video_id,title,publishedAt,channelId,channelTitle,categoryId,trending_date,tags,view_count,likes,dislikes,comment_count,thumbnail_link,comments_disabled,ratings_disabled,description
"Aj56hKEOmhY","HIGHLIGHTS | Leicester 0-2 Man City | MENDY & JESUS","2021-04-03T21:00:02Z","UCkzCjdRMrW2vXLx8mvPVLdQ","Man City","17","21.07.04","MAN CITY|MANCHESTER CITY|LEICESTER V MAN CITY|LEICESTER V MANCHESTER CITY|LEICESTER 0-2 MAN CITY|LEICESTER 0-2 MANCHESTER CITY|MAN CITY WIN|MAN CITY 2-0 LEICESTER|BENJAMIN MENDY|MENDY GOAL|BENJAMIN MENDY GOAL|JESUS|GABRIEL JESUS|JESUS GOAL|KEVIN DE BRUYNE|KEVIN DE BRUYNE ASSIST|KEVIN DE BRUYNE THROUGH BALL|KDB THROUGH BALL|KDB THRU BALL|PREMIER LEAGUE HIGHLIGHTS|EPL HIGHLIGHTS|MAN CITY HIGHLIGHTS|LEICESTER HIGHLIGHTS","1601589","24713","537","963","https://i.ytimg.com/vi/Aj56hKEOmhY/default.jpg","False","False","City moved to within 11 points of a third Premier League title in four years with a flawless 2-0 win over high-flying Leicester.Dominating from start to finish, Pep Guardiola's side are now 17 points clear of second-place Manchester United with goals from Benjamin Mendy and Gabriel Jesus the reward for a commanding display at the King Power Stadium.READ THE MATCH REPORT HERE: https://www.mancity.com/news/mens/leicester-city-0-2-manchester-city-match-report-3-april-2021-63753063Pep speaks to the press ahead of tomorrow's trip to the King Power!SUBSCRIBE! http://www.youtube.com/subscription_center?add_user=mancityhttp://www.mancity.comhttp://www.facebook.com/mancityhttp://www.twitter.com/mancityhttp://www.instagram.com/mancityhttps://www.snapchat.com/add/mancityofficialAbout the Official Man City YouTube Channel:Here you will find all the latest videos from Manchester City, including, all Premier League goals, highlights, behind-the-scenes footage, training and much more.Get closer to the likes of Sergio Aguero, Kevin De Bruyne, Gabriel Jesus, Raheem Sterling, Riyad Mahrez, Benjamin Mendy and the rest of Pep Guardiola's team."
"elYCV2yv3oU","Turns out Tubbo is Cracked at Dodgeball","2021-04-02T19:00:07Z","UC1n_PfsVqxllCcnMPlxBIjw","Wilbur Soot","20","21.07.04","wilbur soot|live|wilbur live|wilbur plays","1010456","87937","393","4149","https://i.ytimg.com/vi/elYCV2yv3oU/default.jpg","False","False","Big thanks to EA for sponsoring this video. To find out more about Knockout City click this link: http://www.inflcr.co/SH6ThFilmed Live on Twitch: https://www.twitch.tv/wilbursootFollow me:https://twitter.com/WilburSoot                    https://www.instagram.com/wilbursoot/Merch: https://bit.ly/WilburSootMerchEdited: https://www.instagram.com/elodie.gif/              https://twitter.com/elodiegifMusic used:Incompetech - Kevin Macleod"
"YI7aBJVtUuE","We're Pregnant!","2021-04-02T17:00:14Z","UCgWfS_47YPVbKx5EK4FLm4A","Jenn Im","26","21.07.04","[none]","1238013","154333","812","15217","https://i.ytimg.com/vi/YI7aBJVtUuE/default.jpg","False","False","Ahhhh, secret's out! Ben and I are ready to start the biggest chapter of our lives. The newest member to our lil fam is arriving this fall.  This whole experience has been huge for us and I just wanted to share a slice of what was going through my mind. ------------------------------------------Subscribe and become a Jem today: http://bit.ly/2iLayjY------------------------------------------➫ Shop my clothing line Eggie: http://eggie.us------------------------------------------➫  Instagram: http://instagram.com/imjennim➫ Twitter: http://twitter.com/imjennim➫ Facebook: http://facebook.com/imjennim➫  Spotify: https://bit.ly/JennImSpotify➫ TikTok: https://bit.ly/2UZB7Zd------------------------------------------❐ MUSIC ❏➥ Epidemic Sound➥ Vansire - Reflection No. 6------------------------------------------FTC: This video is not sponsored! Some of the links above are affiliate links, which means I may earn a small commission if anyone purchases through them. This helps support my channel so I can continue to create videos for ya'll~"
"TNn_sJZBzlE","Freedom 500 Stream Problems/Update Pre Cleetus and Cars","2021-04-03T13:23:02Z","UCMJbbWyIziiUamP5JKK9yAA","Cleetus2 McFarland","22","21.07.04","[none]","334512","25674","202","6935","https://i.ytimg.com/vi/TNn_sJZBzlE/default.jpg","False","False",""
"LK0C-YfeBvE","Guizmow - LE CLASH DES BOSS 2 (Clip Fortnite Officiel)","2021-04-03T08:30:52Z","UCbV-sP7uejgQvSoC3WXsEMg","GUIZMOW !","20","21.07.04","fortnite|guizmow|guizmo|chapitre 2|nouveau|nouveauté|saison 6|film|boss|nouveaux|rap|musique|clip","869084","43178","927","2444","https://i.ytimg.com/vi/LK0C-YfeBvE/default.jpg","False","False","- CLIP : https://www.youtube.com/watch?v=I5k2NTBHbgwYo !! Guizmow - LE CLASH DES BOSS 2 (Clip Fortnite Officiel)- CODE : GUGU #EpicPartnerChaîne Musique : https://www.youtube.com/channel/UCDDb5PMhZMdR6BURmS72QEw- TikTok : https://www.tiktok.com/@guizmowyt- Instagram : https://www.instagram.com/guizmowyt/- Twitter : https://twitter.com/GUIZMOWw"
"RAlI0pbMQiM","Strangers Rank Their Intelligence | IQ vs First Impressions","2021-04-02T16:00:28Z","UCJjSDX-jUChzOEyok9XYRJQ","Jubilee","24","21.07.04","jubilee|jubilee media|jubilee project|middle ground|spectrum|odd man out|versus 1|embrace empathy|live deeper|love language|blind devotion","744880","34999","724","7558","https://i.ytimg.com/vi/RAlI0pbMQiM/default.jpg","False","False","Sign up for a free account and get 20% off Grammarly Premium: https://grammarly.com/jubilee (Sponsored)Follow us on INSTAGRAM: 👉https://www.instagram.com/jubileemedia/ 👈SUBSCRIBE for more! http://bit.ly/SUBSCRIBEjubilee Be in a Jubilee video: http://bit.ly/JubileeCastingSupport Jubilee: http://www.jubileemedia.com/support👉 We started a second channel! Behind the scenes, director commentaries, reaction videos, and more! Check it out & subscribe to Twobilee: https://www.youtube.com/channel/UChaokX58PemxqTI3KjscjPwAre you a loyal Jubilee fan? Join our Facebook group: https://www.facebook.com/groups/407942859721012/Have an idea or a personal story you'd like to share? Submit here: https://airtable.com/shrFDrsc4DzgBV3lV| ABOUT |We believe in the power of empathy for human good. Ultimately, we aim to inspire people to EMBRACE EMPATHY.| SOCIAL |Jubilee Facebook: https://www.facebook.com/jubileemediaJubilee Instagram: https://www.instagram.com/jubileemedia/Jubilee Twitter: https://www.twitter.com/jubileemediaJubilee Website: https://www.jubileemedia.comFor brands interested in partnering with Jubilee, email us:hello@jubileemedia.com#Grammarly"
"IliCvKcvbFc","WARRIORS at RAPTORS | FULL GAME HIGHLIGHTS | April 2, 2021","2021-04-03T01:28:28Z","UCWJ2lWNubArHWmf3FIHbfcQ","NBA","17","21.07.04","Basketball|G League|NBA|Pass|Assist|Dunk|Jump Shot|Steal|Rebound|Offense|Defense|Three|Three-Pointer|Triple|Mid-Range|Jumper|Fadeaway|Highlight|Highlights|Play|Plays|Double-Double|Triple-Double|NBA Season|2020-21 Season|Full Game Highlights|Full Game Recap|warriors vs raptors","512321","5034","242","2149","https://i.ytimg.com/vi/IliCvKcvbFc/default.jpg","False","False","WARRIORS at RAPTORS | FULL GAME HIGHLIGHTS | April 2, 2021The Toronto Raptors defeated the Golden State Warriors, 130-77. Pascal Siakam recorded a season-high 36 PTS, along with 7 REB and 5 AST for the Raptors, while Gary Trent Jr. added 24 PTS and 5 REB in the victory. The Raptors 53-point victory marks their largest margin of victory in franchise history. Andrew Wiggins tallied a team-high 15 PTS for the Warriors in the losing effort. The Raptors improve to 19-30 on the season, while the Warriors fall to 23-26.Next Games:Golden State Warriors at Atlanta Hawks - Apr. 4 at 7:30pm/et on NBA TVWashington Wizards at Toronto Raptors - Apr. 5 at 7pm/et on NBA League PassSubscribe to the NBA: https://on.nba.com/2JX5gSN Full Game Highlights Playlist: https://on.nba.com/2rjGMgeFor news, stories, highlights and more, go to our official website at https://nba_webonly.app.link/nbasiteGet NBA LEAGUE PASS: https://nba.app.link/nbaleaguepass5"
"wkH0H_dMreo","Highlights: Arsenal 0-3 Liverpool | Jota's brace and a Salah special win it at the Emirates","2021-04-03T23:00:28Z","UC9LQwHZoucFT94I2h6JOcjw","Liverpool FC","17","21.07.04","Liverpool FC|LFC|Liverpool|Anfield|Melwood|Liverpool Football Club|premier league","2296965","43553","1107","1879","https://i.ytimg.com/vi/wkH0H_dMreo/default.jpg","False","False","Watch all the key action from the Emirates Stadium, where substitute Diogo Jota scored either side of Mo Salah's individual effort to give Jürgen Klopp's side the points at Arsenal.Enjoy more content and get exclusive perks in our Liverpool FC Members Area, click here to find out more: https://www.youtube.com/LiverpoolFC/joinSubscribe now to Liverpool FC on YouTube now and get notified when new videos land: https://www.youtube.com/subscription_center?add_user=LiverpoolFC#Liverpool #LFC"
"Q8d3hzB9iSQ","Young M.A Successful (Official Music Video)","2021-04-02T16:00:12Z","UCH-T4tFvtcPkbI4sCi237BA","Young MA","22","21.07.04","[none]","1407858","95415","1195","6293","https://i.ytimg.com/vi/Q8d3hzB9iSQ/default.jpg","False","False","Produced by NY Bangers.Video by Diretto Da Rook.Click here to stream Successful at all retailers: https://www.smarturl.it/youngma_successfulText me at (718) 808-6312.Click here for official Young M.A merchandise: https://www.shopyoungma.com/store/​ #YoungMA #Successful #OffTheYak"
"YUcLPuFk9FM","So I Became One of The Fastest Minecraft Speedrunners","2021-04-02T13:00:27Z","UCIabPXjvT5BVTxRDPCBBOOQ","Dani","20","21.07.04","dani|danidev|dani milk|dani minecraft|minecraft speedrun|dani speedrun minecraft|dani game|milkman|I Made Among Us|but it's 3D|I Made a Game Controlled by A Banana|Dream|Couriway|Illumina|EazySpeezy|dani speedrun|Karl Jobst|dani gamedev|minecraft manhunt|uuh cool minecraft tags yeah sick|dani2|daniclips|He said I Couldn't Make a VR Game... So I Bought a VR Headset and Made One!|karlson|dumbo tried speedrunning minecraft","1664174","135936","1337","14844","https://i.ytimg.com/vi/YUcLPuFk9FM/default.jpg","False","False","okay gamers minecraft go vroom zoom brrrr skrt➤ Watch me speedrun on Twitch - https://www.twitch.tv/danimilkman➤ The Full 16m run - https://youtu.be/qz_3ljTtrrM➤  Wishlist my game Karlson - https://store.steampowered.com/app/1228610/KARLSON/➤ Instagram - https://www.instagram.com/danidevmilk/➤ Twitter - https://twitter.com/DaniDevYT➤ Discord - https://discord.gg/P53pFtR➤ Facebook - https://www.facebook.com/danimilkman➤ Music by Evan King, Neo Nomen and MDKTracklist (In the order they appear in the video):Corbyn Kites - Overdrive (https://youtu.be/28S_VTrnR5w)Bobby Cole - Trance Music for Racing Game (https://youtu.be/tJFqdLg58i4)Mozart - 5th SymphonyBobby Richards - Brass OrchidEvan King - Biscuits (https://youtu.be/OMHEdnG_cC8)Evan King - Amiga (https://youtu.be/8IWw9hPM-fg)Slynk - Doctor Momentum (https://youtu.be/xVDT6xrxECs)MDK - Jelly Castle Orchesteral Mix (https://youtu.be/Nlzoy5vVhgQ)Evan King - Metro City (https://youtu.be/YUcLPuFk9FM) Neo Nomen - Silverlights (https://youtu.be/whuc9lLDk_c)Evan KingYoutube:             https://www.youtube.com/user/EvanKingAudioFree Download: https://www.evankingmusic.comMDKYoutube:             http://www.youtube.com/MDKOfficialYTFree Download: http://www.morgandavidking.com/free-downloadsNeo NomenYoutube:             https://www.youtube.com/user/Nickygutt//descriptionokay gamers so i was kinda tired of making games and programming so i took a little break to play and speedrun some minecraft, but who knew minecraft speedrunning was so addicting? so i ended up  playing for 3 months instead of 1 month, and here we are lol. it was a lot of fun though, speedrunning mc is pretty epic. are you proud of me dream?//aboutHey! If you're new here, welcome! I'm an indie game developer, currently working on a physics based game using Unity. This is my devlog / devblog where I show off the progress I make on it. I'll try uploading every week, but I'm pretty busy with university and part time job, so I won't have time every week. But I'll do my best!PC SPECS:GTX 1060i9-9900k32GB RAMLaptop / tabletSurface Pro i5, 8GB RAM, 256GB StorageMy Equipment:Keyboard - Varmilo VA88M rgbMouse - Logitech G305Mic - AT2020+Screen - ViewSonic 24 LED Curved VX2458Headset - Steelseries Arctis 3Check out my other videos:Dani - I Made a Game in 48 Hours!https://youtu.be/gzPGmR6R67YDani - I Made a 3D Game To Prove Him Wrong (Part 2)https://youtu.be/nYIbDAW950sDani - He said I Couldn't Make a 3D Game... So I Made One!https://youtu.be/rb0EhmyQ0aMDani - They Said I Couldn't Make an Online Multiplayer Game... So I Made One!https://youtu.be/TtdBAA3hCxYDani - Programming a Boss Battle For my Gamehttps://youtu.be/nhhSDrA6stwDani - Adding New Weapons to my Game!https://youtu.be/qM7LhN7N7o8Dani - He said I Couldn't Make a VR Game... So I Bought a VR Headset and Made One!https://youtu.be/nR9UfOueJPUDani - I Made Fall Guys in 1 Week... and Tricked Them to Think it's Real!https://youtu.be/vXQpgq1aVoUDani - I Made Among Us, but it's 3Dhttps://youtu.be/K0X5A6aURmsDani - I Made a Game Controlled by A Bananahttps://youtu.be/vq3NyBt__PE#Dani #minecraft #speedrun"
"zFT3f9biz68","BTS (방탄소년단) 'Film out' Official MV","2021-04-01T15:00:09Z","UC3IZKseVpdzPSBaWxBxundA","HYBE LABELS","10","21.07.04","BIGHIT|빅히트|방탄소년단|BTS|BANGTAN|방탄","64056444","6840984","51514","2093990","https://i.ytimg.com/vi/zFT3f9biz68/default.jpg","False","False","BTS (방탄소년단) 'Film out' Official MVSong Credits:Produced by back number, UTA for TinyVoice, Production(Iyori Shimizu from back number, JUNG KOOK)Music Video Credits:Director: Yong Seok Choi (Lumpens)1st AD: Jihye Yoon (Lumpens)2nd AD: Ran Ro (Lumpens)PA: Chanyang Kim, Soeyoung ParkDirector of Photography: EumkoFocus Puller: Sangwoo Yun2nd AC: Youngwoo Lee, Eunil Lee3rd AC: Yuntae KoGaffer: Choi Doo Soo (DS LIGHT)Lighting Crew: Heo Jung Hwan, Jung Yu Jin, Lee Seong Min, Lee Sang Jun, Lee Gun, La haeArt Director: Bona Kim, Jinsil Park (MU:E)Assistant Art team: Yeri Kang, Minjung Kim (MU:E)Art-team Manager: ilho Heo (MU:E)Key Grip: Kiheon ChoiBestboy: Sungeun KimGrip: Hobin Kang , Hyunsuk JoTechno Crane : SeviceVision KoreaTaehyun Choi , Yonggeun Hwang , Jisoo Woo , Hakseo Kim , Jaewon JungJimmy Jib Operator: Youngjung KimJimmy Jib Assistant: Hyunin Kim , Sunghoon Kim , Yunhyun KimVFX: PLASTIC BEACHVFX Supervisor: OHZEONVFX Assistant Supervisor: JOJEEMVFX Project Manager: Song Chanyoung, Jeong JieunVFX Producer: Jang Kyutae, Ahn Sohyun3D Artist: Lee Kwangwon, Kim Doyeon, Lee Jeonghwa, Jeon Jiwon2D Artist: Jang Gihoon, Lee Hyunjun, Shin HyeunsungFX Artist: We JungInVisual Creative: Nu Kim, Lee Sun Kyoung, Kang Ju Eun, Kim Ga Eun, Kim Hyo Won, Cha Yeon HwaArtist Management: Kim Shin Gyu, Jang Jin Gu, Kim Su Bin, An Da Sol, Park Jun Tae, Yun Taewoong, Lee Seung Byung, Lee Jung Min, Lee Hyeon KiBIGHIT MUSIC. Rights are reserved selectively in the video. Unauthorized reproduction is a violation of applicable laws. Manufactured by BIGHIT MUSIC, Seoul, Korea.Connect with BTS: https://ibighit.com/bts​ https://bts-official.jphttp://twitter.com/BTS_bighit​http://twitter.com/BTS_twt​ http://twitter.com/BTS_jp_officialhttp://www.facebook.com/bangtan.official​ https://www.youtube.com/user/BANGTANTV​ http://instagram.com/BTS.bighitofficial​ https://channels.vlive.tv/FE619​ https://www.tiktok.com/@bts_official_bighithttps://weverse.onelink.me/qt3S/94808190​https://www.weibo.com/BTSbighit​https://www.weibo.com/BTSmembers​ http://i.youku.com/btsofficial​ http://btsblog.ibighit.com​https://bts-officialshop.jp/#BTS​​ #방탄소년단​​ #Filmout​ #BTSTHEBEST​"
"UzNWRUdPo9M","Chelsea 2-5 West Brom | Premier League Highlights","2021-04-03T21:00:05Z","UCU2PacFf99vhb3hNiYDmxww","Chelsea Football Club","17","21.07.04","Chelsea F.C. (Football Team)|Chelsea TV (TV Network)|Football (Interest)|Sports (TV Genre) blues stamford bridge|luiz|willian|Premier League|soccer|London|football fan|skills|goal|training|chelsea highlights|nike|kante|lampard|pulisic|hudson-odoi|abraham|chelsea fc|chelsea|hakim ziyech|ziyech|werner|timo werner|Kai havertz|havertz|chilwell|ben chilwell|chelsea news|Thomas Tuchel|Tuchel|Chelsea 2-5 West Brom|chelsea v west brom|Premier League Highlights","1496008","16802","1715","1881","https://i.ytimg.com/vi/UzNWRUdPo9M/default.jpg","False","False","Watch highlights from Chelsea's home game against West Brom.Download Chelsea FC's official mobile app:-App Store https://apple.co/2vvlN9t-Play Store http://bit.ly/2MfNJHX Subscribe: http://che.lc/YTsubscribeTo watch more EXCLUSIVE Chelsea content go to: http://che.lc/YTwebsiteWelcome to the official home of Chelsea Football Club on YouTube. It’s the only channel where you’ll get an authentic look at life at this great club. Every week we’ll be uploading fresh content from the training ground, our famous stadium and much, much more. Nowhere else will you get closer to world-class stars like Christian Pulisic, Kai Havertz, Hakim Ziyech, Timo Werner, N’Golo Kanté, Sam Kerr, Fran Kirby & Pernille Harder.ABOUT CHELSEA FOOTBALL CLUBFounded in 1905, Chelsea Football Club has a rich history, with its many successes including 5 Premier League titles, 8 FA Cups and 1 Champions League, secured on a memorable night in 2012. Famous former Blues include Peter Osgood, Gianfranco Zola, Frank Lampard, John Terry, Didier Drogba & Eden Hazard."
"H6TYPZ734Jw","ranboo REACTS to sadist animation Hog Hunt | Dream SMP Animation","2021-04-03T01:07:45Z","UCEibqgKRgUg_iVIq2w6bGgg","Ro0oney","20","21.07.04","[none]","385132","19321","390","939","https://i.ytimg.com/vi/H6TYPZ734Jw/default.jpg","False","False","ranboo REACTS to sadist animation Hog Hunt | Dream SMP Animation , this is insanely good , go support sadist on patreon :https://www.patreon.com/SADistfiedranboo:https://www.twitch.tv/ranboolivehttps://www.youtube.com/c/RanbooMusic: Marvin Brooks - Ghost (2WEI Remix) Stream here: https://artist.positionmusic.com/Ghost-2WEIRemix-MarvinBrooksReleased by @Position Music​  /2WEI Music This is under ranboos permission."
"uSm2VDgRIUs","Why I got Fired","2021-04-01T16:17:00Z","UCWiXzvPDb5YqG7W0mr2TmlA","Dylan Lemay","22","21.07.04","[none]","5011078","194915","4343","24704","https://i.ytimg.com/vi/uSm2VDgRIUs/default.jpg","False","False","Thank you for 70k"
"pBdKnPcNyl8","Food Theory: Grubhub Lore Exists and It's WEIRDER Than You Thought!","2021-04-01T18:05:18Z","UCHYoe8kQ-7Gn9ASOlmI0k6Q","The Food Theorists","26","21.07.04","grubhub|jimmy neutron|grubhub meme|grubhub commercial|grubhub jimmy neutron|grubhub commercial meme|the grubhub commercial|grubhub dance|grubhub ad but|grubhub song|grubhub lore|jimmy neutron theory|nickelodeon|nickelodeon theory|food theorists|food theory|matpat|game theorists|film theorists|game theory|film theory|eat the menu|binging with babish|grubhub ad","4422326","197181","5852","22491","https://i.ytimg.com/vi/pBdKnPcNyl8/default.jpg","False","False","SUBSCRIBE to NEVER Miss a Food Theory! ►► https://bit.ly/2CdCooV  By now you have likely seen the meme of the hour, the Grubhub dancing commercial. Well, it got me thinking - or rather the familiar looks of the characters got me thinking. Theorists, I think Grubhub may have.. borrowed it's new dancing mascots. Get ready to open up a fresh delivery of Grubhub lore and find out how deep this theory goes!SUBSCRIBE for Every Theory! ►► https://bit.ly/2CdCooV  Want More FOOD THEORY?You've Been SCAMMED! (Supermarket Secrets) ► https://youtu.be/EqviBPG2uPETootsie Pops, How Many Licks? ► https://youtu.be/qOS5NAdyWDwNever Order McDonald's Medium Fries! ► https://youtu.be/c_jnZkVlNtwKool Aid Man Is A Marvel Villain! ► https://youtu.be/CuZ14w_g3WA    Don't Trust Your Cake! ► https://youtu.be/dulS3GGiJ7M  Join our other Theorist Communities!Game Theory! ► http://bit.ly/1qV8fd6 Film Theory! ► http://bit.ly/1dI8VBH Need Royalty Free Music for your Content? Try Epidemic Sound. Get A 30 Day Free Trial! ► http://share.epidemicsound.com/theFoodTheorists Credits:Writers: Matthew Patrick and Luke BaratsEditors: Danial BanditRants Keristoufi, Koen Verhagen, Forrest Lee, and Pedro FreitasAssistant Editor: AlyssaBeCrazy  Sound Editor: Yosi Berman #Grubhub #GrubhubCommercial #GrubhubAd #JimmyNeutron #Grubhubmeme #GrubhubDance #FoodTheory #Food #Recipe #Matpat #GameTheory #FilmTheory"
"2gtv-vFFp9I","Can Anyone Beat Kendall? | Season 20 | Keeping Up With The Kardashians","2021-04-02T12:00:03Z","UCn3jIZe_5xsAgo5FlvyYCXw","hayu","24","21.07.04","hayu|keeping up with the kardashians|real housewives|reality tv|kim kardashian|khloe kardashian|kourtney kardashian|e!|bravo|boobs|kuwtk|botched|beverly hills|kendall jenner|kris jenner|kanye west|kylie jenner|bruce jenner|life of kylie|revenge body|scott disick funny moments|hayu kardashian|kuwtk season 19|boob job|kendall jenner workout|kendall jenner best moments|kourtney kardashian poosh|kourtney kardashian funny moments","1034838","27174","326","747","https://i.ytimg.com/vi/2gtv-vFFp9I/default.jpg","False","False","It's a tie between the Kardashians and the Jenners, can anyone beat Kenny?#KUWTK #KendallJenner #KourtneyKardashian #hayuSubscribe to the Official Hayu Channel https://www.youtube.com/c/hayuHayu is the place to watch your favourite reality shows whenever and wherever you want. With loads of shows the same day as the U.S. and thousands of episodes of binge-worthy Box Sets from the start, hayu is the undoubted home of reality TV. And if all that wasn't enough, we've got exclusive clips and snippets you can share and your fave stars' social media all in one place.With hayu, you can literally have it all."
"Ori0N7Z_23U","Bouncing Bombs #shorts","2021-03-31T14:00:17Z","UC4pNDofN0Xh-z2bhh62g8Ow","Not What You Think","27","21.07.04","not what you think|germany|british|Royal Air Force|bouncing bombs|Operation Chastise|WWII|bombing|dam","5781515","191886","3591","1299","https://i.ytimg.com/vi/Ori0N7Z_23U/default.jpg","False","False","These bombs were quite creative, and were made to attack special targets, and it's #NotWhatYouThink #shorts. The inventor of the bouncing bomb was a British engineer named Barnes Wallis, whose Upkeep bouncing bomb was used in Royal Air Force's Operation Chastise in May 1943 to bounce into German dams and explode under water.Music:Inverted - Hampus NaeseliusFootage:National Archive Catalog"
"2XP6ciRmHg8","WE’RE MOVING TO HAWAII! | EMPTY HOUSE TOUR","2021-04-02T18:54:14Z","UCkoZyNqTZyBZ8nu8E_OSkWw","Lauren & Arie","24","21.07.04","Arie and Lauren|Lauren and Arie|The Bachelor|Twin Pregnancy|Laurie|Lauren Burnham|Lauren Luyendyk|Alessi Luyendyk|Arie Luyendyk|The Bachelorette|Pregnant|Bachelor Baby|Bachelor Twins","634515","9651","235","823","https://i.ytimg.com/vi/2XP6ciRmHg8/default.jpg","False","False","Welcome to our new home!!!!Excited to share with you that we bought a second home in Hawaii 😎🌴 Take a look and comment below on any decorating ideas 💡 If you haven't seen these videos, check them out... Finding out we're having twins! https://www.youtube.com/watch?v=Mr5Ym...Pregnancy announcement: https://youtu.be/2Up7Jbtg37A Twin Pregnancy Q&A: https://www.youtube.com/watch?v=BjUZA...Subscribe to follow along on our pregnancy journey!Follow us on Instagram too!https://www.instagram.com/laurenluyendykhttps://www.instagram.com/ariejrhttps://www.instagram.com/alessiluyendykAs always, we love and appreciate every one of you!-Lauren and Arie Luyendyk"
"1S3Ca9v6pyo","How 1 Boat Just Caused a $400 Million an Hour Traffic Jam","2021-04-02T15:02:02Z","UCP5tjEmvPItGyLhmjdwP7Ww","RealLifeLore","27","21.07.04","real life lore|real life lore maps|real life lore geography|real life maps|world map|world map is wrong|world map with countries|world map real size|map of the world|world geography|geography|geography (field of study)|facts you didn’t know|suez|Suez canal|Suez Canal 2021|2021|Suez Canal crisis|ever given|Suez Canal meme|Suez Canal boat|Suez Canal blocked|Suez Canal block","1646878","58388","1536","5898","https://i.ytimg.com/vi/1S3Ca9v6pyo/default.jpg","False","False","Get a free trial of Skillshare Premium by being one of the first 1,000 to use this link: https://skl.sh/reallifelore04211Please Subscribe: http://bit.ly/2dB7VTO​​Select video clips courtesy of Getty Images"
"A0s1vrnU6qE","COVID-19: Ontario Premier Doug Ford announces 28-day province-wide ‘shutdown’ – April 1, 2021","2021-04-01T18:48:43Z","UCFZSV_So_OaXgXVzgu58tJQ","cpac","25","21.07.04","[none]","152449","436","1726","0","https://i.ytimg.com/vi/A0s1vrnU6qE/default.jpg","True","False","In a news conference at Queen’s Park, Ontario Premier Doug Ford and Health Minister Christine Elliott provide an update on their government’s response to the ongoing COVID-19 (coronavirus disease) pandemic. They are joined by Dr. David Williams, Ontario’s chief medical officer of health, and Adalsteinn Brown, co-chair of the Ontario COVID-19 Science Advisory Table. The premier announces a month-long shutdown for the entire province starting April 3. The new public-health restrictions mean the closing of some non-essential services including gyms, as well as indoor and outdoor dining at restaurants. Essential businesses will remain open at 50 per cent capacity while non-essential retail stores will be allowed to operate at 25 per cent capacity. Indoor gatherings will be prohibited and outdoor gatherings limited to five people. The measures come following a sharp increase in new COVID-19 cases and hospitalizations in the province."
