video_id,title,publishedAt,channelId,channelTitle,categoryId,trending_date,tags,view_count,likes,dislikes,comment_count,thumbnail_link,comments_disabled,ratings_disabled,description
"ODY6JWzS8WU","Starship | SN10 | High-Altitude Flight Test","2021-03-03T23:25:12Z","UCtI0Hodo5o5dUb67FeUjDeA","SpaceX","28","21.04.03","SpaceX|Space|Elon Musk|Musk|Starship|SN8|Test Flight|Suborbital|12.5km|15km|Boca Chica|Mars|Cameron County","4280084","194656","1593","21110","https://i.ytimg.com/vi/ODY6JWzS8WU/default.jpg","False","False","As early as Wednesday, March 3, the SpaceX team will attempt a high-altitude flight test of Starship serial number 10 (SN10) – our third high-altitude suborbital flight test of a Starship prototype from SpaceX’s site in Cameron County, Texas. Similar to the high-altitude flight tests of Starship SN8 and SN9, SN10 will be powered through ascent by three Raptor engines, each shutting down in sequence prior to the vehicle reaching apogee – approximately 10 km in altitude. SN10 will perform a propellant transition to the internal header tanks, which hold landing propellant, before reorienting itself for reentry and a controlled aerodynamic descent.  The Starship prototype will descend under active aerodynamic control, accomplished by independent movement of two forward and two aft flaps on the vehicle. All four flaps are actuated by an onboard flight computer to control Starship’s attitude during flight and enable precise landing at the intended location. SN10’s Raptor engines will then reignite as the vehicle attempts a landing flip maneuver immediately before touching down on the landing pad adjacent to the launch mount. A controlled aerodynamic descent with body flaps and vertical landing capability, combined with in-space refilling, are critical to landing Starship at destinations across the solar system where prepared surfaces or runways do not exist, and returning to Earth. This capability will enable a fully reusable transportation system designed to carry both crew and cargo on long-duration, interplanetary flights and help humanity return to the Moon, and travel to Mars and beyond.  Given the dynamic schedule of development testing, stay tuned to our social media channels for updates as we move toward SpaceX’s third high-altitude flight test of Starship!"
"g5TxSM16S6Q","first game with MY SKIN","2021-03-03T12:22:32Z","UCw1SQ6QRRtfAhrN_cjkrOgA","LazarBeam","20","21.04.03","gaming|fortnite","5145054","314287","3068","30408","https://i.ytimg.com/vi/g5TxSM16S6Q/default.jpg","False","False","LazarBeam X Fortnite MARCH 4TH - CODE LAZAR 👕LAZAR Merch - https://shoplazar.com/🐤TWITTER - https://twitter.com/lazarbeam📘 FACEBOOK - https://www.facebook.com/LazarBeamLannan/📷INSTAGRAM - https://instagram.com/lazarbeamytWant my headset!? I wear the ASTRO.ID A40To get 5% off your Astro headphones go to: https://astro.family/lazarbeam"
"siBt5ithlQ8","🤯 Comeback worthy of a final! | HIGHLIGHTS | Barça 3-0 Sevilla","2021-03-03T23:19:24Z","UC14UlmYlSNiQCBe9Eookf_A","FC Barcelona","17","21.04.03","FC Barcelona|برشلونة،|Fútbol|FUTBOL|soccer|FUTEBOL|Sepakbola|サッカー|كرة القدم|football|FCB|Barça|Sport|Club|Barcelona|CAMP NOU|ter stegen|pique|busquets|messi|goat|leo messi|dembele|lenglet|griezmann|antoine griezmann|yt:cc=on|koeman|trincao|pedri|comeback|ilaix|moriba|sevilla|final|copa|rey|last|minute|remuntada|remontada|lesión|braithwaite|header|cabezazo|penalti|penalty|90|3-0|semifinal|Copa del Rey|2021|Cartuja","2783159","137292","1729","7284","https://i.ytimg.com/vi/siBt5ithlQ8/default.jpg","False","False","Piqué’s last second goal sends the game into extra time and Braithwaite’s header earns a place in the Copa del Rey Final!SUBSCRIBE NOW:▶ https://www.youtube.com/user/fcbarcelona ⚽ BARÇATV+: http://barca.link/wT1w30qMyQO🌐 Site: http://www.fcbarcelona.com📱 App: https://go.onelink.me/xndC/DownloadAppYouTube🔵 Facebook: http://www.facebook.com/fcbarcelona📸 Instagram: http://www.instagram.com/fcbarcelona🐦 Twitter: http://twitter.com/FCBarcelona🎶 Tiktok: https://www.tiktok.com/@fcbarcelona 📱 Viber: http://chats.viber.com/fcbarcelona🛍 Get all official Barça apparel from FC Barcelona's online store: http://barca.link/j8QH30qQh4Y 🔵🔴 #FCBarcelona"
"aaVb3YeNQA0","Oprah With Meghan And Harry First Look | There's A Lot That's Been Lost","2021-03-04T01:44:21Z","UClzCn8DxRSCuMFv_WfzkcrQ","CBS","24","21.04.03","oprah|royal|royal family","497077","1728","835","1648","https://i.ytimg.com/vi/aaVb3YeNQA0/default.jpg","False","False","Oprah asks Meghan, The Duchess of Sussex, how she feels about the palace hearing her speak her truth on the special. Watch Oprah with Meghan and Harry: A Primetime Special on Sunday, Mar. 7 at 8/7c on CBS."
"lh4EtApsiyQ","GOLDBRIDGE! Crystal Palace 0-0 Manchester United Match Reaction","2021-03-03T23:02:17Z","UCMmVPVb0BwSIOWVeDwlPocQ","The United Stand","24","21.04.03","Manchester United|Man United|Man Utd|Manchester United TV|The United Stand|United Stand|Manchester United News|MUFC|Man Utd News|United|Manchester United Transfer News|Man Utd Transfer News|Transfer|Solskjaer|Solskjaer news|MU live streaming|mu live|Man Utd live stream|live|vs Manchester United|Mark Goldbridge|Goldbridge|Crystal Palace|Crystal Palace vs Manchester United|Crystal Palace Manchester United|Crystal Palace vs Man Utd","237513","8145","372","948","https://i.ytimg.com/vi/lh4EtApsiyQ/default.jpg","False","False","Crystal Palace 0-0 Manchester United Mark Goldbridge reacts to a big result for Solskjaer's United. Get the latest Man Utd News on The United Stand. Player Ratings Vote Here https://www.theunitedstand.com/articles/match-ratings/fan-player-ratings-crystal-palace-vs-manchester-united-premier-leagueLIVE FAN REACTION SHOW: https://www.youtube.com/watch?v=-b9LjWJcy3k&feature=youtu.be&ab_channel=TheUnitedStand🚨VISIT OUR WEBSITE 🚨For all the latest United news and TUS content:https://www.theunitedstand.com⏲️The United Stand Content TIMELINE is the best way to find all our latest content quickly! https://www.theunitedstand.com/timeline📰 LATEST WRITTEN NEWS https://www.theunitedstand.com/articles/latest-news📸 FOLLOW OUR INSTAGRAMhttps://www.instagram.com/theunitedstandtv/✅ The United Stand MEMBERSHIP https://buff.ly/2I2Of9R📧Contact The United Stand = soccerboxtv@gmail.com📧WRITER SUBMISSIONS = unitedstandwebsite@gmail.comAddressing: Jamie or NoraSee the FULL United Stand Kit Range CLICK HERE https://buff.ly/2Krpw1zEXCLUSIVE NEW PODCAST ITUNES https://buff.ly/2ZUhv84Spotify https://buff.ly/34dwEo6Google Podcast https://buff.ly/2ZHlNDnCastBox https://buff.ly/2UuiU3RRadio Public https://buff.ly/34jWkzAThe United Stand is Manchester United's biggest independent fan channel. Made for Manchester United fans by Manchester United fans, the United Stand provides you with the latest Manchester United transfer news, highlights, goal reviews and much more. So if MUFC means the world to you, get involved and subscribe to The United Stand http://bit.ly/1CmczHm#Goldbridge #ManchesterUnited #MUFC"
"beJZyxM2cwQ","REACTION | Steven Gerrard | Livingston 0-1 Rangers","2021-03-03T20:35:31Z","UCVaGyBPoEAZItDjlFPsRcSA","Rangers Football Club (Official)","17","21.04.03","Rangers|Rangers FC|Rangers Football Club|RangersTV","95472","0","0","339","https://i.ytimg.com/vi/beJZyxM2cwQ/default.jpg","False","True","Manager Steven Gerrard speaks to RangersTV after another win on the road for his Rangers team.CLICK to subscribe for FREE and never miss another video: http://rng.rs/1KpxkIWSubscribe to RangersTV to receive even more official content and exclusive interviews: http://www.rangerstv.tv/pricing.phphttp://www.rangers.co.ukhttp://www.facebook.com/rangersfchttp://www.twitter.com/RangersFChttp://www.twitter.com/RangersTV"
"sfl2f9mMOn4","Livingston 0-1 Rangers | Late Morelos Goal Secures Huge Win for Gers! | Scottish Premiership","2021-03-04T00:00:22Z","UCakRszbIjjGYtFrDPeg5Ieg","SPFL","17","21.04.03","SPFL|SPFL Highlights|Scottish Premiership|Livingston 0-1 Rangers|rangers win|rangers highlights|rangers hls|rangers|Scottish Premiership highlights|Scottish football highlights|Livi|rangers steven gerrard|red card rangers|scottish football goals|David Martindale)(|The Gers|Jermain Defoe|James Tavernier|Alan Lithgow|Marvin Bartley|Steven Lawless|Ianis Hagi|red card|steven gerrard red card|The Blues|Callachan goal|Melamed goal|Steven gerrard","108141","1474","21","448","https://i.ytimg.com/vi/sfl2f9mMOn4/default.jpg","False","False","Alfredo Morelos scored late in the second half to move Rangers within 4 points of securing the Scottish Premiership title!Subscribe to the SPFL YouTube here!: http://goo.gl/jq3jXNLike us on Facebook: http://www.facebook.com/spflofficialFollow us on Twitter: https://twitter.com/spfl & https://twitter.com/spflnewsSCOTTISH PREMIERSHIP CONTENT AVAILABILITY INFORMATION - GOALS FROM SATURDAY'S MATCHES WILL BE AVAILABLE IN THE UK & IRELAND FROM 6PM ON SUNDAY. GOALS FROM ALL OTHER MATCHDAYS WILL BE AVAILABLE TO VIEW WORLDWIDE FROM MIDNIGHT AFTER THE MATCH.The SPFL is the leading sporting competition in Scotland, covering the top 42 football teams in the country. Subscribe to the official SPFL YouTube channel to make sure you catch all the best bits from Scottish league football. Scottish football is famous for passionate and exciting matches featuring top teams like Celtic, Rangers, Aberdeen, Hearts, Hibs and Dundee United.The top league is called the Scottish Premiership. Below the top level, there are a further three leagues -- the Scottish Championship, Scottish League 1 and Scottish League 2."
"-_oiMkBwoKU","SARAN WRAP PRANK ON DAD GONE WRONG! #shorts","2021-03-02T21:55:04Z","UCeykVZIuLbvlaD3PdTlOHLw","Coltyy","22","21.04.03","[none]","343961","19695","648","348","https://i.ytimg.com/vi/-_oiMkBwoKU/default.jpg","False","False","safe to say he was not happy with this one! #shortsinsta: @colty_"
"MS18aoIDK0s","Highlights | West Indies vs Sri Lanka | 6 Sixes in an Over & a Hat Trick! | 1st CG Insurance T20I","2021-03-04T03:08:09Z","UC2MHTOXktfTK26aDKyQs3cQ","Windies Cricket","17","21.04.03","cricket|cricket west indies|west indies|windies|west indies cricket team|cricket highlights|cricket highlights match today|West Indies v Sri Lanka|West Indies v Sri Lanka T20|Windies v Sri Lanka|West Indies v Sri Lanka Highlights|1st T20 Highlights|Kieron Pollard|Pollard 6 sixes|Pollard six sixes|Pollard 6 6's|6 Sixes|Akila Dananjaya|Akila Dananjaya hat trick|Danajaya hat trick|hat trick|Chris Gayle|Yuvraj sixes|Gibbs sixes","3564562","104259","2177","3729","https://i.ytimg.com/vi/MS18aoIDK0s/default.jpg","False","False","Highlights of West Indies vs Sri Lanka in the first of the CG Insurance T20I's.This is the official channel for the West Indies cricket team, providing all the latest highlights, interviews and features to keep you up to date with all things Windies. Subscribe to the channel here!https://www.youtube.com/channel/UC2MHTOXktfTK26aDKyQs3cQ?view_as=subscriberFind out more about the Windies at:http://Windiescricket.com"
"ydmXQgdvVg8","THE TRUTH BEHIND ME AND BEHZINGA...","2021-03-03T19:00:25Z","UCY9u0a8TtuZOMFpCAxlQ31A","Elz the Witch","20","21.04.03","elzthewitch|elz the witch|reddit|behzinga|youniverse|ad","316530","17742","211","891","https://i.ytimg.com/vi/ydmXQgdvVg8/default.jpg","False","False","Back with another Reddit video finally! Thanks to Dell UK for sponsoring, the link to the XPS I'm using is here: http://bit.ly/ElzDellFollow my Reddit: https://www.reddit.com/r/elzthewitch_/Other Links:Instagram - https://www.instagram.com/elzthewitch/?hl=enTwitter - https://twitter.com/elzthewitchAmazon Wishlist - https://www.amazon.co.uk/hz/wishlist/ls/2KWGXBVWWSCK8?ref_=wl_sharePaypal - paypal.me/elzthewitch"
"cQxikOjJeFE","SpaceX Starship Rocket Explodes After Landing","2021-03-04T02:55:33Z","UCrM7B7SL_g1edFOnmj-SDKg","Bloomberg Technology","25","21.04.03","Bloomberg","215208","693","4418","370","https://i.ytimg.com/vi/cQxikOjJeFE/default.jpg","False","False","Mar.03 -- Space Exploration Technologies Corp.’s newest and biggest rocket pulled off its first successful landing, then exploded a brief time later and was engulfed by fire. The rocket flew to an altitude of about 10 kilometers (around 6 miles) before turning its engines back on and settling on the landing pad with a slight lean. It then exploded."
"-0pEMNPpDc4","is that a shark ??? #shorts #datrie","2021-03-03T00:37:46Z","UC4L2MRS63rPtjIJr99DBLUQ","Datrie","1","21.04.03","Datrie|Tiktok|Datrie tiktok|Datrie shark|Datrie voiceover","228782","14098","312","868","https://i.ytimg.com/vi/-0pEMNPpDc4/default.jpg","False","False","hey yo yallllIM GETTING A UKULELE TOMORROW!!!Might just film a cover :))))Luv u #shorts"
"y3_tFgT8Y6o","Meghan Markle Says Firm 'Perpetuated Falsehoods' About Her & Prince Harry In Oprah Intv","2021-03-04T05:20:22Z","UCiKGMZZmZXK-RpbKJGXgH3Q","Access","24","21.04.03","Access|meghan markle|prince harry|oprah|interview|royal|royal family|palace|cbs|meghan|sussex","72230","1242","219","1185","https://i.ytimg.com/vi/y3_tFgT8Y6o/default.jpg","False","False","Meghan Markle is speaking out in the new promo from her and Prince Harry's Oprah Winfrey interview. In the latest teaser for Sunday night's 90-minute special, the Duchess of Sussex did not hold back when discussing the importance of speaking her truth. When asked by Oprah how she felt about “the palace hearing [her speak her] truth,” she replied, “I don't know how they could expect that after all of this time we would still just be silent if there is an active role that the firm is playing in perpetuating falsehoods about us. And, if that comes with risk of losing things? I mean, there's a lot that's been lost already.” “Oprah with Meghan and Harry: A Primetime Special” airs on March 7 at 8/7c on CBS.» SUBSCRIBE: http://bit.ly/AHSub​​» Visit Our Website: http://www.AccessOnline.com/​​Get More Access:Facebook: https://www.facebook.com/accessonline​​Twitter: https://twitter.com/accessonline​​ Instagram: http://instagram.com/accessonline​​Snapchat: OfficialAccess About Access:Access is a nationally syndicated daily entertainment news show. Access delivers the most comprehensive coverage of entertainment news and personalities on television, featuring in-depth celebrity interviews and behind-the-scenes accounts of the most important events in Hollywood.Meghan Markle Says 'A Lot' Has Been 'Lost' In Oprah Promohttps://www.youtube.com/accessonline​​#AccessHollywood​​#MeghanMarkle#PrinceHarry#Royals"
"fFwpFtBvsyQ","Fortnite Item Shop *NEW* SHANTY FOR A SQUAD EMOTE! [March 3rd, 2021] (Fortnite Battle Royale)","2021-03-04T00:04:54Z","UCIZP6nCTyU9VV0zIhY7q1Aw","I Talk","20","21.04.03","fortnite|fortnite battle royale|fortnite commentary|italkfortnite|fortnite item shop|fortnite new|fortnite funny|itf|fortnite chapter 2|season 5|fortnite season 5|item shop|fortnite item shop today|item shop right now|fortnite update|fortnite item shop live","331487","13675","210","1806","https://i.ytimg.com/vi/fFwpFtBvsyQ/default.jpg","False","False","Fortnite Item Shop right now on March 3rd, 2021.Let's see what's in the Item Shop today!If you would like to support me with Support A Creator, be sure to use code ITF. You can use that code in the Fortnite Item Shop and the Epic Games Store! Thank you for all the support, it really means a lot to me! #EpicPartnerI Talk is a Fortnite YouTube channel, talking about all things Fortnite Battle Royale! We discuss everything from leaks, patch notes, updates, thoughts and opinions, and any other topics that are relevant! I also do daily Item Shop videos everyday, so if you want to see something that's currently in the Item Shop, you can see that I upload every single day for the Item Shop.---Get Connected---Subscribe to my YouTube Channel: https://www.youtube.com/channel/UCIZP6nCTyU9VV0zIhY7q1Aw?sub_confirmation=1Follow me on Twitter: https://twitter.com/ThisIsITalkFollow me on TikTok: https://www.tiktok.com/@imitalkThumbnails made by CrazyShark, check him out here: https://t.co/vKVkQVmqn8"
"tMr5cap9FEg","Letting The Person in FRONT of me DECIDE What I EAT for 24 HOURS *awkward*","2021-03-03T18:05:35Z","UChmPDnOUiWx4FrfiljzR_WA","Millie T","24","21.04.03","millie t|weight loss|filler|i tried|the social climbers|leeting person infant of me decide|uber driver decides|decides my food for 24 hours|food for 24 hours|24 hour challenge|challenge|gone wrong|starbucks|mcdonalds|burger king|millie t food|10k calorie challenge|vegan fast food|I tried|trying|I tried vegan food|awkward|touchdalight|millie t and touchdalight|I spent|for a week|how to lose weight|I only ate|I only ate for 24 hours|fast food","131414","8701","159","259","https://i.ytimg.com/vi/tMr5cap9FEg/default.jpg","False","False","This is probably the messiest/most awkward video you will watch... I let the person in front of me decide my fast food for 24 hours and it didn't go to plan..STREAM MY NEW SONG ON SPOTIFY- https://spoti.fi/34QUTsZSubscribe: https://bit.ly/2IZ7MWV**MY FAVE VIDEOS THAT U SHOULD WATCH!!**I Got My Nails Done By Cardi B's Nail Tech...*HOW MUCH?!*https://www.youtube.com/watch?v=Q8-WM2e6s94I Wore EXTREMELY Long Acrylic Nails For 24 Hours! *HOSPITAL*https://www.youtube.com/watch?v=H62z5RktI9MThe TRUTH About My Weight Loss Transformation | My Fitness Journey *emotional*https://bit.ly/2WyFw4Rasking guys questions girls are too afraid to ask...https://bit.ly/3drasKWI Got Lip Filler Done By Kylie Jenners ACTUAL Surgeon...https://www.youtube.com/watch?v=knGMTeVZCfIThe ULTIMATE Glow Up Transformation Video *i got LOTS of filler*https://www.youtube.com/watch?v=Y0l6ny8K52YFollow meee:Instagram: https://instagram.com/milliet25/Twitter: https://twitter.com/milliet25SnapChat: https://snapchat.com/add/milliet24Tik Tok: https://www.tiktok.com/@milliet24"
"HdOAjKiHQHw","TommyInnit Talks YouTube Money 🤑","2021-03-03T18:15:01Z","UCrboPj-9ZOZvr3IVyyhXz6Q","Happy Hour Podcast","23","21.04.03","happy hour podcast|jaackmaate|jackmate|jaackmate|happy hour|happy hour tommyinnit|tommyinnit podcast|tommyinnit vlog|tommyinnit money|how much does tommyinnit earn|tommyinnit revenue|tommyinnit rich|how much money does tommyinnit make|tommyinnit net worth|tommyinnit 2021 net worth","374318","30569","123","1648","https://i.ytimg.com/vi/HdOAjKiHQHw/default.jpg","False","False","There's no doubt that TommyInnit is one of - if not THE - biggest earner in the YouTuber gaming world right now... but has the fame and money changed him or has he stayed humble? What has he bought with his new found riches or is he not bothered about the money?____________________________________________________________________🎧 Full episode available to listen & download now:https://tinyurl.com/53d676cj____________________________________________________________________🐦 TWITTER: https://twitter.com/JaacksHappyHour📸 INSTAGRAM: http://www.instagram.com/jaackshappyhour🎬 JAACKMAATE'S CHANNEL: https://www.youtube.com/jaackmaate"
"yhoGtNiNX40","Lil Baby - Real As It Gets (Official Video) ft. EST Gee","2021-03-04T05:00:10Z","UCM1gEqLPsgej7ZKzu9w8v7A","LilBabyVEVO","10","21.04.03","lil baby|est gee|real as it gets|on me|errbody|music|fortnite|rap|dababy|polo g|lil durk|baby|tiktok mashup|nba youngboy|king von|nle choppa|young thug|hip hop|drill|best friend|lamborghini|gunna|music video|lil baby type beat|meek mill|lyrical lemonade|kevin gates|rod wave|gucci mane","756013","87941","372","6739","https://i.ytimg.com/vi/yhoGtNiNX40/default.jpg","False","False","Watch the music video for Lil Baby Feat. EST Gee Real As It Gets.Stream/Download Lil Baby Feat. EST Gee - Real As It Gets here: https://QualityControl.lnk.to/RealAsItGetsFollow Lil Baby Everywhere:Instagram: https://www.instagram.com/lilbaby_1/​TikTok: https://www.tiktok.com/@lilbaby​ Twitter: https://twitter.com/lilbaby4PFLil Baby Feat. EST Gee Real As It Gets Lyrics[Hook]I been savin’ my guawla I ain’t savin’ no bitch I had put down my glock but I picked up a stick  Don’t get in hating shit  I’m on some greatest shit  My people proud I’m as real as it gets Gone have to chase me I don’t like to wait and I swear I’m impatient I don’t like to sit I made a way for you little bitty niggas  I wish you would play with me  boy you a bitch  [Lil Baby Verse]Still got exotic I’ll told him to mail it I don’t gotta touch somebody gone sell it Bro gone keep it solid I know you won’t tell it Grew up in the streets I ain’t never saw belly  I didn’t have shit I ain’t never get jealous born in this shit I grew up with some felons reach for this water we’ll go at your melon My lil bro a slime  he’ll draw on a reverend  I don’t really have to talk about steppin’ Cause my niggas never get caught when it happen Own sip no syrup in the morning I’m snapping  You can take this as your warning I’m packing FN inside of my hand when I back in  Get to actin’ I promise we clapping Jokes up it gotta be stamped  on the package  It’s the real one you know that I’m taxing Get the ball imma score or I’m passing got no love for no hoe I ain’t passionate I don ran up a dub on an accident to the streets im the voice I’m an advocate  ask the plug this the most he done ever sent Niggas broke what’s the most you done ever spent? Getting paid is the most I didn’t never save we gone hop out wit k’s out in the broad day  [Hook x 2] I been savin my guawla ain’t savin no bitch I had put down my glock but I picked up a stick  Don’t get in hating shit  I’m on some greatest shit  My people proud I’m as real as it get  Gone have to chase me I don’t like to wait and I swear I’m impatient I don’t like to sit I made a way for you little bitty niggas  I wish you would play wit me  boy you a bitch  [EST Gee Verse]All this shit started off in the kitchen show me once and I was paying attention ask the trenches they gonna say I’m the realist official the difference between me and niggas I’m rich when I get off my Insta  get him killed by the night  For a 60 I sent it  I can’t even risk it  Opps want me finished but I’m steady winning Youngest richest nigga out of my city I been had the streets in the head lock  We had two or three bricks at Miss Jan spot  still dead fresh if the feds watchin send a diss and hide a get yo man shot Niggas play but they know we going to air it out she was acting bougie, flew her friend out I went took it ain’t ask for a hand out old niggas see me out and put they heads down I still got my block if the music don’t crack  Really living what I rap  250 out the trap if I say it’s a fact  You was putting on an act You a killa on a app  Ask who put us on a map  put the hood on my back  3 cars 10 straps  Niggas better never lack  [Hook x 2]I been savin my guawla ain’t savin no bitch I had put down my glock but I picked up a stick  Don’t get in hating shit  I’m on some greatest shit  My people proud I’m as real as it get  Gone have to chase me I don’t like to wait and I swear I’m impatient I don’t like to sit I made a way for you little bitty niggas  I wish you would play wit me  boy you a bitch  #LilBaby #ESTGee #RealAsItGetsMusic video by Lil Baby performing Real As It Gets. Quality Control Music/Motown Records; © 2021 Quality Control Music, LLC, under exclusive license to UMG Recordings, Inc.http://vevo.ly/BdlRqV"
"DlYIkTx9hW8","Prince Harry and Meghan Markle’s Oprah Interview Coming at ‘Worst Time for Royal Family’","2021-03-03T22:18:17Z","UCdtXPiqI2cLorKaPrfpKc4g","Entertainment Tonight","24","21.04.03","Meghan Markle|Prince Harry|Oprah Winfrey|Royals|Prince Harry oprah|Prince Harry oprah interview|Meghan Markle oprah|Meghan Markle oprah interview|Meghan Markle interview|Entertainment Tonight|etonline|et online|celebrity|Hollywood|news|trending|et|et tonight","162318","817","258","1135","https://i.ytimg.com/vi/DlYIkTx9hW8/default.jpg","False","False","Royal expert Katie Nicholl shares what to expect from ‘CBS Presents Oprah With Meghan & Harry,’ the Duke and Duchess of Sussex’s big sit-down with Oprah Winfrey, set to air Sunday, March 7, on CBS. Nicholl explains why the timing of the broadcast is tough for the royal family and digs into why Queen Elizabeth, Prince William and Kate, the Duchess of Cambridge, may take issue with what’s exposed in the special.Exclusives from #ETonline :https://www.youtube.com/playlist?list=PLQwITQ__CeH2Y_7g2xeiNDa0vQsROQQgv"
"E4cuFhpTf98","AMERICANS VS ITALIANS ORDERING FOOD","2021-03-02T19:39:01Z","UCYoPoxxiolInMxwY7p3alwQ","Nicky Cass","22","21.04.03","[none]","274959","13120","420","193","https://i.ytimg.com/vi/E4cuFhpTf98/default.jpg","False","False",""
"GqYddG7Bb0o","On The Tools, Digging The Pool - House Update #4","2021-03-03T20:00:07Z","UCSGuDMofIOX2jcyhWSNPTgw","Yianni","22","21.04.03","yianni|yiannimize|yianni's house|house update|property development|ashville property|house build|ashville|digging the pool|on the tools","73459","3290","35","317","https://i.ytimg.com/vi/GqYddG7Bb0o/default.jpg","False","False","House update number 4 and @Ashville have finally poured the swimming pool slab. All structural steels are in place and the foundations for the new front extention are complete.The 1st fix of plumbing and electrical are completed on the top floor and 90%'ish on the 1st floor.:: Daniel 'Ashville' Louisy ::YT » https://youtube.com/thisisashvilleIG » @thisisashville  /  @daniellouisy#Yianni  |  #Ashville  |  #NewHouse:: THIS  VIDEO ::» https://youtu.be/GqYddG7Bb0o:: YIANNI PERSONALS ::YT » https://youtube.com/channel/UCSGuDMofIOX2jcyhWSNPTgwIG » @y14nny:: YIANNIMIZE ::http://yiannimize.comYT » http://youtube.com/yiannimizeFB » @yiannimizeIG » @yiannimizeTW » @yiannimize"
