video_id,title,publishedAt,channelId,channelTitle,categoryId,trending_date,tags,view_count,likes,dislikes,comment_count,thumbnail_link,comments_disabled,ratings_disabled,description
"v_-1jchRZ9c","Chez Krömer - Zu Gast: Frauke Petry (S04/E03)","2021-04-05T16:00:16Z","UCtyFVwXiQUaZNrE_4fE30_A","rbb","24","21.06.04","ARD|AfD|Berlin|Brandenburg|Bundestag|Bühne|Comedy Satire|Frauke Petry|Humor|Kabarett|Kabarett Comedy|Krömer|Kurt Krömer|Politik|Politikerin|Verhör|parteilos|rbb|rbb-Untertitelung","317787","10617","1401","3491","https://i.ytimg.com/vi/v_-1jchRZ9c/default.jpg","False","False","#ChezKrömer #FraukePetryChez Krömer öffnet auch 2021 seine Tür zum Verhörraum. Der scheint gemütlicher, als er ist. Im abgewetzten Amtsstuben-Flair ist Kurt Krömer Gastgeber und Unruhefaktor zugleich. In dieser Folge ist Dr. Frauke Petry zu Gast.Ob absurd-naive Fragen, böser Witz oder präziser Konter: Der Gast im Verhörraum ist dem unberechenbaren Krömer ausgeliefert. Und es gibt immer noch Menschen, die bereit sind, sich den investigativ-verstörenden Fragen Kurt Krömers zu stellen. Chez Krömer - überraschende Begegnungen, manchmal an der Grenze zur Höflichkeit, ab und an böse, immer mit ganz speziellem Humor: 30 Minuten Krömer pur und einigen Gästen, die es nicht anders verdient haben.Weitere Gäste in Krömers Verhörraum in den kommenden Wochen:Kida Khodr Ramadan, Günther Oettinger und Thomas Hornauer.Mehr Informationen: https://www.rbb-online.de/chezkroemer/"
"aBNHmUT3GPg","Official World Record! Fantastic Classical Music Medley played by a Train","2021-04-05T07:00:00Z","UC99kO6xDZSh2UNA-jdpN7cA","Miniatur Wunderland","2","21.06.04","MiWuLaTV|hamburg|miniature|germany|behind the scenes|tutorial|model building|tips|tools|documentary|model railway|jp performance|guinness world record|diy|do it yourself|toys|märklin|faller|roco|Fleischmann|rivarossi|knuffingen airport|miniature|speicherstadt|lego technic|lego|behind the scenes|attraction|miwula|railroad|railway|modellbau|model building|sehenswürdigkeit|disney world|Disneyland|europapark","546948","59151","286","9534","https://i.ytimg.com/vi/aBNHmUT3GPg/default.jpg","False","False","New GUINNESS WORLD RECORD™ Title! The best of classical music, played by a train. Take part in our three challenges: 1. How many songs are being played?2. Which songs? 3. How many glasses were used in total? A little hint: We used melodies from Wolfgang Amadeus Mozart, Giuseppe Verdi, Ludwig van Beethoven, Johann Strauß, Pyotr Illych Tchaikovsky, Johann Sebastian Bach, Antonio Vivaldi, Johannes Brahms, Georges Bizet and many more.These greatest classical music pieces are famous all over the world. So lay back, relax and enjoy this crazy video with one of the most special classical music compilation.  Miniatur Wunderland:Web & Tickets: https://www.miniatur-wunderland.deFacebook: https://www.facebook.com/MiniaturWunderlandHamburg Instagram: https://www.instagram.com/miniaturwunderlandTwitter: https://twitter.com/MiWuLa"
"f4gx-AhvAGw","Wird Joko zum Karate-Meister? Spiel 6: Schläge | Joko & Klaas gegen ProSieben","2021-04-06T10:00:13Z","UCmoa-beOd9dBmZIiLVXB8Bw","Joko & Klaas","24","21.06.04","Wird Joko zum Karate-Meister? Spiel 6: Schläge|Spiel 5: Schläge|Karate-Meister|Gegenstände kaputt machen|Kaputt hauen|kaputt schlagen|spiel 6|joko und klaas teamarbeit|Joko und Klaas|Circus HalliGalli|Zirkus HalliGalli|Halli Galli|Joko|Klaas|Claas|Klas|Joko gegen Klaas|ProSieben|Klaas Heufer Umlauf|joko Winterscheidt|show|tv show|parodien|comedy|stars|beste unterhaltung|circus|zirkus|halligalli|sendung|tv sendung|tv","79001","2864","72","139","https://i.ytimg.com/vi/f4gx-AhvAGw/default.jpg","False","False","Bei diesem Spiel geht es um Schlagfertigkeit. Also - schnell mit dem Schlagen fertig zu sein. Und als wäre das nicht schon anstrengend genug, hat Herr ProSieben sich mit Coach Esume und Icke Dommisch zwei äußerst schlagkräftige Gegner auserkoren.#JKvsP7 #ProSiebenJoko und Klaas gegen ProSieben dienstags, um 20:15 Uhr auf ProSieben► Ganze Folgen: https://www.prosieben.de/tv/joko-klaas-gegen-prosieben► Joko und Klaas bei Facebook: https://www.facebook.com/jokoundklaas/► Folge uns auf Twitter: https://twitter.com/jokoundklaas► Instagram: https://www.instagram.com/jokoundklaas/Ihr Gegner ist groß, rot und mächtiger denn je: Joko und Klaas fordern gemeinsam einen ganzen Sender heraus. Dabei gilt es, gegen das gesamte ProSieben-Universum zu bestehen - alle werden zum Kräftemessen eingeladen. Über Gegner und Spiele entscheidet alleine ProSieben. Triumphieren Joko und Klaas, überlässt ihnen der Sender einen 15-minütigen Live-Sendeplatz zur freien Gestaltung. Siegt ihr Arbeitgeber, müssen sie sich bedingungslos in seine Dienste stellen._______________________Copyright Thumbnail: ProSieben/Stefan GregorowiusImpressum:https://www.prosieben.de/service/impressum"
"-bn7SOzaQZ4","Mein GROßER BRUDER wird VERHAFTET in GTA 5 RP!","2021-04-06T08:05:04Z","UCBAwb75eZSj7w0MeS9ngLtg","Russik","20","21.06.04","GTA 5|GTA Deutsch|Grand Theft Auto|GTA NEU|GTA Polizei|GTA mod|GTA roleplay|neu|lustig|funny|lachen|GTA Hulk Mod|GTA Hulk|GTA Siren Head|Thanos|kinderfreundlich|Siren|GTA 5 MODS|Standartskill|GTA standart skill|Syou|Syou GTA|RENNEN|CHALLENGE|hunter|Polizei Mod|Avive|Avive GTA|Youtube Auto klauen|fake polizist|mein kleiner bruder wird entführt|mein großer bruder wird verhaftet|verhaftet","32308","3387","102","136","https://i.ytimg.com/vi/-bn7SOzaQZ4/default.jpg","False","False","Mein großer BRUDER icrimax wird VERHAFTET von Fake Polizei1! Liken und Teilen @SYou @iCrimax @Lofty @Amir @enrico italia Mehr Videos: NOOB gewinnt PURES GOLD in Fortnite ..https://www.youtube.com/watch?v=12GJ1E6sgXg&t=5sNOOB gewinnt EIN SCHUSS in Fortnite ..https://www.youtube.com/watch?v=4c4LxOF2LWsMein SOHN ist... ! (Happy Wheels)https://www.youtube.com/watch?v=Qi96CyIwEsA&t=9s10 Arten von ZOCKERNhttps://www.youtube.com/watch?v=nosZZ9CLm6w&t=1s✉ Business-Mail❙❚ russikrussak@gmail.com"
"Z54HdombpkY","Justin reagiert auf Trymacs Modemarke (AMA Studios) | Live - Reaktion","2021-04-05T15:15:01Z","UCnKi0wwQ3YsEte-glfY4DFA","justinLIVE","24","21.06.04","justin|jstn|jstin|justin fuchs|justin twitch|twitch|twitch highlights|justin twitch highlights|justin reagiert|justin reagiert auf|ama|ama studios|ama trymacs|trymacs|ama studios kollektion","124355","12831","1059","1184","https://i.ytimg.com/vi/Z54HdombpkY/default.jpg","False","False","🔋 Twitch: https://www.twitch.tv/jstinlive· High Quality Basics von Peso: http://pesoclo.com​ (werbung)🔋 PRO: http://youtube.com/jstin17🔋 Instagram: http://instagram.com/jstin🔋 InstagramLITE: http://instagram.com/jstinthekid🔋 Snapchat: http://snapchat.com/add/jstnxvii🔋 Video: https://www.instagram.com/p/CNNn44Oip8d/..."
"Z8y05MbYm1Q","RC Helicopter Battle | Dude Perfect","2021-04-05T22:00:09Z","UCRijo3ddMTht_IHyNSNXpNQ","Dude Perfect","17","21.06.04","dude perfect|dude perfect stereotypes|dude perfect water bottle flip|bottle flip|water bottle flip|dude perfect bottle flip|dude perfect basketball|dp|dude perfect world record|edition|nerf|trick shots|trick shot|family|ping pong|bowling|clean|family friendly|bubble wrap|soccer|football|spinner|spinners|fidget spinners|dude|battle|rc|helicopter|heli|helo|flying|army men|waterpark|water|landing|mouse|hunt|city|remote|control","3690373","233279","2620","8215","https://i.ytimg.com/vi/Z8y05MbYm1Q/default.jpg","False","False","First RC cars, then RC planes, and now.. RC HELICOPTERS!! Another incredible DP Battle!► Thanks for subscribing! - http://bit.ly/SubDudePerfect► Watch our Behind The Scenes Video: https://youtu.be/CpcXq_K5NrE► Subscribe to our DP+ Bloopers & Behind The Scenes Channel HERE: http://bit.ly/DPplusSubscribe#BattleNEXT LEVEL STUFF -------------------------------------------🎒 NEW Merch - http://bit.ly/DPStore🎮 Play our FREE iPhone game! - http://smarturl.it/DudePerfect2📱 Text us - (469) 205-7005🔔 Hit the bell next to Subscribe so you don't miss a video!👨🏻‍💻 Watch our newest vids! - http://bit.ly/NewDPVids📕 Read our Book - Go Big - http://amzn.to/OYdZ2sFollow our Instagrams so we can be best friends -------------------------------------------🏆 http://Instagram.com/DudePerfect🧔🏻 http://Instagram.com/TylerNToney👱🏻‍♂️ http://Instagram.com/Cody_Jones_🙋🏻‍♂️ http://Instagram.com/CobyCotton👨‍🦰 http://Instagram.com/GarrettHilbert⛹🏻‍♂️ http://Instagram.com/CoryCotton-------------------------------------------Bonus points if you're still reading this! Comment: What RC battle should we do next??Click here to learn more about Dude Perfect:http://bit.ly/AboutDudePerfectAs always...Go Big and God Bless!- Your friends at Dude PerfectBusiness or Media, please contact us at: Dude@DudePerfect.com------------5 Best Friends and a Panda.If you like Sports + Comedy, come join the Dude Perfect team!Best known for trick shots, stereotypes, battles, bottle flips, ping pong shots and all-around competitive fun, Dude Perfect prides ourselves in making the absolute best family-friendly entertainment possible! Welcome to the crew! Pound it 👊🏻 Noggin 🙇🏻‍♂️ - Dude Perfect"
"YyhBN7-iqPg","Die GEFÄHRLICHSTEN Schlittschuhe der Welt | KETTENSÄGEN - Schlittschuhe","2021-04-05T14:13:59Z","UCn0ITRHWS64_zRz5WWeQBkQ","The Real Life Guys","24","21.06.04","skates|ice skates","226576","21092","201","1214","https://i.ytimg.com/vi/YyhBN7-iqPg/default.jpg","False","False","Wir haben KETTENSÄGEN SCHLITTSCHUHE selber gebaut. Bitte nicht nachmachen ;) Unser Shop - Baumhaus Hoodie: https://do-something.de/products/wald-hoodie-stick (a)- Badewannen T-Shirt: https://do-something.de/products/badewannen-t-shirt (a)- Fearless Hoodie: https://do-something.de/products/fearless-hoodie-1 (a)- Fearless T-Shirt: https://do-something.de/products/fearless-t-shirt (a) ___________Social MediaWir: https://www.instagram.com/the_real_life_guys/?hl=deJulius: https://www.youtube.com/juliusvog___________Unser EquipmentFilmkamera: https://amzn.to/2Pc9Pua (a)Actioncam: https://amzn.to/2I8JRF5 (a)360-Grad Kamera: https://amzn.to/3cqilkn (a)Drohne: https://amzn.to/3j5nZMg (a)___________Unsere Musik für die Videoshttp://share.epidemicsound.com/tFfFD (a)Extra MusikTrack: Tim Beeren & xChenda - No Pressure (feat. Jon Becker) [NCS Release]Music provided by NoCopyrightSounds.Watch: https://youtu.be/K6ry2Lm9-2Q​Free Download / Stream: http://ncs.io/NoPressure___________E-Mail für geschäftliche Anfragen: rlg@flow-fwd.deNachmachen auf eigene Gefahr! ;) ___________* Sämtliche mit (a) gekennzeichneten Links stellen Werbung dar. Wenn du diese Links benutzt, erhalten wir eine Provision. Für dich wird es nicht teurer also vielen Dank, falls du diesen Link nutzt!* Sämtliche mit (b) gekennzeichneten Links stellen unbezahlte Werbung dar."
"nW948Va-l10","Marvel Studios' Loki | Official Trailer | Disney+","2021-04-05T13:00:01Z","UCvC4D8onUfXzvjTOM-dBfEA","Marvel Entertainment","24","21.06.04","marvel|comics|trailer|official trailer|loki|disney+|disney +|disneyplus|disney plus|teaser|loki trailer|tom hiddleston|owen wilson|tva","8497850","421842","4367","23124","https://i.ytimg.com/vi/nW948Va-l10/default.jpg","False","False","Loki’s time has come. Watch the brand-new trailer for Loki, and start streaming the Marvel Studios Original Series June 11 on Disney+.► Watch Marvel on Disney+: https://bit.ly/2XyBSIW► Subscribe to Marvel on YouTube: http://bit.ly/WeO3YJFollow Marvel on Twitter: ‪https://twitter.com/marvelLike Marvel on Facebook: ‪https://www.facebook.com/marvelWatch Marvel on Twitch: https://www.twitch.tv/marvelReward your Marvel fandom by joining Marvel Insider!Earn points, then redeem for awesome rewards.Terms and conditions apply. Learn more at https://www.marvel.com/insider?Osocial=YT&CID=MarvelInsiderFor even more news, stay tuned to:Tumblr: ‪http://marvelentertainment.tumblr.com/Instagram: https://www.instagram.com/marvelPinterest: ‪http://pinterest.com/marvelofficialReddit: http://reddit.com/u/marvel-official"
"FNu6R0pkeSo","Countdown läuft ⏰ Die letzten Tage bis zur Auswanderung | Isabeau","2021-04-06T08:00:03Z","UCucHkPnBa7pB-jITCGuSqKw","Isabeau","22","21.06.04","Geburt|Baby|Hausgeburt|hausumbau|haus tour|familie|vlog|schwanger|Auswanderung|auswandern|Umzug|take me to the ocean|unterwegs|reisen|putzen|aufräumen|kartons packen|fliegen|tipps","88406","4200","193","628","https://i.ytimg.com/vi/FNu6R0pkeSo/default.jpg","False","False","Hi Zusammen, der Countdown für unsere Auswanderung läuft. Wir nehmen euch die letzten Tage mit bei unserem Umzug. Viel Spaß beim Vlog!Kanal Mitglied werden: https://www.youtube.com/channel/UCucH...​Ich würde mich mega über einen Daumen nach oben freuen & lasst mir gerne euer Feedback da! ♥-----------------------------------------------------------------------------------♥ Instagram: isabeau_youtubeE-Mail Kontakt für geschäftliche Anfragen:isabeau.marketing@gmail.com♥ Häufig gestellte Fragen von Euch:Mit welcher Kamera drehst du deine Videos?- Canon Legria Mini XWelches Videobearbeitungsprogramm verwendest du?- Final Cut Pro XWie bist du dazu gekommen, Youtube Videos zu machen?- Langeweile in der Schwangerschaft :)Wie alt seid Ihr?- Isabeau: 22.06.1991 | Alex: 24.10.1987 | Leona: 26.04.2012 | Pauline: 7.05.2016 | Frida: 13.09.2017 | Moritz: 11.10.2020Seid Alex & Du verheiratet? - Ja seit dem 18.02.2017Wieso zeigt ihr eure Kinder nicht? - Um sie zu schützen und ihre Privatsphäre zu bewahren. Zudem sollen unsere Kinder später selbst entscheiden, ob sie im Internet zu sehen sein wollen oder nicht! :)Heißt du wirklich Isabeau?- Ja mein Name ist Isabeau und wird Isabo ausgesprochen. Der Name kommt aus Frankreich.Was sind eure Berufe?- Ich bin gelernte Krankenschwester. Alex arbeitet als Elektriker für Automatisierungstechnik.DANKE FÜR EURE UNTERSTÜTZUNG! Ich wünsche Euch viel Spaß auf meinem Kanal:)Verpasst keine Videos und abonniert mich, ist kostenlos!Fühlt Euch gedrückt, eure Isabeau ♥"
"y4ZR_dwASpQ","GNTM 2021: Linda packt aus - Eigentlich bin ich komplett anders... | INTERVIEW","2021-04-06T09:30:13Z","UCd8hH-tW1-y7B6S8BjAH_dA","Die It-Girl Agenten","24","21.06.04","gntm|gntm 2021|gntm casting|casting gntm 2021|wie bewerben gntm 2021|casting erfahrung gntm 2021|gntm 2020 casting|casting gntm 2020|bewerbung gntm 2021|gntm casting bewerbung|gntm bewerbung|gntm 2021 casting termine|casting termine gntm 2021|gntm 2021 jury|gntm casting erfahrung|bewerbung germanys next topmodel|männer gntm 2021|mindestgröße gntm|mindestgröße gntm 2021|gntm boys und girls|topmodel boys und girls|topmodels boys girls","40549","2326","59","473","https://i.ytimg.com/vi/y4ZR_dwASpQ/default.jpg","False","False","GNTM 2021 Model Linda hat in der Show polarisiert und antwortet heute im Interview auf meine Fragen. Wie hat sie sich selbst wahrgenommen? Wie findet ihr sie im Interview?Linda: https://www.instagram.com/linda.gntm2021.official/?hl=deLetztes Video: https://youtu.be/5MY098vyZxUJetzt kostenlos abonnieren: http://goo.gl/ekuKicMeine Mails abonnieren: http://eepurl.com/dNKr-2Folgt ihr mir hier schon?▸ INSTAGRAM: @itgirlagentenhttps://www.instagram.com/itgirlagenten/▸ Homepage: https://itgirlagenten.deKooperations-Anfragen:▸ kontakt@itgirlagenten.de#gntm #gntm2021 #germanysnexttopmodel"
"QKWE-jtCI6A","Ich habe mir 4 Tattoos gestochen ( Po & Hals 😳 ) & Leni hat geweint 🥺 ( mit@Sonny Loops ) | Dagi","2021-04-04T11:14:13Z","UCpZ_DI-ZugwMzXcqccaTVsg","Dagi Bee","26","21.06.04","dagibee|dagi|daggi|daggy|beetique|dagi shop|zula|pomeranian|pom|zulathepom|hund|dagis|black|probleme|bei|mädchen","569786","20273","1259","561","https://i.ytimg.com/vi/QKWE-jtCI6A/default.jpg","False","False","▸ Hier KOSTENLOS ABONNENT werden 🖤 : http://www.youtube.com/user/Dagibeee?sub_confirmation=1▸ SONNY'S VLOG : https://youtu.be/jMtd8kwE7NE🖤 Tattoowiererin (@xoxotattoo) : https://www.instagram.com/xoxotattoo🖤 Tattoo Studio (@vadersdye ): https://instagram.com/vadersdye Was geht abbb 🖤Ich war wieder bei meiner Lieblings-Tattoowiererin Melina ( @xoxotattoo ) & hatte diesmal meine @Sonny Loops mit dabei 😍  Bei mir sind es tatsächlich 4 Tattoo geworden 😳 aber schaut selbst welche es geworden sind & welche Bedeutung jedes Tattoo für mich hat 🙈 Auch Sonny hat sich was stechen lassen ... 😏Ganz viel Spaß dabei 🖤♡ Ihr findet mich auch HIER ... ♡DAGI SHOP  : http://dagi-shop.deBEETIQUE Cosmetics online shoppen : https://beetique.comINSTAGRAM ▸ @dagibee  /  http://instagram.com/dagibeeTWITTER ▸ https://twitter.com/dagibeeSNAPCHAT ▸ dagibeeeFACEBOOK ▸ https://www.facebook.com/Dagi.Beee♡♡♡♡♡♡♡♡♡♡♡♡♡♡♡♡♡♡♡♡♡♡♡Kontaktadresse/Business Inquiries: DagibeeBusiness@gmail.comAdresse BITTE NUR für geschäftliche Anfragen.♡♡♡♡♡♡♡♡♡♡♡♡♡♡♡♡♡♡♡♡♡♡♡Kamera* : https://amzn.to/2LtI2EZStativ* : https://amzn.to/2Lv6BBmBeleuchtung* : https://amzn.to/2LsuhX5Schneide-programm : Premiere Pro CS6Pc* : https://amzn.to/2Aec7SB( Die mit * gekennzeichneten Links sind Affiliate Links diese mit dem Partnerprogramm von Amazon zusammenhängen. Diese dienen zur Orientierung und schnellem finden der Produkte und werden je nach Erfolg mit einer Provision ausgezahlt falls diese genutzt werden :) )"
"b3LKBp3KliQ","Schnelles Currywurst mit selbstgemachten Pommes-Rezept aka Manta-Platte von Steffen Henssler","2021-04-06T08:00:12Z","UC6MePD-FOhqIelMJx-D99JQ","Hensslers Schnelle Nummer","26","21.06.04","Steffen Henssler|Hensslers Schnelle Nummer|Schnelle Rezepte|Currywurst|selbstgemachte Pommes","47416","2385","42","199","https://i.ytimg.com/vi/b3LKBp3KliQ/default.jpg","False","False","Das schnelle Currywurst aka Manta-Platte mit selbstgemachten Pommes Rezept vom Henssler - Schnell und einfach selbst kochen! Mehr schnelle Gerichte und Rezepte mit Video-Anleitungen findet Ihr auf ► https://bit.ly/3gmxDIzHier geht’s zum Shop für Messer, Pfannen und Co. https://shop.steffenhenssler.de/ -------------------------------------So geht‘s: Paprika und Zwiebel in feine Würfel schneiden, mit Cola, Sojasauce und Orangensaft in einen Topf geben und alles zusammen stark einkochenDie Kartoffeln schälen, in grobe Stäbe schneiden und in kaltem Wasser waschenDie Pommes auf einem Handtuch trockenlegen und anschließend bei 150°C in Rapsöl für ca. 7 Minuten blanchieren. Währenddessen die Currywürste von beiden Seiten leicht diagonal anritzen und in einer Pfanne mit Rapsöl von beiden Seiten langsam bratenDie Pommes aus dem Fett nehmen und für 10 Minuten auf ein Küchentuch legenKetchup und Currypulver zum Ansatz in den Topf geben und die Sauce für weitere 2 Minuten köcheln lassenDie Pommes bei 190°C im Rapsöl frittieren bis sie kross sind, in eine Schüssel geben und mit HSN Gewürzsalz und Gewürzmix würzenPommes und Currywurst auf einem Teller anrichten, die Currysauce über die Wurst geben und mit Currypulver bestreuen-------------------------------------Einkaufsliste:2 Würste nach Wahl2 große mehlig kochende Kartoffeln½ rote Paprikaschote1 weiße Zwiebel50ml Sojasauce250ml Orangensaft100ml Cola650g Ketchup1El CurrypulverSalzHSN GewürzmixRapsöl zum Frittieren -------------------------------------Post vom Henssler mit den schnellsten Gerichten? https://www.hensslers-schnelle-nummer.de/Post_vom_Henssler Noch mehr schnelle und leckere Rezepte: https://www.hensslers-schnelle-nummer.de Instagram:https://www.instagram.com/steffen_hensslerFacebook:https://de-de.facebook.com/S.Henssler/ -------------------------------------Schnelle Pasta Rezepte:Pasta, Pasta mit den schnellsten Rezepten vom Hensslerhttps://www.youtube.com/playlist?list=PL8pdKqQDbXyvzCaoEeJZ6P2haypE89xuH Schnelle Fleischgerichte Schnelle Rezepte mit dem Besten vom Fleisch zubereitet vom Hensslerhttps://www.youtube.com/playlist?list=PL8pdKqQDbXysSbO0l6ix7y5kh341qZvrF Schnelle Salat Rezepte:Leckere Salat Gerichte vom Henssler schnell und einfach gemacht:https://www.youtube.com/playlist?list=PL8pdKqQDbXyuIoP_QVPT6D3CqTQZRiwSK Schnelle Vegetarische Rezepte:Vegetarische Gerichte vom Henssler mit praktischen Tipps:https://www.youtube.com/playlist?list=PL8pdKqQDbXyvt6V3iS1uy4OLg_vXtL0io"
"RMDu1a7yQw0","Welches Ungeheuer lebt unter diesem gigantischen Wasserfall? (Über 250kg können sie sein)","2021-04-05T16:30:11Z","UCgqwQLw6YYjn1nHb-_OkdJw","Ich geh' angeln","24","21.06.04","angeln|fishing|vlog|Angelschein|See|Fluss|meer|outdoor|survival|natur","62659","3979","99","277","https://i.ytimg.com/vi/RMDu1a7yQw0/default.jpg","False","False","Der abgefahrenste Ort an dem ich jemals geangelt habe auf die größten, fast ausgestorbene Süßwasser-Monster der Welt!Hol dir schnell die krasseste Angel-Überraschungsbox des Planeten: Die Better Fishing Box 💥🚀: https://betterfishing.de *Mach deinen Angelschein jetzt online - und spare mit dem Code IGA5 jetzt 5% auf deinen Angelschein: https://ichgehangeln.de/fischereischein-online/ *Angelkarten online kaufen:Hol’ dir jederzeit deine Angelkarte online bei hejfish.com: ➡️ https://bit.ly/3eMKWkBNeuregistrierungen erhalten mit dem Code IGA 5 Euro Startguthaben! Teile diesen Code gerne auch mit deinen Freunden! Findest Du Dein Gewässer nicht bei hejfish, teile uns gerne mit, welches dir fehlt und/oder erzähle deinem Bewirtschafter von hejfish.Information für BewirtschafterDu möchtest auch deine Gewässer über die hejfish-Komplettlösung verwalten und Angelkarten online verkaufen? ➡️ https://bit.ly/3eKimAoBootsverleih und Guiding in Uganda: https://wildfrontiers.co.ug/Unser Fahrer Richard: https://idrive-africa.comUnsere Lodge: https://www.murchisonriverlodge.comVergiss die GLOCKE nicht beim Abonnieren ;)__Facebook: /ichgehangelnDEInstagram: /ichgehangelncontact us (business only): ichgehangelnDE@gmail.comSCHAU DIR UNBEDINGT AUCH DAS HIER AN:Fliegenfischen: https://www.youtube.com/playlist?list=PLzZIUsLdFAfK6guYF10-bHfsUHDgS8NJiFriedfischangeln: https://www.youtube.com/playlist?list=PLzZIUsLdFAfJUEeRnPRIHP2v3algieeOQUm die ganze Welt: https://www.youtube.com/playlist?list=PLzZIUsLdFAfILK1H_CbmW_b_HCiB98FM2Meerforelle und Dorsch: https://www.youtube.com/playlist?list=PLzZIUsLdFAfJfp6Hflh_BNLrQfjw1jkaXHechtangeln: https://www.youtube.com/playlist?list=PLzZIUsLdFAfJWVA_8FzJUXJyFzjSmkyvRBarschangeln: https://www.youtube.com/playlist?list=PLzZIUsLdFAfKfrJo7WreeR_8MOXWXrmf7Zanderangeln: https://www.youtube.com/playlist?list=PLzZIUsLdFAfJZrEXDukqwcSTfxmKY9lbtKarpfenangeln: https://www.youtube.com/playlist?list=PLzZIUsLdFAfK-0bjjTv6OgvEqvbRjoopv*Werbung (für diejenigen, die das nicht selbstständig mitbekommen haben ;)"
"fZQCUsF825A","Baylor wins the 2021 NCAA basketball championship | extended highlights","2021-04-06T03:44:41Z","UCKjEtnnXEHsXE9IvCb92V7g","March Madness","17","21.06.04","2021 NCAA Men's Division I Basketball Tournament (Sports League Championship Event)|Baylor Bears|Gonzaga Bulldogs|Gonzaga Bulldogs vs. Baylor Bears|college basketball|college hoops|march madness|ncaa|ncaa basketball|baylor|baylor highlights|baylor vs gonzaga|baylor vs gonzaga highlights|condensed games|gonzaga|gonzaga highlights|national championship|national championship highlights|march madness highlights|ncaa tournament highlights|baylor gonzaga","540014","6994","305","1899","https://i.ytimg.com/vi/fZQCUsF825A/default.jpg","False","False","Baylor dominated from wire to wire to defeat Gonzaga and win the 2021 National Championship! The Bears won their first title in program history behind 22 points from Jared Butler and 19 from MaCio Teague. Watch the extended highlights here.Watch highlights, game recaps, and much more from the 2021 NCAA Division I Men’s Basketball Tournament on the official NCAA March Madness YouTube channel. Subscribe now to be updated on the latest videos: http://www.youtube.com/marchmadness?sub_confirmation=1Connect with March Madness:Follow March Madness on Twitter: https://twitter.com/marchmadnessLike March Madness on Facebook: https://www.facebook.com/NCAAMarchMadnessFollow March Madness on Instagram: https://instagram.com/marchmadnessFollow March Madness on Snapchat: https://www.snapchat.com/add/marchmadness#marchmadness #collegebasketball"
