video_id,title,publishedAt,channelId,channelTitle,categoryId,trending_date,tags,view_count,likes,dislikes,comment_count,thumbnail_link,comments_disabled,ratings_disabled,description
"7UYOkOsOj1M","「ジョジョの奇妙な冒険 ストーンオーシャン」アニメ制作決定PV","2021-04-04T11:00:01Z","UCcjqSFXBg2cGQg5r0YooMiA","Warner Bros. Japan Anime","1","21.07.04","JOJO|JoJo’s Bizarre Adventure|Stone Ocean|ジョジョ|ジョジョの奇妙な冒険|荒木飛呂彦|JJBA","2645532","157827","627","15908","https://i.ytimg.com/vi/7UYOkOsOj1M/default.jpg","False","False","“JoJo’s Bizarre Adventure Stone Ocean” Animation series coming soon!!▼「ジョジョの奇妙な冒険 ストーンオーシャン」ティザーサイトhttps://jojo-portal-anime.com/We are proud to announce the anime adaptation of “JoJo’s Bizarre Adventure: Stone Ocean” !!Fairouz Ai is to voice Jolyne Cujoh!～ Comment from Fairouz Ai ～I cannot live without “JoJo’s Bizarre Adventure” series and it is also what aspired me to take voice acting as a profession.So when I heard that I was going to be able to participate in the series, I was lost for word and surprised that “Even a Stand would be blown to the moon”.I cried so much as it was literally the moment my dream came true, which I have chased over for 12years.I love and admire Jolyne as a character and her beautiful, strong nature gave me strength especially during my student years, so I am really grateful for the opportunity to voice Jolyne.Jolyne Cujoh is the most brave, beautiful, strong, and compassionate character I ever came across. My admiration towards her has not changed in 12 years. I am thrilled to be able to go on a “bizarre adventure” with her and hope I will be able to gain Jolyne’s “that kind of strength” through acting with everything I have.-----------------------------------------------------------------------------------------------この度「ジョジョの奇妙な冒険」アニメーションシリーズより、アニメ「ジョジョの奇妙な冒険 ストーンオーシャン」の制作が決定となりました！！1987年より週刊少年ジャンプ（集英社）にて連載が始まった荒木飛呂彦 原作による『ジョジョの奇妙な冒険』。第1部主人公ジョナサン・ジョースターと敵対するディオ・ブランドーとの因縁から始まる『ジョジョの奇妙な冒険』は、「人間讃歌」をテーマに、善悪を問わず恐怖を克服する精神、困難に立ち向かう勇気が描かれた作品です。「ジョジョの奇妙な冒険」アニメーションシリーズでは2012年よりこれまでに、「ジョジョの奇妙な冒険」「ジョジョの奇妙な冒険 スターダストクルセイダース」「ジョジョの奇妙な冒険 ダイヤモンドは砕けない」「ジョジョの奇妙な冒険 黄金の風」「岸辺露伴は動かない」とアニメ制作を続けてまいりましたが、この度、世界中のジョジョファンが熱望する原作第6部、「ジョジョの奇妙な冒険 ストーンオーシャン」のアニメ制作を発表いたします！！【空条徐倫 役 キャスト情報解禁】空条徐倫：ファイルーズあい＜ファイルーズあい　コメント＞「ジョジョの奇妙な冒険」は私が声優を目指したきっかけであり、私の人生にはなくてはならないとても大切な作品なので、出演させて頂けることを知った時はまさに「スタンドも月までブッ飛ぶこの衝撃」というか…本当に言葉が出てこなくて、12年間追い続けていた夢が叶ったことの喜びで涙が止まりませんでした。特に学生時代に、徐倫の強く美しい姿を見てたくさんの勇気をもらっていたので、そんな大好きで1番の憧れである徐倫を演じる機会を頂けて、本当に言葉では形容できないほど感謝の思いでいっぱいです。空条徐倫は私が今まで出会った中で、世界一勇敢で美しくて強くて愛情深い、素晴らしい人間です。12年前から彼女に対する憧れの気持ちは変わっていません。そんな彼女と一緒に奇妙な冒険ができることが本当に嬉しいですし、私もアフレコを通じて、徐倫のような『スゴ味』を身につけられるように、命を込めて演技させて頂きます。-----------------------------------------------------------------------------------------------▼「ジョジョの奇妙な冒険」公式ポータルサイトhttps://jojo-portal.com▼アニメ「ジョジョの奇妙な冒険 ストーンオーシャン」ティザーサイトhttps://jojo-portal-anime.com/▼TVアニメ「ジョジョの奇妙な冒険」公式Twitter＠anime_jojo　　　#jojo_anime（C）LUCKY LAND COMMUNICATIONS/集英社・ジョジョの奇妙な冒険SO製作委員会"
"uoDJa-kJutU","GETTING MY DADS PHONE OUT OF A GIANT JOLLY RANCHER! #shorts","2021-04-01T23:01:31Z","UCeykVZIuLbvlaD3PdTlOHLw","Coltyy","22","21.07.04","[none]","4217060","285528","20022","5182","https://i.ytimg.com/vi/uoDJa-kJutU/default.jpg","False","False","What should I do next with jolly ranchers!? #shorts"
"0XeYtTS4zJ8","Insane Water Slides!","2021-04-02T20:04:02Z","UCUaT_39o1x6qWjz7K2pWcgw","Beast Reacts","24","21.07.04","life hacks|crafts|slime|do it yourself|diy|lifehacks|dily projects|useful things|how to|experiment|experiments|diy activities|handcraft|prank|funny|challenge|pranks|secret|diy slime|laugh|new|skills|tricks|tips|fun","7322900","315721","3068","14709","https://i.ytimg.com/vi/0XeYtTS4zJ8/default.jpg","False","False","We found and reacted to the world's craziest water slides. If you watch to the end you'll see my favorite one.SUBSCRIBE TO THEM NOW OR ELSE!TUBERIDEShttps://www.youtube.com/watch?v=X5ilHZB6Pichttps://www.youtube.com/watch?v=ye3srzRjzkAAmusementForcehttps://www.youtube.com/watch?v=NPNCn5sA3-Mhttps://www.youtube.com/watch?v=461xQD9sUh0SoCal Attractions 360 https://www.youtube.com/watch?v=ZZm2wSHbVBMhttps://www.youtube.com/watch?v=28jgsgCNNx0SUBSCRIBE OR YOU'LL HAVE BAD LUCKNew Merch - https://shopmrbeast.com----------------------------------------------------------------follow all of these or i will kick you• Facebook - https://www.facebook.com/MrBeast6000/• Twitter - https://twitter.com/MrBeast•  Instagram - https://www.instagram.com/mrbeast--------------------------------------------------------------------"
"mi9CuoJ6NnA","Why Did The Evergreen Ship Draw This On The Chart Before Blocking the Suez Canal? | Chief MAKOi","2021-04-04T09:00:13Z","UC81BxUCw12jtyvdyv6Hxh-g","Chief MAKOi","22","21.07.04","chief makoi|seaman|seafarer|sailor|merchant marine|merchant navy|maritime|marine engineer|chief engineer|navigator|captain|master mariner|ship|mega ship|suez canal|suez canal blocked|ever given container ship|evergreen ship stuck|ever given controversial track","796201","19817","628","2741","https://i.ytimg.com/vi/mi9CuoJ6NnA/default.jpg","False","False","Was the ship's navigation system hacked?  Was it intentional?  Here's an analysis on the controversial track that the Ever Given made moments before is was grounded in the Suez Canal.Chief MAKOiSeaman Vlog S03E24===Simulation courtesy of VesselfinderVesselFinder: Free AIS Ship Tracking of Marine Traffichttps://www.vesselfinder.com#suezcanal #evergreen #suezcanalblocked"
"8GOEGsrIi68","Rashford & Greenwood seal comeback win! | Manchester United 2-1 Brighton | Premier League Highlights","2021-04-04T23:00:01Z","UC6yW44UGJJBvYTlfC7CRg2Q","Manchester United","17","21.07.04","manchester united|mufc|man utd|manutd|mu|ggmu|old trafford|man utd highlights|de gea|henderson|wan-bissaka|Bailly|maguire|telles|williams|matic|van de beek|pogba|fred|fernandes|bruno fernandes|rashford|cavani|edinson cavani|greenwood|martial|post match|post match press conference|post match presser|presser|ole|ole gunnar solskjaer|highlights|Post Match|Post Match Press Conference|Premier League|Manchester United 2-1 Brighton|Man Utd 2-1 Brighton","2288961","44403","884","1098","https://i.ytimg.com/vi/8GOEGsrIi68/default.jpg","False","False","Enjoy the best of the action as goals from Marcus Rashford & Mason Greenwood secure a comeback win over Brighton & Hove Albion at Old Trafford in the Premier League.Subscribe to Manchester United on YouTube at http://bit.ly/ManU_YTVisit Manchester United at http://www.manutd.comLike Manchester United on Facebook at http://www.facebook.com/manchesterunitedFollow Manchester United on Twitter at http://www.twitter.com/ManUtdFollow Manchester on Instagram at http://www.instagram.com/manchesterunitedSubscribe to MUTV at https://bit.ly/2L9ymRs"
"fzVrdhjxHjc","Tip Chocolate Hacks With Balloon","2021-03-27T04:30:06Z","UCSFLVk8p7tkVxKdVHf4XLjg","Satisfying Cakes","17","21.07.04","Satisfying Cakes|cake|cake decorating|cake decoration|Colorful Cake Decoration|so yummy|delicious cake|amazing cake|so yummy cake|Mr. Cakes|Fancy Cakes|dessert|rainbow cake|short|shorts|short video|Tip Chocolate Hacks With Balloon|balloon|chocolate|chocolate hacks|tip hacks","49284387","1896067","70837","6112","https://i.ytimg.com/vi/fzVrdhjxHjc/default.jpg","False","False","▽ Subscribe Here: https://www.youtube.com/c/SatisfyingCakes▽ Question of the Day: ▽ Playlist: ➞ Transform Cake: https://www.youtube.com/watch?v=-fOcjrIJpuE&list=PLJTwfofMsGNhK369bkFu04pllRtJywjgz➞ Beyond Tasty Official: https://www.youtube.com/watch?v=yXPOD-86J54&list=PLLx2Qeg0T-4T8WDg91FuKH6CVpSexxYXg▽ Contact: Yum-Up produces all content shared in-house. For inquiries please reach out to Transformcake@yumup.co▽ Thank for watching! Don’t forget to turn on notifications, like, & subscribe!#Tasty, #SoYummy, #TastyPlus, #YumUp,  #TastyCake #Shorts, #Short, #Relax, #Satisfyingvideo"
"zGprTKCu5wE","Vocal Coach Reacts to Olivia Rodrigo - Deja Vu","2021-04-04T00:25:14Z","UCi4_eFlo3rvZokGUXB_WoLQ","Tristan Paredes","10","21.07.04","vocal coach|tristan paredes|tristan|paredes|vocal coach reacts|olivia rodrigo|olivia rodrigo deja vu|drivers license|olivia rodrigo reaction|olivia rodrigo deja vu reaction|deja vu reaction|deja vu|deja vu olivia rodrigo|olivia rodrigo drivers license|drivers license reaction|olivia rodrigo songs|olivia rodrigo new song|reaction video|joshua bassett|deja vu olivia rodrigo reaction|drivers license olivia rodrigo|reacts to|deja|vu|how to sing deja vu","401129","25545","204","1727","https://i.ytimg.com/vi/zGprTKCu5wE/default.jpg","False","False","Vocal coach Tristan Paredes reacts to Olivia Rodrigo's 2021 new song titled Deja Vu - a follow-up to Driver's License. People are still speculating this song is about Joshua Bassett and Sabrina Carpenter!! What?? In this video, Tristan talks about how to sing Deju Vu like Olivia Rodrigo!Instagram: https://www.instagram.com/tristan_paredes/Twitter: https://www.twitter.com/maestroparedesTikTok: https://www.tiktok.com/@tristanparedesTwitch: https://www.twitch.tv/tristan_paredes0:00 Intro0:50 Reaction7:03 The Breathy Verses8:40 First Chorus Falsetto9:34 Olivia's Expressive Technique10:33 Belty Angelic Chorus12:05 Bridge Changes13:54 ConclusionListen to ‘deja vu’ out now: https://OliviaRodrigo.lnk.to/dejavu​​ Pre-order the debut album *O*R: https://OliviaRodrigo.lnk.to/preorder​2nd Channel: https://www.youtube.com/channel/UCq02ycwbK5U1UQ4G-QlN23QOur Singing & Karaoke Discord: https://discord.gg/singingunderground"
"9wvzFOcwI40","Minecraft’s Surgery Mod is actually funny…","2021-04-02T18:04:00Z","UC5p_l5ZeB_wGjO_yDXwiqvw","TommyInnit","20","21.07.04","tommyinnit|minecraft|mine craft|dream|dream minecraft|funny|minecraft funny|funniest minecraft video|minecraft manhunt|minecraft speedrunner vs hunter|minecraft speedrunner|minecraft speedrun|minecraft challenge|challenge|minecraft but|wilbur soot|slimecicle|philza|dream war|dream smp|surgery mod|morph mod|shapeshift|fun|minecraft mod|modded minecraft|Minecraft’s Surgery Mod is actually funny…","7595743","540292","5830","33726","https://i.ytimg.com/vi/9wvzFOcwI40/default.jpg","False","False","Today TommyInnit, Wilbur Soot, Philza & Slimecicle have lots of fun with the Surgery Mod in Minecraft. It was properly mental.PLEASE WATCH MY STREAMS - https://www.twitch.tv/tommyinnit Edited by Tommy + Elodie :o (@elodiegif on twitter)@Wilbur Soot @Slimecicle @Ph1LzA Follow my Twitter - @tommyinnitFollow my Instagram - @tommyinnittToday Me, Wilbur Soot, Slimecicle, & Philza Minecraft install the Surgery Mod in Minecraft 1.16.4! Even though I had a Minecraft War with Dream on the Dream Team SMP Minecraft Server today Wilbur Soot went crazy and he is just hilarious and we had lots of laughs.The Funniest Minecraft Video Ever with New Funny Mods makes Minecraft 1.16.4 even funnier & hilarious! It is lots of fun and laughs :) Not Minecraft, But Water Rises or Minecraft, But Lava Rises, or any other but challenge like that. This is a speed run / speed runner of Minecraft against a killer / assassin but it is me and my good friends playing the NEW FUNNIEST MINECRAFT MOD EVER!!! POG CHAMP!!!"
"EAg69LaLlS0","Demi Lovato - Dancing With The Devil","2021-04-02T04:00:14Z","UCnyB9MYKRkSFK3IIB32CoVw","DemiLovatoVEVO","10","21.07.04","Demi|Lovato|Dancing|With|The|Devil|Island|Records|Pop","11204211","715158","14002","34731","https://i.ytimg.com/vi/EAg69LaLlS0/default.jpg","False","False","Listen to “Dancing With The Devil”: https://DemiLovato.lnk.to/DWTD​​ 'Dancing With The Devil... The Art Of Starting Over' out now: https://demilovato.lnk.to/DWTDTAOSO​​Shop: https://shop.demilovato.com/Watch the Demi Lovato: Dancing With The Devil documentary: https://yt.be/demidwtdA true story by Demi LovatoDirected by Demi Lovato & Michael D. RatnerProduced by OBB Pictures & SB FilmsIf you or someone you know is in need of support, it’s OK to ask for help.If you are struggling with addiction, call 1-800-662-HELP (4357) or visit samhsa.gov.If you have experienced sexual assault, call the RAINN Sexual Assault Hotline 1-800-656-HOPE (4673).Need someone to talk to? Reach out to your local crisis text line:USA: Text HOME to 741741; UK: Text SHOUT to 85258; Canada: Text CONNECT to 686868 or 741741Connect with Demi: Subscribe https://www.youtube.com/channel/UCZkURf9tDolFOeuw_4RD7XQInstagram http://instagram.com/ddlovato​​ Twitter http://twitter.com/ddlovato​​ Facebook http://facebook.com/demilovato​​ Official site http://demilovato.com​​ Join her mailing list to stay up to date http://www.demilovato.com/#mailing-list​​ #DemiLovato​​ #DancingWithTheDevil​​ #DWTDTAOSOMusic video by Demi Lovato performing Dancing With The Devil. © 2021 Island Records, a division of UMG Recordings, Inc.http://vevo.ly/lZ34fj"
"ML-iBsCUDg8","Lil Tjay - Run It Up (Feat. Offset & Moneybagg Yo) [Official Video]","2021-04-02T14:31:51Z","UCEB4a5o_6KfjxHwNMnmj54Q","Lil Tjay","10","21.07.04","Lil Tjay|Offset|Moneybagg Yo|Migos|Run It Up|Destined 2 Win|Offset Run It Up|Moneybagg Yo Run It Up|Lil Tjay new song|Lil Tjay Run It Up|Bronx|New York Rap|Lil Tjay Offset|Lil Tjay Moneybagg Yo|Run It Up Lil Tjay|Run It Up Video","4276376","214621","2273","9736","https://i.ytimg.com/vi/ML-iBsCUDg8/default.jpg","False","False","Official video for Run It Up by Lil Tjay featuring Offset & Moneybagg Yo.Lil Tjay 'Destined 2 Win' out now: https://liltjay.lnk.to/Destined2WinAmazon Music - https://liltjay.lnk.to/Born2BeGreat/amazonmusicApple Music - https://liltjay.lnk.to/Born2BeGreat/applemusicAudiomack - https://liltjay.lnk.to/Born2BeGreat/audiomackDeezer - https://liltjay.lnk.to/Born2BeGreat/deezeriTunes - https://liltjay.lnk.to/Born2BeGreat/itunesSoundcloud - https://liltjay.lnk.to/Born2BeGreat/soundcloudSpotify - https://liltjay.lnk.to/Born2BeGreat/spotifyYouTube Music - https://liltjay.lnk.to/Born2BeGreat/youtubemusicDirector: Whipalo.                        Producers: Silvia Durango, Julio Durango        DP: Brian Beckwith                      VFX: Goldmold FongArt Designer: Victor VelleCar Coordinator: Christopher PhanCommissioner/Producer: Saul LevitzA RHINO FARM PRODUCTIONFollow Lil TjayFacebook - https://www.facebook.com/LilTjay​​Instagram - https://www.instagram.com/liltjay/​​TikTok - http://tiktok.com/@liltjay​​Twitter - https://twitter.com/liltjay​​ Text - 917-722-4610Follow OffsetInstagram - https://www.instagram.com/offsetyrn/​Twitter - https://twitter.com/OffsetYRN​Follow Moneybagg YoInstagram - https://www.instagram.com/moneybaggyo/​Twitter - https://twitter.com/moneybaggyohttps://www.liltjaymusic.com/#LilTjay #Offset #MoneybaggYo"
"LkTMBXoB-tM","Among Us But Impostor Can Change Color","2021-04-02T17:00:18Z","UCMDtoPUno_f-puMpHL3Uuqg","STA Studios","20","21.07.04","[none]","3512250","45229","3355","2688","https://i.ytimg.com/vi/LkTMBXoB-tM/default.jpg","False","False","► SUBSCRIBE to the Channel! - https://www.youtube.com/user/STAStudios?sub_confirmation=1Please Like and Subscribe"
"K9_VFxzCuQ0","ROSÉ - 'Gone' M/V","2021-04-04T15:00:06Z","UCOmHUn--16B90oW2L6FRR3A","BLACKPINK","10","21.07.04","YG Entertainment|YG|와이지|K-pop|BLACKPINK|블랙핑크|블핑|제니|로제|리사|지수|Lisa|Jisoo|Jennie|Rosé|BLINK|블링크|ROSÉ On The Ground|로제 On The Ground|On The Ground|로제 R|ROSÉ R|ROSE R|ROSE On The Ground|Gone|ROSE Gone|Gone MV|ROSÉ Gone","26375896","3633905","28192","543051","https://i.ytimg.com/vi/K9_VFxzCuQ0/default.jpg","False","False","#ROSÉ #로제 #BLACKPINK #블랙핑크 #FirstSingleAlbum #Gone #MV #April5th_0amKST #April4th_11amEST #OutNow #YG"
"wFvBY4CtF0k","Leg of Lamb | Cookin' Something with Matty Matheson","2021-04-03T15:00:34Z","UCpqH8-BBNTsluhcOzFKWLuw","MATTY MATHESON","23","21.07.04","retired bolt ears|matty matheson|matty|matheson|cooking|cooking something|leg of lamb|lamb|lamb chops|how to cook lamb|lamb leg|lamb recipes|easy lamb recipes|rack of lamb|lamb meat|matty matheson lamb|leg of lamb recipe|how to make leg of lamb|how to cook|how to cook leg of lamb|grilled lamb|how to cut lamb|yeti|yeti coolers|grilling|grilling recipes|easy salad recipe|crispy rice|marinated lamb","303646","12758","141","1445","https://i.ytimg.com/vi/wFvBY4CtF0k/default.jpg","False","False","This episode is sponsored by YETI. For more from YETI, click here: https://www.yeti.com/ITS GRILLED LAMB CHECK OUT THE INSULASH ON THE YETI 45 TUNDRA BABY!! LETS GO COOKIN SOMETHIN CHECK OUT  THE INSULASH HOT OR COLD KEEP YOUR TOOTSIES WARM YOUR BUTTS COLD NEW COOKING SHOW ON THE YOUTUBE COOKIN SOMETHIN WATCH COMMENT SUBSCRIBE LIKE FEED ME FEED YOU!  YETI Tundra Cooler: https://bit.ly/2PTQjHaRECIPEFor the Marinade:2 tbsp Szechuan peppercorns 2 tbsp black peppercorns 2 tbsp anise seed 2 tbsp fennel seed 2 tbsp coriander seed 2 tbsp coriander seed 1 bunch mint 1 ½ cups parsley 1 ½ cups cilantro 3 shallots, peeled and minced 5 large garlic cloves, smashed and peeled Zest of 1 lime Zest of 1 lemon 1.5 cups Grapeseed oil add more if needed 1 cup roasted pepper relish (pre-made) 1 bone in lamb leg or have your butcher bone out For your salad: ½ cucumber 1 tomato ¼ white cabbage 1 red onion 1 lemon 1 cup hot pepperoncini 1 cup green olives pitted 4 tablespoons of sherry vinegar 4 tablespoons of olive oil Day old cooked white rice 1 bag of Pita breadMETHOD1. Light your grill and allow the coals to get burning hot.  2. Take a large pan and add all of your peppercorns and seeds. Toast them slowly to wake them  up, get them nice and toasty. Sautee and allow the natural oils to come alive, keep them  moving so they don’t burn. Allow the seeds and peppercorns to get a little smokey and remove  once they start to caramelize.  3. In a mortar and pestle (or get your spice grinder), grind your seeds and peppercorns to create a  coarse powder.  4. Set aside in a large bowl and add 2 scoops of your favourite hot sauce relish.  5. Without rinsing your mortar and pestle, mash your garlic cloves, and then add the zest of one  lime and one lemon. Save your citrus for later. Pour in your olive oil, and muddle together. Add  the mashup to your bowl with spices.  6. In the bowl, add your minced shallot, chopped parsley and cilantro, including the stems. Pick off  your mint leaves and chop loosely. Mix through and add just enough grapeseed oil so that the  marinade comes together and is coated nicely. Remember, your marinade is not supposed to be  an emulsified, runny marinade, but more like a salsa verde or chimichurri! Add salt to taste,  then set aside 3 large tablespoons in a bowl for later.  DEBONE + BUTTERFLY LAMB 1. Make an incision above the shank - follow the muscle, cut around the knuckle, remove and then  butterfly the meat, making it nice and flat, slowly cutting out shin bone etc, by following the  bone as closely as possible. 2. Trim some fat and remove the silver skin, because when grilling it becomes a little too chewy,  and the fat will cause flames!! 3. Make some shallow incisions all the way down the length of the lamb so all the marinade gets in  the meat.4. Put your butterflied lamb into a large, reusable container.  5. Take your marinade, spoon half into the container and press into the lamb. Flip the container  over and spoon in the remaining, so both sides are completely covered. Massage marinade into  the lamb a little more. Put into a cooler with ice to marinate for 1 hour.  6. Once marinated, season with salt, and prepare for grilling. Add to your grill! Grill fat side down first.  7. To get as much flavour out of the lamb as possible - turn frequently so it cooks evenly and all  the way through, make sure that there is some good caramelisation. Re-season with salt as you  go!!!! 8. When your lamb looks ready, set aside and place in an insulated container (Yeti) to rest for 20- 30 minutes. PREPARE SALAD1. Dice one whole cucumber, one large red onion, ½ white cabbage. Make sure that all your  vegetables are roughly the same size. Crack your olives with your fingers so they break apart and chop up your pepperoncini. Add to a large bowl, then pour in equal parts sherry vinegar and  olive oil. Add salt and pepper to taste, and finish with the juice of one lemon. Stir and mix  through. CRISP RICE1. Grab your day-old white rice and place in the bottom of a pan in an even layer.  Medium high heat with 2 tablespoon of olive oil. Let it crisp up don’t move it at all until it  releases itself about 5 minutes in, then move it to medium, it will sound like the rice is crackling  and once it smells like popcorn, we are good to go!!! 2. Carefully place a large plate over the top of your pan and FLIP to reveal your crispy bottomed  edges. FINISH THE DISH1. Take the juice of half a lime, and half a lemon that you set aside earlier, and add these to the  marinade you set aside for finishing. Start grilling your pita so they are warmed through! 2. Pull out your lamb, then slice into thin pieces, place it on top of the crispy rice, add salad on the  sides of the crispy rice and spoon your remaining marinade on top of your lamb.  3. Squeeze half a lemon over the top of everything and spoon resting juices over the lamb, serve with pita!https://mattymatheson.store"
"Ma6Tbt82ZKA","Space Jam 2 A New Legacy Trailer BREAKDOWN + Things You Missed (101 Easter Eggs)","2021-04-03T18:23:46Z","UCkFbAywlXz4W0BCle2eFyUw","3C Films","24","21.07.04","space jam a new legacy|space jam 2|space jam a new legacy trailer|space jam 2 trailer|space jam 2021 trailer|space jam trailer|space jam 2 trailer breakdown|space jam 2 trailer Easter eggs|space jam a new legacy trailer breakdown|space jam a new legacy trailer Easter eggs|Easter eggs|space jam 2 trailer 2021|space jam 2 official trailer|3cfilms|trailer reaction|space jam 2 trailer reaction|space jam a new legacy trailer reaction","577492","17276","663","2509","https://i.ytimg.com/vi/Ma6Tbt82ZKA/default.jpg","False","False","Space Jam A New Legacy Trailer Breakdown of all the Easter eggs found in the Space Jam 2 Trailer. I already mad e a trailer reaction for space jam 2 a new legacy so now we dive into every possible hidden cameo and Warner brothers characters I could find in the background of this crazy Space jam 2021 trailer. finding people like the joker pennywise the mask mr freeze flinstones iron giant and so many more!! Space Jam 2 Trailer Things You Missed.#SpaceJam2 #SpaceJamANewLegacy Space Jam A New Legacy Trailer Reaction: https://youtu.be/Yl_AsMN53BMSpace Jam 2 Posters: https://youtu.be/m8gJvwjjf98Space Jam a new legacy teaser: https://youtu.be/P9czx4uP4X0Space jam new legacy footage: https://youtu.be/P9czx4uP4X0CHANNEL MERCH: https://teespring.com/stores/3cfilms------------------------SOCIAL MEDIA ------------------------Twitter: https://twitter.com/3CFilmReviewFacebook: https://www.facebook.com/groups/2204561206458090/------------------------EQUIPMENT I USE IN MY VIDEOS----------------------Camera: https://amzn.to/2BLWqT2Microphone: https://amzn.to/2StTzW0Microphone #2: https://amzn.to/2ViQ5HKLights: https://amzn.to/2rZ9qjGComputer: https://amzn.to/2BXsgMXBusiness Inquiries:3CFilmReview@Gmail.comThank You For Any Support!DISCLAIMER: This video and description may contain affiliate links, which means that if you click on one of the product links, I’ll receive a small commission. This helps support the channel and allows us to continue to make videos like this."
"H8wRT-X_0Ng","What really happens when you bleed","2021-04-04T20:46:40Z","UCESqho-TmmnJQJf4IWEbBkQ","Iamdices","10","21.07.04","[none]","1288501","139837","1325","815","https://i.ytimg.com/vi/H8wRT-X_0Ng/default.jpg","False","False","MERCH: https://teespring.com/stores/dices-3TikTok: https://www.tiktok.com/@iamdices?lang=enInstagram: https://Instagram.com/iamdices/Twitter: https://twitter.com/IamdicessEmail: Wilson.lasayfies@gmail.com#Iamdices #Tiktok #Shorts"
