video_id,title,publishedAt,channelId,channelTitle,categoryId,trending_date,tags,view_count,likes,dislikes,comment_count,thumbnail_link,comments_disabled,ratings_disabled,description
"QKpWvPEZ5bo","The Main Character of Dream SMP","2021-02-28T20:49:09Z","UCFAiFyGs6oDiF1Nf-rRJpZA","Technoblade","20","21.04.03","Minecraft|Technoblade|Technothepig|Hypixel","3876691","458992","1759","30589","https://i.ytimg.com/vi/QKpWvPEZ5bo/default.jpg","False","False","technoblade tries to cope with the realization that he is a side character--------------------------------Ranboo: https://www.youtube.com/channel/UCKQ-wNdh0kO5qnpPfXa2hjQPh1lza: https://www.youtube.com/user/Ph1LzAedited by https://twitter.com/Wardenboobecome a CHANNEL MEMBER here: https://www.youtube.com/channel/UCFAiFyGs6oDiF1Nf-rRJpZA/joinother YT channel (go subscribe): https://www.youtube.com/channel/UCV--8wtuyGo3vMtIdeq4j3wfollow me on twitter too: https://twitter.com/Technothepigmusic:The Happiest Days by J.F. Glosshttps://www.epidemicsound.com/referral/m3rfi7/"
"W3Qo6fml_kY","Testing Famous Products From TV Commercials","2021-03-01T20:00:24Z","UCvmejiV9xeMv-yNgAPk2e_Q","Jay Swingler","24","21.04.03","sidemenreacts|zerkaa|moresidmen|vines we almost forgot|top 10 aggressive animals|in the world|unexplained|dramatic footage|oiiluke|test with my girlfriend|tgfbro|i tried surfing|truth about their girlfriends","315798","44042","111","896","https://i.ytimg.com/vi/W3Qo6fml_kY/default.jpg","False","False","I am genuinely blown away by this..TGF is back next week!"
"DLTgCH0w8EE","CHUNKZ and DARKEST BATTLE A 6 YEAR OLD!!! | Home Schooled | Ep 1","2021-02-28T19:00:04Z","UCSTJELgD0j0gW2_wgF_TYuA","Footasylum","24","21.04.03","chunkz|footasylum|darkest|darkest man|Chunkz and darkest|beta squad|home schooled|quiz|bambino becky|mikes comedy|locked in|does the shoe fit|chefasylum|think twice","485385","32072","170","1410","https://i.ytimg.com/vi/DLTgCH0w8EE/default.jpg","False","False","www.footasylum.com@Chunkz puts YouTubers to the test against school kids in a variety of subjects.Is @Darkest Man smarter than a 6 year old? Probably not...Comment who you want to see on next time.#footasylum #chunkz #darkestman"
"Rghw9wYwKTc","Coming Soon... | Taskmaster","2021-03-02T18:00:06Z","UCT5C7yaO3RVuOgwP8JVAujQ","Taskmaster","23","21.04.03","Taskmaster|Alex Horne|Greg Davies|Frank Skinner|Josh Widdicombe|Romesh Ranganathan|The Horne Section|Tim Key|Dave Channel|UKTV|Red Dwarf|Would I Lie To You|8 out of 10 cats|Taskmaster full episodes|james acaster|taskmaster series 11|series 11|series 11 cast|trailer|channel 4|lee mack|charlotte Ritchie|Mike wozniak|jamali maddix|sarah kendall","94333","3089","24","388","https://i.ytimg.com/vi/Rghw9wYwKTc/default.jpg","False","False","Taskmaster Series 11, coming soon to Channel 4. ------------Follow the show at http://www.twitter.com/taskmasterBecome a fan at https://www.facebook.com/officialtaskmasterBuy Taskmaster merch: https://taskmasterstore.com/------------In this Broadcast Award-winning, BAFTA and Emmy Award-nominated entertainment show, Taskmaster tyrant Greg Davies (Man Down, Cuckoo), with the help of his loyal assistant Alex Horne (The Horne Section and the show’s creator), sets out to test the wiles, wit and wisdom of five hyper-competitive comedians.Comedians that have risked life, limb, and dignity in the hope of making the Taskmaster proud so far include: Frank Skinner (The Frank Skinner Show), Mel Giedroyc (The Great British Bake Off), Romesh Ranganathan (Asian Provocateur), Hugh Dennis (Outnumbered), Sally Phillips (Bridget Jones’ Diary), Rose Matafeo (Edinburgh Comedy Award Winner 2018), and Russell Howard (The Russell Howard Hour). Unaware of what awaits them in each wax-sealed envelope, only one competitor can become the victorious owner of His Royal Task-ness’ golden head and be crowned the next Taskmaster Champion."
"Fbr55An8VPI","HIGHLIGHTS | Canelo Alvarez vs. Avni Yildirim","2021-02-28T04:39:19Z","UCurvRE5fGcdUgCYWgh-BDsg","DAZN Boxing","17","21.04.03","dazn|boxing|highlights|full fight|ko|knockout|ryan garcia|top 10|canelo|anthony joshua|ggg|haney|fight night|avni yildirim|yildirim|turkiye|turkey|mexico","5411150","56839","6253","9620","https://i.ytimg.com/vi/Fbr55An8VPI/default.jpg","False","False","February 27th, 2021 -- Canelo Alvarez vs. Avni Yildirim from the Hard Rock Stadium in Miami, Florida.Subscribe to our YouTube channel 👉  http://bit.ly/DAZNBoxingYouTubeDownload the DAZN app now 👉  http://bit.ly/DAZNYoutubeFollow DAZN Boxing On Social Media 👇Twitter: https://www.twitter.com/DAZNBoxingInstagram: https://www.instagram.com/DAZNBoxingFacebook: https://www.facebook.com/DAZN"
"made_vh4xb0","Can We Beat Minecraft Hardcore in 1.17? (New Cave Update)","2021-03-01T13:30:19Z","UCIYI7DDUMDgJLODyyjM2SWQ","LockDownLife","20","21.04.03","hardcore minecraft|hardcore minecraft 1.17|minecraft hardcore 1.17|beating minecraft hardcore in 1.17|can we beat minecraft hardcore in 1.17|minecraft hardcore cave update|minecraft 1.17|minecraft 1.17 hardcore|minecraft 1.17 survival|minecraft 1.17 caves and cliffs update|1.17|minecraft 1.17 snapshot|minecraft hardcore 1.17 snapshot|lockdownlife|minecraft cave update|wadzee minecraft 1.17|hardcore|minecraft hardcore|1.17 snapshot|duo hardcore minecraft|duo","402128","18257","218","1592","https://i.ytimg.com/vi/made_vh4xb0/default.jpg","False","False","Can we beat hardcore minecraft 1.17? Duo hardcore minecraft!Can we beat hardcore minecraft in the new cave update?Me and my friend @GamerZ attempt to beat minecraft hardcore in the latest version of minecraft, minecraft 1.17 which is the new caves and cliffs update. Hardcore minecraft is the hardest difficulty of minecraft, it will be made even harder by having to explore giant caves, and fight through hoards of enemy mobs! This is a Duo version of beating hardcore minecraft in 1.17. This is duo minecraft 1.17 survival played on the latest minecraft 1.17 snapshot.Will we be able to beat hardcore minecraft in 1.17? Watch till the end to find out!🆂🅾🅲🅸🅰🅻 🎙️𝑫𝒊𝒔𝒄𝒐𝒓𝒅         https://discord.gg/x7xhw42🕊️𝑻𝒘𝒊𝒕𝒕𝒆𝒓         https://twitter.com/DownLifetweets🎬𝑻𝒘𝒊𝒕𝒄𝒉          https://www.twitch.tv/lockdownlifestreams ▶𝑴𝒐𝒓𝒆 𝑳𝑫𝑳      https://bit.ly/3aHCTpn📷𝑰𝒏𝒔𝒕𝒂𝒈𝒓𝒂𝒎  https://www.instagram.com/lockdownlifeinsta📲𝑻𝒊𝒌𝑻𝒐𝒌           https://www.tiktok.com/@lockdownlifett?lang=enBecome a member today: https://www.youtube.com/channel/UCIYI7DDUMDgJLODyyjM2SWQ/joinCredits:@WadZee Credit to wadzee for the beating 1.17 idea.@GamerZ my friend.My setup:My Mouse - https://amzn.to/3u6R5QHMy Keyboard - https://amzn.to/3arZnLcMy Monitors - https://amzn.to/3bjKOs8My Mic - https://amzn.to/3dmsktKMy Graphics Card - https://amzn.to/3pt2OWgMy CPU - https://amzn.to/3qx2uXRMy Chair - https://amzn.to/3qzztdSMusic:Music:1. Track: Future Disco — Vendredi [Audio Library Release]     Music provided by Audio Library Plus     Watch: https://youtu.be/zW2bU3ZnL9Q​     Free Download / Stream: https://alplus.io/future-disco2. Eternity by Lahar https://soundcloud.com/musicbylahar​    Creative Commons — Attribution 3.0 Unported — CC BY 3.0    Free Download / Stream: https://bit.ly/al-eternity​    Music promoted by Audio Library https://youtu.be/tDS0GezECkc3. Electric Joy Ride - Origin [NCS Release] https://youtu.be/iScT5IfgG-Q​    http://facebook.com/ElectricJoyRide​    https://soundcloud.com/electricjoyride​    https://youtube.com/user/ElectricJoyRide​    Music promoted by Audio Library https://youtu.be/dokspLaZqGE4. Music: Dreams - Bensound    https://www.bensound.com​    Support by RFM - NCM: https://bit.ly/2xGHypM5. Monkeys Spinning Monkeys by Kevin MacLeod    Link: https://incompetech.filmmusic.io/song...​    License: http://creativecommons.org/licenses/b…6. oblivion by Rexlambo https://soundcloud.com/rexlambo​    Creative Commons — Attribution 3.0 Unported — CC BY 3.0    Free Download / Stream: https://bit.ly/a_oblivion​    Music promoted by Audio Library https://youtu.be/yn1PcyPBxRU#1.17 #lockdownlife #minecrafthardcore"
"j9LEro19Ues","VW Golf R 2021 review: see how quick it really is 0-60mph!","2021-03-02T10:24:19Z","UCUhFaUpnq31m6TNX2VKVSVA","carwow","2","21.04.03","carwow|mat watson|car review|car review 2021|new car review|volkswagen|vw|volkswagen golf|vw golf|vw golf r|volkswagen golf r|new volkswagen golf r|vw golf r new|new mk8 golf r|m8 8 golf r|vw golf r review|volkswagen golf r review|volkswagen golf r review 2021|golf r review 2021|new hot hatch|fastest hot hatch|fastest german hot hatch|vw hot hatch|best hot hatch 2021|new hot hatch review|hot hatch review|hot hatchback|fastest hot hatchback","904202","33992","648","4187","https://i.ytimg.com/vi/j9LEro19Ues/default.jpg","False","False","Need help buying your next car? Click https://www.carwow.co.uk/-help-me-carwow and my team and I will help you choose your ideal car at a fair price - from Mat Watson!.............................................................Introducing the all-new Volkswagen Golf R! Mat’s finally got his hands on VW’s latest hot hatch to see if the Golf R really is the ultimate car for grown up boy racers.Given it’s a hot hatch, the first thing we need to investigate is the performance! Under the bonnet, you’ll find a 2-litre turbocharged engine (the same as in the Mk7…), although this time it’ll produce 320hp and 420Nm of torque, while also being able to hit 60mph in 4.7 seconds.So the performance stats are ok, but do we really think it’s worth the approximate £40,000 price tag? And more importantly, will Mat be able to beat the claimed 0-60mph time? You know there’s only one way to find out… Sit back & relax with Mat’s all-new in-depth review!Chapters00:00 Intro00:47 Price01:22 Exterior Design03:51 Interior05:44 Back Seats06:10 Boot06:45 Five Annoying Features08:31 Five Good Features09:57 0-60mph10:55 Driving13:44 VerdictHonda Civic Type R Review - http://bit.ly/Honda-Civic-Type-R-Review-2021Mercedes-AMG A45 S Review - http://bit.ly/Mercedes-AMG-A45-Review-2021.............................................................Instagram – http://www.instagram.com/carwowTiktok - https://www.tiktok.com/@carwowFacebook – http://www.facebook.com/carwowukTwitter – http://www.twitter.com/carwowukSign Up to our Newsletter – http://bit.ly/carwow-NewsletterAwkward haggling is a thing of the past with carwow. Choose your perfect car with our configurator tool and let the country’s best dealers compete over you. Compare the five best offers by price, location and dealer ratings and choose the one that’s right for you – no hassle, no haggling, just a great deal. Oder auch in Deutschland Geld beim Autokauf sparen – http://bit.ly/carwow-DEVisita nuestra página web para saber cuánto te puedes ahorrar en tu nuevo coche – http://bit.ly/carwow-ES"
"CboacVTPZV8","Full fight: Tommy Fury v Scott Williams","2021-02-28T10:44:35Z","UC-hWvVvE-crFl5vg5G8QbqA","BT Sport Boxing","17","21.04.03","Tommy Fury|Fury|Fury v Williams|#FuryWilliams|Fight highlights|TNT Fury|Love Island|Molly Mae Hague|John Fury|Tyson Fury|BT Sport|BT Sport Boxing|Knockout|Knockouts|Tommy Fury knockouts|Tommy Fury KO|Tommy Fury win","380522","4439","710","1248","https://i.ytimg.com/vi/CboacVTPZV8/default.jpg","False","False","Tommy Fury secured his fifth professional career win with victory over Scott Williams at the Copper Box Arena. He closed the show with a big right hand in the second round.Subscribe to BT Sport Boxing on YouTube ➡️ http://www.youtube.com/c/btsportboxingFollow BT Sport Boxing on Twitter ➡️ http://twitter.com/btsportboxingJoin our BT Sport Boxing Facebook Group ➡️ https://www.facebook.com/groups/BTSportBoxing/Follow us on Instagram ➡️ http://instagram.com/btsportboxingRead more on upcoming fights on BT Sport and BT Sport Box Office ➡️ http://www.bt.com/sportboxoffice"
"FGCPL_0YOYg","I'm Back... and I Have Something to Tell You","2021-03-01T18:00:10Z","UC2S7CGceq5tsuhcVyACdA3g","CrankGameplays","24","21.04.03","CrankGameplays|Crank Gameplays|break|youtuber break|crankgameplays break|crankgameplays month off|time off|i need to step away|i need to take some time|crankgameplays i need to step away|im back|crankgameplays tour|tour|youtuber tour|crankgameplays live show|crankgameplays live","789981","122563","523","11710","https://i.ytimg.com/vi/FGCPL_0YOYg/default.jpg","False","False","Get Tickets Now ► http://www.ihavetodothis.showValentine's Drop ♥ http://www.crankgameplays.com"
"W5wWL8GZP1o","Oprah Asks Meghan Markle If She Was 'Silenced' In Interview Special Preview","2021-03-01T03:34:03Z","UCKY5PiEq8Tl9r7f3qittXng","ET Canada","24","21.04.03","entertainment|news|et canada|entertainment tonight|entertainment tonight canada|meghan markle|prince harry|meghan markle prince arry|oprah|oprah meghan adn harry|meghan markle oprah winfrey|oprah interview harry meghan|meghan markle oprah interview|prince harry and meghan markle|royals|drama|oprah winfrey","1054246","4185","1370","2988","https://i.ytimg.com/vi/W5wWL8GZP1o/default.jpg","False","False","In the first look at Oprah with Meghan and Harry: A CBS Primetime Special, the queen of TV asks the Duchess of Sussex whether she was silent or silenced by the Royal family. Plus, Prince Harry expresses he doesn't want history repeating itself.SUBSCRIBE to our channel:https://www.youtube.com/user/ETCanadaOfficialFOLLOW us here:http://www.etcanada.comFacebook: https://www.facebook.com/etcanadaTwitter: http://www.twitter.com/etcanadaInstagram: http://www.instagram.com/etcanada#MeghanMarkle #PrinceHarry #Oprah"
"S-271ZmmNpg","Prince Harry & Meghan Markle Oprah Tell-All Sneak Peek | Daily Pop | E! News","2021-03-01T19:06:20Z","UCjDsbbzHgTrGc4Ff26TJtsA","E! News","24","21.04.03","Entertainment|Top Stories|News|Couples|Royals|Prince Harry|Meghan Markle|Oprah Winfrey|Controversy|celebrity families|Princess Diana|Daily pop|E! News|E! Entertainment|E!|Pop Culture|Breaking News|Breaking|Interviews|Red Carpet|Fashion|Trending|Celeb News|Gossip|Hollywood|Celebrities|Celebrity","146654","2158","368","842","https://i.ytimg.com/vi/S-271ZmmNpg/default.jpg","False","False","Was Meghan Markle silent or silenced? In the couple's highly anticipated interview with Oprah Winfrey, nothing is off limits for Harry and Meghan. Watch Daily Pop weekdays at 11am|10c, only on E!Full Story: https://www.eonline.com/news/1243400/meghan-markles-interview-with-oprah-winfrey-features-a-subtle-nod-to-princess-diana#PrinceHarry #ENews #DailyPop #MeghanMarkle #OprahWinfreySubscribe: http://bit.ly/enewssubSubscribe to Daily Pop The PODCAST: http://linktr.ee/dailypopAbout Daily Pop:Come for the Hollywood headlines, stay for the hot takes and juicy gossip. Our hosts discuss, dissect, and debate the biggest pop culture topics of the day. New uploads every weekday!About E! News:The E! News team brings you the latest breaking entertainment, fashion and Pop Culture news. Featuring exclusive segments, celebrity highlights, trend reports and more, the E! News channel is the only destination Pop Culture fans need to stay in the know.Download The E! News App For The Latest Celebrity News and Trending Videos: https://eonline.onelink.me/yMtl/4ead5017Your favorite shows, movies and more are here. Stream now on Peacock. https://bit.ly/PeacockEEntConnect with E! News:Visit the E! News WEBSITE: http://eonli.ne/enewsLike E! News on FACEBOOK: https://www.facebook.com/enews/Check out E! News on INSTAGRAM: https://www.instagram.com/enews/Follow E! News on TWITTER: https://twitter.com/enewsPrince Harry & Meghan Markle Oprah Tell-All Sneak Peek | Daily Pop | E! Newshttp://www.youtube.com/user/enews"
"bNIMbTMsbXQ","I bought a South African motorcycle! 🇿🇦[S5 - Eps. 2]","2021-03-01T14:00:09Z","UCEIs9nkveW9WmYtsOcJBwTg","Itchy Boots","19","21.04.03","Honda CRF250L|Honda|CRF 250|Johannesburg|South africa|travel south africa|buying motorcycle johannesburg|buy Motorcycle south africa|motorcycling south africa|adv rider|solo travel|travel solo in south africa|Honda CRF250L review","404089","38700","246","3963","https://i.ytimg.com/vi/bNIMbTMsbXQ/default.jpg","False","False","I've moved to South-Africa and my first mission (of course) is to find myself a motorcycle. Without a motorcycle, I feel like a bird with clipped wings... taking an Uber around the city is just not my thing! I booked a guesthouse in Bryanston, a very posh neighbourhood of Johannesburg, because it's at walking distance from a motorcycle shop called Fire it Up. They sell second hand motorcycles, and that's exactly what I need. It didn't take long before I found myself a new partner in crime to start Season 5 with!! Gear & Equipment that I use in this season: https://www.itchyboots.com/bikers-guide/gear-and-equipment-for-itchy-boots-season-5Follow my journey on: INSTAGRAM:   https://www.instagram.com/itchybootstravelFACEBOOK:     https://www.facebook.com/itchybootsBLOG:              https://www.itchyboots.com#honda #crf250L #itchyboots"
"B-WcMzYp_Ns","WE'RE HAVING A BABY","2021-03-01T12:54:46Z","UCfbshD56lsI6cM-TjTVQ-3A","Jim Chapman","26","21.04.03","jim chapman|vlog|fun|funny|british|youtuber|vlogger|United Kingdom (Country)|Video Blog (Website Category)|jim|chapman|daily|main channel|main|channel|daily vlog|fashion|style|men|baking|cocktail|making|make|how to|gadget|unboxing|tech|mens|man|guys|guy","100328","7799","42","915","https://i.ytimg.com/vi/B-WcMzYp_Ns/default.jpg","False","False","Sarah's Instagram: @Sarah.TarletonMy Instagram: @JimChapman•Please leave me a comment and give a thumbs up. It means a lot•SUBSCRIBE http://bit.ly/1kV3htg•WEBSITE http://jimchapman.co.uk•TWITTER https://twitter.com/jimchapman•INSTAGRAM https://instagram.com/JimChapman•FACEBOOK http://facebook.com/OfficialJimChapman•ADDRESSCare of Gleam Futures3rd Floor,20 Triton Street,Regents Place,London.NW1 3BF•BUSINESS ENQUIRIES Ryan.Lamont@gleamfutures.com"
"imNWC5Eq9OA","Jack Harlow - Route 66 feat. EST Gee [Official Video]","2021-03-01T19:00:13Z","UC6vZl7Qj7JglLDmN_7Or-ZQ","Jack Harlow","10","21.04.03","jack harlow|jack rapper|harlow rapper|private garden|jack Harlow confetti|new jack Harlow|Louisville rapper|rapper from Louisville|Kentucky rapper|white rapper|jack harlow what’s popping|jack harlow what’s poppin|jack harlow whats popping|jack harlow whats poppin|whats poppin song|confetti|sweet action|tyler herro|jack harlow tyler herro|whats poppin|est gee|route 66|thats what they all say|bitch im from kentucky|jack harlow dixie chicks","1006893","61042","787","4014","https://i.ytimg.com/vi/imNWC5Eq9OA/default.jpg","False","False","'Thats What They All Say' is OUT NOW!Stream/Download: https://JackHarlow.lnk.to/ThatsWhatTheyAllSayFOLLOW JACK HARLOWWebsite: https://www.jackharlow.us/Instagram: https://JackHarlow.lnk.to/InstagramTwitter: https://JackHarlow.lnk.to/TwitterFacebook: https://JackHarlow.lnk.to/FacebookLISTEN TO JACK HARLOWYoutube: https://JackHarlow.lnk.to/YouTubeSoundCloud: https://JackHarlow.lnk.to/SoundCloudSpotify: https://JackHarlow.lnk.to/SpotifyApple: https://JackHarlow.lnk.to/AppleThe official YouTube channel of Generation Now and Atlantic Records artist Jack Harlow. Subscribe for the latest music videos, performances, and more.SUBSCRIBE TO JACK’S YOUTUBE: https://JackHarlow.lnk.to/YouTube#JackHarlow"
"x4HzgVb9lfU","TRAVELiNG w/ 16 KiDS!! *WE LOST THEM!!* 😨","2021-03-01T18:29:01Z","UC-_KiH_Z2yerhAD_cAjAMOA","Not Enough Nelsons","1","21.04.03","notenoughnelsons|not enough nelsons|large family|big family|traveling with kids|not enough nelsons house tour|not enough nelsons christmas|not enough nelsons adopted|flying with kids|family|fun|vlog|vacation|packing|traveling|flying|airplane|shuttle run|what not to do|mask wearing for kids|plane|traveling children|traveling disasters|funny kids|cute families|mormon bloggers|mormon vloggers|mormon vlogs|packing for vacation|packing tips|packing hacks","315312","12710","126","0","https://i.ytimg.com/vi/x4HzgVb9lfU/default.jpg","True","False","#FlyingWithKids This by far was THE MOST STRESSFUL part of the TRiP!! Packed littles masks in the bottom of the bag, wrong seat assignments, Beckham throwing a fit because the bag check was holding his shoes, and then the BEST part!!... We get SEPARATED and can't get back for TWO HOURS!!! *Note to self: Make sure your Airport Car rental company for your THREE Vans is Actually AT THE AIRPORT! 😱WATCH MORE: https://www.youtube.com/channel/UC-_KiH_Z2yerhAD_cAjAMOA?sub_confirmation=1OUR OTHER CHANNELS:NEN FAM!! : https://www.youtube.com/channel/UCoN7jbN54AaJXj7TcFZikCw?sub_confirmation=1JUST KASS AND SISTERS!!  https://www.youtube.com/channel/UCMCMjTKUqJ1pUzmHnKrmiCA?sub_confirmation=1CHECK OUT OUR MERCH!! https://notenoughnelsons.com/Welcome to Not Enough Nelsons! We Post a NEW video every FRIDAY and SATURDAY and NOW Mommy Makeover MONDAYS!! We are the NOT ENOUGH NELSONS FAMILY! We are a big family of 18! We always get asked if they are all ours!!? 7 are biological and 9 are adopted! SO YES!! THEY ARE ALL OURS!! We sure love each one of our 16 kiddos! We hope you enjoy our videos! We have had a blast filming them! (except for the occasional meltdowns) Follow along with our crazy family on this great youtube adventure! Our videos consist of Vlogs of our crazy life, Dancing, Skits, and Challenges Etc.! We post EVERY Friday Saturday and Mondays! SUBSCRIBE FOR MORE FUN VIDEOS!MOM- Tiffany DAD- Benji OUR KIDS:Kenn- 23 yrs oldKass- 21 yrs oldBridger- 21 yrs oldJourNee- 22  yrs oldTrey- 19 yrs oldJaine- 18 yrs oldLiLee- 14 yrs oldSaiDee- 13 yrs oldNayVee- 12 yrs oldLuke- 11 yrs oldPaisLee- 9 yrs oldDeLayNee- 9 yrs oldPresLee- 7 yrs oldElleCee- 7 yrs oldBeckham- 5 yrs oldLedger- 16 Months!!Music: final cut pro free music, youtube audio free music, Artlist .io, Bensound, ZapsplatCategoryEntertainment, Epidemic Sound"
"cFdqsoUhsRg","YOU Have 3 Minutes To Spend $20,000","2021-03-01T20:10:58Z","UCWZmCMB7mmKWcXJSIPRhzZw","Miniminter","24","21.04.03","simon|sidemen|miniminter|mm7games|random|vlog","707023","58067","316","1634","https://i.ytimg.com/vi/cFdqsoUhsRg/default.jpg","False","False","Go to https://expressvpn.com/miniminter to take back your internet privacy TODAY and find out how you can get 3 months free.Make sure you check out all these people's streams:Eleanor: https://www.twitch.tv/eleanorw18Luke: https://www.twitch.tv/itswainyMahnkopf: https://www.twitch.tv/mahnkopfMinzo: https://www.twitch.tv/minzogamingHazz: https://www.twitch.tv/manlykhazzJess: https://www.twitch.tv/hoosierjessLiv: https://www.twitch.tv/peachylivvMooster: https://www.twitch.tv/moosterr_OceanReef: https://www.twitch.tv/oceanreefGoatii: https://www.twitch.tv/goatiii_If you have an idea you would like to see, let me know here:https://docs.google.com/forms/d/e/1FAIpQLSfrqSDycG6GevuJD7gGvfHsa3O-qdbTTyZjV-Lr3tjoP5hXLQ/viewform?usp=sf_linkSecond Channel: https://goo.gl/acaMTtTwitter: https://goo.gl/ugsA1YFacebook: https://goo.gl/S7X2XQSidemen Clothing: https://goo.gl/8RLHBRSidemen Book: https://goo.gl/wqFrjSMy PC: http://bit.ly/miniminterCustom Controller: http://bit.ly/SideCCUKHOW I RECORD MY GAMEPLAY: http://e.lga.to/mmWHERE I GET MY CHAIR:UK: http://goo.gl/35aEHxUSA: https://goo.gl/BbkxsFMusic from: https://www.youtube.com/user/NoCopyrightSoundsMusic from MediaMusicNow.co.ukVideo uploaded bySimon/Miniminter/mm7games"
