video_id,title,publishedAt,channelId,channelTitle,categoryId,trending_date,tags,view_count,likes,dislikes,comment_count,thumbnail_link,comments_disabled,ratings_disabled,description
"jjp-XqIk6Ek","Fortnite Item Shop *RARE* ZADIE IS BACK! [March 1st, 2021] (Fortnite Battle Royale)","2021-03-02T00:04:02Z","UCIZP6nCTyU9VV0zIhY7q1Aw","I Talk","20","21.04.03","fortnite battle royale|fortnite commentary|italkfortnite|fortnite item shop|fortnite new|fortnite funny|itf|fortnite chapter 2|season 5|fortnite season 5|item shop fortnite|fortnite zadie skin coming back|fortnite item shop today|item shop|item shop right now|zadie skin fortnite|fortnite item shop right now|zadie skin coming back fortnite|new item shop|item shop today|fortnite zadie skin|zadie skin returning fortnite|fortnite zadie skin returning","328304","12131","162","2525","https://i.ytimg.com/vi/jjp-XqIk6Ek/default.jpg","False","False","Fortnite Item Shop right now on March 1st, 2021.Let's see what's in the Item Shop today!If you would like to support me with Support A Creator, be sure to use code ITF. You can use that code in the Fortnite Item Shop and the Epic Games Store! Thank you for all the support, it really means a lot to me! #EpicPartnerI Talk is a Fortnite YouTube channel, talking about all things Fortnite Battle Royale! We discuss everything from leaks, patch notes, updates, thoughts and opinions, and any other topics that are relevant! I also do daily Item Shop videos everyday, so if you want to see something that's currently in the Item Shop, you can see that I upload every single day for the Item Shop.---Get Connected---Subscribe to my YouTube Channel: https://www.youtube.com/channel/UCIZP6nCTyU9VV0zIhY7q1Aw?sub_confirmation=1Follow me on Twitter: https://twitter.com/ThisIsITalkFollow me on TikTok: https://www.tiktok.com/@imitalkThumbnails made by CrazyShark, check him out here: https://t.co/vKVkQVmqn8"
"gBGoDmLMe3U","Post Malone - Only Wanna Be With You (Pokémon 25 Version)","2021-02-28T01:00:23Z","UCOhtMAg7xh8wv_wUHMgFc-Q","PostMaloneVEVO","10","21.04.03","Post Malone|Posty|Pokémon|Only Wanna Be With You|Pokémon 25|Hootie|Hootie and the Blowfish|virtual concert","4528090","186681","3863","11603","https://i.ytimg.com/vi/gBGoDmLMe3U/default.jpg","False","False","Only Wanna Be With You – Pokémon 25 Version by Post Malone, from the virtual concert celebrating 25 years of Pokémon. Get the song here: https://postmalone.lnk.to/OWBWY​Pre-save Pokémon 25: The Album here: https://bit.ly/37Obb8O​►Follow Post Malone online: https://www.postmalone.com​ https://instagram.com/postmalone​ https://twitter.com/postmalone​ https://facebook.com/postmalone​ https://tiktok.com/@postmalone​ https://snapchat.com/add/postmalone​►Follow Pokémon online: www.pokemon.com.25 https://facebook.com/Pokemon​ https://twitter.com/Pokemon​ https://instagram.com/pokemon​ https://youtube.com/user/pokemon​#Pokemon25​ #PostMalone​ #P25Music​ #Pokemon© Republic Records, a division of UMG Recordings, Inc.© Pokémon 2021http://vevo.ly/xbFWJc"
"7oxlCKMlpZw","An Afternoon with Prince Harry & James Corden","2021-02-26T05:56:28Z","UCJ0uqCI0Vqr2Rrt1HseGirg","The Late Late Show with James Corden","24","21.04.03","The Late Late Show|Late Late Show|James Corden|Corden|late night|late night show|comedy|comedian|celebrity|celeb|celebrities|CBS|joke|jokes|funny|funny videos|funny video|humor|hollywood|famous","15267020","471472","13848","38292","https://i.ytimg.com/vi/7oxlCKMlpZw/default.jpg","False","False","Now that the Duke and Duchess of Sussex are settled into Southern California, James Corden thought it was time to show his friend Prince Harry the sights. From tea on an open top bus to visiting the Fresh Prince of Bel Air mansion, Prince Harry gets the tour he never dreamed of. Special thanks to Spartan for providing an incredible Spartan Race Obstacle Course to run. Learn more: spartan.comMore Late Late Show:Subscribe: http://bit.ly/CordenYouTubeWatch Full Episodes: http://bit.ly/1ENyPw4Facebook: http://on.fb.me/19PIHLCTwitter: http://bit.ly/1Iv0q6kInstagram: http://bit.ly/latelategramWatch The Late Late Show with James Corden weeknights at 12:35 AM ET/11:35 PM CT. Only on CBS.Get new episodes of shows you love across devices the next day, stream live TV, and watch full seasons of CBS fan favorites anytime, anywhere with CBS All Access. Try it free! http://bit.ly/1OQA29B---Each week night, THE LATE LATE SHOW with JAMES CORDEN throws the ultimate late night after party with a mix of celebrity guests, edgy musical acts, games and sketches. Corden differentiates his show by offering viewers a peek behind-the-scenes into the green room, bringing all of his guests out at once and lending his musical and acting talents to various sketches. Additionally, bandleader Reggie Watts and the house band provide original, improvised music throughout the show. Since Corden took the reigns as host in March 2015, he has quickly become known for generating buzzworthy viral videos, such as Carpool Karaoke."
"L5_693YB4N8","Wales  v England (40-24) | Guinness Six Nations HIGHLIGHTS | ITV Sport","2021-02-27T19:17:21Z","UCBzDz6beXDfMtfxQdEutD_w","ITV Sport","17","21.04.03","Six Nations|6 Nations|Guinness Six Nations|Rugby|Rugby Union|Six Nations 2021|Highlights|Trylights|ITV Rugby|ITV Sport|Owen Farrell|Eddie Jones|Twickenham|England|England rugby|Anthony Watson|Ellis Genge|Kyle Sinckler|Elliot Daly|George Ford|Wales|Welsh Rugby|Josh Adams|Louis Rees-Zammit|Wayne Pivac|Liam Williams","115230","867","70","1219","https://i.ytimg.com/vi/L5_693YB4N8/default.jpg","False","False","Subscribe to ITV Sport: https://www.youtube.com/itvsport?sub_confirmation=1Wales won the Triple Crown and moved two victories away from a Guinness Six Nations Grand Slam after dismissing England 40-24 at the Principality Stadium.While Wales secured the first major silverware of head coach Wayne Pivac’s reign in bonus-point fashion, his opposite number Eddie Jones saw England’s title hopes reduced to ruins.Like, follow and subscribe to ITV Sport:YouTube: https://www.youtube.com/itvsportTwitter: https://www.twitter.com/itvrugbyInstagram: https://www.instagram.com/itvrugby"
"PohpFZZ-bMI","Billie Eilish: The World’s A Little Blurry - Live Premiere Event","2021-02-28T18:35:45Z","UCiGm_E4ZwYSHV3bcW1pnSeQ","Billie Eilish","10","21.04.03","[none]","1564283","219597","1327","16885","https://i.ytimg.com/vi/PohpFZZ-bMI/default.jpg","False","False","Watch the Live Premiere Event for Billie Eilish: The World’s A Little Blurry, a new Apple Original Film, featuring a conversation with Zane Lowe and a special performance. Watch the film exclusively on Apple TV+. https://apple.co/theworldsalittleblurryApple TV+ is available on the Apple TV app including iPhone, iPad, Apple TV, iPod touch, Mac, select Samsung, LG, Sony and VIZIO smart TVs, Amazon Fire TV and Roku devices, Chromecast with Google TV, PlayStation and Xbox consoles, and at tv.apple.com. Just look for the Apple TV app and if you don’t have it go the App Store on your device and download it. If you’ve bought an Apple device like an iPhone, iPad or MacBook recently, you have Apple TV Plus included already. The new Apple Original Film Billie Eilish: The World’s A Little Blurry” tells the true coming-of-age story of the singer-songwriter and her rise to global superstardom. From award-winning filmmaker R.J. Cutler, the film offers a deeply intimate look at this extraordinary teenager’s journey, at just seventeen years old, navigating life on the road, on stage, and at home with her family, while writing, recording and releasing her debut album “WHEN WE ALL FALL ASLEEP, WHERE DO WE GO?”  The documentary is from Apple Original Films, in association with Interscope Films, Darkroom, This Machine and Lighthouse Management & Media. Directed by R.J. Cutler and starring Billie Eilish, Finneas O’Connell, Maggie Baird, and Patrick O’Connell as themselves.  Follow Billie Eilish: Instagram: https://www.instagram.com/billieeilish​ Facebook: https://www.facebook.com/billieeilish​ YouTube: https://www.youtube.com/BillieEilish​TikTok: https://www.tiktok.com/@billieeilishTwitter: https://twitter.com/billieeilish​ Email: http://smarturl.it/BillieEilishEmail​  Shop “The World’s A Little Blurry” collection: http://store.billieeilish.com   Follow Apple TV: Instagram: https://instagram.com/AppleTV​ Facebook: https://facebook.com/AppleTV​ Twitter: https://twitter.com/AppleTV​ Giphy: https://giphy.com/AppleTV​ More from Apple TV: https://apple.co/32qgOEJ​ Subscribe to Apple TV’s YouTube channel: https://apple.co/AppleTVYouTube​  Apple TV+ is a streaming service with original stories from the most creative minds in TV and film. Watch now on the Apple TV app: https://apple.co/_AppleTVapp​  #BillieEilish​ #TheWorldsALittleBlurry​ #Documentary"
"7J52mDjZzto","Heat Pumps: the Future of Home Heating","2021-02-28T15:03:55Z","UCy0tKL1T7wFoYcxCe0xjN6Q","Technology Connections","28","21.04.03","[none]","595429","41013","382","5821","https://i.ytimg.com/vi/7J52mDjZzto/default.jpg","False","False","It's so cold that it's hot.I referenced a lot of old videos in this one. Here they are, in clickity linkity form!Chest Freezers; What they tell us about designing for Xhttps://youtu.be/CGAhWgkKlHIOld-fashioned rice cookers are extremely cleverhttps://youtu.be/RSTNhvDGbYIReusable handwarmers that get hot by freezinghttps://youtu.be/Oj0plwm_NMsI also made passing references toForced-air Furnaces: The What, Why, and Howhttps://youtu.be/lBVvnDfW2XoandPortable Air Conditioners - Why you shouldn't like themhttps://youtu.be/_-mBeYC2KGcTechnology Connextras (the second channel that stuff goes on sometimes):https://www.youtube.com/channel/UClRwC5Vc8HrB6vGx6Ti-lhATechnology Connections on Twitter:https://twitter.com/TechConnectifyThe TC Subreddithttps://www.reddit.com/r/technologyconnectionsThis channel is supported through viewer contributions on Patreon. Thanks to the generous support of people like you, Technology Connections has remained independent and possible. If you'd like to join the amazing people who've pledged their support, check out the link below. Thank you for your consideration!https://www.patreon.com/technologyconnectionsAnd thank you to the following patrons!Christopher Beattie, Help I'm trapped in a driver's license factory Roberts, Samuel Kirzner, Daniel Pritchard, Brandon Tomlinson, Eric Loewenthal, Jeremy Samuels, Malcolm Miles, David L Jones, Matthew Burket, Andrew Roland, Smith8154 , Kenneth Siewers Møller, jacob kamphaus, Slysdexia , HurleyPotter, Tommy McCarthy, Andrew Bobulsky, On Ice Perspectives, TheGreatCO , Petteri Hjort, Daniel DeLage, Nathan Obuchowski, Shaun Puzon, Bret Holmes, Vlycop, Casey Blackburn, Devon Hodgson, Zimpan , Filmmaker IQ, Jan Houben, Bren Ehnebuske, T.J. Zientek, Vernon , Ton Brands, Scott Wright, Kory Howard, rezonant , Thanasis Dimas, Adam Quartarolo, Marc Grondin, HexTheDragon, Craig Kollai, Daniel Barrera, Mark Stradling, Peter Sodke, Dee Dub, joseph , Kristian Scheibe, BigMcLargehuge510, Andrew Liendo, Nick , The Masterpiece, Sterling , Chris Cody, Jason Portwood, Chad Fertig, Joseph Houghtaling, Ben Tucci, Josh Braun, Joe Johnson, Daniel Dugger, Christopher Lowell, Oleg Korsunskiy, Michael Sacchi, Ali Elam, Dan Allen, Zhenbang Xiao, Jason Watson, Markus Towara, Barky doggo, Ectra , Martin Embeh, Reid Fishler, Daniel Meagher, Joel , Clemens , Bill Bates, Centronias , Dennis Walsh, Alex Warren, Paul Robins, Michael Gernoth, CanyonMID , Les , Keenan Finucan, Ian Clanton-Thuon, Ryan Pratt, Paul Newton, Greg Golds, Theo Keeler, Tyler Alberico, Ben Ratner, WildMartin, Paul Sharp, Craig Brickey, Zidy , Brandon , Karl Kornel, Danila Fediashchin, Adam , Patryk Majewski, Ryan Kamphuis, WB , AmbientCyan , Sam Calandra, Wolfgang Gschwendtner, Józef Sokołowski, Will Preston, Christopher Olson, RexRath, Kor Nielsen, Stephen Amar, Bryce , Andy24x, David Jeroslow, Charles MacDonald, Tim Jones, Crisco762 , Phil E, AnsulFolf , Jack Mudge, Raymond Coutts, Ian Spence, John De Witt, Mike A, Alex Dodge, hipp1eguy , Justin Derleth, El Jefe, NEON725 , Emily Eisenberg, Mark Christian, Dylan Leblanc, Bard , Megan Lovett, LGR, kn0tsin , David Wulff, FirstWizardZorander, Michael Riegel, Paul Kavanagh, Isaac Clarke, Sean Hearrell, selectric, Keithius , Julian Haldenby, Seb Bacanu, Mauricio , Hunter Thornsberry, Austin C Borger, Gabe Cook, Anapan, Hodgkin LeBlanc, Michael Patron, Sonic Ether, mike quick, Calisto, Adam , Lucas , microserf , Daniel Kraut, John de Largentaye, Luka Sanzin, Peter Hillier, PeterH , William Holt, Ethan Hamel, Grant Campau, Else , Michael Dunn, Kenny, Richard Hicks, Atlas Pup, Levi Maaia, Mike Roach, Simon Janssen, Jorge Caballero, Matthew Schwartz, gs , ashka , Mr. Yan, Matthias Feist, RedR0ze , adan c, Thomas Fuchs, Markus Wüst, Alan Holland, Dan Boulden, Phiroze Dalal, Devin Rosenthal, Ray Hardman, G Cowell, Kevin Hamilton, Chase Tarson, Chris D'Arpa, Marshall Kurtz, Matt Goldman, Hurf Durr, shaun morris, Miguel Gonzalez, Bryce Ontiveros, Kenneth A Cusson, Johnathan Reale, Charles Corbin, Simon Arrow, Brett Walton, Martin Schröder, John Van Atta, lakewalk3r , Hayden McAfee, Dan Maku, Mark Injerd, Paul Demers, Michael Sandler, Jacob Harrington, Clay , Benjamin Deming, Thorbjörn Meyer, Eben  Lowe, M1GEO , Michael Kaegler, Chrno , Colin Macdonald, Shlomi Borovitz, Krispin, Jan Borcherding"
"xO1_JJnh1vs","WHO WANTS TO BUY THE OLD ACE FAMILY HOUSE!?!?","2021-02-27T20:06:27Z","UCWwWOFsW68TqXE-HZLC3WIA","The ACE Family","22","21.04.03","who wants to buy the old ace family house|the ace family who wants to buy the old ace family house|ace family who wants to buy the old ace family house|ace family house|old ace family house|new house|new house tour|the ace family|ace family|ace family house tour","2339136","116995","4333","9553","https://i.ytimg.com/vi/xO1_JJnh1vs/default.jpg","False","False","WHO WANTS TO BUY THE OLD ACE FAMILY HOUSE!?!?CLAIM YOUR FREE BOX HERE: https://hybe.com/i/aceThanks again to my boys at Hybe for sponsoring this video. Don’t forget to check out Hybe and click the link above for a free box and 10% bonus on your first deposit! WHO WANTS TO BUY THE OLD ACE FAM HOUSE?”**ACE FAMILY MERCH HERE: http://shopacefamily.comhttps://www.youtube.com/watch?v=EOgOEQJBdsUJOIN THE ACE FAMILY & SUBSCRIBE: http://bit.ly/THEACEFAMILY *TURN ON OUR POST NOTIFICATIONS FOR SHOUTOUTS IN OUR VIDEOS****BUSINESS INQUIRIES : INFO.THEACEFAMILY@GMAIL.COMMAKE SURE YOU LIKE, COMMENT, SHARE & SUBSCRIBE TO OUR YOUTUBE CHANNEL AND FOLLOW US ON OUR FAMILY ADVENTURES!WATCH MORE VIDEOS!!! VLOGS: https://youtube.com/playlist?list=PLq...PRANKS: https://youtube.com/playlist?list=PLq...CHALLENGES: https://youtube.com/playlist?list=PLq...POPULAR VIDEOS: https://youtube.com/playlist?list=PLq...LATEST VIDEOS: https://youtube.com/playlist?list=PLq... STALK US :)"
"KN0IfCtY3Cg","We Put Our ENTIRE Team in ONE Game of Fortnite...","2021-02-27T13:42:46Z","UCXrExb1m3VjR0m1_l9luxRQ","PWR","20","21.04.03","PWR|Team PWR|Lachlan|Lachy|Looter|Worthy|Radius|Fortnite|Epic Games|Fortnite Lachlan|Fornite Lachy|Battle Royale|Esports|gaming|competitive gaming|Chanzes|Power|Team|challenge|Overstrand|Vindooly|Muz|Aftr","516067","29239","205","1367","https://i.ytimg.com/vi/KN0IfCtY3Cg/default.jpg","False","False","Thanks to Nvidia and MSI for hooking up the PWR team with the 360hz monitors & RTX3080s!Check out DLSS and Reflex on the Nvidia RTX3080https://www.nvidia.com/en-us/geforce/graphics-cards/30-series/rtx-3080/Check out the MSI 360Hz Gaming Monitor https://www.msi.com/Landing/oculux-nxg253rCheck out the MSI Infinite X RTX 30 Series Gaming Desktophttps://www.msi.com/Desktop/MEG-Infinite-X-10XCheck out the PWR Launch Drop | https://PWR.supplySubscribe to PWR | https://bit.ly/PWRsubscribePWR:❱ Twitter | https://twitter.com/TeamPWR❱ Instagram | https://instagram.com/TeamPWR❱ TikTok | https://www.tiktok.com/@PWR❱ Twitch | https://twitch.tv/TeamPWRgg❱ Facebook | https://facebook.com/TeamPWRgg❱ Website | https://teampwr.ggPWR Content Creators:❱ Lachlan | https://youtube.com/Lachlan❱ Chanzes | https://www.youtube.com/channel/UCMb5KCfOLIYZNQzD3622c-Q❱ Vindooly | https://www.youtube.com/Vindooly❱ Overstrand | https://www.youtube.com/OverstrandtvPWR Pro-Players:❱ Looter | https://youtube.com/Looter❱ Worthy | https://youtube.com/Worthyy❱ Radius | https://youtube.com/Radiusyt❱ Muz | https://www.youtube.com/channel/UCkuxeMoxm--pyTtU25cFgygPWR Creative:❱ DolphinDom | https://www.youtube.com/user/DomAnt20Aquatic❱ Wert | https://www.youtube.com/user/skatastimouri❱ KKSlider | https://www.youtube.com/channel/UCamRaC6JyLF1feuiAK498twPWR Production:❱ Aftr | https://www.youtube.com/channel/UCUbbs_ggmE95ItSFL7gDAMQ (Designer)Music: ❱ Epidemic Sounds | https://bit.ly/EpidemicSoundsPWR"
"EpaLbYFVfbQ","“Wind” Full SparkShort | Pixar","2021-02-26T20:00:43Z","UC_IRYSp4auq7hKLvziWVH6w","Pixar","1","21.04.03","Pixar|Disney|Disney Pixar|Pixar Movie|Animation","2478554","113439","1531","4207","https://i.ytimg.com/vi/EpaLbYFVfbQ/default.jpg","False","False","Pixar Animation Studios and the SparkShorts filmmakers of WIND are in solidarity with the Asian and Asian American communities against Anti-Asian hate in all its forms. We are proud of the onscreen representation in this short and have decided to make it widely available, in celebration of what stories that feature Asian characters can do to promote inclusion everywhere.Pixar Instagram: https://www.instagram.com/pixar/Pixar Twitter: https://twitter.com/pixarPixar Facebook: https://www.facebook.com/pixar Copyright: (C) Disney•Pixar"
"MurHt7Sxhyk","We Bought A “Superbike” From Amazon For £300: How Bad Is It?","2021-02-28T10:00:07Z","UCuTaETsuCOkJ0H_GAztWt0Q","Global Cycling Network","17","21.04.03","amazon|amazon bike|cheap bike|knock off bike|open mould bike|amazon super bike|super bike|superbike|top end bike|budget bike|heavy bike|lightweight bike|premium bike|budget super bike|amazon cheap bike|GCN|Global Cycling Network|Sports|Cycling|Bike|Bikes|Bicycle (Product Category)|Road Bike|Cyclist|Road Bicycle|GCN Cycling|velo|oliver|bridgewood|alex|paton|sec-feature|sca15|ꗶ|n1|Ղ|ཋ|ሙ|ସ|ଙ|ホ|ケ|ළ|Ա|Ժ|Լ|Ծ|Ձ|ፕ15|ュ|ዮ|4255","256757","5779","161","1124","https://i.ytimg.com/vi/MurHt7Sxhyk/default.jpg","False","False","You don't have to spend loads of money to get yourself a really good road bike. Loads of brands trickle technology down through their range so even their entry level bikes perform brilliantly; without breaking the bank! However, there are some bikes out there that just seem a bit too good to be true. With this in mind, we spent £300 on an Amazon Superbike to see what it was like!What do you think of our £300.00 Superbike? Nice or Supernice? Have your say over on the GCN App: https://app.globalcyclingnetwork.com/wt27Subscribe to GCN+ for cycling as you have never seen it before! Live racing, shows & cycling adventure films: https://gcn.eu/plusCheck out the GCN App: https://gcn.eu/appVisit the GCN Shop - Shop Now: https://gcn.eu/5deSubscribe to GCN: http://gcn.eu/SubscribeToGCNRegister your interest in the GCN Club: https://gcn.eu/5dd#Cycling #GCN #RoadBike Would you ride our £300 Superbike? Let us know in the comments below!Sign up to the GCN newsletter https://gcn.eu/3K7Join our Facebook community: http://gcn.eu/FBCommunity If you enjoyed this video, make sure to give it a thumbs up and share it with your friends. 👍Watch more on GCN...📹  TT Bike VS Recumbent: https://gcn.eu/5bnMusic - licensed by Epidemic Sound:ES_Behind the Line - Tigerblood JewelES_Touchdown - Donell MaseES_Unite! - Donell MasePhotos: © Velo Collection (TDW) / Getty Images & © Bettiniphoto / http://www.bettiniphoto.net/The Global Cycling Network (GCN) is the largest and fastest-growing online cycling channel in the world, bringing together a global community of road cyclists to celebrate everything that’s great about the world of cycling. Our videos bring fans compelling daily content including expert tutorials, techniques, training, racing, cutting-edge bike tech, unparalleled behind the scenes event coverage, humour,  entertainment, and more. Presented by ex-pro riders, GCN offers a uniquely qualified insight into the world of cycling, and most importantly it’s fuelled by our passionate and enthusiastic fans – everyone who makes up the GCN community. We also bring you the latest and greatest tech to your attention, showcase the best places in the world to ride and get exclusive access to events and races. Welcome to the Global Cycling Network | Inside #cyclingThanks to our sponsors:Castelli Clothing https://gcn.eu/CastelliGiro Helmets https://gcn.eu/GiroPinarello Bikes https://gcn.eu/PinarelloZipp Wheels: https://gcn.eu/ZippEnervit Nutrition: https://gcn.eu/EnervitTopeak Tools: http://gcn.eu/TopeakCanyon Bikes: http://gcn.eu/-CanyonPirelli Tyres: https://gcn.eu/PirelliOrbea Bikes: http://gcn.eu/OrbeaVision Wheels: http://gcn.eu/VisionWahoo Fitness: http://gcn.eu/Wahoo-Fitness Park Tool: http://gcn.eu/-parktoolElite Bottles: https://gcn.eu/EliteBottlesWhoop Fitness: https://gcn.eu/WhoopKomoot: https://gcn.eu/komootSelle Italia: https://gcn.eu/SelleItaliaGCN Japan: https://gcn.eu/subscribe-gcn-japanGCN Italia: https://gcn.eu/GCN-ItaliaSuscribirse a GCN en Español: http://gcn.eu/SuscribirseThe GCN Club - http://gcn.eu/clubYouTube Channel - http://gcn.eu/gcnYTFacebook - http://gcn.eu/gcnFbInstagram - http://gcn.eu/GCNInstaTwitter - http://gcn.eu/gcnTWGMBN Tech - http://gmbn.tech/subscribeGCN Tech - http://gcntech.co/subscribeEMBN - http://embn.me/subscribeLeave us a comment below!"
"4nwRKWqwbYA","I Survived 300 Days in HARDCORE Minecraft...","2021-02-27T12:15:00Z","UCFrVj6wBM42y3XuKCAj8n5A","SB737","20","21.04.03","minecraft|gaming|sb737|sb minecraft|sb|let's play|minecraft hardcore|hardcore|surviving 100 days|100 days|100 days hardcore|minecraft 100 days|300 days|300 days hardcore|minecraft 300 days|surviving 300 days","982505","39245","532","4354","https://i.ytimg.com/vi/4nwRKWqwbYA/default.jpg","False","False","200 DAYS HARDCORE VIDEO: https://youtu.be/y7v_o3eVdW4►Subscribe Here: http://goo.gl/0JbOQk►Leave a LIKE if you Enjoyed!►Follow me on Twitter: https://twitter.com/sb_737In this Minecraft video I survive 300 days in a Minecraft Hardcore world. Here are all the things I accomplished, and all the adventures that I had. Raid Farm Tutorial I used: https://youtu.be/s3jqhajiT-cGunpowder Farm Tutorial: https://youtu.be/N8eIs_JtakQThanks to  @Luke TheNotable for the idea! https://www.youtube.com/user/Creolesbackfire►Watch me stream Minecraft LIVE: http://twitch.tv/SB737►Become a Channel Member - https://www.youtube.com/channel/UCFrVj6wBM42y3XuKCAj8n5A/join►UK and EU Store - https://teespring.com/stores/sb737-eu-store►US Store - https://teespring.com/stores/sb737-us-store"
"QIAjZwzl2I4","16 Types Of People Watching Disney+","2021-02-28T13:00:09Z","UCGwcH4qnJ2qM_ZJUSFcAMAA","JianHao Tan","23","21.04.03","jianhao tan|jian hao tan|jianhao|the jianhao tan|thejianhaotan|jian hao|jianhaotan|kim lee|singapore|singaporean|youtuber|youtubers|youtube|disney+|Netflix|television|tv|streaming|sitcom|wandavision|iron man|captain America|types of people watching Disney+|disney|disney plus|trailer|Marina Bay Sands|launch|Denise|tasha|Kevin","702608","41513","610","5402","https://i.ytimg.com/vi/QIAjZwzl2I4/default.jpg","False","False","Disney+ has just launched and we are obsessed over the shows! What’s on your watchlist? Download Disney+ now: http://www.disneyplus.com/en-sgFeaturing:JianHao: https://www.instagram.com/thejianhaotan Kevin: https://www.instagram.com/kaleidoscovinVincent: https://www.instagram.com/itsvincentsinRidhwan: https://www.instagram.com/ridhwannabeDebbie: https://www.instagram.com/debbwieTasha: https://www.instagram.com/tashh6Denise: https://www.instagram.com/denisesoongeelynJasmine: https://www.instagram.com/jasminelhrDirector: Ridhwan AzmanProducer: Amander LiewExecutive Producer: Jianhao TanEditor: Ridhwan AzmanCinematographer: Nurhakim SuhaimiCamera operator: Danial RonWritten By: JianHao Tan, Ridhwan AzmanEMAIL: For business enquiries, contact business@thejianhaotan.com directlyGet your merch now: http://www.teamtitanstore.com​ Join our Discord Server: https://discord.gg/yC9QVyh​Join our Telegram group: https://t.me/Amonghao​Titan Digital Media: https://www.titandigitalmedia.comThis video is made in partnership with Disney+ Singapore"
"jryreyEMC-g","W2S explains story behind this Vikkstar picture","2021-03-01T10:42:58Z","UCZiJzk4wTIzaqHI4FXZ_eRQ","W2SClips","22","21.04.03","W2S|wroetoshaw|shorts|sidemen|w2sclips|vikkstar|vikkstar123","648491","19285","96","409","https://i.ytimg.com/vi/jryreyEMC-g/default.jpg","False","False","W2S explains story behind this Vikkstar pictureMy Instagram: http://instagram.com/wroetoshawMy Twitter: http://twitter.com/wroetoshawMy Twitch: https://www.twitch.tv/w2sSubmit a clip: https://bit.ly/W2SClipsSubmit#Shorts"
