video_id,title,publishedAt,channelId,channelTitle,categoryId,trending_date,tags,view_count,likes,dislikes,comment_count,thumbnail_link,comments_disabled,ratings_disabled,description
"jBD3LcQu9NI","Гелик МАЙБАХ - ПОДГОТОВКА ПЕРВОМУ OFF-ROAD!","2021-03-02T14:52:17Z","UC5iYCbrAH2x3BF0yWJeH-Hg","Black & White Team","2","21.03.03","bwt|black|and|white|team|off|road|mut|угробил|испортил|offroad|off road|оффроуд|самый проходимый|гидроудар|гидро удар|проходимый|по говну|сломал|как угробить|ремонт|мотора|капитальный ремонт|капиталка|гелик|кубик|gclass|mercedes|мерседес|серс|g63|g65|g500|фома|физрук|4*4","291447","18071","536","1636","https://i.ytimg.com/vi/jBD3LcQu9NI/default.jpg","False","False","Узнай больше о SINTEC Multifreeze и купи онлайн: https://clik.cc/IrwUAКардан сделали тут - https://kardanbalans.ru (филиалы в 11 городах России) + Инстаграм https://instagram.com/kardanbalans?igshid=1fxa22flvz0kjТак же огромное спасибо ребятам из Legorage - https://www.youtube.com/channel/UC8QfWFxXAjiWYWP3XrrPYpgПодписывайтесь на новый канал - https://www.youtube.com/watch?v=YIs2lYvXibE   все проекты теперь там! если ссылка не работает - то ссылка в первом комментарии)По вопросам работы у Тимура - https://www.instagram.com/_carmeister_/по вопросам сотрудничества https://vk.com/id424427 #bwt #гелик #gclass"
"yx2laN6MmdM","Иван Жданов в прямом эфире. Проклятие Горбачёва. Армянский бунт / СТРИМ 02.03.2021","2021-03-02T19:01:47Z","UCiUVHNJV5tjLtgWtfFASRGA","Максим Шевченко","25","21.03.03","максим|шевченко|михаил горбачев|иван жданов|ФБК|СССР|Армения|Пашинян|Навальный","100499","6935","242","1234","https://i.ytimg.com/vi/yx2laN6MmdM/default.jpg","False","False","Михаилу Горбачёву исполнилось 90 лет. Вспоминаем все то, с чем ассоциируется экс-президент СССР. В Армении продолжаются акции недовольства политикой действующей власти. Устоит ли Пашинян? Каковы перспективы навальнизма? Об этом в нашем стриме расскажет директор ФБК Иван Жданов.Подписывайтесь на аккаунты Максима Шевченко в социальных сетях:Telegram - https://t.me/shevchenkomax_1 (канал «Макс атакует!»)Instagram - https://www.instagram.com/shevchenkomax/Twitter - https://twitter.com/ShevchenkomaxFacebook - https://www.facebook.com/shevchenko.maxim.leonardovichVK - https://vk.com/shevchenko.maksimЧтобы отправить сообщение в прямом эфире в суперчат, нажмите значок $ под чатом.Поддержать канал: https://www.donationalerts.com/r/shevchenkomaxliveПо всем вопросам: shevchenkomax.live@gmail.com"
"8FMaNZmQ2ks","Камеди Клаб «Вопросы к женщинам» Иван Половинкин","2021-03-02T08:00:07Z","UCsIEFXNO4bxh0hW3-_z2-0g","Comedy Club","23","21.03.03","камеди клаб|камеди|тнт|тнт онлайн|comedy|комеди клаб|камеди клаб 2020|смотреть comedy club|смотреть камеди клаб|comedy club онлайн|камеди клаб ютуб|камеди клаб смотреть онлайн|камеди клаб лучшее|камеди 2021|иван половинкин|половинкин|камеди половинкин|половинкин камеди|вопросы к женщинам|иван половинкин про жену|иван половинкин камеди клаб|вопросы|женщины|семейная жизнь|премьера|камеди вопросы","451947","15357","1396","1083","https://i.ytimg.com/vi/8FMaNZmQ2ks/default.jpg","False","False","Ваня Половинкин от лица всех мужчин.«Вопросы к женщинам». Эфир от 26.02.2021Подписывайся и смотри новые видео несколько раз в неделю!Смотри ComedyClub по пятницам в 21:00 на ТНТ.Comedy Club в соц. сетях:Youtube: https://www.youtube.com/c/ComedyClubRussiaInst: https://www.instagram.com/comedyclubru​Vk: https://vk.com/tvcomedyТик Ток - https://www.tiktok.com/@comedyclubruТелеканал ТНТ в соц. сетях:YouTube: https://www.youtube.com/c/tntonlineruInst: https://www.instagram.com/tnt_online/VK: https://vk.com/tntПроизводство: Comedy Club ProductionПавел Воля: https://www.instagram.com/pavelvolyaofficialИван Половинкин: https://www.instagram.com/polovink1n#камедиклаб #тнт #comedyclub"
"XIk8NVFhEak","БЕДНЫЙ ШКОЛЬНИК УКРАЛ БУМАЖНИК С ДЕНЬГАМИ У ГОПНИКОВ","2021-03-02T12:00:02Z","UC5Ob2zi4pkJfra-kdcmG99w","Vashchenko Live","22","21.03.03","школьник|бедный|бедный школьник|украл|школьник украл|украл деньги|украл бумажник с деньгами|гопники|украл у гопников|манифест|декстер|фильм|сериал|ващенко|макс ващенко|ШКОЛЬНИК|ШКОЛЬНИК УКРАЛ|УКРАЛ ДЕНЬГИ|ДЕНЬГИ ГОПНИКОВ|ДЕНЬГИ|деньги|БУМАЖНИК С ДЕНЬГАМИ|УКРАЛ У ГОПНИКОВ","260746","26796","330","1207","https://i.ytimg.com/vi/XIk8NVFhEak/default.jpg","False","False","БЕДНЫЙ ШКОЛЬНИК УКРАЛ БУМАЖНИК С ДЕНЬГАМИ У ГОПНИКОВКто хочет зарабатывать в авалоне: https://avalon.ltd/?ref=vaschenkolМОМЕНТ С МАНЬЯКОМ И НОЖОМ В ИСТОРИЯХ МОЕГО ИНСТАГРАМА: https://www.instagram.com/max_vashchenkoКИРИЛЛ ВЫСТРЕЛИЛ В МАНЬЯКА В МОЕМ ТЕЛЕГРАМЕ:  https://tlgg.ru/vashchenko_maxЯ ВКОНТАКТЕ: https://vk.com/max.vashchenko/Я В ТИК-ТОКЕ: http://vm.tiktok.com/8NQdKh/ОФИЦИАЛЬНАЯ ГРУППА ВК: https://vk.com/vashchenkopubПОДПИСЫВАЙСЯ ВКОНТАКТЕ : https://vk.com/max.vashchenkoМОЙ ВТОРОЙ КАНАЛ: https://www.youtube.com/channel/UC5Ob2zi4pkJfra-kdcmG99w::::::::::::::::::::::::::::::::::::::::::::::::::::::::::::::::::::::::::::::::::::::::::::::Реклама/Сотрудничество: k1noman@mail.ru::::::::::::::::::::::::::::::::::::::::::::::::::::::::::::::::::::::::::::::::::::::::::::::МОИ ВИДЕО - https://www.youtube.com/channel/UCqtzZMiZ5Bng7HCxI6154gg?sub_confirmation=1"
"5B3mZ6r7rqU","Атака Байдена против Кремля: США ввели новые санкции за Навального. DW Новости (02.03.2021)","2021-03-02T16:24:25Z","UCXoAjrdHFa2hEL3Ug8REC1w","DW на русском","25","21.03.03","Deutsche Welle|DW|Дойче велле|новости|dw russian|dw на русском|DW Новости|дойче велле на русском|дойче велле новости ютуб|Навальный колония|Навальный в тюрьме|ЕСПЧ Навальный|Навальный санкции|санкции США|санкции Байден|санкции ЕС|арест Навального|отравление Навального|дело Навального|Хангошвили|убийство в Тиргартене|Вадим Красиков|Михаил Горбачев|прививочный паспорт|прививки от ковида|путешествия по Европе|вакцинация в Израиле|бездомные в США","230491","8132","348","1240","https://i.ytimg.com/vi/5B3mZ6r7rqU/default.jpg","False","False","США ввели санкции против Кремля в связи с отравлением Алексея Навального. В черном списке - семь человек. Кроме того, вступают в силу и другие ограничения. Это первые санкции США против российских граждан после прихода Джо Байдена. Он заявил об ужесточении курса по отношению к Москве. Выступая на Мюнхенской конференции по безопасности, Байден обвинил Кремль в атаках на западные демократии. Он также считает, что Путин пытается подорвать трансатлантическое единство. По сообщениям из администрации США, американские спецслужбы подозревают, что к отравлению Навального причастны люди, связанные с ФСБ. Как сообщается, меры согласовывались с ЕС. В тот же день вступили санкции, введенные в связи с делом Навального Евросоюзом.В этом выпуске00:00 - DW Новости с Вячеславом Юриным00:05 - США и ЕС вводят новые санцкии против Кремля01:11 - Что рассказывают о колонии, в которую отправили Навального03:14 - Новые сведения о причастности российских властей к убийству в берлинском Тиргартене06:52 - Михаилу Горбачеву исполнилось 90 лет10:44 - Станет ли прививочный сертификат пропуском для путешествий по Европе13:58 - Как Израиль добился успехов по вакцинации населения16:46 - Как волонтеры спасают бездомных в США#Навальный #Байден #санкции--------------------------------Больше новостей на нашем сайте http://www.dw.com/russianв Facebook https://www.facebook.com/DWrussianTwitter https://twitter.com/dw_russianи Telegram https://t.me/dwglavnoe"
"g44MIFm7d7A","Тизер Человек-Паук 3 // Черный Супермен // Фильм Mass Effect // Район №10 | НОВОСТИ КИНО 03_1","2021-03-02T17:12:54Z","UCIupfj3rki6dfjQqFKbXzMA","Cut The Crap","1","21.03.03","котокраб|cut the crap|катзекреп|человек-паук 3|нет пути домой|джокер|снайдеркат|черный супермен|супермен","221111","17617","305","922","https://i.ytimg.com/vi/g44MIFm7d7A/default.jpg","False","False","Покупай в Ситилинк: https://bit.ly/3bTJGM8Поздравь Cut The Crap с Днем Рождения - http://www.donationalerts.ru/r/cutthecraptvПраздничный стрим - https://youtu.be/nNfEY8-cP-cЧПВТ Сокол и Зимний Солдат - https://youtu.be/TiKo46pbGq8Арт Джокера с обложки от мегаталантливого Ellejart - https://www.instagram.com/ellejart/Я в клабхаусе - kotokrabsМой инстаграм - http://instagram.com/kotokrabsИнстаграм Cut The Crap - https://www.instagram.com/cutthecraptvНаш телеграм - http://t.me/cutterpool Группа вк - http://vk.com/CutTheCrapTVFacebook - http://facebook.com/cutthecraptvTwitter - https://twitter.com/cutterpoolCoub - http://coub.com/cutthecraptvМоя личная страница в вк - http://vk.com/timberm4nМой лайф канал - http://bit.ly/CutTheCrapLIFEМой канал о путешествиях - http://bit.ly/Miles_AwayМой игровой канал - https://youtube.com/КотокрабЧто показали в трейлере - https://goo.gl/BDw5bNТеории - https://goo.gl/aGzs24Неужели - https://goo.gl/rwkxjQМои мнения о фильмах - https://goo.gl/2xEZWeМы режем киноленты!"
"EfFhKyH0VpE","Emanet 127. Bölüm | Legacy Episode 127","2021-03-02T18:17:38Z","UCgzdfH1fq76l0YAZnoko4DQ","Legacy","1","21.03.03","telenovela|Turkish soap|watch Turkish Drama|Turkish Drama|Günlük Dizi|Yemin İzle|Emanet|Emanet izle|emanet fragman|emanet 1. bölüm|Berat Rüzgar Özkan|Sıla Türkoğlu|Halil İbrahim Ceyhan|Yaman|seher|the promise|Legacy|Legacy watch|Melih Özkaya|Emanet turkish drama|amanat|الامانة|Gülay Özdem|emanet 127|legacy 127","702344","12345","1114","2725","https://i.ytimg.com/vi/EfFhKyH0VpE/default.jpg","False","False","Abone Ol / Subscribe: https://bit.ly/2TLyNnGYaman Kırımlı is a successful and young businessman who had a rough childhood but never gave up, on the contrary he even became stronger with every obstacle. He started his life from the bottom and became very wealthy. All he has in his world, is a family that he has to take care of after his father’s death. He closed his heart to all romantic feelings a long time ago and his only weakness is his 5-year old nephew… Little Yusuf is very well protected under his uncle’s arms, but he craves loves and sympathy. The only happy image in his mind is his aunt Seher.  Seher is a beautiful and humble girl living with her grandfather. Her life is shaken by the death of her sister who was the bride of the Kırımlı family. From now on, she has a legacy she has to take care at all costs: Her little nephew Yusuf. This adventure will arise the long hidden secrets of the Kırımlı mansion; while a whole another legacy will start to grow in Seher and Yaman's hearts. #Legacy#Emanet#SehYam#NeyinVar"
"3MiB-uW65mc","САЛАТ исчезнет за МИНУТУ","2021-03-01T09:00:01Z","UCZEqXoz7G4sPniv_hJJbVhw","Ольга Матвей","22","21.03.03","Салат|Salad (Type Of Dish)|Cooking (Interest)|новогодний салат|новогодние блюда|вкусный|еда|что приготовить на праздник|что приготовить для гостей|что приготовить на новый год|Food (TV Genre)|салаты|рецепты салатов|салат вкусно|вкусные салаты|Salad|recipe|вкусный салат|кухня|вкусняшка|как накормить семью|салат на новый год|блюдо на новый год|новый год салат|простой салат|простой рецепт|рецепт на скорую руку|салат минутка|за минутку|легкий рецепт","188553","11265","273","414","https://i.ytimg.com/vi/3MiB-uW65mc/default.jpg","False","False","Салат закусочный на любое застолье. Приятного аппетита!*************************************** Мой INSTAGRAM: https://www.instagram.com/olga_matvii/ Рецепт Ниже под Видео!!!А Также Плейлисты с Другими Рецептами на Моем Канале!*******************************************НА МОЕМ КАНАЛЕ ЕСТЬ ЕЩЕ МНОГО ВКУСНЫХ РЕЦЕПТОВ.             ПОДПИСЫВАЙТЕСЬ НА МОЙ КАНАЛ:https://goo.gl/gNtayw**************************************Новый Канал о Нашей Жизни. Влог. Подписывайтесь!!!https://goo.gl/f1cXaD******************************************* ПРИСОЕДИНЯЙТЕСЬ В СОЦ СЕТЯХInstagram: https://www.instagram.com/olga_matvii/Яндекс ДЗЕН мой канал: https://zen.yandex.ru/olgamatvey TikTok: https://www.tiktok.com/@olgamatveyКанал в Telegram: https://t.me/OlgaMatveyyОдноклассники:https://ok.ru/group/53507527147713Моя группа ВКонтакте: http://vk.com/public94593369Моя страница в Facebook:    https://www.facebook.com/vkysnueveschi/Сообщество в Google+ https://plus.google.com/u/0/communities/116298370067562231138Twitter: https://twitter.com/Dima111111************************************************************************************************************МОИ ПЛЕЙЛИСТЫ:1) Сладкие блюда. Тортики, Десерты и Разные Сладости.  Вы их просто полюбите и будете всегда готовить:https://www.youtube.com/playlist?list=PLtl_gGHV94in3XfP9C8qB-AspLhvoCKmE2) Вторые блюда, этот плейлист посвящен очень вкусным рецептам Вторых блюд и Несладкой выпечке:  https://www.youtube.com/playlist?list=PLtl_gGHV94ikJ707aLNONvIc67N6o_JYz3) Новые Блюда, в этом плейлисте,  я с вами поделюсь новинками : https://www.youtube.com/playlist?list=PLtl_gGHV94im9D4mKjz9fMLxPo4nZKviy4) Салаты - домашние рецепты, лучше вас их никто не приготовит: https://www.youtube.com/playlist?list=PLtl_gGHV94ilj1K9U7Ffs8cnFYya0p9s55) Очень Быстрые и  Простые рецепты, НО ОЧЕНЬ ВКУСНЫЕ (Дешево и сердито) :https://www.youtube.com/playlist?list=PLtl_gGHV94ilg0fSjW27ypipF7eEyMLg06)Рецепты Праздничных Блюд на Новый Год и Рождествоhttps://www.youtube.com/playlist?list=PLtl_gGHV94ikrYgYIgFZjPFa-iFNUK2FN7)Низкокалорийные Рецепты:https://www.youtube.com/playlist?list=PLtl_gGHV94imfWJv8oGFLQJWDIREGl3Qy8) Очень Вкусные Шашлыки и Еда на Гриле:https://www.youtube.com/playlist?list=PLtl_gGHV94imbxzCuQYVpPx0zoP72ZnuB9) Рецепты для поста:https://www.youtube.com/playlist?list=PLtl_gGHV94in6l6wEepfNx3SYr43aC6bj10) Варенье - вкус лета. Консервация и разная купоркаhttps://www.youtube.com/playlist?list=PLtl_gGHV94ildLWhDE-ohrjVuXX1S9ezv11) Блины и Оладушки - Лучшие мои Рецепты и Вкусные Завтракиhttps://www.youtube.com/playlist?list=PLtl_gGHV94iluwUjMhCsyHfbctUI5aBVj12) Вкусные Пироги, Пирожки и Булочки Не садись на пенек не ешь пирожокhttps://www.youtube.com/playlist?list=PLtl_gGHV94ikXL3Fstvl1bg5Xl06yAP8Z13)Пасхальный Кулич (Паска) Самые Лучшие Рецептыhttps://www.youtube.com/playlist?list=PLtl_gGHV94ikuIOpuNXLJ2P5fUjXweUGD14)Корзина на Выходные (Готовые меню):https://www.youtube.com/playlist?list=PLtl_gGHV94inET2zaNj61WU8BjhmJoQ6G15)Рецепты в Мультиварке:https://www.youtube.com/playlist?list=PLtl_gGHV94imVxEqs4PlSwfXc_CQ5kChv16) Все Плейлисты: https://www.youtube.com/user/vkysnueveschi/playlists?view=1&sort=dd&shelf_id=12***************************************Рецепт:Батон 6-7 кусочковЛуковица 1 штКукуруза 150 грМорковка по-корейски 250 грКуриная грудка  сырокопченая 250  грМайонез по вкусуУкроп***************************************По вопросам рекламы и сотрудничества: OlgaMatveiy@gmail.com#ОльгаМатвей  #Салат #salad"
"GYzi52m_xlI","#ТАНЦЕВАЛЬНАЯМУЗЫКА​​​​​♫Топ музыки Марта 2021 года  🎵 НОВИНКИ МУЗЫКИ 2021 RUSSISCHE MUSIK 2021# 63","2021-03-02T16:51:06Z","UCO7Pcfh0BOeMQlEr4K9Q9KQ","DJ Musical Profession","10","21.03.03","2020 музыка|хиты|музыка 2020|хиты 2020|русская музыка|клубная музыка|russische musik|русские хиты|русские хиты 2020|русская музыка 2020|музика 2020|музыка|новинки музыки|новинки музыки 2020|музыка 2020 русская|музыка 2020 русские хиты|хиты 2020 русские|russische musik 2020|музыка русская 2020|музыка в машину|2020|новинки музыка 2020|pop music|#ТАНЦЕВАЛЬНАЯМУЗЫКА🎵 ЛУЧШИЕ ПЕСНИ 2021- НОВИНКИ МУЗЫКИ 2021- RUSSISCHE MUSIK 2021","25341","99","8","2","https://i.ytimg.com/vi/GYzi52m_xlI/default.jpg","False","False","#ТАНЦЕВАЛЬНАЯМУЗЫКА​​​​​♫Топ музыки Марта 2021 года  🎵 НОВИНКИ МУЗЫКИ 2021 RUSSISCHE MUSIK 2021# 63💖Спасибо за просмотр💖👉Наслаждайся, не забывай любить👉Подписывайтесь на новые видео▶ ️ Нравится + Комментарий✅ + Поделиться✅ + Зарегистрируйтесь как избранноеМое Если вам нравится мое видео, пожалуйста, поставьте лайк, подпишитесь, поделитесь функцией, спасибо"
"VkuW-WOV4Ko","Турбовальный двигатель 9И56  - 70 литров расхода на 110 лошадей Как тебе такое ?","2021-03-02T08:28:16Z","UCb9_Bhv37NXN1m8Bmrm9x9w","Игорь Негода","28","21.03.03","[none]","177230","18286","184","1456","https://i.ytimg.com/vi/VkuW-WOV4Ko/default.jpg","False","False","Такого двигателя у меня еще не было. Особенность в том ,что у него отсутствует свободная турбина и мощность можно снимать прямо с ротора основной турбины. Правда через понижающий до 8000 об в мин редуктор. Используется всего одна форсунка и камера сгорания в виде улитки."
"S5im_VAWPLY","Суриштирув 2: Мирзиëев сирини ëпиш учун Шоввозсойда шоу уюштирилди","2021-03-01T17:45:13Z","UCv9n8Z9zQ8luNEOnro9D_Cg","Ozodlik Radiosi","25","21.03.03","Uzbek|islom karimov|gulnara karimova|gulnora karimova|obid asomov|обид асомов|обид|obid|rauf|parfi|paxta|bolalar mehnati|yulduz usmonova|ruslan chagayev|Uzbekistan|Tashkent|Toshkent|ozodlik|ozodlik radiosi|озодлик|Muhammad Solih|1991|UzTV|1999 yil 16 fevral|OIH|Uzbekistan islomiy harakati|Ozbekiston islomiy harakati|Tohir Yoldosh|ozodlik 2011|andijon|13 may|2005 yil 13 may|Uzbek language|Uzbeks Uzbekistan|Uzbek Khan","357985","10411","698","2799","https://i.ytimg.com/vi/S5im_VAWPLY/default.jpg","False","False","Шавкат Мирзиëев учун қурилган муҳташам Шоввозсой дам олиш зонасини оддий темир йўлчилар учун қурилган маскан деб кўрсатган Ўзбекистон темир йўллари нечта ëлғон гапирди? Бу савол жавобини Озодликнинг навбатдаги суриштирувидан билиб оласиз.Суриштирув 1: Мирзиёевнинг сири: Тоғларга яширилган қароргоҳ ва сув омбори https://www.youtube.com/watch?v=XhAc81AyAME&feature=youtu.be"
"Zi-7Dq5PdXw","2021 Gagarin Cup, Round 1, Barys 4 Metallurg Mg 7 (Series 0-1)","2021-03-02T17:42:39Z","UCwJ3S2Ix7aI1BhHexDJlmEg","КХЛ","17","21.03.03","Kontinental Hockey League (Sports Association)|Ice Hockey (Sport)|кхл|khl|Металлург Мг|Барыс|Коробкин Егор|Панюков Кирилл|Старченко Роман|Диц Даррен|Яковлев Егор К.|Мозякин Сергей|Голдобин Николай|Вароне Филип|Прохоркин Николай|Кошечкин Василий|Карлссон Хенрик","18019","276","76","463","https://i.ytimg.com/vi/Zi-7Dq5PdXw/default.jpg","False","False","1:0 - Коробкин Егор (Кошелев Семён, Голдобин Николай) 0:37 В равенстве1:1 - Панюков Кирилл (Орехов Валерий) 5:26 В равенстве1:2 - Старченко Роман (Панюков Кирилл) 13:33 В большинстве1:3 - Диц Даррен (Панюков Кирилл) 15:17 В большинстве2:3 - Яковлев Егор К. (Прохоркин Николай) 21:33 В большинстве3:3 - Мозякин Сергей (Нестрашил Андрей, Минулин Артём) 26:44 В равенстве4:3 - Голдобин Николай (Кошелев Семён) 28:03 В равенстве5:3 - Голдобин Николай (Плотников Сергей, Яковлев Егор К.) 33:24 В большинстве5:4 - Вароне Филип (Карлссон Хенрик, Диц Даррен) 36:22 В большинстве6:4 - Яковлев Егор К. 52:54 В равенстве7:4 - Прохоркин Николай (Плотников Сергей, Пашнин Михаил) 53:09 В равенствеВратари: Кошечкин Василий - Карлссон ХенрикБроски: 33 - 40Штраф: 24 - 14Вбрасывания: 44 - 31"
