video_id,title,publishedAt,channelId,channelTitle,categoryId,trending_date,tags,view_count,likes,dislikes,comment_count,thumbnail_link,comments_disabled,ratings_disabled,description
"uKPUiVuunAg","Goodbye Old Stuff! Hammer Jam is BACK! (Clash Of Clans Official)","2021-03-31T08:07:41Z","UCD1Em4q90ZUK2R5HKesszJg","Clash of Clans","20","21.07.04","clash of clans|COC|Clash of Clans Gameplay|Clash of Clans Strategy|Clash of Clans Animation|Clash of Clans Commercial|Clash of Clans Attacks|Clash of Clans Town Hall|Hog Rider|PEKKA|Clan Wars|season challenges|clan war leagues|clash on|clan game|clan games|hammer jam|clash of clans new update|coming soon|teaser|last town hall 13 challenge|town hall 13|archer queen|yt:cc=on","21126187","263960","13471","12244","https://i.ytimg.com/vi/uKPUiVuunAg/default.jpg","False","False","The Hammer Jam event is back and it's the season of upgrades! Take full advantage of the 50% Home Village building cost reduction, and get ready for the first update of the year that's coming veeeery soon! 👀Follow us on our Socials!Twitter ► https://twitter.com/ClashofClans/Instagram ►https://www.instagram.com/clashofclans Facebook ►https://www.facebook.com/ClashofClans Attack. Defend. Strategize. Download for free for mobile devices. http://supr.cl/ThisArmyFrom rage-­filled Barbarians with glorious mustaches to pyromaniac wizards, raise your own army and lead your clan to victory! Build your village to fend off raiders, battle against millions of players worldwide, and forge a powerful clan with others to destroy enemy clans.PLEASE NOTE! Clash of Clans is free to download and play, however some game items can also be purchased for real money Also, under our Terms of Service and Privacy Policy, you must be at least 13 years of age to play or download Clash of Clans.A network connection is also required.FEATURES- Build your village into an unbeatable fortress - Raise your own army of Barbarians, Archers, Hog Riders, Wizards, Dragons and other mighty fighters- Battle with players worldwide and take their Trophies- Join together with other players to form the ultimate Clan- Fight against rival Clans in epic Clan Wars - Build 18 unique units with multiple levels of upgrades- Discover your favorite attacking army from countless combinations of troops, spells, Heroes and Clan reinforcements - Defend your village with a multitude of Cannons, Towers, Mortars, Bombs, Traps and Walls- Fight against the Goblin King in a campaign through the realmChief, are you having problems? Visit http://supercell.helpshift.com/a/clas...Privacy Policy:http://www.supercell.net/privacy-policy/Terms of Service:http://www.supercell.net/terms-of-ser...Parent’s Guide:http://www.supercell.net/parents#clashofclans #hammerjam #seasonofupgrades"
"8_Z6CAqQmxU","FOLGADO 😅😠","2021-03-31T15:51:03Z","UCJDBsRxSr-sSHjLyZOeiG3g","Léo Léo","22","21.07.04","[none]","3827503","296180","13676","953","https://i.ytimg.com/vi/8_Z6CAqQmxU/default.jpg","False","False","Fala a verdade, vc é folgado ou conhece gente assim? 😆#shorts"
"9Egch-JhgCo","CR7 PERDE GOL INACREDITÁVEL, MAS DEIXA O DELE! LUXEMBURGO 1 X 3 PORTUGAL - MELHORES MOMENTOS","2021-03-30T21:02:54Z","UCs-6sCz2LJm1PrWQN4ErsPw","TNT Sports Brasil","17","21.07.04","esporte interativo|tnt sports|tnt sports brasil|eliminatórias europeia|eliminatórias copa do mundo 2022|copa do mundo 2022|qatar 2022|melhores momentos eliminatórias|melhores momentos luxemburgo x portugal|luxemburgo 1x3 portugal|luxemburgo|portugal|cristiano ronaldo|cr7|robozão|ronaldo|diogo jota|palhinha|cristiano ronaldo perde gol|virada portugal|luxemburgo 1 x 3 portugal|melhores momentos|eliminatorias copa 2022|eliminatorias|gols eliminatorias","1312886","50877","925","2625","https://i.ytimg.com/vi/9Egch-JhgCo/default.jpg","False","False","Fora de casa, Portugal voltou a vencer pelas Eliminatórias para a Copa do Mundo. Os lusitanos venceram de virada a seleção de Luxemburgo. Cristiano Ronaldo voltou a balançar as redes, mas perdeu um gol inacreditável. Assista aos jogos da Champions League, Brasileirão, Campeonato Italiano e Nations League ao vivo pelo Estádio TNT Sports! Acesse o link: https://bit.ly/3i9MLL0Acesse o portal da TNT Sports: http://www.tntsports.com.br/Canais:De Placa - http://bit.ly/2HxPlHlDe Sola - http://bit.ly/2k0Xg90EI Games - http://bit.ly/2ufcveAMFM - http://bit.ly/2KnSU6P"
"cS6h9414F_I","POUPANÇA É O MELHOR INVESTIMENTO! E OUTRAS 7 mentiras que te contam sobre guardar dinheiro","2021-04-01T15:00:26Z","UC8mDF5mWNGE-Kpfcvnn0bUg","Me poupe!","22","21.07.04","me poupe|mepoupenaweb|finanças pessoais|educação financeira|canal de finanças|nathalia arcuri|como ganhar dinheiro na internet|finanças para mulheres|nath arcuri|dinheiro|dia da mentira|poupança investimento|poupança|investir na poupança|mentiras sobre dinheiro|investir na poupança vale a pena|dinheiro na poupança|investimento em imóvel|poupança é bom","197636","21339","164","738","https://i.ytimg.com/vi/cS6h9414F_I/default.jpg","False","False","ATENÇÃO: A CHAMADA DESTE VÍDEO CONTÉM IRONIA QUE APENAS MENTES RICAS CONSEGUEM CAPTAR!Achou que enlouqueci querendo te indicar a poupança depois de anos falando que essa é uma das maiores furadas que você pode entrar, né? Neste primeiro de abril, DIA DA MENTIRA, decidi jogar a merda no ventilador e revelar TODAS AS MENTIRAS que sempre te contaram sobre INVESTIMENTOS e sobre COMO GANHAR DINHEIRO.Será que você ainda acredita em alguma delas?O Sidnelson não te conta a verdade mas EU CONTO! E agora que você já se livrou das ciladas, pegue o link deste vídeo e mande para todo mundo que ainda pode estar sendo iludindo com essas mentiras. Elas só servem para enriquecer outras pessoas!PICPAY vs NUCONTA: https://youtu.be/mtLW__9h0xEPLAYLIST SOBRE AÇÕES/RENDA VARIÁVEL: https://youtu.be/kWaEA0muVxU---Assistiu a este vídeo e gostou? A única coisa que a Nath pede é pra você se inscrever no canal! É DE GRAÇA! É só clicar aqui: https://goo.gl/jQ6ApF​Tá com perdida e perdido? Quer desabafar, agradecer, falar com a Nath e com o time da Me Poupe!?contato@mepoupenaweb.comQuer ser parceira ou parceiro da desfudência?parcerias@mepoupenaweb.comÉ da imprensa, né, minha filha?imprensa@mepoupenaweb.comQuer saber se tem uma vaguinha por aqui?https://mepoupe.gupy.io/​Aquela cartinha fofa pra Nath e pro time (sim, a gente também gosta!)Caixa Postal: 28235CEP: 01234-970Não quer assistir a Me Poupe!? Você pode ouvir!Estamos em todas as plataformas de podcast!Ouça aqui: https://lnkfi.re/poupecast​Você pode ler textos que você entende também!http://www.mepoupenaweb.com​Quer um material da riqueza pra te ajudar a se organizar? Nós também temos!https://mepoupenaweb.uol.com.br/plani​...Quer a Nath pertinho de você?Segue ela no Insta para dicas diárias:http://instagram.com/nathaliaarcuri​Quer zoeiras financeiras sem fim?Instagram da Me Poupe!https://www.instagram.com/mepoupenaweb/​Quer mesmo é dicas de tecnologia barata, né?Segue o Jobs, o nerd da Me Poupe!https://www.instagram.com/jobs.fernando/​Ahhh, seu lance é renda variável! É claro que temos!Segue o professor Mira, nosso analista CNPI:http://instagram.com/professormira​É de renda extra que você precisa?A Bruna, nossa musa da renda extra, te ensina!https://www.instagram.com/bruandriotto/​Gosta mesmo é do Facebook? Também estamos lá!http://facebook.com.br/mepoupenaweb​Ah, você é autônoma ou autônomo e quer vender mais? Se inscreve no SOS Me Poupe!https://bit.ly/3dfHHRC​Toda semana ouça o Me Poupe 89! Tocando o terror na sua vida financeira todas as segundas - às 9hs da manhã na Rádio Rock: https://goo.gl/37kFRp​Receba as nossas mensagens através do Telegram:http://t.me/mepoupenaweb​Gostou do vídeo? Curta, compartilha e assine o canal pra não perder o que vem por ai!Enriquecer faz parte da vida!Sonhe, mude de atitude, cuide do seu dinheiro e seja feliz!Assine o Canal de graça e receba as dicas de finanças sem frescura toda semana!"
"CrIFrQQJxy4","Gente.... Alguém perdeu 100 reais enrolados em um elástico? Comédia, shorts, histórias","2021-03-31T22:34:22Z","UCzPn0ZLPfE6QjiuDIBMIf2w","Marcela Star19","22","21.07.04","Gente|Alguém perdeu 100 reais|Enrolados em um elástico|Comédia|Shorts|Histórias","424396","23369","1618","115","https://i.ytimg.com/vi/CrIFrQQJxy4/default.jpg","False","False","Gente...Alguém perdeu 100,00 reais enrolado em um elástico? 😝😝😝#Comédia #shorts #histórias"
"0VoaL1wBb2s","TESTAMOS no LAGO a Mini LANCHA do JONATAN SANTOS","2021-03-31T21:00:00Z","UChFKOAbNvHnOIQp4gGQKxkQ","TDS Garage","24","21.07.04","mini|lancha|jonatan santos|renato|garcia|enaldinho|grau|caixa|d'aco|agua|rio|lago|river|gaiola|jeep|tds|garage|2 motores|camaro|hornet|600|xj6|kart|cross|viatura","156679","10008","165","273","https://i.ytimg.com/vi/0VoaL1wBb2s/default.jpg","False","False","https://www.instagram.com/tds_garage/?hl=pt-brMusic NCS  https://www.youtube.com/user/NoCopyrightSounds#tdsgarage #jonatansantos"
"veAF4XrfqvA","💥BBB21: Sarah é eliminada, Gil surta feio, ego do Rodolffo infla e Julitte manda parar de falar","2021-03-31T04:08:53Z","UC0LlPl_mWhIFqVxcH1l3xpQ","WebTVBrasileira","24","21.07.04","bbb|bbb21|big brother brasil|rede bbb|webtvbrasileira|participantes do bbb21|bbb gshow|bbb globo|bbb 21 ao vivo|bbb 21 participantes|vinheta do bbb 21|eliminação|paredão|festa|prova do lider|reality show|programa 30/03/2021|programa 30\/03\/2021|paredão triplo|big fone|anjo|anjo vermelho|jogo da discordia|xepa|vip|pipoca|camarote|quem foi eliminado do bbb21|quem saiu do bbb21|quem perdeu a prova|bate e volta bbb21|bbb 21 hoje|quem esta imune do bbb21","1018968","77507","1993","4562","https://i.ytimg.com/vi/veAF4XrfqvA/default.jpg","False","False","#HoraDaFofoca #FalandoDebbb #bbb21COMENTANDO A ELIMINAÇÃO DE SARAH \ PROGRAMA DE 30/03/2021CANAL NOVO: https://www.youtube.com/construindocomtaticeloInstagram:  @ConstruindoComTatiCelohttps://instagram.com/construindocomtaticelo?igshid=1x5pdt2e0c2xl📛Nossa nova coleção de camisetas e moletons já está disponível e com as estampas que vcs, #webtvzeiros, escolheram. Compre aqui: https://www.lolja.com.br/parceiros/web-tv-brasileira/ 👊🏼👊🏼Público: fofoca@webtvbrasileira.com💬Comercial: webtvbrasileira@play9.com.brBora COMPARTILHAR e COLABORAR para o CRESCIMENTO do CANAL👊🏻Suru-BÃO WebTVzeiros (GRUPO BATE-PAPO)http://www.discord.gg/webtvbrasileiraINSCREVA-SE: https://www.youtube.com/subscription_center?add_user=webtvbrasileira💥Se vc usa IOS, torne-se um membro do Clube WebTVBr clicando neste link: https://www.youtube.com/webtvbrasileira/joinPROGRAMAÇÃO DESTE MÊS:🔴#HoraDaFofoca AO VIVO: de Segunda a Sexta - 20h🔥#FalandoDeBBB AO VIVO: Todos os dias depois do programa da Globo  NA REDE:#WebTVBrasileiraTwitter: http://www.twitter.com/WebTVBrasileiraInstagram: https://www.instagram.com/webtvbrasileira/Facebook: http://www.facebook.com/MotionTVOficialTati MartinsFacebook Page: https://www.facebook.com/TatiMartinsOficialFacebook Perfil: https://www.facebook.com/tati.martins.31508Instagram: https://www.instagram.com/tatimartinsofficial/Marcelo CarlosTwitter: https://twitter.com/marcelowebtvFacebook: https://www.facebook.com/marceloattbi?fref=tsInstagram: https://www.instagram.com/marcelowebtv/Participantes bbb21:arthur picoli, karol conká, caio afiune, carla diaz, joão luiz pedrosa, camilla de lucas, arcrebiano araújo, bil, pocah, juliette freire, nego di, kerline cardoso, lucas koka penteado, lumena aleluia, rodolffo matthaus, gilberto nogueira, viih tube, thaís braz, projota, sarah andrade, fiuk,"
"LZFhw8vvIDg","TIAGO LEIFERT ACABA COM SARAH AO VIVO e FALA TUDO NA CARA DELA","2021-03-31T03:32:30Z","UCvBM1cCiadu8FmnybscD6tA","Mark Avila","24","21.07.04","BBB21|BBB|Big Brother Brasil|Sarah|Juliette|Juliete|Big Brother|globoplay|bbb|21|big brother|big brother brasil|Brasil|Globo|Gil|Tiago Leifert|reality show|Fiuk|pocah|projota|camilla de lucas|prova do líder|famosos|Rodolffo|Camilla de Lucas|briga|treta|líder|Nego Di|Gilberto|João|Sara|Artur|Caio|festa|Pocah|Camila|Projota|Tais|Boninho|Thais|Lumena|Viih Tube|paredão|ao vivo|ju|gil e juliette|carla dias|camila|Camilla|carla diaz|carla|joão luiz|eliminação|eliminada","270812","5664","1271","397","https://i.ytimg.com/vi/LZFhw8vvIDg/default.jpg","False","False","Me siga no Insta: @MarkAvilaOficialEliminação da Sarah ao vivo e discurso e conversa com Tiago Leifert , logo após com Ana Clara na Rede BBB e Ana Maria Braga no Mais Você ! Por que você atacou tanto a Juliette ? e Sarah ficou sem chão ! Sarah / Sara é a eliminada e revelou estar apaixonada pelo Rodolffo / Rodolfo !? A eliminação deve acontecer hoje À noite !  Humilhação ! O reality show ao vivo BBB / BBB21 / BB 21 / Big Brother Brasil da TV Globo tem Tiago Leifert de apresentador e Boninho de diretor e passa ao vivo na emissora ! Beijo / beija / festa / treta / jogo da discórdia / briga / beijaram / se beijam / beijou ! Manipulação / armação / armado / manipulado !  Big Brother Brasil , Big Brother Brasil 2020 , Big Brother Brasil 2021 , Big Brother Brasil elenco , Big Brother Brasil 21 , Big Brother Brasil ao vivo online , Big Brother Brasil hoje , Big Brother Brasil noticias , Big Brother Brasil inscrição , bbb 2020 , bbb 2021 , bbb 21 , bbb elenco , bbb noticias , bbb hoje , bbb ontem , bbb online , bbb ao vivo , bbb eliminação , bbb twitter , bbb quem sai , bbb paredão votar , bbb hj , bbb ao vivo online , bbb agora , bbb paredão enquete , bbb ao vivo agora , globo , globo play , globoplay , globoplay ao vivo , globo play ao vivo , globo ao vivo , globo noticias , globo online , globo agora .Participantes do BBB21:arthur picoli, karol conká, caio afiune, carla diaz, joão luiz pedrosa, camilla de lucas, arcrebiano araújo, bil, pocah, juliette freire, nego di, kerline cardoso, lucas koka penteado, lumena aleluia, rodolffo matthaus, gilberto nogueira / gil, viih tube, thaís braz, projota, sarah andrade, fiuk  #BBB21​ #BBB​ #Sarah"
"sVzBySxRXRw","O PATROCINADOR REVELOU O ROSTO E VAI DAR R$ 1 MILHÃO DE REAIS PRA ROXTEEN!","2021-03-31T21:00:17Z","UC4kt-PRWbwpcArLIhE26mIw","ROXTEEN","24","21.07.04","roxteen|patrocinador revelou o rosto|quem é o patrocinador|1 milhão de reais|rox teen|dinheiro|vídeo com dinheiro","688350","44263","1225","2274","https://i.ytimg.com/vi/sVzBySxRXRw/default.jpg","False","False","ROXTEEN! Finalmente o grande dia chegou! O patrocinador vai revelar o seu rosto nesse vídeo!Siga ROXTEEN nas redes sociais:INSTAGRAM: https://www.instagram.com/roxteenoficialTIKTOK: https://www.tiktok.com/@roxteenoficial"
"HOiNsKhcvv4","L7NNON - Da Boca (prod. Papatinho)","2021-03-29T18:53:47Z","UCjUOSfBPBQxjbWh1uqLvmdA","L7NNON","10","21.07.04","[none]","3989587","293650","2137","9552","https://i.ytimg.com/vi/HOiNsKhcvv4/default.jpg","False","False","Ficha Técnica Clipe: Realização: Papatunes Produção: Saga Filmes Direção: Cherry Rocha Direção de Fotografia: João Dutra 1º Ad - Michel Luz 1º Assistente de Câmera - Lucas Farias 2º assistente de câmera - Matheus Luiz Produção de elenco - Adriano Stoor Produção - Wallace Vidigal Figurino - Sophia Mota Maquiagem - Letícia Nemec Catering - Vó Vidal / Hamburgueria O Burguês Elenco Principal L7NNON DANDARA MARIANA JONATHAN AZEVEDO Stylist Dandara - Carla Garan Assistente - Sophia Mota Maquiagem Dandara - Tito Medeiros Cabelo Dandara - Raquel Vieira🎵 Ficha Técnica Música: - Composição: L7NNON - Autores: L7NNON / Papatinho  - Produção musical: Papatinho / @papatinho - Captação: Leo do Kick / @leodokick- Mix/ Master: 2F- Uflow/ @2f_uflow- Back vocal: Lary / @lary - Estúdio: Papatunes Studios, Rio de Janeiro"
"vZFes82DCFI","PEGA O PATO - Biu do Piseiro e Chinem (QUEN QUEN - Audio Oficial)","2021-03-30T00:14:50Z","UCAkrMMkC8A-eRjUgNZ3shnA","Biu do Piseiro","10","21.07.04","pato|pega o pato|quen quen|biu do piseiro|meme do pato|piseiro 2021|chinem|musica do pato|tiktok do pato|musica nova do biu|bil|patu|mais tocadas","2180442","71610","1530","1742","https://i.ytimg.com/vi/vZFes82DCFI/default.jpg","False","False","#PegaoPato #BiuDoPiseiro #QuenQuenConfira todos os sucessos do Biu do Piseiro se inscrevendo no Canal!https://www.youtube.com/biudopiseiroSiga no Instagram:https://www.instagram.com/biudopiseirooficial/PEGA O PATO, PEGA O PATO, QUEN QUEN!"
"sarlhUK7hnw","Tavin - Namoral Cansei (Prod. Ciro Daniel)","2021-03-30T21:00:13Z","UCAe6HU3wR0FCdIzkg22TgWw","Bendita Gravadora","10","21.07.04","mc sid|mc sid poesias e frustracoes|mc sid autobiografia|5696|rap df|sid freestyle|rap nacional|mc sid assalto a mao letrada|mc sid rap news|mc sid brasil de quem|bendita gravadora|tavin ish|tavin namoral cansei|tavin na moral|tavin cansei|tavin imperio|tavin vortice|tavin rap|tavin eminem|tavin slim shady|tavin ciro|tavin nerd|ciro vs|isso vale minha vida|tavin isso vale minha vida|tavin eminente|tavin batalha|tavin kid|tavin criança","235953","38541","315","1499","https://i.ytimg.com/vi/sarlhUK7hnw/default.jpg","False","False","Música na Moral Cansei, do Artista TavinNa Moral Cansei:Letra: Namoral eu canseiMinha vida tá complicadaMinha mãe reclama que só ela faz tudo em casaMinha professora quer me estudar pela NASAOntem eu levei a filha dela como lição de casa Meu pai, anda muito ocupado no trampoMinha vó é preocupada e quer saber por onde eu andoAcha que eu virei noia e que agora eu tô fumandoMas se eu fumasse foda-se, ninguém ia estar ligando Meus fãs, dizem que eu to abandonando o rapO Sid quer me demitir pq eu sou um mlkEu entro no estúdio com o Ciro e meto uma diss trackE boto na conta da Bendita 5 Big Mac Acho que depois disso esse é meu último somO Ciro sempre fala que minha voz tá fora do tomE que o sample do Nissin Ouhfali não fica bomPorra só confia no pai que nisso aqui eu tenho dom Pq eu sou um garoto especialCom cara de menino de comercialQue não tá nem ligando pro colegialE dizem que adolescente é sempre igual(2x) O público acha que eu tenho mó cara de ricoMas eu sou sofredor, meu banheiro não tem pinicoMinha familia é só pérolas, igual loja de brincoEu tenho um primo alcoólatra e o outro é talaricoEu já fiz merda pra uns mcsEu não sei como ainda não tomei dissOu são muito gente boa ou não quisMas quem não gosta de mim, c mom gimme a kissMeu prod. Ciro finge ser um gringo no InstagramGama em mina asiática e sonha em ser um onii-chanTo escrevendo essa letra 5:30 da manhãDepois de lançar isso eu vou ser caçado até no IrãMúsica: Na Moral CanseiAutor: TavinProdução Musical: Ciro DanielGravação: Bendita Gravadora Audiovisual:Direção: Henrique FranzosiFotografia: Adão MuroProdução Executiva: Henrique Franzosi e Isabella BrasilDireção de Arte: Marina FrecchianeProdução: Henrique FranzoskFotografia Still: Isabella BrasilLocação: Aicon Acoes CinematograficasLogger: Isaac AiconEletrica: Marcos RamosNerd #1: TavinNerd #2: CiroAgradecimentos Especiais a Adriana Freire e Messias Filho!"
"2qrEG0aUy3c","VOU COMPRAR UM NOVO JET SKI PARA MIM 😍","2021-03-31T14:00:01Z","UChMJkHCD2wdvSO7CMOuLR-w","Renato Garcia","24","21.07.04","RENATO GARCIA|RENATO DA XJ6|RENATO|CAMARO|DAILY VLOG","936112","123524","1139","5723","https://i.ytimg.com/vi/2qrEG0aUy3c/default.jpg","False","False","Minha Loja: https://www.lojarenatogarcia.com.br/ ●Instagram: https://www.instagram.com/renatogarciayt●Twitter: https://twitter.com/renatogarciayt●Facebook: https://www.facebook.com/renatogarciayoutubeJOGO DOS CAÇADORES DE LENDAS PARA BAIXAR NO SEU CELULAR!GOOGLE PLAY: https://tinyurl.com/y3ta982bAPPLE STORE: https://tinyurl.com/y2lnoaaeME ENVIE PRESENTES ! Caixa Postal: 8748CEP: 86020980LONDRINA - PR MercadoLivre: https://eshops.mercadolivre.com.br/LOJARENATOGARCIAMEU SEGUNDO CANAL: https://www.youtube.com/channel/UClUN2J5hwEsE6_sKW3SPlMg●Contato para parcerias e eventos: renatogarcia.comercial@gmail.com"
"tfML0f6cl_4","PESSIMA NOTICIA SOBRE A GRAVIDEZ!! Gravidez de risco","2021-03-30T15:56:10Z","UCOJA63FBCg1pCrRqruxEfIw","Loving Couple","24","21.07.04","gravidez|gravidez de risco|estou gravida|gravida|minha gravidez é de risco|priih gamaa gravida","409968","34892","917","2215","https://i.ytimg.com/vi/tfML0f6cl_4/default.jpg","False","False",""
"6FW-glAaTKU","reclaiming power : Dancing with the Devil","2021-03-30T19:00:16Z","UCZkURf9tDolFOeuw_4RD7XQ","Demi Lovato","24","21.07.04","[none]","7338848","213113","6526","9827","https://i.ytimg.com/vi/6FW-glAaTKU/default.jpg","False","False","“You really find out who’s there for you when the world falls out from under your feet.”Demi goes to rehab and begins her road to recovery, but with bumps along the way. As she returns to the stage for the first time since her overdose, she needs to find balance in her life.Resources: SAMHSA Hotline for individuals and family members facing mental health and/or substance use disorders1-800-662-HELP (4357) TTY: 1-800-487-4889  National Sexual Assault Hotlinewww.rainn.org1-800-656-HOPE (4673) Or if you need immediate support, please reach out to your local crisis text line:USA: Text HOME to 741741UK: Text SHOUT to 85258Canada: Text CONNECT to 686868 or 741741 For mental health education and resources go to Hope for the Day at hftd.org  Learn how to save lives at endoverdose.net.Production Companies: OBB Pictures, SB FilmsDirector: Michael D. RatnerExecutive Producers: Michael D. Ratner, Scott Ratner, Scooter Braun, Allison Kaye, Scott Manson, Kfir Goldberg, Miranda Sherman, Andy MiningerListen to Demi Lovato’s new song, “Dancing With The Devil”: https://demilovato.lnk.to/DWTD/youtubemusicPre-order Demi Lovato’s new album ‘Dancing With The Devil… The Art Of Starting Over’ https://DemiLovato.lnk.to/DWTDTAOSOID"
"fxrBn4kLhx0","🔥DESTRUÍDA: Sarah CAI NA REAL AO VIVO! Se desculpa de PODRE e Ana Maria NÃO ALIVIA! Mais Você Sarah","2021-03-31T14:00:32Z","UCJJIQ6h9ZY4uLUx9CZ2BrMw","Já contei? por Ju Nogueira","24","21.07.04","reality|show|famosos|celebridades|ju nogueira|ja contei|fofoca|treta|babado|babados dos youtubers|ontem|hoje|amanha|polemica|bbb21|sarah eliminada|SARAH rodolffo|bbb21 ao vivo|bbb21 agora ao vivo|plantao bbb21|plantao ao vivo|plantao|ao vivo|bbb21 web|sarah ana maria braga|sarah mais voce|sarah na ana maria braga|sarah pandemia|sarah fala pandemia|sarah ve video gil|sarah ve video rodolffo|sarah ve video juliette|sarah ana maria braga mais voce completo","656937","41829","829","3292","https://i.ytimg.com/vi/fxrBn4kLhx0/default.jpg","False","False","#BBB21 #PLANTÃOBBB21 #JÁCONTEIBBB21E como de costume Sarah participou do Café com o Eliminado na Ana Maria Braga e AO VIVO descobriu os podres que ela falou e as declarações dela no BBB21, Sarah ficou chocada com as revelações envolvendo o Rodolffo e Juliette, e Ana Maria Braga NÃO ALIVIOU. Nessa manhã Gil MUDA O VISUAL E CHOCA. Vem que eu te conto tudo!Participantes BBB21:Arthur Picoli, Karol Conká (RECORDE DE REIJEIÇÃO 99,17%) , Caio Afiune, Carla Diaz (44,96%), João Luiz Pedrosa, Camilla de Lucas, Arcrebiano Araújo -O BilL (64,89%) , Pocah, Juliette Feire, Nego Di (98,76%) , Kerline Cardoso (83,5%), Lucas Penteado (DESISTIU), Lumena Aleluia (61,31%) , Rodolffo Matthaus, Gilberto Nogueira, ViihTube, Thaís braz, Projota, Sarah Andrade (76,76%), FiukSEJA MEMBRO E TENHA ACESSO A BABADOS EXCLUSIVOS: https://www.youtube.com/channel/UCJJIQ6h9ZY4uLUx9CZ2BrMw/join🔹🔔 Já Contei? por Ju Nogueira: Tudo que acontece na internet você encontra AQUI EM PRIMEIRA MÃO E SUPER EXPLICADO! (tim tim por tim tim que fala?!) ESTÁ ESPERANDO O QUÊ? SE INSCREVE AGORA E FIQUE POR DENTRO DE TUDO QUE ACONTECE NA INTERNET! 🔺 E TEMOS CAIXA POSTALCaixa POSTAL 15CEP 96750-000Butiá/RSSARAH MAIS VOCÊ ANA MARIA BRAGASARAH MAIS VOCÊ ANA MARIA BRAGASARAH MAIS VOCÊ ANA MARIA BRAGASARAH MAIS VOCÊ ANA MARIA BRAGASARAH MAIS VOCÊ ANA MARIA BRAGA"
"xBF8I9cqxI4","POSITIVO! UM NOVO MEMBRO NA FAMILIA! AAAAAAAAAAAAAA","2021-03-30T21:00:13Z","UCgdnrd2Ae_H07_N8j1l18Xw","Dani Russo Tv","24","21.07.04","dani russo|'dani|russo|tv|danivlogs|dani vlog|membro|filho|gravida|gravidez|segredo|revelacao|positivo","321048","25301","1709","1803","https://i.ytimg.com/vi/xBF8I9cqxI4/default.jpg","False","False","https://youtu.be/6eJp7wauYxcContato Profissional: danirussotv.publicidade@gmail.com"
"xJy3echykZI","UM REACT FORMOU UM CASAL? - ELES REAGIRAM AS ROLIMPÍADAS - PAULO MATHIAS (JOVENS REAGEM)","2021-03-30T14:30:05Z","UC3GB6W8SyUw6IAhSuqULdGw","Janela da Rua","24","21.07.04","janela da rua|jovens reagem|rolimpiadas|paulo mathias|zezão|react|reaction|reação|kranio|eles reagiram as rolimpiadas","669724","75902","472","3021","https://i.ytimg.com/vi/xJy3echykZI/default.jpg","False","False","O João tá fazendo Lives, quem quiser participar é só seguir lá: https://bit.ly/3cYm5dFReact dos jovens ao Paulo Mathias reagindo aos jovens reagindo ao Paulo Mathias, Zezão e Kranio nas Rolimpiadas. Confuso? Eu sei... Canal Paulo Mathias: https://www.youtube.com/user/SkullGamerGRNosso instagram: https://goo.gl/TSzTkc Fotos diárias dos membros e muita zoação! Presentes no vídeo:Alessandra - 18 anos @Ale.ZambelliFernando - 21 anos @garoto_da_toucaLucas - 16 anosEduardo - 19 anos @dudichiesEduarda - 17 anos @YunidudaCanal da Eduarda: https://www.youtube.com/channel/UCH-I7K3MnkAlKek2jKY1sRwLarissa - 22 anos @laricostaq Canal da Larissa: https://www.youtube.com/channel/UCp33ZVjZ34qA6r2MuYRUJawTwitch da Larissa: https://bit.ly/3sr02nd"
