video_id,title,publishedAt,channelId,channelTitle,categoryId,trending_date,tags,view_count,likes,dislikes,comment_count,thumbnail_link,comments_disabled,ratings_disabled,description
"TMjgM3l5l3M","Brawl Stars Animation - The #GoldarmGang Heist","2021-04-07T07:38:23Z","UCooVYzDxdwTtGYAkcPmOgOw","Brawl Stars","20","21.07.04","brawl stars|mobile game|mobile strategy game|mobile rpg|mobile battle royale|battle royale|supercell game|goldarmgang|belle|squeak|wild west|brawl pass","4203918","331238","3094","18316","https://i.ytimg.com/vi/TMjgM3l5l3M/default.jpg","False","False","Download NOW!! ►► https://supr.cl/playbrawlBe a BRAWLER! Subscribe! ►► https://supr.cl/subscribe#GoldarmGang #Brawlstars #BelleFast-paced 3v3 multiplayer and battle royale made for mobile! Play with friends or solo across a variety of game modes in under three minutes.Unlock and upgrade dozens of Brawlers with powerful Super abilities, Star Powers and Gadgets! Collect unique skins to stand out and show off. Battle in a variety of mysterious locations within the Brawliverse!BATTLE IN MULTIPLE GAME MODES- Gem Grab (3v3): Team up and out-strategize the opposing team. Collect and hold 10 gems to win, but get fragged and lose your gems.- Showdown (Solo/Duo): A battle royale style fight for survival. Collect power ups for your Brawler. Grab a friend or play solo - be the last Brawler standing in the rowdiest battle royale yet. Winner take all!- Brawl Ball (3v3): It's a whole new Brawl game! Show off your soccer/football skills and score two goals before the other team. There are no red cards here.- Bounty (3v3): Take out opponents to earn stars, but don’t let them pick you off. The squad with the most stars wins the match!- Heist (3v3): Protect your team’s safe and try to crack open your opponents’. Navigate the map to sneak, blast and blow your way clear to the enemies treasure.- Special Events: Limited time special PvE and PvP game modes.- Championship Challenge: Join Brawl Stars' esports scene with in-game qualifiers!UNLOCK AND UPGRADE BRAWLERSCollect and upgrade a variety of Brawlers with powerful Super abilities, Star Powers and Gadgets! Level them up and collect unique skins.BRAWL PASSComplete quests, open Brawl Boxes, earn Gems, pins and an exclusive Brawl Pass skin! Fresh content every season.BECOME THE STAR PLAYERClimb the local and regional leaderboards to prove you’re the greatest Brawler of them all!CONSTANTLY EVOLVINGLook out for new Brawlers, skins, maps, special events and games modes in the future.PLEASE NOTE! Brawl Stars is free to download and play, however, some game items can also be purchased for real money. If you don't want to use this feature, please disable in-app purchases in your device's settings. Also, under our Terms of Service and Privacy Policy, you must be at least 9 years of age to play or download Brawl Stars.Features:- Team up for real-time 3v3 battles against players from across the world- A fast-paced multiplayer battle royale mode made for mobile- Unlock and collect new, powerful Brawlers - each with a signature attack and Super ability- New events and game modes daily- Battle solo or with friends- Climb to the top of the leaderboards in global and local rankings - Join or start your own Club with fellow players to share tips and battle together- Customize Brawlers with unlockable skins- Player-designed maps offer challenging new terrain to masterFrom the makers of Clash of Clans, Clash Royale and Boom Beach!Support:Contact us in-game via Settings, Help and Support — or visit http://supercell.helpshift.com/a/brawl-stars/Privacy Policy:http://supercell.com/en/privacy-policy/Terms of Service:http://supercell.com/en/terms-of-service/Parent's Guide:http://supercell.com/en/parents/???:https://www.youtube.com/wkbrl"
"bph5Tlzj0C4","Amor de Mãe: capítulo 123, quarta, 7 de abril, na TV Globo","2021-04-07T13:45:03Z","UCEPRQVF6hxGGM9gi1ELaWHg","TV Globo","24","21.07.04","Globo|Rede Globo|TV|novelas|amor de mãe|chamada|capítulo de hoje|lourdes|rigena cazé|chai suede|xai suede|shai suede|shay suede|chay suedi|chai suedi","96970","5803","62","342","https://i.ytimg.com/vi/bph5Tlzj0C4/default.jpg","False","False","No capítulo de hoje, Lurdes (Regina Casé) finalmente encontra Danilo (Chay Suede) e conta a ele que é seu filho, Domênico. Assista à chamada!Veja tudo sobre 'Amor de Mãe' em https://globoplay.globo.com/amor-de-m...​Se inscreva no canal e fique por dentro de tudo sobre a TV Globo:https://bit.ly/3cCEwFY​Nos acompanhe também em outras redes! Facebook: https://www.facebook.com/tvglobo​Instagram: https://www.instagram.com/tvglobo​Twitter: https://twitter.com/tvglobo​Pinterest: https://br.pinterest.com/redeglobo​Visite também o nosso site: https://redeglobo.globo.com/​​​​#AmorDeMãe​​​ #novela​​​ #tvglobo​​"
"jl6wdN2aSt8","🔥 RODOLFFO é HUMILHADO em ENTREVISTA com ANA CLARA e ACUSA JULIETTE Está fazendo personagem BBB21","2021-04-07T05:45:14Z","UCUlLpAC2QoQ5UsU08mPXVUQ","Bora Comentar","24","21.07.04","diego schueng|fora de hora tv|noticias da tv|fofocas|noticias dos famosos|ao vivo|live|bora comentar|bora comentar ao vivo|diego|diego ao vivo|diego tv|web tv brasileira|hora da fofoca|bbb21|bbb21 ao vivo|falando de bbb|noticias do bbb|big brother brasil 21|bbb21 no ar","259164","15354","690","1006","https://i.ytimg.com/vi/jl6wdN2aSt8/default.jpg","False","False","📢 O que você achou? 🍪 Deixe o 👍 • Inscreva-se! ✓ e clique no 🔔 para ser NOTIFICADO quando estivermos 🔴 AO VIVO! Siga no Insta 💛 https://instagram.com/diegoschueng 🟡📌 #DiegoSchueng #Entrevista #BBB21👥REDES SOCIAIS:Diego Schueng 🤪🅵 facebook:https://www.facebook.com/diegoschueng📸 instagram:http://instagram.com/diegoschueng🐦 twitter:http://twitter.com/diegoschueng#BoraComentar 📺🅵 facebook:https://www.facebook.com/boracomentartv📸 instagram:https://www.instagram.com/boracomentartv🐦 twitter:https://www.twitter.com/boracomentartv👉🏽 Conheça meu outro canal com vlogs e minha vida pessoal:🎬 http://youtube.com/diegoschuengPalavras Chave: Bora Comentar com Diego Schueng, Diego Schueng ao vivo, Fora de Hora TV, FHTV, BBB21, noticias dos famosos, noticias da celebridades, lista do bbb21, noticias do big brother brasil 21, bbb 2021, bbb ao vivo, big brother brasil ao vivo"
"78QltZcT7Ws","O Legado de Júpiter | Trailer oficial | Netflix","2021-04-07T13:00:00Z","UCc1l5mTmAv2GC_PXrBpqyKQ","Netflix Brasil","24","21.07.04","Josh Duhamel|Mark Millar|ação|drama|drama netflix|heróis|jupiter's legacy|millarworld|netflix 2021|o legado de júpiter|super|super-herói|super-heróis netflix|série Netflix|teaser|trailer|trailer netflix|trailer oficial","104320","10608","156","660","https://i.ytimg.com/vi/78QltZcT7Ws/default.jpg","False","False","Nenhum legado é eterno.A primeira geração de super-heróis protegeu o mundo por quase um século. Agora, é a vez de seus filhos lutarem pelos mesmos ideais. Uma criação de Mark Millar, “O Legado de Júpiter” estreia em 7 de maio, só na Netflix.Não perca O Legado de Júpiter, só na Netflix: https://www.netflix.com/JupitersLegacy Inscreva-se: https://bit.ly/31ynwtwSobre a Netflix:A Netflix é o principal serviço de entretenimento por streaming do mundo. São 204 milhões de assinaturas pagas em mais de 190 países com acesso a séries, documentários e filmes de diversos gêneros e idiomas. Quem assina a Netflix pode assistir a quantos filmes e séries quiser, quando e onde quiser, em praticamente qualquer tela com conexão à internet. Assinantes podem assistir, pausar e voltar a assistir a um título sem comerciais e sem compromisso. O Legado de Júpiter | Trailer oficial | Netflixhttps://youtube.com/NetflixBrasil"
"3sO-Y1Zbft4","Twenty One Pilots - Shy Away (Official Video)","2021-04-07T17:11:05Z","UCBQZwaNPFfJ1gZ1fLZpAEGw","twenty one pilots","10","21.07.04","twenty one pilots|twenty one pilots scaled and icy|twenty one pilots shy away|shy away official|shy away official video|top shy away|shy away scaled and icy|twenty one pilots official|don't you shy away|twenty one pilots trend|twenty one pilots SAI|tyler joseph|josh dun|21pilots|21pilots shy away|top official video|new twenty one pilots|scaled and icey|shyaway|twenty one pilots livestream|twenty one pilots new album|twentyonepilots","871943","265049","660","38578","https://i.ytimg.com/vi/3sO-Y1Zbft4/default.jpg","False","False","Twenty One Pilots - Shy Away (Official Video)Twenty One Pilots official video for Shy Away from the forthcoming album Scaled And Icy, available May 21st on Fueled By Ramen.Twenty One Pilots - Livestream ExperienceMay 21 @ 8PM ET / 5PM PTTickets available at http://live.twentyonepilots.com Stream / Download Shy Away - https://top.lnk.to/SAIPre-order / Pre-Save Scaled And Icy - https://top.lnk.to/SAIDirected by Miles Cable & AJ FavicchioLYRICSWhen I get home,You better not be thereWe're placing bets you won'tShed your modestyAnd the only thing to leave behindIs your own skin on the floorDon't you shy awayManifest a ceiling when you shy awaySearching for that feelingJust like an 'I Love You'That isn't wordsLike a song he wrotethat's never heardDon't you shh...When you get homeYou barely recognize the pictures theyput in a frame'Cause you shed your modestyDon't circle the trackTake what you haveand leave your skin on the floor.Don't you shy awayManifest a ceiling when you shy awaySearching for that feelingJust like an 'I Love You'That isn't wordsLike a song he wrotethat's never heardWhen I get homeBoy, you better not be thereYou're long goneShed your modestyDon't circle the trackJust break the cycle in halfand leave your skin on the floor.Don't you shy awayManifest a ceiling when you shy awaySearching for that feelingJust like an 'I Love You'That isn't wordsLike a song he wrotethat's never heardthat's never heard...an 'I Love You'That isn't wordsLike a song he wrotethat's never heardDon't you shy away.Subscribe for more official content from twenty one pilots: https://top.lnk.to/subscribe Site: http://smarturl.it/TOPsiteStore: https://store.twentyonepilots.com Spotify: http://smarturl.it/TOPspotifyFacebook: http://smarturl.it/TOPfacebookInstagram: http://smarturl.it/TOPinstagramTwitter: http://smarturl.it/TOPtwitterTumblr: http://smarturl.it/TOPtumblr#TwentyOnePilots #ShyAway #ScaledAndIcy"
"I8I4dsvOghY","POR QUE FALEI DE SEPARAÇÃO? CONTEI TUDO - #MAQUIAEFALA","2021-04-07T15:06:13Z","UCZfId64U0uXqaSsAQCsp7Qg","Evelyn Regly","26","21.07.04","Evelyn Regly|Babados da Vida|É do Babado|Humor","148736","21466","146","1090","https://i.ytimg.com/vi/I8I4dsvOghY/default.jpg","False","False","SE INSCREVA NO CANAL http://goo.gl/1XffBSME ACHE NAS REDES SOCIAIS!!!Instagram @evelynreglyMeu Facebook EVELYN REGLYMeu Twitter @evelynreglyMeu Blog edobabado.com.br"
"oCRlkdYyjXY","CAMILA E DANIEL VOLTARAM A NAMORAR NA ROXTEEN!!! - EPISÓDIO 3","2021-04-06T21:00:16Z","UC4kt-PRWbwpcArLIhE26mIw","ROXTEEN","24","21.07.04","Roxteen|Rox teen|Casal|Meninos e meninas|Meninas|Meninos|roxteen patrocinador|Vídeo de adolescente|websérie|adolescente|amigos|com amigos|Daniel|Camila|Gabi|Luccas Neto|escola|talentos|show de dança|musical|relacionamentos adolescents|engraçado|engraçados|brincadeiras|em português|24 HORAS|brincadeira|desafio|desafios|pegadinhas|divertido|relacionamento|série teen|teen|video teen|websérie teen","733304","47072","1395","2976","https://i.ytimg.com/vi/oCRlkdYyjXY/default.jpg","False","False","A ROXTEEN está a todo vapor com os novos alunos, todos estão ansiosos pelos próximos desafios, além disso Daniel e Camila estão com dificuldades de esconder o sentimento que tem um pelo outro, mas Gabi e Raíssa não vão deixar isso barato. O que será que elas vão aprontar? Não fique de fora dessa e venha ver o que está para acontecer nesse novo episódio da ROXTEEN! #roxteen #webserie #adolescente #teen #teenagers #show #musica #talentos #teenseriesROUPAS ROX TEEN: https://www.lolja.com.br/parceiros/luccas-neto-rox-teen/FILME ACAMPAMENTO DE FÉRIAS 3: https://www.filmelier.com/pt/br/film/12770/luccas-neto-em-acampamento-de-ferias-3Disponível em todas as plataformas digitais:Now, Vivo Play, Sky Play, iTunes / Apple TV, Google Play e YouTubeOUTROS VIDEOS DA ROX TEEN:ROXTEEN - FLUORESCENTE (Clipe Oficial) Español / Português / Englishhttps://www.youtube.com/watch?v=rIRKHamWJVkENTRAMOS NA ROXTEEN OU FOMOS EXPULSOS PARA SEMPRE ? NOVOS ARTISTAS - EPISÓDIO 2https://www.youtube.com/watch?v=t-Oj4DXMuSg&t=2650sRAISSA - AUDIÇÃO ROXTEEN (APROVADA)https://www.youtube.com/watch?v=aUmjZ5qGcNEDANIEL - AUDIÇÃO ROXTEEN (APROVADO)https://www.youtube.com/watch?v=AiYsqJDWotQPRINCESA - AUDIÇÃO ROXTEEN (APROVADA)https://www.youtube.com/watch?v=PDeftl-GxgEGABI - AUDIÇÃO ROXTEEN (APROVADA)https://www.youtube.com/watch?v=NmcYGGHHW5EVICK MCKNIGHT - AUDIÇÃO ROXTEEN (APROVADA)https://www.youtube.com/watch?v=sYHElPUNSpwANA - AUDIÇÃO ROXTEEN (APROVADA)https://www.youtube.com/watch?v=lCPqIgjIMT8JAMES - AUDIÇÃO ROXTEEN (APROVADO)https://www.youtube.com/watch?v=WKycQycAE4UPETER MCKNIGHT - AUDIÇÃO ROXTEEN (APROVADO)https://www.youtube.com/watch?v=tBWs06MTyW0GABRIEL - AUDIÇÃO ROXTEEN (APROVADO)https://www.youtube.com/watch?v=R5vWOUDhfE8CAMILA - AUDIÇÃO ROXTEEN (APROVADA)https://www.youtube.com/watch?v=EewXqwa4dC8RAFAEL - AUDIÇÃO ROXTEEN (APROVADO)https://www.youtube.com/watch?v=rjywVP6JSpI"
"9nwrnctCwyE","O PAI FICOU VICIADO !! DEU RUIM ! - Família Malouca EP 23 ( WebSérie Maloucos )","2021-04-06T14:00:01Z","UCc-DqkU-dsAGocipGthDalg","Família Maloucos","24","21.07.04","familia maloucos|malucos|franjinha|webserie|wiizinho|família malouca|dor de barriga|Luizinho|francesinha|cursinho|familia|familia maluca|video game|pai ficou viciado|nintendo switch","1104005","24998","2157","856","https://i.ytimg.com/vi/9nwrnctCwyE/default.jpg","False","False","Nos Sigam no Instagram: @MALOUCOS Diretor GeralWilerson Favaro Direção de Imagem:Bruno HenriqueFernando SouzaTim Paza MayMontagem Cenografica:Daniele LeiteRoteiro:Wilerson Favaro Franciele SouzaEdição:Arthur BuscoTim Paza MayMake:Luana RodriguesAtores/Atrizes:Franciele SouzaWilerson ReisGabriel MeyerLarissa Gaino"
"cLzn-3fKoxI","FIZEMOS UMA HOMENAGEM DE ANIVERSÁRIO PARA O RENATO  * família e amigos *","2021-04-07T12:11:16Z","UCfzgzFA3WhrkowZEWjQpWkA","IRENE NÓBREGA","24","21.07.04","RENATO GARCIA|RENAN FIORINI|THIAGO REIS|LEO DA HORNET|BOQUINHA|HUNTERS SQUAD|GUI NOBRE|CAÇADORES DE LENDAS|LONDRINA|MULHER|FAMILIA|AMIGOS|FELICIDADE|ENTRETENIMENTO|COMEDIA|VLOG|FILHOS|MOTO|CARRO|CULINARIA|AVENTURA|VIAGEM|EMOÇÃO|ALEGRIA|ANIMAIS DE ESTIMAÇÃO|PET|TURISMO|LAZER|NATUREZA|YOUTUBERS DE LONDRINA|BELEZA|MANSÃO DE YOUTUBERS|VIAGEM EM FAMILIA|SUCESSO","110094","26680","108","5202","https://i.ytimg.com/vi/cLzn-3fKoxI/default.jpg","False","False","#aniversariodorenato #renatogarcia #niverdore #aniversariodorenatogarciaDeixe seu like, compartilha, comente e se inscreva no canalLink do MEU INSTAGRAM: https://www.instagram.com/irenenobreg...​Meu email comercial: irenenobregacomercial@gmail.com"
"UqTglzckcbw","Amor de Mãe: capítulo 122, terça, 6 de abril, na TV Globo","2021-04-06T16:20:54Z","UCEPRQVF6hxGGM9gi1ELaWHg","TV Globo","24","21.07.04","Globo|Rede Globo|TV|novelas|amor de mae|ultima semana|chamada|capítulo de hoje|chai suede|chay suedi|chai suedi|shai suede|shay suede|xai suede|xay suede|telma","419033","8216","315","336","https://i.ytimg.com/vi/UqTglzckcbw/default.jpg","False","False","No capítulo de hoje, Danilo (Chay Suede) descobre que Thelma (Adriana Esteves) saiu do hospital com outra criança após incêndio. E decide ir ao sítio tirar essa história a limpo. Assista à chamada!Veja tudo sobre 'Amor de Mãe' em https://globoplay.globo.com/amor-de-m...​Se inscreva no canal e fique por dentro de tudo sobre a TV Globo:https://bit.ly/3cCEwFY​Nos acompanhe também em outras redes! Facebook: https://www.facebook.com/tvglobo​Instagram: https://www.instagram.com/tvglobo​Twitter: https://twitter.com/tvglobo​Pinterest: https://br.pinterest.com/redeglobo​Visite também o nosso site: https://redeglobo.globo.com/​​​​#AmorDeMãe​​​ #novela​​​ #tvglobo​​"
"rFjJs6ZjPe8","Taylor Swift - Mr. Perfectly Fine (Taylor’s Version) (From The Vault) (Lyric Video)","2021-04-07T13:00:19Z","UCANLZYMidaCbLQFWXBC95Jg","TaylorSwiftVEVO","10","21.07.04","taylor swift|taylor|swift|mr perfectly fine|mr perfectly fine taylor swift|taylor mr perfectly fine|mr perfectly fine taylor’s version|taylor’s version|taylors version|taylor swift new album|taylor swift new music|taylor swift lyrics|fearless|fearless taylor’s version|fearless taylors version|official taylor swift lyrics|taylor rerecord|taylor reissue|taylor new version|fearless rerecord|fearless remaster|new","1258199","200666","622","27008","https://i.ytimg.com/vi/rFjJs6ZjPe8/default.jpg","False","False","Official lyric video for “Mr. Perfectly Fine” (Taylor’s Version) (From The Vault) – off her upcoming Fearless (Taylor’s Version) album. Get the album here: https://taylor.lnk.to/fearlesstaylorsversion Get the song here: https://taylor.lnk.to/mpf►Subscribe to Taylor Swift on YouTube: https://ts.lnk.to/subscribe  ►Exclusive Merch: http://taylorswift.lnk.to/store  ►Follow Taylor Swift online:Instagram: http://instagram.com/taylorswift Facebook: http://facebook.com/taylorswift Tumblr: http://taylorswift.tumblr.com Twitter: http://twitter.com/taylorswift13 Snapchat: http://snapchat.com/add/taylorswiftWebsite: http://www.taylorswift.com ►Follow Taylor Nation OnlineInstagram: http://instagram.com/taylornation Tumblr: http://taylornation.tumblr.com Twitter: http://twitter.com/taylornation13TikTok: http://tiktok.com/@taylornationOfficial Lyrics:Mr. perfect faceMr. here to stayMr. looked me in the eye and told me you would never go awayEverything was rightMr. I’ve been waiting for you all my lifeMr. every single day until the end I will be by your sideBut that was when I got to knowMr. change of heartMr. leaves me all aloneI fall apartIt takes everything in me just to get up each dayBut it’s wonderful to see that you’re okayHello, Mr. perfectly fineHow’s your heart after breaking mine?Mr. always at the right place at the right time, babyHello, Mr. casually cruelMr. everything revolves around youI’ve been Miss misery since your goodbyeAnd you’re Mr. perfectly fineMr. never told me whyMr. never had to see me cryMr. insincere apology so he doesn’t look like the bad guyHe goes about his dayForgets he ever even heard my nameWell I thought you might be different than the restI guess you’re all the sameBecause I hear he’s got his arm ‘round a brand new girlI’ve been picking up my heartHe’s been picking up herAnd I never got past what you put me throughBut it’s wonderful to see that it never phased youRepeat chorusSo dignified in your well pressed suitSo strategizedAll the eyes on youSashay away to your seatIt’s the best seatIn the best roomOh, he’s so smugMr. always winsSo far above me in every senseSo far above feeling anythingAnd it’s really such a shameIt’s such a shameCause I was Miss here to stayNow I’m Miss gonna be alright somedayAnd someday maybe you’ll miss meBut by then you’ll be Mr. too lateGoodbye, Mr. perfectly fineHow’s your heart after breaking mine?Mr. always at the right place at the right time, babyGoodbye, Mr. casually cruelMr. everything revolves around youI’ve been Miss misery for the last timeAnd you’re Mr. perfectly fineYou’re perfectly fineMr. look me in the eye and tell me you#taylorswift #mrperfectlyfine #fromthevault #fearlesstaylorsversionMusic video by Taylor Swift performing Mr. Perfectly Fine (Taylor’s Version) (From The Vault) (Lyric Video). © 2021 Taylor Swifthttp://vevo.ly/enJPdT"
"Xioh7jQY68E","👻 DEU A LOUCA NO SISU 2021!! Notas de Corte NA ESTRATOSFERA","2021-04-07T14:45:27Z","UC3KTSc6Ihj3vKI6aaYYpN_A","Umberto Mannarino","27","21.07.04","dupla classificação|classificação fantasma|sisu|sisu 2021|notas de corte|notas de corte sisu|notas de corte sisu 2021|enem|enem 2021|notas enem|lista de espera|indice f sisu|notas de corte vão aumentar|estratégias sisu|estratégias para o sisu|estratégias sisu 2021|chamada regular|primeira chamada sisu|como funciona a lista de espera|o que é o sisu|como funciona o sisu|como usar o sisu|como usar o sisu 2021|segunda chamada sisu","60536","7538","31","1772","https://i.ytimg.com/vi/Xioh7jQY68E/default.jpg","False","False","🥇 MINHA ÚLTIMA PROMOÇÃO! Mestres do ENEM Completo + Bônus INÉDITOS + Acesso Vitalício e o Preço mais Baixo DA HISTÓRIA: https://cursomestresdoenem.com.br/Neste vídeo faço uma análise detalhada das notas de corte e das classificações parciais do primeiro dia de SiSU 2021. O que já podemos observar é que houve um aumento generalizado das notas de corte com relação ao SiSU passado. Isso se deve em parte à dupla classificação (classificação fantasma) que agora se tornou a nova regra do SiSU. Infelizmente isso eleva as notas de corte de maneira artificial, tornando ainda mais incerto todo o processo do SiSU 2021.1Vamos falar também de estratégias para os próximos dias de SiSU 2021.1. Vale a pena desistir da segunda opção para ter a chance de concorrer na lista de espera da primeira? Conforme passarem os dias, serão geradas mais duas prévias até o fechamento do sistema, à meia-noite do dia 9 de abril. A tendência das notas de corte ao longo dos dias é aumentar gradativamente, mas é natural que nem todos os classificados façam a matrícula, e candidatos seguintes sejam classificados na segunda chamada.Entenda o cálculo do índice F para saber suas CHANCES REAIS de aprovação com base na sua classificação: https://www.youtube.com/watch?v=A0oC9GcaySs#ENEM #SiSU #SiSU2021"
"1YmT0TAkymc","REAGINDO AO “Não Faz Sentido - Crepúsculo” 11 ANOS DEPOIS!","2021-04-07T13:00:01Z","UCV306eHqgo0LvBf3Mh36AHg","Felipe Neto","24","21.07.04","felipe neto|irmãos neto|twilight|crepúsculo|ator|vampiro|Kristen Stewart|Robert Pattinson|Taylor Lautner|ECLIPSE|LIVRO","720011","144972","1551","9142","https://i.ytimg.com/vi/1YmT0TAkymc/default.jpg","False","False","LOJA DO CANAL - https://www.lolja.com.br/felipe-netoEsse vídeo foi um marco em minha trajetória, hoje vou reagir, passar vergonha e relembrar onde tudo começou.SEJA MEMBRO! - https://www.youtube.com/felipeneto/joinPLAYLIST DA SAGA MINECRAFT! - https://www.youtube.com/playlist?list=PLnRuoKy8h_HsnIf9BNo_a4K63jEyowJ8CVEM PARTICIPAR DO NOSSO REDDIT: https://www.reddit.com/r/netolab/"
"rvmbZilmpyM","DESCOBRINDO A GRAVIDEZ + CONHECENDO O BEBÊ ! *EMOCIONANTE* 🍼 😱😭","2021-04-05T21:05:06Z","UCZtOF_W8L82GcENIOGpSPDg","Jaqueline Sobrinho","22","21.07.04","gravidez|grávida|rotina|se arrume comigo|descobrindo|olha isso|chorei|emocionante|como fazer|como ficou|virginia|engravidei|tranformei|cabelo|hair|transformação|baby|revelando|revelação|novelinha|bebê|family|familia|namorada|namorado|casal|nascimento|nasceu|descobrindo a gravidez|surpresa|praia|amor|romantico|melhores|contando para o marido","1599184","137131","1967","0","https://i.ytimg.com/vi/rvmbZilmpyM/default.jpg","True","False","Canal da Valen: https://www.youtube.com/c/ValentinaSobrinho🔹SIGAM AS MINHAS REDES SOCIAIS : ✔️INSTAGRAM : https://www.instagram.com/jaque.sobri... ✔️PLATAFORMA DE PUBLICIDADE: https://jaquesobrinho.com.br/ ✔️TIKTOK: https://www.tiktok.com/@jaquesobrinho... ✔️MEU FACEBOOK: https://www.facebook.com/jaqueline.fs... ESPERO QUE TENHAM GOSTADO DO VÍDEOOOO! BEIJOSSS 😘"
"ncX5oiqU9g4","MC Mirella - Deu Mole (Love Funk) feat. Lais Bianchessi","2021-04-06T21:00:14Z","UC9OMsuaqvGdF0MtK3gYYNkA","Love Funk","10","21.07.04","funk|love filmes|LOVE FUNK|LOVE FUNK TV|funk 2021|mirella|MC Mirella - Deu Mole|mc mirella|mc mirella deu mole","374880","57384","572","3707","https://i.ytimg.com/vi/ncX5oiqU9g4/default.jpg","False","False","Acompanhe a playlist oficial da Love Funk no Spotify: https://bit.ly/LoveFunkPlaylist Siga nosso instagram principal: @lovefunkprodutoraSiga no instagram: @mirella@laisbianchessiUma Realização Love FilmesInscrevam-se no NOVO CANAL da LOVE FUNK:https://bit.ly/CanalRevelacaonaFavelaArtista: MC Mirella feat. Lais BianchessiMusica: Deu MoleProdução: DJ Thi MarquezStudios Love FunkAdquira já os produtos LOVE FUNKhttps://linktr.ee/lojalovefunkSHOWS: (11) 98336-9988 LOVE FUNK (Falar com Morais) @moraislovefunkoficialFicha TécnicaDireção: Rodrigo JotaceProdução: Camila SouzaProdução executiva: Rato Love FunkAssistente de Camera: Mauricio TitoEdição: Rodrigo JotaceFaça seu vídeo Clipe com a Love Filmes (11) 94904-4907 Raul @ribeiro3r(14) 99673-3237 Pedro @tonellilovefunk(11) 94776-5380 ViniFacebook da Love Funk: https://www.facebook.com/lovefunkprodutoraoficialEste videofonograma é um produto original e próprio da Gravadora e Editora. A cópia dele ou o reenvio do mesmo resultará em grandes implicações ao seu canal do youtube ou até a exclusão do mesmo.LOVE FUNK FILMES ®#LoveFunk #Mirella #DeuMoleAno 2021"
