video_id,title,publishedAt,channelId,channelTitle,categoryId,trending_date,tags,view_count,likes,dislikes,comment_count,thumbnail_link,comments_disabled,ratings_disabled,description
"cDyhqqKWDg0","Port Relocation of SpaceX Crew Dragon on the International Space Station","2021-04-05T11:28:02Z","UCLA_DiR1FfKNvjuUpBHmylQ","NASA","28","21.09.04","[none]","316784","11878","134","0","https://i.ytimg.com/vi/cDyhqqKWDg0/default.jpg","True","False","On Monday, April 5 starting at 6 a.m. EDT, watch the first-ever port relocation for a U.S. commercial spacecraft! Four astronauts will undock their SpaceX Crew Dragon Resilience from the International Space Station's Harmony module forward port, and take a short ride to redock at Harmony's zenith, or space-facing port. The autonomous relocation maneuver, taking about 45 minutes, will prepare for the arrival of NASA's SpaceX Crew-2 astronauts in late April, and the upcoming delivery of new solar arrays this summer. Astronauts Michael Hopkins, Victor Glover, and Shannon Walker of NASA and Soichi Noguchi of the Japan Aerospace Exploration Agency will be aboard the spacecraft. "
"BaaRWxLXg3g","The Last SKUNK FIGHTER | Nugget CIVIC Build (EP6)","2021-04-06T06:41:59Z","UCgJRL30YS6XFxq9Ga8W2J3A","Mighty Car Mods","2","21.09.04","mighty|car|mods|mcm|MCM|moog|marty|turbo|jdm|how|to|diy|do|it|yourself|nissan|subaru|supercharged|race","443742","21429","222","1678","https://i.ytimg.com/vi/BaaRWxLXg3g/default.jpg","False","False","Work continues on this rubbish Civic we bought off Facebook. In this episode we focus on the B16 engine, getting it ready to drop into the filthy nugget so we can drop some mad hectic FWD skids. ►GRAB AN MCM GARAGE STOOL to rest your weary legs! https://mightycarmods.com/collections/accessories/products/folding-stoolMORE MERCH HERE ►http://www.mightycarmods.com/collections/Be sure to check out the MCM Facebook Page for regular Updates►http://www.facebook.com/mightycarmods✌️ IRON ON Chopped Patch https://mightycarmods.com/collections/accessories/products/chopped-patch-iron-on👕 CHOPPED Katakana T-shirt https://mightycarmods.com/collections/clothing/products/copy-of-jdm-modified-car-shirt🔔 Hit the bell next to Subscribe so you don't miss a video!Also something to note around Mighty Car Mods: we are normal guys and are not trained mechanics. We like to make interesting car mods and show you how we've gone about it, but we can't promise that anything we show you will work for your particular car, or that you won't harm yourself, someone else, your car or your warranty doing it. Please be safe, be responsible and unless you know what you're doing, do not fool around with very serious machinery just because you've seen us make it look so easy. Talk to a qualified mechanic if you are in any doubt. Some of the products featured in this video may be supplied by sponsors. For a list of our current sponsors please go to mightycarmods.com"
"XxlsLmHwCSk","ASTRO 아스트로 - ONE M/V","2021-04-05T02:59:59Z","UC3Ea2-Ut3navgOlTfoq790g","fantagio 판타지오","24","21.09.04","fantagio|판타지오|fantagiomusic|판타지오뮤직|아스트로|ASTRO|MOONBIN|문빈|2nd Full Album|정규 2집|올유얼스|All Yours|ONE|원|티저|TEASER|JINJIN|MJ|CHAEUNWOO|YOONSANHA|ROCKY|라키|윤산하|진진|차은우|엠제이|산하|은우|MV|뮤직비디오|Music Video|ONE M/V|M/V","16852232","531040","4409","119286","https://i.ytimg.com/vi/XxlsLmHwCSk/default.jpg","False","False","#ASTRO 2ND FULL ALBUM [#All_Yours] #ONE M/V OPEN!☝️2021. 04. 05 6PM (KST) RELEASE▶ Twitter : http://twitter.com/offclASTRO​▶ Facebook : http://facebook.com/offclASTRO​▶ Instagram : https://www.instagram.com/officialastro​▶ Weibo : http://weibo.com/officialASTRO​▶ Fancafe : http://cafe.daum.net/fantagio-boys"
"J3EMz4HInF4","Why Are Award Shows So Awkward?","2021-04-05T16:30:01Z","UCuo9VyowIT-ljA5G2ZuC6Yw","Eddy Burback","23","21.09.04","[none]","538178","45176","404","2749","https://i.ytimg.com/vi/J3EMz4HInF4/default.jpg","False","False","Go to https://buyraycon.com/eddy for 15% off your order! Brought to you by Raycon.YIKES SPRING COLLECTION  - https://www.yikesshop.com/NEW CHANNEL - https://bit.ly/3edh9Ejmy twitch - https://www.twitch.tv/eddyburbackInstagram - https://www.instagram.com/eddyburbackTwitter - https://twitter.com/eddyburback"
"G1hNeVaErR8","Every Minecraft Staircase in 13 Minutes or Less","2021-04-04T15:33:17Z","UC3xZYc4SZUGfRERIvDRGqDQ","Skip the Tutorial","20","21.09.04","[none]","1957499","86672","1857","3114","https://i.ytimg.com/vi/G1hNeVaErR8/default.jpg","False","False","29 Minecraft Staircases You Can Make in 13 Minutes or Less! Did you ever wonder how many staircases you can make in 781 seconds? If so, then we are building every possible minecraft stairs system (that we could think of) in this video. Minecraft staircases can be very straightforward, or incredibly insane. So, whether it's a cake ladder, iron golem staircase, a working escalator, and more, we're talking about it today in this Skip the Tutorial list video! Let's see almost every Minecraft method for a staircase you can build, from practical to just plain crazy.▪Want more? Subscribe Today! ▶https://goo.gl/ZDDJit-OTHER LINKS-▪Follow me on Twitter ▶https://twitter.com/skipthetweets▪Join the Discord ▶https://discord.gg/eqxaSVH▪Check out my Twitch ▶https://www.twitch.tv/skipthetutorial▪Check out my Instagram ▶https://www.instagram.com/skipthetutorial/▪Character done by MagnaGallina ▶https://twitter.com/MagnaGallinaEdited by: https://haleyascharf.com​​Research and map by Jonah WaltersFootage collected by Frankie Mundo------Texture Pack: Vanilla Tweaks https://vanillatweaks.net/picker/resource-packs/------Some music used in this video is courtesy of Mewmore. Make sure to follow their tracks at https://www.youtube.com/user/Mewmore------Portions of this video are copyrighted and owned by Nintendo, and their use is allowed by the Nintendo Game Content Guidelines for Online Video & Image Sharing Platforms (https://www.nintendo.co.jp/networkservice_guideline/en/index.html?n).  All other original content, unless expressly noted otherwise, is ©2021, by the Skip the Tutorial creator, all rights reserved.------Other Credits:Easy Minecraft Builds: Curved/Spiral Staircase Tutorialhttps://youtu.be/MAmyFt6zPosThe steepest walkable staircase possible in 1.16https://www.reddit.com/r/Minecraft/comments/inpzob/the_steepest_walkable_staircase_possible_in_116/The highest 1 block staircase (40 blocks tall) using only unique blockshttps://www.reddit.com/r/Minecraft/comments/de99yt/the_highest_1_block_staircase_40_blocks_tall/This cool hidden staircase that uses the new wall properties.https://www.reddit.com/r/Minecraft/comments/f1eiav/this_cool_hidden_staircase_that_uses_the_new_wall/Minecraft's Longest Staircase, now for 1.16! Currently 18 Blocks Long.https://www.reddit.com/r/Minecraft/comments/ja8dr6/minecrafts_longest_staircase_now_for_116/New Dripstone Horse Staircase in 1.17https://www.youtube.com/watch?v=6JiKlDMi8Ww"
"ix68oRfI5Gw","Making a log carving robot","2021-04-04T08:11:07Z","UCj1VqrHhDte54oLgPG4xpuQ","Stuff Made Here","28","21.09.04","[none]","2558170","150514","1616","8422","https://i.ytimg.com/vi/ix68oRfI5Gw/default.jpg","False","False","Check out https://Kiwico.com/StuffMadeHere for 50% off your first month of any crate!The robot arm I used: https://hubs.ly/H0K42Hg0Please consider supporting these projects through my patreon: http://patreon.com/stuffmadehere When I was offered the opportunity to beta test an upcoming robotic arm from Tormach, I knew exactly what I wanted to do with it. CNC chainsaws baybeeeeee. Aside from being fundamentally awesome, it is a very interesting software problem. Since I didn't have to build the arm I was able to focus the project and the video on the software challenges of making something like this work. Thank goodness I didn't have to build the arm because the software almost killed me. I can imagine all kinds of next steps for this creation like machining textures with the chainsaw or cutting topiaries. I hope you like it!Sources: *  Low Polygon Labrador Model: https://www.thingiverse.com/thing:446787 *  RRT  GIF: https://en.wikipedia.org/wiki/Rapidly-exploring_random_tree#/media/File:Rapidly-exploring_Random_Tree_(RRT)_500x373.gifOther great things (your purchase helps support this channel):*  I use a glowforge pro for rapid prototyping and it's great. You can $500 off a Glowforge pro here: http://glowforge.com/stuffmadehere"
"Fp9pNPdNwjI","Marvel Studios’ Black Widow | New Trailer","2021-04-03T16:00:41Z","UCvC4D8onUfXzvjTOM-dBfEA","Marvel Entertainment","24","21.09.04","marvel|lack widow|scarlett johansson|black widow trailer|natasha romanoff|avengers|trailer|black widow movie|florence pugh|movie|clip|scene|superhero|mcu|david harbour|black widow disney plus|rachel weisz|marvel studios|red guardian|movies|movie clip|the avengers|adventure|black|official|new trailer|2021|black widow 2021|marvel cinematic universe","10442387","461930","6304","22076","https://i.ytimg.com/vi/Fp9pNPdNwjI/default.jpg","False","False","We have unfinished business. See Marvel Studios’ “Black Widow” in theaters or on Disney+ with Premier Access on July 9. Additional fee required.► Watch on Disney+: https://bit.ly/2XyBSIW► Subscribe to Marvel on YouTube: http://bit.ly/WeO3YJFollow Marvel on Twitter: ‪https://twitter.com/marvelLike Marvel on Facebook: ‪https://www.facebook.com/marvelWatch Marvel on Twitch: https://www.twitch.tv/marvelReward your Marvel fandom by joining Marvel Insider!Earn points, then redeem for awesome rewards.Terms and conditions apply. Learn more at https://www.marvel.com/insider?Osocial=YT&CID=MarvelInsiderFor even more news, stay tuned to:Tumblr: ‪http://marvelentertainment.tumblr.com/Instagram: https://www.instagram.com/marvelPinterest: ‪http://pinterest.com/marvelofficialReddit: http://reddit.com/u/marvel-official"
"DUauPVlSO6g","Uncomplicated Complexes LEG DAY Workout | EPIC Heat - Day 1","2021-04-05T04:15:00Z","UCpis3RcTw6t47XO0R_KY4WQ","Caroline Girvan","17","21.09.04","leg day|leg workout|caroline girvan|epic heat|legs|dumbbell leg workout|complexes|quads|hamstrings|lower body workout|dumbbell workout|at home workout|strength training|glutes|advanced leg day|leg circuits|leg workout with dumbbells|leg day workout|workout|quad workout|home workout","255154","12355","41","2148","https://i.ytimg.com/vi/DUauPVlSO6g/default.jpg","False","False","Day 1 in the EPIC Heat Program! Let’s get started! Uncomplicated complexes for this leg day!Complexes on the legs are a sure fire way to light up your entire lower body! The quads, hamstrings, glutes, core and let’s not forget the forearms due to holding those dumbbells will be challenged! If you are new to complexes, basically for the duration of the complex you aim to complete as many solid, great form reps of the exercises for the amount of reps as on screen. So in this case all of the complexes are 3 minutes in total. The first complex is 10 reps of high squats. Once you complete the 10 reps, you move into 10 reps of 1/2 squats, followed then by the 3rd exercise which is squat jumps. You then return to the first exercise and carry on for the total of 3 minutes! All you will need for this leg session is a pair of dumbbells and your mat for cool down! The dumbbells I am using are 12.5kg each. HIGH SQUATS1/2 REPSSQUAT JUMPS (bodyweight)STATIC LUNGECURTSEY LUNGELUNGE TO CURTSEY (bodyweight)STATIC LUNGECURTSEY LUNGELUNGE TO CURTSEY (bodyweight)STAGGERED RDLSTAGGERED SQUATSTAGGERED RDL TO SQUATSTAGGERED RDLSTAGGERED SQUATSTAGGERED RDL TO SQUATCLOSE SQUATCLOSE 1/2 REPSSQUAT ROCKS (bodyweight)SUMO SQUATSRDLSUMO TO RDL (bodyweight)ALT REAR LUNGESBODYWEIGHT LUNGESBODYWEIGHT LUNGE JUMPSThe finisher sets are as follows;SQUAT WALKSQUATSSQUAT PULSESSQUAT WALKSQUAT PULSESSQUATSBe proud of your work! Complexes are very demanding and if you find you are struggling, then you are doing it correct! 😁All of the workouts are meant to challenge you both mentally and physically but without pressure! Pause when you need to and have fun! You are doing it!! Day One and hopefully you look forward to so many more sessions full of variety!Have fun!!! CxTo download the FREE EPIC Heat 10 Week Program Guide, simply visit https://carolinegirvan.com where you can gain access to the full schedule, information relating to the program, FAQs, some tips relating to the training, nutrition and mindset! Always ensure you warm up before any workout, here is my new EPIC Heat Warm Up Routine: https://youtu.be/Wf7BDS2KHGsDon’t forget to Subscribe and turn on notifications so that you don’t miss any Workouts, Community Updates or Surprises: https://youtube.com/c/carolinegirvan/?sub_confirmation=1Add-ons: https://youtu.be/gd7iOXJHvFwMy Other FREE Workout ProgramsEPIC Beginner: https://www.youtube.com/playlist?list=PLhu1QCKrfgPUZ7_HDxP8P_-0ffNoobSDHEPIC I: https://www.youtube.com/playlist?list=PLhu1QCKrfgPW3VAMHM-wefcO4ZyXf6cwtEPIC II: https://www.youtube.com/playlist?list=PLhu1QCKrfgPVI4oP_bKz1NvbPgsRaE8AQJoin The Community▶ Instagram: https://instagram.com/carolinegirvan▶ Private Facebook Group: https://facebook.com/groups/carolinegirvanEquipment I Use:▶ My Amazon UK Page: https://amazon.co.uk/shop/carolinegirvan▶ My Amazon US Page: https://amazon.com/shop/carolinegirvanBusiness Enquiries:▶ Email: info@carolinegirvan.comCaroline Girvan PO BOX 115County Antrim Northern Ireland BT38 8WBDisclaimer: If you are new to exercise or planning on embarking on a new fitness programme, you should consult your physician. This video may offer health, fitness or nutritional information and is meant for educational purposes only. This information is not meant as an alternative to seeking professional medical advice or suggested treatment. Please know that performing any exercise or programme is solely at your own risk."
"mnbhguLE_R8","M1llionz | Tiffany Calver Freestyle","2021-04-03T21:00:18Z","UCqrimRUsQ-hTI8ceDP9c3FQ","BBC Radio 1Xtra","24","21.09.04","[none]","208676","8728","133","564","https://i.ytimg.com/vi/mnbhguLE_R8/default.jpg","False","False","Tiffany Calver Freestyles return with Birmingham's M1llionz.Listen to 1Xtra's Rap Show with Tiffany Calver via the BBC Sounds app.#M1llionz #Freestyle #1Xtra--Official Channel of BBC Radio 1XtraHere you can find your favourite freestyles, incredible live performances, in-depth interviews + more! Still haven’t subscribed to 1Xtra on YouTube? ►► https://goo.gl/3ZE9reFollow us on socials:https://www.facebook.com/bbc1xtra/https://twitter.com/1xtrahttps://www.instagram.com/bbc1xtrahttps://www.bbc.co.uk/1xtra"
"w_WT3gNTrZA","How To Beat Every Trap In HOSTEL","2021-04-05T18:30:20Z","UCfcQPMZg4tNk6tKUTHbAr0g","Cinema Summary","1","21.09.04","how to beat|explained|review|hostel|trap|traps","1454910","60542","561","7407","https://i.ytimg.com/vi/w_WT3gNTrZA/default.jpg","False","False","You’ve been kidnapped by criminals, and locked in a room with a human monster who wants to hurt you in the worst ways possible. No one’s coming to your rescue, and you’ll have to outsmart everyone if you want to survive. When you’re trapped underground and being hurt , what do you do?Thank you for watching Hostel explained and review of how to beat.Check out my:FB ➡ https://www.facebook.com/CinemaSummary/IG ➡ https://www.instagram.com/cinemasummary/Twitter ➡ https://twitter.com/CinemaSummary"
"2AhrkmXy2Ec","Game of Thrones | Iron Anniversary (HBO)","2021-04-05T15:00:01Z","UCQzdMyuz0Lf4zo4uGcEujFw","GameofThrones","22","21.09.04","[none]","162184","7940","1687","1458","https://i.ytimg.com/vi/2AhrkmXy2Ec/default.jpg","False","False","Send a raven. Celebrating 10 years in Westeros, the #IronAnniversary is here."
"ks4EgUkOvtg","the everything sub (1m subscriber special)","2021-04-05T17:30:05Z","UCWLu3q9FEmPPYKcUAxKZb2A","Milad Mirg","24","21.09.04","everything sub|subway|food|1 million subscribers|fun|stories","1528657","104369","789","79389","https://i.ytimg.com/vi/ks4EgUkOvtg/default.jpg","False","False","thank you guys so much for everything, you all changed my life whether you know it or not"
"eukZS1bS69g","Stealing Ice Cream","2021-04-03T22:39:01Z","UCWiXzvPDb5YqG7W0mr2TmlA","Dylan Lemay","22","21.09.04","[none]","2944105","61527","1899","9756","https://i.ytimg.com/vi/eukZS1bS69g/default.jpg","False","False",""
"NjfjNDDprAw","SA set up series decider despite Zaman's 193! | South Africa vs Pakistan | 2nd ODI Highlights","2021-04-04T17:52:47Z","UCkd4takjjF1EGD1TKIK2QiA","Sky Sports Cricket","17","21.09.04","Sky Sports|Sky Sports Cricket|cricket|sky cricket|pakistan vs south africa|south africa pakistan|south africa highlights|pakistan highlights|fakhar zaman batting|fakhar zaman|pakistan cricket|south africa cricket|south africa pakistan today","98083","1158","22","444","https://i.ytimg.com/vi/NjfjNDDprAw/default.jpg","False","False","SUBSCRIBE ► http://bit.ly/SubscribeSkyCricketHighlights from the second ODI where Fakhar Zaman's stunning innings of 193 came in vain as South Africa held on to set up an ODI series decider against Pakistan.Watch cricket LIVE on Sky Sports here ► http://bit.ly/GetSkySportsCricket►TWITTER: https://twitter.com/skysportscricket ►FACEBOOK: http://www.facebook.com/skysports►WEBSITE: http://www.skysports.com/cricketMORE FROM SKY SPORTS ON YOUTUBE:►SKY SPORTS FOOTBALL: http://bit.ly/SSFootballSub►SKY SPORTS BOXING: http://bit.ly/SSBoxingSub►SKY SPORTS CRICKET: http://bit.ly/SubscribeSkyCricket►SOCCER AM: http://bit.ly/SoccerAMSub►SKY SPORTS F1: http://bit.ly/SubscribeSkyF1►SKY SPORTS: http://bit.ly/SkySportsSub►SKY SPORTS GOLF: https://bit.ly/SubscribeSkySportsGolf"
"XeFVGhZ2lo4","I Survived 500 Days Of Hardcore Minecraft, In an Ocean Only World.","2021-04-03T15:00:10Z","UCmYV7u4OrDh2whUD6KMVs5w","Not PaulGG","20","21.09.04","paul|paulgg|notpaulgg|not paulgg|not paulgg minecraft|minecraft|minecraft 100|i survived 100 days minecraft|i survived 100 days|100 days of minecraft|100 days minecraft|ocean only|minecraft ocean only world|minecraft but|minecraft survival|minecraft hardcore|hardcore minecraft","2152283","91170","1449","8035","https://i.ytimg.com/vi/XeFVGhZ2lo4/default.jpg","False","False","This 100 days of hardcore minecraft was a ton of fun to film, other than the power outage.... But we got a lot done, and still have a lot of things to do. So drop a like on this video if you want a 600 day video! #100days​ #Minecraft​ #MinecrafthardcoreOcean Only Playlist! ➡ https://youtube.com/playlist?list=PLiJUHFZ3pDj6A42F-9rFoHqAA6Or27fe4Credit to @Luke TheNotable for the original 100 day ideaTry the ocean world yourself ➡ https://drive.google.com/drive/folders/10UDIifA6R0zcVajl_Pulkicle9DoRl1JOP Mob farm ➡ https://www.youtube.com/watch?v=HtKoviqHUNs&t💬 Discord ➡ https://discord.gg/v3SA7Tp🔴 Twitch ➡ https://www.twitch.tv/notpaulgg🐤 Twitter ➡ https://twitter.com/NotPaulGG📷 Insta ➡ https://instagram.com/notpaulgg🖥McProHosting ➡ https://mcprohosting.com/order?aff=83072Use Code PaulGG at checkout for 25% off!💻Ironside, Click here to customize your own PC ➡ https://ironsidecomputers.com/?v=00dc5da36527🪑  My Chair ➡ http://bit.ly/32xT95b🥤 Gamer Supps! Use code PaulGG at checkout! ➡ http://gamersupps.gg?afmc=PaulGG_________Business Inquires Only: Paulgg@rsinfluence.com"
"v2mVhZO7IFI","why you shouldn't reject villagers...","2021-04-03T18:58:51Z","UCJN3badcuSNJBf1qMbAUL1w","Ulanos","20","21.09.04","short|shorts|minecraft|mine craft|minecraft shorts|memes|villager|tiktok|tik tok|tiktok shorts|dream|dreamsmp|dream smp|mcyt|tommy|tommyinnit|tommy innit|hot|reject","1468247","103613","3419","627","https://i.ytimg.com/vi/v2mVhZO7IFI/default.jpg","False","False","they lowkey hot :I____________________JOIN THE DISCORD ➤https://discord.gg/pEuxBRZVTqMy tiktok ➤https://www.tiktok.com/@ulansauce?lan...​____________________LIKE AND ╔═╦╗╔╦╗╔═╦═╦╦╦╦╗╔═╗║╚╣║║║╚╣╚╣╔╣╔╣║╚╣═╣ ╠╗║╚╝║║╠╗║╚╣║║║║║═╣╚═╩══╩═╩═╩═╩╝╚╩═╩═╝THANK YOU FOR 165K!"
"sa0d1M_kIyI","GR Yaris v BMW M2 CS v Fiesta ST - TRACK BATTLE and 0-60mph 1/4 mile test: AWD v RWD v FWD!","2021-04-04T08:11:17Z","UCulu1KUYJ_2OBDouc_d-cUA","Mat Watson Cars","2","21.09.04","toyota|yaris|gr|gazoo|ford|fiesta|st|bmw|m2|cs|competition|0-60mph|launch|1/4mile|carwow|mat|watson|matt|review|car|cars|track|battle|test","386432","14792","235","1322","https://i.ytimg.com/vi/sa0d1M_kIyI/default.jpg","False","False","In partnership with Stereo. Download Stereo and join me for my next live show here: https://stereo.com/u/r21686FPvo0jZ21My next show with Yianni will be at 18.30 GMT Tue 6th April.In this video I wanted to see which was the easiest and most fun car to drive on a short technical circuit - rear-wheel-drive, front-wheel-drive or all-wheel-drive. So I lined up the new BMW M2 CS, Toyota GR Yaris and Ford Fiesta ST edition. And of course I also launched them to see how quick they are from 0-60mph and over the quarter mile. For business enquires with my channel please email matwatsoncarsofficial@gmail.comInstagram: https://www.instagram.com/matwatsoncars/?hl=enFacebook: https://www.facebook.com/MatthewWatsonCars/TikTok: https://www.tiktok.com/@matwatsoncars?Twitter: https://twitter.com/matwatsoncars"
"H8wRT-X_0Ng","What really happens when you bleed","2021-04-04T20:46:40Z","UCESqho-TmmnJQJf4IWEbBkQ","Iamdices","10","21.09.04","[none]","2470693","248109","2357","1219","https://i.ytimg.com/vi/H8wRT-X_0Ng/default.jpg","False","False","MERCH: https://teespring.com/stores/dices-3TikTok: https://www.tiktok.com/@iamdices?lang=enInstagram: https://Instagram.com/iamdices/Twitter: https://twitter.com/IamdicessEmail: Wilson.lasayfies@gmail.com#Iamdices #Tiktok #Shorts"
"nBAVV8F_bBE","Our scariest day of van life. (winter in Yellowstone)","2021-04-04T14:00:13Z","UC4ijq8Cg-8zQKx8OH12dUSw","Kara and Nate","19","21.09.04","#vanlife|converted van tour|couple vlog|daily vlog|full time travel|kara and nate|kara and nate vlog|off grid living|self converted sprinter van|sprinter van|sprinter van conversion|tiny home|tiny home on wheels|tiny house|travel|travel couple|travel vlog|usa travel|van life|van life couple|van life usa|van life vlog|van tour|vlog|yellowstone|yellowstone national park|wyoming|yellowstone vlog|west yellowstone|road trip|winter in yellowstone","1171406","37586","1905","3647","https://i.ytimg.com/vi/nBAVV8F_bBE/default.jpg","False","False","Our 13 hour drive from Nebraska to Yellowstone, Wyoming turned into our scariest day of van life yet. This video is sponsored by Better Help; Get 10% off your first month here: https://betterhelp.com/kandn Vlog 761 | #Yellowstone, #Wyoming, USA | State 25/50 | Filmed March 11, 2021📸 Follow us on Instagram for behind the scenes content: @karaandnate https://www.instagram.com/karaandnate/ 🗺 Create your own CUSTOM route map from your favorite vacation, city, or road trip with our new site! https://atlas.co/ ✈️ We created FareDrop to help you score super cheap international flights! Try it for free and get flight deals up to 80% off ➡️ https://faredrop.com/ ⬅️📧 Sign up for our Sunday Summary email here - https://karaandnate.com/sunday-summary/🎶 Download these copyright free songs we used in this episode - All are from here: http://bit.ly/epidemic_sound——————————————————💳 Here’s Nate’s FREE guide to airport lounge access: http://karaandnate.com/the-ultimate-guide-to-lounge-access/ 👩🏻‍💻 Kara’s Behind the Scenes Guide to Editing a Vlog:https://learn.karaandnate.com/p/how-to-edit-a-vlog/ 🎥 Our current camera setup: https://karaandnate.com/travel-vlogging-gear/——————————————————SUPPORT OUR WORK: http://karaandnate.com/keep-us-on-the-road/ PACKING LIST: http://karaandnate.com/travel-essentials/ FACEBOOK: https://www.facebook.com/karaandnate/ TWITTER: @karaandnate https://twitter.com/karaandnate——————————————————Originally from Nashville, Tennessee, we got married June 2013 and quickly caught the travel bug! We started “travel hacking” & finally decided we wanted to go travel for one year. After 2 years of saving $ and over 2 million miles and points, we sold our cars and apartment and left home January 10, 2016. We started this travelvlog to share our experiences with friends and family, then decided we really liked vlogging and traveling, and we didn’t want to stop after just one year! After achieving our new goal of 100 countries and then all 7 continents (check out our documentary here: https://www.youtube.com/watch?v=FuFv4iF8wgg&t=1s), we had no plans to slow down, until 2020 decided to force us to ;) which is when we bought a converted Sprinter van to start exploring our own country for the first time. #Vanlife was a major adjustment and so different than flying every week like we were used to, but we are incredibly thankful to be able to continue doing something we love every day. 😊🎥🌎"
