video_id,title,publishedAt,channelId,channelTitle,categoryId,trending_date,tags,view_count,likes,dislikes,comment_count,thumbnail_link,comments_disabled,ratings_disabled,description
"LYR_PvJthJ0","Mohamed Ramadan - Ana El Batal [ Official Music Video ] / محمد رمضان - أغنية أنا البطل","2021-03-03T15:01:35Z","UCJCj2HtcnbOyCj1rmKaxwJg","Mohamed Ramadan I محمد رمضان","24","21.05.03","محمد رمضان|محمد رمضان أغنية أنا البطل|Ana El Batal|أنا البطل|محمد رمضان أنا البطل|Mohamed Ramadan Ana El Batal|Official Music Video|Ramadan Ana El Batal|رمضان أنا البطل|أنا البطل محمد رمضان|البطل محمد رمضان|أنا البطل رمضان|Ramadan el Batal|انا البطل رمضان|انا البطل محمد رمضان|اغنية انا البطل|اغنية انا البطل محمد رمضان|انا البطل فيديو كليب|اغاني محمد رمضان|محمد رمضان 2021|محمد رمضان البطل","3225071","227551","22194","15816","https://i.ytimg.com/vi/LYR_PvJthJ0/default.jpg","False","False","Subscribe To / إشترك علي القناة https://Youtube.com/MohamedRamadanFollow Mohamed Ramadan onhttps://facebook.com/Ramadanhttps://twitter.com/Mohamed_Ramadanhttps://Instagram.com/MohamedRamadanwshttps://play.anghami.com/artist/2368419https://deezer.com/en/artist/7444722https://open.spotify.com/artist/4CflzQprp6nZxKiv0t78tHhttps://soundcloud.com/mohamedramadanofficialبطل لعب مية فورة لكن مخسرش جولة  هتفكر يوم تنافسه اقعد في بيتك أولى أرضي منطقة محظورة بتشتت العتاولة وبطلقة بين حواجبك على ارضك هستولى   انا البطل اللى نفسك تقلده اى حد بيهرى باجى  بسكتهاتخن مافيكم بصباع واحد اثبتهرمضان بس مجرد اسم بيشتته جمهورى فى ودنى قالى اعمل انفجار ادانى إشارة و قالى غير المسار لو الدنيا مرة واحدة بيكم ولعت اعرف يا بني إنى دوست عـ الزرار مين اللى أدى انت اخرك ياض تتفرج  انا صاحب الملعب  وانت قاعد في المدرج من وانت صغير حذورك كتير زمان ان الأسد مفترس مش بيهرجانا البطل اللى نفسك تقلده اى حد بيهرى باجى  بسكتهاتخن مافيكم بصباع واحد اثبتهرمضان بس مجرد اسم بيشتته متحطش نفسك قدام قطر مبيقفشهم عاملين عتاولة وبالنسبالى طفشمفيش حاجة بالنسبالي اسمها معلش اختار كلامك وانت معايا متخرفش المحترم هقابله واديله احترامه  اما اللى يجي يعيشها اقل من مقامه واللي يهلفط بكلمه هاجى اقطعله لسانهلو كنتوا كتير رمضان بـ طوله يطب ميزانه باصص لفوق ومفيش وقت اضيعهاتقل ما فيكم يقف قدامى واسمعهلم صحابك هاتهم  يلا يشجعواواهانتى ليه هتفيده يابني تلمعه  محتاج تشب وبرضه عمرك ما هتطولنى مفيش مقارنة بيننا عشان تيجي تكلمنىياويلك يالى هتفكر تيجي تزاولنى  هتحصل اللى قبلك  مين فيهم كان حملىانا البطل اللى نفسك تقلده اى حد بيهرى باجى  بسكتهاتخن مافيكم بصباع واحد اثبتهرمضان بس مجرد اسم بيشتته#ثقة_في_الله_نجاح   #MohamedRamadan"
"6vNh-QW6Hlc","Sub Urban - Cirque [Official Music Video]","2021-03-03T20:00:14Z","UCqAil6_A1dWHdFXzOwVLqlg","Sub Urban","22","21.05.03","sub urban|cradles|sub urban cradles|freak|sub urban freak|rei ami freak|suburban cradles|suburban|tiktok|tiktok songs|tiktok songs 2020|sub urban tiktok|cradles tiktok|cirque|thrill seeker|sub urban thrill seeker|bella poarch|bella poarch music video|sub urban bella poarch|bella poarch cirque|sub urban official music video|sub urban cirque video|sub urban new music video","1416213","225803","1929","18158","https://i.ytimg.com/vi/6vNh-QW6Hlc/default.jpg","False","False","MERCH & ANNOUNCEMENTS: https://www.thatsuburban.comDebut EP 'Thrill Seeker' is out now: https://suburban.lnk.to/ThrillSeekerFollow Sub Urban:https://www.instagram.com/thatsuburban/https://www.tiktok.com/@thatsuburbanhttps://twitter.com/thatSubUrbanhttps://www.facebook.com/thatSubUrban/https://open.spotify.com/artist/7gXb99Sf9nNmpNYeAgIQFG?si=yjYjkA4NQzGqEYDeQihTsQhttps://music.apple.com/us/artist/sub-urban/429426385Follow Bella Poarch:https://www.tiktok.com/@bellapoarchhttps://www.instagram.com/bella.poarch/https://twitter.com/bellapoarchCredits: Director - Andrew DonohoStory & Creative – Sub UrbanProducer - Valerie BushExecutive Producer - Ryan HuffmanProduction Company - Huffman CreativeHead of Production - Luke ArreguinManager, Production - Katie SarrelsProduction Supervisor - Julio Mata Jr.Production Manager - Christine ParkProduction Coordinator - Chris FishLabel - Warner RecordsVP of Creative Services - Devin SarnoVP of A&R - Stefan MaxBella's MGMT - Aryan MahyarDirector Rep - Doug KlingerDirector of Photography - Nick Bupp1st AC - Bryce Platz2nd AC - Dusty SaundersSteadicam - Erdem ErtalDIT - Sydney SchnurrenbergerBTS - Lorenzo Belassen1st AD - Peter Maestrey2nd AD - Dustin GodwinGaffer - Blake FarmerBBE - Isaak Van Der MeulenElectric - Joe EscandellElectric - Matt TuppenKey Grip - Alex PicassoBBG - Mikey TellGrip - Jose AguilarGrip - Ryker WellsGrip - Daniel VlahosGrip - Nathon GiordanoProduction Designer - Tyler JensenArt Coordinator - Marisa PapaveroSet Decorator - Sandra VictoriSet Dresser - Joseph SalcedoLeadman - Danny ErbSet Dresser - Eric MooreSet Dresser -  Jesse HotchkissSet Dresser - Cesar MojicaSet Dresser - Jason SmithSet Dresser - Tony BarberStylist - Lisa MadonnaStylist Assistant - Chelsie BakerBP Hairstylist - Rachel LitaBP Makeup - Kenna ReefBP's Team - Becky BoltonTwo Feet's Team - Geoffey HuffordHMU Department Head - Alex PerroneKey Hair/Makeup - Mazena PukstoHair/Makeup - Joanna KleinHair/Makeup - Leilani SunglaoHair/Makeup - Heather GalipoHair/Makeup - Orlando MarinProduction Assistant - Jesse AlexanderProduction Assistant - AJ RinellaProduction Assistant - Samuel SmootProduction Assistant - Nigel CoxProduction Assistant - Libby StewartProduction Assistant - Elle KeseleyProduction Assistant - Nick ReynoldsProduction Assistant - Melody GonzalazCasting Director - Michael BeaudryCOVID Compliance Officer - Cerra MendezStunt Coordinator - Webster WhineryStunts - Jose Luis VasquezStunts - Vinny O'BrianStunts - Brian McCoyStunts - Rowbie OrsatiStunts - Craig JensonEditor - Andrew DonohoAssistant Editor - Sydney SchnurrenbergerColorist - Jacob McKeeVFX Creature Animation - Picture WizardsVFX Simulations - Senzo StudioCompositing Supervisor - Andrew DonohoCompositor - Ryan GameRotoscoping - Purple PatchMobster - Ego MikitasMobster - Matthew DorioMobster - Anthony AmorelloBurlesque Dancer - Jenna StockmanBurlesque Dancer - Michelle DionBurlesque Dancer - Angel RodriguezBurlesque Dancer - Leah FicarolaPolice Officer - Zachary ChicosPolice Officer - Al BurkePoker Player - Dan GregoryPoker Player - David Alan GrafPoker Player - Yolanda EsquivelPoker Player - Zone SheatsMobster/General Extra - Daniel DoranMobster/General Extra - Michael DoranGeneral Extra - Alan BornemannGeneral Extra - Brett BenowitzGeneral Extra - Kevin DavisGeneral Extra - Michael FarmerGeneral Extra - Elijah McKinleyGeneral Extra - Logan AndrewsGeneral Extra - Hannah McBrydeGeneral Extra - Arlondriah LenyeaGeneral Extra - Megan WilliamsGeneral Extra - Miki KanekoLyrics:Hear her talkin' 'bout that mainstreamGot it real easy like she got the callbackDroppin' underneath that eave breezeWanna watch her knees weakWhen they pass my name backYou know you sound c*cky as f*ckBut go and try, good f*ckin' luckSo if you ask to come and see meShow some f*ckin' dignityDon't tell me how to live lifeAnd I make it go (Boom), back at it againDon't need to be in love to have a little romanceSing it on the spot to watch the crowd danceAnd even if they're petrified, I hear their hearts pranceAnd I can be free from raw tyrannyMan, f*ck my emotions, they're ghostin' and moanin' all day on repeat(Woo)(Uh)We can fall in love or we can go insaneWe can play it rough or we can, we can play it safeDon't matter what's above, our destinies are madeWhy give us f*ckin' lemons if I can just buy lemonade?And I make it go (Boom), back at it againDon't need to be in love to have a little romanceSing it on the spot to watch the crowd danceAnd even if they're petrified, I hear their hearts pranceAnd I can be free from raw tyrannyMan, f*ck my emotions, they’re ghostin' and moanin' all day on repeat('Round and around we go)('Round and around we go)#SubUrban #Cirque"
"YOfv30fSXk0","Die dunkle Wahrheit hinter “.tv” Domains","2021-03-03T17:00:15Z","UCKGMHVipEvuZudhHD05FOYA","Simplicissimus","22","21.05.03","Twitch|Streaming|Domains|Chagos Inseln|Simplicissimus","447901","48227","401","2064","https://i.ytimg.com/vi/YOfv30fSXk0/default.jpg","False","False","Es gibt unzählige Domains, wie .com, .de, oder auch .tv. Sie sind ein essentieller Teil des Internets. Doch hinter einigen dieser Endungen steckt eine dunkle Wahrheit.Video von Johnny Harris zum Chagos-Archipel: https://www.youtube.com/watch?v=e1EymGBTl-A Unser Instagram-Account: https://www.instagram.com/simplicissimusyt @simplicissimusytUnser Kanal gehört zu funk, dem Netzwerk von ARD und ZDF. Weitere Infos:Youtube: http://www.youtube.com/funkofficial funk Web-App: https://go.funk.net funk bei Facebook: http://www.facebook.com/funk Impressum: https://go.funk.net/impressum____Quellen:[1] Namecheap - Domains Registration Results (2021)https://www.namecheap.com/domains/registration/results/?domain=neuettwitsch.tv [2] Internet Stiftelsenhttps://internetstiftelsen.se/[3] Tweakers - Al 20 jaar ruzie om het domein .nu (2021)https://tweakers.net/reviews/8634/de-20-jaar-lange-strijd-om-het-domein-nu-raakt-ook-nederlanders.html [4] Domain Name System Structure and Delegation - J. Postel (1994)https://tools.ietf.org/html/rfc1591 [5] The neverending CCTLD Story - Peter K. Yu (2003)http://home.uchicago.edu/~mferzige/ccTLDs.pdf [6] Wired - The Digital Colonialism Behind .tv and .ly (2020)https://www.wired.com/story/the-digital-colonialism-behind-tv-and-ly/ [7] SOVEREIGN DOMAINS: A Declaration of Independence of ccTLDs from Foreign Control - Kim G. Arx ; Gregory R. Hagan (2002)https://scholarship.richmond.edu/cgi/viewcontent.cgi?referer=https://scholar.google.de/&httpsredir=1&article=1164&context=jolt [8] The Commonwealth - Tuvaluhttps://thecommonwealth.org/our-member-countries/tuvalu [9] Wired - Buy This Domain (1998)https://www.wired.com/1998/09/tuvalu/ [10] Domain Incite - Tuvalu not happy with VeriSign Deal (2010)http://domainincite.com/1385-tuvalu-not-happy-with-verisign-deal [11] The Washington Post - Tuvalu is a tiny island nation of 11,000 people. It’s cashing in thanks to Twitch. (2019)https://www.washingtonpost.com/video-games/2019/12/23/tuvalu-is-tiny-island-nation-people-its-cashing-thanks-twitch/ [12] Island Studies Journal, Vol. 10: Entrepreneurship, Tuvalu, development and .tv: a response - James M. Conway (2015)https://www.islandstudies.ca/sites/islandstudies.ca/files/ISJ-10-2-Conway.pdf [13] Iana - Delegation Record for .TVhttps://www.iana.org/domains/root/db/tv.html [14] The World Bank - GDP Tuvaluhttps://data.worldbank.org/indicator/NY.GDP.MKTP.CD?locations=TV [15] Government of Niue - Geographical informationhttps://www.gov.nu/wb/pages/the-island.php [16] The Wallstreet Journal - On a Tiny Island, Catchy Web Name Sparks a Battle (2006)https://www.wsj.com/articles/SB114360298137410850 [17] Internet Stiftelsen - Growth .nuhttps://internetstiftelsen.se/en/domain-statistics/growth-nu/?chart=active [18] Pacific Islands Legal Information Institute - Communications Amendment Act (2000)http://www.paclii.org/nu/legis/num_act/caa2000256/ [19] The IUSN Foundation https://www.iusn.org/ [20, 21] TV Niue - Premier & lawyer refute claims Niue lost legal battle for internet domain (2020)https://tvniue.com/2020/04/premier-lawyer-refute-claims-niue-lost-legal-battle-for-internet-domain/ [22] CIA.gov: The World Factbook - British Indian Ocean Territory I South Asiahttps://www.cia.gov/the-world-factbook/countries/british-indian-ocean-territory/#people-and-society [23] The New York Times - U.S.‐British Deal On Diego Garcia In ’66 Confirmed (1975)https://www.nytimes.com/1975/10/17/archives/usbritish-deal-on-diego-garcia-in-66-confirmed.html [24] Diplomatic Cable signed by D.A. Greenhill, dated August 24, 1966https://commons.wikimedia.org/wiki/File:Diplomatic_Cable_signed_by_D.A._Greenhill,_dated_August_24,_1966.jpg [25] The Guardian - Files on UK role in CIA rendition accidentally destroyed, says minister (2014)https://www.theguardian.com/world/2014/jul/09/files-uk-role-cia-rendition-destroyed-diego-garcia-water-damage [26] BBC News - UN court rules UK has no sovereignty over Chagos islands (2021)https://www.bbc.com/news/world-africa-55848126 [27] BBC News - Chagos Islands dispute(2019)https://www.bbc.com/news/world-50924704?ocid=socialflow_twitter [28] Citizen Ex - .io British Indian Ocean Territoryhttp://citizen-ex.com/stories/io Musik:DELNOVA - DiscoveryFrancesco D’Andrea - With some Malice Sebastian Borromeo - Decisions Borrtex - The UndertakeJimmy Svensson - Boot SequenceOstin Drais - Cornered BeastKooma - FloatChris Zabriske - Divider lizenziert unter CC-BY-4.0.https://chriszabriskie.com/​ Three Chain Links - Can’t be bargained with lizenziert unter CC-BY.https://threechainlinks.bandcamp.com/ Kevin MacLeod - Cambodian Odyssey; Sneaky Snitch; Frozen Star; Thinking Music; Dark Fog lizenziert unter CC-BY-4.0. https://incompetech.com/​​ _____Schön, verständlich, kritisch und fundiert. Wir machen Essays zu Fragen, die du dir noch nie, oder viel zu oft gestellt hast."
"q1C_-zAzO4w","[BE-Log] SUGA l #딩가딩가 #LifeGoesOn","2021-03-05T11:00:03Z","UCLkAepWjdylmXSltofFvsYQ","BANGTANTV","10","21.05.03","방탄소년단|BTS|BANGTAN|HIPHOP|알엠|RM|슈가|SUGA|제이홉|jhope|지민|JIMIN|정국|JUNGKOOK|JIN","1829946","784256","629","56466","https://i.ytimg.com/vi/q1C_-zAzO4w/default.jpg","False","False","Connect with BTS: https://ibighit.com/bts http://twitter.com/BTS_bighithttp://twitter.com/BTS_twt http://www.facebook.com/bangtan.official https://www.youtube.com/user/BANGTANTV http://instagram.com/BTS.bighitofficial https://channels.vlive.tv/FE619 https://www.tiktok.com/@bts_official_bighithttps://weverse.onelink.me/qt3S/94808190https://www.weibo.com/BTSbighithttps://www.weibo.com/BTSmembers http://i.youku.com/btsofficial http://btsblog.ibighit.com"
"4M4TyG7R85c","die KTM ist WEG! Was war der Auslöser?","2021-03-03T10:08:02Z","UC3DK3i65yIE7w_iOoHvfONg","HamburgWheelieKidz","24","21.05.03","hamburg wheelie kidz|motorrad|hagen amstep|blackout|hamburgwheeliekidz|harzlife|motovlogger|schrauben|werkstatt|maeximiliano|eickoperformance","80315","5301","96","349","https://i.ytimg.com/vi/4M4TyG7R85c/default.jpg","False","False","--------------------------Wir freuen uns über dein Abo!-----­-----------------------------►Instagram: https://www.instagram.com/hamburgwheeliekidz►Youtube Abonnieren: https://www.youtube.com/c/hamburgwheeliekidz?sub_confirmation=1* Sämtliche mit 1) gekennzeichneten Links stellen Werbung dar."
"f9Z0t031yDI","Rot-Weiss Essen - Holstein Kiel | Highlights - DFB-Pokal 2020/21 | Viertelfinale","2021-03-03T23:00:11Z","UCuOwl-VgqBHOzR8hWnonBcA","Sky Sport HD","17","21.05.03","DFB-Pokal|DFB Pokal|DFB-Pokal 2020/21|DFB Pokal Highlights|Pokal Highlights|Highlights DFB Pokal|DFB Pokal Sky|Sky Highlights|Sky Pokal|Sky Fußball|Highlights|Rot-Weiss Essen|Essen|Holstein Kiel|Kiel|Essen Kiel|DFB Pokal Viertelfinale|Mühling|Serra|Mees","212149","3669","89","560","https://i.ytimg.com/vi/f9Z0t031yDI/default.jpg","False","False","Viel Spaß mit den Highlights des Spiels Rot-Weiss Essen gegen Holstein Kiel aus dem Viertelfinale des DFB-Pokal 2020/21 auf Sky Sport HD!Tore: 0:1 Mühling (26., Elfm.), 0:2 Serra (28.), 0:3 Mees (90.) ▶▶ Aktuelle Sport-News & Videos jetzt auf: https://sport.sky.de/Kostenlos unseren YouTube-Kanal abonnieren: https://zly.de/sky/YTsubFacebook - Sky Sport DE: https://zly.de/sky/facebookFacebook - Sky Sport News HD: https://zly.de/sky/facebookSSNHDTwitter - Dein Sky Sport: https://zly.de/sky/twitterSky abonnieren: https://zly.de/sky/TVabo"
"7YD-b1VNBLI","RB Leipzig - VfL Wolfsburg | Highlights - DFB-Pokal 2020/21 | Viertelfinale","2021-03-03T23:00:01Z","UCuOwl-VgqBHOzR8hWnonBcA","Sky Sport HD","17","21.05.03","DFB-Pokal|DFB Pokal|DFB-Pokal 2020/21|DFB Pokal Highlights|Pokal Highlights|Highlights DFB Pokal|DFB Pokal Sky|Sky Highlights|Sky Pokal|Sky Fußball|Highlights|RB Leipzig|Red Bull Leipzig|Leipzig|VfL Wolfsburg|Wolfsburg|Leipzig Wolfsburg|DFB Pokal Viertelfinale|Poulsen|Hwang","192362","4106","89","445","https://i.ytimg.com/vi/7YD-b1VNBLI/default.jpg","False","False","Viel Spaß mit den Highlights des Spiels RB Leipzig gegen VfL Wolfsburg aus dem Viertelfinale des DFB-Pokal 2020/21 auf Sky Sport HD!Tore: 1:0 Poulsen (63.), 2:0 Hwang (88.)▶▶ Aktuelle Sport-News & Videos jetzt auf: https://sport.sky.de/Kostenlos unseren YouTube-Kanal abonnieren: https://zly.de/sky/YTsubFacebook - Sky Sport DE: https://zly.de/sky/facebookFacebook - Sky Sport News HD: https://zly.de/sky/facebookSSNHDTwitter - Dein Sky Sport: https://zly.de/sky/twitterSky abonnieren: https://zly.de/sky/TVabo"
"DslHQto2V7I","iKON - ‘왜왜왜 (Why Why Why)’ M/V","2021-03-03T09:00:17Z","UCWxCyZibDIWIrGIgP25mbfw","iKON","10","21.05.03","YG Entertainment|YG|와이지|K-pop|iKON|아이콘|김진환|송윤형|BOBBY|김동혁|구준회|정찬우|Jinhwan|Yunhyeong|Donghyuk|Ju-ne|Chanwoo|iKONIC|iKON 왜왜왜|iKON Why Why Why|아이콘 왜왜왜|아이콘 Why Why Why|왜왜왜|Why Why Why","6423039","827147","5688","198681","https://i.ytimg.com/vi/DslHQto2V7I/default.jpg","False","False","왜왜왜 (Why Why Why)사람에서 사랑으로인연에서 연인으로이별 없이 영원할 줄 알았는데 사실 아직도 거짓말 같죠 활짝 웃으며 올 것만 같죠아름다웠던 모습 그대로 이제 와서야 후회만 해요웃는 게 이쁜 그댈 울리기만 했죠내가 바란 건 이게 아닌데결국 이 지경 이 꼴이지 나란 놈지켜주지도 못했지 너란 꽃빨갛게 불타오르던 우리 모든 게 하얗게 재만 남았죠 사람에서 사랑으로인연에서 연인으로아름다운 사랑 꽃을 피웠는데꽃을 피웠는데웃음은 왜 울음이 돼님에서 남이 돼버린 그대이별 없이 영원할 줄 알았는데우린 왜 왜 왜내 꿈속에서도 멀어지는 너아무것도 난 할 수가 없죠멈춰보려 소리쳐도눈을 뜨면 사라지죠왜 네가 있을 때 잘해야 했던 걸그때 난 몰랐을까왜 모든 것들을 잃고 난 후에소중함을 알게 될까결국 이 지경 이 꼴이지 나란 놈지켜주지도 못했지 너란 꽃빨갛게 불타오르던 우리 모든 게하얗게 재만 남았죠사람에서 사랑으로인연에서 연인으로아름다운 사랑 꽃을 피웠는데꽃을 피웠는데웃음은 왜 울음이 돼님에서 남이 돼버린 그대이별 없이 영원할 줄 알았는데우린 왜 왜 왜그때 마지막인 줄 알았다면 조금 더네 모습을 담아뒀을 텐데단 한 번도 사랑하지 않은 적 없죠처음부터 지금까지도Albums Available @YG SELECT KR: ygselect.comYG SELECT EN: en.ygselect.comYG SELECT JP: jp.ygselect.comYG SELECT CN: cn.ygselect.comYG SELECT TH: ygselectth.com#iKON #아이콘 #DIGITAL_SINGLE #왜왜왜 #WHYWHYWHY #MV #JAY #진환 #BOBBY #바비 #SONG #윤형 #JU_NE #준회 #DK #동혁 #CHAN #찬우 #20210303 #OUTNOW #YGMore about iKON @http://www.yg-ikon.com/http://www.youtube.com/OfficialYGiKONhttp://www.facebook.com/OfficialYGiKONhttp://www.twitter.com/ygent_officialhttp://www.sptfy.com/iKONhttp://www.weibo.com/iKONOFFICIAL"
"yBalK-lej1Y","[BE ORIGINAL] ATEEZ(에이티즈) '불놀이야 (I'm The One)' (4K)","2021-03-03T14:00:17Z","UCEIi7zFR_wE23jFncVtd6-A","STUDIO CHOOM [스튜디오 춤]","24","21.05.03","M2|엠투|스튜디오 춤|스춤|Studio choom|COVERS|커버스|DANCE THE X|댄스 더 엑스|댄스|DANCE|비 오리지널|BE ORIGINAL|커버|COVER|에이티즈|불놀이야|ATEEZ|I'm The One|홍중|성화|윤호|여상|산|민기|우영|종호|KQ엔터테인먼트|ateez|김홍중|박성화|정윤호|강여상|최산|송민기|정우영|최종호|Hongjoong|Seonghwa|Yunho|Yeosang|San|Mingi|Wooyoung|Jongho","1116917","198131","567","11588","https://i.ytimg.com/vi/yBalK-lej1Y/default.jpg","False","False","[BE ORIGINAL] ATEEZ 'Fireworks (I'm The One)'[비 오리지널] 에이티즈 '불놀이야' 두루 두루 격하게 사랑할 수 밖에 없는프로심장루팡러 에이티즈의 火려한 컴백❤️에이티니 맘 속에도 불놀이야 불놀이야🔥#ATEEZ​​ #에이티즈​​ #BEORIGINAL​Stream various performance video on STUDIO CHOOM!👉SUBSCRIBE👈YouTube: https://www.youtube.com/STUDIOCHOOMFacebook:  https://www.facebook.com/StudioCHOOMInstagram: https://www.instagram.com/studio_choom/Naver TV: https://tv.naver.com/cjenm.STUDIOCHOOM"
"yEjxpxgoZKo","Анет Сай, NILETTO - Не люблю?","2021-03-03T09:00:15Z","UC7F98YYhXCW8tDQFo9owCXQ","NILETTO","10","21.05.03","NILETTO|niletto|niletto не люблю|niletto песни|анет сай|любимка|музыка|не люблю|нилетто|нилетто не люблю|нилетто песни|обажаю|песни","793238","31894","1550","2106","https://i.ytimg.com/vi/yEjxpxgoZKo/default.jpg","False","False","Премьера нового трека Анет Сай, NILETTO - Не люблю? (лирик видео)Слушай и скачивай: https://band.link/ne_lyublyuНеожиданный дуэт Анет Сай и NILETTO и их лиричная песня о трудностях отношений двух влюбленных под названием Не люблю? Смотри новое лирик видео на канале NILETTO. Подписывайся на меня:Instagram: https://instagram.com/niletto_officialVK: https://vk.com/nilettoTikTok: https://www.tiktok.com/@nilettoYouTube: https://www.youtube.com/nilettoАнет Сай:ВК — https://vk.com/anetsaiInstagram — https://www.instagram.com/anetsai/Tik Tok — https://vm.tiktok.com/ZSJRsJ2Vq/YouTube: https://bit.ly/3q72ZH3Музыка Энди Энди:Instagram: https://www.instagram.com/vndyvndy/Production by ECLECTICAhttps://instagram.com/eclectica.proТЕПЛО, НО NILETTOТекст песни:Мы лежим на кровати Я у стенки а ты с краю Я тебя не люблю Соседи раньше слышали лишь нашу любовь Так много поцелуев было прошлой весной Ну а теперь я даже не хочу домой За ссорами скандалы как же бесишь порой Закипает чайник закипаем и мы Раздражаешь полностью с ног до головы Ты тот кого я ненавижу но почему Я все таки тебя...Мы лежим на кровати Я у стенки а ты с краю Я тебя не люблю Я тебя обожаю Мы лежим на кровати Я у стенки а ты с краю Я тебя не люблю Я тебя обожаю Уже на пределе походу выход одинВ начале недели уже не жду выходныхДавай я свалю а лучше Ты убегиВ нашей комнате порядок но бардак в грудиБесполезно кричишь я что-то снова притихЯ что-то снова как псих Брошу Твои чувства в постель это наш стильСердце любит скулит только не уходиНикто не обнимет как ТыМы лежим на кровати Я у стенки а ты с краю Я тебя не люблю Мы лежим на кровати Я у стенки а ты с краю Я тебя не люблю Я тебя обожаю Мы лежим на кровати Я у стенки а ты с краю Я тебя не люблю Я тебя обожаю"
