video_id,title,publishedAt,channelId,channelTitle,categoryId,trending_date,tags,view_count,likes,dislikes,comment_count,thumbnail_link,comments_disabled,ratings_disabled,description
"_zMK3XIbA3M","FOOTBALL vs. SOCCER","2021-03-30T12:51:05Z","UCywGsTdh_qqZUYmA2Gro2CA","Loic Suberville","1","21.07.04","[none]","641760","50055","994","1052","https://i.ytimg.com/vi/_zMK3XIbA3M/default.jpg","False","False",""
"VrhA3bXpTyA","QUE SONT DEVENUS CES RAPPEURS ? (depuis mes vidéos)","2021-04-05T16:57:36Z","UC6Uole8KsZP63g8qYgFAmkQ","Mahdi Ba","23","21.07.04","mahdi ba","205336","27472","111","678","https://i.ytimg.com/vi/VrhA3bXpTyA/default.jpg","False","False","ㄗ∪ＳＳㄚ Ｓㄥ丹ㄚモ尺Chaine secondaire : @MahdiBaTV Contact@mahdiba.com Musique outro : https://www.youtube.com/watch?v=5mTQFzyCJaoTu peux me suivre sur :►TWITTER : https://twitter.com/MahdiBa_►INSTAGRAM: @mahdiba►TWITCH: https://www.twitch.tv/mahdiba"
"fln5lszv_0U","J'AFFRONTE MA PHOBIE","2021-04-05T17:06:27Z","UC9RRAHA3RuA0N0Genbekgrg","AYOUB","20","21.07.04","Ayoub|Kill it with fire|FR|gameplay|araignées|spiders|phobie|phobia|peur","309950","15274","222","1058","https://i.ytimg.com/vi/fln5lszv_0U/default.jpg","False","False","J'essaye de vaincre ma phobie sur Kill It With Fire, un jeu où l'on incarne un exterminateur qui n'a vraiment pas le timeMail pro : ayoubusiness.contact@gmail.comChaîne secondaire → https://bit.ly/3dxYdg9Chaîne musique → http://bit.ly/2EOJg83Twitter → https://bit.ly/2QrUXXWInstagram → ayoub_le_vraiTwitch → https://bit.ly/2zRn5OJMusique de fond : http://www.epidemicsound.com"
"rt-mr0nw3Uo","OUR INTIMATE WEDDING | Jessy Mendiola","2021-04-04T11:00:14Z","UCCzieVWQu_-OpuomauINRVA","Jessy Mendiola","22","21.07.04","JESSY MENDIOLA|JESSY M|JESSY IS IN LOVE|JESSY IN LOVE|SENORITA JESSY|LUIS MANZANO|JESSY|LUIS|JESS|SENORITA|YOUTUBE|YOUTUBE PHILIPPINES|GOOGLE|FASHON|BEAUTY|ART|ACTRESS|PHILIPPINES|HAUL|SHOPPING|MODEL|MAKEUP|TUTORIAL|CHALLENGE|SHOES|BAGS|HOWHOW|PINOY|PINAY|FILIPINA|COLLECTIONS|RECOMMENDATIONS|ABS-CBN|KAPAMILYA|LUIS & JESSY WEDDING|HOWHOW WEDDING|LUIS MANZANO AND JESSY MENDIOLA WEDDING|INTIMATE WEDDING|ECQ WEDDING|DREAM WEDDING|SDE|SAME DAY EDIT|LOVE|WEDDING|FOREVER","4058085","116841","3530","6738","https://i.ytimg.com/vi/rt-mr0nw3Uo/default.jpg","False","False","LUIS MANZANO & JESSY MENDIOLA INTIMATE WEDDINGHopefully, after watching the video, you’ll have huge smiles on your faces and only feel love because with everything that’s been happening in the world, that’s all we want, to share the love and spread some joy to everyone. ❤️To the whole team, we are grateful for each and everyone of you. Thank you for making our wedding day extra special. ❤️#JessGotLucky#LuisAndJessyWedding#OurIntimateWeddingSPECIAL THANKS TO OUR WEDDING TEAM:Videography: Bob Nicolas and teamPhototography: Caliber King and team (Pat Dy’s team) Venue styling: Gideon Hermosa and team Jessy Mendiola Glam Team:Makeup: Kusie HoHair: Anton PapaStylist: Patty YapSponsors:Wedding dress: Patricia SantosShoes: Jefferson SiNails: ExtraOrdinailEyelash Extensions: New LoungeLuis Manzano: Glam Team:Grooming: Peps SelvestreStylist: Rex Atienza/ Jay SarmientoSuit by: Paulo Lazaro Wedding planner and coordination:  “THE” Joanne Angeles, we LOVE you. Thank you for organizing everything. Wedding bands and jewelry: Manila Diamond StudioIntimate dinner sponsored by Lyka and The Farm (special mention to Gibby, Ms. Jenny, Apple and Mr. Preet Singh)Wedding cake: Celestially Baked Special thanks to Ranvel Rufino for helping us out with the venue.To my sister Meggy, thank you for being by my side the whole time. I love you. And of course to Mayor Eric Africa for accommodating us despite his busy schedule.Please do send me your comments after watching the video and don't forget to subscribe!  ❤️❤️❤️Welcome & enjoy! Live life.Love life.Love,Senorita Jessy 🌺💋Subscribe to my Official Channel! https://www.youtube.com/senoritajessyFollow my Official Accounts!INSTAGRAM: http://instagram.com/senorita_jessyFACEBOOK: http://www.facebook.com/LoveSenoritaJessyINQUIRIES: missjessymendiola@gmail.comSHOP NOW:https://senoritaj.ph/PREVIOUSLY: MOST LIKELY TO with My Howhow: https://youtu.be/OuLKB01NqqwJOJOWAIN O TOTROPAHIN GONE WRONG!!! https://youtu.be/_FMYWtIazyoLUIS & JESSY | Our Prenup Music Video: https://youtu.be/RanOI6oZiS0OUR UNIQUE ENGAGEMENT STORY: https://youtu.be/HxPWfxRsv3oMusic in this Video:Song: RepudiumArtist: Roland LewisAlbum: Starting Over Licensed to  YouTube By: MusicbedCopyright Disclaimer:Copyright Disclaimer under Section 107 of the copyright act 1976, allowance is made for fair use for purposes such as criticism, comment, news reporting, scholarship, and research. Fair use is a use permitted by copyright statute that might otherwise be infringing. Non-profit, educational or personal use tips the balance in favour of fair use."
"hzwTq8ZZeyM","Among Us But Impostor Can Hide Bodies","2021-04-04T17:00:14Z","UCMDtoPUno_f-puMpHL3Uuqg","STA Studios","20","21.07.04","[none]","1311186","43439","1444","1968","https://i.ytimg.com/vi/hzwTq8ZZeyM/default.jpg","False","False","► SUBSCRIBE to the Channel! - https://www.youtube.com/user/STAStudios?sub_confirmation=1Please Like and Subscribe"
"nwYVfzC4-xA","Blue Jays vs. Yankees Game Highlights (4/4/21) | MLB Highlights","2021-04-05T01:06:45Z","UCoLrcjPV5PbUrUyXq5mjc_A","MLB","17","21.07.04","[none]","118404","1554","51","169","https://i.ytimg.com/vi/nwYVfzC4-xA/default.jpg","False","False","Blue Jays vs. Yankees Game Highlights (4/4/21) | MLB HighlightsDon't forget to subscribe! https://www.youtube.com/mlbFollow us elsewhere too:Twitter: https://twitter.com/MLBInstagram: https://www.instagram.com/mlb/Facebook: https://www.facebook.com/mlbTikTok: https://www.tiktok.com/share/user/6569247715560456198Visit our site for all baseball news, stats and scores! https://www.mlb.com/"
"d92oWdkJsXA","New Play Control! for Wii - Scott The Woz","2021-04-05T00:00:04Z","UC4rqhyiTs7XyuODcECvuiiQ","Scott The Woz","20","21.07.04","Wii GameCube|GameCube Games|Wii Games|Nintendo Switch|Wii Port|Wii Remake|Nintendo Remake|Nintendo Rerelease|Nintendo Remaster|New Play Control|Wii Menu|Wii Remote|New Play Control Pikmin|Pikmin Wii|New Play Control Mario Power Tennis|Mario Power Tennis Wii|Mario Tennis Wii|Wii U|Nintendo 64|New Play Control Donkey Kong Jungle Beat|Donkey Kong Wii|Donkey Kong Jungle Beat Wii|Metroid Prime Trilogy|Chibi Robo Wii|New Play Control Chibi Robo","1030072","65735","571","3917","https://i.ytimg.com/vi/d92oWdkJsXA/default.jpg","False","False","Scott refuses to play Mario Power Tennis stationary.Twitter: https://www.twitter.com/ScottTheWozFacebook: https://www.facebook.com/ScottTheWoz/Instagram: https://www.instagram.com/scottthewoz/Music Used:Opening Credits from McLintock!Yoshi's Story from Super Smash Bros. MeleeTitle Screen from Paper Mario: The Thousand-Year DoorWorld 1 Map from New Super Mario Bros. WiiMain Theme from Everybody Votes ChannelDawn Savanna from Donkey Kong: Jungle BeatSeptember 2013 from Nintendo eShop (Wii U)Submission Plaza from Check Mii Out ChannelThe Forest of Hope from PikminChallenge Mode from PikminMain Menu from Mario Power TennisArtist on the Court from Mario Power TennisSky Garden from Donkey Kong: Jungle BeatTitle Screen from Donkey Kong: Jungle BeatRumble Falls from Donkey Kong: Jungle BeatPrologue from Metroid PrimeMenu Select from Metroid PrimeVs. Dark Troopers from Metroid Prime 2: EchoesWorld Map from Pikmin 2Title Screen from Chibi-Robo!Midday Majesty from Chibi-Robo!Breakout from 3D Dot Game Heroes"
"U5kgE1Q51M0","Yoga For Renewal   |   Yoga With Adriene","2021-04-05T05:00:11Z","UCFKE7WVJfvaHW5q283SxchA","Yoga With Adriene","26","21.07.04","yoga for renewal|home yoga|45 minute yoga class|45 minute workout no equipment|45 minute yoga workout|45 minute yoga flow|home yoga practice|yoga at home|at home yoga|Adriene Mishler|austin yoga instructor|free yoga|free yoga videos|full yoga class|morning yoga|online yoga|yoga practice|yoga with Adrienne|online yoga class|yoga for happiness|total body yoga workout|total body yoga flow|Total body yoga stretch","210323","6970","77","847","https://i.ytimg.com/vi/U5kgE1Q51M0/default.jpg","False","False","This full class is designed to support the energetics of the body, boost circulation, and guide you back to a whole & healthy state of being. With a special focus on hip release and abductor work to support the back, this session offers opportunity to reset. In an effort to feel whole, put the pieces together, and experience powerful renewal.Expect an integrated practice of guided breathwork, therapeutic repetition, intentional yoga asana to bring warmth and build strength, as well as philosophy to assist you in the process of practicing yoga off the mat and in your daily life. Let me know how this session goes for you in the comment section down below. I love to hear from you. - - - - - - - - - -CONTENTS00:00 Welcome, Tune in, Breath work08:52 Seated Twist warm up10:59 Cat/Cow spinal flexion12:34 Clams, Hip Flossing, Abductor & Glute work19:42 Downward Facing Dog21:22 Child’s Pose22:18 Knee to Nose core activation23:05 Gate Pose Variation26:36 Downward Facing Dog with Variations (3 Legged Dog and Knee to Nose.)27:32 Low Lunge28:45 Low Lunge Twists29:17 Plank Pose, Core work29:36 Cobra33:58 Peak Pose: Gate Flow37:43 Thread the Needle restore- - - - - - - - - - ❤️SUBSCRIBE to the YWA channel for free yoga videos every week and to support high-quality free yoga for all! ❤️https://www.youtube.com/user/yogawithadriene?sub_confirmation=1- - - - - - - - - - 🧘🏽‍♂️🧘‍♀️Become a FWFG YOGA member! 🧘🏻‍♂️🧘🏿‍♀️https://fwfg.comJoin Find What Feels Good and access over 700 videos including yoga and meditation for all levels. Explore daily practices, workshops, in depth learning, weekly or monthly accountability series, and an opportunity to connect with a one of a kind global community. This is your one stop shop for yoga, creativity, wellness, and all things FWFG. Try it FREE for 7 Days! - - - - - - - - - - 🗓Get your FREE Yoga Calendar: 🗓http://yogawithadriene.com/calendar/- - - - - - - - - - More at www.yogawithadriene.com▶︎ Instagram: @adrienelouise▶︎ Twitter: @yogawithadriene▶︎ Facebook: Yoga With Adriene▶︎ Shop: https://shop.fwfg.com- - - - - - - - - - Music by Shakey Graves: https://www.shakeygraves.com- - - - - - - - - - Yoga With Adriene, LLC recommends that you consult your physician regarding the applicability of any recommendations and follow all safety instructions before beginning any exercise program. When participating in any exercise or exercise program, there is the possibility of physical injury. If you engage in this exercise or exercise program, you agree that you do so at your own risk, are voluntarily participating in these activities, assume all risk of injury to yourself."
"T3-SnH7J3RI","OFFICIAL SSundee FOOT ROLE (Among Us)","2021-04-05T11:00:06Z","UCke6I9N4KfC968-yRcd5YRg","SSundee","20","21.07.04","[none]","2966219","174013","2326","14989","https://i.ytimg.com/vi/T3-SnH7J3RI/default.jpg","False","False","We add an IMPOSTER Foot ROLE in Among Us🔔 Subscribe & click the bell!  https://www.youtube.com/user/SSundee?sub_confirmation=1👍 Hit the Thumbs Up if you liked this video! 🤖 My Friends! 🤖@Nicovald @Henwy @Ambrew @Sigils @GarryBlox @LoafX @Biffle @helloiamkate Zud: https://www.youtube.com/channel/UCgYJLAsnjCZk9ocyIywgbiQMap Maker: @LoafX ❗️ Follow Me! ❗️Twitter: https://www.twitter.com/SSundeeDiscord: https://discord.gg/SSundeeInstagram: https://instagram.com/ssundeeytFacebook:  https://www.facebook.com/pages/SSundee/200010033358843👨🏻‍🍳 Awesome Video Editor ► Russellhttps://www.youtube.com/russelledits👨🏼‍🎨 Awesome Thumbnail Maker ► Flashhttps://www.youtube.com/channel/UCLy01oVLarj7RNQm52jnGKw🎨 Awesome Animator ► Davidhttps://www.youtube.com/channel/UCxSSIQevKsx2bFc_Gn4WAMg?view_as=subscriber🔥 Other Among Us Videos! 🔥No Kill Cooldown: https://youtu.be/31ff5uVzOnoMAX Difficulty: https://youtu.be/XpQCze7XsuMMedic Mod: https://youtu.be/WN_gW7yvM4k🎶 Music by Ninety9 ► LivesTobu - Such FunVideo Link: https://www.youtube.com/watch?v=d3Oc26AFDdUChannel: https://99l.tv/SubscribeDownload the album! https://99l.tv/Levelup-iThanks for watching!"
"Uff2ESprNJ4","Clash Royale: 🔥 P.E.K.K.A's PLAYHOUSE 🔥 New Season! Unlock Magic Items!","2021-04-05T08:01:17Z","UC_F8DoJf9MZogEOU51TpTbQ","Clash Royale","20","21.07.04","Clash Royale|Clash Royale Game|Supercell|Supercell Game|Clash Royale Supercell|Mobile Game","1546503","30121","844","1315","https://i.ytimg.com/vi/Uff2ESprNJ4/default.jpg","False","False","#ClashRoyale  #MagicItemsWelcome to P.E.K.K.A's PLAYHOUSE!New Pass Royale Rewards!Unlock the BOOK OF BOOKS with Pass Royale and many more MAGIC ITEMS!Unlock an epic P.E.K.K.A Tower Skin and Emote with Pass Royale!Play with a Boosted P.E.K.K.A!Subscribe for more! ►► http://supr.cl/SubRoyaleEnter the Arena! From the creators of Clash of Clans comes a real-time multiplayer game starring the Royales, your favorite Clash characters and much, much more.Collect and upgrade dozens of cards featuring the Clash of Clans troops, spells and defenses you know and love, as well as the Royales: Princes, Knights, Baby Dragons and more. Knock the enemy King and Princesses from their towers to defeat your opponents and win Trophies, Crowns and glory in the Arena. Form a Clan to share cards and build your very own battle community.Lead the Clash Royale Family to victory!FEATURES• Duel players from around the world in real-time in both 1v1 and 2v2 Battles• Earn chests to unlock rewards, collect powerful new cards and upgrade existing ones• Destroy opponent's towers and win Crowns to earn epic Crown chests• Build and upgrade your card collection with the Clash Royale Family along with dozens of your favorite Clash troops, spells and defenses• Construct your ultimate Battle Deck to defeat your opponents• Progress through multiple Arenas all the way to the top• Form a Clan to share cards and build your very own battle community• Challenge your Clanmates and friends to a private duel, or play side-by-side in a 2v2 Battle• Work together with your Clan to unlock Clan Chests• Play new events every week• Learn different battle tactics by watching the best duels on TV RoyalePLEASE NOTE! Clash Royale is free to download and play, however, some game items can also be purchased for real money. If you don't want to use this feature, please disable in-app purchases in your device's settings. Also, under our Terms of Service and Privacy Policy, you must be at least 13 years of age to play or download Clash Royale. A network connection is also required.Support:Are you having problems? Visit http://supercell.helpshift.com/a/clash-royale/ or contact us in-game by going to Settings, Help and support.Privacy Policy:http://supercell.com/en/privacy-policy/Terms of Service:http://supercell.com/en/terms-of-service/Parent's Guide:http://supercell.com/en/parents/#ClashRoyale"
"eAFlpLgSGo8","ALONE IN NEW YORK","2021-04-04T17:23:09Z","UC78cxCAcp7JfQPgKxYdyGrg","emma chamberlain","24","21.07.04","emma chamberlain|emma chambie|vlog|new york|traveling alone","3001426","255131","840","13938","https://i.ytimg.com/vi/eAFlpLgSGo8/default.jpg","False","False","new york vlog #2 coming soon.... love you ✩ CHECK OUT (my company) CHAMBERLAIN COFFEE ✩✭ website: https://www.chamberlaincoffee.com ✭ instagram: https://www.instagram.com/chamberlaincoffee✭ twitter: https://twitter.com/chamberlaincof✭ tiktok: @chamberlaincoffee✩ MY PODCAST ✩✭ search Anything Goes on spotify, apple podcasts, or wherever else you get your podcasts...✩ MY SOCIAL MEDIA ✩✭ instagram: https://www.instagram.com/emmachamberlain✭ tik tok (lol): emmachamberlain✭ spotify: http://open.spotify.com/user/emmachambie I LUV U,-emma chamberlain"
"THA6rVoNKaU","Proteas vs Pakistan | 2nd #BetwayPinkODI Highlights | Imperial Wanderers Stadium, 4 April 2021","2021-04-04T20:24:11Z","UCzevPCfP7MtRqOB0ZkU5cwg","Cricket South Africa","17","21.07.04","-	Cricket|-	Cricket highlights|-	South Africa","9104978","129095","11491","0","https://i.ytimg.com/vi/THA6rVoNKaU/default.jpg","True","False","DOWNLOAD THE CSA APP https://csa.app.link/pu7eNVzJefbHighlights from the 2nd #BetwayPinkODI between South Africa and Pakistan taking place at Imperial Wanderers Stadium."
"G1hNeVaErR8","Every Minecraft Staircase in 13 Minutes or Less","2021-04-04T15:33:17Z","UC3xZYc4SZUGfRERIvDRGqDQ","Skip the Tutorial","20","21.07.04","[none]","1786645","80791","1736","2975","https://i.ytimg.com/vi/G1hNeVaErR8/default.jpg","False","False","29 Minecraft Staircases You Can Make in 13 Minutes or Less! Did you ever wonder how many staircases you can make in 781 seconds? If so, then we are building every possible minecraft stairs system (that we could think of) in this video. Minecraft staircases can be very straightforward, or incredibly insane. So, whether it's a cake ladder, iron golem staircase, a working escalator, and more, we're talking about it today in this Skip the Tutorial list video! Let's see almost every Minecraft method for a staircase you can build, from practical to just plain crazy.▪Want more? Subscribe Today! ▶https://goo.gl/ZDDJit-OTHER LINKS-▪Follow me on Twitter ▶https://twitter.com/skipthetweets▪Join the Discord ▶https://discord.gg/eqxaSVH▪Check out my Twitch ▶https://www.twitch.tv/skipthetutorial▪Check out my Instagram ▶https://www.instagram.com/skipthetutorial/▪Character done by MagnaGallina ▶https://twitter.com/MagnaGallinaEdited by: https://haleyascharf.com​​Research and map by Jonah WaltersFootage collected by Frankie Mundo------Texture Pack: Vanilla Tweaks https://vanillatweaks.net/picker/resource-packs/------Some music used in this video is courtesy of Mewmore. Make sure to follow their tracks at https://www.youtube.com/user/Mewmore------Portions of this video are copyrighted and owned by Nintendo, and their use is allowed by the Nintendo Game Content Guidelines for Online Video & Image Sharing Platforms (https://www.nintendo.co.jp/networkservice_guideline/en/index.html?n).  All other original content, unless expressly noted otherwise, is ©2021, by the Skip the Tutorial creator, all rights reserved.------Other Credits:Easy Minecraft Builds: Curved/Spiral Staircase Tutorialhttps://youtu.be/MAmyFt6zPosThe steepest walkable staircase possible in 1.16https://www.reddit.com/r/Minecraft/comments/inpzob/the_steepest_walkable_staircase_possible_in_116/The highest 1 block staircase (40 blocks tall) using only unique blockshttps://www.reddit.com/r/Minecraft/comments/de99yt/the_highest_1_block_staircase_40_blocks_tall/This cool hidden staircase that uses the new wall properties.https://www.reddit.com/r/Minecraft/comments/f1eiav/this_cool_hidden_staircase_that_uses_the_new_wall/Minecraft's Longest Staircase, now for 1.16! Currently 18 Blocks Long.https://www.reddit.com/r/Minecraft/comments/ja8dr6/minecrafts_longest_staircase_now_for_116/New Dripstone Horse Staircase in 1.17https://www.youtube.com/watch?v=6JiKlDMi8Ww"
"gsoTKXA1KEs","I Finally Got My Own Show | Dixie D'Amelio","2021-04-04T17:00:13Z","UCLOEGprmycLLbyzBj2jozLg","Dixie D'Amelio","22","21.07.04","dixie damelio|dixie d'amelio|dixie|damelio|be happy|music video|tik tok|dixie damelio be happy|dixie d'amelio be happy|charli damelio|charli d'amelio|tiktok|charli|d'amelio|exclusive|ᗷᕼᑌᗴᔕᒍYᗴᔕ|marc d'amelio|heidi d'amelio|talkshow|show|dog|dogs|me|fun|laugh|the dixie d'amelio show|hollywood fix|marc|heidi|the early late night show|telns|early late night show|vfx","1435657","93671","10300","8415","https://i.ytimg.com/vi/gsoTKXA1KEs/default.jpg","False","False","I'M BACK!!!! The Early Late Night Show returns bigger and better than ever!! I'm so excited to air this second season of my talk show. It's all because of you that the Dixie D'Amelio Show evolved into this. We have some awesome episodes and amazing guests this season I cannot wait for you to see! Every Sunday at 10AM PST/1PM EST!!! Thanks for watching! CreditsExecutive Producer: Dixie D'AmelioExecutive Producer: Tommy BurnsExecutive Producer: Christian GuitonDirector: Christian GuitonDP: Seth FullerEditor/VFX: Luke KnezevicEditor: Diego ColeProduction Company: Black Street EntertainmentStudio: Hubble StudioWebsite: https://www.dixiedamelio.comSubscribe for more official content from Dixie: https://www.youtube.com/dixiedamelio?sub_confirmation=1Connect with me!TikTok: https://www.tiktok.com/@dixiedamelioInstagram: https://www.instagram.com/dixiedamelioTwitter: https://twitter.com/dixiedamelioWebsite: https://www.dixiedamelio.comWe love our Tov chairs!https://tovfurniture.comCheck out my merch: https://dixiedamelio.shop/#DixieDAmelio #TheEarlyLateNightShow"
"XxlsLmHwCSk","ASTRO 아스트로 - ONE M/V","2021-04-05T02:59:59Z","UC3Ea2-Ut3navgOlTfoq790g","fantagio 판타지오","24","21.07.04","fantagio|판타지오|fantagiomusic|판타지오뮤직|아스트로|ASTRO|MOONBIN|문빈|2nd Full Album|정규 2집|올유얼스|All Yours|ONE|원|티저|TEASER|JINJIN|MJ|CHAEUNWOO|YOONSANHA|ROCKY|라키|윤산하|진진|차은우|엠제이|산하|은우|MV|뮤직비디오|Music Video|ONE M/V|M/V","11156838","479759","3560","100919","https://i.ytimg.com/vi/XxlsLmHwCSk/default.jpg","False","False","#ASTRO 2ND FULL ALBUM [#All_Yours] #ONE M/V OPEN!☝️2021. 04. 05 6PM (KST) RELEASE▶ Twitter : http://twitter.com/offclASTRO​▶ Facebook : http://facebook.com/offclASTRO​▶ Instagram : https://www.instagram.com/officialastro​▶ Weibo : http://weibo.com/officialASTRO​▶ Fancafe : http://cafe.daum.net/fantagio-boys"
"-Ih5UArd4zk","WENDY 웬디 'Like Water' MV","2021-04-05T09:00:00Z","UCEf_Bc-KVd7onSeifS3py9g","SMTOWN","10","21.07.04","[none]","5804458","817869","6947","107301","https://i.ytimg.com/vi/-Ih5UArd4zk/default.jpg","False","False","WENDY's 1st Mini Album Like Water is out!Listen and download on your favorite platform: https://smarturl.it/WENDY_LIKEWATER[Tracklist]01 When This Rain Stops02 Like Water03 Why Can't You Love Me?04 초행길 (The Road)05 Best Friend (with SEULGI)WENDY Officialhttp://www.youtube.com/redvelvethttp://www.facebook.com/RedVelvethttp://www.instagram.com/redvelvet.smtownhttps://www.tiktok.com/@redvelvet_smtownhttps://www.vlive.tv/channel/DCF447http://twitter.com/RVsmtown#WENDY​ #웬디​ #Like_WaterWENDY 웬디 'Like Water' MV ℗ SM Entertainment"
"9oO1kw_O8qg","HOW I BECAME NLE CHOPPAS BARBER 💈 TIKTOK VICBLENDS 🔥  #shorts","2021-03-24T22:50:14Z","UCR6Jv1wniCG_3gdCo_f8_qA","VicBlends","22","21.07.04","Vicblends|Nle choppa|Vic blends|Vicblends tiktok|Nle choppa music|Nle choppa walk em down|Best rappers in 2021|Best rappers of all time|Nle|No love entertainment|Top shotta|How to become a barber|How to cut hair|How to do a fade haircut|How to fade your own hair|How to cut hair at home","4057318","327229","9196","2588","https://i.ytimg.com/vi/9oO1kw_O8qg/default.jpg","False","False","Whats up yall this is a video from my TikTok explaining how I became NLE Choppas barber! Feel free to follow me on TikTok, Instagram, or Twitter @vicblends for more micro content like this! #vicblends #nlechoppa #barber"
"6kLb8_57NQ8","Je DÉMASQUE le FAKE UNCHAINED...(La Vérité)","2021-04-04T16:27:12Z","UCiFyJ_EBmF2XJuR9buWE_3A","Unchained_Off","20","21.07.04","unchained fortnite|fortnite battle royale|battle royale|fortnite|fortnite saison 6|fortnite mise à jour|Unchained|Unchained_Off|Fortnite|top 1|fortnite gameplay|saison 6 chapitre 2|défi fortnite|fortnite challenge|enfant|arnaque|v-bucks|troll fortnite|arnaqueur fortnite|skin rare fortnite|fortnite j'arnaque|arnaque skin fortnite|j'arnaque sur fortnite|il me donne son compte fortnite|fake unchained|Je DÉMASQUE le FAKE UNCHAINED|fake unchained la vérité|hack","743593","64847","943","2943","https://i.ytimg.com/vi/6kLb8_57NQ8/default.jpg","False","False","Téléchargez Gratuitement Wondershare Filmora: https://bit.ly/3dq3xTTOu l'appli mobile Wondershare FilmoraGo: https://filmora.page.link/unchainedApprenez le montage pour débuter sur votre Youtube chaîne: https://bit.ly/3iN4TKi💖CODE UNCHAINED dans la boutique # ad 🔥Mon discord pour participer aux vidéos : https://discord.gg/W6e8jd3​​​​​ ❤️MON INSTA : unchained_off (pour des story exclusives)💙Twitter : https://twitter.com/UnchainedYtb​​​​​💜Live sur twitch : https://www.twitch.tv/unchainedsurtwitch​🖤Mon Tik Tok : unchained_off💛SNAP : UnchainedYTJe DÉMASQUE le FAKE UNCHAINED...(La Vérité)Ce FAKE UNCHAINED s'est fait PASSER pour moi... (il arnaque des abonnés)"
"mfyox_CdOtQ","10 annoying moments EVERYONE has been through in adopt me...","2021-04-05T00:22:07Z","UCtgtZLmGwmTmAp1MHJ8koyg","FadedPlayz","20","21.07.04","[none]","470352","13374","353","3723","https://i.ytimg.com/vi/mfyox_CdOtQ/default.jpg","False","False","Can you relate?🤣You can NOW USE ⭐️ STAR CODE: ‘FADED’ when buying robux, premium, or a roblox gift card!FOLLOW ME ON ROBLOX: YTFadedPlayzTo Join My Game!🧃My Roblox GROUP!!!🧃 https://www.roblox.com/groups/6908174/FadedArmy#!/about ✨My Socials✨🦋Twitter🦋~ https://twitter.com/TheFadedPlayz🦄TikTok🦄~ https://vm.tiktok.com/J2GS3gq/🐶Roblox Profile🐶~ https://www.roblox.com/users/1645551250/profile☃️Discord Fan Server☃️~ https://discord.gg/UxxZ7aGVWD"
