video_id,title,publishedAt,channelId,channelTitle,categoryId,trending_date,tags,view_count,likes,dislikes,comment_count,thumbnail_link,comments_disabled,ratings_disabled,description
"kCOnN3aeHN4","Il s'est fait tatouer nos 2 visages sur la cuisse, nous allons donc le surprendre en Belgique.","2021-02-28T09:00:55Z","UCtxhwJ-6n4_C6ElALThD25Q","Mcfly et Carlito la chaîne secondaire","22","21.01.03","[none]","1643574","156222","1535","6810","https://i.ytimg.com/vi/kCOnN3aeHN4/default.jpg","False","False","Avoir nos 2 énormes tronches gravées à vie sur sa cuisse, telle est la vie que Ben a décidé de mener.Il était bien normal que nous trouvions un moyen de le régaler.C'est fou d'avoir fait ça, ça nous touche tellement. C'est... bordel c'est fou.Merci encore à Céline qui nous a grandement aidé dans cette surprise ! T'es la best ! Suivez les sur Insta : https://www.instagram.com/cherryb.tattoo/https://instagram.com/benowltattoo?igshid=yed1wymfhxtuOn est testés avant chaque tournage. On doit en être, sans exagérer, à 751994 tests.Merci à Sixt Bruxelles d'être si cools à chaque fois ahah !DISCLAIMER : faites attention, un tatouage c’est pour la vie, ne prenez pas ça à la légère, quelque soit l’affection que vous nous portez.Monteurs : Florian Hautekiet - Jérôme Fillette Vignette : Antoine Behaeghel - Moodmaker Directrice de production : Camille Selosse Chargées de production : Élise Porcher - Blanche Martin Assistants de production : Marie Barthelemy - Arthur MillerStagiaire de production : Serena San VincenteRien à voir mais vous avez écoutez le podcast Mugshots sur Spotify ? C'est terriblement intéressant, surtout celui de Justin Bieber. Voilà. Bisous.Rien à voir mais l'accrobranche de Coudou Parc à Six fours les plages est excellent. Voilà. Bisous.Rien à voir mais honnêtement des bonnes fajitas au poulet, avec le guacamole bien tendre, la crème fraîche, le poulet savoureux et quelques épices, c'est vraiment incroyable. Voilà. Bisous.Rien à voir mais la chaîne Youtube Vilebrequin est assez géniale. Voilà. Bisous.Rien à voir mais n'oubliez jamais que le rpg CHRONO TRIGGER est l'alliance entre la team de Final Fantasy ET de Dragon Ball. D'où ce jeu sublime. Voilà. Bisous."
"gZ3LNF6XLek","ON AVOUE NOS PIRES SECRETS 5 avec Marine LB & Chloë","2021-02-28T17:34:16Z","UCJtvlB_Z-Sge7Ok-NxCjbqg","Darko","24","21.01.03","[none]","353263","42318","137","682","https://i.ytimg.com/vi/gZ3LNF6XLek/default.jpg","False","False","Allez voir la vidéo qu'on a fait sur la chaine de Marine !!!:https://youtu.be/qv_I5_D_RQYChaine de Chloé : https://www.youtube.com/channel/UCMaS7Dvkue-CEGIZOFn3EcAMon Instagram : http://instagram.com/darkocttgMon Snapchat : DreamzstoryMon Twitter : http://twitter.com/darkocttgMon Facebook : http://facebook.com/darkocttgMerci à mon frère pour son énorme implication dans la vidéo :http://instagram.com/ZlatkoBzZlatko Snapchat : tsm_chaoxMusique : Bensound, epicsoundmusic"
"qv_I5_D_RQY","JE FAIS LE SHOPPING DE DARKO","2021-02-28T17:29:45Z","UCpeLQhRiHb3DiAFVyAQummw","Marine LB","26","21.01.03","marine lb|darko|marinelbars|shopping|asos|relooking|fait mon shopping|mon copain fait mon shopping|je fais le shopping de mon copain|try-on|haul","229796","28784","119","483","https://i.ytimg.com/vi/qv_I5_D_RQY/default.jpg","False","False","j'ai choisi des tenues incroyables je mérite clairement un 1000/10(mets un emoji ⚡️ si Darko a le même corps que Mcfly)OUBLIE PAS DE T'ABONNER POUR ME FAIRE GAGNER UN MAX DE YOUTUBE MONEYLa vidéo de @Darko : https://youtu.be/gZ3LNF6XLekLa vidéo où Darko fait mon shopping : https://youtu.be/w0HRdS8xkqgTU PEUX AUSSI ME SUIVRE ICI:Instagram : http://www.instagram.com/marinelbars/Twitter : http://twitter.com/marinelbarsSnapchat: marinelbarsTikTok : @marinelbarsAdresse mail PRO uniquement: marinelb.pro@gmail.comMa dernière vidéo JE TESTE UNE MARQUE D'INSTAGRAM : https://youtu.be/wOTA2DMk5hMMon lien de parrainage iGraal: https://fr.igraal.com/?parrain=AG_5954f6828b819_______________________________________________Merci à Malfoy LBC pour la musique de mon intro !Son insta : https://www.instagram.com/malfoooyy/Sa page Spotify : https://open.spotify.com/artist/5JyUYtYr5NpQmBTOAGG7S6_______________________________________________Cette vidéo n'est pas sponsorisée !"
"XBezEiXAYtU","ON FAIT (pas) UN HIT Feat. @SQUEEZIE","2021-02-28T12:00:38Z","UCow2IGnug1l3Xazkrc5jM_Q","JOYCA","24","21.01.03","Joyca|Youtunes|musique|parodie|redbox|diy|video|reaction|Français|squeezie|son|hit|sample","1763945","214835","986","8469","https://i.ytimg.com/vi/XBezEiXAYtU/default.jpg","False","False","On s'est baladé sur un site qui permet d'écouter ce qu'écoutaient les gens à la radio en 1900,1920,1950,2000 dans tous les pays du monde, pour ensuite trouver un sample et en faire un son....... Et on a craqué.La chaine de Squeezie : https://www.youtube.com/channel/UCWeg2Pkate69NFdBeuRFTAw👉 LIVE/TWITCH : https://www.twitch.tv/joyca/videos👉 INSTAGRAM : Joyca👉 TWITTER : https://twitter.com/JoycaOff👉 TIK TOK : @joycaledelire_______👉 JOYCA MUSIC : https://www.youtube.com/channel/UCZakU1z0jijzvw940Hwmlxg/👉 LIL JOYCA : https://www.youtube.com/channel/UCgANFlYnbE47942AoazfNsg➤➤➤ Pour toutes demandes professionnelles ou commerciales : Youtunes.contact@gmail.com"
"xtcVwuauVV0","ATEEZ(에이티즈) - ‘불놀이야 (I'm The One)’ Official MV","2021-03-01T09:00:00Z","UCQdq-lqPEq_yZ_wP_kuVB9Q","KQ ENTERTAINMENT","10","21.01.03","KQ|케이큐|에이티즈|ATEEZ|HONGJOONG|SEONGHWA|YUNHO|YEOSANG|SAN|MINGI|WOOYOUNG|JONGHO|홍중|성화|윤호|여상|산|민기|우영|종호|김홍중|박성화|정윤호|강여상|최산|송민기|정우영|최종호|KPOP|KPOP MV|KPOP Music video|ATEEZ Music Video|ATEEZ MV|ATEEZ FEVER|ATEEZ ZERO FEVER PART 2|에이티즈 제로 피버 파트투|ATEEZ 제로 피버 파트투|불놀이야|Fireworks|에이티즈 불놀이야|ATEEZ Fireworks|Fireworks MV|불놀이야 뮤비|불놀이야 뮤직비디오|Fireworks 뮤비|Fireworks Music Video|에이티즈 불놀이야 뮤직비디오|ATEEZ Fireworks 뮤비|에이티즈 불놀이야 뮤비|에이티즈 Fireworks 뮤비|ateez fireworks|ATEEZ 불놀이야","1286798","405522","1896","74343","https://i.ytimg.com/vi/xtcVwuauVV0/default.jpg","False","False","Melon ▶ https://kko.to/aj3brJeDogenie ▶ https://bit.ly/3uKpfdsiTunes ▶ https://apple.co/3kwDY6ZSpotify ▶ https://spoti.fi/3r3D4kIRelease Date: 2021. 3. 1. 6PM (KST)▶ ATEEZ Official Homepage:http://ateez.kqent.com▶ ATEEZ Official V LIVE: http://channels.vlive.tv/C057DB▶ ATEEZ Official Facebook:https://facebook.com/ATEEZofficial▶ ATEEZ Official Twitter:https://twitter.com/ATEEZofficial▶ ATEEZ Official Instagram:https://instagram.com/ATEEZ_official_▶ ATEEZ Official Fancafe:http://cafe.daum.net/ATEEZ▶ KQ Official Homepage: http://kqent.com▶ KQ Official V LIVE: http://channels.vlive.tv/CB8675▶ KQ Official Facebook: https://facebook.com/kqent▶ KQ Official Twitter: https://twitter.com/kqent▶ KQ Official Instagram:https://instagram.com/kqent#ATEEZ #에이티즈 #FEVER_Part_2"
"5CEEFndnSxA","LA CHIRURGIE ESTHÉTIQUE - NINO ARIAL Feat Isabelle Arnaud, Miss Serbia et Alexis Le Rossignol","2021-02-28T16:43:03Z","UC_3PmpXhpgfBXuFHWaTrTfA","Nino Arial","23","21.01.03","nino|arial|vidéo|original|marrant|stand|up|humour|podcast|drôle|style|youtubeur|sketch|humoriste|tatouage","150742","18315","120","606","https://i.ytimg.com/vi/5CEEFndnSxA/default.jpg","False","False","🏨 Installez Grand Hotel Mania gratuitement et commencez votre aventure hôtelière:https://clcr.me/GHM_NinoArialAjoutez moi sur insta et sur twitch !!!! Merci à Isabelle Arnaud , Miss serbia et Alexis le rossignol  d’avoir participés à cette vidéo.Instagram D’isabelle: Instagram de Miss Serbia: Instagram d’alexis: Merci aussi à Clément dugoujon qui a co-réalisé et monté cette vidéo Insta de clément : https://www.instagram.com/clementdugoujon/?hl=frEt merci à Sébastien Lixandru D’avoir co-réalisé cette vidéo:Insta de Seb : https://www.instagram.com/sebastienlxd/?hl=frPour les music j’ai utilisé celles libre de droit sur youtube mais j’ai aussi calé les sons de potes que je kiff !!!Keven Aleas:facebook: https://www.facebook.com/iamaleasmusicyoutube: https://www.youtube.com/channel/UCqxDA2ht0PLgC49muF-Rztg/Et MATE ORIGINAL : youtube: https://www.youtube.com/channel/UCdvr086mP0a_tRMm-NbUh1gFacebook: https://www.facebook.com/MateOriginalOfficiel/J’ai ouvert un resto / fast-food indien à paris moi aussiAu 13 rue de bagnolet 75020 PARISOuvert tous les jours de 11h à 23h ( sauf le mercredi )Livraison sur Uber Eat et Deliveroo ( Tout est halal )J’espère que vous allez tous venir gouter c’est une TUERIE !!!!!!! ( Les gens au régime, venez pas c’est mieux pour vous haha)Site : linktr.ee/indianstreetfoodparisInstagram : https://www.instagram.com/indianstree...allez tchuss maniac !!!!"
"3QJyyYhuLzs","GAZO - Bail 2 Sneakers","2021-02-28T18:01:39Z","UCOV30hLlzXc4eWVy2HVhN-g","Ptit Delire Tv","24","21.01.03","gazo|clip gazo|freestyle gazo|bail 2 sneakers|drill fr|drill|freeze corleone|hamza|tiakola|ashe 22|rap|entertainment|baloo|la graillance|tchin 2x|gims","101535","11033","37","635","https://i.ytimg.com/vi/3QJyyYhuLzs/default.jpg","False","False","Abonne-toi https://www.youtube.com/ptitdeliretv​​ Suis-nous sur insta https://bit.ly/3ukAskC​​ Interview BAIL 2 SNEKAERS avec GAZO par BALOOS/o Afterdrop Retrouve nos playlists ⬇️► Carton PL1 https://bit.ly/3brjY1n​► La Graillance https://bit.ly/3dBCE1g​ ► Bail 2 Sneakers  https://bit.ly/3sg2DPH​► Ptit Delire Show http://bit.ly/2gRSjvG​► Interviews https://bit.ly/3sfunE7​© Green Garden 2021"
"eYO7Ccj1Iok","DES MEILLEURES AMIES ECHANGENT LEURS VIES PENDANT 24 HEURES","2021-02-28T20:13:20Z","UCDkl5M0WVaddTWE4rr2cSeA","Léna Situations","22","21.01.03","lena situations|lena|lena situation|situations|solene|meilleure amie|lifestyle|on échange de vie|vlog","496938","58906","178","1418","https://i.ytimg.com/vi/eYO7Ccj1Iok/default.jpg","False","False","Je connais ma meilleure amie Solene depuis 22 ans, on a grandit ensemble, vécues toutes les étapes de notre petite vie ensemble et on se connait par coeur. Pourtant je suis sure qu’on peut aller encore plus loin dans la connaissance de notre amitié.... Comment ? En échangeant nos vies pendant 24h. Moi dans ses baskets a Strasbourg en tant qu’infirmière et elle dans mes talons à Paris en tant qu’influenceuse. -------------------------✰ MON LIVRE TOUJOURS PLUS ✰‣ Commande mon livre de développement personnel ici: https://tidd.ly/3bqgwDD​​ ‣ en format livre audio ici : www.audible.fr/lena------------------------TOUTES LES INFOS ⇩ ⇩ ⇩ ⇩ mon makeup  ⇩‣ CC crème Erborian  ||  https://bit.ly/3cFFeTl  ( ♥♥♥♥)‣ shape tape Tarte || https://bit.ly/3e2xrzs mes tenues ⇩▹ dans l'outro: ‣  jean mom levis || https://bit.ly/37XCg9x‣  top noir a lacets || https://bit.ly/37V5kPc 30€▹ ce que Solene porte:‣ boucle d'oreille visage || Persee Paris‣ combi-short en similicuir misguided || https://bit.ly/3uQgdeW------------------------✰ SUIVEZ MOI ✰ instagram ‣ @lenamahfouf twitter ‣ http://twitter.com/lenasituations​​tiktok  ‣ https://vm.tiktok.com/Cf7evy/​​ @lenasituations------------------------✰ MERCIS ✰Un grand merci à Erborian d'avoir accepté d'être le premier sponsor de Solene Situations. A Théo et Raphael pour les fleurs et tout le coté humain de nos collaborations.Merci à Tristan pour les photos.A la dame âgée dans la rue qui m'a fait beaucoup rire. A la famille de Soso de m'avoir accueilli comme quand j'étais petite.Et à Soso pour ces 23 dernières années de fou rire.------------------------✰ Copyright ✰  ( volez pas mes vidéos svp )  ▹ VIDÉO ÉCRITE ET DIRIGÉE PAR LENA MAHFOUF▹ PRODUCTION ET MONTAGE LENA MAHFOUF✰ MONTAGE & EQUIPEMENT DE TOUS LES JOURS ✰ ‣ Final Cut Pro X sur iMac ‣ Grosse caméra:  Canon 6D ||| https://bit.ly/37cPEqf​​‣ Caméra de vlog: Canon G7X Mark III https://bit.ly/3a5pnMr​​‣ Mon ordinateur portable : https://bit.ly/37ZhWnB​​‣ Mon ordinateur de bureau : https://bit.ly/3oPsV9W​​‣ Mes lumières: https://bit.ly/3neRVXO​​✰ F A Q ✰quel est ton nom? Léna Mahfouf ton instagram? @lenamahfoufton twitter? @lenasituationstu as quel age? 23 ans ( 19 novembre 1997, vive les scorpions )tu mesures combien? 1m65tu habites seule ? oui! :) ----------------------------------------------------------------------------------------------------Commente  j'ai les pétoches si tu as lu la barre d'info en entier. :p-----------------------------------------------------------------------------------------------------▹ Cette vidéo contient une séquence sponsorisée par Erborian."
"qewlxRemfk0","BEAU PAPA ET MOI 2 : L'ENTERREMENT DE VIE DE GARÇON","2021-02-27T10:17:31Z","UCc-4HSPd7yMcK1Y5XkVVwGQ","ludovik","23","21.01.03","[none]","802595","69176","1164","1517","https://i.ytimg.com/vi/qewlxRemfk0/default.jpg","False","False","Après la rencontre avec Beau-Papa, le deuxième plus beau jour de ma vie.Abonnez-vous : https://bitly.com/2oTk91e -Le lien de mon instagram http://www.instagram.com/Ludovik​Réalisé par LudovikÉcrit par Ludovik, Guillaume Natas & Florent SteinerDirection éditoriale par Guillaume NatasAvec Ludovik, Alice Llenas, Gil Garyas, Donia Eden, Dylan White, Sengan Memphis, Nicolas Lumbreras, Guillaume Natas, Axel Andlauer, Anastasia Markovic, IbraTV, Raphaël Rajabian, Victor Lecocq, Artus Lecocq, Monsieur Poulpe, MyriamBig BOSS LouHomme de main de Ludovik est Richard OrtillonAssistante réal Léa RouaudStagiaire assistant réal Maxence de PassemarRégisseur général Jim LebihanRégisseur renfort Sébastien BoullardSon par Antoine Caracci, & Basile Catelin Image par Matthieu Misiraca Drone : Whiplash FPV et 303 PRODEtalonnage par Florian Martiny - KeepGradingSuper Électro Lauriane PataudStagiaire électro Barthélemy Auguin Assistante camera Lola GeslinStagiaire caméra Théo GautierMake up by SoAgency - Sonia Allal & Lilly LizéMaquillage FX Christophe Pizzeta & Fabrice HerbetConstruction ARTECH DECOCascadeurs Fred Alhinho et Serge DausqueMontage par Quentin EidenMontage son / mixage : KR-SOUNDAssistante monteur Zoé WilliamsonMusique par FREAKSFX par Hugo GuillemardGraphisme print Tony LouvainTraduction et sous-titrage par Séverine Decolasse Merci à Lou, Lou et Lou, Paulo d'IDZ PROD, Dan, Greg le roux, François de Elastique Record, Arthur Schoeller, le Zèbre de Belleville,  Gilles de Abel14, Séverine, Dylan White Paris best dancer in town, Leia, Opale, Grégoire, Enaelle, Manon, Chelsie, Kyle, Benoit Finck, Simone, Huguette, Lucile Raynal, Chloé Sananikone, Aymeric Dein, Léa Dufour, Martine Maurel, Alexis De Koninck, Harith Jaiel, Olivier Zambon, Margot Woog, Virginie Courtiol, Delphine Husté, Marie Augeai, Romane Fournier,Jeanne Perrin, Adam Ammouch, Rémi Tourenq, Cyril Lebrun, Nadia Gharib, Eymeric Pichon, Arnaud Bonnel, Elvina Maylis, Marius Pascal, MOUSSODIA Eldi Andréa, Zélie FASQUEL, Louis-Kordian BOUCHET, Annabelle SAUVAGET, Louis tourenq, Swan Baudot-Paillouse, Léonie Perriard, Delissa EL AMRI, Alexis des avis d'alexis, Oliv, Anne, Lynda, Thierry.La dernière personne qui laisse un commentaire sous cette vidéo gagne 10.000 euros. Je ne risque pas grand chose à écrire ce message ici, personne ne lira jusqu'au bout. Je vais dormir sur mes deux oreilles."
"AgJP9k-9-_o","JuL - Carré D'as // Album gratuit Vol.6 [02] // 2021","2021-02-26T16:59:42Z","UC-GI5LST5T3Gw93yZxjdFaw","DORETDEPLATINE","10","21.01.03","jul carré d'as|jul moi|jul c'est ca la vie|jul ca me guintch|jul le crémeux|jul burberry","1863889","32541","510","2056","https://i.ytimg.com/vi/AgJP9k-9-_o/default.jpg","False","False","Jul - Carré D'as  Disponible sur : http://jul.bfan.link/albumgratuitvol6Nouvel Album '' Album gratuit Vol.6 ''  disponible sur : http://jul.bfan.link/albumgratuitvol6Application JuL (Julmoji, contenus exclusifs…) : https://jul.ffm.to/application.oydAbonnez-vous au profil de JUL sur Deezer, Spotify, Apple Music ou Napster : https://Jul.lnk.to/profil-streaming Suivez JUL sur : - YouTube : https://www.youtube.com/user/julsaintjean- Facebook : https://www.facebook.com/julOfficial/- Twitter : https://twitter.com/jul- Instagram : https://www.instagram.com/juldetp- Snapchat : Jul135cityShop officiel : http://doretdeplatineshop.com/#Jul #Albumgratuitvol6 #Carrédas"
"Wh84h3cAanw","TEAM CROUTON vs TEAM ALBERT qui va l'emporter ? (ft. Michou Inoxtag Piwerre Stbann)","2021-02-28T13:23:12Z","UCrUuF0aK8OfO8uHsxIbX2pQ","Hairtist Paris","24","21.01.03","team crouton|hairtist|inoxtag|michou|piwerre|coiffure|défi|challenge|les crouton|barber|inox","122870","17158","101","201","https://i.ytimg.com/vi/Wh84h3cAanw/default.jpg","False","False","Yo la miff!!Nouvelle vidéo avec les frérots:Michou Inoxtag Piwerre et Stbann Ils vont devoir s'affrontés d'un coté la team crouton et de l'autre la team albert! Le but est de raser des ballons avec de la mousse dessus sans les éclater! L'équipe qui a fini en premier à gagné!!! C'est totalement partit en cacahuète haha.J'espere en tout cas que vous aller kiffé le conceptN'hésitez pas à me dire si vous voulez une partie 2! 🔔 Abonne toi à ma chaîne et n'oublie pas d'activer la clochepour être toujours à l'affût des nouvelles vidéos!📸 Mon Instagram:https://www.instagram.com/hairtist_paris/?hl=fr📩 Contact pro:Hairtist776@gmail.com"
"AxsRxodS_F0","Le temps","2021-02-25T12:06:05Z","UCjItmeylMPcafIMD7DEhwoQ","Tayc - Topic","10","21.01.03","Tayc|Fleur froide (Donum Novae)|Le temps","2035792","73515","981","30","https://i.ytimg.com/vi/AxsRxodS_F0/default.jpg","False","False","Provided to YouTube by WM FR Affiliated/Play TwoLe temps · TaycFleur froide (Donum Novae)℗ 2021 H24 Music / Play TwoProducer: NyadikoVocals: TaycComposer: NyadjikoComposer, Writer: TaycAuto-generated by YouTube."
"nqqNYvRDIz4","ON JUGE LES PANCAKES JAPONAIS 🥞 (ça partait si bien...)","2021-02-28T10:00:09Z","UC97S5Uiopake8FiOLCy3rkg","Tev & Louis","24","21.01.03","[none]","144064","11101","131","290","https://i.ytimg.com/vi/nqqNYvRDIz4/default.jpg","False","False","Notre lien Grand Hotel Mania 🏨: https://clcr.me/GHM_TevLouis Notre chaîne Twitch: https://www.twitch.tv/tev_et_louisChaîne principale de Louis: https://www.youtube.com/LouisSanChaîne principale de Tev: https://www.youtube.com/IciJaponInstagram de Louis: https://www.instagram.com/louis_zenjasInstagram de Tev: https://www.instagram.com/icijaponTwitter de Louis: https://twitter.com/louis_zenjasTwitter de Tev: https://twitter.com/icijaponMail pro: tev.louis.pro@gmail.com"
"gDgVBg6Jabw","MA VILLA À 100 MILLIONS D’EUROS (HOUSE TOUR)","2021-02-28T18:34:14Z","UCPUp9zXmCUFNAp38z3kHPcg","Emma CakeCup","26","21.01.03","EmmaCakeCup|Villa|Maison|House tour|House|Richard orlinski|Cupcake|Vlad|Oltean","70402","4882","132","206","https://i.ytimg.com/vi/gDgVBg6Jabw/default.jpg","False","False","✿ Ne déroule pas la barre d'infos ✿Tu es un petit rebelle, j'aime ça. MA BD EST ENFIN SORTIE VOUS POUVEZ L'ACHETER ICI : https://www.amazon.fr/Emma-CakeCup-Roland-Pauline/dp/2822221618MON TOME 2 EST SORTIE, SI TU LE VEUX C'EST JUSTE LA : https://livre.fnac.com/a11323473/Emma-CakeCup-Tome-2-Retour-vers-le-passe-Emma-CakeCup?ectrans=1&gclid=CIin_a7P9N0CFRllGwod9KAC3w&gclsrc=ds&oref=00000000-0000-0000-0000-000000000000MON LIVRE DE CUISINE POUR L'AVOIR C'EST JUSTE LA : https://www.amazon.fr/recettes-dEmma-CakeCup-Emma-CAKECUP/dp/2263155856☞ Mets la HD c'est mieux ! ☑☞ Je filme avec une osmo pocket DJI☞ Je fais mes montages avec Final Cut Pro xDES CHOSES À SAVOIR ♡ MES VÊTEMENTS DANS CETTE VIDEO ♡ - mon pull : https://bit.ly/3b4dMO1- mon jean : dr denim (moxy) skinny taille haute - mes chaussons : https://bit.ly/3r80cP6- lunettes anti lumières bleu : quay australia OÙ ME RETROUVER ♡ - Ma chaine de cuisine ♡ https://www.youtube.com/channel/UCPvljaGquvogIHVBvSuyLIQ- Ma chaine de livres, inactive, désolée :( ♡ https://www.youtube.com/channel/UCNhPObtMBfW42x74X90E3uQ- FACEBOOK ♡  https://www.facebook.com/Emmacakecup?ref=hl- INSTAGRAM ♡  http://instagram.com/emmacakecup- TWITTER ♡ https://twitter.com/emmacakecup je suis plus active dessus pcq twitter ça pue la merde - SPOTIFY ♡  Emmacakecup ou Emma Caritz- SOUNDCLOUD ♡  https://soundcloud.com/emmacakecup- SNAPCHAT ♡ https://www.snapchat.com/add/emmactz  ou EmmaCtzSINON ♡ - Je m'appelle Emma et j'ai 24ans.- J'habite près de ParisN'hésitez pas a vous abonner pour être au courant de mes nouvelles vidéos ✌Je vous aime. ♡"
"B2iXNOkSp6U","OLYMPIQUE DE MARSEILLE - OLYMPIQUE LYONNAIS (1 - 1) - Résumé - (OM - OL) / 2020-2021","2021-03-01T01:00:08Z","UCQsH5XtIc9hONE1BQjucM0g","Ligue 1 Uber Eats","17","21.01.03","OM OL|Marseille Lyon|Résumé OLYMPIQUE DE MARSEILLE OLYMPIQUE LYONNAIS|Résumé OM OL|OLYMPIQUE DE MARSEILLE|Marseille|OLYMPIQUE LYONNAIS|Lyon|résumé|buts|but|résumé Ligue 1 Uber Eats|ligue 1|ligue 1 uber eats|L1|championnat|journée|football|foot|match|France|sp:ty=high|sp:dt=2021-02-28T21:00:00Z|sp:vl=fr|sp:st=soccer|sp:li=france|sp:ti:home=OM|sp:ti:away=OL","225899","3045","112","645","https://i.ytimg.com/vi/B2iXNOkSp6U/default.jpg","False","False","Revivez les meilleurs moments de OLYMPIQUE DE MARSEILLE - OLYMPIQUE LYONNAIS (1-1) en vidéo. Ligue 1 Uber Eats - Saison 2020/2021 - 27ème journée ORANGE VELODROME - Dimanche 28 Février 2021Buteurs : Karl TOKO EKAMBI (21' - OLYMPIQUE LYONNAIS) / Arkadiusz Krystian MILIK (44' pen - OLYMPIQUE DE MARSEILLE) Cartons rouges/exclusions : Lucas TOLENTINO COELHO DE LIMA (71') Composition OLYMPIQUE DE MARSEILLE : 30 - Steve MANDANDA (c) /10 - Dimitri PAYET /24 - Saïf-Eddine KHAOUI /22 - Pape Alassane GUEYE /4 - Boubacar KAMARA /15 - Duje CALETA-CAR /3 - Alvaro GONZALEZ /25 - Yuto NAGATOMO /29 - Pol Mikel LIROLA KOSOK /19 - Arkadiusz Krystian MILIK /26 - Florian THAUVIN Composition OLYMPIQUE LYONNAIS : 30 - Steve MANDANDA (c) /10 - Dimitri PAYET /24 - Saïf-Eddine KHAOUI /22 - Pape Alassane GUEYE /4 - Boubacar KAMARA /15 - Duje CALETA-CAR /3 - Alvaro GONZALEZ /25 - Yuto NAGATOMO /29 - Pol Mikel LIROLA KOSOK /19 - Arkadiusz Krystian MILIK /26 - Florian THAUVIN Abonnez-vous à la chaîne YoutubeSubscribe : https://www.youtube.com/subscription_center?add_user=ligue1frSuivez nous sur Instagram : https://instagram.com/ligue1ubereats/ Suivez nous sur Twitter : https://twitter.com/Ligue1UberEatsSuivez nous sur Facebook : https://fb.com/Ligue1UberEatsSuivez nous sur Ligue1.fr : https://www.ligue1.fr"
"3r9vJI5OiV8","Naps - La kiffance (Clip Officiel)","2021-02-26T15:30:17Z","UCfih6kPJCpzWmtCFtlpYK6A","Naps Officiel","10","21.01.03","Naps|13ème|art|records|La kiffance|ok many industrie|AllPoints|Marseille|rap|french hip hop","1222165","40942","841","1426","https://i.ytimg.com/vi/3r9vJI5OiV8/default.jpg","False","False","Naps - La kiffance (Clip Officiel) Nouveau single La kiffance disponible partout : https://naps.bfan.link/lakiffanceAbonne-toi à la chaîne ici : http://bit.ly/2kiGDExProd by Zeg PRéalisation: Neetch Production exécutive : Kaid Productions Prise de vues Marseille: MHEcoute tous les albums de Naps !Carré VIP : http://naps.ffm.to/carrevipOn est fait pour ça : http://naps.lnk.to/OnEstFaitPourCaA l'instinct : http://naps.lnk.to/ALinstinctALL En équipe, vol. 1 : http://naps.lnk.to/EnEquipePochon bleu : https://naps.lnk.to/PochonBleuALLSuis Naps sur les réseaux : Facebook : https://www.facebook.com/NapsOfficiel/Instagram : https://www.instagram.com/napsofficiel/Twitter : https://twitter.com/NapsvraicompteSnapchat : naps13art"
"B-6ZZkEqSco","Un Bon Moment avec Pierre Croce et Amixem","2021-02-28T16:00:03Z","UC-6TxFNjRXDwCBicVMmK5vg","Kyan Khojandi","23","21.01.03","Un bon moment|Kyan khojandi|pierre croce|amixem|jeu de la complicité|navo|bruno muschio","113449","5317","93","437","https://i.ytimg.com/vi/B-6ZZkEqSco/default.jpg","False","False","Si vous voulez soutenir UN BON MOMENT, tout en vous faisant plaisir, on a créé :  https://www.unebonneboutique.com ! Kiffez bien !L'énigme n'a toujours pas été résolue ! Le Discord de l'énigme : https://discord.gg/4spwWa8Nos Insta : Kyan Khojandi : https://www.instagram.com/kyankhojandi/Navo : https://www.instagram.com/navo_/Pierre Croce : https://www.instagram.com/pierrecroce/Amixem : https://www.instagram.com/amixem/"
"JuNz-nx5S3U","POURQUOI JE NE CONDUIS JAMAIS","2021-02-28T09:34:17Z","UCyJaJeQ78SDNPdjdRXiVPYQ","style tonic","26","21.01.03","[none]","101133","8978","125","184","https://i.ytimg.com/vi/JuNz-nx5S3U/default.jpg","False","False","4 ans de permis et tjrs pas de musique au volant par peur d'être déconcentrée.Qui veut monter avec moi lol ? INSTAGRAM : style_tonicAdresse PRO : styletonic@foll-ow.com Merci pour tout les gars !"
"_ve9XwlNqAo","Suis-je une bonne maman ?!","2021-02-28T17:00:13Z","UC5MKYPg4r7e1BXC-waTekIw","LaulauBabyShow","24","21.01.03","laulau|baby|show|laulaubabyshow|lolobabyshow|lolo|interview|grossesse|vergeture|grossesses|vergetures|melanie|mélanie|martial|candidat|candidate|télé|réalité|télé-réalité|people|sans tabou|complexe|bébé|peur|détente|accouchement|kamila|nore|julien tanti|manon tanti|acne|nikola|w9|nabilla|injection|chirurgie","50578","3416","34","129","https://i.ytimg.com/vi/_ve9XwlNqAo/default.jpg","False","False","Hello hello les loulou !!!!!!Alors... Team bonne maman ou pas bonne maman ? :)N'hésitez pas à liker, commenter et me dire ce que vous en pensez ! A très très très vite ❤️❤️❤️Mes comptes Instagram & SnapChat :Instagram : @LauraLempikaSnapchat : lola-braziliaContact pro : laulaubabyshow@gmail.com"
