video_id,title,publishedAt,channelId,channelTitle,categoryId,trending_date,tags,view_count,likes,dislikes,comment_count,thumbnail_link,comments_disabled,ratings_disabled,description
"RTG0pinH7v4","Ontario to impose stay-at-home order","2021-04-07T13:26:48Z","UCuFFtHWoLl5fauMMD5Ww2jA","CBC News","25","21.07.04","COVID-19|#COVID19|coronavirus|pandemic|lockdown|shutdown|cbc news","123671","710","2688","1415","https://i.ytimg.com/vi/RTG0pinH7v4/default.jpg","False","False","Ontario Premier Doug Ford's cabinet has approved a provincewide stay-at-home order and will close non-essential retail stores for all but curbside pickup. The order will take effect at 12:01 a.m. ET Thursday and last up to four weeks.   »»» Subscribe to CBC News to watch more videos: http://bit.ly/1RreYWSConnect with CBC News Online:For breaking news, video, audio and in-depth coverage: http://bit.ly/1Z0m6iXFind CBC News on Facebook: http://bit.ly/1WjG36mFollow CBC News on Twitter: http://bit.ly/1sA5P9HFor breaking news on Twitter: http://bit.ly/1WjDyksFollow CBC News on Instagram: http://bit.ly/1Z0iE7OSubscribe to CBC News on Snapchat: https://bit.ly/3leaWsrDownload the CBC News app for iOS: http://apple.co/25mpsUzDownload the CBC News app for Android: http://bit.ly/1XxuozZ»»»»»»»»»»»»»»»»»»For more than 75 years, CBC News has been the source Canadians turn to, to keep them informed about their communities, their country and their world. Through regional and national programming on multiple platforms, including CBC Television, CBC News Network, CBC Radio, CBCNews.ca, mobile and on-demand, CBC News and its internationally recognized team of award-winning journalists deliver the breaking stories, the issues, the analyses and the personalities that matter to Canadians."
"hT2heeCCmDU","Update on COVID-19 – April 6, 2021","2021-04-06T23:45:25Z","UCnuHHh1V4fubDUY_8YN8ysA","YourAlberta","25","21.07.04","Alberta|Government of Alberta|COVID-19|Health|Premier Kenney|Minister Shandro|Dr. Hinshaw","115352","0","0","0","https://i.ytimg.com/vi/hT2heeCCmDU/default.jpg","True","True","Premier Jason Kenney and officials provide an update on COVID-19 and the ongoing work to protect public health.Learn more:https://www.alberta.ca/release.cfm?xID=778869DFC7AD4-F627-C941-E12D2D7B7AFB4212https://www.alberta.ca/release.cfm?xID=77890A26BAAC3-06BD-6717-EDEF2D2F2DE69455"
"40nUhMa56lw","Game Theory: 3 NEW FNAF Security Breach Theories!","2021-04-06T18:05:07Z","UCo_IB5145EVNcf8hw1Kku7w","The Game Theorists","20","21.07.04","fnaf|new fnaf|fnaf security breach|five nights at freddy's|five nights at freddy's security breach|fnaf books|fazbear frights|fnaf trailer|new fnaf trailer|fnaf security breach trailer|fnaf 4|fnaf vr|fnaf game|new fnaf game|fnaf ar|fnaf help wanted|fnaf sister location|fnaf animation|fnaf song|fnaf tik tok|fnaf special delivery|five nights at freddy's theory|game theorists|game theory|matpat|security breach","2613903","188473","1688","24558","https://i.ytimg.com/vi/40nUhMa56lw/default.jpg","False","False","Special thanks to NordVPN for sponsoring this episode!Go to https://NordVPN.com/matpat and use code MATPAT to get a 2-year plan plus 1 additional month with a huge discount. It’s risk free with Nord’s 30 day money-back guarantee!Thank you to GamesPOfficial on Twitter for making us the Glamrock Chica Asset!► https://twitter.com/GamesPOfficialGet Your Game Theory 10th  Anniversary Theory Wear NOW! ► https://bit.ly/3fx9W2CTheorists, I have been up to my ears in FNAF theories lately and so I thought,  Why not do a rapid fire of 3 mini-theories in one episode? That's right, you get not one, not two, but THREE theories today! WE are talking everything from new clues to FNAF Security Breach to what is going on in the newest Fazbear Frights books, to maybe even uncovering the TRUE villain we've all been overlooking! No time to waste!  Let's dive in!SUBSCRIBE to Catch all the Theories! ► https://goo.gl/kQWHkJ        Need Royalty Free Music for your Content? Try Epidemic Sound. Get A 30 Day Free Trial! ► http://share.epidemicsound.com/MatPat#FNAF #FNAFSecurityBreach #FNAFTheory #SecurityBreach #FiveNightsAtFreddys #FazbearFrights #NewFNAF #MatPat #Theory #GameTheory    More THEORIES: FNAF, The FINAL Timeline ►► https://bit.ly/2MlHYFeFNAF, The Monster We MISSED! ►► https://youtu.be/_ygN8HLCaJgFNAF This Theory Changes Everything ► https://bit.ly/2JUQUn6FNAF, You Were Meant To Lose ► https://youtu.be/7bn8hM9k0b0FNAF 6, No More Secrets ► https://bit.ly/2LVCq4u  Credits:Writers: Matthew Patrick Editors: Dan Cybert Seibert, Tyler Mascola, and Pedro FreitasAssistant Editor: AlyssaBeCrazySound Editor: Yosi Berman"
"ykC7HZ1-FrQ","World's Tallest Tower!","2021-04-06T20:31:36Z","UCUaT_39o1x6qWjz7K2pWcgw","Beast Reacts","24","21.07.04","life hacks|crafts|slime|do it yourself|diy|lifehacks|dily projects|useful things|how to|experiment|experiments|diy activities|handcraft|prank|funny|challenge|pranks|secret|diy slime|laugh|new|skills|tricks|tips|fun","3496316","166502","1454","11592","https://i.ytimg.com/vi/ykC7HZ1-FrQ/default.jpg","False","False","We found clips of people climbing to insane heights and worked our way up reacting to them. Hit subscribe if you like climbing things.SUBSCRIBE TO THEM NOW OR ELSE!AMPISOUNDhttps://www.youtube.com/channel/UCTB7xIF9U_-EsKi67N_NALgJames Kingstonhttps://www.youtube.com/channel/UCp6etHEelnOOd3m9CFsCSggDyingLlamahttps://www.youtube.com/channel/UC88oKpyXNid09t1m_PZlvfQMike Tomasellahttps://www.youtube.com/channel/UCbIrP5Etf1hGeUa5b9QzM6Aandrejciehttps://www.youtube.com/channel/UClm8ZEewQnIovbHn84pta3QWorld Newshttps://www.youtube.com/channel/UCcK_ytDOdC6QXqD5YxuoYUwILLSIGHThttps://www.youtube.com/channel/UCvcrB9ZjNk9yUPKD3uXInHwLIVE JNhttps://www.youtube.com/channel/UCNIfZjPp3s-S3siTdB_XJbwCassOnlinehttps://www.youtube.com/channel/UCX7bpTSlnrm6Qwijs9L0npAFlaviu Cernescuhttps://www.youtube.com/channel/UCwqiq5mOED9aX5kN81FT8GQEngineeringhttps://www.youtube.com/channel/UCJSIsiMUAUaddPP-idgQBpgOn the roofshttps://www.youtube.com/channel/UCiBCfXg5HoSxWQ9vMXUJbggSUBSCRIBE OR YOU'LL HAVE BAD LUCKNew Merch - https://shopmrbeast.com----------------------------------------------------------------follow all of these or i will kick you• Facebook - https://www.facebook.com/MrBeast6000/• Twitter - https://twitter.com/MrBeast•  Instagram - https://www.instagram.com/mrbeast--------------------------------------------------------------------"
"rFjJs6ZjPe8","Taylor Swift - Mr. Perfectly Fine (Taylor’s Version) (From The Vault) (Lyric Video)","2021-04-07T13:00:19Z","UCANLZYMidaCbLQFWXBC95Jg","TaylorSwiftVEVO","10","21.07.04","taylor swift|taylor|swift|mr perfectly fine|mr perfectly fine taylor swift|taylor mr perfectly fine|mr perfectly fine taylor’s version|taylor’s version|taylors version|taylor swift new album|taylor swift new music|taylor swift lyrics|fearless|fearless taylor’s version|fearless taylors version|official taylor swift lyrics|taylor rerecord|taylor reissue|taylor new version|fearless rerecord|fearless remaster|new","1258199","200661","622","27008","https://i.ytimg.com/vi/rFjJs6ZjPe8/default.jpg","False","False","Official lyric video for “Mr. Perfectly Fine” (Taylor’s Version) (From The Vault) – off her upcoming Fearless (Taylor’s Version) album. Get the album here: https://taylor.lnk.to/fearlesstaylorsversion Get the song here: https://taylor.lnk.to/mpf►Subscribe to Taylor Swift on YouTube: https://ts.lnk.to/subscribe  ►Exclusive Merch: http://taylorswift.lnk.to/store  ►Follow Taylor Swift online:Instagram: http://instagram.com/taylorswift Facebook: http://facebook.com/taylorswift Tumblr: http://taylorswift.tumblr.com Twitter: http://twitter.com/taylorswift13 Snapchat: http://snapchat.com/add/taylorswiftWebsite: http://www.taylorswift.com ►Follow Taylor Nation OnlineInstagram: http://instagram.com/taylornation Tumblr: http://taylornation.tumblr.com Twitter: http://twitter.com/taylornation13TikTok: http://tiktok.com/@taylornationOfficial Lyrics:Mr. perfect faceMr. here to stayMr. looked me in the eye and told me you would never go awayEverything was rightMr. I’ve been waiting for you all my lifeMr. every single day until the end I will be by your sideBut that was when I got to knowMr. change of heartMr. leaves me all aloneI fall apartIt takes everything in me just to get up each dayBut it’s wonderful to see that you’re okayHello, Mr. perfectly fineHow’s your heart after breaking mine?Mr. always at the right place at the right time, babyHello, Mr. casually cruelMr. everything revolves around youI’ve been Miss misery since your goodbyeAnd you’re Mr. perfectly fineMr. never told me whyMr. never had to see me cryMr. insincere apology so he doesn’t look like the bad guyHe goes about his dayForgets he ever even heard my nameWell I thought you might be different than the restI guess you’re all the sameBecause I hear he’s got his arm ‘round a brand new girlI’ve been picking up my heartHe’s been picking up herAnd I never got past what you put me throughBut it’s wonderful to see that it never phased youRepeat chorusSo dignified in your well pressed suitSo strategizedAll the eyes on youSashay away to your seatIt’s the best seatIn the best roomOh, he’s so smugMr. always winsSo far above me in every senseSo far above feeling anythingAnd it’s really such a shameIt’s such a shameCause I was Miss here to stayNow I’m Miss gonna be alright somedayAnd someday maybe you’ll miss meBut by then you’ll be Mr. too lateGoodbye, Mr. perfectly fineHow’s your heart after breaking mine?Mr. always at the right place at the right time, babyGoodbye, Mr. casually cruelMr. everything revolves around youI’ve been Miss misery for the last timeAnd you’re Mr. perfectly fineYou’re perfectly fineMr. look me in the eye and tell me you#taylorswift #mrperfectlyfine #fromthevault #fearlesstaylorsversionMusic video by Taylor Swift performing Mr. Perfectly Fine (Taylor’s Version) (From The Vault) (Lyric Video). © 2021 Taylor Swifthttp://vevo.ly/enJPdT"
"3sO-Y1Zbft4","Twenty One Pilots - Shy Away (Official Video)","2021-04-07T17:11:05Z","UCBQZwaNPFfJ1gZ1fLZpAEGw","twenty one pilots","10","21.07.04","twenty one pilots|twenty one pilots scaled and icy|twenty one pilots shy away|shy away official|shy away official video|top shy away|shy away scaled and icy|twenty one pilots official|don't you shy away|twenty one pilots trend|twenty one pilots SAI|tyler joseph|josh dun|21pilots|21pilots shy away|top official video|new twenty one pilots|scaled and icey|shyaway|twenty one pilots livestream|twenty one pilots new album|twentyonepilots","871943","265032","660","38578","https://i.ytimg.com/vi/3sO-Y1Zbft4/default.jpg","False","False","Twenty One Pilots - Shy Away (Official Video)Twenty One Pilots official video for Shy Away from the forthcoming album Scaled And Icy, available May 21st on Fueled By Ramen.Twenty One Pilots - Livestream ExperienceMay 21 @ 8PM ET / 5PM PTTickets available at http://live.twentyonepilots.com Stream / Download Shy Away - https://top.lnk.to/SAIPre-order / Pre-Save Scaled And Icy - https://top.lnk.to/SAIDirected by Miles Cable & AJ FavicchioLYRICSWhen I get home,You better not be thereWe're placing bets you won'tShed your modestyAnd the only thing to leave behindIs your own skin on the floorDon't you shy awayManifest a ceiling when you shy awaySearching for that feelingJust like an 'I Love You'That isn't wordsLike a song he wrotethat's never heardDon't you shh...When you get homeYou barely recognize the pictures theyput in a frame'Cause you shed your modestyDon't circle the trackTake what you haveand leave your skin on the floor.Don't you shy awayManifest a ceiling when you shy awaySearching for that feelingJust like an 'I Love You'That isn't wordsLike a song he wrotethat's never heardWhen I get homeBoy, you better not be thereYou're long goneShed your modestyDon't circle the trackJust break the cycle in halfand leave your skin on the floor.Don't you shy awayManifest a ceiling when you shy awaySearching for that feelingJust like an 'I Love You'That isn't wordsLike a song he wrotethat's never heardthat's never heard...an 'I Love You'That isn't wordsLike a song he wrotethat's never heardDon't you shy away.Subscribe for more official content from twenty one pilots: https://top.lnk.to/subscribe Site: http://smarturl.it/TOPsiteStore: https://store.twentyonepilots.com Spotify: http://smarturl.it/TOPspotifyFacebook: http://smarturl.it/TOPfacebookInstagram: http://smarturl.it/TOPinstagramTwitter: http://smarturl.it/TOPtwitterTumblr: http://smarturl.it/TOPtumblr#TwentyOnePilots #ShyAway #ScaledAndIcy"
"vhTWqPtku14","HIGHLIGHTS | Real Madrid vs. Liverpool: First Leg (UEFA Champions League 2020-2021: Quarter-Finals)","2021-04-06T21:24:02Z","UCaNeFN9L6CHcfn_FA7I_Wng","DAZN Canada","17","21.07.04","Alisson Becker|Federico Valverde|James Milner|Liverpool|Lucas Vázquez|Marco Asensio|Mohamed Salah|Nacho|Real Madrid|Roberto Firmino|Rodrygo Silva de Goes|Thiago Alcântara|Thibaut Courtois|Toni Kroos|Trent Alexander-Arnold|Vinicius Júnior|Watch short highlights|Xherdan Shaqiri|champions|europa|europa league|highlights|ucl|uefa|uefa champions|uefa champions league|ชมไฮไลท์สั้น|นยูฟ่า|บอล ยู ฟ่า|ยู ฟ่า แช ม เปีย น ลีก|ยู ฟ่า แช ม เปีย น ส์ ลีก|ไฮไลท์","111964","1151","33","294","https://i.ytimg.com/vi/vhTWqPtku14/default.jpg","False","False","April 6th, 2021 -- Real Madrid vs. Liverpool: First Leg (UEFA Champions League 2020-2021: Quarter-Finals)Subscribe to our YouTube channel 👉  https://bit.ly/DAZNCanadaYouTubeDownload and stream DAZN 👉  https://bit.ly/DAZNCanadaYTFollow DAZN Canada on social media 👇Twitter: https://twitter.com/DAZN_CAFacebook: https://www.facebook.com/DAZNCAInstagram: https://www.instagram.com/DAZN_CA"
"Z8y05MbYm1Q","RC Helicopter Battle | Dude Perfect","2021-04-05T22:00:09Z","UCRijo3ddMTht_IHyNSNXpNQ","Dude Perfect","17","21.07.04","dude perfect|dude perfect stereotypes|dude perfect water bottle flip|bottle flip|water bottle flip|dude perfect bottle flip|dude perfect basketball|dp|dude perfect world record|edition|nerf|trick shots|trick shot|family|ping pong|bowling|clean|family friendly|bubble wrap|soccer|football|spinner|spinners|fidget spinners|dude|battle|rc|helicopter|heli|helo|flying|army men|waterpark|water|landing|mouse|hunt|city|remote|control","6825304","280094","4981","9506","https://i.ytimg.com/vi/Z8y05MbYm1Q/default.jpg","False","False","First RC cars, then RC planes, and now.. RC HELICOPTERS!! Another incredible DP Battle!► Thanks for subscribing! - http://bit.ly/SubDudePerfect► Watch our Behind The Scenes Video: https://youtu.be/CpcXq_K5NrE► Subscribe to our DP+ Bloopers & Behind The Scenes Channel HERE: http://bit.ly/DPplusSubscribe#BattleNEXT LEVEL STUFF -------------------------------------------🎒 NEW Merch - http://bit.ly/DPStore🎮 Play our FREE iPhone game! - http://smarturl.it/DudePerfect2📱 Text us - (469) 205-7005🔔 Hit the bell next to Subscribe so you don't miss a video!👨🏻‍💻 Watch our newest vids! - http://bit.ly/NewDPVids📕 Read our Book - Go Big - http://amzn.to/OYdZ2sFollow our Instagrams so we can be best friends -------------------------------------------🏆 http://Instagram.com/DudePerfect🧔🏻 http://Instagram.com/TylerNToney👱🏻‍♂️ http://Instagram.com/Cody_Jones_🙋🏻‍♂️ http://Instagram.com/CobyCotton👨‍🦰 http://Instagram.com/GarrettHilbert⛹🏻‍♂️ http://Instagram.com/CoryCotton-------------------------------------------Bonus points if you're still reading this! Comment: What RC battle should we do next??Click here to learn more about Dude Perfect:http://bit.ly/AboutDudePerfectAs always...Go Big and God Bless!- Your friends at Dude PerfectBusiness or Media, please contact us at: Dude@DudePerfect.com------------5 Best Friends and a Panda.If you like Sports + Comedy, come join the Dude Perfect team!Best known for trick shots, stereotypes, battles, bottle flips, ping pong shots and all-around competitive fun, Dude Perfect prides ourselves in making the absolute best family-friendly entertainment possible! Welcome to the crew! Pound it 👊🏻 Noggin 🙇🏻‍♂️ - Dude Perfect"
"nW948Va-l10","Marvel Studios' Loki | Official Trailer | Disney+","2021-04-05T13:00:01Z","UCvC4D8onUfXzvjTOM-dBfEA","Marvel Entertainment","24","21.07.04","marvel|comics|trailer|official trailer|loki|disney+|disney +|disneyplus|disney plus|teaser|loki trailer|tom hiddleston|owen wilson|tva","11742476","493369","5809","26540","https://i.ytimg.com/vi/nW948Va-l10/default.jpg","False","False","Loki’s time has come. Watch the brand-new trailer for Loki, and start streaming the Marvel Studios Original Series June 11 on Disney+.► Watch Marvel on Disney+: https://bit.ly/2XyBSIW► Subscribe to Marvel on YouTube: http://bit.ly/WeO3YJFollow Marvel on Twitter: ‪https://twitter.com/marvelLike Marvel on Facebook: ‪https://www.facebook.com/marvelWatch Marvel on Twitch: https://www.twitch.tv/marvelReward your Marvel fandom by joining Marvel Insider!Earn points, then redeem for awesome rewards.Terms and conditions apply. Learn more at https://www.marvel.com/insider?Osocial=YT&CID=MarvelInsiderFor even more news, stay tuned to:Tumblr: ‪http://marvelentertainment.tumblr.com/Instagram: https://www.instagram.com/marvelPinterest: ‪http://pinterest.com/marvelofficialReddit: http://reddit.com/u/marvel-official"
"43CTgfwoa3Y","GHOSTBUSTERS: AFTERLIFE - Mini-Pufts Character Reveal","2021-04-07T13:15:01Z","UCz97F7dMxBNOfGYu3rx8aCw","Sony Pictures Entertainment","24","21.07.04","ghostbusters|ghostbusters afterlife|ghostbusters reboot|ghostbusters afterlife hd|ghostbusters afterlife scenes|ghostbusters afterlife 2021|ghostbusters afterlife character reveal|mini-pufts character reveal|ghostbusters afterlife mini-pufts character reveal|mini pufts|new ghostbusters|ghostbusters new movie|who you gonna call|bill murray|finn wolfard|paul rudd ghostbusters afterlife|mckenna grace|sigourney weaver|jason reitman|carrie coon|sony","101383","3957","71","547","https://i.ytimg.com/vi/43CTgfwoa3Y/default.jpg","False","False","Sweet. Mischievous. Savage. 🔥 Mini-Pufts are out of the bag, don't miss #Ghostbusters: Afterlife only in theaters this fall.Subscribe for more exclusive content: https://bit.ly/GhostbustersSubscribe Follow Ghostbusters on Social:https://www.ghostbusters.com/?hs308=youtubehttps://www.facebook.com/ghostbustershttps://www.twitter.com/ghostbustershttps://www.instagram.com/ghostbustersFrom director Jason Reitman and producer Ivan Reitman, comes the next chapter in the original Ghostbusters universe. In Ghostbusters: Afterlife, when a single mom and her two kids arrive in a small town, they begin to discover their connection to the original ghostbusters and the secret legacy their grandfather left behind. The film is written by Jason Reitman & Gil Kenan.#Sony #Ghostbusters #GhostbustersAfterlife #CarrieCoon #FinnWolfhard #MckennaGrace #PaulRudd #JasonReitman #MiniPuft #MiniPufts"
"TMjgM3l5l3M","Brawl Stars Animation - The #GoldarmGang Heist","2021-04-07T07:38:23Z","UCooVYzDxdwTtGYAkcPmOgOw","Brawl Stars","20","21.07.04","brawl stars|mobile game|mobile strategy game|mobile rpg|mobile battle royale|battle royale|supercell game|goldarmgang|belle|squeak|wild west|brawl pass","4203918","331233","3094","18126","https://i.ytimg.com/vi/TMjgM3l5l3M/default.jpg","False","False","Download NOW!! ►► https://supr.cl/playbrawlBe a BRAWLER! Subscribe! ►► https://supr.cl/subscribe#GoldarmGang #Brawlstars #BelleFast-paced 3v3 multiplayer and battle royale made for mobile! Play with friends or solo across a variety of game modes in under three minutes.Unlock and upgrade dozens of Brawlers with powerful Super abilities, Star Powers and Gadgets! Collect unique skins to stand out and show off. Battle in a variety of mysterious locations within the Brawliverse!BATTLE IN MULTIPLE GAME MODES- Gem Grab (3v3): Team up and out-strategize the opposing team. Collect and hold 10 gems to win, but get fragged and lose your gems.- Showdown (Solo/Duo): A battle royale style fight for survival. Collect power ups for your Brawler. Grab a friend or play solo - be the last Brawler standing in the rowdiest battle royale yet. Winner take all!- Brawl Ball (3v3): It's a whole new Brawl game! Show off your soccer/football skills and score two goals before the other team. There are no red cards here.- Bounty (3v3): Take out opponents to earn stars, but don’t let them pick you off. The squad with the most stars wins the match!- Heist (3v3): Protect your team’s safe and try to crack open your opponents’. Navigate the map to sneak, blast and blow your way clear to the enemies treasure.- Special Events: Limited time special PvE and PvP game modes.- Championship Challenge: Join Brawl Stars' esports scene with in-game qualifiers!UNLOCK AND UPGRADE BRAWLERSCollect and upgrade a variety of Brawlers with powerful Super abilities, Star Powers and Gadgets! Level them up and collect unique skins.BRAWL PASSComplete quests, open Brawl Boxes, earn Gems, pins and an exclusive Brawl Pass skin! Fresh content every season.BECOME THE STAR PLAYERClimb the local and regional leaderboards to prove you’re the greatest Brawler of them all!CONSTANTLY EVOLVINGLook out for new Brawlers, skins, maps, special events and games modes in the future.PLEASE NOTE! Brawl Stars is free to download and play, however, some game items can also be purchased for real money. If you don't want to use this feature, please disable in-app purchases in your device's settings. Also, under our Terms of Service and Privacy Policy, you must be at least 9 years of age to play or download Brawl Stars.Features:- Team up for real-time 3v3 battles against players from across the world- A fast-paced multiplayer battle royale mode made for mobile- Unlock and collect new, powerful Brawlers - each with a signature attack and Super ability- New events and game modes daily- Battle solo or with friends- Climb to the top of the leaderboards in global and local rankings - Join or start your own Club with fellow players to share tips and battle together- Customize Brawlers with unlockable skins- Player-designed maps offer challenging new terrain to masterFrom the makers of Clash of Clans, Clash Royale and Boom Beach!Support:Contact us in-game via Settings, Help and Support — or visit http://supercell.helpshift.com/a/brawl-stars/Privacy Policy:http://supercell.com/en/privacy-policy/Terms of Service:http://supercell.com/en/terms-of-service/Parent's Guide:http://supercell.com/en/parents/???:https://www.youtube.com/wkbrl"
"jpZrVxvG3mk","Disney’s Cruella | Official Trailer 2","2021-04-07T12:17:21Z","UCuaFvcY4MhZY3U43mMt1dYQ","Walt Disney Studios","1","21.07.04","Cruella|Disney|Trailer|Emma Stone|Emma Thompson","390056","8454","187","808","https://i.ytimg.com/vi/jpZrVxvG3mk/default.jpg","False","False","This May, the Devil Gets Her Due. See #Cruella in theaters and on #DisneyPlus with Premier Access May 28. Additional fee required.Academy Award® winner Emma Stone (“La La Land”) stars in Disney’s “Cruella,” an all-new live-action feature film about the rebellious early days of one of cinemas most notorious – and notoriously fashionable – villains, the legendary Cruella de Vil. “Cruella,” which is set in 1970s London amidst the punk rock revolution, follows a young grifter named Estella, a clever and creative girl determined to make a name for herself with her designs. She befriends a pair of young thieves who appreciate her appetite for mischief, and together they are able to build a life for themselves on the London streets. One day, Estella’s flair for fashion catches the eye of the Baroness von Hellman, a fashion legend who is devastatingly chic and terrifyingly haute, played by two-time Oscar® winner Emma Thompson (“Howards End,” “Sense & Sensibility”). But their relationship sets in motion a course of events and revelations that will cause Estella to embrace her wicked side and become the raucous, fashionable and revenge-bent Cruella.  Disney’s “Cruella” is directed by Craig Gillespie (“I Tonya”) from a screenplay by Dana Fox and Tony McNamara, story by Aline Brosh McKenna and Kelly Marcel & Steve Zissis. It was produced by Andrew Gunn (“Freaky Friday”), Marc Platt (“Mary Poppins Returns”) and Kristin Burr (“Christopher Robin”), with Emma Stone, Michelle Wright, Jared LeBoff and Glenn Close serving as executive producers. Two-time Oscar®- winning costume designer Jenny Beavan (“Mad Max: Fury Road,” “A Room with a View”) creates the dazzling and imaginative costumes, which take on a life of their own.For more information on “Cruella,” follow us on:Facebook: https://www.facebook.com/DisneyCruellaDeVil Twitter: https://twitter.com/cruella  Instagram: https://www.instagram.com/disneycruella YouTube: https://youtube.com/disneymovietrailers​Hashtag: #Cruella"
"3B0OsoxoE1g","Dream Job","2021-04-07T12:57:25Z","UCA3-nIYWu4PTWkb6NwhEpzg","Ryan Reynolds","22","21.07.04","[none]","114509","13012","99","855","https://i.ytimg.com/vi/3B0OsoxoE1g/default.jpg","False","False","Fresh of off finding love on Match, Satan finds his dream job. Guy is on a hot streak!https://www.mintmobile.com/"
