video_id,title,publishedAt,channelId,channelTitle,categoryId,trending_date,tags,view_count,likes,dislikes,comment_count,thumbnail_link,comments_disabled,ratings_disabled,description
"Gz4BkoTlQfc","NA LATA 3","2021-04-03T14:00:04Z","UCEWHPFNilsT0IfQfutVzsag","Porta dos Fundos","24","21.07.04","porta dos fundos|comedia|humor|satira|videos de humor|humor acido|canais de humor|comedia brasileira|lata coca-cola|nome na latinha da coca cola|nomes|nossa coleção da coca cola|lata coca cola letras|lata coca cola com letra|na lata|leticia lima|lata de coca cola porta dos fundos|Coca|coca cola|mercado|refrigerante|guaraná|palavra cruzada|latinha|relacionamento|coca cola nome na lata|supermercado","734021","68187","1658","1328","https://i.ytimg.com/vi/Gz4BkoTlQfc/default.jpg","False","False","A humanidade sempre buscou formas de se comunicar, desde desenhos na pedra, passando por hieróglifos egípcios, kanjis japoneses, código morse, nudes, indiretas no Twitter, até a forma mais evoluída de escrita. Emojis? Não, latinhas de Coca!#PraCegoVer: Dois atores, Rafael Portugal e Fabio Porchat, estão em um corredor de supermercado, na seção de refrigerantes. Eles usam máscaras de proteção por conta da Covid-19. Fabio interpreta o atendente, de avental, diante de várias prateleiras cheias de Coca-Cola e Coca-Cola Sem Açúcar. Cada lata de Coca tem uma letra, e as latas juntas formam frases. O personagem de Rafael está com um carrinho de mercado e tenta fazer compras. Após a música da vinheta, Rafael aparece ainda no mercado falando ao celular com a namorada. #NaLata3ELENCOFabio PorchatRafael PortugalROTEIROGustavo VilelaDIREÇÃORodrigo Van Der PutBAIXE O APP DO PORTAAndroid: http://bit.ly/2zcxLZOiOS: https://apple.co/2IW633jTRADUÇÃO E LEGENDAGEMDispositivaJosniel RodriguezEsse é o canal de humor Porta dos Fundos. Lançamos vídeos todas as segundas, quintas e sábados às 11h."
"6DhYs-VsbEY","CAPPELLANES AFIRMA QUE DENTINHO JOGARÁ NO CORINTHIANS / REFORÇOS DO CRAQUE NETO E TIQUINHO SOARES?","2021-04-05T13:20:41Z","UC9nH0tJpMtChvJOqpMA9AHA","Chico Garcia","24","21.07.04","[none]","70508","7007","47","395","https://i.ytimg.com/vi/6DhYs-VsbEY/default.jpg","False","False","Inscreva-se no canal e seja membro!"
"SKrOhXuRfEI","O GRANDE DIA CHEGOU! ORGANIZAÇÃO DO NOSSO CHÁ REVELAÇÃO *terceira gravidez *","2021-04-03T14:33:03Z","UC3PGilZDRq6wzd7mURXET2g","Sara Kellen Mãe de dois","22","21.07.04","minhavidanaroça|vidanocampo|sarakellenofficial|maededois|vidanafazenda|entretenimento|ficaemcasa|nossosfilhos|minhafamiliaminhavida|nossafamilia|familiadedeus|vidanova|caminhadaeterna|vidadeluta|vidaabençoada|abencoadospordeus|gratidãoadeus|trabalhoeprosperidade|resiliência|superação|desanimarjamais|vidaagrária|produtorrural|sótrabalho","505594","37748","1275","2469","https://i.ytimg.com/vi/SKrOhXuRfEI/default.jpg","False","False","Oi minhas lindas e meus lindos.Espero que gostem desse vídeo, 💖💙E não esqueçam: deixe seu like no vídeo, se inscrevam no canal e nos sigam lá no Instagram: @sarakellenofficial (https://www.instagram.com/sarakellen_official/) e @willker28official (https://www.instagram.com/willker28official/ ).Ah e para quem não está inscrito corre lá no Canal do Willker    @Coisas da Roça        ? Inscreva-se e até o próximo vídeo!"
"Gm3o0bfGP3g","Viúva Negra | Marvel Studios | Trailer Oficial Legendado","2021-04-03T16:00:11Z","UCItRs-h8YU1wRRfP637614w","Marvel Brasil","24","21.07.04","Marvel|Marvel Studios|Novo|Filme|Black Widow|Viúva Negra|Avengers|Vingadores|Scarlett Johansson|Florence Pugh|Taskmaster|David Harbour|Rachel Weisz|Cinema|Disney plus|Conteúdo Especial|Trailer|Teaser|Sizzle|Clipe|Cena|Premier Access","376713","19598","213","701","https://i.ytimg.com/vi/Gm3o0bfGP3g/default.jpg","False","False","Confira o novo trailer de #ViúvaNegra da Marvel Studios. Estreia mundial em 9 de julho nos cinemas e no @DisneyPlusBR com Premier Access por um custo adicional."
"0i4YD2GpD-A","Kevinho e Zé Felipe - Senta com Amor (Videoclipe Oficial)","2021-04-02T15:00:13Z","UCRxAbWkaLIVlyOy3N9QHm6w","Kevinho","10","21.07.04","mc kevinho|canal mc kevinho|mc kevinho canal|canal oficial mc kevinho|kevinho|kevinho mc|kevinho funk|ze felipe|kevinho e ze felipe|kevinho fofoca|ze felipe fofoca|fifeat|senta com amor|ze felipe senta com amor|kevinho senta com amor|mc kevinho senta com amor|ze felipe sertanejo|funk kevinho|kondzilla|funknejo|ze felipe e virginia|kevinho e gabi","3413585","112119","1695","2110","https://i.ytimg.com/vi/0i4YD2GpD-A/default.jpg","False","False","Ouça 'Senta com Amor' no Spotify, é só clicar https://spoti.fi/2POw79tLetra da Música:No primeiro beijo que ela deu, a química bateuDo beijo foi pra cama e não deu outra No sorriso que ela me deu, não sei o que aconteceu Tirou o brilho de todas as bocasLogo eu que não valia nada, se dissesse 'eu te amo' eu vazava Mais olhando ela assim na minha cama, diz ai como é que não amaé que ela fez de um jeito, que detonou meus planos de solteiro é que ela senta, senta, senta com amor é cada quicada braba que meu coração xonouFicha Técnica:Direção: Mateus RigolaProdução: Luan RaphaelProdução Musical: Newton Fonseca Edição: Mateus RigolaAssistente de câmera: Eduardo SousaAssistente de produção: Guilherme Zampieri e Ana YamadaTratamento: Larissa BotaroVFX: Tiago KuurtzFotografia Making of: Gabriel BrasilMaking of: Alef Santz Figurino Kevinho: Léo Bronks e TimbaFigurino Zé Felipe: Rodolpho RodrigoMake Kevinho: Tatiana BombardaMake: Zé Felipe: Rodolpho RodrigoCoreógrafa: Bella Bittencourt Casting Figuração: Thaynara CarvalhoCasting Ballet: Bella BittencourtLocacão Estudio: Blimp Estúdios Locação Shopping: West Plaza ShoppingTeste do Covid: DanielMotorista: Bruno Fechamento#fifeat #Kevinho #ZéFelipe Redes oficiais do Artista: 🚩Página no Facebook: https://bit.ly/39PrMdU🚩Instagram: https://bit.ly/36FRP54🚩Twitter: https://bit.ly/3jiBHMb🚩Spotify: https://spoti.fi/3azZ3bT"
"8YtKN-AsOnU","CELULAR GAMER? - RoG Phone 5","2021-04-02T23:08:10Z","UCuxfOdbKQy0tgGXcm9sjHiw","Coisa de Nerd","28","21.07.04","leon|coisadenerd|coisa de nerd|português|brasil|pt-br|br|smartphone|smart phone|celular|rog phone 5|rog phone|rog fone|asus rog phone 5|asus|asus rog phone|celular gamer|smartphone gamer|gamer|smart phone gamer|android","988024","103404","1009","4538","https://i.ytimg.com/vi/8YtKN-AsOnU/default.jpg","False","False","Este é um vídeo sobre o Asus RoG Phone 5, um smartphone voltado para o público gamer. Ele realmente tem o que precisa pra ser considerado um produto gamer? Analisemos!"
"FLMYKc0SVk4","NICE HOUSE - DIREÇÃO (CLIPE OFICIAL)","2021-04-02T21:30:13Z","UC425ACWMva3Bvze-VNsVgzg","Nice House Brasil","10","21.07.04","tamo nice|nice house br|nice house brasil|nice house|coisas de trigemeas|música tiktok|cdt|cdtcanaloficial|direção","687697","79269","504","4686","https://i.ytimg.com/vi/FLMYKc0SVk4/default.jpg","False","False","Ouça Direção nas Plataformas Digitais: http://bit.ly/NicedirecaoLetra: Somos muito maisDo que as pessoas veem por aíUns querem ficar, uns querem seguirOutros planos, outros sonhos, diferentes do daquiMinha vida é completa de coisas que eu não viviVou sair, em busca de me encontrar Sei que eu pertenço a algum outro lugarLonge de casa não tinha mais opçãoAgora eu sigo a minha própria direçãoEnvolvido com a vida cheio de preocupaçãoE nessa multidão me sinto em outra dimensãoUns vão pra láA gente de cá Memórias vão ficarTive que partirPra conseguirEu sei que o meu lugar não é aquiOutros planos, outros sonhos, diferentes do daquiMinha vida é completa de coisas que eu não viviVou sair, em busca de me encontrar Sei que eu pertenço a algum outro lugarLonge de casa não tinha mais opçãoAgora eu sigo a minha própria direçãoSai da minha casa sem medo, sem nada Tentando me reencontrarVivi o melhor e o pior que a vida podia me proporcionarOooh, Oooh, OhhhVou sair, em busca de me encontrar Sei que eu pertenço a algum outro lugarLonge de casa não tinha mais opçãoAgora eu sigo a minha própria direção (3x).Ficha Técnica Direção:Intérpretes/Voz: Choi, Nica Reina, Cereja, Walter Moraes, Lucas Leal, Filipe Gabriel, Trigêmeas (CDT), Júlia Blaz.Produção Musical (mixagem e masterização): MalharoProdução Geral: Nice House BRDireção artística: Evandro Casarin Diretor de fotografia: Well NavesVocê também pode encontrar a Nice House Brasil em todas as redes sociais: Instagram: https://www.instagram.com/nicehousebr/      Twitter: https://twitter.com/nicehousebr/   TikTok: https://www.tiktok.com/@nicehousebr/ Contato comercial: contato@nicehousebr.com"
"HGWjixwcbRc","MC Lipi - Já Chorei Demais (Love Funk) Emite Beats e DJ GM","2021-04-02T21:00:17Z","UC9OMsuaqvGdF0MtK3gYYNkA","Love Funk","10","21.07.04","funk|love filmes|LOVE FUNK|LOVE FUNK TV|funk 2021|mc lipi|mc lipi já chorei demais","1204138","90318","787","1667","https://i.ytimg.com/vi/HGWjixwcbRc/default.jpg","False","False","Acompanhe a playlist oficial da Love Funk no Spotify: https://bit.ly/LoveFunkPlaylist Siga nosso instagram principal: @lovefunkprodutoraSiga no instagram: @mclipioficialUma Realização Love FilmesInscrevam-se no NOVO CANAL da LOVE FUNK:https://bit.ly/CanalRevelacaonaFavelaArtista: MC LipiMusica: Já Chorei DemaisProdução: Emite Beats e DJ GMStudios Love FunkJá Chorei Demais Disponível em todas as plataformas digitais:https://onerpm.lnk.to/jachoreidemaisSHOWS: (11) 98336-9988 LOVE FUNK (Falar com Morais) @moraislovefunkoficialFicha TécnicaDireção: @TONY SENAS Edição:  @TONY SENAS Ass. Câmera @LuizFFelipeSenaVfx: @ze.lovefunkProdução: @Natangoodoy Faça seu vídeo Clipe com a Love Filmes (11) 94904-4907 Raul @ribeiro3r(14) 99673-3237 Pedro @tonellilovefunk(11) 94776-5380 ViniFacebook da Love Funk: https://www.facebook.com/lovefunkprodutoraoficialEste videofonograma é um produto original e próprio da Gravadora e Editora. A cópia dele ou o reenvio do mesmo resultará em grandes implicações ao seu canal do youtube ou até a exclusão do mesmo.LOVE FUNK FILMES ®#LoveFunk #JáChoreiDemaisAno 2021"
"eY713YR_xRY","Diego & Arnaldo, DJ Ivis - Falei pra Tu","2021-04-02T14:00:12Z","UC5AdE7Oo3kAlIiSeqKZO09Q","DiegoEArnaldoVEVO","10","21.07.04","diego e arnaldo 2021|diego e arnaldo musica nova|diego e arnaldo as melhores|relogio parado|dj ivis 2021|dj ivis esquema preferido|falei pra tu|falei pra tu cifra|falei pra tu letra|falei pra tu status|falei pra tu dj ivis|falei pra tu diego e arnaldo letra|dj ivis e diego e arnaldo|dj ivis piseiro|forró 2021|sertanejo mais tocadas|decide ai|eu falei pra tu|com ele nao vai pra lugar nenhum|dj ivis tiktok|falei|pra","1300167","7883","577","207","https://i.ytimg.com/vi/eY713YR_xRY/default.jpg","False","False","Vídeo Oficial de Falei Pra Tu de Diego & Arnaldo e DJ Ivis.Ouça agora e adicione nas suas playlists: https://smb.lnk.to/FaleiPraTuDEASe inscreva no canal do Diego & Arnaldo: https://SME.lnk.to/DiegoeArnaldonoYT​Falei Pra Tu(DJ Ivis / Val Lima)Você tá se enganando à toaTentando ser feliz com essa pessoaTu tá ficando loucaEsse teu plano pra me esquecerTô vendo lá na frente o que vai acontecerVocê vai sofrerPara de orgulho e deixa de ser ruimQue ainda dá tempo de voltar pra mimDecide aíEu falei pra tuJá falei pra tuQue com ele não vai pra lugar nenhumEu falei pra tuJá falei pra tuQue com ele não vai pra lugar nenhumJá falei pra tu...Siga a dupla nas redes sociais!Site oficial: http://www.diegoearnaldo.com.br​Facebook: https://www.facebook.com/diegoearnaldo​Instagram: https://instagram.com/diegoearnaldo#DiegoEArnaldo #DJIvis #FaleiPraTu"
"JhZFOsb12hc","A Primeira de 2021 - Bruno & Marrone","2021-04-02T05:33:23Z","UCdTX5ycRKPvTUiGu1519u4g","Bruno e Marrone","10","21.07.04","dupla sertaneja|sertanejo|country|romântico|Bruno e marrone|Gusttavo Lima|Modão|sertanejo 2021","3044540","85511","2255","813","https://i.ytimg.com/vi/JhZFOsb12hc/default.jpg","False","False","No dia 01/04 Bruno & Marrone farão a sua primeira live do ano. Beba com moderação. O conteúdo desta live é destinado para maiores de 18 anos.#Bruno&Marrone #01Abril #PrimeiraLiveDoAnoAtualizado semanalmente! Ouça todos sucessos do sertanejo com Bruno e Marrone aqui: https://brunoemarrone.lnk.to/hitsLF"
"ajhMwSG8aRw","SPA DAY REALZÃO 🦋","2021-04-02T17:39:04Z","UCElNAGclgkuKa0bKRtUg3Ig","lisa barcelos","22","21.07.04","lisa barcelos|Luiza barcelos|beleza|makeup|curly|mega|trancas|box braids|cabelo cacheado|cabelo crespo|cacheada|lisa challenge|emalta|lisa barcelox|maquiagem|tatuagem|morena|brasileira|challenge|challenge makeup|melhores challenges|finalizaçao|cachos","533933","79052","2372","4463","https://i.ytimg.com/vi/ajhMwSG8aRw/default.jpg","False","False","Salveeee lindezaaas!! tutubom?? espero muito que tenham gostado do vídeo❤️❤️ não esqueçam o like e nem de se inscrever p fazer parte da família :)⇨ CONTATO: lisabarcelos@i9rdigital.com.br 💌⇨ INSTAGRAN: lisabarcelox 📸⇨ TWITTER: lisabarcelox 🦋⇨ TIKTOK: lisabarcelox 🖤curiosidades frequentes:• tenho 17 anos (10/12/2002)*• meu editor é o filmora9*• moro no Rio de Janeiro- Baixada Fluminense*brigada por leeer até aquii, beba água e espalhe boas energias :)"
"Vwq-jblihr8","COMO FOI A CHEGADA DO BLESS?? - CONSELHOS DE MÃE","2021-04-03T13:00:23Z","UCTCykZFeSbgMuL2ZzhSyVzg","GIOH","24","21.07.04","Giovanna|Ewbank|Gio|Gioh|Bruno|Gagliasso|Diversão|Celebridades|Estrelas|Na|Cama|Famosos|Titi|História do Bless|adoção|irmãos","729781","93154","382","2117","https://i.ytimg.com/vi/Vwq-jblihr8/default.jpg","False","False","Meus amores!Hoje estreia um quadro novo no canal, o Conselhos de Mãe! E eu aproveitei esse vídeo para compartilhar com vocês um pouco mais de algo muito importante pra nossa família,  a história do Bless. Espero que gostem! Beijo giohs 😘Realização: PLAY9Figurino: Luisa MeirellesStyling: Deb EwbankAcompanhe a gente também no Instagram: @gioh_oficial"
"EAg69LaLlS0","Demi Lovato - Dancing With The Devil","2021-04-02T04:00:14Z","UCnyB9MYKRkSFK3IIB32CoVw","DemiLovatoVEVO","10","21.07.04","Demi|Lovato|Dancing|With|The|Devil|Island|Records|Pop","11204211","715162","14002","34731","https://i.ytimg.com/vi/EAg69LaLlS0/default.jpg","False","False","Listen to “Dancing With The Devil”: https://DemiLovato.lnk.to/DWTD​​ 'Dancing With The Devil... The Art Of Starting Over' out now: https://demilovato.lnk.to/DWTDTAOSO​​Shop: https://shop.demilovato.com/Watch the Demi Lovato: Dancing With The Devil documentary: https://yt.be/demidwtdA true story by Demi LovatoDirected by Demi Lovato & Michael D. RatnerProduced by OBB Pictures & SB FilmsIf you or someone you know is in need of support, it’s OK to ask for help.If you are struggling with addiction, call 1-800-662-HELP (4357) or visit samhsa.gov.If you have experienced sexual assault, call the RAINN Sexual Assault Hotline 1-800-656-HOPE (4673).Need someone to talk to? Reach out to your local crisis text line:USA: Text HOME to 741741; UK: Text SHOUT to 85258; Canada: Text CONNECT to 686868 or 741741Connect with Demi: Subscribe https://www.youtube.com/channel/UCZkURf9tDolFOeuw_4RD7XQInstagram http://instagram.com/ddlovato​​ Twitter http://twitter.com/ddlovato​​ Facebook http://facebook.com/demilovato​​ Official site http://demilovato.com​​ Join her mailing list to stay up to date http://www.demilovato.com/#mailing-list​​ #DemiLovato​​ #DancingWithTheDevil​​ #DWTDTAOSOMusic video by Demi Lovato performing Dancing With The Devil. © 2021 Island Records, a division of UMG Recordings, Inc.http://vevo.ly/lZ34fj"
"Ckffb59tET0","Rico vs Pobre - PÁSCOA","2021-04-02T14:00:02Z","UC1k6oMuW2gKd2QFI5NhmmVw","Glauber Cunha","23","21.07.04","rico vs pobre|rico vs pobre na páscoa|páscoa|rico x pobre|humor|comédia|glauber cunha|dona sônia|pobre|rico|ovos de páscoa|almoço de páscoa","693365","41284","658","1753","https://i.ytimg.com/vi/Ckffb59tET0/default.jpg","False","False","Rico vs Pobre na Páscoa"
"JcAVhQ1Fb3A","MINHA IRMÃ É UMA PILANTRA😡😂","2021-04-03T15:25:28Z","UCPZGlmLR5e2OxjkxJfkB4uQ","Irmãos Lemos","24","21.07.04","shorts|vídeos curtos","1192267","89524","3585","720","https://i.ytimg.com/vi/JcAVhQ1Fb3A/default.jpg","False","False","Ela me enganou mais uma vez, mas agora teve troco ksksskNossas Redes Sociais:Evandro Lemos Instagram: https://www.instagram.com/evandro_lemoss Jaqueline Lemos Instagram: https://www.instagram.com/jaque_lemosss #shorts"
"wdJPUgu8E2E","GRAVEI UM CLIPE COM A MC MIRELLA!","2021-04-03T14:01:36Z","UCtsrWh3DHjY6TfqiWqJ3mEg","Lais Bianchessi","22","21.07.04","lais|lais bianchessi|bianchessi|cantora|cantora lais bianchessi|xfactor|lais x factor|adr|rezende|rezendeevil|24h GRAGANDO O CLIPE|mc mirella|clipe mc mirella|mc mirella e lais bianchessi|musica nova","295207","36573","471","917","https://i.ytimg.com/vi/wdJPUgu8E2E/default.jpg","False","False","Se vc curtiu deixa aí nos comentários que eu vou ler tudo s2s2Instagram: @laisbianchessi"
"vqOonOkceIg","Ensaio #LiveCachacaCabare Leonardo e Gusttavo Lima","2021-04-03T01:34:23Z","UC-kCNs2KVMx0WN-tfysYTIw","Leonardo","10","21.07.04","[none]","246647","9831","196","420","https://i.ytimg.com/vi/vqOonOkceIg/default.jpg","False","False","Inscreva-se no meu canal: http://bit.ly/LeonardoCantorOficial #Leonardo Siga Leonardo nas redes sociais:Facebook: http://facebook.com/leonardocantoroficialTwitter: http://twitter.com/leonardocantor_Instagram: http://instagram.com/leonardoTiktok: http://www.tiktok.com/@leonardoAcesse o site oficial: http://www.leonardo.art.brContato para shows: (62) 3638.6280"
"IS4UkvQRj8Q","PROVEI OS OVOS DE PÁSCOA DE COLHER COM PIOR E MELHOR AVALIAÇÃO DA CIDADE!","2021-04-03T15:27:48Z","UCxRql7KwEurNrmFCGaXX8RQ","Carol Bresolin","24","21.07.04","carol bresolin|Pior avaliação|Melhor avaliação|Ovo de colher|Melhor ovo de colher|Pior ovo de colher|Melhor ovo de Páscoa|Pior ovo de Páscoa|Ovo de colher Carol bresolin|Ovo de colher nutella|Ovo de colher kinder|Melhor e pior Avaliação|Série piores Carol bresolin|Carol bresolin piores|Pior avaliação aplicativo|Melhor avaliação aplicativo|Pior avaliação iFood|Melhor avaliação iFood|Pior avaliação rappi|Melhor avaliação rappi|Carol Bresolin série piores","303395","38104","416","1017","https://i.ytimg.com/vi/IS4UkvQRj8Q/default.jpg","False","False","CUPOM BINOMO: MOKA1Link para download: http://bit.ly/bresoli_binomoLink do instagram da Binomo - https://www.instagram.com/binomobr_official/Vocês pediram muito e o vídeo da série de pior vs melhor avaliação voltooou :) Em comemoração a Páscoa, provei o ovo de colher de melhor avaliação da minha cidade e o de pior avaliação! Comentem qual a próxima comparação que eu posso fazer!!Acompanhe também nas redes sociais: Instagram: @carolbresolinFacebook: carolbresolinTwitter: @carolbresolinAtenção: Este vídeo é meramente para entretenimento e não tem o intuito de incentivar a reprodução do conteúdo. Não faça isso em casa!! Este vídeo é para exclusivamente criado para entretenimento, como todos do canal ♥️"
"FLP2kkpQ6Uw","Antony e Gabriel / Israel e Rodolffo - Vizinho Baderneiro","2021-04-02T15:05:44Z","UCQ-YGnapg8TJ9d3ePKWIN8Q","Antony e Gabriel","10","21.07.04","[none]","393071","17277","150","323","https://i.ytimg.com/vi/FLP2kkpQ6Uw/default.jpg","False","False","Ouça 'Vizinho Baderneiro' e adicione na sua playlist favorita! Composição: Ricardo Vismarck / RonaelLetra: Mudou pro lado da minha casaum vizinho baderneiroque não respeita nem segunda-feirae a farra come a semana inteiraE pra piorar tem uma saveirolotada de som até no bagageirooutra noite que eu passo em claronão vou aguentar isso caladoDuas da manhã e meu vizinhoaqui bebendo, cantando, moendosabe o que é que eu vou fazeramizade com elevai que me chama pra beberDuas da manhã e meu vizinhoaqui bebendo, cantando, moendoe já que o som não foi emboraabre o portão vizinhoque eu tô chegandocom a cerveja e a viola._________________________________Direção Musical: Gustavo BurgoDireção Técnica: Cláudio LandgrafDireção de Vídeo: Jacques JrDireção Geral: Concept Music_________________________________• Site: http://www.antonyegabriel.com.br/​• Youtube: http://bit.ly/AeG-Youtube​• Spotify: http://bit.ly/AeG-Spotify​• Deezer: http://bit.ly/AeG-Deezer​• PalcoMp3: http://bit.ly/AeG-PalcoMp3​• Facebook: https://www.facebook.com/AntonyeGabrielOficial• Instagram: @antonyegabriel @antony_aeg @gabriel_aeg• Shows: 43 3324-2474 / 43 99660-0016-----------------------------------------------#AntonyeGabriel #IsraeleRodolffo #Sertanejo"
"RzDP2SNok4o","POR QUE JACQUIN DECIDIU COMPRAR O RESTAURANTE ÇA-VA? | PESADELO NA COZINHA","2021-04-03T15:00:11Z","UCp7tUxXfE9jUtkMLGCzeXqA","Pesadelo na Cozinha","24","21.07.04","[none]","612780","39821","115","1093","https://i.ytimg.com/vi/RzDP2SNok4o/default.jpg","False","False","Erick Jacquin já passou por muitos estabelecimentos em Pesadelo na Cozinha. Mas a terceira temporada teve um sabor especial para o chef, que decidiu comprar um dos restaurantes, o Ça-Va, após as gravações, que aconteceram no início de 2020, antes da pandemia. Depois das filmagens, o antigo dono, Antônio Carlos Cirelli, morreu vítima de Covid-19, e os filhos dele procuraram o líder da atração para uma oferta. “Ele faleceu, infelizmente, sem ver esse resultado. Hoje ele estaria muito feliz de ver esse restaurante”."
"3nXLUIKmy0A","Sorriso Maroto, Lauana Prado - Acidentes Acontecem (DVD AMA)","2021-04-02T15:00:01Z","UClqmzNx7-xd-5_MzdSotYKw","Sorriso Maroto","10","21.07.04","Pagode|Pagode (Musical Genre)|Samba (Musical Genre)|Dependente|Sorriso Maroto|Thiaguinho|Turma do pagode|Luan santana|Jorge e Mateus|Henrique e Juliano|Wesley Safadão|Simone e Simaria|Maiara|Maraisa|Whinderson Nunes|Samba|sorriso maroto|belo|dilsinho|ferrugem|péricles|antigas do sorriso|sorriso antigas","242954","11082","93","302","https://i.ytimg.com/vi/3nXLUIKmy0A/default.jpg","False","False","Este é o clipe oficial da música Acidentes Acontecem, faixa do novo trabalho “Sorriso Maroto – A.M.A.”. Para comprar, ouvir ou baixar essa música, clique https://smb.lnk.to/AMAVol6Acompanhe o Sorriso Maroto nas redes sociais:Facebook: https://www.facebook.com/sorrisomarotoInstagram: http://instagram.com/sorrisomarotoTwitter: https://twitter.com/sorrisomarotoYoutube: http://youtube.com/sorrisomarotoAcidentes Acontecem(Marcos Esteves / Gabriel Cantini / De Ângelo)Quem diria que o amor tava na esquina Pronto pra atravessar a minha vida aaahLogo eu, uma pessoa tão distraída Quando olhei já tava em cima Nem deu pra frear Sua boca acertou em cheio Chegou a amassarMeu coração E agora quem vai consertar?Acidentes acontecem Foi só eu distrair, bati de frente com você A porrada foi forte demais Mas seu beijo foi mais Agora assume aí o estrago que essa boca faz#SorrisoMaroto #LauanaPrado #AcidentesAcontecem"
"DsdjqBfTpaI","Teto - Paypal","2021-04-01T15:01:38Z","UCoHV8LxUFKeIvifJsB3c7Ww","30PRAUM","10","21.07.04","matuê|tuê|matue|30|30praum|praum|rap|trap|hip|hop|pop|mature|hype|track|music|viral|teto|teto previas|teto paypal|paypau|pay pal|fiz um show|pega no meu|teto clipes|teto oficial|teto letra|teto status|teto m4|m4 gritando meu nome","3965800","356609","3165","18902","https://i.ytimg.com/vi/DsdjqBfTpaI/default.jpg","False","False","[previas.zip / PAYPAL_VISUALIZER.mp4]booking@30praum.com"
"sWA5h5B6NvA","QUARTO DA ZAYA COMPLETO","2021-04-01T22:50:28Z","UCPa8vElq5yFo3wV6BY6HqoQ","Simone Mendes","22","21.07.04","simone|simaria|zaya|enxoval|berço|bebê","1359650","98520","976","2249","https://i.ytimg.com/vi/sWA5h5B6NvA/default.jpg","False","False","Quem tá curioso pra ver como ficou o quarto da Zaya, prontinho, decorado e com enxoval completo? Chegou a hora de conferir cada detalhe, cada sapatinho, cada roupinha da nossa pequena, um verdadeiro quarto de princesa! Conta aqui pra mim nos comentários o que você achou e o que mais você gostaria de ver da nova herdeirinha da família!"
"6eKE9pf01FY","3 NEW CLASH Games Announcement!","2021-04-02T13:00:55Z","UCD1Em4q90ZUK2R5HKesszJg","Clash of Clans","20","21.07.04","clash of clans|COC|Clash of Clans Gameplay|Clash of Clans Strategy|Clash of Clans Animation|Clash of Clans Commercial|Clash of Clans Attacks|Clash of Clans Town Hall|Hog Rider|PEKKA|Clan Wars|season challenges|clan war leagues|clash on|clan game|clan games|clash quest|clash mini|clash heroes|supercell games|new supercell game|new clash game|yt:cc=on","6138071","214795","7442","20440","https://i.ytimg.com/vi/6eKE9pf01FY/default.jpg","False","False","Visit 👉 https://clash.com 👈 and sign up to get notified when these games are available in your country! We're excited to announce 3 new Clash games in development: Clash Quest, Clash Mini and Clash Heroes! Announcement blog: http://supr.cl/3cJ6MXrFollow each Clash game on our Socials!Clash QuestTwitter ► https://twitter.com/clashquestInstagram ►https://www.instagram.com/clashquestClash MiniTwitter ► http://twitter.com/clashminiInstagram ►https://www.instagram.com/ClashMiniGameClash HeroesTwitter ► http://twitter.com/clashheroesInstagram ► https://www.instagram.com/ClashHeroesGamePrivacy Policy:http://www.supercell.net/privacy-policy/Terms of Service:http://www.supercell.net/terms-of-ser...Parent’s Guide:http://www.supercell.net/parents#ClashQuest #ClashMini #ClashHeroes #Clash #ClashofClans #ClashRoyale"
