video_id,title,publishedAt,channelId,channelTitle,categoryId,trending_date,tags,view_count,likes,dislikes,comment_count,thumbnail_link,comments_disabled,ratings_disabled,description
"iFgnxNtxwzA","ASSUSTADOR!!! QUANTO MAIS EU VEJO, MENOS EU ACREDITO... Pescaria. Pirarucu.","2021-04-05T12:00:23Z","UCFayRsJDx15WyMzZtll6EPQ","Fabio Fregona - BACA","22","21.07.04","baca|bacca|fabio baca|fábio baca|fabio|fábio|fregona|fabio fregona|fábio fregona|pescaria|pesca|pescar|pescador|pescando|pirarucu|arapaima|peixe|peixes|peixe gigante|peixe monstro|video de pesca|vídeo de pescaria|video de pescaria|vídeo de pesca|pesca de caiaque|pesca com caiaque|fishclub|fish club|fishing|fish|kayak fishing","1225805","73984","1967","6660","https://i.ytimg.com/vi/iFgnxNtxwzA/default.jpg","False","False","Já tive muitas conquistas como pescador, já fiz grandes capturas, já pesquei peixes lindos, mas nada se compara a esse... Pescar um pirarucu de 2 metros, 100kg, sozinho, num pequeno caiaque, com isca artificial e uma varinha de 20lb... Clique e acompanhe a maior pescaria da minha vida!!!ONDE COMPRAR PRODUTOS DE PESCA: Quem quiser comprar algum equipamento de pesca pela internet, indico o site da ANGLER BRASIL, loja 100% confiável, com excelentes preços e ótimo atendimento. https://www.anglerbrasil.com.br/ MATERIAIS UTILIZADOS NESTA PESCARIA: Caiaque Barracuda Profish ( https://www.anglerbrasil.com.br/nautica/caiaque-pesca/barracuda-pro-fish )Camisa Presa Viva Fábio Baca 2021 ( https://www.anglerbrasil.com.br/vestuario/camiseta-pesca/camisa-presa-viva-fabio-baca-2021 )Calça que vira bermuda Presa Viva ( https://www.anglerbrasil.com.br/loja/busca.php?loja=599827&palavra_busca=cal%E7a+presa+viva )Óculos Polarizado Matuto ( https://www.anglerbrasil.com.br/loja/busca.php?loja=599827&palavra_busca=%F3culos+matuto )Vara OKUMA Citrix 10-20lb ( https://www.anglerbrasil.com.br/varas/vara-p-molinete-okuma-citrix-s602mh-6-0-1-83m-20lb-2-partes )Molinete OKUMA Inspira 30 ( https://www.anglerbrasil.com.br/loja/busca.php?loja=599827&palavra_busca=inspira )Linha YGK Grand-PE G-Soul WX8, 55lb Líder YGK Ultra Absorber Slim and Strong, 50lbIsca OCL Jerk SS 120 - protótipo ( https://www.anglerbrasil.com.br/loja/busca.php?loja=599827&palavra_busca=jerk )Snap engate rápido Glico 80lb ( https://www.anglerbrasil.com.br/acessorios/snaps-pesca/snap-glico-engate-rapido )PEIXE PESCADO:Pirarucu - arapaima gigas.Respeite a natureza, preserve! Só há pescaria se o peixe estiver vivo... PESQUE E SOLTE!!!"
"blnMlqdcz-8","New York Knicks x Brooklyn Nets - NBA AO VIVO","2021-04-06T02:01:24Z","UCsiCOcr5SZAWlJMfcw9P__w","NBA Brasil","17","21.07.04","nba|nba ao vivo|vivo|ao vivo|jogo|partida|link|nba brasil|bud|budweiser|transmissão|onde ver jogo da nba|como ver jogo nba|brasileiros na nba|como assistir a um jogo da nba|onde ver um jogo da nba|top 10|top|melhores jogadas|melhores lances|narracoes|melhores narracoes|narracoes mais engracadas|enterrada|ponte aérea|dunk|assistir nba ao vivo|brooklyn|irving|knicks|new york|james harden","309689","48977","116","3","https://i.ytimg.com/vi/blnMlqdcz-8/default.jpg","False","False","JOGO EXCLUSIVO DO YOUTUBE!Nessa segunda-feira, o Brooklyn Nets enfrenta o New York Knicks! Aquele programa pra começar MUITO BEM a nossa semana! Aqui você pode acompanhar os melhores jogadores, times e partidas da NBA ao vivo. Com convidados especiais, matérias exclusivas e muito mais! Não se esqueça de dar like, compartilhar, se inscrever e apertar o sininho para receber todas as notificações do canal.A Loja NBA deixa o estilo da NBA ao seu alcance! E para você que está acompanhando esse jogão, aproveite um desconto especial de 15% na sua compra! Acesse o QR code aí na tela ou visite o link especial que está aqui na descrição do vídeo e use o código NBANOYOUTUBE ao fechar sua compra. Visite agora http://bit.ly/DescontoLojaNBA e confira!"
"iiyrspJ6iHQ","CONSERTANDO OS FILMES","2021-04-06T13:00:27Z","UCV306eHqgo0LvBf3Mh36AHg","Felipe Neto","24","21.07.04","felipe neto|irmãos neto|one piece|matrix|harry potter|crepúsculo|luccas neto|filmes|star wars|guerra nas estrelas|mcdonalds","854482","123341","1747","8498","https://i.ytimg.com/vi/iiyrspJ6iHQ/default.jpg","False","False","LOJA DO CANAL - https://www.lolja.com.br/felipe-netoOs filmes precisavam dessa correção, por isso resolvi fazer esse vídeo. Confira!SEJA MEMBRO! - https://www.youtube.com/felipeneto/joinPLAYLIST DA SAGA MINECRAFT! - https://www.youtube.com/playlist?list=PLnRuoKy8h_HsnIf9BNo_a4K63jEyowJ8CVEM PARTICIPAR DO NOSSO REDDIT: https://www.reddit.com/r/netolab/"
"Pfzz1FeKWOs","COMO FAZER MENTALISMO USANDO UM DADO 🎲 TUTORIAL de MÁGICA","2021-04-05T21:00:15Z","UCUWXjHn_1UeTqGxligXLwIA","Felipe Barbieri","24","21.07.04","mágica|ilusionismo|truque de mágica|mágica com papel|como fazer mágica|mágicas fáceis|mágica fácil|truques de mágica|felipe barbieri|magia|magic trick|mágico|ilusionista|mágicas reveladas|mágica como fazer|truques de mágicas fáceis|mágica com cartas|mágica simples|aula de mágica|curso de mágica|mágica com baralho|mágicas de baralho|magica|magicas|truque de magica|tutorial de magica|mágica do dado|adivinhar numero do dado|mentalismo|mágica com dado","180348","27090","197","613","https://i.ytimg.com/vi/Pfzz1FeKWOs/default.jpg","False","False","Aprenda como fazer 4 mágicas de mentalismo usando DADOS!Meu PODCAST: https://youtube.com/channel/UC6x9_gPto1BJaDhhq5m3AvgCanal de Cortes: https://youtube.com/channel/UCesiCY5dd_1cL3LEBYCTCpQ ▶CURSOS DE MÁGICA http://www.magicaprofissional.com.br▶LOJA OFICIAL de MÁGICAS: http://www.magicnroll.com.br▶CANAL DO ET PIRÚ: https://www.youtube.com/channel/UC2bNwSzjMGGh7xrxOrrLo4A▶Parcerias: contato@magicnroll.com.brInscreva-se para se tornar um expert em mágicas e ilusionismo. Aqui ensinamos os maiores números de ilusionismo para você impressionar seus amigos e deixar todo mundo de boca aberta. Vídeo toda semana, não esqueça de ativar o sininho e deixar seu like em todos os vídeos para nos ajudar a crescer cada vez mais!"
"xXXHR1TTT-c","TÔ GRÁVIDA!!! *não é trollagem* 😱❤️❤️","2021-04-04T23:06:31Z","UCZtOF_W8L82GcENIOGpSPDg","Jaqueline Sobrinho","22","21.07.04","tô grávida|trollagem|gravidez|mãe|novelinha|casal|namorado|revelando|relação|Virgínia|Vou ser mamãe|Vou ser papai|Mãe de menina|Mãe de menino|grávida|baby|bebê|clipe|revelação|surpresa|transformei|namoro|casamento|trollei|dança|descobrindo a gravidez|chorei|fazendo o teste|amor de mãe|ganhei uma cobra|minha irmã é uma chata|filme|romantico|beleza|praia|summer|pedi a clara em namoro|embarazada|descobri|me surpreendeu","1602791","110202","2171","0","https://i.ytimg.com/vi/xXXHR1TTT-c/default.jpg","True","False","VÍDEO: FILIPE SEVERO https://instagram.com/filipepsevero?igshid=as4nv1pxuacj..Canal da Valen: https://www.youtube.com/c/ValentinaSobrinho🔹SIGAM AS MINHAS REDES SOCIAIS : ✔️INSTAGRAM : https://www.instagram.com/jaque.sobri... ✔️PLATAFORMA DE PUBLICIDADE: https://jaquesobrinho.com.br/ ✔️TIKTOK: https://www.tiktok.com/@jaquesobrinho... ✔️MEU FACEBOOK: https://www.facebook.com/jaqueline.fs... ESPERO QUE TENHAM GOSTADO DO VÍDEOOOO! BEIJOSSS 😘"
"xdBWrkcmMwU","Loki | Marvel Studios | Trailer Oficial Dublado | Disney+","2021-04-05T13:00:23Z","UCItRs-h8YU1wRRfP637614w","Marvel Brasil","24","21.07.04","Marvel|Marvel Studios|New|Novo|Loki|Tom Hiddleston|Falcão|Soldado Invernal|Series|Serie|Disney plus|Disneyplus|Special Look|Conteúdo Especial|Trailer|Teaser|Sizzle|Clipe|TVA","342662","23862","456","2137","https://i.ytimg.com/vi/xdBWrkcmMwU/default.jpg","False","False","Confira o novo trailer de #Loki da Marvel Studios. Série original com estreia exclusiva em 11 de junho. Só no #DisneyPlus"
"1D0l662T6fg","Bastidores – Madureira 1 x 5 Flamengo","2021-04-06T22:18:50Z","UCOa-WaNwQaoyFHLCDk7qKIw","FLA TV","17","21.07.04","Clube de Regatas do Flamengo|Flamengo|Mengão|Mengo|Fla|Fla TV|TV Fla|canal oficial do flamengo|bastidores flatv|bastidores flamengo e madureira|preleção flamengo|vestiário flamengo e madureira|madureira e flamengo|melhores momentos flamengo|gols flamengo|gabigol|arrascaeta|diego ribas|gerson flamengo","87913","10917","59","446","https://i.ytimg.com/vi/1D0l662T6fg/default.jpg","False","False","Show de bola! O Flamengo goleou o invicto Madureira por 5 a 1 com um desempenho incrível dentro de campo. Com a vitória, o Rubro-Negro retoma a liderança do Campeonato Carioca. Gabi duas vezes, Gerson, Diego e Arrascaeta marcaram os gols do triunfo. O atacante Gabriel Barbosa entrou para a história nesta partida, alcançando a marca de 73 gols com o Manto Sagrado, que o coloca, ao lado de Renato Abreu, no posto de maior artilheiro do clube no século 21. Quer mais emoção? Só assistindo aos Bastidores desse jogo que a FlaTV preparou com muito carinho para você, torcedor! Vibre com o Mengão!Nação, torcer pelo Flamengo ficou ainda mais emocionante! Assista a todos os jogos do Campeonato Carioca, ao vivo e com imagens, na FlaTV+. É isso mesmo, com imagens da partida! Você não pode perder a transmissão mais rubro-negra do país! Saiba mais em: https://flatvmais.com.br/Inscreva-se na #FlaTV. Vídeos todos os dias!Subscribe to Flamengo channel, a 40-million-fans nation. Join us!----------Com você o Mengão vai mais longe!Seja sócio-torcedor: http://mengo.com.br𝗦𝗶𝗴𝗮 𝗼 𝗙𝗹𝗮𝗺𝗲𝗻𝗴𝗼 𝗻𝗮𝘀 𝗿𝗲𝗱𝗲𝘀:𝗜𝗻𝘀𝘁𝗮𝗴𝗿𝗮𝗺: https://www.instagram.com/flamengo𝗧𝗶𝗸𝗧𝗼𝗸: https://www.tiktok.com/@flamengo𝗧𝘄𝗶𝘁𝘁𝗲𝗿: https://twitter.com/Flamengo𝗙𝗮𝗰𝗲𝗯𝗼𝗼𝗸: https://www.facebook.com/FlamengoOficial"
"jl_iqSpcwTk","Deixa Eu Falar Pra Você - Josue Bom de Faixa ( CLIPE OFICIAL )","2021-04-05T15:00:21Z","UCeHciIF8MgNSx2fbNpQN2hQ","Josué Bom de Faixa","10","21.07.04","Deixa eu falar pra você|Josué bom de faixa|Eu tava aqui pensando|Pensando em teu sorriso|Sonhei com teu olhar|Josue bom de faixa|Clipe oficial|Tarcísio do Acordeon|Zé vaqueiro|Eric Land","166320","15489","170","1168","https://i.ytimg.com/vi/jl_iqSpcwTk/default.jpg","False","False","clipe oficial da musica - DEIXA EU FALAR PRA VOCÊ!Eu tava aqui pensando imaginando o teu  cheiro, beijando a sua boca. para te deixar, louca ...sonhei com teu sorriso, querendo seu olhar... querendo sua atenção... para eu te falar deixa eu falar;deixa eu falar para você, deixa eu contar pra você. 2xo que eu faço com você beber.2xeu vou jogar você na minha cama tirar sua roupa te chamar de meu benzinho te deixar louca puxar o seu cabelo e te fazer enlouquecer. 2 XSiga O Bom de Faixa nas rede sociais e nas plataformas digitais.Instagramhttps://www.instagram.com/josuebomdefaixa/Facebookhttps://www.facebook.com/josuebomdefaixaYoutubehttps://www.youtube.com/josuebomdefaixaSua Músicahttps://suamusica.com.br/josuebomdefaixaSpotifyhttps://open.spotify.com/artist/6yEKZXXjkBPBcAQAFdvSlz?autoplay=trueApple Musichttps://music.apple.com/br/artist/josu%C3%A9-bom-de-faixa/1528063020Artista exclusivo: Caique Pax Entretenimento@caiquepax_entretenimento(87) 9.9634-0607#DeixaEuFalarPraVoce #JosueBomDeFaixa #ChamaSeuMenino #CaiquePax"
"DHn9jM0o20Q","🚨 COMO SE INSCREVER NO SISU 2021 + ESTRATÉGIAS 1º DIA","2021-04-06T14:00:45Z","UC3KTSc6Ihj3vKI6aaYYpN_A","Umberto Mannarino","27","21.07.04","sisu|enem|mudanças no sisu|mudanças sisu|o que mudou no sisu|sisu como funciona|como funciona o sisu|sisu 2020 como funciona|como funciona o sisu 2020|como usar o sisu|como usar o site do sisu|estratégias sisu|estratégias enem|sisu lista de espera|sisu 2021|enem 2021|mudanças sisu 2021|sisu 2021 o que mudou|como funciona o sisu 2021|sisu 2021 como funciona|como usar o sisu 2021|estratégias sisu 2021|estratégias para o sisu 2021|site sisu 2021","44055","5149","27","958","https://i.ytimg.com/vi/DHn9jM0o20Q/default.jpg","False","False","🥇 MINHA ÚLTIMA PROMOÇÃO! Mestres do ENEM Completo + Bônus INÉDITOS + Acesso Vitalício e o Preço mais Baixo DA HISTÓRIA: https://cursomestresdoenem.com.br/Neste vídeo ensino o passo a passo de como usar o SiSU para se inscrever na 1a e 2a opção, bem como estratégias de 1º dia para aumentar as suas chances de aprovação já na chamada regular. No vídeo de amanhã, vamos analisar a primeira prévia de classificações e o possível comportamento das NOTAS DE CORTE. Para usar o SiSU, acesse http://sisu.mec.gov.br e procure o curso e instituição de interesse. Lembre-se de selecionar corretamente o turno e a modalidade de concorrência (cotas ou ampla concorrência) para não ter surpresas na hora da matrícula! A documentação exigida para comprovação de cada uma das cotas encontra-se disponível no próprio site do SiSU, ao lado da opção de matrícula em cada curso, turno, instituição e modalidade de concorrência.#ENEM2021 #SiSU2021 #SiSU"
"TsxJw2-qoKI","MAIS UM SEGREDO - PARTE 02!","2021-04-05T15:00:10Z","UCoIrFSMG4kt0hNF6KBgga0w","Dinah Moraes","23","21.07.04","[none]","579041","43657","642","1739","https://i.ytimg.com/vi/TsxJw2-qoKI/default.jpg","False","False","Gostou do vídeo? Se inscreva no canal e deixe seu like! Ative o sininho para não perder nenhum vídeo! Vídeo novotoda segunda e sexta! Me encontre nas redes sociais!Instagram:   https://instagram.com/dinahmoraesofTwitter: http://www.twitter.com/dinahmoraesofFacebook: https://www.facebook.com/DinahMoraesM/ROTEIRO E DIREÇÃO:Dinah MoraesEDIÇÃO:Glauber ChavesATUANDO:ELIAS MENDESITALO TOMAZITALO LOLPENIIW TEIXEIRAJAYME MENONCLECYANE BRAGAJOELTON BRASILWALESKA GOMESALLEF BRUNOPAULA RODRIGUESFELIPE LIMAMALAQUIASGIL SOUSAAURY MESQUITAJHONATAN LIMA SALOPITA A TRUPE DO CARRAPICHOMusic: Epidemic Sound"
"Vb1HVXhfmEk","VOCÊS VÃO ESCOLHER COMO VAI FICAR MEU APARTAMENTO! Urgente!","2021-04-06T15:33:16Z","UCoTM-vvs2hnv2mCvzNJ5uXA","Franciny Ehlke","22","21.07.04","FRANCINY EHLKE|FRANCINNY|FRANCINI|FRANCINE|ELKE|FRANCINNI|MAKEUP|BEAUTY","323297","57415","291","3196","https://i.ytimg.com/vi/Vb1HVXhfmEk/default.jpg","False","False","➭ CLIQUE AQUI PARA SE INSCREVER https://www.youtube.com/user/franciny...  e ative as notificações para não perder nada!! ❤- COMEÇARAM OS GASTOS DO MEU APARTAMENTO! Muita coisa! https://www.youtube.com/watch?v=NfDAGwz2Lo8➭ Instagram @francinyehlke➭ Contato profissional contato@francinyehlke.com ➭  Para me mandar coisas: Caixa Postal: 38 cep 83702-970 ♥"
"MJlDqU0PtOo","RECEBI UM BUQUÊ DE UM ADMIRADOR SECRETO E MEU MARIDO FICOU COM CIÚMES!!","2021-04-05T22:00:04Z","UCsaB2VrLZrtGbum6Eo0ClbA","Virgínia Fonseca","22","21.07.04","vih|virginia|fonseca|virginia fonseca|rezende|rezendeevil|virginia e rezende|ze felipe|ze felipe cantor|virginia e ze|ze e virginia|virlipe|namorados|casal|vlog|vlog virginia|video todos os dias|troll|trollagem|trollando virgínia|trollagem zé felipe|maria fifi|maria fifi ze felipe|fofoca|vlog com marido|vlog casal|vlog com meu namorado|relacionamento|veja no que deu|zé gueroba|admirador secreto|recebi um buque de rosas|trollagem com namorada ciumenta","1142506","150454","1208","3516","https://i.ytimg.com/vi/MJlDqU0PtOo/default.jpg","False","False","⚠️RUMO AOS 9 MILHÕES NO YOUTUBE!! SE INSCREVE RAPIDIN: http://bit.ly/3lrOT2m ⚠️ QUER VER A REAÇÃO DO ZÉ FELIPE QUANDO A VIRGÍNIA RECEBEU UM BUQUÊ DE FLORES DE UM ADMIRADOR SECRETO??! Oiii amigos, tudo bom? Mais um vlog para vocês com o meu marido Maria Fifi (Zé Felipe). E nesse vídeo ele ficou com ciúmes porque eu recebi um buquê de um admirador secreto. E aí, tão curiosos para saber quem é o admirador secreto que me mandou um buquê e deixou o Zé Gueroba com ciúmes?? Assistam o vídeo até o fim para descobrir. Um beiju e até o próximo vídeo. Tchaauu!Lembrando que agora os vídeos serão postados TODOS OS DIAS!! Então fiquem ligadinhos no canal para não perderem nada.Não vai embora antes de se inscrever no canal e deixar o seu LIKE para eu saber se vocês estão curtindo os vídeos.ME SEGUE NAS REDES SOCIAIS:INSTAGRAM: @virginiaTWITTER: @virginiapfs"
"fhC6mPa8vQs","FUI VER UM FH460 AMARELO PRA COMPRAR 😍 NOVO PROJETO","2021-04-05T15:00:30Z","UCtYmG4OZ96ZacwCpNXo996Q","Bruno Garcia","24","21.07.04","brunogarcia|Bruno|Garcia|CB1000|Voyage|Quadrado|Turbo|viagem|caminhao|cowboy|paulinho|paulinhosbk|gang|gbn|scania|scania 112|scania 143|112|143|scania v8|bruno scania|scania bruno|bruno garcia scania|scania bruno garcia|2 eixos|carretinha|carretinha 2 eixos|carretinha bruno|bruno carretinha|reforma|scania reforma|reforma scania","299349","42957","324","1051","https://i.ytimg.com/vi/fhC6mPa8vQs/default.jpg","False","False","⛔Compre meus Produtos direto no meu Site! ⛔www.lojabrunogarcia.com.br⛔🚚 Me siga no Instagram e acompanhe minha vida!Instagram ➡ https://www.instagram.com/brunogarciaytPágina Oficial ➡ https://www.facebook.com/brunogarciayt/Facebook ➡ https://www.facebook.com/bruno.garcia.ldnRodoara Implementos 🚦🚛🚚IMPLEMENTOS RODOVIÁRIOShttps://www.instagram.com/rodoara_implementos/?hl=pt-br☎️(48) 3524-3568📧rodoaraimplementos02@gmail.com📍Alameda Antonio Alves da Silva, 2880Mato Alto - Araranguá /SC"
"Twmj5b_5DCU","ME VINGUEI DO LIPÃO E JOGUEI ÁGUA NELE!! (Vlog)","2021-04-06T14:00:08Z","UCHDV3JN5aqxAy9hwTTVHJow","Skorpion Gamer","20","21.07.04","Skorpion|SkorpionGamer|Gamer|Scorpion|Skorpion Gamer|GTA V|EASTER EGG GTA 5|EASTER|EGGGTA|CURIOSIDADES|GTA 5 ONLINE|MODO HISTORIA|lugares secretos|GTA 5 MODS|MODS|vlog|lipao|agua","317832","28985","391","723","https://i.ytimg.com/vi/Twmj5b_5DCU/default.jpg","False","False","Discord do canal: https://discord.gg/DnSWbuD🔔 ATIVE O SININHO!!🔔*******************************************************🔴Contato mais direto nas MINHAS REDES SOCIAIS:   📸INSTAGRAM: @SkorpionOFICIAL👍Facebook:  Skorpion Gamer*******************************************************"
"gshm-BzF54s","O QUE SERÁ FEITO DO INFLUENCE??","2021-04-05T22:00:17Z","UCBBLOsBZcFwisnToaQRDzIw","Carlinhos 262","22","21.07.04","[none]","125435","15244","101","1004","https://i.ytimg.com/vi/gshm-BzF54s/default.jpg","False","False","E INSCREVAM E SE CURTIU DEIXE O LIKE ! E SE TIVER ALGUMA SUGESTÃO, É SÓ PEDIR NOS COMENTÁRIOS! OBRIGADO PELO CARINHO E VISITA NO MEU CANAL. NÃO CLIQUE AQUI: http://bit.ly/2MjnCAo---------- CONTATO PARA EVENTOS E PARCERIAS ----------E-mail: CarlinhosParcerias@outlook.comME SIGAM NAS REDES SOCIAIS: Instagram : http://bit.ly/2KKBstEFacebook: http://bit.ly/2Zdf7gm-------- ------------------MF PERSONALIZAÇÃO ----------------------------PRODUTOS PERSONALIZADOS, CAMISAS, CANECAS e MUITOS OUTROSInstagram: mfpersonalizacao Site: www.mfpersonalizacao.com.brWhatsAPP: (37) 99186-7506-------------------------------------------------------MEU EDITOR SEGUE ELE:Instagram: https://www.instagram.com/_mfiuza#CarlinhosRota262 #ApaixonadoPorCaminhoes #ItaunaMG"
"tRpv0dL5-FQ","Clash Royale: 🔥 PARQUINHO DA P.E.K.K.A 🔥 Nova temporada! Desbloqueie os itens mágicos!","2021-04-05T14:17:33Z","UCDB14JrPAMedPRldcrCaHnw","Clash Royale Brasil","20","21.07.04","mobile|celular|clash|royale|supercell|coc|clans|pvp|rts|moba|tower|defense|batalha|multiplayer|coletar|rei|carta|realtime|tempo|real|real-time|arena|duelo|deck|baralho|coroa|troféu|troféus|trofeu|trofeus|android|ios|sparky|torneio|baú|bau|lendária","161445","4646","152","300","https://i.ytimg.com/vi/tRpv0dL5-FQ/default.jpg","False","False","#ClashRoyale #ItensMágicos #PEKKA #ParquinhoDaPEKKA #MagicItemsBem-vindo ao Parquinho da P.E.K.K.A!Novas recompensas do Passe Royale!Desbloqueie o LIVRO DOS LIVROS com o Pass Royale e muitos outros ITENS MÁGICOS!Desbloqueie o visual de Torre épico da P.E.K.K.A e o Emote Especial com o Pass Royale!Jogue com a P.E.K.K.A acelerada!Leve a Família Clash Royale à vitória!RECURSOS● Batalhe com jogadores do mundo inteiro em tempo real e ganhe troféus.● Ganhe baús e use-os para desbloquear recompensas, colecionar novas cartas poderosas e melhorar as cartas que já possui.● Destrua as torres do seu oponente e ganhe coroas para abrir baús da coroa épicos.● Construa e melhore sua coleção de cartas com a Família Clash Royale e dezenas das suas tropas, feitiços e defesas favoritos do Clash.● Construa um forte deck de batalha para derrotar seus oponentes.● Avance no jogo e desbloqueie várias arenas até chegar ao topo.● Forme um clã para doar e receber cartas, além de construir sua própria comunidade de batalha.● Desafie seus colegas de clã e amigos em um duelo privado.● Assista aos melhores duelos na TV Royale e aprenda diferentes estratégias de batalha.ATENÇÃO! O Clash Royale é grátis para baixar e jogar, porém alguns itens do jogo também podem ser adquiridos por meio de compras com dinheiro real. Caso não queira utilizar esse recurso, você pode desabilitar as compras do aplicativo nas configurações do seu dispositivo. Além disso, de acordo com os nossos Termos de Uso e Política de Privacidade, você deve ter no mínimo 13 anos de idade para poder jogar e baixar o Clash Royale. Uma conexão de rede também é necessária para jogar.Suporte:Está com problemas? Visite https://supercell.helpshift.com/a/clash-royale/?p=web&l=pt ou entre em contato conosco por meio do jogo. Para isso, acesse Configurações e toque em Ajuda e suporte.Política de Privacidadehttp://supercell.com/en/privacy-policy/pt/Termos de Uso:http://supercell.com/en/terms-of-service/pt/Guia para os Paishttp://supercell.com/en/parents/ (em inglês)."
"F6VS0DO-Ivo","😱😱CORTEI MEU CABELO CURTINHO!!!!🤩🤩| REAÇÃO DO MARIDO + trollagem com ele!","2021-04-05T23:51:15Z","UCKD0LFxDZ650YU-XFJubs6A","Lorrayne Mavromatis","22","21.07.04","Lorrayne|Mavromatis|Lorrayne mavromatis|cortei cabelo|cortei cabelo longo|cabelo loiro curto|tive que cortar cabelo|cabelo caiu|cabelo long bob|cabelo channel|cabelo curtinho|short blonde hair|short hair|Lorrayne cabelo corte|Lorrayne Mavromatis cabelo|Lorrayne como recuperar cabelo|Lorrayne oleo de coco|Lorrayne Cabelo dicas|dicas cabelo|melhor segredo cabelo","244389","34175","1022","3310","https://i.ytimg.com/vi/F6VS0DO-Ivo/default.jpg","False","False","Me siga em tempo real: http://www.instagram.com/lorraynemavromatis"
"XkXb285SfGg","PINTEI O CABELO 😍","2021-04-06T12:30:04Z","UC8gWf3nGUdGhp_fNUBOrCtA","Dani Nobrega","22","21.07.04","[none]","361234","59059","396","3292","https://i.ytimg.com/vi/XkXb285SfGg/default.jpg","False","False","Meu insta: https://www.instagram.com/danicnobrega/?hl=pt-br"
"NAxzuHzKoeo","CHEGOU AO FIM...","2021-04-06T16:00:08Z","UCvjMzXYbh7xuXH2Dh5Ba-ig","Ana Mosconi","22","21.07.04","ana|ana mosconi|joana|adr|rezende|rezende adr|#adr|#anamosconiadr|ana mosconi adr|vlog|tag|desafio|joao e ana mosconi|joao rezende|desafios|desafio com amigas|desafio com amigos|competição|ACABOU|terminamos|fim","235526","33514","410","1255","https://i.ytimg.com/vi/NAxzuHzKoeo/default.jpg","False","False","Canal oficialmente patrocinado pela #BangEnergyUse o código ANAM10 e ganhe 10% de desconto nos produtos do site da BANG https://bangenergy.com/   #EnergyDrinkSigam https://youtube.com/c/BangEnergy & https://youtube.com/c/JackOwocOI MEUS AMORES, TUDO BEM COM VOCÊS???INSCREVA-SE: https://www.youtube.com/channel/UCvjM...CONTATO COMERCIAL: 📩 mosconi@adragencia.com.br"
"-Ih5UArd4zk","WENDY 웬디 'Like Water' MV","2021-04-05T09:00:00Z","UCEf_Bc-KVd7onSeifS3py9g","SMTOWN","10","21.07.04","[none]","5804458","817869","6947","107301","https://i.ytimg.com/vi/-Ih5UArd4zk/default.jpg","False","False","WENDY's 1st Mini Album Like Water is out!Listen and download on your favorite platform: https://smarturl.it/WENDY_LIKEWATER[Tracklist]01 When This Rain Stops02 Like Water03 Why Can't You Love Me?04 초행길 (The Road)05 Best Friend (with SEULGI)WENDY Officialhttp://www.youtube.com/redvelvethttp://www.facebook.com/RedVelvethttp://www.instagram.com/redvelvet.smtownhttps://www.tiktok.com/@redvelvet_smtownhttps://www.vlive.tv/channel/DCF447http://twitter.com/RVsmtown#WENDY​ #웬디​ #Like_WaterWENDY 웬디 'Like Water' MV ℗ SM Entertainment"
"7IvjUFoClNc","TOUR PELA MINHA CASA DE PRAIA!","2021-04-04T22:51:31Z","UC8_DaAYKn2BYT6wdE2fasWw","Vanessa Lopes","22","21.07.04","vanesssa|vanessa lopes|tour|tour pela minha casa|praia|mansão","453040","52502","437","1372","https://i.ytimg.com/vi/7IvjUFoClNc/default.jpg","False","False","Me siga nas redes sociais:Instagram: @vanessalopesr_Tik Tok: @vanessalopesrTwitter: @vanessalopesr"
"NzbjPi_hP2k","LEVEI O CAFÉ NA CAMA PRA MINHA CRUSH","2021-04-04T22:52:40Z","UCWqp_otGswgVvFjX0CB-HzQ","IShow","24","21.07.04","IShowGamer|IShowGameR|IShow|ShowGames Gamer|GamerShow|Show de Games|Show|ishow|crush|levei o café na cama pra minha crush|by pamella ishow|mercedes a45|a45 amg","696096","94439","901","2601","https://i.ytimg.com/vi/NzbjPi_hP2k/default.jpg","False","False","↪ Instagram - https://www.instagram.com/victorlunardi/↪ Twitter - https://twitter.com/IShow↪ Contato profissional: contatodoishow@gmail.com↪ Canal de Games: http://bit.ly/2UebFxd↪ Moradores da casa:↪ Anão: https://bit.ly/3bghPDR↪ Flap: http://bit.ly/32i8UOP↪ Vini: https://bit.ly/3kdAWmVValeu a atenção, pode ter certeza que é uma honra te ver por aqui, tamo junto! ϟ"
