video_id,title,publishedAt,channelId,channelTitle,categoryId,trending_date,tags,view_count,likes,dislikes,comment_count,thumbnail_link,comments_disabled,ratings_disabled,description
"9n2WoYCJRMc","Kontra K - Diese eine Melodie (Official Video)","2021-03-04T23:15:14Z","UCIgCb1dYprH140Ds0mgeAUA","Kontra K","10","21.05.03","Kontra K|HipHop|Deutsch Hip Hop|Loyal|Loyalität|Sie wollten Wasser doch kriegen Benzin|Erde und Knochen|deutscher Hiphopper|Boxen|Kampfsport|Vollmond|The Cratez|Kontra K neues Album|Wölfe|Freunde|Sirenen|Tiefschwarz|Namen|Der Sonne entgegen|Sonne|Puste Sie Weg|ADLIDSZ|aus dem licht in den schatten zurück|kontra k neues album|Из света – обратно в тень|Та единственная мелодия|Полнолуние|Навстречу солнцу|Последние волки|КонтраК|хип- хоп|немецкий хип-хоп|лояльный","502165","73942","843","4069","https://i.ytimg.com/vi/9n2WoYCJRMc/default.jpg","False","False","A.D.L.I.D.S.Z. 💯🔥 JETZT DIE DELUXE BOX VORBESTELLEN: https://adlidsz.kontra-k.de 🐺Diese eine Melodie - Stream/Download: https://KontraK.lnk.to/DeMID#kontrak #adlidsz #dieseeinemelodie___________________________________________________Music produced by The Cratez, MEZ & Kontra KMix & Master by Lex BarkeyVideo directed by Shaho Casado / END2ENDScript & Concept / Production / Set Design / Styling / FX & VFX Supervision: END2END ► Instagram: https://www.instagram.com/end2end.media► Email: info@End2End.mediaScript / DOP / Cutter / CC / Drone: Shaho Casado► Instagram: https://www.instagram.com/shahocasado ► Instagram: https://www.instagram.com/casadoVFX: MostMagic (Julian Trunke)►https://www.mostmagic.com​​►Instagram: https://www.instagram.com/mostmagic​Make Up & Styling: Nati Lika►Instagram: https://instagram.com/soulfeedaSpecial Thanks to:Alexsej VlasenkoMishu KundelMisha MnatsakanovDaria KorobovaБольшое спасибо моим братьям из Питера!!!___________________________________________________Der Sonne entgegen“-Tour 202122.11.2021 Frankfurt - Festhalle23.11.2021 Stuttgart - Schleyerhalle25.11.2021 Freiburg - Sick Arena28.11.2021 Hannover - ZAG Arena29.11.2021 Nürnberg - Arena30.11.2021 Leipzig - Arena02.12.2021 Bremen - ÖVB Arena03.12.2021 Oberhausen - König-Pilsener-Arena06.12.2021 Köln - Lanxess Arena08.12.2021 Berlin - Mercedes Benz Arena09.12.2021 Berlin - Mercedes Benz Arena11.12.2021 Erfurt - Messe12.12.2021 München - Olympiahalle15.12.2021 Hamburg - Barclaycard Arena16.12.2021 Rostock - Stadthalle17.12.2021 Magdeburg - Getec Arena➤ TICKETS ERHÄLTLICH UNTER: https://www.kontra-k.de"
"PrpYKq43IKw","CAPITAL BRA X JAMULE - AVENTADOR (prod. by Beatzarre & Djorkaeff, Phil the Beat)","2021-03-04T23:00:15Z","UCeJIbOka3ZF8TSWT_-kHmSA","Capital Bra","10","21.05.03","Capital Bra|Joker Bra|Capital bra|Lecker Lecker|Joker Bra Lecker Lecker|Capital Bra Lecker Lecker|Hip Hop|Tilidin|Cheryy Lady|Princessa|NUR NOCH GUCCI|Berlin Lebt|Berlin Lebt 2|Bra Musik|Fick 31|Fick 31er|CB6|Bra|Bratan|Capi|Deutschrap|Rap|Rolex|110|Wir ticken|Aventador|Capital Bra Jamule|Jamule|Capital Bra Aventador|Jamule Aventador|Capital Bra Jamule Aventador","519785","56648","5603","5648","https://i.ytimg.com/vi/PrpYKq43IKw/default.jpg","False","False","AVENTADOR: https://umg.lnk.to/_Aventador„CB7“ OUT NOW: https://umg.lnk.to/CB7CAPITAL BRA ARENA TOUR TICKETS: https://standinfront.de/► Shop: https://capitalbrashop.de/► Capital Bra Social Media: http://capitalbra.fty.li/social► Jamule Social Media: http://jamule.fty.li/social► Produced by HEIKO HAMMER► Produktion: Beatzarre & Djorkaeff, Phil the Beat► Capital Bra Channel abonnieren: http://ytb.li/CapitalBrainfo@standinfront.de"
"1ode0sj_hbs","PA Sports x Jamule x Kianush x Fourty x Hamzo 500 x Rua - Squad X Showtime (LIFE IS PAIN)","2021-03-04T23:00:47Z","UCAbiUl42boUt6vUL019r9Bw","LifeisPainTv","10","21.05.03","Squad x Showtime|Life is Pain|PA sports|Jamule|Hamzo 500|Fourty|Kianush|Rua|Life is Pain Squad|LiP|PA Sports Ade|PA Sports Album|pa sports capital bra hell|capital bra|hell|pa sports capi|pa sports capital bra|pa sports sng|pa sports streben nach glück|life is pain|moe phoenix|dream slr|mosh36|kianush|jamule|hiphop|rap|deutschrap|desperadoz 2|keine tränen|casino royal|kriminell|100 bars|so jung|safe","245261","29985","551","2814","https://i.ytimg.com/vi/1ode0sj_hbs/default.jpg","False","False","Squad X ShowtimeHier streamen ►► https://lip.lnk.to/SquadXShowtimeSNG jetzt bestellen ►► http://pasports.fty.li/SNGLIFE IS PAIN Hoodies + Box  ►► https://www.lifeispain.de​​Life is Pain folgen ►► http://lifeispain.fty.li/socialP.A. Social Media ►► http://pasports.fty.li/socialFOURTY Social Media  ►► http://lifeispain.fty.li/FOURTYSocialKianush Social Media ►► http://kianush.fty.li/socialJamule Social Media ►► http://jamule.fty.li/socialRUA Social Media ►► http://rua.fty.li/socialHAMZO 500 Social Media ►► https://www.instagram.com/hamzo_500/Life is Pain folgen ►► http://lifeispain.fty.li/socialMusik: Aside & ChrizmaticMix: ChekaaMaster: Lex BarkeyEine 1TAKE FILMS Produktionhttps://www.instagram.com/1take_films/​CREATIVE DIRECTOR, REGIE & SCHNITT Adal Giorgishttps://instagram.com/adalgorgeous​CREATIVE DIRECTOR Erhan Doganhttps://www.instagram.com/erhan_dogan/​DOP & COLOR GRADINGKevin Jerome Stembergerhttps://www.instagram.com/kev_1take/​AUSFÜHRENDE PRODUZENTINNoosh Latifi https://instagram.com/nooshynoosh​VFXJanis Papist https://instagram.com/janispapist​OBERBELEUCHTERChristopher Bodenstein1ST ACPhilip BierschenkSET ASSISTENTENMarcel BirkelWalled Rasa BaderTristan RichterH&M Hely DoanStylistinAgnesia Qubreli#SquadXShowtime #LifeIsPain"
"WDEOHCXoWxk","FIRAT X ANNE - YALAN DÜNYA (Offizielles Video)","2021-03-04T23:00:14Z","UC1D5V67Y-y9YMKa5stwrWkQ","Firatelvito","24","21.05.03","[none]","181222","28778","1311","14184","https://i.ytimg.com/vi/WDEOHCXoWxk/default.jpg","False","False","► JETZT STREAMEN: https://open.spotify.com/track/1Ye6UZfzy9UOntonCrXzoI?si=2QB9NrOjTx6ipbL1-mzQugFIRATELVITO► Instagram: https://instagram.com/firatelvito?igshid=18deb5qdeyqgvProduziert: ► Alpay Özsoy VIDEO PRODUCED BY : ► Credits:Production: SkyVision StudioExecutive Producer, Director: Hüseyin „Bertinaxe“ YildirimDirector of Photography: Can Dolu1st AC: Firat Levendoglu2nd AC: Mehmet Can Polater3rd AC: Veli Furkan GünesGaffer: Ibrahim CelikElectrician: IC Lightdesign CrewLocal Producer: Bawer UyarH&M: Altin MakaslarEdit: BertinaxeVFX: Talha Dumanoglu"
"hiY1aq9zuys","CRO X SHINDY - SYGL (Visualizer)","2021-03-04T23:00:13Z","UCz1mQ-4_wui83UfT3ylqmpw","thisiscro","10","21.05.03","Cro Shindy SYGL|Cro Shindy|Cro|Shindy|Cro feat shindy|shindy cro|cro alles dope|alles dope|cro musikvideo|Cro Trip|Cro Live|Cro Dich|Cro endless summer|Cro Fall auf|cro neues album|cro neue lieder|cro neue maske|cro video|Cro Bye Bye|Cro Unendlichkeit|Cro Traum|Cro Easy|Cro Einmal um die Welt|Cro Ein Teil|Cro Du|Cro Baum|Cro Whatever|Cro Easy Lyrics|Cro Meine Gang|Cro Whatever Lyrics|Cro Cop|Cro Unplugged","171589","16646","746","1148","https://i.ytimg.com/vi/hiY1aq9zuys/default.jpg","False","False","CRO X SHINDY - SYGLCRO - trip ► Jetzt vorbestellen: https://umg.lnk.to/tripKanal abonnieren: http://bit.ly/CroYouTubeCheck CRO im Netz:► Facebook: https://www.facebook.com/cromusic► Instagram: https://www.instagram.com/thisiscro ► Twitter: https://www.twitter.com/thisiscro#cro #shindy #sygl"
"7EUVJaKJtBY","Drake - What's Next","2021-03-05T05:24:00Z","UCByOQJjav0CUDwxCk-jVNRQ","Drake","10","21.05.03","[none]","2138195","303500","3269","29014","https://i.ytimg.com/vi/7EUVJaKJtBY/default.jpg","False","False","https://drake.lnk.to/scaryhours2Director: Theo SkudraExecutive Producer/Producer: Christian TylerAssociate Producer: Alex Dall'OrsoProduction Manager: Jackie De NivervilleProduction: Cameron Frengopoulos1st AD: Jason Bourke2nd AD: Mario Scenna2nd AD: Connor JohnsonMedic/COVID Coordinator: Shane MonteiroSanitation Tech: Carla RivasCompliance Officer: Stan AdjeteySanitation Tech: Shane SenaCompliance Officer: Orion HexamerPA: Jeff ChiuPA: Kit WeymanPA: Enrique BaniquidPA: Zach LitzgusPA: Max LitzgusPA: Kahma MassingaPA: Griffin StobbsPA: Alex MakubyaPA: Tyrell MacLennanPA: Peter WiddringtonPA: Molly WestPA: Bee BertrandPA: Tyra HoughtonDirector of Photography: Kristofer Bonnell1st Assistant Camera: Alex Dametto1st Assistant Camera: Richard Gonzales2nd Assistant Camera: Dorian FindlayDIT: Johan ArthursVTR: Dalmane BridgeFilmotechnic - Precision Driver: Mark CabidduFilmotechnic - Flight Head Tech: Oleksiy ZolotarovFilmotechnic - Russian Arm Op: Nikita ZolotarovStills: Norman WongGaffer: Alex PoutiainenGaffer: Gideon AyesuBest Boy Electric: Stefan KucharBest Boy Electric: Rory Summerville-Bathmaker2nd Electric: Mikael Cosmo3rd Electric: Davin VeerasamyElectric: Randy SamarooElectric: Taylor KingElectric: Tom Bowen-SmithElectric/Board Op: Gordon HexerElectric: Omar DavisElectric: Steve ThomElectric: Monty LangfordElectric: Dave MorgadoElectric: Ryan BovairdElectric: Daniel ShpuntovElectric: Kellen McCannKey Grip: Greg ParaskovBest Boy Grip: Dillion FreelBest Boy Grip: Mike Laing-FraserGrip: John GlendonGrip: Ben DundasGrip: Josh DawsonGrip: Bryan GauerGrip: Shawn GothraGrip: Maksym MedvedievDroneBoy Pilot: Tom CometDrone Camera Op: Matt JoniecDrone Safety: Eric BellSPFX Supervisor: Hudson KennySPFX Supervisor: JR KennyArt Director: David DennisEco Trailer: Pat MernaghEco Trailer: Ed MernaghWhites - Package Truck: Spencer TruppWhites - Package Truck: Brad HissonBlazing KitchenLocations Manager: Stephen ConnorLocations Manager: Jonathan KokLocations Manager: Jeff ChadwickAssistant Locations Manager: Aidan ConnorTalent MUA: Onna ChanBackground Beauty Lead: Caitlin CullimoreBackground Beauty Assist: Celeste MortonStylist: Drew FergusonStylist Assistant: Jackie McKeownPool Talent: Beverley DemeloSnow Talent: Badu YiadomSnow Talent: Nyabel GatkuothSnow Talent: Megan Edwards AllenSnow Talent: Florence OginniSnow Talent: Annaleisa MairsSnow Talent: Djamilla NtibuberwaEditor: Noah KendalPost Executive Producer: Sara WindrimPost Producer: Mel StojanovskiColourist: Ana EscorseColourist Assistant : Thomas EberschveilerTitles: Dilan ManahanVFX Studio: Studio FeatherVFX Artist: Julian van MilVFX Artist: Luke BellissimoVFX Artist: Matthew DochstaderVFX Assistant: Sonia RuffoloPost Sounds: SIM InternationalSound Designer: Paul GermannRe-recording Mixer: Graham RogersAssistant Re-recording Mixer: Will Stephens"
"PgDCP9u4XDU","Max Prosa - Flügel (Egon) | The Voice Kids 2021 | Blind Auditions","2021-03-04T14:00:07Z","UCsaKxIA9snv1Wrh_sw1DFvg","The Voice Kids","24","21.05.03","Max Prosa - Flügel (Egon)|Max Prosa|Flügel|Egon|The Voice Kids|The Voice Kids Deutschland|The Voice Kids Germany|Voice Germany|TVK|tvk 2021|the voice 2021|The Voice Kids Germany 2021|The Voice Kids Blind Audition|The Voice Sat.1|Sat.1|Talent Show|Show|Casting|Coaches|Team|Talente|Singen|Kinder|Staffel 9|neunte Staffel|Auftritt|Lied|Song|Alvaro Soler|Wincent Weiss|Stefanie Kloß|Michi Beck|Smudo|Blind Audition","275124","15805","145","727","https://i.ytimg.com/vi/PgDCP9u4XDU/default.jpg","False","False","Egon singt die Ballade Flügel von Max Prosa und widmet das Lied seinem verstorbenen Stiefvater. Dabei begleitet er sich selbst auf dem Klavier. Die The Voice Kids-Coaches spüren seine tiefen Emotionen und vor allem Coach Steff ist zu Tränen gerührt.Seht euch hier Egons Performance mit Flügel von Max Prosa an.► THE VOICE KIDS 2021 Alle Clips: https://www.youtube.com/playlist?list=PL_NKWLcpSrYPYp6n-WYL9KmzfQuIxJ8xy► THE VOICE KIDS 2021 Alle Highlights: https://www.youtube.com/playlist?list=PL_NKWLcpSrYPkQHWmrTPYIQKHQgMIidLI► THE VOICE KIDS 2021 Blind Auditions:https://www.youtube.com/playlist?list=PL_NKWLcpSrYNDyvhR8QFtXKw-v-jVkCVy► SUBSCRIBE TO THE VOICE KIDS: https://s71.link/b/2P4NY8Q Ab dem 27. Februar 2021 ist es wieder soweit – The Voice Kids startet in eine neue Staffel. Doch dieses Jahr läuft die Show samstags und nicht sonntags! Bereits zum neunten Mal fighten die Coaches in ihren roten Drehstühlen um die größten Talente unter den Kids. Bei The Voice Kids 2021 geben der spanisch-deutsche Singer-Songwriter Alvaro Soler sowie der Deutsch-Pop-Barde Wincent Weiss jeweils ihr Debut als Coach. Die beiden anderen Plätze besetzen Silbermond-Sängerin Stefanie Kloß sowie die Fantastischen 2 Michi Beck und Smudo im Doppelsitzer. Man darf mit Spannung erwarten, wem sich die jungen Talente wohl anvertrauen. Mehr über die einzelnen Coaches von The Voice Kids 2021 erfährst du hier!********************************************#TheVoiceKids #AlvaroSoler #WincentWeiss #StefanieKloß #MichiBeck #SmudoImpressum: https://www.sat1.de/service/impressum"
"LWeiydKl0mU","Justin Bieber - Hold On","2021-03-05T05:00:16Z","UCHkj014U2CQ2Nv0UZeYpE_A","JustinBieberVEVO","10","21.05.03","Justin|Bieber|Hold|RBMG/Def|Jam|Pop","3088245","488055","6273","46129","https://i.ytimg.com/vi/LWeiydKl0mU/default.jpg","False","False","Hold On out now: https://JustinBieber.lnk.to/HoldOn Pre Order Justice Out 3/19: https://justinbieber.lnk.to/Justice Shop Justice CDs and merch: https://JustinBieber.lnk.to/OfficialShop Listen to Holy, Lonely, & Anyone here: https://JustinBieber.lnk.to/OutNow Director: Colin TilleyProducer: Jamee Ranta & Katelyn PippyStarring: Justin Bieber & Christine KoWhen you or someone you love is diagnosed with cancer, it’s hard to know where to start. The FCancer CareLine is here to help. Go to https://www.letsfcancer.com/careline/ to learn more.Follow Justin: http://facebook.com/justinbieberhttp://twitter.com/justinbieberhttp://instagram.com/justinbieberSign up for Justin’s newsletter: http://justinbiebermusic.com #HoldOn #Justice #JustinBieber"
"IGkk6nym0dk","Tauben greifen mich an.. In Spanien","2021-03-04T11:30:01Z","UCCtfUIXLPoWdwFkJa7nBxWA","Simex","24","21.05.03","welpe|taube|vlog|vlog deutsch|deutschland|trends|deutsch|auswandern|letztes video|tiktoks|monte|arian|spontanablack|standart skill|simex|trymacs|og skins|wannabe|challenge|amar|freundin|mädchen|icrimax|prank|vvs clan|reagiert auf simex|tik tok|elizabeth sanchez|stanni|spanien|realtalk|fortnite deutsch|avive|rewi|unge|kuchentv|challenge auf deutsch|challenges|simi|barcelona|spain|vlogs|vlog auf deutsch|vlog in spanien|barcelona vlog|barca","240870","35086","14247","8141","https://i.ytimg.com/vi/IGkk6nym0dk/default.jpg","False","False","Meine Freundin und ich wandern aus nach Spanien und nehmen euch jeden Tag per Vlog mit. Wir leben in der Stadt Barcelona.📸Instagram: https://www.instagram.com/simexyt/@Simi (Fortnite Kanal)Twitch: https://www.twitch.tv/simexyt🔥TikTok: https://vm.tiktok.com/XT6JhB/https://www.tiktok.com/@elizabeth_sanchez__"
"g-CU5R0dar4","Ricky Rich, Dardan & Zuna – Habibi (Official Audio)","2021-03-04T23:00:25Z","UCxCxx2XoiNExlB7mpkrd6MQ","Ricky Rich","10","21.05.03","Ricky|Rich|Ricky Rich|Aram Mafia|Habibi|Daran|zuna|habibi|habib|Aram|Mafia|germany","150600","15072","368","856","https://i.ytimg.com/vi/g-CU5R0dar4/default.jpg","False","False","Listen to “Habibi” by Ricky Rich, Dardan & Zuna: http://wmg.click/RickyRichDardanZuna_Habibi Artists: Ricky Rich, Dardan & ZunaProduced by: KJ Ricky RichTikTok: https://www.tiktok.com/@realrickyrich​Instagram: https://www.instagram.com/rickyyrich/​ DardanTikTok: https://www.tiktok.com/@dardynextdoorInstagram: https://www.instagram.com/dardan/ ZunaTikTok: https://www.tiktok.com/@official_kmn_zunaInstagram: https://www.instagram.com/kmn_zuna/ #RickyRich #Dardan #Zuna #HABIBI"
"8JcA6sjQgzQ","BHZ - HOOD NIGHTS (Prod. by MotB, Themba & Dead Dawg)","2021-03-04T23:00:14Z","UCTYYVru04S0yqKYKFrV8uOg","BHZ","10","21.05.03","[none]","91789","15544","173","556","https://i.ytimg.com/vi/8JcA6sjQgzQ/default.jpg","False","False","Text:Ion Miles, Monk, Dead Dawg, Big Pat & Longus MongusInstrumental: MotBThembaDead DawgMix/Master: Samuel Kalbantnerhttps://www.instagram.com/sami.2826/​Video:Antemiliohttps://www.instagram.com/antemilio/​2nd Camera & Assistant:Till Tinskyhttps://www.instagram.com/till.tinsky/​Lights:Foli Creppyhttps://www.instagram.com/fruitypoet/Production:Cafoni Cornerhttps://www.instagram.com/cafoni_corner/​Photography:Rob Lüthje https://www.instagram.com/robluethje----------------------------------------Alle am Dreh beteiligten Personen (Künstler, Produktion, Statist_innen) wurden im Vorfeld der Dreharbeiten negativ auf COVID-19 getestet. Bleibt gesund! ❤️"
"N_OUdjNhLGc","PLAY69 FEAT. AZAD - SAFE [official Video] prod by ThisisYT & Rennoc","2021-03-04T23:00:27Z","UCcVEyQGmDlUvoPNUyrXwXUQ","PLAY69","22","21.05.03","play69|Babylon|Babylon 2|babylon album|play69 babylon 2|azad|hiphop|hip hop|rap|deutschrap|safe|play69 safe|azad safe|play69 Azad safe","59648","7580","115","620","https://i.ytimg.com/vi/N_OUdjNhLGc/default.jpg","False","False","✖️►SAFE https://umg.lnk.to/_Safe​✖️►BABYLON 2 DELUXE BOX [Amazon] https://amzn.to/3ffvJcC​​✖️►BABYLON 2 DELUXE BOX [Alle Links] https://umg.lnk.to/Babylonll​​// PLAY69 //► auf Instagram: www.instagram.com/play69/► auf Tiktok: www.tiktok.com/@play69► auf Facebook: www.facebook.com/offiziell.play/// AZAD //► auf Instagram: www.instagram.com/azadoffiziell#play69 #azad #babylon2​► Play69 Kanal abonnieren: http://ytb.li/Play69​​Safe wurde produziert von ThisisYT & Rennoc► ThisisYT auf Instagram: www.instagram.com/thisisyt1/► Rennoc auf Instagram: www.instagram.com/rennocbeats► CUTZ by Aleo www.instagram.com/aleo.ofc/MASTER by Robin Schmidt 24-96Das Video zu Safe wurde produziert von RN Media Films► RN Media Films auf Instagram: www.instagram.com/rnmediafilmsinfo@major-movez.de"
"4n0JuZHQqk8","RIN - Meer (prod. Alexis Troy)","2021-03-04T23:00:11Z","UCmc5ha-rlBNVB1VDeUVisLw","DIVISION","10","21.05.03","RIN|Division|Nimmerland|EROS|Planet Megatron|Rap|Deutschrap|Hip Hop|Dior 2001|Bros|Monica Belluci|Keine Liebe|Vintage|Up in Smoke|meer|rin meer","147284","19503","484","1320","https://i.ytimg.com/vi/4n0JuZHQqk8/default.jpg","False","False","Song streamen: https://goldleague.lnk.to/MeerRIN folgen: http://rin.fty.li/socialDIVISION folgen: http://division.fty.li/socialKanal abonnieren und Glocke aktivieren: http://ytb.li/DIVISIONFILM:Video produced & directed by saymyname. (www.saymyname.berlin)Directors: Sebastian Mowka, Benjamin ZechDP: Franz BeckerProducer: Benjamin ZechOberbeleuchter: Joran OstAC: Thanh-Long VoBeleuchter: Christoph NeuhausCamcorder: Sebastian Mowka, Oliver Mowka Styling: Tabi CharafStyling Assistant: Deria IsseverH&M: Anna ArizteguiPA: David KühnleinSet Assistant: Mira CasserSet Assistant: Moritz MatthiasSet Assistant & BTS: Oliver MowkaEdit,Grading, VFX: saymyname. (Franz Becker, Sebastian Mowka)Car Animation: Jerome GraffRental: SeeYou Rent"
"mcjD3tU7GYs","MOIS x MAESTRO - DIABLO (prod. by HNDRX & Chryziz)","2021-03-04T23:00:15Z","UCwtSOrVvKUMhqMLk1X2TpOg","KELLER","10","21.05.03","[none]","126476","20308","4459","5549","https://i.ytimg.com/vi/mcjD3tU7GYs/default.jpg","False","False","» DIABLO jetzt auf allen Plattformen streamen:https://kellergmbh.lnk.to/MoisMaestro_Diablo» DIABLO auf Spotify:https://open.spotify.com/track/5kYex9l8PZzr9RTn1nWqU8?si=Yhw_zyjkSAuiCrYOL-vFWw» MOIS auf Instagram:https://www.instagram.com/moiskid/​» MAESTRO auf Instagram:https://www.instagram.com/majestic_maestro/» DIABLO produced by HNDRX x Chryzizhttps://www.instagram.com/iamhndrx/​https://www.instagram.com/chryziz_/» DIABLO mixed & mastered by PERINOhttps://www.instagram.com/perinomusic/» Video directed & produced by Venompictureshttps://www.instagram.com/venompic/» XVI.IV.MMXXI-----------------------------------------------------------------------------------Provided by Warner Music Germany© Keller GmbH"
"RZ4DEn0Ssq4","CÉLINE - Hotel (Offizielles Video)","2021-03-04T23:00:13Z","UC9827X5JtXn2gDYA61FwB8Q","CÉLINE","10","21.05.03","CÉLINE|celine|celine104|cèline|amillion|wasmachstduda?|fürmich|loredana|BTGS|Beatgees|Paderborn|amillionmusic|grooveattack|hotel|ufo361|mom|dad|wenn ich will|twosides|cece|berlin","94264","11854","147","580","https://i.ytimg.com/vi/RZ4DEn0Ssq4/default.jpg","False","False","CÉLINE – Hotel - JETZT ÜBERALLHotel - https://celine.lnk.to/HotelInstinkt EP - https://celine.lnk.to/Instinkt​► CÉLINE IM NETZKanal Abonnieren: http://bit.ly/CÉLINE-YT​​Instagram: https://www.instagram.com/celine.104/​​TikTok: https://www.tiktok.com/@cece.104​► MUSIK:Musik & Text:  CÉLINE, Beatgees, Peter StanowskyVerlagsangaben: Céline Dorka (Beatgees Publishing/BMG) Beatgees (Beatgees Publishing/BMG) Peter Stanowsky (Budde Music)Produziert von: BeatgeesMaster: Lex BarkeyLabel: BTGS / A Million / Groove Attack► Video100BLACKDOLPHINS presents https://instagram.com/100blackdolphins​a video by FEMALE FORCE https://instagram.com/thisisfemaleforcedirector: Tatjana Wenig art director: Dahlia Ibrahim producer: Helena Michl executive producer: Jakub Rzucidlo DOP: Etritane Emini1.AC: Samuel Emmer2.AC & 2nd Unit: Manuel Zollergaffer: Jenny Röders gaffer assist: Janne Ebelset construction: Maximilian Streichert & Jascha Gerberset dressing & creative drip: Marla Kästle photographer: Luna De Luca photographer: Manuel Zollercreative consultant: Aljoscha Bohatschedit: Quang Le, Tatjana Wenig, Jakub Rzucidlo grading: Jakub Rzucidlo title & graphic design: Marco Dos Santos hair & make up: Hely Doan styling: Serena Pompeistyling assistance: Alicia Janke & Elizabeth Kwanoldtimer lend by: Tobias MethnerSFX: Fred BraeutigamSpecial thanks to Maxi and Lucas, Middle East Mambo Studios, Philipp & Christopher from Fabrik23, Yvonne Brandt and all the beautiful people of Berlin℗© 2021 BTGS / A Million Music / Groove Attack"
"OzE5_SU9Cyg","Merkel nach Corona-Gipfel: Welche Lockerungen kommen jetzt? Welche Regeln bleiben? | ZDFheute live","2021-03-03T23:56:45Z","UCeqKIgPQfNInOswGRWt48kQ","ZDFheute Nachrichten","25","21.05.03","ZDF|ZDFheute|ZDFheute Nachrichten|Nachrichten aktuell|Ministerpräsidenten|Merkel|Corona-Gipfel|Lockerungen|Pressekonferenz|Corona|Covid-19|Pandemie|Epidemie|Kretschmer|Kretschmann|Dreyer|Hans|Söder|Bouffier|Laschet|Weil|Günther|Schwesig|Tschentscher|Ramelow|Woidtke|Kanzlerin|Bundeskanzlerin|Inzidenz","580703","2326","2670","1474","https://i.ytimg.com/vi/OzE5_SU9Cyg/default.jpg","False","False","Es ist wieder soweit: Der Corona-Krisengipfel von Bund und Ländern steht an. Die drängensten Fragen: Wie geht es mit dem Shutdown weiter? Und wird es erste Lockerungen sowie eine klare Öffnungsperspektive geben? Der Druck für die Politik ist jedenfalls enorm groß. Denn nach Monaten voller Einschränkungen werden die Rufe nach einer Rückkehr zur Normalität immer lauter. Gleichzeitig sind da aber auch noch schleppende Impfungen, Virusvarianten und steigende Fallzahlen. Experten warnen daher schon länger eindringlich vor einer drohenden dritten Welle. ZDFheute live blickt auf diesen wichtigen Gipfel und zeigt die Pressekonferenz mit der Bundeskanzlerin nach den Corona-Beratungen. Gemeinsam mit ZDF-Korrespondent Thomas Reichart ordnen wir die Ergebnisse ein und beantworten eure Fragen. Außerdem dabei: Manfred Wagner, Medizinischer Direktor am Klinikum Fürth. Und: Prof. Alexander Markowetz. Er plädiert für eine breite Anwendung von Schnelltests, um eine Alternative zu den aktuellen Einschränkungen zu schaffen. Erste Hinweise darauf, welche Maßnahmen künftig gelten könnten, liefern vor dem Gipfel die Beschlussvorlagen: Demnach könnte der Shutdown bis zum 28. März verlängert werden. Zugleich seien erste Schritte und Öffnungen denkbar – etwa bei Inzidenzen von unter 35 oder 100. Die Lockerungen wären jedoch an die Entwicklung der Corona-Zahlen gekoppelt und könnten durch eine „Notbremse“ bei hohen Fallzahlen rückgängig gemacht werden. Bei der neusten Corona-Strategie sollen auch Corona-Schnelltests eine wichtige Rolle spielen.----- Hier auf ZDFheute Nachrichten erfahrt ihr, was auf der Welt passiert und was uns alle etwas angeht: Wir sorgen für Durchblick in der Nachrichtenwelt, erklären die Hintergründe und gehen auf gesellschaftliche Debatten ein. Diskutiert in Livestreams mit uns und bildet euch eure eigene Meinung mit den Fakten, die wir euch präsentieren.Abonniert unseren Kanal, um nichts mehr zu verpassen.Immer auf dem aktuellen Stand seid ihr auf http://www.ZDFheute.de/.#zdf #coronagipfel #coronabeschlüsse0:01:30 - Interview mit Thomas Reichart zur Lage in Berlin0:21:00 - Interview mit Prof. Alexander Markowetz zu Schnelltests 0:34:00 - Interview mit Manfred Wagner/Klinikum Fürth 2:13:15 - Pause 4:44:40 - Pause Ende 5:33:50 - Start Pressekonferenz"
