video_id,title,publishedAt,channelId,channelTitle,categoryId,trending_date,tags,view_count,likes,dislikes,comment_count,thumbnail_link,comments_disabled,ratings_disabled,description
"ysfpD8RmjKo","[신병] 전산오류","2021-04-08T07:59:23Z","UChbE5OZQ6dRHECsX0tEPEZQ","장삐쭈","23","21.09.04","장삐쭈|삐쭈|ㅋㅋㅋ|삐쮸|장삐쮸|병맛더빙|더빙|웃긴동영상|꿀잼|신병|장삐쭈 단편선|단편선|창작애니|볼만한 애니|재밌는애니|웃긴애니|볼만한애니|애니추천|만화추천|장비주|신병 유격|신병신작|장삐쭈 군대|군대만화|박민석|김상훈|최일구|임다혜|차병호|전산오류|재입대","1719557","27835","573","10875","https://i.ytimg.com/vi/ysfpD8RmjKo/default.jpg","False","False","스튜디오 장삐쭈장삐쭈, 정영준, 안류천, 포포, 윤성원, 허혜원, 정대준support : 원동우, 주현우"
"vCp1MrAYypg","[20/21 UCL 8강 1차] B.뮌헨 vs PSG H/L","2021-04-08T05:00:09Z","UCtm_QoN2SIxwCE-59shX7Qg","SPOTV","17","21.09.04","SPOTV|스포티비|바이에른뮌헨|파리생재르망|PSG|챔스|UCL|포체티노|키미히|음바페|네이마르|뮐러","1060789","6307","257","3996","https://i.ytimg.com/vi/vCp1MrAYypg/default.jpg","False","False","바이에른 뮌헨 vs 파리 생제르망 경기 하이라이트"
"Sa7u3kWeq3s","[풀버전] ♬ 그리워하다 (Theatre Ver.) - 비투비(BTOB)","2021-04-08T13:00:10Z","UCbD8EppRX3ZwJSou-TVo90A","Mnet K-POP","24","21.09.04","킹덤|KINGDOM|그리워하다|비투비|BTOB|엠넷|Mnet","1185777","77579","986","27228","https://i.ytimg.com/vi/Sa7u3kWeq3s/default.jpg","False","False","[풀버전] ♬ 그리워하다 (Theatre Ver.) - 비투비(BTOB)전설이 되어라, WHO IS THE KING?＜킹덤(KINGDOM : LEGENDARY WAR)＞매주 (목) 저녁 7시 50분 본방송"
"9VYDdwLdPEU","어몽어스 VR좀비2(SCP) 5화 [어몽어스 애니메이션] / [AMONG US ANIMATION]","2021-04-09T01:00:01Z","UCZ0dIs-Ao2v8eZF4WOYH5uw","썰레임 Ssuleim","23","21.09.04","어몽어스애니메이션|어몽어스애니|어몽어스좀비|VR좀비|쎌레임|설레임|사이다툰|among us animation|among us zombie|어몽어스SCP|SCP Animation|SCP애니|어몽애니","242305","4736","140","4489","https://i.ytimg.com/vi/9VYDdwLdPEU/default.jpg","False","False","어몽어스 애니메이션 VR좀비2 (SCP) 5화 입니다!기다려주셔서 감사합니다! VR좀비 시즌2인 SCP편은 시즌1과 스토리가 이어지며, 대략 7~8부작으로 구성될 예정입니다.SCP 세계관, 어몽어스 세계관, 그리고 썰레임만의 오리지널 세계관을 합쳤습니다.사랑합미다!!Have fun watching!문의 : ssuleim@naver.com총 제작 : 썰레임더빙 : 썰레임,릴리로즈(핑크역)***본 영상을 상업적 이용, 무단 배포 등 불법적으로 이용할 경우 저작권법 및 관계법령에 따른 책임을 질 수 있습니다. ***[ BGM , sound 출처 ]Music  by SOUNDBAG BGMTrack : War (웅장한 긴장) https://youtu.be/-mrA2qXdyKo이소연 - I can not forgive you출처및저작권표시 - 공유마당, CC BY링크: https://gongu.copyright.or.kr/gongu/w...​𝑴𝒖𝒔𝒊𝒄 𝑷𝒍𝒂𝒚𝒍𝒊𝒔𝒕 : https://youtu.be/2jkeMoq2eNg​이충헌 - What We Struggle For…(우리는 무엇을 위하여 투쟁하는가…) 출처및저작권표시 - 공유마당, CC BY링크: https://gongu.copyright.or.kr/gongu/w...​𝑴𝒖𝒔𝒊𝒄 𝑷𝒍𝒂𝒚𝒍𝒊𝒔𝒕 : https://youtu.be/2jkeMoq2eNg​music by  BGM HEROchannel : https://url.kr/Ibdgrq​song link : https://youtu.be/1FDoLVHvNYg(Ambient​ Creepy Music)"
"e3cGchgKkjA","일반인은 절대 알 수 없는 '최강 국물 컵라면'","2021-04-08T11:30:40Z","UCR-qpXziP5pIqNHFKL-w12g","쿠왕coo king","23","21.09.04","#라면|#컵라면","190944","2806","166","525","https://i.ytimg.com/vi/e3cGchgKkjA/default.jpg","False","False","해물라면에 대해서 진지하게 알려드립니다. #shorts문의 : cooking7564@gmail.com"
"8FFxkxq1tyE","(ENG) 거봐 이거 나만 듣는 거 아니었잖아ㅡㅡ^ 전주만 들어도 심장 뛰는 컴눈명 여기서 다 불러재끼려고 그냥 나 말리지마 / [문명특급 EP.180]","2021-04-08T08:30:14Z","UCUyfkq9e9ZfPzxOW5WQ9rzQ","문명특급 - MMTG","24","21.09.04","문명특급|스브스뉴스|재재|SBS|문특|mmtg|jaejae|컴눈명|재컴백|역주행|다시컴백해도|멜론|예나|최예나|아이즈원|izone|yena|채령|chaeryung|itzy|부승관|승관|seungkwan|세븐틴|seventeen|민혁|몬스타엑스|monstax|렌|뉴이스트|최민기|nuest|오마이걸|ohmygirl|나인뮤지스|nine muses|dolls|돌스|와일드|클로저|closer|한발짝 두발짝|txt|사랑하게될거야|온앤오프|아낀다|방탄소년단|쩔어|bts|우주소녀|이루리|비밀이야","864273","29704","299","7457","https://i.ytimg.com/vi/8FFxkxq1tyE/default.jpg","False","False","컴눈명 르네상스 편 드디어 종결봅니다(비장)나인뮤지스의 Dolls, 오마이걸의 한 발짝 두 발짝,그리고 M사에서 직접 받은 데이터 기반의 곡들 중 문명인들의 픽은 어떤 노랜가요?#컴눈명 #Dolls #한발짝두발짝 #Closer기획/하현종  프로듀서/이아리따  진행/이은재  구성/이은재 이규희 이세정  촬영/오채영 정훈 최송인 조문찬 임세종 전재원  동시녹음/소리를 그리다  디자인·CG/김하경 김한솔  담당인턴/김은비 이수현  마케팅/남승훈 김유진 정아름  조연출·편집/오한주  연출/홍민지  제작/SBS디지털뉴스랩 크리에이티브 사업부문"
"5YSALh3HzJw","[다홍VLOG] 나 박다홍, 스트릿시절부터 갈고 닦았던 사냥실력 공개한다.","2021-04-08T18:55:37Z","UCKUz_7LxgiMXa0lrwzzsKTQ","검은고양이 다홍 Blackcat Dahong","22","21.09.04","[none]","595966","42204","296","5703","https://i.ytimg.com/vi/5YSALh3HzJw/default.jpg","False","False","박다홍 숨겨놨던 사냥본능 점프실력 공개 #박수홍 #검은고양이 #박다홍 #상남자 #한국짧은머리고양이"
"b2g8XHTi8nY","하루만에 집 철거 했습니다.....","2021-04-08T11:00:11Z","UCZ1wYQHk1yVle18u8FA8AvA","배말랭","22","21.09.04","배말랭|흙수저|백수|자취|핫소스|생존|원룸|베란다|월세5만원|배건우|철거","418208","7286","172","1645","https://i.ytimg.com/vi/b2g8XHTi8nY/default.jpg","False","False","#배말랭 #배씨표류기 #베란다원룸 #자취 #생존 #월세5만원안녕하세요! 배말랭입니다~~~하루만에 집을 잃은 사람이 불쌍할까 하루만에 100만원을 잃은 사람이 불쌍할까그게 나야^^인스타주소@baebae_geonwoo"
"XM9AenRDVCw","다급했던 사고 현장…피해자 대부분 20대 / KBS 2021.04.07.","2021-04-07T12:59:13Z","UCcQTRi69dsVYHN3exePtZ1A","KBS News","25","21.09.04","사고|피해자|현장|제주|화물차|시내버스|경찰|조사|결과|버스|정류장|KBS|뉴스|뉴스9|KBS 뉴스9|kbs뉴스|kbs 뉴스|kbs news|kbs|사상|제주도|제주사고|교통사고|추돌사고","1189654","5914","242","4164","https://i.ytimg.com/vi/XM9AenRDVCw/default.jpg","False","False","어제(6일) 제주에서 화물차가 시내버스 등을 들이받으면서 3명이 숨지고 50여 명이 다치는 대형 사고가 났는데요.경찰 조사 결과, 피해자 대부분은 버스 정류장에서 무방비로 사고를 당한 것으로 확인됐습니다. [리포트] 4.5톤 화물차가 다급하다는 듯 경적을 울립니다. 속도를 줄이지 못한 채 앞서가던 1톤 화물차를 들이받고, 그대로 30m가량을 미끄러져 버스 정류소에 있던 시내버스 두 대를 덮쳤습니다. [사고났어 사고났어! 어머 어머 어떡해!] 어제저녁,  제주대 사거리에서 발생한 연쇄 추돌 사고입니다. 이 사고로 현재까지 3명이 숨지고 50여 명이 다쳤습니다. 피해자 대부분이 대학생 등 10대와 20대였습니다. 경찰은  사람들이 정류장에서 버스를 기다리거나 버스에서 내리다가 변을 당한 것으로 확인됐다고 밝혔습니다. 사고 현장을 찾은 유족은 눈물을 멈추지 못합니다. [사고 유족 : 3년 동안 기도해서 낳은 아들이에요. 아이고 우리 아들 불쌍해서 어떡해.] 경찰과 국과수는 사고 화물차에 대한  합동 감식을 벌였지만 정확한 사고 원인을 찾지 못했습니다. 경찰 관계자는 4.5톤 화물차의 뒤축 바퀴 등이 추가돼 최대 중량이 8.5톤까지 늘었지만, 불법 구조변경은 없었다고 말했습니다, 다만, 화물차에 적용된 시속 80km 속도 제한 장치를 불법개조해 과속했는지는 아직 확인되지 않았습니다. [오상훈/한국교통안전공단 안전관리차장 : 속도 제한 장치에 이상이 없는지를 확인하려 하는 중인데, 전원이 나가서 확인을 못 하는 실정입니다.] 사고 당시 브레이크가 작동하지 않았다는 40대 화물차 운전자의 진술을 확보한 경찰은, 브레이크 오작동과  과적 여부를 조사하고 있습니다. 경찰은 운전자에 대해 과실 치상치사 혐의로 구속영장을 신청했습니다. KBS 뉴스 박천수입니다. 촬영기자:고성호▣ KBS 기사 원문보기 : http://news.kbs.co.kr/news/view.do?ncd=5157379▣ 제보 하기◇ 카카오톡 : 'KBS제보' 검색◇ 전화 : 02-781-1234◇ 홈페이지 : https://goo.gl/4bWbkG◇ 이메일 : kbs1234@kbs.co.kr#제주 #제주사고 #추돌사고"
"gLhr-l-P6C0","제 여자친구를 소개합니다","2021-04-06T12:05:59Z","UCIA-LPHNERP2MDUQpp2RVHg","케이","24","21.09.04","케이|여친|여자친구|미도|리플","1916562","19062","3745","4940","https://i.ytimg.com/vi/gLhr-l-P6C0/default.jpg","False","False","※해당 영상은 우측 상단, 유료광고 배너를 포함하고있습니다여자친구 소개합니다 #나는미도○광고문의: wndrb1123@nate.com○편집문의 : kbj3898@naver.com ■아프리카TV: http://afreecatv.com/zpdl1313■페이스북: https://www.facebook.com/junggyu2?fref=ts■인스타그램: wndrb1123——————————————————————————————————Music provided by 브금대통령Watch : https://youtu.be/M3j0QKsiIPcMusic provided by Tido Kang"
"HFn-iUXXoUs","WAFFLE IRON vs How to cook ramen easily | 와플기계로 라면 끓이기 #Shorts","2021-04-07T14:00:12Z","UCBTytrss5jCEx7rUH4XiDpQ","Yummy Waffle 야미와플","26","21.09.04","[none]","502051","6543","337","766","https://i.ytimg.com/vi/HFn-iUXXoUs/default.jpg","False","False","How to cook ramen easily with a waffle machineThanks for watching!If you like the video, share it, like it and subscribe for more."
"zP6euNB33gE","[문신돼지충 Vlog] 99대장의 설계/ 새로운 도약/ 99조진세의 등장","2021-04-08T09:55:14Z","UCXTQWsvCnuKxqnbBFMYhrSA","별놈들","22","21.09.04","코미디|유머|몰카|참교육|브이로그|페이크다큐|문신돼지충|vlog|돼지국밥육수충|별놈들|99대장","238770","3599","72","1096","https://i.ytimg.com/vi/zP6euNB33gE/default.jpg","False","False","브금 출처!♫Tracklist(출처)Track - Daniel Rosty - Party Non StopSoundcloud - https://soundcloud.com/danielrosty​✔️나눔뮤직 - https://tv.naver.com/v/10546266재밌게 보시구 구독과 좋아요 부탁드릴게요~ 광고,협찬 문의는 tjsdnrrkaus@naver.com별놈들 일상 데일리룩 보러오셈인스타  https://instagram.com/hahahahauk?igshid=12n15117q5qo0 (99대장 선욱이)             https://instagram.com/she_meeee?igshid=1897eelolkm6e  (99인심 인심이)#문신돼지충 #Vlog #페이크다큐"
"CQMiQeTm4wI","[맨인블박] 하늘의 뜻이겠지...","2021-04-08T00:50:41Z","UCiubh7VqeQxJ_ejOFP0Cgqw","맨인블박","2","21.09.04","Dash Cam|DashCam|Driving Fails|driving|맨인블박|블랙박스로 본 세상|맨인블랙박스|블랙박스|자동차|도로|사고|몇대몇|블박|sbs 맨인블랙박스|모닝와이드|SBS|차|차로|변경|천운|구사일생|보행자|무단횡단|스키드|마크|소리|중앙분리대|전방주시태만|휠|바퀴|화물차|덤프|배수로|변압기|추락|전신주|추돌|충돌|불량|적재물|철판|119","916267","4224","115","1684","https://i.ytimg.com/vi/CQMiQeTm4wI/default.jpg","False","False","#맨인블박 #구사일생 #천운당신은 신을 믿습니까?!설령 그렇지 않다고 해도 아마 이 사고들을 보신다면 믿게 될지도 모릅니다하늘이 도와 '최악'을 피해 간 운전자들블랙박스 속 '구사일생' 스토리! 영상으로 확인해보세요!!"
"pAErKfUaf-o","(광고예용) 먹고 자고 운동하는 햇님의 일상 브이로그!! 20210408","2021-04-08T08:00:09Z","UC-Bsa2ivAGWq7bsSPrPGFVA","입짧은햇님","22","21.09.04","韓国大食い女性 MUKBANG|키노시타유우카 木下ゆうか|밴쯔|엠브로|프란|떵개|도로시|슈기|소프|mukbang|eating show|social eating|입짧은햇님|햇님|먹방|韓国大食い女性|키노시타유우카|木下ゆうか","274218","6966","166","854","https://i.ytimg.com/vi/pAErKfUaf-o/default.jpg","False","False","#픽싱틴트 #안묻틴트 #이시국틴트#에뛰드오늘은 에뛰드 픽싱틴트와 함께하는 일상 브이로그!! : 에뛰드 픽싱틴트는 올리브영 온.오프라인 및 에뛰드 디지털 채널에서 구매가능합니다.https://www.oliveyoung.co.kr/store/goods/getGoodsDetail.do?goodsNo=A000000149244&chlNo=27&chlDtlNo=399[Video Source Support]Youtube channel freeticon : https://www.youtube.com/c/Freeticon👍월, 화, 수 - PM10시 / 목요일 - PM 6시  유튜브 LIVE👍금,토,일 - 랜덤 편집영상 업로드👍인스타 계정 (Instagram -  cnstka486)   해당 영상의 저작권은 CJ E&M DIA TV에 귀속되어 있으며 해당 영상을 영리목적으로 사용시 제재를 받을 수 있습니다. 또한 비영리 목적으로 사용시 반드시 출처를 남겨주시기 바랍니다."
"KV-4O2CPelw","체리툰 | 사장님 여기 치킨 100마리요~!🍗 돈쭐 난 치킨집💶  | 영상툰/썰툰/일상툰 | 설렘썰/공포썰/고민썰/개그썰","2021-04-08T09:00:16Z","UCz2KbgTUwirkfmHDT44009w","체리툰","1","21.09.04","체리의영상툰|체리툰|영상툰|일상툰|사연툰|썰툰|설렘썰|공포썰|고민썰|사이다|사이다썰|웃긴썰|개그|심쿵|밍꼬발랄|헤이지니|오늘의영상툰|흔한남매|꾹TV|허팝|치킨|돈쭐|치킨집|형제|훈훈|감동","171091","3952","82","916","https://i.ytimg.com/vi/KV-4O2CPelw/default.jpg","False","False","사장님 여기 치킨 100마리요~!🍗 돈쭐 난 치킨집💶  ▶ 채널구독하기 https://www.youtube.com/channel/UCz2KbgTUwirkfmHDT44009w?sub_confirmation=1 ▶ 업로드 일정매주 월, 목 오후 6시 ▶ 사연받는 곳 사연은 유튜브에 댓글로 달거나 메일로 보내주세요~! 체리툰 메일 주소 cherrytoon.tv@gmail.com ▶ 구독 & 좋아요 🔔알람설정🔔 부탁드려용~ #체리의영상툰 #체리툰 #영상툰 #일상툰 #사연툰 #썰툰 #설렘썰 #공포썰 #고민썰 #사이다 #사이다썰 #웃긴썰 #개그 #심쿵 #가위 #귀신썰 #치킨 #돈쭐 #치킨집 #형제 #훈훈 #감동─────────────────────────────────────🎵 BGM 출처Track : Ready To NapMusic by 브금대통령Music provided by 브금대통령Watch : https://youtu.be/UZE2a9gTsDkMusic provided by 브금대통령Track : Confusing Road -https://youtu.be/ydPppyQQdPcMusic provided by 브금대통령Track : 겨울에 피는 꽃 - https://youtu.be/Vmrrd9nONDUTrack : 웃기고있네Music by 브금대통령Music provided by 브금대통령Watch : https://youtu.be/aY7VLF71pNMMusic provided by 브금대통령Track : Warm Christmas at home -https://youtu.be/LO7IAa9mRHY🎵Music provided by 브금대통령🎵Track : 와 이거 뭔데 - https://youtu.be/7zswBFefpLU🎵Music provided by 브금대통령🎵Track : Brand New Company - https://youtu.be/mzQA4qJxloU"
"upWR0_-jXno","너 대체 뭐하느라 연락이 없어?","2021-04-08T13:12:58Z","UC4MfUqhvA1LxpxE-67sJGbw","단하나 DANHANA","22","21.09.04","크리에이터|타투|문신|타투이스트|냐아|으냐|단하나|김경은|이하나|레즈|레즈커플|동성애|동성커플|하나경은|하나|경은|gay|couple|goals|danhana|tattoo|dantattoo|dan|21lee21|iwantdan|lesbian|korean|hana|queer|lgbt|퀴어|퀴어커플|퀴어커플영상|패션|먹방|요리","397694","13659","93","1237","https://i.ytimg.com/vi/upWR0_-jXno/default.jpg","False","False","이하나의 단점단 인스타 https://www.instagram.com/iwantdan하나 인스타 https://www.instagram.com/21lee21단하나 유투브 구독https://bit.ly/2OaoIyc"
"9fVheRR6jgU","[LIVE] STAYC 스테이씨 'ASAP' Showcase Stage 쇼케이스 무대 (수민, 시은, 아이사, 세은, 윤, 재이) [통통컬처]","2021-04-08T09:00:03Z","UCHzW_7Mf8G0JxP4b0LoAd7A","TongTongTv 통통컬처","24","21.09.04","통통TV|TongTongTV|연합뉴스|yonhapnews|통통티비|STAYC|스테이씨|스테이시|스테이돔|STAYDOM|에이셉|ASAP|스테이씨 에이셉|STAYC ASAP|스테이씨 소 왓|STAYC SO WHAT|스테이씨 사랑은 원래 이렇게 아픈 건가요|스테이씨 소 배드|STAYC SO BAD|수민|시은|아이사|세은|윤|재이|Sumin|Sieun|Isa|Seeun|Yoon|박남정 딸|스테이씨 힘내|STAYC Like this|스테이씨 라이브|STAYC Live|STAYC REACTION|스테이씨 무대|STAYC Stage|스테이씨 직캠|스테이씨 쇼케이스|STAYC Showcase|스테이씨 풀|스테이씨 쇼케이스 풀영상|STAYC Full|STAYC Showcase Full|스테이씨 데뷔 쇼케이스|STAYC DEBUT Showcase|에이셉 무대|ASAP Stage","256972","16310","268","1585","https://i.ytimg.com/vi/9fVheRR6jgU/default.jpg","False","False","#STAYC #스테이씨 #ASAP4월 8일 스테이씨가 두 번째 싱글앨범 'STAYDOM'을 발매했다. 이번 앨범에는 타이틀곡 'ASAP'와 수록곡 'SO WHAT', '사랑은 원래 이렇게 아픈 건가요', 'SO BAD'(TAK REMIX) 등 총 4곡이 수록됐다.On April 8, STAYC released their second single album, 'STAYDOM'. A total of four songs were included in the album, including the title song 'ASAP', and the side tracks called 'SO WHAT', 'Does Love Really Hurts Like This?' and 'SO BAD' (TAK REMIX).✔️TongTong Culture is a Korean pop culture channel of Yonhap News Agency. 연합뉴스가 만드는 대중문화 전문채널 '통통컬처' (보도자료/출연문의 : syipd@yna.co.kr)"
"NrRmUT6BIOs","바베큐 그릴은 사서 쓰세요... 제발....!!! [성수동공업소 - 승우아빠 의뢰편]","2021-04-08T10:00:16Z","UCp94pzrtA5wPyZazbDq0CXA","긱블 Geekble","26","21.09.04","Geekble|긱블|승우아빠|철원일기|로잉머신|바베큐|철원|김계란|공혁준|찐서유기","215588","3760","46","336","https://i.ytimg.com/vi/NrRmUT6BIOs/default.jpg","False","False","139만 요리유튜버 승우아빠가 성수동공업소에!!!운동을 시키면서 요리를 할 수 있는 작품이 필요하다던데...이거 못참지 ㅋㅋㅋ 또 하나의 기괴한 작품이 탄생할지도?!🛠 성수동공업소 의뢰하기: http://bit.ly/geekgarage🛠 성수동공업소 정주행하기: https://youtube.com/playlist?list=PL_12Raz22R-lnuT74Lh-nz3Gkh1OyLsVk🎨 긱블 인스타그램잭키 https://www.instagram.com/maker_jacky/​민바크 https://www.instagram.com/minb_dev/​찬스 https://www.instagram.com/geekble_cha...​카프 https://www.instagram.com/cmonincoff/-긱블 유튜브 구독 : https://bit.ly/321VSEe긱블 카페: https://cafe.naver.com/geekbleofficial"
"G0ey5zbQB-U","브레이브걸스(Brave Girls)│쁘걸의 밴드 라이브 콘서트!!  ‘롤린(Rollin')’ & ‘운전만해(We Ride)’ One Take Ver. │ it’s PICKed","2021-04-08T08:00:37Z","UCB9e3pof1o83aa0kkaoeJGA","Mdromeda KPOP","24","21.09.04","브레이브걸스|Brave Girls|Rollin|롤린|쁘걸|브브걸|쁘걸 롤린|브브걸 롤린|브레이브 걸스 유정|유정|유나|민영|은지|브레이브걸스 유나|브레이브걸스 은지|운전만해|브레이브걸스 운전만해|We Ride|역주행|밀보드|롤린 춤|가오리춤|비디터|꼬북좌|메보좌|단발좌|왕눈좌|용감한 형제|용형|위문열차|군통령|브레이브걸스 갤러리|브레이브걸스 무대|브레이브걸스 노래|브레이브걸스 역주행|Brave girls Rollin|Brave Girls We Ride|하이힐|Brave girls Members|Minyoung|Yujeong|EunJi|YUNA|Brave Girls KPOP|Brave girls Yujeong|Brave girls YUNA|Brave Girls Eunji|Brave Girls Stage|Brave girls Song|KPOP|Mdromeda|MDR|잇츠라이브|itsLIVE","234495","10367","54","2344","https://i.ytimg.com/vi/G0ey5zbQB-U/default.jpg","False","False","케이팝 “찐”라이브 ‘잇츠라이브’이전에 없던 엄청난 스케일의 라이브 웹콘텐츠가 찾아왔다!Real KPOP Live “it’s Live”그룹 브레이브걸스(Brave Girls)가 잇츠라이브를 찾아왔습니다💖롤린(Rollin’)과 운전만해(We Ride)를 밴드 버전으로 들어보실 수 있는 기회! 라이브 무대와 쁘걸의 인터뷰까지, 지금 바로 만나보세요!😍Brave Girls - “Rollin” & “We Ride” Producer 박수민Creative Director 김라희Co-producer 문소현 김채윤 김혜연 Publisher 류가을 Camera Director 김상훈Camera 김승현 최준환 노영일 최영훈Music Director 자이언루즈E.guitar  유승범 E.bass  이성찬 Keyboard 이원희, 황득경 Drums 렉토 루즈Percussion 유이엽  Lighting | (주)라이팅코리아 Recording & Sound | 폴리웍스오디오Mixing | Wilson Sound Factory 허건회 [assited by 이은주] #itsLIVE #브레이브걸스 #Rollin #BraveGirls #롤린 #운전만해 #WeRide #브브걸 #쁘걸 #KPOP #잇츠라이브"
"Rlep0oYzu3I","애니메이션: 골드암 갱, 스타 뱅크를 털다 [브롤스타즈]","2021-04-07T07:44:37Z","UClJspSpzADMROqOW9HLHaoA","브롤스타즈","20","21.09.04","브롤스타즈|슈퍼셀|브롤|brawlstars|supercell","220508","2721","138","752","https://i.ytimg.com/vi/Rlep0oYzu3I/default.jpg","False","False","브롤스타즈 시즌 6 골드암 갱, 드디어 업데이트! 💰 무법자 벨과 함께 서부 황야로 출발하세요.지금 다운로드 받으세요 👉 https://supr.cl/BrawlStarsKR브롤스타즈 Youtube 🔗 https://www.youtube.com/BrawlStarsKorea/브롤스타즈 공식 카페 🔗 https://cafe.naver.com/brawlstars브롤스타즈 Facebook 🔗 https://www.facebook.com/BrawlStarsKorea/브롤스타즈 Instagram 🔗 https://www.instagram.com/brawlstars_korea/ 브롤스타즈 Tik Tok 🔗 https://www.tiktok.com/@brawlstars_korea#브롤스타즈 #애니메이션 #골드암갱"
"d44DGi4LXNI","펜트하우스 1, 2 등장인물 성대모사ㅣ진짜 똑같다...ㅣ소름 주의ㅣ천서진,주단태,이규진 등등ㅣ레전드","2021-04-08T11:00:21Z","UCwZTeeKyb1hT6sg8tfOaZiA","임다TV","24","21.09.04","임다|아재개그|웃긴영상|레전드|웃겨라|아프리카tv|역대급|반전사진|임다를웃겨라|병맛더빙|성대모사|비트코인|주식|비트코인 전망|코인|펜트하우스|펜트 하우스 드라마|펜트 하우스 드라마 시즌2|주단태|천서진|성대모사 달인|성대모사 하는법","158906","3935","99","618","https://i.ytimg.com/vi/d44DGi4LXNI/default.jpg","False","False","#주단태 #펜트하우스 #성대모사[아프리카TV ★임다★]BJ★임다★를 아프리카TV 생방송 ▶ https://goo.gl/V99177BJ★임다★유튜브 구독 ▶ https://goo.gl/5MwW5BBJ★임다★의 페이스북 ▶ https://goo.gl/7N2mKv"
"Z56VThUfQ8k","화제의 홍진경 스터디윗미 16분 요약(3시간공부,제삿상스터디,댓글이벤트) [공부왕찐천재]","2021-04-07T10:00:31Z","UCkxbPwdaV74Erdxt97Nt23w","공부왕찐천재 홍진경","24","21.09.04","홍진경|홍진경채널|홍진경 유튜브|공부왕찐천재 홍진경|공부왕찐천재|홍진경 브이로그|홍진경 채널|홍진경 라이브|홍진경 딸|홍진경 공부|홍진경공부준비|홍진경 집|홍진경 집공개|홍진경 교육법|개그맨 유튜브|홍진경 인터뷰|홍진경 무한도전|홍진경 레전드|우울할땐 홍진경|홍진경 식스맨|홍진경 오분순삭|홍진경 예능|웃긴짤|학교 브이로그|입학식|공부|과외|교육법|인강추천|공부할때듣는음악|공부할때 BGM|시험잘보는|공부브이로그|공부자극|공부꿀팁|스터디윗미|공부라이브|공부 같이 해요|hong jin kyung|라이브스트리밍|슈퍼챗|슈퍼챗 반응|공부 브이로그|공부잘하는|그리|남창희|mc그리|10만 공약|구독자 애칭|구독자 애칭 정하기|실버버튼|유튜브 라이브|라이브전|라이브 심경|홍진경먹방|홍진경 먹방|투다리|사주카페|홍진경 사주카페|뻥튀기|뻥튀기 정보|하트뻥튀기|사과|사러가마트","384321","10335","61","1618","https://i.ytimg.com/vi/Z56VThUfQ8k/default.jpg","False","False","저의 3시간 풀공부를빠르게 보고싶다고 하신구독자분들을 위해요약본을 만들었습니다 ^^감사합니다 사랑합니다─────────* 여러분! 약속 지키겠습니다!! [더김치] 구독자 댓글 이벤트!!- 이벤트내용 : 이번 회차에 댓글 달아주신 만재님들 중 추첨을 통해 홍진경 '더김치'를 보내드립니다♡- 이벤트기간 : ~4/15(목) 오후 5시까지- 이벤트상품 : 홍진경 '더김치' 30명- 당첨자발표 : ~4/16(금) 커뮤니티 공지 & 대댓글 #홍진경​ #공부왕찐천재​ #스터디윗미"
