video_id,title,publishedAt,channelId,channelTitle,categoryId,trending_date,tags,view_count,likes,dislikes,comment_count,thumbnail_link,comments_disabled,ratings_disabled,description
"2EIod2VBkyA","DIJON FCO - PARIS SAINT-GERMAIN (0 - 4) - Résumé - (DFCO - PSG) / 2020-2021","2021-03-01T00:00:00Z","UCQsH5XtIc9hONE1BQjucM0g","Ligue 1 Uber Eats","17","21.01.03","DIJON FCO PARIS SG|Dijon Paris|Résumé DIJON FCO PARIS SAINT-GERMAIN|Résumé DIJON FCO PARIS SG|DIJON FCO|Dijon|PARIS SAINT-GERMAIN|Paris|résumé|buts|but|résumé Ligue 1 Uber Eats|ligue 1|ligue 1 uber eats|L1|championnat|journée|football|foot|match|France|sp:ty=high|sp:dt=2021-02-27T17:00:00Z|sp:vl=fr|sp:st=soccer|sp:li=france|sp:ti:home=DIJON FCO|sp:ti:away=PARIS SG","77426","1192","20","93","https://i.ytimg.com/vi/2EIod2VBkyA/default.jpg","False","False","Revivez les meilleurs moments de DIJON FCO - PARIS SAINT-GERMAIN (0-4) en vidéo. Ligue 1 Uber Eats - Saison 2020/2021 - 27ème journée STADE GASTON GÉRARD - Samedi 27 Février 2021Buteurs : Bioty Moise KEAN (6' - PARIS SAINT-GERMAIN) / Kylian MBAPPE (32' pen - PARIS SAINT-GERMAIN) / Kylian MBAPPE (51' - PARIS SAINT-GERMAIN) / Danilo Luis Helio PEREIRA (83' - PARIS SAINT-GERMAIN) Composition DIJON FCO : 25 - Bruno ECUELE MANGA (c) /1 - ANTHONY RACIOPPI /2 - Sacha BOEY /8 - Eric Junior DINA EBIMBE /11 - Moussa KONATÉ /6 - Pape Cheikh DIOP /5 - Senou COULIBALY /4 - Jonathan PANZO /17 - Mama Samba BALDÉ /3 - Glody NGONDA MUZINGA /9 - Bersant CELINA Composition PARIS SAINT-GERMAIN : 25 - Bruno ECUELE MANGA (c) /1 - ANTHONY RACIOPPI /2 - Sacha BOEY /8 - Eric Junior DINA EBIMBE /11 - Moussa KONATÉ /6 - Pape Cheikh DIOP /5 - Senou COULIBALY /4 - Jonathan PANZO /17 - Mama Samba BALDÉ /3 - Glody NGONDA MUZINGA /9 - Bersant CELINA Abonnez-vous à la chaîne YoutubeSubscribe : https://www.youtube.com/subscription_center?add_user=ligue1frSuivez nous sur Instagram : https://instagram.com/ligue1ubereats/ Suivez nous sur Twitter : https://twitter.com/Ligue1UberEatsSuivez nous sur Facebook : https://fb.com/Ligue1UberEatsSuivez nous sur Ligue1.fr : https://www.ligue1.fr"
"I_eASMRyisc","Résumé : Milan remporte le choc au sommet contre la Roma !","2021-02-28T21:59:42Z","UCfj4kQ6_mYO5r4hzX5KloVw","beIN SPORTS France","17","21.01.03","Foot|Football|résumé|highlights|but|buts|AC milan|milan|Gianluigi Donnarumma|donnarumma|théo hernandez|hernandez|romagnoli|ante rebic|rebic|sandro tonali|tonali|Ismaël Bennacer|bennacer|kessié|paqueta|lucas paqueta|brahim diaz|diaz|Saelemaekers|zlatan ibrahimovic|ibra|ibrahimovic|zlatan|Roma|as roma|rome|nicolo zaniolo|zaniolo|lorenzo pellegrini|pellegrini|kumbulla|Marash Kumbulla|jordan veretout|veretout|mancini|Henrikh Mkhitaryan|mkhitaryan|Gianluca Mancini","124874","3191","38","231","https://i.ytimg.com/vi/I_eASMRyisc/default.jpg","False","False","[📺 RÉSUMÉ VIDÉO] 🇮🇹 #SerieA🔥 Milan remporte le choc au sommet contre la Roma !🎯 Un succès 2-1 malgré un golazo de Veretout !🌪 Kessie et Rebic ont fait trembler les filets, Milan revient à 4 points de l’Inter !💻 Résumés, buts, articles, vidéos, ... ➡️ www.beinsports.com📱 Retrouvez-nous sur les réseaux sociaux :➡️ Facebook : https://www.facebook.com/beINSPORTSFr...➡️ Twitter : https://twitter.com/beinsports_FR➡️ Instagram : https://www.instagram.com/beinsports_fr/➡️ TikTok : https://www.tiktok.com/@beinsportsfr"
"AP0NUqQXoLQ","Crash! Ogier OFF on SS8 at WRC Arctic Rally Finland 2021 (crew ok)","2021-02-27T19:34:46Z","UC5G6kTnHXDz0WIBC2VGBOqg","FIA World Rally Championship","17","21.01.03","Rallying|motorsport|FIA|World|Rally|Championship|racing|rallye|rally compilation|rally highlights|wrc highlights|FIA World Rally Championship|rally car|ogier|crash|snowbank|drift","62872","784","18","39","https://i.ytimg.com/vi/AP0NUqQXoLQ/default.jpg","False","False","He's gone off the road 200m from the stage end and is stuck deep into a snow bank! He manages to get out and finishes the stage...More FREE videos, news and results at https://www.wrc.comWatch LIVE rally! All stages of every rally live or on demand with live cameras on stage, onboard and in the air, including expert analysis, behind the scenes stories, split times and real time GPS tracking. Thousands of onboard videos with moving maps, speed, gear, pedal and steering data, rally highlights, and exclusive videos all available on demand anytime, on any device with your subscription to WRC+ All Live.http://www.wrcplus.com/Find out about the official WRC video game on PC, XBox, Playstation and Nintendo Consoles here.https://www.wrcthegame.comeSports WRC Championship, is open to anyone, driving on the same roads and stages as the real-life WRC.https://www.wrc.com/en/more/gaming/esports-wrc/Rally Fan? Merch, clothing and more at the official shop of the FIA World Rally Championship.https://shop.wrc.com/Subscribe to this YouTube Channel for exclusive, frequent new rally videos.https://www.youtube.com/user/wrc?sub_confirmation=1Behind the scenes and more on Facebook.https://www.facebook.com/WorldRallyVideos, photos, stories and competitions to win on Instagram.https://www.instagram.com/officialwrc/News, results, photos, videos on Twitter.https://twitter.com/OfficialWRCThe WRC is the FIA World Rally Championship, a tough motorsport using rally cars on real roads around the world. Watch the best rally drivers battle on gravel and asphalt roads with mud, rain, dust, ice and heat! Watch high speed action as the rally drivers power slide and drift round narrow corners, go flat out over a big jump or through a watersplash, handbrake turn round a hairpin, survive a big moment, or have a massive crash! Rally requires maximum attack and careful tactics to become world rally champion.Each rally has timed sections called special stages, on closed roads. Drivers complete these stages as quickly as possible. A co-driver reads pace notes that explain the hazards ahead. Rally drivers use the same rally car to travel to each stage on public roads, following normal traffic regulations. The crew which completes all the stages in the shortest time is the rally winner. Championship points are won using the same scoring system as Formula 1. The championship is administered by Fédération Internationale de l'Automobile (FIA), motorsport's world governing body.Over 30 countries have hosted WRC rallies. Rally Monte Carlo, Rally Argentina, Rally Finland, Rally Portugal, Tour de Corse on Corsica, France, Rally Sardegna on Sardinia, Italy, Safari Rally in Kenya, Acropolis Rally in Greece, Rally New Zealand, Rally Australia, Rally Japan, Rally GB, Rally Catalunya, Rallye Deutschland, Rally Mexico and many more.Some of the world's greatest drivers have won the FIA World Rally Championship for Drivers, like Colin McRae, Carlos Sainz, Walter Röhrl, Stig Blomqvist, Petter Solberg, Ott Tänak. The list of world rally champions includes many Finnish rally drivers like Juha Kankkunen, Tommi Mäkinen, Ari Vatanen, Marcus Grönholm, Hannu Mikkola. French drivers have had success with Sébastien Ogier, and 9 times world champion Sébastien Loeb. Famous drivers from other motorsports have come to try rally driving like Ken Block from Rallycross, and Robert Kubica and Kimi Räikkönen from F1.Car companies compete for the prestigious FIA World Rally Championship for Manufacturers awarded to the most successful WRC constructor. Winners include Citroen, Hyundai, Volkswagen and Peugeot. Ford have had success with the Ford Escort, Ford Focus and Ford Fiesta when the M-Sport team won in 2017.The 1980's featured the iconic Group B rally cars like the Lancia 037 and Delta S4, Peugeot 205 T16, MG Metro 6R4, Ford RS200 and Audi Quattro.Japan dominated the 1990s with the Mitsubishi Lancer, Subaru Impreza, and Toyota Celica and Toyota Corolla. Toyota returned to the WRC in 2017 with the Toyota Yaris WRC, winning in 2018. The 2019 championship was won by Hyundai with the Hyundai i20 Coupe WRC. Find out about the latest winners and champions at https://www.wrc.com"
"7-aoBMt__o4","Interview Ciryl Gane après sa victoire sur Rozenstruik -  un petit goût amer","2021-02-28T14:47:26Z","UC0hLHeIEaQPtef66IUWynSg","La Sueur","17","21.01.03","UFC|Ultimate Fighting Championship|MMA|Bellator|bellator mma|knockouts|KO MMA|Mixed Martial Arts|conor mcgregor interview|Conor McGregor UFC|Conor McGregor KO|Khabib|Khabib Nurmagomedov|résultat MMA|La Sueur|Podcast La Sueur|MMA Junkie|MMA Fighting|The Mac Life|Ilies Mkt|Boxe Attitude|Karaté Bushido|Francis Ngannou|MMA Factory|Ciryl Gane|Ciryl Gane vs. Jairzinho Rozenstruik|Jairzinho Rozenstruik|Ciryl Gane UFC Vegas 20|UFC Vegas 20|Bon Gamin","38298","3234","15","584","https://i.ytimg.com/vi/7-aoBMt__o4/default.jpg","False","False","Vainqueur de Jairzinho Rozenstruik par décision unanime (50-45, 50-45, 50-45), Ciryl Gane est revenu sur son main-event de l'UFC Vegas 20. #RozenstruikGane #RustyBusinessVENUM -10% avec le code LASUEUR : https://bit.ly/31VtLtAMYPROTEIN -42% supplémentaires avec le code LASUEUR : http://bit.ly/2FiQqmZLa Sueur Store pour la merch La Sueur ➡️ https://lasueur.store/Pour regarder l'UFC Fight Pass : https://bit.ly/2Qygr7ALien iTunes pour balancer les 5 étoiles de la mort : https://apple.co/2tyLhRrLien vers le discord pour ne plus être solo pendant les fight nights : https://discord.gg/A8dd4RBSoundcloud, Deezer, Apple Podcast, Spotify, le podcast est disponible sur toutes les plateformes audio ici : https://www.liinks.co/lasueurSUIVEZ-NOUS !Web: https://lasueur.comFacebook: https://facebook.com/lasueurInstagram: https://instagram.com/lasueurTwitter : https://twitter.com/lasueur_offContact : contact@lasueur.com ou podcast@lasueur.comMusique générique par l'incroyable Setry (Setrymusic) : https://soundcloud.com/setrymusic"
"2-ER52fX47M","ON ESSAYE UN SIDE-CAR DE L'ARMÉE RUSSE ! TROP DANGEREUX !","2021-02-27T09:00:01Z","UC-uy7_1hColMpQ_2rs-kY6w","KIKANINAC","24","21.01.03","moto|russe|sidecar|side car|ural|ranger|armee|motard|roadtrip|essai|balade|supermotard|russie","124722","12205","74","298","https://i.ytimg.com/vi/2-ER52fX47M/default.jpg","False","False","Deux soldats en side-car de l'armée russe ! 😂💥👕  BOUTIQUE SUPERMOT : https://supermot.fr➜FACEBOOK: https://www.facebook.com/KIKANINAC/➜TWITTER: https://www.twitter.com/KIKANINAC/➜INSTAGRAM: https://www.instagram.com/KIKANINAC/➜MON MATOS VIDÉO 🎥:MA CAMÉRA : https://amzn.to/2FATiMfOBJECTIF 25mm : https://amzn.to/2t9rFahOBJECTIF 7-14mm : https://amzn.to/2R6ZPU7MON STABILISATEUR : https://amzn.to/37R61GsMON PETIT STABILISATEUR : https://amzn.to/36UJB76MON DRONE : https://amzn.to/39WUveEMON ORDINATEUR : https://amzn.to/2tPh8B0MA GOPRO  : https://amzn.to/37U4hwdMICRO DE MA GOPRO : https://amzn.to/2tRuInO➜SPONSORS:🛡 ÉQUIPEMENTSiCASQUEhttp://www.icasque.comCode -15% : KIKANINAC15🔗  SUSPENSIONSROYAL SUSPENSIONShttps://www.instagram.com/royalsuspension/🎨  KIT DÉCOFéroce Graphicshttps://www.instagram.com/ferocegraphics/✂️  SELLENOX CUSTOMhttps://www.noxcustom.fr/⚒  CARBONEGCARBONPROhttps://www.instagram.com/gcarbonpro/https://www.facebook.com/gcarbonpro/🏍 BRChttps://brcracing.ca/#MOTO #RUSSE #SIDECAR"
"ja3FVSXOlbY","FAIRE SON COMING OUT C'EST FACILE ?","2021-02-28T17:01:40Z","UCE_j4oA4mu2CP3y_rR037LA","Ben Névert","24","21.01.03","coming out|homosexualité|aloïse sauvage|alex ramires|ben névert|lgbt|gay","76495","8378","33","653","https://i.ytimg.com/vi/ja3FVSXOlbY/default.jpg","False","False","Yoooh !J'ai invité Aline et Cédric, jumeaux homosexuels qui ont monté le merveilleux média @PAINT qui donne parole à la communauté LGBTQ+.On parle de Coming Out, d'acceptation de son identité et orientation sexuelle. Leur témoignage m'a beaucoup touché et vos vocaux aussi ! (+ des guests surprise comme d'hab) ----- Vous pouvez retrouver la série Love, Victor en streaming dès maintenant dans Star, le nouveau monde de divertissement de Disney+ : ► http://disneyplus.comMerci à eux d’avoir sponsorisé cet épisode et de nous permettre d’explorer ce thème qui me tient à cœur : le coming-out ❤️🙏-----Si tu as kiffé cet épisode, laisse un commentaire de soutien, pour que cette vidéo soit vue MASSIVEMENT tu koné. Même si c’est un simple « ❤️ » ou un « Voici le YouTube qu'on aime ».Abonne-toi à la chaine pour ne pas manquer les prochaines vidéos (dimanche prochain, oui.)Bisous ❤️---------------Retrouve-moi ici :Instagram ► https://www.instagram.com/bennevert/Podcasts (Spotify, Deezer, Apple Podcast) ► https://linktr.ee/bennevertRetrouve Aline et Cédric sur leur merveilleux média @PAINT  :Instagram ► https://www.instagram.com/paint.lgbt/Facebook ► https://www.facebook.com/paintlgbt/Retrouve mes invité.es surprises (coeur sur vous)@Alex Ramirès  ► https://www.instagram.com/alexramiress/@Aloïse Sauvage ► https://www.instagram.com/aloisesauvage/---------------La Team :RÉALISATIONHugo NOULINSONNorman TONNELIERCHARGÉ DE PRODUCTIONMaxime PONTOISMONTAGEGildas GUEVELETALONNAGEHugo NOULINMIX SONNorman TONNELIERGÉNÉRIQUE    ANIMATION    Valp     ► https://www.instagram.com/bonjour_valp/     MUSIQUE    Omar MEBROUK     ► https://www.instagram.com/omaronzolo/REMERCIEMENTViolaine, une personne en or."
"efvsg_xE3Ak","UFC Ciryl Gane vs. Jairzinho Rozenstruik RECAP & REACTION : BON GAMIN EN CONTRÔLE TOTAL","2021-02-28T05:16:11Z","UC0hLHeIEaQPtef66IUWynSg","La Sueur","17","21.01.03","UFC|Ultimate Fighting Championship|MMA|Bellator|bellator mma|knockouts|KO MMA|Mixed Martial Arts|conor mcgregor interview|Conor McGregor UFC|Conor McGregor KO|Khabib Nurmagomedov|La Sueur|Podcast La Sueur|MMA Junkie|MMA Fighting|The Mac Life|Ilies Mkt|Boxe Attitude|Karaté Bushido|Francis Ngannou|MMA Factory|Ciryl Gane|Ciryl Gane vs. Jairzinho Rozenstruik|Jairzinho Rozenstruik|UFC Vegas 20|Gane vs. Rozenstruik|Bon Gamin|Fernand Lopez|ciryl gane","48459","1375","44","467","https://i.ytimg.com/vi/efvsg_xE3Ak/default.jpg","False","False","Retour sur la victoire de Ciryl Gane lors de l'UFC Vegas 20 face à Jairzinho Rozenstruik, pour son premier main-event.VENUM -10% avec le code LASUEUR : https://bit.ly/31VtLtAMYPROTEIN -42% supplémentaires avec le code LASUEUR : http://bit.ly/2FiQqmZLa Sueur Store pour la merch La Sueur ➡️ https://lasueur.store/En France, toutes les cartes principales de l'UFC sont diffusées en direct sur RMC SPORT ➡️https://bit.ly/2XVa69WPour regarder l'UFC Fight Pass : https://bit.ly/2Qygr7ALien iTunes pour balancer les 5 étoiles de la mort : https://apple.co/2tyLhRrLien vers le discord pour ne plus être solo pendant les fight nights : https://discord.gg/A8dd4RBSoundcloud, Deezer, Apple Podcast, Spotify, le podcast est disponible sur toutes les plateformes audio ici : https://www.liinks.co/lasueurSUIVEZ-NOUS !Web: https://lasueur.comFacebook: https://facebook.com/lasueurInstagram: https://instagram.com/lasueurTwitter : https://twitter.com/lasueur_offContact : contact@lasueur.com ou podcast@lasueur.comMusique générique par l'incroyable Setry (Setrymusic) : https://soundcloud.com/setrymusic"
"ZmG_MNPJqzc","Ma valise de maternité: SANS TABOU !!  💗Fille ou 💙Garçon ? 👼🏻حقيبة الولادة","2021-02-26T20:00:25Z","UCtI9iRaHa7Ex9Z7ATfjpLwg","Ziya Inspiration","26","21.01.03","lifestyle|homedecor|vlog","435010","36557","785","4532","https://i.ytimg.com/vi/ZmG_MNPJqzc/default.jpg","False","False","▶︎LET'S BE FRIENDS💕💕         INSTA: https://www.instagram.com/ziya_inspiration/----------------------------------------------------------------------------------------------▶︎REJOINS LA ZIYAFAMILY💕💕          https://www.youtube.com/c/ZiyaInspiration?sub_confirmation=1-----------------------------------------------------------------------------------------------▶︎Autres Videos💕💕-----------------------------------------------------------------------------------------------RANGEMENTS CUISINE  | ORGANISATION ⭐  IDÉES DECO 🌟 cuisine IKEA🌟https://youtu.be/hKOw_a9pRTo-----------------------------------------------------------------------------------------------                     Celle qui a fait le BUZZZZZhttps://www.youtube.com/watch?v=95iOeB5QI3Y&t=397s-----------------------------------------------------------------------------------------------                  Journee dans mon assiettehttps://www.youtube.com/watch?v=QS_0ahK9U6U-----------------------------------------------------------------------------------------------IDÉES DÉCO 🌟CLEAN WITH ME🌟ORGANISATION 🌟  https://youtu.be/6QIeah5WDP4-----------------------------------------------------------------------------------------------Une journée dans mon assiette (x7)🌟MEAL PREP🌟 Rééquilibrage Alimentaire🌟https://youtu.be/F198LwSXoiM-----------------------------------------------------------------------------------------------           Routine Couplehttps://youtu.be/lXqxDkKXhIk-----------------------------------------------------------------------------------------------Je partage avec vous What's in my hospital bag, ce que j'ai mis dans Ma valise de maternité, les necessaires pour bébé (Trousseau de naissance ).Gender reveal, je vous dévoile le sexe du  : FILLE OU GARÇON. Bienvenue sur ma chaine Ziya Inspiration la ou je partage mon lifestyle en mettant un accent sur tout ce qui touche au developpement personnel, Home & Decor et le bien-être.Ziya Inspiration a pour but d'inspirer, motiver et reveler la fabuleuse qui sommeille en toi.XOXO...Ziya#France #Algerie #Maroc #Tunisie-------------------▶︎Contact me 💕💕------------------- Email Pro: ziyainspiration@gmail.com"
"n94Aox706kI","Et Si l'Algérie Était Restée Française?","2021-02-27T11:18:24Z","UCacgofzftbbkUhcftPvUzQg","AlterHis","24","21.01.03","alterhis|histoire|alternative|histoire alternative|uchronie|doc histoire|reportage histoire|documentaire histoire|documentaire historique|algérie française|guerre d'algérie|indépendance algérie|histoire algérie|et si la france avait gardé l'algérie?|décolonisation|guerre froide|oas|De Gaulle|accords d'évian|et si l'Algérie n'avait jamais été indépendante?|alter his|alteris","118931","9258","237","3524","https://i.ytimg.com/vi/n94Aox706kI/default.jpg","False","False","Aujourd'hui deux hypothèses sur ce qui aurait pu se passer si l'Algérie n'avait jamais pris son indépendance  !Pour soutenir la chaîne ! ➡ https://www.tipeee.com/alterhis++++++++++++++++++++ AlterHis est désormais disponible en podcast !Spotify➡️https://spoti.fi/344sCAwDeezer➡️https://bit.ly/3dI9wU4Apple podcasts➡️https://apple.co/37L0C7dSoundcloud➡️https://bit.ly/2HHurejPodcast Addict➡️https://bit.ly/3kAtbrpAcast➡️https://bit.ly/3dZKSOG++++++++++++++++++++ N'hésite pas à me rejoindre sur les réseaux sociaux !FACEBOOK ➡ https://www.facebook.com/alterhis TWITTER ➡ https://twitter.com/AlterHis DISCORD➡ https://discord.me/alterhisINSTAGRAM➡@alterhis_insta++++++++++++++++++++ Musiques et vidéos utilisées➡https://pastebin.com/nDY1DqWt++++++++++++++++++++ Sources:Lefeuvre, Daniel (2005). Chère Algérie: La France et sa ColonieDe Gaulle et le problème algérien en 1958 - Guy Pervilléhttps://www.larousse.fr/encyclopedie/divers/guerre_d_Alg%C3%A9rie/104808++++++++++++++++++++ 00:00 -Intro01:56 -Résumé bref de la guerre08:29 -Scénario 1: Intégration et francisation de l'Algérie16:46 -Scénario 2: Partition et indépendance de l'Algérie++++++++++++++++++++ Toutes les musiques, vidéos et images de cette émission appartiennent à leurs propriétaires respectifs et sont utilisées en vertu de l'article L122-5 du code de la propriété intellectuelle.#algérie#histoire"
"oHvP6nQORVU","All my Sneakers ! Je vous montre mes paires préférées et mes vêtements ! #2","2021-02-27T13:30:10Z","UCL9aTJb0ur4sovxcppAopEw","Inoxtag","24","21.01.03","INOXTAG|INOX|CROUTON|all my sneakers|all my sneakers inoxtag|inoxtag tn|inoxtag chaussure|inoxtag vetement|inoxtag bail 2 sneakers|inoxtag chaussures","1021874","128545","644","13072","https://i.ytimg.com/vi/oHvP6nQORVU/default.jpg","False","False","Yop tout le monde ! Nouvelle vidéo ! Partie 2 j'avais déjà fait un all my sneakers y'a 1 an, du coup j'ai voulu vous en faire un 2ème avec toutes les paires que j'ai pu avoir entre temps, j'ai aussi voulu vous monter mes vêtements car vous me l'aviez beaucoup demandé !Bonne vidéo à tous, hésites pas à commenter, mettre le pouce en l'air et t'abonner Bg !🎥Chaîne secondaire: https://bit.ly/2TnCBfm💙T'abonner: https://bit.ly/2Licu2N🔔✅Activez la cloche de notification ↪️Afin d'être au courant de mes prochains live ou vidéos !  😄Mes réseaux sociaux ! 😄Twitch: https://www.twitch.tv/inoxtag🎥Youtube: https://bit.ly/2Licu2N🐤Twitter: @Inoxtag / https://bit.ly/2rT3lVq📸Instagram: @Inoxtagytb / https://bit.ly/2IRifX4📞Discord: https://bit.ly/2LlIBi4💎Deviens Sponsor: https://www.youtube.com/channel/UCL9aTJb0ur4sovxcppAopEw/join💌 SponsorShip : inoxtag@talentweb.fr"
"d2BEL2nk3wg","JeanJass - Qu'est ce qui m'arrive","2021-02-26T11:15:14Z","UCeg0PVLfsBKFLGd9V_EvbGA","Caballero & JeanJass","10","21.01.03","caballero & jeanjass|lomepal|roméo elvis|sur mon nom|x men|high fines herbes|bruxelles arrive|cadeau|clip|qu'est ce qui m'arrive|mister v","218918","19262","166","656","https://i.ytimg.com/vi/d2BEL2nk3wg/default.jpg","False","False","🌑  Qu'est ce qui m'arrive dispo partout !http://bitd.be/jeanjass-qcqmaJEANJASSFacebook : http://www.facebook.com/JeanJassGoldmanInstagram : http://instagram.com/JeanJassTwitter : https://twitter.com/jeanjassÉcrit par JeanJassComposé par JeanJass, Vladimir Cauchemar & La MiellerieEnregistré, mixé et masterisé par Jules Fradet au Studio PlanetÉcrit et réalisé par Dario FauProduit par Maximilien Rivolet (Obvious)Directrice de production: Charlotte LancelotAvec: JeanJassMister V et Lena SimoneSoraya Rhazel, Anton Laclias, Sebastian Kasluk, Arnold Siemeni, Mustapha Razzoume, Dorian Kane, Chloé Carvalho, Tristan Jerram, Marley Dubosq, Alyssia Desmeth, Philippe Richardin, Audrey Quotori, Heather Secchy, Raphaël Lecomte Chef Opérateur: Benjamin Roux 1er assistant caméra: François Morvan2nd assistante caméra: Julia Escobar1er assistant réalisateur: David Levi2nd assistant réalisateur: Arthur Dezanneau Assistants mise en scène: Eythan Hoanna, Léa SchildbergDir cast : Marine RichardRégisseur Général: Steffy Guesnay Régisseurs: Rémi Lacour, Antoine Lancelot, Louis Schneider, Paul Oudin, Tess Mazaud,Chef électricien: Maxime Chastres Électriciens: Alexis Bonnet, Nathan Jean-François Chef machinerie: Sebastien Demarigny Machino: Grégoire Taupin Chef décorateur: Lisa Rodriguez Assistante décoration: Kim Adoniadis Styliste: Anne-Laure NicolasHabilleuse : Charlotte RodièreMaquilleuse: Anouk Haif Montage : Robin DeriaudÉtalonnage: Vincent AmorEffets Spéciaux: Robin Deriaud et Clément Milot#JEANJASS"
"WW__dUXRib8","CYBERPUNK 2077 : UN BUG DANS LA MATRICE ?","2021-02-27T11:09:53Z","UCZpJLCV3gVP8R_sc8P30VpQ","BOTCH","20","21.01.03","botch|gamebotch|voix off|cyberpunk 2077|cd projekt|keanu reeves|ps4|bugs|matrix|neo|le 5e élément|glitch|bug|sheshounet|savun|jean baptiste show|jdg","66457","9976","134","520","https://i.ytimg.com/vi/WW__dUXRib8/default.jpg","False","False","Vous avez été nombreux à nous le réclamer. Alors on vous le livre. Le Gamebotch sur Cyberpunk 2077. Bon par contre il se peut qu'il y ait quelques bugs évidemment.Soutenez nous ici (si vous voulez avoir des gamebotch plus souvent. Enfin peut être...) : https://en.tipeee.com/botch-1​Boutique Botch : https://teespring.com/stores/botch-shop​​Suivez nos aventures EX-TRA-OR-DI-NAIRES sur : https://www.instagram.com/botch_sa_me...​ https://twitter.com/botchvideos​​ https://www.facebook.com/BOTCHvideos/​​ Soutenir Botch gratuitement : https://www.utip.io/feed/botch​​ Discord :https://discord.gg/3jA8pcrNotre corbeille (chaîne secondaire) :https://www.youtube.com/channel/UCJCuDTSZmH4m2i4LN0u-gPgContact PROFESSIONNEL : botch.videos@gmail.com"
"ykIIGKVdsyc","LE DEPART DE CYRIL ABITEBOUL","2021-02-27T19:00:11Z","UCV4G8eTI0qxMbveC0rL3nkA","Depielo","2","21.01.03","renault|alpine|F1|Formula 1|formule 1|abiteboul|horner|tatouage|ricciardo|luca de meo|laurent rossi|davide brivio|alonso|ocon","95275","6343","24","190","https://i.ytimg.com/vi/ykIIGKVdsyc/default.jpg","False","False","On revient sur le départ de Cyril Abiteboul du Groupe Renault et de l'équipe Alpine de Formule 1Twitch : twitch.tv/depieloInstagram : @depielof1Twitter : @DepieloF1https://www.youtube.com/channel/UCV4G8eTI0qxMbveC0rL3nkA/join"
