video_id,title,publishedAt,channelId,channelTitle,categoryId,trending_date,tags,view_count,likes,dislikes,comment_count,thumbnail_link,comments_disabled,ratings_disabled,description
"5hdKcitAcqs","Es ist vorbei!","2021-04-04T10:00:01Z","UChr1sKJ27Fr6WZxAlusbo_w","Felix von der Laden","19","21.06.04","felixladen|dner|spielkind|vlog|2020|Felix von der Laden|Vlogdown|Roomtour|Base|Büro|wo wohnt|wo arbeit|wo ist|Ufo|Hive|Spielkind|Spielkind media|unser Office|Mein neues Büro","309783","21859","741","644","https://i.ytimg.com/vi/5hdKcitAcqs/default.jpg","False","False","Nach 2 Jahren BASE, müssen wir uns nun leider nach etwas neuem umschauen. Was die Gründe dafür sind, erzähl ich euch im heutigen Video.__________________________📸 Instagram: FelixLaden | https://instagram.com/felixladen• Mehr Vlogs: http://youtube.com/felixladen?sub_confirmation=1__________________________Meine Links:• Gaming-Kanal: http://youtube.com/dner • Spielkind Store: http://spielkind.de• Twitter: http://twitter.com/felixladen• Instagram: http://instagram.com/felixladen• Facebook: http://facebook.com/felixladen• Management: http://spielkindmedia.com• Businessanfragen: felixladen@spielkindmedia.com__________________________Mein Kamera Equipment:• Kameras:Sony A7 SIII: https://amzn.to/3deR1sfGoPro Hero 7: https://amzn.to/2S3tmyvOsmo Action: https://amzn.to/3aVpJDkRED Scarlet-W 5K: https://cvp.com/product/red_scarlet-w...• Objektive:Hauptwinkelzoom: Sony 16-35 f2.8: https://amzn.to/38Q8fX7Leichtes Tele: Zeiss Batis 85mm f1.8: https://amzn.to/2u1R2v6Schönstes Bild: Sony 24mm f1.4: https://amzn.to/2RGFPcDMega Zoom: Sony 24-240: https://amzn.to/2uLthrgProfi Tele: Canon 70-200 f2.8 IS III: https://amzn.to/2ObaJHWWeitwinkel Monster: Sigma 14mm f1.8: https://amzn.to/31izU0FFacecam Objektiv: Sigma 24mm f1.4: https://amzn.to/2GysGvTObjektiv für RED und APS-C Kameras: https://amzn.to/2GEgKsg• Mikrofone: Sony Mikrofon: https://amzn.to/2RHLO0JSennheiser AVX Funk-Ansteckmikro: https://amzn.to/2OexLO1Sennheiser AVX Funk-Handmikro: https://amzn.to/2RD5l2eSennheiser Profi Mikro: https://amzn.to/2tahanaZubehör:Drohne: https://amzn.to/2GEuhA4Gimbal: https://amzn.to/37H70JUGoPro Dome: https://amzn.to/2u5QxjHSlider: https://amzn.to/2RIiVlcSSDs: https://amzn.to/2tbStXD• Mein PC: http://bit.ly/SpielkindPC• Schnitt:Macbook 16 Zoll: https://amzn.to/316mN2texterne SSD: http://amzn.to/2uwCcHK *• Zusätzliches Equipment:externer Recorder: http://amzn.to/2uwch2P *Strom Adapter fürs Auto: http://amzn.to/2uwkGmX *Gimbal: http://amzn.to/2uwbrD5 *Saugnapfhalterung: http://amzn.to/2stFIGh *Slider: Rhino MotionStativ: http://amzn.to/2sCgocp *Wasserfeste Kamerahülle: http://amzn.to/2sBUq9x *GoPro Hand Mount: http://amzn.to/2uzloQl *softes LED Licht in der Base: http://amzn.to/2uzf4IJ *mobiles LED Licht: http://amzn.to/2sBU5U4 *Kamera Clip am Rucksack: http://amzn.to/2sBV0nw *(*) Alle amzn.to Links sind sind Amazon Affiliate Links. Werden Käufe über diese Links getätigt, erhält der Linkersteller eine Provision von Amazon. Der Preis für den Käufer (euch) ändert sich dadurch natürlich nicht. :)"
"4yANd1x6thc","WIR sind wieder da!!!","2021-04-05T16:00:02Z","UC5cbqFDRJq8OTHRWlNpthvQ","This is Us","22","21.06.04","life of pablo|einfachmarci|pablo|marci freund|Marci Pablo|schwangerschaft|verlobt|verlobung|zukunft|schwanger|Tochter|eltern|marci tochter|pablo tochter|marci kind|geburtsbericht|neuer kanal|familien|alltag|family vlog|laia|unsere Tochter ist da|this is us|team perez|erster vlog marci|erster vlog pablo|baby ist da|comeback|lange pause|marci vlog neu|endlich zurück|ostern|familie|Vlogging","26674","1635","25","86","https://i.ytimg.com/vi/4yANd1x6thc/default.jpg","False","False","#Familie #VLOG  #EndlichWIR sind endlich wieder da! Es ist viel passiert. Freuen uns endlich wieder regelmäßig euch mit durch unseren Alltag zu nehmen. Viel Spaß beim Zuschauen!Dieser Kanal wird jetzt zu unserem Family/Vlogging Kanal! Neues Video jeden Montag und Donnerstag um 18:00 Uhr.Abonnieren und die Benachrichtigungen aktivieren um keine neuen Videos zu verpassen!Danke für´s anschauen und bis zum nächsten Video!Laia, Marci, PabloLinks:Pablo: https://www.instagram.com/pabloraafael/Marci: https://www.instagram.com/marci/"
"5rkMxc7yGSk","Feeding a City in Need","2021-04-05T20:00:41Z","UCAiLfjNXkNv24uhpzUgPa6A","Beast Philanthropy","22","21.06.04","beast philanthropy|mrbeast charity|beast philanthropy channel|beast philanthropy real channel","1643234","362763","631","24718","https://i.ytimg.com/vi/5rkMxc7yGSk/default.jpg","False","False","THIS IS MY FAVORITE VIDEO EVER! Thank you so much for watching this channel and allowing us to grow this charity! :)MERCH & DONATIONS - Coming Soon!"
"XnZ4PDqAurc","Nur Beethoven hat Musik gemacht vor uns... Straight Outta Bonn mit Xatar und Samy | DASDING","2021-04-05T12:00:20Z","UC4nLJIDAzK565c5jwKV4l4w","DASDING","24","21.06.04","DASDING|Interview|Straight Outta|Deutschrap|Xatar|Samy|Köfte|Gold|Goldraub|Alles oder nix|Irak|Bonn|Beethoven|Goldmann Entertainment|Fatih Akin|Haval Bonn|Brüser Berg|Ohne Reden|Gib kein Hand|Meme|Zino|Label|Gefängnis|Xatar Film 2022|Ramin Bozorgzadeh|Ich trage Mantel|Ayran","38218","1239","36","98","https://i.ytimg.com/vi/XnZ4PDqAurc/default.jpg","False","False","Straight Outta – Jeden Montag, um 14 Uhr neue Folgen auf unserem DASDING-Kanal.#Samy #Xatar #Bonn   TRIGGERWARNUNGIn diesem Video geht es um das Thema Suizid. Wenn es dir psychisch gerade nicht gut geht oder dieses Thema dir Sorgen bereitet, dann überspringe dieses Video einfach. Falls du Hilfe brauchst, wende dich an eine Person deines Vertrauens oder an deinen Arzt oder Ärztin. Weiter unten haben wir noch Hilfsangebote für dich. 😊 Bonn ist Ex-Regierungssitz und Hometown von Beethoven. Bundesdeutsche Verantwortung, Geld und wegweisende Kultur reichen sich hier die Hand. Ein Hauch davon weht auch im Stadtteil Brüser Berg am Stadtrand, wo die beiden Freunde Samy und Xatar diese Impulse auf ihre ganz eigene Art umsetzen. Zino trifft die beiden am Hofgarten direkt an der Uni und spricht mit ihnen über ihre wilden Geschichten. Über die Anfänge von „Alles oder Nix“-Records, Tape-Verkäufen auf der Straße, den ersten Label Deal und den Aufbau von Goldmann Music mit Künstlern wie SSIO, Mero, oder Eno. Alles haben die beiden zusammen erlebt. Bei einem Ayran vor seinem Köfte-Grill erklärt Xatar wie aus einem Meme eine Geschäftsideen wurde. Anschließend geht es in den Stadtteil Brüser Berg, wo für beide alles begann. Sie mussten schon früh schauen wo das Geld herkam, da es Zuhause kaum Geld gab. Sogar das Toastbrot war knapp. Deshalb fingen die beiden unter anderem an mit Drogen zu dealen. Der Höhepunkt dieser kriminellen Unternehmungen war ein Raubüberfall, der auch den Wendepunkt im Leben von Xatar und Samy markierte. Der Gefängnisaufenthalt im Irak hat vor allem bei Samy Spuren hinterlassen. Ein wichtiges Heilmittel für ihn ist die Musik. Schon früh ist klar: Er ist der Soulman, Xatar der Rapper. Die Biografie der beiden ist der Stoff, von dem sich die deutsche Rap-Welt ernährt. 2022 bringt Fatih Akin genau diese Geschichte ins Kino. _______________ HILFSANGEBOTE: Hast du Suizidgedanken? Beschäftigt dich ein Trauerfall in der Familie oder im Freundeskreis? Brauchst du Hilfe? Es ist wichtig, dass du mit Familie, Freunden oder Bekannten darüber sprichst. Du kannst dich auch an folgende professionelle Beratungsstellen wenden: Bei der Telefonseelsorge kannst du rund um die Uhr anrufen und deine Sorgen und Gedanken anonym mit jemandem teilen: 0800- 1110111https://www.telefonseelsorge.de/​Die Nummer gegen Kummer richtet sich ganz besonders an Jugendliche. Auch dort findest du rund um die Uhr und anonym ein offenes Ohr: 0800-116111 https://www.nummergegenkummer.de/​ ---- Abonnieren und Glocke anmachen nicht vergessen! Schreibt uns in die Kommentare, wen Zino unbedingt auch noch treffen soll?#Samy #Xatar #Bonn   Host: ZinoAutor: Philipp Jöster Schnitt: Lena AllgeierKamera: Christian Lache, Pascal FieselerTon: David Czarnetzki ------ Straight Outta… ist eine Produktion von Signed Media Produktion GmbH & Co. KG https://www.signed-media.com/Musik aus dem Video:XATAR - IZ DA ► Beat by ENGINEARZ, XATAR & REAFhttps://www.youtube.com/watch?v=60pc_H4GlJ4XATAR x SSIO Hrrr (Official Video)https://www.youtube.com/watch?v=188b9KtrIFMXATAR - § 31 (Paragraph 31) official videohttps://www.youtube.com/watch?v=Zye3-1rsFUUSAMY feat. XATAR - STÖDÖF (Official Video)https://www.youtube.com/watch?v=gamgfh5dJyESAMY feat. SCHWESTA EWA - Sie Wartet (Official Video)https://www.youtube.com/watch?v=Cyg_5jGb8fsSAMY - MANN IM HAUS (Official Video)https://www.youtube.com/watch?v=h82jt7J3kasXATAR feat SAMY Ich will hier nicht weghttps://www.youtube.com/watch?v=g92VLNx2CpsSAMY feat. OLEXESH - Ein letztes Mal(Remix) (Official Video)https://www.youtube.com/watch?v=gpYIdyWSb1sKöfte Spieß Xatar [ Original ]https://www.youtube.com/watch?v=yJcIchmaXqkXATAR & SAMY ► Legendäres Interview von Rheinkultur 2009!https://www.youtube.com/watch?v=m-T56LMjgxE___♪ Instagram: https://www.instagram.com/DASDING ♪ Homepage: http://www.dasding.de♪ Facebook: https://facebook.com/DASDING♪ TikTok: @dasding___DASDING ist das junge Programm des SWR und auf unserem Musik-YouTube-Kanal treffen wir für euch die Stars, die ihr im Radio hört, zu denen ihr auf Festivals abgeht, die ihr auf YouTube oder in eurer Lieblingsserie binge-watched!Abonnieren und Glocke anmachen nicht vergessen!Schreibt uns in die Kommentare, wen ihr gerne als nächstes im Interview sehen möchtet. :)"
"XXjXtuWKn3o","I'm Moving Away... (not a prank)","2021-04-05T02:15:14Z","UCwVg9btOceLQuNCdoQk9CXg","Ben Azelart","24","21.06.04","ben azelart|brent rivera|Lexi rivera|stokes twins|ben Azelart girlfriend|Lexi rivera boyfriend|mylifeaseva|lexi hensler|Andrew davila|pierson|Pierson wodzynski|Jeremy hutchins|dom brack|Brent and pierson|im moving|our new house|my new house|house tour|2021|sad|emotional|Ben Azelart dares|stunts|team rar|Carter sharer","3997816","462929","4921","140036","https://i.ytimg.com/vi/XXjXtuWKn3o/default.jpg","False","False","I'm moving away and broke the news to my friends...GET THE MERCH! https://staywildshop.comDon't forget to SUBSCRIBE to my channel for NEW videos every weekend!! Also, make sure to LIKE this video if you enjoyed it! Turn my POST NOTIFICATIONS on to get notified whenever I post! I love you guys and thanks for watching!INTRO SONG: Ace Of Spades By Yugohttps://distrokid.com/hyperfollow/yugo5/ace-of-spadesSubscribe to Bailey! (stunt double) @Bailey PayneSubscribe to my friends!@Stokes Twins@Alexa Rivera@Brent Rivera@Pierson@Lexi Hensler@Paris Rosenbaum@Jeremy Hutchins@Dom Brack@Andrew Davila@Derek Days☆ Follow Me On All Social Media!INSTAGRAM: @BenAzelart https://www.instagram.com/benazelart/TWITTER: @BenAzelart https://twitter.com/benazelartYOUTUBE: Ben Azelart https://www.youtube.com/benazelart/SNAPCHAT: @BenAzelartI have all rights to use this audio in this video according to Final Cut Pro's/YouTube's terms of use."
"rb_moqRWI3k","ACHTUNG: UNPOPULÄRE CRYPTO MEINUNG ZU Q2 2021","2021-04-05T11:56:13Z","UCseNUrq7mUUWqTspr4QJ9eg","Dr. Julian Hosp - Bitcoin, Aktien, Gold und Co.","28","21.06.04","Bitcoin|altcoins kaufen|kryptowährung|kryptowährungen handeln|crypto|cryptofit|#cryptofit|krypto news|Bitcoin 2021|Dr. Julian Hosp|Julian Hosp Bitcoin|Cake DeFi|Bitcoin kaufen|Julian Hosp|dr julian hosp|julian hosp|bitcoin news|hosp julian|bitcoin julian hosp|krypto april 2021|bitcoin kaufen|krypto 2021|kryptowährung kaufen|hosp bitcoin|ethereum deutsch|bitcoin aktuell|julian hosp defi","62430","3924","125","788","https://i.ytimg.com/vi/rb_moqRWI3k/default.jpg","False","False","ACHTUNG: UNPOPULÄRE CRYPTO MEINUNG ZU Q2 2021! Für mich wird es Zeit umzuschichten in Coins mit wirklichem Wert! Diese sind:Bitcoin & Ethereum: https://www.binance.com/?ref=11272739 *DeFiChain hier: https://trade.kucoin.com/DFI-USDTStake DeFiChain hier und bekomme 37% APY aufs Jahr: http://app.cakedefi.com/► Hier kannst du bitcoins kaufen und bekommst auch gleich bis zu 10% pro Jahr Zinsen: https://cakedefi.com/ ► Alles rund um DeFiChain (DFI): https://www.youtube.com/c/DeFiChain/featured?sub_confirmation=1► Alles rund um Cake DeFi https://www.youtube.com/c/CakeDeFi/featured?sub_confirmation=100:00 Intro02:10 Meine Frage an dich...05:20 Die Auflösung...06:44 Meine andere Meinung!10:00 Das mache ich jetzt!18:45 Weitere spannende Videos——————Hat dir das Video gefallen? Gib mir nen DAUMEN HOCH 👍 bzw. TEILE dieses Video um gemeinsam AT, DE und CH #cryptofit zu machen!#JulianHosp #Bitcoin #Blockchain 👌  Kein Video mehr verpassen? ABONNIERE meinen Kanal: https://www.youtube.com/channel/UCseNUrq7mUUWqTspr4QJ9eg?sub_confirmation=1   UND klicke die GLOCKE 🔔 - WICHTIG!⏰  E-MAIL ERINNERUNG beim nächsten Video erhalten: https://i-unlimited.de/youtube——————❓ Welcher Kryptoinvestor Typ bist du? Das Cryptofit Quiz: https://bit.ly/cryptoquiz_yt 🔗  Hole dir kostenlos die ultimative Linkliste zum Durchstarten - verifiziert von Julian & #cryptofit: https://www.cryptofit.de/links ——————📚  EINSTEIGER - KRYPTO BUCHEMPFEHLUNGEN 📚📕  #Kryptowährungen einfach erklärt: http://geni.us/krypto_einfach 📗  #Blockchain 2.0 - mehr als #Bitcoin: http://geni.us/blockchain_einfach 📘  In 5 einfachen Schritten Bitcoin Kaufen: https://www.cryptofit.de/wie-kauft-man-bitcoin/ ——————🤫  ADVANCED 🤫🧨  Falls du bereits ein High Networth Individual (mehr als 1 Mio Euro Kapital) bist, oder ein solcher werden willst, dann bewirb dich für unsere exklusive Crypto Mastermind: https://products.cryptofit.de/ic 🔮  Der perfekte Schutz vor Inflation UND Deflation: Cashflow aus Bitcoin und anderen Kryptowährungen mit kompletter Transparenz Cake DeFi: https://pool.cakedefi.com ——————⭐️  ICH NUTZE SELBST DIESE SERVICES ⭐️💥  BTC kaufen am besten hier: http://bit.ly/exchange_promo *🔒  Danach diese Hardwallet nutzen: http://www.julianhosp.com/hardwallet *📊  Diese #Exchange nütze ich für #Altcoins: https://www.binance.com/?ref=11272739 *——————🙋‍♂️  CRYPTOFIT COMMUNITY 🙋‍♂️👉  Unsere Facebook-Gruppe: https://www.facebook.com/groups/kryptoganzeinfach/ 👉  Unser #cryptofit Shop: https://shop.spreadshirt.de/cryptofit 👉  Die Kryptoshow (Spotify): https://open.spotify.com/show/3FqYrO3r7aLvTsmZxAy4NY?si=69kiFac6Qkq8EVTnEfzg9g👉 iTunes: https://podcasts.apple.com/de/podcast/die-krypto-show-blockchain-bitcoin-und-kryptow%C3%A4hrungen/id1226276280 —————💼  Meine Webseite: https://julianhosp.com/ 💼📩  Business Kontakt: Team@julianhosp.com 📩🔥  Folge mir hier und bleibe in Kontakt 🔥👉  Twitter: https://twitter.com/julianhosp 👉  Facebook: https://www.facebook.com/julianhosp/ 👉  Instagram: https://www.instagram.com/julianhosp/ 👉  LinkedIn: https://www.linkedin.com/in/julianhosp/ 👉  Xing: https://www.xing.com/profile/Julian_Hosp/ #JulianhospDie mit Sternchen (*) gekennzeichneten Verweise sind sogenannte Provision-Links. Wenn du auf so einen Verweislink klickst und über diesen Link einkaufst, bekomme ich von deinem Einkauf eine Provision. Für dich verändert sich der Preis nichtDisclaimer: Dies ist keine Investmentempfehlung. Wie bei jeder Investition ist dein Kapital gefährdet und die Rendite ist nicht garantiert. Bevor du dich für eine Investition entscheidest, ließ bitte unsere Risikoerklärung oder wende dich gegebenenfalls an einen Finanzberater"
"OVIweEyq2UQ","Ich teste EURE LIEBSTEN DROGERIE Neuheiten!","2021-04-04T09:30:01Z","UC9VCyVOqou6wf-BMBYlEkjQ","Kim Lianne","26","21.06.04","kim|lianne|dm haul live|dm haul kim lianne|dm neuheiten|dm neuheiten 2021|dm neuheiten live test|kim vloggt|Wir kriegen NACHWUCHS! & ATTACKE mit KAKTUS-Stacheln…|Ich gehe SHOPPEN zum 1.MAL seit 2019!!|Werbung vs. Realität: EURE viralen BEAUTY NEUHEITEN testen!|Ich kaufe 24(!) FISCHE & ein AQUARIUM! Einrichten|Pflanzen einsetzen|Eure CRAZY FOOD MASCHINEN & TikTok Snacks testen!|Ich teste PERIODEN UNTERWÄSCHE zum Waschen. *PMS with me*","318577","24993","219","1446","https://i.ytimg.com/vi/OVIweEyq2UQ/default.jpg","False","False","↬ NEUER VLOG aufm 2. KANAL: https://www.youtube.com/watch?v=OTvSaPUh8aM↬ MEINE KLAMOTTEN*: http://kimlianne.com↬ Mein SCHMUCK-SHOP*: http://www.itscult.com/shop/↬ INSTAGRAM & TikTok: @kimlianne Müller, DM, BIPA, etc. Haul im April & Mai 2021! Ich teste eure meist eingeschickten Drogerie Favoriten & Neuheiten im live Test - das Gegenstück zu euren Hass-Produkten quasi. Sehr spannend, was ihr für Lieblings-Produkte habt. :D-----↬ ICH TRAGE im VIDEO:HALSKETTE (aus echtem Silber, vergoldet) aus MEINEM SHOP*: http://www.itscult.com/shop/OHRSTECKER (aus echtem Silber) bald in MEINEM SHOP*: http://www.itscult.com/shop/Alle RINGE aus meinem SHOP*: http://www.itscult.com/shop/----Wer liest die Infobox? Zeig es mir, indem wir andere Zuschauer PRANKEN. :D Schreib einfach mal zur Verwirrung der Unwissenden DAS hier in die Kommentare: -Wieso war deine Haut nach der Anwendung grün verfärbt? 😱-Ich freue mich schon auf die Leute, die nicht Teil unseres kleinen Infobox-Clubs sind & nichts ahnend verwirrt nachfragen, was gemeint ist?! *pranked* HAHAHA----↬ Mein ONLINE-SHOP:*Hier: http://www.itscult.com/shop/Folge für GUTSCHEIN-CODES & Updates itsCult auf INSTAGRAM: @itsCultFolge für GUTSCHEIN-Codes & Updates itsCult auf FACEBOOK: https://www.facebook.com/ItsCult↑ Auf den beiden Plattformen werde ich regelmäßig Updates zu den Collectionen & Rabatt-Codes posten!-----↬ VORHERIGES VIDEO IN DER ENDCARD:Werbung vs. Realität: EURE viralen BEAUTY NEUHEITEN testen!: https://www.youtube.com/watch?v=jFdp_mA1b2YMICH GRATIS ABONNIEREN: http://goo.gl/N5YEGq----↬ WEITERE VIDEOS:Werbung vs. Realität: EURE viralen BEAUTY NEUHEITEN testen!: https://www.youtube.com/watch?v=jFdp_mA1b2YIch teste ne Home-Spa Landschaft mit Amazon Wellness Produkten: https://bit.ly/3ggWBsTWerbung vs Realität: Kranke Beauty Neuheiten ab 1€ | Wish: https://bit.ly/2z8KEocGruseligster PRANK aller Zeiten an Stevie: https://bit.ly/3992SmDNur REDUZIERTES ESSEN für 24 Stunden..: https://bit.ly/2R2HJ7lWir stellen INSTAGRAM BILDER von YouTubern nach: https://bit.ly/31Hgr9eIch drucke 3D GESICHTSMASKEN aus ESSEN & DRINKS!: https://bit.ly/2WwYcUINur DURCHSICHTIGES ESSEN für 24 Stunden..: https://bit.ly/2Vsk97rIch teste DM NEUHEITEN die ihr HASST!: https://bit.ly/2WmI5poWerbung vs. Realität: Kranke DM NEUHEITEN im live Test: https://bit.ly/2CV01At----#KimLianneLiveTest #EureDMFavoriten #KimLiCrew* (Eigen) Werbung für meinen Shop' Die mit ' gekennzeichneten Links sind Affiliate-Links die ich freiwillig einfüge, da ich persönlich die Produkte empfehlen kann, hier kriege ich ein paar Cent des Verkaufspreises, du zahlst aber genau so viel wie sonst auch.In diesem Video findet keinerlei Marken-Kooperation statt."
"RMICU-iAWjc","Gurkensohn - Opel Corsa (Official Video)","2021-04-04T17:08:20Z","UCgSt0pAnRuPyK537sbtX0fA","Gurkensohn","10","21.06.04","gurkensohn|opel|corsa|official|video|musik|music|2021|trend|opel corsa|song|youtube|trends|neu|deutschland|official video|official music video|official audio|music video|offical video|(Official Video)|offiziell|new|capital bra|4k video|official music|official song|musik 2021|songs|rap musik|neuer song|trends 2021|musik video|neuer trend|video official","126593","15171","1665","2404","https://i.ytimg.com/vi/RMICU-iAWjc/default.jpg","False","False","JETZT STREAMEN: https://spoti.fi/3fKEKwHMein Instagram ↔ https://www.instagram.com/gurkensohnyt/?hl=deMein Snapchat ↔ gurkensohnytMein TikTok ↔ https://vm.tiktok.com/ZMe8QtQ9k/Kameramann/Regie/Color Grading/ Schnitt by. J.Paul ↔  https://linktr.ee/jaypauloffiziellDie Frau an der Kamera 2 ↔ https://bit.ly/2R5J2VdVertonung Max Meadow & J.Paul ↔ https://bit.ly/3dLeGPFDrohne Willi ↔ https://bit.ly/3unXQNpMix/Mastering Nrgee ↔ https://bit.ly/3upY0UxGurkensohn - Opel Corsa (Official Video)Dies hier ist mein Official neuer Song. Ich hoffe die Musik und das Video gefallen euch. Es ist mal was anderes als typische Rap Musik. Opel Corsa ist schon längst zum Trend in Deutschland geworden. Lasst uns die YouTube Trends 2021 stürmen und zeigen wie stark die Gurkenarmy ist! Mero, Capital Bra und Samra können einpacken! Hier kommt Gurkensohn! #Official​ #Gurkensohn Kontakt: gurkensohn.youtube@web.deAlte Official Songs auf YouTube von mir: Gurkensohn - Ich bin Grün (Official Video)https://www.youtube.com/watch?v=31IXkbT5XzsGurkensohn - Die Gurke meines Lebens (Official Video)https://www.youtube.com/watch?v=b1o7iH__ytIGurkensohn - I Love You Jasmin Ritter (Official Video)https://www.youtube.com/watch?v=qniH_St4Jnw"
"BNWM-cZhqLU","GIMS x DADJU x SLIMANE - Belle (Clip Officiel)","2021-04-05T15:00:15Z","UCCB1Byx5yTbLpQaV-rlfmtA","GIMS","10","21.06.04","gims|clip officiel|clip|sapés comme jamais|vianney|gims album|gims stade de france|gims maluma|gims brisé|gims miami vice|stade de france|gims vianney|gims bella|gims senorita|gims tout donner|belle|gims dadju slimane|gims belle|belle clip","1392560","79371","2074","4908","https://i.ytimg.com/vi/BNWM-cZhqLU/default.jpg","False","False","#BELLE ⚔️👑⚔️Maintenant disponible ➡ https://gims.s-ib.link/belle​----------------------------------------------------------------------Facebook : https://www.facebook.com/maitregimsoffInstagram : https://instagram.com/gimsTwitter : https://twitter.com/gimsSnapchat : Warano75----------------------------------------------------------------------INDIFFERENCE PROD :https://www.instagram.com/indifferenceprod.comhttps://www.facebook.com/Indifferenceprod.com-----------------------------------------------------------------Abonne-toi à la chaîne : http://bit.ly/2q6P6Ni​"
"RQxfI_NzMn8","I TRADED SAND FOR A TESLA! #shorts","2021-04-03T00:34:17Z","UCjPYYvIdTqn9U52p9IxJ72Q","Isaiah Photo","24","21.06.04","tesla|tesla model s|elon musk|tesla car|trading|sand|trading sand|trading up|isaiah photo|isaiah photo tesla|isaiah photo shorts|isaiahphoto|tiktok|isaiahphoto tiktok","977650","87481","1332","655","https://i.ytimg.com/vi/RQxfI_NzMn8/default.jpg","False","False","#shorts I finally did it! Now it's time to find Elon...Sub to @Harrison Nevel He's the GOAT!----------------------------------------------------------------► FOLLOW THESE!• Twitter - https://twitter.com/isaiahphoto• Instagram - https://www.instagram.com/isaiahphoto• TikTok - https://www.tiktok.com/@isaiahphoto--------------------------------------------------------------------"
"YtF1t8AeSEo","tagesschau 20:00 Uhr, 05.04.2021","2021-04-05T18:31:08Z","UC5NOEUbkLheQcaaRldYW5GA","tagesschau","25","21.06.04","[none]","231692","2521","517","1705","https://i.ytimg.com/vi/YtF1t8AeSEo/default.jpg","False","False","Themen der Sendung: 0:00 Guten Abend!0:22 CDU-Chef Laschet plädiert für Verschärfung der Corona-Maßnahmen und vorgezogene Bund-Länder-Beratungen2:45 Kultusministerkonferenz und Lehrerverbände wollen an Abiturprüfungen unter sicheren Bedingungen festhalten3:14 Modellprojekte und einzelne Regionen mit niedrigen Inzidenzwerten testen versuchsweise Öffnung von Gastronomie-Betrieben5:13 Tausende Menschen für Frieden und Abrüstung bei traditionellen Ostermärschen auf den Straßen7:06 Portugal lockert weitere Corona-Beschränkungen7:35 Staatsanwaltschaft wirft Israels Regierungschef Netanyahu Machtmissbrauch vor8:04 Russlands Präsident Putin unterzeichnet Gesetz über mögliche Verlängerung seiner Amtszeit8:34 EU-Außenbeauftragter Borrell äußert Besorgnis über russische Truppenbewegungen an Grenze zur Ostukraine10:52 Europäische Häfen bereiten sich auf hohen Andrang nach Auflösung der Blockade im Suez-Kanal vor13:07 Parlamentswahl in Bulgarien ohne klare Mehrheit13:45 Gefahr einer Umweltkatastrophe durch Leck in Abwasserbecken eines stillgelegten Düngemittelwerks in Florida14:15 Das Wetter"
"ayXxwJJId_c","I Bought The World's Largest Mystery Box! ($500,000)","2021-04-03T20:00:01Z","UCX6OQ3DkcsbYNE6H8uQQuVA","MrBeast","24","21.06.04","[none]","28692451","1854632","17322","124466","https://i.ytimg.com/vi/ayXxwJJId_c/default.jpg","False","False","I cant believe I spent over $500,000 on mystery boxesAdd Honey for FREE ▸ http://joinhoney.com/mrbeastThanks to Honey for making this video possible!New Merch - https://shopmrbeast.com/SUBSCRIBE OR I TAKE YOUR DOG╔═╦╗╔╦╗╔═╦═╦╦╦╦╗╔═╗║╚╣║║║╚╣╚╣╔╣╔╣║╚╣═╣ ╠╗║╚╝║║╠╗║╚╣║║║║║═╣╚═╩══╩═╩═╩═╩╝╚╩═╩═╝----------------------------------------------------------------follow all of these or i will kick you• Facebook - https://www.facebook.com/MrBeast6000/• Twitter - https://twitter.com/MrBeast•  Instagram - https://www.instagram.com/mrbeast--------------------------------------------------------------------"
