video_id,title,publishedAt,channelId,channelTitle,categoryId,trending_date,tags,view_count,likes,dislikes,comment_count,thumbnail_link,comments_disabled,ratings_disabled,description
"zFT3f9biz68","BTS (방탄소년단) 'Film out' Official MV","2021-04-01T15:00:09Z","UC3IZKseVpdzPSBaWxBxundA","HYBE LABELS","10","21.06.04","BIGHIT|빅히트|방탄소년단|BTS|BANGTAN|방탄","60113574","6747521","49077","2045796","https://i.ytimg.com/vi/zFT3f9biz68/default.jpg","False","False","BTS (방탄소년단) 'Film out' Official MVSong Credits:Produced by back number, UTA for TinyVoice, Production(Iyori Shimizu from back number, JUNG KOOK)Music Video Credits:Director: Yong Seok Choi (Lumpens)1st AD: Jihye Yoon (Lumpens)2nd AD: Ran Ro (Lumpens)PA: Chanyang Kim, Soeyoung ParkDirector of Photography: EumkoFocus Puller: Sangwoo Yun2nd AC: Youngwoo Lee, Eunil Lee3rd AC: Yuntae KoGaffer: Choi Doo Soo (DS LIGHT)Lighting Crew: Heo Jung Hwan, Jung Yu Jin, Lee Seong Min, Lee Sang Jun, Lee Gun, La haeArt Director: Bona Kim, Jinsil Park (MU:E)Assistant Art team: Yeri Kang, Minjung Kim (MU:E)Art-team Manager: ilho Heo (MU:E)Key Grip: Kiheon ChoiBestboy: Sungeun KimGrip: Hobin Kang , Hyunsuk JoTechno Crane : SeviceVision KoreaTaehyun Choi , Yonggeun Hwang , Jisoo Woo , Hakseo Kim , Jaewon JungJimmy Jib Operator: Youngjung KimJimmy Jib Assistant: Hyunin Kim , Sunghoon Kim , Yunhyun KimVFX: PLASTIC BEACHVFX Supervisor: OHZEONVFX Assistant Supervisor: JOJEEMVFX Project Manager: Song Chanyoung, Jeong JieunVFX Producer: Jang Kyutae, Ahn Sohyun3D Artist: Lee Kwangwon, Kim Doyeon, Lee Jeonghwa, Jeon Jiwon2D Artist: Jang Gihoon, Lee Hyunjun, Shin HyeunsungFX Artist: We JungInVisual Creative: Nu Kim, Lee Sun Kyoung, Kang Ju Eun, Kim Ga Eun, Kim Hyo Won, Cha Yeon HwaArtist Management: Kim Shin Gyu, Jang Jin Gu, Kim Su Bin, An Da Sol, Park Jun Tae, Yun Taewoong, Lee Seung Byung, Lee Jung Min, Lee Hyeon KiBIGHIT MUSIC. Rights are reserved selectively in the video. Unauthorized reproduction is a violation of applicable laws. Manufactured by BIGHIT MUSIC, Seoul, Korea.Connect with BTS: https://ibighit.com/bts​ https://bts-official.jphttp://twitter.com/BTS_bighit​http://twitter.com/BTS_twt​ http://twitter.com/BTS_jp_officialhttp://www.facebook.com/bangtan.official​ https://www.youtube.com/user/BANGTANTV​ http://instagram.com/BTS.bighitofficial​ https://channels.vlive.tv/FE619​ https://www.tiktok.com/@bts_official_bighithttps://weverse.onelink.me/qt3S/94808190​https://www.weibo.com/BTSbighit​https://www.weibo.com/BTSmembers​ http://i.youku.com/btsofficial​ http://btsblog.ibighit.com​https://bts-officialshop.jp/#BTS​​ #방탄소년단​​ #Filmout​ #BTSTHEBEST​"
"MHoJeVkehyQ","17 Jahre Groll auf EA, ich muss noch einmal darüber sprechen... Der Held am Freitagabend","2021-04-02T16:01:56Z","UCUcuCA0XD_dnZromsXOsMyg","Der Held","24","21.06.04","[none]","202470","10788","305","1595","https://i.ytimg.com/vi/MHoJeVkehyQ/default.jpg","False","False","Welt, willkommen beim Helden!Kurz zu mir:Einige von Euch kennen mich vielleicht aus meinem Held der Steine-Kanal, den ich als kleiner Held, jung und den Kopf voll Träumereien, in Frankfurt gründete. Seit vielen Jahren versuche ich dort die Welt der Bausteine zu sortieren, das entdeckte Wissen zu teilen und Euch in ruhigen Momenten auch zu unterhalten.Nun finde ich immer wieder ein wenig freie Zeit und diese möchte ich natürlich mit Euch verbringen. Wir werden unentdeckte Welten erforschen, Abenteuer bestehen und manchmal erzähle ich einen Schwank aus meiner Jugend.Ich wünsche Euch viel Freude & eine tolle Zeit!Hier gibt's die netten Tassen*:http://bit.ly/Bausteinecke-HdSTasse...und hier die weiteren Kanäle & Infoshttps://www.held-der-steine.dehttps://www.instagram.com/helddersteinehttps://www.twitch.tv/held_der_steineThomas Panke069-95863972Laubestr. 2660594 Frankfurt am Main*Die Links sind Affiliate-Links. Die Angebote stammen nicht von mir, allerdings erhalte ich durch den Verweis eine Provision, wenn dann ein Kauf stattfindet, jedoch ohne dass Euch zusätzliche Kosten entstehen.Wenn Ihr klickt und kauft: vielen Dank! :)"
"mfNEzpjY2Ho","Lockdown im Wunderland #10 - HIGH NOON - Die letzten Vorbereitungen des VERRÜCKTESTEN WELTREKORDS #2","2021-04-04T07:00:20Z","UC99kO6xDZSh2UNA-jdpN7cA","Miniatur Wunderland","2","21.06.04","MiWuLaTV|hamburg|miniature|germany|behind the scenes|tutorial|model building|tips|tools|documentary|model railway|jp performance|guinness world record|diy|do it yourself|toys|märklin|faller|roco|Fleischmann|rivarossi|knuffingen airport|miniature|speicherstadt|lego technic|lego|behind the scenes|attraction|miwula|railroad|railway|modellbau|model building|sehenswürdigkeit|disney world|Disneyland|europapark","172282","13147","97","691","https://i.ytimg.com/vi/mfNEzpjY2Ho/default.jpg","False","False","Wir nutzen den Lockdown für Projekte, die wir schon immer umsetzen wollten, wenn keine Besucher da sind. Diese Woche haben wir den Weltrekord gebrochen. Eine Lok fährt 220 Meter Gleis durch das gesamte Wunderland, schlägt mehrere Tausend Gläser an, und spielt dabei ein Medley aus bekannten klassischen Songs. Morgen, Montag, den 05.04.2021 könnt ihr den Weltrekord um 9 Uhr sehen. Außerdem wartet, unserer Elektroniker Stefan, den Knopfdrücker in Kiruna, das Förderband des Bergwerk.Lass einen Like da, wenn es Dir gefallen hat und drück den Abonnieren-Button, wenn Du mehr von uns sehen möchtest. Du findest Du noch ganz viel über das Wunderland hier: Homepage: http://www.miniatur-wunderland.deFacebook: https://www.facebook.com/MiniaturWunderlandHamburg Instagram: https://www.instagram.com/miniaturwunderlandTwitter: https://twitter.com/MiWuLaFalls Du uns besuchen möchtest:Tickets für eine unvergessliche Reise: https://www.miniatur-wunderland.de/besuch/ticketsMehr über unsere Technik erfährst Du bei unseren spannenden Führungen: https://www.miniatur-wunderland.de/besuchen/wunderland-vor-ort/fuehrungen Highlight sind unsere Abendveranstaltungen, wie z. B. die Kulinarische Weltreise mit passenden Gerichten zu allen Nationen im Wunderland: https://www.miniatur-wunderland.de/besuchen/veranstaltungen"
"d6zxNcOCD8s","Das Gedanken-Experiment um Maxwells Dämon","2021-04-02T13:00:30Z","UCEJDM_70A2EiRqZ41l6bZlg","100SekundenPhysik","28","21.06.04","Physik|Wissenschaft|Technik|Science-Fiction","259958","32226","154","933","https://i.ytimg.com/vi/d6zxNcOCD8s/default.jpg","False","False","►Zum Hörbuch: http://Delphin.100SekundenPhysik.de►Alle Videos: http://bit.ly/1fa7Tw3✚Snapchat: SekundenPhysik✚Facebook: http://on.fb.me/YJFlNt✚Abonnieren: http://bit.ly/10jgdi2100SekundenPhysik: das ist Wissenschaft in einfacher, knapper und unterhaltsamer Form."
"F5NBfztNR2o","Kevin Jenewein - Hurricane (Official Audio)","2021-04-02T08:00:03Z","UCorI9V6adKvuIYE7ey9HPQQ","Digster Pop","10","21.06.04","Kevin Jenewein|Hurricane|Official Audio|Kevin Jenewein Hurricane|Pop|DSDS|kevin dsds|Finalist|Singen|Hold Me|Finale|Dieter Bohlen|Starian Dwayne McCoy|Kevin Jenewein DSDS|kevin Hurricane|Jan Marten Block|Never Not Try|Karl Jeroboan|Where We Were|Mike Singer|Maite Kelly|Thomas Gottschalk|Deutschland sucht den Superstar","245952","10316","279","676","https://i.ytimg.com/vi/F5NBfztNR2o/default.jpg","False","False","Alle Infos zu Kevin Jenewein und seiner brandneuen Single „Hurricane“ findet ihr hier: https://umg.lnk.to/Kevin-HurricaneDas offizielle Audio-Video zu „Hurricane“ von dem DSDS Finalist 2021 Kevin Jenewein!+++Folgt Kevin Jenewein im Netz+++ ►Instagram: https://www.instagram.com/kevin.jenewein_official/Folgt Digster Pop:❤ Kanal abonnieren: http://bitly.com/YTDigsterPop❤ ➔ Instagram | https://www.instagram.com/digster_pop/❤➔ TikTok | https://www.tiktok.com/@digsterpopstories❤➔ Digster Pop Playlist | https://digster.lnk.to/digster_pop😍 Entdecke unseren neuen Kanal: Digster Pop Stories - http://bit.ly/YTDigsterPopStories„Hurricane“I found somebody to save me from drowningWhen we walk through hell it feels like HeavenI Never let you goI found somebodyTo keep me warm But don’t you be afraidWhen the wind is howling You’re The one I wanna holdI’ll take you through the thunderAnd through troubled watersAnd I’ll hold you closerThrough the stormWhen we sail through the Tsunami I’d cross a Hurricane for you I know you need somebodyTo keep you safe and warmAnd I give you strength whenYour knees are shaking And when we‘re grey and oldOur story will be toldI’ll take you through the thunderAnd through troubled watersAnd I’ll hold you closerThrough the storm When we sail through the TsunamiI’d cross a Hurricane for you We made a million melodiesFilled with broken memoriesWe made it Together we made itWe’ve come across some tragediesThey can’t take you away from me we made it -together we made itI’ll take you through the thunderAnd through troubled watersAnd I’ll hold you closerThrough the storm When we sail through the Tsunami I’d cross a Hurricane for you#DigsterPop #KevinJenewein #Hurricane"
"N4lpKuBPnaU","Starian Dwayne McCoy - Hold Me (Official Audio)","2021-04-02T08:00:04Z","UCorI9V6adKvuIYE7ey9HPQQ","Digster Pop","10","21.06.04","Starian Dwayne McCoy|Hold Me|Official Audio|Starian DSDS|Starian Hold Me|Pop|DSDS|Finalist|Singen|Finale|Dieter Bohlen|DSDS Starian Dwayne McCoy|Hold Me Starian|Kevin Jenewein|Hurricane|Jan Marten Block|Never Not Try|Karl Jeroboan|Where We Were|Mike Singer|Maite Kelly|Thomas Gottschalk|Deutschland sucht den Superstar","226014","11985","166","789","https://i.ytimg.com/vi/N4lpKuBPnaU/default.jpg","False","False","Alle Infos zu Starian Dwayne McCoy und seiner brandneuen Single „Hold Me“ findet ihr hier: https://umg.lnk.to/Starian-HoldMeDas offizielle Audio-Video zu „Hold Me“ von dem DSDS Finalist 2021 Starian Dwayne McCoy!+++Folgt Starian Dwayne McCoy im Netz+++ ►Instagram: https://www.instagram.com/stariann/►TikTok: https://www.tiktok.com/@stariannFolgt Digster Pop:❤ Kanal abonnieren: http://bitly.com/YTDigsterPop❤ ➔ Instagram | https://www.instagram.com/digster_pop/❤➔ TikTok | https://www.tiktok.com/@digsterpopstories❤➔ Digster Pop Playlist | https://digster.lnk.to/digster_pop😍 Entdecke unseren neuen Kanal: Digster Pop Stories - http://bit.ly/YTDigsterPopStories„Hold Me“Oh I feel lonely Please can you hold meI need a light in the darkPlease light up my heartplease can you show mehow to be lovely sometimes it’s hard to be strong,i can’t face it alone, noYeah I crawled through the dirt I was lost I was hurt oh loveI run alone through the night I was searching a light in the dark when I need to get up  I get stuck in the mud I do all this time I was lost seems I wasted my love Please can you hold meI feel so lonelyI need a light in the darkPlease light up my heart Please can you show me how to be lovely sometimes it’s hard to be strong,i can’t face it alone, no Uh 4*say is there someone who cares about me at all? give me your hand baby please I don’t want to fall everything seems to be fallen, fallen apart I just want hold you and kiss you and give you my lovePlease can you hold meI feel so lonely I need a light in the darkPlease light up my heart Please can you show me how to be lovely sometimes it’s hard to be strong,i can’t face it alone, no Please can you hold me 4*Cause I feel so Lonely#DigsterPop #StarianDwayneMcCoy #HoldMe"
"9wvzFOcwI40","Minecraft’s Surgery Mod is actually funny…","2021-04-02T18:04:00Z","UC5p_l5ZeB_wGjO_yDXwiqvw","TommyInnit","20","21.06.04","tommyinnit|minecraft|mine craft|dream|dream minecraft|funny|minecraft funny|funniest minecraft video|minecraft manhunt|minecraft speedrunner vs hunter|minecraft speedrunner|minecraft speedrun|minecraft challenge|challenge|minecraft but|wilbur soot|slimecicle|philza|dream war|dream smp|surgery mod|morph mod|shapeshift|fun|minecraft mod|modded minecraft|Minecraft’s Surgery Mod is actually funny…","7115406","527353","5546","32847","https://i.ytimg.com/vi/9wvzFOcwI40/default.jpg","False","False","Today TommyInnit, Wilbur Soot, Philza & Slimecicle have lots of fun with the Surgery Mod in Minecraft. It was properly mental.PLEASE WATCH MY STREAMS - https://www.twitch.tv/tommyinnit Edited by Tommy + Elodie :o (@elodiegif on twitter)@Wilbur Soot @Slimecicle @Ph1LzA Follow my Twitter - @tommyinnitFollow my Instagram - @tommyinnittToday Me, Wilbur Soot, Slimecicle, & Philza Minecraft install the Surgery Mod in Minecraft 1.16.4! Even though I had a Minecraft War with Dream on the Dream Team SMP Minecraft Server today Wilbur Soot went crazy and he is just hilarious and we had lots of laughs.The Funniest Minecraft Video Ever with New Funny Mods makes Minecraft 1.16.4 even funnier & hilarious! It is lots of fun and laughs :) Not Minecraft, But Water Rises or Minecraft, But Lava Rises, or any other but challenge like that. This is a speed run / speed runner of Minecraft against a killer / assassin but it is me and my good friends playing the NEW FUNNIEST MINECRAFT MOD EVER!!! POG CHAMP!!!"
"BUSSCu1gau8","SPLIT DYE Haare färben 😎 - wir färben meine Haare in 2 Farben! 👀","2021-04-03T15:38:18Z","UCDAhDUmNuxVaH3N5yHOnL3g","Alycia Marie","26","21.06.04","alycia marie|alicia marie|alycia marie makeup tutorial|make up tutorial deutsch|split dye|split hair|split hair dye|split dye färben|haare färben|egirl haare|hair dye tutorial|split dye tutorial","141221","10929","75","480","https://i.ytimg.com/vi/BUSSCu1gau8/default.jpg","False","False","Heute ist es endlich mal wieder Zeit für eine neue Haarfarbe.... bzw gleich zwei auf einmal :D Wir färben heute meine Haare SPLIT DYE! Und zwar in einer Version, die ich so extrem selten gesehen habe 👀▷ KOSTENLOS abonnieren und Glocke aktivieren, um keins meiner Videos zu verpassen! ➜ http://bit.ly/allyabo ❤ _______________________________________________▼ ▽ PRODUKTE & INFOS[WERBUNG / enthält Affiliate Links (A)]Danke an Marius: http://instagram.com/mariuspalomaExtensions hell: https://www.desinas.de/prodeluxe-mittelbraun-8-50cm.htmlExtensions dunkel: https://www.desinas.de/prodeluxe-dunkelbraun-1b-50cm.htmlTop: https://bit.ly/3wr8l4n (A)▽ RABATTCODESALYCIA10* für 10% Rabatt auf eure gesamte Bestellung bei http://www.bhcosmetics.de(*Affiliate Code)▽ SFX PRODUKTEGünstige super gute Cremefarbe: https://amzn.to/2Gw2a9X (A)Mein Latex: https://amzn.to/3nkBBoV (A)Für Latexpaste am Liebsten: https://amzn.to/33zHRkv (A)3rd Degree Silikon: https://amzn.to/3lllCFi (A)Die besten wasseraktivierten Farben: https://amzn.to/30H7BcX (A) und https://pusch-art.shop/▽ MEINE MUSIKStreamt mich doch 'ne Runde auf Spotify! ➜ https://open.spotify.com/artist/7tQYlwgl838bKUud4cZer4?si=Cjq077GaQuu20dcqPVK3fg...oder schaut auf meinem Musikkanal vorbei ➜ https://www.youtube.com/user/AlyciaMarieMusic_______________________________________________▼ ▽ JOIN THE FAMILY▫︎ ▫︎  INSTAGRAM • http://instagram.com/alyciamarie▫︎ ▫︎  TWITTER • http://www.twitter.com/alyciamarie▫︎ ▫︎  TIKTOK • alyciamarie_______________________________________________▼ ▽ GESCHÄFTLICHE ANFRAGEN / BUSINESS MAIL» business@alyciamarie.deBitte hier keine sonstigen Mails!_______________________________________________▽ KENNZEICHNUNG» Produkte, die ich kostenlos zur Verfügung gestellt bekommen habe, sind mit einem * gekennzeichnet.» Bei Links, die mit [affiliate] bzw (A) gekennzeichnet sind, handelt es sich um freiwillig eingefügte Affiliate-Links. Diese sind für euch völlig kostenfrei, unterstützen mich aber dadurch, dass ich bei einem Kauf mit einem geringen Prozentsatz des Kaufpreises am Umsatz beteiligt werde._______________________________________________DISCLAIMER • Für dieses Video erfolgte keine bezahlte Zusammenarbeit. Ich habe die Extensions und auch Marius ganz normal selbst bezahlt :DIntro Design: https://www.instagram.com/dynthasic/Animation: ich lol"
"zyvDzwEcIAc","UNDACAVA, LUCIANO - MELODIEN ► (prod.by  ThisisYT )","2021-04-01T22:00:11Z","UCjmNFoBlrquo1mTionhe-cw","B.O.M MUSIC","10","21.06.04","[none]","191631","9399","435","384","https://i.ytimg.com/vi/zyvDzwEcIAc/default.jpg","False","False","► “MELODIEN”  Jetzt Überall Streamen https://backl.ink/145669179Undacava: https://instagram.com/undacava_b.o.mLuciano:https://www.instagram.com/luciano_loco030Pablokk:https://instagram.com/pablokk_b.o.mJason:https://instagram.com/jason_b.o.mBeat by:ThisisYThttps://instagram.com/thisisyt1Mix:Christian Mahalhttps://www.instagram.com/tokzic203/Master:Niklas Neumann:https://www.instagram.com/nklsnmn/Cover-Video by:https://instagram.com/lirim.sejdiu1B.o.M. Music Kontakt:Booking: bom.music65@gmail.com"
"CQL3njxwDio","🥙 Big Döner im Wald 🔥 auf Lagerfeuer kochen - Outdoor Bushcraft Deutschland","2021-04-03T08:00:06Z","UCTWiyoWvQ6CnnRXyWL2mIAA","Naturensöhne","24","21.06.04","Bushcraft|Naturensöhne|Survival|Berlin|Brandenburg|Deutschland|Überleben|Wald|Natur|Outdoor|Döner im Wald|Döner selber machen|Lagerfeuer Döner|kochen am Lagerfeuer|Kochen im Wald","114194","8504","250","703","https://i.ytimg.com/vi/CQL3njxwDio/default.jpg","False","False","Neues Merch-Taschenmesser: https://naturensoehne.shop/products/taschenmesser-1Essbesteck: https://naturensoehne.shop/products/essbesteck-schlingelKüchenhelferset: https://naturensoehne.shop/products/kuchen-helfer-set__Unser Merch: https://naturensoehne.shop/__♦ Amazon-Wunschzettel: https://amzn.to/2RFSkVT ♦♦ Unterstützer werden: https://steadyhq.com/de/naturensoehne ♦♦ Instagram: https://www.instagram.com/naturensoehne ♦__♦♦♦ Hier findet ihr einige Links zu diversen Ausrüstungsgegenständen, die wir in unseren Videos nutzen. ♦♦♦♦ Koch-Ausrüstung ♦Petromax Feuertopf ft9: https://bit.ly/2VXVlBN (*)Petromax Feuertopf ft3: https://bit.ly/2VTFGU7 (*)Petromax Deckelheber: https://bit.ly/3516ypj (*)Petromax gr. gusseiserne Pfanne: https://bit.ly/2KsBZzp (*)Petromax schmiedeeiserne Pfanne: https://bit.ly/2Vz47qP (*)Petromax Pfannenknecht: https://bit.ly/2Y1oI8R (*)Petromax Ringreiniger: https://bit.ly/2yIy92d (*)Petromax Kaffeekocher: https://bit.ly/2VwsTIa (*)Petromax Feuerschale: https://bit.ly/2S1Cl4g (*)Petromax Kühlbox: https://bit.ly/2Vyo7cZ (*)Petromax Hitzeschutz-Handschuhe: https://bit.ly/3azqJvx (*)♦ Anfänger-Ausrüstung ♦Rucksack: http://amzn.to/2vg34ww (*)Plane: http://amzn.to/2xtgGFo (*)Mora-Messer: http://amzn.to/2xt7EIg (*)Beil: http://amzn.to/2xsWhjR (*)Säge: http://amzn.to/2xd0Yip (*)Paracord: http://amzn.to/2voZ7Vi (*)Feuerstahl: http://amzn.to/2xsYBqI (*)Erste-Hilfe-Set: http://amzn.to/2w4vc72 (*)♦ Bushcraft-Ausrüstung ♦Rucksack: http://amzn.to/2xsY08s (*)BE-X-Messer: http://amzn.to/2vp1N5h (*)Helle-Messer: http://amzn.to/2xtpbQC (*)Beil: https://amzn.to/2O9nPWe (*)Säge: http://amzn.to/2w4iYeJ (*)Taschenmesser: http://amzn.to/2xsP1Ex (*)Feuerstahl: http://amzn.to/2xt2ITQ (*)Naturschnur: http://amzn.to/2vZ696T (*)♦ Ultralight-Ausrüstung ♦Rucksack: https://amzn.to/38QiIC8 (*)Schlafsack: http://amzn.to/2xtfdyF (*)Isomatte: http://amzn.to/2vYGEm6 (*)Kopfkissen: http://amzn.to/2xsYOKG (*)Tarp: http://amzn.to/2voHyF9 (*)Hängematte: http://amzn.to/2xsS93l (*)Titan-Löffel: http://amzn.to/2w3QHEJ (*)Titan-Tasse: http://amzn.to/2w3Pfm8 (*)Kochset: http://amzn.to/2vYDLBD (*)Trek'n'eat Wildtopf: http://amzn.to/2w3J9BX (*)♦ Outdoor-Ausrüstung ♦Fleece-Jacke: http://amzn.to/2xtmyyk (*)Hose: http://amzn.to/2vparRv (*)T-Shirt: http://amzn.to/2xsZy2g (*)Socken: http://amzn.to/2vpsMxF (*)Stiefel: http://amzn.to/2w4impa (*)Dreiecktuch: http://amzn.to/2vp8BQs (*)Mütze: http://amzn.to/2g6jcxO (*)Handschuhe: http://amzn.to/2w4oDRC (*)Schlafsack: http://amzn.to/2xt2r3j (*)Rucksack: http://amzn.to/2xd4jO8 (*)Bei den mit (*) markierten Links handelt es sich um Amazon- oder Petromax-Partnerlinks durch welche wir eine kleine Provision bekommen, wenn ihr auf sie raufklickt und etwas bestellt. Wer uns unterstützen mag, ist dadurch herzlich eingeladen. Dadurch entstehen euch natürlich keine zusätzlichen Kosten. Liebe Grüße, Andy und Gerrit__♦ Youtube: http://goo.gl/BK7RwU ♦♦ Facebook: https://www.facebook.com/Naturensoehne ♦♦ Instagram: https://www.instagram.com/naturensoehne ♦♦ Kontakt: naturensoehne@gmail.com ♦♦ Spende via Paypal: https://goo.gl/iLQw23 ♦__© CopyrightAlle Filminhalte sind Eigentumvon Naturensöhne"
"G7SDkfc-uWk","ICH KANN NICHT AUFHÖREN ZU LAUFEN","2021-04-03T10:08:16Z","UCgZpwegd4AdDlZNrIamIgRw","BastiGHG","20","21.06.04","minecraft|mc|challenge|bastighg|ghg|pvp|durchspielen|german|deutsch|hungergames|runde|team|rage|uhc|hacker|hd|varo|skill|pro|elite|texturepack|resourcepack|download|rp|tp|highlights|varo 4|best of|speedrun|tutorial|basti ghg|suro|minecraft durchspielen|nicht|extreme|hardcore|tot|fail|bestrafung|laufen|ich kann|aufhören|permanent|bug|datapack|seltene sachen|suchen|serie|fiver|fiverr bastighg|fiverr minecraft|1.17|update|weltrekord|schnell|clip|roomtour|leak|bestof|highlight|twitch","340011","29450","218","1656","https://i.ytimg.com/vi/G7SDkfc-uWk/default.jpg","False","False","NEUER MERCH + GRATIS Poster & AUTOGRAMM (Werbung) ► https://www.yvolve.de/bastighg ABONNIEREN ► http://bit.ly/1siFMkG MITGLIED WERDEN ► https://bit.ly/3bmiAgxZickZack v2 Cosmetics  (Code: BastiGHG) (Werbung) ► https://bit.ly/3eUTMNAJeden Tag Streams ► https://www.twitch.tv/bastighg 2. Kanal ►https://goo.gl/PXQqZRHier lasse ich meine PCs bauen (Werbung) ► https://nzxt.co/34xjODETwitter ►https://twitter.com/kompetenzGHGInstagram ►https://instagram.com/babaesti TikTok ►https://www.tiktok.com/@bastighg.tiktokDiscord ► https://discord.com/invite/ghgThumbnail ► https://twitter.com/DeAslacHaupt-Setup:Maus ► ASUS ROG Gladius II ORIGIN ► https://bit.ly/2O4XwQd (Werbung)Tastatur ► ASUS ROG Strix Flare MIT CHERRY MX RGB RED ► https://bit.ly/2O4XwQd (Werbung)Mousepad ► ROG Sheath BLK LTD (Werbung) Haupt-Monitor ►https://bit.ly/2Z3YVwX (Werbung)Stuhl* ►https://goo.gl/JbJlg1Bildschirmhalterung* ►https://goo.gl/6U6CYBMein TS ►bastighg.comMusik ►Epidemic Soundhttps://player.epidemicsound.com········································­­­······································­·Die mit (*) gekennzeichneten Links sind Affiliate Links, von diesen erhalte ich eine Provision bei abgeschlossenen Kauf.Kompetenz steht an erster Stelle.#GHG"
"cii6ruuycQA","Olivia Rodrigo - deja vu (Official Video)","2021-04-01T16:00:27Z","UCxE5jEls-T0QtlTHT8lI1lw","OliviaRodrigoVEVO","10","21.06.04","Olivia|Rodrigo|deja|Pop","18741335","1111270","22097","68731","https://i.ytimg.com/vi/cii6ruuycQA/default.jpg","False","False","Listen to ‘deja vu’ out now: https://OliviaRodrigo.lnk.to/dejavu​ Pre-order the debut album *O*R: https://OliviaRodrigo.lnk.to/preorder​Co-starring - Talia Ryder Shop the deja vu collection: https://smarturl.it/oliviarodrigoshopDirector - Allie AvitalProduction Co. - SMUGGLER x north of now Executive Producer - Elizabeth DoonanCreative Producer - Daniel YaroProducer - Matisse GaillardAssistant Director - Lynna BaculoCinematography - Logan TriplettSteadicam - Renard Cheren Gaffer - Cole PisanoGrip - Colin Stoye Art Director - Jake TremblayProduction Designer - Natalia Brito Editor - Lindsey NadolskiColorist - Kaitlyn BattistelliVFX - B.Art VFXFollow Olivia Rodrigo:Instagram: https://instagram.com/oliviarodrigo​​​Twitter: https://twitter.com/Olivia_Rodrigo​​​Facebook: https://www.facebook.com/OliviaRodrigoOfficialYouTube: https://youtube.com/oliviarodrigomusic​​​TikTok: https://tiktok.com/@livbedumb​​​Store: https://smarturl.it/oliviarodrigoshopMusic video by Olivia Rodrigo performing deja vu. © 2021 Olivia Rodrigo, under exclusive license to Geffen Recordshttp://vevo.ly/6wgmhZ"
"ukCuIlDG3Ls","WIR ÜBERRASCHEN UNSERE FAMILIE 😍❤️ Team Harrison","2021-04-03T10:01:06Z","UCvX4QLz-gxgWpQXTutSan_w","Team Harrison","22","21.06.04","Team Harrison|vlog|pregnant|schwanger|familie|family|schwangerschaft|Dubai|auszug|auswandern|aswanderung|goodbye deutschland|einzug|umzug|neuanfang|sonara|camp|desert|wüste|ausflug|überraschung|familienausflug|schön|emotional|kamel|essen|dinner","444692","21210","774","0","https://i.ytimg.com/vi/ukCuIlDG3Ls/default.jpg","True","False","Wenn Ihr in einem Video von uns gegrüßt werden möchtet► Abonniert unseren Channel https://tinyurl.com/y7jonjup► Kommentiere mit #TeamHarrison ► Like das Video Viel Spaß beim anschauen Ganz liebe Grüße FAMILIE HARRISONUNSERE SOCIAL MEDIA ACCOUNTS - FOLLOW US ♡Youtube ► https://tinyurl.com/y7jonjupSarah Instagram ► https://www.instagram.com/sarah.harrison.official/TikTok ► https://vm.tiktok.com/w8vQQa/Dominic Instagram ► https://www.instagram.com/dominic.harrison.official/HIER FINDET IHR MEHR VIDEOS VON UNS:Schwangerschaft Playlist ► https://tinyurl.com/yc96w99jLos Angeles Playlist ► https://tinyurl.com/ybszppv9TeamHarrisons Vlogs ► https://tinyurl.com/ydaxmatvHochzeit Playlist ► https://tinyurl.com/y83syzts"
