video_id,title,publishedAt,channelId,channelTitle,categoryId,trending_date,tags,view_count,likes,dislikes,comment_count,thumbnail_link,comments_disabled,ratings_disabled,description
"JGYAhz8uxvU","Потерянные. 10 серия","2021-03-02T19:30:13Z","UCsA_vkmuyIRlYYXeJueyIJQ","НТВ","1","21.03.03","Потерянные|Потерянные все серии|Потерянные сериал|Потерянные сериал НТВ|Потерянные смотреть|сериалы про полицию|детективы|интересный сериал|криминал|расследования|Александр Робак|Арсений Робак|Наталья Земцова|Игорь Савочкин|Татьяна Казючиц|новый сериал|сериалы 2021|сериалы НТВ 2021|сериалы НТВ|фильмы НТВ|фильмы 2021|НТВ|NTV","233750","1598","148","251","https://i.ytimg.com/vi/JGYAhz8uxvU/default.jpg","False","False","Поисковики обходят места, где обитают бомжи, и те рассказывают, что в последнее время таинственная «Скорая помощь» забирает самых крепких мужчин и увозит в неизвестном направлении. Чтобы раскрыть это дело, Паша становится бомжом-наживкой.Все серии - в одном плейлисте: https://www.youtube.com/playlist?list=PLSgy-gJ-dkS-Fo3JBnmW6belm0FDogE1ohttp://www.ntv.ru/video/click1995260/?catid=4&vcid=1995260&vcver=0"
"djj5Lmo_Ehc","Людмила Павличенко - о снайперах Великой Отечественной войны (1973)","2021-03-02T11:00:25Z","UCiVZttFkdEwMi3QXpRqFTzQ","Советское телевидение. ГОСТЕЛЕРАДИОФОНД России","24","21.03.03","архив советского тв|архивное видео|гостелерадиофонд|гостелерадиофонд россии|гтрф|жизнь в ссср|ностальгия|передачи советского телевидения|раритет|советские телепередачи|советский союз|советское тв|советское телевидение|советское телевидение смотреть онлайн|ссср|ссср как это было|тв архив|людмила павличенко|снайпер|великая отечественная война|1973|женщины ссср|женщины|снайперы|битва за севастополь|война|герой советского союза|интервью","100735","8406","96","1913","https://i.ytimg.com/vi/djj5Lmo_Ehc/default.jpg","False","False","Людмила Павличенко - о снайперах Великой Отечественной войны▶Подписаться на канал Советское телевидение: https://goo.gl/qw3iEKГод производства: 1973 Cамая успешная женщина-снайпер в мировой истории Герой Советского Союза Людмила Михайловна #Павличенко рассказывает о снайперах Великой Отечественной войны.Фрагмент документальной записи Воспоминания Л.М.Павличенко.Главная редакция научно-популярных и образовательных программ, 1975 г.#ЖенщиныСССР #женщины #ЛюдмилаПавличенко #снайперы #ВеликаяОтечественнаяВойна #БитваЗаСевастополь #война #ГеройСоветскогоСоюза #интервьюНаши группы в соцсетях:📌  Facebook: https://www.facebook.com/gosteleradiofond📌  VK: https://vk.com/teleradiofond📌  ОK: https://ok.ru/group/54885780750586Приложение для смартфона Радио. XX век🔗 Google Play: https://play.google.com/store/apps/details?id=ru.gtrf🔗 App Store: https://itunes.apple.com/ru/app/радио-xx-век/id1336486169"
"CAyZtQrg_i0","Сериал След. «Утырок» Премьера!","2021-03-03T11:00:06Z","UCZCWol-6RuRBa3QVzR_4tnQ","Сериал След. Пятый канал","1","21.03.03","След|Сериал След|След новый сезон|смотреть след|След новые серии|След все серии|След смотреть онлайн|След сериал новые серии|след новый сезон|sled|slad|cktl|cthbfk cktl|фэс|фэс след|Ольга Копосова|Рогозина|Майский|новинки детективы|детективные сериалы|русские сериалы|детектив|криминал|смотреть бесплатно|онлайн|в хорошем качестве|пятый канал|след все серии|след новые серии|след 2021|след 5 канал","41166","879","48","150","https://i.ytimg.com/vi/CAyZtQrg_i0/default.jpg","False","False","В лесу находят труп школьника Тимофея Табакина и две закопанные могилы. Но могилы пусты и ни разу не использовались по назначению.—————————————————————————► Смотри все серии сериала «След» бесплатно в хорошем качестве: https://youtube.com/playlist?list=PLLRv0VRa0HHkbL2-Q5lqEfgP9JcaslOTS———∎ След, мемы, интервью, эксклюзивные анонсы и конкурсы только здесь: https://instagram.com/detectiveclub———∎ Недавно смотришь След? Заходи на официальный сайт сериала, чтобы познакомиться с героями, их обязанностями и непростыми взаимоотношениями:https://5-tv.ru/projects/1000117/sled/———∎ Подписывайся на наши официальные каналы:След - http://youtube.com/c/Sled5tv?sub_confirmation=1Пятый Канал - https://youtube.com/5TVRussia?sub_confirmation=1—————————————————————————#СериалСлед #ПятыйКанал«След» на Пятом канале — один из самых успешных российских криминальных сериалов — это не просто набор увлекательных детективных историй. Все они объединены основной идеей — идеальных преступлений не существует. Как бы не старался злоумышленник, он всё равно оставит след, по которому его замысел будет раскрыт. Сотрудниками ФЭС очень подробно изучается материальный мир на месте преступления. Высокотехнологичная лаборатория оснащена по последнему слову техники. Это серьезный эксперимент, на который пошло МВД: если этот проект докажет свою пользу в раскрытии преступлений, такие лаборатории появятся во многих регионах России.———Режиссер: Юрий Харнас.В ролях: Ольга Копосова, Владимир Ташлыков, Евгений Кулаков, Павел Шуваев, Руслан Сасин, Сергей Коваленко, Станислав Эрклиевский, Олег Валкман, Андрей Лавров, Александра Попова, Георгий Тесля-Герасимов, Анастасия Гулимова, Анна Дюкова.—————————————————————————∎ Официальный сайт Пятого канала:Сайт - http://5-tv.ruПроекты http://5-tv.ru/projectsТелепрограмма - http://5-tv.ru/scheduleСериалы - http://5-tv.ru/filmsНовости - http://5-tv.ru/news———∎ Социальные сети:Группа VK - http://vk.com/5tvpromoМы в Facebook - http://facebook.com/5tv.ruМы в Twitter - http://twitter.com/5tvНаш Instagram - http://instagram.com/5_t"
"_a0SfKzZwiY","Художественная гимнастика. Чемпионат России 2021. Финал индивидуального многоборья","2021-03-02T15:53:03Z","UCppkxNOs8rEuhEyk0GtrfRg","Telesport","17","21.03.03","telesport|телеспорт|художественная гимнастика|Дина Аверина|Арина Аверина|Dina Averina|Arina Averina|Аверина|Averina|сестры Аверины|Rhythmic gymnastics|Лала Крамаренко|Lala Kramarenko|Екатерина Селезнёва|Ekaterina Selezneva|художественная гимнастика 2021|чемпионат россии по художественной гимнастике 2021","49503","976","16","35","https://i.ytimg.com/vi/_a0SfKzZwiY/default.jpg","False","False","Прямая видео-трансляция. 2 марта 2021 года. Дворец Ирины Винер-Усмановой.В финале индивидуального многоборья выступят 24 лучшие по итогам квалификации гимнастки. Участие в соревнованиях принимают лидеры сборной команды России: Дина и Арина Аверины, Лала Крамаренко, Екатерина Селезнёва.Прямые трансляции спортивных событий на сайте: https://tele-sport.ru/​ Больше контента на наших страницах в соцсетях: Инстаграм - https://www.instagram.com/telesporttv/​Телеграм-канал - https://t.me/telesportmedia​ Твиттер - https://twitter.com/telesporttv​  #ХудожественнаяГимнастика #Аверины #Крамаренко"
"xl90_3-VfTo","Без Путина никуда: почему Байден не сможет ввести санкции против российского президента лично","2021-03-03T07:00:07Z","UCdubelOloxR3wzwJG9x8YqQ","Телеканал Дождь","25","21.03.03","дождь|телеканал дождь|новости|политика|путин|байден|котрикадзе|котрикадзе иностранных дел|котрикадзе дождь|санкции против россии|санкции сша|навальный|алексей навальный|навальный санкции|ес санкции|путин евросоюз евросоюз|санкции россия|котрикадзе екатерина|дождь навальный|навальный лайв|кремль|екатерина котрикадзе|навальный леха|приговор навальному|санкции|пригожин|евгений пригожин|фбр|байден путин|путин санкции","112502","4682","442","933","https://i.ytimg.com/vi/xl90_3-VfTo/default.jpg","False","False","ФБР объявило награду в $250 тысяч за информацию, которая может поспособствовать аресту Евгения Пригожина. В Вашингтоне уверены, что именно он пытался повлиять на результат президентских выборов 2016 года. Однако Пригожин уже состоит в санкционных списках ЕС и США, на Запад ему путь заказан. Сильные заявления в администрации 46-го президента США делаются почти каждый день. Но вопрос в том, какие действия последуют за словами. На фоне довольно жалкого ответа ЕС на отравление и арест Навального американцам нужно выступить серьезнее, чтобы доказать свой статус «лидера свободного мира». Но, например, сделать Путина нерукопожатным не выйдет — есть темы, по которым придется разговаривать. Екатерина Котрикадзе рассказала о том, почему, несмотря на спорную и провокационную политику Кремля, Россия останется частью глобального мира.Поддержите нашу работу и станьте спонсором канала в ютубе: https://www.youtube.com/channel/UCdubelOloxR3wzwJG9x8YqQ/joinПодписывайтесь на Дождь - https://www.youtube.com/user/tvrainruОфициальный сайт Дождя - http://tvrain.ru/Facebook - https://www.facebook.com/tvrainTwitter - https://twitter.com/tvrainTelegram - https://t.me/tvrainInstagram - https://www.instagram.com/tvrain_inside/ВКонтакте - https://vk.com/tvrainОдноклассники - https://ok.ru/tvrain#путин #байден #дождь"
"cVjhdCetghY","Санкции США и ЕС из-за отравления Навального. Лукашенко о Союзном государстве и российском кредите","2021-03-02T18:37:37Z","UCdubelOloxR3wzwJG9x8YqQ","Телеканал Дождь","25","21.03.03","навальный|дождь|санкции против россии|лукашенко|беларусь|союзное государство беларуси и россии|дождь навальный|телеканал дождь|новости|политика|дождь смотреть онлайн|фургал|хабаровск|протесты в хабаровске|белоруссия|rain|tv rain|беларусь сегодня|белоруссия протесты|беларусь протесты|навальный дождь|навальный лайф|на дожде|россия|tvrain|путин|алексей навальный|дождь прямой эфир|санкции за навального|союзное государство|новые санкции за навального","355722","13856","466","995","https://i.ytimg.com/vi/cVjhdCetghY/default.jpg","False","False","США вслед за ЕС ввели санкции из-за Навального. Это первые санкции против России при новом президенте США. Под ограничения попали несколько высокопоставленных чиновников, а также один из столичных НИИ и еще ряд организаций.Лукашенко объяснил отказ от «глупой работы» по объединению с Россией. По его словам, мир настолько изменился, что говорить и работать в направлении объединения двух стран нет смысла и необходимости. Лукашенко подчеркнул, что в рамках Союзного государства Минск и Москва сотрудничают очень тесно.00:00 США назвали россиян и организации, против которых ввели санкции из-за преследования Навального03:54 «Политика удушения подушкой»: Владимир Рыжков о санкциях ЕС и США18:25 «Полицейские ломились в квартиру»: москвича задержали за пост про фонарик под подушкой24:43 «Следователь не заметил побои»: что случилось с петербуржцем, который умер в отделении полиции31:59 «Военный переворот — не метод России»: чем может закончится противостояние в Ереване40:13 Два года за опровержение Лукашенко: врача и журналистку приговорили к реальным срокам за разоблачение версии властей об убийстве Романа Бондаренко47:22 О чем Лукашенко говори с Путиным? 56:29 Кому достанется башкирская сода?1:09:32 Кто будет мэром Грозного? 1:17:42 Михаилу Горбачеву исполнилось 90 летПоддержите нашу работу и станьте спонсором канала в ютубе: https://www.youtube.com/channel/UCdubelOloxR3wzwJG9x8YqQ/joinПодписывайтесь на Дождь - https://www.youtube.com/user/tvrainruОфициальный сайт Дождя - http://tvrain.ru/Facebook - https://www.facebook.com/tvrainTwitter - https://twitter.com/tvrainTelegram - https://t.me/tvrainInstagram - https://www.instagram.com/tvrain_inside/ВКонтакте - https://vk.com/tvrainОдноклассники - https://ok.ru/tvrain#навальный #беларусь #дождь"
"x4CX5LgkTmE","SCP-191 Ребёнок киборг (Анимация SCP)","2021-03-03T05:59:01Z","UC3M_RxlDLqUPreOpa9git5A","Детектив Войд","22","21.03.03","анимация scp|фонд scp|детектив войд|scp истории|scp на русском|scp ru|scp 191|scp-191|scp191|ребенок-киборг|робот|ребенок|маленькая девочка|врач-экспериментатор","188599","20408","150","1791","https://i.ytimg.com/vi/x4CX5LgkTmE/default.jpg","False","False","Этот безопасный объект обладает свойствами, о которых вы, возможно, мечтаете. Однако в реальности человек-киборг выглядит не так впечатляюще, как в фильмах. Особенно, если учесть, что это маленькая девочка, ставшая жертвой эксперимента. Сегодня я расскажу вам об SCP-191, чье существование вызывает глубокие этические противоречия. При этом опасность повторения эксперимента никто не отменял, ведь, насколько мне удалось выяснить, его автор всё ещё в деле. Найди меня в:TIK TOK: https://vm.tiktok.com/ZSccbeVL/Instagram: https://instagram.com/detectivevoidВК: https://vk.com/club201646914Идея в этом видео, полученная с сайта http://www.scpwiki.com/scp-191, опубликована в Creative Commons Sharealike 3.0. https://creativecommons.org/licenses/by/3.0/"
"P9y2winModI","THE HARDKISS - Обійми (OST «Обійми мене») (ПРЕМ'ЄРА КЛІПУ)","2021-03-03T08:02:05Z","UCgJxsxqbS_lQ3Y-_gbEq-lA","The HARDKISS","10","21.03.03","the hardkiss|hardkiss|хардкис|хардкіс|залізна ластівка|зализна ластивка|hard kiss|хард кіс|хард кис|музика 2020|українська музика|акустика live|юлія саніна|валерій бебко|євген кібєлєв|клим лисюк|крічі|kreechy|десять|шоу десять|обійми|hugs|обійми мене","95518","11835","217","981","https://i.ytimg.com/vi/P9y2winModI/default.jpg","False","False","Слухай пісню на Spotify, Apple Music та інших стрімінгових платформах: https://thehardkiss.com/obiymyThe HARDKISS. Десять.Київ, 29 травня 2021 р., НСК «Олімпійський». Квитки на шоу «Десять»: http://bit.ly/thehardkisstenytLyrics: https://genius.com/The-hardkiss-obiymy-lyricsПідписуйся на канал The HARDKISS: http://bit.ly/thehardkissytДивись The HARDKISS official videos: http://bit.ly/thehardkissytovНаші соціальні мережі, приєднуйся:https://instagram.com/the_hardkisshttps://facebook.com/thehardkisshttps://twitter.com/the_hardkisshttps://t.me/the_hardkisshttps://bit.ly/thehardkissviberРежисер - Катя ЦарикОператор - Юрій КорольПродюсер - Віталій ДенчукЛ-продюсер - Антон КолосовськийСвітлова інсталяція - Євген Костира, компанія AlightХудожник з освітлення - Євген КостираМонтаж - Катя ЦарикVFX - Роман ОнуфрійчукКолір - Дмитро ВасиленкоMUA & Style (THE HARDKISS) - Слава ЧайкаHAIR  (THE HARDKISS) - Віталій Дацюк Ґаффер - Олександр Казаков Фокус-пулер - Тарас ШаповалМеханік камери - Максим ЩербоносМеханіки крану - Олександр Сопичев, Максип ПрилепаКей-ґріп - Микола Орлов Освітлювач - Євген Зайцев, Роман СафонюкЕлектрик - Олександр Коротчук Технічне забезпечення - Alight. Велика подяка за підтримку Володимиру Андрусишину та Кирилу Лобасєву.Освітлювачі Alight - Віталій Катунін, Сергій Сержан, Дмитро Козленко, Едуард Головаш, Дмитро Менжерес, Юрій Ігнатюк, Олександр СофієнкоСпецефекти - Snow Business Ukraine (Оля Маркова)Технічне запезпечення - Patriot Rental HouseКран - Filmotechnic Remote SystemsСпеціальна подяка КП Київський метрополітен та особисто Наталії МакогонВиконавиця головної ролі - Вікторія КарпинськаХореограф - Оля Голдис, Максим ПекнийТацівники:Дмитро АбрамБазела Олексій Лузан Катерина Крапівін ОлександрКуруоглу АртемМалікова Дар’яТодуа ІракліБарвінська КатеринаХарченко РоманТарас ВалігураШевчук ОленаСофі ПашкуальАльона Ткаченко Серінє СіаносянВетковський Артур Наливайко ДмитроСергеєва Анастасія Дроздов ІванІлля КагіянПауль СтефаніяКоленкова Анастасіяbooking: info@thehardkiss.com+380504171010(C) the hardkiss 2020"
"A2KwCMR8AH0","ЭТО НЕ НАРАЩИВАНИЕ! Откуда длинные волосы?","2021-03-02T12:33:36Z","UCgOkfjHzgwyT3xr1P9BPZbg","Evelinushka","24","21.03.03","Эвелина|Эвелинушка|evelinushka|eveliinushka|наращивание|сколько стоит|афролоконы|д.е.локоны|афрокудри|афро|завивка|волосы|испортила волосы|афрокудри на трассах|брейды|окрашивание|мой опыт|моя история|дреды|д.е. дреды","110793","12897","109","572","https://i.ytimg.com/vi/A2KwCMR8AH0/default.jpg","False","False","Зацени новую коллекцию от Beauty Bomb! https://www.instagram.com/beautybomb.russia https://beautybomb.ru/catalog/Сегодня я расскажу вам о своем опыте носки Афролоконов, их еще называют Д.Е. локоны. Расскажу, сколько я их носила, как за ними ухаживала и как в итоге снималаОтвечу на ваши вопросы по поводу прически; как мыть голову с такими локонами, как расчесывать волосы и сколько это стоит! Приятного просмотра, буду рада услышать ваше мнение в комментариях!Я делала локоны вот тут: https://www.instagram.com/afro_spb/INSTAGRAM: https://www.instagram.com/eveliinushkaaVK: https://vk.com/evellinushkaСОТРУДНИЧЕСТВО:https://vk.cc/ax7lHAМузыка в видео:Bill Brown - Crossroad at DawnKevin MacLeod - Folk RoundKevin MacLeod - Achaidh CheideHearthstone  Tavern Brawl - Main Title (Solo)Hearthstone - Tavern Brawl Hearthstone - Bad ReputationThe Witcher 3  Wild Hunt - Yes, I Do...P.S. Это видео спонсировано Beauty Bomb!"
