video_id,title,publishedAt,channelId,channelTitle,categoryId,trending_date,tags,view_count,likes,dislikes,comment_count,thumbnail_link,comments_disabled,ratings_disabled,description
"ix68oRfI5Gw","Making a log carving robot","2021-04-04T08:11:07Z","UCj1VqrHhDte54oLgPG4xpuQ","Stuff Made Here","28","21.06.04","[none]","1565224","119916","1009","6207","https://i.ytimg.com/vi/ix68oRfI5Gw/default.jpg","False","False","Check out https://Kiwico.com/StuffMadeHere for 50% off your first month of any crate!The robot arm I used: https://hubs.ly/H0K42Hg0Please consider supporting these projects through my patreon: http://patreon.com/stuffmadehere When I was offered the opportunity to beta test an upcoming robotic arm from Tormach, I knew exactly what I wanted to do with it. CNC chainsaws baybeeeeee. Aside from being fundamentally awesome, it is a very interesting software problem. Since I didn't have to build the arm I was able to focus the project and the video on the software challenges of making something like this work. Thank goodness I didn't have to build the arm because the software almost killed me. I can imagine all kinds of next steps for this creation like machining textures with the chainsaw or cutting topiaries. I hope you like it!Sources: *  Low Polygon Labrador Model: https://www.thingiverse.com/thing:446787 *  RRT  GIF: https://en.wikipedia.org/wiki/Rapidly-exploring_random_tree#/media/File:Rapidly-exploring_Random_Tree_(RRT)_500x373.gifOther great things (your purchase helps support this channel):*  I use a glowforge pro for rapid prototyping and it's great. You can $500 off a Glowforge pro here: http://glowforge.com/stuffmadehere"
"29v69XXhR_M","ICH BAUE EINEN SEE","2021-04-03T18:00:00Z","UCmxc6kXbU1J-0pR2F3wIx9A","laserluca","24","21.06.04","[none]","589348","65557","828","11427","https://i.ytimg.com/vi/29v69XXhR_M/default.jpg","False","False","In der 22. Folge von Minecraft mit Luca holen wir den Rest aus der Höhle, machen uns eine Full Dia Rüstung, ersetzen unsere Farm durch einen privaten See und bauen einen Fluss mit 2 Wasserfällen auf die Insel... viel Spaß!👕 SHOP↪︎ http://luca-shop.de🎥 ZWEITKANAL↪︎ http://youtube.com/lucrew🎨 INSTAGRAM↪︎ http://instagram.com/laserluca🎙️ PODCAST↪︎ http://spotify.com/dickunddoof"
"gsoTKXA1KEs","I Finally Got My Own Show | Dixie D'Amelio","2021-04-04T17:00:13Z","UCLOEGprmycLLbyzBj2jozLg","Dixie D'Amelio","22","21.06.04","dixie damelio|dixie d'amelio|dixie|damelio|be happy|music video|tik tok|dixie damelio be happy|dixie d'amelio be happy|charli damelio|charli d'amelio|tiktok|charli|d'amelio|exclusive|ᗷᕼᑌᗴᔕᒍYᗴᔕ|marc d'amelio|heidi d'amelio|talkshow|show|dog|dogs|me|fun|laugh|the dixie d'amelio show|hollywood fix|marc|heidi|the early late night show|telns|early late night show|vfx","1290516","88428","9490","7912","https://i.ytimg.com/vi/gsoTKXA1KEs/default.jpg","False","False","I'M BACK!!!! The Early Late Night Show returns bigger and better than ever!! I'm so excited to air this second season of my talk show. It's all because of you that the Dixie D'Amelio Show evolved into this. We have some awesome episodes and amazing guests this season I cannot wait for you to see! Every Sunday at 10AM PST/1PM EST!!! Thanks for watching! CreditsExecutive Producer: Dixie D'AmelioExecutive Producer: Tommy BurnsExecutive Producer: Christian GuitonDirector: Christian GuitonDP: Seth FullerEditor/VFX: Luke KnezevicEditor: Diego ColeProduction Company: Black Street EntertainmentStudio: Hubble StudioWebsite: https://www.dixiedamelio.comSubscribe for more official content from Dixie: https://www.youtube.com/dixiedamelio?sub_confirmation=1Connect with me!TikTok: https://www.tiktok.com/@dixiedamelioInstagram: https://www.instagram.com/dixiedamelioTwitter: https://twitter.com/dixiedamelioWebsite: https://www.dixiedamelio.comWe love our Tov chairs!https://tovfurniture.comCheck out my merch: https://dixiedamelio.shop/#DixieDAmelio #TheEarlyLateNightShow"
"Ijssm6Qv5nE","The Thinnest Smartphone in the World.","2021-04-04T11:13:55Z","UCMiJRAwDNSNzuYeN2uWa0pA","Mrwhosetheboss","28","21.06.04","phone|smartphone|thinnest phone|android|tech|technology|slimmest phone|thin phone|best phone|best smartphone|2021 smartphone|cool phones|cool tech|unboxing|samsung|samsung galaxy","3086994","180221","4933","10650","https://i.ytimg.com/vi/Ijssm6Qv5nE/default.jpg","False","False","7 of the Strangest, Rarest Smartphones, including the thinnest phone in the world, ever...😱...Check out Huel here:  https://my.huel.com/arunmFor my most brutally honest phone commercial: https://youtu.be/wadg_mLOPJQSubscribe for more content (IT'S FREE) : https://goo.gl/pLg6fEIt would make my day if you could also follow me on:🌈 Instagram: https://goo.gl/OUqBBa🐦 Twitter: https://goo.gl/EFhwqL😊 Facebook: https://goo.gl/Aluzl1Amazon Affiliate links:Amazon US: https://goo.gl/3yS2aPAmazon UK: https://goo.gl/gvrsGZMy Filming Gear:https://bit.ly/35CuxwIMusic is from Epidemic sound:http://share.epidemicsound.com/pHDFT"
"LRsB68ing5Q","Highlights FC Barcelona vs Real Valladolid (1-0)","2021-04-05T22:11:43Z","UCTv-XvfzLX3i4IGWAm4sbmA","LaLiga Santander","17","21.06.04","liga|laliga|laliga santander|football|resumen|goles|highlights|goal|gol|sp:dt=2021-04-05T19:00:00Z|sp:ti:home=fcb|sp:ti:away=vad|sp:ty=high|sp:or=2|sp:li=liga|sp:vl=en|Dembele|Messi|Griezmann|Jordi Alba|Busquets|Dest|Lenglet|Frenkie de Jong|Mingueza|ter Stegen|Araujo|Ilaix Moriba|Riqui Puig|Braithwaite|Trincao|Kodro|Sergi Guardiola|Roque Mesa|Oscar Plano|Janko|Nacho Martinez|Alcaraz|Javi Sanchez|Bruno|Olaza|Masip|Hervias|Waldo|Marcos Andre","1294476","20719","680","998","https://i.ytimg.com/vi/LRsB68ing5Q/default.jpg","False","False","FC Barcelona beat Real Valladolid with a goal of Ousmane Dembélé in the 90th minute and move back to the second place #BarçaRealValladolid Matchdat 29 LaLiga Santander 2020/2021Suscríbete al canal oficial de LaLiga Santander en HD http://goo.gl/Cp0tCSubscribe to the Official Channel of LaLiga in High Definition http://goo.gl/Cp0tCLaLiga Santander on YouTube: http://goo.gl/Cp0tCLaCopa on YouTube: http://bit.ly/1P4ZriPLaLiga SmartBank on YouTube: http://bit.ly/1OvSXbiFacebook: https://www.facebook.com/laligaTwitter: https://twitter.com/LaLigaInstagram: https://instagram.com/laligaGoogle+: http://goo.gl/46Py9"
"2eZJ7f3iCEo","Naturtalent oder Katastrophe? Spiel 3: Ein Tisch, zwei Stühle | Joko & Klaas gegen ProSieben","2021-04-03T10:00:00Z","UCmoa-beOd9dBmZIiLVXB8Bw","Joko & Klaas","24","21.06.04","Naturtalent oder Katastrophe?|Spiel 3: Ein Tisch zwei Stühle|joko und klaas bauen einen tisch|tisch bauen|stühle bauen|joko und klaas bauen ein haus|handwerk|tischler|joko und klaas handwerk|joko und klaas tisch|Joko und Klaas|Circus HalliGalli|Zirkus HalliGalli|Halli Galli|Joko|Klaas|Claas|Klas|Joko gegen Klaas|ProSieben|Klaas Heufer Umlauf|joko Winterscheidt|show|tv show|parodien|comedy|stars|beste unterhaltung|circus|zirkus|halligalli|sendung|tv sendung|tv","306158","7274","134","235","https://i.ytimg.com/vi/2eZJ7f3iCEo/default.jpg","False","False","Herr ProSieben hat es sich diesmal in der Aufgabenstellung ziemlich leicht gemacht - Joko und Klaas sollen ihm kurzerhand eine neue Essgarnitur zusammenzimmern. Und als ob das noch nicht genug wäre, sollen die zwei Stühle und der Tisch auch noch einem amtlichen Belastungstest standhalten.#Joko&KlaasbaueneinHaus #JKvsP7 #ProSiebenJoko und Klaas gegen ProSieben dienstags, um 20:15 Uhr auf ProSieben► Ganze Folgen: https://www.prosieben.de/tv/joko-klaas-gegen-prosieben► Joko und Klaas bei Facebook: https://www.facebook.com/jokoundklaas/► Folge uns auf Twitter: https://twitter.com/jokoundklaas► Instagram: https://www.instagram.com/jokoundklaas/Ihr Gegner ist groß, rot und mächtiger denn je: Joko und Klaas fordern gemeinsam einen ganzen Sender heraus. Dabei gilt es, gegen das gesamte ProSieben-Universum zu bestehen - alle werden zum Kräftemessen eingeladen. Über Gegner und Spiele entscheidet alleine ProSieben. Triumphieren Joko und Klaas, überlässt ihnen der Sender einen 15-minütigen Live-Sendeplatz zur freien Gestaltung. Siegt ihr Arbeitgeber, müssen sie sich bedingungslos in seine Dienste stellen._______________________Copyright Thumbnail: ProSieben/Stefan GregorowiusImpressum:https://www.prosieben.de/service/impressum"
"9d7TDm6hvlE","VOYAGE x J FADO - PLESI (JUŽNI VETAR 2 OFFICIAL SOUNDTRACK)","2021-04-03T10:00:04Z","UCv2Kgy7-3tirU4Ezge8Oapg","Južni vetar","24","21.06.04","voyage|plesi|novo|juzni|vetar|film|ubrzanje|j fado|voyage plesi|juzni vetar|j fado plesi|voyage plesi novo|juzni vetar 2021|juzni vetar 2|juzni vetar ubrzanje|juzni vetar ubrzanje film|juzni vetar 2 film","3400798","144626","4447","9584","https://i.ytimg.com/vi/9d7TDm6hvlE/default.jpg","False","False","Label and Copyright: Režim & Južni Vetar, ℗ & © 2021. All rights reserved. Streaming link: https://fanlink.to/plesi🎧 Listen:Deezer: https://bit.ly/3dABUHUSpotify: https://spoti.fi/3wu33osTidal: https://bit.ly/3une6OqApple music: https://apple.co/2PXWGt3Amazon Music: https://amzn.to/2PV0KdB🎵 Buy It On:iTunes: https://apple.co/3ugTnMeFollow Južni Vetar:Instagram: https://bit.ly/2yULhS4Facebook: https://bit.ly/2XGLpzbYouTube: https://bit.ly/2XBW6TEIMDB: https://imdb.to/3aaiF46Follow VOYAGE:Instagram: https://bit.ly/3rPxYZbBooking: +38162/164-57-76 DachaFollow J FADO:Instagram: https://bit.ly/3rGmWFw🎵 Muzika: Voyage, J Fado🎵 Tekst: Voyage, J Fado🎵 Aranžman: Beyjan beatsRežija: Nemanja NovakovićDirektor Fotografije: Nemanja NovakovićProducent: Aleksandar PejčićScenografija: Orjen DjurićVideo produkcija: NN-media +38162357368Beauty TeamŠminka: Aleksandra GavrićFrizer: Aleksandar GligorijevskiStilista: Vanja Pantin#Voyage #JFado #JuzniVetarUbrzanje #SoccerBetZahvaljujemo se našem sponzoru: Web: https://soccerbet.rs/ Instgram: https://www.instagram.com/soccerbet.rs/Zahvaljujemo se: Atera Business SuitesZabranjeno je svako kopiranje video i/ili audio snimaka i postavljanje na druge kanale! ©Copying, re-uploading and illegally distributing this copyrighted work is strictly prohibited! ©"
"TWy3aViHYXM","Ich VERWANDEL mein 1.000€ RC AUTO in einen TESLA CYBERTRUCK! (Unzerstörbare Karosserie)","2021-04-03T16:36:48Z","UCPFhnt7T8iaBLp1wIfFRzFw","Johnny Hand","28","21.06.04","johnny hand|johnny hand rc auto|johnny hand rc|rc auto|rc auto test|rc auto unboxing|elektro auto|1000€ rc auto|rc auto tuning|rc auto umbau|traxxas xmaxx|xmaxx rc auto|tesla cybertruck|tesla cybertruck rc auto|rc auto fail|neues rc auto","150813","8699","287","592","https://i.ytimg.com/vi/TWy3aViHYXM/default.jpg","False","False","Ich VERWANDEL mein 1.000€ RC AUTO in einen TESLA CYBERTRUCK! (Unzerstörbare Karosserie)📷Noah Cusoms auf Insta ➡️https://www.instagram.com/noah_customs/➥ Für mich das BESTE Rc Auto: https://amzn.to/3d05beN➥ Originale 4s Akkus für Traxxas X-Maxx: https://amzn.to/2NKOnzS➥Günstigere Akkus für Traxxas X-Maxx: https://amzn.to/3rfqEWf➥Mein Ladegerät: https://amzn.to/2QyADJI➥Gutes günstiges Ladegerät: https://amzn.to/2OUlguM➥ Original Ladegerät + Akkus Combo: https://amzn.to/3lP8UzR►Business Anfragen an: sogehtsrichtig92@web.deBei einem mit ➥ gekennzeichneten Link handelt es sich um einen Affiliate-Link, an dem ich als Werbevermittler durch eine kleine Provision vergütet werde. Es entstehen für euch keinerlei Zusatzkosten noch Benachteiligungen. Dadurch unterstützt ihr aber meinen Kanal. Danke!"
"r_wfIlIyb1c","📍 ISTANBUL VLOG","2021-04-03T10:30:03Z","UCcPQ61cfBu9Tj0vyQmgNYbA","justin","22","21.06.04","jstn|jstin|justin|fashion|style|street|top|best|outfit|outfits|german|deutsch|youtube|youtuber|peso|produktion|vlog|vlogging|istanbul|portugal|kollektion|jet|privatjet|flug|türkei|deutschland|köln|cologne","264015","33722","840","865","https://i.ytimg.com/vi/r_wfIlIyb1c/default.jpg","False","False","· High Quality Basics von Peso: http://pesoclo.com (#werbung)· Peso Instagram: http://instagram.com/pesoclo· Mein Zweitkanal: http://youtube.com/justinLITE· Mein Instagram: http://instagram.com/jstin-------------· Snapchat: jstnxvii-------------Bei dem Instagram-Link zu @pesoclo handelt es sich um Werbung für meine eigene Marke! :)"
"HJuUP-0PcBg","Ostergrüße 2021 WhatsApp kostenlos Liebe Grüße zu Ostern senden Frohe Ostern Gruß Liebe Grüße","2021-04-03T18:15:01Z","UCfd8-d70tJXUBR-9zamW53A","The Handyman","26","21.06.04","Ostergrüße|ostergruß 2021|ostergrüße lustige|grüße ostern|gruß ostern|ostergrüße freunde|ostergrüße kostenlos|ostergrüße witzig|ostergruß|ostergrüße senden","64742","383","151","165","https://i.ytimg.com/vi/HJuUP-0PcBg/default.jpg","False","False","Liebe Grüße zu Ostern. Ich wünsche dir ein frohes Osterfest. Videogrüße, Grußbotschaft, Grüße zu Ostern zum weitersenden per whatsapp, E-Mail, Facebook oder SMS an Freunde, Familie, Bekannte, Verwandte oder Kollegen.Hier kostenlos abonnieren: https://www.youtube.com/c/TheHandyman81Folgt mir auf Instagram & Facebookhttps://www.instagram.com/the_handyman81/https://www.facebook.com/The-Handyman-257368118030919/Quelle: Bild von anncapictures auf Pixabay#Ostern #Grußvideo #Grüße"
"Fp9pNPdNwjI","Marvel Studios’ Black Widow | New Trailer","2021-04-03T16:00:41Z","UCvC4D8onUfXzvjTOM-dBfEA","Marvel Entertainment","24","21.06.04","marvel|lack widow|scarlett johansson|black widow trailer|natasha romanoff|avengers|trailer|black widow movie|florence pugh|movie|clip|scene|superhero|mcu|david harbour|black widow disney plus|rachel weisz|marvel studios|red guardian|movies|movie clip|the avengers|adventure|black|official|new trailer|2021|black widow 2021|marvel cinematic universe","8299894","406470","5499","20141","https://i.ytimg.com/vi/Fp9pNPdNwjI/default.jpg","False","False","We have unfinished business. See Marvel Studios’ “Black Widow” in theaters or on Disney+ with Premier Access on July 9. Additional fee required.► Watch on Disney+: https://bit.ly/2XyBSIW► Subscribe to Marvel on YouTube: http://bit.ly/WeO3YJFollow Marvel on Twitter: ‪https://twitter.com/marvelLike Marvel on Facebook: ‪https://www.facebook.com/marvelWatch Marvel on Twitch: https://www.twitch.tv/marvelReward your Marvel fandom by joining Marvel Insider!Earn points, then redeem for awesome rewards.Terms and conditions apply. Learn more at https://www.marvel.com/insider?Osocial=YT&CID=MarvelInsiderFor even more news, stay tuned to:Tumblr: ‪http://marvelentertainment.tumblr.com/Instagram: https://www.instagram.com/marvelPinterest: ‪http://pinterest.com/marvelofficialReddit: http://reddit.com/u/marvel-official"
"q4dANhP7BVg","Parkour - Animation vs. Minecraft Shorts Ep. 22","2021-04-03T11:00:17Z","UCbKWv2x9t6u8yZoB3KcPtnw","Alan Becker","1","21.06.04","[none]","8554048","398377","6055","26987","https://i.ytimg.com/vi/q4dANhP7BVg/default.jpg","False","False","Nothing bad ever happens in a friendly parkour competition, right?Full Animation vs. Minecraft Playlist: https://bit.ly/37Nr9zj​👕MERCH ► https://alan-becker.creator-spring.com/🕹️ANIMATORS VS GAMES ► https://www.youtube.com/AnimatorsVSGames📷INSTAGRAM ► http://www.instagram.com/alanbecker​ ✏️TWITTER ► http://twitter.com/alanthebecker​💬DISCORD SERVER ► https://discord.gg/Ksd7b86​ #alanbecker​ #animation​ #shorts"
"4Bij1GZQJMo","ALKOHOL am Steuer! BETRUNKEN wegen MON CHERI - Geht das? | Selbstexperiment | Survival Mattin","2021-04-03T06:00:01Z","UCyQAraT4FYcXgnUTLOj796Q","SurvivalMattin","24","21.06.04","ALKOHOL am Steuer! BETRUNKEN wegen MON CHERI - Geht das? | Selbstexperiment | Survival Mattin|survival mattin|survival mattin betrunken|survival mattin selbstexperiment|betrunken durch mon cheri|mon cheri|durch mon cheri betrunken|betrunken wegen moncherie|alkohol am steuer|alkohol am steuer experiment|betrunken von mon cheri|betrunken von moncheri|survival mattin moncheri|survival mattin alkohol","349057","21038","594","1120","https://i.ytimg.com/vi/4Bij1GZQJMo/default.jpg","False","False","ALKOHOL am Steuer! BETRUNKEN wegen MON CHERI - Geht das? | Selbstexperiment | Survival MattinZum Energie Drink von Runtime → https://runtime.idevaffiliate.com/idevaffiliate.php?id=2063&tid1=youtube20210403Rabattcode (10%) → SURVIVALMATTIN (*)Ausrüstung aus dem Video:Mon Cheri Pralinen: https://amzn.to/3cChDTb (*)Dräger Messgerät: https://amzn.to/2Pn72m3 (*)Biergläser: https://amzn.to/3rGX3VU (*)Polizei Ausrüstung: https://amzn.to/3cAasL1 (*)Polizei Uniform: https://amzn.to/3cAlv7a (*)Gamsbokk Hose BushcrafterPants: https://www.gamsbokk.de/shop/hosen/bushcrafter-pants/Chris/RELOADIAK Youtube Kanal: https://www.youtube.com/user/RELOADIAKMATTIN Live YouTube KANAL: https://www.youtube.com/channel/UC5iYuXSliCgk_mtUJa25eoQSurvival Mattin PATCHES https://gearjunk.com/survivalmattin (*)NECK KNIFE von Mattin: https://amzn.to/2IWRJKa (*)Mattins MESSER: https://amzn.to/2lO6O96 (*)Survival Mattins Kamera: https://amzn.to/2ntLZjE (*)Kamera 2 (Schnittbilder): https://amzn.to/2nvD4OF (*)Mayas Kamera: https://amzn.to/2lXs6B2 (*)Drohne : https://amzn.to/2lXAtwk (*)Survival Mattin Hymne von Lukas Litt: https://youtu.be/bWljaL5XlxU© Copyright Filminhalte sind Eigentum von „u.ü.n.k. Production“Bei den mit (*) markierten Links handelt es sich um Partnerlinks durch welche ich eine kleine Provision bekomme, wenn ihr auf die LINKS raufklickt und etwas bestellt. Wer mich unterstützen mag, ist dadurch herzlich eingeladen. Dadurch entstehen euch natürlich keine zusätzlichen Kosten."
"NDef1gdsvbE","SIE MACHT SICH AN JONAS EMS RAN! - Folge 3 I Villa der Liebe (Among Us in Reallife)","2021-04-03T14:00:18Z","UCxu6buvs6eYtmAnC0xtJIhg","Villa der Liebe","22","21.06.04","villa der liebe|krass klassenfahrt|liebe|dating|jonas ems|jonas wuttke|vila der liebe|die villa der liebe|vila|parodie|Parodie|drama|Drama|among us|among us in realllife|among us in reallife turnier|gaming|vdlauir","130299","7858","227","213","https://i.ytimg.com/vi/NDef1gdsvbE/default.jpg","False","False","Während sich ROT auf die Mission begibt und vergeblich versucht einen Streit zwischen SCHWARZ und ORANGE anzustiften, will auch DUNKELGRÜN unbedingt ihre Aufgabe erfüllen. Alle wollen als Sieger nach Hause gehen! Aber nur einer kann gewinnen...--------Werbung I Jetzt auf TVNOW streamen: https://www.tvnow.de/specials/villa-der-liebe-rabattaktion?utm_source=youtube&utm_medium=kooperation&utm_campaign=beschreibung&utm_term=villaderliebe 🌹 VILLA DER LIEBE KANAL: https://www.youtube.com/channel/UCxu6buvs6eYtmAnC0xtJIhg🌹 VILLA DER LIEBE INSTAGRAM: https://www.instagram.com/villaderliebe_official/🌹 VILLA DER LIEBE TIKTOK: https://www.tiktok.com/@villaderliebe_official❗ LEUTE, folgt JETZT allen Beteiligten❗💗 JONAS EMS (Jonas): https://www.youtube.com/user/uFoneTV💗 JONAS WUTTKE (Jonas): https://www.youtube.com/channel/UC5XbGYYAazZi02btPCwsemA 💗 TIM RASCH (Tim): https://www.instagram.com/tim_rasch/💗 VANESSA COUPLEONTOUR (Vanessa): https://www.instagram.com/coupleontour/💗 INA COUPLEONTOUR (Ina): https://www.instagram.com/coupleontour/💗 REGINA HIXT (Regina): https://www.instagram.com/reginahixt/💗 KEANU RAPP (Keanu): https://www.instagram.com/keanu/💗 THEO CAROW (Theo): https://www.instagram.com/theocarow/💗 MARIBEL TODT (Maribel): https://www.instagram.com/maribeltodt/💗 MELISSA MINH (Melissa): https://www.youtube.com/channel/UC_p6rgs6J6zBuLWt7AqMKwQ💗 LARISSA NEUMANN (Larissa): https://www.instagram.com/tigerlariz/💗 LINA BMN (Lina): https://www.instagram.com/linabmn/💗 GERRIT MAYBAUM (Gerri): https://www.instagram.com/gerrisnewgroove/🎥 Die Crew 🎥ren/▸ JONAS EMS (Produktion): https://www.youtube.com/user/uFoneTV▸ JONAS WUTTKE (Produktion): https://www.youtube.com/channel/UC5XbGYYAazZi02btPCwsemA▸ NELSON DEPAYZE (Regie): https://www.instagram.com/nelson.depayze/▸ GERRIT MAYBAUM (Regie): https://www.instagram.com/gerrisnewgroove/▸ LORIS ZIMMERLI (Regieassistenz): https://www.instagram.com/loriszimmerli/▸ FELIX KIRCHNER (Produktionsleitung): https://www.youtube.com/channel/UCbv9Amr7CMHtCJPK00IIPNw?view_as=subscriber%3D1▸ TOBIAS WACKER (Kamera & Bildregie): https://www.instagram.com/tobiaswacker/▸ PAUL LENDZIAN (Kamera & Bildregie): https://www.instagram.com/paullendzian/▸ MERLIN SLAMANIG (Ton): https://www.instagram.com/merlinsla/▸ PATRICK ZÖLLIG (Cut): https://www.instagram.com/_patrickdaniels_/▸ THERESA GEISSINGER (Social Media Content, Fotografie): https://www.instagram.com/theresa_sophie_less/▸ PAULA GORCZYCA (TikTok Content): https://www.instagram.com/whospg/▸ THIERRY SKOLUDA (Set Runner): https://www.instagram.com/thierry.jos/📩 Geschäftliche Anfragen / Kooperationsanfragen: business@moonvibe.comVilla der Liebe:Eine Produktion von moonvibe GmbH🐺 MOONVIBE | https://moonvibe.de/🐺 MOONVIBE INSTAGRAM KANAL: https://www.instagram.com/moonvibe_de/🔻 VILLA DER LIEBE KANAL: https://www.youtube.com/channel/UCxu6buvs6eYtmAnC0xtJIhg🔻 VILLA DER LIEBE INSTAGRAM: https://www.instagram.com/villaderliebe_official/🔻 VILLA DER LIEBE TIKTOK: https://www.tiktok.com/@villaderliebe_official"
"JrlOvPCVp-E","RedStar - Ech Mazel Feat JenJoon (official video)","2021-04-03T16:30:15Z","UC4m5L8brApVSVe_AoD_Lw4w","RedStar","10","21.06.04","redstar|gga|redstarradi|raptunisien|rapalgerien|rapsousse|rapexclusif|raptn|rapdz|jenjoon|ratchopper|mmgentertainment|mmg|mkadagroup|aligezgez|aymenbenamor","2197483","123041","1945","7540","https://i.ytimg.com/vi/JrlOvPCVp-E/default.jpg","False","False","Ech Mazel - Khrafa EPProduced by Ratchopper Presented by MMG EntertainmentDirected by Yassine TabkaPostprod by houssem dhahbiSpecial thanks to AWS"
"1dIIUgRnjEo","Telling my wife “my girlfriend’s coming you need to hide” #shorts","2021-03-27T19:04:53Z","UC3zZX4ttC52HlqVis7eQ-Hg","Matt & Abby","22","21.06.04","my girlfriend’s coming you need to hide|Prank|Matt and Abby|Abby and Matt","2824354","119222","3299","704","https://i.ytimg.com/vi/1dIIUgRnjEo/default.jpg","False","False","Her reaction 😳🤣 #shortslots of fun photos coming your way on Instagram:@abbyelizabethoward@_matt_howard_also... you should follow us on TikTok:@matt_and_abbyMerch: https://urfavmerch.com/matt-abby/"
"JNSC2cyaoX8","Corona-Protest in Stuttgart ohne Masken und Abstand | AFP","2021-04-03T15:07:55Z","UCCjkK_Qk9BUytDlAzz0iCZw","AFP Deutschland","25","21.06.04","BERICHT|DEUTSCHLAND|BADEN|WÜRTTEMBERG|STUTTGART|PANDEMIE|CORONAVIRUS|DEMONSTRATION|QUERDENKEN|GEGENDEMONSTRATION|POLIZEI|AFP|NEWS|ACTU|INFO","143692","3912","984","0","https://i.ytimg.com/vi/JNSC2cyaoX8/default.jpg","True","False","In Stuttgart haben zahlreiche Menschen unter anderem aus der sogenannten Querdenken-Bewegung gegen die Corona-Maßnahmen demonstriert. Laut Polizei trugen viele Demonstranten auch nach Aufforderung keine Masken und hielten Abstände nicht ein. Auch Gegendemonstranten waren auf den Straßen.Subscribe to AFP and activate your notifications to get the latest news 🔔https://www.youtube.com/channel/UCCjkK_Qk9BUytDlAzz0iCZw/?sub_confirmation=1"
