video_id,title,publishedAt,channelId,channelTitle,categoryId,trending_date,tags,view_count,likes,dislikes,comment_count,thumbnail_link,comments_disabled,ratings_disabled,description
"RXZy8BbMz_U","Teaching Jake about the Camcorder, Jan '97","2021-03-03T17:00:27Z","UCakAg8hC_RFJm4RI3DlD7SA","brian david gilbert","1","21.04.03","brian|david|gilbert|BDG|funny|humor|music|song|awkward|comedy|songs|singing|brian david gilbert|camcorder|teaching jake|jake|vhs|vcr|vhs camcorder|scary|horror|video camera|crt|tv|mustache|goatee|dad|son|father|glitch|rewind|bitmus park|steven spielberg|recording|rewind button|terror|frightening|scream","351518","58638","254","6574","https://i.ytimg.com/vi/RXZy8BbMz_U/default.jpg","False","False","attaboyjoin my patreon to see some behind the scenes of how i made this video: https://patreon.com/briandavidgilbertwith help from karen han: https://twitter.com/karenyhanthis is where brian david gilbert is: https://twitch.tv/briandavidgilberthttps://twitter.com/briamgilberthttps://instagram.com/briamgilbert"
"QKoR4d_aIYc","I TOOK TENNESSEE THRESH OUT FOR THE DAY 😍 *I THINK I LIKE HER 😳*","2021-03-02T18:15:13Z","UCHOUVSWe-fX1WUcFjK8QxdQ","TheMkWay","22","21.04.03","Mkfray|Tennessee Thresh","72329","7772","94","814","https://i.ytimg.com/vi/QKoR4d_aIYc/default.jpg","False","False","MAIN CHANNEL: Mkfrayhttps://www.youtube.com/channel/UCiTYUFWXAdIufyN2d7rXZywREDDIT: r/Mkfrayhttps://www.reddit.com/r/Mkfray/MY SOCIALS INSTAGRAM: mkfrayhttps://instagram.com/mkfray?igshid=ae4h1w9waxrdSNAPCHAT: makfray https://www.snapchat.com/add/makfrayTIKTOK: mkfray https://vm.tiktok.com/EfhCuP/Turn On Post Notifications 🔔 Business Inquiries: mkfray@thewallofcomedy.com"
"-024Swollbc","We sold my bike for charity! Find out who got it and more","2021-03-03T15:00:00Z","UCOpP5PqrzODWpFU961acUbg","Berm Peak Express","26","21.04.03","do it yourself|diy|tools|home|backyard|mountain biking|cycling|outdoors","146873","11715","60","713","https://i.ytimg.com/vi/-024Swollbc/default.jpg","False","False","Today we actually send the P7 off to its new home! After multiple eBay mishaps (and the last time we use it to sell a bike) this chapter is finally over.Shoutout to Competitive Cyclist for sponsoring the original build. Shop somewhere with expert Gearheads that you can actually call on the phone! https://bit.ly/2EO2AYBCheck out Jared's Channel here: https://youtube.com/channel/UCYIHUs5CJnaxGidbYv-vuIQSee the original video here https://youtu.be/39fCKTCOg8ABerm Peak Jerseys https://cognativemtb.com/collections/seths-bike-hacks-collection/products/berm-peak-tech-jersey-tealWant us to review your unique mountain bike or outdoor product? https://www.sethsbikehacks.com/product-review/Check out our main channel https://youtube.com/c/sethsbikehacksFollow me on Instagram https://instagram.com/sethsbikehacksBerm Peak Merch https://cognativemtb.com/collections/seths-bike-hacks-collectionMusic in this video is from http://share.epidemicsound.com/trQSgand https://soundstripe.com?fpr=seth20#mountainbikingI'm also working on a long-term moonshot project: Building a free public bike park in the Asheville metro area. Join my Patreon and 100% of the proceeds go towards funding this. https://www.patreon.com/sethsbikehacksAdvertising disclosure: All of these videos contain products, logos, or mentions associated with Diamondback Bicycles. Whether or not the video itself was sponsored by Diamondback, they do support this channel, and by extension, every video on it."
"2t6ZpD66h6k","When Supermarkets Rip-Off Brands | Foil Arms and Hog","2021-03-04T08:00:03Z","UCzb-6smlTg5UPirLdsdQ_cQ","Foil Arms and Hog","23","21.04.03","Foil Arms and Hog|Irish Comedy|Sketch|Funny|Comedy|Ireland|Comedian|Jokes|Laugh","59685","7873","24","865","https://i.ytimg.com/vi/2t6ZpD66h6k/default.jpg","False","False","When Supermarkets Rip-Off Brands | Foil Arms and HogThe first full length episode of 'SQUATTERS' our very own SITCOM premieres next week, Thursday 11th MarchHere's the pilot episode we did last year:https://youtu.be/yy00xMn99QAIf you'd like to support us making these videos we have a Patreon page here: https://www.patreon.com/foilarmsandhogDownload 5 of our filmed LIVE shows here :-)https://foilarmshog.com/DownloadMERCH from our website: http://www.foilarmsandhog.ie/merchIf you would like to help out by translating this video into another language you can do so here: https://amara.org/en/videos/9zmC4p1qjMbf/info/when-supermarkets-rip-off-brands-foil-arms-and-hog/  We'd really appreciate it as would all the non native English speakers and the hard of hearing! So basically you'd be a legend.SUBSCRIBE ➡ http://www.youtube.com/foilarmsandhogLIVE SHOWS ➡ http://www.foilarmsandhog.ie/tourMERCH ➡ http://www.foilarmsandhog.ie/merchFACEBOOK ➡ http://www.facebook.com/foilarmsandhogINSTAGRAM ➡ https://www.instagram.com/foilarmsandhog/TWITTER ➡ http://www.twitter.com/foilarmsandhog"
"6vNh-QW6Hlc","Sub Urban - Cirque [Official Music Video]","2021-03-03T20:00:14Z","UCqAil6_A1dWHdFXzOwVLqlg","Sub Urban","22","21.04.03","sub urban|cradles|sub urban cradles|freak|sub urban freak|rei ami freak|suburban cradles|suburban|tiktok|tiktok songs|tiktok songs 2020|sub urban tiktok|cradles tiktok|cirque|thrill seeker|sub urban thrill seeker|bella poarch|bella poarch music video|sub urban bella poarch|bella poarch cirque|sub urban official music video|sub urban cirque video|sub urban new music video","690272","150112","975","14345","https://i.ytimg.com/vi/6vNh-QW6Hlc/default.jpg","False","False","MERCH & ANNOUNCEMENTS: https://www.thatsuburban.comDebut EP 'Thrill Seeker' is out now: https://suburban.lnk.to/ThrillSeekerFollow Sub Urban:https://www.instagram.com/thatsuburban/https://www.tiktok.com/@thatsuburbanhttps://twitter.com/thatSubUrbanhttps://www.facebook.com/thatSubUrban/https://open.spotify.com/artist/7gXb99Sf9nNmpNYeAgIQFG?si=yjYjkA4NQzGqEYDeQihTsQhttps://music.apple.com/us/artist/sub-urban/429426385Follow Bella Poarch:https://www.tiktok.com/@bellapoarchhttps://www.instagram.com/bella.poarch/https://twitter.com/bellapoarchCredits: Director - Andrew DonohoStory & Creative – Sub UrbanProducer - Valerie BushExecutive Producer - Ryan HuffmanProduction Company - Huffman CreativeHead of Production - Luke ArreguinManager, Production - Katie SarrelsProduction Supervisor - Julio Mata Jr.Production Manager - Christine ParkProduction Coordinator - Chris FishLabel - Warner RecordsVP of Creative Services - Devin SarnoVP of A&R - Stefan MaxBella's MGMT - Aryan MahyarDirector Rep - Doug KlingerDirector of Photography - Nick Bupp1st AC - Bryce Platz2nd AC - Dusty SaundersSteadicam - Erdem ErtalDIT - Sydney SchnurrenbergerBTS - Lorenzo Belassen1st AD - Peter Maestrey2nd AD - Dustin GodwinGaffer - Blake FarmerBBE - Isaak Van Der MeulenElectric - Joe EscandellElectric - Matt TuppenKey Grip - Alex PicassoBBG - Mikey TellGrip - Jose AguilarGrip - Ryker WellsGrip - Daniel VlahosGrip - Nathon GiordanoProduction Designer - Tyler JensenArt Coordinator - Marisa PapaveroSet Decorator - Sandra VictoriSet Dresser - Joseph SalcedoLeadman - Danny ErbSet Dresser - Eric MooreSet Dresser -  Jesse HotchkissSet Dresser - Cesar MojicaSet Dresser - Jason SmithSet Dresser - Tony BarberStylist - Lisa MadonnaStylist Assistant - Chelsie BakerBP Hairstylist - Rachel LitaBP Makeup - Kenna ReefBP's Team - Becky BoltonTwo Feet's Team - Geoffey HuffordHMU Department Head - Alex PerroneKey Hair/Makeup - Mazena PukstoHair/Makeup - Joanna KleinHair/Makeup - Leilani SunglaoHair/Makeup - Heather GalipoHair/Makeup - Orlando MarinProduction Assistant - Jesse AlexanderProduction Assistant - AJ RinellaProduction Assistant - Samuel SmootProduction Assistant - Nigel CoxProduction Assistant - Libby StewartProduction Assistant - Elle KeseleyProduction Assistant - Nick ReynoldsProduction Assistant - Melody GonzalazCasting Director - Michael BeaudryCOVID Compliance Officer - Cerra MendezStunt Coordinator - Webster WhineryStunts - Jose Luis VasquezStunts - Vinny O'BrianStunts - Brian McCoyStunts - Rowbie OrsatiStunts - Craig JensonEditor - Andrew DonohoAssistant Editor - Sydney SchnurrenbergerColorist - Jacob McKeeVFX Creature Animation - Picture WizardsVFX Simulations - Senzo StudioCompositing Supervisor - Andrew DonohoCompositor - Ryan GameRotoscoping - Purple PatchMobster - Ego MikitasMobster - Matthew DorioMobster - Anthony AmorelloBurlesque Dancer - Jenna StockmanBurlesque Dancer - Michelle DionBurlesque Dancer - Angel RodriguezBurlesque Dancer - Leah FicarolaPolice Officer - Zachary ChicosPolice Officer - Al BurkePoker Player - Dan GregoryPoker Player - David Alan GrafPoker Player - Yolanda EsquivelPoker Player - Zone SheatsMobster/General Extra - Daniel DoranMobster/General Extra - Michael DoranGeneral Extra - Alan BornemannGeneral Extra - Brett BenowitzGeneral Extra - Kevin DavisGeneral Extra - Michael FarmerGeneral Extra - Elijah McKinleyGeneral Extra - Logan AndrewsGeneral Extra - Hannah McBrydeGeneral Extra - Arlondriah LenyeaGeneral Extra - Megan WilliamsGeneral Extra - Miki KanekoLyrics:Hear her talkin' 'bout that mainstreamGot it real easy like she got the callbackDroppin' underneath that eave breezeWanna watch her knees weakWhen they pass my name backYou know you sound c*cky as f*ckBut go and try, good f*ckin' luckSo if you ask to come and see meShow some f*ckin' dignityDon't tell me how to live lifeAnd I make it go (Boom), back at it againDon't need to be in love to have a little romanceSing it on the spot to watch the crowd danceAnd even if they're petrified, I hear their hearts pranceAnd I can be free from raw tyrannyMan, f*ck my emotions, they're ghostin' and moanin' all day on repeat(Woo)(Uh)We can fall in love or we can go insaneWe can play it rough or we can, we can play it safeDon't matter what's above, our destinies are madeWhy give us f*ckin' lemons if I can just buy lemonade?And I make it go (Boom), back at it againDon't need to be in love to have a little romanceSing it on the spot to watch the crowd danceAnd even if they're petrified, I hear their hearts pranceAnd I can be free from raw tyrannyMan, f*ck my emotions, they’re ghostin' and moanin' all day on repeat('Round and around we go)('Round and around we go)#SubUrban #Cirque"
"wjKz3toMbsE","BUYING MY FIRST SUPERCAR!!","2021-03-02T19:34:38Z","UC0S5w-TQJywcsni8ZMzgqkg","LivingLifeFast","2","21.04.03","llf|bmw|m3|m4|m4gts|m4cs|competitionpack|m4cp|2018m4|livinglifefast|vw|audi|rs3|vlogging|vlog|car|vlogger|ricky|senior|rickysenior|f82m4|f82|lci|facelift|superm4|720bhp|700bhp|pureturbos|ricky and emma|supercar|buying my first supercar|mclaren|720s|claritycoat|570s|675lt|supercar collection|my new car","85612","4957","206","818","https://i.ytimg.com/vi/wjKz3toMbsE/default.jpg","False","False","Justin ClarityCoathttps://claritycoat.com/Follow MeInstagram - https://www.instagram.com/livinglifefast_llf/Facebook - https://en-gb.facebook.com/www.livinglifefast.co.uk/Inquiries Personal: Ricky@livinglifefast.comBusiness: livinglifefast@hub7brands.comMusic by Epidemic Soundhttps://www.epidemicsound.com/"
"TUwNC1wcwxM","I Bought an AS-IS $90,000 Mercedes AMG at Auction and got 50% OFF (Twin Turbo C63s)","2021-03-02T19:00:05Z","UCtn2hU9HKYQAgDtwrhux7Sw","Samcrac","2","21.04.03","exhaust|install|diy|armytrix|custom|modified|modded|AMG|C63s|c63|Mercedes|Mercedes-Benz|German|BMW|salvage|rebuilt|samcrac|samcracc|twin turbo|drag strip|0-60|fast|deal|discount|price|methanol|downpipe|catless|catted|weistec|eurocharged|built|transmission build|build|project|auto|automotive","456469","22460","503","1934","https://i.ytimg.com/vi/TUwNC1wcwxM/default.jpg","False","False","Armor Shield IX Ceramic Coating Kit: https://bit.ly/3kANEgOFor $25 off Use Code: samcrac#ARMYTRIX Supreme Exhaust Systems Youtube Channel: http://bit.ly/3sISA6cEurocharged Orlando Florida: http://bit.ly/36unFSb​ or call (407) 960-4517I bought an As-Is Mercedes-Benz C63s AMG Twin Turbo V8 at the Auto Auction recently and I finally hit the jackpot on a very modified custom built AMG for a bargain price. Amazing Mercedes C63 AMG deal.Instagram: https://www.instagram.com/samcracc/​​​​Email Me: SamcracAuto@gmail.com"
"XROvVSpSvG4","UFC 259 Embedded: Vlog Series - Episode 2","2021-03-02T18:56:23Z","UCvgfXK4nTYKudb0rFR6noLA","UFC - Ultimate Fighting Championship","17","21.04.03","ufc|ultimate|fighting|championship|champion|champ|embedded|episode|series|mma|ultimate fighting championship|UFC Apex|Apex|Las Vegas|Jan|Blachowicz|Israel|Adesanya|Petr|Yan|Aljamain|Sterling|Amanda|Nunes|Anderson|Three|Title|Fights|megan","1261587","24972","340","4241","https://i.ytimg.com/vi/XROvVSpSvG4/default.jpg","False","False","Presented by Hyperice, Jan Blachowicz visits Hoover Dam. Petr Yan, Islam Makhachev and Aleksandar Rakić put in time at the UFC PI. Israel Adesanya arrives in Las Vegas. Aljamain Sterling impresses his teammates during a training session. Visit https://hyperice.com/Subscribe to get all the latest UFC content: http://bit.ly/2uJRzRRExperience UFC live with UFC FIGHT PASS, the digital subscription service of the UFC. Visit https://ufcfightpass.com/To order UFC Pay-Per-Views on ESPN+, visit https://bit.ly/2vNIBE8 (U.S. only)To order UFC Pay-Per-Views, visit http://welcome.ufcfightpass.com/#PPV (Non U.S.)Connect with UFC online and on Social:Website: http://www.ufc.comTwitter: http://www.twitter.com/ufcFacebook: http://www.facebook.com/ufcInstagram: http://www.instagram.com/ufcSnapchat: UFCPeriscope: http://Periscope.tv/ufcConnect with UFC FIGHT PASS on Social:Twitter: http://www.twitter.com/ufcfightpassFacebook: http://www.facebook.com/ufcfightpassInstagram: http://www.instagram.com/ufcfightpass#UFC259"
"hKOWts1VvFA","I Might Be Pregnant For The Wedding!!","2021-03-02T22:45:00Z","UCnM1ay_QoQOpa1N2iejLA7A","Jatie Vlogs","1","21.04.03","i might be pregnant for the wedding|taking a pregnancy test|pregnant|pregnancy test|shes preegnant|were pregnant|telling my fiance im pregnant|telling my boyfriend im pregnant|im pregnant|getting pregnant before our wedding|our wedding|were getting married|married|wedding|jatie|jatie vlogs|jatie vlogs wedding|jatie vlogs pregnant|jatie vlogs pranks|josh and katie|josh brueckner|katie betzing","552463","32298","351","3663","https://i.ytimg.com/vi/hKOWts1VvFA/default.jpg","False","False","I might be pregnant for the wedding!! VIP: https://www.jatievip.com/PROPOSAL VID: https://youtu.be/U7VEN2EZkI8Tiktok: @joshxkatie-PRANK WARS-You can look but you CANT touch prank: https://youtu.be/WtVe0typDVIBeing PDA in front of our friends: https://youtu.be/-MP2E1IiHXgBeing mean to my fiancé: https://youtu.be/Yi6T9UCslx0•Follow Us On Social Media•Instagram: @katiebetzing @JoshbruecknerFitness Instagram @J80FitTwitter: @ktbetzing @Joshbrueckner Snapchat: @k80betz @JoshbruecknerHow we met: https://youtu.be/Ed6MYkS1-eoKatie’s Main Channel: https://www.youtube.com/user/Beautygu...Business inquiries: j80vlogs@gmail.com"
"k7nV8Gyn56o","10 MIN BEST OF HIIT - a compilation of the best parts of my HIIT workouts - INTENSE I Pamela Reif","2021-03-03T04:30:09Z","UChVRfsT_ASBZk10o0An7Ucg","Pamela Reif","17","21.04.03","workout|training|abs|sickpack|flat|tummy|stomach|exercise|how to get|home workout|no equipment|sport|body fat|get thin|lose weight|fit|healthy|strong|instagram|keine gewichte|no weight|körpergewicht|pamela rf|muscle|madfit|bauchmuskeln|song|good mood|dance|happy|fun|bikini|summer|last minute|Chloe ting|quarantine|dancing|cardio|sweat|butt|booty|burn calories|music|hip|marshall|gute laune|choreo|hiit|high intensity|burn|fat|calorie|happy sweat|12min|r&b|fat burn","584493","26476","290","1710","https://i.ytimg.com/vi/k7nV8Gyn56o/default.jpg","False","False","SUCH A KILLER ROUTINE - but you won't notice while you're training (because it's also kind of happy). I was dripping sweat after only 1 round! ♥︎ Cardio is fun today! / Werbungomg I am so exciteeeeeed! A combination of your (and my :D) favorite parts of the 15min Happy Dance, 12min Happy Sweat, 12min Happy Cardio & 10min R&B Dance. Basically, it's mostly about the last, super high energy songs! The parts that we put all our energy into, that we sweat it all out & feel so happy afterwards. This is my favorite HIIT workout ever now. It's SUPER DUPER intense, will kick your ass, but it will also kick the 12min Happy Cardio from it's throne haha. At least for my personal taste. Let me know what you think!!! ▸ burn lots of calories ▸ improve your endurance ▸ main muscles worked: thighs, butt, abs (from all the high knees)▸ boost your mood & just be happyyyyyPS: thanks for helping me decide about the workout parts on Insta Stories! Always love to do whatever you like best :))__Apart form the good mood & I can also guarantee a serious number of burned calories here. ▸ I burned 90kcal in those 10min (which is a loooooot). Depending on your height, weight and fitness level this might vary between 80-160kcal. __▸ you can find FREE WORKOUT PLANS on my Instagram Channel. 30min, 45min and Beginner Friendly combinations. Check out the Highlight Bubble Workout Plans for that.  ➞ Instagram http://www.instagram.com/pamela_rf/use #PamelaReif if you want me to see your workout pics and videos! ▸ my Pam App ♥︎ Free workout plans, recipes & tips: https://appurl.io/5Exh2D1Uo __ I update my workout playlist weekly & it's available on Spotify, Apple Music, etc. ♥︎http://wmg.click/GetActive1. David Guetta feat. Nicki Minaj, Bebe Rexha & Afrojack - Hey Mama  2. Sam And The Womp - Bom Bom   3. Parx feat. Nonô - Feel Right Now4. Ciara - Level Up __Business Contact:pamela_reif@icloud.com__unterstützt durch Warner Music GermanyDisclaimer:When joining me for this workout video, you need to take some precautions as your health and safety is the most important. To avoid any injury or harm, you need to check your health with your doctor before exercising. By performing any fitness exercises without supervision like with this video, you are performing them at your own risk. See a fitness professional to give you advice on your exercise form. Pamela Reif will not be responsible or liable for any injury or harm you sustain as a result of this video."
"7NbqetcG588","THE ZEZE MILLZ SHOW: FT GHETTS - “I Have A Gift”","2021-03-02T20:00:01Z","UC31HGjPhqcrq74cVRdikdCg","TREND CENTRL","24","21.04.03","BKCHAT|LDN|The zeze millz show|Link up tv","49564","1876","25","231","https://i.ytimg.com/vi/7NbqetcG588/default.jpg","False","False",""
"b7t3aYSSLgE","The most embarrassing Sidemen tweets of all time...","2021-03-02T19:00:07Z","UCh5mLn90vUaB1PbRRx_AiaA","MoreSidemen","22","21.04.03","sidemen|moresidemen|miniminter|ksi|zerkaa|behzinga|tbjzl|vikkstar|wroetoshaw","2134226","122969","603","4944","https://i.ytimg.com/vi/b7t3aYSSLgE/default.jpg","False","False","• Sidemen: http://www.youtube.com/Sidemen• Sidemen Clothing: http://www.sidemenclothing.com• Sidemen Twitter: https://twitter.com/Sidemen---------------------------------------------------------------------Sidemen:• Miniminter: http://www.youtube.com/Miniminter• Zerkaa: http://www.youtube.com/Zerkaa• Behzinga: http://www.youtube.com/Behzinga• Vikkstar123: http://www.youtube.com/Vikkstar123• TBJZL: http://www.youtube.com/TBJZL• Wroetoshaw: http://www.youtube.com/Wroetoshaw• KSI: http://www.youtube.com/KSIedited by https://twitter.com/TegsRF"
"oIvDIn7SsI0","Why I Wouldn't Join The Sidemen","2021-03-02T18:46:37Z","UCKI_nC8ZYng9JmLcRbu1V_w","Stephen Tries Less","23","21.04.03","stephen tries|stephen tries less|steven tries|comedy|comedy videos|steven tries less|the sidemen|sidemen|stephen tries sidemen|eboys|assumptions|w2s|chris md|stephen tries assumptions|stephen tries school","173879","13501","87","348","https://i.ytimg.com/vi/oIvDIn7SsI0/default.jpg","False","False","This week i'm tackling all of your assumptions. Boy oh boy, you really don't know me at allIf you enjoyed this video please drop a tasty like and subscribe if you're feeling fruityMain channel - https://www.youtube.com/stephentriesPodcast - https://www.youtube.com/stephentriespodcastRyan - https://twitter.com/Ryan_LockMe - https://www.instagram.com/stephen_triesMusic by Prod. Riddiman"
"wu4tKs3mLSk","Jacksepticeye Speaks FLUENT Korean and SHOCKS OTHER STREAMERS","2021-03-02T16:00:20Z","UCYzPXprvl5Y-Sf0g4vX-m6g","jacksepticeye","24","21.04.03","jacksepticeye","2350599","296445","1236","15031","https://i.ytimg.com/vi/wu4tKs3mLSk/default.jpg","False","False","Jacksepticeye Speaks FLUENT Korean and SHOCKS OTHER STREAMERSMy COFFEE ☕: https://bit.ly/38CIixGTwitter 🐥: https://twitter.com/Jack_Septic_EyeInstagram 📷: http://instagram.com/jacksepticeyeEdited By: https://www.youtube.com/channel/UCHsjBlPYou_k7FgMKLCo5JA"
"u9OHTq4C-aI","Guess the Sidemen's Embarrassing Tweets ft. W2S","2021-03-01T20:12:00Z","UCmpWLoKQBVd5YPz0cYan_Xg","Callux","24","21.04.03","callux","918925","64464","295","1047","https://i.ytimg.com/vi/u9OHTq4C-aI/default.jpg","False","False","We each dug up old tweets and... here's what happened lolfollow NOTWOWAYS: https://instagram.com/notwowaysHarry: https://youtube.com/w2shttps://twitter.com/calluxhttps://instagram.com/callux__MY COMPANIES:notwowaysWebsite: http://www.notwoways.comInstagram: https://instagram.com/notwowaysTwitter: https://twitter.com/notwowaysAFTER PARTYWebsite: http://www.afterparty.studioTWITTER: https://twitter.com/AfterPartyLDNINSTA: https://www.instagram.com/afterpartystudios__If you see this comment saying ' HAHA MAD TINGS 'Business email: business @ callux.co.uk"
"ljgHhMvmgCg","The Miz vs. Bobby Lashley – WWE Championship Lumberjack Match: Raw, Mar. 1, 2021","2021-03-02T05:25:09Z","UCJ5v_MCY6GNUBTO8-D3XoAg","WWE","17","21.04.03","wwe|world wrestling entertainment|wrestling|wrestler|wrestle|superstars|कुश्ती|पहलवान|डब्लू डब्लू ई|मैच|सुपरस्टार|व्यावसायिक कुश्ती|مصارعه|wwe 2021|Raw|Bobby Lashley|The Miz|Shane McMahon|John Morrison|MVP|Shelton Benjamin|Cedric Alexander|Raw clips|raw videos|raw highlights|raw winners|monday night raw clips|monday night raw highlights|raw news|raw tonight|raw match card|miz vs bobby lashley wwe championship|wwe title","3536938","80683","5158","10328","https://i.ytimg.com/vi/ljgHhMvmgCg/default.jpg","False","False","Bobby Lashley finally gets his hands on The Miz with Raw Superstars surrounding the ring in a Lumberjack Match for the WWE Championship. Catch WWE action on WWE Network, FOX, USA Network, Sony India and more.WWE Network | Subscribe now: http://wwe.yt/wwenetwork---------------------------------------------------------------------Follow WWE on YouTube for more exciting action!---------------------------------------------------------------------Subscribe to WWE on YouTube: http://wwe.yt/Check out WWE.com for news and updates: http://goo.gl/akf0J4Watch WWE on Sony in India: http://www.wwe.com/SonySportsNetworkFind the latest Superstar gear at WWEShop: http://shop.wwe.com---------------------------------------------Check out our other channels!---------------------------------------------The Bella Twins: https://www.youtube.com/thebellatwinsUpUpDownDown: https://www.youtube.com/upupdowndownWWEMusic: https://www.youtube.com/wwemusicTotal Divas: https://www.youtube.com/wwetotaldivas------------------------------------WWE on Social Media------------------------------------Twitter: https://twitter.com/wweFacebook: https://www.facebook.com/wweInstagram: https://www.instagram.com/wwe/Reddit: https://www.reddit.com/user/RealWWEGiphy: https://giphy.com/wwe------------------------------------WWE Podcasts------------------------------------After the Bell with Corey Graves: https://wwe.com/afterthebellThe New Day: Feel the Power: https://wwe.com/feelthepowerUncool with Alexa Bliss: https://wwe.com/uncoolwithalexa"
"VYEtNWp5VgA","20 WOMEN VS 1 SIDEMEN: HARRY EDITION","2021-02-28T18:23:08Z","UCDogdKl7t7NHzQ95aEwkdMw","Sidemen","24","21.04.03","sidemen|sidemen sunday|#sidemensunday","10808420","795036","3445","61471","https://i.ytimg.com/vi/VYEtNWp5VgA/default.jpg","False","False","👉🏻 Subscribe to our 2nd Channel: https://www.youtube.com/MoreSidemen 👈🏻👕: Sidemen Clothing: http://www.sidemenclothing.com📸: Sidemen Instagram: http://www.instagram.com/Sidemen🐤: Sidemen Twitter: http://www.twitter.com/Sidemen✏️: SUBMIT A #SidemenSunday IDEA HEREhttps://forms.gle/JDuGrSzM4F6mdo6D9-----------------------------------------------------------------------------------------------------------------------▶️ SIDEMEN ◀️🔴 SIMON (Miniminter)● http://www.youtube.com/Miniminter● http://www.youtube.com/MM7Games● http://www.instagram.com/Miniminter● http://www.twitter.com/Miniminter🔵 JOSH (Zerkaa)● http://www.youtube.com/Zerkaa● http://www.youtube.com/ZerkaaPlays● http://www.instagram.com/Zerkaa● http://www.twitter.com/ZerkaaHD🔴 ETHAN (Behzinga)● http://www.youtube.com/Behzinga● http://www.youtube.com/Beh2inga● http://www.instagram.com/Behzingagram● http://www.twitter.com/Behzinga🔵 VIK (Vikkstar123)● http://www.youtube.com/Vikkstar123● http://www.youtube.com/Vikkstar123HD● http://www.youtube.com/VikkstarPlays● http://www.instagram.com/Vikkstagram● http://www.twitter.com/Vikkstar123🔴 TOBI (Tobjizzle)● http://www.youtube.com/TBJZL● http://www.youtube.com/Editingaming● http://www.instagram.com/Tobjizzle● http://www.twitter.com/Tobjizzle🔵 JJ (KSI)● http://www.youtube.com/KSI● http://www.youtube.com/KSIOlajidebtHD● http://www.instagram.com/KSI● http://www.twitter.com/KSIOlajidebt🔴 HARRY (W2S)● http://www.youtube.com/W2S● http://www.youtube.com/W2SPlays● http://www.instagram.com/Wroetoshaw● http://www.twitter.com/Wroetoshaw"
