video_id,title,publishedAt,channelId,channelTitle,categoryId,trending_date,tags,view_count,likes,dislikes,comment_count,thumbnail_link,comments_disabled,ratings_disabled,description
"Cu0TrTsoWuU","Recreating Sanders Sides INCORRECT QUOTES! - We Take Requests | Thomas Sanders & Friends","2021-02-27T16:04:08Z","UCU8JJqKH0JCyr8T_THGKSaQ","Thomas Sanders and Friends","23","21.01.03","thomas sanders|thomas sanders vines|thomas sanders vine compilation|thomas sanders vlog|thomas sanders channel|fanders|vine|thomas|sanders|ultimate|storytime|sanders sides|skit|skits|sketch comedy|dad|dad jokes|narrating people's lives|best vines|relatable","175250","34479","49","3678","https://i.ytimg.com/vi/Cu0TrTsoWuU/default.jpg","False","False","** WARNING: Un-bleeped curse word at 11:32 **There are definitely quotes from different pieces of media out there you all have felt could be applied to our characters, so in this episode, WE RE-ENACT SOME! Along with this request, Joan and I take on spur-of-the-moment haikus, pointless debates, and personality quizzes thanks to requests submitted by YOU!! Hope you all enjoy!!If you wanna join in the fun of these videos, especially LIVE as we film them, please check out our Patreon! You’d be helping us immensely!! www.patreon.com/ThomasSandersWanna take the Sanders Sides personality quiz we took in this video? Click here: https://uquiz.com/quiz/zJmjO9/which-sanders-sides-are-youThank you SO MUCH to my incredible friend, Joan, for joining me on this episode of We Take Requests! Joan’s Links: https://www.instagram.com/thejoanglebookAnd also a HUMONGOUS thank you to Talyn for joining in on the fun!Talyn’s Links:https://www.instagram.com/tallykat3https://www.twitter.com/tallykat3https://tallykat3.tumblr.com Also, HUGE thank you to Dominic for playing the angry waiter in one of the Incorrect Quotes scenes!Dominic’s Links:http://www.Instagram.com/DomGoldOfficialhttp://www.Twitter.com/DomGoldOfficialhttp://www.Facebook.com/DomGoldOfficialhttps://vm.tiktok.com/3VD2Er/YouTube:  @Dom Gold And OODLES OF THANK YOUS to Quil, who did Remus' and Janus' makeup for this video!!Quil's Links:https://www.instagram.com/quildarlinghttps://www.twitter.com/quildarlinghttps://vm.tiktok.com/ZMejjsNQx/Thank you to Sean who helped facilitate the livestream!Also, a GINORMOUS thank you to the editor of this video, Colleen, who came in clutch to bring this video to life!! This was her FIRST edit of a video of ours and I think she hit it out of the park!! Colleen also has her own YouTube channel and you can support her there!!Colleen’s Links:https://youtube.com/c/colliscoolhttp://www.Instagram.com/colliscoolhttp://www.Twitter.com/colliscoolAnd a GREAT BIG thank you to our friend, Brei, who helped make the thumbnail for this video!!Brei’s Links:http://www.Instagram.com/brei.gracehttp://www.Twitter.com/BreiGrace_______________________My Social Links: http://www.Twitter.com/ThomasSanders​​http://www.Instagram.com/ThomasSanders​​http://www.Facebook.com/ThomasSandersOfficialTikTok - https://vm.tiktok.com/ZMeN9NfyF/​Snapchat - Thomas_SandersTumblr - https://thatsthat24.tumblr.com/​​http://www.vine.co/ThomasSanders​​________________________Merchandise: North America/WorldWide: https://shop.thomassanders.com/​​________________________Business Inquires: business@fosterdawg.com________________________"
"mpszSy5h7kA","Fortnite Item Shop *NEW* PULL UP EMOTE! [February 27th, 2021] (Fortnite Battle Royale)","2021-02-28T00:04:18Z","UCIZP6nCTyU9VV0zIhY7q1Aw","I Talk","20","21.01.03","fortnite|fortnite battle royale|fortnite commentary|italkfortnite|fortnite item shop|fortnite new|fortnite funny|itf|fortnite chapter 2|season 5|fortnite season 5","359322","11808","205","1319","https://i.ytimg.com/vi/mpszSy5h7kA/default.jpg","False","False","Fortnite Item Shop right now on February 27th, 2021.Let's see what's in the Item Shop today!If you would like to support me with Support A Creator, be sure to use code ITF. You can use that code in the Fortnite Item Shop and the Epic Games Store! Thank you for all the support, it really means a lot to me! #EpicPartnerI Talk is a Fortnite YouTube channel, talking about all things Fortnite Battle Royale! We discuss everything from leaks, patch notes, updates, thoughts and opinions, and any other topics that are relevant! I also do daily Item Shop videos everyday, so if you want to see something that's currently in the Item Shop, you can see that I upload every single day for the Item Shop.---Get Connected---Subscribe to my YouTube Channel: https://www.youtube.com/channel/UCIZP6nCTyU9VV0zIhY7q1Aw?sub_confirmation=1Follow me on Twitter: https://twitter.com/ThisIsITalkFollow me on TikTok: https://www.tiktok.com/@imitalkThumbnails made by CrazyShark, check him out here: https://t.co/vKVkQVmqn8"
"GvyYlNeay9A","Table Size Naan!! INDIAN FOOD - Giant Kebab Meal Cooked in the Tandoor!!","2021-02-27T13:00:08Z","UCyEd6QBSgat5kkC6svyjudA","Mark Wiens","19","21.01.03","Indian food|biryani|Mark Wiens|Bangkok|Thailand|Charcoal Grill Bangkok|Charcoal Tandoor Grill|best Indian food Bangkok|Bangkok Indian food|Bangkok kebabs|kebabs in Bangkok|kebabs|tandoori chicken|tandoori food|tandoor|best Indian food|Indian food videos","770773","50734","570","2085","https://i.ytimg.com/vi/GvyYlNeay9A/default.jpg","False","False","🎥 Eating an Alien Spiky Ball: https://youtu.be/BEQZ-kP9O5g👕 T-shirts and caps available now: https://migrationology.com/store/🔥 Charcoal Tandoor Grill: https://goo.gl/maps/GhH1b3Vz5ioSKZdu6BANGKOK, THAILAND - Welcome to Bangkok! Today we’re going to Charcoal Tandoor Grill, an Indian restaurant that specializes in all food cooked in the tandoor oven. From kebabs, to dal, to the biggest naan I’ve ever seen - literally the size of the table or blanket - we’re going to feast on an amazing tandoori meal!Charcoal Tandoor Grill - They have a great concept, focus on serving food, all food, cooked in the tandoor oven. And as Prerak the manager explained to me, the restaurant also has roots in rural areas of India where people living in villages would hunt for game, and then roast everything in a fire, sharing with the community. They also only use charcoal tandoor clay ovens, no gas fires, which I think makes a huge difference in the taste and quality of the food.We ordered a huge mix of tandoori specialties including an entire leg of lamb, chicken kebabs, a tandoori lobster, dal Charcoal style, biryani, and finally the massive family sized naan.The food was extraordinary, you could taste the thick layers of spices and marinades, and the layers of smokiness from the tandoor cooking process. What I love so much about tandoori food is that the fire is so hot, and so it scorches the outside, yet the insides of what you cook remains so juicy and tender. This was the case for everything we ate. Really outstanding and tasty food.Next, we had one of their famous biryanis. To be honest I was blown away, the fragrance and fluffiness was out of control. The tenderness of the lamb just melted in your mouth. Highly recommended to go with your kebabs.Finally, for dessert we had what they call “the tree of life,” a mango tree filled with mangoes that were shaped into mangoes, yet made from Indian alphonso mangoes and soy milk and froze. It was a perfect way to end this amazing Indian food meal in Bangkok.NOTE: This video is not sponsored, I arranged to eat here and film a video because I had heard great things about their tandoori food and their giant naan. However, after I asked for the bill, they insisted that I not pay for our meal. That being said prices range from about 400 - 600 THB per dish, with the lamb and lobster being about 1,500 THB each.📍 Charcoal Tandoor Grill: https://goo.gl/maps/GhH1b3Vz5ioSKZdu6🎵MUSIC: https://goo.gl/HwVjdo——————————————————🍌100% Real Durian Chips - Order Here: http://pixelfy.me/uY4K5z👕Get t-shirts and caps:https://migrationology.com/store/——————————————————📱FOLLOW:Instagram: https://instagram.com/migrationologyFacebook: https://www.facebook.com/migrationology"
"JCOApOon4aw","#CivilTV: Welcome Home Bobby Shmurda","2021-02-26T20:34:03Z","UC8sl9EAOqIwKN9jcnMcdGWw","Karen Civil","24","21.01.03","[none]","1374044","38059","759","2961","https://i.ytimg.com/vi/JCOApOon4aw/default.jpg","False","False","Welcome home #BobbyShmurda. Brooklyn's own Bobby Shmurda has touched down on his first home as Karen Civil & #CivilTV recaps his day from a family dinner with his mom, his first interview with GQ magazine and a private welcome home party with family & friends. Remember to subscribe to channel for updated on the next episode!Executive Produced by: Karen CivilShot By: Destiny FulfilledFollow Karen Civil:http://www.Twitter.com/KarenCivil​http://www.Instagram.com/KarenCivil​http://www.Facebook.com/KarenCivil​"
"pPTKPMgY4_A","#OFB​ Bandokay x Double Lz - Hashtags [Official Music Video]","2021-02-26T12:00:13Z","UCAh6aiGr8RF81-h2W-40Qhg","OFB OFFICIAL","10","21.01.03","[none]","283155","21603","183","1642","https://i.ytimg.com/vi/pPTKPMgY4_A/default.jpg","False","False","Hashtags out now, available on all platforms: https://ada.lnk.to/HashtagBeat produced by M1ontheBeat x Ka7ton8Instagram -Bandokay: https://www.instagram.com/bandokaay_ofb/?hl=enDouble Lz: https://www.instagram.com/doublelz_ofb/?hl=enTwitter -  Bandokay: https://twitter.com/sj90201032Double Lz: https://twitter.com/DoublelzOSubscribe: https://www.youtube.com/channel/UCAh6aiGr8RF81-h2W-40QhgVideo Directed by @TVTOXIC"
"-555Hg5_Qqo","Pam Gets Her First Complaint - The Office US","2021-02-27T17:00:01Z","UCa90xqK2odw1KV5wHU9WRhg","The Office","24","21.01.03","the office|the office full episodes|rainn wilson|john krasinski|steve carell|michael scott|the office fire drill|jim and dwight pranks|dwight schrute|jim halpert|jenna fischer|the office thug life|the office funniest moments|the office bloopers season 1|the office cpr|the office parkour|Best The Office Moments|season 9|card tower|pam's first complaint","312629","7416","106","378","https://i.ytimg.com/vi/-555Hg5_Qqo/default.jpg","False","False","After realising everyone thinks she's too prissy, Pam attempts to receive her first customer complaint.From Season 9, Episiode 8 The Target - When Angela finds out about her husband's affair, she goes to Dwight for help. Stanley and Phyllis take advantage of Jim when he needs a favour. Pete distracts Pam as she begins painting her mural.Streaming now on Peacock: https://www.peacocktv.com/stream-tv/the-office?cid=2101priolibraryofceownyt653&utm_campaign=2101priolibraryofce&utm_source=yt&utm_medium=own_yt_brandawareness_descriptionlink&utm_content=theofficeprelau&utm_term=peacockWatch The Office US on Google Play: http://bit.ly/2xYQkLD & iTunes http://apple.co/2eW0rcKSubscribe: http://bit.ly/2y5VK8NThis is the official YouTube channel for The Office US. Home to all of the official clips from the series, the funniest moments, pranks and fails. Think we should feature your favourite episode? Let us know in the comments! FB : https://www.facebook.com/theofficenbcTwitter : https://twitter.com/theofficenbcWebsite : http://www.nbc.com/the-office#TheOffice #USA #PeacockTV"
"SliqG_0MElo","Travis Scott, HVME - Goosebumps (Remix - Official Visualizer)","2021-02-11T02:20:50Z","UClRx3MMyYUyqOxyEqA5F2nQ","TravisScottVEVO","10","21.01.03","Astronomical|Fortnite|the scotts|franchise|young thung|M.I.A.|MIA|kid cudi|travis scott and kid cudi|travis and kid cudi|cudi the scotts|La Flame|stargazing|highest in the room|highest in the room remix|rosalia|Travi$ Scott|ASTROWORLD|Sicko Mode|goosebumps|Kendrick Lamar|Butterfly Effect|Huncho Jack|Birds in the Trap|through the late night|Rodeo|Days Before Rodeo|Owl Pharaoh|Houston|Houston Rockets|Kanye West|the","1381716","67967","1379","3729","https://i.ytimg.com/vi/SliqG_0MElo/default.jpg","False","False","Goosebumps (Remix) available at: https://TravisScott.lnk.to/Goosebumps_HVMEOfficial Audio: https://youtu.be/XULMZ907iosTravis Scott online:https://shop.travisscott.com/https://twitter.com/trvisXXhttps://www.instagram.com/travisscott/https://soundcloud.com/travisscott-2https://www.facebook.com/travisscottlaflamehttps://travisscott.com/HVME online:https://twitter.com/HVMEOFFICIALhttps://www.instagram.com/hvmemusic/https://soundcloud.com/hvme(C) 2021 Epic Records. With Cactus Jack.#TravisScott #HVME #Goosebumps"
"dc3eD6C6Gbk","Character Teaser - Hu Tao: Scared Yet? | Genshin Impact","2021-02-27T04:00:10Z","UCiS882YPwZt1NfaM0gR0D9Q","Genshin Impact","20","21.01.03","Amber|amber vtuber|genshi|genshi game|genshi impact|genshi video|genshin|genshin game|genshin impact|genshin impact 2020|genshin impact game|genshin impact good|genshin impact graphics|genshin impact introduction|genshin impact manga|genshin impact wiki|geshin|geshin game|Teyvat|yuanshen game|miHoYo China|miHoYo Japan|adventure story|open world game|anime style|MMORPG|anime games|mobile game|MMO PlayStation|yt:cc=on","2476799","231801","1220","22134","https://i.ytimg.com/vi/dc3eD6C6Gbk/default.jpg","False","False","Hee-hee, did I scare you?Eh? My appearance is less of a shock, and more of a pleasant surprise?Mm... Then, should I call this a farcical failure — or a splendid success?Download FREE: https://genshin.mihoyo.com/en#GenshinImpact #miHoYo↓ Follow us for the latest news ↓Official Website: https://genshin.mihoyo.com/enOfficial Community: https://www.hoyolab.com/genshin/Facebook: https://www.facebook.com/GenshinImpact/Twitter: https://twitter.com/GenshinImpactInstagram: https://www.instagram.com/genshinimpact/Reddit: https://www.reddit.com/r/Genshin_Impact/"
"BRASmZr-b58","Holo Taco UNICORN DREAM Collection Reveal🦄☁️","2021-02-27T16:30:04Z","UCGCVyTWogzQ4D170BLy2Arw","Simply Nailogical","24","21.01.03","nails|nail art|nail tutorial|beauty tutorial|nail art tutorial|diy nails|diy nail art|simply nailogical|cristine|unicorn|unicorn dream|holo taco|holo taco unicorn|unicorn skin|collection reveal|full reveal|dreams|flakies|unicorn nails|pastel nails|unicorn aesthetic|unicorn makeup|unicorn box|limited edition|cyantific|what do you pink","651439","46818","430","4486","https://i.ytimg.com/vi/BRASmZr-b58/default.jpg","False","False","This is my 2021 ~*aesthetic*~🦄☁️ NEW HOLO TACO UNICORN DREAM collection just dropped➡️ https://holota.co/simplyunicorndream♡ Subscribe to never miss n̶e̶w̶ ̶n̶a̶i̶l̶ ̶a̶r̶t̶ ̶t̶u̶t̶o̶r̶i̶a̶l̶s̶! http://bit.ly/subsimply​♡ Subscribe to Holo Taco (for nail videos lol): http://bit.ly/SubHoloTaco​♡ Subscribe to the Podcast to hear me have adult conversations: http://bit.ly/SubSimplyPodLogical​_ _ _ _ _ _ _ _ _ _ _ _ _ _ _ _ _ _ _ _ _ _ _ _ _ _ _ _ _ _ _ _ _ _💿🌮💅🦄H O L O  T A C O  U N I C O R N  D R E A M  C O L L E C T I O NNOW AVAILABLE: https://holota.co/simplyunicorndream🦄📦Holo Taco Unicorn Dream Collection Box set (includes 5 polishes) - $60 (USD) ***LIMITED QUANTITIES of box***  https://holota.co/simplyunicorndream💅 2 new crème polishes  - $11 each 🦄 3 new iridescent flakie Unicorn Skin toppers - $13 eachNote: The Collection Box set is limited edition and there will not be a restock of boxes. The individual polishes are sticking around, and will restock if sold out so long as supplies are available. Make sure to grab your faves! #HoloTaco​Don't forget to pick up the following to complete the perfect mani!💅 Smoothing Base coat: holota.co/simplysmoothingbase​💅 Long-Lasting Base coat: holotaco.com/products/long-lasting-base​🖤 One-Coat Black: https://www.holotaco.com/products/one-coat-black🤍 Not Milky White: https://www.holotaco.com/products/not-milky-white-2021🧰 Rainbow Chrome Tool Kit: https://www.holotaco.com/products/rainbow-chrome-nail-tool-kit💦🌮 Glossy Taco or Super Glossy Taco, for that super smooth glossy quick-dry finish and to make your nail polish last longer without chipping🎩Matte Taco: https://holota.co/simplymattetaco💿🌮 A Holo Taco and make it your own #HoloTacoCombo​🎧SimplyPodLogical episodes about Holo Taco business:1. https://www.youtube.com/watch?v=u_beA3gHe0I2. https://www.youtube.com/watch?v=h8LNT1HLz6Q💿Follow the holo:https://www.instagram.com/holotaco/​https://twitter.com/holotaco​https://www.facebook.com/holotaco/​https://www.tiktok.com/@holotaco_ _ _ _ _ _ _ _ _ _ _ _ _ _ _ _ _ _ _ _ _ _ _ _ _ _ _ _ _ _ _ _ _ _http://instagram.com/simplynailogicalhttps://www.snapchat.com/add/simplynailogicahttps://twitter.com/nailogicalhttps://www.facebook.com/simplynailogicalhttp://www.simplynailogical.com (archival materials)My other YouTube channels:https://www.youtube.com/simplypodlogicalhttps://www.youtube.com/holotacohttps://www.youtube.com/simplynotlogical_ _ _ _ _ _ _ _ _ _ _ _ _ _ _ _ _ _ _ _ _ _ _ _ _ _ _ _ _ _ _ _ _ _I film my nail videos with this camera: http://amzn.to/1Mgznht​This 105mm macro lens: http://amzn.to/1Pi8PM3​I filmed my face in this video with this camera: https://amzn.to/327OB7b​This lens: https://amzn.to/38HnBgU​Voiceover mic: http://amzn.to/1MefGpG​Audio recorder: https://amzn.to/3dbtg1w​External mic: https://amzn.to/32AnO3g​Ring light for face-cams: http://amzn.to/2cU7cNO​I edit my videos with: http://bit.ly/videoeditor1​I get some cool editing filters from: https://motionvfx.sjv.io/Ze3bR​Check out my personalized Amazon page with stuff I like! https://www.amazon.com/shop/simplynailogicalMusic: http://share.epidemicsound.com/SIMPLY​_ _ _ _ _ _ _ _ _ _ _ _ _ _ _ _ _ _ _ _ _ _ _ _ _ _ _ _ _ _ _ _ _ _Disclaimer: I didn't pay myself specifically to make this video for Holo Taco but I do benefit from Holo Taco sales😊 Some other links above are affiliate links."
"3cxtvDEziXU","PewDiePie Comment On This Video","2021-02-25T21:00:01Z","UC4-79UOlP48-QNGgCko5p2g","MrBeast Shorts","22","21.01.03","[none]","8759453","577649","11068","54329","https://i.ytimg.com/vi/3cxtvDEziXU/default.jpg","False","False","please tell pewds to comment on this! #shorts SUBSCRIBE!"
"SKOMZkOo-tE","Borussia Dortmund vs Arminia Bielefeld (3-0) | Jadon Sancho makes history | Bundesliga Highlights","2021-02-27T20:10:56Z","UC4i_9WvfPRTuRWEaWyfKuFw","BT Sport","17","21.01.03","BVB|Dortmund|Borussia Dortmund|Arminia Bielefeld|Jadon Sancho|Erlind Haaland|Bundesliga|Soccer|Football|BT Sport|Highlights|3-0","341355","6273","51","491","https://i.ytimg.com/vi/SKOMZkOo-tE/default.jpg","False","False","Borussia Dortmund cruise to a comfortable 3-0 win against Arminia Bielefeld.Hit 'Subscribe' above to ensure you never miss a video from the BT Sport YouTube channel.Get a BT Sport Monthly Pass now! - http://bit.ly/BTSportMonthlyPass​ Visit and subscribe to our 'BT Sport Boxing' YouTube channel ➡️ http://www.youtube.com/c/btsportboxing​Twitter: http://twitter.com/btsport​Facebook: http://www.facebook.com/btsport​Instagram:http://instagram.com/btsport​Website: http://sport.bt.com"
"xtgtjJvJRg8","Ranboo bakes a cake (1 MILLION Subscriber special)","2021-02-26T20:00:10Z","UCKQ-wNdh0kO5qnpPfXa2hjQ","Ranboo","24","21.01.03","Ranboo|Ranboo bakes a cake|Ranboo cake|Cake Ranboo|Ranbow|Rainbow|Comedy|Ranboolive|RanbooLIVE|Ranboo funny moments|Baking video|Commentary","1500307","291098","1004","23157","https://i.ytimg.com/vi/xtgtjJvJRg8/default.jpg","False","False","YOUTOOZ!: https://youtooz.com/products/ranbooToday in celebration i decided to bake an ENTIRE CAKE! It went terribly, but it was fun.I am LIVE onhttps://www.twitch.tv/Ranboolive​​I say dumb thingshttps://twitter.com/Ranboosaysstuff​​MERCH!:https://streamlabs.com/ranboolive/merch​​DISCORD?!?!?!?!?!:https://discord.com/invite/ranboo​​Have an awesome day!"
"vnDMnpTSvMI","Transforming Noah Beck into a Contortionist","2021-02-27T16:55:01Z","UCF0_hwTeQ73IhJuEtsUbEtA","Sofie Dossi","24","21.01.03","sofie dossi|america's got talent 2016|agt|contortionist|acrobat|noah beck|contortion|flexible|bendy|bow and arrow|stunt|noah neck|sofie dossi boyfriend|comedy|funny","667253","49729","423","4104","https://i.ytimg.com/vi/vnDMnpTSvMI/default.jpg","False","False","I trained Noah Beck to be a contortionist! Also he insisted I shoot a pineapple off his head with my bow and arrow... Comment below if I should do more videos with Noah!Noah Beck: https://www.youtube.com/channel/UClPsjnF7D_Ar1ZSrEsnTxJABuy my new Merch! ► https://shopsofiedossi.com​​​​​Subscribe to get my weekly videos! ► http://bit.ly/2gG1vkB​​​​​Sofie is a self-taught contortionist, hand balancer, aerialist. 2016 America’s Got Talent Golden Buzzer Contestant & FINALIST. She can be seen on The Ellen Degeneres Show, Disney Channel, and Nickelodeon.And check out my social media:►SnapChat: SofieDossiInstagram: @SofieDossiTwitter: @SofieDossiFacebook: @SofieDossi►Contact/Booking: sofie@sofiedossi.com"
"cd4ILT8LDoI","Minecraft’s Black Hole Mod Is Very Funny","2021-02-26T23:03:27Z","UC5p_l5ZeB_wGjO_yDXwiqvw","TommyInnit","20","21.01.03","tommyinnit|minecraft|mine craft|dream|dream minecraft|funny|minecraft funny|funniest minecraft video|minecraft manhunt|minecraft speedrunner vs hunter|minecraft speedrunner|minecraft speedrun|minecraft challenge|challenge|minecraft but|wilbur soot|slimecicle|philza|dream war|dream smp|fun|black hole|black hole mod|minecraft black hole|minecraft mod|modded minecraft|Minecraft’s Black Hole Mod Is Very Funny","5337649","462177","3559","39766","https://i.ytimg.com/vi/cd4ILT8LDoI/default.jpg","False","False","Today TommyInnit, Wilbur Soot, Philza & Slimecicle have lots of fun with the Black Hole Mod in Minecraft. It was properly mental.PLEASE WATCH MY STREAMS - https://www.twitch.tv/tommyinnit Edited by Tommy + Big Man Editor Larry ( @TalentLacking )@Wilbur Soot @Slimecicle @Ph1LzA Follow my Twitter - @tommyinnitFollow my Instagram - @tommyinnittToday Me, Wilbur Soot, Slimecicle, & Philza Minecraft install the Black Hole Mod in Minecraft 1.16.4! Even though I had a Minecraft War with Dream on the Dream Team SMP Minecraft Server today Wilbur Soot went crazy and he is just hilarious and we had lots of laughs. This was so fun, awesome, poggers and cool! The Funniest Minecraft Video Ever with New Funny Mods makes Minecraft 1.16.4 even funnier & hilarious! It is lots of fun and laughs :) Not Minecraft, But Water Rises or Minecraft, But Lava Rises, or any other but challenge like that. This is a speed run / speed runner of Minecraft against a killer / assassin but it is me and my good friends playing the NEW FUNNIEST MINECRAFT MOD EVER!!! POG CHAMP!!!"
"gyejRSOEuxc","Leaving My Golden Retriever and German Shepherd Alone with Food","2021-02-26T14:00:11Z","UCfOc-5FcQLJeoFZ5wyjWYmg","Funny Dog Bailey","15","21.01.03","leaving my golden retriever|leaving my german shepherd|leaving my golden retriever and german shepherd|leaving my dogs|leaving my golden retriever alone with food|leaving my german shepherd alone with food|leaving my golden retriever and german shepherd alone with food|leaving my dogs alone with food|funny|funny dog|funny dog video|funny dogs|funny dogs video|dog|dogs|dogs alone with food|dogs left alone|dogs left alone with food|golden retriever|german shepherd","178096","2521","111","350","https://i.ytimg.com/vi/gyejRSOEuxc/default.jpg","False","False","Leaving My Golden Retriever and German Shepherd Alone with Food! Be sure to subscribe, make sure to enable ALL push notifications! 🔔and leave your comments under this video!Subscribe!➡️http://bit.ly/2R24Z5NFeel free to leave a comment! Share this video in Facebook/Twitter/Google+ and show to your friends!Have a GREAT Day :)#FunnyDogBailey #GoldenRetrieverBailey #Dog #Perro #GoldenRetriever #GermanShepherd #LeaveItChallenge"
"Jc1tFH8Xzc8","Martial Swap? Solskjaer Transfer Update! Man Utd News","2021-02-28T11:20:16Z","UCMmVPVb0BwSIOWVeDwlPocQ","The United Stand","24","21.01.03","Manchester United|Man United|Man Utd|Manchester United TV|The United Stand|United Stand|Manchester United News|MUFC|Man Utd News|United|Manchester United 2020|Manchester United Latest News|Manchester United Transfer News|Transfer|Solskjaer|Ole Gunnar Solskjaer|Solskjaer news|Solskjaer press conference|Ole Gunnar Solskjaer Press Conference|Van De Beek|Bruno|Bruno Fernandes|Cavani|Edinson Cavani|Cavani ban|Cavani FA Ban|Klopp","117703","3628","134","415","https://i.ytimg.com/vi/Jc1tFH8Xzc8/default.jpg","False","False","Man Utd could swap Anthony Martial this summer in a shock transfer move and Solskjaer gives an update on his transfer plans. Get the latest Man Utd News on The United Stand 🔔 SUBSCRIBE here http://bit.ly/1CmczHmUnited Stand Exclusive T Shirt collection https://united-stand.myshopify.com/🚨VISIT OUR WEBSITE 🚨For all the latest United news and TUS content:https://www.theunitedstand.com⏲️The United Stand Content TIMELINE is the best way to find all our latest content quickly! https://www.theunitedstand.com/timeline📰 LATEST WRITTEN NEWS https://www.theunitedstand.com/articles/latest-news📸 FOLLOW OUR INSTAGRAMhttps://www.instagram.com/theunitedstandtv/✅ The United Stand MEMBERSHIP https://buff.ly/2I2Of9R📧Contact The United Stand = soccerboxtv@gmail.com📧WRITER SUBMISSIONS = unitedstandwebsite@gmail.comAddressing: Jamie or NoraSee the FULL United Stand Kit Range CLICK HERE https://buff.ly/2Krpw1zEXCLUSIVE NEW PODCAST ITUNES https://buff.ly/2ZUhv84Spotify https://buff.ly/34dwEo6Google Podcast https://buff.ly/2ZHlNDnCastBox https://buff.ly/2UuiU3RRadio Public https://buff.ly/34jWkzAThe United Stand is Manchester United's biggest independent fan channel. Made for Manchester United fans by Manchester United fans, the United Stand provides you with the latest Manchester United transfer news, highlights, goal reviews and much more. So if MUFC means the world to you, get involved and subscribe to The United Stand http://bit.ly/1CmczHm#ManchesterUnited #MUFC"
