video_id,title,publishedAt,channelId,channelTitle,categoryId,trending_date,tags,view_count,likes,dislikes,comment_count,thumbnail_link,comments_disabled,ratings_disabled,description
"M-fhbK4FxMI","24시간 대환장 육고기파티 돼지vs소vs닭, 당신의 선택은?","2021-04-03T11:00:06Z","UCa56qkMvVvq1IMn4xbXaKEA","삼대장 Samdaejang","24","21.09.04","삼대장 챌린져스|삼대장 먹방|심심먹방|삼대장 심심먹방|소고기|24시간 먹방|삼대장 24시간|돼지고기|닭고기 먹방|치킨 먹방|삼겹살 먹방|스테이크 먹방|파뿌리 24시간|삼대장 칼로리|50000칼로리|5만칼로리 삼대장","351700","4384","170","892","https://i.ytimg.com/vi/M-fhbK4FxMI/default.jpg","False","False","너무 많은 고기 섭취는 영양 밸런스를 무너뜨립니다.---------------------------------------------------------------------삼대장 인스타그램 ☞  samdaejang경원 인스타그램 ☞  woney2ny재영 인스타그램 ☞  nowzero92도윤 인스타그램 ☞  creyoon#삼대장 #고기먹방 #소고기 #돼지고기 #닭고기 #치킨 #삼겹살 #먹방"
"ilHj1bS1kUk","일사불란! 센스만점! 박군 & 깡미가 못하는 건 없다👍 [정글의 법칙|SBS 210403 방송]","2021-04-06T09:00:13Z","UCnx4Fi4cmkLGDiFfZ311wWw","SBS ENTER PLAY","24","21.09.04","정글의법칙|Law of The Jungle|정법|김병만|정글의법칙 생존의달인|생존의 달인|강은미|박군|특전사|강은미 특전사|강은미 출신부대|특전사 듀오|라이머|이동국|최성민|칸토|스카이다이빙|서해|무인도|도리도|강은미 스카이다이빙|깡미|박군 강은미|통발|미끼|게|개불|갯벌 탐사","179552","1151","47","101","https://i.ytimg.com/vi/ilHj1bS1kUk/default.jpg","False","False","도대체 못하는 게 뭐야?!특전사 듀오 매력에 빠져든다.. 빠져들어...#정글의_법칙 #Law_Of_The_Jungle #강은미 #박군 #김병만 #라이머 #이동국 #최성민 #칸토☞ 매주 토요일 오후 08:55"
"jmD-j87P26A","단, 2가지재료! 완두콩 팝잇 만들기🐛 | 틱톡 핫템! 피젯토이 만들기 | 푸시팝버블 만들기 | Diy Pea Fidget Toy TikTok | 루키밍","2021-04-03T01:09:37Z","UCnCyCLS6IpDizrFSXED1S9g","루키밍ʀᴏᴏᴋɪᴇ sʟɪᴍᴇ","26","21.09.04","액체괴물|슬라임|slime|rookieming|슬라임 만들기|만들기|루키밍|액괴|액괴 만들기|액괴 실험|슬라임 실험|액괴 유튜버|슬라임 유튜버|슬라임 ASMR|슬라임 후기|액점만들기|폭신액점|투명액괴|ASMR|asmr|slime asmr|Water slime|jiggly slime|Rookie Slime|ROOKIEMING|룩희밍|루키밍 슬라임|루키밍 액체괴물|문구점 슬라임|슬라임 리뷰|액체괴물 만들기|Clay cracking|Clay Cracking Asmr|스퀴시|말랑이|문구점 리뷰|신상 슬라임|지글리슬라임|Fidget toy|Pop it|Diy Pop it|Tiktok|Tiktok Fidget toy|Fidget|DiyFidget toy|Simple Dimple|POP IT TikTok|팝잇|팝잇 만들기|푸시팝|푸쉬팝|푸시팝버블|푸시팝 만들기|피젯토이|틱톡핫템|틱톡인기템","474846","8203","137","914","https://i.ytimg.com/vi/jmD-j87P26A/default.jpg","False","False","(내가.. 인기급상승 43등까지 올랐다니.. 댑악댑악)여러분 정말 감사합니다!🌱made by rookieming🌱     [촬영] 갤럭시 울트라 20     [편집] 프리미어프로     [폰트] 이랜드 나이스체     [노래] 샛별 - 당근 밭의 셀러리 / https://youtu.be/FqI9cM6fczU🌱rookieming SNS🌱    Tiktok : rookieming    Naver blog : 루키밍    Naver tv : 루키밍 그림채널    Instagram : rookie_ming    Email : rookieming@naver.com#팝잇 #Popit #Diy"
"xs6hl6WR1tY","[#인기급상승] (풀버전) 💜아이유(IU)가 유퀴즈 100회에 등판했다💜 모든 말이 띵언이라 시간순삭되는 아이유 30분 풀버전 | #유퀴즈온더블럭 #디글","2021-04-01T02:00:04Z","UCWYzc_p0GgfCepIWDHGFmEg","디글 :Diggle","24","21.09.04","Diggle|IU|IU 라일락|IU 아이유 라일락|iu lilac reaction|iu reaction|iu you quiz|iu you quiz on the block|tvN|tvN D ENT|tvN 예능|youquizontheblock|디글|디글 유퀴즈|아이유|아이유 라일락|아이유 유퀴즈|아이유 코인|예능 다시보기|유재석 눈물|유재석 아이유|유재석 연예대상|유재석 오열|유재석조세호|유퀴즈|유퀴즈 100화 다시보기|유퀴즈 IU|유퀴즈 개그|유퀴즈 눈물|유퀴즈 다시보기|유퀴즈 디글|유퀴즈 레전드|유퀴즈 방탄|유퀴즈 아이유|유퀴즈 연기|유퀴즈 유행어|유퀴즈 이지은|유퀴즈 일반인|유퀴즈 티격태격|유퀴즈 힐링|유퀴즈100화|유퀴즈온더블럭 100화 다시보기|유퀴즈온더블럭 아이유|인기급상승","2741752","42733","713","2710","https://i.ytimg.com/vi/xs6hl6WR1tY/default.jpg","False","False","#유퀴즈온더블럭 #Diggle #디글유튜브에서 지금 핫한 사람 누구? 人기가 급상승한 人물 모음집Let's giggle, :Diggle!방송국놈들이 덕질하는 채널 '디글'구독하기 ☞ https://www.youtube.com/c/디글Diggle"
"bvz5xi-zGZ8","24시간동안 마늘 VS 버터!! 한국인은 무조건 마늘을 좋아할까?!","2021-04-04T09:00:22Z","UClzB2iZ5jPoTNz0S-QU6Wiw","파뿌리","24","21.09.04","파뿌리|예능|게임|GAME|오락|버라이어티|variety|웹예능|플레이","778547","10769","431","2816","https://i.ytimg.com/vi/bvz5xi-zGZ8/default.jpg","False","False","※ 노랭이 PD : 마늘 쪼끔만 넣자※ 강호이 : 버터 쪼끔만 넣어줍니다※ 진렬이 : 둘 다 넣으면 안 돼?!#파뿌리24파뿌리 채널 구독하기 ☞ https://url.kr/IPn4hC상경한 세 남자의 유쾌한 매력에 빠져보세요!!파뿌리24 영상 몰아보기 ☞ https://url.kr/SDQwbZ 복층라이프 몰아보기 ☞ https://url.kr/w3lLgh파뿌리 저가락 몰아보기 ☞ https://url.kr/5IUCuO슈퍼푸드보이 몰아보기 ☞ https://url.kr/JEGKBi랜덤챌린지 몰아보기 ☞ https://url.kr/iK3q9R퀴즈먹방 몰아보기 ☞ https://url.kr/QXLzIP뿌이로그 몰아보기  ☞ https://url.kr/M9DVLH1분 리뷰 몰아보기 ☞ https://url.kr/nufm3C[이메일] 콘텐츠요청, 팬 아트, 보내주고픈 말들 : popfree@sandboxnetwork.net[팬사서함] 서울시 용산구 서빙고로 17 센트럴파크타워, 30층 샌드박스받는 사람명 - 파뿌리"
"5tW7R3R8410","샤이니 Key & 민호 찐친 케미, 이렇게 다른데 어째서 볼수록 비슷한거죠...? 에스크얼루어 QnA, TMI, 비하인드 | 얼루어코리아 Allure Korea","2021-04-03T01:00:16Z","UCcTWmzBmvxAKtM1tQ0VMwZA","Allure Korea","24","21.09.04","얼루어|얼루어코리아|Allure|Allure Korea|샤이니|SHINee|샤이니 키|샤이니 김기범|샤이니 민호|민호|키|Key|샤이니 인터뷰|샤이니 키 민호","199172","15507","28","1141","https://i.ytimg.com/vi/5tW7R3R8410/default.jpg","False","False","빛나는 샤이니 에스크얼루어 Key & 민호 편 , 같은 질문에 답변이 이렇게 다를 수 있다고요...? ----------------------------------------------------------------------------------잠깐! 얼루어 채널 구독하셨나요?구독하고 매주 올라오는 다양한 뷰티, 패션, 라이프스타일 꿀팁들을 만나보세요. 좋아요와 댓글도 잊지마세요~----------------------------------------------------------------------------------ALLURE KOREA SOCIAL MEDIA유튜브 ☞ https://goo.gl/1gZ2rm인스타그램 ☞ https://goo.gl/EMmZpT페이스북 ☞ https://goo.gl/oxz9uk네이버 포스트 ☞ https://goo.gl/qBomme카카오 ☞ https://goo.gl/2eBLLi----------------------------------------------------------------------------------"
"DrzAeol2Uoo","[다큐3일★풀버전] 배 한 척을 위한 수천 명의 장인들 “8000조각으로 띄우는 꿈 조선소 72시간” (KBS 100110 방송)","2021-03-31T12:00:13Z","UC4LW3sOslC14Vn5bcoNUBkg","KBS 다큐","24","21.09.04","KBS|다큐멘터리|docu|documentary|다큐|주식|테마주식|조선소주식|stx조선|해운업|조선소|해양다큐","1063399","6143","529","797","https://i.ytimg.com/vi/DrzAeol2Uoo/default.jpg","False","False","다큐멘터리 3일 (일요일 밤 11시 5분 KBS 2TV)“8000조각으로 띄우는 꿈 조선소 72시간” (2010.01.10 방송)배 한 척을 만들기 위해서는사람 손으로 수천 개의 쇳조각을 붙여야 한다는 사실,알고 계신가요?● ‘배’라는 꿈을 짓는 곳전 세계 30%가 넘는 수주량을 자랑하며 우리나라의 수출효자 품목으로 불리는 '조선업'. 배는 수공예품이라고 말할 수 있을 정도로 배 짓는 일은 수작업이 절대적이다. 땀과 노력으로 세계 1위라는 자부심을 만들어내는 배를 짓는 사람들의 이야기가 있는 곳, 조선소에서의 3일이다.    ● 철판 1조각이 4만 톤급 용량이 되기까지배는 한 덩어리로 이루어진 것이 아니다. 수천 개의 철판이 55개의 파트로 모아지는 많은 공정과 설계로부터 2~3년이라는 시간을 거쳐 하나의 배가 된다. '토치'라는 장비로 평평한 철판을 배의 굴곡처럼 휘게 만드는 곡 블록 작업, 지상 70미터의 높이를 자랑하는 조선소의 얼굴인 골리앗 크레인에서 아래의 신호를 받아 조종하는 일, 특수 이동장비인 트랜스포터로 6400톤의 거대 블록을 실어 배의 몸통을 붙이는 작업 등이 이루어지는 현장. 개미처럼 작아 보이는 사람들이지만 그들의 손끝에서 거대한 배가 만들어진다.● 용접복, 안전모 속의 다양한 얼굴남편을 잃고 두 아이를 키우기 위해 남자도 힘든 용접을 하는 씩씩한 아주머니, 고된 노동과 소음 때문에 일을 시작한 지 하루 만에 그만두겠다던 조선소에서 7년이 지나자 망치소리가 돈 소리가 되었다는 아저씨, 33년을 다닌 조선소를 정년퇴직하는 여성 1호 직원, 서로의 일을 도와가며 함께 출퇴근하는 부부까지. 배를 만드는 수많은 과정만큼이나 다양한, 배를 짓는 사람들의 인생 이야기.                    8000명이 8000조각으로 만드는 꿈,바다에 띄어 보낼 그 꿈은 과연 무엇일까※ [다큐3일] 인기 풀영상 보기엄마라는 이름으로 - 광주 영아 일시 보호소 72시간 https://youtu.be/RsRPzBomOJg혹한의 GOP 3일간의기록 https://youtu.be/VZwb5qkvFkE부산 범어사 72시간 https://youtu.be/gE397R8FA9Y나를 이기는 길 이기자 부대 수색대 무박 4일 https://youtu.be/s5vnp4wKnbc강원도의 힘 정선 5일장 https://youtu.be/pCt8Td0Lo1Y한 잔의 위로 용산 포장마차촌 72시간 https://youtu.be/fmvPIj2SI_E다시 심장이 뛴다 - 대학병원 흉부외과 https://youtu.be/XxpMRF71Btg신림동 고시촌 3일 https://youtu.be/WDmzssnYXzU미혼여성 임대아파트 3일 https://youtu.be/m_DHWEh7sQ4#조선소 #배 #해운업"
"BA0mqp97wuY","[바로 보는📺 아는형님] 역주행 신화를 일으킨✈  희망의 아이콘 '브레이브걸스(Brave Girls)' 모음ZIP 〈Knowing bros〉 | JTBC 210403 방송","2021-04-04T00:47:41Z","UCOHM2N1YQdb-cHWxJxwBMLQ","아는형님 Knowingbros","24","21.09.04","아는 형님|형님|형님 학교|민영|유정|은지|유나|롤린|Rollin|노래|역주행|대세|가요|무대|Kpop|스페셜|기획영상|모음집|풀끌립|풀클립|메보좌|꼬북좌|왕눈좌|단발좌|군통령|날개잃은천사|룰라|나에게로떠나는여행|버즈|원조군통령|가시","738185","12620","134","1948","https://i.ytimg.com/vi/BA0mqp97wuY/default.jpg","False","False","역주행 신화를 일으킨✈  희망의 아이콘 '브레이브걸스' 모음ZIP#아는형님 #브레이브걸스 #롤린00:00:22 쁘걸 등장↗ (가오리떼 출몰↗)00:00:55 눈물의 감동 썰 시작☞00:02:38 역주행 신화의 시작00:09:32 하이힐👠00:10:52 메보좌-꼬북좌, 날개 잃은 천사🧚‍♀️00:12:47 눈물 펑펑 감동의 메시지💌00:13:54 롤린 (Rollin')〈아는 형님〉은 매주 토요일 밤 9시 본.방.사.수!"
"LN2pKYvNHi0","[몰카] ENG) 중국집 사장님이 다른 중국집 짜장면을 배달 시켜 먹는걸 목격한다면?!? ㅋㅋㅋ 왜 다른집을 더 맛있어 해 ㅋㅋㅋㅋㅋ","2021-04-02T03:00:05Z","UCLVwgJVAzHwA-zv88mrAeZw","낄낄상회","24","21.09.04","#낄낄상회|#몰카|#미녀|개그맨|임종혁|장윤석|꿀잼|웃참|웃긴영상|스님|목사님|eng|eng sub|낄낄상회|보물섬|조재원|더블비|배꼽빌라|몰카|미녀|중국|중국집|짜장면|탕수육|여의도맛집|짬뽕|배달|배달음식|외식|스왑딜|주방|셰프|주방장|중식","565444","9833","253","533","https://i.ytimg.com/vi/LN2pKYvNHi0/default.jpg","False","False","#중국집 #짜장면 #배달    중국집 사장님이 다른 중국집에서 짜장면을 시켜먹는다면?! ㅋㅋㅋ 미쳤냐고 ㅋㅋㅋㅋㅋㅋ 심지어 다른 집 짜장면이 더 맛있데 ㅋㅋㅋㅋ 하... 어떠케 안웃어 ㅋㅋㅋ 식사중이던 아이돌 삘 미녀 두분은 웃다가 자동 소화 ㅋㅋ 근데 얘네 아이디어는 진짜 멘사에서 조사 나와야 된다. 오늘 점심은 짜장면이다!!!!!!"
"6o41a7vu7KQ","전 남친의 새 여친이 너무 예쁘다 (SUB)","2021-04-03T08:28:51Z","UCYn09ySlShmzBtYwl1OgOsA","CheezeFilm","24","21.09.04","webdrama|drama|kdrama|highteen|school|romance|movie|kmovie|kpop|드라마|영화|고등학교|고딩|절친|친구|friend|マブダチ|女子高生|ユリ|JK|남사친|여사친|남친|여친|토모|高校生|百合","492238","8785","152","464","https://i.ytimg.com/vi/6o41a7vu7KQ/default.jpg","False","False","3년 친구 그리고 3개월 차 연애중인 석주와 유진석주는 자신을 좋아하는 것 같지 않는 유진에게 헤어지자고 말한다그리고 1개월 후 석주는 새 여친을 소개한다.#웹드라마 #벚꽃 #친구"
"TelnExrl0N0","[#인기급상승] 저희는 말을 잘 안 해요💬 찐남매가 확실한 현실 누나 아이유와 남동생ㅋㅋㅋ 누나가 아이유인 것도 비밀이라고?😲 | #유퀴즈온더블럭 #디글","2021-04-01T07:15:03Z","UCWYzc_p0GgfCepIWDHGFmEg","디글 :Diggle","24","21.09.04","Diggle|IU|IU 라일락|IU 아이유 라일락|iu lilac reaction|iu reaction|iu you quiz|iu you quiz on the block|tvN|tvN D ENT|tvN 예능|youquizontheblock|디글|디글 유퀴즈|아이유|아이유 라일락|아이유 유퀴즈|아이유 코인|예능 다시보기|유재석 눈물|유재석 아이유|유재석 연예대상|유재석 오열|유재석조세호|유퀴즈|유퀴즈 100화 다시보기|유퀴즈 IU|유퀴즈 개그|유퀴즈 눈물|유퀴즈 다시보기|유퀴즈 디글|유퀴즈 레전드|유퀴즈 방탄|유퀴즈 아이유|유퀴즈 연기|유퀴즈 유행어|유퀴즈 이지은|유퀴즈 일반인|유퀴즈 티격태격|유퀴즈 힐링|유퀴즈100화|유퀴즈온더블럭 100화 다시보기|유퀴즈온더블럭 아이유|인기급상승","3287907","23659","454","2230","https://i.ytimg.com/vi/TelnExrl0N0/default.jpg","False","False","#유퀴즈온더블럭 #Diggle #디글유튜브에서 지금 핫한 사람 누구? 人기가 급상승한 人물 모음집Let's giggle, :Diggle!방송국놈들이 덕질하는 채널 '디글'구독하기 ☞ https://www.youtube.com/c/디글Diggle"
"bhXGwIpp5gk","고길동 - 종로롤린","2021-03-31T10:14:21Z","UCDb1t5K_DAgdfYQyq0k40HQ","여유만만","24","21.09.04","音mad|리믹스","3005907","73586","611","10654","https://i.ytimg.com/vi/bhXGwIpp5gk/default.jpg","False","False","소재 : 아기공룡 둘리 in 고길동원곡 : 브레이브걸스 - 롤린 (Rollin') ( https://youtu.be/nw6mcjNlh8E )*사용한 반주 : https://youtu.be/MEdk239VLE8( Brave Girls - Rollin' Instrumental REMAKE [MIDI COPY] 브레이브걸스 롤린 Inst 미디 카피 MR )DANPIA님 반주 사용 허락 감사합니다.[코멘트]종로스타 1주년 기념으로 만들어봤습니다.#브레이브걸스 #Rollin #둘리여유만만 트위치 : https://www.twitch.tv/huk102030"
"S0k6uBMPKWc","쁘야호💘 쁘걸이 음방 재소환 때 했던 가장 큰 고민?!🤔 웃음과 감동 두가지를 모두 잡은 브레이브 걸스와의 티타임☕ | 𝓪𝓯𝓽𝓮𝓻𝓷𝓸𝓸𝓷 𝓽𝓮𝓪 𝔀𝓲𝓽𝓱 𝓼𝓽𝓪𝓻","2021-04-03T09:00:19Z","UCreX6ANlD_P1yKaOSaN8A6Q","덕질하는 기자-Fangirling","24","21.09.04","fangirling|kpop|korea|star","125929","4201","19","827","https://i.ytimg.com/vi/S0k6uBMPKWc/default.jpg","False","False","드.디.어. 덕기자도 만났습니다😉역주행의 신화💓 고로나 시대의 활력소💓 뿌야호🎶 #브레이브걸스 💘뭐라도 먹이고 싶은 찐.덕.후.의 마음으로 준비한                                                          덕기자의  𝓪𝓯𝓽𝓮𝓻𝓷𝓸𝓸𝓷 𝓽𝓮𝓪 𝔀𝓲𝓽𝓱 𝓼𝓽𝓪𝓻 ✨지금 바로 즐겨보세요 😉#유정 #유나 #민영 #은지 #역주행 #롤린=====================================================[ 한국일보가 만드는 창조적 연예계 덕질 공간 ]덕질하는기자 구독하기  https://goo.gl/YeoYAT[ 비즈니스 | For Business ]hanp06@hankookilbo.com[ 다양한 곳에서 덕질하는기자 만나기 Social Media ]Facebook : https://goo.gl/3wkzs8Twitter : https://twitter.com/idoldkInstagram : @idoldkNaver TV: https://tv.naver.com/duckreporterCOPYRIGHT ⓒ 덕질하는기자 ALL RIGHTS RESERVED======================================================"
"Xqgnqv7Yx4M","알면 알수록 기묘한 동물, 문어! (feat. 문어의 지능과 진화)","2021-04-02T09:00:09Z","UCIk1-yPCTnFuzfgu4gyfWqw","과학드림 [Science Dream]","28","21.09.04","문어|지능|두족류|진화|문어 피부|문어 다리","276295","5905","139","828","https://i.ytimg.com/vi/Xqgnqv7Yx4M/default.jpg","False","False","과학드림은 여러분의 소중한 후원으로 성장합니다.멤버십 가입!▶ http://bitly.kr/ZDqKr1WUG과학드림의 식구가 되어 주세요! :)다른 후원 방법!▶https://toon.at/donate/sciencegive=============================================아마, 지구상 생명체 중에변장술에 있어 문어만큼 기괴한 녀석은 없을 겁니다.변신의 대가인 카멜레온은 호르몬을 분비해 색을 변화시키기 때문에 아무리 빨라야 약 20초 정도의 시간이 필요한 반면, 문어는 정말 눈 깜짝할 새 색을 변화시키고,심지어는 피부의 질감마저 바꿀 수 있죠.뿐만 아니라, 문어는 놀라운 기억력과 더불어 도구까지 사용하는 등 지능도 뛰어난 동물입니다.지능 면에서 척추동물의 정점에 인간이 있다면,무척추동물의 정점엔 문어가 있다라는 말이 나올 정도죠.도대체 문어는 어떻게 이런 변장술과 지능을 갖추게 된 걸까요?오늘은 기묘하고도 기괴한 문어에 대한 이야기입니다.#문어 #지능 #진화=============================================[참고 자료]- EVERET C. JONES, (1963). Tremoctopus violaceus Uses Physalia Tentacles as Weapons.- ROGER T. HANLON, (1999). Crypsis, conspicuousness, mimicry and polyphenism as antipredator defences of foraging octopuses on Indo-Pacific coral reefs, with a method of quantifying crypsis from video tapes.- Julian K. Finn et al., (2009). Defensive tool use in a coconutcarrying octopus.- Roland C. Anderson et al., (2014). Octopuses (Enteroctopus dofleini) Recognize Individual Humans.- M. Desmond Ramirez et al., (2015). Eye-independent, light-activated chromatophore expansion (LACE) and expression of phototransduction genes in the skin of Octopus bimaculoides.- Mauricio Gonzalez-Forero et al., (2018). Inference of ecological and social drivers of human brain-size evolution.- Dominic Sivitilli et al., (2019). RESEARCHERS MODEL HOW OCTOPUS ARMS MAKE DECISIONS.- Piero Amodio et al., (2019). Grow Smart and Die Young: Why DidCephalopods Evolve Intelligence?-Wen-Sung Chung et al., (2020). Toward an MRI-Based Mesoscale Connectome of the Squid Brain.[사진 및 영상]- 셔터스톡[음악](1)Mood Instrumental Version by Weare the good(2)On the way by Ian Post(3)Music: [Foam rubber] by Alexander Nakarada (www.serpentsoundstudios.com)Licensed under Creative Commons BY Attribution 4.0 Licensehttp://creativecommons.org/licenses/by/4.0/(4)Counting the money by Ian Post"
"8WJw1_PgSig","샤이니 온유 & 태민, 이형제 원래 이렇게 스윗한가요...?  막내가 너무 사랑스러운 리더, 에스크얼루어 QnA 비하인드| 얼루어코리아 Allure Korea","2021-04-02T10:30:14Z","UCcTWmzBmvxAKtM1tQ0VMwZA","Allure Korea","26","21.09.04","얼루어|얼루어코리아|Allure|Allure Korea|샤이니|SHINee|온유|태민|SHINee 태민|SHINee 온유|온유태민|샤이니 에스크얼루어|에스크얼루어|taemin","219550","18602","31","1779","https://i.ytimg.com/vi/8WJw1_PgSig/default.jpg","False","False","형이랑 같이 인터뷰 해서 마냥 즐거운 태민과 막내가 세상 사랑스러운 온유,그저 보기만해도 흐뭇한 샤이니 맏형 & 막내 케미를 감상해보세요!내일 오전 10시, 이어서 업로드 될 Key & 민호 버전 에스크 얼루어도 놓치지 마시길..! #샤이니 #온유 #태민 #SHINee----------------------------------------------------------------------------------잠깐! 얼루어 채널 구독하셨나요?구독하고 매주 올라오는 다양한 뷰티, 패션, 라이프스타일 꿀팁들을 만나보세요. 좋아요와 댓글도 잊지마세요~----------------------------------------------------------------------------------ALLURE KOREA SOCIAL MEDIA유튜브 ☞ https://goo.gl/1gZ2rm인스타그램 ☞ https://goo.gl/EMmZpT페이스북 ☞ https://goo.gl/oxz9uk네이버 포스트 ☞ https://goo.gl/qBomme카카오 ☞ https://goo.gl/2eBLLi----------------------------------------------------------------------------------"
"WCNb4dk42XE","조기축구 아저씨 유형 Best12","2021-04-02T09:03:15Z","UChb4gtsgSdwMDktdLukfrfw","김진짜 Real KIM","17","21.09.04","김진짜|김진짜유형|김진짜조기축구|조기축구|조기축구유형|김진짜조기축구아저씨|김진짜꽁트|3호님|김진짜극혐유형|동네축구|아마추어축구","270405","5323","81","669","https://i.ytimg.com/vi/WCNb4dk42XE/default.jpg","False","False","조기축구에서 만나뵐 수 있는 형님들 유형 정리해보았습니다. 항상 안전하게 재미있게 공 찼으면 좋겠습니다. 쿠키 영상 놓치지 마세요! 기획, 연출: 김진짜촬영: 3호님출연: 김진짜, 김뮐러편집: 김진짜, 유주현*골드 멤버십에 가입해주신 분들에게는 새 영상을 10분 먼저 보여드립니다.혜택확인: https://www.youtube.com/channel/UChb4gtsgSdwMDktdLukfrfw/join감사합니다.찐스타그램:https://www.instagram.com/kimjinjja10/?hl=ko3호스타그램:https://www.instagram.com/yj__dong/?hl=ko비즈니스 문의:qksdidhkdwk@naver.com틱톡:kimjinjja10"
"RoonrxBAK1s","사랑의 콜센타 돌잔치에 초대합니다_신청곡을 불러드립니다-사랑의 콜센타 시즌2 50회 예고 TV CHOSUN 210408 방송","2021-04-05T02:12:46Z","UCuw1hxBo5mDVUhgMzRDk3aw","TVCHOSUN - TV조선","24","21.09.04","임영웅|영탁|이찬원|정동원|장민호|김희재|김성주|붐|1주년|돌잔치|센타장|선물|트롯|트롯맨|트로트|사랑의콜센타|TV조선","290141","10127","234","1581","https://i.ytimg.com/vi/RoonrxBAK1s/default.jpg","False","False","null"
"NM2zBAmcDWQ","문방구에서 한 가지 과목으로만 장보기 대결ㅋㅋㅋㅋ","2021-04-01T09:00:15Z","UCmzMtXrJgfCqA0rfhz8_P4A","웃소 Wootso","23","21.09.04","웃소|wootso|유형|쿡소|호불호|korean types|삼자대결|과목별 장보기|장보기 삼자대결|웃소 삼자대결|문방구|문방구 쇼핑|웃소 삼자","431719","7380","269","1744","https://i.ytimg.com/vi/NM2zBAmcDWQ/default.jpg","False","False","앵무새 친구가 생겼다....!웃소의 다양한 굿즈는!? 웃소샵 ▶ http://wootsoshop.com웃소 구독하기 ▶ https://goo.gl/UnQQTU웃소 멤버십 [아코] 가입하기 ▶ http://youtube.com/wootso/join[웃소는?!]웃소 채널은 함께 공감할 수 있는 유형별 공감 영상, 보드게임을 비롯한 다양한 게임 및 챌린지 등 함께 모여 왁자지껄 떠들며 즐기는 모든 웃음을 영상으로 담습니다! 뚜루뚯뚯 뚜뚜뚜루루~ 우~웃소!웃소 Wootso홈페이지 http://wootso.com웃소샵 http://wootsoshop.com인스타그램 http://instagram.com/wootso"
