video_id,title,publishedAt,channelId,channelTitle,categoryId,trending_date,tags,view_count,likes,dislikes,comment_count,thumbnail_link,comments_disabled,ratings_disabled,description
"8DfkGx6nxOk","Schoko-Eiweißkuchen / Schokokuchen / einfach aber total lecker","2021-03-04T09:30:01Z","UCedE9hbOHC_YxHY0_1A151Q","Silvia W-K","22","21.05.03","Tipps|Tricks|Backen|Kochen|Garten|Hauswirtschaft|Home Economics","42591","1905","21","99","https://i.ytimg.com/vi/8DfkGx6nxOk/default.jpg","False","False","Wer kennt es nicht! Man hat für Eierlikör oder Vanillesoße nur die Eigelbe gebraucht und was mache ich jetzt mit dem Eiweiß? Dieser Schoko-Eiweißkuchen ist eine tolle Lösung. Er ist einfach herzustellen schmeckt aber total lecker.Rezept (20er Springform)3 Eiweiß1 Prise Salz60 g Zucker60 g Butter80 g Vollmilch-Kuvertüre oder Vollmilchschokolade80 g MehlBackzeit:160 ° Umluft 25-30 MinutenVerschiede Dekomöglichkeitenetwas Puderzuckerweiße Choclaitchipsoder Schokoladensahne (Sahne mit Kabapulver aufschlagen)"
"qRyiX_FdwCg","Achja.. Ich liebe eure Fragen doch so sehr...","2021-03-03T17:33:00Z","UCIS-e4W5wK2xG6NbI5Tdm_g","Need To Know","23","21.05.03","Needtoknow|needtoknoww|need to know|lustig|fragen stellen|wenn meine zuschauer mir fragen stellen|wenn meine zuschauer mir fragen stellen sollen|zuschauer fragen|frage und antwort|q&a|fragen und antworten","230652","36975","415","3578","https://i.ytimg.com/vi/qRyiX_FdwCg/default.jpg","False","False","✎ Folgt mir auf Stereo! Die nächste Live-Show wird mit meiner Mutter stattfinden, yeaahh https://stereo.com/needtoknow✎ Heute schaue ich mir ein Paar Fragen von euch an...━━━━━━━━━━━Instagram: https://www.instagram.com/needtoknoww/Mitglied werden: https://www.youtube.com/channel/UCIS-e4W5wK2xG6NbI5Tdm_g/join━━━━━━━━━━━Ich hoffe man sieht die Mühe & Arbeit, die ich in dieses Video investiert habe! :-)Ich freue mich über jedes einzelne Abo, denn dadurch weiß ich, dass ich mit meinen Videos euch Spaß bereite :D!Auch für Verbesserungsvorschläge bin ich offen, also, lasst doch einfach ein wenig konstruktive Kritik, oder auch nur ein nettes Kommentar da! :-)Ich wünsche euch noch einen schönen Tag! :D"
"P-8WEJSnQCc","The Best Steak And Sauce Combo Of All Time","2021-03-03T00:23:09Z","UC19OYOBqkgVqgTIQxbsPdlw","ThatDudeCanCook","22","21.05.03","[none]","390067","20600","523","721","https://i.ytimg.com/vi/P-8WEJSnQCc/default.jpg","False","False","#shorts #steak #cooking #sauceIf there is a better combination of Steak and Sauce in the world I haven't tried it yet!!Yakiniku 1/4 cup soy sauce 1 1/2 tbsp mirin 1 1/2 tbsp white sugar 2 tsp sesame oil 2 tsp toasted sesame seedsSUBSCRIBE: http://bit.ly/2TPzddNBUSINESS INQUIRY: CookingwithChefSonny@gmail.comFOLLOW ME:Instagram|https://www.instagram.com/cookingwithsonny/Twitter|https://twitter.com/CookingwithSon1Tiktok|https://vm.tiktok.com/xWJmN7/D5 allclad pan as seen in video-https://amzn.to/3lr682ZDISCLAIMER:This video and description contain affiliate links, which means that if you click on one of the product links, we'll receive a small commission."
"X9x9xgeVI6g","W.T.F. PLAYSTATION ❗❓ Ruiniert sich Sony gerade die Zukunft?","2021-03-04T17:55:20Z","UCwyi4mA4zCuXDhVwLxwtylA","GamingClerks","20","21.05.03","Gameplay|German|Deutsch|PS5|PlayStation 5|GamingClerks|Gaming Clerks|Zukunft|Playstation|Kritik|Japan Studio|Japan|Xbox Series X|Xbox|Vergleich|PS5 Pro","39982","3766","85","761","https://i.ytimg.com/vi/X9x9xgeVI6g/default.jpg","False","False","Ich verstehe den aktuellen Plan von PlayStation nicht. Runieren sie sich gerade die Zukunft?Abonnieren und nichts mehr verpassen: https://www.youtube.com/c/GamingClerks?sub_confirmation=1 ‗‗‗‗‗‗‗‗‗‗‗‗‗‗‗‗‗‗‗‗‗‗‗‗‗‗‗‗‗‗‗‗‗‗‗‗‗‗‗‗­‗‗‗‗‗‗‗‗‗‗‗‗‗💙 Supported GamingClerks via Patreon: http://bit.ly/ClerksSupport🎮 Mehr? MEHR! ➲ Kurzer Content auf TikTok https://vm.tiktok.com/Jj1JGp2/➲ GamingClerks auf Twitter: http://www.twitter.com/gamingclerks➲ Niko auf Instagram http://instagram.com/schlappohrpanda🔊 GamingClerks Podcast für die Ohren➲ Spotify: https://spoti.fi/2A8prZy ➲ iTunes: https://apple.co/2NIYwak ➲ SoundCloud: http://bit.ly/SoundClerks ‗‗‗‗‗‗‗‗‗‗‗‗‗‗‗‗‗‗‗‗‗‗‗‗‗‗‗‗‗‗‗‗‗‗‗‗‗‗‗‗­‗‗‗‗‗‗‗‗‗‗‗‗‗#PlayStation5"
"3Ic88dYKbTA","Live: Ministerpräsident Armin Laschet zu den Ergebnissen der Bund-Länder-Beratungen","2021-03-03T23:29:58Z","UCeYDqk0bvLsDwcdn2bI0Xiw","Land NRW","25","21.05.03","[none]","56481","183","238","230","https://i.ytimg.com/vi/3Ic88dYKbTA/default.jpg","False","False","8:58 BeginnMinisterpräsident Armin Laschet informiert im Anschluss an die Bund-Länder-Beratungen zur aktuellen Lage im Rahmen der Corona-Virus-Pandemie, zu Ergebnissen der Beratungen und zu den weiteren Maßnahmen der Landesregierung in Nordrhein-Westfalen."
"1mNSCVnSy4g","(spearfishing big mahi mahi)","2021-03-02T14:30:00Z","UCj6g9HNS_uisb8aSo5iUeow","Aquatic Apes","22","21.05.03","[none]","942773","48858","919","1351","https://i.ytimg.com/vi/1mNSCVnSy4g/default.jpg","False","False","#shortsTHIS IS THE CAMERA I USE: https://amzn.to/2NmvzWZMUSIC by these guys: https://soundcloud.com/kromatiks-musicThis is the microphone I use: https://amzn.to/2OvYFUEThis is my dive mask (with gopro mount): https://amzn.to/2Omg4PoThese are my carbon fiber dive fins: https://amzn.to/375P39kGreat book about learning how to spearfish: https://amzn.to/3rM9Zu5Amazing book about freediving, the ocean, and our connection to these things as humans: https://amzn.to/3778MFJInteresting read on how it’s scientifically proven that being near, in, on or under water can make you happier, healthier, more connected, and better at what you do: https://amzn.to/3d3USbcThis book is all about big fish, where to find them, and how to spear them. Written by a spearfishing OG, it will inspire you to explore the world, searching for big fish: https://amzn.to/2OxpcRt William Trubridge can dive to over 100 meters (330 feet) on a single breath of air, without wearing fins. This well-written autobiography explores his journey to become one of the deepest diving humans in the history of the world, and also helps show the potential that we all have inside of ourselves to dive deep, if we practice: https://amzn.to/3pe8R0PFinally, this book tells a tragic tale of an extremely talented freediver and how dangerous this sport can be, if not practiced safely: https://amzn.to/3aWqdtZ***If you want to learn how to freedive or spearfish, DO NOT TRY IT ALONE. I recommend signing up for a freediving course to learn how to dive safely and find a buddy do dive with 🤙🤙******"
"bFl8V9aUcZo","[ATEEZ - Fireworks(I'm The One)] Comeback Stage |#엠카운트다운 | M COUNTDOWN EP.700 | Mnet 210304 방송","2021-03-04T10:39:00Z","UCbD8EppRX3ZwJSou-TVo90A","Mnet K-POP","24","21.05.03","ATEEZ|에이티즈|Fireworks|불놀이야|엠카운트다운|엠카|MCD|MCOUNTDOWN|엠넷|Mnet|케이팝|KPOP","579274","96387","385","7583","https://i.ytimg.com/vi/bFl8V9aUcZo/default.jpg","False","False","- KPOP Chart Show M COUNTDOWN | EP.700- ATEEZ - Fireworks(I'm The One)▶Watch more video clips:http://bit.ly/MCOUNTDOWN2021[Kor Ver.]'최초 공개''ATEEZ'만의 맛과 멋! '불놀이야 (I'm The One)’ 무대----------------------------------------------------------------------------M COUNTDOWN is the World No.1 KPOP Chart Show, which is broadcast in 13 countries.Live broadcast every Thursday at 6 p.m. KST.(매주 목요일 저녁 6시 엠넷 생방송) ▶Subscribe Now! - Mnet K-POP: http://bit.ly/Subscribe-Mnet-KPOPFacebook: http://www.facebook.com/mcountdownTwitter: https://twitter.com/MnetMCOUNTDOWN________________________________________________Mnet(Music Network) is an official KPOP music television in South Korea owned by CJ Group.ⓒCJ ENM. Corp ALL RIGHTS RESERVED"
"BuiUKkmW9wc","Mein neuer Traum REITPLATZ I Kirchhellener Sand für Ponyhausen I Viereck Bau im eigenen Stall","2021-03-04T13:13:03Z","UCTlqQrC627gcPHBprKrQyfA","Annica Hansen","15","21.05.03","annica hansen|wölbchen|pferd|pferde|reiten|stall|reitplatz|bauen|bau|schleppen|ziehen|reitplatzbau|stremmer|sand|reitsand|paddock|selber|tretschicht|drainage|dressur|viereck|springplatz|aufbau|stresan|kirchhellener","32862","2278","25","208","https://i.ytimg.com/vi/BuiUKkmW9wc/default.jpg","False","False","Endlich ist es so weit. Ponyhausen bekommt einen neuen Reitplatz. Die Tretschicht wird abgetragen und wir überarbeiten den Boden.Nach ausgiebiger Beratung durch Stremmer Sand & Kies und Bernds Reitbodensysteme wird mein Sandplatz neu aufbereitet. Für welchen Sand ich mich entschieden habe, wie der Platz vorbereitet wurde und wie er fertig aussieht, zeige ich euch im Video.WerbungOder ihr schaut hier →Mein Reitsand https://stresan.de/Mein Reitplatzbauer https://www.bernds-reitbodensysteme.de/Wenn ihr Euch für die verschiedenen Sandarten für Plätzte, Hallen und Paddocks und Reitplatz oder Paddockbau interessiert, meldet Euch gerne bei Stresan oder Bernds. Dort könnt ihr Euch beraten lassen und alle Infos bekommen.♥ DANKE für DEIN KANAL ABO! Für DICH ist es nur ein Klick, aber DU macht es mir dadurch möglich immer bessere Videos zu produzieren und stetig zu wachsen ♥🐴 Kennst Du schon dieses PONYHAUSEN Video? 🐴https://www.youtube.com/watch?v=PKAi-CQz33Q&t=109s ----------------------------------------­-----------------------★ FANPOST / AUTOGRAMMWÜNSCHE:Ich freu mich sehr über Eure Post! Pakete & BriefeAnnica Hansen, Alte Zollstrasse 36, 41372 Niederkrüchten ----------------------------------------­-----------------------★ FOLLOW MEHier kannst Du mir auch noch folgen→ instagramhttp://instagram.com/woelbchenhttp://instagram.com/annicahansen→ facebookhttp://www.facebook.com/annicahansen ----------------------------------------­-----------------------★ mein Dreh Equipment** Vlog Kamera: https://amzn.to/2OcGGzH** große Kamera:  https://amzn.to/2RDD7EA** großes Stativ: http://amzn.to/1EUpP8j ** kleines Stativ: http://amzn.to/1sY50ky ** externes Mikro: Sennheiser http://amzn.to/1q3GNgRBearbeitungsprogramm: Final Cut Pro XMusik: Youtube Creative Tools----------------------------------------­-----------------------★ geschäftliche Anfragen und Buchungen:           hello@annicahansen.com----------------------------------------­-----------------------* PR Samples: Produkte, die ich kostenlos zur Verfügung gestellt bekomme.**Affiliate Link: Du unterstützt meinen Kanal wenn Du über diesen Link bei Amazon kaufst, da ich eine kleine Verkaufsprovision bekomme.Meine Meinung ist nicht käuflich. Egal ob bezahlt oder nicht, ich zeige Euch nur Dinge die ich zu 100% vertreten kann und die mir wirklich gefallen!!!"
"9V5GtYMi53c","Umstyling 2021: Auf 13 Kandidatinnen wartet eine große Veränderung! | GNTM 2021 ProSieben","2021-03-04T20:00:02Z","UCC5kum96eeAdJGfizULP4lw","Germany's Next Topmodel","24","21.05.03","Umstyling 2021: Auf 13 Kandidatinnen wartet eine große Veränderung!|Umstyling gntm|Umstyling|Umstyling gntm kim|umstyling gntm klaudia mit k|gntm umstyling 2021|gntm haare ab|umstyling gntm|gntm haare abrasieren|Heidi Klum Umstyling|Outfit|gntm 2021|Germanys Next Topmodel 2021|Germanys next topmodel|Topmodel 2021|GNTM|Staffel 16|Heidi Klum|Leni Klum|Models|Fashion|Stefanie Giesinger|Lena Gercke|Rebecca Mir|Model|topmodel look|casting show|ProSieben","171922","2973","76","459","https://i.ytimg.com/vi/9V5GtYMi53c/default.jpg","False","False","Heidi Klum bereitet ihre Topmodel-Anwärterinnen auf das Umstyling vor! Was erwartet die Models? Etwa ein Pixie-Cut wie bei Kandidatin Kim aus 2016? Werden wie bei Klaudia mit K große Tränen kullern? Oder bekommen alle kurze Haare? #GNTM2021Alle Videos und die ganzen Folgen von #GNTM findest du auf:https://s71.link/b/2FJD1Wi ► Abonnieren nicht vergessen: https://s71.link/b/2NlVOvZ► Ganze Folgen auf #ProSieben: https://s71.link/b/2N3vUcV► Facebook: https://s71.link/b/2D64NwR► Instagram: https://s71.link/b/2NgWZNg******************************************************Germany’s next Topmodel – by Heidi Klum – die 16. Staffel ab 04. Februar 2021, immer donnerstags um 20:15 Uhr auf ProSieben und auf JoynAuch 2021 begibt sich Weltstar Heidi Klum wieder auf die Suche nach Germany's next Topmodel, und das bereits in der 16. Staffel. Bei ProSieben bist du wie immer ganz nah dabei, wenn sich für die Kandidatinnen alles darum dreht, welche Topmodel-Anwärterin auf dem Laufsteg überzeugt und wer Heidi und ihre Gast-Juroren bei den Shootings am meisten beeindrucken kann.Auf ProSieben.de findet ihr natürlich wieder alle Videos aus der Sendung sowie weitere spannende Infos und Storys zu den Models. Hier könnt ihr euch alle aktuellen und früheren Episoden von Germany's next Topmodel jederzeit noch einmal online ansehen. In unseren GNTM-News verpasst ihr außerdem keine Neuigkeit und bleibt auch zwischen den Folgen immer top informiert.#GermanysnextTopmodel #HeidiKlum #Topmodel #Model Impressum: https://www.prosieben.de/service/impressum"
"fIq5XiJMecM","Große Neuigkeiten bei uns + Kirschkuchen Backen 🍒","2021-03-04T17:02:31Z","UCqAISscklbbQS-Y3GHyE-sA","Kupferfuchs","22","21.05.03","kirschkuchen backen|kirschkuchen backen blech|kirschkuchen backen einfach|kirschkuchen backen mit christina|kirschkuchen backblech|kirschkuchen backform|kirschkuchen backmischung|kirschkuchen banane|kirschkuchen blech|kirschkuchen blech einfach|kirschkuchen blech pudding|kirschkuchen blech rezept|kirschkuchen blechkuchen|kirschkuchen mit pudding|kirschkuchen mit quark|kirschkuchen mit streusel|kirschkuchen ohne backen|kirschkuchen rezept|kirschkuchen vegan","44809","5405","31","1030","https://i.ytimg.com/vi/fIq5XiJMecM/default.jpg","False","False","Kirschkuchen backen ist heute tatsächlich nicht sooo das große Thema. Kirschkuchen backen wir zwar trotzdem, darum geht es aber eigentlich nicht, denn ich ahab euch heute was wichtioges zu erzählen :) Also große News... UND Kirschkuchen backen :D► Mein Onlineshop: http://kupfergruen.shop► Lass dich benachrichtigen, wenns los geht: http://kupfergruen.shop/newsletter► Gutscheincode: HAPPY21 21% aufs gesamte Sortiment (Nur gültig am 07.03.2021)►Podcast Spotify: https://spoti.fi/3bQh5co​►Kirschkuchen-Rezept: https://www.instagram.com/kupferfuchs/reels/__►►Für mehr Videos: http://likn.de/R4W__►►►Social NetworkingInstagram: http://instagram.com/kupferfuchsTwitter: https://twitter.com/KupferFuchsFacebook: https://www.facebook.com/KupferfuchsTwitch: https://www.twitch.tv/kupferfuchsPodcast Spotify: https://spoti.fi/3bQh5co__♥Fuchsfamilie♥"
"o_WlT8WA1No","Yaw Tog, Stormzy & Kwesi Arthur - Sore (Remix) (Official Video)","2021-03-04T20:00:14Z","UCddWk8aPqzPeyRN9OIygcwg","Yaw Tog YT","10","21.05.03","[none]","298718","32489","257","3974","https://i.ytimg.com/vi/o_WlT8WA1No/default.jpg","False","False","Listen to the single Sore (Remix). Out now! Stream: https://music.empi.re/soreremix.oyd Video directed by KooPokuStudios #YawTog #Stormzy #KwesiArthur Official music video by Yaw Tog, Stormzy & Kwesi Arthur - Sore (Remix) © 2021 KOOPOKUSTUDIOS / EMPIRE"
"dWZHglupNiU","Dachdecker / Alltag #4 / Trainingsplan Dachfenster / Dacheinteilung","2021-03-04T19:00:11Z","UCYRfE59YDkK58_EJTX_Zmpw","DACH PRO","22","21.05.03","dachdecker|zimmerer|spengler|dachsanierung|dachdecken|steildach|handwerk|dachfenster|baustelle|gerüstbauer|berufsschule|ausbildung|dachdeckergeselle|lehrling|praktikant|roofer|lattung|einlatten|dacheinteillung|velux|engelbert strauß hose|baustellenfahrzeug|trainingsplan|ladungssicherung|nageltasche|würth|Schrauben|Eindeckrahmen|fensterkehle|kamineinfassung|dach|einteilen|Dachziegel|Ziegel|Einteilung|hikoki|makita|nagelschussgerät akku|Akkuschrauber|future|mask off|dach pro","24078","882","20","119","https://i.ytimg.com/vi/dWZHglupNiU/default.jpg","False","False","▬ Über diesen Kanal ▬▬▬▬▬▬▬▬▬▬▬▬ Du bist selber vom Fach oder hast einfach nur Spaß daran, anderen bei der Arbeit zuzusehen? Mit „Dach PRO“ hast du die ultimative Möglichkeit gefunden, Dachdeckern bei ihrer täglichen Arbeit über die Schulter zu schauen.Alle Videos wurden geschnitten und ggf. in der Ablaufreihenfolge geändert. Wir wollen keine Praxistipps für Heimwerker geben und verfolgen auch keinen Bildungsauftrag. Wir übernehmen keine Haftung für Irrtümer, Aufbaufehler und Regeländerungen. Wir möchten informieren und unterhalten. Achtet bei der Ausführung eurer Arbeit auf eure persönliche Schutzausrüstung und ausreichenden Arbeitsschutz. Informationen hierzu findet ihr auf www.bgbau.de Schützt die Gewerke! Ja zum Meister!Hoch die Dachdeckerkunst!▬ Projekt unterstützen ▬▬▬▬▬▬▬▬▬▬▬▬▬▬▬🗃 https://www.dach-pro.de​🔔 https://www.dach-pro.shop​▬ Social Media ▬▬▬▬▬▬▬▬▬▬▬▬▬▬▬►Instagram: https://www.instagram.com/dachpro/​►TikTok: https://www.tiktok.com/@dachpro/​►Facebook: http://www.facebook.com/DachPRO.HD/​▬ Ausrüstung in diesem Video ▬▬▬▬▬▬▬▬▬▬▬▬▬Dach PRO Bleistift: http://bit.ly/30eOh69Bitset: https://amzn.to/37wcXu7​Messer: https://amzn.to/3lwcBc9​Schonhammer: https://amzn.to/3lCat2i​Blechschere rechts: https://amzn.to/2Vy08tGBlechschere links: https://amzn.to/2L4jZijAnreißschablone: https://amzn.to/3lAbM1VRadio: https://amzn.to/2Vvv2D5​Akku-Schrauber: https://amzn.to/3g721qTAkku-Handkreissäge: https://amzn.to/37qypkiBleistift: https://amzn.to/2VvNiwbAkku-Streifen-Nagler: https://amzn.to/3ok5Uf4Schlagschnur: https://amzn.to/3mF0JWt​Softshelljacke: https://amzn.to/36wRHoY​​▬ Kamera Eqipment ▬▬▬▬▬▬▬▬▬▬▬▬Actioncam Profi: https://amzn.to/3g5nYGA​▬ Affiliate Links ▬▬▬▬▬▬▬▬▬▬▬▬Die Links von Amazon sind sogenannte Affiliate Links. Bei diesen bekommen wir eine Provision für jeden Kauf den ihr macht. Für Euch entstehen dadurch keine Mehrkosten.#DachPRO​ #SAFETYGEHTFIRST​ #Dachdecker"
"6XSX2HpDDso","Warum wurde Anakin keine Jedi Tempelwache?","2021-03-04T12:00:01Z","UCAQXa3MEqtuVSkvqQfabI_g","Star Wars Stories | Deutsch","24","21.05.03","star wars deutsch|star wars geschichten|star wars stories|star wars stories deutsch|anakin tempelwache|warum wurde anakin keine jedi tempelwache|warum wurde anakin zu keiner jedi tempelwache|jedi wache|tempel wache","79570","7844","35","415","https://i.ytimg.com/vi/6XSX2HpDDso/default.jpg","False","False","► Livestreams: https://www.twitch.tv/starwarsstories​​​​Warum wurde Anakin keine Jedi Tempelwache?► Instagram: https://www.instagram.com/starwarsstoriesdehttps://www.instagram.com/jakobano​​► Musik von epidemicsound.com:Galactic Battles - Bonnie GraceWhen Fealty Fails - Jon BjorkPatient Zero - Robert Ruth"
"ksqRyYD6L50","Bachelor 2021 #8: Michèle FLIEGT RAUS & Mimi GEHT FREIWILLIG?!? | Bachelor Folge 8","2021-03-04T09:00:13Z","UCpgEjwz_weSmlBhT-evPOcQ","Robsn","24","21.05.03","Bachelor|bachelor|Niko bachelor|bachelor 2021|bachelor Niko|bachelor neue staffel|liebe|rose|rote rose|nacht der rosen|tvnow|rtl|andrej|melissa|love island|der bachelor 2021|der Bachelor|der bachelor neue staffel|kuss|drama|erster kuss|kiss|love|achte folge|folge 8|bachelor achte folge|bachelor 8|bachelor folge 8|bachelor folge acht","67641","1103","19","340","https://i.ytimg.com/vi/ksqRyYD6L50/default.jpg","False","False","Servus Leute,der Bachelor 2021 mit Niko Griesert. In einer Villa in Deutschland trifft er auf 22 Frauen und darf rote Rosen verteilen. Am Ende muss er sich für eine Person entscheiden.In Folge 8 werden Home Dates geführt. Davor fliegt aber schon eine Kandidatin und danach fleigt eine zweite. Beider Michelles drohen zu gehen. Bereut Niko seine Entscheidung? #Bachelor #NachtderRosen #TVNOW Ich hoffe es gefällt euch!Viel Spaß! Lasst gerne ein Abo und einen Daumen da! :-)  MUSIK: - https://www.youtube.com/watch?v=g_CX3UWFchU- https://www.youtube.com/watch?v=9Rfykh-YzCc- https://www.youtube.com/watch?v=vBGiFtb8Rpw- https://www.youtube.com/watch?v=Tv6WImqSuxA- https://www.youtube.com/watch?v=3sCGysVB41kGrazMEINE LINKS:INSTAGRAM: robsn_ytE-Mail für Geschäftsanfragen/ E-Mail for business inquiries: obadic.robert@gmail.com"
"D30BjKV6Nio","Das ist Zoes Abschiedsvideo 😢😲  | Köln 50667 #2065","2021-03-04T18:00:11Z","UCnrvUg5MJWPDSrv_voT7AqA","Köln 50667","24","21.05.03","Köln|50667|RTL2|RTL|Serie|k50667|ganze folge|tv now|preview|stream|ganze folge köln|soap köln|preview köln|Stella Köln 50667|oskar köln 50667|danilo köln 50667|beate köln 50667|köln 50667 luca|köln 50667 nelli|toni köln 50667|nelly köln 50667|köln 50667 phil|köln 50667 jill|oscar köln|vorschau|tägliche highlights|cleo köln 50667|köln 50667 bo und leonie|köln 50667 online schauen kostenlos|köln 50667 kevin","215449","6946","93","216","https://i.ytimg.com/vi/D30BjKV6Nio/default.jpg","False","False","Kevin nimmt endlich allen Mut zusammen und schaut sich gemeinsam mit Leonie Zoes Abschiedsvideo an. Doch Zoe hat nicht nur emotionale Worte für Kevin, sondern auch einen Auftrag!Abonniert unseren Kanal: https://www.youtube.com/channel/UCnrvUg5MJWPDSrv_voT7AqA?sub_confirmation=1Holt euch die Köln 50667-App: https://k50.rtl2.de/0dNVt3CN29Instagram: http://www.instagram.com/koeln50667Schaut euch die kompletten Folgen auf TVNOW an: http://www.tvnow.de/rtl2/koeln-50667Facebook: http://www.facebook.com/koeln50667Twitter: http://twitter.com/rtl2„Köln 50667“ ist eine Reality-Soap, die seit 2013 täglich von montags bis freitags im Vorabendprogramm gesendet wird. Aufgrund des großen Erfolges wurde die ursprünglich auf 120 Folgen begrenzte Serie weiter produziert und ist bisher auf über 1700 Folgen angewachsen. Im Mittelpunkt stehen unter anderem Kevin, Jan, Sophia, Marc und Jule. Köln 50667 erzählt die spannenden Geschichten von Kevin, Sophia und Co. Egal, ob im Vanity oder in den WGs - hier gibt es Leben pur.#köln50667 #k50 #rtlzwei"
"kBscScFQNHY","Krass, was Lukas sich traut...! 😳🤬 #324 | Krass Schule","2021-03-04T17:15:04Z","UCKjG1V6WFTfnMP6B9rumr-g","Krass Schule - Die jungen Lehrer","24","21.05.03","RTLZWEI|neue folgen|krass klassenfahrt|krass schule|rtl2|ganze folge|preview|tv now|die jungen lehrer|schule|RTL|krasse schule|krass schule 2020|krass schule neue staffel|tv now krass schule|staffel 4|carmen krass schule|lukas krass schule|max krass schule|niko krass schule|liebe|love|in love|beziehung|fail|zocken|zockerabend|spieleabend|spielen|gaming|games|gamer|vertrauen|hintergehen|sauer|kumpels|324 krass schule|freund|freundin|pärchen|zusammen wohnen","269217","12960","215","611","https://i.ytimg.com/vi/kBscScFQNHY/default.jpg","False","False","Eigentlich war ein chilliger Abend mit Carmen geplant, aber Lukas hat offensichtlich auch seine Kumpels zum Zocken eingeladen. Carmen ist alles andere als begeistert davon...Die ganze Folge auf TVNOW: https://www.tvnow.de/rtl2/krass-schule-die-jungen-lehrerFolgt uns bei Instagram: www.instagram.com/krassschuleFolgt uns bei TikTok: https://vm.tiktok.com/ZSTfvydX/Folgt uns bei Snapchat: https://www.snapchat.com/discover/Krass_Schule/1928030477Zur Website: http://www.RTLZWEI.de/sendung/krass-schule-die-jungen-lehrerBei der RTLZWEI-Sendung „Krass Schule - Die jungen Lehrer“ geht es um Liebe, Intrigen und den knallharten Konkurrenzkampf an Deutschlands härtester Schule! Der Druck ist für Lehrer, Schüler und Referendare hoch - und manche drohen daran zu zerbrechen."
