video_id,title,publishedAt,channelId,channelTitle,categoryId,trending_date,tags,view_count,likes,dislikes,comment_count,thumbnail_link,comments_disabled,ratings_disabled,description
"4IRBsQYY5QY","Daisy (feat. pH-1)","2021-04-07T09:11:13Z","UCrxE3jMpg69KhoXgD1eWRKg","Mirani - Topic","10","21.09.04","Mirani|미란이|pH-1|Daisy|Daisy (feat. pH-1)","67826","329","9","0","https://i.ytimg.com/vi/4IRBsQYY5QY/default.jpg","False","False","Provided to YouTube by WM KoreaDaisy (feat. pH-1) · Mirani · pH-1Daisy℗ 2021 AREAArranger: GroovyRoomArranger: KontrabandzVocals: MiraniCover  Artist: Seulki LimComposer: GroovyRoomComposer: KontrabandzComposer: MOONComposer, Lyricist: MiraniLyricist: Park Joon WonAuto-generated by YouTube."
"mRlocNbydH8","🦷 기억을 없애주는 치과 🧠｜망각 발치 ASMR","2021-04-07T12:00:28Z","UCa_ZCXMQ57PDcpE_3tPOW1g","rappeler하쁠리","22","21.09.04","korean asmr|relaxing sound|satisfying sound|ASMR|잠오는소리|insomnia|불면증|수면|편안|팅글|한국어asmr|하쁠리|rappeler","168389","5811","88","570","https://i.ytimg.com/vi/mRlocNbydH8/default.jpg","False","False","🔊 이어폰 권장볼륨 : 3~6/10🐥 *오늘의 메시지* 드디어 여러분의 사연으로 만든 첫 번째 영상이 나왔네요. 용기내어 보내주신 사연이라는 것을 잘 알기 때문에 정말 소중히 만들지 않을 수 없었답니다. 인트로 부분에 나오는 작은 캐릭터는 송이님의 현재와 아기 때 사진을 보고 만든 것이랍니다. 모든 분들이 같이 즐기셨으면 좋겠어요. 잊고 싶은 기억이 있다면 몽중치과로 오세요 :D 🐥 *송이님 사연*(길이 문제로 짧게 간추렸습니다.) 제가 4살쯤이었을 때부터  아빠가 엄마에게 폭력을 쓰기 시작하셨어요. 거실에서는 아빠가 욕하는 소리, 때리는 소리가 계속 났어요.  방 안에서 제가 듣는 소리는 정말 정말 무섭고 싫었어요. 엄마가 어떻게 맞고 있는지 상상하게 됐거든요.  그때는 너무 어렸어서라는 변명을 써서 말해보지만  저는 아무것도 하지 못했어요.  나가서 아빠를 말리지도, 경찰에 신고하지도,  그리고 힘든 엄마를 제대로 위로하지도요.  그게 지금까지 죄책감이 되어서 저를 힘들게 해요.  엄마한테 너무너무 미안해서요.  저는 지금 엄마하고 같이 있지만  한동안은 박수 소리나 뭐든  때리는 소리랑 비슷한 소리가 들리면  심장이 쿵쾅거리고 힘들어서 그 자리엔 있을 수가 없었어요.  기억을 지우는 약이 있으면  정말 그거라도 먹고 싶다고 생각해본 적도 있어요.  진짜 힘들었던 사람은 엄마인데  제가 이렇게까지 힘들어도 되나 싶어서  요즘 또 죄책감이 하나 더 늘었어요.  계속 답답하고 우울해져만 가는 것 같아요.🐥 *타임라인*   00:01 미리듣기 00:25 인트로 01:27 병원 접수 02:22 검사실 17:40 발치실 44:58 후원콩 후원콩 영상 미리보기 & 후원콩 목록        (구독 버튼 옆 가입 누르시면 후원자가 되실 수 있어요!)🐥 *인스타, 부계정 등 링크*⊙ *INSTAGRAM*  https://www.instagram.com/rappeler.iam/⊙ *하쁠리 채널 후원 링크* (영상 선공개 / 광고없는 후원콩이 전용 영상 업로드) https://www.youtube.com/channel/UCa_ZCXMQ57PDcpE_3tPOW1g/join⊙ *EMAIL* dalcom20000@gmail.com각국어 번역 자막 제작 :컨텐츠 제작의 마무리는 컨텐츠플라이! 글로벌 진출을 위한 최고의 파트너,CONTENTSFLY에서 제작되었습니다.https://www.contentsfly.com  #치과asmr #점토부수기 #몽중치과"
"GiAuPQI9bhQ","나빼고 말하지마 근데 말은 시키지마","2021-04-08T00:39:43Z","UCzjDgV-G8_J-iRbkYktqyGQ","속삭이는몽자","15","21.09.04","[none]","210718","7296","34","584","https://i.ytimg.com/vi/GiAuPQI9bhQ/default.jpg","False","False","*몽자 2016년 4월 8일생 여아https://www.instagram.com/mongja0408♪Music provided by 브금대통령안졸리나 졸리다  https://youtu.be/NNKNQMeWhm4"
"xw6kW8GMrrQ","정찬성 vs 댄 이게 공식 발표! 왜 또 5라운드로 싸우나? 정찬성이 직접 밝힙니다 [Korean Zombie Chan Sung Jung]","2021-04-08T09:00:19Z","UCc7o0OkR2BDFN4TCgPChjEw","KoreanZombie 코리안좀비","17","21.09.04","정찬성|코리안좀비|코리안 좀비|koreanzombie|korean zombie|chan sung jung|chansung|chan sung|KZ|MMA|UFC|종합격투기|종합 격투기|코좀|격투기|AOMG|댄이게","100204","3338","48","1484","https://i.ytimg.com/vi/xw6kW8GMrrQ/default.jpg","False","False","#정찬성 #KoreanZombie #댄이게2021년 6월 20일(GMT+9)옥타곤 링 위에서 뵙겠습니다! 🥊[코리안 좀비 정찬성 공식 유튜브 채널]제작: (주)샌드박스네트워크이메일: koreanzombie@sandbox.co.kr"
"Jl425XVHqpk","생으로 먹으면 절대 안되는 회와 수산물 7가지!","2021-04-06T10:00:15Z","UCY2uWQDCzn_ZE-JpTfDRR2A","입질의추억TV jiminTV","24","21.09.04","수산물|해산물|장어|자연산연어|홍합|입질의추억","484394","7040","210","788","https://i.ytimg.com/vi/Jl425XVHqpk/default.jpg","False","False","00:00 시작00:43 생으로 먹으면 안되는 식재료01:10 문어03:24 장어류05:54 패류의 중장선07:42 자연산 연어09:25 열대성 대형 어류11:56 홍합12:38 개해삼13:28 몇몇 민물고기의외로 사람들이 모르고 먹다가 탈이 나기도 하는 수산물이니 알아둡시다! 입질의추억TV를 구독(무료)하는 것은 사랑입니다~♥ '좋아요와 알림설정도' 부탁드려요! ^^- 총괄 : 김지민- 기획, 촬영 : 김지민, 조정연- 영상 편집 : 김은진입질의 추억의 어류, 생선 ↓↓↓https://www.youtube.com/watch?v=GT2qGGuS5XM&list=PLd4fUtz0QVASvLY7_3uYcW2ZwrQBDIWCv입질의 추억의 갑각류, 해산물 ↓↓↓https://www.youtube.com/watch?v=cqo7hsXNKf4&list=PLd4fUtz0QVAR_kVXWGfLQpqE67mJcG5QK입질의 추억의 수산시장 탐방 ↓↓↓https://www.youtube.com/watch?v=Hht0ZmjrmfI&list=PLd4fUtz0QVAQHxDjV_quwK95IHFTZmwa-입질의 추억의 기생충 이야기 ↓↓↓https://www.youtube.com/watch?v=NPyijVTsP5g&list=PLd4fUtz0QVATWhwAmbsl2j-Ar0BLKqTiq입질의 추억의 낚시 ↓↓↓https://www.youtube.com/watch?v=sCDxpD2i2Mo&list=PLd4fUtz0QVASGVPnYom-uOcmKeuOGCbE1입질의 추억의 V-Log ↓↓↓https://www.youtube.com/watch?v=Y45HiRxaKg4&list=PLd4fUtz0QVARYm-f4KqxAQaYycLvTRrA3비즈니스 문의 : slds3@hanmail.net입질의추억 유튜브 구독하기 : https://www.youtube.com/입질의추억tv입질의 추억 티스토리 블로그 : https://slds2.tistory.com입질의 추억 네이버 블로그 : https://blog.naver.com/slds2입질의 추억 페이스북 : https://www.facebook.com/slds22입질의 추억 인스타그램 : https://www.instagram.com/slds3네이버 오디오 클립(우리 식탁의 수산물 상식) : https://audioclip.naver.com/channels/802#날로먹으면안되는수산물 #해산물 #장어"
"CT35p0Bx1qs","[하이라이트✨] 특전사 듀오에겐 쉬워도 너무 쉬운 생존? 순식간에 낙지 머리가...! [정글의 법칙|SBS 210403 방송]","2021-04-06T09:00:08Z","UC5QSBlTcEJV0b0L8-EAVNYg","정글의 법칙","22","21.09.04","[none]","214998","1134","68","122","https://i.ytimg.com/vi/CT35p0Bx1qs/default.jpg","False","False","여기에 그냥 걸면 되는 거 아냐?이미 깡미님 매력에 중독...😍Ep.444✨매주 토요일 오후 08:55​ [정글의 법칙] 본방사수!✨[정글의 법칙] 유튜브 채널을 구독하면 더욱 빠르게과거 레전드 영상부터 미공개 영상을 즐기실 수 있습니다! 😆#정글의법칙​ #하이라이트 #특전사듀오 #정글의법칙_생존의달인 #김병만 #박군 #강은미 #라이머 #이동국"
"3C6xfNeb5Xs","[MV] 미란이(mirani)-Daisy (feat.pH-1)","2021-04-07T09:00:03Z","UCcQ3rsk3vO-qaJkWYva5-KQ","미란이","22","21.09.04","#미란이|#데이지|#미란이뮤비","451417","18963","117","2399","https://i.ytimg.com/vi/3C6xfNeb5Xs/default.jpg","False","False","난 더이상 봄이 무섭지 않아미란이 (Mirani) - Daisy (Feat. pH-1)Listen and downloadhttps://smarturl.it/MIRANI_DAISYFollow@미란이 (Mirani)Instagram : https://www.instagram.com/mirannnnnnni/@AREAInstagram : https://www.instagram.com/areainarea/"
"eX5GWkH7slQ","아기수달이 드디어 첫 수영을 해요! 태어나서 처음 수영 배우는 아기수달","2021-04-06T10:04:46Z","UCHXnnasv33y-tDilXip8s9A","이웃집수달 Otter’s Home","15","21.09.04","수달|otter|水獺|수달키우기|아기수달|baby otter|sea otter|해달|otter pet|カワウソ|nutrias","634830","10784","114","1142","https://i.ytimg.com/vi/eX5GWkH7slQ/default.jpg","False","False","*이웃집수달은 정식동물원 등록 및 수달 사육시설등록을 완료해 합법적으로 수달을 키우고 있습니다.수달가족 돌체♥라떼 = 모카돌체 / 아빠수달 / 2살: 장꾸, 친화력 좋은 남자아이/까만 입술과 코라떼 / 엄마수달 / 7살 : 새침도도공주님, 표정이 풍부한 여자아이/분홍한 입술과 코! 모카 / 아기수달(여) / 2021.02.04 오전 9시 42분: 돌체, 라떼사이에서 태어난 공주님, 엄마아빠와 집사들의 사랑을 먹고 무럭무럭 자라는 중!▷집주소 : 대구 중구 명덕로 99, 5층 이웃집수달 http://naver.me/GT0Oy391▷콜라보&광고,협찬&기타문의 :  E-mail - senacein910@gmail.com▷인스타그램 :  http://instagram.com/neighbor_otter▷투네이션-https://toon.at/donate/otter*멸종위기의 수달에게 관심과 사랑을 주세요!*Otter's Home have completed the official zoo permit and the otter care facility permit.We are raising otters legally.Otter Family Dolce♥Latte=MochaDolce / Daddy otter / 2 year old: mischievous,  friendly boy/black lips and nose! Latte / Mommy otter /7 years old: Lofty Princess,  a girl full of facial expressions/pink lips and nose!Mocha / baby otter(Girl) / 2021.02.04 AM 9 : 42 Born: She is growing up after eating the love of her mother latte and father Dolce.*Give attention and love to endangered otters!"
"qpTgjtXR1DQ","[20/21 UCL 8강 1차] 포르투 vs 첼시 H/L","2021-04-08T05:00:08Z","UCtm_QoN2SIxwCE-59shX7Qg","SPOTV","17","21.09.04","SPOTV|스포티비|UCL|포르투|첼시|마운트|벤 칠웰|멘디|페페|조르지뉴|베르너|하베르츠","535992","2939","85","1167","https://i.ytimg.com/vi/qpTgjtXR1DQ/default.jpg","False","False","포르투 vs 첼시 경기 하이라이트"
"aMq7a5fHDCI","일주일 동안 미역 음식만 먹어봤습니다. 미역 다이어트!","2021-04-06T08:00:00Z","UCYnfy2hyzqnVXv_UlLBiV-A","일주어터","22","21.09.04","미역국|미역국수|건미역|생미역|물미역|미역요리|일주일다이어트|단기다이어트|원푸드다이어트|다이어트방법|다이어트영상|다이어트자극","475955","11055","166","1745","https://i.ytimg.com/vi/aMq7a5fHDCI/default.jpg","False","False","단기간의 무리한 다이어트는 건강을 해칩니다.건강한 다이어트란 적게 먹고 많이 움직이는 것이죠.하나의 컨텐츠로 봐주시면 감사하겠습니다.인스타그램 : http://www.instagram.com/juy93​(수익 전액 기부) 돼지 머리띠 : https://bit.ly/3mlFYzP(수익 전액 기부) 소주 코인 목걸이 : https://bit.ly/3cPXkS7#서울역 #악역 #주단태"
"VleVR1g_56E","[TEASER] 강다니엘(KANGDANIEL) - Antidote M/V #1","2021-04-06T15:00:11Z","UCHGJwrjlY6rmZJInxRmiztA","KONNECT Entertainment","10","21.09.04","[none]","223154","30917","113","4216","https://i.ytimg.com/vi/VleVR1g_56E/default.jpg","False","False","[TEASER] 강다니엘(KANGDANIEL) - Antidote M/V #1#강다니엘 #KANGDANIEL #YELLOW #AntidoteOfficial Homepage : https://danielk.konnectent.com Official Twitter : https://twitter.com/konnect_danielk Official Instagram : https://www.instagram.com/konnect_kangdaniel Artist Instagram : https://www.instagram.com/daniel.k.here/ Official V LIVE : https://channels.vlive.tv/B019E3/home"
"mtIDstrQZLA","신입사원 미란이가 예능 만렙 선배들에게 살아남는 법 [DF Interview] 미란이 (Mirani) (Feat. pH-1) (W. 그루비룸)","2021-04-06T10:00:27Z","UCviI9lzTe2pkxJ9M2ArA7WQ","dingo freestyle","10","21.09.04","dingofreestyle|dingo|딩고|딩고프리스타일|딩프|DF|힙합|hiphop|미란이|그루비룸|피에치원","434333","8454","70","752","https://i.ytimg.com/vi/mtIDstrQZLA/default.jpg","False","False","미란이가 직접 말하는 에어리어 영입 썰부터🔥 벚꽃연금각🌸 미란이 미공개 신곡 소개까지...?▶딩고프리스타일 (Dingo Freestyle) : http://bit.ly/Dingo__Freestyle▶딩고뮤직 (Dingo Music) : http://bit.ly/Dingo__Music▶일소라 (일반인들의 소름돋는 라이브) : http://bit.ly/ilsoracontact : musicbiz@makeus.com#미란이 #pH1 #그루비룸#딩고프리스타일 #DingoFreestyle"
"DslHXIOhFMs","길거리에서 사쿠란보 춰보기","2021-04-06T10:30:13Z","UCabon80hORhtGhnqClyeixQ","김광연","10","21.09.04","[none]","1133915","49408","894","7615","https://i.ytimg.com/vi/DslHXIOhFMs/default.jpg","False","False","이 영상의 좋아요가 10000개를 넘으면 롤린 교차편집 영상을 올리겠습니다.+ 약속 지켰습니다: https://www.youtube.com/watch?v=C9z18eWTbQ0사쿠란보 치면서 사쿠란보 춰보기: https://www.youtube.com/watch?v=eaT7HbCOJH0인스타: light_kite_0110♫ Instagram: https://www.instagram.com/light_kite_0110/♫ Facebook: https://www.facebook.com/profile.php?id=100006248265168♫ Toonation: http://toon.at/donate/lightkite0110#김광연 #피아노 #사쿠란보"
"vyuQAgDBKM4","Like Water","2021-04-05T09:03:55Z","UCdNMDRSHlZiBEBYBmZeTGhQ","WENDY - Topic","10","21.09.04","WENDY|Like Water - The 1st Mini Album|Like Water","475380","9034","174","7","https://i.ytimg.com/vi/vyuQAgDBKM4/default.jpg","False","False","Provided to YouTube by SM EntertainmentLike Water · WENDYLike Water - The 1st Mini Album℗ SM EntertainmentReleased on: 2021-04-05Lyricist: KENZIELyricist: YOO YOUNG JINComposer: Coach & SendoComposer: Anne Judith Stokke WikArranger: Coach & SendoAuto-generated by YouTube."
"oUDi648X_oU","[1일1준^^]최준의 니곡내곡 '폴킴님의 너를만나' 댓글읽기를 해보았어요^^","2021-04-06T15:40:46Z","UCPwGQuQiIqvUTfa_OKZL7qQ","김해준","23","21.09.04","[none]","329023","6965","107","935","https://i.ytimg.com/vi/oUDi648X_oU/default.jpg","False","False","#최준 #김해준 #폴킴 #너를만나 #니곡내곡 #피식대학"
"hivxAjKzTWU","[짐승친구들] 셀프 미용","2021-04-07T09:00:25Z","UCszFjh7CEfwDb7UUGb4RzCQ","짤툰","1","21.09.04","짤툰|만화|애니메이션|웹툰|병맛|더빙|병맛더빙|yt:cc=on","1373752","23352","451","3821","https://i.ytimg.com/vi/hivxAjKzTWU/default.jpg","False","False","이 만화는 무료로 웃겨줍니다![배급 : 빅픽처팀] [기획 : 비크리스피] [제작 : 짤태식 스튜디오]각본 - 짤태식 / 작화 - 최수빈(feat. 김혜은) / 도움 - 김태훈, 황현식, 안송주, 장다현, 김주은, 이유진, 최지영, 윤남우, 황태훈, 최혁준 / 성우 - 짤태식, 성현희#짤툰#애니메이션#짐승친구들#셀프미용"
"VXpg5FVDhVw","설거지 절대 안끝나게 계속 몰래 쌓기ㅋㅋㅋ","2021-04-06T10:45:01Z","UCzRDCwJdqSSRwI4BgojVkIw","핫소스","22","21.09.04","핫소스|웃긴영상|예능|유머|장난|몰래카메라|시트콤|보물섬|핫소스 김선응|핫소스 송형주|핫소스 시트콤|hidden cam|설거지 절대 안끝나게 계속 몰래 쌓기ㅋㅋㅋ|핫소스 배말랭","745230","12945","321","1830","https://i.ytimg.com/vi/VXpg5FVDhVw/default.jpg","False","False","#핫소스 #웃긴영상 #시트콤음뫄!핫소스!설거지 절대 안끝나게 계속 몰래 쌓기ㅋㅋㅋ좋아요&구독&알람설정!인스타주소@apnalchangchangkimseoneung 김선응@hyoja94 송형주"
"-Ih5UArd4zk","WENDY 웬디 'Like Water' MV","2021-04-05T09:00:00Z","UCEf_Bc-KVd7onSeifS3py9g","SMTOWN","10","21.09.04","[none]","7107729","865757","7746","114584","https://i.ytimg.com/vi/-Ih5UArd4zk/default.jpg","False","False","WENDY's 1st Mini Album Like Water is out!Listen and download on your favorite platform: https://smarturl.it/WENDY_LIKEWATER💧'When This Rain Stops' Live Video: https://youtu.be/tknKZe_TyqU[Tracklist]01 When This Rain Stops02 Like Water03 Why Can't You Love Me?04 초행길 (The Road)05 Best Friend (with SEULGI)WENDY Officialhttp://www.youtube.com/redvelvethttp://www.facebook.com/RedVelvethttp://www.instagram.com/redvelvet.smtownhttps://www.tiktok.com/@redvelvet_smtownhttps://www.vlive.tv/channel/DCF447http://twitter.com/RVsmtown#WENDY​ #웬디​ #Like_WaterWENDY 웬디 'Like Water' MV ℗ SM Entertainment"
"R8ja8lDIBt8","When This Rain Stops","2021-04-05T09:03:55Z","UCdNMDRSHlZiBEBYBmZeTGhQ","WENDY - Topic","10","21.09.04","WENDY|Like Water - The 1st Mini Album|When This Rain Stops","351647","12199","78","6","https://i.ytimg.com/vi/R8ja8lDIBt8/default.jpg","False","False","Provided to YouTube by SM EntertainmentWhen This Rain Stops · WENDYLike Water - The 1st Mini Album℗ SM EntertainmentReleased on: 2021-04-05Composer: minGtionLyricist: minGtionArranger: minGtionAuto-generated by YouTube."
"sO2dCqcAabU","텍사스 비프립 : 극대노 유발하는 소갈비 대장주! 홈메이드 실내 레시피로! (Homemade Oven Baked Beef Ribs)","2021-04-06T09:15:14Z","UC0VR2v4TZeGcOrZHnmwbU_Q","육식맨 YOOXICMAN","24","21.09.04","요리|레시피|오븐|육식|고기|육식맨|고기요리|YOOXICMAN|비프립|beef ribs|소갈비|만화고기|뼈 고기|바베큐|텍사스바베큐|오븐요리|오븐레시피|오븐바베큐|갈비","506283","7573","144","1195","https://i.ytimg.com/vi/sO2dCqcAabU/default.jpg","False","False","※ 오늘 영상에 등장하는 모든 식재료, 조리도구, 브랜드에 대해 광고, 협찬 없습니다.[[[자주 받는 질문들]]][육식맨 YOOXICMAN 채널 소개]고기 없이 못 사는 육식주의자를 위한 본격 육식 요리 채널!!!평범한 아파트 가정집에서 평범하지 않은 고기 요리에 도전합니다!메뉴 선정, 식자재 준비, 요리, 촬영, 영상 편집 모든 과정을 혼자서 직접 합니다.유튜브, 인스타그램 외 소셜 미디어를 운영하지 않으며특히 페이스북과 인스타그램의 제 영상은 100% 무단도용(불펌)이니 신고와 제보를 부탁드립니다.인스타그램 : https://www.instagram.com/yooxicman/비즈니스 메일 : cloudpark09@gmail.com[육식맨 영상의 4대 목표]◇ 참 보기 좋고 먹어 보고 싶은 육식◇ 군더더기, 시간 낭비 없이 깔끔한 영상 편집◇ 흥미로우면서 진실한 리액션◇ 꽤 도움이 되며 부담스럽지 않은 요리 정보[수비드란?]https://cafe.naver.com/svcook/130[수비드 머신]현재 메인으로 쓰고 있는 유튜버 승우아빠님이 선물해주신 고급형 기종 https://bit.ly/3nHDX1g제 생각에 수비드는 아직 보급이 덜 돼서 가격만큼 성능이 아닌 거 같습니다. 시작은 저렴한 거로 쓰다가 아쉬움을 느끼시면 업그레이드하시길 추천해 드릴게요.가정용 가성비 기종 https://bit.ly/3icLCSB업소용 대형 기종 https://bit.ly/36O2kEb수조 대신 곰솥 냄비, 철제 양동이 쓰셔도 됩니다.[수비드 온도와 시간은 어떻게 정하나요?]수비드 시간표 검색하면 진짜 많이 나옵니다.https://bit.ly/2WPapU7거기에 해외 유튜브 영상들 검색한 뒤 참고해서 정하고 있습니다.[수비드 음식 보관]수비드는 조리가 된 음식이기 때문에 며칠 먹을 수 있냐는 질문은 그냥 프라이팬 구워 먹다가 남은 거를 냉장고에 며칠 둘 거냐는 질문하고 같은 격입니다. 저는 고기 남으면 냉장고 3, 4일은 두었다가 데워먹는 경우가 종종 있는데 수비드도 같습니다.다만! 수비드라는 조리방식 자체가 레스토랑에서 육류 식자재를 효율적으로 관리하고 균일한 음식을 빠르고 간편하게 내기 위해 '보관 용이'를 핵심 가치로 개발된 측면이 있거든요.대량 수비드 (큰 덩어리 고기) → 1인분으로 잘라서 소분 진공 포장 → 냉동 보관 → 그날 팔릴 개수 예측해서 '수비드 해동(재가열)' → 남으면 다시 냉동이렇게 수비드는 진공 냉장/냉동 보관 후 수비드 재가열하는 것이 상당히 자유로운 조리법이에요. 한 달 치 고기를 한 번에 조리하는 것도 가능하겠죠. 레스토랑에서 한 달 전 얼린 고기를 낸다고 생각하면 별로이긴 하지만, 수비드는 그래도 되는 조리법이긴 합니다.먹다가 남은 것을 재포장하는 경우는 재가열 해당이 아닙니다. 공기 노출도 많았고 침 같은 것도 묻었을 테니까 그냥 냉장고에 두고 3, 4일 안에 드시면 됩니다. 전자레인지 데우면 여전히 부드럽고 맛있습니다.수비드 재가열 전문적인 블로그 : https://bit.ly/2tp4fgR[수비드를 밥솥으로 할 수 있나요?]밥솥 기종에 따라서, 온도에 따라서 성공 사례가 있는 건 알고 있지만수비드 기계와 같은 물의 순환 기능이 없고 섬세한 온도 조절도 불가능 하므로 원칙적으로는 되지 않습니다.특히 집마다 밥솥이 브랜드, 연식, 기능이 너무 달라서 수만 명이 시청하실 영상을 제작하는 것은 불가능합니다.[수비드 전기세]2~3시간 짧은 수비드는 전기세 체감하기 어렵고12~24시간 장시간 수비드는 1회 500~1,000원은 나오는 거 같습니다.[진공포장기]https://bit.ly/2CGcQRi백만 원 넘는 순간 진공포장기(챔버형)를 사용하지 않는 이상, 20만 원짜리 푸드세이버나 3만 원짜리 중소기업 제품이나 진공포장의 품질은 비슷하다고 생각합니다.수비드를 자주 해도 의외로 진공포장보다는 지퍼락을 많이 사용합니다.[각종 제품 링크]구리 팬 : https://bit.ly/3886R1o (10인치 모델)스테인리스 팬 : https://bit.ly/386rtqW무쇠 팬 : https://bit.ly/2waryN3오븐 : LG 광파오븐 32L 모델인덕션 : https://bit.ly/2XLzQ89부처 나이프 : https://bit.ly/2AUjlzg셰프 나이프 세트 : https://bit.ly/38QkvrJ (비매품이라 정보만 링크)엔드그레인 도마 : https://bit.ly/3b4vfq0 (블랙우드 L사이즈)대형 대나무 도마 : https://bit.ly/2Pw2ffk가위 집게 : https://bit.ly/2XmfKlT앞치마 : https://bit.ly/2zDSXZT[오븐 고르기]혹시 주방이나 설비가 허락되시는 분은 가능한 컨벡션 오븐, 가스 오븐, 대형 기종을 사세요. 오븐 요리는 배우면 배울수록 재미를 붙이면 붙일수록 큰 요리를 하게 됩니다.[오븐 요리를 에어프라이어로 할 수 있나요?]- 기종마다 크기와 디자인이 제각각이고- 열 파이프와 음식의 거리가 가까워서- 오븐과 달리 강한 열풍이 돌기 때문에오븐 레시피와 같을 수 없습니다. 하지만 심부 온도계가 있다면 원리상으로는 충분히 가능합니다.[오븐 트레이, 망]https://bit.ly/30Q5eEN오븐 트레이는 이케아가 답입니다. 최고의 가성비와 사이즈 구성. 인터넷 배송도 됩니다. 트레이가 작아서 아쉬울 때는 있어도 트레이가 커서 슬픈 적은 없습니다. 무조건 오븐에 들어가는 최대 크기로 사세요.음식을 트레이에서 띄워놓는 그릴은 '밧드망', '식힘망'을 검색하면 나옵니다. 고열을 견뎌야하니 반드시 스테인리스 100%인지 확인하고 구입하세요.지금까지 쓰면서 가장 만족한 랙 https://bit.ly/2M1Koha[일반 코팅팬이 아닌 고급팬을 쓰는 이유]열전도, 열보관이 좋아서 음식 맛의 원천이 되는 시어링, 마이야르반응, 캐러멜라이제이션이 빠르고 효과적으로 됩니다.[구리팬, 스테인리스팬 설거지]베이킹 소다니 과탄산수소니 정말 많이 시도해봤는데, 결국 굴복하고 전용세제 '아스토니쉬 찌든때 클리너 프로실버'를 사용하고 있습니다. 구리의 핑크색은 '와이만 쿠퍼 크림' 사용합니다.[온도계]블루투스 무선 온도계 https://amzn.to/2DhbwRM와이어형 온도계 : https://bit.ly/38QkvrJ (비매품이라 정보만 링크)저는 시청자분들의 이목을 끌고자 위 제품을 구입했지만 온도 측정이라는 단순 용도에 비해 엄청 비쌉니다. 아래 제품들을 추천드립니다.https://bit.ly/39w2RZAhttp://t.ly/MMEk[시어잘(SEARZALL)]시어잘은 엄밀히 말하면 그릇 모양 화구만을 말합니다.시어잘, 용접용 토치, 미국 규격 프로판 가스 3가지가 전부 있어야 합니다.시어잘 공식수입처 http://t.ly/c23b프로판 가스를 구하기 어려울 경우 대안 https://cafe.naver.com/svcook/14073[영상 찍고 남은 고기 어떻게 하나요?]잔반 처리하듯 며칠에 걸쳐서 전자레인지 돌려 먹습니다.저는 고기는 일단 푸짐해보여야 보여야한다고 생각해서 4인분 이상 만듭니다.[촬영]메인 카메라 + 렌즈 : Sony α7S III (A7S3) + Sony FE 20mm F1.8 G서브 카메라 + 렌즈 : Sony α7C (A7C) + Sony FE 28-60mm F4-5.6캠코더(가끔 씁니다) : Sony FDR-AX40마이크(나레이션) : JTUM-200레코더(조리,시식) : Sony ICD-TX650편집 : 프리미어프로[BGM]유튜브 저작권 해결되는 구독형 유료 음원 사이트 Artlisthttps://artlist.io/Yooxicman-1309311이 URL을 통해 구독하시면 2개월 추가 혜택을 받으실 수 있고, 저도 2개월 구독 연장 혜택을 받습니다."
