video_id,title,publishedAt,channelId,channelTitle,categoryId,trending_date,tags,view_count,likes,dislikes,comment_count,thumbnail_link,comments_disabled,ratings_disabled,description
"VYEtNWp5VgA","20 WOMEN VS 1 SIDEMEN: HARRY EDITION","2021-02-28T18:23:08Z","UCDogdKl7t7NHzQ95aEwkdMw","Sidemen","24","21.01.03","sidemen|sidemen sunday|#sidemensunday","6465311","635659","1748","52204","https://i.ytimg.com/vi/VYEtNWp5VgA/default.jpg","False","False","👉🏻 Subscribe to our 2nd Channel: https://www.youtube.com/MoreSidemen 👈🏻👕: Sidemen Clothing: http://www.sidemenclothing.com📸: Sidemen Instagram: http://www.instagram.com/Sidemen🐤: Sidemen Twitter: http://www.twitter.com/Sidemen✏️: SUBMIT A #SidemenSunday IDEA HEREhttps://forms.gle/JDuGrSzM4F6mdo6D9-----------------------------------------------------------------------------------------------------------------------▶️ SIDEMEN ◀️🔴 SIMON (Miniminter)● http://www.youtube.com/Miniminter● http://www.youtube.com/MM7Games● http://www.instagram.com/Miniminter● http://www.twitter.com/Miniminter🔵 JOSH (Zerkaa)● http://www.youtube.com/Zerkaa● http://www.youtube.com/ZerkaaPlays● http://www.instagram.com/Zerkaa● http://www.twitter.com/ZerkaaHD🔴 ETHAN (Behzinga)● http://www.youtube.com/Behzinga● http://www.youtube.com/Beh2inga● http://www.instagram.com/Behzingagram● http://www.twitter.com/Behzinga🔵 VIK (Vikkstar123)● http://www.youtube.com/Vikkstar123● http://www.youtube.com/Vikkstar123HD● http://www.youtube.com/VikkstarPlays● http://www.instagram.com/Vikkstagram● http://www.twitter.com/Vikkstar123🔴 TOBI (Tobjizzle)● http://www.youtube.com/TBJZL● http://www.youtube.com/Editingaming● http://www.instagram.com/Tobjizzle● http://www.twitter.com/Tobjizzle🔵 JJ (KSI)● http://www.youtube.com/KSI● http://www.youtube.com/KSIOlajidebtHD● http://www.instagram.com/KSI● http://www.twitter.com/KSIOlajidebt🔴 HARRY (W2S)● http://www.youtube.com/W2S● http://www.youtube.com/W2SPlays● http://www.instagram.com/Wroetoshaw● http://www.twitter.com/Wroetoshaw"
"MhbRw04ZBx8","Oprah With Meghan And Harry First Look | It Has Been Unbelievably Tough","2021-03-01T00:06:36Z","UClzCn8DxRSCuMFv_WfzkcrQ","CBS","24","21.01.03","Oprah|Prince Harry","938329","2758","815","1048","https://i.ytimg.com/vi/MhbRw04ZBx8/default.jpg","False","False","In a preview of Oprah with Meghan And Harry: A Primetime Special, Prince Harry says at least we had each other. Watch Oprah with Meghan And Harry: A Primetime Special on Sunday, Mar. 7 at 8/7c on CBS."
"y7LJrh5UTr4","Oprah With Meghan And Harry First Look | Almost Unsurvivable","2021-03-01T00:06:31Z","UClzCn8DxRSCuMFv_WfzkcrQ","CBS","24","21.01.03","Oprah|Prince Harry","1077538","3933","1000","1830","https://i.ytimg.com/vi/y7LJrh5UTr4/default.jpg","False","False","Get a first glimpse at Oprah Winfrey's interview with The Duke and Duchess of Sussex, Meghan and Harry, where there is no subject that is off limits. Watch Oprah with Meghan And Harry: A Primetime Special on Sunday, Mar. 7 at 8/7c on CBS."
"csMNkRrcRW8","Skengdo x AM x Lil Rass x BM x Mini x Rack5 x TY x Mskum - Plugged In W/Fumez The Engineer","2021-02-28T19:00:14Z","UCwxK6Ba2IzJXw8gW2ZPjHSw","Pressplay Media","10","21.01.03","pressplay|media|music|video|uk rap|uk drill|kwengafce|m24|block6|plugged in|lightwork freestyle|ofb|double lz|bandokay|67|smoke boys|grm|linkuptv|mixtape madness","252112","28010","85","2523","https://i.ytimg.com/vi/csMNkRrcRW8/default.jpg","False","False","Out on all streaming platforms and 01/03 be first to stream Powered By Amuse Beat Composer - JesterProduction Manager - MichieTaylorssSponsored by Hoodrich - https://hoodrichuk.com/The First Drill Album | Out Now!!https://empire.ffm.to/firstdrillSUBSCRIBE NOW: https://goo.gl/OtAv6EFACEBOOK: http://goo.gl/a3Re7mTWITTER: http://goo.gl/E82rVPINSTAGRAM: https://www.instagram.com/itspressplayuk/EMAIL US FOR ALL ENQUIRES: pressplaymedia@hotmail.comDISCLAIMER: The views and opinions expressed in these videos are for Entertainment & Educational purposes only, and do not represent the views of any artist(s) or Pressplay Media."
"OozWcmne_eM","PE With Joe 2021 | Monday 1st March (NO SOUND)","2021-03-01T09:25:52Z","UCAxW1XT0iEJo0TYlRfn6rYQ","The Body Coach TV","17","21.01.03","the body coach|Joe wicks|joe wix|the bodycoach|lean in 15|hiit|home workout|fitness channel|personal trainer|health|wellness|wellbeing|yoga|kettlebell|exercise|celebrity|kayla itsines|emily skye|the body coach tv|pe with joe","156726","2941","249","309","https://i.ytimg.com/vi/OozWcmne_eM/default.jpg","False","False","We had some technical issues this morning and unfortunately we've got no sound on this workout 😰"
"cOzOXMfG3GQ","Amy Poehler and Tina Fey's Opening Monologue - 2021 Golden Globes","2021-03-01T03:06:03Z","UCccjdJEay2hpb5scz61zY6Q","NBC","24","21.01.03","NBC|NBC network|tv|tv shows|entertainment|episode|full episode|trailer|golden globes|red nose day|comedy|free tv|watch tv|watch episodes|andy samberg|sandra oh|Entertainment|TV Series|Celebrities|tv 2021|nbc|watch golden globes|2021 golden globes 2021|golden globe awards|golden globes speech|tina fey golden globes|amy poehler|best golden globes speech|opening monologue|2021","250553","4655","627","714","https://i.ytimg.com/vi/cOzOXMfG3GQ/default.jpg","False","False","Watch Amy Poehler and Tina Fey's hilarious opening monologue as they host the 78th annual Golden Globe Awards.» Subscribe for More: http://bit.ly/NBCSub» Stream on Peacock: https://bit.ly/StreamPeacockNBC ON SOCIAL:YouTube: http://www.youtube.com/nbcTwitter: http://Twitter.com/NBCFacebook: http://Facebook.com/NBCInstagram: http://instagram.com/nbcFind NBC trailers, full episode highlights, previews, promos, clips, and digital exclusives here.ABOUT THE 2021 GOLDEN GLOBE AWARDS:The 78th Golden Globes will take place on February 28, coast to coast from 4 pm to 8 pm PT/7-11 ET on NBC. The event will be hosted by Tina Fey and Amy Poehler, returning for the fourth time, after hosting in 2013, 2014, and 2015. Fey and Poehler will share duties from their respective cities, with Fey on the East Coast and Poehler on the West Coast. Fey will be live from New York’s Rainbow Room, Poehler will be live from the Beverly Hilton, in Beverly Hills, and nominees, from various locations around the world.Amy Poehler and Tina Fey's Opening Monologue - 2021 Golden Globeshttps://youtu.be/cOzOXMfG3GQNBC on YouTubehttp://www.youtube.com/user/nbc"
"QKpWvPEZ5bo","The Main Character of Dream SMP","2021-02-28T20:49:09Z","UCFAiFyGs6oDiF1Nf-rRJpZA","Technoblade","20","21.01.03","Minecraft|Technoblade|Technothepig|Hypixel","2283073","375893","861","27136","https://i.ytimg.com/vi/QKpWvPEZ5bo/default.jpg","False","False","technoblade tries to cope with the realization that he is a side character--------------------------------Ranboo: https://www.youtube.com/channel/UCKQ-wNdh0kO5qnpPfXa2hjQPh1lza: https://www.youtube.com/user/Ph1LzAedited by https://twitter.com/Wardenboobecome a CHANNEL MEMBER here: https://www.youtube.com/channel/UCFAiFyGs6oDiF1Nf-rRJpZA/joinother YT channel (go subscribe): https://www.youtube.com/channel/UCV--8wtuyGo3vMtIdeq4j3wfollow me on twitter too: https://twitter.com/Technothepigmusic:The Happiest Days by J.F. Glosshttps://www.epidemicsound.com/referral/m3rfi7/"
"daOQ-RlOeKM","Meghan Markle & Prince Harry's Explosive Oprah Interview Sneak Peek","2021-03-01T04:44:38Z","UCiKGMZZmZXK-RpbKJGXgH3Q","Access","24","21.01.03","Access|celebrities|entertainment|oprah winfrey|meghan markle|prince harry|royals|royal family|meghan markle prince harry oprah|duchess of sussex","134924","1832","401","1228","https://i.ytimg.com/vi/daOQ-RlOeKM/default.jpg","False","False","Meghan Markle and Prince Harry are ready to tell all! The couple sat down with Oprah for their first joint interview since getting engaged in 2017 – and apparently nothing was off-limits! The in-depth conversation will unfold in a two-hour primetime special on CBS Sunday, March 7, and in an explosive first look, even Oprah herself was surprised at how candid Meghan and Harry were willing to get.» SUBSCRIBE: http://bit.ly/AHSub» Visit Our Website: http://www.AccessOnline.com/Get More Access:Facebook: https://www.facebook.com/accessonlineTwitter: https://twitter.com/accessonline Instagram: http://instagram.com/accessonlineSnapchat: OfficialAccess About Access:Access is a nationally syndicated daily entertainment news show. Access delivers the most comprehensive coverage of entertainment news and personalities on television, featuring in-depth celebrity interviews and behind-the-scenes accounts of the most important events in Hollywood.Oprah Asks Meghan Markle If She Was 'Silenced' In Explosive Tell-All Interview Sneak Peek https://www.youtube.com/accessonline#AccessHollywood#MeghanMarkle#PrinceHarry#Oprah"
"rOG-djHcfko","Zerkaa Reveals Wroetoshaw's X-RATED Sidemen Sunday Idea...","2021-02-28T18:53:03Z","UCrboPj-9ZOZvr3IVyyhXz6Q","Happy Hour Podcast","23","21.01.03","happy hour podcast|happy hour|sidemen sundays|zerkaa thursdays|sidemen harry|wroetoshaw|zerkaa podcast|sidemen sundays harry|best of sidemen sundays|20 WOMEN VS 1 SIDEMEN: HARRY EDITION|Harry 20 Women|Wroetoshaw 20 women|Harry 20 vs 1|happy hour wroetoshaw|harry sidemen sunday","250041","15159","51","174","https://i.ytimg.com/vi/rOG-djHcfko/default.jpg","False","False","Zerkaa reveals the elaborate process behind how the boys come up with Sidemen Sunday videos ideas, and Harry's naughty suggestion... ____________________________________________________________________🎧 Full episode available to listen & download now:https://tinyurl.com/fst5svw7____________________________________________________________________🐦 TWITTER: https://twitter.com/JaacksHappyHour📸 INSTAGRAM: http://www.instagram.com/jaackshappyhour🎬 JAACKMAATE'S CHANNEL: https://www.youtube.com/jaackmaate"
"CboacVTPZV8","Full fight: Tommy Fury v Scott Williams","2021-02-28T10:44:35Z","UC-hWvVvE-crFl5vg5G8QbqA","BT Sport Boxing","17","21.01.03","Tommy Fury|Fury|Fury v Williams|#FuryWilliams|Fight highlights|TNT Fury|Love Island|Molly Mae Hague|John Fury|Tyson Fury|BT Sport|BT Sport Boxing|Knockout|Knockouts|Tommy Fury knockouts|Tommy Fury KO|Tommy Fury win","223963","2713","567","847","https://i.ytimg.com/vi/CboacVTPZV8/default.jpg","False","False","Tommy Fury secured his fifth professional career win with victory over Scott Williams at the Copper Box Arena. He closed the show with a big right hand in the second round.Subscribe to BT Sport Boxing on YouTube ➡️ http://www.youtube.com/c/btsportboxingFollow BT Sport Boxing on Twitter ➡️ http://twitter.com/btsportboxingJoin our BT Sport Boxing Facebook Group ➡️ https://www.facebook.com/groups/BTSportBoxing/Follow us on Instagram ➡️ http://instagram.com/btsportboxingRead more on upcoming fights on BT Sport and BT Sport Box Office ➡️ http://www.bt.com/sportboxoffice"
"Fbr55An8VPI","HIGHLIGHTS | Canelo Alvarez vs. Avni Yildirim","2021-02-28T04:39:19Z","UCurvRE5fGcdUgCYWgh-BDsg","DAZN Boxing","17","21.01.03","dazn|boxing|highlights|full fight|ko|knockout|ryan garcia|top 10|canelo|anthony joshua|ggg|haney|fight night|avni yildirim|yildirim|turkiye|turkey|mexico","3088872","40719","4125","7631","https://i.ytimg.com/vi/Fbr55An8VPI/default.jpg","False","False","February 27th, 2021 -- Canelo Alvarez vs. Avni Yildirim from the Hard Rock Stadium in Miami, Florida.Subscribe to our YouTube channel 👉  http://bit.ly/DAZNBoxingYouTubeDownload the DAZN app now 👉  http://bit.ly/DAZNYoutubeFollow DAZN Boxing On Social Media 👇Twitter: https://www.twitter.com/DAZNBoxingInstagram: https://www.instagram.com/DAZNBoxingFacebook: https://www.facebook.com/DAZN"
"L5QEB-GdqBY","Zerkaa's HONEST First Opinion Of KSI","2021-02-28T12:30:02Z","UCrboPj-9ZOZvr3IVyyhXz6Q","Happy Hour Podcast","23","21.01.03","happy hour podcast|jaackmaate|jackmate|jaackmate|jackmaate|happyhourpodcast|happy hour|happy hour zerkaa|zerkaa podcast|sidemen podcast|first sidemen video|sidemen alton towers|zerkaa thursdays|happy hour zerka|happy hour zerker","197602","10837","38","383","https://i.ytimg.com/vi/L5QEB-GdqBY/default.jpg","False","False","Zerkaa discusses the moment he first met KSI on a YouTuber trip to Alton Towers back in 2013, and his honest opinion on wild young JJ!!____________________________________________________________________🎧 Full episode available to listen & download now:https://tinyurl.com/fst5svw7____________________________________________________________________🐦 TWITTER: https://twitter.com/JaacksHappyHour📸 INSTAGRAM: http://www.instagram.com/jaackshappyhour🎬 JAACKMAATE'S CHANNEL: https://www.youtube.com/jaackmaate"
"28RxpkcVAFw","Customizing Nintendo Switch In 10 Hours, 1 Hour, 10 Minutes, 1 Minute & 10 Seconds!","2021-02-28T20:59:51Z","UClQubH2NeMmGLTLgNdLBwXg","ZHC","24","21.01.03","nintendo switch|nintendo|zhc|gaming|minecraft","1702331","110513","1274","14857","https://i.ytimg.com/vi/28RxpkcVAFw/default.jpg","False","False","I can't believe we customized nintendo switches in 10 hours, 1 hour, 10 minutes, 1 minute, and 10 secondsHope you enjoyed! Thanks for watching :)Subscribe and you might be picked to be in my next video! It's free and it would genuinely make me super happy if you subscribed! 🥺Follow my socials too!Instagram - https://www.instagram.com/zhcTwitter - https://twitter.com/zhc_ytFacebook - https://www.facebook.com/ZHC/Subscribe to all our channels!ZHC Crafts:  @ZHC Crafts   ZHC Shorts:  @ZHC Shorts  MsMunchie:  @MsMunchie   If you scrolled till the end... here's a fist bump for you 👊"
"EcmaD6NCFYc","Virtual Golden Globes 2021 recap: Wins, bloopers & shocks","2021-03-01T05:13:29Z","UCtWWry0cgjWi9C0Ye9sh6og","news.com.au","25","21.01.03","golden globes|globe|awards|ceremony|fashion|margot robbie|celebrities|hollywood|aussie|actress|actor|looks|best|worst|bloopers|shocks|wins|losses|summary|recap","67126","511","71","70","https://i.ytimg.com/vi/EcmaD6NCFYc/default.jpg","False","False","The first major virtual event of awards season was a digital fiasco at times, here are the shocks, wins and stuff-ups of the 2021 Golden Globe awards.GET ALL THE LATEST NEWS AND LIFESTYLE VIDEOS: https://www.news.com.au/"
"1ms3ihZ2xPs","Beres Hammond - Love From A Distance","2021-03-01T03:45:54Z","UCZng8TYQxSMYuRS7CZd-nvg","VP Records","10","21.01.03","[none]","525707","25904","190","677","https://i.ytimg.com/vi/1ms3ihZ2xPs/default.jpg","False","False","Beres Hammond - Love From A DistanceENTER CONTEST // http://bit.ly/2Pc9WcWGet Beres Hammond merch and music today // http://bit.ly/3bMw3yf"
"xLfwyH-Q9rc","Bale stars as Spurs put FOUR past Burnley! | Tottenham 4-0 Burnley | Premier League Highlights","2021-02-28T16:05:51Z","UCNAf1k0yIjyGu3k9BwAg3lg","Sky Sports Football","17","21.01.03","sky sports|premier league|Football League|football|Sky Sports live|Sky|Sports|stream|sky sports football|premier league highlights|epl highlights 1920|Tottenham vs Burnley|Tottenham vs Burnley highlights|Bale goal|Kane goal|Lucas Moura goal|Bale Spurs highlights|Bale brace|Bale highlights vs Burnley|Gareth Bale vs Burnley|Spurs 4-0 Burnley|4-0|Spurs 4-0 Burnley highlights","897876","15657","276","1453","https://i.ytimg.com/vi/xLfwyH-Q9rc/default.jpg","False","False","SUBSCRIBE ► http://bit.ly/SSFootballSubPREMIER LEAGUE HIGHLIGHTS ► http://bit.ly/SkySportsPLHighlights2021Highlights from Premier League as Tottenham swept Burnley aside with a dominant performance spearheaded by a Gareth Bale brace. Watch Premier League LIVE on Sky Sports here ► http://bit.ly/WatchSkyPL►TWITTER: https://twitter.com/skysportsfootball►FACEBOOK: http://www.facebook.com/skysports►WEBSITE: http://www.skysports.com/footballMORE FROM SKY SPORTS ON YOUTUBE:►SKY SPORTS FOOTBALL: http://bit.ly/SSFootballSub►SKY SPORTS BOXING: http://bit.ly/SSBoxingSub►SKY SPORTS CRICKET: http://bit.ly/SubscribeSkyCricket►SOCCER AM: http://bit.ly/SoccerAMSub►SKY SPORTS F1: http://bit.ly/SubscribeSkyF1►SKY SPORTS: http://bit.ly/SkySportsSub►SKY SPORTS GOLF: https://bit.ly/SubscribeSkySportsGolf"
"qrH9vMZBwAk","Character Demo - Hu Tao: Let the Living Beware | Genshin Impact","2021-03-01T04:42:22Z","UCiS882YPwZt1NfaM0gR0D9Q","Genshin Impact","20","21.01.03","Amber|amber vtuber|genshi|genshi game|genshi impact|genshi video|genshin|genshin game|genshin impact|genshin impact 2020|genshin impact game|genshin impact good|genshin impact graphics|genshin impact introduction|genshin impact manga|genshin impact wiki|geshin|geshin game|Teyvat|yuanshen game|miHoYo China|miHoYo Japan|adventure story|open world game|anime style|MMORPG|anime games|mobile game|MMO PlayStation|yt:cc=on","1068060","152985","462","13316","https://i.ytimg.com/vi/qrH9vMZBwAk/default.jpg","False","False","When the Wangsheng Funeral Parlor is performing important rites, we appreciate it if people keep a respectful distance away from the proceedings....But if you insist on gatecrashing a funeral... Well, I'm sure we can squeeze you in somewhere...Download FREE: https://genshin.mihoyo.com/en#GenshinImpact #miHoYo↓ Follow us for the latest news ↓Official Website: https://genshin.mihoyo.com/enOfficial Community: https://www.hoyolab.com/genshin/Facebook: https://www.facebook.com/GenshinImpact/Twitter: https://twitter.com/GenshinImpactInstagram: https://www.instagram.com/genshinimpact/Reddit: https://www.reddit.com/r/Genshin_Impact/"
"p10rOHC72zg","Pepe rounds off BRILLIANT Arsenal comeback! | Leicester 1-3 Arsenal | Premier League Highlights","2021-02-28T14:15:49Z","UCNAf1k0yIjyGu3k9BwAg3lg","Sky Sports Football","17","21.01.03","sky sports|premier league|Football League|football|Sky Sports live|Sky|Sports|stream|sky sports football|premier league highlights|epl highlights 1920|Leicester City vs Arsenal|Leicester City vs Arsenal highlights|Leicester vs Arsenal highlights|Harvey Barnes|Jamie Vardy|Pierre-emerick Aubameyang|tielemans goal|David Luis goal|Lacazette goal|Pepe goal|Leicester 1-3 Arsenal|Arsenal 3-1 Leicester highlights","651567","10893","182","1338","https://i.ytimg.com/vi/p10rOHC72zg/default.jpg","False","False","SUBSCRIBE ► http://bit.ly/SSFootballSubPREMIER LEAGUE HIGHLIGHTS ► http://bit.ly/SkySportsPLHighlights2021Highlights from Premier League as Arsenal produced a brilliant comeback to beat Leicester City 3-1 away from home. Watch Premier League LIVE on Sky Sports here ► http://bit.ly/WatchSkyPL►TWITTER: https://twitter.com/skysportsfootball►FACEBOOK: http://www.facebook.com/skysports►WEBSITE: http://www.skysports.com/footballMORE FROM SKY SPORTS ON YOUTUBE:►SKY SPORTS FOOTBALL: http://bit.ly/SSFootballSub►SKY SPORTS BOXING: http://bit.ly/SSBoxingSub►SKY SPORTS CRICKET: http://bit.ly/SubscribeSkyCricket►SOCCER AM: http://bit.ly/SoccerAMSub►SKY SPORTS F1: http://bit.ly/SubscribeSkyF1►SKY SPORTS: http://bit.ly/SkySportsSub►SKY SPORTS GOLF: https://bit.ly/SubscribeSkySportsGolf"
"mdrtC8d1MxU","GOLDBRIDGE! Chelsea 0-0 Manchester United Match Reaction","2021-02-28T19:26:40Z","UCMmVPVb0BwSIOWVeDwlPocQ","The United Stand","24","21.01.03","Manchester United|Man United|Man Utd|Manchester United TV|The United Stand|United Stand|Manchester United News|MUFC|Man Utd News|United|Manchester United Transfer News|Man Utd Transfer News|Transfer|Solskjaer|Solskjaer news|MU live streaming|mu live|Man Utd live stream|live|vs Manchester United|Mark Goldbridge|Goldbridge|Real Sociedad|Europa League|Manchester United Real Sociedad|Man Utd vs Real Sociedad|Manchester United vs Real Sociedad","222996","8392","451","1084","https://i.ytimg.com/vi/mdrtC8d1MxU/default.jpg","False","False","Chelsea 0-0 Manchester United Mark Goldbridge reacts to a big result for Solskjaer's United. Get the latest Man Utd News on The United Stand. Player Ratings Vote Here https://www.theunitedstand.com/articles/match-ratings/fan-player-ratings-chelsea-vs-manchester-unitedLIVE FAN REACTION SHOW: https://www.youtube.com/watch?v=lN9KReM-IIU&feature=youtu.be&ab_channel=TheUnitedStand🚨VISIT OUR WEBSITE 🚨For all the latest United news and TUS content:https://www.theunitedstand.com⏲️The United Stand Content TIMELINE is the best way to find all our latest content quickly! https://www.theunitedstand.com/timeline📰 LATEST WRITTEN NEWS https://www.theunitedstand.com/articles/latest-news📸 FOLLOW OUR INSTAGRAMhttps://www.instagram.com/theunitedstandtv/✅ The United Stand MEMBERSHIP https://buff.ly/2I2Of9R📧Contact The United Stand = soccerboxtv@gmail.com📧WRITER SUBMISSIONS = unitedstandwebsite@gmail.comAddressing: Jamie or NoraSee the FULL United Stand Kit Range CLICK HERE https://buff.ly/2Krpw1zEXCLUSIVE NEW PODCAST ITUNES https://buff.ly/2ZUhv84Spotify https://buff.ly/34dwEo6Google Podcast https://buff.ly/2ZHlNDnCastBox https://buff.ly/2UuiU3RRadio Public https://buff.ly/34jWkzAThe United Stand is Manchester United's biggest independent fan channel. Made for Manchester United fans by Manchester United fans, the United Stand provides you with the latest Manchester United transfer news, highlights, goal reviews and much more. So if MUFC means the world to you, get involved and subscribe to The United Stand http://bit.ly/1CmczHm#Goldbridge #ManchesterUnited #MUFC"
"p0GUZVU_TTU","Welcome To Our New House","2021-02-27T19:35:40Z","UC-SV8-bUJfXjrRMnp7F8Wzw","Roman Atwood Vlogs","22","21.01.03","Roman|Atwood|The Atwoods|Brittney|Family|Family Friendly|Smile|Smile More|Kids|Noah|Kane|Cora|Vlog|Upload|New|Inspire|Motivational","3229783","272189","3091","35027","https://i.ytimg.com/vi/p0GUZVU_TTU/default.jpg","False","False","Subscribe: http://bit.ly/SubToRomanWelcome to chapter 3! Thank you so much for being here.Follow Roman Atwood:Twitter: https://twitter.com/romanatwoodInstagram: https://instagram.com/romanatwoodFacebook: https://facebook.com/RomanAtwoodFollow Brittney:Twitter: https://twitter.com/_Little_Britt_Instagram: https://instagram.com/BrittneyAtwoodSmile More Store: http://RomanAtwood.comWatch More Roman Atwood:Daily Vlogs: https://youtube.com/playlist?list=PLItZ1aGL8ScA4RNpVQVekAv2AaNUMQWfiPopular Videos: https://youtube.com/playlist?list=PLItZ1aGL8ScDPCi1yw-ZH_51vGZazpv7wTrips: https://youtube.com/user/RomanAtwoodVlogs/playlists?view=50&sort=dd&shelf_id=11Latest Uploads: https://youtube.com/playlist?list=PLItZ1aGL8ScArc7A-QTq8BpArqliaRCwDChapter 3 starts now."
"aHIjtMiBb8g","Zack Knight | Jernade Miah - Para Rum Pa (Official Video)","2021-02-28T15:04:45Z","UC8tjqXag737a3B9dHd_nU2w","iamzackknight","10","21.01.03","zack knight|zack knight new song|jernade miah|para rum pa|zack knight para rum pa|zack knight songs|zack knight jernade miah|zack knight mashup|jernade miah bangla|jernade miah ft zack knight|zack knight new song 2021|zack knight new song 2020 mashup|zack knight new song tik tok|zack knight bom diggy|krishno","190126","30560","369","2661","https://i.ytimg.com/vi/aHIjtMiBb8g/default.jpg","False","False","iTunes: https://apple.co/2NQmkyZ Spotify: https://spoti.fi/3r3YKNvSingers: Zack Knight, Jernade Miah, Kayes RashidMusic: Zack KnightDirector: Lutch MediaOriginal Bengali Folk Song by Shah Abdul Karim & Lyrics by Akrum ShahSpecial thanks to HabibSocials:@iamzackknight @JernadeMiah #ZackKnight #JernadeMiahOFFICIAL LYRICSher mamma from the bay of bengal but she a baddie from the east (baddie from the east)she want that para rum payou know she wanna get a piece (know she wanna piece)Caramel skin yeh she BengaliBody so thickLike a new Bugatti Be my new ting u aint gotta worry do you dirtyAlways trustworthy  she be in and outlike a criminal when i call her she say balah ah seeshe say i dont play aroundwhat you take me forKhota bolo tumhi Bala ni she wanna para rum pa Krishno Aila Radhar KunjeFule Paila Bhromorashe wanna para rum pa Krishna Aila Radhar KunjeFule Paila Bhromorapara rum pa Mayur Beshete Shajon RadhikaMayur Beshete Shajon Radhikapara rum pa Girl you got me fallin in love Mone pore bareCoz girl you got me putting all kinda work Amar pranay maray Tumi chara ami bachi na Eshona Hold me when your feeling lonely Coz ima give you loyalty Ami tomake bhalobashiCaramel skin yeh she bengaliBody so thickLike a new Bugatti Be my new ting u aint gotta worry do you dirtyshe wanna para rum pa Krishno Aila Radhar KunjeFule Paila Bhromorashe wanna para rum pa Krishna Aila Radhar KunjeFule Paila Bhromorapara rum pa Mayur Beshete Shajon RadhikaMayur Beshete Shajon Radhikapara rum pa She got that extra Pshe tryna rescue mewhen she pull up in the ends in the SUVshe got these diamonds on her wristBut she came from the bottombaby make a wish like a genie in a bottlei wanna keep the talk to the minimal dance in traditionalif she want that vitamin D i got the minerals if u wanna go with the combothen ima give u extra cheeeeese she wanna para rum pa Krishno Aila Radhar KunjeFule Paila Bhromorashe wanna para rum pa Krishna Aila Radhar KunjeFule Paila Bhromorapara rum pa Mayur Beshete Shajon RadhikaMayur Beshete Shajon Radhikapara rum pa"
"bKj6Iuh9ECE","SAY IT OR SHOT IT!!","2021-02-28T17:00:30Z","UC_2mX7SbHCRswNOA_6cH6RA","Jed Barker","22","21.01.03","[none]","76701","6471","33","228","https://i.ytimg.com/vi/bKj6Iuh9ECE/default.jpg","False","False",""
