video_id,title,publishedAt,channelId,channelTitle,categoryId,trending_date,tags,view_count,likes,dislikes,comment_count,thumbnail_link,comments_disabled,ratings_disabled,description
"MU8Nn5ps6B0","THEY BASICALLY GAVE US AN ENTIRE SIMS PACK FOR FREE","2021-02-25T19:45:23Z","UC_TYFButglZuuDbD-0Q_IzQ","lilsimsie","20","21.01.03","the sims|ts4|ts3|sims 4|sims 3|fixer upper|lilsimsie|kayla sims|kayla|gameplay|challenge|pg|family friendly","692085","54106","359","3739","https://i.ytimg.com/vi/MU8Nn5ps6B0/default.jpg","False","False","The new anniversary update for The Sims 4 has SO MUCH free content!Daily Twitch streams! https://www.twitch.tv/lilsimsieRead more about the update! https://www.ea.com/games/the-sims/the-sims-4/news/the-sims-21st-birthday?utm_campaign=sims4_hd_ww_ic_soco_twt_the-sims-21st-blog-tw&utm_source=twitter&utm_medium=social&cid=67810&ts=1614282004861HeyHarrie (dining set) https://twitter.com/HeyHarriestorylegacysims (toddler clothes) https://twitter.com/storylegacysimspeachyfaerie (highlight and eyebrows) https://twitter.com/thepeachyfaeriepeacemaker_ic (dresser) https://twitter.com/Peacemaker_icLuumia (skin details) https://twitter.com/luumiasimsicemunmun (recipes) https://twitter.com/icemunmungrimcookies (lipstick) https://twitter.com/thegrimcookiesFeralPoodles (cat hat) https://twitter.com/feralpoodlesAHarris00Britney (top and jeans) https://twitter.com/aharris00britmerch link in bio https://teespring.com/stores/lilsimsie-merchFind me elsewhere!★ Twitter: https://twitter.com/lilsimsie★ Instagram: https://www.instagram.com/lilsimsie/★ Twitch Streams: https://www.twitch.tv/lilsimsie★ Stream Reuploads: https://www.youtube.com/c/moresimsie★ Sims Gallery: lilsimsieThis video is family friendly, but The Sims 4 is rated T for Teen and this video is intended for an audience aged 13 and up.Business Inquiries: contact@lilsimsie.com"
"TRjISzJPsuk","I'm Leaving YouTube","2021-02-25T18:04:07Z","UCvK4bOhULCpmLabd2pDMtnA","Yes Theory","24","21.01.03","yestheory|seek discomfort|yes theory strangers|yes theory travel|yes theory subscribers|getting out of your comfort zone","2078083","146379","2987","13285","https://i.ytimg.com/vi/TRjISzJPsuk/default.jpg","False","False","📝 Follow Matt’s Newsletter: http://yestheory.com/newsletter/After five and a half years as a host on this channel, I've decided to step away. 'Thank You' are the only two words I can muster. You, this community, have shown me nothing but endless love and support. The video goes into detail about my decision.I'll be writing a short newsletter twice a month at www.yestheory.com/newsletter. This is the newsletter I wish my 19 year old self had when I first set out to live a fulfilling life. When you sign you'll receive lessons, tips and tricks from ten years of seeking discomfort.I'll also be working on the book which will come out in November of this year...but more on that later.Come follow along on the ride. We're only just getting started :)Also, make sure to wait till the end to watch our EPIC season trailer. Love you all,Matt🎬  Matt’s Best Moments: https://www.youtube.com/watch?v=3yw6EPr6jJM🙏🏼 Thank you for making these videos possible through your support of Seek Discomfort ⚡️ SEEK DISCOMFORT: http://seek-discomfort.com/yes-theoryJOIN OUR COMMUNITY⁺ Yes Theory Plus: https://www.youtube.com/channel/UCTd7KzdwnFE3lm6LCfYDmUQ📸 Instagram -  https://www.instagram.com/yestheory/🐦 Twitter - https://twitter.com/yestheory🎬  Facebook- https://www.facebook.com/yestheory/If you want to join the Yes Fam Facebook group which is 100,000+ of our most engaged and badass community members, you can apply here: https://www.facebook.com/groups/yesfam/🎥 HOW WE MAKE OUR VIDEOS🎵 Where we find our music:1- Epidemic Sound. Amazing royalty free music for YouTube. Free 30 day trial here: http://share.epidemicsound.com/wFFbr​ 2- Musicbed. Amazing label-quality cinematic music. 30-day free trial here:http://share.mscbd.fm/YesTheory​3- Artlist. 2 Months Free High Quality Music: https://artlist.io/artlist-70446/?art​...🎞 Our b-roll and stock footage:2 Months Free Stock Footage Videos: https://artgrid.io/Artgrid-114820?art​...For an amazing b-roll and footage library, checkout: http://storyblocks.com/YesTheory​📈  Our Most Popular YouTube Videos🎬  Traveling to the least visited country in the world: https://youtu.be/ODuEl4oNae0🎬  Becoming Superhuman with Iceman Wim Hof: https://youtu.be/8cvhwquPqJ0🎬  We Helicopter Bungee Jumped with Will Smith: https://youtu.be/KSu6gRp7UBA🎙 The Yes Theory Podcast: https://spoti.fi/3sFdq6vGET IN TOUCH🌍 Our website - https://www.yestheory.com 🌍 Advertise With Us - zack@onedayent.com  Who are we? We believe that life’s greatest moments and deepest connections exist outside of your comfort zone.Ask us a Question:Tweet us @yestheory"
"OcFpzr7-A-k","THE FANBASE WAR (Sidemen Among Us)","2021-02-25T20:30:04Z","UCh5mLn90vUaB1PbRRx_AiaA","MoreSidemen","22","21.01.03","sidemen|moresidemen|miniminter|ksi|zerkaa|behzinga|tbjzl|vikkstar|wroetoshaw","2317080","158340","2209","10206","https://i.ytimg.com/vi/OcFpzr7-A-k/default.jpg","False","False","#SidemenGaming• Sidemen: http://www.youtube.com/Sidemen• Sidemen Clothing: http://www.sidemenclothing.com• Sidemen Twitter: https://twitter.com/Sidemen---------------------------------------------------------------------Sidemen:• Miniminter: http://www.youtube.com/Miniminter• Zerkaa: http://www.youtube.com/Zerkaa• Behzinga: http://www.youtube.com/Behzinga• Vikkstar123: http://www.youtube.com/Vikkstar123• TBJZL: http://www.youtube.com/TBJZL• Wroetoshaw: http://www.youtube.com/Wroetoshaw• KSI: http://www.youtube.com/KSIedited by https://twitter.com/chipfat_"
"CeP3XYwoOcs","ATEEZ(에이티즈) – ‘불놀이야 (I'm The One)’ Performance Preview","2021-02-25T09:00:15Z","UCQdq-lqPEq_yZ_wP_kuVB9Q","KQ ENTERTAINMENT","10","21.01.03","KQ|케이큐|에이티즈|ATEEZ|홍중|성화|윤호|여상|산|민기|우영|종호|KIMHONGJOONG|PARKSEONGHWA|JEONGYUNHO|KANGYEOSANG|CHOISAN|SONGMINGI|JEONGWOOYOUNG|CHOIJONGHO|FEVER|ATEEZ_FEVER|에이티즈 피버|HONGJOONG|SEONGHWA|YUNHO|YEOSANG|SAN|MINGI|WOOYOUNG|JONGHO|김홍중|박성화|정윤호|강여상|최산|송민기|정우영|최종호|KPOP|ATEEZ ZERO FEVER PART 2|ZERO FEVER PART2|에이티즈 제로 피버 파트투|ATEEZ 제로 피버 파트투|에이티즈 영상|ATEEZ 퍼포먼스 프리뷰|에이티즈 퍼포먼스 프리뷰|ATEEZ PERFORMANCE PREVIEW|PERFORMANCE PREVIEW|퍼포먼스 프리뷰|에이티즈 퍼포먼스|에이티즈 춤|에이티즈 불놀이야|불놀이야|ATEEZ 불놀이야","3413962","383712","4718","49579","https://i.ytimg.com/vi/CeP3XYwoOcs/default.jpg","False","False","Release Date: 2021. 3. 1. 6PM (KST)▶ ATEEZ Official Homepage:http://ateez.kqent.com▶ ATEEZ Official V LIVE: http://channels.vlive.tv/C057DB▶ ATEEZ Official Facebook:https://facebook.com/ATEEZofficial▶ ATEEZ Official Twitter:https://twitter.com/ATEEZofficial▶ ATEEZ Official Instagram:https://instagram.com/ATEEZ_official_▶ ATEEZ Official Fancafe:http://cafe.daum.net/ATEEZ▶ KQ Official Homepage: http://kqent.com▶ KQ Official V LIVE: http://channels.vlive.tv/CB8675▶ KQ Official Facebook: https://facebook.com/kqent▶ KQ Official Twitter: https://twitter.com/kqent▶ KQ Official Instagram:https://instagram.com/kqent#ATEEZ #에이티즈 #FEVER_Part_2"
"65pnjHGmgos","CHLOE FERRY: HUGE ANNOUNCEMENT…","2021-02-25T15:21:54Z","UCX0qAbYaVxCvLGhM2jvoynQ","Chloe Ferry","24","21.01.03","[none]","153891","3475","101","161","https://i.ytimg.com/vi/65pnjHGmgos/default.jpg","False","False","I’M BACK GUYS! By popular demand, I’m back on You Tube! Keep an eye out on my channel to watch a day in the life of Chloe Ferry!!💕In today’s episode see me get stuck in to a few of the businesses I have going on at the moment! Make sure you LIKE and SUBSCRIBE! Check out the Leggings I'm wearing: https://slimki.com/products/legging-sheath-blackVisit my shop: https://www.ferryhomely.co.ukWhat do you want to see next? Brand Enquiries - ben@allstarlondon.com SUBSCRIBE FOR MORE CHLOE FERRY CONTENT! (https://www.youtube.com/channel/UCX0qAbYaVxCvLGhM2jvoynQ) FOLLOW MY SOCIALS Chloe's Instagram: @chloegshore1Snapchat: chloe1ferryTik Tok: @gschloe"
"8G-FKgXqowA","Rangers vs Antwerp (5-2) | Morelos & Kent star for Steven Gerrard's side | Europa League Highlights","2021-02-25T20:53:20Z","UC4i_9WvfPRTuRWEaWyfKuFw","BT Sport","17","21.01.03","[none]","604679","8757","155","1469","https://i.ytimg.com/vi/8G-FKgXqowA/default.jpg","False","False","Rangers advance to the last 16 of the Europa League following a dramatic two-legged tie with Antwerp.Hit 'Subscribe' above to ensure you never miss a video from the BT Sport YouTube channel.Get a BT Sport Monthly Pass now! - http://bit.ly/BTSportMonthlyPass Visit and subscribe to our 'BT Sport Boxing' YouTube channel ➡️ http://www.youtube.com/c/btsportboxingTwitter: http://twitter.com/btsportFacebook: http://www.facebook.com/btsportInstagram:http://instagram.com/btsportWebsite: http://sport.bt.com"
"BjCwUk06ZSk","Return to the Sinnoh region in Pokémon Brilliant Diamond and Pokémon Shining Pearl!","2021-02-26T15:19:40Z","UCFctpiB_Hnlk3ejWfHqSm6Q","The Official Pokémon YouTube channel","20","21.01.03","[none]","2220676","60537","10954","18811","https://i.ytimg.com/vi/BjCwUk06ZSk/default.jpg","False","False","Sinnoh. Remakes.Confirmed.Experience the nostalgic story from Pokémon Diamond and Pokémon Pearl in a new adventure. #PokemonBrilliantDiamond and #PokemonShiningPearl arrive on the Nintendo Switch in late 2021! 💎✨Official site: https://diamondpearl.pokemon.com/en-us/Shop: http://www.pokemoncenter.comFacebook: http://www.facebook.com/Pokemon Twitter: http://www.twitter.com/Pokemon Instagram: http://www.instagram.com/pokemon"
"9YQ19x66U6E","CHARLI AND DIXIE ON BEING FAMOUS SISTERS!!","2021-02-24T22:38:01Z","UCJ94IBNmj9bBGHgqV1EXCBw","VIEWS","24","21.01.03","Views|Views podcast|the views|David|dobrik|Jason|Nash|joe's teeny weeny podcast|vlog squad|vloggers|top podcast|video podcast|comedy podcast|CHARLI|charlie|dixie|d'amelio|sister|sisters|best friends|interview|sit down|conversation|tik tok|tik tokkers|dance|dancing|compilation|best of|best moments|hilarious|comedy|jokes|silly|octopus|clip|clips|full interview","3504287","156962","12239","11959","https://i.ytimg.com/vi/9YQ19x66U6E/default.jpg","False","False","Thank you Charlie and Dixie for hanging out!!Get 10 free meals + free shipping on America’s #1 meal kit at https://hellofresh.com/views10Charlie and Dixie Socials: Instagram: @charlidamelio @dixiedamelioTwitter: @charlidamelio  @dixiedamelioTiktok: @charlidamelio  @dixiedamelioYoutube: https://www.youtube.com/channel/UCi3OE-aN09WOcN9d2stCvPghttps://www.youtube.com/channel/UCLOEGprmycLLbyzBj2jozLgDavid's Socials:Instagram: @DavidDobrikTwitter: @DavidDobrikJason's Socials:Instagram: @JasonNashTwitter: @JasonNashCheck out the new merchandise here!!: https://shopdaviddobrik.com​PLEASE GET JOE TO 1,000,000 SUBSRIBERS!! He's so close, GO SUBSCRIBE!! (its me David): https://www.youtube.com/watch?v=zkBEVeRpqdITHANK YOU ELLA DSOUZA YOU ARE THE BEST Thank you for watching :)**We ensure that every individual that walks onto this set has tested negative for COVID-19 prior to arrival**"
"58V_sXSI-bM","Minecraft Gordon Ramsay...","2021-02-27T07:11:49Z","UCZWBGXa6kiaWo9-pE8CX6Dg","Dream Shorts","22","21.01.03","[none]","1846649","186717","1007","9462","https://i.ytimg.com/vi/58V_sXSI-bM/default.jpg","False","False","Minecraft Gordon Ramsay...#shortsSUBSCRIBE! Lots of uploads coming this year!@Dream @BadBoyHalo @GeorgeNotFound @Sapnap If George was Gordon Ramsay this is what he would be like..."
"z6V9K83EZTY","W2S gets Swatted live on stream","2021-02-25T15:36:14Z","UCZiJzk4wTIzaqHI4FXZ_eRQ","W2SClips","22","21.01.03","W2S|wroetoshaw|shorts|sidemen|w2sclips","683385","28851","763","530","https://i.ytimg.com/vi/z6V9K83EZTY/default.jpg","False","False","W2S gets Swatted live on streamMy Instagram: http://instagram.com/wroetoshawMy Twitter: http://twitter.com/wroetoshawMy Twitch: https://www.twitch.tv/w2sSubmit a clip: https://bit.ly/W2SClipsSubmit#Shorts"
"bKD33VoRAfU","Virtual Pub Quiz, Live! Thursday 25th February","2021-02-25T21:38:27Z","UCLcSqjJWHJeDWD_SbdorBRw","Jay's Virtual Pub Quiz","24","21.01.03","[none]","80977","226","24","11","https://i.ytimg.com/vi/bKD33VoRAfU/default.jpg","False","False","Live stream from 7:50 and first question at 8:15 as always! Tonights quiz is sponsored by Big Potato Gameshttp://bit.ly/3rWYRL4Discount code JAY20 for 20% discount on any game from the Colourbrain FamilyOur featured charity for February is:https://www.justgiving.com/fundraising/place2bequizMentioned in the stream tonight:Chocolate: https://tinyurl.com/jayadventTeemill: https://jvpq.teemill.com/PrezzyBox: https://www.prezzybox.com/jayOurs socials,Facebook: https://www.facebook.com/thevirtualpubquiz/ Twitter: https://twitter.com/TheVirtualPubQ1 Instagram: https://www.instagram.com/thevirtualpubquiz/ Patreon: https://www.patreon.com/thevirtualpubquizSupport from:Quiz Jockey: https://quizjockey.com/Quizmaster Biz: https://www.quizmasters.biz/The Bookhttps://www.amazon.co.uk/Jays-Virtual-Pub-Quiz-Book/dp/1913406407/Stay SafeJay"
"WTyyNifsjnc","THIS is COLD WAR WARZONE Season 2...(NEW Map Update!)","2021-02-25T07:35:30Z","UCW1CGYCjfKhNLGp_Os1g_Pg","Swagg","20","21.01.03","swagg|swaggxbl|faze swagg|faze clan|faze|class|new|call of duty|cod|modern warfare warzone|warzone|warzone dlc weapons|dlc weapons|warzone dlc|warzone gameplay|warzone new|warzone season one|cold war warzone season 1|black ops cold war warzone|cold war|cold war season 1|call of duty warzone|Nickmercs|warzone meta|new warzone update|new warzone dlc|Warzone|season 2|warzone season 2|warzone season 2 battle pass|warzone season 2 trailer|season 2 warzone","834985","32730","909","5963","https://i.ytimg.com/vi/WTyyNifsjnc/default.jpg","False","False","2nd Channel: https://www.youtube.com/channel/UCKY-_9D0z_vzSLqkzAsaVzw My Streams! Twitch:  https://www.twitch.tv/swaggMy Discord: https://discord.gg/6aDGDeCMy Team: https://www.youtube.com/user/FaZeClan                                     THIS is COLD WAR WARZONE Season 2...(NEW Map Update!)How I Capture Gameplay! https://e.lga.to/SwaggSony A6400: https://www.amazon.com/Sony-Alpha-a6400-Mirrorless-Camera/dp/B08777GYP7/ref=sr_1_7?dchild=1&keywords=sony+a6400&qid=1589564416&sr=8-7Lens: https://amzn.to/2lq5rNaAC Adapter: https://amzn.to/2jTYrYtElgato Cam Link 4k: https://amzn.to/2lq61KQMicro HDMI to HDMI: https://amzn.to/2lPi1pqSponsors! (Down Below)(SCUF)   Swagg Scuf: http://scuf.co/swagg                  (ASTROs) Click Here for discount! - https://astro.family/Swagg___________________________________▼ STAY CONNECTED! ▼Tik tok: tiktok.com/@swagg_ytFacebook: https://www.facebook.com/SwaggXBLTwitter: https://twitter.com/SwaggInstagram: https://www.instagram.com/swagg_/Twitch:  https://www.twitch.tv/swaggSnapchat: @ SWAGGXBL2nd Channel! - https://www.youtube.com/channel/UCJ7Ug7MOABAYv_c371vbsdQBackground Music: Pamaj: https://soundcloud.com/austin-pamajewonhttps://www.youtube.com/user/CHUKImusicInstrumental produced by Chuki.BUSINESS CONTACT ONLY:swaggxblyt@gmail.comDaniel.Kang@unitedtalent@.com#coldwar #warzone #callofdutyfamily friendly content"
"zAUiy4vqxxY","DDG, OG Parker - Money Long (Official Audio) ft. 42 Dugg","2021-02-26T05:00:32Z","UC9OAeZY8zp976DwRvHGjuSA","DDGVEVO","10","21.01.03","ddg|queen naija|pontiacmade|sorry 4 the hold up|arguments|pontiac|michigan|rap|run it up|take me serious|DDG YouTube|Lil Baby|Too Much To Lose|Young Rich Black|Accountant|YBN Almighty Jay|YBN Nahmir|YBN Cordae|BlocBoy JB|Jay Critch|VALEDICTORIAN|meet me in the lobby|toxic|exotics|she cheated|moonwalking in calabasas|remix|moonwalking in calabasas remix|salim montari|salim montari remix|carnage","336261","34993","288","4418","https://i.ytimg.com/vi/zAUiy4vqxxY/default.jpg","False","False","Pre-Save Die 4 Respect now: https://DDG.lnk.to/D4RPreSaveMoney Long available at: https://DDG.lnk.to/MoneyLongOfficial Music Video: https://DDG.lnk.to/MoneyLongOfficialFollow DDG:https://twitter.com/pontiacmadeddg https://www.facebook.com/Pontiacmadeddg/ https://www.instagram.com/pontiacmadeddg https://soundcloud.com/pontiacmadeddg https://www.youtube.com/channel/UCKqqDlf6lfo3ChRA4-gzusQFollow OG Parker:https://www.instagram.com/ogxparker/(C) 2021 DDG Entertainment Inc., under exclusive license to Epic Records, a division of Sony Music Entertainment#DDG #OGParker #42Dugg #MoneyLong"
"Qc4BFVeuYaM","Ghetts - Fire in the Booth pt3","2021-02-24T19:00:15Z","UCB5-9DHv6C6WMJOksBocwJQ","CharlieSloth","10","21.01.03","charlie sloth|apple music|fire in the booth|fitb|fire in the desert|fire in the booth dubai|fire in the booth desert|fire in the booth ghetts|ghetts fire in the booth pt3|ghetts fire in the booth 3|ghetts fire in the booth part 3|rapping in desert|fire in the dunes","233269","13406","137","1760","https://i.ytimg.com/vi/Qc4BFVeuYaM/default.jpg","False","False","Ghetts is back for a special Fire in the Booth on the week of his 'Conflict of Interest' Album release. Fire in the Dunes aka Fire in the Desert was filmed in Dubai UAE.Listen to Ghetts 'Conflict of Interest' Album here: https://apple.co/3dywtuO🎤Artist » @Ghetts http://youtube.com/user/TheRealGhettsTV0:00 - intro0:59 - Ghetts on @tenbilliondreams 🎼  beat3:59 - Ghetts on @tenbilliondreams  🎼  beat6:44 - credits7:00 - outroShot and Edited by Saoud KhalafProduced by TENBILLION DREAMSCamera Operator: Jordan BarehamDrone Operator: Ryan Taylor#Ghetts  |  #FireInTheBooth  |  #RapListen to this Ghetts Fire in the Booth here: https://apple.co/2ZKpTt3Listen to Ghetts' new music here: https://apple.co/2NSNyowListen to more Charlie Sloth on Apple Music: http://apple.co/charlieFire In The Booth is a Charlie Sloth original freestyle Rap format on Apple Music.It's very different now.----------CHARLIE SLOTH➤ http://youtube.com/CharlieSloth➤ http://facebook.com/CharlieSloth➤ http://instagram.com/CharlieSloth➤ http://twitter.com/CharlieSloth➤ http://soundcloud.com/CharlieSloth➤ SnapChat - imCharlieSloth➤ http://charliesloth.com"
"wBX_m6QvBQA","WARZONE'S SHIPWRECK IS CHAOS!! - Zombies, New Loot & More! [Cold War Warzone]","2021-02-25T09:56:01Z","UCoT7FaR2QO-YSplT4N5UIbg","IceManIsaac","20","21.01.03","call of duty|warzone|cod warzone|call of duty warzone|icemanisaac|cod|cold war|cold war warzone|warzone academy|isaac|warzone tips|warzone tips and tricks|warzone nvidia|warzone new season|warzone update|warzone season 2|season 2|cold war season two|warzone season two|warzone cold war update|new warzone guns|new warzone map|warzone map changes|warzone leaks|warzone easter eggs|warzone shipwreck|warzone ship|warzone boat|warzone new spot","347930","6150","211","504","https://i.ytimg.com/vi/wBX_m6QvBQA/default.jpg","False","False","► TWITCH:  https://Twitch.tv/IceManIsaac► TWITTER: https://Twitter.com/IceManIsaac_WARZONE ACADEMY is now adding on to its incredibly in-depth guides by adding additional gameplay where we apply the tactics and strategies we've discussed in our guides!If you're interested in future coaching videos, let me know what you want to see next! ___________________________________________________________► SCUF DISCOUNT: Isaac at checkout for 5% off (https://scuf.co/Isaac)► GFUEL DISCOUNT: Isaac at checkout (http://gfuel.ly/2EGGyqv)► TWITCH:  https://Twitch.tv/IceManIsaac► TWITTER: https://Twitter.com/IceManIsaac_► TIKTOK: https://www.tiktok.com/@icemanisaac► INSTAGRAM: https://www.Instagram.com/IceManIsaac► FACEBOOK: https://www.facebook.com/IceManIsaac► DISCORD: https://discord.gg/DRZmKaT► BUSINESS ONLY: Isaac@evolved.gg___________________________________________________________► MY GAMING/STREAMING/CAMERA GEAR: https://kit.co/IceManIsaac___________________________________________________________ Tags: call of duty,warzone,cod warzone,call of duty warzone,icemanisaac,cod,cold war,cold war warzone,warzone academy,isaac,warzone tips,warzone tips and tricks,warzone nvidia,warzone new season,warzone update,warzone season 2,season 2,cold war season two,warzone season two,warzone cold war update,new warzone guns,new warzone map,warzone map changes,warzone leaks,warzone easter eggs,warzone shipwreck,warzone ship,warzone boat,warzone new spot"
"ExJoykl6tXc","Super Rugby Aotearoa | Highlanders v Crusaders - Rd 1 Highlights","2021-02-26T08:38:47Z","UCDOGExGCsrrt_RrGDgLuMww","SUPER RUGBY","17","21.01.03","[none]","162912","1679","38","147","https://i.ytimg.com/vi/ExJoykl6tXc/default.jpg","False","False","Super Rugby Aotearoa | Highlanders v Crusaders - Rd 1 HighlightsThe Crusaders kicked off their Super Rugby Aotearoa defence with a win on Friday, overcoming a gallant Highlanders outfit in Dunedin.#SuperRugby #SkySuperRugbyAotearoa #HIGvCRU"
"87ipF5E1dmc","Dax - SELF PROCLAIMED 4 (Official Music Video)","2021-02-25T22:00:14Z","UCvvVOIyaYu2l4jiH9L8_eRw","Dax","10","21.01.03","dax|self proclaimed 4|self proclaimed 3|self proclaimed|official music video|motivational music|workout music|rap|hip hop|King Arthur|excalibur|manifestation|rare|very rare|inspirational music|the king arthur|excalibur song|dax rap god|rap god|dax self proclaimed|dax self proclaimed 3|dax dear god|manifestation music|sad nigga hours|law of attraction|eminem","604162","76553","653","9428","https://i.ytimg.com/vi/87ipF5E1dmc/default.jpg","False","False","This is the official end of 2020 for us. IMPACT 2021 has now begun. Let's share this everywhere and motivate millions. Love you all and I can't wait to show you what I've been working on. Like, comment, and share :)Available Everywhere:  Follow DAX: @ thatsdaxShot by: Logan MeisProduced by: Lex Nour Beats#SelfProclaimed4​ #motivation​ #manifestation​ #itsdax​ #kingarthur #excaliburLYRICS: Don’t let nobody tell you who you areI remember sleeping wishing on a shooting starAfter practice over night cleaning working hard coming up short hoping one day I’d go farI was young dumb broke and I was still naiveI had failed so many times but I still believedThat I would turn into that man everyone could see wouldn’t never let nobody tell him what He could achieveI stayed focused walked right on my pathI told my mom I was leaving and I couldn’t come backHopped out my feelingsquit my job graduated and laughed then went to Cali straight broke and hopped right in my bagNow I’m standing here speaking giving all I amTrying to show you that the change starts with one man I ain’t lying cause I did so I know you can so here help the world understand thatThis is motivationFor every single chance you ain’t takenany rule that’s in your way you better break itShut up, embrace itThe pain is a pre-requisite without it how the fuck you think you Ever gon’ make itThe sweat is your paymentFuck an escalator take the stairs to top right from the fucking basementYour life is a statement Leave a legacy and stop waitingGet yo ass up today and start chasingThis that motivation I’m hoping that this hits your soulThey’re just dreams till you sit down and you write your goalsI remember when they said I wasn’t built this strong I bounced back like elastic and put myself onNow I’m Selling out these tickets to places I don’t knowGoing to these places they said that I couldn’t goGiving all my time to people at these showsTo spread this message and this music that i know brings hopeThey feel itI don’t gotta top a stupid chart or win a Grammy just show that I’m the realest I don’t need a co-sign from nobody if they ain’t said nothing by now they pretending not to see itAny odd I beat, negativity delete it, I don’t care succes it’s the journey I fiending, if I say it meant it, flow(floor) dirty can’t clean it, give a fick about the past cuz I rip’d itNow I’m bout to fucking hit the topYou fucking people can’t cancel mePut me in boxOr fucking drive to me to insanityI’m already crazy, 1/4 of me is all of you so half of me is two of you and 4 of you is all me, you’ll need a whole army if you thinking bout stopping me and 5 lifetimes if you’re thinking you can copy meI’ve beaten poverty went to war and beat mediocrity my life is mine I’m molding that shit like I’m doing potteryI’m not scared of failure I embrace it and chase it If there’s a 1 percent chance I can do it I take itI took the hate they all threw sat down and I ateThen took the motivation from it turnt to one of the greatestAnd now every time i drop I know I’m making a statementReplacing every single person that you got on your playlistI’m not a product of the system that’s why no one can break it I’m trynna change the whole game man fuck being famous dawgI’m Self proclaimed and I Never changedI rock the same clothes and still got the same chainIt’s reminder when hooped and I would go and get my jersey And those people didn’t even know my nameWell now I know you  you see it!They told me leave I made a promise they would all feel it!I couldn’t find the change so I said I’ll be it!So I hope y’all knowThis is Dax fucking self proclaimed 4 GOOOOOO!This is motivationFor every single chance you ain’t takenany rule that’s in your way you better break itShut up, embrace itThe pain is a pre-requisite without it how the fuck you think you Ever gon’ make itThe sweat is your paymentFuck an escalator take the stairs to top right from the fucking basementYour life is a statement Leave a legacy and stop waitingGet yo ass up today and This is motivation!"
