video_id,title,publishedAt,channelId,channelTitle,categoryId,trending_date,tags,view_count,likes,dislikes,comment_count,thumbnail_link,comments_disabled,ratings_disabled,description
"PLmgqsdAmfE","Présentation de 5 Prototypes d'Avions Ratés (1900 -1910)","2021-02-26T16:55:02Z","UCHwd4qMCzN4A2r6piZxTl4A","Epic Teaching of the History","27","21.01.03","top 5 des pires avions|l'histoire de l'aviation|le premier avion de l'histoire|premier avion de l'histoire|prototype d'avion|avion 1890|avion 1900|avion frères wrights|top avions|histoire avion|Éole avion|top fails|top histoire|top|aviation|avion|histoire|fails|Epic Teaching of History","37429","4002","42","253","https://i.ytimg.com/vi/PLmgqsdAmfE/default.jpg","False","False","Oyez à tous ! Aujourd'hui je vous propose de découvrir les débuts de l'histoire de l'aviation ainsi que 5 prototypes d'engins volants qui ont eu quelques petits.. soucis dirons-nous. J'espère que ça vous plaira, bon visio !--Un Epic merci aux Tipeurs du mois de Janvier ! (des exemples à suivre pour la jeunesse):Léo, District3, Cloudyletyran, frederic, xardas, Reinok, Otoro, Azamor, Pollux, Eniphleda, Amizie Lamy, Wurlyre, hbkraven, Richelieu, ADDMIN, Valentin, Corentin Limoge, Joany Leprince, Zarmando, Exo, Cpat, Alexandre Lorret, Tarkiache, ledie, AnonKekus, lilian11100, Rullia, Overkiiiiiiiiiill, Trelaire, merlin Goulet, cthulhu21000, TeknocraT, FrdeSang, dannyds, Pierre Zanon, morkai.e, Poupoulh5n1, JB Bongrand, Xavier Bonfond, Ezechiel Affagard, Steelfya, Leteif, Krokenstein, Sioul Jurthe, Mavel D, Varkogan, Gimar, Gilles, Manou, Gwendal, Agathe, Division-par-zero, Korkangel, TheAfterMF, Baptiste, Lasic, shigara, Alfredfr, nibor63, HaruKuro, Kamiperat0r, DecPascal, BlazingHanauta, Sheltine, Astropong, Caren, Virgule (lol), Tomeek302, Damien Cab, akanoa, Vincent Martin, Popov, , Zoharion, Amrozy et Neuromancien059 !!! (ouais on change l'ordre de fin c'est toujours Amrozy en dernier)Les Utipeurs:lelion, lulu, Adi, TMG_JR, Draco L., PAUL Q., Lurius O'nada, SirMoustach, Himaj, hiddenlulu, Docthrax, diego, grogneux, Meteora7b, et UnUn i. !  --Si vous avez apprécié vous pouvez me rejoindre et me soutenir sur: Utip: https://www.utip.io/RaAaKTipeee: https://www.tipeee.com/epic-teaching-of-the-history Twitter: https://twitter.com/RaAaKtheFox Facebook: https://www.facebook.com/Epicteachingofthehistory/Instagram: https://www.instagram.com/raaak_the_fox/ Discord: https://discord.gg/WcZ2A3DL'incroyable boutique de T-shirts pourris: https://teespring.com/fr/stores/les-arna-produits-de-raaak Disponibles aussi sur Utip: https://utip.io/raaak/shop Ma Ma deuxième chaine: https://www.youtube.com/channel/UC_WJ_7zzV9rlA4nzUoDAaYQ--La partie Amazon (petite musique d'ascenseur).Pour profitez d'1 mois gratuit sur Amazon Audible (si ça c'est pas une bonne affaire): https://www.amazon.fr/dp/B01AUIE0CK?tag=elrako-21Vous pouvez aussi profitez directement de 3 mois si vous êtes sur Amazon Prime: https://www.amazon.fr/dp/B01DPWQ20Q?tag=elrako-21.. et si jamais vous n'êtes pas au programme de Amazon vous pouvez profitez de 30 jours gratuits ici même: https://www.amazon.fr/prime?tag=elrako-21* OFFRE INDISPENSABLE DU JOUR * Découvrez ce magnifique Concentré Mr Propre Nettoyant Multi-Usages Citrons d’Été de 600 ml: https://www.amazon.fr/gp/product/B06WP6433D/ref=as_li_tl?ie=UTF8&camp=1642&creative=6746&creativeASIN=B06WP6433D&linkCode=as2&tag=elrako-21&linkId=be908ba970982afa7b42ce006fb21c1b (au passage mdr vous avez flingués le référencement de Amazon à force, maintenant quand je vais sur l'article c'est marqué 'Les clients ayant consulté cet article ont également regardé Abonnement Audible', on est des génies)(Ceci est un lien affilié, chaque achat effectué sur amazon via ce lien peut me rapporter un % du dit achat sans influer sur son prix, oui je galère à ce point)--Sources, liens des vidéos utilisées et bonus disponibles sur ce doc:https://docs.google.com/document/d/e/2PACX-1vSi9H-3yFmtQDa132hjfNMifc7yt8Y4To4JocYdzY7GXgXsrhYpLdLhcD31x2WhoJCmaMqqHOzTt8EA/pubMusiques utilisées:Winner winner - Kevin Mc LeodSymphony no40 in g minor k 590 1 molto allegro asterix et obélix - MozartErst trink mit mir ein bisschen Alkohol mein Schatz (oui) - Paul GoodwinAlexandermarsch - Prussian MarchHyperfun - Kevin Mc LeodWomen of the 1920's - aucune idéeSay it with (instrumental ) - Paul WhitemanStorm - Antino VivaldiWagon Wheel Electronic - Kevin Mc LeodDies Irae - Mozart--00:00 Introduction00:31 100 ans d'aviation en musique, la chanson officielle 00:48 Les débuts de l'aviation à moteur (l'Éole)6:46 Le générique bien trop tardif6:58 1 - Le Kress Drachenfliegen8:31 2 - l'Aérodrome A10:15 3 - L'Hélicoptère12:04 4 - Le Gyroplane13:25 5 - Les Multiplanes14:53 - Outro et générique#Avions #Fails"
"xZLPfSFI8-4","Tirage EuroMillions - My Million® du 26 février 2021 - Résultat officiel - FDJ","2021-02-27T00:54:18Z","UCJSrz9qWHiOdcMyMcroIv-g","FDJ","24","21.01.03","jackpot|gagner|numéro|chance|code|gagnant|tirage|EuroMillions - My Million|résultats|française des jeux|FDJ|code gagnant|combinaison gagnante|vendredi|2021|février|26|26 février 2021","34184","174","21","85","https://i.ytimg.com/vi/xZLPfSFI8-4/default.jpg","False","False","Retrouvez la vidéo du #tirage #EuroMillions - My Million® du 26 février 2021 sur la chaîne YouTube officielle FDJ®. Les tirages des autres dates sont également disponibles sur la chaîne YouTube ainsi que sur le site internet officiel : https://www.fdj.fr/jeux-de-tirage/euromillions-my-million/resultats"
"zcRJ2yZZiLw","Phénomène","2021-02-25T22:06:32Z","UCHWwWHw7tApW9TJ8lSzz6Rg","Kekra - Topic","10","21.01.03","Kekra|Benihana Boy|Roc Legion|Phénomène","39740","2617","17","3","https://i.ytimg.com/vi/zcRJ2yZZiLw/default.jpg","False","False","Provided to YouTube by Believe SASPhénomène · Kekra · Benihana Boy · Roc Legion · KekraPhénomène℗ VRLReleased on: 2021-02-26Auto-generated by YouTube."
"w8mBplMtwJ8","Ava Max - My Head & My Heart [Official Music Video]","2021-02-25T17:00:12Z","UCOwgc8DswjoBMuuUU2ScPvQ","Ava Max","10","21.01.03","ava max|pop|pop music|sweet but psycho|ava max sweet but psycho|sweet psycho|ava max music|ava max song|ava max lyrics|ava max salt|ava max kings & queens|ava max so am i|ava max torn|ava max my head and my heart|my head and my heart|ava max my head & my heart|my head & my heart|My head and my heart are caught in|My head and my heart are torturing me|baby now and then|z100 song|atc|all around the world","2309581","153954","1738","10331","https://i.ytimg.com/vi/w8mBplMtwJ8/default.jpg","False","False","My Head & My Heart Available NowDownload/Stream: https://AvaMax.lnk.to/MyHeadMyHeartIDDirector: Cham La’Donna and Emil NavaExecutive Producer Kirsten AronginoHead of Production Ryan PalmieriProducer : Seth LevinChoreography: Charm La'DonnaDirector of Photography: Ross RichardsonEditor: Jen KennedyColorist: Aubry WoodwissBeauty Work: Nick GregorioSubscribe for more official content from Ava Max: https://Atlantic.lnk.to/AvaMaxSubscribeFollow Ava MaxFacebook - https://www.facebook.com/avamaxofficialInstagram - https://www.instagram.com/avamaxTwitter - https://twitter.com/avamaxhttp://avamax.com"
"2O4cQpiDS0U","Faire un ASMR chez JOJOL","2021-02-27T20:00:00Z","UCB8il9i9Bl9mxEaCaClFEXQ","ASMinotauR","24","21.01.03","ASMR français|ASMR|Autonomous sensory meridian response|ASMR french|french ASMR|ASMR 2020|ASMR double micros|ASMR binaural|ASMR neumann KM 185|jojol|jojol67|asmr jojol|asmr high tech","47820","4459","91","349","https://i.ytimg.com/vi/2O4cQpiDS0U/default.jpg","False","False","Go vous abonner en masse à sa chaine youtube : https://www.youtube.com/user/jojol67Merci beaucoup pour l'invitation (et pour le KFC)Obtiens le vrai pourboire ASMR en devenant membre : https://www.youtube.com/channel/UCB8il9i9Bl9mxEaCaClFEXQ/joinAchetez le tshirt officiel de la chaine ici :https://www.youtube.com/channel/UCB8il9i9Bl9mxEaCaClFEXQ/storeRejoignez le discord : https://discord.com/invite/asterionMes réseaux sociaux :Instagram : https://www.instagram.com/asterionlebon/Twitter : https://twitter.com/AsterionlebonTwitch : https://www.twitch.tv/asterionlebonMatos utiliséNeumann Km 185Microphones Rode NT5 (meilleur rapport qualité/prix) : https://amzn.to/2HdzQWsMicrophone H5N (pour enregistrer le son) : https://amzn.to/3e2EKEWLumière : https://amzn.to/2NdnxMMCanon EOS 800D : https://amzn.to/2Sd6rCiTrepied Manfrotto : http://amzn.to/2wR9DqL"
"HRqRGQ8jD_4","Dead by Daylight | Chapter XIX Teaser","2021-02-26T22:00:02Z","UCaSgsFdGbwjfdawl3rOXiwQ","Dead by Daylight","20","21.01.03","dead by daylight|dbd|behaviour interactive|bhvr|slasher game|survival horror|dead by daylight chapter 19|dbd chapter 19|dbd chapter xix|dead by daylight chapter xix|dead by daylight teaser|dbd teaser|dbd new killer|dbd new survivor|dbd new chapter|dead by daylight new killer|dead by daylight new survivor|dead by daylight new chapter","469994","23681","583","5684","https://i.ytimg.com/vi/HRqRGQ8jD_4/default.jpg","False","False","Inspiration can often be drawn from the darkest places…    Chapter XIX is coming soon to Dead by Daylight.     Dead by Daylight is a multiplayer action/horror game where one player takes on the role of a brutal Killer and the other four play as Survivors. As a Killer, your goal is to sacrifice as many Survivors as possible. As Survivors, your goal is to work together to evade, escape and most importantly – stay alive.     BUY GAME: https://deadbydaylight.com     Join the official forum: https://forum.deadbydaylight.com     Like and follow us on our official Social Media Channels:   - Facebook: https://www.facebook.com/DeadByDaylight   - Twitter: https://twitter.com/deadbybhvr   - Instagram: https://instagram.com/deadbydaylight     #DbD"
"2szqiHykCJk","Vianney : Pour de vrai (clip officiel)","2021-02-24T17:00:16Z","UC5TkQJO0gnV7Ayw4xCsTn-g","Vianney Musique","10","21.01.03","[none]","539199","11144","529","1002","https://i.ytimg.com/vi/2szqiHykCJk/default.jpg","False","False","Vianney : Pour de vrai, extrait du nouvel album N'attendons pas disponible ici https://lnk.to/VianneyNTDPalbum​.En tournée en 2021 ! https://lnk.to/VianneyNTDPlaTournee/​Rejoignez Vianney sur Instagram : https://www.instagram.com/vianneymusique​Sur Facebook : https://www.facebook.com/vianneymusique​ Sur Twitter : http://twitter.com/VianneyMusique​ Paroles et Musique : Vianney℗ & © 2020 tôt Ou tard - VF musiques – La Passée Musiques"
"6XmucgoHO6Y","Super Rugby Aotearoa | Hurricanes v Blues - Rd 1 Highlights","2021-02-27T08:31:31Z","UCDOGExGCsrrt_RrGDgLuMww","SUPER RUGBY","17","21.01.03","[none]","116215","1628","30","151","https://i.ytimg.com/vi/6XmucgoHO6Y/default.jpg","False","False","Super Rugby Aotearoa | Hurricanes v Blues - Rd 1 HighlightsThe Blues overcame a slow start against the Hurricanes on Saturday, kicking off Super Rugby Aotearoa with a win in Wellington.#SuperRugby #SkySuperRugbyAotearoa #HURvBLU"
"MP45dXkGjfI","48H avec MOI en COUPE DE FRANCE !!! | QDF#033","2021-02-25T17:00:08Z","UCKJ7cmBniTdqzwyeQLOk6ow","Val Lienard","17","21.01.03","coupe de france|coupe de france val lienard|7ème tour|7e tour|8ème tour|8e tour|coupe de france val|qualification|qualification coupe de france|match coupe de france|vlog coupe de france|vlog football|foot|amateur en coupe de france|N3 coupe de france|N3|national 3|R2 coupe de france|immersion coupe de france|club amateur coupe de france|CDF|CDF football|Alès coupe de france|Olympique d'alès|OAC|val lienard|#val lienard|regional|QDF","85324","6686","28","392","https://i.ytimg.com/vi/MP45dXkGjfI/default.jpg","False","False","Gagne ta paire de CLR collector ici ⬇️ :https://www.decathlon.fr/landing/gamme-clr-kipsta/_/R-a-gamme-clr?utm_source=insta&utm_medium=vallienard&utm_campaign=clr———————————-Dans cette épisode de QDF, je vous amène avec moi vivre le septième tour de la coupe de France à côté de Limoges contre l’AS Panazol !D’après-vous, on va aller jusqu’où ?! 👀⚽️————————————A propos de moi :Nom Prénom : Lienard ValentinÂge : 23ansNationalité : Française Profession : Joueur de FootballÉquipe : Olympique d’Ales en CévennesChampionnat : National 3Poste : Latéral / PistonFormation : OGC Nice / AS Monaco FC / FC Istres.————————————Follow-moi sur :-TWITTER : https://twitter.com/val_lienard -INSTAGRAM : https://www.instagram.com/val_lienard/ -SNAPCHAT : val_lienard———————————-Montage : Nicolas Irr / Clément Irr / Valentin Lienard"
"7mskPSVF6DA","ATEEZ(에이티즈) - ‘불놀이야 (I'm The One)’ Official MV Teaser","2021-02-28T09:00:01Z","UCQdq-lqPEq_yZ_wP_kuVB9Q","KQ ENTERTAINMENT","10","21.01.03","KQ|케이큐|ATEEZ|에이티즈|HONGJOONG|SEONGHWA|YUNHO|YEOSANG|SAN|MINGI|WOOYOUNG|JONGHO|홍중|성화|윤호|여상|산|민기|우영|종호|김홍중|박성화|정윤호|강여상|최산|송민기|정우영|최종호|KPOP|KPOP MV|KPOP Music video|ATEEZ Music Video|ATEEZ MV|ATEEZ TEASER|ATEEZ FEVER|ZERO FEVER PART2|에이티즈 제로 피버 파트투|ATEEZ 제로 피버 파트투|에이티즈 불놀이야 티저|불놀이야|Bulnoriya|Fireworks|ATEEZ Fireworks|ATEEZ Bulnoriya|에이티즈 불놀이야|Fireworks TEASER|불놀이야 티저|ATEEZ ZERO FEVER PART2|Fireworks 티저|에이티즈 티저","541279","145054","196","7678","https://i.ytimg.com/vi/7mskPSVF6DA/default.jpg","False","False","Release Date: 2021. 3. 1. 6PM (KST)▶ ATEEZ Official Homepage:http://ateez.kqent.com▶ ATEEZ Official V LIVE: http://channels.vlive.tv/C057DB▶ ATEEZ Official Facebook:https://facebook.com/ATEEZofficial▶ ATEEZ Official Twitter:https://twitter.com/ATEEZofficial▶ ATEEZ Official Instagram:https://instagram.com/ATEEZ_official_▶ ATEEZ Official Fancafe:http://cafe.daum.net/ATEEZ▶ KQ Official Homepage: http://kqent.com▶ KQ Official V LIVE: http://channels.vlive.tv/CB8675▶ KQ Official Facebook: https://facebook.com/kqent▶ KQ Official Twitter: https://twitter.com/kqent▶ KQ Official Instagram:https://instagram.com/kqent#ATEEZ #에이티즈 #FEVER_Part_2"
"V0GLIcSg_Oc","Guy2bezbar - D.C.B (Clip officiel)","2021-02-24T15:00:09Z","UCWy0VFXt-zTNB6u1lYQMfZQ","Guy2bezbar","10","21.01.03","[none]","808363","15579","137","391","https://i.ytimg.com/vi/V0GLIcSg_Oc/default.jpg","False","False","Ecoute D.C.B par Guy2bezbar partout : https://guydebezbar.lnk.to/DCBRéalisé par : NATAS3000 (@natas3000)Clip produit par CAPSUL (@capsul__)Prod par : Ponko, Pierrari, Lucozi----- Abonne-toi dès maintenant à la chaine de Guy2Bezbar : https://www.youtube.com/channel/UCWy0...​----- Retrouve Guy2Bezbar sur : Facebook : https://www.facebook.com/guydebezbar/​ Twitter : https://twitter.com/Guy2Bezbar​ Instagram : https://www.instagram.com/guy2bezbaro​fficialSnap: guy2bezbarsnap"
"tuJqHuANkyw","State of Play | February 25, 2021 [ENGLISH]","2021-02-25T22:39:35Z","UC-2Y8dQb0S6DtpxNgAKoJKA","PlayStation","20","21.01.03","PlayStation|PS5|PS4|PSVR|PlayStation 5|PlayStation 4|Video Games","1898232","59244","6669","4438","https://i.ytimg.com/vi/tuJqHuANkyw/default.jpg","False","False","Rated RP - T, THIS LIVE STREAM MAY INCLUDE CONTENT INAPPROPRIATE FOR CHILDREN This Thursday, State of Play will serve up new updates and deep dives for 10 games coming to PS4 and PS5. The show is clocking it at 30 minutes or so, give or take.Get ready for new game announcements and updates on some of the third-party and indie titles you last saw in June’s PS5 showcase. And a quick note: there won’t be PlayStation hardware or business-focused updates in this show. We’re focusing on great games set to come out in the months ahead. Be sure to tune in on Thursday, February 25 at 2:00pm Pacific Time / 5:00pm Eastern Time / 10:00pm GMT!#StateofPlay #PS5 #PlayStation"
"ef8xS0NdhZU","COLOMBIEN DE BOOSKA-P EST-IL TOUJOURS NUL AU FOOT ??","2021-02-25T17:00:31Z","UCqcwr5S5S3dsjNjiw7UYwnQ","Boumé Sama","24","21.01.03","boume|boume sama|football|foot|futbol|soccer|marque|marquer|challenge|defie|defi|defis|défi|défis|défie|match|resume|résumé|replay|f2|insane|crazy|chrismd|score a goal|epic|tekkers|messi|ronaldo|mbappe|neymar|psg|vinsky|pro|joueur|nike|youtube|joueur pro|joueur professionnel|hazard|extrem|but|buts|challenges|frappe|frappes|tir|tirs|top but|top buts|keeper|goal|goalkeeper|training|foot mercato|booska-p|dans la gova|rap jeu|rap|juventus|pogba|champions league|mendy","165759","12023","62","294","https://i.ytimg.com/vi/ef8xS0NdhZU/default.jpg","False","False","Pour avoir un Sweat: https://bernobini.com/collections/samaMon interview et l'humiliation de colombien chez booska-p: https://www.youtube.com/watch?v=urW_6FC2M0Q&t=17sQue vaut Colombien de booska-p au football ?Une vidéo tous les jeudi 18h Abonne toi pour rejoindre l'aventure !On teste une personnalité des réseaux pour voir ce qu'il donne au football !Aujourd'hui c'est le retour de colombien de chez Booska-p !Colombien: https://www.instagram.com/booskacolom...​⚽ Instagram: https://www.instagram.com/boumesama/​⚽Twitter:  https://twitter.com/BoumeSama​⚽Contact: boumesama@gmail.com"
"SretrBMugEs","TUTO MÉCA - L’état des lieux… - SXV Revival : 1ère partie","2021-02-24T17:00:34Z","UCo2LeYTlpLra9swD4Ye-vBg","High Side","24","21.01.03","high side|tuto méca|tuto mécanique|aprilia|sxv|550|aprilia sxv|aprilia sxv 550|sxv 550|highside|bader|thorn bikes|franck|noury|vnr bike|vnr|bike","235747","15771","75","641","https://i.ytimg.com/vi/SretrBMugEs/default.jpg","False","False","Voici la première partie de notre série de tutos mécanique sur l’Aprilia 550 SXV. Adrian a eu la bonne idée d’acheter 2 motos en panne et espère que Franck et Bader pourront en faire une qui fonctionne. Pour cela, ils vont commencer à démonter complètement les deux moteurs, en profitant des conseils de Vincent, spécialiste de ces machines… LA BOUTIQUE HIGH SIDE EST EN LIGNE : https://boutique.highside-moto.com/MERCI À VNR BIKE : https://vnrbike.fr/Plus de High Side sur : https://www.highside-moto.com/Suivez-nous sur Facebook : https://www.facebook.com/High-Side-374144846056802/?fref=tsSuivez-nous sur Instagram : https://www.instagram.com/highsidemoto/?hl=frVous pouvez soutenir l'émission sur Tipeee : https://fr.tipeee.com/high-sideBader Benlekehal : Facebook : https://www.facebook.com/baderbenlekehal/?fref=tsInstagram : https://www.instagram.com/baderbenlekehal/?hl=frSite : https://www.highside-moto.com/articles-par-auteur/?liste_des_redacteurs=BaderFranck Nourry : Facebook : https://www.facebook.com/thornbikes/Instagram : https://www.instagram.com/thornbikes/?hl=frSite : https://thornbikes.com/Adrian Parassol : Facebook : https://www.facebook.com/adrian.parassol/?fref=tsInstagram : https://www.instagram.com/adrianoni/?hl=frSite : https://www.highside-moto.com/articles-par-auteur/?liste_des_redacteurs=Adrian"
"hY4LO6b2RMA","Lyna Mahyem - Purple (Clip officiel)","2021-02-24T11:00:12Z","UCL1HRetzM1V5LYkdglrFH-g","Lyna Mahyem","10","21.01.03","[none]","868070","32107","390","1242","https://i.ytimg.com/vi/hY4LO6b2RMA/default.jpg","False","False","« Purple » disponible sur toutes les plateformes : https://Lyna-Mahyem.lnk.to/PurpleIDPurple est aussi disponible dans l’album « Femme forte » de Lyna Mahyem sur toutes les plateformes : https://Lyna-Mahyem.lnk.to/FemmeForteIDL'album Femme forte de Lyna Mahyem est disponible en intégralité sur cette playlist Youtube : https://www.youtube.com/playlist?list=PLLPxEtEP1Yv2x7xrfJ3QHJgh1U2jes3tt Écrit par Lyna MahyemComposé par Greg K (@gregk94)Mixé par Sino (@sinobounce) Produit par TefaMasterisé par David Hachour (@colorsoundstudio_mastering)Enregistré par Yasmymen (@yasmymen)ClipRéalisation: WHB (@whb_art)Boîte de production: Digitalnak (@digitalnak)Suivez Lyna Mahyem : Instagram : https://www.instagram.com/lynamahyem/ Snapchat : LynaMahyem1 Youtube : https://www.youtube.com/channel/UCL1HRetzM1V5LYkdglrFH-g TikTok : https://www.tiktok.com/@lynamahyem_off Spotify : https://open.spotify.com/artist/0Yj3N31EWXHc6e3eDyJPLP Facebook : https://www.facebook.com/lynaMahyemMusic/ Twitter : https://www.twitter.com/LynaMahyem Label : Nouvelle Ecole - BLZ (https://www.instagram.com/blz______/) (https://www.instagram.com/nouvelleecole/) Music video by Lyna Mahyem performing « Purple ».℗ 2020 BLZ Inc. - Nouvelle Ecole © 2020 BLZ Publishing - Nouvelle Ecole - Artbeat - SUTHER KANE FILMS#lynamahyem #purple #femmeforte"
"oy9YdrP1_8g","Seven Binks - On Arrose (Clip Officiel)","2021-02-24T16:00:14Z","UC4tglAncZr5jflNEiWAKMeA","Seven Binks","10","21.01.03","koba|koba lad|koba coffre plein|koba maes|koba detail|bolemvn|bolemvn rk|boleman|shotas|keusty|seven binks|7binks|bat7|batiment 7|koba la detaille|koba niska|koba rr 91|koba vald|koba pas de reine|bolemvn maes|kauba|koba la detail|shotas koba|koba lad shotas|koba binks|shotas capuché|bolemvn 10k|bolemvn vol169|seven binks booskap|booskap|bolemvn eh boy","296757","16088","229","555","https://i.ytimg.com/vi/oy9YdrP1_8g/default.jpg","False","False","Écoute On Arrose  → https://sevenbinks.lnk.to/OnArroseAbonne-toi → https://bit.ly/2ZURCaFSuivez Seven Binks :Instagram → https://www.instagram.com/7binksofficielTwitter → https://twitter.com/7binksofficielRéalisé par BabassAssistant réal : Côme CerezalesProduit par Fabrique 209Directrice de production : Mélissa DelgadoAssistante de production : Rhizlane QuadryDOP : David Moerman1ère Assistante caméra : Héloïse Tour2nd Assistant caméra : Serge SamoSteadicam : Simon NeugebauerChef électricien : Abdellah Bouallala1er Assistant électricien : Lucas Fraizy2nd Assistant électricien : Eryl BounekhlaCheffe décoratrice : Laurine L. Kante 1ère Assistante décoratrice : Morgann Despoulains2ème Assistante décoratrice : Mina Grandi Renfort déco : Mathis Boisson Chef constructeur : Mickael PereiraAccessoiriste plateau : Inès Alez-MartinGraphiste : Vadim Régisseur général : Jules Poulin Régisseur/ Rippeur : Hadrien TissierRégisseur : Mathis BoissonMake up : Léa FontaineStyliste : Malick AhgarsMontage : BabassEtalonnage : Azzedine Wahbi / AW COLOR STUDIOVFX : Swanside Photographes plateau : Arthur Bresset, Baptiste Gouzy, Jacques-Henri, 22th.Gallery, Zéphyrin, Tsiori_35mnMaking-of : ACYRAUn grand merci à tous les figurants, Koria et à l'association Buncoeur Damoclès#7Binks #OnArrose #Bat7 #Koba #Bolemvn #Shotas #Keusty"
"DJgundSMuXw","Libertés en danger, confinement à Paris, doute sur Emma Watson… Actus du jour","2021-02-26T21:00:01Z","UCAcAnMF0OrCtUep3Y4M-ZPw","HugoDécrypte","25","21.01.03","[none]","386648","20939","423","2443","https://i.ytimg.com/vi/DJgundSMuXw/default.jpg","False","False","Les actus du jour, résumées et expliquées ! 🤗 Sur Instagram, du contenu exclusif et des résumés d'actu en moins d'1 minute : @HugoDecrypte http://instagram.com/hugodecrypte/🍿 La même chose, mais pour la culture (ciné/séries, musique) : https://instagram.com/hugodecrypte.pop⚽️ Et pour le sport : https://instagram.com/hugodecrypte.sport 🐦 Mon Twitter (moins de résumés d’actu, + de tweets persos) : http://twitter.com/HugoTravers🎙 Sur Twitch, du live  ! Au menu : de l’actualité, de la culture et du jeu https://www.twitch.tv/hugodecrypte🎧 Les actus du jour en podcast : https://open.spotify.com/show/6y1PloEyNsCNJH9vHias4T?si=pz8U9CGkTCO_IGSEnMVxVw (également disponible sur Apple Podcast, Deezer, etc)Des liens pour en savoir + SOURCESPASS SANITAIRE EN FRANCEhttps://www.lemonde.fr/politique/article/2021/02/25/mis-sous-pression-par-les-variants-emmanuel-macron-reflechit-a-la-maniere-de-vivre-avec-le-covid-19_6071123_823448.htmlhttps://www.ouest-france.fr/sante/virus/coronavirus/covid-19-macron-evoque-la-mise-en-place-d-un-pass-sanitaire-pour-les-restaurants-et-lieux-culturels-7167818CONFINEMENT A PARIShttps://www.francetvinfo.fr/replay-radio/19h20-politique/covid-19-le-premier-adjoint-a-la-maire-de-paris-emmanuel-gregoire-plaide-pour-un-reconfinement-de-trois-semaines_4292343.htmlhttps://www.lefigaro.fr/politique/la-mairie-de-paris-avance-l-hypothese-d-un-confinement-de-trois-semaines-en-ile-de-france-20210226https://www.bfmtv.com/politique/paris-confinee-trois-semaines-l-opposition-denonce-une-proposition-aberrante_AV-202102250496.htmlRESTRICTIONS DES LIBERTÉS https://www.lefigaro.fr/flash-actu/la-pandemie-un-pretexte-pour-certains-etats-en-vue-de-reprimer-s-inquiete-l-onu-20210222?utm_medium=Social&utm_source=Facebook&fbclid=IwAR3HNnEEMajbiAPiwApxY2622IMWj8dtVVETcKrPJinkMZ2mLNv34PLaGeA#Echobox=1614005238https://www.lorientlejour.com/article/1252909/la-pandemie-un-pretexte-pour-certains-etats-en-vue-de-reprimer-sinquiete-lonu.htmlhttps://www.lalibre.be/international/amerique/la-pandemie-est-un-pretexte-utilise-par-certains-etats-pour-reprimer-et-abolir-les-libertes-deplore-l-onu-6033a828d8ad5809d095efa3EN BREFhttps://www.lemonde.fr/international/article/2021/02/26/joe-biden-echoue-a-imposer-la-hausse-du-salaire-minimum-dans-son-plan-de-relance_6071249_3210.htmlhttps://www.lci.fr/culture/non-la-comedienne-emma-watson-ne-met-sa-carriere-en-pause-2179331.htmlÉcriture : Blanche Vathonne - Benjamin Aleberteau - Hugo Travers Montage : Camille Paulet"
