video_id,title,publishedAt,channelId,channelTitle,categoryId,trending_date,tags,view_count,likes,dislikes,comment_count,thumbnail_link,comments_disabled,ratings_disabled,description
"w2IhccXakkE","Polo G - RAPSTAR (Official Video)","2021-04-09T04:00:15Z","UCojuFn_hfMyScH5hSHTBADQ","PoloGVEVO","10","21.09.04","PoloG RAPSTAR|Polo|Polo Capalot|RAP STAR|RAPSTAR Polo G|Polo G RAPSTAR|New polo G video|Polo G Capalot|Die A Legend|THE GOAT|Chicago Rap|RAPSTAR video|Columbia|Hip Hop|Polo G|RAPSTAR","2015959","325736","1093","46894","https://i.ytimg.com/vi/w2IhccXakkE/default.jpg","False","False","Official video for RAPSTAR by Polo GListen + Download RAPSTAR out now: https://polog.lnk.to/RAPSTARAmazon Music - https://polog.lnk.to/RAPSTAR/amazonmusicApple Music - https://polog.lnk.to/RAPSTAR/applemusicAudiomack - https://polog.lnk.to/RAPSTAR/audiomackDeezer - https://polog.lnk.to/RAPSTAR/deezeriTunes - https://polog.lnk.to/RAPSTAR/itunesSoundcloud - https://polog.lnk.to/RAPSTAR/soundcloudSpotify - https://polog.lnk.to/RAPSTAR/spotifyYouTube Music - https://polog.lnk.to/RAPSTAR/youtubemusicDirected by ArradWritten & Co-directed by Polo GProduced by Riveting EntertainmentFollow Polo GFacebook - https://www.facebook.com/pologofficial/Instagram - https://www.instagram.com/polo.capalot/Tiktok - https://www.tiktok.com/@pologofficialTwitter - https://twitter.com/Polo_Capalot#PoloG #RAPSTAR"
"0EVVKs6DQLo","Doja Cat - Kiss Me More (Official Video) ft. SZA","2021-04-09T04:00:00Z","UCpTaAz_BxtkUB1qc8JTU_7g","dojacatVEVO","10","21.09.04","doja cat|sza|kiss me more|doja cat kiss me more|doja cat sza|doja|kiss me more video|new doja cat|new sza|planet her|doja cat planet her|streets|doja streets|say so|doja cat rules|tia tamera|kiss me more lyrics|doja cat juicy|hot pink|sza good days|broken clocks|hit different|drew barrymore|sza the weekend|all the stars|supermodel|doja cat live|sza live|doja cat tiktok|new pop|new r&b|kiss|more","2182420","313790","2248","31761","https://i.ytimg.com/vi/0EVVKs6DQLo/default.jpg","False","False","Doja Cat // “Kiss Me More” ft. SZAOut Now // https://smarturl.it/xKMMx 🎧 Put headphones on for a simulated 360 Reality Audio experience 🎧“Kiss Me More” was mixed with an immersive #360RA experience in mind, use headphones for the full effect. Stream “Kiss Me More” in full 360 Reality Audio, now available on Tidal, Amazon and Deezer.Register at the link below to redeem your 3-month free trial!Visit: https://cutt.ly/music_com_Doja_Cat*Quantities are limited, while supplies lastSubscribe to Doja Cat's Official YouTube Channel: https://smarturl.it/DojaYTSubcribe​​ Follow Doja Cat:http://www.dojacat.com/​​https://www.instagram.com/dojacat/​​ https://twitter.com/DojaCat https://www.facebook.com/DojaCat​​ Follow SZA:http://szactrl.com​http://instagram.com/sza​http://twitter.com/sza​http://facebook.com/sza___“Kiss Me More” (Official Video)Astronaut: Alex Landi  Director: Warren FuDP: Christopher Ripley Executive Producer: Sara NixProducer: Whitney JacksonCommissioner: Sam HoustonPM: Val PensaPM: Quinci BryantLabel: RCA Records Production Company: Partizan Entertainment1st AD: Ev SalomonProduction Designer: John Richoux with Nomad Art + DesignEditor: Nick Rondeau at Work EditorialColorist: Matt Osborn at Company 3Sound Mixing: Brandon Kim at Therapy StudiosVFX: Roman Bilichenko + Olga Petrishena at Digital Axis and Jumanah Shaheen + Grant Miller + David Lebensfeld at Ingenuity StudiosGame Designer: Christopher RodriguezDirector Reps: Nicole O’Connell + Beatriz Lopez at Hart Represents Team Doja Cat Management: Wassim “Sal” Slaiby, Gordan Dillard, Lydia Asrat, Josh Kaplan, Rachel RowleyCreative Director / Stylist: Brett Alan NelsonTailor: Jesstia UsherStylist Assist: Kristin Ritchie + Samuel WolfeHair: J Stay ReadyMakeup: Ernesto CasillasMakeup Assist: Ivan NunezNails: Saccia LivingstonChoreographer: Cortland Brown Team SZA Management: Terrence Punch Henderson, Roberto retOne Reyes, MeLisa ChaneleStylist: Diane Garcia Makeup: Ernesto CasillasHair: Tevin Washington#dojacat #kissmemore #szahttp://vevo.ly/ymvm09"
"Qt1dZiD0rsY","Deno - Lingo ft. J.I & Chunkz (Official Video)","2021-04-08T18:30:13Z","UCqOkTlaaRsFNsYwzmrCvAnQ","OfficialDenoVEVO","10","21.09.04","Columbia|Deno feat. J.I the Prince of N.Y & Chunkz|Lingo|Rap/Hip-Hop","313847","28535","254","2503","https://i.ytimg.com/vi/Qt1dZiD0rsY/default.jpg","False","False","Deno – Lingo ft. J.I & ChunkzListen/Download: https://deno.lnk.to/LingoAYPre-order Boy Meets World, the new mixtape, out May 14th: https://deno.lnk.to/BoyMeetsWorld ----------------------Follow Deno –https://www.instagram.com/denodrizhttps://www.twitter.com/denodrizhttps://www.tiktok.com/@denodrizhttps://www.facebook.com/denodriz ------------------------Lyrics –Now your talking my lingoBig stacksEvery day we making cash, making cash Hop out the cab 1,2,3 with the gang LingoMoney madEverything we do for the bag Making cashHop out the cab 1,2,3 with the gang Cos money mad We ain’t ever had no bags Really came from the bottom of the ground So it’s crazy now we got bands Me and you is a different ratio Counting up my p’s while I’m on the radio Aiming for the top, You n*ggas are way below Saw a big cheque, then I got my mother a yard J.I.:I don’t wanna do it, but they all gonna make me do me right, Empty out the clip at the audience, like it’s movie night,Baby in the UK, put you on a sooner flight, I ain’t tryna put it in your mouth if you don’t chew it right She a little bad thing, and she got an accent, I can see the Louis Vuitton, upgraded your fashion You deserve a stylist, I can make it happen She gonna use my lingo in her caption Now your talking my lingoBig stacksEvery day we making cash Hop out the cab 1,2,3 with the gang Lingo Money madEverything we do for the bag Hop out the cab 1,2,3 with the gangChunkz:(Uh) She rocking with my lingo She used to see my shop outside the window She was riding with me even when I been low,But now it’s different So tell me when you need me She told me bout her CVBad little freaky ting like Riri Normal, For you it’s Celine cos it’s normal,Dominican, Nigerian, Somaliana,She bad she make me wanna be her baby father Shit changed, is it me or are you capianaOr is it maybe cos I hit a miliana Take her out to eat we going Benihana Flights from the ends take her to BahamasMake her do the deed, while she’s in her PradaShe calling me daddy, but I’m the Don Dada Now you’re talking my lingo Big stacksEvery day we making cash Hop out the cab 1,2,3 with the gang Lingo Money madEverything we do for the bagMaking cash1,2,3 with the gang------------------------#Lingo #OfficialVideo #Deno"
"Wbvc-LxTUs8","Arsenal vs Slavia Prague | Watch Along Live","2021-04-08T21:18:08Z","UCBTy8j2cPy6zw68godcE7MQ","AFTV","17","21.09.04","afc|aftv|arsenal|arsenal fan tv|fan cams|arsenal tv|arsenal fan cams|football|gooners|premier league|robbie lyle|troopz|dt|aftvmedia|david luiz|xhaka|martinelli|arteta|mikel arteta|aftv news|Pierre-Emerick Aubameyang|Aubameyang|Nicolas Pepe|All Gunz Blazing|transfer daily|gabriel|willian|thomas partey|aftv troopz|uel|north london|north london derby|arsenal tottenham|don robbie|football youtube|youtube football|aftv ty|arsenal videos|football fans","476001","5071","254","876","https://i.ytimg.com/vi/Wbvc-LxTUs8/default.jpg","False","False","Arsenal vs Slavia Prague | Watch Along Live📊 Join 120,000+ users on Profit Accumulator today: https://bit.ly/2SCMlRh18+ & UK only. Please gamble responsibly. begambleaware.org #adIf you would like to donate towards supporting Claude's funeral, memorial and family, you can do so here: https://gofund.me/2a22766a(This is the official 'GoFundMe' page set-up by his family.)☑️Try the full AFTV VIP experience (https://www.aftv.mobi/) FREE for 2 weeks, with exclusive new shows, all our YouTube content ad-free, an in-game Opta match centre, team selectors, daily polls, world-class news articles, as well as brilliant competitions including; opportunities to appear on AFTV and much more. *Just £2.99/month after the free trial period*Subscribe to the brand-new Don Robbie YouTube channel now ➡️ https://www.youtube.com/c/DonRobbie😷  AFTV have put in place all the measures suggested by our government, in order to keep our people, and our country, safer during Covid-19.  https://aftv.co.uk/home/aftv-covid-19-policy/🎥 SUBSCRIBE NOW: https://bit.ly/3dXN9Zl📸 FOLLOW US ON INSTAGRAM: https://bit.ly/3dX0kcT📲 FOLLOW US ON TWITTER: https://bit.ly/3f0Wvou👤 LIKE US ON FACEBOOK: https://bit.ly/2VJaHuK📱 FOLLOW US ON TIKTOK: https://bit.ly/2BEux3h👀 SUBSCRIBE ON SNAPCHAT: https://bit.ly/3eBAn6K🤖 JOIN US ON REDDIT: https://bit.ly/2VN1tNU📺 WATCH US ON TWITCH: https://bit.ly/3ivXYVR🖥 VISIT OUR WEBSITE: https://www.aftv.co.uk🙋 Do you have a suggestion for content that you would like to see us do, here on AFTV?➡️ Fill out this quick suggestion form and we might use your idea: https://bit.ly/3iork8JAFTV is the largest football fan network in the world! With a bias towards Arsenal Football Club, we are the place where the fan’s uncensored opinion can be heard before, during and after the whistle blows. Join in the banter and follow us for football previews, watch alongs, fan cams, podcasts and more. This is where the world watches, and the voice of the fan is heard!⚠️ DISCLAIMER: Football is a vibrant game and fans are passionate. Colourful language is sometimes used, and controversial opinions expressed. Content is often streamed live, and we are not always able to edit or censor material in advance. VIEWER DISCRETION IS ADVISED. The thoughts, views and opinions expressed are those of the contributors and do not necessarily purport to be or reflect those of AFTV.#UEL #AFTV #Arsenal #Football"
"6w4Cgpto-G0","Kourtney & Addison Bunker Down: KUWTK Katch-Up (S20, Ep4) | E!","2021-04-09T00:58:01Z","UC8oimTPVHKiC7oL3QgdKbgg","Keeping Up With The Kardashians","24","21.09.04","Kardashians|Recaps|Entertainment|Top Stories|Reality TV|TV|Shows|E! Shows|Addison Rae|Kim Kardashian|Kourtney Kardashian|Khloe Kardashian|Kris Jenner|Scott Disick","743106","16728","264","855","https://i.ytimg.com/vi/6w4Cgpto-G0/default.jpg","False","False","Kim & Khloe Kardashian go into survival mode while the rest of the family questions Kourt's close relationship with TikTok star Addison Rae. Watch!"
"9ctUcvktD7c","Making The WEIRDEST Food Combinations","2021-04-08T19:45:44Z","UCHhfSXoDG6gSgpOvLH4wrRw","Behzinga","20","21.09.04","behzinga|beh2inga|sidemen|moresidemen","498392","31383","184","1763","https://i.ytimg.com/vi/9ctUcvktD7c/default.jpg","False","False","💻 ExpressVPN: https://expressvpn.com/behzinga to take back your internet privacy TODAY and find out how you can get 3 months free with a 1-year subscription.💪 Gymshark: https://gym.sh/EthanGS🏋️‍♂️ Bulk Official: http://tidd.ly/9e0caa89💾 Second Channel: https://goo.gl/zj8iLh🐦Twitter: https://goo.gl/vLFjVi📸 Instagram: https://goo.gl/kZFDby---------------------------------------------------------------------------------------👨‍👦‍👦 Sidemen Channel: https://goo.gl/75JAoW👕 Sidemen Clothing: https://goo.gl/3PvKDU📘 Sidemen Book: https://goo.gl/iFMyRx🎮 Custom Controllers: https://goo.gl/7mf2bs📹 How I Record My Gameplay: https://goo.gl/L4UUcA💻 My Custom PC: https://goo.gl/2QPvxR---------------------------------------------------------------------------------------#Behzinga #SidemenVideo Uploaded by Behzinga, Beh2inga."
"uF0gZE59R8w","SL x M1llionz - Versus (Official Music Video)","2021-04-08T18:30:14Z","UC16Jppb49O5WW54ZyWnJz_w","OfficialSL","10","21.09.04","[none]","171438","11680","43","704","https://i.ytimg.com/vi/uF0gZE59R8w/default.jpg","False","False","Stream/Buy 'VERSUS' here:https://ditto.fm/_versusFollow SL:Instagram: https://www.instagram.com/officialslTwitter: https://twitter.com/officialslFacebook: https://www.facebook.com/SL-104134237...Spotify: https://open.spotify.com/artist/0wY1K...TikTok: https://www.tiktok.com/@officialsl"
"ABTdTTnnEU8","World’s Largest Explosion!","2021-04-07T18:45:24Z","UCIPPMRA040LQr5QPyJEbmXA","MrBeast Gaming","20","21.09.04","[none]","15511923","568540","11235","50072","https://i.ytimg.com/vi/ABTdTTnnEU8/default.jpg","False","False","We set up a bunch of TNT and worked our way up the the world's largest TNT blast! Also if the boys survive they get a prize every round because why notSUBSCRIBE OR YOU'LL HAVE BAD LUCKNew Merch - https://shopmrbeast.comJoin our discord server for your chance to compete in future Minecraft challenges!https://discord.gg/kCQKvZD----------------------------------------------------------------follow all of these or i will kick you• Facebook - https://www.facebook.com/MrBeast6000/• Twitter - https://twitter.com/MrBeast•  Instagram - https://www.instagram.com/mrbeast--------------------------------------------------------------------"
"ilut9TzMfXs","Rag’n’Bone Man & P!nk – Anywhere Away From Here (Official Video)","2021-04-09T07:00:17Z","UCE5yTn9ljzSnC_oMp9Jnckg","P!NK","10","21.09.04","ragnboneman|pink|P!nk|anywhereawayfromhere|lifebymisadventure","216437","19687","151","1461","https://i.ytimg.com/vi/ilut9TzMfXs/default.jpg","False","False","Rag’n’Bone Man & P!nk – Anywhere Away From Here (Official Video)Listen: https://rnbm.lnk.to/AAFH From the album Life By Misadventure:https://rnbm.lnk.to/LifeByMisadventure --- P!nk:https://pinkspage.com​https://tiktok.com/@pinkofficial​https://facebook.com/pink​https://twitter.com/pink​https://instagram.com/pink​ Rag’n’Bone Man:https://ragnboneman.com​https://instagram.com/ragnboneman​https://twitter.com/ragnboneman​https://facebook.com/ragnbonemanhttps://tiktok.com/@ragnboneman​ --- Wild and runningFearlessness is burning brightWe knew nothing ‘cause out of sight is out of mindBefore we ever learnt the fear of being boldBefore we ever were afraid of the unknown When the lights go upI don’t think I told you I don’t think I told youThat I feel out of placePull me undergroundDon’t know if you noticeSometimes I close my eyes and dream of somewhere elseAnywhere away from hereAnywhere away from hereAnywhere away from here We sold our souls and we lost controlWith more doubt than hopeGlass half empty Discontented from growing oldThrough all the failed attempts at trying to belongI over think the obvious when I’m alone When the lights go upI don’t think I told you Idon’t think I told youThat I feel out of placePull me undergroundDon’t know if you noticeSometimes I close my eyes and dream of somewhere elseAnywhere away from hereAnywhere away from hereAnywhere away from here Oh, when I close my eyesOh, when I close my eyesI wish I could disappear  When the lights go upI don’t think I told youDon’t know if I told youThat I feel out of placePull me undergroundDon’t know if you noticeSometimes I close my eyes and dream of somewhere elseAnywhere away from hereAnywhere away from hereAnywhere away from here"
"1CTyGnUh5Qg","I Am The World’s Greatest Magician","2021-04-08T20:00:02Z","UC4-79UOlP48-QNGgCko5p2g","MrBeast Shorts","22","21.09.04","[none]","1454055","94237","812","5532","https://i.ytimg.com/vi/1CTyGnUh5Qg/default.jpg","False","False","subscribe or else #shorts"
"IGoeipibzf0","GRANADA vs MANCHESTER UNITED With Mark GOLDBRIDGE LIVE","2021-04-08T21:12:42Z","UCMmVPVb0BwSIOWVeDwlPocQ","The United Stand","24","21.09.04","Manchester United|Man United|Man Utd|Manchester United TV|The United Stand|United Stand|Manchester United News|MUFC|Man Utd News|United|Manchester United Transfer News|Man Utd Transfer News|Transfer|Solskjaer|Solskjaer news|MU live streaming|mu live|Man Utd live stream|live|vs Manchester United|Mark Goldbridge|Goldbridge|Granada|Granada vs Manchester United|Granada Manchester United|Granada vs Man Utd","391191","7166","185","125","https://i.ytimg.com/vi/IGoeipibzf0/default.jpg","False","False","Granada vs Manchester United match reaction https://youtu.be/zYMgc2OnKmw. Join in the match chat on our Man Utd live stream as they take on Granada in the Europa League. PLAYER RATINGS https://www.theunitedstand.com/articles/match-ratings/fan-player-ratings-granada-vs-manchester-unitedLIVE GOLDBRIDGE REACTION: United Stand Exclusive T Shirt collection https://united-stand.myshopify.com/🚨VISIT OUR WEBSITE 🚨For all the latest United news and TUS content:https://www.theunitedstand.com⏲️The United Stand Content TIMELINE is the best way to find all our latest content quickly! https://www.theunitedstand.com/timeline📰 LATEST WRITTEN NEWS https://www.theunitedstand.com/articles/latest-news📸 FOLLOW OUR INSTAGRAMhttps://www.instagram.com/theunitedstandtv/✅ The United Stand MEMBERSHIP https://buff.ly/2I2Of9R📧Contact The United Stand = soccerboxtv@gmail.com📧WRITER SUBMISSIONS = unitedstandwebsite@gmail.comAddressing: Jamie or NoraSee the FULL United Stand Kit Range CLICK HERE https://buff.ly/2Krpw1zEXCLUSIVE NEW PODCAST ITUNES https://buff.ly/2ZUhv84Spotify https://buff.ly/34dwEo6Google Podcast https://buff.ly/2ZHlNDnCastBox https://buff.ly/2UuiU3RRadio Public https://buff.ly/34jWkzAThe United Stand is Manchester United's biggest independent fan channel. Made for Manchester United fans by Manchester United fans, the United Stand provides you with the latest Manchester United transfer news, highlights, goal reviews and much more. So if MUFC means the world to you, get involved and subscribe to The United Stand http://bit.ly/1CmczHm#ManchesterUnited #MUFC #Goldbridge"
"rsCul1sp4hQ","Monkey MindPong","2021-04-08T23:34:43Z","UCLt4d8cACHzrVvAz9gtaARA","Neuralink","28","21.09.04","[none]","1474625","32321","411","4538","https://i.ytimg.com/vi/rsCul1sp4hQ/default.jpg","False","False","Pager, a nine year old Macaque, plays MindPong with his Neuralink. www.neuralink.com"
"mMT1V44rZTY","Kim Wonders Just How Close Are Kourtney Kardashian & Addison Rae? | E!","2021-04-08T13:03:15Z","UC8oimTPVHKiC7oL3QgdKbgg","Keeping Up With The Kardashians","24","21.09.04","Top Stories|Keeping Up With the Kardashians|Kardashians|TV|Reality TV|Addison Rae|Kourtney Kardashian|Kim Kardashian|Khloe Kardashian|Scott Disick|Kris Jenner|TikTok|Highlight|E! Shows|Shows|Entertainment","969101","19465","361","1746","https://i.ytimg.com/vi/mMT1V44rZTY/default.jpg","False","False","TikTok star Addison Rae and the KUWTK star have become fast best friends...but Kim K. and Scott Disick have some questions. Watch!"
"GHySdvcq20I","Minecraft, But There Are Custom Structures...","2021-04-09T01:30:01Z","UCETZ7OiW7-wqwb-6hsz3C4w","Bionic","20","21.09.04","minecraft|minecraft there are custom structures|minecraft but|minecraft challenge|minecraft structures|structures mod|minecrraft mod|mod|mods|challenge|bionic|family friendly","815623","35126","779","4221","https://i.ytimg.com/vi/GHySdvcq20I/default.jpg","False","False","Minecraft, But There Are Custom Structures...👕 MY NEW MERCH! - https://bionicware.net🔴 WATCH ME LIVE! - https://www.twitch.tv/bionicsanCREDIT! 💙https://www.curseforge.com/minecraft/mc-mods/repurposed-structures👀 FOLLOW ME PLSTikTok: https://www.tiktok.com/@dannybionicTwitter: https://twitter.com/dannybionicInstagram: https://www.instagram.com/danny.bionicDiscord: https://discord.gg/bionicMy Editor: @Saf 🎮 JOIN MY SERVER IP - bionic.gamesIn todays Minecraft Challenge... There are custom structures that spawn in every single biome and world! This was using a Minecraft mod called Repurposed Structures! These structures added a bunch of new challenges to Minecraft! Like and subscribe to get us Trending #1!#minecraft #MinecraftChallenge #MinecraftBut"
"4g7p9a1lbIQ","Bayern Munich v Paris Saint-Germain (2-3) | Mbappé Brace In Thriller! | Champions League Highlights","2021-04-07T22:00:24Z","UC4i_9WvfPRTuRWEaWyfKuFw","BT Sport","17","21.09.04","bt sport|bt sport official","1469501","23348","276","2636","https://i.ytimg.com/vi/4g7p9a1lbIQ/default.jpg","False","False","Kylian Mbappé took his Champions League goal tally to eight for the campaign, as PSG picked up an impressive victory at the Allianz.Hit 'Subscribe' above to ensure you never miss a video from the BT Sport YouTube channel.Get a BT Sport Monthly Pass now! - http://bit.ly/BTSportMonthlyPass Visit and subscribe to our 'BT Sport Boxing' YouTube channel ➡️ http://www.youtube.com/c/btsportboxingTwitter: http://twitter.com/btsportFacebook: http://www.facebook.com/btsportInstagram:http://instagram.com/btsportWebsite: http://sport.bt.com"
"adV1Qb9uDp4","Granada vs Manchester United (0-2) | Rashford Kickstarts Win In Spain! | Europa League Highlights","2021-04-08T21:57:12Z","UC4i_9WvfPRTuRWEaWyfKuFw","BT Sport","17","21.09.04","Man Utd|Man U|Manchester|United|highlights|football|Rashford|Marcus Rashford|Granada|Man Utd vs Granada|Granada vs Man Utd|Bruno|Fernandes|goals|Europa League|UEL|BT Sport","523654","7558","167","1360","https://i.ytimg.com/vi/adV1Qb9uDp4/default.jpg","False","False","It was Marcus Rashford and Bruno Fernandes who again provided the goals for Man Utd as Solskjaer's side claimed a 2-0 win in the first leg of their Europa League quarter-final with Granada.Hit 'Subscribe' above to ensure you never miss a video from the BT Sport YouTube channel.Click here to purchase a BT Sport Monthly Pass - http://bit.ly/BTSportMonthlyPass​Visit and subscribe to our 'BT Sport Boxing' YouTube channel ➡️ http://www.youtube.com/c/btsportboxing​Twitter: http://twitter.com/btsport​Facebook: http://www.facebook.com/btsport​Instagram:http://instagram.com/btsport​Website: http://sport.bt.com"
"XBNLM2sDtv4","The cast of Glee pays tribute to Naya Rivera & Santana Lopez at the 32nd Annual GLAAD Media Awards","2021-04-09T01:23:08Z","UCZmLgxP2N3Vj0XaQtohLT-A","GLAAD","29","21.09.04","GLAAD|media|LGBT|GLBT|gay|lesbian|bisexual|transgender|equality|award","111988","6760","9","442","https://i.ytimg.com/vi/XBNLM2sDtv4/default.jpg","False","False","The cast of Glee reunites during the virtual ceremony for the 32nd Annual GLAAD Media Awards for a special tribute to the legacy of the late Naya Rivera’s character Santana Lopez. The tribute honors the ten-year anniversary of Santana’s coming out on the GLAAD Media Award-winning series and spotlights the character’s impact on LGBTQ teens and Latinx LGBTQ representation on television. Global superstar Demi Lovato, who played Santana’s girlfriend on Glee, introduced the special tribute, featuring Glee cast members Jacob Artist, Chris Colfer, Darren Criss, Jessalyn Gilsig, Dot-Marie Jones, Vanessa Lengies, Jane Lynch, Kevin McHale, Heather Morris, Matthew Morrison, Alex Newell, Lauren Potter, Amber Riley, Harry Shum Jr., Becca Tobin, and Jenna Ushkowitz.The 32nd Annual GLAAD Media Awards honor media for fair, accurate, and inclusive representations of LGBTQ people and issues. Since its inception in 1990, the GLAAD Media Awards have grown to be the most visible annual LGBTQ awards show in the world, sending powerful messages of acceptance to audiences globally. The 32nd Annual GLAAD Media Awards are presented by Gilead, Hyundai, and Ketel One Family Made Vodka.For more information about the 32nd Annual GLAAD Media Awards, please visit www.glaad.org/mediaawards. On social media, follow @GLAAD and #glaadawards."
"JcjzFIPuk2M","Apex Legends War Games Event Trailer","2021-04-08T15:00:06Z","UC0ZV6M2THA81QT9hrVWJG3A","Apex Legends","20","21.09.04","Apex Legends|Apex Legends Anniversary Event|Apex Legends War Games|Apex Legends Fuse|Apex Legends Season 8|Apex Legends Mayhem|Apex Legends 2nd Anniversary|Season 8 Battle Pass|Apex Legends new season|Apex Legends game|Respawn Apex Legends|Battle Royale game|Battle Royale|Battle Royale shooter|Apex Games|squad play|multiplayer shooter|Apex Legends PS4|Apex Legends Xbox|Apex Legends PC|Apex Legends Origin|Respawn Entertainment|Electronic Arts","1650557","53889","1276","5647","https://i.ytimg.com/vi/JcjzFIPuk2M/default.jpg","False","False","Shall we play a game? The new War Games Event features five rotating takeover modes with never-before-seen modifiers, a new rewards track, and new skins.  Maggie warned the Legends what would happen if they didn’t deliver Fuse to her. Now she’s following through on her threat. Say goodbye to your precious games -- Salvo’s War Games are here instead. Play five rotating limited-time takeovers over two weeks. Shields regenerate in Shield Regen, round time is reduced whenever a Legend dies in Killing Time, automatically retrieve fallen banners in Auto Banners, compete for top loot in Ultra Zones, and get a free respawn in Second Chance. Plus check out the store to get bold new cosmetics. Everybody loves a little Mayhem -- get out there and make Maggie proud. Apex Legends™ is a free-to-play battle royale game where legendary characters battle for glory, fame, and fortune on the fringes of the Frontier. Play for free now on PlayStation® 4, PlayStation 5, Xbox One, Xbox Series X|S, Nintendo Switch, and PC via Origin and Steam.  Learn more about Apex Legends Season 8 – Mayhem: http://x.ea.com/67416 Check out our YouTube channel: http://x.ea.com/56710.Follow us on Twitter: https://twitter.com/playapex.Follow us on Instagram: https://www.instagram.com/playapex/.#WarGames #ApexSeason8 #ApexSeason8 #ApexLegends"
