video_id,title,publishedAt,channelId,channelTitle,categoryId,trending_date,tags,view_count,likes,dislikes,comment_count,thumbnail_link,comments_disabled,ratings_disabled,description
"EiuMpLG_l6Q","Brewstew - Our Dog Otis","2021-04-06T21:29:59Z","UCepPGz8AVCbggMl3BvboaBA","brewstewfilms","23","21.09.04","brewstew|rottweiler|cartoon|flash animation|animation|dogs|canines|stick figure|funny story|storytime|otis","744045","54680","366","5294","https://i.ytimg.com/vi/EiuMpLG_l6Q/default.jpg","False","False","Our Dog Otis was filmed in front of a live studio audience.Merch Store:https://teespring.com/stores/brewstewSpecial Thanks to the people that support me on Patreon!https://www.patreon.com/brewstewBrewstew.comMusic:Hidden Agenda Kevin MacLeod (incompetech.com) Licensed under Creative Commons: By Attribution 3.0http://creativecommons.org/licenses/b...End Music by Mark JaySound Effects:http://www.freesfx.co.uk/"
"LXKWDcDV4DY","Amy Fisher 07.09.1996  -  01.04.2021 - Forever & Always","2021-04-06T14:15:50Z","UCnrMs985SDFiM40arKM75-w","Amy Lee Fisher","22","21.09.04","[none]","225832","12281","41","3950","https://i.ytimg.com/vi/LXKWDcDV4DY/default.jpg","False","False","It is with great sadness that I have to announce that Amy passed away last week. She was loved and will continue to be loved by many. She will be missed by her followers and her family. We are all so proud of what Amy achieved in her life and are so thankful for your support. We hope Amy's legacy will continue to help many more people in the future. Her sister, Ellie, would also like to post in the coming days.Amy was and still is my soul mate, my first true love and I am truly heartbroken. I love you, forever and awaysTomx"
"uDi2FIww1YA","They WARNED Me About SOUTH SUDAN But I DID NOT LISTEN!","2021-04-06T18:50:01Z","UClwrpH_Np9zk8uMwnMwu8Nw","WODE MAYA","22","21.09.04","south sudan|south sudan tall people|world newest country|wode maya|salva kiir|tallest people|tallest people in the world|south sudan tall|dinka|dinkas|dink tribe|juba|juba vlog|south sudan vlog|dinka language|dinka height|dinka tallest|dinka man|tall people|african|africa|south sudanese|south sudan tallest man|tallest man in world|manute bol|luol deng|central africa|south sudan travel|sudan|sudan vlog|drew binsky south sudan","313621","11757","129","4276","https://i.ytimg.com/vi/uDi2FIww1YA/default.jpg","False","False","I was scared of visiting the world's newest country(South Sudan)based on the things I heard and watched on social media but since am on journey to Change the narratives of Africa I had to go!The Image of Africa has been distorted around the globe and we are changing the narratives via Youtube videos One Country At Time.Welcome to South Sudan my country number 18 in Africa!Until the history of Africa is told by Africans, the story of greatness will always glorify the imperialists.!It's Time For Africans To Unite, Embrace their Culture and be Proud of their Roots & Tell Their Own Story!-AFRICA TO THE WORLD..Subscribe to unlocked the Real Africa!Looking for a Short stay place in Ghana?Book With https://www.instagram.com/woodburyluxuryapartments/?r=nametagOne On One Consultation With WODEMAYAhttps://aiyawodemaya.com/consultation/We Need Your Support To Make This Project A Successful OneFor Sponsorship Advertisement & Business Enquirieshello@mayaempiregroup.comDonate & Support the Channel on Patreon:https://www.patreon.com/wode_mayaPurchase Our T-Shirt To Support Our Journey!https://teespring.com/proudly-africahttps://teespring.com/wodemaya-africa-to-the-worldhttps://teespring.com/maya-africa-to-the-worldhttps://teespring.com/born-african-in-america-blackLet's Interract On:Twitterhttps://twitter.com/wode_maya Instagram:https://www.instagram.com/mrghanababy/Like My Facebook page:https://www.facebook.com/Wodemaya99/I LOVE YOU"
"Z8y05MbYm1Q","RC Helicopter Battle | Dude Perfect","2021-04-05T22:00:09Z","UCRijo3ddMTht_IHyNSNXpNQ","Dude Perfect","17","21.09.04","dude perfect|dude perfect stereotypes|dude perfect water bottle flip|bottle flip|water bottle flip|dude perfect bottle flip|dude perfect basketball|dp|dude perfect world record|edition|nerf|trick shots|trick shot|family|ping pong|bowling|clean|family friendly|bubble wrap|soccer|football|spinner|spinners|fidget spinners|dude|battle|rc|helicopter|heli|helo|flying|army men|waterpark|water|landing|mouse|hunt|city|remote|control","7968749","297036","5619","9753","https://i.ytimg.com/vi/Z8y05MbYm1Q/default.jpg","False","False","First RC cars, then RC planes, and now.. RC HELICOPTERS!! Another incredible DP Battle!► Thanks for subscribing! - http://bit.ly/SubDudePerfect► Watch our Behind The Scenes Video: https://youtu.be/CpcXq_K5NrE► Subscribe to our DP+ Bloopers & Behind The Scenes Channel HERE: http://bit.ly/DPplusSubscribe#BattleNEXT LEVEL STUFF -------------------------------------------🎒 NEW Merch - http://bit.ly/DPStore🎮 Play our FREE iPhone game! - http://smarturl.it/DudePerfect2📱 Text us - (469) 205-7005🔔 Hit the bell next to Subscribe so you don't miss a video!👨🏻‍💻 Watch our newest vids! - http://bit.ly/NewDPVids📕 Read our Book - Go Big - http://amzn.to/OYdZ2sFollow our Instagrams so we can be best friends -------------------------------------------🏆 http://Instagram.com/DudePerfect🧔🏻 http://Instagram.com/TylerNToney👱🏻‍♂️ http://Instagram.com/Cody_Jones_🙋🏻‍♂️ http://Instagram.com/CobyCotton👨‍🦰 http://Instagram.com/GarrettHilbert⛹🏻‍♂️ http://Instagram.com/CoryCotton-------------------------------------------Bonus points if you're still reading this! Comment: What RC battle should we do next??Click here to learn more about Dude Perfect:http://bit.ly/AboutDudePerfectAs always...Go Big and God Bless!- Your friends at Dude PerfectBusiness or Media, please contact us at: Dude@DudePerfect.com------------5 Best Friends and a Panda.If you like Sports + Comedy, come join the Dude Perfect team!Best known for trick shots, stereotypes, battles, bottle flips, ping pong shots and all-around competitive fun, Dude Perfect prides ourselves in making the absolute best family-friendly entertainment possible! Welcome to the crew! Pound it 👊🏻 Noggin 🙇🏻‍♂️ - Dude Perfect"
"lRTJ-U5sisk","This Is The End.","2021-04-06T19:00:11Z","UCtPqR1gumPRaMLhSTlLn5nw","The Herberts","22","21.09.04","abby|Abbie herbert|the Herbert family|herbert family|herbert fam|the Herbert fam","439187","12839","310","1022","https://i.ytimg.com/vi/lRTJ-U5sisk/default.jpg","False","False","It is finally over...Subscribe to Abbie’s Channel: https://www.youtube.com/channel/UCQ0F...​...Subscribe to Josh’s Channel: https://www.youtube.com/user/joshherb...​...Follow us and be part of the Herbert Fam!—————————————————————————————————————Abbie’s Instagram: https://www.instagram.com/abbieherber...​...Josh’s Instagram: https://www.instagram.com/joshherbert...​...Abbie’s Twitter: https://twitter.com/AbbieHerbert_​​​​...​Josh’s Twitter: https://twitter.com/joshherbert?lang=...​Abbie’s TikTok: https://www.tiktok.com/@abbieherbert_...​...Josh’s TikTok: https://www.tiktok.com/@josh_herbert?...​...Spotify: https://open.spotify.com/artist/61ePJ...​...OUR CANDLE BUSINESS: https://herbertcandle.co​​​​​​​​​ABOUT US: Hi guys! We are Josh & Abbie Herbert! You might know us from our viral TikTok videos. We are known as that TikTok couple that is always doing the latest trends. We are so excited to have you on this journey with us. BUISNESS INQUIRIES: Abbie@talentxent.comJosh.Herbert@talentxent.comOUR MOST POPULAR VIDEOS Finding out I'm PREGNANT! https://youtu.be/BNhKSjfRzQU​​​​​​​​​Asking My Husband **JUICY** Questions Girls Are Afraid Too Afraid To Ask: https://youtu.be/IJ-GYDZs8eY​​​​​​​​​Asking My Wife *JUICY* Questions Guys Are Too Afraid To Ask https://youtu.be/bX5MqPGZO6s​​​​​​​​​#TheHerberts​​​​​​​​​ #TheEnd #CoupleVlog"
"DQ2c-6CJ-tM","PAC-MAN™ 99 - Announcement Trailer - Nintendo Switch","2021-04-07T01:11:53Z","UCGIY_O-8vW4rfX98KlMkvRg","Nintendo","20","21.09.04","nintendo|game|gameplay|fun|video game|action|adventure|rpg|play|pacman|pac-man|ms. pac man|pac man","696081","31709","771","6913","https://i.ytimg.com/vi/DQ2c-6CJ-tM/default.jpg","False","False","PAC-MAN™ is back in a new 99-PAC-MAN battle royale! PAC-MAN™ 99 goes live 4/7 at 6 PM PST, exclusively for #NintendoSwitchOnline members!🟡🟡🟡 ninten.do/6019VXwL1#PACMAN99Subscribe for more Nintendo fun! https://goo.gl/HYYsotVisit Nintendo.com for all the latest! http://www.nintendo.com/Like Nintendo on Facebook: http://www.facebook.com/NintendoFollow us on Twitter: http://twitter.com/NintendoAmericaFollow us on Instagram: http://instagram.com/NintendoFollow us on Pinterest: http://pinterest.com/Nintendo"
"RwOuXs3R9h4","Town Hall 14 Revealed! Clash of Clans Update Sneak Peek 1!","2021-04-06T12:00:08Z","UC85aYbNSFjsJdxfpxgQr8tA","Judo Sloth Gaming","20","21.09.04","clash of clans|coc|clash of clans gameplay|judo sloth|th14|town hall 14|town hall 14 gameplay|th14 gameplay|new th14|new town hall 14|town hall 14 update|th14 update|clash of clans update|coc update|clash of clans sneak peek|new update clash of clans|clash of clans 2021 update|clash of clans town hall 14|clash of clans th14|coc th14","918452","32858","849","3729","https://i.ytimg.com/vi/RwOuXs3R9h4/default.jpg","False","False","Town Hall 14 is the New Update for Clash of Clans! Judo Sloth Gaming shows TH14 Gameplay and explains all of the New Troop and Defense Levels for Town Hall 14. This is only Sneak Peek 1, there is so much more to reveal with the New Town Hall Level. TH14 will be Jungle Themed and the Giga Inferno will still be its weapon, but with a Poison Blast! This update will bring a huge amount of new content to Clash of Clans so be sure to subscribe for all the upcoming Update Sneak Peeks. Suggested Video:Big Donation Changes with Clash Update: https://www.youtube.com/watch?v=wkSrvtZ0q9cJoin 'The Dojo' to gain Exclusive Perks by becoming a Member of the Judo Sloth Gaming YT Channel: https://bit.ly/DojoMemberThank you for using Code 'Judo' in Clash of Clans to support me: https://bit.ly/CodeJudoMy Clash of Clans PlaylistsClash Explained: https://bit.ly/ClashExplainedBase Upgrading Advice: https://bit.ly/UpgradeBaseTip for Everything Series: https://bit.ly/TipsForEverythingLatest Update Info: https://bit.ly/ClashUpdatesTH9 Strategy: https://bit.ly/TH9-JudoTH10 Strategy: https://bit.ly/TH10-JudoTH11 Strategy: https://bit.ly/TH11-JudoTH12 Strategy: https://bit.ly/TH12-JudoTH13 Strategy: https://bit.ly/TH13-JudoWatch my Livestreams on Twitch and Facebook:TWITCH ► https://www.twitch.tv/judo_slothFACEBOOK ► https://www.facebook.com/JudoSlothFollow me on Social Media:TWITTER ► https://twitter.com/JudoSlothINSTAGRAM ► https://www.instagram.com/judoslothDISCORD ► https://discord.gg/JudoSloth#ClashOfClans #TH14 #TownHall14Video Chapters:0:00 Town Hall 14 Revealed2:15 Town Hall 14 Weapon Gameplay4:03 New Hero Levels5:32 New Building Levels8:05 New Defense Levels13:14 New Troop Levels14:32 Balance Changes► Judo Sloth Gaming is a mobile gaming channel focused on Clash of Clans. You will see a variety of videos focused on being Educational but Entertaining! You will find Informational Guides on Everything in CoC. Attack Strategies, 3 Star Attacks, Farming or Upgrade Advice, Lets Play and Update News - you'll want to Subscribe to see it all. Clash On!"
"yKO2V9wLDdA","Kane’s fire still burns as he becomes a Hall of Famer: WWE Hall of Fame 2021","2021-04-07T04:14:30Z","UCJ5v_MCY6GNUBTO8-D3XoAg","WWE","17","21.09.04","Kane|WWE Hall of Fame|superstars|world wrestling entertainment|wrestle|wrestler|wrestling|wwe|wwe 2021|مصارعه|कुश्ती|डब्लू डब्लू ई|पहलवान|मैच|व्यावसायिक कुश्ती|सुपरस्टार|wwe hall of fame 2021|kane hall of fame 2021|kane hall of fame|wwe hof|kane wwe hof|kane wwe hall of fame|kane wwe|wwe kane hall of fame 2021|kane joins wwe hall of fame|wwe kane hall of fame","1675404","68421","474","4638","https://i.ytimg.com/vi/yKO2V9wLDdA/default.jpg","False","False","After more than 25 years in WWE, “The Big Red Machine” Kane finally takes his place in the WWE Hall of Fame. Catch WWE action on Peacock, WWE Network, FOX, USA Network, Sony India and more.Stream WWE on Peacock https://pck.tv/3l4d8TP in the U.S. and on WWE Network http://wwe.yt/wwenetwork everywhere else---------------------------------------------------------------------Follow WWE on YouTube for more exciting action!---------------------------------------------------------------------Subscribe to WWE on YouTube: http://wwe.yt/Check out WWE.com for news and updates: http://goo.gl/akf0J4Watch WWE on Sony in India: http://www.wwe.com/SonySportsNetworkFind the latest Superstar gear at WWEShop: http://shop.wwe.com---------------------------------------------Check out our other channels!---------------------------------------------The Bella Twins: https://www.youtube.com/thebellatwinsUpUpDownDown: https://www.youtube.com/upupdowndownWWEMusic: https://www.youtube.com/wwemusicTotal Divas: https://www.youtube.com/wwetotaldivas------------------------------------WWE on Social Media------------------------------------Twitter: https://twitter.com/wweFacebook: https://www.facebook.com/wweInstagram: https://www.instagram.com/wwe/Reddit: https://www.reddit.com/user/RealWWEGiphy: https://giphy.com/wwe------------------------------------WWE Podcasts------------------------------------After the Bell with Corey Graves: https://wwe.com/afterthebellThe New Day: Feel the Power: https://wwe.com/feelthepowerUncool with Alexa Bliss: https://wwe.com/uncoolwithalexa"
"xeplzAFVGlE","Piers Morgan takes NEW SWIPE at Meghan Markle during EXPLOSIVE Tucker Carlson interview | Sunrise","2021-04-05T20:49:27Z","UCMRq9ADyETX-Touo4Srph5g","Sunrise","24","21.09.04","piers morgan and tucker carlson interview|Piers and tucker|piers morgan and tucker carlson|tucker carlson and piers morgan|piers morgan|Sunrise|Samantha Armytage|Sunrise on 7|Sunrise 7|Kochie|David Koch|tucker carlson|piers morgan prince harry meghan markle|7NEWS|Sam Armytage|Natalie Barr|Mark Beretta|Edwina Bartholomew|Monique Wright|Matt Doran|Australia|news|current affairs|fox news|meghan markle|Fox nation","654210","7949","837","3799","https://i.ytimg.com/vi/xeplzAFVGlE/default.jpg","False","False","Former Good Morning Britain host Piers Morgan has spoken with Fox's Tucker Carlson in his first TV interview since sensationally walking out on his high-profile job live on air. Morgan doubled down on his criticism of Meghan Markle during the interview.Get the latest news » https://7news.com.auMore from Sunrise » https://sunrise.com.au Subscribe to Sunrise » https://7news.link/SunriseSubscribeSubscribe to the Sunrise newsletter » http://7sunrise.link/NewsletterConnect with Sunrise online:Facebook » https://www.facebook.com/SunriseTwitter » https://twitter.com/sunriseon7Instagram » https://www.instagram.com/sunriseon7/#tuckercarlson #PiersMorgan #7NEWS"
"NKkVBQU1_5U","Sea of Thieves Season Two Approaches...","2021-04-06T15:00:07Z","UCtt2JqBTG-KoBae4F0Ay2tg","Sea of Thieves","20","21.09.04","sea of thieves|sea of thieves anniversary|anniversary update|sea of thieves update|pirates|rare ltd|xbox one|video games|xbox exclusive|pirate game|Kraken|pirate adventure game|xbox game pass|PC game pass|Game Pass ultimate|sea of theives|season two|new season|seasons","208938","7439","165","1955","https://i.ytimg.com/vi/NKkVBQU1_5U/default.jpg","False","False","Sea of Thieves Season Two begins on April 15th.----------------------------------------Sea of Thieves Merch: https://www.raregames.store/sea-of-thieves-----------------------------------------Buy the game and forge your own legend: https://www.xbox.com/seaofthievesDive into the Sea of Thieves Forums: https://www.seaofthieves.com/forumFollow Sea of Thieves on Twitter: https://twitter.com/SeaOfThievesLike Sea of Thieves on Facebook: https://www.facebook.com/SeaOfThievesGameSoak up Sea of Thieves sunsets on Instagram: https://www.instagram.com/seaofthievesgameTalk Sea of Thieves on Discord: https://discord.gg/seaofthievesLive your best pirate's life with us on TikTok: https://www.tiktok.com/@seaofthieves_gameXbox Live Gold required to play on Xbox One and Xbox Series X|S (sold separately)."
"5rkMxc7yGSk","Feeding a City in Need","2021-04-05T20:00:41Z","UCAiLfjNXkNv24uhpzUgPa6A","Beast Philanthropy","22","21.09.04","beast philanthropy|mrbeast charity|beast philanthropy channel|beast philanthropy real channel","3647818","484147","1537","32425","https://i.ytimg.com/vi/5rkMxc7yGSk/default.jpg","False","False","THIS IS MY FAVORITE VIDEO EVER! Thank you so much for watching this channel and allowing us to grow this charity! :)MERCH & DONATIONS - Coming Soon!"
"1lEfvcoSakc","KATIE PRICE: MOVING BACK IN MY ‘MUCKY’ MANSION!","2021-04-05T16:00:00Z","UCgWFC7cvQMoFP9WY1sx75cw","Katie Price","24","21.09.04","Katie|Katie Price|Harvey Price|Reality TV|Quest|KP|Pricey|Jordan|Junior Andre","282629","6419","386","1253","https://i.ytimg.com/vi/1lEfvcoSakc/default.jpg","False","False","Hey guys!In today's video, watch me and Carl move back into my ‘mucky’ mansion. This is such a lovely house but I’ve had such bad luck here! With Carl by my side I know we can turn this into such a lovely place together and make good memories here❤️Make sure you LIKE and SUBSCRIBE!Brand Enquiries - contact@proseeders.comSUBSCRIBE FOR MORE GREAT KATIE PRICE CONTENT! https://bit.ly/3bamerz​​​​​​SUBSCRIBE TO THE ADVENTURES OF KATIE & CARLhttp://bit.ly/3nZAJVy​​​​​SUBSCRIBE TO PRINCESS'S CHANNEL! https://bit.ly/2ZKvGhM​​​​​​FOLLOW MY SOCIALSKatie's Instagram: @katieprice - https://bit.ly/2Zwn0vu​​​​​​Katie's Twitter: @KatiePrice - https://bit.ly/3iqjKdy​​​​​​Music- Epidemic Sound- Jazzaddict by Cosimo and Fogg"
"61PVs2N61H0","I Must Win MrBeast's $10,000 Refrigerator","2021-04-04T21:57:24Z","UCFAiFyGs6oDiF1Nf-rRJpZA","Technoblade","20","21.09.04","Minecraft|Technoblade|Technothepig|Hypixel","7240603","600903","3454","31209","https://i.ytimg.com/vi/61PVs2N61H0/default.jpg","False","False","Mr. Sandman, bring me a Dream...Ranboo: https://www.youtube.com/channel/UCKQ-wNdh0kO5qnpPfXa2hjQMrBeast: https://www.youtube.com/channel/UCIPPMRA040LQr5QPyJEbmXA/WildCat: https://www.youtube.com/user/W1LDC4T43not linking Fundy. that man is getting nothing from me--------------------------------edited by myself & https://twitter.com/Wardenboobecome a CHANNEL MEMBER here: https://www.youtube.com/channel/UCFAiFyGs6oDiF1Nf-rRJpZA/joinother YT channel (go subscribe): https://www.youtube.com/channel/UCV--8wtuyGo3vMtIdeq4j3wfollow me on twitter too: https://twitter.com/Technothepig"
"L4Xh14lPHrk","Minecraft, But You're On The Moon...","2021-04-07T01:36:23Z","UC9tXyGZiEft9J4ZiI8dHb3Q","TapL","20","21.09.04","Minecraft|Competitive Minecraft|Minecraft PvP|TapL|UHC|Ultra Hardcore|Crazy UHC|Insane Minecraft|Minecraft Minigames|Tapple|Tapple Events|Tapple Minecraft|Tapple Server|Tapple UHC|TapL UHC|TapL Challenge|Challenge|Tapple Challenge|Minecraft But|Minecraft UHC But|MinecraftBut|Minecraft Challenge|Minecraft Challenges|Minecraft Hardcore|Beating Minecraft|Minecraft OP|OP Minecraft|Blessed Minecraft|Cursed Minecraft|Minecraft Scenario|Minecraft UHC","1841041","69595","837","6137","https://i.ytimg.com/vi/L4Xh14lPHrk/default.jpg","False","False","This is Minecraft, But You're On The Moon... this was stressful.Thanks for Watching! :D I appreciate all feedback and support :L!Edited By @ExtremeBlitz + TapL :LTWITCH STREAMS → https://twitch.tv/taplTAPL MERCH → https://tapl.storeTikTok → https://www.tiktok.com/@taplharvTwitter → https://twitter.com/TapLHarV Discord Server → https://discord.gg/TapLInstagram → https://instagram.com/taplharvSnapchat → itstapl#MinecraftBut #MinecraftChallenge #Minecraft #TapL"
"LvxtPm4OGJ4","rebirthing : Dancing with the Devil","2021-04-06T19:00:25Z","UCZkURf9tDolFOeuw_4RD7XQ","Demi Lovato","24","21.09.04","[none]","3835182","165394","1684","8450","https://i.ytimg.com/vi/LvxtPm4OGJ4/default.jpg","False","False","“I’ve had a lot of lives – like my cat, I’m on my ninth life.” Demi Lovato’s explosive documentary series comes to a close with revelations about her broken engagement, her return to the studio, and exploration of moderation sobriety as she attempts to let go of her past and moves ahead living her truth. Resources: The National Eating Disorders Association (NEDA) helpline1-800-931-2237 (they also offer click-to-chat messaging) www.nationaleatingdisorders.org SAMHSA Hotline for individuals and family members facing mental health and/or substance use disorders1-800-662-HELP (4357) TTY: 1-800-487-4889  Love Is Respect. Love is more than just the way you feel. Text loveis to 22522 for support and help understanding healthy relationships.www.loveisrespect.org1-866-331-9474TTY 1-866-331-8453Text: loveis to 22522Chat Online: www.loveisrespect.org Or if you need immediate support, please reach out to your local crisis text line:USA: Text HOME to 741741UK: Text SHOUT to 85258Canada: Text CONNECT to 686868 or 741741 Learn how to save lives at endoverdose.net.Production Companies: OBB Pictures, SB FilmsDirector: Michael D. RatnerExecutive Producers: Michael D. Ratner, Scott Ratner, Scooter Braun, Allison Kaye, Scott Manson, Kfir Goldberg, Miranda Sherman, Andy Mininger Find resources for your path to recovery at the Recovery Resource Hub (https://www.recoveryresourcehub.org/)."
"XXjXtuWKn3o","I'm Moving Away... (not a prank)","2021-04-05T02:15:14Z","UCwVg9btOceLQuNCdoQk9CXg","Ben Azelart","24","21.09.04","ben azelart|brent rivera|Lexi rivera|stokes twins|ben Azelart girlfriend|Lexi rivera boyfriend|mylifeaseva|lexi hensler|Andrew davila|pierson|Pierson wodzynski|Jeremy hutchins|dom brack|Brent and pierson|im moving|our new house|my new house|house tour|2021|sad|emotional|Ben Azelart dares|stunts|team rar|Carter sharer","6150951","549401","7253","167273","https://i.ytimg.com/vi/XXjXtuWKn3o/default.jpg","False","False","I'm moving away and broke the news to my friends...GET THE MERCH! https://staywildshop.comDon't forget to SUBSCRIBE to my channel for NEW videos every weekend!! Also, make sure to LIKE this video if you enjoyed it! Turn my POST NOTIFICATIONS on to get notified whenever I post! I love you guys and thanks for watching!INTRO SONG: Ace Of Spades By Yugohttps://distrokid.com/hyperfollow/yugo5/ace-of-spadesSubscribe to Bailey! (stunt double) @Bailey PayneSubscribe to my friends!@Stokes Twins@Alexa Rivera@Brent Rivera@Pierson@Lexi Hensler@Paris Rosenbaum@Jeremy Hutchins@Dom Brack@Andrew Davila@Derek Days☆ Follow Me On All Social Media!INSTAGRAM: @BenAzelart https://www.instagram.com/benazelart/TWITTER: @BenAzelart https://twitter.com/benazelartYOUTUBE: Ben Azelart https://www.youtube.com/benazelart/SNAPCHAT: @BenAzelartI have all rights to use this audio in this video according to Final Cut Pro's/YouTube's terms of use."
"GA-q2VpX0Qk","Minecraft's Most Mind-Blowing Inventions...","2021-04-05T21:58:19Z","UCIDQSqdVuNwtfRMKqfX-o7g","Sipover","22","21.09.04","sipover|slipover|sleepover|minecraft|inventions|minecraft inventions","1506852","54554","1427","2570","https://i.ytimg.com/vi/GA-q2VpX0Qk/default.jpg","False","False","Minecraft's Most Mind-blowing Inventions. Minecraft Players have always been pushing Minecraft to it's limit with INSANE inventions and today we look at the most craziest and mind-blowing ones. HELP ME HIT 350K SUBSCRIBERS BEFORE THE END OF APRIL! Twitch: SipoverSTwitter: SipoverSInstagram: SipoverS Discord: https://discord.gg/qFrX5QbThese Minecraft inventions can't even be built with a Redstone or a build tutorial, but some actually go way back in Minecraft's History. Dream should still use one of these to win his Minecraft Manhunt though. CREDITS TO THE ABSOLUTE MASTERMINDS WHO MADE THESE INVENTIONS!!! Super Quarry, Mob Switch, Tunnel Bore, Bedrock Remover - Scicraft / Ilmango - https://www.youtube.com/channel/UCHSI8erNrN6hs3sUK6oONLAAuto AFK Bridge Builder, Raid Farm, How Did We Get Here - Rayworks - https://www.youtube.com/user/craigeneggerFootage of Scicraft, Wave Machine, Lava Bridge Builder - Mumbo Jumbo - https://www.youtube.com/user/ThatMumboJumboBiggest Minecraft Door - Lord Jon25 - https://www.youtube.com/watch?v=IgQ6X7M4r8oXbox 360 Kinect Real-Time - Nate Viniconis - https://www.youtube.com/watch?v=x2mCDkqXki0Bomber Plane - Pi - https://www.youtube.com/watch?v=y_p51dXIITs&t=248sRedstone Calculator - Mattbatwings - https://www.youtube.com/watch?v=uGug-4xkw6MRedstone Computer - legomasta99 - https://www.youtube.com/watch?v=SbO0tqH8f5I&t=1563sEMP Lag Machine - Romtec - https://www.youtube.com/watch?v=R_S8o4hngNIMore Footage - https://www.youtube.com/watch?v=816mQFkks1Y&t=314s15x15 Door - ViscoseComb 24 - https://www.youtube.com/watch?v=6pGmLbuud-Q&t=0shttps://www.youtube.com/watch?v=ZOwWK2OkBfghttps://youtu.be/O2AvKEU9gpghttps://youtu.be/PCONcFQQ_aQ"
