video_id,title,publishedAt,channelId,channelTitle,categoryId,trending_date,tags,view_count,likes,dislikes,comment_count,thumbnail_link,comments_disabled,ratings_disabled,description
"WcwGleN38zE","Extreme $100,000 Game of Tag!","2021-04-17T20:00:00Z","UCX6OQ3DkcsbYNE6H8uQQuVA","MrBeast","24","21.18.04","[none]","20768349","1432925","9128","92983","https://i.ytimg.com/vi/WcwGleN38zE/default.jpg","False","False","I cant believe he actually won..New Merch - https://shopmrbeast.com/SUBSCRIBE OR I TAKE YOUR DOG╔═╦╗╔╦╗╔═╦═╦╦╦╦╗╔═╗║╚╣║║║╚╣╚╣╔╣╔╣║╚╣═╣ ╠╗║╚╝║║╠╗║╚╣║║║║║═╣╚═╩══╩═╩═╩═╩╝╚╩═╩═╝----------------------------------------------------------------follow all of these or i will kick you• Facebook - https://www.facebook.com/MrBeast6000/• Twitter - https://twitter.com/MrBeast•  Instagram - https://www.instagram.com/mrbeast--------------------------------------------------------------------"
"NjwQzJuHG4I","I PRANKED The News","2021-04-17T18:03:17Z","UCdcUmdOxMrhRjKMw-BX19AA","Niko Omilana","24","21.18.04","Pranking the news|news prank|bbc prank|bbc|prank|Niko|Niko Omilana|niko omilana mayor|NDL|niko for mayor|pranking news channels","2104794","367657","1230","12724","https://i.ytimg.com/vi/NjwQzJuHG4I/default.jpg","False","False","I pranked BBC News into giving me an interview.REGISTER TO VOTE- https://www.londonelects.org.uk/im-voter/registering-voteFollow me on Instagram- http://instagram.com/nikoomilanaFollow me on Twitter- https://twitter.com/NikoOmilanaBusiness Email - Grace@totalpsyclone.com"
"Ii5WVB01wVE","BEN ASKREN IMMEDIATE REACTION TO KNOCKOUT LOSS TO JAKE PAUL: THAT WAS NOT FUN","2021-04-18T05:02:30Z","UCmxZw7N4Jyljr1RbSs4Ymaw","FightHype.com","17","21.18.04","Jake Paul|Ben Askren|Boxing|FightHype","1964654","24929","1359","11369","https://i.ytimg.com/vi/Ii5WVB01wVE/default.jpg","False","False","FightHype.com is on hand at the Mercedes-Benz Stadium in Atlanta, Georgia where cruiserweight Jake Paul faces off with former UFC star Ben Askren. You don't want to miss what sent down immediately after the fights. Check it out!"
"ly6yEJSDFko","Prince Philip's funeral: the key moments","2021-04-17T18:17:55Z","UCoMdktPbSTixAyNGwb-UYkQ","Sky News","24","21.18.04","sky|news|queen|duke|edinburgh|prince|philip|funeral|prince philip funeral|national|anthem|prince philip|service|procession|st|george|george's|chapel|windsor|castle|plan|live|coverage|arrivals|elizabeth|harry|william|charles|andrew|family|royal|royals|military|proceedings|watch","3665759","39497","2030","0","https://i.ytimg.com/vi/ly6yEJSDFko/default.jpg","True","False","The funeral of the Duke of Edinburgh has taken place at St George's Chapel in Windsor.The Queen led her family in mourning her husband of 73 years.The service was led by the Dean of Windsor, who paid tribute to Prince Philip's kindness, humour and humanity - as well as his unwavering loyalty to Her Majesty.Sky's Jason Farrell looks at how the funeral unfolded.SUBSCRIBE to our YouTube channel for more videos: http://www.youtube.com/skynews Follow us on Twitter: https://twitter.com/skynews  Like us on Facebook: https://www.facebook.com/skynews Follow us on Instagram: https://www.instagram.com/skynews For more content go to http://news.sky.com and download our apps:  Apple: https://itunes.apple.com/gb/app/sky-news/id316391924?mt=8 Android https://play.google.com/store/apps/details?id=com.bskyb.skynews.android&hl=en_GBSky News videos are now available in Spanish here/Los video de Sky News están disponibles en español aquí https://www.youtube.com/channel/UCzG5BnqHO8oNlrPDW9CYJog"
"lpP5Ux1We28","JAKE PAUL IMMEDIATE REACTION TO KNOCKING OUT BEN ASKREN; GETS EMOTIONAL OVER DEATH & ALLEGATIONS","2021-04-18T05:36:35Z","UCmxZw7N4Jyljr1RbSs4Ymaw","FightHype.com","17","21.18.04","Jake Paul|Ben Askren|Boxing|FightHype","489179","6307","2287","4400","https://i.ytimg.com/vi/lpP5Ux1We28/default.jpg","False","False","FightHype.com is on hand at the Mercedes-Benz Stadium in Atlanta, Georgia where cruiserweight Jake Paul faces off with former UFC star Ben Askren. You don't want to miss what down immediately after the fights. Check it out!"
"mCY4b6GGkb4","The Funeral of The Duke of Edinburgh","2021-04-17T14:56:38Z","UCTkC3Jt91QkqNAE4FGWkEIQ","The Royal Family","22","21.18.04","[none]","0","0","0","0","https://i.ytimg.com/vi/mCY4b6GGkb4/default.jpg","True","True","The Funeral procession and service for His Royal Highness The Duke of Edinburgh at St George's Chapel, Windsor Castle."
"zYpUs22wAL4","🏆 HIGHLIGHTS ATHLETIC 0-4 BARÇA COPA DEL REY 2021 FINAL CHAMPIONS! 🏆 #CopaBarça","2021-04-17T22:25:47Z","UC14UlmYlSNiQCBe9Eookf_A","FC Barcelona","17","21.18.04","FC Barcelona|برشلونة،|Fútbol|FUTBOL|soccer|FUTEBOL|Sepakbola|サッカー|كرة القدم|football|FCB|Barça|Sport|Club|Barcelona|CAMP NOU|ter stegen|pique|busquets|messi|goat|leo messi|dembele|lenglet|griezmann|antoine griezmann|yt:cc=on|ansu fati|koeman|trincao|coutinho|pedri|0-4|final|copa del rey|cartuja|athletic|athletic club|bilbao|Champions|Campeones|golazo|Lionel|goal|goals|resumen|champions|King's Cup|Spanish|Cup|Sevilla|goles","4265152","159480","2583","6279","https://i.ytimg.com/vi/zYpUs22wAL4/default.jpg","False","False","Barça beat Athletic Club in the final of the Copa del Rey. Griezmann, De Jong & Messi x2 the Goal scorers in a brilliant performance from the Blaugranas. SUBSCRIBE NOW:▶ https://www.youtube.com/user/fcbarcelona ⚽ BARÇATV+: http://barca.link/wT1w30qMyQO​💎 Official Culers Membership: http://barca.link/plXS30rAhfC​🌐 Site: http://www.fcbarcelona.com📱 App: https://go.onelink.me/xndC/DownloadAppYouTube🔵 Facebook: http://www.facebook.com/fcbarcelona📸 Instagram: http://www.instagram.com/fcbarcelona🐦 Twitter: http://twitter.com/FCBarcelona🎶 Tiktok: https://www.tiktok.com/@fcbarcelona 📱 Viber: http://chats.viber.com/fcbarcelona🛍 Get all official Barça apparel from FC Barcelona's online store: http://barca.link/j8QH30qQh4Y 🔵🔴 #FCBarcelona"
"LL55C3pgiEo","The Funeral of HRH The Prince Philip, Duke of Edinburgh 🔴 Live - BBC","2021-04-17T15:54:07Z","UCCj956IF62FbT7Gouszaj9w","BBC","25","21.18.04","BBC iPlayer|United Kingdom|British TV|British TV Shows|Watch UK TV Online|Watch British TV Online|Watch British TV Shows Online|Prince Philip funeral live|Royal family|The queen","8318010","0","0","0","https://i.ytimg.com/vi/LL55C3pgiEo/default.jpg","True","True","Huw Edwards introduces live coverage of the ceremonial Funeral of HRH The Duke of Edinburgh from Windsor. Her Majesty The Queen, together with other members of the Royal Family will attend the funeral service. A full military procession and members of the Royal Family will accompany the coffin, as it makes the final journey from Windsor Castle to St George's Chapel.Throughout the afternoon, Huw Edwards will be joined by special guests, including Sir David Attenborough, Baroness Scotland, Alan Titchmarsh, and Baroness Grey-Thompson, to remember the man behind the crown. Royal experts will share their thoughts and analysis on this historic occasion and pay tribute to The Duke of Edinburgh’s life of service and duty.JJ Chalmers and Sophie Raworth in Windsor will report on the events from key locations around the Castle and will meet people participating in today’s ceremonial events.The Funeral of HRH The Prince Philip, Duke of Edinburgh - BBC#BBC #BBCiPlayer #BBCNews #PrincePhilip #DukeOfEdinburgh #RoyalFamilySubscribe and 🔔 to OFFICIAL BBC YouTube 👉 https://bit.ly/2IXqEIn​Stream original BBC programmes FIRST on BBC iPlayer 👉 https://bbc.in/2J18jYJAll our TV channels and S4C are available to watch live through BBC iPlayer, although some programmes may not be available to stream online due to rights. If you would like to read more on what types of programmes are available to watch live, check the 'Are all programmes that are broadcast available on BBC iPlayer?' FAQ 👉 https://bbc.in/2m8ks6v​."
"GdJkO3PLZrs","Prince Harry and William Walk Together as Royal Family Departs Prince Philip's Funeral","2021-04-17T15:46:04Z","UCCvgLV2Ixb8KCemj-UtXZ-g","The Royal Family Channel","25","21.18.04","prince harry|prince philip|prince william|royal family|queen elizabeth|duke of edinburgh|prince philip funeral|meghan markle|harry and meghan|prince harry and prince william|harry and william|the queen|the royals|prince william and kate middleton|windsor castle|prince philips funeral|buckingham palace|prince phillip|royal news|prince philip death|harry and william funeral|duke of edinburgh funeral|william and harry walk together|william and harry","7828812","50024","2964","7473","https://i.ytimg.com/vi/GdJkO3PLZrs/default.jpg","False","False","'Prince Harry and William Walk Together as Royal Family Departs Prince Philip's Funeral'Prince William and his brother, Prince Harry, were seen walking together through the grounds of Windsor Castle following the funeral of their grandfather, Prince Philip, the Duke of Edinburgh, on Saturday."
"Vsuq2QgPbC4","Chelsea v Manchester City | Key Moments | Semi-Final | Emirates FA Cup 2020-21","2021-04-17T18:45:41Z","UCChcWqwYXCEs657MQ00qVWA","The Emirates FA Cup","17","21.18.04","Chelsea|Man City|Chelsea 1-0 city|Chelsea highlights|city highlights|cfc|mcfc|Chelsea v Man City|Chelsea v Manchester City|emirates fa cup|emirates fa cup highlights|fa cup|fa cup highlights|fa cup highlights Chelsea|ziyech|hakim ziyech|ziyech goal v city|ziyech fa cup|emirates fa cup semi-final semi-final fa cup","1672175","21565","563","1428","https://i.ytimg.com/vi/Vsuq2QgPbC4/default.jpg","False","False","Chelsea faced Manchester City at Wembley Stadium in the semi-finals of the Emirates FA Cup.Follow @EmiratesFACup on Twitter for in-game highlights and match updates! https://twitter.com/emiratesfacup Subscribe: https://www.youtube.com/thefacup To find out more about The Emirates FA Cup visit: TheFA.com/EmiratesFACup The Emirates FA Cup on Facebook: https://www.facebook.com/EmiratesFACup/ The Emirates FA Cup on Instagram:https://www.instagram.com/emiratesfacup/"
"VFYmEMsqKVQ","Robert Whittaker: 'I'd fight Jake Paul for less than half a million'; says Adesanya is only fight","2021-04-18T06:13:49Z","UC789h3eqw0H1HqGmIsI26OA","TheMacLife","17","21.18.04","Conor McGregor|UFC|Dana White|MMAFighting|MMAJunkie|TheMacLife|Mac Life|UFC weigh in|ESPN MMA|Jorge Masvidal|Conor McGregor interview|UFC weigh ins|ufc highlights|dana white press conference|ufc|israel adesanya|khabib nurmagomedov|Khabib|conor mcgregor highlights|conor mcgregor funny|Mcgregor|Usman masvidal|UFC 259|Derrick Lewis|adesanya jan|Stipe Miocic|Francis Ngannou|Ngannou Miocic|robert whittaker|Kelvin Gastelum|whittaker gastelum","563732","11754","135","2662","https://i.ytimg.com/vi/VFYmEMsqKVQ/default.jpg","False","False","VISIT: http://www.themaclife.comFOLLOW: http://instagram.com/themaclifeofficialFOLLOW: https://twitter.com/MaclifeofficialLIKE: http://facebook.com/themaclife"
"qi0LwjB6hU8","HIGHLIGHTS | Demetrius Andrade vs. Liam Williams","2021-04-17T23:12:17Z","UCurvRE5fGcdUgCYWgh-BDsg","DAZN Boxing","17","21.18.04","dazn|boxing|highlights|full fight|ko|knockout|ryan garcia|top 10|canelo|anthony joshua|ggg|haney|demetrius andrade|andrade|liam williams|williams|fight night","273689","3739","242","1905","https://i.ytimg.com/vi/qi0LwjB6hU8/default.jpg","False","False","April 17th, 2021 -- Demetrius Andrade vs. Liam Williams from the Seminole Hard Rock Hotel & Casino in Hollywood, Florida.Subscribe to our YouTube channel 👉  http://bit.ly/DAZNBoxingYouTubeDownload the DAZN app now 👉  http://bit.ly/DAZNYoutubeFollow DAZN Boxing On Social Media 👇Twitter: https://www.twitter.com/DAZNBoxingInstagram: https://www.instagram.com/DAZNBoxingFacebook: https://www.facebook.com/DAZN"
"rfbbTEGXtyE","Ben Askren REACTS to KO LOSS to Jake Paul, Sean O'Malley sees Jake Paul, reactions to Askren, DC","2021-04-18T08:55:57Z","UCcHwjDdCJdDghV1S21J33jA","MMA Focus","17","21.18.04","Jake Paul|Triller Fight Club|ben askren|ben askren reacts to jake paul loss|jake paul ko ben askren|ben askren vs jake paul full fight|conor mcgregor|daniel cormier on jake paul|cormier jake paul ben askren|sean o'malley jake paul|sean o'malley ben askren vs jake paul|reactions to jake paul vs ben askren|jake paul vs askren full fight|ben askren boxing|UFC|MMA|Robert Whittaker|Israel Adesanya|mcgregor ufc 264|mcgregor vs poirier 3","148161","1483","125","1143","https://i.ytimg.com/vi/rfbbTEGXtyE/default.jpg","False","False","Ben Askren REACTS to KO LOSS to Jake Paul! Jake Paul KO's Ben Askren✔️ SUBSCRIBE for daily MMA news: https://goo.gl/gRSFH2✔️Please LIKE if you enjoy this video!✔️ Twitter: https://twitter.com/themmafocus✔️ Facebook: https://www.facebook.com/mmafocusofficialMMA NEWS:00:07 - Jake Paul KO's Ben Askren in 1 round00:47 - Ben Askren discusses loss to Jake Paul02:06 - Sean O'Malley sees Jake Paul backstage, attends VIP afterparty02:55 - Daniel Cormier reacts to Jake Paul vs Ben Askren04:07 - MMA pros react to Ben Askren vs Jake Paul boxing bout05:00 - Conor McGregor training for Dustin Poirier 3 at UFC 26405:57 - Markus Perez details sparring Jake Paul07:00 - Aljamain Sterling undergoes neck surgery07:45 - Jessica Andrade training for Shevchenko title bout at UFC 261Sources:https://www.instagram.com/p/CNy9doph6j3https://www.instagram.com/heybigmikehttps://www.instagram.com/sugaseanmmahttps://www.instagram.com/dc_mmahttps://twitter.comhttps://www.instagram.com/thenotoriousmmahttps://agfight.comhttps://www.instagram.com/funkmastermmahttps://www.instagram.com/jessicammapro#TrillerFightClub #UFC #MMAThanks for watching MMA FOCUS!Subscribe for daily MMA news related content!"
"30qwcIBAEX8","I'll Give You $0.10 Every Time You Click This Cookie","2021-04-17T19:07:04Z","UCvxfEIG3PHpgM0TMJJ_SH-w","FaZe Jarvis","20","21.18.04","[none]","954635","58337","752","2402","https://i.ytimg.com/vi/30qwcIBAEX8/default.jpg","False","False","Support my channel by playing Mobile Legends: Adventure: http://bit.ly/MLAxFaZeJarvis Use my code: 69NHGN2223W for an exclusive bonus: 5 Premium Summon Scrolls. Redemption of bonus code is up to 2000 players.We went to twitch gaming streamers and donated a lot of money in various ways. A lot of the streamers we picked are Fortnite streamers. featuring   @FaZe Nikan @TeaWap  . This is part of my ongoing Fortnite Donating To Twitch Streamers series.🕺 TikTok: @jarvis📸 Instagram: @fazejarvis🐦 Twitter: @liljarviss"
"dYzzGVu1K3Q","Jake Paul vs Ben Askren [LIVE] PPV Preview","2021-04-18T01:17:54Z","UCcgVECVN4OKV6DH1jLkqmcA","Jake Paul","22","21.18.04","jake paul|mini jake paul|jake paul pranks|logan paul|jake paul scary vids|team 10|morgz|lucas and marcus|jake paul song|its everyday bro|scary clowns","2624634","45699","3628","2692","https://i.ytimg.com/vi/dYzzGVu1K3Q/default.jpg","False","False","Watch my fight on https://www.thefightclub.com/ APRIL 17TH #TrillerFightClubJOIN MY CLOSE FRIENDS LIST NOW!: https://www.friendshavebenefits.com/ more on my IG: https://www.instagram.com/jakepaul/TWITTER ➤  http://twitter.com/JakePaul ⚠ WARNING ⚠Please be warned (and we cannot possibly stress this enough); under no circumstances should any challenges, stunts, or pranks be attempted by any of our viewers. All challenges, stunts, and pranks are performed by trained professionals in a controlled environment and are for entertainment purposes only. Again, do not try anything you see in this content at home and always consult a parent or adult with any questions or concerns."
"jh9660906z8","Qualifying Highlights | 2021 Emilia Romagna Grand Prix","2021-04-17T14:13:40Z","UCB_qr75-ydFVKSF9Dmo6izg","FORMULA 1","17","21.18.04","F1|Formula One|Formula 1|Sports|Sport|Action|GP|Grand Prix|Auto Racing|Motor Racing|Imola|Emilia Romagna|Qualifying|Lewis Hamilton|Sergio Perez|Max Verstappen|Lando Norris|Red Bull Racing","3327688","72713","1059","6141","https://i.ytimg.com/vi/jh9660906z8/default.jpg","False","False","Catch up with highlights from a scintillating qualifying session at Imola, where less than half a second covered the top 8 drivers!For more F1® videos, visit http://www.Formula1.comFollow F1®:http://www.instagram.com/F1https://www.facebook.com/Formula1/http://www.twitter.com/F1https://www.twitch.tv/formula1https://www.tiktok.com/@f1#F1 #ImolaGP"
"ylVylyurV84","The World Cup of Takeaways (MUKBANG)","2021-04-16T18:31:01Z","UCQ-YJstgVdAiCT52TiBWDbg","ChrisMD","24","21.18.04","w2s|sidemen|stephen tries|mukbang|takeaway|chrismd|willne","1139511","85622","334","2305","https://i.ytimg.com/vi/ylVylyurV84/default.jpg","False","False","Stephen: https://www.youtube.com/channel/UCRmmd8tl3sT96cqDynL4QggWill: https://www.youtube.com/user/BettySchwallocksHarry: https://www.youtube.com/user/wroetoshaw► No.10 Clothing: https://no10.store/► Follow my Instagram: http://instagram.com/chrismd10► Follow me on Twitter: https://twitter.com/chrismd10My editor: https://twitter.com/conFmckMusic by Epidemic Sound (http://www.epidemicsound.com) & others."
"wqCAeEf3s9o","Anthony Joshua's Personal Message From Tyson Fury | The Jonathan Ross Show","2021-04-17T21:45:01Z","UCgurmV2nVq_1DUb2pvGOKmg","The Jonathan Ross Show","24","21.18.04","The Jonathan Ross Show|ITV|Jonathan Ross|Wossy|Rossy|chat show|jonathan ross chat show|live|hollywood|celebrity|music|british|UK|Anthony Joshua|Tyson Fury|Boxing|Fighting|Heavyweight|strongest man|British Boxing|Wembley|Gypsy King|Deontay Wilder|Wladimir Klitschko|Olympic Boxing|world champion|world title|knock out|video message|WBA|IBF|WBO|IBO","137635","1994","33","589","https://i.ytimg.com/vi/wqCAeEf3s9o/default.jpg","False","False","Tyson Fury sends an exclusive video to Anthony Joshua before their £200million mega-fight.#TheJonathanRossShow #AnthonyJoshua #TysonFurySubscribe to The Jonathan Ross Show YouTube channel for weekly videos and the best bits from the show - http://www.youtube.com/TheJonathanRossShowFollow the show on Twitter: https://twitter.com/JRossShowLike the show on Facebook: https://www.facebook.com/TheJonathanRossShow"
"L6GiPS_KZos","Mega Pokemon Battle Royale (Loud Sound/Flashing Lights Warning) ☄️ Collab With @Lockstin & Gnoggin","2021-04-18T00:15:03Z","UCLFXk9J3O-hhOk0msOjKYdQ","TerminalMontage","20","21.18.04","terminalmontage|terminal|montage|jeremey|jer|chinshue|nintendo|animation|cartoon|animated|something|about|cartoon violence|fighting|action|meme|parody|comedy|funny|loud|screaming","1773574","164822","729","17981","https://i.ytimg.com/vi/L6GiPS_KZos/default.jpg","False","False","We're running the simulation again! This time it's.. A Mega Pokemon Battle Royale!! Who will win?? Be sure to watch Lockstin's analysis here: https://www.youtube.com/watch?v=cNla5PEJFeIhttp://www.TerminalMontage.comPatreon: https://www.patreon.com/sidequests Twitter: https://twitter.com/TerminalMontageFacebook: https://www.facebook.com/TerminalMontage/Instagram: https://www.instagram.com/jeremeyyyyyy/Merch: https://terminalmontagemerchportal.weebly.com/Writing by Lockstinyoutube.com/user/Lockstin2https://www.patreon.com/GnogginAnimation, Additional Coloring, Sound Design, Writing, Voice of Gallade by Jeremey Chinshuehttps://twitter.com/JeremeyChinshueBackground Art & Coloring by Edgar Nielsenhttps://twitter.com/funymonyhttps://www.mediamuffin.com/Chelsea Livingstone (Colonel Cheru) as Redhttps://twitter.com/ColonelCheruhttps://www.twitch.tv/colonelcheruAgent J voiced by TTSDemo Jameshttps://ttsdemo.com/Music Used:Pokemon Black & White - Battle! Elite Four (CPS-2 Remix) By TheLegendOfRenegadehttps://www.youtube.com/watch?v=P8woBuE3cL4Coffin Dance Meme Song (FREE Midi File, Stems & Ableton File) By DixonBeats https://www.youtube.com/watch?v=tG9MJeuhQQg (I applied the Goldeneye 64 Soundfont to the Midi)Pokemon Ruby/Sapphire/Emerald - Team Aqua/Magma Grunt Battle (Genesis Version) By MyNewSoundtrackhttps://www.youtube.com/watch?v=xo5jZX5RTdcPokemon Diamond & Pearl - Contest Victory Midi (Pokemon Emerald Soundfont) Pokemon Diamond & Pearl - Jubilife City [Daytime] (Sega Genesis Remix) By TheLegendOfRenegadehttps://www.youtube.com/watch?v=ZuLzXMu8Gv0Credits theme; Garden Stage by Jattello https://youtu.be/WSDSCWLkaXE?t=2679For business inquiries and questions email us at:AskTerminalMontage@gmail.comTERMINALMONTAGE ® SOMETHING SERIES®Registered in the U.S. Patent and Trademark Office.© TERMINALMONTAGE LLC. All Rights Reserved. For additional legal information, please see: https://terminalmontageportal.weebly.com/legal-notices-and-disclaimers.html#SomethingSeries #Pokemon #BattleRoyale #Royale #Nintendo #Parody #Animated #Animation #Cartoon"
"OdYWnSZ2rWc","Queen bids farewell to Prince Philip at funeral","2021-04-17T15:24:20Z","UCoMdktPbSTixAyNGwb-UYkQ","Sky News","25","21.18.04","sky|news|queen|prince|philip|national|anthem|prince philip|funeral|service|procession|st|george|george's|chapel|windsor|castle|duke|edinburgh|plan|live|coverage|arrivals|elizabeth|harry|william|charles|andrew|family|royal|royals|military|proceedings|watch","2662057","20219","1011","0","https://i.ytimg.com/vi/OdYWnSZ2rWc/default.jpg","True","False","The Queen led the Royal Family in mourning Prince Philip at his funeral service. She sat alone due to coronavirus restrictions. SUBSCRIBE to our YouTube channel for more videos: http://www.youtube.com/skynews Follow us on Twitter: https://twitter.com/skynews  Like us on Facebook: https://www.facebook.com/skynews Follow us on Instagram: https://www.instagram.com/skynews For more content go to http://news.sky.com and download our apps:  Apple: https://itunes.apple.com/gb/app/sky-news/id316391924?mt=8 Android https://play.google.com/store/apps/details?id=com.bskyb.skynews.android&hl=en_GBSky News videos are now available in Spanish here/Los video de Sky News están disponibles en español aquí https://www.youtube.com/channel/UCzG5BnqHO8oNlrPDW9CYJog"
"SCz4iKNF-EA","Queen Arrives at Windsor Castle and Funeral Procession Begins","2021-04-17T14:39:51Z","UCCvgLV2Ixb8KCemj-UtXZ-g","The Royal Family Channel","25","21.18.04","royal family|prince philip|queen elizabeth|united kingdom|duke of edinburgh|queen elizabeth ii|prince philip funeral|royal family channel|royal family funeral|prince philip funeral live|prince philips funeral|duke of edinburgh funeral|duke of edinburgh funeral live|funeral procession|prince philip funeral 2021|prince philip funeral procession|prince charles|prince william|prince harry|prince edward","8455911","56486","3893","5476","https://i.ytimg.com/vi/SCz4iKNF-EA/default.jpg","False","False","Queen Elizabeth II and other members of the Royal Family, including Prince Charles, Prince Edward, Prince Andrew and Princess Anne, joined a procession on Saturday at Windsor Castle ahead of the funeral for Prince Philip.The service will salute both his service in the Royal Navy and his support for Britain's monarch over three quarters of a century.#Queen #PrincePhilip #Funeral"
"kNGueZmEuUM","Jumping 6323 Blocks to Break a Minecraft Record","2021-04-17T17:28:16Z","UCexHwo25wa-LYbVLEamy4BQ","Dom","20","21.18.04","dom|bigboydom|bigboydom yt|dom record|dom Minecraft|minecraft world record|Breaking Records|Speedrunning|Jumping 6323 Blocks to break a Minecraft World Record|I Spent 24 hours Breaking Siege World Records|gaming records|gaming|challenge|WR|Tallest Staircase|Longest Bridge|Most Double Jumps|Breaking Minecraft World Records","521416","18936","442","875","https://i.ytimg.com/vi/kNGueZmEuUM/default.jpg","False","False","Jumping 6323 Blocks to Break a Minecraft Record. This was one out of 6 records of the Minecraft Records I broke in this video.Follow me right now:•twitter @BigBoy_Dom•instagram @bigboydom•twitch @bigboydomSUBSCRIBE TO THESE LEGENDS:@Marley @Lt Custard Watch more of me breaking records - https://www.youtube.com/watch?v=wsjXqRZcSaE&list=PLD5rFCtnxOsTGg4liUUVmtyf7wrYJYMRbAfter Spending 24 Hours Breaking Siege World Records I thought I would attempt to break some Minecraft World Records. Not only did I brake the furthest distance jumped in Minecraft, I also got the furthest distance ran in 60s, fastest crafting of 10 tools, longest Minecraft Bridge, Tallest staircase built in 60s and most iron golems built in 60s. Like for a face reveal."
