video_id,title,publishedAt,channelId,channelTitle,categoryId,trending_date,tags,view_count,likes,dislikes,comment_count,thumbnail_link,comments_disabled,ratings_disabled,description
"Xhzk5dpPQCY","11 человек убили в школе города Казань","2021-05-11T09:32:23Z","UCSqO8lV-ric7ow5G5q9roWw","ВОТ ТАК","25","21.13.05","Казань|подросток|Школа|стрельба|перестрелка|убиты|застрелены|Татарстан|Россия|новости|Ильназ Галявиев|спецназ|МВД|Рустам Минниханов|гимназия №175|Оружие|Новости|Росляков|Hatsan ESCORT|новости мира|последние новости","383493","2953","247","947","https://i.ytimg.com/vi/Xhzk5dpPQCY/default.jpg","False","False","В результате стрельбы 11 человек погибли и 13 получили раненияПо даным экстренных служб, число погибших при стрельбе в школе в Казани выросло до 11. Также сообщается, что 12 школьников и один взрослый доставлены в больницу. Telegram-каналы писали, что четверо пострадавших находятся в реанимации. Ранее стало известно, что в квартире на улице Туганлык, где находилась мать нападавшего, произошел взрыв. При задержании Галявиев сообщил, что заложил там бомбу. Отец Ильназа не знает, жива ли она, они сегодня собирались увидеться, но созвониться не успели.Предполагается, что подросток действовал вместе с сообщником. Он может оставаться в здании школы, уточнял источник «Интерфакса». Его заблокировали на одном из этажей.Второй нападавший на школу в Казани убит, сообщил источник ТАСС. Его имени пока не раскрывают. В учебном заведении работает спецназ.Напомним, что первым нападавшим был бывший учащийся гимназии Ильназ Галявиев. МВД подтвердило его задержание.Коллаж из фото: Наш сайт – https://belsat.eu/Подписывайтесь на наши каналы:БЕЛСАТ NEWS – https://goo.su/50k3ВОТ ТАК – https://goo.su/50K3БЕЛСАТ LIFE – https://goo.su/50k2ЖЭСТАЧАЙШЫЙ МУЛЬТ - https://goo.su/50K5БЕЛСАТ NOW – https://goo.su/4yPdБЕЛСАТ HISTORY – https://goo.su/50K4БЕЛСАТ MUSIC – https://goo.su/50k5BIEŁSAT PL – https://goo.su/50k7BELSAT ENGLISH – https://goo.su/50K7БЕЛСАТ DOC – https://goo.su/4YpBПодписывайтесь на наши социальные сети:Па-беларуску:Instagram – https://goo.su/50k8 Facebook – https://goo.su/50K8 Vkontakte – https://goo.su/50k9Twitter – https://goo.su/50K9Odnoklassniki – https://goo.su/50ka Telegram – https://goo.su/50kATikTok – https://goo.su/5FBhПо-русски:Instagram – https://goo.su/4yu9  Facebook – https://goo.su/4YU9Vkontakte – https://goo.su/4yuATwitter – https://goo.su/5fbiPo polsku:Instagram – https://goo.su/50kbFacebook – https://goo.su/50kB Twitter – https://goo.su/50Kb In english:Twitter – https://goo.su/50KBПо всем вопросам – belsat.eu@gmail.com#Казань #Татарстан #стрельба"
"Vrj1cgrP5f4","САМАЯ БЮДЖЕТНАЯ КУХНЯ своими руками ПРЕОБРАЖЕНИЕ ГАРНИТУРА установка раковины Сочетаю СТАРОЕ и НОВОЕ","2021-05-12T17:20:02Z","UCYCtV8AA0NbLSbCJkeaNvdw","tanya leto","22","21.13.05","ремонт|кухня|как сделать столешницу|ремонт кухни|переделка|как поставить столешницу|установка раковины|преображение кухни|бюджетный ремонт|самая бюджетная кухня|кухонная столешница|кухонные фасады|идеи|идеи ремонта|таня лето|новое видео|влог|влоги|врезка раковины|своими руками|ремонт своими руками|как установить раковину","52591","0","0","436","https://i.ytimg.com/vi/Vrj1cgrP5f4/default.jpg","False","True","Ура! Столешница и раковина!Дорогие друзья, сегодня о том, как  БЮДЖЕТНО преобразить СТАРЫЙ КУХОННЫЙ ГАРНИТУРРациональное использование и экономный подходКРАСИВЫЙ ТЕКСТИЛЬ для дома и интерьера здесь:Сайт ВАСИЛЁК https://ivanovskij-trikotazh.ruВАСИЛЁК Одноклассники https://ok.ru/group/57159063568608ВАСИЛЁК Инстаграм https://www.instagram.com/lyubimyj_vasilek/ВАСИЛЁК ВКонтакте https://vk.com/vasilek_trikotazh МОЙ НОВЫЙ КАНАЛ здесь: https://www.youtube.com/channel/UCm35waTLCVxh7qqnqfLTAEA/featuredЯ в ИНСТАГРАМ https://www.instagram.com/tanyaleto1/?hl=ruГруппа ВКонтате https://vk.com/club102228570 ВИДЕО КАК ПОКРАСИТЬ и изменить форму КУХОННЫХ ФАСАДОВ https://www.youtube.com/watch?v=t0E-laKtdVw&t=67s"
"CRaOeeReMzs","Невзоров.Невзоровские среды на радио Эхо Москвы. Терракт в Казани, Путин, Шойгу и наркоманы.","2021-05-12T19:36:15Z","UC8kI2B-UUv7A5u3AOUnHNMQ","Александр Невзоров","25","21.13.05","Nevzorov|Новости и политика|Александр Невзоров|Соловьев|эхо москвы невзоровские среды|невзоровские среды последний выпуск|эхо москвы|Невзоровские среды последний выпуск|nevzorov.tv|новости|новости дня|новости и политика сегодня|Навальный|Путин|навальный|Война|Беларусь|Выборы|Главврач|выводы Совета безопасности и «этнооружие»|бурятский театр оперы и балета|Казанский стрелок|Донбасс|Шойгу|Жириновский|Ургант|Армия|Лукашенко","640172","36171","1066","2841","https://i.ytimg.com/vi/CRaOeeReMzs/default.jpg","False","False","#невзоровскиесреды #эхомосквы🔴 книги с автографом, сувениры,  «Расчленинград»  по ссылке: https://shop.nevzorov.tv/product/kalendar-razvitiya-2021/   🔴 Билеты на Невзоровские среды ,  книги с автографом, мерч Невзорова и аудиокниги:  «Искусство Оскорблять» и «Уроки атеизма»  здесь: https://shop.nevzorov.tv Главврач в лесу, Шойгу и наркоманы, расстрел в Казани - кто виноват, вакханалия маразма, парад и хобби Президента, реакция Китая, хоккей Путина, выводы Совета безопасности и «этнооружие», бурятский театр оперы и балета, веселая Питерщена, решение Лукашенко, Единая Россия и Донбасс, Патрушев и клевета на Ивана Грозного.00:00 - начало00:21 - Александр Невзоров из Петербурга, из гостиницы 'Гельвеция' 01:00 - где надо искать хорошего министра здравоохранения04:35 - наш министр обороны вдругчуть не отменил всеобщий призыв05:12 - как можно не стать капелланом09:11 - психические расстройствана почве религиозно-мистических переживаний14:20 - Пальто (!!!) уползает под музыку К.Бадельта и Х.Циммера20:28 - .. во всём виноват Женя Ройзман..21:18 - российские йоги предложили передовые методы защиты от COVID1922:57 - индийский штамм вируса и Мукоромикоз23:26 - будут ли губернаторы работать 'от сети' - ? ..24:57 - Дегтярёв выбрал себе challenge26:19 - знания должны стать собственным компонентом на уровне обмена веществ29:46 - продолжение эфира после перерыва на новости33:06 - как похоронить любые надежды пацифистов-гуманистов36:06 - какие бывают 'придворные' хобби39:05 - истинно коварные планы западной буржуазии40:45 - 'il concerto grosso' в Бурятскомтеатре оперы и балета44:15 - чего хочет 'режим' 46:30 - 'народ уже ничего не решает, но пока ещё реагирует'.. 47:12 - Питерские квесты49:12 - можно ли свергнуть диктатора через пристыживание - ?53:15 - жители Донбасса и голосование.54:32 - реабилитируем(!!!), уже наконец, Ивана Грозного... 56:05 - Большое Спасибо за эфир! 56:17 - P.S.🔴   Инстаграм: https://www.instagram.com/nevzorovofficial/?hl=ru🔴   Телеграм: https://t.me/nevzorovtv   ▪️ Твиттер: https://twitter.com/nevzorovag ▪️ Фейсбук: https://ru-ru.facebook.com/nevzorovanevzorov/▪️  ВКонтакте: https://vk.com/nevzorovofficial▪️ Невзоровский Кружок - https://t.me/Nevzoroff▪️ Л. Невзорова  https://www.instagram.com/lydianevzorova/?hl=en▪️Невзоров сын: https://instagram.com/nevzorov_junior?igshid=r34f556jqdk2Невзоров. Невзоровские среды"
"Othd8W8o3t0","Веном 2 – официальный трейлер","2021-05-10T13:00:08Z","UCKgFtx79Z1R61PQSB_XDUfA","SonyPicturesRU","1","21.13.05","[none]","3411187","76079","2519","4221","https://i.ytimg.com/vi/Othd8W8o3t0/default.jpg","False","False","В кино с 16 сентября! Том Харди возвращается на большие экраны в роли Венома - одного из величайших и самых противоречивых героев вселенной MARVEL. Режиссером продолжения стал Энди Серкис, главные роли также сыграли Мишель Уильямс, Наоми Харрис и Вуди Харрельсон - суперзлодей Клетус Кэседи/Карнаж.Студия: Columbia Pictures, MARVELЖанр: приключенческий экшнРежиссёр: Энди СеркисВ ролях: Том Харди, Мишель Уильямс, Наоми Харрис, Рейд Скотт, Стивен Грэм и Вуди ХаррельсонПрокатный рейтинг: 16+"
"rr697Rq0rtQ","ВОТ ЧТО ПРОИЗОШЛО НА САМОМ ДЕЛЕ В КАЗАНИ.ШЕВЧЕНКО ОТКРЫЛ СТРАШНУЮ ТАЙНУ КОТОРУЮ СКРЫВАЕТ ...","2021-05-12T11:31:23Z","UCMHxWdKv8Fth8gz6ZfN_CIQ","Антиплатон","25","21.13.05","Казань|стрельба|школа|Ильназ|Галиев|11 мая|2021|стрелок|казань|максим|шевченко","194159","17562","423","2203","https://i.ytimg.com/vi/rr697Rq0rtQ/default.jpg","False","False","Источник: Максим Шевченко: https://www.youtube.com/watch?v=ByxswS-ngfQ&t=156sСтаньте спонсором канала, и вы получите доступ к эксклюзивным бонусам. Подробнее:https://www.youtube.com/channel/UCMHxWdKv8Fth8gz6ZfN_CIQ/join=======ПОДДЕРЖИТЕ КАНАЛ=======💲Донат: http://www.donationalerts.ru/r/antiplaton🚚 Подпишись на канал Антиплатон: http://qps.ru/cVO70 ►►►►►►►►►►►►►►►►►►►►►►по вопросу рекламы standapers@gmail.com"
"yg6D34_ot7E","ШКОЛЬНИК УКРАЛ ЧАСЫ ЗА 7 МИЛЛИОНОВ РУБЛЕЙ И СЕЛ В ТЮРЬМУ","2021-05-12T12:00:32Z","UC5Ob2zi4pkJfra-kdcmG99w","Vashchenko Live","22","21.13.05","школьник|школьник украл|украл часы|школьник в тюрьме|сел в тюрьму|фильм|сериал|ващенко|макс ващенко|ШКОЛЬНИК|ШКОЛЬНИК УКРАЛ|ШКОЛЬНИК СЕЛ|ЗА 7 МИЛЛИОНОВ|МИЛЛИОНОВ РУБЛЕЙ|СЕЛ В ТЮРЬМУ|УКРАЛ|УКРАЛ ЧАСЫ|ШКОЛЬНИК В ТЮРЬМЕ|КРАЖА|ШКОЛЬНИКИ|школьники","363472","35787","675","1285","https://i.ytimg.com/vi/yg6D34_ot7E/default.jpg","False","False","ШКОЛЬНИК УКРАЛ ЧАСЫ ЗА 7 МИЛЛИОНОВ РУБЛЕЙ И СЕЛ В ТЮРЬМУКто хочет зарабатывать: https://avalon-company.pro/?ref=vaschenkolМЫ ПОКОНЧИЛИ С МАНЬЯКОМ:  https://tlgg.ru/vashchenko_maxОПАСНЫЕ МОМЕНТЫ В ИСТОРИЯХ МОЕГО ИНСТАГРАМА: https://www.instagram.com/max_vashchenkoЯ ВКОНТАКТЕ: https://vk.com/max.vashchenko/Я В ТИК-ТОКЕ: http://vm.tiktok.com/8NQdKh/ОФИЦИАЛЬНАЯ ГРУППА ВК: https://vk.com/vashchenkopubПОДПИСЫВАЙСЯ ВКОНТАКТЕ : https://vk.com/max.vashchenkoМОЙ ВТОРОЙ КАНАЛ: https://www.youtube.com/channel/UC5Ob2zi4pkJfra-kdcmG99w::::::::::::::::::::::::::::::::::::::::::::::::::::::::::::::::::::::::::::::::::::::::::::::Реклама/Сотрудничество: k1noman@mail.ru::::::::::::::::::::::::::::::::::::::::::::::::::::::::::::::::::::::::::::::::::::::::::::::МОИ ВИДЕО - https://www.youtube.com/channel/UCqtzZMiZ5Bng7HCxI6154gg?sub_confirmation=1"
"3ShdrRgmwjg","1 ПРЕДАТЕЛЬ VS 100 МИРНЫХ ИГРОКОВ * АМОНГ АС В РЕАЛЬНОЙ ЖИЗНИ *","2021-05-11T15:58:11Z","UCM44x9uWlx__9M9Y2IFhxzQ","HiMan","24","21.13.05","амонг ас|в реальной жизни|100 игроков|против|1 предатель|100 игроков против 1 предатель|амонг ас в реальной жизни|among us|хаймен|химан|himan|интересное видео|подписчики","1391132","139646","2581","4429","https://i.ytimg.com/vi/3ShdrRgmwjg/default.jpg","False","False","🔥 Смотри первую серию Хостела - https://youtu.be/t5-4HtWJ9iwПодпишись и получи шанс выиграть IPHONE 12👆Правила конкурса! Для участия в конкурсе достаточно просто написать под серией «Я ОТ ХАЙМЕНА! ХОЧУ АЙФОН! 13:06. 13:06 - это таймкод, где обнаружили ту самую КОРОБКУ. В первой серии - это 13:06. В других сериях - вам нужно найти самим! Вам не нужно ГАДАТЬ, что в коробке (как я сказал в своём видео). Просто пишите, что вы хотите АЙФОН!Буду рад твоей подписке(мой канал)! ☛ https://vk.cc/9gpGxv ☚❶ INSTAGRAM ☛ https://goo.gl/mnv4ZZ ☚Стать спонсором : https://www.youtube.com/channel/UCM44x9uWlx__9M9Y2IFhxzQ/joinЯ позвал 100 мирных игроков, чтобы сыграть с ними в Амонг Ас реальной жизни . В игре будет всего лишь 1 предатель. Задача предателя убрать всех участников, а задача мирных игроков определить, кто является предателем."
"9xinP8ffioE","Знакомые — об убитой в казанской гимназии учительнице английского Эльвире Игнатьевой","2021-05-12T11:12:14Z","UCVSw9pZrmStZAgQQSz5RQKA","Life Новости","25","21.13.05","новостной|политика|lifenews|life|news|новости|тв|телеканал|сюжет|известия|СМИ|tv|важное|срочное|срочно|важно|россия|russia|вмире|мире|мир|актуально|ютюб|первые","282446","4817","82","599","https://i.ytimg.com/vi/9xinP8ffioE/default.jpg","False","False","Она закрыла своим телом ребёнка. Она спасала детей. Сказала детям: Прощайтесь. Первая пуля попала ей в голову сразу. Потом остальных детей расстреливал. Коллеги и близкие рассказывают об убитом преподавателе английского Эльвире Игнатьевой. Девушка была замужем. В свои 26 лет она уже заняла второе место на местном конкурсе Учитель года и готовилась к всероссийскому этапу. Подпишитесь на канал Life | Новости - https://goo.gl/7MElrHСмотрите также:Viber - https://viber.com/lifenewsruТелеграм— https://t.me/LshotICQ - https://icq.com/chat/AoLEmf1sCS3TP_VTVRUОфициальный сайт  http://Life.ru/➤Life в Vk - https://vk.com/life➤Life в Twitter - https://twitter.com/lifenews_ru➤Life в OK.ru - https://ok.ru/lifenews➤Life в Facebook - https://www.facebook.com/lifenews.ruLife – первый по срочным новостям! Эксклюзивные видео по самым главным темам дня, прямые включения с мест событий, топовые ньюсмейкеры в студии – главные особенности Life"
"nDrkqkPUILA","Я КУПЛЮ ВСЕ, что ТЫ НАРИСУЕШЬ ЧЕЛЛЕНДЖ / с Миланой Хаметовой","2021-05-11T09:02:50Z","UC5C2bbzS3oPCMpHWc6IEKWQ","Elsa Arca","22","21.13.05","челлендж|хо тим|хо|разрисовываю все|разрисовываю|рисование|кастом|рисую челлендж|эльза рисует|эльсарка|елсарка|elsarca|ПОКУПАЮ ВСЕ ЧТО НАРИСУЕТ МИЛАНА|милана хаметова|дава|дочка давы|покупаю все что нарисует|покупаю все что нарисует челлендж|айфон|рисую айфон|покупаю все челлендж|покупаю айфон|рисую сладости|рисую вещи","317213","11540","1121","2472","https://i.ytimg.com/vi/nDrkqkPUILA/default.jpg","False","False","Видео Миланы- https://youtu.be/x-WU5kVl7DgВ этом видео Я КУПЛЮ ВСЕ, что ТЫ НАРИСУЕШЬ ЧЕЛЛЕНДЖ приняла участие МИЛАНА ХАМЕТОВА.Мы приехали в торговый центр, и суть челленджа в том, что МИЛАНА рисует ВСЕ ЧТО хочет, а я это ПОКУПАЮ. Это видео получилось очень смешным. МИЛАНА нарисовала все: от еды до айфона. ДОСМОТРИ ДО КОНЦА этот ПОКУПАЮ ВСЕ ЧТО НАРИСУЕТ челлендж , чтобы увидеть какие вещи я оплатила и сколько денег я потратила!Инст: https://www.instagram.com/elsarca/TikTok: https://www.tiktok.com/@elsarca?#хотим #кастом #elsarca"
"8X0e2KvisjU","Стрельба в школе Казани: не менее 11 погибших","2021-05-11T10:17:56Z","UC44FxW3p7A-0r86D5BJL2FA","NTDRussian","25","21.13.05","NTD|NTDTV|новости|New|news|мир|новости мира|происшествия|вести|бизнес|политика|интервью","94795","718","135","203","https://i.ytimg.com/vi/8X0e2KvisjU/default.jpg","False","False","Подписывайтесь на Телеканал NTD —https://www.youtube.com/NTDRussianFacebook — https://www.facebook.com/NTDRussian/Vkontakte — https://vk.com/ntdrussianTwitter — https://twitter.com/NTDRussianTelegram — https://t.me/ntdtvAndroid - https://play.google.com/store/apps/details?id=ru.ntdtv.fol.ror_app_ntdtv"
"LS2KX4Tb5ug","Только Что Сообщили..Она Скончалась Утром 12 Мая","2021-05-12T10:37:07Z","UC-nrc93CxokB5jMFFNKTqTA","EnergyStar News","22","21.13.05","кино|режиссер|культура|новости шоу бизнеса|последние новости|шоу бизнес|актеры|актрисы|новости шоу бизнеса сегодня|новости шоу бизнеса 2020|последние новости шоу бизнеса|театр|спектакли|траур|актер|шоу-бизнес|знаменитости|звезды|скандал|новости|шоу бизнес сегодня|российские звезды|скандалы|сенсации|наследство|новости звезд|новости о звездах|андрей малахов|в прямом эфире|русские сериалы|Только Что Сообщили..Она Скончалась Утром 12 Мая","622536","4362","1829","302","https://i.ytimg.com/vi/LS2KX4Tb5ug/default.jpg","False","False","Подписывайтесь на наш канал, ставьте лайк и не забудьте нажать на колокольчик, чтобы не пропускать новые видео!#новости​​​​​​​​​​​​​​​​​​​​ #знаменитости​"
