video_id,title,publishedAt,channelId,channelTitle,categoryId,trending_date,tags,view_count,likes,dislikes,comment_count,thumbnail_link,comments_disabled,ratings_disabled,description
"yALoy13mmz8","Baking Soda & Ketchup Explosion?! 😳 - #Shorts","2021-05-11T01:33:51Z","UCAatjI5Yc8o7WZcHDbNw7eA","Cam Casey","22","21.13.05","science|comedy|viral|tiktok|tiktoks|shorts|viral shorts|wait|wait for it|science experiment|easy science|baking soda|ketchup|food|cam casey","12680424","472700","21429","2835","https://i.ytimg.com/vi/yALoy13mmz8/default.jpg","False","False","Hey guys this is my 115th #Shorts​ video on here! I will definitely be uploading more of these if you enjoy! Thanks so much and I love you all!Today I tried using ketchup and baking soda to make it explode!! It was super fun! Hope you enjoy!Don't forget to subscribe :)TEXT ME! (847) 278-0556Follow me on instagram: https://www.instagram.com/itscamcasey...​Follow me on TikTok: https://www.tiktok.com/@itscamcasey?l...​ALL THE GEAR I USE TO MAKE VIDS:The Camera I Use: https://amzn.to/35ZGFXL​The Lense I Use: https://amzn.to/3jZaPzb​Cheap Version of the Lense I Use: https://amzn.to/3enRhTZ​The Big Lense I Use: https://amzn.to/3jXY3RA​Cheap Version of the Big Lense I Use: https://amzn.to/34RNoUc​BEST Tripod For TikToks: https://amzn.to/3kWiQXc​The Camera Tripod I Use: https://amzn.to/3jSziXa​The BEST Ringlight: https://amzn.to/3oX1v2z​The Studio Lights I Use: https://amzn.to/2I5npQB​The GoPro I Use: https://amzn.to/2I0ifW0​Super High Quality SD Card I Use: https://amzn.to/3kWYUTQ​Another Cheaper SD Card I Use: https://amzn.to/36gTNYT​The Computer I Use To Edit: https://amzn.to/3emrgEN​DRONE that is awesome!! https://amzn.to/3jV7hy7​Phone That Shoots My TikToks! https://amzn.to/3l0bVfy​Phone Case I Use: https://amzn.to/3l7Prco​If you read all this I love you :)FUNNIEST VIDEOS 2021FAIL VIDEOS 2021BEST PRANKS 2021BEST MOMENTS 2021FUNNY VIDEOS 2021BEST VIDEOS 2021PRANK GAME HOMEAT HOMEDIY FUNTIKTOKTIKTOKERSSODA COKE AND MENTOSEGGSatisfying TikTokDIYDo it yourselfHomemade DROP TEST100 mini balloonsBalloonsSODASODA life hackcoke life hacksodacokecoke and mentosmagicmagic trickparty trickeasy magicPrankmompranksmomscomedy mom fails MansionHide & SeekBig houseCharli damelioAddison RaeTikTokersTikTok Drama⚠️ WARNING ⚠️Please be warned; under no circumstances should any activities, stunts, challenges, or pranks in our content be replicated or attempted in any capacity by any of our viewers. All activities, stunts, challenges, and pranks are performed by trained professionals and/or actors in a controlled environment and are for entertainment purposes only. Again, do not replicate anything you see in our content at home!"
"o6tYc8khbEM","BRITS 2021: Little Mix React to Best British Group Win at The Brits!","2021-05-11T20:52:17Z","UCXM_e6csB_0LWNLhRqrhAxg","On Demand Entertainment","24","21.13.05","perrie edwards|jade thirwall|leigh-annepinnock|brits|little mix|jade thirlwall|little mix reaction|the brits 2021|the brits awards 2021|the brits 2021 performers|the brits 2021 little mix|the brits 2021 red carpet|the brits little mix|little mix interview|little mix pregnant|little mix touch|jade thirlwall interview|brit awards|brit awards 2021|brit awards 2021 red carpet|brits 2021 little mix|jack whitehall little mix|leigh-anne pinnock|brits 2021","75250","4068","24","224","https://i.ytimg.com/vi/o6tYc8khbEM/default.jpg","False","False","Little Mix make history at The Brits! They talk female empowerment & 2022 tour plans whilst celebrating their win! 'Next year it's gonna go OFF!'#LittleMix #TheBrits #Brits2021Report by Jodie Mccallum."
"-jdVyvuFC0A","The National Lottery ‘Lotto' draw results from Wednesday 12th May 2021","2021-05-12T19:04:37Z","UCnOiv4Hp3fu43NDHl335cvQ","The National Lottery","24","21.13.05","Lotto|National Lottery|The National Lottery|Lotto results|The National Lottery results|The National Lottery show|Live stream|Live","68049","169","36","0","https://i.ytimg.com/vi/-jdVyvuFC0A/default.jpg","False","False","The National Lottery draw results for Lotto recorded and streamed live at 8pm on Wednesday 12th May 2021. Rules and Procedures (and Account Terms if playing online) apply. Players must be 18+ and physically located in the UK or IoM.To enter the next available draw, visit http://www.national-lottery.co.uk/games/lotto/You can also check your Lotto tickets on our website:http://www.national-lottery.co.uk/results/lotto/checker"
"WsvPp0RahHA","HIGHLIGHTS | Canelo Alvarez vs. Billy Joe Saunders","2021-05-09T05:05:29Z","UCurvRE5fGcdUgCYWgh-BDsg","DAZN Boxing","17","21.13.05","dazn|boxing|highlights|full fight|ko|knockout|ryan garcia|top 10|canelo|anthony joshua|ggg|haney|Canelo|Alvarez|Mexico|Billy Joe Saunders|Saunders Canelo|Canelo Saunders|DAZN|Fight Night|British|Mexican","11565385","153815","6213","20504","https://i.ytimg.com/vi/WsvPp0RahHA/default.jpg","False","False","May 8, 2021 -- Canelo vs. Saunders from AT&T Stadium in Arlington, TexasSubscribe to our YouTube channel 👉  http://bit.ly/DAZNBoxingYouTubeDownload the DAZN app now 👉  http://bit.ly/DAZNYoutubeFollow DAZN Boxing On Social Media 👇Twitter: https://www.twitter.com/DAZNBoxingInstagram: https://www.instagram.com/DAZNBoxingFacebook: https://www.facebook.com/DAZN"
"0Rdg3ejpCCA","“Sent Him for a Hot Dog! 🤣 | Foden & Phillips React to Insane Grassroots Goals | England Reacts","2021-05-11T11:00:00Z","UCNT2e7Og56vm5_V-yJWvglA","England","17","21.13.05","england|england football|england reacts|phil foden|phil foden england|kalvin phillips|kalvin phillips england|foden and phillips|foden and phillips reacts|phil foden funny|kalvin phillips funny|three lions|england mens|england goal reactions|grassroots goal reactions|england grassroots goals reactions|foden reacts|phillips reacts|phil foden reacts|kalvin phillips reacts|foden england|phillips england","212421","5580","38","245","https://i.ytimg.com/vi/0Rdg3ejpCCA/default.jpg","False","False","Phil Foden and Kalvin Phillips sit down to watch some of the best grassroots goals and skills! Which was your favourite? Let us know in the comments down below 👇Thank you to http://twitter.com/YourInstReplay​ for supplying some of the clips. England Reacts is supported by the Matchday app with PayPal. The app has been developed specifically to automate everything around your football life – whether you’re a player, club secretary, manager or coach. For more information head to: www.TheFA.com/Matchday.SUBSCRIBE to ensure you don’t miss a video from the England YouTube channel. Hit the bell to get notifications on our latest uploads! ► Subscribe: http://bit.ly/FATVSub► Twitter: http://www.twitter.com/england► Instagram: http://www.instagram.com/england► Facebook: http://www.facebook.com/englandteam► Twitch: https://www.twitch.tv/england► TikTok: https://www.tiktok.com/@england"
"-177nYc5pWk","SIDEMEN FOOTBALL DARTS","2021-05-11T18:00:00Z","UCh5mLn90vUaB1PbRRx_AiaA","MoreSidemen","22","21.13.05","sidemen|moresidemen|miniminter|ksi|zerkaa|behzinga|tbjzl|vikkstar|wroetoshaw","2238033","137558","1208","3549","https://i.ytimg.com/vi/-177nYc5pWk/default.jpg","False","False","• Sidemen: http://www.youtube.com/Sidemen• Sidemen Clothing: http://www.sidemenclothing.com• Sidemen Twitter: https://twitter.com/SidemenSidemen:• Miniminter: http://www.youtube.com/Miniminter• Zerkaa: http://www.youtube.com/Zerkaa• Behzinga: http://www.youtube.com/Behzinga• Vikkstar123: http://www.youtube.com/Vikkstar123• TBJZL: http://www.youtube.com/TBJZL• Wroetoshaw: http://www.youtube.com/Wroetoshaw• KSI: http://www.youtube.com/KSIedited by https://twitter.com/TegsRF"
"0nI6ROX2pwc","INSANE Football Vs Baseball TIC TAC TOE CHALLENGE! #Shorts","2021-05-11T01:04:36Z","UCFSaBAqySWbnd61n9r3Dd1g","CS99TV","20","21.13.05","Baseball|Football|Tic Tac Toe|Challenge|Sports challenge|Baseball challenge|Football challenge|Accuracy competition|Baseball Football Tic Tac Toe|Sports Tic Tac Toe|Sports Tic Tac Toe Challenge","2224981","82425","2480","369","https://i.ytimg.com/vi/0nI6ROX2pwc/default.jpg","False","False","Full video: https://youtu.be/02EGfljvA5cHey Everyone! It’s CS99TV from TikTok! We’ll be posting new content on our YouTube channel every single week, so be sure to subscribe and stay with us! As always, feel free to comment video suggestions!🔥Want to get $20 off your next concert or sporting event ticket? Be sure to check out seatgeek! It’s a super cheap and reliable website to purchase tickets, and our code “CS99” will get you $20 off your first purchase!Official SeatGeek Website: https://seatgeek.com/CHECK OUT OUR TIKTOK: @CS99TV📲Be sure to follow our social media:Instagram: CS99TV❓All Business Inquiries please contact here: CS99.TV1@gmail.comThanks for watching this video!#sports#shorts#tictactoe"
"d1V0JYF-sMo","Leicester beat Man United to hand Man City the PL title🏆 | Man United 1-2 Leicester | EPL Highlights","2021-05-11T19:11:32Z","UCNAf1k0yIjyGu3k9BwAg3lg","Sky Sports Football","17","21.13.05","sky sports|premier league|Football League|football|Sky Sports live|Sky|Sports|stream|sky sports football|premier league highlights|epl highlights 1920|Man United 1-2 Leicester|Manchester United 1-2 Leicester highlights|football highlights|Soyuncu|Jamie Vardy|Vardy|James Maddison|Leicester Premier League|Manchester City Premier League title","643858","9343","285","1833","https://i.ytimg.com/vi/d1V0JYF-sMo/default.jpg","False","False","SUBSCRIBE ► http://bit.ly/SSFootballSubPREMIER LEAGUE HIGHLIGHTS ► http://bit.ly/SkySportsPLHighlights2021Leicester breathed life into their Champions League qualification bid with a 2-1 victory at Manchester United which confirmed Manchester City as Premier League champions.Watch Premier League LIVE on Sky Sports here ► http://bit.ly/WatchSkyPL►TWITTER: https://twitter.com/skysportsfootball►FACEBOOK: http://www.facebook.com/skysports►WEBSITE: http://www.skysports.com/footballMORE FROM SKY SPORTS ON YOUTUBE:►SKY SPORTS FOOTBALL: http://bit.ly/SSFootballSub►SKY SPORTS BOXING: http://bit.ly/SSBoxingSub►SKY SPORTS CRICKET: http://bit.ly/SubscribeSkyCricket►SOCCER AM: http://bit.ly/SoccerAMSub►SKY SPORTS F1: http://bit.ly/SubscribeSkyF1►SKY SPORTS: http://bit.ly/SkySportsSub►SKY SPORTS GOLF: https://bit.ly/SubscribeSkySportsGolf"
"ra2VadaoMAQ","This week on RELEASED | Little Mix (Official Trailer)","2021-05-11T19:00:05Z","UCIvqWqjC4aLvp7zI8hzARrA","Little Mix","10","21.13.05","New Music|RELEASED YouTube Originals|YouTube Originals|New Music Videos|Music Videos|Music Artists|RELEASED|Music|Performance|Billboard Top 100|Live|RELEASED on YT|Little Mix YouTube|Little Mix YouTube Originals|Little Mix RELEASED|Little Mix Confetti|Little Mix Sweet Melody|Little Mix Not a Pop Song|Little Mix Saweetie|Saweetie YouTube|Saweetie Confetti|Little Mix Songs","370297","22212","83","1018","https://i.ytimg.com/vi/ra2VadaoMAQ/default.jpg","False","False","Join Little Mix this week on RELEASED as they reveal their secret superpowers and tell who they’d pick to ride with in sticky situations. All this leading up to an exclusive performance of their song “Confetti” featuring Saweetie. The Week’s Official Premiere Party + Music Video Drop. RELEASED, every Thursday, only on YouTube. #RELEASEDonYT #LittleMix #Saweetie"
"UmVpw2TisOA","My Dog Rents a Log Cabin","2021-05-11T12:30:04Z","UCNSzfesc7IgWZwg4n6uXr1A","Tucker Budzyn","15","21.13.05","my dog rents a log cabin|log cabin vacation|cabin in the woods|we rented a cabin|my dog has a beach house vacation|my dog rents a beach house|this is what my dog does|jealous dog reaction|my dog rents a swimming pool|log cabin|dog reviews food|butcher box|tucker budzyn|funny dog reaction|my dog reacts|tucker taste test|vacation|family vacation|golden retriever|throwing my dog a pool party|leaving my dog along with a juicy steak","911312","53718","418","5156","https://i.ytimg.com/vi/UmVpw2TisOA/default.jpg","False","False","My Dog Rents a Log CabinClick the link: https://www.butcherbox.com/tucker to get $20 off your first box PLUS 3lbs of chicken breasts FREE in your first order. Tucker and I both love the high quality meats from Butcher Box and we know you will love it too! Tucker and fam had a much needed getaway at a log cabin in the woods of Wisconsin. Tucker has never seen such deep, beautiful snow. He had the time of his life roaming free in the snowy woods. He's already begging me to take him back!What was your favorite part???TUCKER MERCH IS HERE!!!https://www.tuckerbudzyn.shopGet the Official Tucker Budzyn App on IOS or Android:https://doggymojis.com/tuckermojiFOLLOW ME:» Tucker's 2nd Channel: https://bit.ly/3aHgqcE» Instagram: https://www.instagram.com/tuckerbudzyn» Facebook: https://www.facebook.com/tuckerbudzyn» TikTok: https://www.tiktok.com/@tuckerbudzyn» Twitter: https://twitter.com/tuckerbudzyn» My Mommy: https://bit.ly/2xCCfVwTucker's Favorite Products!https://www.amazon.com/shop/tuckerbudzynBusiness Inquiries: tuckerbudzyn@gmail.com"
"DU3MAeDaZls","P!nk - All I Know So Far (Film Trailer)","2021-05-11T20:00:06Z","UCXJDX1KK6t121Z9FLhu5o2A","PinkVEVO","10","21.13.05","pink|p!nk|all i know so far|pink all i know so far|all i know so far movie|pink movie|new pink movie|new p!nk|p!nk amazon|amazon prime video|prime video|p!nk documentary|p!nk trailer|all I know so far trailer|p!nk movie trailer|pink documentary|pink doc|cover me in sunshine|pink cover me in sunshine|willow|willow sage hart|all i know so far lyrics|aiksf|cover me|cover me in sunshine video|new pink|pink TikTok|cover","163256","12353","45","992","https://i.ytimg.com/vi/DU3MAeDaZls/default.jpg","False","False","P!nk: All I Know So Far - The Movie // Directed by Michael GraceyComing to Amazon Prime Video on May 21“All I Know So Far” - P!nk’s New Single // Out Now: https://smarturl.it/AIKSFWatch the official video for “All I Know So Far” // https://smarturl.it/AIKSF/youtubeAll I Know So Far: Setlist // The New Album // Available May 21Pre-Save/Add // https://pinkspage.com Subscribe to P!NK's channel for more official content // https://smarturl.it/PINKytSubscribe Connect with P!NK:https://tiktok.com/@pinkofficialhttps://facebook.com/pink https://twitter.com/pink https://instagram.com/pink https://pinkspage.com #pink #alliknowsofar #primevideo"
"ita_jmKbxuI","Danny Ings scores brace on return from injury! 👏| Southampton 3-1 Crystal Palace | EPL Highlights","2021-05-11T21:26:45Z","UCNAf1k0yIjyGu3k9BwAg3lg","Sky Sports Football","17","21.13.05","sky sports|premier league|Football League|football|Sky Sports live|Sky|Sports|stream|sky sports football|premier league highlights|epl highlights 1920|Southampton|Southampton Crystal Palace|Southampton 3-1 Crystal Palace|Southampton 3-1 Crystal Palace highlights|highlights|Sky football highlights|Danny Ings|Ings","343823","5507","66","394","https://i.ytimg.com/vi/ita_jmKbxuI/default.jpg","False","False","SUBSCRIBE ► http://bit.ly/SSFootballSubPREMIER LEAGUE HIGHLIGHTS ► http://bit.ly/SkySportsPLHighlights2021Highlights from the Premier League as Danny Ings scored twice on his return from injury as Southampton came out on top 3-1 in an exciting end-of-season encounter with Crystal Palace.Watch Premier League LIVE on Sky Sports here ► http://bit.ly/WatchSkyPL►TWITTER: https://twitter.com/skysportsfootball►FACEBOOK: http://www.facebook.com/skysports►WEBSITE: http://www.skysports.com/footballMORE FROM SKY SPORTS ON YOUTUBE:►SKY SPORTS FOOTBALL: http://bit.ly/SSFootballSub►SKY SPORTS BOXING: http://bit.ly/SSBoxingSub►SKY SPORTS CRICKET: http://bit.ly/SubscribeSkyCricket►SOCCER AM: http://bit.ly/SoccerAMSub►SKY SPORTS F1: http://bit.ly/SubscribeSkyF1►SKY SPORTS: http://bit.ly/SkySportsSub►SKY SPORTS GOLF: https://bit.ly/SubscribeSkySportsGolf"
"dcBKEEVna-g","Billie Eilish - Your Power (Live On The Late Show with Stephen Colbert/2021)","2021-05-11T04:30:04Z","UCDGmojLIoWpXok597xYo8cg","BillieEilishVEVO","10","21.13.05","billie eilish|your power|happier than ever|billie your power|billie live|billie eilish live|your power live|Stephen Colbert|billie colbert","3972587","432046","3290","23676","https://i.ytimg.com/vi/dcBKEEVna-g/default.jpg","False","False","Listen to “Your Power”, out now: https://BillieEilish.lnk.to/YourPower Pre-order the new album “Happier Than Ever”, out July 30: https://BillieEilish.lnk.to/HappierThanEverFollow Billie Eilish:Facebook: https://BillieEilish.lnk.to/FacebookInstagram: https://BillieEilish.lnk.to/InstagramTwitter: https://BillieEilish.lnk.to/TwitterTikTok: https://BillieEilish.lnk.to/TikTokYouTube: https://youtube.com/BillieEilishEmail: http://smarturl.it/BillieEilishEmailStore: http://smarturl.it/BillieEilishStore"
"2yKKXVv0-SI","Friday Night Funkin' but Different Characters Sings Ugh","2021-05-10T20:48:52Z","UCo-QVDBBVFBkjUsDteFhYiw","Kiza Gameplays","20","21.13.05","among us drip|amogus|among us in friday night funkin|friday night funkin gameplay|friday night funkin among us|amogus meme|among us music|among us remix|among us songs|among us meme|among us memes|among us funny|among us trap|among us animation|amogus memes|friday night funkin mod|friday night funkin henry stickmin|friday night funkin ellie|friday night funkin funny|friday night|friday night memes|friday night funkin memes|friday night funkin ripoffs","3993127","82527","2186","3523","https://i.ytimg.com/vi/2yKKXVv0-SI/default.jpg","False","False","If you liked the game, you can find it here:https://ninja-muffin24.itch.io/funkinMore FNF Videos!: https://www.youtube.com/watch?v=lXXFtMR8agk&list=PLqUfzLRPa4By2BOS6XjymsjE6wEDMm25j&ab_channel=KizaGameplaysHere you can find the mods: Ruv Sing Ugh: https://gamebanana.com/mods/56135Mom Sings Ugh: https://www.youtube.com/watch?v=_RARpGIBbSM&ab_channel=JomJom412Selever Sings Ugh: https://gamebanana.com/mods/261790Fun Sized Sarvente: https://gamebanana.com/mods/284218https://gamebanana.com/mods/184275Sarvente Sings Ugh: https://www.youtube.com/watch?v=fm3fdxepDN8&ab_channel=JordanSantiagoWhitty Sings Ugh: https://gamebanana.com/mods/253985Carol x Bf: https://www.youtube.com/watch?v=VqxtGTvB8Dw&ab_channel=ElTacoHex Sings Ugh: https://www.youtube.com/watch?v=q5DBpmye9Pw&t=6s&ab_channel=JordanSantiago Pufferfish sings ugh: https://gamebanana.com/mods/44759Subscribe for more videos!•NOOB vs PRO vs HACKER Playlist: https://www.youtube.com/watch?v=InVnvNLmRQo&list=PLqUfzLRPa4BwW3SKL1DruPJ_S_kyK3ukG•Different games for mobile devices: https://www.youtube.com/watch?v=dnojnHGOhNY&list=PLqUfzLRPa4ByGhnn78VANB27_TRVjja26•Popular games for mobile devices:  https://www.youtube.com/channel/UCo-QVDBBVFBkjUsDteFhYiw/playlists?view=50&sort=dd&shelf_id=4•Scary fun games for mobile devices: https://www.youtube.com/channel/UCo-QVDBBVFBkjUsDteFhYiw/playlists?view=50&sort=dd&shelf_id=5#fridaynightfunkin #fnf #fnfmods"
"135bv6GhD2M","J. Cole - Applying Pressure: The Off-Season Documentary","2021-05-10T17:00:12Z","UCnc6db-y3IU7CkT_yeVXdVg","J. Cole","10","21.13.05","J. Cole|J.Cole|Dreamville|The-Off Season|Cole World|Hip-Hop|Rap|Music|Documentary","3225559","289115","1055","18575","https://i.ytimg.com/vi/135bv6GhD2M/default.jpg","False","False","Applying Pressure: The Off-Season Documentary Executive Producers: Jermaine Cole, Ibrahim Hamad Director: Scott LazerExecutive Producer: Tripp KramerProducers: Tripp Kramer, David PetersDirector of Photography: Taylor McIntosh 1st AC: Manny Rodriguez Colorist: Mikey Pehanich @ BlacksmithSound Mix/Design: Dean White Editor: Roberta Spitz Connect with J. Cole:https://www.instagram.com/realcoleworld/https://twitter.com/jcolenchttps://www.facebook.com/JColeMusic/Connect with Dreamville:http://dreamville.com/https://www.instagram.com/dreamvillehttps://twitter.com/Dreamvillehttps://www.facebook.com/dreamville"
"NmwIdGUb3qY","We Bought 3 Cheap Ferraris For The Price Of A Toyota Camry - Car Trek S4E1","2021-05-10T16:00:11Z","UCvAhDxNNUDhi78tMXVGBUaQ","Tavarish","2","21.13.05","aston martin|mercedes|amg|hyundai|bmw|lamborghini|ferrari|toyota|supra|mr2|sw20|3sgte|2jz|1jz|sl55|r230|r231|m113k|vantage|v8|v12|v10|v6|gallardo|turbo|cheap|budget|diy|wrench everyday|doug demuro|chrisfix|hoovies garage|tavarish|jalopnik|mightycarmods|motor trend|roadkill|hack|bendpak|tools|lift|4 post|2 post|quick jack|welding|how to|tutorial|456|gated|308|599|ferrari special|top gear|the grand tour|jeremy clarkson|james may|richard hammond|car wizard","1062354","45135","840","3163","https://i.ytimg.com/vi/NmwIdGUb3qY/default.jpg","False","False","Find your own CHEAP FERRARI on AutoTempest!►https://bit.ly/FerrariCT4Find your DREAM car on AutoTempest!►http://bit.ly/CT401Thanks to AutoTempest.com for sponsoring this series!--------------------------------------------------------------------On the first episode of Car Trek, AutoTempest tasks the guys with finding three cheap Ferraris for the price of a Toyota Camry. Freddy, predictably bought a 1978 Ferrari 308 GTB that needs a little bit of work, Tyler bought a 1994 Ferrari 456GT, also known as the world's most expensive Ford Probe, and Ed bought a 2009 Ferrari 599 GTB with the HGTE handling package. If you're wondering how that last one makes sense, so does everyone else. They were then told to see what was wrong with their aging prancing horses. Hold on to your butts. This one is gonna be fun. #CarTrek4 #FoundOnAutoTempest #FerrariSpecial--------------------------------------------------------------------CAR TREK SERIES 4 PLAYLISTSeries 4, Episode 1►https://youtu.be/NmwIdGUb3qYSeries 4, Episode 2►https://youtu.be/HJZVyoWS9fU--------------------------------------------------------------------COMPLETE CAR TREK SERIES 3 PLAYLISTSeries 3, Episode 1►https://youtu.be/TN6E1gyb4qQSeries 3, Episode 2►https://youtu.be/h_YaBjx4P2QSeries 3, Episode 3 ►https://youtu.be/zQbERnh3atcSeries 3, Episode 4 ►https://youtu.be/zxP6fYvXR_oSeries 3, Episode 5(FINALE)►https://youtu.be/tmymr12wc84--------------------------------------------------------------------COMPLETE CAR TREK SERIES 2 PLAYLIST:Series 2, Episode 1 ►https://youtu.be/bDAiui-W79wSeries 2, Episode 2 ►https://youtu.be/ohRQjQ8AYh8Series 2, Episode 3 ►https://youtu.be/otvA_QLAl70Series 2, Episode 4 ►https://youtu.be/0Qt_ExrTx8ESeries 2, Episode 5(FINALE)►https://youtu.be/tqwd5VDEn88--------------------------------------------------------------------COMPLETE CAR TREK SERIES 1 PLAYLIST:Car Trek Episode 1 ► https://youtu.be/Dom6bmnd_DcCar Trek Episode 2 ►https://youtu.be/wPi1BJw-zscCar Trek Episode 3 ►https://youtu.be/SJGWk9nX49UCar Trek Episode 4 ►https://youtu.be/9Woe-PnI9qgCar Trek Episode 5 ►https://youtu.be/Ug_GRlGQ0_ACar Trek Episode 6 ►https://youtu.be/7me9z2Xt90UCar Trek Episode 7 (FINALE)► https://youtu.be/LbpHcd1pa8I--------------------------------------------------------------------The story of Tyler's Ferrari 360 Spider ►https://www.youtube.com/watch?v=IK0OKOPmFEMThe story of Ed's Lamborghini Gallardo►https://www.youtube.com/watch?v=2cjzI2M7eQc--------------------------------------------------------------------Car Trek on social media:Instagram ►https://www.instagram.com/cartrekofficialFreddy Tavarish Hernandez: Instagram ►https://www.instagram.com/therealtavarishYouTube► https://www.youtube.com/tavarishTyler Hoover:Instagram ►https://www.instagram.com/the_real_hoovies_garageYouTube ►https://www.youtube.com/channel/UCdEczn3MVkx_4PnMZ10MVFAEd Bolian: Instagram► https://www.instagram.com/vinwiki_officialYouTube ►https://www.youtube.com/channel/UCefl-5pmhZmljwZTE2KrcdA--------------------------------------------------------------------BIG Thanks to our amazing production crew: Thomas Durant►https://www.instagram.com/reheracte/Jordan Cole► https://www.instagram.com/trustinthemachine/Brent Baxter► https://www.instagram.com/sidebproductions/Vincent Monsaint►https://www.instagram.com/vmonsaint/Jared Pink►https://www.instagram.com/jaredpink/Timothy Alsbrooks►https://www.instagram.com/ta_visuals/--------------------------------------------------------------------Questions? Comments? Business inquiries? Email me at asktavarish@gmail.com--------------------------------------------------------------------Thanks to the companies that support this channel!Advance Auto Parts - Enter 'TAVARISH25 at checkout to get up to 25% off!►https://bit.ly/AdvanceTavGet the Advance Auto Parts App►https://bit.ly/AdvanceAppTavValvoline - The Original Motor Oil►https://www.valvoline.com/Find your dream car on AutoTempest!►https://bit.ly/foundonautotempest--------------------------------------------------------------------"
