video_id,title,publishedAt,channelId,channelTitle,categoryId,trending_date,tags,view_count,likes,dislikes,comment_count,thumbnail_link,comments_disabled,ratings_disabled,description
"xVjzNyydTfM","Freeze Corleone 667 feat. Central Cee - Polémique","2021-05-13T01:53:11Z","UCaW8nWryLD0TunnyUYqp5dQ","Mangemort Squad","10","21.14.05","[none]","959946","112492","581","4922","https://i.ytimg.com/vi/xVjzNyydTfM/default.jpg","False","False","Freeze corleone feat. Central Cee - Polémique (Prod By Flem)Bientôt disponible sur toutes les plateformes Réalisation : Kunography Enregistrement : Studio 5 étoiles Mix : Studio KGBMaster: Tha Trickaz"
"IhaQdbZjPGQ","L'HISTOIRE DE DAFT PUNK ! - SEB","2021-05-12T16:18:20Z","UCK3inMNRNAVUleEbpDU1k2g","SEB","24","21.14.05","seb la frite|seb|ce mec|seblafrite|sebastien frit|histoire|incroyable|mystère|daft punk|thomas bangalter|guy manuel de homem christo|discovery|homework|human after all|random acces memories|coachella|documentaire","1344326","176088","657","7002","https://i.ytimg.com/vi/IhaQdbZjPGQ/default.jpg","False","False","RDV sur https://NordVPN.com/SEBVPN et utilisez le code SEBVPN pour obtenir un abonnement de 2 ans + 1 mois supplémentaire gratuit, le tout avec la réduction évidemment ! C’est satisfait ou remboursé pendant les 30 premiers jours.Aujourd'hui on retrace le parcours de Daft Punk, j'espère que vous allez bien aimer, pensez à vous abonner, et moi je vous remercie pour votre fidélité et votre soutien ! 🤖Les différents chapitres :00:00 INTRODUCTION03:26 LE COMMENCEMENT05:28 UN NOUVEAU COURANT07:18 DAFT PUNK EST NÉ09:34 ANONYMAT = LIBERTÉ11:33 DISCOVERY14:11 L'ART DU SAMPLING17:35 LA RÉVOLUTION DU LIVE20:43 DES PLATINES À L'ORCHESTRE21:44 L'ALBUM DE MUSICIEN24:53 LA BOUCLE EST BOUCLÉE26:21 LA SPONSOMES RESEAUX : http://instagram.com/seblafritehttp://www.twitter.com/Seb_FritMON MATERIEL : Canon 5D Mark IV : https://amzn.to/2RhzpiSObjectif Canon 16-35mm 2.8 : https://amzn.to/3hoGRDqMicro SM7B : https://amzn.to/2GOhCxPMicro Vidéomic Pro : https://amzn.to/35qvPvnFocusrite Scarlett Solo : https://amzn.to/3k5o4igMon Fauteuil : https://amzn.to/3hm29BNLa bise, à bientôt !PS : les vidéos sur la musique sont monétisées par les ayant-droits, c'est donc YouTube qui y place des publicités et je n'ai pas le contrôle dessus, donc désolé d'avance si certaines pubs peuvent gêner le visionnage mais j'y suis pour rien !"
"G8RizzJFRO8","Larry - Sirène (Clip officiel)","2021-05-14T10:00:12Z","UCbOO7kLwv0viB2I1GGInhTg","LarryOfficielVEVO","10","21.14.05","bouster|sirène|sirènes|siren|sirennes|sirenne|boster|boosteur|lari|larry|larry 2019|larri 2019|lary 2019 larry clip|larri clip|lary clip|larry question réponse|larri question réponse|lary question réponse larry cité blanche|larri cité blanche|lary cité blanche|larry nouvel album|larri nouvel album|lary nouvel album|larry single|larri single|lary single|larry titre|larri titre|lary titre|larry concert|larri concert","147301","18704","348","1638","https://i.ytimg.com/vi/G8RizzJFRO8/default.jpg","False","False","Sirène – Disponible sur toutes les plateformes de streaming : https://larry.lnk.to/Sirene--- Prod : BersaProduction audiovisuelle : EntermediaRéalisation : Dren Berisha / Genc Mehmetaj--- Abonnez-vous à ma chaîne Youtube : https://www.youtube.com/channel/UC0TDAu7FOnqP5W2UfFNDzsA?sub_confirmation=1Instagram : https://www.instagram.com/larrysogoodnolove/Tiktok : https://www.tiktok.com/@larrysogoodFacebook: https://www.facebook.com/larrysogood/Twitter : https://twitter.com/Larrysogood_Snapchat : @Larry6tblanche"
"E553AnMAvlU","Migos - Straightenin (Official Video)","2021-05-14T04:00:16Z","UCGIelM2Dj3zza3xyV3pL3WQ","MigosVEVO","10","21.14.05","migos|straightenin|culture 3|culture III|dababy|drake|post malone|cardi b|lil baby|dj khaled|nicki minaj|t rap|lil uzi vert|lil durk|megan thee stallion|nba youngboy|marshmello|lil yachty|lil wayne|narcos|trap music|tik tok song|carpool karaoke|offset|quavo|bad and boujee|yrn|khaled|youngboy never broke again|khaled khaled|atlanta|jay-z|migos narcos","1517867","193558","1950","13212","https://i.ytimg.com/vi/E553AnMAvlU/default.jpg","False","False","Watch the official video for Migos - StraighteninStream//Download Migos new single Straightenin here: https://QualityControl.lnk.to/StraighteninFollow Migos on socials:https://instagram.com/migoshttps://facebook.com/THEMigosAtlhttps://twitter.com/migosMigos - Straightenin Lyrics:[Intro](DJ Durel, Ay Castro go crazy)Yeah (Soo), we gone (huh)Stop, we good (stop)Chill, we on (chill)Scale (huh), let’s go (let’s go)Domingo (huh), let’s go (migo)Take (huh), let’s go (huh)Set, let’s roll[HOOK]Straightenin’Straightenin’ (woo)Straightenin’Yeah (straight)Straightenin’Straightenin’ (soo)Straightenin’Yeah (straight)Don’t nothing get straightenin’ but straightenin’ (hey)Don’t nothing get straightenin’ but straightenin’ (soo)Don’t nothing get straightenin’ but straightenin’ (straight)You don’t get shit straight if you don’t straightenin’ it (sah)[QUAVO]In this game, sit back be patient (gang)Niggas act like the game went vacant (huh?)Niggas act like something been taken (took what?)Ain’t nothing but a little bit of straightenin’ (I’m tellin ya)Been kicking shit popping out daily (go)On an island, it’s a movie I’m making (that’s facts)I’m counting dineros with Robert De NiroHe telling ‘em that Cho amazing (ay)Put that shit on (shit on) , Niggas get shit on (shit on)I bought two whips, and I put my bitch on (skrt)She put this wrist on (wrist)She factory set it with Richard Mille prongs (ice)Turn a pandemic into a bandemicYou know that’s the shit that we on (yessir)Them niggas gon pull up and act like this shit is togetherWe don’t fuck with you homes (fuck em)Uh uh, I don’t do the fake kicking (no)There go a rocket, is Take in it? (soo)It’s a problem with ‘phew then we straightenin’ in (straight)Swap out the cat put a demon in it (skrt)Upgrade the bando put fiends in it (woo)I got some shooters you ain’t seen with me (graaa)We’ll run that shit back I just seen Tenet (woah)We’re going to get straightenin’[HOOK]Straightenin’Straightenin’ (woo)Straightenin’Yeah (straight)Straightenin’Straightenin’ (soo)Straightenin’Yeah (straight)Don’t nothing get straightenin’ but straightenin’ (hey)Don’t nothing get straightenin’ but straightenin’ (soo)Don’t nothing get straightenin’ but straightenin’ (straight)You don’t get shit straight if you don’t straightenin’ it (sah)[TAKEOFF]You don’t get shit straight if you don’t straighten it (no)I’m the type to sit back and watch patient (watch)Do a trick with the stick it’s amazing (stick)In the bando trappin out vacants (bando)Locs on like I’m starring in the Matrix (Matrix)I keep the cookie like my grandma made it (cookie)I keep the keys and the pounds and the babies (keys)And the bricks came white like Shady (white)Drive the Lambo through the avenue (skrt)Pretty lil bih with a attitude (bad)Give a shoutout to the white boy (boys)All white Rolls look radical (radical)Keep you a fire, don’t let them take it (no)If they get yours you gotta get straightenin’ (straightenin’)I catch a opp I give him a facelift (opp)My niggas lurkin and spinnin the day-shift (lurk)I got them racks when you see me (rackades)Spin back to back it’s a repeat (spin)Championship it’s a three-peat (three)Shoot out the window like Drizzy and Freaky (freak)I keep it on me believe me (yessir)I be up high where the trees be (high)I go and put on so much of this iceThey say don’t touch me you gon’ freeze me (freeze)[HOOK]Straightenin’Straightenin’ (woo)Straightenin’Yeah (straight)Straightenin’Straightenin’ (soo)Straightenin’Yeah (straight)Don’t nothing get straightenin’ but straightenin’ (hey)Don’t nothing get straightenin’ but straightenin’ (soo)Don’t nothing get straightenin’ but straightenin’ (straight)You don’t get shit straight if you don’t straightenin’ it (sah)[OFFSET]Get my straightenin ’ (straightenin)Automatic handgun like the Navy (automatic)I keep a hundred round drum I ain’t fadingTurn a nigga to a mummy with the paymentTerminate him with the money, it was gravy (Terminator)Spin an opp block, rock a bye baby (rockabye)Made his heart stop made his momma hate me (make em hate me)We were trappin out the spot out the basement (out the spot)Tasmanian devil we spin on your block (spin)I pop a perk and I’m going berserkAnd I woke up and bought me a drop (like fuck it)Straight to the point I get straight to the straightenin’Your buddy he can’t even walk (straight)We gutted him nobody talk (we gutted him)New Cullinan stars start to fall (new Cullinan)Trappin and hustlin beat down the walls (beat down)I’m with the steppa north side reppaQua keep a mac in the back of the Tesla (Qua)I’m with the gang we could never be selfish (gang, gang, gang)Watch how I dress I’m the drippin professorBought a Kill Tech then I bought a compressor (Kill Tech)Time to press him, eat him for breakfast (hey)Taught him a lesson I’m never confessing (hey)Left him a message, somebody’s stretcher (str..."
"nqmK4PMhBsE","Haaland, Sancho & Co. unstoppable | Leipzig vs. Borussia Dortmund 1-4 | Highlights | DFB-Pokal Final","2021-05-13T22:03:55Z","UC7am34-1rGU_ky1vWYnoOJQ","German Football","17","21.14.05","DFB|German Football|Football|Soccer|Germany|Live Football|Football Highlights|DFB-Pokal|DFB-Pokal Highlights|DFB-Pokal 2020/21|Highlights|Best of|Goals|German Cup|Final|Leipzig Dortmund|RB Leipzig|Leipzig|Borussia Dortmund|Dortmund|BVB|Jadon Sancho|Erling Haaland|Dani Olmo","1488257","43185","561","1308","https://i.ytimg.com/vi/nqmK4PMhBsE/default.jpg","False","False","Enjoy the Highlights of RB Leipzig vs. Borussia Dortmund from the Final of the DFB-Pokal 2020/21. #RBLBVBGoals: 0-1 Jadon Sancho (5‘), 0-2 Erling Haaland (28’), 0-3 Jadon Sancho (45’+1), 1-3 Dani Olmo (71’), 1-4 Erling Haaland (87‘)Subscribe now for more German Football action and hit the bell: https://zly.de/dfb/yt_subWatch all Highlights from the DFB-Pokal: https://go.dfb.de/dfb-pokal-pl-2021"
"T37nO9uJNp0","Fally Ipupa - Amore (Clip officiel)","2021-05-14T10:00:25Z","UCBFYkrVI8OfHm9PzbAGFqlA","Fally Ipupa","10","21.14.05","Fally Ipupa|Bad Boy|Musique|Afro|Clip officiel|fally ipupa|aya nakamura|eloko oyo|fally|fally ipupa eloko oyo|booba|bad boy|kiname|fally ipupa bad boy|fally eloko oyo|aya|fally ipupa 2016|fally ipupa 2017|fally ipupa amour assassin|fally ipupa nourrisson|fally ipupa service|fally ipupa original|eloko|fally ipupa anissa|eloko oyo fally ipupa|fally ipupa eloko oyo audio|booba kiname","232254","26691","846","3288","https://i.ytimg.com/vi/T37nO9uJNp0/default.jpg","False","False","Nouvel album Tokooos II Version Bonus disponible : https://FallyIpupa.lnk.to/Tokooos2BonusAY-Écoute les meilleurs titres de Fally Ipupa ici : https://FallyIpupa.lnk.to/PlaylistsAY-Produit par FAM ProductionProductrices: Flora Koffi - Lopez & Marjane Slami Assistante de production : Salomé DrachRéalisatrice: Lucie Morey 1ere ass réal : Barbara JosephChef opérateur : Teva Vetea 1ere ass camera : Lola Rougier - Onnis 2nd ass cam : Carmen Bamba Steadicamer : Charlie Moreno Chef Machiniste : Fabrice Mignot Chef électricien : Julien Derail Electricien : Manuela De Freitas BrancoChef Décorateur : Benoît Dagorne Pyrotechnicien : Nicolas, Martin, Valentin - Harmony EvénémentMake up : Alexia Amzallag Styliste : Elodie Deval Assistante styliste : Mouni Sognoko Régie général : Jordan CiprianoRégisseur : Axel Regnault Régisseur : Bryan Cipriano Monteuse : Claire DantecEtalonneur : Kenji FirchVFX : SDRNGraphiste : Marius Turpin Merci Guy Laroche, Louis Gabriel Nouchi, Guerasfatim, Soleils d’Afrique, Patou, Converse. @guylarocheparis @louisgabrielnouchi @guerasfatim @soleilsdafrique @patou @converse -Abonnez-vous à la chaine : http://po.st/FallyIpupa-Retrouvez Fally Ipupa sur :https://www.instagram.com/fallyipupa01https://www.facebook.com/FallyIpupaOfficialhttps://twitter.com/fallyipupa01"
"FLGCGc7sAUw","Bella Poarch - Build a B*tch (Official Music Video)","2021-05-14T04:00:16Z","UCCY_8y1FjtOegxKB4s2bWqw","Bella Poarch","22","21.14.05","bella poarch|bella porch|build a bitch|build a babe|build a b*tch|bella poarch tiktok|tiktok songs|you cant build a bitch|sub urban|valkyrae|mia khalifa|dina|bretman rock|rakhim|larray|zhc|Аnokhina|liza|face zoom|bella poarch face zoom|bella poarch music video|bella poarch valkyrae|paca|bella poarch tiktoks|bella poarch new song|tiktok singers|tiktok musicians|im filled with flaws and attitude|if you need perfect im not built for you|la la la tiktok","8397931","1316614","18333","87905","https://i.ytimg.com/vi/FLGCGc7sAUw/default.jpg","False","False","Stream Build a B*tch: http://bellapoarch.lnk.to/BuildABitch 😈Subscribe to my channel: https://www.youtube.com/c/bellapoarch?sub_confirmation=1Follow Bella Poarch:https://www.tiktok.com/@bellapoarchhttps://www.instagram.com/bellapoarchhttps://www.facebook.com/BellaPoarchOnlinehttps://twitter.com/bellapoarchSTARRING:Bella Poarch ValkyraeMia Khalifa Dina Larray ZHC Rakhim Bretman RockSub UrbanCREDITS:Director - Andrew DonohoCreative Director - Sub Urban Producer - Valerie BushExecutive Producer - Ryan Huffman Executive Producer - Valerie BushProduction Company - Huffman Creative Manager, Production - Katie Sarrels Production Manager - Julio Mata Jr.Production Coordinator - Garrett KynardProduction Coordinator - Raashauna Payne Production Coordinator - Chris FishLabel - Warner RecordsVP of Creative Services - Devin SarnoSVP of A&R - Stefan MaxBella's MGMT - Aryan Mahyar, Danny K. & Francisco MontielDirector Rep - Doug Klinger Director of Photography 1st AC - Noah Ramos 2nd AC - Minmin TsaiSteadicam - Brian SergottDIT - John Davis1st AD - Julia Zsolnay 2nd AD - Robert Torres 2nd 2nd AD - Leah Rice LYRICS:This ain’t Build a B*tchYou don’t get to pick and chooseDifferent ass and bigger boobsIf my eyes are brown or blueThis ain’t Build a B*tchI’m filled with flaws and attitudeSo if you need perfect, I’m not built for youBob the Builder broke my heartTell me I need fixingSaid that I’m just nuts and boltsLot of parts were missingCurvy like a cursive fontVirgin and a vixenThat’s the kind of girl he wantsBut he forgotThis ain’t Build a B*tchYou don’t get to pick and chooseDifferent ass and bigger boobsIf my eyes are brown or blueThis ain’t Build a B*tchI’m filled with flaws and attitudeSo if you need perfect, I’m not built for you(La la la)Boys are always playing golfLooking for the BarbieThey don’t look like Ken at allHardly have a heart beatNeed someone who falls apartSo he can play prince charmingIf that’s the kind of girl he wantsThen he forgotThis ain’t Build a B*tchYou don’t get to pick and chooseDifferent ass and bigger boobsIf my eyes are brown or blueThis ain’t Build a B*tchI’m filled with flaws and attitudeSo if you need perfect, I’m not built for you(La la la)(La la la)Partnered with NYX Cosmetics on this makeup look! Wearing Epic Ink Liner: https://bit.ly/32XZ9XC #BellaPoarch #BuildABitch"
"gNi_6U5Pm_o","Olivia Rodrigo - good 4 u (Official Video)","2021-05-14T04:00:09Z","UCxE5jEls-T0QtlTHT8lI1lw","OliviaRodrigoVEVO","10","21.14.05","Olivia|Rodrigo|good|Pop","5472476","865041","7943","55779","https://i.ytimg.com/vi/gNi_6U5Pm_o/default.jpg","False","False","Listen to good 4 u out now: https://OliviaRodrigo.lnk.to/good4uPre-order the debut album SOUR: https://OliviaRodrigo.lnk.to/preorder​Shop the SOUR collection: https://smarturl.it/oliviarodrigoshopDirected by Petra CollinsStarring Olivia RodrigoFollow Olivia Rodrigo:Instagram: https://instagram.com/oliviarodrigoTwitter: https://twitter.com/Olivia_RodrigoFacebook: https://www.facebook.com/OliviaRodrigoOfficialYouTube: https://youtube.com/oliviarodrigomusicTikTok: https://tiktok.com/@livbedumbStore: https://smarturl.it/oliviarodrigoshopMusic video by Olivia Rodrigo performing good 4 u. © 2021 Olivia Rodrigo, under exclusive license to Geffen Recordshttp://vevo.ly/9pB8LU"
"USloUr8Dzg8","Demi-finales : Montpellier HSC-Paris-SG (2-2, 5 tab à 6), le résumé I Coupe de France 2020-2021","2021-05-13T11:23:25Z","UCeJlXGyEl7kBgQJKADAHM3A","Fédération Française de Football","17","21.14.05","2-2|2020-2021|6254013320001|andy delort|buts|cdf|cfra-compilation|coupe-de-france|demi-finale|gaëtan laborde|kylian mbappé|montpellier hsc|moïse kean|paris-sg|résumé","283434","6117","154","456","https://i.ytimg.com/vi/USloUr8Dzg8/default.jpg","False","False","Recordman de victoires en Coupe de France (13), le Paris-SG s'est qualifié mercredi soir au stade de la Mosson pour sa septième finale consécutive. Les Parisiens ont pris les devants à deux reprises grâce à un doublé de Kylian Mbappé (10e, 50e) mais se sont faits rejoindre sur des réalisations du duo offensif héraultais Laborde-Delort (45e, 83e). Les joueurs de Mauricio Pochettino se sont imposés finalement au terme de la séance des tirs au but (5 tab à 6)."
"-xulsY5AGew","Pomme - à perte de vue (Clip Officiel)","2021-05-14T10:00:02Z","UCh9h2bgEKibJGgH072CU78A","PommeOfficialVEVO","10","21.14.05","Pomme|perte|vue|Universal|Music|Division|Polydor|French|Pop|pomme|pome|pom|à perte de vue|beluga|les failles|gremm|pomme clip|pomme les belugas|pomme à perte de vue|belugas clip|à perte de vue clip|les failles pomme|pomme à perte de vue clip|pomme les belugas clip","54465","12390","48","650","https://i.ytimg.com/vi/-xulsY5AGew/default.jpg","False","False","les bélugas sont plus cool que les humains. bisous 3à perte de vue disponible sur toutes les plateformes : https://Pomme.lnk.to/apertedevueID→ Retrouvez Pomme sur les réseaux sociauxFacebook : https://www.facebook.com/pommeofficial​Twitter : https://twitter.com/pommeofficial​Instagram : https://instagram.com/pommeofficial​Youtube : https://www.youtube.com/channel/UCZy0-5YHgLpzgT-biGtJgJgProduit par Socialclub & Télescope FilmsSocialclubDirecteurs de création: Maxime Daguet, Léo SattinResponsables agence : Corentin Fardeau, Valentin FertilletResponsables projet : Marine Sanchez, Candice DainCréatifs : Louise Robert, Robin Blanc Télescope FilmsConcept : Vincent René-LortieRéalisateurs : Vincent René-Lortie & Claire PommetProducteur exécutif:  Samuel Caron Productrice : Élise LardinoisDirectrice de production : Jessica PoirierCoordonnatrice de production : Marjorie Gauvin Directeur de la photographie : Alexandre Nour 1er assistant caméra : Steven TurcotteMaquilleuse : Carole Méthot Styliste : Mélodie WronksiChef éclairagiste : Alexis Vallée-CharestChef machiniste : Mathieu Lefrançois-GauvreauMachiniste : Philippe St-Laurent LévesqueAssistante de production : Lorie Lebeau VFX : Philippe Toupin 2e artiste VFX : Émile MassieAnimation : Alexandre MorinMonteur : Vincent René-LortieColoriste : Simon BoisxBTS : Léa TailleferMerci à Colliers International, Surf Spot, MELS & Cineground."
"pX9BQ-l-24k","Sapapaya","2021-05-13T22:03:37Z","UCePs8uvCAAL0pRMa0L807lw","L'Algérino - Topic","10","21.14.05","L'Algerino|SCH|Jul|Sapapaya","47513","2860","123","2","https://i.ytimg.com/vi/pX9BQ-l-24k/default.jpg","False","False","Provided to YouTube by Universal Music GroupSapapaya · L'Algerino · SCH · JulSapapaya℗ 2021 Only Pro / Capitol Music FranceReleased on: 2021-05-14Producer, Associated  Performer, Programming: SkalpAuthor: L'AlgerinoAuthor: SCHAuthor: JulComposer: SkalpAuto-generated by YouTube."
"ojpTpT5i-PI","Katy Perry - Electric","2021-05-14T04:00:18Z","UC-8Q-hLdECwQmaWNwXitYDw","KatyPerryVEVO","10","21.14.05","pokeman|katy perry|katy perry pokeman|katy|perry|electric|pokeman's 25 version|only wanna be with you|post malone|katheryn hudson|pikachu|captiol records|new katy perry|orlando bloom|smile|teenage dream|ur so gay|i kissed a girl|katy perry 2021","1915249","276719","3945","31291","https://i.ytimg.com/vi/ojpTpT5i-PI/default.jpg","False","False","Listen to “Electric” here: http://katy.to/electricID Katy Perry Complete Collection on Spotify: http://katy.to/SpotifyCompleteYD​Katy Perry Essentials on Apple Music: http://katy.to/AMEssentialsYD​Watch your favorite Katy videos on YouTube: http://katy.to/MusicVideosYD​ Credits:Directed by Carlos López Estrada Production Company: ObsidianExecutive Producer: Doug Klinger Head of Production: Anna Heinrich Producers: Nicole Jordan Webber, Andrew Chennisi, Yusef ChabaytaLabel Commissioner: Targa SahyounPost Producer: Julian ConnerAnimation: Maverick MediaFollow Katy Perry:Website: http://katy.to/WebsiteYD​Instagram: http://katy.to/InstagramYD​Twitter: http://katy.to/TwitterYD​Facebook: http://katy.to/FacebookYD​Weibo: http://katy.to/WeiboYD​VK: http://katy.to/VKPageYD​ Lyrics: (Electric)In the dark when you feel lostWanna be the best but at what costIf you're gonna stay hereNothing's ever changing, noBig world gotta see it allGotta get up even when you fallThere's no point in waiting, noOhhhThey’ll try to bring you downOhhhhBut you've got the power nowI know you feel it, feel itIf you believe it then you canThere’s no reason that this life can’t be electricOh I can see it, see itIf you believe it then you canThere’s no reason that this life can’t be electricLong road got a ways to goTook a big step but you're not aloneCause we got each otherThere's so much you’ll discoverHeadstrong but your heart is strongerStay calm walking through the fireI know you're gonna make it outOhhhThey’ll try to bring you downOhhhhBut you've got the power nowI know you feel it, feel itIf you believe it then you canThere’s no reason that this life can’t be electricOh I can see it, see itIf you believe it then you canThere’s no reason that this life can’tbe electricOhhhThey’ll try to bring you downOhhhYou're electric right now (Electric)OhhBut you’ve got the power nowYou’ve got the power now(Electric)You’ve got the power nowI know you feel it, feel itIf you believe it then you canThere’s noreason that this life can’t be electricOh I can see it, see itIf you believe it then you canThere’s no reason that this life can’t be electricOhhhThey’ll try to bring you downOhhhYou're electric right now (Electric)OhhBut, you’ve got the power nowOhhhYou’ve got the power nowYou’ve got the power now#KatyPerry​ #Electric #PokémonMusic video by Katy Perry performing Electric. © 2021 Capitol Records LLChttp://vevo.ly/Oowzt4"
"z47g1U_uajA","Les Tiktok des gens qui ont trop d'argent #2 (c’est de pire en pire)","2021-05-13T16:06:57Z","UCgl_xdd0kH27vMIZnE-_17w","ALEKS","24","21.14.05","[none]","189972","22256","383","738","https://i.ytimg.com/vi/z47g1U_uajA/default.jpg","False","False","Ces gens respirent la stabilité financière et ils le montrent mdrAlors la plupart du temps c'est rigolo mais parfois agaçant Mes autres réseaux :► Instagram : https://www.instagram.com/aleksytb► Tiktok : https://www.tiktok.com/@aleks.ytb► Twitter : https://twitter.com/AleksYtb► Snapchat : r7aleexBUSINESS INQUIRIES ONLY :contact@aleksytb.frMontage : @ArmandLesRouxALEKS"
"VNicgRZky50","J'ai acheté une maison ! (Et y'a du boulot...)","2021-05-13T16:00:08Z","UCCkpbiw1lI9CGIkgWEj5NQg","So Andy","26","21.14.05","so andy|andy rowski|andy raconte|rénovation|achat maison|décoration|déco|DIY|travaux maison","152411","14868","202","721","https://i.ytimg.com/vi/VNicgRZky50/default.jpg","False","False","Le début d’une nouvelle aventure que j’ai trop hâte de vous partager ! :)Tu peux me stalker ici si tu veux : Insta : @andyrowski https://www.instagram.com/andyrowskiTikTok @andyrowski https://vm.tiktok.com/ZSsBnpX2/☆ Mes tenues :Pantalon palazzo blanc : https://bit.ly/2RPx16QGilet en tricot : https://bit.ly/3w6GCFdDébardeur style corset : https://bit.ly/3fhjVayRobe à épaulettes beige : https://bit.ly/3vQFDJ0Gilet long blanc : https://bit.ly/2QaDfNXBoots blanches : https://bit.ly/2Rb5ixiEnsemble jogging vert : https://bit.ly/3y1UXnXSweat marron: https://bit.ly/2RIKMnMEt comme vous m’avez montré que vous étiez nombreux et nombreuses à lire la description alors un énorme bisou à toi parce que je suis très très heureuse que tu fasses partie des gens qui regardent mes vidéos ! Tu peux me laisser un petit 🐿 pour me montrer que tu as lu jusqu’au bout 💕"
"kRIMJdlNi0M","J'AI JAMAIS EU AUTANT DE CHANCE POUR UNE OUVERTURE DE BOOSTER POKÉMON ! (ma meilleure ouverture)","2021-05-13T12:26:17Z","UCOdKaYgvLlPuinUJ1z5Gm2g","MichouOff","24","21.14.05","michou|michouoff|michou off|michou pokémon|pokemon michou|booster pokemon|booster|ouverture|pokemon|chance|meilleur","800861","88293","834","3492","https://i.ytimg.com/vi/kRIMJdlNi0M/default.jpg","False","False","👉 Code Créateur dans la boutique Fortnite : michoucroute📸 Mon Instagram : http://bit.ly/MichouINSTA💙 Mon Twitter : http://bit.ly/MichouTweet💜 Mon Twitch : http://bit.ly/MichouTwitchSalut ! Aujourd'hui nouvelle vidéo ouverture de booster pokémon ! Aujourd'hui on s'attaque a une nouvelle edition de carte pokémon, on s'attaque aux boosters et coffret destinees occultes ! Objectif toujours le dracaufeu shiny et, sachez que je vais avoir une chance de fou dans cette ouverture de booster pokémon ! J'ai jamais eu autant de chance pour une ouverture de booster pokémon !Abonne-toi !🎁 Devenir sponsor sur iOS : http://bit.ly/SoutieniOS👦 Chaîne secondaire : http://bit.ly/BobbyYtb📧 Adresse mail Pro : michoucontactpro@gmail.com"
