video_id,title,publishedAt,channelId,channelTitle,categoryId,trending_date,tags,view_count,likes,dislikes,comment_count,thumbnail_link,comments_disabled,ratings_disabled,description
"QIfqRN3vzVQ","Стволы и монеты серебро. 20 лет под слоем пыли в гараже.","2021-04-18T13:22:29Z","UCtnDD2vM8S4FcznwWjKDnig","АУКЦИОН КОНТЕЙНЕРОВ В США","22","21.18.04","аукцион контейнеров|заброшенные|поиск клада|поиск предметов|приключения|нумизматика|золото|монеты|антиквариат|коллекции|находка|кладоискатели|серебро|оценка|техника|бренды|аукцион гаражей|копатель|аукцион в сша|редкие находки|storage wars|storage auctions|коп|коп монет|заработать деньги|сша|жизнь в сша","482631","33943","324","6393","https://i.ytimg.com/vi/QIfqRN3vzVQ/default.jpg","False","False","Цель: купить на аукционе заброшенный гараж, найти ценные предметы, оценить, продать и заработать. Золото, монеты, антиквариат, техника и другое.  Каждый, кто здесь участвует в осмотре находок - соучастник (в хорошем смысле этого слова).Присоединяйтесь к обсуждению и оценке! Приятных просмотров!Отправка посылок из США   https://usanadivane.com/   (номер кабинета - это SUITE#, свой адрес надо добавить в раздел получатели)почта  для победителей розыгрыша и реклама  skladusainfo@gmail.cominstagram продажи    https://www.instagram.com/skladinfo/FB  https://www.facebook.com/skladusainfoVK https://vk.com/id551987786"
"-hehYFIFlIU","Відео обстрілу українських військових під Горлівкою","2021-04-18T10:31:59Z","UC-wWyFdk_txbZV8FKEk0V8A","Радіо Свобода Україна","25","21.18.04","радіо свобода|україна|radiosvoboda|війна донбас|война донбасс|обстрел всу|обстрел горловка|бои горловка|відео зсу|відео обстріл зсу|передова|передові позиції|шуми|оос|ато|новости донбасса|війна|обострение|донбас новости|донбасс новости|війна росія|агресія росія|війська|война оос|війна оос","179575","4069","388","581","https://i.ytimg.com/vi/-hehYFIFlIU/default.jpg","False","False","Неподалік Горлівки, що на Донеччині, не вщухає напруженість. Контрольовані Росією сили продовжують вести провокаційний вогонь, обстрілюючи українських військових. Так поблизу Горлівки лунали вибухи із важкого озброєння. У нічний час в бік українських військових цілили із стрілецької зброї. Як повідомляє кореспондент Радіо Свобода, наразі жертв немає. Радіо Свобода побувало на передових позиціях під Горлівкою та зафільмувало обстріли позицій ЗСУ з боку окупованої території.Підписатись на наші каналиРадіо Свобода Україна: http://bit.ly/radiosvoboda-ukraineПрограми та трансляції: http://bit.ly/radiosvoboda-youtubeМи у соцмережахhttps://www.facebook.com/radiosvoboda.org/https://twitter.com/radiosvobodahttps://instagram.com/radio.svobodahttps://telegram.me/svoboda_radiohttps://vk.com/radiosvobodauahttps://ok.ru/radiosvobodaApp Store http://apple.co/2ODmqdYGoogle Play http://bit.ly/2ONTn7g#Донбас #РадіоСвобода #RadioSvoboda"
"N8ENUmAL3Y4","КҮНДӨШҮ ҮН КАТТЫ/ЖОЛДОШУМА АЯЛДЫ ӨЗҮМ АЛЫП БЕРГЕНМИН/БАЛАНЫ БЕРБЕЙБЫЗ/КАЙЫН ЖУРТУ АГЫНАН ЖАРЫЛДЫ","2021-04-18T10:55:06Z","UCChd6d_O2SxlQa-spP-5C7Q","Адыл Акжол уулу","29","21.18.04","Адыл|Акжол|уулу|КАБАР|НОВОСТИ|тез|кабар|азаттык|жаңылыктар|бүгүнкү|новостии|оштв|санжар|калматай|күндөшү|үн катты|бала|талаш|баланы|бербейбиз|өзү артис|аяя|үйгө|алмашам|чыр|күншөү|мына|чындык|кайын|журту|үн|катты","115322","1768","321","6963","https://i.ytimg.com/vi/N8ENUmAL3Y4/default.jpg","False","False","✅ Эгер сиз биздин каналга жарнама бергиңиз келсе: 0554 910 105✅ Если вы хотите разместить рекламу на нашем канале: 0554 910 105Каналга катталыңыздар!!!https://www.youtube.com/channel/UCChd6d_O2SxlQa-spP-5C7QКҮНДӨШҮ ҮН КАТТЫ/ЖОЛДОШУМА АЯЛДЫ ӨЗҮМ АЛЫП БЕРГЕНМИН/БАЛАНЫ БЕРБЕЙБЫЗ/КАЙЫН ЖУРТУ АГЫНАН ЖАРЫЛДЫ"
"pyN_ROjunnA","ИЗМЕНА МУЖА!? У НАШЕЙ ГЕРОИНЕ ЕСТЬ РЕШЕНИЕ;) Русские мелодрамы 2021! РЕФЕРЕНТ","2021-04-18T10:09:09Z","UCbt1nwQXG6PZIn8iEgvMyVw","КиноМурка","1","21.18.04","мелодрамы новинки|фильмы 2021|русские мелодрамы|русские|фильмы|мелодрамы|hd|мелодрамы про любовь|фильм мелодрама|фильмы о любви|russkiye melodramy|novinki melodram|melodrama|сериал|новинка|премьера|сериалы новинки|2021|кино новинки|мелодрамы 2021|сериалы 2021|русские сериалы|российские мелодрамы 2021|русские сериалы 2021|сериалы онлайн|мелодрамы 2020|ИЗМЕНА МУЖА!? У НАШЕЙ ГЕРОИНЕ ЕСТЬ РЕШЕНИЕ;) Русские мелодрамы 2021! РЕФЕРЕНТ","237896","1185","200","172","https://i.ytimg.com/vi/pyN_ROjunnA/default.jpg","False","False","https://www.youtube.com/channel/UCbt1nwQXG6PZIn8iEgvMyVw Подписывайся на КиноМурка:)Узнав об измене мужа, Марина решает начать новую жизнь. Но квартира, в которой они с Андреем и их сыном Глебом провели лучшие годы, принадлежит свекрови Елене Константиновне, которая невестку терпеть не может. Да и в свои двадцать семь Марина в совершенстве освоила лишь профессию хранительницы домашнего очага. А свекровь подговаривает Андрея лишить Марину ее главной жизненной ценности — сына."
"TexIua-a8Iw","ТЕЗКОР! ШОХЖАХОН ЖЎРАЕВ НОХУШ ХАБАР АЙТДИ_ЧЕГАРАДА ОТИШМА","2021-04-18T13:31:07Z","UCNKBfzUdZQpcSGlJ_OsK_Dg","Xabarlar uz","25","21.18.04","Ўзбекистон|Uzbekiston|Тезкор Хабарлар|Ўзбек|ЯНГИЛИКЛАР|ТОШКЕНТДА|УЗБДА|Марузалар|Абдуллох домла|GM|Rossiyada|uzbek qizlari|o'zbek serial|узбек сериал|o'zbek film|ТУРКИЯДА|ОДДИЙ РЕЙСЛАР|ДАХШАТ|ИНТЕРВЮ|INTERVYU|СВЕТ|ГАЗ|УРУШ|xabarlar uz|o'zbek qizlari|muhim xabarlar","180076","3053","239","245","https://i.ytimg.com/vi/TexIua-a8Iw/default.jpg","False","False","#StayHome #WithMe #остатьсядома @O'zbekiston milliy teleradiokompaniyasi  Ассалому алейкум. Хаммага кун хайирли бўлсин. Хабарлар уз Сизларга енг сўнги ва сифатли тасдиқланган янгиликларни етказишда давом этади. Агарда каналда янги бўлсангиз лайк босиб обуна бўлишни унутманг куннинг долзарб мавзулари ва янгиликларидан сизларни биринчилардан бўлиб хабардор этамиз. Энг тезкор янгиликлар ва мухим хабарлар фақат Хабарлар уз ютуб каналида кузатинг саломат бўлинг. ЭСЛАТМА !!!                                                         ⚠️⚠️⚠️⚠️⚠️⚠️⚠️⚠️⚠️⚠️⚠️Все права защищены. Полное или частичное копирование материалов запрещено !!!⚠️⚠️⚠️⚠️⚠️⚠️⚠️⚠️⚠️⚠️⚠️⚠️⚠️Barcha huquqlar himoyalangan.  Materiallarni to'liq yoki qisman nusxalash taqiqlanadi !!! #StayHome #WithMe #Uyda #yangivideo #videouzb #uzbvideo #xitvideo #topvideo #trendyoutube #uzbekistom #newvideo #topuzb #videouzb #uzbekvideo #premyera #премьера #[xabarlaruz DIQQAT🛑 Xurmatli kanalimiz kuzatuvchilari sizlarga shuni ma'lum qilamizki, endilikda xabarlar uz kanali orqali chiqarilgan video yoki postda siz o'z fikirlaringizni qoldirishda odob, axloq qoiydasiga rivoya qilishingizni so'rab qolar edik. Yangi chiqqan qonunga ko'ra, biror bir shaxsni xaqorat qilish uni qadir qimmatini kamsitish va jamoatni xar xil oqimlarga davat qilish, xalq tinchligini buzuvchi xatti xarakat va xozirgi Prezident olib borayotgan siyosatga qarshi chiquvchi xar xil so'zlarni yozish TAQIQLANADI aks xolda qonunda belgilanagn javobgarlikka tortilishingiz mumkin...  P/S  Eslatish bizdan amal qilish sizdan...🔴O‘ZBEKISTON RESPUBLIKASINING QONUNIOMMAVIY AXBOROT VOSITALARI TO‘G‘RISIDA🔴1-modda. Ommaviy axborot vositalariGazetalar, jurnallar, axborotnomalar, byulletenlar, axborot agentliklari, televideniye (kabelli, efir-kabelli televideniye) va radioeshittirishlar, hujjatli kino, elektron axborot tizimi, shuningdek, doimiy nomga ega bo‘lgan, davlat tasarrufidagi, mustaqil va boshqa ommaviy davriy nashrlar ommaviy axborot vositalaridir.Ommaviy axborot vositalari qonun hujjatlarida belgilangan tartibda ilovalar nashr etishi mumkin.2-modda. Ommaviy axborot vositalari erkinligiO‘zbekiston Respublikasida ommaviy axborot vositalari erkin bo‘lib, ular O‘zbekiston Respublikasi Konstitutsiyasiga, ushbu Qonunga va boshqa qonun hujjatlariga muvofiq faoliyat ko‘rsatadi.Ommaviy axborot vositalari axborotni izlash, olish va tarqatish huquqidan foydalanadilar hamda o‘zlari e’lon qilayotgan axborotning to‘g‘riligi va haqqoniyligi uchun qonun hujjatlarida belgilangan tartibda javobgar bo‘ladilar.3-modda. So‘z erkinligiHar kim ommaviy axborot vositalarida chiqish, o‘z fikri va e’tiqodini oshkora bayon etish huquqiga egadir.4-modda. Senzuraga yo‘l qo‘yilmasligiO‘zbekiston Respublikasida ommaviy axborot vositalarini senzura qilishga yo‘l qo‘yilmaydi. E’lon qilinayotgan xabarlar yoki materiallar oldindan kelishib olinishini, shuningdek, ularning matni o‘zgartirilishini yoki butunlay nashrdan olib qolinishini (efirga berilmasligini) talab qilishga hech kimning haqqi yo‘q.6-modda. Ommaviy axborot vositalaridan foydalanishda suiiste’mollarga yo‘l qo‘yilmasligi.Ommaviy axborot vositalaridan O‘zbekiston Respublikasining mavjud konstitutsiyaviy tuzumini, hududiy yaxlitligini zo‘rlik bilan o‘zgartirishga da’vat qilish, urush va zo‘ravonlikni, shafqatsizlikni, milliy, irqiy va diniy adovatni targ‘ib etish, davlat sirini yoki qonun bilan qo‘riqlanadigan o‘zga sirni oshkor etish, jinoiy javobgarlikka sabab bo‘ladigan boshqa xatti-harakatlarni sodir qilish maqsadida foydalanilishiga yo‘l qo‘yilmaydi.Ommaviy axborot vositalari orqali fuqarolarning sha’ni va qadr-qimmatini tahqirlash, ularning shaxsiy hayotiga aralashish taqiqlanadi.Prokuror, tergovchi yoki surishtiruvchining yozma ruxsatisiz dastlabki tergov materiallarini e’lon qilish, muayyan ish bo‘yicha sud qarori chiqmasdan turib yoki sudning hal qiluv qarori yoxud hukmi qonuniy kuchga kirmay turib, uning natijalarini taxmin qilish yoki sudga o‘zgacha yo‘l bilan ta’sir ko‘rsatish, nomini ko‘rsatmaslik sharti bilan ma’lumot bergan shaxsning nomini oshkor qilish (sud oshkor etishni talab qiladigan hollar bundan mustasno) taqiqlanadi.10-modda. Axborot manbaini oshkor etmaslikOmmaviy axborot vositasi xabar, ma’lumot, fakt yoki dalillar taqdim etgan manbaning yoki taxallusini qo‘ygan muallifning nomini ularning yozma roziligisiz oshkor etishga haqli emas.Ommaviy axborot vositasi axborot manbaining yoki taxallusini qo‘ygan muallifning iltimosiga binoan sudda uning nomidan ishtirok etishi mumkin. O'zbekiston Respublikasi Konstitutsiyasi🔴🔴🔴29-modda.Har kim fikrlash, so‘z va e’tiqod erkinligi huquqiga ega. Har kim o‘zi istagan axborotni izlash, olish va uni tarqatish huquqiga ega, amaldagi konstitutsiyaviy tuzumga qarshi qaratilgan axborot va qonun bilan belgilangan boshqa cheklashlar bundan mustasnodir. Fikr yuritish va uni ifodalash erkinligi faqat davlat siri va boshqa sirlarga taalluqli bo‘lgan taqdirdagina qonun bilan cheklanishi mumkin..."
"8sUJW31Bt64","ОНО ТУТ!! НОЧЬ В МАШИНЕ С КЛОУНОМ ОНО! МЫ ПОКИНУЛИ НАШ ДОМ НАВСЕГДА ИЗ-ЗА ПРОЕКТА ОНО! НАС ВЫГНАЛИ!","2021-04-17T11:48:45Z","UClglGxl1v55UIAIgxomrC9Q","DIANA DI","24","21.18.04","DIANA DI|Диана ди|ди|диана|di|diana|ОНО ТУТ!! НОЧЬ В МАШИНЕ С КЛОУНОМ ОНО! МЫ ПОКИНУЛИ НАШ ДОМ НАВСЕГДА ИЗ-ЗА ПРОЕКТА ОНО! НАС ВЫГНАЛИ!|оно тут|ночь в машине с клоуном оно|ночь в машине с|ночь в|машина|клоун оно|оно|клоун|мы покинули наш дом на всегда из за проекта оно|проект|проект оно|мы покинули наш дом|уехали из дома|переезд|наш дом|нас выгнали|выгнали|выгнали из дома|мистика|мистика диана ди|сериал|сериал диана ди|мистический сериал|сериал клоун","227342","21591","657","3914","https://i.ytimg.com/vi/8sUJW31Bt64/default.jpg","False","False","РЕБЯТ, если хотите больше видео с Бэль и Луной, то можете смотреть их тут: https://youtu.be/VcbkideEN-8И ПОДПИШИТЕСЬ на их канал!!!Мой канал по ИГРАМ: https://bit.ly/2HrJOaqОНО ТУТ!! НОЧЬ В МАШИНЕ С КЛОУНОМ ОНО! МЫ ПОКИНУЛИ НАШ ДОМ НАВСЕГДА ИЗ-ЗА ПРОЕКТА ОНО! НАС ВЫГНАЛИ!Подпишись на меня: https://instagram.com/diana_ddi/Мой резервный канал: https://www.youtube.com/channel/UCAm_ZpEZDBALXqmZBqLkp7gСМОТРИ ЕЩЕ:Прямой эфир с клоуном: https://youtu.be/fxkqeHlpkV4Заказали в Макдоналдсе на 666р: https://youtu.be/Eozlt396DN4Нам разбили окно: https://youtu.be/i7kgKoAyTfcКлоун оно украл кнопку: https://youtu.be/jxhBDvW5aXIУкрали компьютер: https://youtu.be/BH353nN8tKkПрослушка в машине: https://youtu.be/tcUYQmgTslgБез тормозов 180км/ч: https://youtu.be/hFio8K2QBxcСкрытая камера в машине: https://youtu.be/s3xdkZ20UUYПосле того как мы ➡Мое предыдущее видео: https://youtu.be/P4OffOBHCeIПодпишись на меня, чтобы не пропустить новые ролики Большое спасибо за лайк и подписку! 🔽Кто я такая? 🔽 Всем привет, меня зовут Диана. Я очень веселый позитивный человек! Мои ролики самые смешные! На моем лайф канале вы можете увидеть всю мою жизнь ... Это приключения, пранки, челленджи, дий, лайфхаки, мистику, сериалы и вообще всю мою веселую жизнь! Наверное уже все знают, но я все равно напишу, я люблю снимать видео вместе со своей собакой Сибирской хаски, ее зовут Луна!🔽Мои социальные сети 🔽1. YouTube канал второй: https://goo.gl/ofmbn12. YouTube канал о животных: https://goo.gl/b8pcDh3. Подпишись на мой Инстаграм: https: //www.instagram .com / diana_ddi /4. Подпишись на Инстаграм моей собачки Луны:https://www.instagram.com/dianadi_ani ...5. Моя страница вк: https://vk.com/diiana_di6. Группа ВК DIANA DI: https://vk.com/diana_di_official_public7. Группа моих животных ВК: https://vk.com/public_dianadi_animals8. Мой парень Саша ВК: https://vk.com/id444588093►РЕКЛАМА на канале: https://vk.com/reklamadianadi✅Сотрудничество: dianadi.lotus@gmail.com9. Реклама НА МОЕМ КАНАЛЕ - https://goo.gl/V5FCcWМОИ КЛИПЫ: https://goo.gl/nxTKh9Плейлист РУМ ТУР ОБЗОР: https://goo.gl/kM1NXRПлейлист МИСТИКА: https://goo.gl/s9dJ9PПлейлист экспериментов - https://goo.gl/apV9r0Плейлист челленджей - https://goo.gl/9sMLrZПлейлист пранков - https://goo.gl/X1wILNПлейлист лайфхаков - https://goo.gl/XG3AkZПлейлист DIY - https://goo.gl/wuZdBAОни все интересные ... Подпишись, чтобы не пропустить кого вы скоро заведем в нашу дружную семью!1. Обзор зоотоваров: https://goo.gl/a1sxod2. Жизнь Луны: https://goo.gl/pboSQA3. Дрессировка собаки: https://goo.gl/qwiwPT4. Эксперименты: https://goo.gl/k5YLYX5. Хочешь хаски? Посмотри что она сломала дома: https://goo.gl/asQvbc6. Распространенные проблемы собак:https://goo.gl/qA43Qv7. Пранки над родителями: https://goo.gl/ozrgsW8. Самые новые ролики: https://goo.gl/9s9qGt9. Реакции: https://goo.gl/3qs9ou10. Тайная жизнь домашних животных: https://goo.gl/nYUzFB11. Новые покупки для собачки: https://goo.gl/guKhekпокупки для собачки: https://goo.gl/guKhek🔴Подпишись на этот канал, чтобы не пропустить новые видео! https://goo.gl/HHGi3V 🔴 И не забывай подписаться на канал HUSKY LUNA: https://goo.gl/b8pcDhБОЛЬШОЕ СПАСИБО ВСЕМ ЗА ПОДПИСКУ И ЛАЙК!"
"rx2UIOI5rVE","Проверил ЛАЙФХАКИ из ТИК ТОКА.. **ЭТО ВЗРЫВ МОЗГА**","2021-04-17T10:21:36Z","UCLjVmPadcJqKLiX3VCQfFwg","МИША ВАЙС","24","21.18.04","Проверил ВИРУСНЫЕ ЛАЙФХАКИ из ТИК ТОКА ЭТО ВЗРЫВ МОЗГА|ЛАЙФХАКИ|проверил лайфхаки из тик тока|ЛАЙФХАКИ из ТИК ТОКА|тик ток|tiktok|tik tok|тикток|тик ток лайфхаки|проверка лайфхаков|топ лайфхаков|проверка лайфхаков из тик тока|невероятный лайфхак","422195","48489","705","1380","https://i.ytimg.com/vi/rx2UIOI5rVE/default.jpg","False","False","Проверил ЛАЙФХАКИ из ТИК ТОКА.. **ЭТО ВЗРЫВ МОЗГА**Мой Instagram: https://www.instagram.com/mishawice/Мой TikTok: https://www.tiktok.com/@mishawice?В этом видео я с моей подругой Яной проверил ВИРУСНЫЕ ЛАЙФХАКИ из ТИК ТОКА!  Некоторые ЛАЙФХАКИ оказались не рабочие, а некоторые просто *ВЗОРВАЛИ МНЕ МОЗГ*  Досмотрите это видео до конца что-бы узнать какой ЛАЙФХАК оказался рабочим, а какой НЕТ! Приятного ПРОСМОТРА! Поддержи нас твоей ПОДПИСКОЙ и ЛАЙКОМ!"
"0N30hRdgT1w","Мы снова ВОЛШЕБНИКИ!! Хасячья магия вернулась!! (Хаски Бандит) Говорящая собака","2021-04-18T05:00:16Z","UC0RoWfEY2x5wmFASOk-wODQ","Хаски Бандит","15","21.18.04","мистер бубл|хаски бандит|mister booble|хаски|бублик рыжая сопля|сибирский хаски|бандит и бублик|хаски видеоблогер|говорящая собака|собака|чем кормить хаски|щенок хаски|сабаки|сабака|собачка|хаски бублик|песик|песики|щенок видео|mr Booble|хаски собака|щенки|питомцы|маламуты|хаски маламут|щенки хаски|хаски щенки|хаски щенок|домашние животные|бублик|бандит","69309","5871","127","401","https://i.ytimg.com/vi/0N30hRdgT1w/default.jpg","False","False","Мой ТИКТОК: https://www.tiktok.com/@banditbooblekorjik Тикток Крутых деток: https://www.tiktok.com/@cool_kids_serial_🐺 Группа VK - https://vk.com/HuskyBanditБУБЛИК: https://www.youtube.com/channel/UCFvYljGofVfAm83Ixr6C5eQКОРЖИК: https://www.youtube.com/channel/UCnAlWuDdDTan1EjIKe_FZdAПОДПИШИСЬ НА COOL KIDS КУХНЯ: https://clck.ru/NVgNpПОДПИШИСЬ НА COOL KIDS HOUSE (Детский дом): https://clck.ru/HWEy4ПОДПИШИСЬ НА канал COOL KIDS (Крутые Детки) https://clck.ru/FPfcz Подпишись на мой канал: http://www.youtube.com/channel/UC0RoWfEY2x5wmFASOk-wODQ?sub_confirmation=1Меня зовут Бандит и я первый в России хаски-видеоблогер! 😂 И никакие мы не няши, а самые настоящие злобные волки! Так что к тем, кто не подпишется на мой канал, я приду ночью и укушу за бочок! 😂😂😂🐺🐺🐺🐾🐾🐾🐺 Группа VK - https://vk.com/HuskyBandit🐺 Инстаграм - https://www.instagram.com/bandit_dogvlog/🐺 YouTube - https://www.youtube.com/c/HuskyBandit#хаскибандит #хаскибублик #коргикоржик"
"ankd0lNh-4Y","ТРЕШ ОБЗОР фильма ВЫМИРАЮЩАЯ ПОРОДА [легенда о Пирожнике]","2021-04-17T16:11:59Z","UCZnxD9WE_p6YgrjK6EKNvOg","TerlKabot channel","23","21.18.04","Треш Обзор фильма|смешной обзор фильма|обзор на фильм|кинообзор|терлкабот|тэрлкэбот|терл кэбот|терлкебот|terl kabot|terl kebot|смешное|юмор|обзор|кинокритика|кино|фильмы|канал о кино|канал о фильмах|terlkabot|Terlkabot channel|обзор фильма|треш обзор|Слешер|обзор слешера|Поворот не туда|Вымирающая порода|Вымирающая порода обзор|Поворот не туда обзор|Легенда о Пирожнике|Александр Пирожник Пирс|Смешной треш обзор фильма","274254","29487","296","1313","https://i.ytimg.com/vi/ankd0lNh-4Y/default.jpg","False","False","https://playwt.link/terlkabot — забрать бонус и скачать бесплатно War Thunder!Стать спонсором - https://www.youtube.com/channel/UCZnxD9WE_p6YgrjK6EKNvOg/joinМОЙ МЕРЧ                 - https://clck.ru/RzusQСмешной Треш Обзор фильма ВЫМИРАЮЩАЯ ПОРОДА.Классический слешер про каннибалов, как вы любите, а не хрен пойми что) Это конечно не поворот не туда, а скорее поворот туда, но героям фильма от этого не лучше.Вступай в мою группу в ВК               - http://vk.com/club60235272Мой игровой канал - https://www.youtube.com/channel/UCXEASFTVush5hHRk5trBE8QПодписывайся на живой канал      - http://goo.gl/SPxFU9 Добавляйтесь в друзья                     - https://vk.com/id191491486Мой инстаграм                      - https://www.instagram.com/terlkabot/"
