video_id,title,publishedAt,channelId,channelTitle,categoryId,trending_date,tags,view_count,likes,dislikes,comment_count,thumbnail_link,comments_disabled,ratings_disabled,description
"cT7wOSOZVoc","Minecraft Survivor VS 3 Hitmen...","2021-03-11T08:00:15Z","UCTkXRDQl0luXxVQrRQvWS6w","Dream","20","21.11.03","Dream Minecraft|dream Minecraft youtube|minecraft|dream|Minecraft hitmen|Minecraft Survivalist vs 3 hitmen|Speedrunner vs 3 hunters|Speedrunner vs 4 hunters|Speedrunner vs someone trying to stop them|Beating Minecraft but my friend tries to stop me|Minecraft but water rises every minute|minecraft but lava rises every minute|minecraft but challenge|minecraft challenge|challenge|minecraft 1.14|beating minecraft|rematch|finale|finale rematch|grand finale|grand","5202696","739022","6284","60446","https://i.ytimg.com/vi/cT7wOSOZVoc/default.jpg","False","False","Minecraft Survivor VS 3 Hitmen... This was incredible.Click the Merch link below for a chance to play in a Manhunt video with me! Merch: https://www.dream.shopFollow my socials:➽ Twitter - @dream➽ Instagram - @dreamwastaken➽ Snapchat - @dreampublicPatreon (Plugin): https://www.patreon.com/DreamWasTakenBadBoyHalo:  @BadBoyHalo George:  @GeorgeNotFound Sapnap:  @Sapnap We decided to call this series Minecraft Hitmen. This video there are THREE hunters/hitmen instead of just one.This is a new Minecraft but, 1.16 challenge that we have decided to try. I try to survive for 100 minutes, while my friend George AND my friend Sapnap AND my friend BadBoyHalo tries to prevent me from surviving. Every 10 minutes there is a 10 minute period of invincibility. They can see me through walls, and the world is small. It's a chase, a race, and it's super intense. A lot of laughs. I love doing these challenges.If this video gets 1,500,000 likes we'll do it again!Manhunt T-Shirt Details:Each and every Manhunt t-shirt purchased will be assigned a unique number. Limit 10 Manhunt t-shirts per order.In late April after all shirts have been processed, we will randomly select one unique Manhunt t-shirt number for invitation into a 2021 Dream Manhunt video. Dream will announce the associated order number (and perhaps country and initials) via social media. The lucky customer does not need to see the announcement or know their order number, because we will make reasonable attempts to contact the customer using the contact information provided at checkout. Do not fall for scams that ask you to provide sensitive information or click, install or open anything! If contact attempts are not successful or the invitation is not accepted within 2 business days, we will repeat the same process every 2 business days approximately until an invitation is accepted. The non-transferable invitation and video participation have no retail or monetary value for the purchaser of the Manhunt t-shirt which is sold at fair value and is non-refundable. Adequate computer, internet, video and other capabilities will be arranged if necessary for the sole purpose of video participation.Employees and their families are not eligible for selection.Not Minecraft, But Water Rises or Minecraft, But Lava Rises, or any other but challenge like that. This is a speed runner / survivalist in Minecraft against a killer / assassin / hitmen#MinecraftHitmen"
"sG9rX6Ifzhw","Piers and Alex Clash Over Prince Harry and Meghan’s Accusations of Racism | Good Morning Britain","2021-03-09T10:58:19Z","UCq18eeL7D9Vd8DhjMcLh9QQ","Good Morning Britain","24","21.11.03","good morning britain|breakfast show|news|morning news|gmb|good morning britain interview|itv|piers morgan|susanna reid|Talk Shows - Topic","7237892","72178","12944","0","https://i.ytimg.com/vi/sG9rX6Ifzhw/default.jpg","True","False","Following the Duke and Duchess of Sussex’s landmark interview with Oprah Winfrey, today’s Good Morning Britain shared the reaction to the revelations, including those about Meghan’s suicidal thoughts and allegations of racism within the Royal family.Subscribe now for more! http://bit.ly/1NbomQaBroadcast on 09/03/2021Like, follow and subscribe to Good Morning Britain!The Good Morning Britain YouTube channel delivers you the news that you’re waking up to in the morning. From exclusive interviews with some of the biggest names in politics and showbiz to heartwarming human interest stories and unmissable watch again moments. Join Susanna Reid, Piers Morgan, Ben Shephard, Kate Garraway, Charlotte Hawkins and Sean Fletcher every weekday on ITV from 6am until 9 every weekday!ITV Hub: https://bit.ly/37kf3wDWebsite: http://bit.ly/1GsZuhaYouTube: http://bit.ly/1Ecy0g1Facebook: http://on.fb.me/1HEDRMbTwitter: http://bit.ly/1xdLqU3http://www.itv.com#GMB #PiersMorgan #SusannaReid"
"OyREzWcCPDo","Russell Brand Reacts To Meghan & Harry Interview","2021-03-10T20:39:36Z","UCswH8ovgUp5Bdg-0_JTYFNw","Russell Brand","27","21.11.03","Russell Brand|Brand Russell|BrandThe|Russell Brand video|Russell Brand news|Russell Brand politics|News|Brand|politics|Russell|Meghan Markle|Prince Harry|Meghan|Harry|Royal|royals|royal family|the queen|Queen|Prince Charles|prince william|kate|Oprah|clintons|clinton|thatcher|JKF|george bush|bush|buckingham palace|interview|reaction|reacts","769189","25733","1748","7415","https://i.ytimg.com/vi/OyREzWcCPDo/default.jpg","False","False","Reaction to Meghan Markle and Prince Harry's Primetime interview with Oprah. Elites are taking over! Our only hope is to form our own. To learn more join my cartel here https://www.russellbrand.com​/join and get weekly bulletins too incendiary for anything but your private inbox.*not a euphemismListen to my Under The Skin podcast to hear from guests including #JonathanHaidt, #JordanPeterson, #Naomi Klein, #KehindeAndrews, #AdamCurtis and #VandanaShiva.Get a one month free trial at http://luminary.link/russell​My Audible Original, ‘Revelation', is released on 25 MarchMy Audible Original, ‘Revelation', is released on 25 MarchUS: http://adbl.co/revelationUK: http://adbl.co/revelationukAU: http://adbl.co/revelationauCA: http://adbl.co/revelationcaInstagram: http://instagram.com/russellbrand/Twitter: http://twitter.com/rustyrocketsProduced by Gareth Roy"
"BMDGTsa_Qq0","James Newman - Embers - United Kingdom 🇬🇧 - Official Music Video - Eurovision 2021","2021-03-11T11:18:13Z","UCRpjHHu8ivVWs73uxHlWwFA","Eurovision Song Contest","24","21.11.03","Eurovision Song Contest|2021|Open Up|Rotterdam|United Kingdom|James Newman|Embers|Official|Music Video","168910","9236","1034","1886","https://i.ytimg.com/vi/BMDGTsa_Qq0/default.jpg","False","False","James Newman will represent the United Kingdom at the Eurovision Song Contest 2021 with the song Embers.-Stream or buy Embers: https://JamesNewman.lnk.to/Embers!ESC-If you want to know more about the Eurovision Song Contest, visit https://eurovision.tvShop the official Eurovision Song Contest merchandise: https://shop.eurovision.tv/Follow us on Instagram: https://www.instagram.com/eurovision Follow us on Twitter: https://twitter.com/EurovisionFollow us on Facebook: https://www.facebook.com/EurovisionSongContest/"
"11ZcEnYiz0s","Why Meghan and Harry's son Archie isn't already a prince - ITV's Chris Ship explains | Newshub","2021-03-10T21:00:25Z","UCWq564ONoREJprMNhewS6Sw","Newshub","25","21.11.03","Newshub|Meghan|Markle|Prince|Harry|Archie|Royal|Titles|ITV|Editor|Chris|Ship|Correspondent|Commentator|Oprah|Winfrey|Interview|CBS|Allegations|Fact|Institution|Family|Rules|Who|What|Where|When|How|Why|The|Firm|UK|United|Kingdom","137303","1533","224","0","https://i.ytimg.com/vi/11ZcEnYiz0s/default.jpg","True","False","ITV's Chris Ship clarifies some royal rules after questions popped up from Meghan and Harry's interview with Oprah Winfrey. ➡️ SUBSCRIBE: https://bit.ly/3kQM2OS​​See more: https://www.newshub.co.nz/home/entertainment/2021/03/why-is-baby-archie-not-a-prince-meghan-reveals-it-s-more-than-just-the-palace-s-rules.htmlYou're joining us on the official YouTube channel for Discovery NZ's Newshub. Here you will find livestreams and news videos from our award-winning team of journalists working across our bulletins and shows - The Project NZ, The AM Show and Newshub Nation.* Like Newshub on Facebook: https://bit.ly/2SOOIR3​​​* Follow Newshub on Twitter: https://bit.ly/33Vru29​​​* Sign up for the Newshub Now newsletter: https://bit.ly/33S4fWp​​​* Follow Newshub on Instagram: https://bit.ly/2KUlxWWFor all footage l​​icencing enquiries please visit: https://www.discoverycorporate.co.nz/home/contact-us/commercial-footage-request.html"
"Lc7o7ZB1Cow","Piers Morgan leaves role on Good Morning Britain after row over Meghan comments | ITV News","2021-03-09T22:52:31Z","UCFQgi22Ht00CpaOQLtvZx2A","ITV News","25","21.11.03","[none]","1243892","11019","2401","0","https://i.ytimg.com/vi/Lc7o7ZB1Cow/default.jpg","True","False","Piers Morgan has left his role as a presenter on Good Morning Britain, ITV has announced.The announcement comes after broadcasting regulator Ofcom launched an investigation after it received more than 41,000 complaints regarding comment made by the presenter following Harry and Meghan's interview with Oprah Winfrey.In a statement, the broadcaster said: Following discussions with ITV, Piers Morgan has decided now is the time to leave Good Morning Britain.ITV has accepted this decision and has nothing further to add.• Subscribe to ITV News on YouTube: http://bit.ly/2lOHmNj • Get breaking news and more stories at http://www.itv.com/newsFollow ITV News on Facebook: https://www.facebook.com/itvnews/ Follow ITV News on Twitter: https://twitter.com/itvnews Follow ITV News on Instagram: https://www.instagram.com/itvnews/"
"oT3XR1e1Aoo","Met police officer arrested on suspicion of murder after disappearance of Sarah Everard - BBC News","2021-03-10T22:23:37Z","UC16niRr50-MSBwiO3YDb3RA","BBC News","25","21.11.03","bbc|bbc news|news|Sarah|Everard|33|Metropolitan|Police|officer|policeman|arrest|arrested|suspected|suspicion|murder|disappearance|disappeared|Met|commissioner|Cressida|Dick|human|remains|Ashford|Kent|identified|indentification|Dame|suspect|shockwaves|anger|force|rare|woman|women|abducted|abduction|London|streets|family|Huw Edwards|correspondent|Lucy Manning|Daniel Sandford|home|affairs","480907","3853","327","0","https://i.ytimg.com/vi/oT3XR1e1Aoo/default.jpg","True","False","A serving Metropolitan Police officer has been arrested on suspicion of murder, following the disappearance of a woman in south London last week. Sarah Everard, who was 33, was last seen a week ago on her way home from a friend's house. The Metropolitan Police commissioner Dame Cressida Dick revealed tonight that “what appear to be human remains” have been found near Ashford in Kent but those remains have not yet been identified. Dame Cressida said the news that the suspect was one of her officers had sent shockwaves and anger throughout the force.  She also said it was “incredibly rare” for a woman to be abducted from the capital’s streets and her thoughts were with Sarah Everard’s family. Huw Edwards presents BBC News at Ten reporting by special correspondent Lucy Manning and home affairs correspondent Daniel Sandford. Please subscribe HERE http://bit.ly/1rbfUog#BBCNews"
"8P8sAhYF3hc","Dream - Minecraft Hitmen Extra Scenes (Hitmen 2)","2021-03-11T08:44:57Z","UChU3JRloULzdFX3aCu7BiSA","DreamXD","22","21.11.03","[none]","483629","82066","274","7558","https://i.ytimg.com/vi/8P8sAhYF3hc/default.jpg","False","False","This is extra scenes from Dream's channel of the Minecraft Survivor VS 3 Hitmen video. We react to what happened during the video and talk about it.Manhunt Merch: https://www.dream.shopOriginal Video: https://youtu.be/hgdSJdeGF_0 on  @Dream This video was crazy fun and intense. Definitely one of the hardest challenges.Minecraft challenge videos are fun to do :)"
"nj5Bo_T0o7o","Sarah Everard: Serving Met Police officer arrested on suspicion of murdering missing woman","2021-03-10T17:09:59Z","UCPgLNge0xqQHWM5B5EFH9Cg","The Telegraph","25","21.11.03","Telegraph|News|sarah everard|Wayne Couzens|deal|kent|ashford|metropolitan police|clapham","530015","1246","256","0","https://i.ytimg.com/vi/nj5Bo_T0o7o/default.jpg","True","False","A serving Metropolitan Police officer who works in the Diplomatic Protection Command in Westminster has been arrested on suspicion of murdering missing marketing executive Sarah Everard.Wayne Couzens, 49, a father of two from Deal in Kent, was initially arrested on suspicion of kidnapping the 33-year-old who disappeared in south London a week ago.But on Wednesday, Scotland Yard said the man in custody had further been arrested on suspicion of murder. They confirmed that the officer had not been on duty when Miss Everard disappeared.Read all the details here: https://www.telegraph.co.uk/news/2021/03/09/sarah-everard-sniffer-dogs-deployed-inside-church-yards-disappeared/Subscribe to The Telegraph on YouTube ► https://bit.ly/3idrdLHGet the latest headlines: https://www.telegraph.co.uk/Telegraph.co.uk and YouTube.com/TelegraphTV are websites of The Telegraph, the UK's best-selling quality daily newspaper providing news and analysis on UK and world events, business, sport, lifestyle and culture."
"CaZ5LhUbFng","Piers Morgan Walks Off Set After Being Called Out Over Meghan Markle Comments | THR News","2021-03-09T17:58:28Z","UCZ8Sxmkweh65HetaZfR8YuA","The Hollywood Reporter","24","21.11.03","thr|the hollywood reporter|hollywood reporter|entertainment|hollywood|Thr news|the Hollywood reporter|2021|piers morgan|meghan markle|prince harry|oprah winfrey|good morning Britain|oprah with meghan and harry|oprah meghan harry interview|interview|meghan markle interview|piers morgan meghan markle|piers morgan meghan markle comments|tv|television|alex Beresford|alex beresfod piers morgan|piers|piers morgan walk off","1236831","7030","1340","4088","https://i.ytimg.com/vi/CaZ5LhUbFng/default.jpg","False","False","Piers Morgan stormed off the set of his own morning show in the U.K. after a colleague called him out for his rants against Meghan Markle and Prince Harry following their bombshell interview with Oprah Winfrey.►►Subscribe for more entertainment news: http://thr.cm/dwtPxG2►► See our latest videos: http://thr.cm/syLedfwAbout: The Hollywood Reporter (THR) is the entertainment industry's flagship media brand, offering in-depth reporting, analysis, unparalleled access, world-class photography and video, and feature exclusives in its award-winning weekly magazine and dynamic website. The Hollywood Reporter also boasts prestigious live events, industry-leading philanthropic, empowerment and diversity initiatives and hugely successful video series.Connect with The Hollywood Reporter Online:Visit the website: http://thr.cm/MgwCFl9Likes us on Facebook: http://thr.cm/ngIBL8lFollow us on Twitter: http://thr.cm/2S875k7Follow us on Instagram: http://thr.cm/cDQoWQd#PiersMorgan #MeghanMarkle #THRNewsPiers Morgan Walks Off Set After Being Called Out Over Meghan Markle Comments | THR NewsThe Hollywood Reporterhttps://youtube.com/hollywoodreporter"
"xf-PC5JC66o","MUST SEE: MJF Leaves the Inner Circle and Starts His Own Faction in AEW AEW Dynamite","2021-03-11T04:16:47Z","UCFN4JkGP_bVhAdBsoV9xftA","All Elite Wrestling","24","21.11.03","All Elite Wrestling|AEW|The Young Bucks|Cody Rhodes|Brandi Rhodes|Nick Jackson|Matt Jackson|Chris Jericho|Pro Wrestling|Kenny Omega|Being the Elite|Jon Moxley|Luchasaurus|Jungle Boy|Jack Perry|MOX|AEW DYNAMITE HIGHLIGHTS|#AEWDYNAMITE|AEW ON TNT|AEWonTNT|Jurassic Express|Jake Hager|Inner Circle|Join Dark Order|Rusev|Miro|AEW Dynamite|#AEW|DON CALLIS|Video Games|Music Video|Among Us|Sting|AEW Sting|WCW Sting|the icon sting|man called sting","570544","17582","559","2957","https://i.ytimg.com/vi/xf-PC5JC66o/default.jpg","False","False","Subscribe now and never miss a new video: https://www.youtube.com/c/aew?sub_confirmation=1AEW Dynamite airs every Wednesday night 8e/7c on TNTAEW Dark: Elevation airs every Monday at 7e/6c - youtube.com/AEWAEW Dark airs every Tuesday night 7e/6c - youtube.com/AEWHow to watch Dynamite and Pay Per View events➡️  TNT - https://www.tntdrama.com/allelitewrestling➡️  Fire TV - https://www.fite.tv/channel/aew (For international fans only)➡️  B/R Live - https://www.fite.tv/channel/aew (Pay Per Views & Special Events only)Follow #AllEliteWrestling on all social media platforms➡️  https://www.Twitter.com/aew➡️  https://www.Twitter.com/AEWonTNT➡️  https://www.Facebook.com/allelitewrestling➡️  https://www.instagram.com/allelitewrestling➡️  https://www.instagram.com/AEWonTNT➡️  TikTok - AllEliteWrestling➡️  Snapchat - AllEliteWrestlingWelcome to the All Elite Wrestling YouTube channel! Here you can find the latest highlights from AEW Dynamite and the latest episodes of AEW DARK. A world-class roster of diverse male and female wrestlers give you a new wrestling experience for the first time in 20 years. Featuring Cody & Brandi Rhodes, The Young Bucks, Kenny Omega, Hangman Adam Page, Chris Jericho and Jon Moxley. Subscribe today so you don't miss the latest videos from All Elite Wrestling!This video is AEW intellectual property. It is intended for only the private use of our audience.  No part of this show may be reproduced, broadcast or exhibited in any form or by any means without the consent of AEW.  It is also prohibited for users to generate revenue from the broadcast or exhibition by the user of any AEW content (including media scrums or other editorial materials) without the consent of AEW."
"SBUg3c6G0mE","Liverpool v RB Leipzig (2-0) | Salah and Mané score as Reds progress | Champions League Highlights","2021-03-10T22:19:16Z","UC4i_9WvfPRTuRWEaWyfKuFw","BT Sport","17","21.11.03","[none]","740388","11852","228","1332","https://i.ytimg.com/vi/SBUg3c6G0mE/default.jpg","False","False","Second-half strikes from Mohammed Salah and Sadio Mané ensured a comfortable passage into the Champions League quarter-finals for Jürgen Klopp's Liverpool.Hit 'Subscribe' above to ensure you never miss a video from the BT Sport YouTube channel.Click here to purchase a BT Sport Monthly Pass - http://bit.ly/BTSportMonthlyPassVisit and subscribe to our 'BT Sport Boxing' YouTube channel ➡️ http://www.youtube.com/c/btsportboxingTwitter: http://twitter.com/btsportFacebook: http://www.facebook.com/btsportInstagram:http://instagram.com/btsportWebsite: http://sport.bt.com"
"A-5ChVshJsw","PSG v Barcelona (1-1) | Messi scores stunner but Barca crash out! | Champions League Highlights","2021-03-10T22:50:50Z","UC4i_9WvfPRTuRWEaWyfKuFw","BT Sport","17","21.11.03","bt sport|bt sport official","710360","12721","178","2249","https://i.ytimg.com/vi/A-5ChVshJsw/default.jpg","False","False","Lionel Messi's lightning strike wasn't enough to mount a serious Barcelona fightback in Paris.Hit 'Subscribe' above to ensure you never miss a video from the BT Sport YouTube channel.Get a BT Sport Monthly Pass now! - http://bit.ly/BTSportMonthlyPass Visit and subscribe to our 'BT Sport Boxing' YouTube channel ➡️ http://www.youtube.com/c/btsportboxingTwitter: http://twitter.com/btsportFacebook: http://www.facebook.com/btsportInstagram:http://instagram.com/btsportWebsite: http://sport.bt.com"
"U4sWbTfrzj8","Starlink Mission","2021-03-11T09:27:42Z","UCtI0Hodo5o5dUb67FeUjDeA","SpaceX","28","21.11.03","SpaceX|Space|Musk|Satellite|NROl-108|Mission","476182","25663","240","1061","https://i.ytimg.com/vi/U4sWbTfrzj8/default.jpg","False","False","SpaceX is targeting Thursday, March 11 for launch of 60 Starlink satellites from Space Launch Complex 40 (SLC-40) at Cape Canaveral Space Force Station in Florida. The instantaneous window is at 3:13 a.m. EST or 8:13 UTC. The Falcon 9 first stage rocket booster supporting this mission previously supported launch of NASA astronauts Bob Behnken and Doug Hurley to the International Space Station, ANASIS-II, CRS-21, Transporter-1, and a Starlink mission. Following stage separation, SpaceX will land Falcon 9’s first stage on the “Just Read the Instructions” droneship, which will be located in the Atlantic Ocean. One half of Falcon 9’s fairing previously flew on the ANASIS-II and SXM-7 missions, and the other half previously supported launch of Sentinel-6A."
"xc4loR2ViUM","A Day in My Life ❤️","2021-03-10T19:00:12Z","UCOioBz79f74LeFaf6W7N_2Q","Grace Conder","26","21.11.03","[none]","103998","10651","101","1104","https://i.ytimg.com/vi/xc4loR2ViUM/default.jpg","False","False","Advertisement | Guys check out the new LEGO VIDIYO app by clicking this link: https://apps.lego.com/vidiyo-device❤️"
"NNtMb0DrBRA","Sasy - Tehran Tokyo OFFICIAL VIDEO |  ساسی -  تهران توکیو","2021-03-10T16:30:11Z","UCVjt1H4u5z3Ya7_hxHGus6w","Radio Javan","10","21.11.03","persian|radio javan|iran|persian music|iranian music|ahange shad e irani|ahange irani|persian new music|iranian new music|music shad irani|ahange irani jadid|jadidtarin ahange|jadidtarin music video|music video irani|music video persian|radio javan music|ahange radio javan|mix shad|mix ghadimi|ahange shad jadid|ahange shad ghadimi|رادیو جوان|موزیک شاد|آهنگ جدید|آهنگ جدید ایرانی|جدیدترین آهنگ|آهنگ شاد|آهنگ شاد ایرانی|موزیک ایرانی|موزیک ویدیو","571082","5483","1147","3538","https://i.ytimg.com/vi/NNtMb0DrBRA/default.jpg","False","False","بیننده ی جدیدترین ویدیو از ساسی به نام «تهران توکیو» در اپ و وبسایت رادیو جوان باشیدBinandeye jadid tarin video az Sasy be name «Tehran Tokyoh» dar app va website Radio Javan bashidhttps://www.radiojavan.comhttps://www.instagram.com/radiojavan/https://www.instagram.com/radiojavanapp/https://www.instagram.com/rjtv/https://t.me/radiojavan#RadioJavan #RJ #Sasy"
"SV5M39LmFP8","10 months later...","2021-03-10T18:40:18Z","UC-DxGKz7B0xh_zSDzgnL2cw","Mrs Meldrum","22","21.11.03","mrs meldrum|rebecca meldrum|the meldrums|lee meldrum|vlog|family|parenting|lifestyle|fashion|cleaning|vlogger|speed cleaning","45228","4406","50","1137","https://i.ytimg.com/vi/SV5M39LmFP8/default.jpg","False","False","Well, it's been a while! 10 months to be exact! I just wanted to post a little video to talk about why I disappeared & where I've been for the last 10 months. I hope you are all doing well & you accept my apology for just vanishing from the youtube space. I'm still on instagram: @mrsrmeldrumMusic: www.bensound.com"
"rC-1I1wHou8","Dana White is Betting $1 Millon that Jake Paul Loses To Ben Askren","2021-03-11T01:22:05Z","UCcgVECVN4OKV6DH1jLkqmcA","Jake Paul","22","21.11.03","jake paul","246284","21880","1838","1560","https://i.ytimg.com/vi/rC-1I1wHou8/default.jpg","False","False","Let's make it a $2M bet Dana...Watch me fight on https://go.triller.co/​ APRIL 17THmore on my IG: https://www.instagram.com/jakepaul/"
"12PR7gjt4xY","PUNS IN MINECRAFT pt2","2021-03-08T20:38:01Z","UC0XYf2zBx0BaHd0az7Gpavw","TheKOJokerGaming","20","21.11.03","[none]","506079","24216","1583","406","https://i.ytimg.com/vi/12PR7gjt4xY/default.jpg","False","False","Next stream this Saturday afternoon."
"bP6ocWyWRTA","What Happened When Christian Cage and Kenny Omega Came Face to Face? | AEW Dynamite","2021-03-11T06:00:05Z","UCFN4JkGP_bVhAdBsoV9xftA","All Elite Wrestling","24","21.11.03","All Elite Wrestling|AEW|The Young Bucks|Cody Rhodes|Brandi Rhodes|Nick Jackson|Matt Jackson|Chris Jericho|Pro Wrestling|Kenny Omega|Being the Elite|Jon Moxley|Luchasaurus|Jungle Boy|Jack Perry|MOX|AEW DYNAMITE HIGHLIGHTS|#AEWDYNAMITE|AEW ON TNT|AEWonTNT|Jurassic Express|Jake Hager|Inner Circle|Join Dark Order|Rusev|Miro|AEW Dynamite|#AEW|DON CALLIS|Video Games|Music Video|Among Us|Sting|AEW Sting|WCW Sting|the icon sting|man called sting","395051","14040","337","1852","https://i.ytimg.com/vi/bP6ocWyWRTA/default.jpg","False","False","AEW Dynamite 3/10/21 LIVE!Subscribe now and never miss a new video: https://www.youtube.com/c/aew?sub_confirmation=1AEW Dynamite airs every Wednesday night 8e/7c on TNTAEW Dark: Elevation airs every Monday at 7e/6c - youtube.com/AEWAEW Dark airs every Tuesday night 7e/6c - youtube.com/AEWHow to watch Dynamite and Pay Per View events➡️  TNT - https://www.tntdrama.com/allelitewrestling➡️  Fire TV - https://www.fite.tv/channel/aew (For international fans only)➡️  B/R Live - https://www.fite.tv/channel/aew (Pay Per Views & Special Events only)Follow #AllEliteWrestling on all social media platforms➡️  https://www.Twitter.com/aew➡️  https://www.Twitter.com/AEWonTNT➡️  https://www.Facebook.com/allelitewrestling➡️  https://www.instagram.com/allelitewrestling➡️  https://www.instagram.com/AEWonTNT➡️  TikTok - AllEliteWrestling➡️  Snapchat - AllEliteWrestlingWelcome to the All Elite Wrestling YouTube channel! Here you can find the latest highlights from AEW Dynamite and the latest episodes of AEW DARK. A world-class roster of diverse male and female wrestlers give you a new wrestling experience for the first time in 20 years. Featuring Cody & Brandi Rhodes, The Young Bucks, Kenny Omega, Hangman Adam Page, Chris Jericho and Jon Moxley. Subscribe today so you don't miss the latest videos from All Elite Wrestling!This video is AEW intellectual property. It is intended for only the private use of our audience.  No part of this show may be reproduced, broadcast or exhibited in any form or by any means without the consent of AEW.  It is also prohibited for users to generate revenue from the broadcast or exhibition by the user of any AEW content (including media scrums or other editorial materials) without the consent of AEW."
