video_id,title,publishedAt,channelId,channelTitle,categoryId,trending_date,tags,view_count,likes,dislikes,comment_count,thumbnail_link,comments_disabled,ratings_disabled,description
"xEZfz5w4BcY","TƏCİLİ VƏZİYYƏT! Ordumuz Zəngəzura BELƏ GİRDİ","2021-05-13T12:34:28Z","UCNOfqrIKVy3AQ9iZTTPoaoQ","Bir Bax","28","21.13.05","bir bax|bir bax youtube|bir bax xeyale|bir bax rufet|ZƏNGƏZUR|zəngəzurda nə baş verir|zəngəzur azərbaycana veriləcək|zəngəzur dəhlizi|zəngəzur mahalı|zəngəzur azərbaycan|zengezur|zengezurda atisma|zengezur azerbaycana verilecek|zengezurda ne bas verir|zengezur son dakika|zengezurda son veziyyet|zengezurda müharibe|zengezur koridoru|zengezur mahali|zengezur dehlizi|bir bax zengezur|bir bax tv|şuşa|susa zengezur","225732","12567","215","674","https://i.ytimg.com/vi/xEZfz5w4BcY/default.jpg","False","False","#BirBax #Zengezur #ZəngəzurBir Bax kanalı Rüfət və Xəyalə Xəlilovlara məxsusdur. Əməkdaşlıq üçün aşağıdakı nömrə ilə əlaqə saxlaya bilərsiniz: (+994) 55-554-58-83Vətən Şavaşında yerlə bir olan ermənilərin qara günləri davam edir.Qarabağın bir hissəsindən qovulan bədnam qonşularımız indi də Zəngəzur üçün göz yaşı axıtmaqla məşğul olur.Ötən gün Azərbaycan Ordusunun Zəngəzur ərazisinə 3, 5 kilometr daxil olması tiqranoidləri cin atına mindirib..Siz Bir Bax kanalındasınız...Ötən gün ölkəmiz üçün çox vacib və mühüm gün kimi yadda qaldı..Şuşada keçirilən Xarıbülbül musiqi festivalı günün əsas hadisəsi idi. Lakin gün ərzində Ermənistandan gələn xəbərlər az keçmədi ki, festivalı bir qədər unutturdu.Gəlin baş verən bütün hadisələri və ordumuzun Zəngəzur ərazisinə girməyini geniş şəkildə bir bir təqdim edək.Zəngəzurun Qaragöl deyilən ərazisində səhər saatlarında maraqlı hadisələr yaşandı..Yerli erməni mənbələri Azərbaycan hərbçilərinin böyük bir qrupunun Ermənistan-Azərbaycan dövlət sərhədini pozduğunu bildirdi. Səhər saatlarında Qaragöl ərazisində böyük təşviş yaşanırdı. Burada yerləşən 159, 160 və 161 saylı erməni postlarındakı düşmən əsgərlər Azərbaycan hərbçilərinin sərhəd istiqamətində hərəkət etdiyini görür. Bu məqamda xatırladaq ki, sözügedən ərazidə rusiya sərhədçiləri xidmət etmir bu zonanı Ermənistan ordusunun güya ki, xüsusi təyinatlı zabitləri qoruyur..Əlbəttə erməni yalanlarını nəzərə alsaq bu məqam çox da inandırıcı gəlmir..Hər halda necə olur olsun, hansısa Aşot və ya Tiqran şərhəddə keçik çəkir. Bir neçə dəqiqədən sonra Azərbaycan hərbçilərinin sərhədi keçdiyi Ermənistanın yüksək komandanlığına məruzə edilir. Zəngəzur ərazisinin 3,5 kilometrliyinə qədər nüfuz edən Azərbaycan oğulları xəritələrlə müəyyən etdikləri məntəqələrdə çadırlar qurmağa başlayırlar. Ermənistan tərəfinin Zəngəzuru tərk etmək çağırışları isə hərbçilərimiz tərəfindən rədd edilir.Bir neçə saatdan sonra Zəngəzurun rəsmi şəxsləri əhalini sakitləşdirmək üçün müxtəlif yalanlar uydurmağa və biri-birlərinə zidd açıqlamalar verməyə başlayır. Zəngəzurun qubernatoru Meliksat Poqosyan ilk açıqlamada deyir... “Düşmən Syünik istiqamətində bir addım belə irəliləməyib. Onlar nəzarət məntəqəsi tikməyə gəlmişdilər, amma ərazidə azdılar. Dövlət sərhəddində heç bir insident baş verməyib. Bu mümkün deyil. Bunu mən sizə deyirəm” – Lakin düşmən deyən üstəlik utanmadan Zəngəzuru Syünik adlandıran Poqosyanın yalanı tez faş oldu.. Onun dediklərinin əksinə Gorus şəhərinin meri hər şeyi açıq aşkar etiraf etdi. Erməni mer Aruş aruşanyanın dedikləri belə oldu.“Azərbaycan hərbçilərinin bir qrupu Sevliç gölünü keçərək Ermənistan ərazisinə soxulublar və hal hazırda bizim ərazilərdədirlər. Onlarla danışıqlar aparılır.” “İndiki vəziyyətə görə detalları açıqlaya bilmərəm, çünki danışıqlar davam edir.Daha sonra erməni mer “Azərbaycan hərbçilərinin Zəngəzur ərazisində azması” məsələsinə də aydınlıq gətirdi. O , Zəngəzurun qubernatoru Melikset Poqosyanın yalan danışdığını bəyan edib. “Belə insanlar vətənlə bağlı olan məsələlərdə belə yalan danışmağa davam edirlər” – sitatın sonu...Axşam saatlarında isə Ermənistanın gündəmi çalxalandı..Artıq hamının dilndə sərhəddə baş verənlər idi..Media bar bar bağırmağa başladı...Bir sözlə ara qarışdı...Lakin hadisələrlə gağlı dəqiq məlumatı olan yox idi.Olayların nəzarətdən çıxdığını sezən başıbəlalı baş nazir dabanyalayan ləqəbli Nikol Paşinyan təcili sürətdə Təhlükəsizlik Şurasının iclasını çağırdı..Paşinyan ölkəsinin generalları önündə uzun uzadı çıxış edərək bütün olanlara aydınlıq gətirdi..İclasada Paşinyan hərbçilərimizin 3, 5 kilometr Zəngəzur ərazsinə daxil olmasını etiraf etdi.“Yaranmış vəziyyət qəbulediməzdir. Ermənistan bu durumla barışa bilməz. Lakin bizim başlıca məqsədimiz problemin diplomatik yolla həll olunmasından yanadır. Bu baş verməsə başqa alternativlərə əl atacayıq”- deyə Paşinyan əlavə etdi..Son cümləyə diqqətinizi çəkmək istərdik..Yoldaş Paşinyan başqa alternativlərə əl atmaq istəyirmiş...Yəni belə desək danışıqlar yolu ilə alınmasa silaha əl atacaqlarmış...Kifayət qədər gülünc açıqlamalardır.Ermənistan mediası məsələni gündəmdə saxlayaraq müxtəlif məlumatlar paylaşdı. Yerli mətu orqanları Azərbaycan Ordusunun irəli çəkdiyi mövqelərdən geri çəkilmədiyini yazdı. Paşinyana düşmən mövqedə olan neüs am portalı Danışıqlar nəticə verməyib, sabah yenidən cəhd edəcəklər- başlığı ilə xəbərlər tirajladıGün boyu diplomatik cəhdlərin ardı arası kəsilmədi Əvvəlcə Ermənistan xarici işlər naziri əslən hacıqabuldan olan Ara Ayvazyan rusiyalı həmkarı Lavrovla danışdı və Azərbaycanın əvvəlki mövqeyə qaytarılmasını xahiş etdi . Ardınca Rusiya müdafiə naziri Sergey Şoyqu və Ermənistan müdafiə naziri Vaqraşak Arutyunyan arasında telefon söhbəti oldu. Rəsmi məlumata görə, tərəflər Qarabağdakı rus sülhməramlıların fəaliyyətini müzakirə ediblər. Lakin Laçın-Gorus sərhədində baş verənlərin müzakirə edildiyi istisna edilmədi"
"2Np6P8vcppQ","СВЁЛ ПЕРЕКУПЩИКА АВТО И ПРОДАВЦА ИГРУШЕК АВТО (телефонный пранк)","2021-05-13T10:00:15Z","UCqo61OZaNzi7XIiNMENhdmA","Стас Ёрник","23","21.13.05","коннект|СВЁЛ ПЕРЕКУПЩИКА АВТО И ПРОДАВЦА МОДЕЛЕК АВТО (телефонный пранк)|перекупщик|перекуп|телефонный пранк|авто|модельки авто|стас ёрник|стас ерник|стас ерник пранк|стас ёрник пранк|пранк|пранки|курсы пранк|курсы|соединяет людей по телефону между собой|телефонный розыгрыш|телефонный звонок|покупает игрушки авто как настоящие у перекупа","198417","29139","609","2079","https://i.ytimg.com/vi/2Np6P8vcppQ/default.jpg","False","False","Кто хочет зарабатывать: https://avalon-parthner.com/?ref=yornik_________________________________________________Пробуем новый формат под названием Коннект. Смысл в том, что мы будем по телефону соединять людей, которые будут общаться по телефону и думать о том, что говорят об одном и том же, но по факту будет совсем не так и это будет ОЧЕНЬ СМЕШНО!_________________________________________________Соц сети Стаса: Instagram Ёрника - https://www.instagram.com/stas.yornik/ VK Ёрника - https://vk.com/stas.yornik VK паблика - https://vk.com/yornik_and_koss По вопросам рекламы и сотрудничества писать на почту stas_msk@mail.ru #пранк  #СтасЕрник #телефонныйпранктэги:  курсы перекуп телефонный пранк авто."
"IJd1F4lkvVA","ВСЕ ПОШЛО НЕ ПО ПЛАНУ *Открыли свой САЛОН*","2021-05-13T10:00:22Z","UCM0lWLQuQhEKwq0qhdWejQA","Lesha Maisak","24","21.13.05","ВСЕ ПОШЛО НЕ ПО ПЛАНУ *Открыли свой САЛОН*|Открыли свой САЛОН|Открыли свой САЛОН Lesha Maisak|мы открыли свой салон|открыли свою парихмахерскую|салон|открыли свой барбершоп|успешный салон|это успех|БЕСПЛАТНЫЙ МАГАЗИН|24 часа челлендж|челлендж|А4|льоша|Лёха|Лёша|Lesha Maisak|LM team|LM|team|мйасак|открыли салон красоты|открыли свой магазин|открыли магазин|леша майсак открыл свой салон","984270","95221","1596","5235","https://i.ytimg.com/vi/IJd1F4lkvVA/default.jpg","False","False","Скачивай Mobile Legends: Bang Bang по моей ссылке http://bit.ly/MLBBLeshaMaisak, заходи на сайт https://m.mobilelegends.com/en/codexchange, активируй код на получение крутых подарков (q3c6mkb9c3jg22apc) и играй с друзьями!Хэй! В этом видео, мы открыли свою парихмахерскую LM team. И у нас были самые настоящие посетители, а многим из них помогли изменить имидж! Ставь лайк, подписывайся и скорее нажимай на play!Благодарим за помощь в создании видео: https://instagram.com/barbershop_bulvar?igshid=1047406bqxs2yИНСТАНГРАМ, там весело https://www.instagram.com/lesha.lm/​​..● TikTok - https://vm.tiktok.com/smaMvx/​​​..● ВКонтакте - https://vk.com/id268440118​​​..РЕКЛАМА, СОТРУДНИЧЕСТВО : leshamaisak@mediacube.inМоя партнерская сеть mediacube: https://bit.ly/mediacube_lesha_maisak​"
"t3x8CLAEYAk","КАДЫРОВ ОБРУШИЛСЯ НА ХАБИБА / Чимаев: Мы и его порвем / СЕНСАЦИОННОЕ заявление","2021-05-13T03:31:03Z","UCaPUQ2WnmAxqdl8mbgIfzng","Ушатайка : Спорт-Экспресс","17","21.13.05","ушатайка|хабиб|рамзан кадыров|кадыров|хабиб нурмагомедов|хамзат чимаев|чимаев|кадыров против хабиба|рамзан кадыров прямой эфир|рамзан кадыров интервью|чимаев про хабиба|чимаев хабиб мы его порвем|кадыров хабиб проект ufc|ufc|юфс|новости мма|мма|mma|кадыров про хабиба|рамзан кадыров хабиб","121481","2110","614","2384","https://i.ytimg.com/vi/t3x8CLAEYAk/default.jpg","False","False","Глава Чечни Рамзан Кадыров назвал Хабиба Нурмагомедова стопроцентным проектом UFC, а также заявил, что готов заплатить любые деньги, чтобы увидеть его поединок с бойцом из Ахмата. Когда же Кадыров в прямом эфире инстаграма говорил, что Хабиб порвал UFC, но не факт, что порвет Ахмат, Хамзат Чимаев написал в комментариях: Мы и его порвем, если он захочет. В материале Ушатайке - 9 минут из прямого эфира Кадырова, история его взаимоотношений с Хабибом, старая цитата Чимаева о Хабибе, а также немного про гонорары Нурмагомедова.Хабиб Нурмагомедов завершил карьеру бойца после победы в октябре 2020 года над Джастином Гейджи (удушение, второй раунд). Он остановился на рекорде 29 побед, 0 поражений.Инстаграм Рамзана Кадырова: https://www.instagram.com/za_kadyrova_akhmat/Инстаграм Хабиба Нурмагомедова: https://www.instagram.com/khabib_nurmagomedov/Инстаграм Хамзата Чимаева: https://www.instagram.com/khamzat_chimaev/00:00 - Информационная бомба00:47 - Кадыров: В UFC есть свои проекты. Они не проигрывают. Могут подставной бой сделать. Я не любитель подставных боев03:00 - Кадыров: Хабиб - стопроцентный проект UFC. Его никогда не снимали с рейтинга03:40 - Кадыров: Никогда не видел, чтобы наш брат Хабиб выступал с флагом РФ, с флагом Дагестана04:26 - Кадыров: Вы видели, как Хамзата сняли с рейтинга? Но для UFC он очень интересен06:00 - Кадыров: Я не говорю, что Хабиб не чемпион. Он чемпион. Но если UFC захочет, из любого может сделать чемпиона07:20 - Кадыров: Тем, кто ушел непобежденным, мы желаем удачи09:00 - Кадыров: Готов дать Хабибу любой гонорар. Посмотрим, порвет ли он Ахмат10:00 - 6,5 лет назад Хабибу уже предлагали бой с чеченским бойцом10:31 - Хронология взаимоотношений Кадырова и Хабиба12:00 - Чимаев второй день взрывает российские ММА комментариями12:40 - Добрые слова Чимаева о Хабибе (сентябрь 2020 года)12:57 - Первый комментарий Чимаева после того, как поднялась шумиха из-за слов Кадырова13:18 - Хабибу готовы заплатить любые деньги. А сколько он заработал за бои с Макгрегором, Порье и Гейджи?#хабиб #кадыров #чимаев #ufc #рамзанкадыров"
"qQzmJMnlegc","РАБОТАЮ ДОСТАВЩИКОМ ШАУРМЫ Димы Масленникова ЧЕЛЛЕНДЖ","2021-05-12T14:36:40Z","UCVlPyvH-XhOVPovpLe0EkMw","ЭМИЛЬ","22","21.13.05","РАБОТАЮ ДОСТАВЩИКОМ ШАУРМЫ Димы Масленникова ЧЕЛЛЕНДЖ|РАБОТАЮ ДОСТАВЩИКОМ ШАУРМЫ Димы Масленникова|РАБОТАЮ ДОСТАВЩИКОМ ШАУРМЫ|РАБОТАЮ ДОСТАВЩИКОМ ШАУРМЫ ЧЕЛЛЕНДЖ|РАБОТАЮ ДОСТАВЩИКОМ|ЭМИЛЬ|эмиль масленников|работаю доставщиком еды|эмиль челлендж|челлендж|challenge|шаурма|шаурма масленников|шаурма димы масленникова|я работаю доставщиком|доставляю шаурму|работаю|эксперимент|челлендж с едой|доставляю еду челлендж","402035","55265","723","1188","https://i.ytimg.com/vi/qQzmJMnlegc/default.jpg","False","False","Получить подарки в World of Tanks - https://tanks.ly/3ea0z7MЕсли ссылка не открывается - отключите adblock.РАБОТАЮ ДОСТАВЩИКОМ ШАУРМЫ Димы Масленникова Сегодня я бросил себе вызов, снять ролик РАБОТАЮ ДОСТАВЩИКОМ ШАУРМЫ Димы Масленникова ЧЕЛЛЕНДЖ. Рано утром я приду в ШАУРМУ Димы Масленникова, и начну доставлять шаурму, ведь я РАБОТАЮ ДОСТАВЩИКОМ ШАУРМЫ Димы Масленникова. Интересный ЧЕЛЛЕНДЖ, как считаете? Приятного просмотра! Подпишись на меня ● Instagram - https://www.instagram.com/emilen_im/● TikTok - https://vm.tiktok.com/pCKMu9/​​​​​​​● VKontakte: https://vk.com/emilka98​​​​​​​СОТРУДНИЧЕТСВО: emilen.pr@gmail.com"
"TvfSKD7gTV4","Как мы хотим сделать / Как мы делаем","2021-05-13T13:00:26Z","UCpfefG1t0k2FJ8mevWHhp0g","МЁD","23","21.13.05","мёд|мёD|makeyourday|make|yo|day|makeyoday|med|myod|makeЁday|мейкёдэй|your|смешное видео|рыжая|марго|дирдж|скетчи|как хотим сделать|как делаем|ожидание реальность","94943","12844","309","405","https://i.ytimg.com/vi/TvfSKD7gTV4/default.jpg","False","False","Ребята из МЁDа стикточились: https://tiktok.com/@med_makeyodayПочта для связи: MakeYoDay@avtormedia.ruНаши инстаграмчики👇😉Марго: http://instagram.com/margaritadirgeРома: https://instagram.com/manusajian/Серёжа: http://instagram.com/segakashnikovЭмиль: http://instagram.com/askemmmСаша: https://instagram.com/kerr1989/Тимур: http://instagram.com/timaristoНикита: http://instagram.com/nikitasukharevДима: https://instagram.com/zlolyudov/Лёха: https://instagram.com/menya_mnogoМЁD Вконтакте  - https://goo.gl/oghvdsМЁD в Instagram - https://goo.gl/PqpSPvМЁD в Telegram - https://tele.click/makeYoDayМЁD в Facebook - https://goo.gl/aJFRsf"
"n72vQpZhg_E","Manizha - Russian Woman - Second Rehearsal - Russia 🇷🇺 - Eurovision 2021","2021-05-12T10:29:53Z","UCRpjHHu8ivVWs73uxHlWwFA","Eurovision Song Contest","24","21.13.05","Eurovision Song Contest|2021|Open Up|Rotterdam|Russia|Manizha|Russian Woman|Second Rehearsal","492387","22405","6001","3434","https://i.ytimg.com/vi/n72vQpZhg_E/default.jpg","False","False","Manizha will represent Russia at the Eurovision Song Contest 2021 with the song Russian Woman. This was her second rehearsal in Rotterdam Ahoy.-The Eurovision Song Contest celebrates diversity through music. Please keep your comments respectful. We will not tolerate racism, sexism, ableism, homophobia, transphobia, body-shaming or any other derogatory or hostile language. Offensive users will be blocked and reported. Music first, always.If you want to know more about the Eurovision Song Contest, visit https://eurovision.tvShop the official Eurovision Song Contest merchandise: https://shop.eurovision.tv/Follow us on Instagram: https://www.instagram.com/eurovision Follow us on Twitter: https://twitter.com/EurovisionFollow us on Facebook: https://www.facebook.com/EurovisionSongContest/"
"pVOucwf2tYI","«Возомнил себя богом»: кто будет отвечать за стрельбу в школе Казани?","2021-05-11T16:12:00Z","UCu_sa2ZIHKkr5IXqUe7_VpQ","Телеканал 360","25","21.13.05","казань|стрельба|стрельба в школе казани|школа казань|школа казань стрельба убиты дети|убиты дети|убиты учителя|казань стрельба|файзи|стрельба на улице файзи|расстрелял детей|расстрелял детей и учителей|стрельба в школе|школа стрельба|школа татарстан|татарстан|погибли дети|убийство|расправа|день траура|казань стрельба в школе|казань новости|сайга|оружие|гимназия|гимназия стрельба|расстрел|массовый расстрел|массовый расстрел детей в школе","1254049","20085","2626","12178","https://i.ytimg.com/vi/pVOucwf2tYI/default.jpg","False","False","Подпишитесь на канал 360: https://www.youtube.com/360tvru?sub_confirmation=1 Стрельба в гимназии 175 города Казани обрастает подробностям. Не исключено что вместе с убийцей на скамье подсудимых могут оказаться и другие фигуранты. Полиция выясняет законность получение стрелком разрешений на оружие, а самого подозреваемого ждёт медицинская экспертиза. Не исключено что молодой человек может быть не вменяемым. Подробности в нашем видео.#360новости  #казань #стрельба #школа #новости360 #телекнал360 #георгийбелецкий #максимселиков #мариябокарева #дарьяомельченко #екатеринаандроноваПодпишись на нас:✅Telegram -  https://tele.gg/tv360ru✅Instagram - https://www.instagram.com/mbn360tv/✅TikTok - https://www.tiktok.com/@360tv✅VК - https://vk.com/tv360✅FB - https://www.facebook.com/tv360/?fref=ts✅ОК -  https://ok.ru/tv360✅Twitter - https://twitter.com/360tvПриложение 360 Android: https://play.google.com/store/apps/details?id=ru.tv360.mobile.androidПриложение 360 iOS:  http://social.360tv.ru/SPUWПоследние новости - https://www.youtube.com/playlist?list=PLKlOceUfsEcxmgPap_a80MmCmazqkewUnГлавное видео дня - https://www.youtube.com/playlist?list=PLKlOceUfsEcwL3VwCgOWDlEAuEuF00VrsЛучшие истории - https://www.youtube.com/playlist?list=PLKlOceUfsEcyWlGN841OZdBJysV5ioaMfПроисшествия - https://www.youtube.com/watch?v=6FON2_FNbsI&amp;list=PLKlOceUfsEcwBhu7bdZhyLBG72MzIWFBl"
"bxaWJKXZwtA","«То же самое, что в Казани». Парень обещал повторить расстрел в школе. Ему грозит срок","2021-05-13T10:55:45Z","UCu_sa2ZIHKkr5IXqUe7_VpQ","Телеканал 360","25","21.13.05","школьник хотел повторить казанского стрелка|обещал повторить расстрел|обещал повторить стрельбу|подросток из благовещенска|псевдо имитатор|казань|казань стрельба|благовещенск школа|благовещенск подросток|ильназ галявиев|дети|стрелок|безопасность в школах|галявиев институт сербского|оружие|телеканал 360|360 подмосковье|канал 360|360tvru","499762","8513","379","4011","https://i.ytimg.com/vi/bxaWJKXZwtA/default.jpg","False","False","⭕️Подпишитесь на канал 360: https://www.youtube.com/360tvru?sub_confirmation=1 Ильназа Галявиева доставят в Москву для проведения психолого-психиатрической экспертизы. Эксперты рассказали о неадекватном поведении задержанного. В Благовещенске появился «псевдо имитатор» стрелка. Он обещал сделать «то же самое, что и в Казани». Подробнее в нашем видео.#Телеканал360 #Казань #Благовещенск #дети #стрелок #школа #жертвы #подростки #оружие #дарьяомельченко #екатеринаандронова #георгийбелецкий #мищенкоксения #newsbarПодпишись на нас:✅Сайт -  https://360tv.ru/✅Telegram - https://t.me/tv360✅Instagram - https://www.instagram.com/mbn360/✅TikTok - https://www.tiktok.com/@360tv✅Rutube - https://rutube.ru/channel/23501555/✅VК - https://vk.com/tv360✅FB - https://www.facebook.com/tv360/?fref=ts✅ОК -  https://ok.ru/tv360✅Twitter - https://twitter.com/360tv⭕️Присылайте свои видео через приложение «Репортер 360»!Ссылки для скачивания: iOS: https://goo.gl/cBuVLb  Android: https://goo.gl/6vSR8GПриложение 360 Android: https://play.google.com/store/apps/details?id=ru.tv360.mobile.androidПриложение 360 iOS:  http://social.360tv.ru/SPUW"
