video_id,title,publishedAt,channelId,channelTitle,categoryId,trending_date,tags,view_count,likes,dislikes,comment_count,thumbnail_link,comments_disabled,ratings_disabled,description
"WJhy1vnlrUc","お引っ越しします...お家を解体。新居へ。#181","2021-04-07T12:00:13Z","UCMWuA3HeWpYUcEpxyjGN3-Q","OKUDAIRA BASE","22","21.14.04","一人暮らし|暮らし|https://www.youtube.com/channel/UCMWuA3HeWpYUcEpxyjGN3-Q?view_as=subscriber|丁寧な暮らし","243181","3710","152","321","https://i.ytimg.com/vi/WJhy1vnlrUc/default.jpg","False","False","次回は新しいお家での暮らしです。本当に４年半お世話になったお家。寂しいですが、元通りにしてお家を出ます。次、住む方に気に入ってもらえたら嬉しいです...今までありがとう。そして、一人暮らしも最後となりました。お付き合いしているmamiさんと一緒に住むことになりました。二人暮らしになりましたが、大好きな暮らしは今まで通り発信してお届けしたいです。これからもどうぞよろしくお願いします。mami dot. →　https://www.youtube.com/watch?v=TgCs0dq1Oug新しいお家では今まで出来なかった暮らしのことも沢山出来そうです...!!!ご視聴ありがとうございました!!初の著書が２０２０年５月９日に発売しました!!Amazonにて受付中です↓【自分を楽しむ衣食住】https://www.amazon.co.jp/dp/4416620012/暮らしの道具をデザインしてます↓https://cores-ec.site/kiduki/?inflow=17vlog1話はこちらから↓https://www.youtube.com/watch?v=OcDa8m9CKy4&list=PL_dxbKWK3gy4fonZmK-orPiqSg0ya9hH0&index=2&t=0sツイッター、インスタグラムもやっております!!(普段はよくこちらでつぶやいてます↓)twitter https://mobile.twitter.com/okudaira_0421Instagram http://instagram.com/okudaira.m/music:ピアノ弾きpianimoさん　https://www.youtube.com/watch?v=GSGn4z4jDu8&t=8sHello. It is okudaira base channel.Thank you for watching.I send my everyday life with this channel.I introduce a tool and the food of everyday life!If you think this video is good, please click 'like' and subscribe to my channel.Thank you!＃一人暮らし　＃vlog"
"_YKyn59PYEk","浜崎あゆみ / 23rd Monster (MV teaser -episode 0-)","2021-04-07T15:00:28Z","UC7eXWU3oN-w5tNtP7sgeeNg","ayu","10","21.14.04","[none]","433729","0","0","0","https://i.ytimg.com/vi/_YKyn59PYEk/default.jpg","True","True","2021年4月8日配信ニューシングル「23rd Monster」ダウンロード・視聴はこちらから → https://avex.lnk.to/23rdMonster-結末はボクシダイだ-2021年4月8日、浜崎あゆみデビュー23周年を迎えたこの日、待望の新曲をゲリラリリース！歌い続ける、伝え続ける、ayu渾身のメッセージを込めた力強いロックナンバー！・・・「23rd Monster」words : ayumi hamasakimusic : Kazuhiro Haraarrangement : Takehito Shimizu & Atsushi SatoTry 穏やかな さざ波のようななんて勘違いの夢の夢見た行手を全て塞がれるのは良く考えてみなくても慣れっこどう考えたって正気の沙汰じゃないIt's called A 'Monster'ノーマルは書き換えられて悲観してる時間ももう過ぎた受け止める？牙を剥く？見据えるのは終わりか始まりか選択肢は減ったようである意味無限になったのかもね見知らぬ人よ君のジャッジに興味はない結末はボクシダイだFly 疲弊して 擦り減った心全てを失くした訳じゃまだない右にならえなんてクソ喰らえだと瞳の奥がハッキリ言ってるやるだけやって玉砕のがマシねYou're also A 'Monster'不確かな時代になって確かなものに白黒がついた守り抜く？何捨てる？その未来に今来た過去がある貫くだけが強さじゃない手放すのは楽なんて事はない愛しい人よ誰のせいにもしないで結末はキミシダイだノーマルは書き換えられて悲観してる時間ももう過ぎた受け止める？牙を剥く？見据えるのは終わりか始まりか選択肢は減ったようである意味無限になったのかもね見知らぬ人よ君のジャッジに興味はない不確かな時代になって確かなものに白黒がついた守り抜く？何捨てる？その未来に今来た過去がある貫くだけが強さじゃない手放すのは楽なんて事はない愛しい人よ誰のせいにもしないで結末はキミシダイだ-結末はボクシダイだ-・・・Directed by Hideaki Sunaga◆2021年4月8日発売　バラード・ベストアルバム『A BALLADS 2』　ダウンロード・視聴はこちらから → https://avex.lnk.to/aballads2　詳細はこちら → https://avex.jp/ayu/discography/◆浜崎あゆみの音楽を聴く → https://avex.lnk.to/ayu ◆浜崎あゆみのライヴ映像をもっと見る → https://avex.lnk.to/ayu_LIVE_DVD_BDYouTubeチャンネル登録はこちらから → http://bit.ly/ayuch_sbsc​ Official｜http://avex.jp/ayu/​ FANCLUB ”TeamAyu”｜https://global-fc.net/teamayu/​ Instagram | https://www.instagram.com/a.you/​ Twitter｜https://twitter.com/ayu_19980408​ Facebook｜https://www.facebook.com/ayu.official​ #ayu23rd​ #23rdMonster​ #ayu_MV​"
"n8R8YQajzQQ","【検証】年収5億円のラファエルならコロナに苦しむ銀座クラブで2500万円使う説","2021-04-07T11:00:30Z","UCYLIuZ_k8mb9RJrLqNI5rhA","銀座ななえチャンネル","26","21.14.04","銀座|クラブ|キャバクラ|唐沢菜々江|ななえママ|銀座クラブ|高級クラブ|銀座のママ|エンリケ|愛沢えみり|進撃のノア|デヴィ夫人|北新地|イベント|桜井野の花|インスタ|キャバ嬢|椿そら|ホステス|銀座ママ|水商売","258111","3002","442","172","https://i.ytimg.com/vi/n8R8YQajzQQ/default.jpg","False","False","【ラファエルさんのチャンネル】https://www.youtube.com/channel/UCgQgMOBZOJ1ZDtCZ4hwP1uQ/featured【ラファエルさんのインスタグラム】https://www.instagram.com/raphaelangel8183/?hl=ja銀座ななえチャンネルではホステスになってみたいYou Tuberの方やインフルエンサー、ライバーの方、おもしろいコラボをして頂ける方の募集を行っております！【コラボ申し込みフォーム】https://docs.google.com/forms/d/e/1FAIpQLSegytByVtgEBSzXQeru_CQ15XL3Z7lNKjuPmzyCfnpzweo_uA/viewform【唐沢菜々江 Instagram】https://www.instagram.com/nanae.karasawa/【銀座クラブ「Nanae」official HP】http://club-nanae.com/【クラブNanaeホステス募集中！詳細と応募はこちらから】http://club-nanae.com/recruit.html【THE SEVEN BEAUTY MAINTENANCE オンラインショップ】https://www.the-seven-bm.com/◆銀座ななえチャンネルおすすめ動画◆【THE SEVEN BEAUTY MAINTENANCE】ななえママのヘアセットを公開！https://youtu.be/jkmO_ZaCc7s【質問コーナー第2弾!!】ディープすぎ！見てるこっちが辛くなる…https://youtu.be/tOKwVEhkAjg【インスタ映えコスメ】銀座高級クラブホステスがリアルに使い、インスタにも使ってる超おすすめコスメをご紹介！蘭ちゃんのメイクのこだわりも！#53https://youtu.be/Gv5CG8o4ZQA【100の質問】ななえママが100の質問に答えます！https://youtu.be/ZP_uWoQVGBI【大打撃】新型コロナで銀座は極限状態。このまま行けば売り上げは「0」#84https://youtu.be/Clb70LNZwGw#銀座クラブ#ホステス#ななえママ#唐沢菜々江#令和の虎#銀座"
"Ij1QvNbe_qc","ホンダGB350最速試乗バーチカルサウンドたっぷり聴かせます♪丸山浩速攻インプレ","2021-04-07T12:45:16Z","UCIOgnwv7IOAjGf0onKlbNLw","MOTOR STATION TV","2","21.14.04","丸山浩|WITH ME|MOTOR STATION TV|マルチャンネル|バイク|モータースポーツ|MSTV|モタステTV|2021年ホンダ|2021HONDA|本田技研工業株式会社|ホンダ|HONDA|GB350|ハイネス350|H’ness CB350|ハイネスCB350|ニューレトロ|カスタム|神永暁|レース|サーキット|耐久|レーサー|最高速|クルマ|自動車|オートバイ|モーターサイクル|インプレッション|インプレ|レビュー|解説|検証|ライテク|ドラテク|ライディングテクニック|ドライビングテクニック|試乗|内外装チェック|詳細チェック|整備|メンテ|メンテナンス|チューニング|チューン|ツーリング|モトブログ|motovlog|峠|ワインディング|ドライバー|ライダー|プロライダー|プロレーサー|テストライダー|テストドライバー|プロドライバー|モータージャーナリスト|ドライブ|ドライビング|女子ライダー|女子ドライバー|バイク女子|チャレンジ女子アナ|小鳥遊レイラ|バトルレイヤーズ|速攻インプレ|中古車鑑定団","236461","1409","77","243","https://i.ytimg.com/vi/Ij1QvNbe_qc/default.jpg","False","False","早速乗ってきました♪バーチカルシングルサウンドがたまらないGB350。4月7日　千葉県房総半島にて行われた、ホンダGB350試乗会にMSTVのことりちゃんと丸山浩が収録に急行~。まずは撮って出しの「丸山浩速攻インプレ」各所で聴かせるシングルサウンド♪この音はこだわって造りこんだな~。ポジションの詳しいインプレは前回お知らせした放送にて観てください。https://youtu.be/BLd6ldsnlts【MSTV制作委員会】番組の応援サイト‼MOTOR STATION TV有料版コミュニティ【MSTV製作委員会】が発足しました‼こちらでは月額1000円の有料コンテンツで見放題や、制作サイドに一歩寄った情報を配信しております。こんな動画を作って欲しいなどリクエストBOXなどもありますので応援しくださる方は、下記リンクから詳細ご確認いただけますので是非たくさんのご参加お待ちしております‼http://www.withme-racing.com/mstv/main.htmlMSTVでは、番組スタッフ募集中。ビデオ編集、ビデオカメラクルー、2021年チャレンジ女子アナ、男子キャスター5期生を募集します。詳細は￬こちらからhttps://www.withme-racing.com/companyprofile/mstv_crew.htm皆様からのチャンネル登録よろしくお願いいたします。MSTV、ツイッターも始めました！ぜひぜひフォローお願いします！https://twitter.com/WITH_ME_PRT"
"_iXgDPya_6o","【４人実況】スーパー大逆転ルドー【世界のアソビ大全51】","2021-04-06T08:14:30Z","UCZMRuagdTBKmmrFtSMN48Xw","牛沢","20","21.14.04","ゲーム|game|実況|実況プレイ動画|ゲーム実況|牛沢|世界のアソビ大全51|ルドー|ガッチマン|キヨ|レトルト","998144","31663","216","2696","https://i.ytimg.com/vi/_iXgDPya_6o/default.jpg","False","False","撃墜数と勝敗は無関係メンバー：牛沢 ガッチマン キヨ レトルトチャンネル登録されると喜ぶ→http://goo.gl/3ZTvNW【twitter】http://twitter.com/ushizawa【単発動画再生リスト】https://goo.gl/shN97S【全ての実況プレイpart1リスト】https://goo.gl/DCmhNb"
"HdEA-OyHzik","【涙腺崩壊】小学生時代の息子の成長を振り返り→手紙で親の気持ちを伝えてみた【シングルマザー】","2021-04-08T10:00:13Z","UCvkWfTGdqAz8N3nJfNay-cA","chiimeloちいめろ","24","21.14.04","ちいめろ|chiimelo|ママ|琉ちゃろ|りゅうちゃろ|まひめろ|あきたん|彼氏|メンヘラ|メンヘラカップル|ファミリー|ホストくん","987005","24469","1001","2604","https://i.ytimg.com/vi/HdEA-OyHzik/default.jpg","False","False","おはめろ〜(((o(*ﾟ▽ﾟ*)o)))今回は…琉ちゃろの小学生時代を振り返り〜❤そしてサプライズお手紙で中学生になる琉ちゃろに伝えたい事を伝えました❤号泣してしまう動画なので、必ずひとりでみてください😭❣️by スタッフ#ちいめろ　#琉ちゃろ　#入学🔻【ちいめろ初書籍】こちらから購入できます🔻https://www.amazon.co.jp/dp/4299003365/ref=cm_sw_r_tw_dp_U_x_WIurEbNZ1XYN8【サブチャンネル】https://youtu.be/hwWkyYh7-4A【お問い合わせ先について】チャンネル概要欄に記載しております問い合わせ先にお願い致します。ブログ▶http://www.dclog.jp/chiimelo74/Twitter▶https://twitter.com/chiimelo74Instagram▶https://www.instagram.com/chiimelo74/Pop Pop Candy_pt1 / ALL BGM CHANNELPop Pop Candy_pt2 / ALL BGM CHANNELPop Pop Candy_pt3 / ALL BGM CHANNELHi New World_pt1 / ALL BGM CHANNELHi New World_pt2 / ALL BGM CHANNELHi New World_pt3 / ALL BGM CHANNEL音源提供：(P)&(C) Star Music Entertainment Inc."
"nNmJtfPb8Wk","自作カートでいきなりラスボス戦。自分の作ったカートの性能","2021-04-07T11:39:30Z","UCFtVzEblikHdro4J5HeMo4w","GUNMA-17","2","21.14.04","gunma-17|カート|塚本|773|サーキット|走り屋|ベスペラードレーシング","515762","5373","241","527","https://i.ytimg.com/vi/nNmJtfPb8Wk/default.jpg","False","False","こっちのデータsdにいて良かった。　うんまくチューニング動画まとめます塚本ななみさんhttps://www.youtube.com/channel/UCFTpYqmD-rqUj6ieScLlOWAGUNMA-17 Twitter　★https://twitter.com/fw_3010​​"
"3vokpSLw2oQ","ライズでリストラされた過去作モンスターを全部まとめてみた","2021-04-07T04:13:45Z","UCu5vQIQxGZ8tJ-2pd3dKEdQ","テスタのゆっくり実況","20","21.14.04","モンハン|ライズ|リストラ|モンスター|図鑑|ディノバルド|キリン|ウカムルバス|イャンクック|ネルギガンテ|復活|解説","894301","6788","421","2907","https://i.ytimg.com/vi/3vokpSLw2oQ/default.jpg","False","False","正直この動画は骨が折れました楽しんでいただけると幸いですみなさんの思い出に残っているモンスターはどれでしょうか？追記：アトラル・カシェンガオレンがぬけていました大変申し訳ありません！"
"Sacay2VOp5A","【マインクラフト】全てのモブの能力が使える世界だったら余裕で『黄昏の森』のラスボス倒せるんじゃね？","2021-04-06T04:00:12Z","UCyFN8ul17Ov5oDr_lsjZODg","ふうはや","20","21.14.04","実況|ふうはや|マイクラ|マインクラフト|モブ|能力|黄昏の森|サバイバル","1167332","6811","328","357","https://i.ytimg.com/vi/Sacay2VOp5A/default.jpg","False","False","現世 vs 黄昏の森　みたいな感じで熱いエンドラ戦の動画:https://www.youtube.com/watch?v=wIW3mH22sOA&ab_channel=%E3%81%B5%E3%81%86%E3%81%AF%E3%82%84⬇チャンネル登録してくれると嬉しいです！⬇https://www.youtube.com/channel/UCyFN8ul17Ov5oDr_lsjZODg/✦ツイッター:https://twitter.com/fuuhaya_✦サブチャンネル:https://www.youtube.com/channel/UClOJPMU7J_toeIKYv1Aa8Mw▶グッズ購入はこちらhttps://muuu.com/videos/c424b46c2d32091c▶スポンサーはこちらhttp://ur0.link/JOHO◀高評価・コメント・チャンネル登録してくれると嬉しいです！▶------------------------------------------------------------------------------ 使用BGM:「さばの味噌煮と牛乳」「世界の情景～西海岸より～」作曲者:SACORAMA FILM COMPANY様http://www.aoitorinouta.com/------------------------------------------------------------------------------ 楽曲提供：Production Music by http://www.epidemicsound.com 素材提供：PIXTA------------------------------------------------------------------------------"
"StdNkjRYp1k","「燃費」理論の実践編！平凡ステのスペちゃんが全身全霊出した結果ｗｗｗ","2021-04-07T06:48:19Z","UC65pbyeRNoKRS0z7_T45ZDA","さとるの無課金ゲーム攻略TV","20","21.14.04","[none]","251609","5481","113","1141","https://i.ytimg.com/vi/StdNkjRYp1k/default.jpg","False","False","マンハッタンカフェ行こうぜtwitterハジメマシタhttps://twitter.com/satoru_gaming燃費検証第一回https://youtu.be/MsdzfpUu7CI​第二回https://youtu.be/1S5IQG4uE-A​第三回https://youtu.be/zlXauX7u_p4​第四回https://youtu.be/8DeU4AOvjEQ"
"iii33R1wzxs","Exclusive Interview With Johnny's Snow Man! | Sitting Back With Snow Man","2021-04-07T13:00:26Z","UCPkntuliX8a4vHCFXcCGWIQ","Kevan Kenney","24","21.14.04","snow man|snow man group|snow man johnnys|johnny's|Johnnys entertainment","180255","15613","130","612","https://i.ytimg.com/vi/iii33R1wzxs/default.jpg","False","False","The wait is finally over! I had the chance to chat with @Snow Man's Hikaru Iwamoto and Tatsuya Fukazawa. We chat about their most memorable moments in the group, Tatsuya talks about getting his Driver's License, and Hikaru gives some workout advice/a demonstration!Subscribe for more!Comment your favorite part for the chance to get pinned📌Follow me:Instagram: https://www.instagram.com/kevankenney/Twitter: https://twitter.com/kevankenneyTikTok: https://www.tiktok.com/@kevankenneySpotify: https://open.spotify.com/playlist/75g5QKGodfDgSHz9ywdFAE?si=TFvlskkSSqGhUdI6Mlgfjg2021 Interviews: https://www.youtube.com/playlist?list=PLSixQ1ua6PaO22G5NqQIQaOs5lIo0JOrk2020 interviews:https://www.youtube.com/playlist?list=PLSixQ1ua6PaM4XQl8s8Gt2hl4Wxefy3-2#SnowMan #Johnnys #Grandeur"
"BAjbY7N00tQ","野山でタケノコを採って『炭火焼き』で食べる至高の時間","2021-04-07T10:00:08Z","UCgh_rZp0SXcbD9ilti7sH3A","【離島移住生活】マサル","1","21.14.04","タケノコ|タケノコ掘り|山菜採り","172001","2517","62","368","https://i.ytimg.com/vi/BAjbY7N00tQ/default.jpg","False","False","◇皆様のご支援お待ちしております。https://camp-fire.jp/projects/view/393522◇メインチャンネルにてクラウドファンディングの説明をしてます。https://www.youtube.com/watch?v=piCmy_2-oSs&t=250s"
"_x57unKwNu4","おかわり！1歳男児じぃじにイチゴミルクをもらう","2021-04-08T02:49:26Z","UCoxy3r8oACjytszytpxQoEg","見るまえに跳べ","24","21.14.04","[none]","524674","8628","114","433","https://i.ytimg.com/vi/_x57unKwNu4/default.jpg","False","False",""
"18cAPPFPKxI","第109回 【小金持ちはどんな人？】資産5,000万円以上の準富裕層の「典型例」を3つ解説【稼ぐ 実践編】","2021-04-07T22:00:00Z","UC67Wr_9pA4I0glIxDt_Cpyw","両学長 リベラルアーツ大学","26","21.14.04","両学長|準富裕層|退職金|公務員|共働き|小規模事業経営者|インカムリッチ・プロフェッショナル|稼ぐ力|転職|副業|自己投資","447726","5968","219","362","https://i.ytimg.com/vi/18cAPPFPKxI/default.jpg","False","False","※数十社以上ある転職エージェントの中から、リベ大関係者が実際に利用して満足度の高かったエージェントだけを厳選しています。◆ハイクラス案件（年収アップ）に圧倒的な強みがあるおすすめ転職エージェント【JACリクルートメント】の公式サイト＜無料＞https://h.accesstrade.net/sp/cc?rk=0100ntzn00geuv✓35歳以上で転職が気になる人が、最初に相談すべきエージェント✓年収アップがメインの目的なら、ここを使わない理由なし✓年収600万円～のハイクラス案件で独占求人多い✓今は転職するつもりがなくても、キャリア相談のみもOK◆第2新卒向け転職エージェント【JAIC（ジェイック）】https://h.accesstrade.net/sp/cc?rk=0100nlwd00geuv✓親切・丁寧なサポートで転職支援実績20,000名以上✓高い内定率(81.1％以上)✓高い定着率(91.3％)✓未経験職種へのチャレンジも含め、まずは面談して状況確認するのがおすすめ◆20代・大企業への転職に強い大手優良エージェント＜無料＞【マイナビエージェント】https://liberaluni.com/prmynavi✓非公開・独占の優良求人が多い✓各業界に精通した専門チーム・キャリアアドバイザー✓首都圏・関西圏在住の20代～30代に圧倒的な強み✓特に、営業・金融系専門職・エンジニア職種の方におすすめ▼オンラインコミュニティ『リベシティ』https://liberaluni.com/community★リベ大が本になりました！Amazonhttps://amzn.to/2VztyaF楽天https://af.moshimo.com/af/c/click?a_id=1500158&p_id=56&pc_id=56&pl_id=637&url=https%3A%2F%2Fbooks.rakuten.co.jp%2Frb%2F16310040%2F---------------------------------------00:00 intro00:19 今日の話題：準富裕層の「典型例」を3つ解説01:15 └①退職金を受け取った公務員共働き世帯04:19 └②お金回りの良い小規模事業経営者06:16 └③都市圏に住むインカムリッチ・プロフェッショナル08:44 準富裕層の「典型的な職業」じゃない人がとるべき戦略13:16 まとめ：準富裕層になるための戦略を理解して、小金持ちになる確率をアップさせよう！について解説しています。【動画内でご紹介した書籍】『専業主婦は2億円損をする』（橘玲）▼Amazonhttps://af.moshimo.com/af/c/click?a_id=1057360&p_id=170&pc_id=185&pl_id=4062&url=https%3A%2F%2Fwww.amazon.co.jp%2Fdp%2F4838729588▼楽天https://af.moshimo.com/af/c/click?a_id=1057359&p_id=54&pc_id=54&pl_id=616&url=https%3A%2F%2Fbooks.rakuten.co.jp%2Frb%2F15213685%2F【関連資料】『野村総合研究所「日本の富裕層は133万世帯、純金融資産総額は333兆円と推計」』（株式会社野村総合研究所）https://www.nri.com/jp/news/newsrelease/lst/2020/cc/1221_1『平成31年地方公務員給与の実態』（総務省）https://www.soumu.go.jp/main_sosiki/jichi_gyousei/c-gyousei/kyuuyo/pdf/h31_kyuyo_1_03-8.pdf【関連動画】【使わないと損】サラリーマンが20％OFFで自己投資する方法【教育訓練給付金】【お金の勉強　初級編】：（アニメ動画）第29回https://youtu.be/n5W2OCg2urM【ここで差がつく】自己投資を「成功に結びつける人」と「時間のムダにする人」の違い【良いお金の使い方】：（アニメ動画）第39回https://youtu.be/3baYoUB-vIQ【転職初心者必見】転職エージェントを利用する”前”に知っておくべき重要ポイント8選【稼ぐ 実践編】：（アニメ動画）第26回https://youtu.be/VRIXgDPhhUw第44回 【2020年版】貯金増やしたい！そのうち会社辞めたい！それならこの副業をやろう8選【稼ぐ 実践編】https://youtu.be/X9yvsN9mOgI第50回 【未経験OK】在宅で月10万円！ハンドメイドで稼ぐ、超具体的な方法【稼ぐ 実践編】https://youtu.be/KeADnRZGOik第91回 【実は誰でもできる？】副業コンサルタントになる方法と、コンサル事業の7つのメリットについて解説【稼ぐ 実践編】https://youtu.be/WuRjklugLhw第107回 【攻略法を伝授】副業で月5万円稼ぐための9つのポイント【稼ぐ 実践編】https://youtu.be/bAwoXkzvwdU----------------------------------------▼動画資料作成ツール「MindMeister（マインドマイスター）」https://www.mindmeister.com/?r=571381----------------------------------------▼リベ大おすすめサービス一覧https://liberaluni.com/recommended-services▼リベ大おすすめ書籍一覧https://liberaluni.com/recommended-books----------------------------------------◆twitterhttps://twitter.com/freelife_blog◆インスタグラムhttp://instagram.com/freelife_blog◆両学長LINE公式アカウントhttps://lin.ee/gsTRDUv◆公式ブログhttps://liberaluni.com/----------------------------------------～まずはこのリストの動画からチェック～お金の勉強初級編-初めての方はここから-https://www.youtube.com/playlist?list=PLpwLNivKud-jSHTx8hArrxyUqmLgm1opb----------------------------------------～お金持ちになるために必要な5つの力～【貯める】-支出を減らす力を育てようhttps://www.youtube.com/playlist?list=PLpwLNivKud-jfHYqAOGhKM-pzIQh2fSdA【稼ぐ】-収入を増やす力を育てよう-https://www.youtube.com/playlist?list=PLpwLNivKud-in1wtIJTbVgDvrFDNJFwpo【増やす】-資産を増やす力を育てよう-https://www.youtube.com/playlist?list=PLpwLNivKud-iOTvsdRXy1hcbQSeAKxUuU【守る】-資産を減らさない力を育てよう-https://www.youtube.com/playlist?list=PLpwLNivKud-j7u8WKXmo-h0FsJ4IY3HBt【使う】-満足感が高まることにお金を使う力を育てよう-https://www.youtube.com/playlist?list=PLpwLNivKud-gITrm7Fsil7odutlOjXLIH----------------------------------------◆学長プロフィール・高校生の時に起業し、起業歴20年以上。・現在は経済的自由を達成し、友人向けにYouTube・SNSで「お金の知識」を発信スタート。▼詳しくは学長プロフィールの関連動画をご覧ください・10年以上『金のなる木』を買い続けた結果【なぜか皆やらない】【人生論】https://youtu.be/Mr_ykmzIdVA・第70回 【一番大切なものはどれ？】お金・スキル・道徳・愛　なにか一つ足りない社長の話【人生論】https://youtu.be/EBO6Vgwtl-8・第8回 学長が学生時代に稼いだ方法【稼ぐ 実践編】https://youtu.be/FkQ9Xh2w2WY▼学長へのご意見・ご質問はこちらからhttps://forms.gle/LcZ4cJGb9ii3VaWL6----------------------------------------#両学長#リベ大#リベラルアーツ大学#お金#準富裕層"
