video_id,title,publishedAt,channelId,channelTitle,categoryId,trending_date,tags,view_count,likes,dislikes,comment_count,thumbnail_link,comments_disabled,ratings_disabled,description
"nGke9-b4WRk","VENDEMOS O JOVEM NERD!!! (não é bait)","2021-04-14T14:00:56Z","UCmEClzCBDx-vrt0GuSKBd9g","Jovem Nerd","24","21.15.04","Magalu|NerdOffice|Vendemos O Jovem Nerd","479293","72526","1388","8777","https://i.ytimg.com/vi/nGke9-b4WRk/default.jpg","False","False","Lambda, lambda, lambda, nerds! Hoje, Alexandre Ottoni - o Jovem Nerd e Deive Pazos - o Azaghal irão falar de um dos momentos mais importantes da história do Jovem Nerd!CONHEÇA A NERDSTOREhttp://www.nerdstore.com.brEDIÇÃO POR GAVETA FILMEShttp://www.gavetafilmes.com.brASSINE O CANAL DO JOVEM NERD NO YOUTUBEhttp://www.youtube.com/JovemNerdSiga o Jovem Nerd no Twitter, Facebook, YouTube e Instagram, foi o Azaghal que mandou!http://twitter.com/JovemNerdhttp://facebook.com/JovemNerdhttp://youtube.com/JovemNerdhttp://instagram.com/JovemNerdhttp://twitter.com/Azaghal"
"qJLr3Aqeiaw","SAUDADES DE UMA TAG DE CASAL NÉ?","2021-04-14T23:00:23Z","UCgSvw7asvNq7wJWKMSW28Eg","Bianca Andrade","22","21.15.04","Bianca Andrade|Fred|Bruno Carneiro|BIED|Tag|BiaTodoDia|Especial 10 Anos|Maridão|Quem Sabe Mais?|Desimpedidos|Boca Rosa|Batom QUARTA|Sephora","141253","31179","150","6065","https://i.ytimg.com/vi/qJLr3Aqeiaw/default.jpg","False","False","Terceiro dia do nosso especial #BIATODODIA​! Estrelando minha faceta MÃE, nossa parceira do dia @sephorabrasil  e o tuuuuudo de bom batom QUARTA!Link para a compra do kit BIA TODO DIA:https://www.sephora.com.br/Boca-Rosa-Kit-de-Batons-Bia-Todo-Dia-554104-554104.html Minhas redes:Instagram: https://instagram.com/bianca​​​​Twitter: https://twitter.com/biancaandrade​​​​Boca Rosa Beauty:Instagram: https://instagram.com/bocarosabeauty​​Ficha Técnica:Direção Criativa: @bianca e @biaventurottiProdução Executiva: @andrezageizianeMídias Sociais: @anjumalheirosProdução e Edição Vinheta: @alextavares___ e @ma_sarmentoCaptação e Edição: @rodrigojubramBeauty: @biancaHair: @oliveiraguel Direção de Imagem: @murilomahlerRealização: @bocarosabeauty e @payotbrasil"
"XNROQyD5EH8","Orochi LOBO🐺 feat. Poze do Rodo (prod. Ajaxx)","2021-04-13T19:00:13Z","UCQSDP7H4BINtrZ0bJc_FNIA","Orochi","10","21.15.04","Orochi|Balao|Balão|Anitta|Djonga|Choice|Recayd Mob|Derek|Dfideliz|Raffa Moreira|bc raff|medellin records|Rap Box|Bagua Records|GR6 EXPLODE|bola rebola|kondzilla|Pineapple StormTV|1Kilo Oficial|zetre|recayd mob|30PRAUM|Matue|Darua|roda do tanque|vs|rei do tanque|freestyle|trap|rap|mpb|soul|trapper|preso|Vitão|DAY|hip hop|juizo final|sanjoe|desculpa doutor|Musica Brasileira|lançamentos 2019|viral","1352876","181782","1785","6857","https://i.ytimg.com/vi/XNROQyD5EH8/default.jpg","False","False","Ouça #Lobo em todas as plataformas digitais: https://ps.ONErpm.com/Lobo_Se inscreva no canal e ative o sino de notificações para não perder nenhum lançamento!Instagram: https://www.instagram.com/orochi​Twitter: https://twitter.com/orochi1999_​Facebook: https://www.facebook.com/mcorochioficial​https://www.instagram.com/ajaxxprod​https://www.instagram.com/mainstreetrecComposição: Orochi Produção Musical: AjaxxRec/Mix: AjaxxMaster: 2f UflowDireção: Pedro DaRua Assistente direção: Matheus Portugal Operador de câmera: Diogo Oliveira Fotografia Still: 25birdman Intro / Colorização: Lucas Araújo Stylist: Elegannex Montagem e edição: Pedro DaRua Gaffer: Lua PereiraProdução: Lucas DiasProdução: Leandro SantosProdução Executiva: Lucas Lang©℗ Mainstreet Records"
"XT5D4Zx0RvQ","Ingrid Michaelson, ZAYN - To Begin Again (Official Video)","2021-04-15T04:00:15Z","UCU-7_92DalfcpLB4MUw_3bA","IngridMichaelsonVEVO","10","21.15.04","Cabin 24 Records|ZAYN|Pop|Pop Singer/Songwriter|Ingrid Michaelson|To Begin Again|Sony 360|The Way I Am|Girls Chase Boys|One Direction","376806","111167","190","6430","https://i.ytimg.com/vi/XT5D4Zx0RvQ/default.jpg","False","False","Listen to To Begin Again - https://smarturl.it/tobeginagain🎧Put headphones on for a simulated 360 Reality Audio experience🎧To Begin Again Official Music Video Credits:Director: Marykate SchneiderProducer: Marykate Schneider, Bill Hendrickson, Tom LiDirector of Photography: Tom LiEditor: Marykate SchneiderB Cam Operator: Matt ChiricoPA: Michael Cornwallis Dancer: Ayla Ciccone-Burton Memorial Vintage Store Owner: Ian IsenhourStuffed Ice Cream owner: Alan Yaung, Jackie LuuIce cream enjoyer: Dana TruittBasketball player: Matthew DaddonaFree Hugs guy: Jeremy HarrisFamily: The Adetola's“To Begin Again” was mixed with an immersive #360RA experience in mind, use headphones for the full effect.Stream “To Begin Again” in full 360 Reality Audio, now available on Tidal, Amazon and Deezer.Register at the link below to redeem your 3-month free trial!Visit: https://cutt.ly/music_com_Ingrid_Michaelson_ft_Zayn*Quantities are limited, while supplies last"
"EFsqF96BDqQ","♫ DEU PSG!!! NEYMAR E CIA ELIMINAM BAYERN DA CHAMPIONS | Paródia Ele é Ele, Eu Sou Eu - Safadão","2021-04-14T14:23:03Z","UCGFNp4Pialo9wjT9Bo8wECA","FutParódias","17","21.15.04","Futebol|FutParodias|Paródia|futparodia|futeparodia|parodia|fut parodia|fut parodias|Paródia com Jogadores|psg|paris saint germain|psg champions|psg x bayern|futparodias psg|neymar|menino ney|adulto ney|ney|neymar futparodias|mbappé|mbappé futparodias|kimmich|bayern|bayern de munique|bayern champions|bayern futparodias|neuer|ele é ele eu sou eu|wesley safadão|barões da pisadinha|paródia safadão|paródia barões da pisadinha|paródia ele é ele eu sou eu","1025692","143546","1699","5130","https://i.ytimg.com/vi/EFsqF96BDqQ/default.jpg","False","False","Uma paródia de futebol da música Ele é Ele, Eu Sou Eu do Wesley Safadão com os Barões da Pisadinha. O PSG sofreu demais, mas passou do super Bayern! Neymar carimbou a trave três vezes, Mbappé fez gol que foi invalidado, Navas pegou pra caramba e o Paris ganhou a vaga aos trancos e barrancos, será que a orelhuda enfim vai pros parisienses?Bora seguir nossas redes? =)👍 INSTAGRAM:https://instagram.com/dezaofutparodiashttps://instagram.com/leonwhosoeverhttps://instagram.com/FutParodias👍 TWITTER:https://twitter.com/dezaodrumondhttps://twitter.com/leonwhosoeverhttps://twitter.com/FutParodias👍 FACEBOOK:https://facebook.com/dezaodrumondhttps://facebook.com/leonwhosoeverhttps://facebook.com/FutParodias-----------------------------------------------------------------------------------------------🎼 Playback: Ponto do Karaokê 3Link: https://www.youtube.com/watch?v=fvWHezzrb0g💻 Edição: Canal iFutMagicLink: https://www.youtube.com/channel/UCn7BfZqsZ6ZyWM1EOzsbelw-----------------------------------------------------------------------------------------------LETRA:Ney jogou um bolãoBayern ficou pelo gramadoBayern deuli...Deu? Deuli adeusAssim, oh...Não tem coração que aguentaEsse jogo tenso deu até infarteNeymar quase voando em campoSó que a bola teima em beijar a traveAí rolou o gol do ChoupoMaldita lei que nunca falhaMas mesmo com a Lei do ExFoi tchau pro time da BaváriaBayern dava aula, mas no fim o que ele deuEle deu foi adeusEle deu foi adeusE quem trombar com o Mbamar e a tropa do NeydeusPode crer que morreuPode crer que já morreuNinguém para os muleksNey e Imba lado a ladoPra levantarRRRRRRRRRRRR TROFÉU DA CHAMPIONSUhl, bora ser campeãoO Bayern tava tão potenteCampeão da Champions na BavaridadeTalvez foi tanta segurançaQue fez Kimmich bicudar a humildadeAchou que iam passar o rodoFalou que era melhor que os carasAgora é aturar o NeyComemorando na tua caraBayern dava aula, mas no fim o que ele deuEle deu foi adeusEle deu foi adeusE quem trombar com o Mbamar e a tropa do NeydeusPode crer que morreuPode crer que já morreuPra cima, NeyzãoE o Tartaruga NinjaSinistra a união pra ser campeãoBayern deuli...Deuli adeusTchauzinho!"
"qFnD6eKjeh0","MAQUIEI MEU NAMORADO!","2021-04-14T21:57:55Z","UC3hbOa9SPef18ciKN4iXFhA","Clara Garcia","22","21.15.04","clara|garcia|namorado|make|maquiagem|maquiei|pedro|argueles|vanessa|lopes|luccas|lucas|abreu|amigos|vlog","126069","23855","99","786","https://i.ytimg.com/vi/qFnD6eKjeh0/default.jpg","False","False","Neste vídeo maquiei meu namorado! Espero que tenham gostado pois me diverti muito fazendo! Amo vocês! ❤️Me siga nas outras redes:Instagram: https://instagram.com/claragnds?igshid=1gnom4dh2bfidTiktok: https://vm.tiktok.com/ZSJM4LvDy/Twitter: https://twitter.com/claragnds?s=21Sigam todos da mansão: Vanessa: https://youtube.com/channel/UC8_DaAYKn2BYT6wdE2fasWwLuccas: https://youtube.com/channel/UCadUaKYqJ5MGIsjnrLEHQEwPedro: https://instagram.com/pedrografiass?igshid=1fupims20448q"
"oySHRt64xLk","Velozes & Furiosos 9 – Trailer 2 Oficial (Universal Pictures) HD","2021-04-14T15:00:33Z","UCwhVCdYsd-A32RECPqJUoPg","Universal Pictures Brasil","24","21.15.04","trailer|trailer oficial|filme|universal pictures|ação|thriller|fast and furious|fast 9|velozes e furiosos|velozes 9|vin diesel|john cena|michelle rodriguez|ludacris|tyrese gibson|charlize theron|helen mirren|jordana brewster|nathalie emmanuel|cardi b|wiz khalifa|ozuna|+ velozes + furiosos|desafio em tóquio|a saga velozes e furiosos","523640","14223","211","817","https://i.ytimg.com/vi/oySHRt64xLk/default.jpg","False","False","Breve nos cinemas.Curta a Universal Pictures no Facebook: www.facebook.com/universalpicturesbrSiga nosso perfil no Instagram: www.instagram.com/universalpicsbrSiga nosso perfil no Twitter: twitter.com/UniversalPicsBrhttp://www.velozesefuriososfilme.com.brGênero: Ação e Thriller  Elenco: Vin Diesel, Michelle Rodriguez, Tyrese Gibson, Chris “Ludacris” Bridges, John Cena, Jordana Brewster, Nathalie Emmanuel, com Helen Mirren e Charlize Theron Diretor: Justin Lin Roteirista: Dan CaseyBaseado nos personagens criados por: Gary Scott Thompson Produtores: Neal H. Moritz, Vin Diesel, Jeff Kirschenbaum, Joe Roth, Justin Lin, Clayton Townsend, Samantha VincentNão importa o quão veloz você seja, ninguém supera o passado. V9 é o nono capítulo da saga Velozes & Furiosos que perdura há duas décadas e ganhou mais de US$ 5 bilhões em todo o mundo. Dom Toretto, de Vin Diesel, está levando uma vida tranquila fora das pistas com Letty e seu filho, o pequeno Brian, mas sabem que a qualquer momento, isso pode mudar. Desta vez, uma ameaça forçará Dom a confrontar os pecados de seu passado e salvar aqueles que ele mais ama. Sua equipe se une contra uma trama mundial liderada por um assassino e motorista de alto desempenho: um homem que também é o irmão abandonado de Dom, Jakob.Velozes & Furiosos 9 ainda conta com a volta de Justin Lin, diretor do terceiro, quarto, quinto e sexto filme da franquia que se tornou um blockbuster mundial. A ação percorre o mundo — de Londres a Tóquio, da América Central a Edimburgo, e de um bunker secreto no Azerbaijão até as ruas de Tblisi, na Geórgia. Ao longo do caminho, velhos amigos voltarão, velhos inimigos voltarão, a história será reescrita e o verdadeiro significado da família será testado como nunca antes.O filme ainda traz o elenco fiel da série como Michelle Rodriguez, Tyrese Gibson, Chris “Ludacris” Bridges, Jordana Brewster, Nathalie Emmanuel e Sung Kang, além das ganhadoras do Oscar® Helen Mirren e Charlize Theron. Velozes & Furiosos 9 também destaca a ganhadora do Grammy Cardi B como Leysa, uma nova personagem que terá conexão com o passado de Toretto. O filme é produzido por Neal H. Moritz, Vin Diesel, Jeff Kirschenbaum, Joe Roth, Justin Lin, Clayton Townsend e Samantha Vincent."
"ZH-QEv9nkCA","Melhores Momentos de São Paulo 3 x 2 Guarani - Rodada 9 - Paulistão A1 Sicredi 2021","2021-04-15T02:40:57Z","UCaf4uhI8ItLyM_6kZ5I5Zdw","Paulistão Sicredi","17","21.15.04","Gol|Gols|Noticias|Esporte|Futebol|Paulistão Sicredi A1|Paulistão|São Paulo|Guarani","44507","915","15","58","https://i.ytimg.com/vi/ZH-QEv9nkCA/default.jpg","False","False","Melhores Momentos de São Paulo 3 x 2 Guarani - Rodada 9 - Paulistão A1 Sicredi 2021.Imagens: Grupo Globo"
"AviFjiKeisw","PALMEIRAS PERDE MAIS UMA NOS PÊNALTIS E É VICE DA RECOPA SUL-AMERICANA | Linha de Passe","2021-04-15T03:48:09Z","UCw5-xj3AKqEizC7MvHaIPqA","ESPN Brasil","17","21.15.04","palmeiras|verdao|palmeiras final|recopa sulamericana|defensa y justicia|palmeiras penaltis|torcida do palmeiras|meu palmeiras|tudo palmeiras|estadio|palmeiras x defensa y justicia|palmeiras perde|palmeiras derrota|gols rony|weverton|expulsao|briga|vermelho|libertadores|palmeiras x flamengo|noticias palmeiras|espn|fox|fox sports","144527","6137","169","1231","https://i.ytimg.com/vi/AviFjiKeisw/default.jpg","False","False","Foto original: Cesar Greco/PalmeirasO Palmeiras perdeu no tempo normal e nos pênaltis para o Defensa y Justicia, nesta quarta-feira, no Mané Garrincha, em Brasília, e ficou com o vice da Recopa Sul-Americana 2021! Tudo isso dias depois de perder o título da Supercopa do Brasil, no mesmo estádio, para o Flamengo.Quer saber tudo sobre o melhor do esporte? Acesse o ESPN.com.br e inscreva-se no nosso canal!https://www.espn.com.br/​➡ Facebook: https://facebook.com/foxsportsbrasil​ ➡ Twitter: https://twitter.com/foxsportsbrasil​➡ Instagram: https://instagram.com/foxsportsbrasil​➡ Facebook: https://www.facebook.com/espnbrasil​➡ Twitter: https://twitter.com/ESPNBrasil​➡ Instagram: https://www.instagram.com/espnbrasil"
"QCnQnRWhHoE","SÃO PAULO 3X2 GUARANI - ANÁLISE E NOTAS","2021-04-15T02:59:23Z","UC0GUaQ6lVzvu0FWklbsKFhg","BAROLO VÍDEOS","17","21.15.04","[none]","123847","20176","112","1367","https://i.ytimg.com/vi/QCnQnRWhHoE/default.jpg","False","False","LINK PARA VOCÊ COMPRAR A CAMISETA E AJUDAR O CANAL DO TIOZINHO!EDIÇÃO LIMITADA! FALTAM POUCAS PEÇAS!https://www.qestilos.com.br/produtos/ALô, Família Tricolor!Mais um dia de maratona. Mais um dia de São Paulo em campo. E com vitória! No vídeo de hoje a gente analisa o desempenho do time e dá a nota dos jogadores na ótima vitória contra o Guarani. O técnico Crespo usou vários jogadores que não estavam atuando, poupando a equipe titular para o clássico de sexta-feira contra o Palmeiras. E terça tem Liberta, que na verdade é o jogo mais importante do ano!Assista o vídeo, deixe seu comentário, seu like e se inscreva no canal!Aqui não é VAI, SÃO PAULO.Aqui é VAMOS, SÃO PAULO!Eu não quero ter razão...QUERO SER CAMPEÃO!CONTATO BAROLO:rbarolo@hotmail.comFACE E INSTA:barolo vídeos TWITTER:   @blogdobarolo CANAL BOTEKO DO BAROLO:https://www.youtube.com/channel/UCukV...​CANAL RESENHA TRICOLOR: https://www.youtube.com/channel/UCOgL...​"
"ch7kMel_tS4","Alguém mais é assim??🤣🤣","2021-04-13T21:45:26Z","UC37x4zhps87gIQuVZybBPzw","ADR PORTAL","22","21.15.04","[none]","367089","30402","864","243","https://i.ytimg.com/vi/ch7kMel_tS4/default.jpg","False","False",""
"O_iA3FHQPMQ","UM URSO E UM BAITA SUSTO - Ep.1533","2021-04-14T22:35:33Z","UCtrjFP7i92_30uv6IehwE5Q","Cadê a chave?","24","21.15.04","Leon|Martins|Nilce|Moretto|nilmoretto|leon|intercambio|intercâmbio|imigrar|br|pt|ptbr|daily|vlog|Canada","334086","92253","394","1508","https://i.ytimg.com/vi/O_iA3FHQPMQ/default.jpg","False","False","NÃO PERCA! 50%off na maior promoção do ano do Cambly: CAC-50OFF |  https://bit.ly/3lxRPKx  Acompanhe nosso trabalho em outros canais! https://www.youtube.com/coisadenerdhttps://www.youtube.com/financeirohttps://www.youtube.com/channel/UChmOR1T5ZNnbRUba3lHRTOghttps://www.youtube.com/queroouvirpodcastNos siga no Instagram: Instagram do Leon: https://instagram.com/cdnleonInstagram da Nilce:  https://instagram.com/nilmorettoMusic by: Epidemic Sound www.epidemicsound.comYoutube (Ferramentas de Criação) Pacote Royalty Free do Sony Vegas"
"A4PhxGDFAsU","Multi Money Ball -PLINKO!!","2021-04-14T01:00:03Z","UC-OfPFc1p-FclPQc2nXg1FA","Klem Family","20","21.15.04","[none]","6770491","233198","9238","1027","https://i.ytimg.com/vi/A4PhxGDFAsU/default.jpg","False","False","Multi money ball -PLINKO!!Subscribe to watch family friendly challenges and games every day!! #familythings #family #challenge #moneygames #competition #fun #game #familygamenight #familyfun #plinko #moneyball #shortsFOLLOW US ON ALL SOCIAL MEDIA!!!!!:TikTok: https://vm.tiktok.com/ZMJmwq3fB/Instagram: https://www.instagram.com/theklemfamily/Triiler: https://triller.co/@klemfamilySnapchat: https://www.snapchat.com/add/theklemfamilyFacebook: https://www.facebook.com/KlemFamily/Twitter: https://twitter.com/brian_klemAll our links:https://beacons.page/bklem55"
"1gbC3ZS4SNU","TÔ GRÁVIDA?!  Fiz o TESTE e CONTEI TUDO pra vocês! 😍","2021-04-14T15:04:04Z","UCLC9WflyJi3Rq_jog91fMNQ","Ingredy Barbi","24","21.15.04","Ingredy|Ingredy Barbi|Free Fire|Garena Free Fire|como ganhar diamante|Diamantes Free Fire|gravida|gravidez|teste de gravidez","185396","32173","307","1646","https://i.ytimg.com/vi/1gbC3ZS4SNU/default.jpg","False","False","No vídeo de hoje, respondi algumas perguntas de vocês, inclusive falando sobre gravidez, filhos e etc. Espero que gostem.Nossa casa nova: https://youtu.be/nRRV1orQ1xY📷 Instagram @ingredybarbi🎶 TikTok @ingredybarbi"
"cHfrmZLK_3w","Japinha Conde, Conde do Forró - Quase Surta | EP Piseiros - DVD Evidências (Video Oficial)","2021-04-14T15:00:21Z","UChbVeRtv-cDsM9-PO4Mxltw","Conde do Forró Oficial","10","21.15.04","Romance Desapegado|Conde do Forró|Japinha Conde|Japinha do Conde","231154","15452","192","779","https://i.ytimg.com/vi/cHfrmZLK_3w/default.jpg","False","False","- Inscreva-se no canal: http://bit.ly/CANALCONDEDOFORRO​​Música parte do EP Piseiros DVD Evidências #JapinhaConde​ #CondeDoForro​ #QuaseSurta #EPPiseiros Contato para shows: (82) 9.9961-5969(85) 9.9623-0663Siga nas rede sociais: http://facebook.com/condedoforrooficial​​ http://intagram.com/condedoforro​​http://instagram.com/japinhaconde​​http://tiktok.com/@japinhaconde​​ http://tiktok.com/@condedoforro​​ http://facebook.com/japinhaconde​http://twitter.com/japinhaconde​​QUASE SURTA Cê tá com ele néSó pra me esquecerSerá que ele sabe disso?Que você liga pra mimToda madrugaFala que ta com saudadesPede pra voltarMe disseram um tempo desseQuase surtaQuem mandou me deixarQuem mandou me deixarO ditado é certoDepois que perde sabe valorizarCê tá com ele, néSó pra me esquecerSerá que ele sabe disso?Que você liga pra mimToda madrugaFala que ta com saudadesPede pra voltarMe disseram um tempo desseQuase surtaQuem mandou me deixarQuem mandou me deixarO ditado é certoDepois que perde sabe valorizarQue você liga pra mimToda madrugaFala que ta com saudadesPede pra voltarMe disseram um tempo desseQuase surtaQuem mandou me deixarQuem mandou me deixarO ditado é certoDepois que perde sabe valorizarQue você liga pra mimToda madrugaFala que ta com saudadesPede pra voltarMe disseram um tempo desseQuase surtaQuem mandou me deixarQuem mandou me deixarO ditado é certoDepois que perde sabe valorizar"
"yY6CyR4rn9o","DEIXEI O PEIXINHO COM CIÚMES POR 24 HORAS! *ele ficou muito bravo*","2021-04-14T22:45:18Z","UCRKMoImiahCNu833HVQVhBA","Luiza Parente","23","21.15.04","[none]","136448","26455","169","684","https://i.ytimg.com/vi/yY6CyR4rn9o/default.jpg","False","False","Eaiii galera, nesse dia fiz o peixinho passar muuuuito ciúmes, passei ele no ppp, fingi que queria gravar com o foganoli ao invés dele e muito mais, ele ficou MUITO bravo, assistam!!!Instagram: @luizaparente Tiktok: @luizaparente Twitter: @luizaparente4"
"i6zuh-GeQRk","A SURPRESA QUE ELA ESPEROU POR 10 ANOS * O nome de verdade | Kathy Castricini","2021-04-14T16:08:20Z","UCdMdGdabsaWIzSbmE1phGBQ","Kathy Castricini","24","21.15.04","Kathy Castricini|kathy pink|familia Castricini|familia|maternidade|vlog|dia a dia|familia castricini|kathy castricini|vlog em familia|maternidade real|sonho|meu nome de verdade|pai biologico|descobrindo meu pai biologico depois de adulta","297061","32443","295","2366","https://i.ytimg.com/vi/i6zuh-GeQRk/default.jpg","False","False","Foram 10 anos esperando para realizar esse sonho e agora é oficial, enfim vou ter o nome do meu pai biológico nos meus documentos, conheci o meu pai biológico com 20 anos, dai em diante seguimos esperando pelas burocracias de documentação e enfim saiu e eu tenho oficialmente o nome Castricini.VIDEOS NOVOS DE SEGUNDA À SEXTA AO 12:00HRS ➜ Anuncie: comercial.kathycastricini@gmail.com♡ FIQUE PERTINHO DE MIM:➜ www.kathycastricini.com➜  Email: comercial.kathycastricini@gmail.com➜  instagram : http://instagram.com/kathy.castricini➜  Facebook: https://www.facebook.com/Kathypiink➜  Twitter : http://twitter.com/kathycastricini➜ Tiktok: https://www.tiktok.com/@kathycastricini➜ Grupo vip no telegram: https://t.me/joinchat/AAAAAFDIHDGFn3lbdVJdxw♡ SE INSCREVA NO CANAL DAS CRIANÇAS:- Canal Eliza:https://goo.gl/cuc7we- Canal do Kaick: https://goo.gl/hMJZ6R- Canal do Ezequiel: https://www.youtube.com/user/EzequielMendes92#FamiliaCastricini♡ Fiquei muito feliz em ter você aqui, obrigado pelo carinho e por assistir. Seu comentário e JOINHA é muito importante para mim. E não se esqueça de se INSCREVER e ativar o SININHO DE NOTIFICAÇÕES. ♡"
"BMNQSUgLhbc","Palmeiras vs. Defensa y Justicia [1-2] | CONMEBOL Recopa 2021: ¡DEFENSA CAMPEÓN!","2021-04-15T05:03:49Z","UClgFf9mS1mZI2D_vo-ZTpmQ","CONMEBOL Libertadores","17","21.15.04","CONMEBOL|Copa|Libertadores|Fútbol|Sudamericano","213513","5450","153","1126","https://i.ytimg.com/vi/BMNQSUgLhbc/default.jpg","False","False","Suscríbete al canal oficial de la CONMEBOL Libertadores para tener acceso al mejor contenido: https://bit.ly/345e8OLEncuentra toda la información en nuestro sitio oficial: https://www.copalibertadores.com/¡Síguenos en nuestras redes!Facebook: https://facebook.com/CopaLibertadores/Twitter: https://twitter.com/libertadoresInstagram: https://instagram.com/libertadores"
"2CZsmTXeRBM","Oh No.... 😂","2021-04-13T19:55:26Z","UC6D1L2vxEAg_Vi0JSxMBDgA","Dan Rhodes","24","21.15.04","[none]","8607612","321743","18887","1873","https://i.ytimg.com/vi/2CZsmTXeRBM/default.jpg","False","False","Got myself into a sticky situation there 😂"
"P0c14BJucZo","BRIGADEIRO PERFEITO - Receita rápida e fácil, para nunca mais errar","2021-04-14T06:23:59Z","UC52Ql_o7tYJfSobudv_BqYA","Sau Sampaio","24","21.15.04","sau sampaio|sau|tiktok|como fazer brigadeiro|receita|receitas|receita facil de brigadeiro|como fazer brigadeiro facil|receita brigadeiro perfeito|receita de brigadeiro|brigadeiro de colher|brigadeiro facil|brigadeiro de microondas|brigadeiro recipe|brigadeiro cake|brigadeiros de chocolate|brigadeiro brazilian|brigadeiro receta|brigadeiro receta original|original brigadeiro|recipe brigadeiro original","73777","7041","77","71","https://i.ytimg.com/vi/P0c14BJucZo/default.jpg","False","False","BRIGADEIRO PERFEITO - Receita rápida e fácil, para nunca mais errar.SE INSCREVA NA SEMANA COZINHA CRIATIVA - https://bit.ly/sem-cozinha-criativaMELHORES VINHOS COM DESCONTO. Acesse o link e tenha 15% de desconto no site da evino - https://bit.ly/Vinho-DescontoO doce mais brasileiro de todos sem dúvida é o brigadeiro. Nessa receita rápida você aprende como fazer um brigadeiro perfeito sem segredos.Ingredientes:- 1 lata de leite condensado- 1 colher de sopa de manteiga- 4 colheres de chocolate em pó- GranuladoModo de preparo:Colocar tudo em uma panela. Misturar bem e deixar em fogo baixo até a mistura começar a ficar firme. O ponto ideal é quando o brigadeiro desgruda do fundo da panela.Coloque em um prato para esfriar. Unte as mãos com manteiga para enrolar e passe pelo granulado.Você pode substituir o chocolate por outras coisas como pasta de amendoim para um brigadeiro de amendoim.Sigam nas minhas outras redes sociais:TIKTOK: SAUSAMPAIO ou https://www.tiktok.com/@sausampaio​​INSTAGRAM: SAUSAMPAIO ou https://instagram.com/sausampaio​​TWITTER: SAUSAMPAIO ou https://twitter.com/Sausampaio​​Deixa seu likeSe inscreveComenta o que achou do vídeo!--------------------------------------------------------------------------------------------------#brigadeiro​​ #receitafacil​​ #docinho #shorts"
"opSx2ECWidw","JÚLIA PINTOU O CABELO DE MORENA ILUMINADA 😱","2021-04-13T23:43:38Z","UC5K2cu7OuDEUFWeRKpeSH9A","Hytalo Santos","24","21.15.04","[none]","751499","62499","1080","0","https://i.ytimg.com/vi/opSx2ECWidw/default.jpg","True","False","Vem se divertir com a gente 😱"
"gnHBVXrZYmk","CHEGOU O MEGA ENXOVAL DA ALANA","2021-04-14T15:00:51Z","UCy9xDEfMD8jrXU3NatFLLtw","Taciele Alcolea","22","21.15.04","Taciele|Alcolea|Taciele alcolea|taci alcolea|taci","224108","24594","195","649","https://i.ytimg.com/vi/gnHBVXrZYmk/default.jpg","False","False","INSCREVA-SE NO CANAL E VENHA FAZER PARTE DO MEU DIA-A-DIA: www.youtube.com/c/tacielealcoleaaEdição @caaajuuFIlmmaker @alcolea7Quem já comprou o nosso livro? Corre pra garantir o seu!Os links estão abaixo, VEM:Saraiva: http://bit.ly/2xV6kCqFnac: http://bit.ly/2jRoI9dLivraria Cultura: http://bit.ly/2w9OBm8Amazon: http://amzn.to/2fENt3PME SEGUE NO INSTA: https://www.instagram.com/tacielealcoleaBlog: http://www.tacielealcolea.com/E-mail para contato: contato@tacielealcolea.comContato comercial: comercial@tacielealcolea.comTwitter: http://twitter.com/tacielealcoleaFacebook: https://www.facebook.com/TaciAlcolea/Minha caixa postal: 71 | CEP: 18200-970 Itapetininga – SP"
