video_id,title,publishedAt,channelId,channelTitle,categoryId,trending_date,tags,view_count,likes,dislikes,comment_count,thumbnail_link,comments_disabled,ratings_disabled,description
"CkTVoLamPio","Meghan, Duchess of Sussex, opens up about her family","2021-03-08T14:01:55Z","UC-SJ6nODDmufqBzPBwCvYvQ","CBS This Morning","25","21.14.03","cbs this morning|duchess of sussex|Meghan Markle|thomas markle|prince harry|sitdown|Oprah Winfrey","10270437","73960","16349","18645","https://i.ytimg.com/vi/CkTVoLamPio/default.jpg","False","False","For the first time Meghan, Duchess of Sussex, publicly discusses her father Thomas Markle and her half-sister's forthcoming tell-all book in this previously unaired clip from her and Prince Harry's sit-down with Oprah Winfrey. Watch Oprah's full primetime special with Meghan and Prince Harry here: https://bit.ly/3t24kAKSubscribe to the CBS This Morning YouTube channel: https://bit.ly/3ceNNCXWatch more CBS This Morning: http://bit.ly/1T88yARLike CBS This Morning on Facebook: https://on.fb.me/1LhtdvIFollow CBS This Morning on Instagram: https://bit.ly/1Q7NGnYFollow CBS This Morning on Twitter: https://bit.ly/1Xj5W3pFollow CBS News on Twitter: https://bit.ly/3bdNXekGet the latest news and best in original reporting from CBS News delivered to your inbox. Sign up for newsletters: https://cbsn.ws/1RqHw7TGet your news on the go! Download CBS News mobile apps for Android and iOS: https://cbsn.ws/1Xb1WC8Get new episodes of shows you love across devices the next day, stream local news live, and watch full seasons of CBS fan favorites and originals anytime, anywhere with Paramount+. Sign up here: https://bit.ly/309gCe2---Each weekday morning, CBS This Morning co-hosts Gayle King, Anthony Mason and Tony Dokoupil deliver two hours of original reporting, breaking news and top-level newsmaker interviews in an engaging and informative format that challenges the norm in network morning news programs. The broadcast has earned a prestigious Peabody Award, a Polk Award, four News & Documentary Emmys, three Daytime Emmys and the 2017 Edward R. Murrow Award for Best Newscast. The broadcast was also honored with an Alfred I. duPont-Columbia Award as part of CBS News division-wide coverage of the shootings at Sandy Hook Elementary School in Newtown, Connecticut. Check local listings for CBS This Morning broadcast times."
"sG-muoQiQaQ","2021 F1 Testing | Day 1 Afternoon Session | Bahrain","2021-03-12T16:02:13Z","UCB_qr75-ydFVKSF9Dmo6izg","FORMULA 1","17","21.14.03","F1|Formula One|Formula 1|Sports|Sport|Action|GP|Grand Prix|Auto Racing|Motor Racing","660170","18261","228","872","https://i.ytimg.com/vi/sG-muoQiQaQ/default.jpg","False","False","Watch all of F1 2021 Testing Live on F1 TV - http://f1.com/F1TVLiveWatch the final 15 minutes of the first day of 2021 pre-season testing live from Bahrain. Don't miss a second of coverage with F1 TV - sign up now with the code F1TV25 to get 25% off an Annual Subscription.For more F1® videos, visit http://www.Formula1.comFollow F1®:http://www.instagram.com/F1https://www.facebook.com/Formula1/http://www.twitter.com/F1https://www.twitch.tv/formula1https://www.tiktok.com/@f1#F1 #F1Testing"
"B1KhOizIx_0","TommyInnit is the Funniest Roblox Player Ever","2021-03-09T21:30:16Z","UCFbZ2e9IrPejOdp8wsKUxvA","QuackiTwo","20","21.14.03","Quackity|Quackitwo|Quackity Second Channel|Quackity Funny|Dream SMP|Twitch Stream|TommyInnit|GeorgeNotFound|BadBoyHalo|Quackity Funny Moments|Quackity Two|Dream|Dream Minecraft|Funny|Minecraft Funny|Minecraft Manhunt|Minecraft Challenge|Challenge|Minecraft but|Fun|TommyInnit Roblox|TommyInnit playing roblox|quackity and tommy playing roblox|roblox tommyinnit|tommy playing roblox|tommyinnit playing roblox|tommy plays roblox|quackity and tommy play roblox","1711524","148671","1242","3906","https://i.ytimg.com/vi/B1KhOizIx_0/default.jpg","False","False","He really is the funniest Roblox player YETT!WATCH THE DELETED SCENES: https://www.youtube.com/watch?v=ccYWrvuaPIESTREAMED LIVE ON TWITCH: https://www.twitch.tv/quackityhqFollow me on:DISCORD - https://discord.gg/quackityTWITTER - https://twitter.com/QuackityHQTWITCH - https://www.twitch.tv/quackityhqINSTAGRAM - https://www.instagram.com/quackity/"
"HgFzP5m1k_c","I Turned Valheim Into a Physics-Defying Nightmare","2021-03-09T16:00:05Z","UCto7D1L-MiRoOziCXK9uT5Q","Let's Game It Out","20","21.14.03","let's game it out|lets game it out|letsgameitout|lgio|lgio josh|josh let's game it out it out|valheim|valheim game|let's game it out valheim|valheim let's game it out|let's game it out survival|let's game it out tycoon|funny moments|valheim gameplay|valheim tips|valheim guide","3335989","163771","2314","8605","https://i.ytimg.com/vi/HgFzP5m1k_c/default.jpg","False","False","JOIN MY STREAMS! ► https://www.twitch.tv/letsgameitoutMerch!  ►  US/CA STORE ► http://bit.ly/LetsGameItOutUSStore  EU STORE ► http://bit.ly/LetsGameItOutEUStoreSubscribe if you enjoy! ► http://bit.ly/letsgameitout_showTwitter ► https://twitter.com/letsgameitoutFacebook ► https://www.facebook.com/letsgameitoutWant more LGIO?!More Simulator Mayhem ► https://www.youtube.com/watch?v=UqaNKNgSxYI&list=PLrBjj4brdIRzn3ja4BfqYUForg0p-p5wiFunny Tycoon Games ► https://www.youtube.com/watch?v=UqaNKNgSxYI&list=PLrBjj4brdIRwf14QPGmfDXCQQrDs860igThe Finest One-Offs ► https://www.youtube.com/watch?v=zIOFGCbwJSs&list=PLrBjj4brdIRwKf72d6spk7fSHhwwYuQu1Some Truly Bizarre Games  ► https://www.youtube.com/watch?v=zIOFGCbwJSs&list=PLrBjj4brdIRyM5mUsHwPN0PH6UVNfeNl2#LetsGameItOut #Simulation #ValheimI Turned Valheim Into a Physics-Defying Nightmare - Let's Game It Out----------Check it out on Steam ► https://store.steampowered.com/app/892970/Valheim/More about Valheim (from Steam):A battle-slain warrior, the Valkyries have ferried your soul to Valheim, the tenth Norse world. Besieged by creatures of chaos and ancient enemies of the gods, you are the newest custodian of the primordial purgatory, tasked with slaying Odin’s ancient rivals and bringing order to Valheim.Your trials begin at the disarmingly peaceful centre of Valheim, but the gods reward the brave and glory awaits. Venture forth through imposing forests and snow-capped mountains, explore and harvest more valuable materials to craft deadlier weapons, sturdier armor, viking strongholds and outposts. Build a mighty longship and sail the great oceans in search of exotic lands … but be wary of sailing too far...Key features:- Huge procedurally-generated world - explore and inhabit mystical lands, from mysteriousforests to imposing snow-topped mountain ranges and stunning meadows, complete with their own creatures of legend to battle and wildlife to hunt.- Co-op PvE (2-10 players) - - Whether you want to brave the lands alone or venture with trusted allies, Valheim supports independent, player-hosted servers and unlimited world creation. We recommend playing co-op with 3-5 players.- Punishing dodge & block based combat system with a wide range of weapons- Build & sail ships - from flimsy rafts to imposing warships, build legendary vessels to conquer the seas and discover new lands.- Summon and defeat vengeful primordial bosses of myth and legend, and collect trophies to progress and craft new powerful items- Flexible house and base building system - raise mead halls, farms, settlements outposts, castles and more.- Intuitive item crafting - forge the finest weapons and armour, and craft food and mead.- Dedicated server- for players who want to run a persistent server. If you prefer not to run a server on your PC, consider renting a server at G-Portal."
"VB_GWz25B3Q","What if the World turned to Gold? - The Gold Apocalypse","2021-03-09T14:59:36Z","UCsXVk37bltHxD1rDPwtNM8Q","Kurzgesagt – In a Nutshell","27","21.14.03","[none]","3954820","308206","3970","24374","https://i.ytimg.com/vi/VB_GWz25B3Q/default.jpg","False","False","The Map of Evolution and other sciency posters, researched and designed with love, are now available on the kurzgesagt shop. Your purchase will support us directly and keep our videos free for everyone. ►► https://shop.kurzgesagt.org(Worldwide Shipping Available)Sources & further reading:https://sites.google.com/view/sources-goldapocalypse/Let us explore the scientific mystery of what would happen to you, if Earth suddenly turned into gold! The “Midaspocalypse”, based on the ancient tale of King Midas who was cursed so everything he touched turned into gold. OUR CHANNELS▀▀▀▀▀▀▀▀▀▀▀▀▀▀▀▀▀▀▀▀▀▀▀▀▀▀German Channel: https://kgs.link/youtubeDE Spanish Channel: https://kgs.link/youtubeES HOW CAN YOU SUPPORT US?▀▀▀▀▀▀▀▀▀▀▀▀▀▀▀▀▀▀▀▀▀▀▀▀▀▀This is how we make our living and it would be a pleasure if you support us!Get Merch designed with ❤ from https://kgs.link/shop  Join the Patreon Bird Army 🐧 https://kgs.link/patreon  DISCUSSIONS & SOCIAL MEDIA▀▀▀▀▀▀▀▀▀▀▀▀▀▀▀▀▀▀▀▀▀▀▀▀▀▀Reddit:            https://kgs.link/redditInstagram:     https://kgs.link/instagramTwitter:           https://kgs.link/twitterFacebook:      https://kgs.link/facebookDiscord:          https://kgs.link/discordNewsletter:    https://kgs.link/newsletterOUR VOICE▀▀▀▀▀▀▀▀▀▀▀▀▀▀▀▀▀▀▀▀▀▀▀▀▀▀The Kurzgesagt voice is from Steve Taylor:  https://kgs.link/youtube-voiceOUR MUSIC ♬♪▀▀▀▀▀▀▀▀▀▀▀▀▀▀▀▀▀▀▀▀▀▀▀▀▀▀700+ minutes of Kurzgesagt Soundtracks by Epic Mountain:Spotify:            https://kgs.link/music-spotifySoundcloud:   https://kgs.link/music-soundcloudBandcamp:     https://kgs.link/music-bandcampYoutube:          https://kgs.link/music-youtubeFacebook:       https://kgs.link/music-facebookThe Soundtrack of this video:Soundcloud:   https://bit.ly/3uC1UdPBandcamp:     https://bit.ly/3rafoeA🐦🐧🐤 PATREON BIRD ARMY 🐤🐧🐦▀▀▀▀▀▀▀▀▀▀▀▀▀▀▀▀▀▀▀▀▀▀▀▀▀▀Many Thanks to our wonderful Patreons from http://kgs.link/patreon who support us every month and made this video possible:Karthik Ramasamy, Vladan Lausevic, Glenn Green, Austin Millan, Wyton Chu, Gintare Petraityte, Cédric Marchal, Stacey Shpaner, Marko Cukovic, Misha Suksnguan, Christina Mansson, yem, Patrick Lathrop, Ben Saward, Igor Shevchenko, Eugen Schiller, Kamran Hassan, SrirachaSeahawk, Andrew Morse, Nick Wharff, Aleksander Lis, Andrew Conner, Linda Massie, R Armstrong, Garrett Krest, Vector-Dopamine math, James McMeeking, tuxlu, Matthew Gunn, Benjamin Lois, Xiaohan Ma, Yu Li, Fernadno, Memo Akten, Wrong_Dongle, วงศกร นันทวิชิต, Jose Mejia, Jacob B., gingerninja, Ondrej Priečinský, Leo MacMitchell, Mehran Ziadloo, Milan Mladoniczky, Jonathan Beranger, Jessie Childers, Joan Zak, Danil, Plinzler, landon, Patrick Jones, Ahmed Sultan, Ethan Holland, Ralitsa Tsoneva, David Lindvall, Bryan Roscoe, Jason aka Kypzethdurron, Christopher R. Collins, Jason Meyer, Patrick Frank, Anne Commons, James Moffatt, Emma Phillips, KoblerMan, Michael Wolfe, Kristian Küng, Morten Berg, Cristian Klein, Athletic Interest, Nomvitch, Team HAM, planloskreativ, Martin Lange"
"Xt5nPbXNgLQ","BTS | Meet The First-Time GRAMMY Nominees","2021-03-10T16:10:35Z","UCq4isO8ZYOZfmvGJ-_1UdIA","Recording Academy / GRAMMYs","10","21.14.03","grammy awards|grammys|grammy|album of the year|record of the year|song of the year|grammys red carpet|grammy red carpet|unexpect everything|2020 grammys|2021 grammys|63rd grammys|BTS|BTS grammy awards|bts grammy nomination|meet first-time grammy nominee|grammy nomination|best pop duo/group performance|bts dynamite|dynamite","1426413","299327","779","12598","https://i.ytimg.com/vi/Xt5nPbXNgLQ/default.jpg","False","False","In the latest episode of GRAMMY.com's annual Meet The First-Time GRAMMY Nominee series, global pop superstars BTS share their excitement and overflowing gratitude for their fans for their Best Pop Duo/Group Performance nomination at the 2021 GRAMMY Awards show.Tune into the 63rd GRAMMY Awards Sunday, March 14, on CBS to find out who will win.https://www.grammy.com/grammys/news/bts-interview-2021-grammys-meet-the-first-time-grammy-nomineeAbout the Recording Academy / GRAMMYs: Recording Academy is the world's leading society of musical professionals, and is dedicated to celebrating, honoring, and sustaining music's past, present and future. Connect with the Recording Academy / GRAMMYs: WEBSITE: http://www.grammy.comFACEBOOK: http://grm.my/2gcTcMk TWITTER: http://grm.my/2gDUHUD  INSTAGRAM: http://grm.my/2gZGIvJ Subscribe NOW to the Recording Academy / GRAMMYs on YouTube: http://grm.my/1dTBF8H#BTS #GRAMMYs #GRAMMYAwards"
"eT6wYbaRrlQ","VAN NEISTAT: The Spirited Man","2021-03-09T22:16:25Z","UC5mPJA4y5G8Z6aNkY6AxgAw","Van Neistat","1","21.14.03","4-18-16","661220","73288","474","4244","https://i.ytimg.com/vi/eT6wYbaRrlQ/default.jpg","False","False","Glimpse into a spirited man's self-reliant analog world.  Meet a spirited woman, too.For an in-depth explanation of this channel:   https://www.kickstarter.com/projects/1767122922/the-spirited-man-series?ref=74nmgl&token=0df6e7c5"
"2lfBYyQ2xjo","Juventus vs. Porto: Extended Highlights | UCL on CBS Sports","2021-03-09T23:08:35Z","UCET00YnetHT7tOpu12v8jxg","Champions League on CBS Sports","17","21.14.03","Juventus|FC Porto|Juventus vs. FC Porto","1312629","13338","466","4680","https://i.ytimg.com/vi/2lfBYyQ2xjo/default.jpg","False","False","Juventus won the second leg 3-2, but Porto move on to the quarterfinal round thanks to away goals. Sergio Oliveira was the savior for Porto notching goals in the 19’ by way of penalty and in the 115’ to all but seal the win. Chiesa notched goals in the 49’ and 63’ to get the offense going for Juventus. After Porto evened it up at 2, Rabiot found the back of the net just two minutes later to give Juventus some hope with three minutes remaining. Juventus almost rallied to score a stoppage time goal in extra time, however Porto’s defense stiffened and got rid of the threat. Porto who was undermanned after Mehdi Taremi was sent off in the 54’ still managed to knock off the traditional power and make some waves in the UEFA Champions League.Stream every UEFA Champions League match live on Paramount+:https://www.paramountplus.com/shows/uefa-champions-league/#UEFA #UCL #ChampionsLEague #Juventus #Porto #ExtraTime"
"6DD9-W9z62o","Inside the US War On Terror in Somalia","2021-03-10T17:00:03Z","UCZaT_X_mc0BI-djXOlfhqWQ","VICE News","25","21.14.03","VICE News|VICE News Tonight|VICE on HBO|news|vice video|VICE on SHOWTIME|vice news 2020","1546371","28603","1662","7236","https://i.ytimg.com/vi/6DD9-W9z62o/default.jpg","False","False","Fifteen years after the creation of al-Shabaab in Somalia, terror still reigns and the reality on the ground just shifted more in their favor.In a last ditch effort to leave a mark on foreign policy before his ouster, President Trump announced a drawdown of US troops in global hotspots around the world, including around 700 in Somalia. With no soldiers on the ground the plan promised to provide support through an already controversial and secretive drone program–which watchdog groups say has killed exponentially more civilians than the US admits.VICE News travels to the frontline of Somalia’s war against al-Shabaab to see what the US pullout means for the next chapter in the war on terror.Subscribe to VICE News here: http://bit.ly/Subscribe-to-VICE-NewsCheck out VICE News for more: http://vicenews.comFollow VICE News here:Facebook: https://www.facebook.com/vicenewsTwitter: https://twitter.com/vicenewsTumblr: http://vicenews.tumblr.com/Instagram: http://instagram.com/vicenewsMore videos from the VICE network: https://www.fb.com/vicevideo#VICENews #News"
"MnYDoMjL1UQ","Random CS:GO Bullshittery (part 9)","2021-03-09T22:33:18Z","UCQD3awTLw9i8Xzh85FKsuJA","SovietWomble","20","21.14.03","csgo|bullshittery|sovietwomble|funny|clips|livestream|highlights|animated|zero fucks|zf|clan","2085318","155254","1366","6392","https://i.ytimg.com/vi/MnYDoMjL1UQ/default.jpg","False","False","Highlights from some CSGO livestreams a while back.All ZF Twitch channels - https://www.twitch.tv/team/zfclanMy personal one - http://www.twitch.tv/sovietwomble​Sources:All French music drawings made by TwistieZ."
"ZT_cZAIxp7A","I don't even know what Riverdale is anymore...","2021-03-10T13:20:02Z","UCY6Ij8zOds0WJEeqCLOnqOQ","Alex Meyers","24","21.14.03","alex meyers|alex mayers|alex myers|riverdale|riverdale is a mess","786637","54581","298","3585","https://i.ytimg.com/vi/ZT_cZAIxp7A/default.jpg","False","False","🏨Install Grand Hotel Mania for free and start your hotel adventure!: https://patron.me/GHMAlex★☆★ Help Me Get to 3,000,000 Subscribers! http://bit.ly/1IqsdaqDownload my game!https://apps.apple.com/us/app/id1527894025https://play.google.com/store/apps/details?id=games.b6.alexCheck out my Podcasthttps://www.youtube.com/channel/UCBgm0clEVtGjgUKGHbMrqIw/★☆★Buy some Merch:  alexmeyers.teemill.com★☆★PLEASE SHARE THIS VIDEO!!★☆★PREVIOUS VIDEOS:Thank you so much for 2,000,000 subscribers.  If you like what you see, please share these videos with your friends to show support!"
"mxnGGyH2_Is","I Spent 300 Days in ONE BLOCK Minecraft... Here's What Happened","2021-03-09T13:00:23Z","UCIVSqoHCUN1XdEpiVItxfoQ","aCookieGod","20","21.14.03","300 days in minecraft|minecraft 300 days|i spent 300 days in minecraft|acookiegod|acookiegod minecraft|a cookie god|i spent 300 days in one block minecraft|i survived 300 days in one block minecraft|i spent 300 days in one block skyblock|300 days but you only get one block|surviving 300 days on one block|minecraft 300 days in one block skyblock|300 days one block survival|300 days on one block|300 days but its one block|acookiegod one block|acookiegod 300 days","2227429","104390","1809","27623","https://i.ytimg.com/vi/mxnGGyH2_Is/default.jpg","False","False","I Spent 300 Days in ONE BLOCK MinecraftI Spent 300 Days in ONE BLOCK SkyblockJOIN MY ONE BLOCK SKYBLOCK SERVER: cookie.oneblockmc.comHow to join One Block: https://oneblockmc.com/play» SUBSCRIBE TO MY SECOND CHANNEL:✔ https://www.youtube.com/channel/UCMfADVjndQ4w9-CQvQZaL_g➖➖➖➖➖➖➖➖➖➖➖➖➖➖➖➖➖➖➖➖➖➖COOKIE'S SOCIAL MEDIA:» Second Channel: https://www.youtube.com/channel/UCMfADVjndQ4w9-CQvQZaL_g» Discord Server: https://discord.gg/xyyGMez» Twitter: https://twitter.com/aCookieGod» Subscribe: https://www.youtube.com/channel/UCIVSqoHCUN1XdEpiVItxfoQ?sub_confirmation=1➖➖➖➖➖➖➖➖➖➖➖➖➖➖➖➖➖➖➖➖➖➖》ONE BLOCK SERIES:✔ 100 Days: https://youtu.be/NnM24Ed2uK4✔ 200 Days: https://youtu.be/0bORiBtbRJ8》We Spent 100 Days in Minecraft PIXELMON:✔ https://youtu.be/UosoE8aS-p0➖➖➖➖➖➖➖➖➖➖➖➖➖➖➖➖➖➖➖➖➖➖》 Music from Epidemic Sounds》100 Days Inspired by @Luke TheNotable​ 》One Block Skyblock Inspired by @WadZee​ @Aphmau​ @UnspeakableGaming​ @Unspeakable​ 》OneBlock Map Download by  @IJAMinecraft​ Thank you for clicking on this video and for watching! I have more awesome videos, so go watch them. Also, drop a like & comment, I respond to all my comments! ❤️️#300days #minecraftoneblock #oneblockskyblock"
"NFF3d1VNmvE","When people do things that are unnecessary.","2021-03-10T20:29:24Z","UCb8vrqP8Z7Oz9ZTYvUtjUHQ","Daniel LaBelle","23","21.14.03","[none]","2633477","127966","1968","4817","https://i.ytimg.com/vi/NFF3d1VNmvE/default.jpg","False","False","We all do pointless things from time to time.--------------------------------------------------------------------------------------------------Tiktok - https://www.tiktok.com/@daniel.labell...​Instagram - https://www.instagram.com/daniellabel...​Facebook - https://www.facebook.com/daniellabell...​Twitter - https://twitter.com/labelled4"
"K96S2qroRN4","I'M LAUNCHING A YOUTUBE CHANNEL by Van Neistat","2021-03-09T22:16:11Z","UC5mPJA4y5G8Z6aNkY6AxgAw","Van Neistat","1","21.14.03","4-18-16","450854","27365","228","1443","https://i.ytimg.com/vi/K96S2qroRN4/default.jpg","False","False","A solution to focusing on yourself when your camera is out of reachFor an in-depth explanation of this channel:   https://www.kickstarter.com/projects/1767122922/the-spirited-man-series?ref=74nmgl&token=0df6e7c5"
"Ooga5KqtkMo","Miami Heat Player Meyers Leonard Uses Anti-Semitic Slur While Streaming Video Game","2021-03-09T22:42:52Z","UCXJryYh6xcW5iEeJGzK191A","CBS Miami","25","21.14.03","CBS 4 News Evening|Miami Heat|Meyers Leonard|Anti-Semitic Slur|Call of Duty|Twitch Stream|Local TV|Miami News","743096","3349","1406","2697","https://i.ytimg.com/vi/Ooga5KqtkMo/default.jpg","False","False","The team is aware of the video and the NBA is also looking into it."
"9H_368c2Hzw","Selena Gomez - Adiós (Lyric Video)","2021-03-12T05:00:02Z","UCjK8ORC71kwyj1DWFwril_A","SelenaGomezVEVO","10","21.14.03","Selena|Gomez|Adiós|(Lyric|Video)|Interscope|Records|Latin|Pop","2926579","306360","2562","13823","https://i.ytimg.com/vi/9H_368c2Hzw/default.jpg","False","False","Escucha ‘REVELACIÓN,’ disponible ya. // Listen to ‘REVELACIÓN,’ out now. https://smarturl.it/REVELACIONSG​​Animation by: Carlos Reyes, Ethan Madison, Cole SwansonShop Selena’s Official Store: https://smarturl.it/SelenaStore​​​Follow Selena:Instagram: https://www.instagram.com/selenagomezTwitter: https://twitter.com/selenagomez​​​​Facebook: https://www.facebook.com/Selena​​​​TikTok: https://www.tiktok.com/@selenagomez​​​​YouTube: https://smarturl.it/SelenaYT​​​​Listen on Apple Music: https://smarturl.it/SGEssentials​​​​Listen on Spotify: https://smarturl.it/SelenaGomezTheHitsSp​Get exclusive Selena Gomez merch, available at: http://smarturl.it/SelenaStore​​​​Sign-up to be the first to hear news from Selena: http://smarturl.it/SelenaGomez.News​​​​Best of Selena Gomez https://goo.gl/mgJg2s​​​​Selena Gomez Audio https://goo.gl/dmJYbdMusic video by Selena Gomez performing Adiós (Lyric Video). © 2021 Selena Gomez, under exclusive license to Interscope Recordshttp://vevo.ly/MuW1DT"
"fJ5TTIWems8","He EXPOSED ME on the Internet (FT @KING VADER)","2021-03-10T21:37:03Z","UCRfg0SWjIHm_h95e4V8X5og","Young Don The Sauce God","1","21.14.03","young don the sauce god|animations|animated|story time|king vader|exposed me on the internet|he exposed me on the internet|young don the sauce god expose video|exposed|insecurities|insecure about my feet|insecure about|insecure about body|funny|netflix dreams","570372","51175","251","3985","https://i.ytimg.com/vi/fJ5TTIWems8/default.jpg","False","False","I swear, it be your own people.Go watch our Netflix movie - https://youtu.be/rPQPgItxfgAOutro Song - https://song.link/GbXTRzPd7jkhFWatch My Last Animation - https://youtu.be/78OjlZglWnM​Instagram - https://www.instagram.com/ilovesaucegod/​Outro Song 'On Me' - https://song.link/GbXTRzPd7jkhFThe Team:Guedi Absiyeh - Lead AnimatorBea Battista - Background ArtistEduardo 'Fez' Escalante - Animation DirectorThane Katsillis - AnimatorChi Nguyen - AnimatorTanja Hass Nielsen - Background Art DirectorMiriam Salib - Background ArtistKate Vaughn - Thumbnail ArtistChristopher Zambrano - Storyboard Artist"
"VgS54fqKxf0","Right Up Our Alley","2021-03-08T05:34:16Z","UC7Y1wd4-c4H2Cl0lAuNvJ-Q","jaybyrdfilms","1","21.14.03","[none]","1559435","28943","185","1595","https://i.ytimg.com/vi/VgS54fqKxf0/default.jpg","False","False","Instagram: jaybyrdfilms"
"U4sWbTfrzj8","Starlink Mission","2021-03-11T09:27:42Z","UCtI0Hodo5o5dUb67FeUjDeA","SpaceX","28","21.14.03","SpaceX|Space|Musk|Satellite|NROl-108|Mission","856685","32479","443","2095","https://i.ytimg.com/vi/U4sWbTfrzj8/default.jpg","False","False","SpaceX is targeting Thursday, March 11 for launch of 60 Starlink satellites from Space Launch Complex 40 (SLC-40) at Cape Canaveral Space Force Station in Florida. The instantaneous window is at 3:13 a.m. EST or 8:13 UTC. The Falcon 9 first stage rocket booster supporting this mission previously supported launch of NASA astronauts Bob Behnken and Doug Hurley to the International Space Station, ANASIS-II, CRS-21, Transporter-1, and a Starlink mission. Following stage separation, SpaceX will land Falcon 9’s first stage on the “Just Read the Instructions” droneship, which will be located in the Atlantic Ocean. One half of Falcon 9’s fairing previously flew on the ANASIS-II and SXM-7 missions, and the other half previously supported launch of Sentinel-6A."
"7dmB1_g1GN0","BTS shares how they feel as first time Grammy nominees and performers (FULL) | Entertain This","2021-03-09T23:30:14Z","UCi3RHb1iJWQB4qOuWPVAQ_w","USA TODAY Entertainment","22","21.14.03","usa today|usa today entertainment|bts interview 2021|bts grammy interview|bts previews grammy performance|is bts releasing new music|what is bts working on|bts fatima farha|jin v jungkook joking|bts talks about the success of dynamite","1758828","237172","637","10485","https://i.ytimg.com/vi/7dmB1_g1GN0/default.jpg","False","False","Ahead of the 2021 Grammy's, BTS sits down with USA TODAY's Fatima Farha to reveal how they are feeling as first time nominees and performers, what BTS Army can look forward to during their performance, and what Dynamite means to them now. Watch the full interview here.» Subscribe to USA TODAY Entertainment: https://bit.ly/2STkDAa"
