video_id,title,publishedAt,channelId,channelTitle,categoryId,trending_date,tags,view_count,likes,dislikes,comment_count,thumbnail_link,comments_disabled,ratings_disabled,description
"cf1NAHT1Upo","Minecraft, But You Can Craft Custom Totems...","2021-05-08T16:45:00Z","UCss_0YiNRBiQzFLt2dosZIg","Silver","20","21.13.05","minecraft|mine craft|manhunt|speedrunner vs hunter|Speedrunner vs 3 hunters|Speedrunner vs 4 hunters|minecraft but challenge|minecraft challenge|beating minecraft|four hunters|4 hunters|dream|wisp|silver|minecraft manhunt|minecraft manhunt but|speedrun|speedrunner|manhunt minecraft|hacks|op items|villager|totem|totems|custom totem|ender dragon|random items|there are custom|you can craft custom totems|minecraft but you can craft custom totems","2023350","83534","1799","9611","https://i.ytimg.com/vi/cf1NAHT1Upo/default.jpg","False","False","Minecraft, But You Can Craft Custom Totems... (Challenge)Follow My Socials:• twitter: @SpeedSilverr• twitch: https://www.twitch.tv/speedsilver​​• discord: https://invite.gg/speedsilver​​​• tiktok: @SpeedSilverThis is a Custom Coded Minecraft Challenge (Minecraft 1.16) in which I try to beat the game, but I can craft custom totems! this idea was inspired by @Wisp's Minecraft, But There Are Custom Totems video, except I put my own twist on it. This is not a Minecraft Speedrunner VS Hunter, but a Minecraft, But Challenge!#Minecraft​​ #MinecraftBut​​ #MinecraftChallenge"
"xtRHKv8xQLY","Film Theory: Wall-E's Secret Cannibalism... More Juicy Proof!","2021-05-08T18:04:25Z","UC3sznuotAs2ohg_U__Jzj_Q","The Film Theorists","1","21.13.05","wall-e|wall e|pixar|disney|pixar theory|disney theory|wall-e cannibalism|wall e cannibalism|dark disney|dark disney theory|another brick in the wall-e|wall-e full movie|wall-e trailer|trailer|bnl|bnl wall-e|pixar bnl|bnl pixar|wall-e ending|wall-e movie|film theorists|film theory|matpat|film theory wall e|film theory wall-e|pixar wall-e|eve","2603919","147825","1944","13675","https://i.ytimg.com/vi/xtRHKv8xQLY/default.jpg","False","False","Get State of Survival FREE to enter giveaway ► https://app.adjust.com/dujpvp4_8dyfkup?adgroup=TFTThanks State of Survival for sponsoring.Giveaway subject to T&Cs: https://bit.ly/3usodSOWatch the rest of Cannibalism Weekend! The Disturbing Lore of M&Ms ► https://youtu.be/6ennbi0E-0QOnlyCans Meaty Secret ► https://youtu.be/N-I7ktbVVVgAbout 4 years ago, I released a theory saying that the movie Wall-E was about cannibalism. It was likely what solidified my place as King of Ruining Your Childhood forever. Theorists, today I am doubling down on that theory. The proof is in the pudding, or rather, it is in the cup. Where does the food come from and what is in it? Get ready for another heaping helping of people!Get yourself some Theory Wear! ► https://bit.ly/3bZzn9tDon't miss a Film Theory! ► http://bit.ly/1dI8VBH  #WallE #Pixar #PixarTheory #Disney #DisneyTheory #Cannibalism #Theory #FilmTheory #MatpatNeed Royalty Free Music for your Content? Try Epidemic Sound.Get Your 30 Day Free Trial Now ► http://share.epidemicsound.com/TheFilmTheoristsMORE FILM THEORIESRick's True CRIME! | Rick and Morty ►► https://bit.ly/2MVhP2WWill MORTY KILL RICK?! ►► https://bit.ly/2qKFFFVHow PICKLE RICK Functions! ►►► https://bit.ly/2JvU4fTBlair Witch's SECRET DANGER!  ► https://bit.ly/2qhmv7aAriel & Hercules Are RELATED?! ► https://bit.ly/32WnVWiCredits:Writers: Matthew Patrick and Justin KuiperEditors: Thomas Torbergsen, Koen Verhagen, Danial BanditRants Keristoufi, and Dan Cybert SeibertAssistant Editor: AlyssaBeCrazySound Editor: Yosi Berman"
"yoETsq1suDE","Why I’m Quitting Music","2021-05-07T18:39:41Z","UCv-GNHtqM97EaU_i7gN_Ikw","Chunkz","24","21.13.05","Chunkz Entertainment|comedy|family friendly|Funny Challenges Fun|music|chunkz quits music","1116411","106134","1313","11999","https://i.ytimg.com/vi/yoETsq1suDE/default.jpg","False","False","Why I’m Quitting Music... FOR ALLAH SWT! Subscribe: https://bit.ly/2PGvXfx | 🔔Make sure to enable ALL push notifications!🔔Watch the NEWEST videos: https://bit.ly/2PzaVSYFollow Chunkz :Instagram: https://instagram.com/chunkzTwitter: https://twitter.com/ChunkzSnapChat: https://snapchat.com/add/SpiceggWatch more Chunkz :1V1 RAP BATTLE: https://bit.ly/2RY6Ar1COOKING WITH CHUNKZ: https://bit.ly/2pWEXlc2V2 RAP BATTLE: https://bit.ly/2RYtyOHLatest Videos: https://bit.ly/2PzaVSYPopular Videos: https://bit.ly/2yGdppi"
"ra_zT102OfI","The Most Expensive Car I've Bought.. NEW CAR REVEAL!","2021-05-09T08:59:46Z","UCeMt42qV9-DY9KOQwtQ648g","Lee Lockwood","2","21.13.05","Lee Lockwood new car|New car|New car reveal|Lee Lockwood|Lee Lockwood reveal|Buying a new car|C63 amg|Buying a c63|Buying a used car|C63 buying guide|Lee Lockwood Mercedes|Lee Lockwood c63|Buying dream car|Dream car reveal|Buying my dream car|W204 c63|C63 reveal|Buying first Mercedes|Dream Mercedes|used car buying guide|buying my most expensive car|buying a c63 amg|buying amg","39734","1740","101","386","https://i.ytimg.com/vi/ra_zT102OfI/default.jpg","False","False","So here is the new car which has replaced two! Did you guess correctly? ;)Patreons will have already seen this car, so if you want extra content, all behind the scenes, monthly competitions and more! Head over to https://Patreon.com/itsleelockwoodPolice video;https://youtu.be/Df0msfbs6wISUPPORT THE CHANNEL IT HELPS ALOT :)  - SUBSCRIBE!  - Follow @itsleelockwood and @truerally  - https://www.truerally.co.uk​​​​​​​  - https://www.patreon.com/itsleelockwood​Let me know your thoughts guys!"
"ZzyiJsk0pRY","Elena Tsagrinou - El Diablo - First Rehearsal - Cyprus 🇨🇾 - Eurovision 2021","2021-05-09T09:16:59Z","UCRpjHHu8ivVWs73uxHlWwFA","Eurovision Song Contest","24","21.13.05","Eurovision Song Contest|2021|Open Up|Rotterdam|Cyprus|El Diablo|Elena Tsagrinou|First Rehearsal","727466","17525","1643","2677","https://i.ytimg.com/vi/ZzyiJsk0pRY/default.jpg","False","False","Elena Tsagrinou will represent Cyprus at the Eurovision Song Contest 2021 with the song El Diablo. This was her first rehearsal in Rotterdam Ahoy.-If you want to know more about the Eurovision Song Contest, visit https://eurovision.tvShop the official Eurovision Song Contest merchandise: https://shop.eurovision.tv/Follow us on Instagram: https://www.instagram.com/eurovision Follow us on Twitter: https://twitter.com/EurovisionFollow us on Facebook: https://www.facebook.com/EurovisionSongContest/"
"G0BfAs70yZI","Gordon FURIOUS Over Being Served Sample Scrambled Eggs | Hell's Kitchen","2021-05-08T16:00:07Z","UCt1fxPc6KaOeMxdhtUcEEEA","Hell's Kitchen","24","21.13.05","Hell’s kitchen|hells kitchen us|hells kitchen uk|gordon Ramsay|hells kitchen|Ramsay hells kitchen|hell's kitchen full episodes|hells kitchen full episodes|hells kitchen best moments|hells kitchen funny moments|Gordon Ramsay Hell’s Kitchen|Gordon Ramsay Hell’s Kitchen best moments|Gordon Ramsay Hell’s Kitchen funny|Hell’s Kitchen insults|where’s the lamb sauce|lamb sauce|hells kitchen official","860963","14943","279","1208","https://i.ytimg.com/vi/G0BfAs70yZI/default.jpg","False","False","As the teams cook breakfast for paramedics, one chef decides to serve the sample plate.#HellsKitchen #HellsKitchenUSA #GordonRamsayNEW!!  Get your official Hell’s Kitchen t-shirts and more at the **OFFICIAL HELLS KITCHEN STORE** ,  please click here to visit:http://amazon.com/hellskitchenYes Chef! - Official Hell's Kitchen t-shirthttps://amzn.to/2STvdoVWhere’s the Lamb Sauce!? - Official Hell's Kitchen t-shirthttps://amzn.to/2M88OBzGet Out! - Official Hell's Kitchen t-shirthttps://amzn.to/2SUqZNEYou Donkey! - Official Hell's Kitchen t-shirthttps://amzn.to/2SUlRZZOfficial Red Hell's Kitchen logo t-shirthttps://amzn.to/2SUm7bpIt’s Raw! - Official Hell's Kitchen t-shirthttps://amzn.to/2ElsX65Get a Grip! - Official Hell’s Kitchen PopSockethttps://amzn.to/2FyqtRHAre we missing your favourite quotes? Think you have a great idea for a shirt? Please emailhells.kitchen@itv.com with your suggestions, and you could see them in store!__________________________________________In Hell's Kitchen, two teams compete for the prestigious job of head chef at a top restaurant, all under the guidance of world-class fiery chef Gordon Ramsay."
"ErX0u9WRYaU","How many Bags of Popcorn can I Eat?  *super salty*","2021-05-09T05:23:50Z","UCd1fLoVFooPeWqCEYVUJZqg","Matt Stonie","24","21.13.05","Matt Stonie|Megatoad|Competitive Eating|Food Challenge|Speed Eating|Eating Challenge","1819925","107852","1098","7495","https://i.ytimg.com/vi/ErX0u9WRYaU/default.jpg","False","False","omg was this tough...50 Bags of Popcorn! I put alot of practice into the Popcorn Eating Championship, so I figured why not put my newfound Popcorn Eating abilities to use & make a YouTube challenge!Turned out to be way harder than I imagined...ENJOY!!!Plug Link :)TWITCH - https://www.twitch.tv/mattstonieNEW GAMING CHANNEL - https://www.youtube.com/channel/UCk8iW032970F4wGugjyRoHwPopcorn Championship Footage - https://youtu.be/JhY2TGLrxVY**Note**These 'Bags' are no comparison to the contest 'Cups'. The bags were much smaller & we didn't accurately measure them. As reference, it took 20 bags of Microwave Popcorn to fill the 50 bags.Follow me on Social!FACEBOOK - https://www.facebook.com/mattmegatoadstonieTWITTER - https://www.twitter.com/mattstonieINSTAGRAM - https://www.instagram.com/matt_stonieWEBSITE - http://www.mattstonie.comMERCH - http://www.mattstoniemerch.comMailing Address:P.O. Box 46908Las Vegas, NV 89102Credits:Music and Sound Effects from Video CoPilot's Proscores & Design Studio FXMusic from Epidemic SoundsHot Coffee by Ghostrifter Official https://soundcloud.com/ghostrifter-of...Creative Commons — Attribution-ShareAlike 3.0 Unported — CC BY-SA 3.0 http://creativecommons.org/licenses/b...Music promoted by Audio Library https://youtu.be/Y30VQPGtxOs"
"PUuk7Zfrmnw","You had a quicker car | Horner & Wolff react to Mercedes' overtake & Spanish GP win!","2021-05-09T15:39:02Z","UC3kxJQ9RfaS5CKeYbbFMi4Q","Sky Sports F1","17","21.13.05","F1|Formula 1|Formula One|Sky F1|Sky Sports|Sky Sports F1|motor racing|spanish grand prix|spain practice|f1 practice|f1 practice session|f1 crash|f1 spin|marshall f1|carlos sainz|mazepin|nikita mazepin|mazepin spin|bottas|f1 crashes|f1 spins|f1 funny|f1 today|f1 highlights|hamilton|hamilton 100th pole|hamilton 100 pole|spain gp|max verstappen|hamilton wins|toto wolff|christian horner|spanish grand prix 2021","260786","3164","43","1102","https://i.ytimg.com/vi/PUuk7Zfrmnw/default.jpg","False","False","SUBSCRIBE ► http://bit.ly/SubscribeSkyF1Red Bull Team Principal Christian Horner and Mercedes Team Principal Toto Wolff discussed Lewis Hamilton's fascinating win over Max Verstappen in Barcelona.Add the Sky Sports F1 TV channel to your Sky package by clicking here ► http://bit.ly/WatchSkyF1MORE FROM SKY SPORTS F1:►FACEBOOK: http://www.facebook.com/SkySportsF1►INSTAGRAM: http://www.instagram.com/SkySportsF1►TWITTER: https://www.twitter.com/SkySportsF1MORE FROM SKY SPORTS ON YOUTUBE:►SKY SPORTS FOOTBALL: http://bit.ly/SSFootballSub►SKY SPORTS BOXING: http://bit.ly/SSBoxingSub►SKY SPORTS CRICKET: http://bit.ly/SubscribeSkyCricket►SOCCER AM: http://bit.ly/SoccerAMSub►SKY SPORTS F1: http://bit.ly/SubscribeSkyF1►SKY SPORTS: http://bit.ly/SkySportsSub►SKY SPORTS GOLF: https://bit.ly/SubscribeSkySportsGolf"
"kdcLvF7yM2Y","Turning My Nails Into a Flute (Nail Hacks)","2021-05-08T15:30:21Z","UCGCVyTWogzQ4D170BLy2Arw","Simply Nailogical","24","21.13.05","nails|nail art|nail tutorial|beauty tutorial|nail art tutorial|diy nails|diy nail art|simply nailogical|cristine|troom troom|life hacks|nail hacks|hack|tips|tricks|college|university|testing|test|trying|trying hacks|dumb hacks|dumb nail hacks|straw|flute|5 minute crafts|internet hacks","1444625","70591","1032","3739","https://i.ytimg.com/vi/kdcLvF7yM2Y/default.jpg","False","False","Testing whether or not this life hack blows😇Got boring nails? Just add a Holo Taco 💿🌮 Sign up for email updates to be notified about restocks ➡️ http://holota.co/holothere1 ♡ Subscribe to never miss n̶e̶w̶ ̶n̶a̶i̶l̶ ̶a̶r̶t̶ ̶t̶u̶t̶o̶r̶i̶a̶l̶s̶! http://bit.ly/subsimply♡ Subscribe to Holo Taco (for nail videos lol): http://bit.ly/SubHoloTaco♡ Subscribe to the Podcast to hear me have adult conversations: http://bit.ly/SubSimplyPodLogicalTroom Troom's 11 Weird Nail Hacks in College: https://www.youtube.com/watch?v=96rN1ll-r0EOther Simply Testing Troom Troom videos:http://bit.ly/BubblesNailshttp://bit.ly/ChristmasPrankshttp://bit.ly/CouplePranks1http://bit.ly/ClickbaitThumbnailhttp://bit.ly/SchoolPranksOnTeacherhttp://bit.ly/PregnancyHack1http://bit.ly/BananaLifeHacks_ _ _ _ _ _ _ _ _ _ _ _ _ _ _ _ _ _ _ _ _ _ _ _ _ _ _ _ _ _ _ _ _ _♡PRODUCTS USED IN THIS VIDEO:♡♥ Pastel Rainbow holos: https://holota.co/simply-pastelrainbow7♥ Holo Taco - Menchie The Cat♥ Grade 8 knowledge of playing the recorderON MY OTHER HAND: An assortment of Holo Taco blues💙_ _ _ _ _ _ _ _ _ _ _ _ _ _ _ _ _ _ _ _ _ _ _ _ _ _ _ _ _ _ _ _ _ _Stalk me on all the social medias!http://instagram.com/simplynailogicalhttps://www.snapchat.com/add/simplynailogicahttps://twitter.com/nailogicalhttps://www.facebook.com/simplynailogicalhttps://www.tiktok.com/@simplynailogical_itsmehttp://www.simplynailogical.com (archival materials)My other YouTube channels:https://www.youtube.com/simplypodlogicalhttps://www.youtube.com/holotacohttps://www.youtube.com/simplynotlogicalhttps://www.youtube.com/simplypodlogicalhighlights_ _ _ _ _ _ _ _ _ _ _ _ _ _ _ _ _ _ _ _ _ _ _ _ _ _ _ _ _ _ _ _ _ _I film my nail videos with this camera: http://amzn.to/1MgznhtThis 105mm macro lens: http://amzn.to/1Pi8PM3I filmed my face in this video with this camera: https://amzn.to/327OB7bThis lens: https://amzn.to/38HnBgUVoiceover mic: https://amzn.to/3nrlIgHAudio recorder: https://amzn.to/3dbtg1wExternal mic: https://amzn.to/32AnO3gRing light for face-cams: http://amzn.to/2cU7cNOCheck out my personalized Amazon page with stuff I like! https://www.amazon.com/shop/simplynailogicalMusic: http://share.epidemicsound.com/SIMPLY_ _ _ _ _ _ _ _ _ _ _ _ _ _ _ _ _ _ _ _ _ _ _ _ _ _ _ _ _ _ _ _ _ _Disclaimer cause I love you guys: This video was not sponsored by any of the brands mentioned. All opinions are my own. Some links above are affiliate links."
"KdIlvta-yGA","VALKYRIE ... For Noobs","2021-05-08T15:00:07Z","UCs3uTN9G4MnZGOfYWoSs9mA","Macro","20","21.13.05","Apex legends|Valkyrie|Valkyrie for noobs|Valk for noobs|valkyrie guide|valk guide|how to valkyrie|valkyrie apex|valkyrie story|titanfall 2|beginners guide|new apex|new legend|season 9|legacy|arenas|bocek|abilities|ultimate|combo|pro tips|funny moments|multiplayer|apex|battle royale|tactical|viper|ash|jetpack|apex funny moments|how to play valkyrie|noob guide|noob|redeploy|passive|how to apex|viper skin|titanfall apex|apex story|new apex legends","1084772","53585","814","4661","https://i.ytimg.com/vi/KdIlvta-yGA/default.jpg","False","False","Thank you to EA for sponsoring this video! Apex Legends LEGACY is out NOW, check it out here: http://www.inflcr.co/SH71QValkyrie is the 17th legend in Apex, and her addition adds a lot to the game! The skies belong to her, so let's find out why in another episode of For Noobs!►TWITCH: https://www.twitch.tv/Macro►TWITTER: https://twitter.com/TheMacroShow►INSTA: https://instagram.com/TheMacroShow►MERCH: https://crowdmade.com/collections/macro►DISCORD: https://discord.gg/macro►MY 2ND CHANNEL: https://www.youtube.com/channel/UCSzBfLmM-DswAOKzOv8eqbAThumbnail art by Halmey: https://twitter.com/tishalmeyThe Intro song is I Think I'm Normal by Carter AceCheck him out here: https://awal.lnk.to/nWCQvThe Outro song is Bone Theme by Michael Wyckoff, check him out here: https://www.youtube.com/watch?v=snAWszNWhAc#Valkyrie #ApexLegendsPartner #Legacy"
"eCw5wd3yKHc","FAKE TIRE POP PRANK 😂 #shorts","2021-05-08T14:00:28Z","UCPuEAY09CtdTzFNWuqVZgDw","Topper Guild","23","21.13.05","Topperguild|tiktok|pranks|family|girlfriend|dad|funny|family friendly|prank|relationships|couples|shorts|car|tire","13987249","387510","30392","2042","https://i.ytimg.com/vi/eCw5wd3yKHc/default.jpg","False","False","🔥 FOLLOW ME 🔥Instagram: https://www.instagram.com/topperguild/?hl=enTikTok: https://www.tiktok.com/@topperguild?lang=en"
"DJazh4v53Ms","FREDO - INDEPENDENCE DAY FREESTYLE","2021-05-06T18:04:51Z","UChCu7JmWByOod4xdH7IVJ_g","FREDOPG","10","21.13.05","UK rap|UK hip hop|British rap|fredo|fredo dave|All i Ever Wanted|fredopg|fredo youtube|santandave|rappin n trappin|Fredo money can’t buy happiness|Fredo Funky Friday|fredo rap|fredo daily duppy|fredo new music|fredo grm|fredo video|fredo music|fredo track|fredo music video|fredo pattern gang|fredo official|Fredo netflix and chill|Money cant buy happiness|Fredo back to basics|Fredo dave money talks|fredo freestyle|fredo independence day|freddo","1908266","58592","700","2464","https://i.ytimg.com/vi/DJazh4v53Ms/default.jpg","False","False","'Independence Day' is coming soonFollow Fredo:https://www.instagram.com/fredo/​https://twitter.com/fredo​https://www.facebook.com/FredoPG/"
"TuzEWSXlo9g","Anticipation mounts as Chinese rocket debris is expected to hit Earth this weekend","2021-05-08T22:46:51Z","UCAeWdyKJXGWmVAXFpgLNNTg","CBS Evening News","25","21.13.05","made in china|coronavirus|space|junk|debris|terror|nuisance|chinese|rocket|fall|land|earth|china|NASA|atmosphere|news|CBS Weekend News|CBS|video|CBS News","795632","5572","858","3360","https://i.ytimg.com/vi/TuzEWSXlo9g/default.jpg","False","False","The world is anxiously awaiting the landing of debris from China's Long March Rocket, which is expected to hit Earth this weekend. Ramy Innocencio reports. CBS Evening News with Norah O'Donnell delivers the latest news and original reporting, and goes beyond the headlines with context and depth. Catch the CBS Evening News every weekday night at 6:30 p.m. ET on the CBS Television Network and at 10 p.m. ET on CBSN.Subscribe to the “CBS Evening News YouTube channel: http://bit.ly/1S7DhikWatch full episodes of CBS Evening News”: http://cbsn.ws/23XekKAFollow CBS Evening News on Instagram: http://bit.ly/1T8icTOLike CBS Evening News on Facebook: http://on.fb.me/1KxYobbFollow CBS Evening News on Twitter: http://bit.ly/1O3dTTeDownload the CBS News app: http://cbsn.ws/1Xb1WC8Try Paramount+ free: https://bit.ly/2OiW1kZFor video licensing inquiries, contact: licensing@veritone.com"
"HJ0Jw3oY9Z8","Dortmund vs Leipzig (3-2) | Sancho Stars In Crucial BVB Win | Bundesliga Highlights","2021-05-08T17:10:51Z","UC4i_9WvfPRTuRWEaWyfKuFw","BT Sport","17","21.13.05","[none]","419381","6775","72","382","https://i.ytimg.com/vi/HJ0Jw3oY9Z8/default.jpg","False","False","Dortmund's 3-2 win over Leipzig lifted them to fourth in the Bundesliga and kept alive their chances of qualifying for the Champions League. Jadon Sancho starred scoring a brace, including the decisive goal. Hit 'Subscribe' above to ensure you never miss a video from the BT Sport YouTube channel.Get a BT Sport Monthly Pass now! - http://bit.ly/BTSportMonthlyPass​​​ Visit and subscribe to our 'BT Sport Boxing' YouTube channel ➡️ http://www.youtube.com/c/btsportboxing​​​Twitter: http://twitter.com/btsport​​​Facebook: http://www.facebook.com/btsport​​​Instagram:http://instagram.com/btsport​​​Website: http://sport.bt.com"
"eV5Qckkjs-s","Bayern vs Gladbach (6-0) | Lewy Hat-Trick As Bayern Crowned Champions | Bundesliga Highlights","2021-05-08T20:04:14Z","UC4i_9WvfPRTuRWEaWyfKuFw","BT Sport","17","21.13.05","bt sport|bt sport official","418765","6969","86","809","https://i.ytimg.com/vi/eV5Qckkjs-s/default.jpg","False","False","Lewandowski was in typical form as Bayern celebrated winning a ninth-straight league title in style, with a 6-0 demolition job of Gladbach.Hit 'Subscribe' above to ensure you never miss a video from the BT Sport YouTube channel.Get a BT Sport Monthly Pass now! - http://bit.ly/BTSportMonthlyPass Visit and subscribe to our 'BT Sport Boxing' YouTube channel ➡️ http://www.youtube.com/c/btsportboxingTwitter: http://twitter.com/btsportFacebook: http://www.facebook.com/btsportInstagram:http://instagram.com/btsportWebsite: http://sport.bt.com"
"JLPgrgKc1SE","I adopted a cat.","2021-05-07T16:45:03Z","UC2mP7il3YV7TxM_3m6U0bwA","jschlattLIVE","24","21.13.05","jschlatt|jschlattlive|jschlatt livestream|schlatt|livestream|twitch|jschlatt twitch|jschlatt livestream highlights","3469860","478581","2380","23964","https://i.ytimg.com/vi/JLPgrgKc1SE/default.jpg","False","False","Schlatt adopts a cat.Follow me on Twitter:https://twitter.com/jschlatthttps://twitter.com/schlattFollow me on Instagram:https://instagram.com/jschlattAWW! Schlatt talks about how he adopted Jambo, a 6-month old orange tabby. Jambo, or, as jschlatt's twitch chat calls him, Soup, or, Jcat, or, Andrew Yang's Chicken Soup Surprise, is the newest addition to the Jschlatt Family. Jambo has already been getting tons of love on Twitter, where Schlatt's Twitter Alt (still Twitter Unverified) posts frequent photos of the Cute Lovable Kitten for hundreds of thousands of likes. I enjoy seeing all of the angry Quote Retweets on pictures of Jambo, and laugh at your lack of a father figure. I have a cute cat and you don't!No, this is not a Minecraft Manhunt vs 5 Hunters video (even though I would love to take a break from my 24/7 Dream SMP Minecraft 1.17 stream). TommyInnit doesn't make this video 1000x Funnier. Wilbur doesn't show his cute face and Minx isn't even here to flirt with me. It's just me talking about my awesome Garfield cat who I love more than any of my fans..... just kidding! I genuinely love and care about you guys, and that's the best way that I can describe it. You are like a whole bunch of kittens and I LOVE YOU. Not every creator will feel the same as me, and that's fine, but I'm being genuine every time I say it. My Youtooz plushies drop later this month so you better buy one before they sell out. Maybe even resell them at a 100x markup."
"O4XGsIDesEI","Bugworkout moment","2021-05-03T23:01:18Z","UCMz6Fjq_SZJWrd103GjtcWw","Bugworkout Sport in Russia","22","21.13.05","[none]","51205269","1148364","88156","8518","https://i.ytimg.com/vi/O4XGsIDesEI/default.jpg","False","False","Funny moment #bugworkout #shorts #humor"
"2BQ7dsRsVUA","Revealing my BIG SECRET PROJECT!","2021-05-07T19:49:15Z","UCFYs3KYHDPoZfwGv0A4sYGQ","Life of Tom","22","21.13.05","life of tom|lifeoftom|tom syndicate|syndicate|syndicate vlog|vlogger|daily vlog|uk vlogger|tom cassell|adventure|travel|exploration|life of tom 2.0|syndicate house|new house|new project|life of tom house|life of tom land|Home renovation|Home upgrade|House Flip","345046","20884","199","2172","https://i.ytimg.com/vi/2BQ7dsRsVUA/default.jpg","False","False","11 Years ago I embarked on this YouTube journey.. I never thought it would get me to where I am! Yet today we're starting a WHOLE NEW CHAPTER that I cannot wait to embark on you all with :) ● If you're NEW here.. Click SUBSCRIBE to see more of my Videos (IT'S FREE) 😀If you're excited to see this adventure unfold, SMACK THE LIKE BUTTON!👍Grab yourself a Syndicate Shirt! ► http://www.syndicateoriginal.com/‎‎Send me something! ‎Tom Syndicate PO Box 418 ‎HYDE SK14 9DN‎My Socials‎● My Twitter ► ⁦‪https://twitter.com/Syndicate‎● My Instagram ► http://instagram.com/syndicate‎● My Facebook ► ⁦‪https://www.facebook.com/LifeOfTom‎● My Snapchat ► ItsSyndicate‎● My Gaming Channel ► https://www.youtube.com/Syndicate‎‎Want to upgrade your gaming equipment?‎Check out Razer ► ⁦‪http://rzr.to/lifeoftom‎‎Syndicate Original Clothing‎● Shop: ⁦‪http://www.syndicateoriginal.com‎● Twitter: https://twitter.com/SyndicateOG‎● Facebook: ⁦‪ ⁦‪https://www.facebook.com/SyndicateOG‎Thank you so much for watching, I hope you enjoyed the video!"
"9V7VvQk6k0U","Eddie Hearn gives update on Billy Joe Saunders' BRUTAL EYE INJURY that stopped fight with Canelo","2021-05-09T05:58:31Z","UCEVVENPnHv-kcp2PqQuJvHg","SecondsOut","17","21.13.05","boxing|secondsout|seconds out|combat|sport|sports|Combat Sport (Sport)|boxe|boxeo|boxer|knockouts|Canelo Álvarez vs. Billy Joe Saunders|Saunders v Canelo|Billy Joe Saunders|Canelo Alvarez|Eddie Hearn|DAZN|Matchroom boxing|sky sports boxing|canelo v saunders|canelo vs saunders post fight|canelo alvarez vs billy joe saunders|canelo alvarez vs billy joe saunders fight|canelo vs saunders weigh in|billy joe saunders vs canelo alvarez fight|boxing news","198979","2012","74","692","https://i.ytimg.com/vi/9V7VvQk6k0U/default.jpg","False","False","In this video Eddie Hearn talks about Billy Joe Saunders' broken orbital bone that ended the title unification fight against Canelo Alvarez. #eddiehearn #canelosaunders #boxingSubscribe for updates - http://goo.gl/meA2GBFollow on Twitter: http://goo.gl/VDYVMPLike on Facebook: https://www.facebook.com/secondsoutliveSecondsOut is a world leader in boxing entertainment since 1999.Part of the Knockout TV YouTube MCN - http://goo.gl/t77GMc"
"CcM7qB5gfOM","I Survived On $0.01 For 1 Week - Day 3","2021-05-07T17:02:03Z","UCnmGIkw-KdI0W5siakKPKog","Ryan Trahan","24","21.13.05","Ryan|Trahan","5549794","144914","4026","12313","https://i.ytimg.com/vi/CcM7qB5gfOM/default.jpg","False","False","7 days. 1 penny. day 3. 0 fricks left to give.learn more about CTFB ► https://www.centraltexasfoodbank.org/support Front Steps ► https://frontsteps.org/gaming channel ► https://www.youtube.com/watch?v=L_RSgboBN4o&t=175s"
