video_id,title,publishedAt,channelId,channelTitle,categoryId,trending_date,tags,view_count,likes,dislikes,comment_count,thumbnail_link,comments_disabled,ratings_disabled,description
"eH6nSLAGpT4","【DQ6】ついにスラリンの限界判明！成功率1/4096以下の唯一の手段で装備・転職なし素のスラリンが限界挑戦！中編/Slime will break the limit of system!","2021-04-10T10:05:28Z","UCv3DBWI1aZVYiq-WcARA83g","マイティーやり込みゲーム動画","20","21.14.04","マイティー|UCv3DBWI1aZVYiq-WcARA83g|ドラクエ|ドラクエ6|Dragon quest|DQⅥ|Dragon Warrior|DQ|スライム|はぐれメタル|SFC|スーパーファミコン|ゲーム|ゲーム攻略|ダークドレアム|バーバラ|アリーナ|ドラゴンクエストXI|ビアンカ|ドラクエウォーク","474568","7834","172","1461","https://i.ytimg.com/vi/eH6nSLAGpT4/default.jpg","False","False","＜チャンネル登録宜しくお願い致します♪＞👉 http://www.youtube.com/channel/UCv3DBWI1aZVYiq-WcARA83g?sub_confirmation=1＜Twitterで毎日「やり込み動画の制作過程」を投稿中♪＞👉 https://twitter.com/4hkODvuru2Kctz2＜おすすめ動画＞【ドラクエ】【ドラクエ6】エッチな下着で戦闘が180度変わる！誰も知らないエッチな下着のひみつをバーバラ・ミレーユで公開！Do you know how to handle Sexy Lingerie? 👉 https://youtu.be/vpOqRQDyeuI【DQ6】ついに判明！452時間かけてDQ5・6の一回の戦闘の最大経験値を徹底調査！spending 452 hours to investigate maximum experience point 👉 https://youtu.be/MLj2H9kXiNs【DQ5】171時間かけて少年時代にあり得ないくらい子供を鍛え上げゲマ討伐に挑戦！前編/trying to defeat Ladja in protagonist's boyhood! 👉 https://youtu.be/_vsuxr6HYEo【DQ5】少年期に298時間かけてMP999！23000回の戦闘を経験した最強の子供を爆誕させゲマ討伐に挑戦！中編/taking 298 hours to raise MP up to 999! 👉 https://youtu.be/05BqiaPNEQc【DQ5】あなたは少年期に装備無し・1人でゲマを討伐できますか？974時間かけた史上最強の狂った企画！完結編/defeating Ladja without equipments and alone! 👉 https://youtu.be/-Df6Kvtk08Q【DQ6】スラリンの限界突破に挑戦！装備なし・無職のスライム1匹で物語をどこまで行けるか限界挑戦！前編/Slime will challenge DQ6 alone with nothing! 👉 https://youtu.be/Xcl4m6TJlGM【DQ6】ついにスラリンの限界判明！成功率1/4096以下の唯一の手段で装備・転職一切なしスラリンが限界挑戦！中編/Slime will break the limit of system! 👉 https://youtu.be/eH6nSLAGpT4【DQ3】極限まで鍛え抜いた武闘家でしんりゅう最短撃破の限界に挑む！前編/Have you seen trained martial artist this much? 👉 https://youtu.be/6B1j-WETr0g【DQ3】驚異的な会心率を持つ全ステータスMAX最強武闘家でしんりゅう最短撃破に挑め！後編/break the limit of critical hit to defeat Divinegon! 👉 https://youtu.be/qxueB6IVjuE【DQ2】仲間も装備もいらない！裸のムーンブルク王女1人で全クリする狂った企画！前編/Princess Moonburg saves the world alone with nothing! 👉 https://youtu.be/rwlCLNiwB6g【DQ2】装備なしLv20台のムーンブルク王女1人でラスボス・ハーゴンとシドーは撃破可能か挑戦！/Can Princess Moonburg defeat Hargon, Malroth alone? 👉 https://youtu.be/ZB5hqpPs4JA【DQ6】あなたはミレーユ1人でムドーを倒せますか？150時間以上かけて何レベルで1人撃破できるか徹底検証！Can you defeat Murdaw with only Mireille? 👉 https://youtu.be/g5-4LkIjVyc【ドラクエ6】テリーが弱いと思ってないですか？隠しステータス「回避率」で彼にしかできない戦法を編み出す！Do you know secret ability Evasion in DQⅥ? 👉 https://youtu.be/Lzf7p8uL2g8【ドラクエ6】あなたは一回の戦闘でレベル99にできますか？ドラクエ史上最大の経験値に挑んだ240時間！/DQⅥ/Can we raise the level 1 to 99 at a battle? 👉 https://youtu.be/EJRKkY2errI【DQ5】観たいですか？限界まで育成したサンチョ1人でDQ5を制圧する瞬間！前編/Do you want to see Sancho conquering world of DQ5? 👉 https://youtu.be/C2FrkPf2e0E【DQ5】DQ5制圧へ！全ステータスMAX最強サンチョ1人でミルドラースをぶっ飛ばす！後編/Conquering DQⅤ!Sancho will defeat Nimzo alone! 👉 https://youtu.be/7UR24uKRD9o【ドラクエ4】一発でカジノコイン999999にする狂った方法!57時間かけてカジノで一発最大獲得コイン数をやり込み検証！Can you win bet of 100x odds in casino? 👉 https://youtu.be/12JEQFChAuc【ファイナルファンタジー】【FF7】「やり込み過ぎ！」限界まで鍛えたヴィンセント1人で「エメラルドウェポン」を一撃、「ルビーウェポン」も....！/defeating Emerald Weapon with a blow! 👉 https://youtu.be/__yOJGnJ4qM【概要】前回、装備・転職一切なしの素のスライムでDQ6物語をどこまで進められるのかの検証がスタート！しかし前編で早くもLv99、しゃくねつも必要と想像を絶する厳しさ！もう既にスラリンは成長の限界に達する....そして中編この先進むにはスラリンがシステムの限界を突破するしかない！【English explanation】In previous video, the project about how much slime without equipments and vocation can completeDQ6 has started!But it was so hard that we have to raise slime up to Lv99 in the beginning of story.In this video, slime have to break out of slime's shell to break through the limit of system!【ジャンル関連動画】【FF9】入手困難！エクスカリバーIIを入手して真に最強のスタイナーを目指す（完結編）～　Final Fantasy IX 20th Anniversaryhttps://www.youtube.com/watch?v=rsk5UuTzOC4【ドラクエ７】最強すぎるNPC戦闘員ランキングTOP6https://www.youtube.com/watch?v=dfgreyNZQHw&ab_channel=%E3%82%8D%E3%81%B3%E3%82%93%2F%E3%83%89%E3%83%A9%E3%82%AF%E3%82%A8%E3%83%A9%E3%83%B3%E3%82%AD%E3%83%B3%E3%82%B0[ドラクエ3]驚き！商人で桁違いに穴掘りをした結果・・・https://www.youtube.com/watch?v=i1LlgK4XbN4【衝撃】【ドラクエランキング】裏のラスボス達　７選【びびっち】https://www.youtube.com/watch?v=rEqIbolBFQQ&ab_channel=%E3%83%93%E3%83%93%E3%81%A3%E3%81%A1%E3%83%81%E3%83%A3%E3%83%B3%E3%83%8D%E3%83%ABー・ー・ー・ー・ー・ー・ー・ー・ー・ー・ー■ファンレター・プレゼントの宛先はこちら〒150-0031東京都渋谷区桜丘町20-1渋谷インフォスタワー17階株式会社Kiii cube マイティーやり込みゲーム動画宛※冷蔵・冷凍が必要な、なま物の受付はできません。■お仕事のご依頼等cube@kiii.co.jp■Kiii HPhttps://kiii.co.jp/cube/■Kiii YouTubeチャンネルhttps://www.youtube.com/c/KiiiJAPANー・ー・ー・ー・ー・ー・ー・ー・ー・ー・ー"
"vfVFKSOgAzs","NiziU 「Poppin’ Shakin’ 」 featuring guide Video","2021-04-10T02:00:50Z","UCHp2q2i85qt_9nn2H7AvGOw","NiziU Official","24","21.14.04","JYP Entertainment|JYP|Make you happy|Step and a step|Sony|JYP nation|MV|M/V Teaser|niziu debutsingle|니쥬|needyou|niziproject|nizipro|니지프로젝트|ニジュー|마야|마코|리마|리오|미이히|마유카|아야카|니나|리쿠|maya|mako|rima|miihi|mayuka|rio|ayaka|nina|riku|虹プロ|ニジプロ|アイドル|オーディション番組|マヤ|マコ|リマ|リオ|ミイヒ|マユカ|アヤか|ニナ|リク|JYPさん|niziu step and a step music video|스텝앤어스텝|니쥬 스텝앤어스텝|니쥬데뷔|데뷔싱글 NiziU music video|girl group|k-pop|j-pop|NiziU|Takeapicture|PoppinShakin","1310836","32680","700","2302","https://i.ytimg.com/vi/vfVFKSOgAzs/default.jpg","False","False","NiziU 2nd Single『Take a picture／Poppin’ Shakin’』2021.4.7 Release『Take a picture／Poppin’ Shakin’』 Digital Release https://niziu.lnk.to/ZfXGc1​MelOn https://bit.ly/31QgXmT​FLO https://bit.ly/3wFFOrZ​Genie https://bit.ly/3dIYyOB​Bugs https://bit.ly/3sPVINX​NiziU Official Homepage: https://niziu.com/​NiziU Official YouTube: https://www.youtube.com/c/NiziUOfficial​NiziU Official Facebook: https://www.facebook.com/NiziUinfooff...​NiziU Official Twitter: https://twitter.com/NiziU__official​NiziU Official Instagram: https://www.instagram.com/niziu_info_...​NiziU Official Artist Instagram: https://www.instagram.com/niziu_artis...​NiziU Official TikTok: https://www.tiktok.com/@niziu_official​NiziU Official FANCLUB “WithU”: https://fc.niziu.com​NiziU Official FANCLUB “WithU MOBILE”: https://m.niziu.com​#NiziU​ #ニジュー​ #니쥬​ #WithU​#Poppin_Shakin​#Take_a_picture​Copyrights ©2021 JYP Entertainment Japan./ Sony Music Entertainment (Japan) Inc. All rights reserved."
"yCaAL175A_8","体力が無限に増え続けるマインクラフト","2021-04-10T03:30:28Z","UC9Lx-zRFGfpuls27tNAOIqA","マエスケちゃんねる","20","21.14.04","マインクラフト|マインクラフト実況|ゲーム実況|マエスケ|マエスケ実況|マイクラ|マイクラ実況|ゲーム|game|マエスケマインクラフト|マインクラフトマエスケ","672523","13265","675","390","https://i.ytimg.com/vi/yCaAL175A_8/default.jpg","False","False","高評価と登録してくれたら幸せになるよ。まじで。クリサポ(Maesukeeeeeeee)してね♡登録してくださいお願いします : https://goo.gl/ffUf7Uトゥイッター : https://twitter.com/maesuke118インスタ : https://www.instagram.com/maesuke118/businessmail : maesuke0118@gmail.comサブちゃんねるあるあるよ : https://goo.gl/udEPH6#マイクラ"
"laLT2XNYAOU","男女でお花見ドライブしてんけどハプニング続出で大丈夫そ！？www","2021-04-10T10:00:28Z","UCwN4CR-bDM9ZjvPhb44AfxQ","パパラピーズ","24","21.14.04","パパラピーズ|ぱぱらぴーず|タナカガ|じんじん|デブ|ブス|男女","488425","11532","313","548","https://i.ytimg.com/vi/laLT2XNYAOU/default.jpg","False","False","パパラピーズです！《19時〜週4投稿》チャンネル登録よろしくお願いします( ＾∀＾)タナカガブランドGAB GAB  https://gabgab.jp/じんじんブランド　JINCL  https://jincl.jp/グッズはこちらからhttps://bit.ly/3rApiWzサブチャンネル↓↓【パパラピーズの秘密基地】https://www.youtube.com/channel/UCl0T3l0OJFm6bNEdYAGnFqA?view_as=subscriber~じんじん~【Twitter】https://twitter.com/jinjinpocha【Instagram】https://www.instagram.com/jinjiiiindao~タナカガ~【Twitter】https://twitter.com/Tanakaga_【Instagram】https://www.instagram.com/tanakaga.12~パパラピーズ~【Twitter】https://twitter.com/paparapysファンレターやプレゼント等は下記宛にお願いいたします〒106-6131東京都港区六本木6-10-1六本木ヒルズ森タワー31FGROVE株式会社　 パパラピーズ宛お仕事依頼は、こちらからmatsuzaki@grove.tokyo"
"4WXXL_JJqpE","[BANGTAN BOMB] Choreographers BTS - BTS (방탄소년단)","2021-04-10T10:00:02Z","UCLkAepWjdylmXSltofFvsYQ","BANGTANTV","10","21.14.04","방탄소년단|BTS|BANGTAN|HIPHOP|알엠|RM|슈가|SUGA|제이홉|jhope|지민|JIMIN|정국|JUNGKOOK|JIN","4471415","822137","3203","40787","https://i.ytimg.com/vi/4WXXL_JJqpE/default.jpg","False","False","Connect with BTS: https://ibighit.com/bts http://twitter.com/BTS_bighithttp://twitter.com/BTS_twt http://www.facebook.com/bangtan.official https://www.youtube.com/user/BANGTANTV http://instagram.com/BTS.bighitofficial https://channels.vlive.tv/FE619 https://www.tiktok.com/@bts_official_bighithttps://weverse.onelink.me/qt3S/94808190https://www.weibo.com/BTSbighithttps://www.weibo.com/BTSmembers http://i.youku.com/btsofficial http://btsblog.ibighit.com"
"afYFFFNt7so","超有名実況者から「手」を集めた結果…","2021-04-11T07:47:12Z","UCNIjpXLKS2PrAzBspZ3ppyw","かあいいちゃん!!","20","21.14.04","[none]","237770","9460","53","779","https://i.ytimg.com/vi/afYFFFNt7so/default.jpg","False","False","一部YouTubeが見当たらない方はTwitter、ゲーム実況というカテゴリでさせていただいておりますので本アカウントではないゲーム実況の方を記載させていただいております。ご了承ください。〇ぷりっつhttps://www.youtube.com/channel/UC_LS7mBxC0zL9Ot0gaU26Lw〇キャプテンしょーたhttps://www.youtube.com/channel/UCk5ItNvRXZ6BKRaosdQtlXw〇ねこくんhttps://www.youtube.com/channel/UCLFiFaxDZc3FmdU8fAJNKYw〇わきをさんhttps://twitter.com/sg__soccer〇まぜ太https://www.youtube.com/channel/UCnXvbSMrmWH9Izx_7fKA7fg〇ネバティーさんhttps://www.youtube.com/channel/UCHO-6X7bvqyDYo0Inynmtvw〇怜さんhttps://www.youtube.com/channel/UCG5yNUVrSCmpzEzpXZrQEAA〇シンクさんhttps://www.youtube.com/channel/UCxghAnYqBmcDCMILs3LqVmg〇リテイルローのおじさんhttps://twitter.com/riteiruozisan?ref_src=twsrc%5Egoogle%7Ctwcamp%5Eserp%7Ctwgr%5Eauthor〇りあんhttps://www.youtube.com/channel/UCdVnOfmhI0sNGdaH5yldztg〇だるまさんhttps://www.youtube.com/channel/UCRRKdB87Oj-FkqS4L9QQRiQ〇あっきぃhttps://www.youtube.com/channel/UCtBWXrQqfd5EaVbhezbxopg〇まろさんhttps://www.youtube.com/channel/UCPZkdkj_rUi_3YQ3rFTbXlw〇おれんじくんhttps://www.youtube.com/channel/UCTeVjS8J3N1qsxFoetjaM4Q〇るりさんhttps://www.youtube.com/channel/UCA0DY-BEMXg8wfOs3J_aXKQ〇東雲はるさんhttps://www.youtube.com/channel/UCrOV-crqUmRluPVOjjVs-Xw〇ぬめもんさんhttps://www.youtube.com/channel/UC6qfuRHQBM77yz_BcTb5F7Q〇べるくんhttps://www.youtube.com/channel/UCIDs6SS8xleLe9E5yseH1Lg〇ぼぶくんhttps://www.youtube.com/channel/UC-fHhpWFkvl2sDEc09kEHtQ〇ゼラールさんhttps://www.youtube.com/channel/UCSANy7iWxNBvRAE0ScXHV-Q〇れじぇくんhttps://www.youtube.com/channel/UCILZFnKZJksR7zwhZbAB4vw〇うゆりるさんhttps://www.youtube.com/channel/UC6bZVIFYFdlfrzPJ9-r5zaw〇なえじさんhttps://www.youtube.com/channel/UC4gdjRllGCVpr80lF4i37pg〇リズ君https://www.youtube.com/channel/UCWcS5FzBnhiKm27NJNCB9Qw〇まうふぃんさんhttps://www.youtube.com/channel/UC_INF4xQABOfv116mpQz2YQ〇ネフライトさんhttps://www.youtube.com/channel/UCFkncXKwLRtA2MFdXOv34yQ〇メイシーさんhttps://www.youtube.com/channel/UCiFqXmTwHyqd6Of_H0YOh1w〇はむっぴさんhttps://www.youtube.com/channel/UCh_YKX-TMMwdQrBxfZr2A0w〇れたすさんhttps://www.youtube.com/channel/UCxtX4Y31zFIW4FCL-3yLB4w〇きりたんぽさんhttps://www.youtube.com/channel/UCi-VeNo-6P6CKZtlIwbv3pQ〇たかぎさんhttps://www.youtube.com/channel/UCQRUxjjRM011vsnlOHHtsHw〇はなちゃんhttps://www.youtube.com/channel/UCwaMnSFOH3g46OOosktIU_w〇なーなてぃんhttps://www.youtube.com/channel/UCaSnTIeHLgSlq9kjDVrql_Q＿＿＿＿＿＿＿＿＿＿＿＿＿＿＿＿＿＿＿＿＿＿＿＿＿＿＿＿＿＿＿＿チャンネル登録すると今日の晩ごはんはハンバーグになります○Twitterhttps://twitter.com/kawaii__chann○BGM・効果音https://dova-s.jp/http://www.hmix.net/music_gallery/image/horror.htm"
"BrvXorUVouk","【第3話】日本の半分使って壮大な鬼ごっこしてみた～真夜中の攻防戦〜","2021-04-10T11:00:16Z","UCYTximhpSat0HHFPAI0UpUA","西園寺","2","21.14.04","[none]","373108","7470","216","1301","https://i.ytimg.com/vi/BrvXorUVouk/default.jpg","False","False","#対決 #鬼ごっこ #乗り物【第1話】はこちら→ https://youtu.be/Dz1TAg5iSrw【第2話】はこちら→ https://youtu.be/s-BBMxs6YhU【ルール説明】1.鉄オタ(逃走者)と非鉄オタ(鬼)に別れて対決2.逃走範囲は西日本・九州・四国全域3.制限時間は午前8時から翌日午後8時までの36時間4.すべての公共交通機関を用いることが出来る5.両者共に乗り物には必ず2人で乗らなければならない6.30分に1回、お互いの位置情報を確認することが出来る7.逃走者の新幹線利用について、連続利用は1時間まで。　利用後30分はその駅に留まる必要がある8.不定期でゲームマスターからミッションが発令される。　逃走者はクリアすることで有利に進められるが、確保されるリスクも高まる企画・出演/西園寺・たなか編集/ほいさっさ(https://www.youtube.com/channel/UCRRmcsQ8_zt0Ye_25-Rn2Gw)サムネイル/おっくん(https://www.instagram.com/nao__photogra/)サムネイル編集/たなか旅行チャンネルはこちら→ https://www.youtube.com/channel/UCkV8IOmz7pyh39QbkrADPlAたなかチャンネルはこちら→ https://youtube.com/channel/UC7uZCLDOf-IM3bEmMEzyhaA【BGM】「ONE WAY」作曲・Tck.さん  Twitter→ https://mobile.twitter.com/tck_lomucaYouTube→ https://www.youtube.com/channel/UCHYOwwZ2RZLV_SsCE--AlQg【人気企画・非鉄シリーズ】➡https://www.youtube.com/playlist?list=PLiA91HZIXkxloerV2MKS86phnwU0d3DLoーーーーーーーーーーーーーーーーーーーーーーーー【チャンネル紹介】関西の鉄道を中心に全国の鉄道路線やその他公共交通機関に関連した動画を投稿しています。また不定期で「対決企画」や「〜してみた」等の公共交通機関を取り入れた企画動画も製作しており大変好評を頂いております。【自己紹介】関西在住の大学2年生、19歳。「西園寺」はお金持ちに見えるであろうという安易な気持ちで付けた仮名です。2019年の夏に「最長片道切符」を用いた日本一周旅行を完遂。その半年後に2度目の日本一周旅行を敢行し、YouTubeに動画を出すようになりました。日本という国の凄さ、美しさを「公共交通機関」「風景」等の観点から伝えられたら良いなと思います。ーーーーーーーーーーーーーーーーーーーーーーーー【最長片道切符の旅】➡️ https://www.youtube.com/playlist?list=PLiA91HZIXkxlXAkwZyJjKjEAdYoCv930L【グリーン車乗車シリーズ】➡https://www.youtube.com/playlist?list=PLiA91HZIXkxkf3fmOLePJZOVqK_nueWa3【東京・金沢旅行記】➡https://www.youtube.com/playlist?list=PLiA91HZIXkxkKJp_kpTSDyfWquI-575bM【Twitter】https://twitter.com/SAIONJI_com【音楽】魔王魂たなかのTwitter → https://mobile.twitter.com/SAIONJIofficial"
"T-8spCRyuFw","【WEB限定】向井D企画 “映画観終わったインタビュー風 PR”『それSnow Manにやらせて下さい』【TBS】","2021-04-10T07:00:12Z","UCxpIo6FFB7gMQz2Fy2X8XdQ","TBS公式 YouTuboo","24","21.14.04","TBS","464255","32699","156","0","https://i.ytimg.com/vi/T-8spCRyuFw/default.jpg","True","False","☆番組公式HP　https://www.tbs.co.jp/sore_snowman/☆番組公式Twitter　https://twitter.com/sore_snowman​[放送日時]4月11日スタート 毎週日曜午後1:00~1:30[出演者]Snow Man　岩本 照　深澤辰哉　ラウール　渡辺翔太　向井康二　阿部亮平　目黒 蓮　宮舘涼太　佐久間大介■番組概要TBSでは、4月11日(日)午後1時から『それ Snow Man にやらせて下さい』がスタートする。本番組は Snow Man の初冠番組で、2回の地上波特番と動画配信サービス「Paravi」でのレギュラー配信を経て、念願の地上波レギュラーへ進出。約32年ぶりに生まれ変わる日曜ひる1時枠で、Snow Manがお茶の間に笑いを届ける。記念すべき初回は、市川猿之助をゲストに迎えて送る。歌舞伎界の大御所登場に、Snow Man メンバーは「テレビで見ている方だ!」(佐久間)、「来ていただけるとは思わなかった」(深澤)と大興奮! 初回にふさわしい豪華ゲスト・猿之助と共に、気合十分で初回収録に臨んだ。今回 Snow Man が挑戦する企画は、「第1回それな~動画グランプリ」。“それな~動画”とは、動画を見た人が共感して、つい「それな~」と言ってしまう動画のこと。第1回は「街中でのジャニーズそれな~動画」で対決! “ジャニーズが街中で声を掛けられた時に、ついやってしまいがちな恥ずかしい行動”をテーマに、動画の演出から撮影までをメンバー自ら行う。くじ引きで5チームに分かれたメンバーは、それぞれユニークなアイデアで1位を目指す!審査には、ゲストの猿之助も特別審査員として参加。メンバーが全力で挑んだリアルな“ジャニーズそれな~動画”に、スタジオは爆笑の連続! 第1回のグランプリに輝くチームは果たして!?ビリのチームには過酷な罰ゲームが待ち受けている…。スタジオでは、猿之助が歌舞伎界の“それな~話”を披露。「滝沢歌舞伎 ZERO」で座長を務める Snow Manは、大御所からの貴重な話に興味津々! 猿之助が明かした、歌舞伎界の意外なエピソードとは?さらに、ドラマ『半沢直樹』に出演していた猿之助を前に、向井が半沢のモノマネを披露する場面も。だが猿之助の予想外の返しに、向井撃沈…!?大いに盛り上がったスタジオトークにも注目してほしい。TBSの新しい日曜お昼の顔『それ Snow Man にやらせて下さい』、ぜひお楽しみに!#それスノ #SnowMan"
"YpyIhQHyUeU","【キル集】敵にグッバイ宣言してみた！【グッバイ宣言】","2021-04-10T08:00:06Z","UC_LS7mBxC0zL9Ot0gaU26Lw","ぷりっつ","22","21.14.04","実況うますぎ人間|うますぎ|フォートナイト|Fortnite|ぷりっつ|グッバイ宣言|キル集","795679","19110","259","2261","https://i.ytimg.com/vi/YpyIhQHyUeU/default.jpg","False","False","次は全部ソロで作りたいよねって話お借りした音源【グッバイ宣言】https://youtu.be/dHXC_ahjtEE▼あっきぃと作ってるゲームhttp://castle0.goodroid.co.jp/⬇︎”Lemon”のバナナバージョンwwwww⬇︎https://www.youtube.com/watch?v=W7Cmt...​⬇︎トマトに嫌われている歌ってみたwwww⬇︎https://youtu.be/IeRZQVbngd0​ ★バカと行くフォートナイト最初から見たい人https://youtu.be/3lUrYy142ug​◆アマルさんのチャンネル登録お願いします！https://www.youtube.com/channel/UCNLY...​ーーーーーーーーーーーーーーーーーーーーーーーー★Twitterhttps://twitter.com/umasugi_human​ーーーーーーーーーーーーーーーーーーーーーーーー★BGM提供https://dova-s.jp​フリーBGM・音楽素材｜H/MIX GALLERYwww.hmix.net/★クリエイターサポートのBGM→Moment★NCShttps://www.youtube.com/user/NoCopyri..."
"nrkQqyz97Kk","卵焼き花嫁修業とそれを食べたい人","2021-04-10T11:00:15Z","UCOwqf_QhtnDDFmylLRg4hWg","パオパオチャンネル","24","21.14.04","[none]","1139013","68355","243","2931","https://i.ytimg.com/vi/nrkQqyz97Kk/default.jpg","False","False","【チャンネル登録・高評価をお願いします】春夏秋冬、季節ごとに3日連続投稿はじめました。カメラが壊れているのか、映像の色味が変なタイミングで変わってしまう現象が起きています。大目に見てやってください。泣ける。2021年サンリオキャラクター大賞のコラボ部門に『@小豆♥はぴだんぶい』がノミネートされています！みなさまの清き一票をよろしくお願い致します！https://ranking.sanrio.co.jp/collabos/============================================パオパオチャンネルTwitter → https://twitter.com/paopaoinfo＠小豆YouTube→ https://www.youtube.com/channel/UC7S0xhrVe5H5VGnQylAyKngTwitter → https://twitter.com/azukin_tokiInstagram  → https://www.instagram.com/pkpk_azs/ぶんけいYouTube→ https://www.youtube.com/channel/UCoXM_xINTF-pnrK75OEePVQTwitter → https://twitter.com/bunkei_tkInstagram  → https://www.instagram.com/bunkei.tk/============================================"
"Wq_f9P-QdDg","2021.4.10ハイライト【DeNA vs 阪神】上茶谷大河選手が7イニング１失点と力投を見せるも、野手の援護なく連敗・・・","2021-04-10T08:42:14Z","UChJI9KrjSgPzv_kfX6yuqhA","YOKOHAMA DeNA BAYSTARS CHANNEL","17","21.14.04","プロ野球|横浜|DeNA|ベイスターズ|横浜スタジアム|BAYSTARS","172175","698","74","639","https://i.ytimg.com/vi/Wq_f9P-QdDg/default.jpg","False","False","2021シーズン　公式戦#ベイスターズ　#プロ野球ハイライト　#上茶谷"
"1ebllh2AUzQ","忙しめの日はこんな感じに過ごしてます！","2021-04-09T09:00:01Z","UCfnSEB4atVWATf6vzepHzqw","さしはらちゃんねる","22","21.14.04","[none]","1902932","25220","695","2109","https://i.ytimg.com/vi/1ebllh2AUzQ/default.jpg","False","False","こんにちは！指原です。今日はお仕事の日密着です。初だったので撮るの下手！またリベンジしたいです。リファのカッサなんですがPRじゃないので、絶対買える！という確約じゃなくてごめんなさい！売り切れたりしませんようにー！！何卒！"
