video_id,title,publishedAt,channelId,channelTitle,categoryId,trending_date,tags,view_count,likes,dislikes,comment_count,thumbnail_link,comments_disabled,ratings_disabled,description
"cT7wOSOZVoc","Minecraft Survivor VS 3 Hitmen...","2021-03-11T08:00:15Z","UCTkXRDQl0luXxVQrRQvWS6w","Dream","20","21.11.03","Dream Minecraft|dream Minecraft youtube|minecraft|dream|Minecraft hitmen|Minecraft Survivalist vs 3 hitmen|Speedrunner vs 3 hunters|Speedrunner vs 4 hunters|Speedrunner vs someone trying to stop them|Beating Minecraft but my friend tries to stop me|Minecraft but water rises every minute|minecraft but lava rises every minute|minecraft but challenge|minecraft challenge|challenge|minecraft 1.14|beating minecraft|rematch|finale|finale rematch|grand finale|grand","5202696","739031","6285","60363","https://i.ytimg.com/vi/cT7wOSOZVoc/default.jpg","False","False","Minecraft Survivor VS 3 Hitmen... This was incredible.Click the Merch link below for a chance to play in a Manhunt video with me! Merch: https://www.dream.shopFollow my socials:➽ Twitter - @dream➽ Instagram - @dreamwastaken➽ Snapchat - @dreampublicPatreon (Plugin): https://www.patreon.com/DreamWasTakenBadBoyHalo:  @BadBoyHalo George:  @GeorgeNotFound Sapnap:  @Sapnap We decided to call this series Minecraft Hitmen. This video there are THREE hunters/hitmen instead of just one.This is a new Minecraft but, 1.16 challenge that we have decided to try. I try to survive for 100 minutes, while my friend George AND my friend Sapnap AND my friend BadBoyHalo tries to prevent me from surviving. Every 10 minutes there is a 10 minute period of invincibility. They can see me through walls, and the world is small. It's a chase, a race, and it's super intense. A lot of laughs. I love doing these challenges.If this video gets 1,500,000 likes we'll do it again!Manhunt T-Shirt Details:Each and every Manhunt t-shirt purchased will be assigned a unique number. Limit 10 Manhunt t-shirts per order.In late April after all shirts have been processed, we will randomly select one unique Manhunt t-shirt number for invitation into a 2021 Dream Manhunt video. Dream will announce the associated order number (and perhaps country and initials) via social media. The lucky customer does not need to see the announcement or know their order number, because we will make reasonable attempts to contact the customer using the contact information provided at checkout. Do not fall for scams that ask you to provide sensitive information or click, install or open anything! If contact attempts are not successful or the invitation is not accepted within 2 business days, we will repeat the same process every 2 business days approximately until an invitation is accepted. The non-transferable invitation and video participation have no retail or monetary value for the purchaser of the Manhunt t-shirt which is sold at fair value and is non-refundable. Adequate computer, internet, video and other capabilities will be arranged if necessary for the sole purpose of video participation.Employees and their families are not eligible for selection.Not Minecraft, But Water Rises or Minecraft, But Lava Rises, or any other but challenge like that. This is a speed runner / survivalist in Minecraft against a killer / assassin / hitmen#MinecraftHitmen"
"X6hSrYsB_k0","Glutamat ist unbedenklich","2021-03-11T06:15:00Z","UCyHDQ5C6z1NDmJ4g6SerW8g","maiLab","22","21.11.03","Mai Thi Nguyen-Kim|Mai Thi|Mai|Nguyen|Nguyen Kim|Mailab|Die kleinste gemeinsame Wirklichkeit|Kleinste gemeinsame Wirklichkeit|Komisch alles chemisch|Terra X|Quarks|The Secret Life Of Scientists|Glutamat|Geschmacksverstärker|Essen|Zusatzstoff|Zustatzstoffe|Zutaten|Inhaltsstoffe|kochen|Gesundheit|gesund|schädlich|ungeseung|Bauchschmerzen|Übelkeit|Übergewicht|Neurotransmitter|chinesisches Essen|chi","196784","22803","728","2963","https://i.ytimg.com/vi/X6hSrYsB_k0/default.jpg","False","False","Die wirklich seltsame Geschichte, wie aus missverstandenem Mediziner-Humor eine weit verbreitete Glutamat-Angst entstand.INHALT0:00 Intro0:16 Was ist Glutamat?5:38 Die seltsame Geschichte der Glutamat-Angst11:54 Das Potential von Umami13:34 KeksempfehlungmaiLab wird produziert von Mai Thi Nguyen-Kim für funk (ARD & ZDF)►funk Web-App: https://go.funk.net   ►https://go.funk.net/impressum QUELLEN & WEITERE INFOSEs gibt unterschiedliche Glutamate, also unterschiedliche Salze der Glutaminsäure, die sich in ihrem Gegenion unterscheiden. Hier eine Übersicht mit den dazugehörigen E-Nummern:E 620 GlutaminsäureE 621 Mononatriumglutamat (das häufigste, auch engl. MSG)E 622 MonokaliumglutamatE 623 Calciumdiglutamat E 624 MonoammoniumglutamatE 625 MagnesiumdiglutamatÜber Kikunae Ikeda, wie er umami & Glutamat entdeckte & über Julius Maggi:https://bit.ly/3vdd9JJ Ergänzung zu 2:28 - Glutamat und Aspartat (rechts im Bild) sind Aminosäuren, Inosinat und Guanylat (links im Bild) sind Nukleotide. Die Kombi aus beiden Stoffklassen intensiviert das Umami-Erlebnis, man spricht hier von “Umami-Synergie”: Eine Glutamat-Inosinat-Kombination sorgt für besonders intensiven Umami-Geschmack: https://bit.ly/2Oa49ER Interessant: Umami-Synergien als Erklärung für beliebte Essenskombis wie Austern & Champagner: https://go.nature.com/3l3XfwX Diskussion darüber, ob man umami als Grundgeschmack klassifizieren sollte oder nicht: https://bit.ly/3lb9mIA Die beschriebene Studie mit Umami-Drink (Glutamat + Inosinat, s.o. “Umami-Synergie”) plus Gemüseraroma: https://bit.ly/2ObbaW0 (McCabe, C., & Rolls, E. T. 2007)Elbert T., Rockstroh B. (1990) Die Blut-Hirn-Schranke. In: Psychopharmakologie. Springer-Lehrbuch. Springer, Berlin, Heidelberg. https://bit.ly/2OAhPZv Paul Ehrlichs und Edwin Goldmans Färbeversuche (Trypanblau an toten Tieren):  https://bit.ly/2OB7nku Übrigens: Maggi enthält nicht nur Glutamat, sondern die bewährte Glutamat-Inosinat-Kombi, s.o.Letter to the editor von “Dr. Robert Ho Man Kwok” im New England Journal of Medicine (NEJM) 1968: https://bit.ly/38saMcr Beispiele für Antworten: https://bit.ly/2PKYYvfNew York Times Bericht über “Chinese Restaurant Syndrome”: https://nyti.ms/2OhkfMI Rhetorische Analyse des ganzen Debakels: https://bit.ly/2ObVEJu Unbedenklichkeit von Glutamat:Safety Evaluation 2000: https://academic.oup.com/jn/article/130/4/1049S/4686675?login=true Doppelblinde challenge study (in der man Menschen mit selbst angegebener Glutamat-Unverträglichkeit /Sensitivität bewusst Glutamat verabreichte), kam zu inkonsistenten und nicht reproduzierbaren Ergebniessen: https://academic.oup.com/jn/article/130/4/1058S/4686672 Die Existenz einer echten GLutamat-Unverträglichkeit oder Sensitivität wurde bisher zwar nicht belegt, ist aber grundsätzlich nicht auszuschließen. Die Symptome, über die Betroffene berichten sind aber in aller Regel milde, wie vorübergehende Übelkeit oder Bauchschmerzen nach Konsum.Review alleged health hazards: https://onlinelibrary.wiley.com/doi/pdfdirect/10.1111/1541-4337.12448 Nebenwirkungen, die man v.a. in Tierversuchen mit extrem hosen Dosen beobachtet hat: https://www.tandfonline.com/doi/pdf/10.1080/10942912.2017.1295260 Consensus meeting: monosodium glutamate - an update, 2007: https://pubmed.ncbi.nlm.nih.gov/16957679/ Bericht von der Colgate University über Alumnus Howard Steel, der sich nach eigenen Angaben Dr. Ho Man Crock à la Human Crock ausgedacht hat: https://bit.ly/3l1ivDv Proteinbuch mit “National Biomedical Research Foundation, Silver Spring, Maryland”: https://bit.ly/30ubwcF Es gibt allerdings dieses Institut: https://bit.ly/3t9katA in der Nähe von Dupont Circle in Washington, DC - DC grenzt nahtlos an Silver Spring, Maryland, vom Dupont Cir aus sind es etwa 7 Meilen dorthin. Könnte also auch eine Verwechslung bzw. ein Adresswechsel sein?? Laut Wiki-Eintrag wurde die Foundation bereits 1970 ins Medical Center der Georgetown University eingegliedert; das könnte erklären, warum man hinterher nichts mehr darüber findet.BILDQUELLEN- Tomaten: Bild von Ernesto Rodriguez auf Pixabay - Parmesan: Bild von Anna Lebed auf Pixabay - Pfifferlinge: Bild von RitaE auf Pixabay - Lachs: Bild von Shutterbug75 auf Pixabay - Steak: Bild von Divily auf Pixabay - Die 20 kanonischen Aminosäuren: aus dem Buch “Komisch, alles chemisch” (Mai Thi Nguyen-Kim), gezeichnet von claire Lenkova- Kikunae Ikeda: Von Autor unbekannt - Google Arts and Culture [1], Gemeinfrei, https://commons.wikimedia.org/w/index.php?curid=8297726- Misosuppe: https://www.flickr.com/photos/avlxyz/4390865166- Getrocknete Tomaten: Bild von congerdesign auf Pixabay - Paul Ehrlich: Von Harris &amp; Ewing https://commons.wikimedia.org/w/index.php?curid=6060062- Julius Maggi: https://commons.wikimedia.org/w/index.php?curid=351575 - Maggi Werbung: Von Autor unbekannt - Trowitzsch Volkskalender 1904., Gemeinfrei, https://commons.wikimedia.org/w/index.php?curid=4785016"
"YHxtszFzVpg","Julia Michaels - Issues (Alicia & Jasmina) | The Voice Kids 2021 | Blind Auditions","2021-03-11T11:00:08Z","UCsaKxIA9snv1Wrh_sw1DFvg","The Voice Kids","24","21.11.03","The Voice Kids|The Voice Kids Deutschland|The Voice Kids Germany|Voice Germany|TVK|tvk 2021|the voice 2021|The Voice Kids Germany 2021|The Voice Kids Blind Audition|The Voice Sat.1|Sat.1|Talent Show|Show|Casting|Coaches|Team|Talente|Singen|Kinder|Staffel 9|neunte Staffel|Auftritt|Lied|Song|Alvaro Soler|Wincent Weiss|Stefanie Kloß|Michi Beck|Smudo|Blind Audition|Julia Michaels - Issues (Alicia & Jasmina)|Julia Michaels|Issues|Alicia|Jasmina|Alicia & jasmina","147701","10279","116","571","https://i.ytimg.com/vi/YHxtszFzVpg/default.jpg","False","False","Die Zwillinge Alicia und Jasmina sorgen in ihrer Blind Audition mit dem Song Issues von  für Gänsehaut. Die 14-Jährigen punkten nicht nur mit ihren einzigartigen Stimmen, sondern auch mit ihrer charmant-lustigen Art. Doch reicht es für einen Buzzer? Seht euch hier die Performance von Alicia & Jasmina an, die gemeinsam den Song Issues von Julia Michaels singen.► THE VOICE KIDS 2021 Alle Clips: https://www.youtube.com/playlist?list=PL_NKWLcpSrYPYp6n-WYL9KmzfQuIxJ8xy► THE VOICE KIDS 2021 Alle Highlights: https://www.youtube.com/playlist?list=PL_NKWLcpSrYPkQHWmrTPYIQKHQgMIidLI► THE VOICE KIDS 2021 Blind Auditions:https://www.youtube.com/playlist?list=PL_NKWLcpSrYNDyvhR8QFtXKw-v-jVkCVy► SUBSCRIBE TO THE VOICE KIDS: https://s71.link/b/2P4NY8Q Ab dem 27. Februar 2021 ist es wieder soweit – The Voice Kids startet in eine neue Staffel. Doch dieses Jahr läuft die Show samstags und nicht sonntags! Bereits zum neunten Mal fighten die Coaches in ihren roten Drehstühlen um die größten Talente unter den Kids. Bei The Voice Kids 2021 geben der spanisch-deutsche Singer-Songwriter Alvaro Soler sowie der Deutsch-Pop-Barde Wincent Weiss jeweils ihr Debut als Coach. Die beiden anderen Plätze besetzen Silbermond-Sängerin Stefanie Kloß sowie die Fantastischen 2 Michi Beck und Smudo im Doppelsitzer. Man darf mit Spannung erwarten, wem sich die jungen Talente wohl anvertrauen. Mehr über die einzelnen Coaches von The Voice Kids 2021 erfährst du hier!********************************************#TheVoiceKids #AlvaroSoler #WincentWeiss #StefanieKloß #MichiBeck #SmudoImpressum: https://www.sat1.de/service/impressum"
"FaLBtpEU4fY","MIA KANN ALLEINE SCHWIMMEN  😵 Team Harrison","2021-03-10T15:00:18Z","UCvX4QLz-gxgWpQXTutSan_w","Team Harrison","22","21.11.03","Team Harrison|vlog|familie|family|schwangerschaft|Dubai|auszug|auswandern|goodbye deutschland|einzug|umzug|neuanfang|Pool|Schwimmen|baby schwimmen|schwimmkurs|tauchen|unter wasser|mama|papa|stolze eltern|haus|villa","391238","19589","2047","1052","https://i.ytimg.com/vi/FaLBtpEU4fY/default.jpg","False","False","Wenn Ihr in einem Video von uns gegrüßt werden möchtet► Abonniert unseren Channel https://tinyurl.com/y7jonjup► Kommentiere mit #TeamHarrison ► Like das Video Viel Spaß beim anschauen Ganz liebe Grüße FAMILIE HARRISONUNSERE SOCIAL MEDIA ACCOUNTS - FOLLOW US ♡Youtube ► https://tinyurl.com/y7jonjupSarah Instagram ► https://www.instagram.com/sarah.harrison.official/TikTok ► https://vm.tiktok.com/w8vQQa/Dominic Instagram ► https://www.instagram.com/dominic.harrison.official/HIER FINDET IHR MEHR VIDEOS VON UNS:Schwangerschaft Playlist ► https://tinyurl.com/yc96w99jLos Angeles Playlist ► https://tinyurl.com/ybszppv9TeamHarrisons Vlogs ► https://tinyurl.com/ydaxmatvHochzeit Playlist ► https://tinyurl.com/y83syzts"
"cqcU7rsjE_o","Der Bachelor 2021: Der HAMMER im FINALE!","2021-03-11T05:00:06Z","UCwLTMMZVlnhM3lhyzADoALA","OnionDog","24","21.11.03","Bachelor|bachelor 2021|bachelor finale|bachelor gewinnern|bachelor mimi|bachelor stephi|bachelop michele|bachelor letzte rose|bachelor niko|oniondog","88684","4790","84","733","https://i.ytimg.com/vi/cqcU7rsjE_o/default.jpg","False","False","Der Bachelor 2021: Wer bekommt Nikos letzte Rose?Die niedlichen Robbenkissen: https://amzn.to/3cjY6pc * Vorsicht! Dieses Video enthält Spoiler in Bezug auf das Finale des Bachelors 2021:Welchen verhängnisvollen Anruf tätigt Niko vor den letzten Dates?Wer bekommt die letzte Rose der Staffel?Und warum wirkt Niko nach dieser Folge nicht mehr so sympathisch?All das und noch viel mehr Highlights gibt es in dieser Parodie zur neuen Folge vom Bachelor 2020. Kommentiert, parodiert und analysiert vom einzig wahren OnionDog. Viel Spaß! Wer ist „Der Bachelor“ 2021? Loyal, ziemlich ehrlich und teilweise auch echt direkt – so beschreibt sich der neue Bachelor. Niko Griesert tritt in die Fußstapfen von Sebastian Preuss. Er ist 30 Jahre alt, 1,91m groß und kommt aus Osnabrück in Niedersachsen. Niko ist seit drei Jahren Single und sehnt sich nach einer Partnerin: So richtig verliebt war ich seit drei Jahren nicht mehr. Ich habe auch noch nicht viele Beziehungen gehabt, nur zwei, die letzte ist 3 Jahre her. Es wird also Zeit! Ich bin jetzt 30 und komme in das Alter, wo man seinen Eltern auch mal eine Frau vorstellen kann und sagt, das ist sie! Sein Vater, der übrigens der Bürgermeister von Osnabrück ist, und seine Mutter sind in Sachen Liebe seine großen Vorbilder, da sie seit über 30 Jahren glücklich verheiratet sind. Was macht „Der Bachelor“ 2021 beruflich? Niko Griesert ist studierter IT-Projektmanager. Der 30-Jährige liebt es aber auch, sich privat weiterzubilden und immer wieder neue Dinge zu lernen. Besonders Klavierspielen und Sprachen sind große Leidenschaften von ihm. Hat Niko Griesert schon Kinder? Eine Frau hat schon einen festen Platz in Nikos Herz – und das sollte auch kein Problem für seine zukünftige Partnerin sein. Der Bachelor ist nämlich schon Papa. Seine neunjährige Tochter wohnt gemeinsam mit der Mutter in den USA. Meine Tochter bedeutet mir alles, macht er im RTL-Interview deutlich. Bachelor 2021: Welche Kandidatinnen kämpfen um Niko Grieserts Herz?Anna Corcelli (30)Debora Goulart (24)Denise Hersing (24)Esther Kobelt (22)Hannah Kerschbaumer (28)Jacqueline Bikmaz (32)Jacqueline Siegle (23)Karina Wagner (24)Kim Virginia (25)Kim-Denise (23)Laura Stella Bühre (21)Linda-Caroline Nobat (25)Maria Chatzinikolau (25)Melissa Lindner (27)Michèle de Roos (27)Michelle Mimi Gwozdz (26)Nadine Ackermann (24)Nina Röber (20)Nora Lob (31)Stefanie Desiree (27)Stephie Stark (25)Vivien Fabia-Offelmann (27)Wo & Wann läuft das?Immer Mittwochs 20.15 Uhr auf RTL, oder jederzeit auf TNOW.de#bachelor#bachelor2021#oniondog*Affiliate-Link."
"k7j-CceRTI8","Sido, bist du ohne Führerschein gefahren? Kinder fragen Rapper | Late Night Berlin | ProSieben","2021-03-09T23:00:22Z","UCBlOtMAWn6nQpChhRo14CYA","Late Night Berlin","24","21.11.03","sido bist du ohne Führerschein gefahren? Kinder fragen Rapper|sido|sido interview|sido kinder fragen rapper|sido late night berlin|sido kinder|kinder interviewen rapper|sido führerschein|sido musikvideo|ohne führerschein|Late Night Berlin|Klaas Late Night|Late|Night|Berlin|Klaas|Klaas Heufer-Umlauf|Circus HalliGalli|Joko und Klaas|Joko|Joko Winterscheidt|Klas|Claas|ProSieben|Late Night Show|Show|TV Show|Sendung|TV Sendung|TV","633559","43053","477","1309","https://i.ytimg.com/vi/k7j-CceRTI8/default.jpg","False","False","Unseren beiden investigativen Journalist*innen Pauline und Romeo haben sich diesmal mit Sido verabredet. Und wie sollte es anders sein - es wurde ein denkwürdiges Aufeinandertreffen.#Sido #KinderFragenRapper #LateNightBerlin #ProSiebenAlle Highlights und die komplette Show findest du auf https://www.prosieben.de/tv/late-night-berlin-mit-klaas-heufer-umlauf/video/highlights-vom-09-03-2021 ► Late Night Berlin – Ganze Folgen & alle Videos: http://bit.ly/LNBGanzeFolge ► Late Night Berlin abonnieren: http://bit.ly/LNBAbonnieren► Late Night Berlin in einer Playlist: http://bit.ly/LNBAlleClips► FACEBOOK: https://www.facebook.com/LateNightBerlin/ ► TWITTER: https://twitter.com/latenightberlin► INSTAGRAM: https://instagram.com/latenightberlin/***************************************Die feste Verabredung am Dienstagabend: Popkultur, Politik, Musik, Sport, Gesellschaft und Medien – Klaas Heufer-Umlauf kommentiert und diskutiert die wirklich wichtigen Themen und ist dabei ganz subjektiv. Woche für Woche sendet ProSieben die neue Late-Night-Show für Deutschland direkt aus Berlin, der Stadt, die Trends setzt.Dienstags, 23:30 Uhr auf ProSieben.Impressum:   http://www.prosieben.de/service/impressum"
"0VG7KeCjcfw","Wasserstandmeldung #2 Spendenstand, News, Infos und einige Bitten Qman   LEGO®","2021-03-10T12:49:06Z","UCERQK9uhCLXg2xHqar1afCw","Johnny's World","24","21.11.03","LEGO® - Zoll und Urheberrechte - Qman Container beim Zoll einkassiert!|lego zollbeschlagnahme|lego abmahung|lego vs steingemachtes|lego hogan lovells|lego anwälte|spendenaktion bricks4thekids|bricks4thekids|bricks4thekids spendenstand|lego vs qman|lego vs. johnnys world|hogan lovells|Wasserstandmeldung #2 Spendenstand|News|Infos und einige Bitten Qman LEGO®","209488","20324","208","3240","https://i.ytimg.com/vi/0VG7KeCjcfw/default.jpg","False","False","Hallo ihr Lieben,  hier eine neue Zwischenstandmeldung. Was ist in den letzen Tagen passiert, wie hoch ist der Spendenstand bei Bricks4theKids? Eine dringende Bitte an euch und noch einiges anderes an Infos.Zeitmarken00:00 gewagte These00:20 Begrüßung01:04 Wann Laden wieder offen02:19 Online-Shop & Versand02:50 der Kontakt zu mir03:23 Qman bei Amazon04:35 Spenden über Paypal05:49 Der Zoll kann nix dafür10:09 Stand der Dinge14:54 Dr. Von Gerlach19:15 der Mann mit der Kamera20:39 Hogan Lovells in China21:25 Warum in der Öffentlichkeit24:20 Bitte geht fair miteinander um!26:14 Ein Luxusproblem27:46 Kontakte zu Kinderheimen28:21 SpendenstandHier die Spendenmöglichkeiten für Bricks4TheKidsAdresse für Spenden per Paypal: johnnysworld773@gmail.com Link zur Spendenaktion: https://gofund.me/58736ef6Quellen:Verordnung (EU) Nr. 952/2013 https://eur-lex.europa.eu/legal-content/DE/TXT/PDF/?uri=CELEX:32013R0952&from=DEHogan Lovells und die Detektive:https://www.lto.de/recht/kanzleien-unternehmen/k/hogan-lovells-zuliefererstreit-prevent-vw-vorwurf-mitarbeiter-bespitzeln/https://www.juve.de/nachrichten/verfahren/2019/05/nach-spitzelaffaere-hogan-lovells-vergleicht-sich-mit-ex-ewe-vorstandhttps://www.juve.de/nachrichten/namenundnachrichten/2016/10/ewe-spitzel-affaere-hamburger-bueroleiter-von-hogan-lovells-tritt-zurueckHelloCustomshttps://www.hellocustoms.eu/YouTube Channel von HelloCustomshttps://www.youtube.com/channel/UC2sRWdjqyu0q1hrxFdYbDiwSeite von Dr. Leopold von Gerlach bei Hogan Lovells (von wegen guten Beziehungen zum Zoll und der Staatsanwaltschaft und so..) https://www.hoganlovells.com/de/leopold-vongerlachDie Bundesrechtsanwaltsordnung (BRAO)https://www.gesetze-im-internet.de/brao/BRAO §1https://www.gesetze-im-internet.de/brao/__1.htmlBRAO §43a (hier wichtig (1) berufliche Unabhängigkeit - kann schwierig sein bei „guten Beziehungen zu Zollämtern, ermittelnden Staatsanwaltschaften“ Beziehungen ziehen fast immer in 2 Richtungenhttps://www.gesetze-im-internet.de/brao/__1.htmlBRAO§43b Werbunghttps://www.gesetze-im-internet.de/brao/__43b.htmlDie Anschreiben an private Einführende im Kleinsendeverfahren können hier runtergeladen werden:(3 Jahre Knast bei Markenverletzungen?)https://we.tl/t-yDjdgLrv8dAlle Korrespondenz bezgl. Qman / LEGO A/S findet ihr hier:https://we.tl/t-wjQv0rqj9XWasserstandmeldung #2 Spendenstand, News, Infos und einige Bitten Qman   LEGO®ACHTUNG! Böse Werbung!Lust auf Klemmbausteine bekommen? Dann schaut doch mal bei Steingemachtes rein:http://www.steingemachtes.deSchaut auch gerne mal in meinem Amazon Shop* vorbei. Da hab ich mal son paar Teile für euch zusammengestellt. T-Shirts, meine LieblingsRum und Whisky Sorten, meine Filmausrüstung und ne Menge anderen Krams den keiner braucht!http://www.amazon.de/shop/johnnysworld  Die Idefix Figur im Hintergrund*: (wurde mehrfach nach gefragt)https://amzn.to/2BRppIFDie von mir genutzte Bauunterlage (Filz grau) findet ihr hier:https://amzn.to/30piH7bDen kleinen 16x16 LED-Bildschirm (DIVOOM) findet ihr hier bei Amazon:*https://amzn.to/2UTbwkyAffiliate Link bei Amazon* Danke für eure Unterstützung!https://amzn.to/3e4mnQ6Wenn ihr jetzt Lust auf andere Klemmbausteine bekommen habt schaut doch  mal hier vorbei:https://steingemachtes.de/... oder schaut, nach Ende des Lockdowns, bei mir im Laden in Paderborn oder online unter http://www.steingemachtes.de vorbei!Zur Zeit gelten folgende Beschränkungen / Vorgaben im Steingemachtes Ladenlokal:So dürfen nicht mehr als 8 Leute gleichzeitig im Laden sein, es wird eine Mund/Nasenbedenkungspflicht geben. Bitte Zahlt wenn möglich bargeldlos. Es wird erstmal keinen Kaffee mehr geben, der Kinderbautisch ist vorerst abgebaut ubd in den Gruschelkisten darf nur mit (bereitliegenden ) Schutzhandschuhen gewühlt werden.Überlegt bitte auch gut ob eine weite Anreise in der momentanen Situation das Richtige ist. Eine Lange Verweildauer ist im Sinne der Kontaktbeschränkungen nicht gewollt und kann für mich im schlimmsten Fall zu Ärger mit der Oberigkeit führen.Wenn ihr eigene Masken habt (ob nun industriel oder selbstgenäht) bringt diese bitte mit. ICh werde im Laden auch einweg OP-Masken haben. Die können für 1 Euro erworben werden, Der Euro wird beim Kauf dann an der Kasse verrechnet.Hier gibts eine kleine Roomtour zu Laden in Paderborn:https://youtu.be/xtqhnu8n_3I*Die Angebote bei Amazon stammen nicht von mir oder der Steingemachtes GmbH, ich erhalte aber durch den Verweis auf diese Produkte eine Provision, wenn ihr dort etwas kauft, jedoch ohne dass Euch zusätzliche Kosten entstehen. Wenn Ihr über diese Links etwas (muss nicht mal der verlinkte Artikel sein) kauft... Vielen Dank! Hier findet ihr uns bei Twitter: https://twitter.com/JohnnysWorldYT Neue Telefonnummer für den Laden:05251 5063594WhatsApp: +4915227611809Instagram: johnnysworldyt"
"CAFrtEllIHY","Mein NEUES ZUHAUSE auf MADEIRA!","2021-03-10T15:00:05Z","UCmsRVk4x80Sy3yPmP_GVrIw","Mexify","20","21.11.03","Mexify|Mexify Uncut|Mexify Games|Mexi|Furdis|Fufu|mexify reacts|mexify reagiert|mexify haustour|mexify roomtour|roomtour|madeira|madeira roomtour","283337","35977","665","3533","https://i.ytimg.com/vi/CAFrtEllIHY/default.jpg","False","False","Mein NEUES ZUHAUSE auf MADEIRA! | Mexify ❤️Lass dem Video ein ''Daumen nach oben'' da für mehr Mini Vlogs! Mexify Buch bei Amazon: https://amzn.to/3azf81f Mexify Buch bei Thalia: http://bit.ly/Mexify_Thalia ᵂᴱᴿᴮᵁᴺᴳMein Creator Code: Mexify Den Code muss man nach 14 Tagen wieder neu eingeben! :3 ᵂᴱᴿᴮᵁᴺᴳ___🦖 Dino Kissen: https://www.moodrush.de/Mexify ᵂᴱᴿᴮᵁᴺᴳ👕 Mein Merch: https://shop.spreadshirt.de/Mexify ᵂᴱᴿᴮᵁᴺᴳ🎮 Twitch: https://www.twitch.tv/mexify📷 Insta: https://instagram.com/mexify/ 🐦Twitter: https://twitter.com/Mexify"
"jJXQDhFSubw","Paris St. Germain - FC Barcelona | Meine Nerven liegen blank... | ViscaBarca","2021-03-11T12:00:09Z","UCPgivdyEmcyDE-ThW9IRK5Q","ViscaBarca","24","21.11.03","paris st germain|paris fc barcelona|fc barcelona|barcelona|barcelona viscabarca|viscabarca paris|Paris St. Germain - FC Barcelona | Meine Nerven liegen blank... | ViscaBarca|paris barca|fc barcelona viscabarca|viscabarca|viscabarca paris st germain|psg barca|psg viscabarca|psg fcb|Paris vs barcelona|Psg vs barcelona|Paris vs fc barcelona|Psg vs barca","38422","4939","125","441","https://i.ytimg.com/vi/jJXQDhFSubw/default.jpg","False","False","Folgt Barca auf Twitch: https://www.twitch.tv/fcbarcelonaFolgt mir auf Twitch: https://www.twitch.tv/visca96barca▬▬▬▬▬▬▬▬▬▬Paris St. Germain - FC Barcelona | Meine Nerven liegen blank... | ViscaBarca Meine Sponsoren:Meine eigener Scuf (Code ViscaBarca für 5%) ► http://scuf.co/viscabarca *MEIN BUCH BESTELLEN ► http://www.amzn.to/31IGY5I *Mein Lieblingsheadset ► https://astro.family/viscabarcaEMEA  *Mein Elgato Aufnahmegerät ► http://e.lga.to/ViscaBarcaMeine Gamer-Ausrüstung ► http://bit.ly/MyEquip *NEUER MERCH ► https://3dsupply.de/de/viscabarca/ ** Diese Links sind Affiliate Links. Falls du dieses Produkt kaufen solltest, werde ich am Umsatz beteiligt. Für dich entstehen dabei keine Mehrkosten.▬▬▬▬▬▬▬▬▬▬▬Instagram: http://instagram.com/visca96barcaSnapchat: viiscabarcaTwitter: http://twitter.com/viscabarcacodFacebook: http://bit.ly/FazebookMEINE SCUF FAN PAGE auf Insta: http://instagram.com/endlichscuf▬▬▬▬▬▬▬▬▬▬▬Für geschäftliche Anfragen: viscabarca@ciberdime.com"
