video_id,title,publishedAt,channelId,channelTitle,categoryId,trending_date,tags,view_count,likes,dislikes,comment_count,thumbnail_link,comments_disabled,ratings_disabled,description
"ScOBx8Anrsk","Skoda Kushaq walkaround - Skoda's mid-size SUV for India is here! | First Look | Autocar India","2021-03-18T15:15:00Z","UCjWs7BxyjO5SLqevxSmp4vQ","Autocar India","2","21.19.03","Autocar|India|Autocar India|Car Reviews|Video Reviews|Test Drives|skoda kushaq|skoda kushaq india|skoda kushaq 2021|skoda kushaq launch|skoda kushaq price|skoda kushaq interior|skoda kushaq unveil|skoda kushaq world premiere|skoda kushaq walkaround|skoda kushaq 2021 interior|skoda kushaq 2021 price|skoda india|india|hyundai creta|kia seltos|skoda kushaq 2021 price in india|skoda kushaq review|kushaq 2021|skoda car review|kushaq skoda india","281068","4643","207","345","https://i.ytimg.com/vi/ScOBx8Anrsk/default.jpg","False","False","The Skoda Kushaq is coming soon! Sergius Barretto gives you a quick tour of the final production model for India. 0:00 - Introduction0:41 - Skoda Kushaq dimensions and styling2:13 - Skoda Kushaq boot2:27 - Skoda Kushaq space3:30 - Skoda Kushaq interior4:33 - Skoda Kushaq features5:50 - Skoda Kushaq quality6:26 - Skoda Kushaq engines6:55 - Skoda Kushaq launch SUBSCRIBE to Autocar India for the hottest automotive news and the most comprehensive reviews ► http://bit.ly/AutocarIndAutocar India is your one-stop source for test drive reviews & comparison tests of every new car and motorcycle launched in India. We also offer a great mix of other automotive content, including weekly news, motor show reports, travelogues and other special features. Website: http://www.autocarindia.com Facebook: http://www.facebook.com/autocarindiamagInstagram: https://www.instagram.com/autocar_india/Twitter: http://www.twitter.com/autocarindiamagNew car reviews ►http://bit.ly/ACI-NewCarReviewsComparison tests ►http://bit.ly/ACI-ComparisonNew bike reviews ►http://bit.ly/ACI-BikeReviewsFeatures ►http://bit.ly/ACI-Features"
"JgOW0oaeC4g","പരസ്പരം മനസ്സിൽ ഒളിപ്പിച്ച പ്രണയം തിരിച്ചറിഞ്ഞ് ശിവനും അഞ്ജലിയും..","2021-03-18T14:00:23Z","UCp_r6Z-Oh0YTf-ym71z5Nqg","Asianet","24","21.19.03","Chippy|Popular serial Santhwanam|Rajeev Parameshwar|Sandhwanam|Sandwanam|Santhwanam|Santhwanam Full Episode|Santhwanam Hotstar|Santhwanam Latest Episode|Santhwanam Serial Online|Santhwanam asianet|Santhwanam asianet serial|Santhwanam hotstar|Santhwanam serial|Watch Santhwanam Serial|asianet|asianet serials|chippy|malayalam serials|new serial","1183115","24511","424","1114","https://i.ytimg.com/vi/JgOW0oaeC4g/default.jpg","False","False","#Shivanjali പരസ്പരം മനസ്സിൽ ഒളിപ്പിച്ച പ്രണയം തിരിച്ചറിഞ്ഞ് ശിവനും അഞ്ജലിയും..Santhwanam || Mon to Sat at 7 PM || Asianet#Santhwanam #Chippy #Asianet #SisterLove #AsianetSerials #MalayalamSerials #RajeevParameshwar #Sreedevi"
"A8b5wsBP1nE","ബാങ്ക് അക്കൗണ്ട് ഉടമകൾക്ക് 10000 രൂപ പിഴ ലഭിക്കും.അവസാന തീയതി മാർച്ച് 31. അക്കൗണ്ട്  ഉടമകൾ അറിയുക","2021-03-17T09:29:56Z","UCYngtzudrjUI2o8vbefHWww","Chrishal Media","22","21.19.03","Latest information|Daily latest news updates|Chrishal Media|Christo Joseph|Trending updates|PANCARD AADHAR CARD LINK|KYC UPDATE","461478","18495","1044","453","https://i.ytimg.com/vi/A8b5wsBP1nE/default.jpg","False","False","ബാങ്ക് അക്കൗണ്ട് ഉടമകൾക്ക് 10000 രൂപ പിഴ ലഭിക്കും.അവസാന തീയതി മാർച്ച് 31. അക്കൗണ്ട്  ഉടമകൾ അറിയുക PAN CARD AADHAR CARD LINKhttps://www.incometaxindiaefiling.gov.in/home𝐃𝐢𝐬𝐜𝐥𝐚𝐢𝐦𝐞𝐫📢📢📢ഈ ചാനലിലൂടെ ഞങ്ങൾ  പ്രസിദ്ധീകരിക്കുന്ന വീഡിയോകളിൽ ഒരുതരത്തിലുമുള്ള രാഷ്ട്രീയ,സാമുദായിക, മതപരമായ  ഒരു വേർതിരിവുമില്ല. ഗവൺമെന്റ് സ്കീമുകൾ ഏത് നിമിഷവും എപ്പോൾ വേണമെങ്കിലും മാറ്റം സംഭവിക്കാം . ആയതിനാൽ ഞങ്ങൾ പ്രസിദ്ധീകരിക്കുന്ന പുതിയ വീഡിയോ അപ്‌ഡേഷനുകൾ കാണുവാൻ ശ്രമിക്കുക👍.#chrishalmediaFor more latest news and informative updates..𝑷𝒍𝒆𝒂𝒔𝒆 𝑺𝒖𝒃𝒔𝒄𝒓𝒊𝒃𝒆 𝒕𝒐 𝒐𝒖𝒓 𝒄𝒉𝒂𝒏𝒏𝒆𝒍 :https://www.youtube.com/c/chrishalmedia𝑭𝒐𝒍𝒍𝒐𝒘 𝒐𝒖𝒓 𝑭𝒂𝒄𝒆𝒃𝒐𝒐𝒌 𝒑𝒂𝒈𝒆 :https://www.facebook.com/chrishalmedia/𝑪𝒉𝒆𝒄𝒌 𝒐𝒖𝒕 𝒎𝒚 𝒑𝒓𝒐𝒇𝒊𝒍𝒆 𝒐𝒏 𝑫𝒂𝒊𝒍𝒚𝒉𝒖𝒏𝒕https://profile.dailyhunt.in/Chrishalmedia?s=a&ss=pd&uu=0x4afc8a6b9748085avia Dailyhunt𝑭𝒐𝒓 𝒎𝒐𝒓𝒆 𝒆𝒏𝒒𝒖𝒊𝒓𝒊𝒆𝒔..𝒎𝒂𝒊𝒍 𝒖𝒔 chrishalmedia@gmail.com"
"MEr0IT_l1mc","Sumit Goswami | Baapu (Official Video) | Latest Haryanvi Song 2021 | New Haryanvi Song 2021","2021-03-17T04:30:15Z","UC_wRxe9tOFevlxOfDpRKuMw","Speed Records Haryanvi","10","21.19.03","Latest Hits|Haryanvi Latest Hits|Sumit Goswami|Feelings Sumit Goswami|Sumit Goswami Viral Song|Haryanvi Romantic Song|Latest Haryanvi Hit Song 2020|Latest Haryanvi Song 2020|Trending Haryanvi Song 2020|Haryanvi Latest Trending Song 2020|sumit goswami song|sumit goswami new song|sumit goswami all song|sumit goswami new song 2020|deepesh goyal|Speed Records|tora|sumit|goswami|latest|new|haryanvi|songs|Baapu Sumit goswami|Baapu Official Video|Baapu","1693346","83391","12249","6288","https://i.ytimg.com/vi/MEr0IT_l1mc/default.jpg","False","False","Speed Records Haryanvi presents the Teaser of Sumit Goswami's Baapu, a song for all the fathers.Song - BaapuSinger/Lyrics/Composer- Sumit GoswamiMusic - KhatriDirector- Deepesh Goyal DOP - Nishan SinghEP - AnishProduction - Deepesh RakhejaChild Artist - Elvin Art AcademyMakeup and Hair - Sanju, KuljeetPublicity Designs - Sumit BamalArtist Managed By- Gem Tunes EntertainmentLabel- Speed Records HaryanviBaapu –Sumit GoswamiGaana : http://bit.ly/3bSyiBq iTunes /Apple Music : http://apple.co/3vy6hHd JioSaavn : http://bit.ly/38OeFsd Wynk : https://bit.ly/3qZinFD Hungama : https://bit.ly/3ttjgIh Spotify : http://spoti.fi/3bU7WiH Amazon Music : https://amzn.to/2Q8lgqZ Youtube Music : http://bit.ly/3vx5t5tEnjoy & stay connected with us!► Subscribe to Speed Records Haryanvi : https://bit.ly/2kSrhZK ► Follow us on Instagram: https://instagram.com/speedharyanviofficialContact For More Information :+91 9855553379"
"-UOp6qDQ4Mc","Barathi Kannamma | Raja Rani | Mega Sangamam Vaaram - Promo","2021-03-18T11:08:17Z","UCvrhwpnp2DHYQ1CbXby9ypQ","Vijay Television","24","21.19.03","Star|Star Vijay TV|Vijay TV|Vijay|Redefining Entertainment|தமிழ்|விஜய்|டிவி|தொலைக்காட்சி|Tamil TV|Tamil Shows|Aranamanai Kili|Durga|Yamuna|Renu|Jaanu|Arjun|Meenakshi|Aarthi|Chinna Thambi","3198437","55103","1105","904","https://i.ytimg.com/vi/-UOp6qDQ4Mc/default.jpg","False","False","#BarathiKannamma #RajaRani #SirapuMegaSangamam #Barathi #Kannamma #Akilan #Anjali #Soundarya #Venba #Durga #Sandhya #Saravanan #VijayTV #VijayTelevision #StarVijayTV #StarVijay #TamilTV பாரதி கண்ணம்மா ராஜா ராணி மெகா சங்கமம் - திங்கள் முதல் சனிக்கிழமை இரவு 9 மணி முதல் 10 மணி வரை நம்ம விஜய் டிவில.."
"cQRa0rH_8TA","Alitho Saradaga | Naveen Polishetty (Actor) Anudeep KV (Director)| 22nd March 2021 |Latest Promo|ETV","2021-03-17T10:34:22Z","UCSs9H1cyB3OHdy8wkit8ZKg","etvteluguindia","24","21.19.03","alitho saradaga|ali tho saradaga|alitho saradaga latest|ali tho|etv alitho saradaga|alitho saradaga 2019|alitho saradaga youtube|alitho saradaga latest promo|ali tho saradaga latest|alitho saradaga 2018|alitho saradaga etv","1899237","54953","785","1305","https://i.ytimg.com/vi/cQRa0rH_8TA/default.jpg","False","False","#AlithoSaradaga #TeluguShow #ETVWinTo watch your ETV all channel’s programmes any where any time Download ETV Win App for both Android & IOS: https://f66tr.app.goo.gl/appsETV Telugu(Youtube) - http://bit.ly/2QR0yu9  Facebook - http://bit.ly/2L2GYYhETV Jabardasth(Youtube) - http://bit.ly/35xdqtuETV Dhee(Youtube) - http://bit.ly/2Ok8zWFETV Plus India(Youtube) - http://bit.ly/2OlEAOgFacebook - http://bit.ly/2DudC0tETV Abhiruchi(Youtube) - http://bit.ly/2OkEtTbFacebook - http://bit.ly/2OSrIhvETV Life(Youtube) - http://bit.ly/2OiKAY6Facebook - http://bit.ly/34tiqzkETV Telangana(Youtube) - http://bit.ly/33nRaAKFacebook - http://bit.ly/37GkVQFETV Andhra Pradesh(Youtube) - http://bit.ly/2OKARZzFacebook - http://bit.ly/2R0vs3k► Like us on Facebook : https://www.facebook.com/etvwin► Follow us on Instagram : https://www.instagram.com/etvwin/► Follow us on Twitter : https://twitter.com/etvwin ► Visit Website : https://www.etvwin.com/► Pin us on Pinterest: https://in.pinterest.com/etv_win/"
"EZ0JZLQER2g","Teenmar Mallanna Face to Face | Telangana MLC Elections Result 2021 | TV5 News","2021-03-18T13:00:47Z","UCAR3h_9fLV82N2FH4cE4RKw","TV5 News","25","21.19.03","teenmar mallanna|teenmar mallanna q news|q news|q news mallanna|teenmar mallanna morning news|teenmar mallanna interview|telangana mlc election|telangana mlc result|mlc counting|mlc counting telangana|2021|face to face|tv5 face to face|telangana news|teenmaar mallanna|tv5 face to face inteview|telangana political news|telangana live news|tv5 telugu|tv5 telugu live|tv5|tv5 telugu news|tv5 live telugu|tv5 telugu live news|tv5 live|tv5 news","342658","5219","320","448","https://i.ytimg.com/vi/EZ0JZLQER2g/default.jpg","False","False","Teenmar Mallanna Face to Face | Telangana MLC Elections Result 2021 | TV5 NewsTV5 News is Telugu Live news which gives 24 Hours Live News covering politics news, sports news, entertainment news. Channel gives hourly news updates. This is our Telugu Live TV Live Streaming on YouTube which can be accessed from anywhere across the Globe. News Update, Telangana News, Andhra News and live updates about our politicians cm kcr cm jagan chandrababu naidu We have Telugu Live News Website http://www.tv5news.in. You can watch TV5 Live Streaming from our website. On YouTube Watch TV5 Telugu News Online HD.Tv5 News  established its image as one of India's leading credible news channels, and is a preferred channel by an audience which favours high quality programming and news, rather than sensational infotainment.  Subscribe to TV5 News for Latest Happenings and Breaking news from Andhra and Telangana. For More Updates► TV5 News Live : https://goo.gl/UPacax► Subscribe to TV5 News Channel: http://goo.gl/NHJD9►Our Website : http://www.tv5news.in► Like us on Facebook: http://www.facebook.com/tv5newschannel► Follow us on Twitter: https://twitter.com/tv5newsnow► Circle us on TV5 News Channel G+: https://plus.google.com/+tv5newschannel► Follow us on Pinterest: https://www.pinterest.com/tv5newschannel"
"XX6XQlFgLwI","Ghanchakkar | Girlfriend Ke Ghar Rishtey Ki Baat | Awanish Singh","2021-03-18T14:00:02Z","UCPTw_UvDWKCYtWfZQAOi7pg","Awanish Singh","24","21.19.03","awanish singh|avinish|avinash singh|avinash|awanish new video|awnish new video|funny videos|comedy videos|vines|youtube|facebook|instagram|ghanchakkar|ghanchakkar awanish|rishta|girlfriend|couple|bhai behan|funny|comedy|viral|viral videos|awinash|avinash videos|awanish singh presents|youtube videos|india|refreshing video|timepass video|videos for timepass|whitereel|vikee|swatantra rai|awanish singh 2.0|awanish 2.0|girlfriend ke ghar|rishte ki baat|tags","156041","18742","311","945","https://i.ytimg.com/vi/XX6XQlFgLwI/default.jpg","False","False","Follow me also on :-Instagram - https://www.instagram.com/theawanishsinghSnapchat - TheawanishsinghFacebook - https://www.facebook.com/TheAwanishSingh​-----------------------------------------------------------------------Directed By & DP  -  VIKEELink - https://instagram.com/whitereelproduction---------------------------------------------------------------------------------------------------Cast Of The Video :-Awanish SinghAnchal - https://www.instagram.com/anchalmarwaha/​Akshay -Swatantra Rai -Luv -Dhruv Dogra -————————————————————Written By - Subhanshu / Awanish SinghDialogue By - Subhanshu SrisvastavaEdited by - Vivek Rao / Awanish SinghProduced By - Ratan Tata / Bill GatesThumbnail By - Vishal Rana ( Phoenix Production )"
"VfQ0TrJIg90","Babuni Tere Rang Mein | Pawan Singh, Tridha, Sharvi | Dr Sagar | Salim Sulaiman | Merchant Records","2021-03-15T05:30:13Z","UCdDDWwRdgJTgpD4iPtOZRUQ","Salim Sulaiman","10","21.19.03","salim sulaiman|pawan singh|babuni tere rang mein|holi song|pawan singh new song|pawan singh holi song|pawan singh new song 2021|pawan singh ke gana|holi song bhojpuri|pawan singh new holi song|pawan singh bhojpuri song|pawan singh holi|pawan singh hits|pawan singh song|pawan singh songs|pawan singh ka gana|pawan singh hit|tridha choudhury|babuni tere rang me|bhojpuri song|bhojpuri holi song|holi songs|holi song 2021|bhojpuri gana|holi|holi status","9188205","335138","28042","159821","https://i.ytimg.com/vi/VfQ0TrJIg90/default.jpg","False","False","Tayyar ho jaiye iss Holi ka jashn manane ke liye, aapke apne #PawanSingh ke sath! We had so much fun making this video with Pawan Singh and Tridha Chaudhury with beautiful vocals by Pawan Singh and Sharvi Yadav! Apna pyaar dijiye and let's celebrate #Holi2021 in the power-star-Pawan style! ✨ Subscribe now for more music every week!🎧 Listen to & download 'Babuni Tere Rang Mein' on:Wynk: https://wynk.in/music/song/babuni-tere-rang-mein/or_196006272005_ING642100271JioSaavn: https://www.jiosaavn.com/song/babuni-tere-rang-mein/Rx8cfExHY34Spotify: https://open.spotify.com/track/2sPqQdQ2rJZtTdhcymBZSD?si=vWcI_Uj6RdK9nH_TKX_c_AGaana: https://gaana.com/song/babuni-tere-rang-meinResso: https://m.resso.app/ZSJN3Jk64/Hungama: https://www.hungama.com/song/babuni-tere-rang-mein/63302712/Amazon Prime Music: https://music.amazon.in/albums/B08YDCVW7H?trackAsin=B08YDDZ4P7&ref=dm_sh_IQcfo2LLvB4GEnQac1ImmRrLZTo Set Babuni Tere Rang Mein Your Caller Tune: Vodafone Customers Dial 53712379375Idea Customers Dial 53712379375BSNL Customers Dial 5678912379375Audio Credits -Music Composed & Produced by : Salim - SulaimanLyrics : Dr. SagarSingers : Pawan Singh, Sharvi YadavAdditional Music Production : Raj PanditTabla : Navin SharmaDholak : Aslam Dafrani, Navin SharmaBulbul Tarang & Harmonium : Pradeep PanditRecorded by : Aftab Khan & Raj Pandit at Blue Productions Mixed & Mastered by : Aftab Khan at Headroom StudioDistributed by Global Music Junction Video Credits - Starring : Pawan Singh, Tridha ChaudhuryChoreographer & Director : Caesar GonsalvesAssociate Producer : Rajveer Ahuja Executive Producer : Rajesh Chakre Production Head : Tanka Production Assistant : Suraj JanaDOP : Chandan KowliPost Supervisor & Editor : Abhishek WaheeColorist : Dilshad NanjiDI Studio : CoolabmediaProduction Designer : Uday Prakash Singh Art Assistant Director : Vaibhav Art Assistant Director : VivekStylist : Divya and PrameetLocation : Sania resort Pawan Singh's Management & Social Media Promotions : Amit SinghManaged by : Nirav Thakar, Radhika MistryDigital Strategy : Shivansh JindalAlbum Creatives : Dishant MistryPR : Lily AhluwaliaLyrics -Rango ki katori hunTang se chatori hunChahun mai colorful piyaChahat ki tarango meinDoobi hun mai rango meinPink pink mora jiyaGeeli geeli siGeeli geeli meri dhaarAaja dekh le fuhaarPichkaari nahi yeTere love ka shikaarBabuni tere rang meinBabuni tere rang meinMai aur thoda young ho gyaaMai bhola bhaala lallaChappan inch dabangg ho gayaBabuni tere rang meMai aur thoda young ho gayaAntraKulhad mein whiskyToh saiyaan ji hai riskyKulhad mein whiskyToh saiyaan ji hai riskyMaare ignoreMai deewani hui jiskiPeeli peeli hai.. HaayePeeli peeli maine chaarKi hairaan thekedaarMujhko majnu banaakeDe de laila waala pyaarBabuni tere rang meMai aur thoda young ho gayaKheenchein jaise chumbak emotion teraBabuni tere rang meChappan inch dabangg ho gayaNaam saare jille me roshan teraBabuni tere rang mein,Mai aur thoda.. ho gaya!To SUBSCRIBE click the link below:http://www.youtube.com/subscription_center?add_user=SalimSulaimanMusicLike us on Facebook:https://www.facebook.com/salimsulaimanmusicFollow us on Twitter:https://twitter.com/SlimSulaimanFollow Salim Merchant on:Twitter: https://twitter.com/salim_merchant/Instagram: https://www.instagram.com/salimmerchant/Follow Sulaiman Merchant on:Twitter: https://twitter.com/SulaimanInstagram: https://www.instagram.com/sulaiman.merchant/Follow Merchant Records on:Facebook: https://www.facebook.com/MerchantRecordsMusicInstagram: https://www.instagram.com/merchant_records/Twitter: https://twitter.com/MerchantRec#BabuniTereRangMein​ #PawanSingh​ #TridhaChaudhury​ #SharviYadav​ #SalimSulaiman​ #Holi​ #Holi2021"
"i0Z1d3_RJco","Skoda Kushaq - Features, Design, Engines and Launch Timeline","2021-03-18T11:48:56Z","UCSXOsOIzeJqJb4h0QlimDww","MotorOctane","2","21.19.03","motoroctane|motor octane|Skoda kushaq|skoda kushaq most detailed review|skoda kushaq india price|skoda kushaq variants|skoda kushaq colours","278421","14767","245","910","https://i.ytimg.com/vi/i0Z1d3_RJco/default.jpg","False","False","Skoda Kushaq - Most DETAILED WALKAROUND ON THIS NEW SUV. WHAT does it have on offer? We share all the details on it. Car Consultancy Form: https://motoroctane.com/car-consultancyCar Insurance: https://motoroctane.com/insuranceCAR SAFETY STORY: https://forms.gle/M7xLVmys5r8ZyQnN6OWNER'S Car ReviewWant us to review your car/bike? Share your details -https://forms.gle/BAr48SScVUz9igkZ9Follow us on Subscribe us @ YouTube : http://bit.ly/MotorOctaneFacebook: http://www.facebook.com/motoroctaneTwitter: http://www.twitter.com/motoroctaneInstagram: http://www.instagram.com/motoroctaneYouTube: https://www.youtube.com/user/MotorOctaneWebsite: https://motoroctane.com"
"Ize-M8y_JEw","Rishi & Shivani | ENJOY ENJAAMY DANCE CHOREO #trending","2021-03-18T14:38:31Z","UCWB9EGOW6HfcnXTmZr6D1Sw","Rishi K","24","21.19.03","[none]","425467","15657","612","620","https://i.ytimg.com/vi/Ize-M8y_JEw/default.jpg","False","False","DIGITAL PARTNER : Magazine Media Entertainment || ANTI-PIRACY WARNING ||This content is Copyrighted to Rishi K . Any unauthorized reproduction, redistribution or re-upload is strictly prohibited. Legal action will be taken against those who violate the copyright of the same"
"cPhp6e6ZWmE","VIVO IPL 2021 | Dhoni presents #IndiaKaApnaMantra | The Hitman","2021-03-14T13:07:14Z","UCmqfX0S3x0I3uwLkPdpX03w","Star Sports","17","21.19.03","[none]","10514655","457282","11992","11671","https://i.ytimg.com/vi/cPhp6e6ZWmE/default.jpg","False","False","#VIVOIPL salutes the new Indian spirit that is eager to innovate and rewrite the rulebook.Will history be created yet again this IPL?Join us in celebrating #IndiaKaApnaMantra.LIVE from Apr 9 | Broadcast starts 6 PM, Match starts 7:30 PM | Star Sports & Disney+Hotstar VIPFollow us for more on:Facebook: https://www.facebook.com/StarSportsIndia Twitter: https://twitter.com/StarSportsIndiaInstagram: https://www.instagram.com/starsportsindia"
"C-hqPzHpf0w","Tandoori Momos 😋😋#shorts #chinese #food #foodie #foodlover #streetfood #hungry #foodblogger #fire","2021-03-15T09:23:56Z","UCNj5oELNCUlW2ZWip50apdQ","Travel Food and Facts","22","21.19.03","[none]","1441384","6988","2735","802","https://i.ytimg.com/vi/C-hqPzHpf0w/default.jpg","False","False",""
"fs3-MDJsc3w","Nyruh Naithaoruh ll Kau Bru Official Music Video Song 2021 ll Nadu & Sanraj...","2021-03-19T03:18:30Z","UC5Vz0f-DjDEHxf8WYVvq-tQ","T.D - Dola Chongpreng","10","21.19.03","[none]","111990","10084","387","959","https://i.ytimg.com/vi/fs3-MDJsc3w/default.jpg","False","False","This is Official Music Video of this channel.Uploading this video is another channel Without Permission is Strictly prohibited....#Nyruh #Nythaoruh#Kaubru #Offical #Music # Video...          Starring: Nadusha Reang.                          Sanraj Debarma.          Costume & Producer:                             Dola chongpreng.          Direction & Cheoragrapher:.                            Govind Molsoi.          Camera & Editing:                          British Molsoi.          Singers:                          Jewel chongpreng.                         Damudhar Toimoi.          Music:                          Podho Meska .          Recording:                         RBL.          Lyrics & Composed :                         Jewel chongpreng.                         Damudhar Toimoi.          Make up :                          Prince Bru.          Subtitles :                            Rev Zomarai Apetow.                            Jowel chongpreng.          Special thanks:                          Chainlahphru Mog.                          Baspi Debarma.                           Biki Debarma.                           Rabi Sharma.          THANKS FOR WATCHING..🙏🏽🙏🏽🙏🏽🙏🏽🙏🏽....."
"NOG0LycqMhc","Happy Birthday Raistar |  Raistar Hai Kiya? Face Reveal Agar Tu Hota Sm Hota | Garena Free Fire","2021-03-18T01:30:03Z","UChXi_PlJkRMPYFQBOJ3MpxA","Gyan Gaming","20","21.19.03","[none]","2764130","472491","5030","33125","https://i.ytimg.com/vi/NOG0LycqMhc/default.jpg","False","False","Happy Birthday Raistar |  Raistar Hai Kiya? Face Reveal Agar Tu Hota Sm Hota | Garena Free Fire"
"ddCRTBR4kTQ","JHAGDALU PATNI AUR GARIB KI HOLI || Holi Special Maha Episode ||  Ajay Chauhan","2021-03-17T03:04:22Z","UCMmHfwNsk0QUe0jhv5zTAFQ","Ajay Chauhan","24","21.19.03","[none]","2077818","16416","5165","674","https://i.ytimg.com/vi/ddCRTBR4kTQ/default.jpg","False","False","like share and subscribe"
"IsGZB8yWNvs","Aloo Finger Indian street food #shorts","2021-03-15T04:56:35Z","UCOOf_MBxOTjw5a-KNjgPCTw","Nk Foodie","22","21.19.03","Indian street food|street food|street food india|street food around the world|aloo fingers|nagpur street food|street food of india|nadda kabab|potato fingers|Aloo finger|Mumbai street food|delhi street food|#Shorts|#youtubeshorts|food street","2579111","18058","3268","803","https://i.ytimg.com/vi/IsGZB8yWNvs/default.jpg","False","False","Hello guys welcome Again to my channel NK foodieAnd Also welcome to my new video!!Hope you guys like this videoPlease like share and subscribe To my channelThanks for Support Till now! And keep supporting Further!Todays Dish:- Dahi FingerPrice :- ₹20Place:- Nagpur near drink n dream shopFollow me on InstagramLink https://instagram.com/food_factory_2021?igshid=1iv14dve5icephttps://www.instagram.com/reel/CLcGtXBHRun/?igshid=z87u9h392j63#Trending on 13Tags:-Indian street foodStreet foodStreet food indiaStreet food around the worldnagpur street food,nadda kabab,nadda kabab recipe,nadda kabab nagpur,potato fingers,aloo finger chips,potato finger recipe,aloo fingers,aloo fingers recipe,aloo fingers chaat"
"_0Mjssdnzi8","Why do punching makes your hand stronger? | Unnoticed#2.1 | LMES","2021-03-18T13:30:05Z","UCNwcxhfBVDgwx9Lv3CBpu6A","Let's Make Education Simple","28","21.19.03","lmes|science videos in tamil|engineering videos in tamil|lets make education simple|lets make engineering simple|premanand sethurajan|maths videos in tamil|tamil educational videos|school subject videos in tamil|chitti learning app|chitti the smart learning app|jee videos in tamil|neet videos in tamil|biology videos in tamil|school syllabus in tamil|+2 videos in tamil|unoticed|unnoticed lmes|lmes in tamil","145085","10257","156","600","https://i.ytimg.com/vi/_0Mjssdnzi8/default.jpg","False","False","Chitti Super Learners 2 DAYS WORKSHOP for Class 1 -10 students who are struggling with maths & science by Mr.Premanad SethurajanClick the link to Register Now👇http://bit.ly/ChittiworkshopBATCH - I starts on 20th & 21st Mar 2021*LIMITED SEATS are only available*___________________________________________________________________________Help LMES to Produce more videos: http://lmes.in/donate​Email: support@lmes.inHelp underprivileged students to complete their college education, Support at https://lmesfoundation.com---------------------------------------------------------------------------------------------------------------------------Download  Chitti Classes - Learning app for K-12 studentsGoogle Playstore - http://bit.ly/ChittiClasses-AndroidApple Store - http://bit.ly/ChittiClasses-AppleLMES always has a vision to bring a revolution in the education system of our country and each student should enjoy the process of learning. To accomplish the mission, we created an application for school students named as Chitti Classes through which students can learn the basic concepts in their curriculum connected with real-time experiments and animations.Install the app and experience the new fun way of learning:)Mobile number:- +91 9599 162163Email id:-  support@chitti.app► YouTube → http://bit.ly/ChittiYT► Facebook → http://bit.ly/ChittiFacebookPage► Instagram → http://bit.ly/Chitti_instagram"
