video_id,title,publishedAt,channelId,channelTitle,categoryId,trending_date,tags,view_count,likes,dislikes,comment_count,thumbnail_link,comments_disabled,ratings_disabled,description
"kyR2ScSZUPs","КУПИЛ себе НОВУЮ МАШИНУ - УАЗ Патриот","2021-05-12T16:16:21Z","UC9diVCDUnRAB3buT1vLn4-w","FROST","24","21.13.05","Уаз патриот|купил уа патриот|моя новая машина|купил себе новую машину|машина фроста|уаз патриот 2021|Уаз патриот обзор|уаз|плюсы и минусы|обзор|купил патриот|купил уаз|uaz patriot|уаз patriot|Что стало|сыпется|обзор на машину|оффроад|фрост|frost|yfrosta|новая машина|новая машина фроста|внедорожник|патриот|уаз патриот","206401","31599","443","1862","https://i.ytimg.com/vi/kyR2ScSZUPs/default.jpg","False","False","Я придумал один очень экстравагантный проект на основе УАЗ патриот) Ну вот и купил себе Уазик! На сколько хорош патриот? Плюсы и минусы автомобиля, все разберем и покажем. Встречайте обзор на новую машину Фроста.Подписывайся, что бы не проспать следующую серию - https://www.youtube.com/user/YFrostA?sub_confirmation=1Обзор на Мой Джип Гранд Чероки - https://youtu.be/XWGHBY37sFcИгровой Канал - https://www.youtube.com/channel/UCkwO1hL7RFeeoMPd-pzewUA?sub_confirmation=1Мой ТИК ТОК - https://www.tiktok.com/@yuriifrost?lang=ruМоя Инста - https://www.instagram.com/frost_yt/ # Самый КЛАССНЫЙ магазин ИГР - https://froststore.ru/КЛАССНЫЙ МЕРЧ - https://www.bloggerstore.ru/frostРЕКОМЕНДУЮ ПОСМОТРЕТЬПовторяю Сложные Спортивные Трюки из ТТ - https://youtu.be/Z7lXeq9Xvb8Рыболовный ВЛОГ - https://youtu.be/TXZa3lWo51E24 часа на катере - https://youtu.be/fZQFtaI5ATcДЕЛОВЫЕ ПРЕДЛОЖЕНИЯ frost@blogo-sphere.com"
"CalvGYerC4Y","Казанский стрелок / Важное видео! / Ответы на ваши вопросы","2021-05-12T16:40:16Z","UCg0Y6Q0m3A_5X0CPY-IG3Yg","Психолог Вероника Степанова","22","21.13.05","казанский стрелок|Ильназ Галявиев|терракт|психология|псих|психопат|казань|терракт в казани|стрельба в казани|стрельба в школе|психотерапия|психоанализ|вероника степанова|психолог|психотерапевт|психология личности|психология жизни|психология отношений|вопросы психологу|степанова вероника|психологическая помощь|отношения|самопознание|детский психолог|психика|невроз|психоз|шизофрения|отношения в паре|саморазвитие|самосовершенствование|самоанализ|здоровье|жизнь|любовь","209218","11605","732","1927","https://i.ytimg.com/vi/CalvGYerC4Y/default.jpg","False","False","Ответы на ваши актуальные вопросы!Таймкоды:00:21 Казанский стрелок: что самое главное упустили?03:16 Что делать, если дрожит голос и трясется голова во время спора? Как прекратить тремор и заикание?04:30 Что не так с мужчиной, у которого было очень много женщин?06:03 Мне не нравится, что мама и бабушка смотрят мой Инстаграм, как быть?07:03 Квартирный вопрос: как перестать жить с родителями мужа?07:52 Стоит ли верить в приметы? Почему суеверия сбываются?08:58 Что делать, если начальник видит во мне конкурента и старается приглушить?10:29 Потрясающе интересное чтиво!10:51 Почему я хочу заболеть раком?13:10 Как себя вести, если твоя семья тебя стыдится?13:50 Мне 30 и я девственница! Почему так?14:24 Как стать навеки популярным музыкантом?14:34 Во сколько лет ребенка с СДВГ отдавать в школу?15:16 Прививалась ли я от короновируса?15:42 Самый неловкий сеанс психотерапии в моей жизни!Сайт Вероники Степановой с полезными книгами и видео-уроками https://veronikastepanova.com/​​​​​Телеграмм https://t.me/veronikastepanova20011​​​​​ Ваша реклама в моих социальных сетях❣️ Пишите на 📩 crem318@gmail.com#психология​​​​ #психотерапия​​​​ #психолог​​"
"zOTcSAN2RXM","24 ЧАСА ПИТАЮСЬ как МАЙК ТАЙСОН! Рацион ЛЕГЕНДЫ БОКСА","2021-05-13T10:00:17Z","UCJsOVd61dzow401WI1hR-kg","Алексей Столяров","17","21.13.05","24 ЧАСА ПИТАЮСЬ как МАЙК ТАЙСОН! Рацион ЛЕГЕНДЫ БОКСА|24 ЧАСА ПИТАЮСЬ как МАЙК ТАЙСОН|ПИТАЮСЬ как МАЙК ТАЙСОН|24 ЧАСА ПИТАЮСЬ как|рацион ЛЕГЕНДЫ БОКСА|24 часа питаюсь как майк тайсон|24 часа питаюсь как|24 часа питаюсь|24 часа|майк тайсон|рацион легенды бокса|легенда бокса|бокс|тайсон|24 питаюсь как майк тайсон|спорт|рацион|питание на массу|питание|майк тайсон лучшее|mike tyson|железный майк тайсон|майк тайсон мотивация|майк тайсон видео","158781","14439","213","1546","https://i.ytimg.com/vi/zOTcSAN2RXM/default.jpg","False","False","В новом ролике я решила повторить рацион ЛЕГЕНДЫ БОКСА и 24 ЧАСА ПИТАЮСЬ как МАЙК ТАЙСОН! Тайсон один из самых именитых боксёров, с очень интересной судьбой.Как ТАЙСОНУ удалось ПОХУДЕТЬ со 130 кг до 90, чем он питался и как тренировался, я расскажу в этом ролике. Выдержал ли я тренировки, осилил ли РАЦИОН ТАЙСОНА, что я могу в БОКСЕ — смотри в видео «24 часа питаюсь как Майк Тайсон»!24 ЧАСА ПИТАЮСЬ как МАЙК ТАЙСОН! Рацион ЛЕГЕНДЫ БОКСА►Лера: https://instagram.com/rodionovavm►Никита: https://instagram.com/nikita_kasyanov_1►Myprotein - https://bit.ly/2McrjWt​​​​ ( МАСКСИМАЛЬНАЯ СКИДКА) ПРОМОКОД STOLIAROV►Подписаться на мой канал: https://goo.gl/YrWVRv​​​​►Мой Инстаграм: https://www.instagram.com/stoliaroval...​►Наш сайт: https://eazy-way.com/​​​​►Реклама, сотрудничество:  stolyarov@wildjam.ru"
"rjzouavXZ4w","Мутный вписался в блудень и ПРОПАЛ!","2021-05-12T15:00:18Z","UCBTaUsMpT9tARr4uiZAONXQ","НЕЗАВИСИМЫЙ ЭКСПЕРТ CH2","22","21.13.05","мысли|влух|независимый|эксперт","162351","9398","250","375","https://i.ytimg.com/vi/rjzouavXZ4w/default.jpg","False","False","Георгий Александрович В TikTok https://vm.tiktok.com/ZSJktE98Q/Независимый Эксперт https://clck.ru/FXaMtТехник Теоретик https://clck.ru/MzgmHНадо Делать https://clck.ru/TtNYmНезависимый Эксперт СН2 https://clck.ru/Mzgk8Досье G https://clck.ru/TtNg3Мутные Будни https://clck.ru/TtNbAИнстаграмм:Надо Делать @maer77711Независимый Эксперт @georg_medvedevТехник Теоретик @taras.marinichМутные Будни @feofan_mutnoi📬 По  вопросам рекламы: info.pr@lpspb.ru📬 Личная почта: georgmedvedev@mail.ru📌Для заказа худи пишите на почту нашему менеджеру:shop.exp@mail.ru"
"x10dpaz668o","Галявиева мучили головные боли: детали допроса и первые выводы следствия - Россия 24","2021-05-12T19:50:04Z","UC_IEcnNeHc_bwd92Ber-lew","Россия 24","25","21.13.05","marked|Вести|Казань|Культовые программы|Россия|выпуски Вестей новости передача политика убийцароссия 24|последние новости|последние события|актуальные события|россия 1|вести 24|тв|телевидение|новости мира|общество|информация|событие","719861","8174","463","3397","https://i.ytimg.com/vi/x10dpaz668o/default.jpg","False","False","СМОТРИМ В HD ТУТ 👉 - https://smotrim.ru/vesti/?utm_source=youtube&utm_medium=all&utm_campaign=all_0Подпишитесь на канал Россия24: https://www.youtube.com/c/russia24tv?sub_confirmation=1Ильназ Галявиев арестован на два месяца, вплоть до 11 июля. Убийца семи школьников и двух учителей будет содержаться в следственном изоляторе №1 в Казани.Приступы агрессии у молодого человека появились несколько месяцев назад. Примерно в это время он ссорится с семьей и идет к врачам.Последние новости России и мира, политика, экономика, бизнес, курсы валют, культура, технологии, спорт, интервью, специальные репортажи, происшествия и многое другое.#Россия24 #Вести #НовостиОфициальный YouTube канал ВГТРК. Россия 24 - это единственный российский информационный канал, вещающий 24 часа в сутки. Мировые новости и новости регионов России. Экономическая аналитика и интервью с влиятельнейшими персонами. Смотрите также:Вести недели с Дмитрием Киселевым - https://www.youtube.com/playlist?list=PLLHjKKyQ4OaTpipoWQNR1ya5zp19Gc4ZBВести в субботу с Сергеем Брилевым - https://www.youtube.com/playlist?list=PL6MnxjOjSRsQAPpOhH0l_GTegWckbTIB4 Воскресный вечер с Владимиром Соловьевым - https://www.youtube.com/playlist?list=PLwJvP0lZee7zYMGBmzUqNn16P71vHzgkU60 минут - https://www.youtube.com/channel/UCR16nHT1nkmG7g9AkE9tGeQ?sub_confirmation=1Новости в прямом эфире - https://www.youtube.com/playlist?list=PLLHjKKyQ4OaQ73BA1ECZR916u5EI6DnEEМеждународное обозрение - https://www.youtube.com/playlist?list=PLLHjKKyQ4OaSEmz_g88P4pjTgoDzVwfP7Специальный репортаж - https://www.youtube.com/playlist?list=PLLHjKKyQ4OaQLdG0uLyM27FhyBi6J0IkfИнтервью - https://www.youtube.com/playlist?list=PLLHjKKyQ4OaReDfS4-5gJqluKn-BGo3JsФакты - https://www.youtube.com/playlist?list=PLLHjKKyQ4OaR4eBu2aWmjknIzXn2hPX4cМнение - https://www.youtube.com/playlist?list=PLLHjKKyQ4OaST71OImm-f_kc-4G9pJtSGРоссия и мир в цифрах - https://www.youtube.com/playlist?list=PLLHjKKyQ4OaRx4uhDdyX5NhSy5aeTMcc4"
"tRCpuEulzk8","Конфликт с Соболевым. Лапенко - несмешной? Уход из Камеди / 50 вопросов Смирняге и Бандерасу","2021-05-12T07:58:49Z","UCKgNnp6G0dlwTS1eR4-77yQ","Макарена","22","21.13.05","смирняга|бандерас|алексей смирнов|антон иванов|камеди|камеди клаб смирняга и бандерас|камеди клаб|дуэт быдло|50 вопросов|макарена|makarena|карен адамян|адамян|лапенко|щербаков|интервью|авто|камеди смирняга и бандерас|смирняга интервью|камеди клаб интервью|харламов|юмор|что было дальше|тнт|labelcom|илья соболев|соболев|макарена интервью|интервью 50 вопросов|стендап|чбд|антон лапенко|внутри лапенко","288149","7992","313","478","https://i.ytimg.com/vi/tRCpuEulzk8/default.jpg","False","False","Попробуйте себя в роли диджитал-маркетолога: https://netolo.gy/gxfСкидка 40% на обучение в Нетологии по промокоду МАКАРЕНА до 12.06.2021Создай домашний кинотеатр с Cinemood. Скидка 3000 руб. промокод МАКАРЕНА https://cinemood.ru/?utm_source=youtube&utm_medium=bloger&utm_campaign=makarenaАлексей Смирнов и Антон Иванов - они же просто Смирняга и Бандерас - новые герои шоу 50 вопросов Карена Адамяна. Знаменитый дуэт Быдло, работа в Камеди, как Смирняга жил с Харламовым, а потом занялся сериалом с Лапенко. Реакция Бандераса на конфликт Смирняги с Ильей Соболевым и его уход из Камеди. 2 часа с очень приятными гостями - в новом выпуске. Приятного просмотра. Нажмите на кнопку подписаться.Инстаграм Карен Адамян https://www.instagram.com/adamyan27Инстаграм Смирняга https://www.instagram.com/alesha_smirnovИнстаграм Бандерас https://www.instagram.com/banderas_spb#Смирняга #Бандерас #50вопросовТайм-коды:0:00 - Смирняга и Бандерас. 50 вопросов1:20 - уход Смирняги из Камеди5:34 - жесткий пранк над другом8:18 - как стать профи в своей сфере?10:17 - Питер – столица расчлененки. Почему11:59 - работа Смирнова в солярии и первые гонорары15:22 - священник прервал выступление на корпоративе банка23:14 - лучший домашний кинотеатр 25:28 - Зенит vs BLM 28:31 - самый смешной в Камеди 30:54 - какие юмористические шоу смотрят?33:18 - как познакомились с Лапенко?36:20 - бывший дом Бандераса, который входит в топ 20 самых красивых домов Петербурга 42:26 - Бандерас работал в МЧС и спасал людей45:53 - «Долго не могли попасть в Камеди»47:23 - Сложно в Камеди после ухода Смирняги?50:55 - заработок в Камеди. Где яхты, особняки и спорткары?52:49 - конфликт с Ильей Соболевым58:07 - Смирнов жил у Харламова в детской и делал совместную передачу1:01:11 - «Внутри Лапенко» – не комедийный сериал?1:07:49 - Антон Лапенко – большой актёр?1:09:46 - пародия Щербакова - хороша?1:15:14 - первые выступления1:17:21 - случайно увидели в порно общую знакомую 1:20:40 - сколько денег заработали на сериале?1:24:43 - стендап-клуб Смирняги1:29:57 - почему Павел Воля ведет все шоу на ТНТ?1:31:25 - лучшее место на планете1:36:18 - новые тренды в юморе – ЧБД и стендап1:39:30 - зритель блеванул на концерте1:44:05 - Бандерос целовался с парнем и развёл девушку на копро1:47:50 - про счастье1:49:15 - последняя философская мысль, над которой размышляли1:51:55 - MVP планеты Земля"
"RMPgo2Nq0BA","За Николаем Платошкиным домой приехал сотрудник ФСИН","2021-05-12T09:29:43Z","UCNvO3ZSSIXBPgecci3vZsjw","Рупор Москвы","25","21.13.05","Канал Рупор Москвы|Рупор Москвы|в москве|гагаринский суд платошкин|за новый социализм|москва|николай платошкин|николай платошкин сегодня|платошкин|платошкин сегодня|платошкин суд сегодня|сотрудник фсин платошкин|суд над николаем платошкиным|суд над пдатошкиным|суд николай платошуин сейчас|фсин приехал к платошкину|фсин у николая платошкина|фсин у платошкина","322452","16999","384","4768","https://i.ytimg.com/vi/RMPgo2Nq0BA/default.jpg","False","False","За Николаем Платошкиным домой приехал сотрудник ФСИН.❗️Стать спонсором - https://www.youtube.com/channel/UCNvO3ZSSIXBPgecci3vZsjw/joinПоддержать финансами проект «Рупор Москвы»:Карта Сбербанка - 5469380065259995QIWI.Donate - https://donate.qiwi.com/payin/RUPORMOSCOWЯндекс.Деньги - 410013586382566PayPal - rupordonation@gmail.comWebmoney R - R198688371987Bitcoin - 1AJJCS1D7bqnrDiqCX6BTC8NmbqE8BE7HaBitcoin Cash - qqatxpdu3k89gjyjj2808z73d9hcy879c54h4pkqyaEther - 0xE358EC6f52B89be1596B9E35e39C6bdF61e274D3Разные платежные системы - http://www.donationalerts.ru/r/rupormoscowСайт: https://rupormoscow.ruМы в социальных сетях:Facebook - https://goo.gl/aM2N3cВконтакте - https://goo.gl/3ENJf7Одноклассники - https://goo.gl/Hn87QuInstagram - https://goo.gl/NdmKhpTwitter - https://goo.gl/CpDqEePeriscope - https://goo.gl/ciXSvzTelegram - https://goo.gl/UcsyxN#Платошкин #Суд #ФСИН #Москва #Гагаринскийсуд #12мая"
"ytIwnaRijJg","А вот эти автомобильные хитрости стоит запомнить!!","2021-05-12T06:32:46Z","UCRFMpg5Q3Fko_Wdxh08yZ_g","Denis МЕХАНИК","2","21.13.05","Денис механик|механик|авто|лайфхаки|хитрости|полезные советы|ваз|лада|калина|автосервис|гараж|ремонт авто|доработки","181992","15464","905","754","https://i.ytimg.com/vi/ytIwnaRijJg/default.jpg","False","False","Качай Номерограм:https://nomerogram.ru/s/YdV  Пробивай K696PO98 и смотри анонс новой серии!Еще лайфхаки: https://youtu.be/G0xWBJaHGtEМой 2й КАНАЛ  https://www.youtube.com/channel/UC6rJlbPrc07AnG4BYlciPoAProduction Music courtesy of Epidemic Sound www.epidemicsound.comДля коммерческих запросов: Denis.avtoservis@gmail.com"
"dfqFD85mnEg","Стрельба в Казани: похороны погибших, у Галявиева диагностировано заболевание мозга","2021-05-12T13:27:19Z","UCdubelOloxR3wzwJG9x8YqQ","Телеканал Дождь","25","21.13.05","казань|стрельба|школа|стрельба в казани|стрельба в школе|175|школа 175|школа 175 казань|шутинг|Ильназ Галявиев|галявиев|дождь|телеканал дождь|прямой эфир|телеканал дождь прямой эфир|стрельба казань школа|татарстан|татарстан стрельба|фсб|спецслужбы","904284","13748","1317","5477","https://i.ytimg.com/vi/dfqFD85mnEg/default.jpg","False","False","В Казани завершились похороны семерых детей и двух взрослых, погибших при стрельбе в гимназии №175. Троих детей похоронили на мусульманском кладбище. Как сообщал корреспондент Дождя, на Самосыровском кладбище состоялось прощание с 26-летней учительницей английского языка Эльвирой Игнатьевой и учительницей начальных классов Венерой Айзатовой. Ранее власти Татарстана объявили 12 мая днем траура и взяли на себя организацию похорон погибших при стрельбе в школе.У 19-летнего Ильназа Галявиева, устроившего стрельбу в казанской школе, еще в прошлом году было диагностировано «заболевание головного мозга». Об этом говорится в сообщении Следственного комитета.Поддержите нашу работу и станьте спонсором канала в ютубе: https://www.youtube.com/channel/UCdubelOloxR3wzwJG9x8YqQ/joinПодписывайтесь на Дождь - https://www.youtube.com/user/tvrainru​Официальный сайт Дождя - http://tvrain.ruFacebook - https://www.facebook.com/tvrain​Twitter - https://twitter.com/tvrain​Telegram - https://t.me/tvrain​Instagram - https://www.instagram.com/tvrainВКонтакте - https://vk.com/tvrain​Одноклассники - https://ok.ru/tvrain#казань #школа #дождь"
"2K_PgnxVUaE","Сестра против сестры. Мужское / Женское. Выпуск от 12.05.2021","2021-05-12T18:02:11Z","UCX9-cJy8dZWDI8hCnmahuLA","Первый канал","29","21.13.05","Семья|помощь|родители|семья|брак|дети|любовь|измена|дружба|предательство|горе|радость|наследство|сестра|мать|дом|конфликт|rutube|мужское женское|2021","764462","4529","643","1203","https://i.ytimg.com/vi/2K_PgnxVUaE/default.jpg","False","False","Вот уже год родные сестры и брат не могут поделить многомиллионное наследство. Особняк в Самарской области, в котором выросли Ирина, Надежда и Евгений, после смерти матери было решено оформить на Ирину, а деньги от продажи разделить на всех. Но после того, как наследство было оформлено, Ирина решила с родственниками не делиться. Между некогда родными людьми началась война за дом стоимостью 3 млн рублей. Точку в этом деле должен был поставить отчим наследников, который знал последнюю волю своей жены, но он был зверски убит накануне судебного заседания. Надежда и Евгений уверены: их сестра со своим мужем причастны и к этому преступлению. В студии «Мужское / Женское» собрались все участники этой некогда дружной семьи, чтобы выяснить, кому достанется наследство."
