video_id,title,publishedAt,channelId,channelTitle,categoryId,trending_date,tags,view_count,likes,dislikes,comment_count,thumbnail_link,comments_disabled,ratings_disabled,description
"PJD7YnBZ5kw","MARJANEYA - Neha Kakkar | Rubina Dilaik & Abhinav Shukla | Anshul Garg | Babbu | Rajat Nagpal","2021-03-18T05:30:03Z","UCLtNvbkqea8wN_kGtfgx_Mw","Desi Music Factory","10","21.19.03","tony kakkar|neha kakkar|sonu kakkar|music|song|desi music factory|Biggboss|Biggboss14|Rubina Dilaik|Rubina new song|Neha Kakkar new song|Abhinav new song|Tony Kakkar new song|Karan aujla new song","14733438","920750","43371","146274","https://i.ytimg.com/vi/PJD7YnBZ5kw/default.jpg","False","False","Anshul Garg presents Marjaneya by Neha Kakkar ft. Abhinav Shukla & Rubina Dilaik.Stream the full song here:Gaana: https://gaana.com/song/marjaneya-1Spotify: https://open.spotify.com/track/0fZJoLBwD8ja2Hg8tCPImu?si=Uv0zhihaQxSy2b2MoZZMDw&utm_source=whatsappResso: https://m.resso.app/ZSJFqrpMU/Amazon Prime Music: https://music.amazon.in/albums/B08YRX4PXF?trackAsin=B08YRS4527&ref=dm_sh_6HS1cMPokCQvtnYV400KSmPIOJioSaavn: https://www.saavn.com/s/song/punjabi/Marjaneya/Marjaneya/Ii0seC5oRX4?referrer=svn_source=share&svn_medium=com.whatsapp&utm_source=share&utm_medium=com.whatsappApple Music: https://music.apple.com/in/album/marjaneya-single/1558134197?at=1l3v9Tx&uo=4&app=itunesYouTube Music: https://music.youtube.com/watch?v=rmc8ijIKpxY&feature=shareSinger - Neha KakkarMusic - Rajat NagpalLyrics - BabbuMusic arranged & produced by Rajat Nagpal Guitars Shomu Seal Recorded @ Studio 504 by Rahul Sharma Assist by Samir DharapFeaturing - Abhinav Shukla & Rubina DilaikProducer - Anshul GargVideo Director - Rajan Bir Video Supervisor - Raghav SharmaCo-Director - Anmol Randhawa Dop - Shinda SinghProject Manager - Piyush ChandakChoreographer - Sumit Kumar Assistant Choreographer- Robin SinghEditor - Gaurav K Mehra Di - Onkar VFX - Prathmesh Chaukekar​ ,Prathmesh Sampada Parab Art Director - Karma Art Studio Jimmy Jib - Manish AroraProduction - Fateh Film ProductionAbhinav Shukla & Rubina Dilaik Stylist - Ashna Makhijani ShahNeha's team:Styled by - Outro  By Akshita & AnulikaMake-up - Ritika VatsHair by - Rita ShuklaPhoto by - Piyush MehraArtwork - Vicky SandhuDistribution - Believe DigitalPromotions - Underdog DigitalLyrics -Karda rahen ignore ve mainuLabhgyi lagda hor ve tenuJe tu pyar naal rakhna hi nahi Fer tu vapis tor ve mainuIk paasa karde yaar.. Asi tere nahi rehnaMarjaaneya tu hun nahi karda pyar..Asi tere nahi rehnaTethon ramdev ton ve routine nahi chadya jandaTu reliance chalauna hain..Tethon time nai kadhya jandaTethon ramdev ton ve routine nahi chadya jandaTu reliance chalauna hain..Tethon time nai kadhya jandaKade bahr lajaKoi film dikhaKade pyar naalKoi gal sunaaBanya rehnaa talwar asi tere nai rehnaMarjaneyaTu hun nahi karda pyar asi tere nai rehnaKoi labh lyi hou chudail Chakkar koi paaya lagdaSade pichon ve muuhKaala karvaaya lagdaKoi labh lyi hou chudail Chakkar koi paaya lagdaSade pichon ve muuhKaala karvaaya lagdaSanu milna nahi Milauna nahiBabbu je pyarJatauna nahiKi pauna fer achaar Asi tere nahi rehnaMarhanevalaTu hun nahi karda pyar asi tere nai rehna#NehaKakkar #RubinaDilaik #AbhinavShukla"
"PTpimuHzlvE","#Uppena - Jala Jala Jalapaatham Full Video Song | Panja Vaisshnav Tej,Krithi Shetty| Buchi Babu| DSP","2021-03-18T12:30:00Z","UCNApqoVYJbYSrni4YsbXzyQ","Aditya Music","10","21.19.03","jala jala jalapaatham nuvvu lyrical video|jala jala jalapaatham song|jala jala jalapaatham video song|uppena jala jala jalapaatham song|uppena movie songs|jala jala jalapaatam nuvvu video song|jala jala jalapaatham|uppena video songs|jala jala jalapaatham nuvvu full video song|jala jala jalapaatham nuvvu video song|jala jala jala patham nuvvu video song|latest telugu songs|jala jal uppena songs uppena songs|Panja Vaisshnav Tej|Krithi Shetty Buchi Babu|DSP","7937854","255395","7639","7362","https://i.ytimg.com/vi/PTpimuHzlvE/default.jpg","False","False","Watch & Enjoy #JalaJalaJalapaatham Full Video Song From Uppena Telugu Movie#DeviSriPrasad #PanjaVaisshnavTej #KrithiShetty #VijaySethupathiAudio also available on:spotifyindia► http://spoti.fi/39xWp7pgaana► http://bit.ly/3crPjD8AppleMusic► http://apple.co/3cpB3LjResso► https://bit.ly/3tcO5llJioSaavn► http://bit.ly/2MD51k6AmazonMusicIN► https://amzn.to/2MdSaVTWynkMusic► http://bit.ly/3aiMTEpSong : Jala Jala JalapaathamSingers:  Jaspreet Jasz & Shreya Ghoshal Lyrics: SreemaniCast: Panja Vaisshnav Tej, Vijay Sethupathi, Krithi ShettyWritten & Directed by: Buchi Babu SanaCinematography: Shamdat SainudeenMusic director: Devi Sri PrasadEditor: Naveen NooliArt Director: Mounika RamakrishnaFights: VenkatChoreogrpahy : Brinda, Prem RakshitVFX Supervisor: YugandharExecutive Producers: Anil Y, Ashok BCEO: CherryPresented by SukumarProducers: Naveen Yerneni, Y Ravi ShankarBanners: Mythri Movie Makers, Sukumar WritingsMusiciansKeyboards: KPRhythm: KalyanSolo Violin: BalajiFlute: Kiran KumarChorus: Deepti, Veena, Haripriya, Shenbagaraj, Deepak, Narayana & HariLive Strings conducted by J Chittey Prakash Rao,Strings performed by CMU Orchestra, ChennaiAlbum Mixed & Mastered by A. Uday Kumar @ “Brindavan–The Garden Of Music”Album Recorded by A. Uday Kumar, T. Uday Kumar & Suresh Kumar Taddi.Orchestra In-Charge: MuruganStudio Asst: Pugalendhi, Raja & DhinakaranAlbum Co-ordinator: B. Manikandan------------------------------------------------------------------------------------------Enjoy and stay connected with us!!►Subscribe us on Youtube: http://bit.ly/adityamusic►Like us on Facebook: http://www.facebook.com/adityamusic►Follow us on Twitter: http://www.twitter.com/adityamusic►Follow us on Instagram: https://www.instagram.com/adityamusicindia►Follow us on LinkedIn: http://bit.ly/2Pp6ze3SUBSCRIBE Aditya Music Channels for unlimited entertainment:►For New Movies in HD: http://www.youtube.com/Adityamovies►For Songs with Lyrics: https://www.youtube.com/AdityaMusic►For Devotional Songs: http://www.youtube.com/AdityaDevotional►For Kids Educational: http://www.youtube.com/AdityaKids→మా పాట మీ నోట Telugu Lyrical Songs - http://bit.ly/1B2EcJG→Latest Tollywood Lyric Video Songs - http://bit.ly/1Km97mg→Ever Green Classics - https://goo.gl/1fZEDy→Popular Jukeboxes - https://goo.gl/LNvAIo→Telugu Songs with Lyrics - https://goo.gl/7ZmgWT© 2020 Aditya Music India Pvt. Ltd."
"bt3EgOdIvA8","Unacademy RSWS Cricket Semi Final 1 | India Legends Vs West Indies Legends | Full Match Highlights","2021-03-18T01:00:12Z","UCFHhFwEdsLs2wuvh1YdChHw","Voot","17","21.19.03","Road Safety World Series|RSWS|RSWS on Voot|India Legends|West Indies Legends|Sachin Tendulkar|Brian Lara","6767666","100864","6545","5010","https://i.ytimg.com/vi/bt3EgOdIvA8/default.jpg","False","False","It's Tendular Vs Lara and it's a fight for a place in the final! Catch all the action on Voot - https://voot.onelink.me/eIb4/88673b6dTo watch the live match for free, download the Voot App now!Road Safety World Series is a Twenty20 extravaganza in association with the Road Safety Cell, Government of Maharashtra! 6 Nations, 15 Matches - Who will win it all?#UnacademyRoadSafetyWorldSeries #BattleOfTheLegends #RoadSafetyWorldSeriesOnVoot #RSWS #Unacademy #Cricket #T20 #Voot #ColorsCineplex #UnacademyAskTheExpert #LetsCrackIt #IndiaLegends #WestIndiesLegends #SachinTendulkar #VirenderSehwag #BrianLaraIndia Legends Squad : Sachin Tendulkar (C), Virender Sehwag, Yuvraj Singh, Mohammed Kaif, Zaheer Khan, Pragyan Ojha, Noel David, Munaf Patel, Irfan Pathan, Manpreet Gony, Yusuf Pathan, Ashok Dinda, Naman OjhaWest Indies Legends Squad : Brian Lara (C), Pedro Collins, Ridley Jacobs, Danza Hyatt, Tino Best, Sulieman Benn, Dinanath Ramnarine, Renford Pinnock, Mahendra Nagamootoo, Adam Sanford, Carl Hooper, Dwayne Smith, Ryan Austin, William PerkinsiFollow us on:Facebook: https://www.facebook.com/VootInstagram: https://www.instagram.com/voot/"
"04ZX8SaKwRg","Setting Ki Dawat | the mridul | Pragati | Nitin","2021-03-18T12:30:00Z","UC0zXnLIFedO97pFsyMxZcFg","The MriDul","23","21.19.03","the mridul|the mridul new video|pragati|pragati comedy video|nitin mridul|mridul nitin video|nitin mridul comedy video|mirdul nitin comedy|new comedy video","3376111","165604","6739","9547","https://i.ytimg.com/vi/04ZX8SaKwRg/default.jpg","False","False","Hello Doston 👋🏻😊🌸🌺Follow MriDul on instagram ~ https://www.instagram.com/themridul_/Follow Nitin on instagram ~ https://www.instagram.com/i.am.nitin_/ Setting ki dawat | the mridul | Pragati | NitinPLEASE SUBSCRIBE 🥰Cast ~ MriDul, Nitin, Ujjwal, Aarav, Prashant, pari.  camera & Editing ~ Maan gujjar Script ~ The MriDulThumbnail - Vishal Rana ( Phoenix )the mridul new videothe mridulpragatischool videoPragati new videoThnkew for watching 🙏🏻😊😍🌺🌸"
"kpbyRh32mH8","Unacademy RSWS Cricket Semi Final 1 | India Legends Vs West Indies Legends | Final Overs | #RSWS","2021-03-18T00:30:03Z","UCFHhFwEdsLs2wuvh1YdChHw","Voot","17","21.19.03","Road Safety World Series|RSWS|RSWS on Voot|India Legends|West Indies Legends|Sachin Tendulkar|Brian Lara","6271900","107768","5034","2882","https://i.ytimg.com/vi/kpbyRh32mH8/default.jpg","False","False","It's Tendular Vs Lara and it's a fight for a place in the final! Catch all the action on Voot - https://voot.onelink.me/eIb4/88673b6dTo watch the live match for free, download the Voot App now!Road Safety World Series is a Twenty20 extravaganza in association with the Road Safety Cell, Government of Maharashtra! 6 Nations, 15 Matches - Who will win it all?#UnacademyRoadSafetyWorldSeries #BattleOfTheLegends #RoadSafetyWorldSeriesOnVoot #RSWS #Unacademy #Cricket #T20 #Voot #ColorsCineplex #UnacademyAskTheExpert #LetsCrackIt #IndiaLegends #WestIndiesLegends #SachinTendulkar #VirenderSehwag #BrianLaraIndia Legends Squad : Sachin Tendulkar (C), Virender Sehwag, Yuvraj Singh, Mohammed Kaif, Zaheer Khan, Pragyan Ojha, Noel David, Munaf Patel, Irfan Pathan, Manpreet Gony, Yusuf Pathan, Ashok Dinda, Naman OjhaWest Indies Legends Squad : Brian Lara (C), Pedro Collins, Ridley Jacobs, Danza Hyatt, Tino Best, Sulieman Benn, Dinanath Ramnarine, Renford Pinnock, Mahendra Nagamootoo, Adam Sanford, Carl Hooper, Dwayne Smith, Ryan Austin, William PerkinsiFollow us on:Facebook: https://www.facebook.com/VootInstagram: https://www.instagram.com/voot/"
"m-N7hRqx0CM","12 DIA 12 (Official Video) | Sippy Gill | Laddi Gill | New Punjabi Songs 2021 | Latest Punjabi Songs","2021-03-19T05:00:00Z","UCoU6AzYucV7Xlg-J5GSTAPg","Gringo Entertainments","10","21.19.03","12 Dia 12 video|Bara dia bara|sippy gill new song|sippy gill song|sruishty mann|New Punjabi Song|Punjabi Song 2021|Punjabi Song Status|12 Dia 12|Punjabi Song Dj|new romantic song|latest punjabi song|Sippy Gill|Punjabi Swag Song|attitude status|Punjabi Gaane 2021|romantic song|ehna sohna munda|soch aproach dono high rkhda|hick utte khalii karun|Baaran dia baraan|3 cheezan jaan to piyarian|bebe baapu tu yaraan de yaarian|magnum dabb ch fasai rakhda","1438808","68750","2877","1948","https://i.ytimg.com/vi/m-N7hRqx0CM/default.jpg","False","False","Soch Aproch Dono High Rakhda , Colt 45 dabb ch Fasai Rakhda..Gringo Entertainments presents the new outstanding desi track by Sippy Gill , penned and composed by itself and music is given by Laddi Gill.Tune in Now!♫ Full Song Available On ♫Itunes : https://geo.itunes.apple.com/at/album/id1558177434?at=1l3v9Tx&app=itunesSpotify : https://open.spotify.com/track/650UF67iPnxpIQINUnPQU8?si=Nj0RzzI0S66dMgjg8AvEeg&utm_source=whatsappGaana : https://gaana.com/song/12-dia-12Wynk :  https://wynk.in/u/mx36LfbrSJioSaavan : https://www.saavn.com/s/song/punjabi/12-Dia-12/12-Dia-12/Blg9Q0JadVk?referrer=svn_source=share&svn_medium=com.whatsapp&utm_source=share&utm_medium=com.whatsappApple Music : https://music.apple.com/in/album/12-dia-12-single/1558177434Youtube Music : https://music.youtube.com/watch?v=wb2uB0G9JdE&feature=shareAmazon Music : https://music.amazon.in/albums/B08Z45TC2N?trackAsin=B08Z45G5SZ&ref=dm_sh_UpxTlZbsdizXtNpNNOLTHxIHmResso : https://m.resso.app/ZSJFcaTRw/———————————————————————————————♫ Song Credits ♫Singer/Composer : Sippy GillLyrics : Sippy Gill / KiranjeetMusic : Laddi GillMix Master : MJFeaturing : Sruishty Mann Villian : Satnam DhaliwalVideo: A Tru Makers FilmDilsher Singh & Khushpal SinghAssistant Director : Gurdeep Dop : Shoeb Siddiqui & Gagan RandhawaEdit & Di : Garry Khatrao Media Production : V Singh BTS : Harman SinghSpecial Thanks : Sulakhan Cheema & Narinder SinghProducers : G.S Sandhu & A.S MacLabel : Gringo Entertainments———————————————————————————————Connect with Gringo EntertainmentsSUBSCRIBE- https://www.youtube.com/gringoentertainmentsofficialLIKE US-  https://www.facebook.com/gringoentertainmentINSTAGRAM- https://www.instagram.com/gringoentertainmentsLINKEDIN - https://www.linkedin.com/in/gringo-entertainment-951186195/TWITTER- https://twitter.com/GringoEntertainWEBSITE-  https://www.gringoentertainments.com#12dia12​ #latestpunjabisongs20201#sippygill"
"a4Nh4YJ2ot8","Proposal Sothanaigal | Micset","2021-03-18T11:30:15Z","UC5EQWvy59VeHPJz8mDALPxg","Mic Set","23","21.19.03","micset|mic set|micset sothanaigal|sothanaigal|mic set sothanaigal|sothanaigal micset|mic set comedy|micset sriram|micset new episodes|mic set videos|micset mind voice|micset sothanaigal in tamil|#micset|mic set mind voice|micset videos|micset channel tamil|mic set channel tamil|mic set in tamil|micset latest episode|micset in tamil|proposal sothanaigal|proposal comedy|love propose|mic set sriram|sriram micset|mic set video|proposal comedy video","1700922","238978","2457","10054","https://i.ytimg.com/vi/a4Nh4YJ2ot8/default.jpg","False","False","Link to the instruction video on how to change the language in the amazon app - https://youtu.be/xJWKCvF8cGsDownload the Amazon app nowAndroid - https://play.google.com/store/apps/details?id=in.amazon.mShop.android.shoppingios - https://apps.apple.com/in/app/amazon-india-shop-and-pay/id1478350915Giving a New Dimension for Love and Proposal.. Presenting You with Proposal Sothanaigal Like & Share for More!#Micset #Proposalsothanaigal #MicsetSriram__________________________________Cast & Crew:Sriram ( INSTA ID - https://www.instagram.com/sriram_prince_ )Sivaranjini ( INSTA ID - https://www.instagram.com/sivaranjanii_  ) Abinash ( INSTA ID - https://www.instagram.com/abiash_rajtha )Prakash ( INSTA ID - https://www.instagram.com/micset_prakash )Nandha ( INSTA ID - https://www.instagram.com/nandy_nandha_ )Aarya  ( INSTA ID - https://www.instagram.com/missdreamfaactory )script - Direction - Screenplay - Editing - Vfx - Sfx - Di -  Cinematographer :Sriram ( INSTA ID - https://www.instagram.com/sriram_prince_ )Asst. Direction Bush ( INSTA ID - https://www.instagram.com/bushparajjagadeesh )Administration - Vfx - Cinematographer :Chandru ( INSTA ID - https://www.instagram.com/chandru_kidboy ) Business Developer  :Raji  ( INSTA ID - https://www.instagram.com/r.a.j.i.i )Music Theme :Sathish ( INSTA ID - https://www.instagram.com/sattrichard )Vignesh ( INSTA ID - https://www.instagram.com/vigneshvickyy )Drone :Vishal ( INSTA ID - https://www.instagram.com/the_adventurous_boy ) Special Thanks :Pandian - Harrison - Vimal - Aakash - Edwin - Sujith - Achu - Harini - Pooja - Drishya - Swetha - Estel - Roshini - Soniy - Sneha - AnistaLocation :Elixir Resto Pub  #elixirrestopubpondicherrySt joseph English High School __________________________________For Promotions, Branding, Digital Marketing Contact : +91 8248991430Email: officialmicset@gmail.com_______________________________________Sriram ( INSTA ID - https://www.instagram.com/sriram_prince_ )___________________________________________Facebook page : https://www.facebook.com/micsetchannel/instagram          :  https://instagram.com/micset_micset/twitter                 :  https://twitter.com/micset_official/___________________________________________In Association with DIVO - Digital Partnerhttp://www.Facebook.com/divomovieshttps://Twitter.com/divomovieshttps://Instagram.com/divomovies"
"qQWX_AFOaZ0","Surya Web Series || Episode - 3 || Shanmukh Jaswanth || Mounika Reddy || Infinitum Media","2021-03-17T04:30:51Z","UCjbBFvK04b-O3foSNabdrOA","Shanmukh Jaswanth","24","21.19.03","shanmukh jaswanth|surya web series|surya web series shanmukh jaswanth|surya web series shanmukh|shannu latest videos|mounika reddy|shanmukh videos|shanmukh short films|shanmukh jaswanth videos|software devloveper|software shanmukh|latest telugu comedy videos|middle class abbai|shanmukh jaswanth cover songs|telugu web series 2021|surya web series 3|surya episode 3|surya episode 1|shanmukh jaswanth surya|surya episode 2|infinitum media","5048761","245598","6046","11888","https://i.ytimg.com/vi/qQWX_AFOaZ0/default.jpg","False","False","Entri is the perfect solution - handy and hassle-free in function, providing all job-seekers with a personalized learning experience at your fingertip. You can prepare for any government job exam of your choice like APPSC, TSPSC, RRB, TET, SSC, Banking etc. with Entri App. Click the below link to download Entri App : https://bit.ly/EntriShanmukhShannu plays the boy next door in the new series, SURYA. Watch Surya's life unfold with highs, lows and everything in between. This one is for every guy who faces life and its challenges as they come. Cast:- Shanmukh Jaswanth, Mounika Reddy, Chandu JC, Murali Krishna, Padma Venkat, Likitha Tejomurthula, Ravi Shiva Teja, Shiva Prasad, Avinash Varma, Revathinadha, Dhana Balla, Hanumantha Rao, Satya Prerepa, RajeshwariWritten & Directed by - Subbu.KEditor -  Krishna Karthik VunnavaCinematography & DI - Vamshi Srinivas Sound engineer - Vamsi Vinod Nalli (Nani)Music - Suman VankaraTitle Animation - Nikhil ConceptsPoster Designer - Nikhil ConceptsLine Producer - Sajeev#ShanmukhJaswanth​ Famously known as  Shannu is a Telugu comedy & Entertainment Youtube Content Creator. We upload the latest Telugu comedy videos.This is Produced by #Infinitum media.Follow Infinitum Originals on Facebook: https://www.facebook.com/InfinitumOriginalsInstagram: https://www.instagram.com/infinitum_originals/"
"j7I8iJvE90E","Master Ji Ka Bhoot - Amit Bhadana","2021-03-16T14:00:48Z","UC_vcKmg67vjMP7ciLnSxSHQ","Amit Bhadana","24","21.19.03","amit bhadana|amit bhadana videos|amit bhadana desi videos|amit bhadana new video|amit bhadana comedy|amit bhadana horror|funny videos|comedy video|horror|horror comedy|master ji ka bhoot|teacher students|homework|school|college|ghost|bhoot|कॉमेडी वीडियो|अमित भड़ाना की कॉमेडी|amit bhadana funny video|school life|college life|amit bhadana school|amit bhadana college|भूत|ghost story|horror story|bhoot ki kahani|bhoot in school|amit badana|haunted place","7322725","686746","26894","57286","https://i.ytimg.com/vi/j7I8iJvE90E/default.jpg","False","False","Do badmash students ne kar rakha hai apne master ji ki naak mein dum aur is duniya mein nahi hai unka koi bhi ilaaj. Par kya karenge vo dono jab master ji dosari duniya se mangne ayenge jawaab? Is kahani mein hum aapko parlok ki sair karayenge, thoda sa darr lagega par bahut sara hansayenge. Masterji ki class mein attendance lagao aur bakiyon ko bhi le kar aao.Follow Me On Instagram & Twitter ⬇️Instagram: https://www.instagram.com/theamitbhadanaTwitter: https://twitter.com/iAmitBhadana 🎬 Video Team Directed By : Amit Bhadana, Swapnil Narendra Written & Created By : Amit BhadanaD.O.P : Manish PanditEdited By : Amit BhadanaAssistant Director : Rahul Bhati, Apurva ChaudharyColor Grading : Sarfaraz ZuberVFX : Vishesh Background Music : Riyaz Qadir & PC Arun Thumbnail : Muzammil HayaatSound Recordist : FrancisMakeup : Govind & Mac Pal Hair : Rohit DiwakarProsthetic Makeup : SunnySTARRING (Kalakar)⬇️Amit BhadanaAdheesh VermaVikas BainslaPankaj KasanaKuljeet SinghShaurya SharmaDeepakSpecial Thanks To Mewar group of Institutions#HorrorComedy #AmitBhadana #MasterJiKaBhoot"
"DSb7tmVcZm4","MC STΔN - SNAKE  (Official Music Video)","2021-03-19T04:30:14Z","UC_Q-YjEXDN0ufkU4AoWhU1g","MC STΔN","10","21.19.03","mcstan|mc stan|mc stan new song|snake|mc|indian rapper|hindi records|mc stan live|rap|hip hop|slatt|official music video|rap song|rappers","718625","115304","5510","13062","https://i.ytimg.com/vi/DSb7tmVcZm4/default.jpg","False","False","Listen to Snake on all audio streaming platforms: https://mcstan.bfan.link/snake.ydeSpotify: https://mcstan.bfan.link/snake/spotifyApple Music: https://mcstan.bfan.link/snake/appleMusicJioSaavn: https://mcstan.bfan.link/snake/jiosaavnWynk: https://mcstan.bfan.link/snake/wynkGaana: https://mcstan.bfan.link/snake/gaanaAmazon: https://mcstan.bfan.link/snake/amazonMusicSHARE KARRA EXPERIENCE JO BHI SUNNE 👽 PYAAR MAI SE NIKALU LOGO MEIN 💔Artist - MC STΔNProd. by - MC STΔNDirected by - MC STΔNEdit by - MC STΔN ( STAY CONNECTED ) 💁INSTAGRAM - https://www.instagram.com/m___c___stan/?hl=enHINDI RECORDS - https://www.instagram.com/hindi_records/#yedechalekarobhimat 🔞Features & Booking : stanplug@gmail.comFor Licensing enquiries: Email:- sync-india@believedigital.com"
"LAYHUuaeuyM","Jash Vs Amit Bhai Best Collection Versus In Free Fire || Face To Face Battle - Two Side Gamers","2021-03-17T11:03:31Z","UCiDikVE7Y4_KpQwsxarj38g","TWO SIDE GAMERS","20","21.19.03","Two side gamers vs Amit bhai|Tsg Vs Amit Bhai|Tsg vs Desi Gamers|Two side gamers Collection Vs Amit Bhai Collection|Tsg jash Collection vs Desi Gamers Collection|Lokesh Gamer Collection vs Jash Collection|Total Gaming Vs Amit Bhai|Ajju Bhai Vs Amit Bhai|Ajju Bhai Collection|Lokesh Gamers vs Jash Collection|Desi Gamers|Desi Gamers Live|Two side gamers live|Two side gamers New Video|Tsg Collection|Best Collection in Free Fire|YouTube homepage|Suggestion|Dailyvideo","2059103","242622","5834","25543","https://i.ytimg.com/vi/LAYHUuaeuyM/default.jpg","False","False","Subscribe Soumyo roy channel - https://bit.ly/3vHJyJ1Jash Vs Amit Bhai Best Collection Versus In Free Fire || Face To Face Battle - Two Side Gamersin Todays Video Jash Did Free Fire Best Collection Fun Versus With Amit Bhai ( Desi Gamers ) The Collection Versus was Of 5 rounds #Desigamers #Twosidegamers#CollectionVersus #Tsgvsdesigamers Hope You Likes This Versus & Want More Collection Versus in Future with other Youtubers ❤️ Do Comment Your Favourite Youtubers Name Likes Target 🎯- 60,000 For Part 2 ❤️@TWO SIDE GAMERS  📦For business:- contact.twoside@gmail.com🟣Discord :- https://discord.gg/twosidegamers ⚫Instagram:- https://instagram.com/twosidegamers?igshid=1xpma500r9zsxIder Dhayn Mat do :- @TSG ARMY @TWO SIDE SHORTS @Desi Gamers Free Fire Collection Versus #CollectionversusinfreefireCollection Versus With TSG#CollectionversuswithtsgCollection Versus With Desi Gamers #FreefirecollectionversuswithdesigamersCollection Versus With Amit Bhai #GarenafreefirebestcollectionCollection Versus In Free Fire First Elite Pass vs Second Elite PassAmitbhai Vs Jashbhai"
"LQ92p5UbfTw","hare matar ki sab se asan recipe part 2 #shortvideo shaheen azeem","2021-03-15T12:07:17Z","UC4YrpCdpXXcEW1kfDRy_WjA","shainy ka kitchen","22","21.19.03","[none]","3329963","18895","7817","1959","https://i.ytimg.com/vi/LQ92p5UbfTw/default.jpg","False","False",""
"RcffCUtKYDI","papri chaat recipe #shortvideo #roshan rishu #roshanfood for #shorts","2021-03-14T13:30:06Z","UCDVVakxK2uTautQYNupFhbg","Geeta's Kitchen Hindi","22","21.19.03","[none]","2332998","11711","3537","251","https://i.ytimg.com/vi/RcffCUtKYDI/default.jpg","False","False","papri chaat recipe #shortvideo #roshan rishu #roshanfood #shorts"
"3cbesRP6ZP8","chatai mathri recipe #shorts #holispecial #recipes","2021-03-17T03:33:54Z","UCR6xXw6zVqOKi7oLbBPaVgg","Deepti Mishra's Kitchen","26","21.19.03","[none]","808717","8131","1047","167","https://i.ytimg.com/vi/3cbesRP6ZP8/default.jpg","False","False","#shorts चटाई मठरी को इस होली पर जरुर बनायें आप के सभी मेहमान Chatai Mathri देखते रह जायेगें  Chatai MathriFull Video Link - https://youtu.be/cv1DY4-CQIA"
