video_id,title,publishedAt,channelId,channelTitle,categoryId,trending_date,tags,view_count,likes,dislikes,comment_count,thumbnail_link,comments_disabled,ratings_disabled,description
"O3QTcGBhSjk","高校あるある〜伝説のブチギレ授業編【TikTok】で5億回以上再生された高校生あるある動画【高校生ゆうきの日常","2021-04-09T09:00:17Z","UC6tCT6LpekaoNPjpWVN9SYg","土佐兄弟の青春チャンネル","22","21.14.04","TikTok|Instagram|バズった|ティックトック|インスタ|100万回再生|高校生|あるある|ゆうき|たくや|土佐兄弟|兄弟|漫才|漫才師|お笑い|芸人|テスト|学校|高校|中学|流行|ツイッター|Twitter|お笑い芸人|コント|ショートコント|ミニコント|ネタ|コンビ|チャイム|学祭|学園祭|黒板|制服|学ラン|BL|ボーイズラブ|小栗旬|マロンマロン|おばたのお兄さん|とさきょうだい|土佐有輝|土佐卓也|ペン回し|シャーペン|消しゴム|教室|恋愛|元カノ|彼女|彼氏|元彼|先生|教師|懐かしい|ブレザー|高校あるある|教員|tiktok|卒業式|入学式|卒業|入学|新学期|クラス替え|中間|期末|試験|監督|顧問|コロナ|休校|自粛|外出|ナイトルーティン|モーニングルーティン|ルーティン|日本史|ステイホーム|STAYHOME|中川大志|しゃべくり|しゃべくり００７|緊急事態宣言|文化祭|かみひとえ|夜会|櫻井翔|有吉|ジェネレーションズ|深イイ|深イイ話|アメトーク|アメトーーク|兄弟でコンビ組んでる芸人|あるある土佐カンパニー|文化放送","700802","9338","158","1833","https://i.ytimg.com/vi/O3QTcGBhSjk/default.jpg","False","False","7月11日、土曜19時よりTOKYO MXにて放送！TOKYO NEXT（トーキョーネクスト）『夢に向かって頑張っている人』の動画を大募集！！詳細はこちらから！https://s.mxtv.jp/tokyo_next/​TikTokでバズって5億回以上再生された高校あるあるシリーズをまとめました！ありましたよね一回はこう言う修羅場！弟のゆうきを見て思い出しました！ちなみに僕は誰かが怒られてるのを見るの好きでした！（土佐兄弟の兄兼カメラマン　たくや）#tiktok​​​​​ #あるある​​​​​ #高校生ゆうきの日常​​​​​ #高校生​​​■土佐兄弟の冠番組テレビ朝日「あるある土佐カンパニー」放送日：毎週木曜深夜2:16 ～ 2:36出演者：土佐兄弟、三谷紬(テレビ朝日アナウンサー)https://www.tv-asahi.co.jp/pr/sphone/20201007_01817.html土佐兄弟が“新しいあるあるを見つける会社を遂に設立!!日常の何気ない瞬間に潜むベタな出来事=“あるある。この会社では、誰もが思わず うなずかずにはいられない…でも、気付かなかった「まだ見ぬ“新たなあるある」を全力で探します!!『地味にイラッとした時…』、『腹痛の時…』、あなたの“あるあるは?『高校生あるある』で動画アプリ4億回再生を記録した土佐兄弟が、初の冠番組として力の限りお届けします!■土佐兄弟の冠ラジオ文化放送「土佐兄弟のCultureZ」放送日：火曜 深夜1:00～深夜3:00 生放送出演者：土佐兄弟http://www.joqr.co.jp/programs/detail/culturez.phpメール：cz@joqr.netTwitter：@CultureZ_radiko：http://radiko.jp/#!/ts/QRR/20201027010000■新チャンネル「丸山礼と土佐有輝」はこちらから！チャンネル登録よろしく！https://www.youtube.com/channel/UCdk5Gdd1XDMq1AbldfDZEOQ/videos土佐兄弟の情報、お仕事依頼はこちらからお願いします！https://www.watanabepro.co.jp/mypage/4000071/https://ameblo.jp/tosakyoubai/・土佐有輝TikTok：https://www.tiktok.com/@tosakyodaiotot_yuki103https://www.tiktok.com/@tosakyodaiotot_yuki103Twitter：https://twitter.com/tosakyodai_yukiInstagram：https://www.instagram.com/tosakyodai_otot/・土佐卓也Twitter：https://twitter.com/takuyatosa1Instagram：https://www.instagram.com/takuyatosa1/"
"j4X5OeCJAxc","最低限なのに最高！？キャンプのバッグの中身を紹介【ミニマリスト】","2021-04-09T12:53:41Z","UCIJPUOgFIBu8TiXUa9hRWYw","CABHEY RIDE ON!!","2","21.14.04","キャンプ|バイク|モトブログ|ソロキャン|ミニマリスト","479503","11830","198","1359","https://i.ytimg.com/vi/j4X5OeCJAxc/default.jpg","False","False","俺の本が出ます→https://www.amazon.co.jp/dp/4046803029「準備はリュック１つ！日本一身軽なキャブヘイのソロキャンプ」(KADOKAWA)(5/26日発売　Amazonの予約販売は今日から開始)[ゲームチャンネル]https://www.youtube.com/channel/UC0iNpcyM6QkUlX9mzziauQA[Twitter]https://twitter.com/cabhey_dj[Instagram]https://www.instagram.com/dj_cabhey[Music/SE]DOVA-SYNDROME:https://dova-s.jp/NCS:https://soundcloud.com/nocopyrightsoundsperitune:http://peritune.com/"
"JUR16rk7Smg","ポカリスエットweb movie｜『Behind the Scenes of POCARI SWEAT』","2021-04-08T19:00:03Z","UCOgqmqpvV9wIjcXbhb6Ee6Q","大塚製薬 公式チャンネル","24","21.14.04","[none]","406281","5366","39","0","https://i.ytimg.com/vi/JUR16rk7Smg/default.jpg","True","False","撮影に奮闘する、新ヒロイン中島セナさんに密着。CMでは伝えきれなかったセナさんの魅力とまるで映画のような舞台セットを、1分47秒でご紹介。▼2021年、ポカリスエットCM「でも君が見えた」篇 60秒https://youtu.be/lcZo5sVK6QM▼ポカリスエットweb movie｜「新ヒロイン 中島セナ」https://youtu.be/COYJMrvptQE♩A_o「BLUE SOULS」ポカリスエットCMソング#ポカリスエット #汗が私をつれていく #A_o  A_o(エーオー)公式アカウント情報Twitter：https://twitter.com/A_o_is_u  ＠A_o_is_uTikTok：https://www.tiktok.com/  @a_o_is_uInstagram：https://www.instagram.com/a_o_is_u/YouTube ： https://www.youtube.com/channel/UC_ii6itRa8gNiLdZKV-ZDLQ"
"45eaXV6CJOk","SuperM 슈퍼엠 'We DO' MV","2021-04-09T10:00:18Z","UCEf_Bc-KVd7onSeifS3py9g","SMTOWN","10","21.14.04","[none]","7124855","833738","27627","116426","https://i.ytimg.com/vi/45eaXV6CJOk/default.jpg","False","False","SuperM X Prudential’s new single “We DO” is out!Listen and download on your favorite platform: https://smarturl.it/SuperM_WeDO 🔗http://www.prudentialwedo.com SuperM Officialhttps://www.supermofficial.comhttps://www.youtube.com/SuperMhttps://www.instagram.com/SuperMhttps://www.tiktok.com/@superm_smtownhttps://www.twitter.com/SuperMhttps://www.facebook.com/SuperMhttps://www.vlive.tv/channel/9ADC8BPrudential Corporation Asiahttps://www.prudentialcorporation-asia.com/Prudential Corporation Asia is a business unit of Prudential plc of the United Kingdom. Neither Prudential Corporation Asia nor Prudential plc are affiliated in any manner with Prudential Financial, Inc., a company whose principal place of business is in the United States of America or with the Prudential Assurance Company, a subsidiary of M&G plc, a company incorporated in the United Kingdom.#WeDO #PRUxSuperM #SuperM#SuperM_Prudential #SuperM_WeDO"
"uOE901_IooE","【大型トラック】私のトラックを紹介します!!","2021-04-09T10:00:34Z","UC1ehCtrs06EDmCwu9MUXhhw","ばーしちゃんねる","2","21.14.04","女子|トラガール|牽引|車中泊|ドライバー|ダンプ","502172","4688","320","796","https://i.ytimg.com/vi/uOE901_IooE/default.jpg","False","False","#トラック #長距離ドライバー私の働く職場は誠昇です。✌️ぜひよろしくお願いいたします٩(๑•ㅂ•)۶トレーラーですが、トラックの事を何も知らずそれで全国走って行くのもどうなのかなと考えに考えた結果、まずは単車で全国を走ろうと決めました。私はまだ大阪から関東までの道しか知らないので、これから様々な道を覚えて行きたいなと思ってます。冬になるとチェーンも巻かないといけない県にも行くのでまずは勉強していきます！社長にトラック運転手1人前って認めて貰えるようになったら、トレーラーをねだってみようかな😏😏✩ ⋆ ✩ ⋆ ✩ ⋆ ✩ ⋆ ✩﻿ ⋆ ✩ ⋆ ✩﻿✩ ⋆ ✩ ⋆ ✩ ⋆ ✩ ⋆ ✩﻿ ⋆ ✩ ⋆ ✩﻿日常チャンネル(たなぴーばばしー)https://www.youtube.com/channel/UC-sO9DNa4YpgUWZnY601ElA・Twitter　☞　BABASHIhttps://mobile.twitter.com/babashi_youtube・Instagram ☞  babashi_01https://www.instagram.com/babashi_01/ばーしちゃんねるYOUTUBE公式ステッカー6ｃｍ丸型https://amzn.to/3gMkA39ばーしちゃんねる公式ラバーバンド(ピンク)https://amzn.to/33O7Q8kばーしちゃんねる公式YOUTUBEステッカー8ｃｍ丸型https://amzn.to/2PDGuK2たなぴーばばしーチャンネル公式ステッカー https://amzn.to/3imiYNY★手紙・プレゼントの送り先はこちら★TBカンパニー  ばーしちゃんねる宛大阪市西成区萩ノ茶屋3-6-22 512※ナマモノ、動物、非衛生的、危険を伴うプレゼント等は受け付けておりません。着払いは拒否させて頂きます。ご了承ください。★動画に関するお問い合わせ先(案件等)★tbch001yt@gmail.com"
"C38duJh071c","NiziUの子供のころの夢は…【Ｍステ】","2021-04-09T10:06:47Z","UCStFsybJM6SjDFvcacVcanw","MUSIC STATION","22","21.14.04","[none]","523724","13670","359","0","https://i.ytimg.com/vi/C38duJh071c/default.jpg","True","False","ＮiziUのみなさんが #Mステカメラ に登場です〜😍Ⓜ今夜のテーマは『子供のころの夢✨』みんな子どもの頃の夢を教えてくれました😚❤みなさんは子供の頃の夢なんでしたか？？？『Take a picture』を披露してくれます📺⚡今夜は3時間SPです、お見逃しなく🎵#Mステ　#NiziU"
"7WalqydGwk8","ONE OK ROCK - Renegades [OFFICIAL MUSIC VIDEO Short Ver.]","2021-04-09T03:00:03Z","UCzycs8MqvIY4nXWwS-v4J9g","ONE OK ROCK","10","21.14.04","ONE OK ROCK|ワンオク|ワンオクロック|Taka|Toru|Ryota|Tomoya|バンド|OOR|ロック|Japan|J-Rock|rock band|Japanese Band","1991028","94131","369","5124","https://i.ytimg.com/vi/7WalqydGwk8/default.jpg","False","False","#Renegades #ONEOKROCK #OOR​ #EdSheeran #るろうに剣心Director: Toshi AtsunoriAnnouncing the new single Renegades co-written with Ed Sheeran set for release on April 16th,to feature as the official theme song of the upcoming Japanese film Rurouni Kenshin: The Final.[Music]Releasing on April 16th, 2021Pre-order/Pre-save/Pre-addJapanese Version: https://OOR.lnk.to/RenegadesJAWInternational Version: https://oor.lnk.to/renegades[MUSIC VIDEO]YouTube Premiere on Official YouTube ChannelApril 16th, 20215:00AM PT / 8:00AM ET / 1:00PM  BST / 9:00PM JSThttps://www.youtube.com/user/oneokrockchannel[ミュージックビデオ]オフィシャルYouTubeチャンネルにてプレミア公開！2021年4月16日 21:00〜https://www.youtube.com/user/oneokrockchannel[Other Videos]ONE OK ROCK - Renegades Talk and Reviewhttps://youtu.be/wRqjqN6tNvY★Official TikTok Account is now Launched!!★http://tiktok.com/@oneokrock_officialFollow ONE OK ROCK on...Instagram: https://www.instagram.com/oneokrockofficial/Twitter: https://twitter.com/ONEOKROCK_japanTikTok: http://tiktok.com/@oneokrock_officialFacebook: https://www.facebook.com/ONEOKROCK/More to follow...Taka: https://www.instagram.com/10969taka/Toru: https://www.instagram.com/toru_10969/Ryota: https://www.instagram.com/ryota_0809/Tomoya: https://www.instagram.com/tomo_10969/Official Website: https://www.oneokrock.com/"
"3_e1szJovxo","【ストーリー編】第７話後編「崩壊のはじまり」【アニメ】【漫画動画】","2021-04-10T09:00:17Z","UCo_nZN5yB0rmfoPBVjYRMmw","全力回避フラグちゃん!","1","21.14.04","全力回避フラグちゃん|フラグちゃん|アニメ|漫画|マンガ|まんが|漫画動画|マンガ動画","348188","6431","88","1171","https://i.ytimg.com/vi/3_e1szJovxo/default.jpg","False","False","私はいっつもダメダメだから今回もきっと回避できないんです！そうですよね？モブ男さん…「全力回避フラグちゃん！」アクスタ等グッズ発売中！！！お買い求めはこちら→→ https://plott.store/チャンネル登録、高評価よろしくお願いします！https://www.youtube.com/channel/UCo_nZN5yB0rmfoPBVjYRMmw?sub_confirm=1フラグちゃんLINEスタンプ発売中です！https://store.line.me/stickershop/product/12763172ツイッターもフォローしてくれると嬉しいです！https://twitter.com/flag__chanファンアートなどは# フラグちゃんでツイートしてくださいね！◆お問い合わせやお仕事の依頼はこちらflagchan@plott.tokyo原作：bikihttps://twitter.com/biki_relic企画・製作：株式会社Plott【使用している音楽素材など】audiostock https://audiostock.jp/http://www.music-note.jp/index.htmlhttps://taira-komori.jpn.org/human01.htmlhttps://soundeffect-lab.info/sound/anime/"
"cdXgKcC0d-M","SEVENTEEN Performs A High-Octane Version Of VERY NICE | Press Play","2021-04-08T17:00:28Z","UCq4isO8ZYOZfmvGJ-_1UdIA","Recording Academy / GRAMMYs","10","21.14.04","grammy awards|grammys|grammy|album of the year|record of the year|song of the year|grammys red carpet|grammy red carpet|2021 GRAMMYs|63rd GRAMMYs|The One And Only GRAMMYs|SEVENTEEN|SEVENTEEN live performance|SEVENTEEN performs VERY NICE|Press Play|Press Play At Home|SEVENTEEN Press Play|VERY NICE|semicolon","779018","97558","271","5484","https://i.ytimg.com/vi/cdXgKcC0d-M/default.jpg","False","False","In the latest episode of Press Play At Home, the South Korean boy band SEVENTEEN performs an irresistible version of their track VERY NICE, written by members S.COUPS, WOOZI and VERNON along with their producer, BUMZU.About the Recording Academy / GRAMMYs: Recording Academy is the world's leading society of musical professionals and is dedicated to celebrating, honoring, and sustaining music's past, present and future. Connect with the Recording Academy / GRAMMYs: WEBSITE: http://www.grammy.comFACEBOOK: http://grm.my/2gcTcMk TWITTER: http://grm.my/2gDUHUD  INSTAGRAM: http://grm.my/2gZGIvJ Subscribe NOW to the Recording Academy / GRAMMYs on YouTube: http://grm.my/1dTBF8H#SEVENTEEN #VERYNICE #PressPlay #GRAMMYs"
"P8HdGQWFxMA","伶 『水平線』(カバー)","2021-04-08T13:00:08Z","UC36d9BfqBDm4ToLVvPnI1zg","伶Official YouTube Channel","10","21.14.04","E-girls|Flower|鷲尾伶菜|LDH|Girls|ファーストテイク|First Take|伶|backnumber","522731","20966","116","1215","https://i.ytimg.com/vi/P8HdGQWFxMA/default.jpg","False","False","伶、オフィシャルYouTubeチャンネルを開設！注目のカバー第二弾目はback numberの「水平線」　をバンドサウンドに乗せてカバー。伶の声がしっかり堪能できるアレンジとなっています！オフィシャルHP：https://rei-web.jpオフィシャルtwitter：https://twitter.com/rei__official_オフィシャルInstagram：https://www.instagram.com/reina.washio.official/♪伶「白雪姫 - From THE FIRST TAKE」　配信はこちら　https://smar.lnk.to/X6iFCJ　　　♪伶「Call　Me Sick/こんな世界にしたのは誰だ」配信はこちらhttps://smar.lnk.to/N4Z9O5nx"
"EUcGQLaYXqw","【アニメ】手取り15万円になるとどうなるのか？","2021-04-09T12:00:06Z","UCUTgXNqRBqR33D5q10DfQXw","テイコウペンギン","1","21.14.04","テイコウペンギン|ていこうぺんぎん|抵抗ペンギン|ショートアニメ|アニメ|雑学|ブラック企業|社畜|会社|仕事|YouTubeアニメ","463154","5836","322","1639","https://i.ytimg.com/vi/EUcGQLaYXqw/default.jpg","False","False","場所によってはもう少しいい暮らしができるみたいだが…そういえば前にもこんな動画があったな。https://bit.ly/39Ry501ま、動画見たらチャンネル登録・高評価よろしくPlott公式ファンコミュニティアプリ「Plott Land」のインストールはこちらから！ ▼有料会員登録はこちらから(※初月無料) https://subscription.app.c-rayon.com/app/plott/home▼アプリDLは以下から(iOS/Android共通) https://c-rayon.com/plott/​ 『テイコウペンギン アニメBOOK』はこちら↓https://www.amazon.co.jp/dp/4065187389/ref=cm_sw_r_li_awdo_c_sBD4EbYV003H4▼チャンネル登録しない理由があるのか？http://bit.ly/2FNW81H▼最新情報はTwitterで発信してるぞhttps://twitter.com/teikoupenguin【グッズはここから】▽LINEスタンプhttp://bit.ly/2tZgT3h▽書籍https://amzn.to/2TMSb4Iコメントか #テイペン でツイートしたらペチペチするぞ。【チャンネル紹介】ブラック企業で働くペンギンと同僚のパンダ、上司のモニターの日常を配信してます。人気になれば、グッズとかも出るかもしれないので応援お願いします。【使用している音楽素材など】・audiostock https://audiostock.jp/・効果音ラボ https://soundeffect-lab.info/・甘茶の音楽工房 http://amachamusic.chagasi.com/・OtoLogic https://otologic.jp/#Plottアニメ"
"LURLJZqzqlc","東京事変 - 「永遠の不在証明」スペシャルスポット・ムービー","2021-04-09T01:00:07Z","UCqoUKpMpv8hz64ckrRWBbUw","東京事変","10","21.14.04","[none]","368564","16857","43","602","https://i.ytimg.com/vi/LURLJZqzqlc/default.jpg","False","False","東京事変 デジタル ニューシングル「永遠の不在証明」 ＜劇場版『名探偵コナン 緋色の弾丸』主題歌＞配信はこちら ▶ https://lnk.to/tjtsabdm1. 永遠の不在証明m2. 永遠の不在証明 - The Scarlet KARAOKE-作詞作曲　椎名林檎　編曲　東京事変produced by 東京事変 & 井上雨迩劇場版『名探偵コナン 緋色の弾丸』 2021年4月16日(金)より全国東宝系にて全国ロードショー公式サイト：http://www.conan-movie.jp/#東京事変 #永遠の不在証明 #名探偵コナン #緋色の弾丸"
"TCI1oxbVuCk","【神回！？】テレビでよく見る恒例の本人登場やってみたら衝撃の結果に！？【ドッキリ】","2021-04-08T10:00:10Z","UC7MvTslTWkE1HKNYkXiGv1Q","優里ちゃんねる【公式】","22","21.14.04","[none]","677377","22047","740","1110","https://i.ytimg.com/vi/TCI1oxbVuCk/default.jpg","False","False","〇一言:楽しんでもらえたかな〜！コメントお待ちしてます！＜学校ホームページ＞OSM 大阪スクールオブミュージック専門学校 https://www.osm.ac.jp大阪スクールオブミュージック専門学校(OSM)とは音楽・ダンス・コンサートスタッフ・作曲・声優・俳優・マネージャーなど音楽＆エンターテイメント業界とともに学び、就職・デビューするための専門学校です。「ドライフラワー」配信中！https://va.lnk.to/pDtB0i優里の曲はこちら:https://lnk.to/PO4pBF​ドライフラワーNEWグッズ＆インフィニティグッズ販売開始！ドライフラワーのグラフィックがデザインされたトートバッグ、使い勝手の良いサーモタンブラーにステッカーセット。インフィニティのロンTとお得なマスク＆ストラップセット！是非ゲットしてください！https://official-goods-store.jp/yuuri/過去の動画はこちら【神回】本人同士による『魔法の絨毯』VS『ドライフラワー』カラオケ対決https://youtu.be/pkk-qQE7gK4【優里】120分耐久 2020年楽曲全開放【作業用BGM】https://youtu.be/4g8PHEWFows【ドライフラワー】歌手志望必見！！歌が上手くなる方法教えますhttps://youtu.be/x6xOU6AHcFk【ドライフラワー】アカペラカラオケでも自分の曲なら93点いけるのか！？https://youtu.be/o5TxvH7G4mY今年卒業するあなたへ【桜晴】【新曲初披露】https://youtu.be/Z-_U-D6z5io【荒野行動】『ドライフラワー』本人が歌って知名度調査！知ってる人いるまで帰れま10https://youtu.be/aSf-BvSNCHE・優里SNSTwitter：https://twitter.com/yuuri_officialinstagram：https://www.instagram.com/yuuri__music__official/・ジュンSNSTwitter：https://twitter.com/Jun_Yuuri_CHinstagram：https://www.instagram.com/__juntleman__/・げんたSNSTwitter：https://twitter.com/Genta_Yuuri_CHinstagram：https://www.instagram.com/g_zooo1/▶︎案件、コラボ、お仕事のご依頼はこちらyuuri.oshigoto@gmail.com#優里#ドライフラワー#ドッキリ#OSM#ピーターパン#生演奏"
"z92DmTxjzwU","NO GOOD TV| GAME Vol. 7 - WEREWOLF/人狼","2021-04-08T09:00:17Z","UCy5YRlHRDW3y-N5aIzABo9Q","NO GOOD TV","22","21.14.04","Jin Akanishi|Ryo Nishikido|錦戸亮|赤西仁|N/A|ライブ|音楽|アイドル|Idol|Japanese|日本語|暇潰し","443205","8823","157","627","https://i.ytimg.com/vi/z92DmTxjzwU/default.jpg","False","False","［NO GOOD TV | GAME Vol. 7 - WEREWOLF/人狼 ］JIN AKANISHI & RYO NISHIKIDO & TAKERU SATOH & TAKAYUKI YAMADA & SHOHEI MIURA「N/A」YouTube Channelhttps://www.youtube.com/c/NAOfficialChannel「RYO NISHIKIDO」YouTube Channelhttps://www.youtube.com/c/ryonishikido「JIN AKANISHI」YouTube Channelhttps://www.youtube.com/user/JinAkanishiusa「TAKERU SATOH」YouTube Channelhttps://www.youtube.com/c/takerusatoh「TAKAYUKI YAMADA」YouTube Channelhttps://www.youtube.com/channel/UCsy3RSnpdXfVL73z9TfBa9Q/featuredINSTAGRAMRYO NISHIKIDO: https://www.instagram.com/ryonishikido_officialJIN AKANISHI: https://www.instagram.com/jinstagram_officialTAKAYUKI YAMADA: https://www.instagram.com/takayukiyamadaphotoTWITTERRYO NISHIKIDO: https://www.twitter.com/ryonishikido_jpJIN AKANISHI: https://www.twitter.com/Jin_AkanishiWEBSITEN/A PROJECT: https://na-official-project.comRYO NISHIKIDO: https://www.ryonishikido.comJIN AKANISHI: http://www.jinakanishi.comTAKERU SATOH: http://www.satohtakeru.com［INFO］info@nogood.tvinfo@nomadrecords.jpinfo@gogood.jp#NOGOODTV #RyoJin #NA #JINAKANISHI  #RYONISHIKIDO #TAKAYUKIYAMADA #TAKERUSATOH #SHOHEIMIURA #錦戸亮 #赤西仁 #山田孝之 #佐藤健 #三浦翔平 #人狼 #JINRO"
