video_id,title,publishedAt,channelId,channelTitle,categoryId,trending_date,tags,view_count,likes,dislikes,comment_count,thumbnail_link,comments_disabled,ratings_disabled,description
"y__nwTKa_h0","GABRIELA ROCHA - ALFA E ÔMEGA / PRA TE ADORAR (CLIPE OFICIAL)","2021-04-07T20:00:18Z","UC4t2mdI8uAiJDJSRjiWJT1Q","Gabriela Rocha","10","21.15.04","alfa e omega|pra te adorar|gabriela rocha|clipe oficial|musica gospel|worship|gospel|musica evangelica|adoracao|louvores|hinos|louvor|gospel music|louvores gospel|louvores de adoracao|lugar secreto|diz que amado sou|eu navegarei|diz gabriela rocha|gabriela rocha 2020|hosana gabriela rocha","891159","49503","334","2131","https://i.ytimg.com/vi/y__nwTKa_h0/default.jpg","False","False","Alfa e Ômega / Pra Te Adorar - Gabriela Rocha | Assista minha playlist de músicas: https://onilnk.com/r/AlfaeOmega+PraTeAdorar Inscreva-se no canal Gabriela Rocha: https://onilnk.com/r/GabrielaRocha _____Outras músicas de Gabriela Rocha:- O Mover do Espírito (Quero Que Valorize): https://onilnk.com/r/OMoverDoEspiritoQueroQueValorize - Lugar Secreto: https://onilnk.com/r/Lugar_Secreto- Eu Navegarei: https://onilnk.com/r/EuNavegarei_- Creio Que Tu És a Cura: https://onilnk.com/r/CreioQueTuEsaCura- Nada Além De Ti: https://onilnk.com/r/_NadaAlemDeTi_- Diz (You Say): https://onilnk.com/r/Diz- Hosana: https://onilnk.com/r/Hosana_- A Ele a Glória: https://onilnk.com/r/A_Ele_A_Gloria- Santo Espírito Vem: https://onilnk.com/r/SantoEspiritoVem- Céu: https://onilnk.com/r/Ceu- Eu e o Rei: https://onilnk.com/r/EueoRei___ Site Oficial: https://gabrielarocha.com.br/___Letra - Alfa e Ômega / Pra Te AdorarCompositores: Erasmus Mutanbira / Meleasa Houghton / Israel HoughtonÉs o Alfa e o ÔmegaTe Adoro meu SenhorTu És Digno do louvor (2x)Te damos toda GlóriaTe adoro meu SenhorTu És Digno do louvor (3x)Pra Te adorar, eu vivoPra Te adorar, eu vivo só pra Te adorar (2x)Pra Te adorar, eu vivoPra Te adorar, eu vivo só pra Te adorar (3x)Te damos toda GlóriaTe adoro meu SenhorTu És Digno do louvorSim, te damos toda GlóriaTe adoro meu SenhorTu És Digno do louvor___Ficha Técnica: Alfa e Ômega / Pra Te adorarDirigido por Mateus PatoProdução Musical: Matheus Charles Produtora: DCK PROD (http://dckprod.com)Edição: João Cunha e Mateus PatoDireção de Fotografia: Mateus PatoCinegrafistas: Luz Guerra, João Cunha e Vitor HugoMovimentos: EDZCaptação de áudio: Guiarone Adão/João RicardoGravado em Estúdio Sérgio MenezesVoz: Gabriela RochaTeclado: Matheus CharlesGuitarra: Marcos OliveiraBateria: André LimaBaixo: Michel Barcellos___Gabriela Rocha nasceu em São Paulo no ano de 1994. Aos 5 anos iniciou seu ministério na igreja que frequentava, quando aos 13 participou do programa Raul Gil, onde sua voz se propagou pela nação. A partir de então, a cantora se dedicou por completo ao chamado do Senhor em se tornar voz de Deus, levando os louvores e ministrações a todos os povos. Em 2012 Gabriela lançou seu primeiro álbum “Jesus”, em 2014 “Pra Onde Iremos?” e em 2016 “SML”, “EP Gabriela Rocha” e “Até Transbordar (Ao Vivo)”, seu primeiro CD/DVD ao vivo. Seu segundo EP, “Céu”, foi lançado em 2017 e tornou-se repertório das igrejas brasileiras e internacionais. Em 2019 ela lançou o EP “Hosana” com canções como: Eu e o Rei (Ao Vivo), A Ele a Glória (Ao Vivo) e Diz. Em 2020 lançou a canção “Lugar Secreto (Español)”, o EP “Juntos Em Adoração (Live 2020)” que chegou junto com a estreia do canal da ministra no PodCast na plataforma e a canção “Teu Espírito” e “Seu Nome é Amor” que contou com a collab da Kim Walker Smith - gravado no início de Março/20, antes das restrições da pandemia. Ouça seu último lançamento “Alfa e Ômega / Pra Te Adorar ”, que faz parte de seu projeto “Ecoar''.___ Redes sociais:Instagram: https://onilnk.com/r/InstagramGabrielaRochaFacebook: https://onilnk.com/r/FacebookGabrielaRochaTwitter: https://onilnk.com/r/TwitterGabrielaRocha___#GabrielaRocha #AlfaEÔmega #PraTeAdorar #SomQueAlimenta"
"bph5Tlzj0C4","Amor de Mãe: capítulo 123, quarta, 7 de abril, na TV Globo","2021-04-07T13:45:03Z","UCEPRQVF6hxGGM9gi1ELaWHg","TV Globo","24","21.15.04","Globo|Rede Globo|TV|novelas|amor de mãe|chamada|capítulo de hoje|lourdes|rigena cazé|chai suede|xai suede|shai suede|shay suede|chay suedi|chai suedi","1826895","21122","1899","979","https://i.ytimg.com/vi/bph5Tlzj0C4/default.jpg","False","False","No capítulo de hoje, Lurdes (Regina Casé) finalmente encontra Danilo (Chay Suede) e conta a ele que é seu filho, Domênico. Assista à chamada!Veja tudo sobre 'Amor de Mãe' em https://globoplay.globo.com/amor-de-m...​Se inscreva no canal e fique por dentro de tudo sobre a TV Globo:https://bit.ly/3cCEwFY​Nos acompanhe também em outras redes! Facebook: https://www.facebook.com/tvglobo​Instagram: https://www.instagram.com/tvglobo​Twitter: https://twitter.com/tvglobo​Pinterest: https://br.pinterest.com/redeglobo​Visite também o nosso site: https://redeglobo.globo.com/​​​​#AmorDeMãe​​​ #novela​​​ #tvglobo​​"
"6RomXldt048","CALMA 😂🤬","2021-04-08T19:19:06Z","UCJDBsRxSr-sSHjLyZOeiG3g","Léo Léo","22","21.15.04","[none]","2580952","208836","9294","1136","https://i.ytimg.com/vi/6RomXldt048/default.jpg","False","False","Quando a gente quer sossego, tudo acontece 😅#shorts"
"w8nA9mfzMUc","QUERO COMPRAR O FH 440 DO MEU AMIGO 😲 FIZ A PROPOSTA!","2021-04-09T15:00:20Z","UCtYmG4OZ96ZacwCpNXo996Q","Bruno Garcia","24","21.15.04","brunogarcia|Bruno|Garcia|CB1000|Voyage|Quadrado|Turbo|viagem|caminhao|cowboy|paulinho|paulinhosbk|gang|gbn|scania|scania 112|scania 143|112|143|scania v8|bruno scania|scania bruno|bruno garcia scania|scania bruno garcia|2 eixos|carretinha|carretinha 2 eixos|carretinha bruno|bruno carretinha|reforma|scania reforma|reforma scania","237279","29253","243","505","https://i.ytimg.com/vi/w8nA9mfzMUc/default.jpg","False","False","⛔Compre meus Produtos direto no meu Site! ⛔www.lojabrunogarcia.com.br⛔🚚 Me siga no Instagram e acompanhe minha vida!Instagram ➡ https://www.instagram.com/brunogarciaytPágina Oficial ➡ https://www.facebook.com/brunogarciayt/Facebook ➡ https://www.facebook.com/bruno.garcia.ldnRodoara Implementos 🚦🚛🚚IMPLEMENTOS RODOVIÁRIOShttps://www.instagram.com/rodoara_implementos/?hl=pt-br☎️(48) 3524-3568📧rodoaraimplementos02@gmail.com📍Alameda Antonio Alves da Silva, 2880Mato Alto - Araranguá /SC"
"NsY-9MCOIAQ","STAYC(스테이씨) 'ASAP' MV","2021-04-08T08:59:59Z","UCod5V2dpnpJLklGvVOv5FcQ","STAYC","24","21.15.04","STAYC|스테이씨|수민|배수민|시은|박시은|아이사|이채영|채영|세은|윤세은|심자윤|자윤|재이|예은|장예은|sumin|sieun|ISA|seeun|yoon|하이업엔터테인먼트|하이업|블랙아이드필승|블아필|highupent","18140421","172287","3199","26113","https://i.ytimg.com/vi/NsY-9MCOIAQ/default.jpg","False","False","STAYC(스테이씨) The 2nd Single Album[STAYDOM]'ASAP' MV[Track List]01. ASAP02. SO WHAT03. 사랑은 원래 이렇게 아픈 건가요04. SO BAD (TAK Remix)#STAYC #스테이씨 #ASAP #수민 #시은 #아이사 #세은 #윤 #재이#Sumin #Sieun #Isa #Seeun #Yoon #J[STAYC Official SNS]Fancafe ▶ http://cafe.daum.net/STAYC​​Youtube ▶  http://youtube.com/c/STAYC​​Instagram ▶ http://instagram.com/stayc_highup​​Twitter ▶ https://twitter.com/STAYC_official​​Facebook ▶ http://bit.ly/3nqGTzf​​Tic Tok ▶ http://tiktok.com/@stayc_official"
"CH9shTvLxoI","SURTEI E CORTEI MEU CABELO CURTO EM CASA!","2021-04-09T16:15:01Z","UCOQ_KwPhg3IZbigiK7NCnfQ","Yasmin Galvão","24","21.15.04","Yasmin Galvão|yasmin|galvão|surtei e cortei meu cabelo curto em casa|surtei|cortei|meu|cabelo|curto|em casa|curtissimo|muito curto|cortei o cabelo","181774","18741","243","0","https://i.ytimg.com/vi/CH9shTvLxoI/default.jpg","True","False","SURTEI E CORTEI MEU CABELO CURTO EM CASA!YEE!https://www.instagram.com/useyeebr/MEU INSTAGRAM:https://www.instagram.com/yasmingalvao_oficial/DRICO ALVES:https://www.instagram.com/dricoalves/CANAL DRICO ALVES:https://www.youtube.com/channel/UC9e9XT9edKDovJHcfjU_1AA"
"3sO-Y1Zbft4","Twenty One Pilots - Shy Away (Official Video)","2021-04-07T17:11:05Z","UCBQZwaNPFfJ1gZ1fLZpAEGw","twenty one pilots","10","21.15.04","twenty one pilots|twenty one pilots scaled and icy|twenty one pilots shy away|shy away official|shy away official video|top shy away|shy away scaled and icy|twenty one pilots official|don't you shy away|twenty one pilots trend|twenty one pilots SAI|tyler joseph|josh dun|21pilots|21pilots shy away|top official video|new twenty one pilots|scaled and icey|shyaway|twenty one pilots livestream|twenty one pilots new album|twentyonepilots","12999391","528382","4436","58876","https://i.ytimg.com/vi/3sO-Y1Zbft4/default.jpg","False","False","Twenty One Pilots - Shy Away (Official Video)Twenty One Pilots official video for Shy Away from the forthcoming album Scaled And Icy, available May 21st on Fueled By Ramen.Twenty One Pilots - Livestream ExperienceMay 21 @ 8PM ET / 5PM PTTickets available at http://live.twentyonepilots.com Stream / Download Shy Away - https://top.lnk.to/SAIPre-order / Pre-Save Scaled And Icy - https://top.lnk.to/SAIDirected by Miles Cable & AJ FavicchioLYRICSWhen I get home,You better not be thereWe're placing bets you won'tShed your modestyAnd the only thing to leave behindIs your own skin on the floorDon't you shy awayManifest a ceiling when you shy awaySearching for that feelingJust like an 'I Love You'That isn't wordsLike a song he wrotethat's never heardDon't you shh...When you get homeYou barely recognize the pictures theyput in a frame'Cause you shed your modestyDon't circle the trackTake what you haveand leave your skin on the floor.Don't you shy awayManifest a ceiling when you shy awaySearching for that feelingJust like an 'I Love You'That isn't wordsLike a song he wrotethat's never heardWhen I get homeBoy, you better not be thereYou're long goneShed your modestyDon't circle the trackJust break the cycle in halfand leave your skin on the floor.Don't you shy awayManifest a ceiling when you shy awaySearching for that feelingJust like an 'I Love You'That isn't wordsLike a song he wrotethat's never heardthat's never heard...an 'I Love You'That isn't wordsLike a song he wrotethat's never heardDon't you shy away.Subscribe for more official content from Twenty One Pilots: https://top.lnk.to/subscribe Site: http://smarturl.it/TOPsiteStore: https://store.twentyonepilots.com Spotify: http://smarturl.it/TOPspotifyFacebook: http://smarturl.it/TOPfacebookInstagram: http://smarturl.it/TOPinstagramTwitter: http://smarturl.it/TOPtwitterTumblr: http://smarturl.it/TOPtumblr#TwentyOnePilots #ShyAway #ScaledAndIcy"
"CzjmD2Tjxhk","A CLARA E EU PINTAMOS O CABELO DA MESMA COR!","2021-04-07T22:27:22Z","UC8_DaAYKn2BYT6wdE2fasWw","Vanessa Lopes","22","21.15.04","vanessa|lopes|clara|maria|garcia|vlog|amigas|cabelo|roxo|salao|amizade|surpresa|namoro","871306","74342","782","2152","https://i.ytimg.com/vi/CzjmD2Tjxhk/default.jpg","False","False","Neste video minha amiga e eu pintamos o cabelo da mesma cor! Me diverti muito fazendo este video e espero que gostem!Deixem ideias nos comentários dos videos que gostariam que fizesse!Amo voces! Neste vídeo um novo morador chegou! Me digam nos comentários o que acharam! Amo vocês! ❤️Me siga nas outras redes =)TikTok: https://vm.tiktok.com/ZSJMyJpSR/Instagram: https://instagram.com/vanessalopesr_?igshid=xi0dpmrgkwc7Twitter: https://twitter.com/vanessalopesr?s=21Sigam todos da mansão: Luccas: https://youtube.com/channel/UCadUaKYqJ5MGIsjnrLEHQEwClara: https://youtube.com/channel/UC3hbOa9SPef18ciKN4iXFhAPedro: https://instagram.com/pedrografiass?igshid=1fupims20448q"
"G7lsa8ytHZs","Adriano Moraes vs. Demetrious Johnson | ONE Championship Full Fight","2021-04-08T03:29:09Z","UCiormkBf3jm6mfb7k0yPbKA","ONE Championship","17","21.15.04","Fights|ONE|ONEFC|ONE Championship|MMA|Mixed Martial Arts|Martial Arts|Bouts|fighter|full fight|free fight|whole fight|latest fight|2020|knockout|knocked out|knockouts|wtf|moment|best|shocking|punch|mma fight|fighting|brawl|grappling|kick|boxing|mma ko|mma knockouts|mma best moments|mma fights|mma moves|mma best fights|analysis|sports|breakdown|bjj|muay thai","899891","15090","603","2465","https://i.ytimg.com/vi/G7lsa8ytHZs/default.jpg","False","False","A sensational KNOCKOUT closed out the historic World Title clash between defending flyweight king Adriano Moraes and all-time great Demetrious Johnson in the main event of ONE on TNT I!#ONEonTNT #ONEChampionshipSubscribe to ONE Championship on YouTube: http://bit.ly/ONECHAMPIONSHIPConnect with ONE Championship: ONE Super App: http://bit.ly/ONESuperAppWebsite: https://onefc.com/ Facebook: https://www.facebook.com/ONEChampionshipTwitter: https://twitter.com/ONEChampionshipInstagram: https://www.instagram.com/ONEChampionshipTikTok: https://www.tiktok.com/@onechampionship"
"I8I4dsvOghY","POR QUE FALEI DE SEPARAÇÃO? CONTEI TUDO - #MAQUIAEFALA","2021-04-07T15:06:13Z","UCZfId64U0uXqaSsAQCsp7Qg","Evelyn Regly","26","21.15.04","Evelyn Regly|Babados da Vida|É do Babado|Humor","811499","62261","875","2567","https://i.ytimg.com/vi/I8I4dsvOghY/default.jpg","False","False","SE INSCREVA NO CANAL http://goo.gl/1XffBSME ACHE NAS REDES SOCIAIS!!!Instagram @evelynreglyMeu Facebook EVELYN REGLYMeu Twitter @evelynreglyMeu Blog edobabado.com.br"
"3rHrijkN_FI","O NOVO MORADOR CHEGOU E PEDIU A CLARA EM NAMORO!","2021-04-08T22:50:09Z","UC8_DaAYKn2BYT6wdE2fasWw","Vanessa Lopes","22","21.15.04","Vanessa|Lopes|Clara|Luccas|Vlog|Amigos|Morador|Casa|Feliz","481325","36183","341","1068","https://i.ytimg.com/vi/3rHrijkN_FI/default.jpg","False","False","Neste vídeo um novo morador chegou! Me digam nos comentários o que acharam! Amo vocês! ❤️Me siga nas outras redes =)TikTok: https://vm.tiktok.com/ZSJMyJpSR/Instagram: https://instagram.com/vanessalopesr_?igshid=xi0dpmrgkwc7Twitter: https://twitter.com/vanessalopesr?s=21Sigam todos da mansão: Luccas: https://youtube.com/channel/UCadUaKYqJ5MGIsjnrLEHQEwClara: https://youtube.com/channel/UC3hbOa9SPef18ciKN4iXFhAPedro: https://instagram.com/pedrografiass?igshid=1fupims20448q"
"Fenrch-Ui5I","AO VIVO - Apresentação do goleiro Vanderlei","2021-04-09T14:41:15Z","UCZD5qcen7lbLPFTjfvdLFcw","Vasco TV","17","21.15.04","Vasco|Vasco da Gama|VascoTV|Futebol Brasileiro","54203","7271","65","323","https://i.ytimg.com/vi/Fenrch-Ui5I/default.jpg","False","False",""
"t2DV__3EYbo","PEGA, PENSA OU PASSA POLÊMICO! (Connect House)","2021-04-07T22:01:25Z","UCdWrhnxuGhLq58PwdBhNxLg","Connect House","22","21.15.04","léo alves tiktok|peggau tiktok|leo alves|pegau|irmã do léo alves|ad mendes|ad|ad oficial|connect house|tik toke|mansão dab|casa de youtubers|iguinorando os meninos|ujoãozinho|a maria clara|dia inteiro|crush|connect hause|beijo|tiktok|teen|kids|Conect house|tiktokers|ujoaozinho|amaria clarinha|lais gomes|vitinho|novos integrantes|pacheco|vitinho e gabi|novo casal|PEGGAU","264317","24343","322","649","https://i.ytimg.com/vi/t2DV__3EYbo/default.jpg","False","False","Connect House BrasilInsta: @connecthousebrasilcontato: contatoconnecthousebrasil@gmail.comEdit :  @AD Mendes"
"9Df9pAqc5S0","Minha primeira briga (histórias da escola)","2021-04-07T22:03:20Z","UC0aX6HfZC9Syi9ATaKBW2Vg","N3RD","24","21.15.04","N3RD|NERD|n3rd|N3rd|N3rdzito|N3rdizito|nerdzito|história|histórias da escola|minha primeira briga","243650","38857","368","8670","https://i.ytimg.com/vi/9Df9pAqc5S0/default.jpg","False","False","Essa é a história da minha primeira briga na escola.Criado por:Matheus Louis"
"78QltZcT7Ws","O Legado de Júpiter | Trailer oficial | Netflix","2021-04-07T13:00:00Z","UCc1l5mTmAv2GC_PXrBpqyKQ","Netflix Brasil","24","21.15.04","Josh Duhamel|Mark Millar|ação|drama|drama netflix|heróis|jupiter's legacy|millarworld|netflix 2021|o legado de júpiter|super|super-herói|super-heróis netflix|série Netflix|teaser|trailer|trailer netflix|trailer oficial","613247","27810","584","1643","https://i.ytimg.com/vi/78QltZcT7Ws/default.jpg","False","False","Nenhum legado é eterno.A primeira geração de super-heróis protegeu o mundo por quase um século. Agora, é a vez de seus filhos lutarem pelos mesmos ideais. Uma criação de Mark Millar, “O Legado de Júpiter” estreia em 7 de maio, só na Netflix.Não perca O Legado de Júpiter, só na Netflix: https://www.netflix.com/JupitersLegacy Inscreva-se: https://bit.ly/31ynwtwSobre a Netflix:A Netflix é o principal serviço de entretenimento por streaming do mundo. São 204 milhões de assinaturas pagas em mais de 190 países com acesso a séries, documentários e filmes de diversos gêneros e idiomas. Quem assina a Netflix pode assistir a quantos filmes e séries quiser, quando e onde quiser, em praticamente qualquer tela com conexão à internet. Assinantes podem assistir, pausar e voltar a assistir a um título sem comerciais e sem compromisso. O Legado de Júpiter | Trailer oficial | Netflixhttps://youtube.com/NetflixBrasil"
"TMjgM3l5l3M","Brawl Stars Animation - The #GoldarmGang Heist","2021-04-07T07:38:23Z","UCooVYzDxdwTtGYAkcPmOgOw","Brawl Stars","20","21.15.04","brawl stars|mobile game|mobile strategy game|mobile rpg|mobile battle royale|battle royale|supercell game|goldarmgang|belle|squeak|wild west|brawl pass","17276351","485638","7781","23227","https://i.ytimg.com/vi/TMjgM3l5l3M/default.jpg","False","False","Download NOW!! ►► https://supr.cl/playbrawlBe a BRAWLER! Subscribe! ►► https://supr.cl/subscribe#GoldarmGang #Brawlstars #BelleFast-paced 3v3 multiplayer and battle royale made for mobile! Play with friends or solo across a variety of game modes in under three minutes.Unlock and upgrade dozens of Brawlers with powerful Super abilities, Star Powers and Gadgets! Collect unique skins to stand out and show off. Battle in a variety of mysterious locations within the Brawliverse!BATTLE IN MULTIPLE GAME MODES- Gem Grab (3v3): Team up and out-strategize the opposing team. Collect and hold 10 gems to win, but get fragged and lose your gems.- Showdown (Solo/Duo): A battle royale style fight for survival. Collect power ups for your Brawler. Grab a friend or play solo - be the last Brawler standing in the rowdiest battle royale yet. Winner take all!- Brawl Ball (3v3): It's a whole new Brawl game! Show off your soccer/football skills and score two goals before the other team. There are no red cards here.- Bounty (3v3): Take out opponents to earn stars, but don’t let them pick you off. The squad with the most stars wins the match!- Heist (3v3): Protect your team’s safe and try to crack open your opponents’. Navigate the map to sneak, blast and blow your way clear to the enemies treasure.- Special Events: Limited time special PvE and PvP game modes.- Championship Challenge: Join Brawl Stars' esports scene with in-game qualifiers!UNLOCK AND UPGRADE BRAWLERSCollect and upgrade a variety of Brawlers with powerful Super abilities, Star Powers and Gadgets! Level them up and collect unique skins.BRAWL PASSComplete quests, open Brawl Boxes, earn Gems, pins and an exclusive Brawl Pass skin! Fresh content every season.BECOME THE STAR PLAYERClimb the local and regional leaderboards to prove you’re the greatest Brawler of them all!CONSTANTLY EVOLVINGLook out for new Brawlers, skins, maps, special events and games modes in the future.PLEASE NOTE! Brawl Stars is free to download and play, however, some game items can also be purchased for real money. If you don't want to use this feature, please disable in-app purchases in your device's settings. Also, under our Terms of Service and Privacy Policy, you must be at least 9 years of age to play or download Brawl Stars.Features:- Team up for real-time 3v3 battles against players from across the world- A fast-paced multiplayer battle royale mode made for mobile- Unlock and collect new, powerful Brawlers - each with a signature attack and Super ability- New events and game modes daily- Battle solo or with friends- Climb to the top of the leaderboards in global and local rankings - Join or start your own Club with fellow players to share tips and battle together- Customize Brawlers with unlockable skins- Player-designed maps offer challenging new terrain to masterFrom the makers of Clash of Clans, Clash Royale and Boom Beach!Support:Contact us in-game via Settings, Help and Support — or visit http://supercell.helpshift.com/a/brawl-stars/Privacy Policy:http://supercell.com/en/privacy-policy/Terms of Service:http://supercell.com/en/terms-of-service/Parent's Guide:http://supercell.com/en/parents/???:https://www.youtube.com/wkbrl"
"gHmReU7wO9g","DRAGON BALL Z NO BRASIL","2021-04-07T15:00:13Z","UCyCd7_a5O3JQJlBFmkgx-dg","Canal Conspiração","23","21.15.04","canal|conspiração|#canalconspiração|dragon ball|dragon ball z|no brasil|brasileiro|paródia|o filme|dublado|goku|live action","382117","23168","624","1383","https://i.ytimg.com/vi/gHmReU7wO9g/default.jpg","False","False","Gogu e seus amigos estão se reunindo para conversar sobre as novidades, porém um ser maligno de outro planeta surge com propósitos tenebrosos, será que Gogu será capaz de proteger a terra?Think Mind Productions: https://www.youtube.com/channel/UChbOvHWhMpQ3CwYC74CJ-mw#DragonBall #DragonBallZ #DragonballSuper DEIXEM AQUELE LIKE, CONSPIREM CONOSCO E COMENTEM!!!Contato Profissional: contatocanalconspiracao@gmail.comFacebook: facebook.com/canalconspiracaoInstagram: instagram.com/canalconspiracaoATENÇÃO: A DIVULGAÇÃO DESTE E OUTROS VÍDEOS DO NOSSO CANAL EM OUTRAS MÍDIAS, COMO FACEBOOK, SOMENTE É PERMITIDA SE O POST FOR DEVIDAMENTE CREDITADO, E O CANAL, INFORMADO DISSO. NÃO PERMITIMOS A REPRODUÇÃO DESDE VÍDEO NO YOUTUBE."
"YSMRYYVXokU","A MOTO NOVA DO RENATO CHEGOU !!","2021-04-08T21:00:07Z","UC_XGgRFoktKUXZVD1_tp7EA","Gui Nobre","24","21.15.04","gui|nobre|gui nobre|gui nobre gameplay|guilherme|londrina|hunters|guinobre|guinobreyt|caçadores de lendas|youtuber de londrina","651644","97457","1666","7242","https://i.ytimg.com/vi/YSMRYYVXokU/default.jpg","False","False","Canal do Rossi: https://www.youtube.com/user/rossimarkuramotoEae galera já deixa o like e se inscreve no canal para não perder nem um video e não esquece de deixar seu comentário!!Meus veículos :Carro Jetta Volkswagen 2012 stage3Moto Xj6 2018 Azul meu BBYamaha R3 BambuJet Ski Spark Trixx 2020Cg Titan 150Contato profissional: guinobrecomercial@gmail.com"
"kXVXapL60iI","SAN LORENZO 1 X 3 SANTOS | BASTIDORES | CONMEBOL LIBERTADORES (07/04/21)","2021-04-07T23:00:20Z","UC0uRT_armQXqds_rjTjqJ0g","Santos Futebol Clube","17","21.15.04","Santos|Santos Futebol Clube|Santos FC|Santos TV|Notícias do Santos|Jogos do Santos|TV Santos|Santos canal oficial|Santos ao vivo|angelo|marinho|lucas braga|san lorenzo|buenos aires|libertadores|conmebol libertadores|conmebol|soy loco por tetra|peixe|nuevo gasometro|ariel holan|holan","133537","11938","70","717","https://i.ytimg.com/vi/kXVXapL60iI/default.jpg","False","False","Mesmo atuando no Nuevo Gasómetro, em Buenos Aires (ARG), o Santos FC não se intimidou com o San Lorenzo, buscou o ataque desde o início e conquistou uma importante vitória por 3 a 1 nesta terça-feira (6), pelo confronto de ida da terceira fase da Conmebol Libertadores de 2021. A noite ainda contou com um momento inesquecível, afinal, #Ângelo fechou o placar na Argentina e tornou-se o jogador mais jovem a marcar um gol na história do torneio continental, com apenas 16 anos, 3 meses e 16 dias. Lucas Braga e Marinho anotaram os outros tentos santistas. #SoyLocoPorTetraInscreva-se na #SantosTV e fique por dentro de tudo o que rola no #Santos: http://bit.ly/146NHFUSubscribe now and stay connected to #SantosFC and your idols everyday!http://bit.ly/146NHFUSantos TV is the official Santos FC channel. Here you can be with your idols all the time. Watch behind the scenes, goals, live broadcasts, hability skills, learn how the club works, exclusive videos, remember historical moments."
