video_id,title,publishedAt,channelId,channelTitle,categoryId,trending_date,tags,view_count,likes,dislikes,comment_count,thumbnail_link,comments_disabled,ratings_disabled,description
"6dAb4fNJ7EA","Luan diz que tem poucas oportunidades no Corinthians com Mancini | Arena SBT (12/04/20)","2021-04-13T04:02:43Z","UCxc3marqP9BJSkQ0_K4mqDg","Arena SBT","17","21.15.04","Arena SBT|Arena SBT ao vivo|Corinthians|Eu e o Benja|Gols do Luan no Corinthians|Luan|Luan Corinthians|Luan Grêmio|Luan Rei da América|Mancini|SBT|SBT ao vivo|Timão|Vagner Mancini|benja|benjamin back|debate esportivo|esporte|futebol|gols do Luan|gols do Luan no Grêmio|programa esportivo","180173","11117","219","2243","https://i.ytimg.com/vi/6dAb4fNJ7EA/default.jpg","False","False","No Arena SBT desta segunda-feira (12), Benjamin Back entrevistou Luan, do Corinthians, e não passou pano. O apresentador fez todas as perguntas que a torcida quer saber.O atacante falou que respeita todas as críticas e tenta tirar proveito do que é construtivo. Quando o Corinthians me contratou eu quis muito vir pra cá. Era meu sonho desde moleque e tendo essa oportunidade eu sabia que seria a chance da minha vida, afirmou ele.O jogador ainda desmentiu os boatos de que estaria caindo na noite ou com depressão. Tudo mentira, acho que as pessoas falam demais. Desde quando eu cheguei no Corinthians eu desfoquei muito fora de campo, porque eu sabia que eu estava realizando um sonho, explicou.Chegada do ManciniLuan ainda afirmou que desde a chegada de Vagner Mancini para comandar o Corinthians, ele teve poucas oportunidades no time. Se perguntar pra qualquer jogador isso faz falta, o ritmo de jogo, disse.Mas tem que perguntar pra ele porque eu não tenho oportunidade de jogar. Se eu não me engano, sou o único ali da frente que não teve sequência de jogos. Eu fico chateado por não jogar. Fico triste de estar no meu time de coração e não ter oportunidade. Eu sei o que a diretoria fez para me contratar, completou.O atleta perguntou para Mancini o que teria que melhorar para ter espaço no clube. Pelo o que eu entendi foi mais uma opção tática, da forma como ele queria montar a equipe. Entendo que por isso ele não tem me colocado, afirmou.#Corinthians #Luan #ArenaSBT #TimãoINCREVA-SE NO CANAL!Site oficial: https://www.sbt.com.br/jornalismo/are...?Instagram: https://www.instagram.com/arenasbt/??Twitter: https://twitter.com/arenasbt??Facebook: https://www.facebook.com/ArenaSBT/"
"Djb9qPZ2QZE","PEDIDO DE NAMORO (VOLTAMOS) !!","2021-04-12T22:09:10Z","UC5eSYzBfquvWTfsX-wwNAWQ","Victor Goes","23","21.15.04","VICTOR GOES|GOES|VLOG|HUMOR|DAILYVLOG|VICTOR GOES PEDIDO DE NAMORO|VICTOR GOES VLOG|VICTOR GOES NAMORO|VICTOR GOES SURPRESA TAMARA|VICTOR GOES SURPRES PRA MINHA EX NAMORADA|VICTOR GOES PEDIDO DE NAMORO TAMARA|TAMARA|VOLTAMOS VICTOR GOES E TAMARA|VOLTEI COM MINHA EX NAMORADA|VOLTAMOS|PEDIDO DE NAMORO|TAMARA E VICTOR GOES|TAMARA MACIEL|NAMORO|MINHA EX NAMORADA|EX NAMORADA","160687","28226","167","2127","https://i.ytimg.com/vi/Djb9qPZ2QZE/default.jpg","False","False","Esse foi um dos momentos mas felizes da minha vida, quem assistiu o vídeo anterior viu que preparei uma surpresa pra minha ex namorada tamara, onde tínhamos acabado a quase três meses, estava super nervoso mas no final deu tudo certo e a reação dela me fez ver que valeu a pena todo esforço no final de tudo.📸Insta: @victorgoes🐥twitter: @viictorgoes📩E-mail: victorprofissional@hotmail.com - Se inscreva pra acompanhar os vídeos - Deixa o like pra receber as notificações e sempre esta atualizado- Compartilha nas redes e me marca, estou sempre repostando"
"9kxSjsOjPkA","PINTEI MEU CABELO DE UMA COR SÓ 😱- Nunca Te Pedi Nada","2021-04-12T21:00:07Z","UCYWtYb0GcYrhDxOykcUpzJw","Nunca Te Pedi Nada","23","21.15.04","maíra medeiros|maira medeiros|nunca te pedi nada","148966","23114","221","1175","https://i.ytimg.com/vi/9kxSjsOjPkA/default.jpg","False","False","Pintei meu cabelo de uma cor só! Um vlogzinho para espairecer, o que acham? Eu tava sem saber o que fazer com o meu cabelo, pensei até em pintar de preto, e aí um belo dia resolvi fazer esse vídeo pintando de uma cor só! Já adianto que tivemos o quê? Participação especialíssima do Bertô! O que achou do resultado? Gostaria que tivesse caído outra cor no sorteio com o Bertô? Deixa aqui nos comentários!Atenção: Este vídeo não é um tutorial!Não se esqueçam de consultar um profissional antes de usar produtos químicos no cabelo, hein?MINHA COLEÇÃO DE ÓCULOS DIFERENTÕES: https://bit.ly/3wS8vSk--MEU LIVRO SAIU!Este livro é coisa de mulher é pra qualquer pessoa que percebe que a nossa sociedade já faz um bom tempo que não é tão igualitária quando o assunto é gênero e outros recortes. Vamos juntas atrás das respostas que nunca nos deram!Compre o livro físico - https://tinyurl.com/ycg4sr63Mora fora do BR? - Compre o e-book - https://tinyurl.com/vkynte8♡ ♡ ♡ ♡ ♡ ♡ ♡ ♡ ♡ ♡ ♡ ♡ ♡ ♡ ♡ ♡ ♡Sigam-me os bons aqui também (pfvr, nunca te pedi nada)Insta: @mairamedeiros_Twitter: @mairamedeirosFacebook: fb.com/mairanuncatepedinadaPlaylists NUNCA TE PEDI UM BBB #BBB21: https://bit.ly/3dg4DlpCOMENTANDO MIMIMI - https://bit.ly/2ECYNsYUNSACOLING  https://goo.gl/ckw3v5ANALISANDO MUSICAS https://goo.gl/BFYiHjEMPODERAMENTO FEMININO https://goo.gl/Ws62FBPERGUNTAS QUE FAZEM PARA - https://goo.gl/a2rsEyCABELO COLORIDO: https://goo.gl/r64XY7FILHOS DA GRÁVIDA DE TAUBATÉ (Podcast com Diva Depressão)Spotify: https://spoti.fi/3poXLH7--Edição por Bruna Efeitos - https://bit.ly/2XD9e7K"
"vqF8DrrBrII","TOWN HALL 14 Is Here! (Clash Of Clans Official)","2021-04-12T11:06:56Z","UCD1Em4q90ZUK2R5HKesszJg","Clash of Clans","20","21.15.04","clash of clans|COC|Clash of Clans Gameplay|Clash of Clans Strategy|Clash of Clans Animation|Clash of Clans Commercial|Clash of Clans Attacks|Clash of Clans Town Hall|Hog Rider|PEKKA|Clan Wars|season challenges|clan war leagues|clash on|clan game|clan games|town hall 14|battle builders|hero pets","9951393","133220","4342","6723","https://i.ytimg.com/vi/vqF8DrrBrII/default.jpg","False","False","Step inside the Jungle...  🌴 Town Hall 14 Update is live! 🌴 Power up your attacks with Hero Pets, make way for the Battle Builders, enjoy the new Starter Challenges  between Town Hall 2 and 6, and much much more! 👉 http://supr.cl/TH14_releasenotes Follow us on our Socials!Twitter ► https://twitter.com/ClashofClans/Instagram ►https://www.instagram.com/clashofclans Facebook ►https://www.facebook.com/ClashofClans Attack. Defend. Strategize. Download for free for mobile devices. http://supr.cl/ThisArmyFrom rage-­filled Barbarians with glorious mustaches to pyromaniac wizards, raise your own army and lead your clan to victory! Build your village to fend off raiders, battle against millions of players worldwide, and forge a powerful clan with others to destroy enemy clans.PLEASE NOTE! Clash of Clans is free to download and play, however some game items can also be purchased for real money Also, under our Terms of Service and Privacy Policy, you must be at least 13 years of age to play or download Clash of Clans.A network connection is also required.FEATURES- Build your village into an unbeatable fortress - Raise your own army of Barbarians, Archers, Hog Riders, Wizards, Dragons and other mighty fighters- Battle with players worldwide and take their Trophies- Join together with other players to form the ultimate Clan- Fight against rival Clans in epic Clan Wars - Build 18 unique units with multiple levels of upgrades- Discover your favorite attacking army from countless combinations of troops, spells, Heroes and Clan reinforcements - Defend your village with a multitude of Cannons, Towers, Mortars, Bombs, Traps and Walls- Fight against the Goblin King in a campaign through the realmChief, are you having problems? Visit http://supercell.helpshift.com/a/clas...Privacy Policy:http://www.supercell.net/privacy-policy/Terms of Service:http://www.supercell.net/terms-of-ser...Parent’s Guide:http://www.supercell.net/parents#clashofclans #townhall14 #heropets #battlebuilders #th14"
"0BreX868M68","Melhores Momentos de São Paulo 1 x 0 Red Bull Bragantino - Rodada 11 - Paulistão A1 Sicredi 2021","2021-04-13T01:11:06Z","UCaf4uhI8ItLyM_6kZ5I5Zdw","Paulistão Sicredi","17","21.15.04","Gol|Gols|Noticias|Esporte|Futebol|Paulistão Sicredi A1|Paulistão|São Paulo|Red Bull Bragantino|Red Bull","64583","897","48","87","https://i.ytimg.com/vi/0BreX868M68/default.jpg","False","False","Melhores Momentos de São Paulo 1 x 0 Red Bull Bragantino - Rodada 11 - Paulistão A1 Sicredi 2021.Imagens: Grupo Globo"
"RGDuYmvcgTU","TITI, BLESS E ZYAN PREPARARAM A SURPRESA MAIS FOFA DA HISTÓRIA DO CANAL","2021-04-13T13:00:08Z","UCTCykZFeSbgMuL2ZzhSyVzg","GIOH","24","21.15.04","Giovanna|Ewbank|Gio|Gioh|Bruno|Gagliasso|Diversão|Celebridades|Estrelas|Na|Cama|Famosos","489939","50968","213","1231","https://i.ytimg.com/vi/RGDuYmvcgTU/default.jpg","False","False","Amores!Hoje é dia dele!! Claro que Titi, Bless e, óbvio, o Baby Z resolveram movimentar a casa para fazer uma surpresa muito fofa para o papito! Realização: PLAY9 (oficialplay9)Garra Animal: @garranimalAcompanhe a gente também no Instagram: @gioh_oficial"
"N1HUpkBvDrU","A CHATA DA MINHA IRMÃ 39/NOITE MAL- ASSOMBRADA","2021-04-11T13:06:05Z","UCz2A8OXLR2xwYE63zWbu7IA","Wiris Viana","23","21.15.04","webséries|novelinha|videosengraçados|wirisviana|achatadaminhairmã|armariamãe","1758931","59877","2589","2694","https://i.ytimg.com/vi/N1HUpkBvDrU/default.jpg","False","False","Este episódio foi escrito por Wiris A. Viana e Vinnicius LimeiraCONTATO E PUBLICIDADE: producaowirisviana@gmail.com → Nosso Clubinho: https://bit.ly/ClubinhoDoWirisRedes sociais→ Instagram: https://bit.ly/InstagramWirisViana→ Tik Tok: https://bit.ly/TikTokDoWiris→ Facebook: https://bit.ly/FacebookDoWiris"
"htSixickuYc","OBRIGADA MEC POR FAZER O MÍNIMO! 🙏 EXPLICANDO A MUDANÇA NO SISU 2021 (Débora Aladim)","2021-04-12T22:05:20Z","UCx7HKmnCIIbRBF2FjAoV0bg","Débora Aladim","27","21.15.04","[none]","104570","16871","86","825","https://i.ytimg.com/vi/htSixickuYc/default.jpg","False","False","🌎 Explicando a mudança no sisu anunciada ontem pelo Ministério da Educação! Retirada da dupla classificação ou nota fantasma. Se você gostou, curta o vídeo e valorize o meu trabalho! ❤️✏️MEUS CURSOS PARA O ENEM:https://www.deboraaladim.com.br/👚👕COMPRE MINHAS CAMISETAS E MOLETONS!https://www.lolja.com.br/parceiros/debora-aladim/✨Instagram: https://www.instagram.com/dedaaladim/📬Contato profissional: profissional.aladim@outlook.com"
"VfGusqihQ04","ESTOU GRAVIDA!!!!🤰🏻 * não é trolagem *","2021-04-12T22:05:08Z","UCnz120SUyIH3wzZc5IyvPdw","Leticia Santos","22","21.15.04","[none]","120059","13381","201","1576","https://i.ytimg.com/vi/VfGusqihQ04/default.jpg","False","False",""
"yv-MFM2BJQI","Como Fazer um Buraco de Minhoca","2021-04-12T19:06:40Z","UCn9Erjy00mpnWeLnRqhsA1g","Ciência Todo Dia","28","21.15.04","buraco de minhoca|universo|espaço|buraco negro|wormhole|astronomia|buracos de minhoca|astrofísica|lenda ou fato|em drive|dark|espaço tempo|tempo|espaço-tempo|tecido espaço-tempo|relatividade|relatividade geral|relatividade geral explicada|relatividade restrita|relatividade de einstein|dilatação do tempo|relatividade especial|teoria da relatividade|viagem no tempo|curiosidades|teoria da relatividade geral|einstein|albert einstein|viagem espacial|viagem","253648","41513","162","2053","https://i.ytimg.com/vi/yv-MFM2BJQI/default.jpg","False","False","Um buraco de minhoca é um atalho no próprio espaço-tempo que nos permite fazer viagens muito mais rápidas. Mas o quão reais eles são? Buracos de minhoca não violam nenhuma lei da física! Mas o que precisaríamos para fazer um?Seja membro do nosso canal para ajudar a manter os vídeos no ar! http://youtube.com/cienciatododia/joinMinhas redes sociais:http://instagram.com/pedrolooshttp://twitter.com/pedroloosNosso podcast: http://anchor.fm/sinapseE-mail: contato@cienciatododia.com.brUm muito obrigado aos apoiadores do Catarse que tornaram esse vídeo possível: Patricia Guedes, René da Silva Bastos, Bruno Pereira, Pedro Amorim, Edilson Gomes, Simone Neves, Eraldo Baroni, Lucas Moreira, Yann Motta, Carlos Vilhena, Rosa Maria de Castro e Mauricio Diegues."
"ZVHrfPS-B_g","PRINCESA FAVELADA - VT Kebradeira // Clipe Oficial","2021-04-11T15:30:16Z","UCugGl9-PodMPbaZAEFlZtuw","VT Kebradeira","10","21.15.04","vt kebradeira|dog malvado|musica|oficial|brega funk|reggaeton|funk|recife|Nordeste|Vt Kebradeira Clipe|Música Nova Vt Kebradeira","944018","105086","1977","4237","https://i.ytimg.com/vi/ZVHrfPS-B_g/default.jpg","False","False","Ouça #PrincesaFavelada em todas as plataformas: http://sl.onerpm.com/princesafaveladaSe insreva no canal e ative o sino de notificações para não perder nenhum lançamentoPRINCESA FAVELADA - VT Kebradeira // Clipe OficialPrincesa FaveladaCristian Bell / Diego Barão / Shylton Fernandes / Marco EstevesLetra:Todo mundo sabe quem é elaA dona da boca mais gostosa que eu beijei Arrepiei só de lembrar o que ela fez comigo da última vez A gente fez amor até as quatroQuando acordei ela já tinha vazado Não teve beijo, só deixou o recadoCafé na cama é coisa do passado Ela é princesa faveladaEla é bagaceira mas também é delicadaDominou meu mundo dando só uma sentadaAquela sentada#VtKebradeira #PrincesaFavelada"
"nMuPfCrpO8c","Pr. Lucas - Medo (Clipe Oficial MK Music)","2021-04-13T14:00:16Z","UCbVwJCxsVbmaP1PFmbGQDeQ","MK MUSIC","10","21.15.04","Pr. Lucas|Medo|Lucas|Clipe Oficial|MK Music|Medo MK Music|Pr. Lucas Medo Clipe|Pr. Lucas Medo|Pr. Lucas Medo Clipe Oficial MK Music|musica gospel|gospel 2021|musicas gospel|louvores 2021|louvores|gospel mais tocadas|louvores de adoração|ao vivo|top gospel 2021|musica gospel 2021|adoração 2021|hinos evangélicos|plataformas digitais|vai passar|o escritor|compositor|louvores de adoração 2021|christian songs 2021|musicas gospel 2021|louvor 2021|mk","206018","17542","122","1637","https://i.ytimg.com/vi/nMuPfCrpO8c/default.jpg","False","False","Clipe oficial da música Medo, novo single do Pr. Lucas, disponível em todas as plataformas digitais.OUÇA NAS PLATAFORMAS DIGITAIS: http://mkmusic.mk/prlucas-medo#PrLucas #Medo #Lançamento #ClipeOficial =========================================• ACESSE A PLAYLIST COMPLETA DO PR. LUCAS: https://gospel.mk/2Yt0nGl• ASSISTA A OUTROS LANÇAMENTOS DO DO PR. LUCAS:Vai Passar: https://gospel.mk/clipevaipassarOstras Feridas: https://gospel.mk/3gDUQFmPintor do Mundo (Ao Vivo): https://gospel.mk/3klRWb7O Lugar (Ao Vivo): https://gospel.mk/2XvOz7J• SIGA A MK MUSIC NAS PLATAFORMAS DIGITAIS: http://gospel.mk/1khCjkF• SIGA PR. LUCAS NAS PLATAFORMAS DIGITAIS: https://gospel.mk/prlucas• INSCREVA-SE NO CANAL MK MUSIC: https://gospel.mk/canalMKMusic• INSCREVA-SE NO CANAL DO PR. LUCAS: http://gospel.mk/2COKRcj=========================================• SIGA A MK MUSIC NAS REDES SOCIAIS:https://www.facebook.com/mkmusicoficialhttps://www.instagram.com/mkmusicbrasilhttps://www.twitter.com/MKMusicBrasil• SIGA O PR. LUCAS NAS REDES SOCIAIS:https://www.facebook.com/prlucasoficial/https://www.instagram.com/prlucasoficial/https://twitter.com/prlucasjnv=========================================MEDOEstou sentindo medoSozinho nesse quarto sem ninguém que eu amo por pertoTô sentindo medoEu tinha tantos planos, mas o meu futuro agora é incertoAinda bem que eu tenho O Senhor cuidando de tudo, tudo, tudo E ainda me amaSei que tem gente orando ajoelhada lá no quarto lembrando de mimE eu aqui tentando juntar forças pra não duvidar do Teu agirOh, Pai, não leve em conta esse medo que enfraquece o meu coraçãoMesmo atemorizadaEu entrego toda a minha vida em Tuas mãosVoltar pra casa agora é uma questão que só o Senhor que vai decidirNão questiono os Teus planosMas se me der mais uns anos pra eu viver felizNo sofá de casa com a família e os amigos que aprendi amarEsse é o meu desejo, mas se não for como o Teu, eu posso aceitarCuida de mim, PaiCuida dos meus, PaiFaz Tua vontadeEu te prometo não vou questionarCuida de mim, PaiCuida dos meus, PaiNão vou deixar a esperança em mim se apagarEu confio em TiEu confio em TiSei que tem gente orando ajoelhada lá no quarto lembrando de mimE eu aqui tentando juntar forças pra não duvidar do Teu agirOh pai não leve em conta esse medo que enfraquece o meu coraçãoMesmo atemorizadaEu entrego toda a minha vida em Tuas mãosVoltar pra casa agora é uma questão que só o Senhor que vai decidirNão questiono os Teus planosMas se me der mais uns anos pra eu viver felizNo sofá de casa com a família e os amigos que aprendi amarEsse é o meu desejo mas se não for como o Teu eu posso aceitarCuida de mim, PaiCuida dos meus, PaiFaz Tua vontadeEu te prometo não vou questionarCuida de mim, PaiCuida dos meus, PaiNão vou deixar a esperança em mim se apagarEu confio em TiEu confio em TiOo oooCuida de mim PaiEu confio em TiCompositor: Pr. Lucas=========================================Pr. Lucas é uma das grandes revelações da música gospel brasileira. Apesar de apenas oito anos de carreira, o cantor e compositor já escreveu seu nome no cenário nacional e internacional, emplacando hits, música em trilha sonora de filme (“Marcas da Vida''), novela (''Gênesis) e uma indicação ao Grammy Latino (2018). Após os bem-sucedidos singles “Ostras Feridas” e “Vai Passar” (feat. com Sarah Farias) apresenta sua nova e inspirada canção, “Medo”. A produção musical é de Josué Godoi, que trabalhou com o cantor nos seus primeiros projetos. A faixa está disponível nos aplicativos de música e o clipe no canal MK Music no YouTube.  “Estamos vivendo momento de dúvidas, incertezas, dores sem precedentes em nossa história e sociedade... Além de nos trancarmos no quarto físico, nos trancamos também emocionalmente. Mas, apesar do título, a música é sobre esperança e fé. É uma oração mesmo a Deus pedindo que cuide de nós, que nos cure... Porque só mesmo o Espírito Santo para tratar nosso coração, enxugar nossas lágrimas, nos dar direção e força para superar obstáculos”, compartilha Pr. Lucas, que é o compositor da faixa e também escreveu o roteiro do clipe.  “Eu estou muito satisfeito com todo o resultado. Até então meu clipe preferido era ‘Ostras Feridas’. Mas conseguimos imprimir uma linguagem cinematográfica com muito sentimento. Foi a primeira experiência que eu tive de gravar um clipe noturno por conta de luz, de uma série de detalhes para conseguirmos o resultado que queríamos. O clipe, com certeza, vai impactar seu coração. Eu queria deixar minha gratidão a MK Music, a toda equipe que me acompanhou, a todas as pessoas que trabalharam até tardão da noite”, adianta. =========================================Este é um lançamento gospel da gravadora MK Music."
"h7wz6nIfAwU","KAMYLINHA PINTOU O CABELO DE PRETO 😱","2021-04-11T20:39:14Z","UC5K2cu7OuDEUFWeRKpeSH9A","Hytalo Santos","24","21.15.04","[none]","898938","62157","2281","0","https://i.ytimg.com/vi/h7wz6nIfAwU/default.jpg","True","False","Vem se divertir com a gente 😱"
"YJw6MELb4OI","14 DICAS PARA FAZER AS COMPRAS DO SUPERMERCADO DURAREM 10X MAIS","2021-04-12T15:00:11Z","UC8mDF5mWNGE-Kpfcvnn0bUg","Me poupe!","22","21.15.04","me poupe|mepoupenaweb|finanças pessoais|educação financeira|canal de finanças|nathalia arcuri|como ganhar dinheiro na internet|finanças para mulheres|dinheiro|nath arcuri|compras no supermercado|como fazer durar mais a compra|aumento de preço|evitar desperdício|como economizar no mercado|como fazer compras no mercado|dicas para compras no supermercado|preço alto","236848","30523","209","1324","https://i.ytimg.com/vi/YJw6MELb4OI/default.jpg","False","False","Só de ir ao supermercado e ver o preço das coisas já é motivo de susto hoje em dia, né minha filha?Muitos PRODUTOS BÁSICOS tiveram AUMENTO DE PREÇO nos últimos meses e qualquer pessoa que faça as compras no supermercado consegue perceber isso. É só prestar atenção em quantos produtos você levava pra casa com 100 reais 6 meses atrás e quantos você leva hoje. Absurdo, eu sei...NATH, MAS SE OS PREÇOS AUMENTAM E MEU SALÁRIO NÃO, O QUE EU POSSO FAZER?.Agora, mais do nunca, é hora de ECONOMIZAR e FAZER RENDER o que você consegue comprar! Por isso, fiz esse vídeo com DICAS PRÁTICAS de como você pode FAZER AS COMPRAS DO SUPERMERCADO DURAREM MAIS aí na sua casa.São técnicas simples mas que, com o tempo, fazem muita diferença e ainda te ajudam a EVITAR DESPERDÍCIO de alimentos. Afinal de contas, comprar já é difícil, então bora fazer durar o máximo que a gente consegue, né?Lá no blog Me Poupe!, tem mais dicas pra você economizar MUITO no mercado! Dá uma olhada aqui: https://bit.ly/3mGPeOY---Assistiu a este vídeo e gostou? A única coisa que a Nath pede é pra você se inscrever no canal! É DE GRAÇA! É só clicar aqui: https://goo.gl/jQ6ApF​​Tá com perdida e perdido? Quer desabafar, agradecer, falar com a Nath e com o time da Me Poupe!?contato@mepoupenaweb.comQuer ser parceira ou parceiro da desfudência?parcerias@mepoupenaweb.comÉ da imprensa, né, minha filha?imprensa@mepoupenaweb.comQuer saber se tem uma vaguinha por aqui?https://mepoupe.gupy.io/​​Aquela cartinha fofa pra Nath e pro time (sim, a gente também gosta!)Caixa Postal: 28235CEP: 01234-970Não quer assistir a Me Poupe!? Você pode ouvir!Estamos em todas as plataformas de podcast!Ouça aqui: https://lnkfi.re/poupecast​​Você pode ler textos que você entende também!http://www.mepoupe.com​​​...Quer a Nath pertinho de você?Segue ela no Insta para dicas diárias:http://instagram.com/nathaliaarcuri​​Quer zoeiras financeiras sem fim?Instagram da Me Poupe!https://www.instagram.com/mepoupenaweb/​​Quer mesmo é dicas de tecnologia barata, né?Segue o Jobs, o nerd da Me Poupe!https://www.instagram.com/jobs.fernando​Ahhh, seu lance é renda variável! É claro que temos!Segue o professor Mira, nosso analista CNPI:http://instagram.com/professormira​​É de renda extra que você precisa?A Bruna, nossa musa da renda extra, te ensina!https://www.instagram.com/bruandriotto/​​Gosta mesmo é do Facebook? Também estamos lá!http://facebook.com.br/mepoupenaweb​​Ah, você é autônoma ou autônomo e quer vender mais? Se inscreve no SOS Me Poupe!https://bit.ly/3dfHHRC​​Toda semana ouça o Me Poupe 89! Tocando o terror na sua vida financeira todas as segundas - às 9hs da manhã na Rádio Rock: https://goo.gl/37kFRp​​Receba as nossas mensagens através do Telegram:http://t.me/mepoupenaweb​​Gostou do vídeo? Curta, compartilha e assine o canal pra não perder o que vem por ai!Enriquecer faz parte da vida!Sonhe, mude de atitude, cuide do seu dinheiro e seja feliz!Assine o Canal de graça e receba as dicas de finanças sem frescura toda semana!"
"gW_76tYGEaY","Live Zé Vaqueiro - O original [Oficial]","2021-04-11T03:30:03Z","UCF1QpivnnDnbM85kPbR-sWA","Zé Vaqueiro","10","21.15.04","[none]","3598348","202711","1746","2311","https://i.ytimg.com/vi/gW_76tYGEaY/default.jpg","False","False","#Live​ #Piseiro #ZéVaqueiroLive Zé Vaqueiro com os seus maiores sucessos.Siga o Zé Vaqueiro nas redes sociais!Siga no Instagramhttp://www.instagram.com/zevaqueiro​Segue no Tiktok https://vm.tiktok.com/ZMe2rFdhLTwitterhttps://twitter.com/zevaqueir0Curta a fanpage no Facebook https://www.facebook.com/zevaqueiroooriginalInscreva-se e ative o sininhohttp://www.YouTube.com/Zevaqueiro​"
