video_id,title,publishedAt,channelId,channelTitle,categoryId,trending_date,tags,view_count,likes,dislikes,comment_count,thumbnail_link,comments_disabled,ratings_disabled,description
"nK3WflCxEXI","Fortnite Item Shop *THIS SHOP IS INSANE!* [March 8th, 2021] (Fortnite Battle Royale)","2021-03-09T00:13:48Z","UCIZP6nCTyU9VV0zIhY7q1Aw","I Talk","20","21.11.03","fortnite|fortnite battle royale|fortnite commentary|italkfortnite|fortnite item shop|fortnite new|fortnite funny|itf|fortnite chapter 2|season 5|fortnite season 5|fortnite item shop today|item shop right now|fortnite item shop right now|march 8 2021|new item shop fortnite today|fortnite item shop no clickbait|fortnite item shop right now today|fortnite update today","405433","15949","354","1835","https://i.ytimg.com/vi/nK3WflCxEXI/default.jpg","False","False","Fortnite Item Shop right now on March 8th, 2021.Let's see what's in the Item Shop today!If you would like to support me with Support A Creator, be sure to use code ITF. You can use that code in the Fortnite Item Shop and the Epic Games Store! Thank you for all the support, it really means a lot to me! #EpicPartnerI Talk is a Fortnite YouTube channel, talking about all things Fortnite Battle Royale! We discuss everything from leaks, patch notes, updates, thoughts and opinions, and any other topics that are relevant! I also do daily Item Shop videos everyday, so if you want to see something that's currently in the Item Shop, you can see that I upload every single day for the Item Shop.---Get Connected---Subscribe to my YouTube Channel: https://www.youtube.com/channel/UCIZP6nCTyU9VV0zIhY7q1Aw?sub_confirmation=1Follow me on Twitter: https://twitter.com/ThisIsITalkFollow me on TikTok: https://www.tiktok.com/@imitalkThumbnails made by CrazyShark, check him out here: https://t.co/vKVkQVmqn8"
"OS8ncSvWg9U","Toyah & Robert’s Sunday Lunch - Toxic","2021-03-07T12:00:13Z","UC9rYtOXUyIDQszsdgBzJy5A","Toyah","10","21.11.03","[none]","679626","11445","434","1914","https://i.ytimg.com/vi/OS8ncSvWg9U/default.jpg","False","False","#FreeBritney #ToyahWillcox #RobertFripp #BritneySpears Toyah & Robert hit it (baby) one more time with their Sunday Lunch outing which this weekend is a love letter to Britney Spears. There’s also bonus footage so keep watching right until the end!  Order a Personalised Artwork by Toyah or a Personalised Aphorism by Robert at https://toyahshop.ccsproducts.co.uk/Order a personalised video message to keep forever..... . from Toyah Willcox: https://celebvm.com/toyahwillcox​  from Robert Fripp: https://celebvm.com/robertfripp"
"Xb6blQtSA8A","TommyInnit makes Minecraft 100000% Funnier..","2021-03-06T18:00:17Z","UCS5Oz6CHmeoF7vSad0qqXfw","DanTDM","20","21.11.03","dantdm|dan tdm|gaming|video games|minecraft|funny","3330089","291959","2338","28655","https://i.ytimg.com/vi/Xb6blQtSA8A/default.jpg","False","False","sub pls : http://bit.ly/TxtGm8Twitch : http://www.twitch.tv/dantdmFollow Me : 🐦 http://www.twitter.com/DanTDM 📷 http://www.instagram.com/DanTDMtommyinnnit joined be in completing minecraft using the lucky blocks minecraft modThanks for playing Tommy : http://www.youtube.com/TommyInnitEdited by: https://twitter.com/NoGoodDavis"
"7Dm096raoDI","2021 All-Star Game Recap: Team LeBron 170, Team Durant 150","2021-03-08T07:01:29Z","UCLd4dSmXdrJykO_hgOzbfPw","Motion Station","17","21.11.03","[none]","243405","4301","114","193","https://i.ytimg.com/vi/7Dm096raoDI/default.jpg","False","False","Team LeBron defeated Team Durant, 170-150. Giannis Antetokounmpo recorded 35 points (16-16 FG, 3-3 3pt FG) for Team LeBron, setting a new All-Star Game record for most FGM without a miss (previously Hal Greer, 8-8 FG on 01/23/1968). Damian Lillard (32 points, eight 3pt FGM) and Stephen Curry (28 points, eight 3pt FGM) combined for 60 points for Team LeBron in the victory. Kyrie Irving tallied 24 points, six rebounds and 12 assists for Team Durant, while Bradley Beal added a team-high 26 points in the losing effort."
"hAm5uC252zk","Boris Johnson warns school reopening will increase transmission","2021-03-08T19:35:39Z","UCw3fku0sH3qA3c3pZeJwdAw","Daily Mail","25","21.11.03","boris johnson|school reopening|transmission","120064","573","2248","2380","https://i.ytimg.com/vi/hAm5uC252zk/default.jpg","False","False","The Department of Health recorded another 4,712 coronavirus cases and 65 deaths, both marking substantial drops on last week's figures, as the 'first step on the roadmap' happens with schools reopening to all pupils, indoor care home visits beginning again and socialising outdoors in pairs allowed. Lockdown-sceptic Tory MPs are calling for the plans to move faster, saying it would be 'odd' for the country to still be in lockdown as cases and deaths get close to zero. But Mr Johnson hit back, saying there was a 'big budget of risk' in reopening schools and that only time would tell if it was the right decision.Original Article: http://www.dailymail.co.uk/news/article-9339051/Coronavirus-UK-announces-4-712-cases-65-deaths.htmlOriginal Video: http://www.dailymail.co.uk/video/news/video-2371134/Video-Boris-Johnson-warns-school-reopening-increase-transmission.htmlDaily Mail Facebook: http://facebook.com/dailymailDaily Mail IG: http://instagram.com/dailymailDaily Mail Snap: https://www.snapchat.com/discover/Daily-Mail/8392137033Daily Mail Twitter: http://twitter.com/MailOnlineDaily Mail Pinterest: http://pinterest.co.uk/dailymailDaily Mail Google+: https://plus.google.com/+DailyMailGet the free Daily Mail mobile app: http://dailymail.co.uk/mobile"
"hjMG8lTxS_o","[LIVE] Zara Larsson Live In Concert","2021-03-08T20:04:55Z","UCjNRJBlxvvS0UXAT2Ack-QQ","Zara Larsson","10","21.11.03","Zara Larsson|Zara|Larsson|TEN Music Group|Sweden|Swede|Music|Pop|Synthpop|Alternative Pop|Singer|Song Writer|Girl|Pop Music|livestream|zara larsson live|zara larsson livestream","509459","26926","754","1511","https://i.ytimg.com/vi/hjMG8lTxS_o/default.jpg","False","False","Poster Girl available: https://ZaraLarsson.lnk.to/PosterGirlThank you @IKEA ​for collaborating on this with me! Read more about the FiftyFifty game https://bit.ly/3cfFo1ZMake a donation https://Help.unicef.org   This International Women’s Day, I will celebrate female empowerment with a live online concert.The COVID-19 pandemic has amplified existing gender inequalities, with women still doing three times more unpaid work in the home than men. An IKEA study found that 1/3 of women say their careers have been held back because they do more in the home than men. Which is why IKEA worked with a relationship expert to launch a game on Instagram Stories that can help start a global conversation about equality at home. This game helps couples (or flatmates) talk about and address any imbalance in the home. We must educate each other, and we must educate women all over the world!Learn more about the FiftyFifty game here https://www.ikea.com/gb/en/campaigns/fiftyfifty-the-card-game-for-everyday-equality-pub7b826150Don’t forget to join the live Premium-exclusive afterparty, straight after the show.It’s only available for YouTube Premium users, so make sure you sign up now!New members can get a free trial: youtube.com/premium​Afterparty: https://youtu.be/d2gd4CGh0Uc​Follow Zara Larsson:https://www.instagram.com/zaralarsson/https://www.facebook.com/ZaraLarssonOfficialhttps://twitter.com/zaralarssonhttp://www.zaralarsson.se/http://www.zaralarssonofficial.com/"
"6VDzezv7atU","LITTLE BIG - SEX MACHINE (Official Music Video)","2021-03-08T09:00:10Z","UCu7TZ_ATWgjgD9IrNLdnYDA","Little Big","10","21.11.03","little|big|sex machine|littlebig|little big sex machine|music|sound|ilich|prusikin|russia|rave|dance|dance music|music video|video|funny|comedy|russian style|party|electronic|official video|pop|little big family|little big music|pop music|литл биг|литлбиг|литл|биг|ильич|илья прусикин|прусикин|клип|музыка|премьера|official music video|little big|little big music video|little big song|sex machine music video|uno|little big eurovision|eurovision 2021|eurovision","4805515","289678","33392","24137","https://i.ytimg.com/vi/6VDzezv7atU/default.jpg","False","False","Listen to SEX MACHINE by Little Big: https://littlebig.lnk.to/sxmachine Written by Ilia Prusikin, Danny ZuckermanProduced by Viktor SibrininOfficial merch / Официальный мерч: https://bit.ly/38i3esINew collection already available! / Новая Коллекция уже на сайте!LITTLE BIG:Instagram: https://www.instagram.com/littlebigbandFacebook: https://www.facebook.com/littlebigbandofficialTikTok: https://www.tiktok.com/@littlebigVK: http://vk.com/littlebigband Telegram: https://t.me/littlebigtgSoundcloud: https://soundcloud.com/littlebigrussiaWebsite: http://littlebig.ruLITTLE BIG production: Idea: Iliya PrusikinScript: Iliya Prusikin, Alina Pasok Director: Alina Pasok, Iliya PrusikinDOP: Alexander PavlovExecutive Producer: Nastya AntipovaArt director: Daria UkhvatovaСostume designer: Masha SivyakovaJunior producer: Ekaterina MironovaStyle: Elmira TulebaevaStylist assistants: Elizaveta Kolmina Property Master: Ekaterina MironovaProduction assistant and props: Roman Konshin, Maxim HarinChief Lighting technician: Stas GerasimovLightening crew: Savchenko Igor, Voytov Aleksey, Kolobayev Aleksandr, Bobin Ivan, Zakharov Vladimir, Avvakumov Denis, Yakovlev Anton, Nurmagomedov Ismail, Lenko Alexander1st AC, 2nd AC: Pavel SmolyakovPlayback: Dmitry ChirukhinCamera crane: Trifonov Gennady, Oskin Mikhail, Titov Oleg, Kozlov MikhailDecorators: Batychko Nikolay, Antonenkov Sergey, Kostikov Dmitry, Lomovtsev Danila, Kantemirov Anatoly, Konovalchuk Andrey and othersPyrotechnics: Markin Pavel, Markin Vladislav, Anisimov Andrey, Petrov Vladimir, Mikhailov AndreyAdministrator: Kolya KatrominAssistants: Balashov Andrey, Stupin Vyacheslav, Tarankov EvgeniyMake-up artist: Masha FrancevichMake-up assistants: Glasha Gurianova, Nepryakhina MariaHair artist: Petr BogdanovHair artist assistants: Bibikova Anastasia, Ushakova Ekaterina, Olga ZhukDancer Coordinator: Emelyanova Maria, Petrovskaya AnnaDesigner: Shulya Choreographer: Dilanyan Sima, Ukraintseva ZhannaEditing: Alina Pasok, Iliya PrusikinColorist: Dmitriy NovikovVFX, CG: Alexandr StepanovSound design: Stas KravetsVideo backstage: Kirill MyagkovPhoto backstage: Akhiyarov Timur, Evgeny RomanovStarring:Iliya PrusikinSonya TayurskayaAnton LissovDmitry KrasilovDilanyan SimaTen VladimirPischasova VladlenaAlexey AlesikovEzhova KseniaCherkashina DariaNazarov AndreyDjouguela ChristianAnischenko NikitaZhenya ArguellesVasily DenisovKuen WooNazarov AndreyUkraintseva ZhannaBystrov AlexanderBondarenko EkaterinaNastya AntipovaTechnical equipment: LKS rental  Special Thanks: Vanya FedotovSergey DuborovAndrey BiryukovAtelier Soultiss, Saint-PetersburgMaxim PastuhovLesha ZalozhukWe express our deep gratitude to Kirovsky Zavod, St. Petersburg, especially to Ekaterina KlyuchnikovaWe express our deepest gratitude to the RIK Containers company for the equipment provided to shoot the video. https://ric-box.ru/ https://www.instagram.com/ricboxru/"
"R5bt_Jed2cw","KSI & Miniminter Ruined my Hair... (Behind the Scenes) Sidemen Barber Shop","2021-03-07T18:31:58Z","UCutBTW0UzX-nCXSaZOM1R2w","JCC","23","21.11.03","Sidemen Barber Shop|sidemen|behind the scenes|jcc","91660","5477","11","173","https://i.ytimg.com/vi/R5bt_Jed2cw/default.jpg","False","False","Subscribe to the Channel to see more ridiculous content! 🔥 ►Can we hit 5000 likes!?🔵Twitter: https://twitter.com/WorldofJCC📸 Instagram: https://www.instagram.com/worldofjcc/👋 Facebook Live: https://www.facebook.com/JCC-113072180820289Music from: https://www.epidemicsound.com/music/featured/#SidemenSunday #Sidemen #JCC"
"UOZpCJhxv-w","Gol D Roger vs Whitebeard | One Piece","2021-03-07T20:00:12Z","UC6pGDc4bFGD1_36IKv3FnYg","Crunchyroll Collection","1","21.11.03","crunchyroll|anime|anime trailer|anime preview|anime full episode|crunchyroll collection|daily clips|anime pv|anime op|anime opening|anime highlights|one piece|ワンピース|wano kuni|wano|one piece episode 965|one piece ep 965|gol d roger|roger|whitebeard|newgate|oden|roger vs whitebeard","3523636","111160","1254","9557","https://i.ytimg.com/vi/UOZpCJhxv-w/default.jpg","False","False","Ep 965: Whitebeard saves Oden from Gol D Roger! Watch One Piece on Crunchyroll: http://got.cr/Watch-OP965Crunchyroll Collection brings you the latest clips, OPs, and more from your favorite anime! Don't have time for a full episode but want to catch up on the best scenes? We've got them! FREE 14-DAY CRUNCHYROLL TRIAL 🌟 https://got.cr/14DaysFree#onepiece #wano #crunchyroll"
"Bddx1q6hdPQ","Doja Cat - Streets (Official Video Trailer)","2021-03-07T21:41:37Z","UCzpl23pGTHVYqvKsgY0A-_w","Doja Cat","10","21.11.03","doja cat|streets|silhouette challenge|hot pink|tik tok 2020|tik tik 2021|best of tik tok|tik tok challenge|rnb|hip hop|model|taxi driver|doja cat trend|ariana grande|megan thee stallion|female rap|best of music|grammy nominees 2021|say so|juicy|how juicy are you|tyga|nikki minaj|official video|trailer|telepatia|kali uchis|cardi b up|wap","2963357","333752","1449","14696","https://i.ytimg.com/vi/Bddx1q6hdPQ/default.jpg","False","False","For all you silly window shoppers…March 9thHot Pink out now: https://smarturl.it/xHotPink​ Subscribe to Doja Cat's Official YouTube Channel: https://smarturl.it/DojaYTSubcribe​ Follow Doja Cat:https://www.facebook.com/DojaCat​https://www.instagram.com/dojacat/​http://www.dojacat.com/​#HotPink​ #DojaCat​ #Streets​"
"SPXsDhNXimY","I ruined Sidemen Sunday","2021-03-07T19:31:23Z","UC1AH7xvzpGOArDbD5kuk25A","Alex Elmslie","24","21.11.03","imallexx|alex elmslie","195483","15094","121","392","https://i.ytimg.com/vi/SPXsDhNXimY/default.jpg","False","False","I ruined Sidemen Sunday...Subscribe and become an Internet Sensation!👕 INTERNET SENSATION SHIRTS 👕http://www.internetsensation.shop● HIGHLIGHTS -  @ImAllexx Live● EBOYS -   @Eboys  ● EBOYS PODCAST -  @The Eboys Podcast  ● TIKTOK -  @ImAllexx  ● TWITTER -   @ImAllexx  ● INSTAGRAM - @imallexx● OUTRO MUSIC - Andrew Applepie - Feel It In My FaceAlex Elmslie or ImAllexx is a YouTube channel based off commentary on events and interests."
"hEoM0Gim1PE","James Arthur Addresses Sidemen Beef","2021-03-07T20:10:40Z","UCpLh6CawAd90bJ9tyDBovTg","True Geordie Xtra","24","21.11.03","James Arthur|James|Arthur|X Factor|Beef|Medicine|KSI|Olajide Olatunji|Tobijizzle|Miniminter|Simon Minter|Behzinga|Wroetoshaw|Vikkstar|Calfreezy|Callux|Drama|True Geordie|True Geordie Podcast|Music|Logan Paul|Jake Paul|DramaAlert|Sidemen|The Sidemen","158463","6511","342","1014","https://i.ytimg.com/vi/hEoM0Gim1PE/default.jpg","False","False","James Arthur talks on the True Geordie Podcast about his beef with the Sidemen.FULL PODCAST 👉🏼 https://www.youtube.com/watch?v=29TMOB-1mWI&t=138sGYMSHARK 👉🏼 https://gym.sh/TrueGeordie📧 Business Email : info@truegeordie.com📹 Main Channel : https://www.youtube.com/truegeordie👑 TG2 Channel : https://www.youtube.com/channel/UCpLh6CawAd90bJ9tyDBovTg⚽️ The Kick Off Channel : https://www.youtube.com/thekickoff 🐦 Twitter : https://twitter.com/TrueGeordieTG📸 Instagram : https://instagram.com/TrueGeordieOfficial"
"ls2x-4GQDrw","How Does A Blind Person Know What Colour Something Is? #Shorts","2021-03-08T10:06:26Z","UChhMknOcAZOQXC1rh0ler-Q","Lucy Edwards","22","21.11.03","[none]","387311","20831","273","595","https://i.ytimg.com/vi/ls2x-4GQDrw/default.jpg","False","False","❤️ FOLLOW ME ONLINE ❤️TikTok 🎵 https://www.tiktok.com/@lucyedwardsblindTwitter 💙 https://twitter.com/lucyedwardsWebsite 💜 www.lucyedwardsofficial.comFacebook 💚 https://www.facebook.com/lucyedwardsofficialFor Business Enquiries 💛 https://www.lucyedwardsofficial.com/contactDo you use a screen reader to access YouTube? This link may help as it's the RSS Feed for my YouTube Channel: 🌻 https://goo.gl/rT4tAV#BritishBlindGirl #LucyEdwards"
"GSljy7YcSLY","Harry and Meghan interview with Oprah Winfrey airing tonight | GMA","2021-03-07T18:39:01Z","UCH1oRy1dINbMVp3UFWrKP0w","Good Morning America","24","21.11.03","harry|and|meghan|oprah|winfrey|interview|anticipated|buckingham|palace|royals|queen|elizabeth|couple|royal|family|grievances|gma|good|morning|america|abcnews|abc|news|p_cmsid=2494279|p_vid=news-76305923|해리 왕자|메건 마클|영국 왕실|오프라 윈프리","376745","2495","410","1633","https://i.ytimg.com/vi/GSljy7YcSLY/default.jpg","False","False","What the highly anticipated interview might mean for Buckingham Palace as the couple is expected to air out grievances with the royal family. Subscribe to GMA's YouTube page:  https://bit.ly/2Zq0dU5 Visit GMA's homepage: https://www.goodmorningamerica.comFollow GMA:TikTok: tiktok.com/@gmaFacebook:facebook.com/GoodMorningAmericaTwitter: twitter.com/gmaInstagram: instagram.com/goodmorningamericaWatch full episodes:abc.go.com/shows/good-morning-americahulu.tv/2YnifTH#GMA #MeghanMarkle #PrinceHarry #OprahWinfrey #BuckinghamPalace #RoyalCouple"
"U42ERi46MOM","We Recreated The McDonalds Menu At Home!","2021-03-06T19:01:57Z","UC9-3c4LzdzT_HvW3Xuti9wg","Calfreezy","24","21.11.03","Soccer|Football|Calfreezy|Rebel|Rebel FC|London|England|How to|Footy|Tekkers|YouTuber|Challenge|Soccer Skills|Football Skill|Trick Shots|Soccer Fails|Football Fails|Tricks|Freestyle Football|funny|comedy|friends|vlog|vlogging|freezy","1036271","63550","508","1852","https://i.ytimg.com/vi/U42ERi46MOM/default.jpg","False","False","🔔: Subscribe & click that notification bell so you don't miss anything!📱: Follow me on my socials so you don't miss anything!:       ► Instagram - http://www.instagram.com/Calfreezy       ► Twitter - http://twitter.com/Calfreezy       ► Twitch - http://www.twitch.tv/Calfreezy       ► Tik Tok - @Calfreezy💻: Join my Discord!        ► https://discord.gg/sHmpz7D"
"1SsB8V7afIw","KS LDN & RONZO TAKE ON THE MUSIC CHALLENGE!! 🎵 😤","2021-03-07T19:00:00Z","UC4KeemgeqYG2Mo3ODwIRacQ","Wall Of Entertainment","23","21.11.03","mkfray|wall of comedy|move to me mkfray|asmxlls|asmxlls move to me|mkfray wall of comedy|joivan wade|percelle ascott|dee kaate|wall of comedy group chat|mkfray and asmxlls|the wall of entertainment|wall of entertainment|asmxlls wall of entertainment|mkfray wall of entertainment|mkfray and asmxlls footasylum|ronzo mkfray|ronzo youtuber|the ronzo family|ks london|ronzo and KS LDN|ronzo and kd ldn music challenge|ronzo wall of comedy|ks ldn wall of comedy","42880","3987","27","145","https://i.ytimg.com/vi/1SsB8V7afIw/default.jpg","False","False","Subscribe to the channel if you like to laugh!: http://bit.ly/1ewcjJv​​#WallOfEntertainment​​ #MusicChallenge Cast:  @Ronzo @KS Ldn __Credits:Executive Producers: @joivan_wade @percelleascott @tafara12Director: Percelle Ascott @percelleascott Producer: Chris Boorman @chris_boorman_photography Producer: Sam Ewen @samewen1Associate Producer: Arnold Jorge @arnoldjorge_ DOP/Camera Op A: Jack Edmonds Camera Op B: Ricardo Mclearly-CampbellCamera Op C: Sebastian TanguiangCamera Op D: Elliott KennedyDIT: Dan Hurst Sound recordist: Adam Hurley @adam_hurley Editor: Jack Edmonds Set Dresser: Claire Haxell-White Caterer: Marie-Olive Ahinrinlude Production Assistant Runner: Adam Benwell @benwe11Location Manager: Colin __The Wall Of Entertainment is the home of UK comedy and Entertainment, founded by Mandem On The Wall.Official Site: https://thewallofentertainment.com/​​TikTok: @thewallofcomedyFacebook: https://www.facebook.com/TheWallOfCom​​...My Snapchat: MOTWSnapInstagram: https://instagram.com/wallofcomedy/​​Twitter: https://twitter.com/thewallofcomedy​​The Wall Of Comedy Shop: https://thewallof.shop/​​Subscribe! http://bit.ly/1ewcjJv"
"OjC4F0CUDS0","Dana White reacts to Israel Adesanya loss at UFC 259 to Jan Blachowicz","2021-03-07T07:46:35Z","UC789h3eqw0H1HqGmIsI26OA","TheMacLife","17","21.11.03","Conor McGregor|UFC|Dana White|MMAFighting|MMAJunkie|TheMacLife|Mac Life|UFC weigh in|ESPN MMA|Jorge Masvidal|Conor McGregor interview|UFC weigh ins|ufc highlights|dana white press conference|ufc|israel adesanya|khabib nurmagomedov|Khabib|conor mcgregor highlights|conor mcgregor funny|Mcgregor|Usman masvidal|Dustin Poirier|UFC 259|Curtis Blaydes|Derrick Lewis|adesanya jan|Israel Adesanya weigh ins|blachowicz|amanda nunes|Adesanya|adesanya highlights","1698304","18856","838","8216","https://i.ytimg.com/vi/OjC4F0CUDS0/default.jpg","False","False","VISIT: http://www.themaclife.comFOLLOW: http://instagram.com/themaclifeofficialFOLLOW: https://twitter.com/MaclifeofficialLIKE: http://facebook.com/themaclife"
"Oy-L-OVwmZQ","First of Many — Women’s History Month 2021","2021-03-03T01:23:50Z","UCK8sQmJBp8GCxrOtXWBpyEA","Google","28","21.11.03","[none]","4371349","58299","7363","4045","https://i.ytimg.com/vi/Oy-L-OVwmZQ/default.jpg","False","False","In the past year, the world searched for “the first woman” more than ever before. In honor of #WomensHistoryMonth, we’re celebrating some of the most notable firsts by women and the many they inspire, from the first woman to break the sound barrier to all of those continuing to break the glass ceiling. Explore more firsts and learn about Google’s commitments to gender equality at https://goo.gle/WomensHistoryMonth. Audio described version here: https://youtu.be/n6Qyxv7kH9Y#FirstofMany #WomensHistoryMonthCREDITS:Google Brand StudioEditorial: Jasmine McCullough - JOINTMusic Supervision and Production Company: Walker Sound Mix: Charlie KeatingVFX/Color/Finish: Chapeau StudiosFootage courtesy of:© 2019 The Recording Academy  Megan Thee Stallion Footage courtesy of 300 Entertainment Missy Elliott Supa Dupa Fly video copyright courtesy of Atlantic Records Video content provided courtesy of USA Gymnastics / NBC Sports Footage and imagery Courtesy of Harpo, Inc. Madam Walker Family Archives/A’Lelia Bundles BioNTech SE 2020, all rights reserved Dr. Maria Schaumayer Stiftung, http://schaumayerstiftung.net/cgi-bin/view.cgi?page=home  Courtesy of Science History Institute SESC Ceará Alice Ball image courtesy of University of Hawaii Library Footage courtesy of The Kitchen Archive, c. 1971–1999. The Getty Research Institute, Los Angeles. MC Sha-Rock is the First Women MC/Rapper of Hip Hop Culture as well as a Founding Member of Hip Hop Culture Candy Bleakz appears courtesy of Chocolate City Limited/ Warner Music Group CL - Rapper, Recording Artist & Performer Sharif Hamza Content provided courtesy of USA Gymnastics / NBC Sports Iga Świątek Footage & Imagery copyright courtesy of Getty Images collections Footage copyright courtesy of Jukin MediaSubscribe to our Channel: https://www.youtube.com/googleTweet with us on Twitter: https://twitter.com/googleFollow us on Instagram: https://www.instagram.com/googleJoin us on Facebook: https://www.facebook.com/Google"
"RAYFXblKn4c","19 Ridiculous Ways to Use Map Art in Minecraft","2021-03-07T16:33:15Z","UC3xZYc4SZUGfRERIvDRGqDQ","Skip the Tutorial","20","21.11.03","skipthetutorial|skip the tutorial|19 Ridiculous Ways to Use Map Art in Minecraft|map art minecraft|minecraft map art|minecraft|minecraft maps|maps in minecraft|pixel art minecraft|minecraft pixel art|minecraft map wall|minecraft map room|minecraft infinity room|infinity room minecraft|map art in minecraft|map art in survival minecraft|map art in survival|minecraft survival map art|skip the tutorial minecraft|minecraft skip the tutorial|maps minecraft","1559455","66754","1388","2837","https://i.ytimg.com/vi/RAYFXblKn4c/default.jpg","False","False","Download Core to play and create PC games for FREE at http://bit.ly/Core-SkiptheTutorialEnter the City Building Jam with $25,000 in prizes: https://citybuildingjam.coregames.com/19 Ridiculous Ways to Use Map Art in Minecraft! Minecraft map art can create some fantastic pixel art to use in your singleplayer and smp worlds. Whether that's a blank infinity matrix room, a news bulletin board messaging system for your friends, or even a 4 panel animation, there are plenty of different ways to use minecraft maps in your survival and creative Minecraft worlds. So, let's see some of the most insane and creative ways to use your minecraft map pixel art in this Skip the Tutorial video.▪Want more? Subscribe Today! ▶https://goo.gl/ZDDJit-OTHER LINKS-▪Follow me on Twitter ▶https://twitter.com/skipthetweets▪Join the Discord ▶https://discord.gg/eqxaSVH▪Check out my Twitch ▶https://www.twitch.tv/skipthetutorial▪Check out my Instagram ▶https://www.instagram.com/skipthetutorial/▪Character done by MagnaGallina ▶https://twitter.com/MagnaGallinaEdited by: https://haleyascharf.com​​Research and map by Jonah WaltersFootage collected by Frankie Mundo------Texture Pack: Vanilla Tweaks https://vanillatweaks.net/picker/resource-packs/------Some music used in this video is courtesy of Mewmore. Make sure to follow their tracks at https://www.youtube.com/user/Mewmore------Portions of this video are copyrighted and owned by Nintendo, and their use is allowed by the Nintendo Game Content Guidelines for Online Video & Image Sharing Platforms (https://www.nintendo.co.jp/networkservice_guideline/en/index.html?n).  All other original content, unless expressly noted otherwise, is ©2021, by the Skip the Tutorial creator, all rights reserved.------Other Credits:I scattered hundreds diamond ore map arts in my server like a madman!https://www.reddit.com/r/Minecraft/comments/fwr4br/i_scattered_hundreds_diamond_ore_map_arts_in_my/I made a moving map art in survival!https://www.reddit.com/r/Minecraft/comments/l2p8he/i_made_a_moving_map_art_in_survival/The History of Map Art - Minecraft/2b2thttps://youtu.be/jUEYVVdmcHUNew York in Minecraft at 1:1 scale - Project Trailer || Building New York in Minecraft #10https://youtu.be/VKXlbhUhDXg"
