video_id,title,publishedAt,channelId,channelTitle,categoryId,trending_date,tags,view_count,likes,dislikes,comment_count,thumbnail_link,comments_disabled,ratings_disabled,description
"Uq-b5CsKN6o","Yasmin Santos - Sinto Muito Mas Não Sinto Mais","2021-04-09T14:00:08Z","UCHK_zRFYfjVXR8wKQGTaVHQ","YasminSantosVEVO","10","21.15.04","yasmin santos 2021|yasmin santos oficial|yasmin santos marilia mendonça|sinto muito mas não sinto mais letra|sinto muito mas não sinto mais status|não sinto mais yasmin santos|yasmin santos as melhores|yasmin santos ao vivo|foguete nao tem ré yasmin|yasmin santos amiga|yasmin santos cd completo|bachata feeling|sertanejo mais tocadas|yasmin santos tipografia|seu beijo eu não beijo mais|ate quando voce puder pagar|Sinto|Muito","861421","11644","530","238","https://i.ytimg.com/vi/Uq-b5CsKN6o/default.jpg","False","False","Vídeo Oficial de Sinto Muito Mas Não Sinto Mais” da Yasmin Santos.Ouça agora e adicione nas suas playlists: https://smb.lnk.to/FogueteNaoTemReEP2Se inscreva também no canal da Yasmin Santos no YouTube: https://SME.lnk.to/YasminSantosnoYTSinto Muito Mas Não Sinto Mais (Chayenne / Filipe Mattos / Rennan Passos / Ruan Soares / V Pereira / Yasmin Santos)Você pode até falar que isso é amorMas fala aqui pra mim quanto é que cê pagou?Pra ela falar o que eu falavaCê tá pagando o que cê ouvia de graçaQue decepção deve ter passadoDeitou com outra com o horário contadoEla vai te amarAté quando cê puder pagarEla vai te iludirAté a sua ficha cairEla vai te amarAté quando cê puder pagarEla vai te iludirAté a sua ficha cairSeu beijo eu não beijo maisSua cama eu não deito maisEu sinto muito mas não sinto maisSeu beijo eu não beijo maisSua cama eu não deito maisEu sinto muito mas não sinto mais-SONY MUSICPresidente: Paulo JunqueiroDiretor A&R: Renê Lavradas JrDiretora de Marketing: Cristiane SimõesGerente A&R: André VilellaCoordenadora A&R: Tatiana LandA&R Audiovisual: Karina TaccoliniLabel Mkt: Daniela RabelloSiga Yasmin Santos nas redes sociais:Facebook: https://www.facebook.com/yasminsantosoficialInstagram: https://www.instagram.com/yasminsantosoficial/Twitter: https://twitter.com/yasminsantos#YasminSantos #SintoMuitoMasNãoSintoMais #FogueteNãoTemRé"
"EFPkkeXFp_I","Bruno & Marrone - Coração de Isca","2021-04-09T15:00:15Z","UCdTX5ycRKPvTUiGu1519u4g","Bruno e Marrone","10","21.15.04","dupla sertaneja|sertanejo|country|romântico|caipira' universitário sertanejo universitário","465176","12174","260","521","https://i.ytimg.com/vi/EFPkkeXFp_I/default.jpg","False","False","Bruno e MarroneCoração de IscaSpotify: https://open.spotify.com/artist/5JXhk...Artista: Bruno & MarroneMúsica: Coração de IscaBruno e Marrone - Coração de Isca (Letra)Aquele eu te amoParecia ser verdade “heim”? Aquele abraço apertado Suspiro forçadoEntão era saudade de alguémTinha que ser logo euA pessoa que mais te entendeu Quando cê largou dele e sofreu Quem fez curativo em você foi euTinha que ser logo euQue escolheu pra cair na armadilha Logo eu, que te amava e não via malíciaCê fez meu coração de isca Tinha um plano em vistaFiz a ponte pra ele voltarEu só fiz o amor dele aumentarCê fez meu coração de isca Tinha um plano em vistaE no filme dele e vocêEu só fiz papel de dublê Vai o Oscar de melhor atriz Pra você(Solo)Tinha que ser logo euA pessoa que mais te entendeu Quando cê largou dele e sofreu Quem fez curativo em você foi euTinha que ser logo euQue escolheu pra cair na armadilha Logo eu, que te amava e não via malíciaCê fez meu coração de isca Tinha um plano em vistaFiz a ponte pra ele voltarEu só fiz o amor dele aumentarCê fez meu coração de isca Tinha um plano em vistaE no filme dele e vocêEu só fiz papel de dublêCê fez meu coração de isca Tinha um plano em vistaFiz a ponte pra ele voltarEu só fiz o amor dele aumentarCê fez meu coração de isca Tinha um plano em vistaE no filme dele e vocêEu só fiz papel de dublê Vai o Oscar de melhor atriz Pra vocêVai o Oscar de melhor atriz Pra vocêCê fez meu coração de iscaREDES SOCIAISWWW.BRUNOEMARRONE.COM.BRFACEBOK: https://www.facebook.com/brunoemarrone/INSTAGRAM: instagram.com/oficialbrunoemarrone Atualizado semanalmente! Ouça todos sucessos do sertanejo com Bruno e Marrone aqui: https://open.spotify.com/playlist/37i9dQZF1DX4LMp7Dggc2V?si=2c32c6ab75734d66&nd=1"
"INnXkoJwV0M","SPACE TODAY - Inteligência Ltda. Podcast #113","2021-04-10T03:27:19Z","UCWZoPPW7u2I4gZfhJBZ6NqQ","Inteligência Ltda.","24","21.15.04","podcast|flow podcast|Rogério Vilela|conversa|bate papo|inteligencia|inteligencia limitada|inteligencia ltda|vilela|convidados|live|ao vivo|space today|astronomia|sergio sacani","457907","21644","258","1564","https://i.ytimg.com/vi/INnXkoJwV0M/default.jpg","False","False","SÉRGIO SACANI é geofísico, entusiasta da astronomia e criador do canal Space Today. Com uma didática acessível e vídeos diários, o canal expõe fatos e curiosidades sobre tecnologia espacial e o Universo. Com isso, Sérgio é a pessoa perfeita para explicar por que o Vilela vive no mundo da lua.Cambly está promovendo a maior promoção do ano!!! Com vagas limitadas apenas para os 2000 primeiros.50% de desconto na plataforma + uma aula grátis utilizando o código INTELIGENCIA50OFF.Acesse o link e participe - https://bit.ly/3eSuy4V 🔪 CORTES DO PODCAST | Inteligência Ltda. https://www.youtube.com/channel/UCvmWNQH4c2T3Triih3lftiw💩 POOPS DO INTELIGÊNCIA | Inteligência Ltda.https://youtube.com/channel/UCJ0Ytcivic_poBtgboxuLQg☎ 📧 Contato: inteligencialimitada@gmail.comQuer mandar presentes para nós? CAIXA POSTAL81969 | CEP: 5619970 | São Paulo - SP#Podcast #RogerioVilela #InteligenciaLtda -----------------ANFITRIÃO: Rogério Vilela - Insta: @vilela | Twitter: @rogeriovilela - Canal de Stand-up: Rogério VilelaCAPTAÇÃO, PRODUÇÃO E EDIÇÃO: Fábrica de QuadrinhosPESQUISA E PAUTA: Fabio MantoanelliREALIZAÇÃO: Fábrica de Quadrinhos"
"uGu6ndhdCXY","Libertadores e Sul-Americana: Sorteio da fase de grupos ao vivo","2021-04-09T17:09:17Z","UCR3TOnFWDeAlT-Ho6LueDmg","SBT","25","21.15.04","arena|arena sbt|benja|benja back|benjamin|benjamin back|champions|champions league|esporte|futebol|libertadores|liga dos campeões|sbt|teo josé","303781","14845","209","502","https://i.ytimg.com/vi/uGu6ndhdCXY/default.jpg","False","False","A Conmebol realiza, nesta 6ª feira (9.abr), o sorteio dos grupos da Copa Sul-Americana e Libertadores para a temporada de 2021. Diferentemente das edições anteriores, os representantes dos clubes que irão disputar os torneios acompanham o evento, realizado em Luque, no Paraguai, remotamente. A medida atende às recomendações dos órgãos sanitários em combate à pandemia do novo coronavírus.Na Sul-Americana, seis equipes brasileiras estão classificadas para a fase de grupos. Além de Corinthians e Athletico-PR, que são cabeças de chave, estão Bahia, Atlético-GO, Ceará e Red Bull Bragantino. Já na Libertadores, as equipes nacionais classificadas são: Palmeiras, Flamengo, São Paulo, Atlético-MG, Internacional e Fluminense. Grêmio e Santos ainda tentam uma vaga pela Pré-Libertadores.Tradicionais rivais da América do Sul, como River Plate (ARG), Boca Juniors (ARG) e Nacional (URU), também estão na disputa."
"0EVVKs6DQLo","Doja Cat - Kiss Me More (Official Video) ft. SZA","2021-04-09T04:00:00Z","UCpTaAz_BxtkUB1qc8JTU_7g","dojacatVEVO","10","21.15.04","doja cat|sza|kiss me more|doja cat kiss me more|doja cat sza|doja|kiss me more video|new doja cat|new sza|planet her|doja cat planet her|streets|doja streets|say so|doja cat rules|tia tamera|kiss me more lyrics|doja cat juicy|hot pink|sza good days|broken clocks|hit different|drew barrymore|sza the weekend|all the stars|supermodel|doja cat live|sza live|doja cat tiktok|new pop|new r&b|silhouette challenge|Doja","19894025","799749","15078","63909","https://i.ytimg.com/vi/0EVVKs6DQLo/default.jpg","False","False","Doja Cat // “Kiss Me More” ft. SZAOut Now // https://smarturl.it/xKMMx 🎧 Put headphones on for a simulated 360 Reality Audio experience🎧“Kiss Me More” was mixed with an immersive #360RA experience in mind, use headphones for the full effect. Stream “Kiss Me More” in full 360 Reality Audio, now available on Tidal, Amazon and Deezer.Register at the link below to redeem your 3-month free trial!Visit: https://cutt.ly/music_com_Doja_Cat*Quantities are limited, while supplies lastSubscribe to Doja Cat's Official YouTube Channel: https://smarturl.it/DojaYTSubcribe​​ Follow Doja Cat:http://www.dojacat.com/​​https://www.instagram.com/dojacat/​​ https://twitter.com/DojaCat https://www.facebook.com/DojaCat​​ Follow SZA:http://szactrl.com​http://instagram.com/sza​http://twitter.com/sza​http://facebook.com/sza___“Kiss Me More” (Official Video)Astronaut: Alex Landi  Director: Warren FuDP: Christopher Ripley Executive Producer: Sara NixProducer: Whitney JacksonCommissioner: Sam HoustonPM: Val PensaPM: Quinci BryantLabel: RCA Records Production Company: Partizan Entertainment1st AD: Ev SalomonProduction Designer: John Richoux with Nomad Art + DesignEditor: Nick Rondeau at Work EditorialColorist: Matt Osborn at Company 3Sound Mixing: Brandon Kim at Therapy StudiosVFX: Roman Bilichenko + Olga Petrishena at Digital Axis and Jumanah Shaheen + Grant Miller + David Lebensfeld at Ingenuity StudiosGame Designer: Christopher RodriguezDirector Reps: Nicole O’Connell + Beatriz Lopez at Hart Represents Team Doja Cat Management: Wassim “Sal” Slaiby, Gordan Dillard, Lydia Asrat, Josh Kaplan, Rachel RowleyCreative Director / Stylist: Brett Alan NelsonTailor: Jesstia UsherStylist Assist: Kristin Ritchie + Samuel WolfeHair: J Stay ReadyMakeup: Ernesto CasillasMakeup Assist: Ivan NunezNails: Saccia LivingstonChoreographer: Cortland Brown Team SZA Management: Terrence Punch Henderson, Roberto retOne Reyes, MeLisa ChaneleStylist: Dianne Garcia, Alejandra HernandezMakeup: Ernesto CasillasHair: Randy Stodghill, Tevin WashingtonNails: Karen Jimenez #dojacat #kissmemore #sza"
"Tr1jTjtsSrI","♫ NEYDAY!!! PSG SUPERA O BAYERN e VINI JR DESTRÓI O LIVERPOOL | Paródia Deixa de Onda - Dennis","2021-04-09T15:03:50Z","UCGFNp4Pialo9wjT9Bo8wECA","FutParódias","17","21.15.04","Futebol|FutParodias|Paródia|futparodia|futeparodia|parodia|fut parodia|fut parodias|Paródia com Jogadores|champions|champions league|ucl|champions futparodias|liga dos campeões|psg|neymar|neyday|adulto ney|neymar futparodias|ney|mbappé|mbappé futparodias|bayern|neuer|borussia|borussia dormund|haaland|reus|city|manchester city|guardiola|kevin de bruyne|foden|vinicius junior|vini jr|real madrid|liverpool|alisson|salah|deixa de onda|paródia deixa de onda|ludmilla","1556708","139522","1049","3944","https://i.ytimg.com/vi/Tr1jTjtsSrI/default.jpg","False","False","Uma paródia de futebol da música Deixa de Onda do Dennis com Ludmilla e Xamã. A Champions tá on fire e os confrontos tão doidos demais! PSG com a dupla de craques voando baixo venceu o Bayern, NeyDay se justificou com show do Neymar e de quebra, brilho do Mbappé. Borussia saiu atrás do City de Guardiola e De Bruyne, mesmo com Haaland. E ainda teve SHOW de Vinicius Júnior!Bora seguir nossas redes? =)👍 INSTAGRAM:https://instagram.com/dezaofutparodiashttps://instagram.com/leonwhosoeverhttps://instagram.com/FutParodias👍 TWITTER:https://twitter.com/dezaodrumondhttps://twitter.com/leonwhosoeverhttps://twitter.com/FutParodias👍 FACEBOOK:https://facebook.com/dezaodrumondhttps://facebook.com/leonwhosoeverhttps://facebook.com/FutParodias-----------------------------------------------------------------------------------------------💻 Edição: Canal iFutMagicLink: https://www.youtube.com/channel/UCn7BfZqsZ6ZyWM1EOzsbelw-----------------------------------------------------------------------------------------------LETRA:Tá... calma aí, sei que não tá nada ganhoSei que o Paris tomou um sufoco danado em campoQue o Bayern ganha tudo com a turma marombada, ahQue tem o jogo da volta e é bom não celebrar na hora erradaQue papo chato, meu truta, deixa de ondaDeixa eu curtir o show do MbamarO Bayern caiu de bunda para o NeymarE pro filho do Dida viciado em brocarCuidado com o Tartaruga que ele aprontaSe tu vacila, ele vai suvacarE com a versão adulta desse NeymarO Bayern sem o TikToker vai... hahahaPrepara o enterro, não é? VaiVai dar entrada na tumbaBonde do Ney, hey, heyO Navas brilhou com a luva, enquanto o NóiaDeixou um peruzinho apetitoso entrarA volta vai ser maluca e a turma imploraPela cura do Marquinhos que sem ele não dáE não deu bom pro Borussia! Haaland quase sumiuQuase que a gente nem viu, se não fosse o toqueQue ele deu pro Reus pegar a killE empatar o game só queO WhattaFoden no finzinho garantiu a vitória no suor e no brioE com o Bruyninho à pampa, City quer buscar a taça da ChampaE a creche forte do Chelsea tá vindo à galopeDeu no Porto um baita golpeCom o rosa no uniformeQue dó do Dragão, não entrou em erupçãoChelsea tomou a frente com as criança...Quem falou do Vini Júnior, que ele só isolava?Se um dia eu critiquei o monstro, eu juro que eu nem lembro de mais nadaQue coisa mais absurda, alguém me contaQuem disse que só serve pra dibrar?Meteuli goli em dupla, pode aturarMelhor que o Vinícius, só o RibamarPoolzão, mas que saia justa, 3x1 contraCom chapeuzinho só pra completarA bigodera graúda tipo o BoratNão salvou o Alissinho do ViniCréu... hahahaVini é o brabo"
"hVNKu2urKCs","🐍💣OFENDEU: Viih Tube HUMILHA Juliette QUE FICA FURIOSA e ARMA PLANO mas VAI SE DAR MAL! Festa BBB21","2021-04-10T12:50:17Z","UCJJIQ6h9ZY4uLUx9CZ2BrMw","Já contei? por Ju Nogueira","24","21.15.04","reality|show|famosos|celebridades|ju nogueira|ja contei|fofoca|treta|babado|babados dos youtubers|ontem|hoje|amanha|videos no youtube|polemica|babados|festa ontem bbb21|festa bbb21|festa video bbb21|juliette talarica video|viih tube chama juliette de talarica video|juliette e thais|thais viih tube","735286","51737","683","3506","https://i.ytimg.com/vi/hVNKu2urKCs/default.jpg","False","False","#BBB21 #PLANTÃOBBB21 #JÁCONTEIBBB21E ontem rolou mais uma festa no BBB21 que teve climão entre Juliette e Viih Tube, isso porque Viih Tube chamou Juliette de Talarica e aparentemente não gostou nada e depois furiosa reclamou! Viih Tube também ofendeu Juliette ao falar que a cabeça dela seria quadrada, vem que eu te conto TUDO!Participantes BBB21:Arthur Picoli, Karol Conká (RECORDE DE REIJEIÇÃO 99,17%) , Caio Afiune, Carla Diaz (44,96%), João Luiz Pedrosa, Camilla de Lucas, Arcrebiano Araújo -O BilL (64,89%) , Pocah, Juliette Feire, Nego Di (98,76%) , Kerline Cardoso (83,5%), Lucas Penteado (DESISTIU), Lumena Aleluia (61,31%) , Rodolffo Matthaus, Gilberto Nogueira, ViihTube, Thaís braz, Projota (91,89%) , Sarah Andrade (76,76%), FiukSEJA MEMBRO E TENHA ACESSO A BABADOS EXCLUSIVOS: https://www.youtube.com/channel/UCJJIQ6h9ZY4uLUx9CZ2BrMw/join🔹🔔 Já Contei? por Ju Nogueira: Tudo que acontece na internet você encontra AQUI EM PRIMEIRA MÃO E SUPER EXPLICADO! (tim tim por tim tim que fala?!) ESTÁ ESPERANDO O QUÊ? SE INSCREVE AGORA E FIQUE POR DENTRO DE TUDO QUE ACONTECE NA INTERNET! 🔺 E TEMOS CAIXA POSTALCaixa POSTAL 15CEP 96750-000Butiá/RS"
"JyGq2UloUz8","ENCONTRO EMOCIONANTE DE ZAYA E SIMARIA","2021-04-08T23:00:04Z","UCPa8vElq5yFo3wV6BY6HqoQ","Simone Mendes","22","21.15.04","simone|simaria|zaya|bebê|tia","2164788","150795","1018","2045","https://i.ytimg.com/vi/JyGq2UloUz8/default.jpg","False","False","Fala, miglos do canal! Hoje tem vlog meu levando minha nova passarinha para conhecer a minha melhor migla e irmã, a Simaria. Quase que a Simaria leva minha pitica pra casa dela, mas eu não ia deixar, me evite! Quer se emocionar também? Aperte o play  coleguinha!"
"e4r44cgKBSU","ASSITA AO VIVO EM PORTUGUÊS Masculino - Quartas de Final The Rip Curl Newcastle Cup","2021-04-10T00:28:19Z","UChuLeaTGRcfzo0UjL-2qSbQ","World Surf League","17","21.15.04","wsl|world|surf|league|pro|surfing|surfer|beach|wave|waves|action|sports|world surf league","268992","0","0","210","https://i.ytimg.com/vi/e4r44cgKBSU/default.jpg","False","True","O WSL Championship Tour está de volta e nos próximos dois meses, todos os olhos estarão voltados para a Austrália. Os melhores surfistas do mundo voltam para quatro eventos consecutivos em todo o continente, começando com a Rip Curl Newcastle Cup apresentada pelo Corona de 1 a 11 de abril. John John Florence e Tyler Wright, recém-conquistados vitórias históricas em Pipeline, buscam permanecer no topo do ranking. A campeã da Vans Triple Crown, Carissa Moore, e o estreante australiano Jack Robinson tentam transformar seu ímpeto North Shore em vitórias em eventos. Siga o caminho para as finais da WSL do Rip Curl e assista ao vivo no worldsurfleague.com.For More Check Out:Can Matt Banting Play Spoiler At The Rip Curl Newcastle Cup? | GETTING HEATED - https://youtu.be/SrUxmKb3xbs​Which Is The Hottest Heat Of The Rip Curl Newcastle Cup Draw? | GETTING HEATED - https://youtu.be/PU1hdCtp6fE​Rip Curl Newcastle Cup Presented By Corona - Day 1 - https://youtu.be/lEGoXdsPIlo​John John Florence Battles Yago Dora, Mikey Wright | Rip Curl Newcastle Cup - Seeding Round heat 3 - https://youtu.be/teJWqkVJhIw​Big Wave Champ Wins It All, Chases Massive North Atlantic Swell To Morocco | BILLY Chapter 1 - https://youtu.be/xzLowIj-DuA"
"kq7zVGoC254","APARTAMENTO NOVO DOS MEUS AMIGOS! ‹ EduKof ›","2021-04-10T15:00:15Z","UCrGnb5RdHA9M6WGmBGYo4ZQ","AM3NlC","22","21.15.04","VLOG|Estados|Unidos|EUA|Brasil|Brazil|Breakmen|Casa|House","369050","35210","249","1111","https://i.ytimg.com/vi/kq7zVGoC254/default.jpg","False","False","Canal de Games: https://goo.gl/BHD7sB♦ Redes Sociais:Instagram: http://goo.gl/hYNGE6 @EduKofTwitter: https://goo.gl/feFHSj @EduKof♦ Contato Comercial: contato-edukof@hotmail.com#EduKof #Breakmen"
"46Z5vj34T4A","Elana Dara - aff...","2021-04-09T14:04:33Z","UCQrMFHy4Tk-e2vu4OSq1GYQ","Elana Dara","10","21.15.04","elana dara|pop|elana|aff|aff elana dara","1186911","23477","298","4110","https://i.ytimg.com/vi/46Z5vj34T4A/default.jpg","False","False","SIGA ELANA NAS REDESInstagram: https://bit.ly/InstaElanaDara​Twitter: https://bit.ly/TWElanaDara​Facebook: https://bit.ly/FBElana​TikTok: https://bit.ly/TikTokElana​#aff​ #ElanaDara_____________________FICHA TÉCNICAGravadora: Warner MusicArtista: Elana DaraEmpresária (Diretora Geral): Mirella De LucaRealização Videoclipe: Lagon FilmesDiretor: Arthur Moric1 Ad: Tony DinizProdutora Executiva: Carol CalliriProdutor De Set: Diego GaleraAssistente De Produção: Diego LucenaAssistente De Produção: Milze TiemiDiretor De Fotografia: Ching C. WangOperador De Estabilizador De Câmera: Miro Moreira1 Ac: Felipe Sampaio2 Ac: Logger Klaus OtiChefe Elétrica: Eurico GonçalvesTécnico de Grua: Rossi JibMotorista Camera Car: Zé LuisFotógrafo: Still BernnieStylist: Dario MittmannAssistente De Styling: Naná MilumbêMaquiagem e Cabelo: Ian RibeiroAssistente De Beleza: Caique MarcianoMotorista Carro de Cena: Luciano GallottaMontagem: Miro MoreiraCollorgrand: Raphael BorghiMoff: Gui FuchsDublê: Gil VilelaMotorista: IsaacCatering: ArcaSegurança de Set: FerreiraLocadora: MonsterItens de Produção: BestUma artista Granola Talentos_____________________LETRAÉ uma garota de cabelo bagunçadoEla usa roupa de maloqueiro safadoÉ como prata em navio pirataÉ preciosa, é cara, é raraÉ mais bonita que amarelo de VangoghEmocionante como Jogo de consoleDeliciosa feito sorvete de flocosQuente igual Marrocos uh la laComo ciência é curiosaMalemolência maravilhosaRisada frouxa é perigosaDeixa de ser trouxa ela só é carinhosaAff... Como ela é lindaE me olhando fica mais bonita aindaEu disse Aff…Como ela é tão lindaUma pena que me iludeAff... Como ela é lindaE me olhando fica mais bonita aindaEu disse Aff…Ela é tão lindaUma pena que me iludeDiretamente do mundo de narniaSó com o cigarrinho de palhaPé no chão e de toalha, gata surrealViralata inconsequente, timida o suficientePra fazer teu pensamento virar ilegalÉ chuva de garoa e temporalContradição mais do que especialComo ela é lindaE me olhando fica mais bonita aindaEu disse Aff…Ela é tão lindaUma pena que me iludeAff... Como ela é lindaE me olhando fica mais bonita aindaEu disse Aff…Ela é tão lindaUma pena que me iludeÉ febre é hitÉ xeque-mateÉ série é filmeÉ desempate é elaÉ final de novelaAmanhece quando a noite caiEla é retorno de JediRomance na medida certaComo ela é lindaE me olhando fica mais bonita ainda Aff…Ela é tão lindaUma pena que me iludeAff... Como ela é lindaE me olhando fica mais bonita aindaAff… Ela é tão lindaUma pena que me iludeAff... Como ela é lindaE me olhando fica mais bonita aindaEu disse Aff…Ela é tão lindaUma pena que me ilude"
"GWfIiFLRDDI","Valesca Mayssa | Tá Nas Mãos de Deus [Clipe Oficial] - De Janeiro a Dezembro","2021-04-09T15:00:17Z","UCpf5YXmzGHC4m5uLCdlrrfA","Todah Music","10","21.15.04","Todah Music|Gravadora Todah Music|Todah|musica gospel|musica pentecostal|gravadora pentecostal|lançamento Todah Music|Valesca Mayssa|Tá Nas Mãos de Deus","429742","31139","271","1475","https://i.ytimg.com/vi/GWfIiFLRDDI/default.jpg","False","False","Clipe da canção Tá Nas Mãos de Deus da Valesca Mayssa que faz parte do projeto de Janeiro a Dezembro lançado pela Todah Music em março/2021.Inscreva-se no canal: https://todahmusic.lnk.to/youtube​----------------------------------------------------------------------------▷ ESCUTE VALESCA MAYSSA NAS PLATAFORMAS DIGITAIS► Dias de Guerra: https://todahmusic.lnk.to/DiasdeGuerra​► Boa Obra: https://todahmusic.lnk.to/BoaObra​► Faz Mover os Céus: https://todahmusic.lnk.to/FazMoverOsCeus​► Vendavais: https://todahmusic.lnk.to/Vendavais​► Vem Pra Fora: https://todahmusic.lnk.to/VemPraFora​► Árvore Cortada Acústico: https://todahmusic.lnk.to/ArvoreCorta...​► O Dono do Fogo: https://todahmusic.lnk.to/ODonodoFogo​► Espírito Santo: https://todahmusic.lnk.to/EspiritoSanto​► To Chegando: https://todahmusic.lnk.to/ToChegando​► Árvore Cortada: https://todahmusic.lnk.to/ArvoreCortada​----------------------------------------------------------------------------▷ SIGA VALESCA MAYSSA NAS REDES SOCIAIS► Instagram: https://valescamayssa.lnk.to/Instagram​► Facebook: https://valescamayssa.lnk.to/Facebook​► Youtube: https://valescamayssa.lnk.to/Youtube​----------------------------------------------------------------------------▷ ESCUTE NOSSAS PLAYLISTS► https://todahmusic.lnk.to/GospelMaisTocadas► https://todahmusic.lnk.to/LouvorPentecostal----------------------------------------------------------------------------▷ VALESCA MAYSSA DE JANEIRO A DEZEMBRO► Clipe Faz Mover os Céus (Janeiro)- https://youtu.be/3KnccDKSCr8​► Clipe Boa Obra (Fevereiro)- https://youtu.be/Ht-9MXK4BQI​► Clipe Dias de Guerra (Março)- https://youtu.be/Kt5dhOvFqfk​----------------------------------------------------------------------------▷ FICHA TÉCNICA► Canção: Tá Nas Mãos de Deus► Composição: Valesca Mayssa  e Jessé Aguiar► Produção Musical, Mix e Master: Tiago Oliveira► Direção de Vídeo: Amaral Alves► Makeup: Kelly Cristina► Fotos e Making Of: Gih Pepsi e Katia Porfírio ► Direção Geral: Alessandro Porfírio► Produção Geral: Todah Produções► Direção Executiva: Todah MusicValesca Mayssa veste : Neide Martins Style----------------------------------------------------------------------------▷ LETRA► Tá Nas Mãos de DeusFugiu do meu controle e logo me assustei,não consegui compreender, onde eu erreiEstava confiante, eu tinha tudo planejado,e no auge do meu fracasso, uma voz tão doce eu escuteiAssumo o controle, tá tudo nas minhas mãos,e eu estou à frente de toda situação.Faço tudo tão perfeito, mas eu faço do meu jeito,descansa o teu coraçãoFoi aí que eu entendi que Ele vai agirTá nas mãos de Deus, Ele sabe fazer melhor que eu,o jeito dEle é melhor que o meu,Eu posso até ficar com medomas o controle Ele não perdeu.Deixa tudo com Deus,entrega tudo pra Deus,Ele sabe o que é melhor.Entrega o controle,deixa tudo nas mãos dEle,Ele sabe o que é melhor.//#deJaneiroaDezembro​​ #ValescaMayssa​​​ #TaNasMaosDeDeus"
"45eaXV6CJOk","SuperM 슈퍼엠 'We DO' MV","2021-04-09T10:00:18Z","UCEf_Bc-KVd7onSeifS3py9g","SMTOWN","10","21.15.04","[none]","7435159","847676","28171","121191","https://i.ytimg.com/vi/45eaXV6CJOk/default.jpg","False","False","SuperM X Prudential’s new single “We DO” is out!Listen and download on your favorite platform: https://smarturl.it/SuperM_WeDO 🔗http://www.prudentialwedo.com SuperM Officialhttps://www.supermofficial.comhttps://www.youtube.com/SuperMhttps://www.instagram.com/SuperMhttps://www.tiktok.com/@superm_smtownhttps://www.twitter.com/SuperMhttps://www.facebook.com/SuperMhttps://www.vlive.tv/channel/9ADC8BPrudential Corporation Asiahttps://www.prudentialcorporation-asia.com/Prudential Corporation Asia is a business unit of Prudential plc of the United Kingdom. Neither Prudential Corporation Asia nor Prudential plc are affiliated in any manner with Prudential Financial, Inc., a company whose principal place of business is in the United States of America or with the Prudential Assurance Company, a subsidiary of M&G plc, a company incorporated in the United Kingdom.#WeDO #PRUxSuperM #SuperM#SuperM_Prudential #SuperM_WeDO"
