video_id,title,publishedAt,channelId,channelTitle,categoryId,trending_date,tags,view_count,likes,dislikes,comment_count,thumbnail_link,comments_disabled,ratings_disabled,description
"Eg7wliu6nRI","Que vaut LEBOUSEUH en sport-automobile ? (s🅱️innala)","2021-05-13T16:00:05Z","UCyPV2XiTRB_VuJqRAPfHAiQ","Romain MONTI","2","21.14.05","inox|michou|lebouseuh|pidi|course|automobile|crash|F1|kart|karting|gokart","45534","4661","11","108","https://i.ytimg.com/vi/Eg7wliu6nRI/default.jpg","False","False","🚀 🏆DEVIENS MEMBRE ET APPRENDS LE PILOTAGE (ou perfectionne-toi) AVEC MOI 🏆🚀https://www.youtube.com/channel/UCyPV2XiTRB_VuJqRAPfHAiQ/join--➥  La chaîne du Bouseuhhttps://www.youtube.com/channel/UCUl7mwOyySfZzUkq4H29nug➥ Abonne-toi à ma chaîne ! https://www.youtube.com/channel/UCyPV2XiTRB_VuJqRAPfHAiQ/?sub_confirmation=1➥ Pour rouler comme nous en 4T et en 2T; c'est à ClotKart que ça se passe🚜 • https://www.clotkart.com/➥ Merci à MyShortmovies pour son travail de cadragehttps://www.youtube.com/channel/UC-w_SewABqUXcru-arPhV8g➥ Ainsi qu'à Battermy (qui a créé une super chaîne YouTube sur le design automobile)https://www.youtube.com/channel/UC4A7tgERyx1xMaRM996RIfQ➥ MontageLoris: https://www.instagram.com/loristresallet/➥ Musique - Silver Lake by NATUR.https://www.youtube.com/channel/UC9JFQbnGECV-6_Z0XukRT1Q--Time code00:00 Intro02:13 Quelle est la voiture préférée du Bouseuh ?02:56 Quelles sont les voitures du Bouseuh ?03:41 Quelle est son expérience en sport-auto ?04:46 Pilotage en kart 4T15:05 Pilotage en kart 2T--➥ Pour me suivre sur mes réseaux :📲• Instagram: http://www.instagram.com/romainmonti📲• Facebook: http://www.fb.com/RomainMontiPilote🕹• Discord: https://discord.gg/t2YrpH7🕹• Twitch: https://www.twitch.tv/romainmonti--➥ Ma boutique en ligne👕• https://teespring.com/fr/stores/la-boutique-officielle--➥ Partenariats uniquement:📟 partenariats.romain.monti@gmail.com--👊 ➥ Pour soutenir la chaîne: https://fr.tipeee.com/romain-monti 👊--Merci aux 3 tipeurs pour votre soutien ! 👊 ❤️Nico, Pierre, Tony BenaphtaliJe le dirai jamais assez, mais ton soutien est essentiel pour le développement de la chaîne. Alors merci à toi, petit pote tipeur de donner la force ! 🕺🏻-Je vous rappelle que le sport-automobile doit être réalisé dans un cadre professionnel, accompagné de professionnels: circuits homologués, organisateurs, moniteurs, assurances, etc...--MON SETUP SIMRACING➥ Ecran Samsung 32’’ incurvé, 144hZ➥ Unité Centrale • Processeur Ryzen 7 5800x • Carte graphique  Asus RTX 3070 Strix OC • Carte graphique  ASUS GeForce ROG STRIX RTX 3070 8G GAMING• Memoire 2x16go Crucial Ballistix 3600mhz • SSD Kingston A2000  2x1 To Nvme • Alimentation Asus ROG Strix 750w • Carte mère Asus Strix B550i Gaming• Boitier Asus Rog Strix Z11 ➥ Chassis JCL NEW V2 noir➥ Casque Hyper X cloud alpha➥  Base - ClubSport Wheel Base V2.5 https://fanatec.com/eu-en/racing-wheels-wheel-bases/wheel-bases/clubsport-wheel-base-v2.5?utm_medium=FAP+Banner&utm_source=romainmonti&utm_campaign=General+Links&a_aid=romainmonti➥ ClubSport Shifter SQ V 1.5 Fanatechttps://fanatec.com/eu-en/shifters-others/clubsport-shifter-sq-v-1.5?utm_medium=FAP+Banner&utm_source=romainmonti&utm_campaign=General+Links&a_aid=romainmonti➥ Volant ClubSport Steering Wheel R300 Fanatechttps://fanatec.com/eu-en/steering-wheels/podium-steering-wheel-r300?utm_medium=FAP+Banner&utm_source=romainmonti&utm_campaign=General+Links&a_aid=romainmonti➥ Pédalier ClubSport Pedals V3 Fanatec https://fanatec.com/eu-en/pedals/clubsport-pedals-v3?utm_medium=FAP+Banner&utm_source=romainmonti&utm_campaign=General+Links&a_aid=romainmonti➥ Podium Advanced Paddle Module Fanatechttps://fanatec.com/eu-en/shifters-others/podium-advanced-paddle-module?utm_medium=FAP+Banner&utm_source=romainmonti&utm_campaign=General+Links&a_aid=romainmonti➥ ClubSport Steering Wheel Formula V2 Fanatechttps://fanatec.com/eu-en/steering-wheels/clubsport-steering-wheel-formula-v2?utm_medium=FAP+Banner&utm_source=romainmonti&utm_campaign=General+Links&a_aid=romainmonti➥ Frein à main ClubSport Handbrake V1.5 Fanatechttps://fanatec.com/eu-en/shifters-others/clubsport-handbrake-v1.5?utm_medium=FAP+Banner&utm_source=romainmonti&utm_campaign=General+Links&a_aid=romainmonti➥ Baquet OMP TRS-E--➥ Merci aux conseils avisés de Jérémie de Sim4u pour avoir une installation qui correspond à mes besoins: https://www.sim4u.fr/➥ Merci à JCL pour leur chassis d'une grande rigidité et d'une grande qualité: https://www.jcl-simracing.com/fr/➥ Merci à LDLC Saint-Priest pour leurs conseils quant à l'écran: https://www.ldlc.com/magasins-ldlc/magasin-470068/69-ldlc-saint-priest/"
"0_6JPyBdKb4","NOUVEAU MODE CATCH BRAWL STARS en mode créatif","2021-05-13T16:29:31Z","UCV3CAvUPaMZai8GxW2fqZAg","Romain Dot Live","20","21.14.05","brawl stars|brawl stars mode|brawl stars mode de jeu|brawl stars catch","53804","5338","82","83","https://i.ytimg.com/vi/0_6JPyBdKb4/default.jpg","False","False","NOUVEAU MODE CATCH BRAWL STARS en mode créatifAbonne toi : https://youtube.com/romaindotlive?sub_confirmation=1🏆 Lien Sponsor : https://www.youtube.com/romaindotlive/join🔗 https://twitter.com/RomainDot"
"j3GN_ZsgjOA","Little Mix - Confetti (Acoustic)","2021-05-14T04:00:14Z","UCssD3_aDYhaG44mwP53CO0w","littlemixVEVO","10","21.14.05","Saweetie|Jade|Leigh-Anne|Perrie Edwards|sweet melody|official music video|lyrics|feat|feature|Drag Queens|Drag UK|Bimini Bon Boulash|Tayce|touch|the search|power|secret love song|shout out to my ex|x factor|reaction|holiday|salute|break up song|bounce back|woman like me|music|pop|lil mix|littel|LM5|wings|icy girl|trio|black magic|remix|girl group|best friend|my type|tap in|back to the streets|freestyle","752082","140551","270","9425","https://i.ytimg.com/vi/j3GN_ZsgjOA/default.jpg","False","False","Little Mix - Confetti (Acoustic Version) Listen to the new single ‘Confetti’ feat Saweetie: http://lttlmx.com/singleconfettiListen to the album 'Confetti': http://lttlmx.com/confetti ‪‬‬‬‬Follow Us On Spotify - https://spoti.fi/2Qk4m4E ‬ ‪‬‬‬‬Listen On Apple Music - https://smarturl.it/LittleMix_AppleMusic ‬Listen On Amazon Music - https://smarturl.it/LittleMix_Amazon ‬Subscribe on YouTube - http://lttlmx.com/SubscribeYT Sign up to our newsletter: http://lttlmx.com/Newsletter ‪‬‬‬‬Follow Little Mix:‬ ‪Instagram - https://www.instagram.com/littlemix/‬ ‪‬‬‬‬‬‬‬‬Twitter - https://twitter.com/LittleMix‬ TikTok - https://smarturl.it/LMTikTok Facebook - https://facebook.com/LittleMixOfficial/‬ ‪‬‬‬‬Musical Director:  Donavan Hepburn Vocal Arrangement: Joshua Alamu Guitar by: Daniel HutchinsonEngineered by: Rob DerbyshireMixed by: Rob DerbyshireLyrics: We wanna celebrate like we in the club every dayGot all my friends here with meAnd I don't need ya, I don't need ya Got this dress up on meSo I don't need your stress up on meBaby, we're done, c'est la vieNow I don't need ya, I don't need ya Should've left your ass from time agoDidn't love me then, but now I doI used to sit at home and cry for youDiamonds on my neck, I shine for youAin't blocking my blessings anymoreNever be the girl I was beforeI'ma let the good things in my life rain down From the sky, drop like confettiAll eyes on me, so V.I.PAll of my dreams, from the sky, drop like confettiDrop it downYou're missin' me, but I'm finally freeI got what I need, so let it rain down like Confetti Flashing lights, I ain't got no worry on my mindKnow that you're mad, I realisedThat I don't need ya, I don't need ya So, DJ, say my name like it's my birthdayYou're just a memoryAnd, boy, I don't need ya, I don't need ya Should've left your ass from time ago (time ago)Didn't love me then, but now I do (now I do)I'ma let the good things in my life rain down From the sky, drop like confettiAll eyes on me (on me, yeah), so v.I.pAll of my dreams, from the sky, drop like confetti (woah)Drop it downYou're missin' me, but I'm finally free (finally free)I got what I need, so let it rain down like confettiDown (Oh, la-la-la)Rain down (oh, la-la-la)Let it, let it rain down (oh, la-la-la) – leigh ad libLet it rain down (oh, la-la-la) -  leigh ad lib From the sky, drop like confetti (yeah)All eyes on me, so V.I.PAll of my dreams (all of my dreams, whoa)From the sky, drop like confettiYou're missin' me (you're missing me)I'm totally free (I'm finally free)I got what I need (I've got what I need)#LittleMix #Confetti #Saweetie #Acoustic"
"Dl8Y7PHlQZE","Le PROBLEME avec les SURVIVAL HORROR - Resident Evil 8 Village - NO SPOIL (CDMP)","2021-05-13T16:41:40Z","UCrt_PUTF9LdJyuDfXweHwuQ","Monsieur Plouf","20","21.14.05","Plouf|Critique|test|vidéotest|review|Monsieur Plouf|opinion|journalisme","47400","5880","39","231","https://i.ytimg.com/vi/Dl8Y7PHlQZE/default.jpg","False","False","Salut, première chronique de Papa Plouf, avec un retour juste à temps pour parler de Resident Evil 8, ou Resident Evil Village. Après un énorme passage à vide, la série Resident Evil était jusqu'à présent sur de bons rails depuis l'encourageant 7ème épisode. Est-ce que le huitième vient enfoncer le clou? Eh bien c'est compliqué. Un jeu qui soulève un problème général qu'ont beaucoup de survival horror à mon avis. Alors bon visionnage :)🎙️ Monsieur Plouf sur d'autres plateformes 🎙️Ma chaîne Twitch: https://www.twitch.tv/monsieurploufLes Podcasts avec Pseudoless: https://anchor.fm/plouf-et-pseudo✨Soutenir la chaîne et m'aider✨S'abonner et mettre la cloche! 🛎️Me faire un don sur Tipeee: https://fr.tipeee.com/monsieur-ploufMe faire un petit don direct via Paypal: https://cutt.ly/uflTcnKMon Utip: https://www.utip.io/monsieurploufMa petite boutique de t-shirts: https://www.tostadora.fr/monsieurploufMettre un like et laisser un commentaire! 📃🖥️ Mes réseaux sociaux 🖥️Twitter: https://twitter.com/MonsieurPloufInstagram: https://www.instagram.com/monsieurploufytbFacebook: https://www.facebook.com/MonsieurPloufLe serveur Discord des Chroniques: https://discord.gg/wCmeYy5Pour me contacter:📧 chroniquesdemonsieur.plouf@gmail.com 📧👍 Crédits pour la vidéo 👍Générique par Mister Flech: https://www.youtube.com/user/MisterFlechLogo par Boris Chiaradia: https://www.borischiaradia.chPosters par: Yue: https://twitter.com/yueartisteContacte-moi, j'ai perdu ton nom! :-/📻 Musiques utilisées dans la vidéo 📻Générique: https://www.youtube.com/watch?v=GWkxnnR9JhUIntro: https://www.youtube.com/watch?v=-1hQgI35SssChronique: https://www.youtube.com/watch?v=jnt7pIfaBRIFin: https://www.youtube.com/watch?v=qBfsAUFifOo🕹️ Nouveau sur la chaîne? 🕹️🎥 La playlist pour découvrir les chroniques: https://www.youtube.com/watch?v=Y-yGAjC9GFs&list=PLhUHOG-bRckvAVuJJoEjCx-ZR5R4H-OdJ&index=2On se voit dans les commentaires ;)Waltz of the Flowers (by Tchaikovsky) by TchaikovskyCreative Commons — Attribution 3.0 Unported— CC BY 3.0https://creativecommons.org/licenses/...Music provided by FreeMusic109 https://youtube.com/FreeMusic109#ResidentEvilVillage #RE8 #Critique #Test #Plouf #ResidentEvil"
"mIcYH6YlkE8","Ce pays utilise un BUG illégal sur MARS... (c'est cheat) - Episode 52 | EarthNG | NationsGlory","2021-05-13T15:30:13Z","UCfznY5SlSoZoXN0-kBPtCdg","Fuze III","20","21.14.05","Minecraft|Fuze|FuzeIII|Fuze III|Serveur|EarthMC|Monde|Map|NationsGlory|NG|Anti-Fuze|Missile|Raptor|Raptor_130|AntiFuze|Pays|Mars|Espace|Fusée|Chunk|Bug|Buggé|Illégal|Interdit|Météorite|Abusé","362362","45295","351","2826","https://i.ytimg.com/vi/mIcYH6YlkE8/default.jpg","False","False","🎯Télécharge ou joue à FRAG PRO Shooter gratuitement : https://bit.ly/3oeFbBFRecevez gratuitement 7€ de ressources : 1 coffre Or 🎉 + 500 pièces 💰 + 50 diamants 💎+ 1 offre spéciale 🎁 juste pour toi !Aujourd'hui, on va enquêter sur un bug particulièrement étrange qu'un pays utilise sur Mars...👕Acheter les peluches Didier: http://fuzeshop.frRejoindre NationsGlory: https://nationsglory.fr/from/FuzeIIIFormulaire de recrutement: https://forms.gle/HpmfQudNmvwoAQYm9🎮Instant Gaming (Jeux à -70%): https://www.instant-gaming.com/fr/giveaway/FUZECREDIT :Musique intro/outro : Disco on Tutti - IncompletechSous licence Creative Commons🎬 Ma chaîne secondaire: https://www.youtube.com/channel/UCzTTYntJHARp5YCxakwUepA📷 Mon Instagram: http://instagram.com/fuzeIII_hd🐦 Mon twitter : http://twitter.com/FuzeIII🔴 Ma chaîne Twitch : http://twitch.tv/FuzeIII💬 Mon Discord: http://discord.gg/fuzeiii👉 Code créateur EpicGames: Fuzele raison"
"YbXMw_qmZJc","L'homme qui a failli tuer HITLER (à 13 minutes près) - HDG #32","2021-05-11T16:00:29Z","UCjxfoYq1vAEGU7KD_C3I48g","Mamytwink","24","21.14.05","Georg Elser|Adolf Hitler|Attentat|Mamytwink|Histoires de Guerre|8 novembre 1939|WW2|Seconde Guerre mondiale","443226","29126","266","1189","https://i.ytimg.com/vi/YbXMw_qmZJc/default.jpg","False","False","Merci à Koober d'avoir sponsorisé la vidéo. Obtenez 40% de réduction sur l'abonnement (500 premiers d'entre vous) en cliquant sur ce lien : https://partners.koober.com/partenaires/mamytwinkDécouvrez l'histoire de Georg Elser, l'ouvrier allemand qui a failli assassiner Adolf Hitler. Pendant un an, il planifie son attentat dans les moindres détails. Mais le 8 novembre 1939, alors qu'Hitler est sur le point d'être éliminé, un événement imprévu vient changer le cours de l'Histoire... à 13 minutes près !Merci à Pierre-Alain de Garrigues d'avoir narré avec merveille cette histoire. N'hésitez pas à nous dire ce que vous en avez pensé. Vous pouvez également le retrouver sur sa chaîne : https://www.youtube.com/user/sainteannaLa vidéo sur l’attentat de la tanière du loup (juillet 1944) : https://youtu.be/7ftbrVDw1VYRetrouvez notre livre « Histoires de guerre » dans toutes les librairies ou commandez-le en ligne. Fnac : https://livre.fnac.com/a14809979/Mamytwink-Histoires-de-guerreMerci à l'historien Patrick Godfard pour son aide dans la préparation de cet épisode.Nouvelle vidéo une fois par mois, le mardi à 18h !Abonnez-vous à la chaîne : https://www.youtube.com/user/Mamytwink?sub_confirmation=1INSTAGRAM➜ https://www.instagram.com/mamytwink/➜ https://www.instagram.com/francoiscalvier/➜ https://www.instagram.com/zecharia_hs/La chaîne de François : https://www.youtube.com/user/francoiscalvierSources de l'épisode : Bénédicte Savoy, Un attentat contre Hitler, procès-verbaux des interrogatoires de Johann Georg Elser, Solin Actes sud, 1998 Didier Chauvet, Georg Elser et l’attentat du 8 novembre 1939 contre Hitler, L’Harmattan, 2018 Site du mémorial de la résistance allemande sur Georg Elser : https://www.georg-elser.de/Site dédié à la vie de Georg Elser : http://www.georg-elser-arbeitskreis.de/"
"50GjhhyfN_Q","H.E.R. - Come Through (Official Video) ft. Chris Brown","2021-05-13T16:00:02Z","UCQT3bmChpmnR5ThhY_ewoOQ","HERMusicVEVO","10","21.14.05","Come through|come thru|come through her|come through her chris brown|h.e.r.|her|her fight for you|judas and the black messiah|lil durk judas|lil durk music|her damage|h.e.r. damage|original soundtrack|nip and jay|what it feels like|fight for you official|fred Hampton|jay z what it feels like|g herbo judas|g herbo|g herbo all black|polo g|polo g last man standing|pooh shiesty|pooh shiesty no profanity|lil|durk","1067282","81180","807","4080","https://i.ytimg.com/vi/50GjhhyfN_Q/default.jpg","False","False","H.E.R. - Come Through” Featuring Chris Brown // Out Now!Stream/Download // https://smarturl.it/xComeThrough Subscribe to H.E.R.'s channel for more official content // https://smarturl.it/HERytSubcribeFollow H.E.R.https://twitter.com/HERMusicx    https://www.instagram.com/hermusicofficial https://www.facebook.com/officialHERmusic http://www.her-official.com Follow Chris Brownhttps://twitter.com/chrisbrownhttps://www.instagram.com/chrisbrownofficial/ https://www.facebook.com/chrisbrown http://www.chrisbrownworld.com/ #HER #ChrisBrown #ComeThrough #RnB #OfficialVideo"
"AB3XxMIs10k","L2B Gang - Toto Riina (Clip Officiel)","2021-05-12T16:00:01Z","UCiADY94gaAZlXpItKC0P26g","L2B Gang Officiel","10","21.14.05","l deux b gang|l2b gang|toto riina|toto rina|totorina|l2b gang toto riina|l2B gang toto rina|rapfr|94 bois|94 bois l2B gang","86162","7830","59","455","https://i.ytimg.com/vi/AB3XxMIs10k/default.jpg","False","False","L2B Gang - Toto Riina (Clip Officiel)Toto Riina, extrait de notre 1er EP 94 Bois disponible sur toutes les plateformes de streaming ➡ https://backl.ink/144796745​Prod by @Dany SynthéMixé par @Adam MonroeMasterisé par @Adil de Saint DenisClip Réalisé par: @Bien vu ProductionsRejoignez nous ici:IG: https://www.instagram.com/l2b_gang/​​​Twitter : https://mobile.twitter.com/l2b_gang​​​Snap KLN: @Killian945Snap D2: @D2gang945Snap IDS: @IdrysblLyrics:Toto RiinaD2 Couplet:GSM appel anonyme C’est l’yencli il veut d’la cocaïne à mortJ’suis connu pour chacun d’mes délitsLe casier est lourd ils ont mes paluches a mortOnt détaille tout ont laisse pas d’tracesCellulaire intracable l’affaire est noirOnt s’fait tous rare comme des cafardsSi j’bétom j’attend mon colis au D3IDS Couplet:Ah c’est donc ça la vie?Entouré d’sale ami Il sont la quand sa va vite Pas quand sa sent l’salamiEveriday sur l’synthéSur le Synthé mais pas celui d’Dany Revente de vitamine j’ai vite changer d’amiJ’ai pris l’oseille j’ai vite change d’habitsPré refrain IDSJ’suis en costard comme Bumpy 300 mille balle dans l’jumpee J’ai grandit j’suis l’gérant du fourC’est plus moi qui sers les junkee Grandi dans la cocaïna ont a aussi d’lamnesia J’ai les codes de la mafia 6,35 comme Toto riina Pré Refrain D2: Le commissaire à tout mis sous scellés j’suis dans une sale histoire Le commissaire a tout mis sur la feuille de compte comme sa pas d’histoire Jme fait tout seul j’ramasse l’oseille Tout sa dans l’noir Trop connue la hess jme suis fait tout seul Laisser moi dans le noir Refrain KLN: Grandi dans la cocaïna ont a aussi d’lamnesia J’ai les codes de la mafia 6,35 comme Toto riina(X2)KLN:Fini d’dormir la faut s’remplir les poches J’en ai marre d’vissére les D sous l’porscheD2: J’ai plus trop d’ennemis depuis qu’jai mon glockeuuh IDS: J’ai toujours la peuStu callé dans l’FrokeuuhKLN Couplet:Dans la zone tout l’monde nous connaît J’ai fait si j’ai fait ça mais j’en suis pas fier Askip c’est nous les gros bonnetsMais c’est fini la street on veut changer d’air Jeune O.GPrêt pour la monnaies J’suis monter sur plusieurs coup avec mes frères Mais tu connaisC’est la vidaEt tant qu’on fera rienC’est la Hess qui nous suivraPré refrain IDSJ’suis en costard comme Bumpy 300 mille balle dans l’jumpee J’ai grandit j’suis l’gérant du fourC’est plus moi qui sers les junkee Grandi dans la cocaïna ont a aussi d’lamnesia J’ai les codes de la mafia 6,35 comme Toto riina Pré Refrain D2: Le commissaire à tout mis sous scellés j’suis dans une sale histoire Le commissaire a tout mis sur la feuille de compte comme sa pas d’histoire Jme fait tout seul j’ramasse l’oseille Tout sa dans l’noir Trop connue la hess jme suis fait tout seul Laisser moi dans le noir Refrain KLN: Grandi dans la cocaïna ont a aussi d’lamnesia J’ai les codes de la mafia 6,35 comme Toto riina(X2)℗ & © 2021 O-VNEE MUSIC X 172 RECORDS"
"aJBL6DNKxYY","Le grand tournoi des Youtubeurs","2021-05-10T15:00:00Z","UCC_r3spMB5i5QKgtdNVO0OQ","Pierre Croce","23","21.14.05","pierre|croce|pierrecroce|funny|marrante|drole|vidéo|vidéos|youtubeur|lol|fun|comedie|comedy|comedien|benjamin|verrecchia","2066859","141300","1420","5183","https://i.ytimg.com/vi/aJBL6DNKxYY/default.jpg","False","False","Le sport est une histoire de respect, malheureusement, on n'a pas respecté le sportLa chaîne de Ben : https://t.ly/TLbqLa chaîne de Louis : https://t.ly/nGp0La chaîne de Lucas : https://t.ly/WHPSLa chaîne de Daniil : https://t.ly/YzQCLa chaîne de Guizzi : https://t.ly/WtyELa chaîne de Michou : https://t.ly/C6d7La chaîne de Darko : https://t.ly/XzYiLa chaîne de Guillaume : https://t.ly/Gkx2Un grand merci à la mairie de Neuilly-sur-Marne pour l'accueil :https://www.neuillysurmarne.fr/Si vous voulez aller faire de l'athlétisme là-bas, voici toutes les infos : https://wdev.nsmathle.fr/Ma seconde chaîne : https://bit.ly/2M4dpYrMon instagram : https://instagram.com/pierrecroce/Mon Twitch : https://www.twitch.tv/mrpierrecroceMontage : Quentin LegacLéane DevimeuxJoffrey RousseauChargés de production : Thomas Mouy / Dylan RongierMerci à Auriane Vanesse"
"5SSmhTAsuvE","CE GÉANT MESURE 2m22 !!","2021-05-11T16:00:56Z","UCpWaR3gNAQGsX48cIlQC0qw","Tibo InShape","24","21.14.05","tibo inshape|teamshape|2m22 géant|grande taille|tibo géant|tibo grande taille|tibo inshape géant|tibo muscu|fitness géant|Tibo inshape grande taille|2m22","1404130","112129","941","4311","https://i.ytimg.com/vi/5SSmhTAsuvE/default.jpg","False","False","Vincent géant de 2m22 nous présente son quotidien !Clique ici pour t'abonner ► http://bit.ly/1qAbjhL & rejoins la TeamShape !Mes vêtements TeamShape ► http://bit.ly/1wXqeD7 Mes compléments Inshape Nutrition ►https://bit.ly/2M9v9QVMes programmes ►https://bit.ly/2TDimHNMa salle de sport ►http://bit.ly/2jaOdSOLien vincent :Instagram : vincent.pourchotSnapchat : Vince.pourchotTikTok : vincentpourchotHARCÈLE-MOI sur : TWITTER : http://bit.ly/1o88uUVINSTAGRAM : http://bit.ly/1Q4RInr (tiboinshape)SNAPCHAT : tiboinshapeTIKTOK : tiboinshapeFACEBOOK : http://on.fb.me/1EcbKmeDISCORD : http://discord.gg/teamshapeSPOTIFY : Tibo InShape - Motivation (playlist)TWITCH : TiboInshapeLiveMon adresse postale : Tibo InshapeCS 5207281012 ALBI CEDEXMon e-mail (business uniquement) ► tiboinshapevideo@gmail.comSi vous lisez cette phrase écrivez « DAAMN » en commentaire !"
"wxDHQT0iBKM","우기 (YUQI) - 'Giant' Official Music Video","2021-05-13T09:00:31Z","UCritGVo7pLJLUS8wEu32vow","(G)I-DLE (여자)아이들 (Official YouTube Channel)","10","21.14.05","kpop|gidle|(여자)아이들|(G)I-DLE|IDLE|여자아이들|아이들|미연|민니|수진|소연|우기|슈화|MIYEON|MINNIE|SOOJIN|SOYEON|YUQI|SHUHUA|큐브|CUBE","3376527","236953","1007","37863","https://i.ytimg.com/vi/wxDHQT0iBKM/default.jpg","False","False","우기 (YUQI) - 'Giant' Official Music VideoComposed, Lyrics by 우기, BOYTOY, Young Sky, Peter Hyun, ChaToneArranged by BOYTOY, Young Sky, Peter HyunI'm on the ropes now, my arms are heavyCan't let them break me downDon't let ‘em pushI hear the voices say I'm not worthyNowhere to run but dig deep(I won’t be afraid)Hesitation got me against the wallNo more mistakes like I made beforeCause I know how to win this timeI'll rise up like a giantHold my head a little higherSo don't you doubt meWhen I'm fighting my lonely nightsStanding tall like a giantYeah I'll be going higherSo don't you doubt meWhen I'm down in my lonely fightsStand up like a giantThe scars in my heart Imma kiss you goodbyeCan't bring me downYou have no rights to say I'm no betterFeeding me liesLeave it with your damn apologiesWon't be needing your same excusesI can be hurt but I'm not afraid (Not afraid)(I won’t be afraid)Hesitation got me against the wallNo more mistakes like I made beforeCause I know how to win this timeI'll rise up like a giantHold my head a little higherSo don't you doubt meWhen I'm fighting my lonely nightsStanding tall like a giantYeah I'll be going higherSo don't you doubt meWhen I'm down in my lonely fightsStand up like a giantStand up like a giantI'll be going my wayHold my head a little higherI'll be going way up higherI'll be going my wayI'll rise up like a giantHold my head a little higherSo don't you doubt meWhen I'm fighting my lonely nightsStanding tall like a giantYeah I'll be going higherSo don't you doubt meWhen I'm down in my lonely fightsStand up like a giantStand up like a giantSo don't you doubt meWhen I'm down in my lonely fights(G)I-DLE Official YouTube: http://www.youtube.com/gidleofficial​​(G)I-DLE Official Twitter: https://twitter.com/G_I_DLE​​(G)I-DLE Official Facebook: https://facebook.com/G.I.DLE.CUBE​​(G)I-DLE Official Instagram: https://instagram.com/official_g_i_dle​​(G)I-DLE Official Weibo: http://weibo.com/cubegidle​​(G)I-DLE Official Fansite: https://www.united-cube.com​​ⓒ All Rights Reserved CUBE Entertainment Inc.#우기​​ #YUQI​​​ #Giant"
"vGVAltxSltc","Escape Game Royal : Qui sortira en premier ?","2021-05-12T15:30:04Z","UCWjwOKRRrxhWeZzgdj4qoMw","Pierre Croce Volume 2","22","21.14.05","[none]","450721","33344","176","650","https://i.ytimg.com/vi/vGVAltxSltc/default.jpg","False","False","- Pour tout savoir sur la fibre Bouygues Telecom : http://bytl.fr/LaFibre-BouyguesTelecom - Testez votre éligibilité à la fibre et découvrez les offres Bouygues Telecom : http://bytl.fr/TestEligFibreUn immense merci à Julie de OnceUponaLock, allez voir son site :https://www.onceuponalock.com/Pour suivre les lives : https://www.twitch.tv/mrpierrecroceMontage : Léane Devimeux et Alexandre SoubeyrandCadreurs : Morgane Mariel et Pierre-Antoine Leroux"
