video_id,title,publishedAt,channelId,channelTitle,categoryId,trending_date,tags,view_count,likes,dislikes,comment_count,thumbnail_link,comments_disabled,ratings_disabled,description
"lXQbXn_3Jd0","17.04.2021 Атлетик - Барселона. Обзор финального матча Кубка Испании","2021-04-17T21:47:32Z","UCtetJiD_llxdGL4Uh5-Oe2w","Матч ТВ","17","21.18.04","Матч ТВ|Спорт|Все на Матч|Матч|Футбол|Гол|Обзор матча|Обзор|Голы|Лучшие моменты|кубок|испании|кубок испании|кубок короля|атлетик|барселона|финал","705965","22754","435","886","https://i.ytimg.com/vi/lXQbXn_3Jd0/default.jpg","False","False","⚽️🔥 Включи и смотри! Больше ста трансляций топовых чемпионатов и еврокубков в месяц:https://matchtv.ru/sport-packageСтатистика матча: https://news.sportbox.ru/Vidy_sporta/Futbol/Evropejskie_chempionaty/Ispaniya/Kubok_Ispanii/stats/turnir_18204/game_1380794129Подписаться на канал: https://www.youtube.com/channel/UCtetJiD_llxdGL4Uh5-Oe2w?sub_confirmation=1Чтобы получать уведомления о новых видео, жмите на колокольчик!Больше видео с лучшими моментами матчей на нашем официальном сайте: https://matchtv.ru/Матч ТВ в соцсетях:ВКОНТАКТЕ: https://vk.com/matchtv  FACEBOOK: https://www.facebook.com/MatchTVChannelTWITTER: https://twitter.com/MatchTVINSTAGRAM: https://www.instagram.com/matchtv_channel/ОДНОКЛАССНИКИ: https://ok.ru/matchtvchannelСкачивайте официальное приложение МАТЧ!:IOS: https://itunes.apple.com/app/apple-store/id1051293689?mt=8ANDROID: https://play.google.com/store/apps/details?id=com.tviztv.tviz2x45&referrer=utm_source%3DMatchTVinVKФото анонса: Soccrates Images / Contributor / Getty Images Sport / Gettyimages.ru"
"LL55C3pgiEo","The Funeral of HRH The Prince Philip, Duke of Edinburgh 🔴 Live - BBC","2021-04-17T15:54:07Z","UCCj956IF62FbT7Gouszaj9w","BBC","25","21.18.04","BBC iPlayer|United Kingdom|British TV|British TV Shows|Watch UK TV Online|Watch British TV Online|Watch British TV Shows Online|Prince Philip funeral live|Royal family|The queen","8318010","0","0","0","https://i.ytimg.com/vi/LL55C3pgiEo/default.jpg","True","True","Huw Edwards introduces live coverage of the ceremonial Funeral of HRH The Duke of Edinburgh from Windsor. Her Majesty The Queen, together with other members of the Royal Family will attend the funeral service. A full military procession and members of the Royal Family will accompany the coffin, as it makes the final journey from Windsor Castle to St George's Chapel.Throughout the afternoon, Huw Edwards will be joined by special guests, including Sir David Attenborough, Baroness Scotland, Alan Titchmarsh, and Baroness Grey-Thompson, to remember the man behind the crown. Royal experts will share their thoughts and analysis on this historic occasion and pay tribute to The Duke of Edinburgh’s life of service and duty.JJ Chalmers and Sophie Raworth in Windsor will report on the events from key locations around the Castle and will meet people participating in today’s ceremonial events.The Funeral of HRH The Prince Philip, Duke of Edinburgh - BBC#BBC #BBCiPlayer #BBCNews #PrincePhilip #DukeOfEdinburgh #RoyalFamilySubscribe and 🔔 to OFFICIAL BBC YouTube 👉 https://bit.ly/2IXqEIn​Stream original BBC programmes FIRST on BBC iPlayer 👉 https://bbc.in/2J18jYJAll our TV channels and S4C are available to watch live through BBC iPlayer, although some programmes may not be available to stream online due to rights. If you would like to read more on what types of programmes are available to watch live, check the 'Are all programmes that are broadcast available on BBC iPlayer?' FAQ 👉 https://bbc.in/2m8ks6v​."
"bDMZYSDlhKg","17.04.2021 Краснодар - Зенит. Обзор матча","2021-04-17T18:20:52Z","UCtetJiD_llxdGL4Uh5-Oe2w","Матч ТВ","17","21.18.04","Матч ТВ|Спорт|Все на Матч|Матч|Футбол|Гол|Обзор|Болельщик|РПЛ|Чемпионат|России|краснодар|зенит","575563","12341","570","1772","https://i.ytimg.com/vi/bDMZYSDlhKg/default.jpg","False","False","⚽️🔥 Включи и смотри! Весь российский футбол в высоком качестве:https://matchtv.ru/channel/premier﻿Статистика матча: https://news.sportbox.ru/Vidy_sporta/Futbol/Russia/premier_league/stats/turnir_17804/game_1380775808Подписаться на канал: https://www.youtube.com/channel/UCtetJiD_llxdGL4Uh5-Oe2w?sub_confirmation=1Чтобы получать уведомления о новых видео, жмите на колокольчик!Больше видео с лучшими моментами матчей на нашем официальном сайте: https://matchpremier.ru/ МАТЧ ПРЕМЬЕР в соцсетях:ВКОНТАКТЕ: https://vk.com/matchpremierFACEBOOK: https://www.facebook.com/matchpremier/TWITTER: https://twitter.com/matchpremierINSTAGRAM: https://www.instagram.com/matchpremier/TELEGRAM: https://t.me/matchpremier_official ОДНОКЛАССНИКИ: https://ok.ru/matchpremierСкачивайте официальное приложение МАТЧ!:IOS: https://itunes.apple.com/app/apple-store/id1051293689?mt=8ANDROID: https://play.google.com/store/apps/details?id=com.tviztv.tviz2x45&referrer=utm_source%3DMatchTVinVKФото анонса: ФК «Зенит»"
"pcW-7plmpvs","ЭЛЕКТРОПАНК 2077: Как мы ПОЖИРАЕМ ЭНЕРГИЮ? — ТОПЛЕС","2021-04-16T08:23:27Z","UC2Ru64PHqW4FxoP0xhQRvJg","ТОПЛЕС","28","21.18.04","топлес|ян топлес|ян лапотков|topless|топлес шоу|я не каспар|янекаспар|tesla|тесла|энергия|илон маск|аккумулятор|турбина|солнечные батареи|транспорт|биотопливо|нефть|бензин|экология|глобальное потепление","1902826","192522","2835","9176","https://i.ytimg.com/vi/pcW-7plmpvs/default.jpg","False","False","Хочешь узнать, чем будут рулить в 2077 году? Загляни в пространство Hyundai MotorStudio на Новом Арбате, 21.Следи за их ивентами и новостями здесь:  https://bit.ly/3sdaaOQЭнергия есть повсюду: в солнце, ветре и воде, надо только протянуть за ней руку. Но люди до сих пор копают, бурят скважины, задыхаются от дыма – и всё это ради того, чтобы сжечь ещё немного нефти или угля, питая наши гаджеты и автомобили. Почему так сложно? Когда уже наступит прекрасное будущее энергетики, где ничего не горит и не портит нам планету? Давайте разбираться в новом выпуске.↓↓↓ДОПОЛНИТЕЛЬНУЮ ИНФОРМАЦИЮ К ВЫПУСКУ ИЩИ ЗДЕСЬ: TELEGRAM ► https://t.me/toplesofficialГРУППА VK ► https://vk.com/toples_showЯ В VK ► https://vk.com/yanlapotkovINSTAGRAM ► https://www.instagram.com/yan_lapotkov/↓↓↓Смотрите больше видео:КОСМОС ► https://goo.gl/uCkfD3ТЕХНОЛОГИИ ► https://goo.gl/vLdH2HИГРЫ ► https://goo.gl/17LhoNЗАГАДКИ ► https://goo.gl/ZUgWGDСТРАХ ► https://goo.gl/b6fu5KКУЛЬТУРА ► https://goo.gl/jn93tzОЧЕНЬ ИНТЕРЕСНЫЕ ► https://goo.gl/PrcrtjРеклама, сотрудничество: toples.show@gmail.com#ТОПЛЕС #ЯНТОПЛЕС #ЯНЛАПОТКОВ #TOPLES ИСТОЧНИКИ: http://bit.ly/toples_energyНад выпуском работали:Ян ЛапотковВадим КуликовМихаил МартыновПавел ЖдановАндрей СавельевАндрей АлексинМаксим БойкоАлександр РепецкийЕкатерина АдаричеваOpsi и уровень БогЧилибон Тёма"
"zioBPiEewpA","Немков vs Дэвис 2 | Лучшие моменты | Bellator 257 | Okko MMA","2021-04-17T07:02:07Z","UC9q_Stc4DXWrUPQ8DFEdWDQ","Okko Спорт","17","21.18.04","немков|немков девис|немков бой|немков победа|вадим немков|немков смотреть|нимков|вадим немков бой|мма|беллатор|немков беллатор|немков мма|немков хайлайт|немков обзор боя|беллатор мма|окко мма|окко спорт|okko|okko sport|okko mma|okko мма|емельяненко|nemkov|bellator|обзор боя немков|обзор боя немкова|обзор немков|бой немков|немков дэвис|немков девис 2","97803","2043","46","352","https://i.ytimg.com/vi/zioBPiEewpA/default.jpg","False","False","Лучшие моменты боя Вадима Немкова и Фила Дэвиса 2 на турнире Bellator 257.Оформите подписку и смотрите Bellator, PFL, BRAVE СF и весь сопутствующий контент на пяти устройствах одновременно: https://okko.tv/s/nemkov17april#okkosport #okkomma #bellator257"
"cdcXMN69zy0","Эти опасные находки мы подняли со дна, где затонул робот во время магнитной рыбалки!","2021-04-18T07:00:21Z","UCj3ZYlmofqiDzt4w00KXljQ","Жизнь Виа","22","21.18.04","жизнь виа|виа|вия|магнитная рыбалка|опасные находки под водой|жуткие находки","114634","10417","414","760","https://i.ytimg.com/vi/cdcXMN69zy0/default.jpg","False","False","Магнитная рыбалка в этот раз заставила нас отправиться туда, где по слухам утонул робот. Мы кинем наш поисковый магнит, чтобы проверить, есть там робот или нет. Мы достанем все опасные и жуткие находки со дна, чтобы узнать, какие находки есть на дне. Поддержать канал: https://www.youtube.com/channel/UCj3ZYlmofqiDzt4w00KXljQ/joinЯ VK: https://vk.com/mega_slavaФАН Клуб ВИА: https://vk.com/viafan_oficialМой Instagram: https://www.instagram.com/mega_slava/#жизньвиа #виа #вия #магнитнаярыбалка #поисковыймагнит #жуткиенаходки #опасныенаходки #поднялисодна #досталисодна #робот #подводой"
"FvJM4u4vZwM","Дикий лейтенант! О нем ДОКЛАДЫВАЛИ ЛИЧНО Гитлеру","2021-04-17T08:00:02Z","UCz92P9cydSoBBYHKl5gBiOg","ЧУЖАЯ ПЛАНЕТА","1","21.18.04","[none]","168697","3116","166","290","https://i.ytimg.com/vi/FvJM4u4vZwM/default.jpg","False","False","Не забудьте подписаться на канал https://www.youtube.com/user/100fakel?sub_confirmation=1  чтобы не пропустить новые и интересные видео.В этом видео речь пойдет о настоящем герое Великой Отечественной Войны, которого уважали солдаты и невзлюбили маршалы. Так уж вышло, что об этом советском офицере очень мало информации и это при том, что его батальон внес неоценимый вклад в оборону Москвы. Он первым использовал оригинальную тактику выхода из окружения, которую по сей день изучают в военных учебных заведениях США и Израиля. О его способностях кошмарить элитные подразделения Вермахта докладывали лично Адольфу Гитлеру. Бауыржан Момышулы"
"l0EC6dvS89M","КЛИП Lady Diana - Hey Boy (Official music video)","2021-04-17T07:00:15Z","UCCB4-saKfwGbUFO2-rRdUqQ","Lady Diana","10","21.18.04","клип леди диана|клип ей бой|песня про парня|песня для девушек|русская песня|песня 2021|песня про подростков|песня про любовь|песня про девочку|песня хит 2021|лучший русский клип|клип блогера|Диана черлидерша|Диана бунтарка","3375401","240537","8418","0","https://i.ytimg.com/vi/l0EC6dvS89M/default.jpg","True","False","КЛИП Lady Diana - Hey Boy (Official music video)Слушать песню суперхит«Hey Boy» в ITUNES, Apple Music, Google Play, SpotifyBOOM https://fanlink.to/ladydianaHEYBOYНовый клип Леди Диана Эй Бой 2021 #ледидиана​ #ladydiana​ #musicvideo​ #clip2021 #videoclip​ #song​ #bestsong​ #partysong​ #teensong​ #heyboy #hitsong #girlsongInstagram: https://www.instagram.com/diankazaichionok/ #ледидиана #ladydiana #данаидиана ПОДПИШИСЬ НА КАНАЛ: https://goo.gl/c5kZPY Новое Видео клип леди Диана Hey Boy: https://youtu.be/l0EC6dvS89M© Юнона Коваленко, Анатолій Коваленко 2021 (Yunona Kovalenko, Anatoliy Kovalenko) Автор идеи: Yunona Kovalenko https://www.instagram.com/kovalenkoyunona/Режиссёр Антон ШатохинInstagram.com/anton_shatohinAVstudio productioninstagram.com/av_studio_production"
"cdPTWK7wmcQ","Kate and Camilla arrive at Duke of Edinburgh's funeral","2021-04-17T15:05:36Z","UCshwRhftzkiov5wKR7M_LsQ","The Independent","25","21.18.04","Funeral|Duke of Edinburgh|Prince Philip|Windsor|Royal|UK|troops|Marching|Parade|St George's Chapel|Death|Windsor Castle|News|Duchess of Cornwall|Duchess of Cambridge|Kate Middleton","1193013","4151","391","452","https://i.ytimg.com/vi/cdPTWK7wmcQ/default.jpg","False","False","The Duchess of Cambridge and the Duchess of Cornwall arrive for the funeral of the Duke of Edinburgh at Windsor Castle.The Queen and her family gathered to say farewell to the Duke of Edinburgh, who died just over a week ago at Windsor.Kate Middleton arrived at St George’s Chapel wearing a pearl necklace known as the Four-Row Japanese Pearl Choker.The necklace was loaned to Kate by the Queen from the Royal Collection after it was given to Her Majesty by the Japanese Government.Kate previously wore the statement necklace in 2017 at a dinner to commemorate the 70th wedding anniversary of Prince Philip and the Queen.Read more here: https://www.independent.co.uk/life-style/royal-family/prince-philip-funeral-kate-middleton-pearl-necklace-meaning-b1833126.htmlLike us on Facebook: https://www.facebook.com/TheIndependentOnlineFollow us on Twitter: https://twitter.com/IndependentFollow us on Instagram: https://www.instagram.com/the.independentSubscribe to Independent Premium for exclusive content and live events: https://bit.ly/2MiOONB"
"k_7-tANhiVo","Прямо в храме! Елизавета 2 зарыдала.Она сидела одна - На глазах слезы! 73 года любви – прямо у гроба","2021-04-17T17:00:14Z","UCl8RpdIo3cj8wfV9bb7IX0Q","Новости в Мире звёзд","22","21.18.04","знаменитости|шоу-бизнес|публичные люди|личная жизнь|звездные дети","357971","3132","391","604","https://i.ytimg.com/vi/k_7-tANhiVo/default.jpg","False","False","Вот о чем идет речь! ➔ Наш сайт: https://novostivmire.com/➔Instagram - https://www.instagram.com/vmirenovosti/➔ Твиттер - https://twitter.com/VmireNovosti ➔ Facebook - https://www.facebook.com/novostivmire/?ref=aymt_homepage_panel#Новости_в_мире #люди#путь"
"n3BR9j0vp_s","КСЕНИЯ ДУКАЛИС РЕШАЕТ ЕГЭ ПО ЛИТЕРАТУРЕ","2021-04-17T14:04:12Z","UCp7_K5hgSzo7nGJc5v6sHFA","GQ Russia","22","21.18.04","джейкью_журнал|gq|мода|стиль|знаменитости|звезды|журнал gq|ксения дукалис|дукалис истомина|подруги|дукалис подруги|ксюша дукалис|ксюша дукалис gq|ксения дукалис gq|ксения дукалис книги|ксения дукалис подруги|ксения дукалис блогер|дукалис егэ|ксюша дукалис егэ|gq russia|gq россия|ксения дукалис егэ|дукалис решает егэ|звезды решают егэ|дукалис gq россия|дукалис интервью|ксения дукалис интервью|ксюша дукалис интервью","122753","6532","86","153","https://i.ytimg.com/vi/n3BR9j0vp_s/default.jpg","False","False","Запомните: «Кроп-топ, Блок — топ». Ксения Дукалис плохих советов не даст. Подпишись на GQ Россия, чтобы не пропустить новые видео: http://www.youtube.com/subscription_center?add_user=gqrussiaДРУГИЕ ВИДЕО Интервью: https://www.youtube.com/playlist?list=PLjOTbq1UM5wvniTeAEjv-3vruO2TomOaGЗвезды отвечают на вопросы о себе в социальных сетях: https://www.youtube.com/playlist?list=PLjOTbq1UM5ws-x-s8nRhk6QdZBu3kG5VRСоциальные сети GQ РОССИЯWeb: http://www.gq.ru/video/Newsletter: http://gq.ru/sign/upFacebook: https://www.facebook.com/GQRussiaTwitter: https://twitter.com/gqrussiaInstagram: https://www.instagram.com/gqrussiaPinterest: https://www.pinterest.com/gqrussia/YouTube: https://www.youtube.com/user/gqrussia"
"0j7DsLb3kco","Лучший Смартфон до $300 🔥 Xiaomi Redmi Note 10 Pro vs realme 8 Pro","2021-04-18T07:00:25Z","UCgZKAGxEZcLfHF5LxWi-AwQ","Andro News 2","28","21.18.04","Xiaomi|redmi|redmi note 10 pro|note 10|note 10 pro|redmi note|realme|realme 8|realme 8 pro|смартфон|смартфоны|смартфоны до $300|сяоми|realme 8 pro vs redmi note 10 pro|Xiaomi vs realme|лучший смартфон|andro news|андроньюс","41404","4096","116","681","https://i.ytimg.com/vi/0j7DsLb3kco/default.jpg","False","False","🔥 Канал в Telegram - https://t.me/andronews_officialЛучший Смартфон до $300 🔥 Xiaomi Redmi Note 10 Pro vs realme 8 Pro➤ Советую ВСЕМ! - https://goo.gl/rohNyL🔥 Канал с НИЗКИМИ ЦЕНАМИ на все! - https://t.me/andro_priceПо вопросам рекламы писать сюда - https://t.me/andrey_koftun"
"mep818UaYz0","FUNNY DIY FOOT SOAP 🧼🦶😂 || #SHORTS","2021-04-11T20:45:02Z","UC63mNFJR8EAb8wAIJwoCmTA","5-Minute Crafts FAMILY","26","21.18.04","5-Minute Crafts|5-Minute Crafts Family|family|DIY|Do it yourself|crafts|useful things|lifehacks|tricks|tips|DIY projects|DIY activities|Handcraft|Tutorial|easy life hacks|simple life hacks|kids|children|parents|how to|howto|soap|foot|foot soap|bathroom|bath|soap making|diy soap|colorful|prank ideas|pranks|funny|bath bomb|shorts|shorts india|best shorts","49590950","1378320","57780","6098","https://i.ytimg.com/vi/mep818UaYz0/default.jpg","False","False","#Shorts​​​​​​​​​​​​​​ #YouTubeShorts​​​​​​​​​​​​​​ #5MCSHORTS​​​​​​​​​​​​​​ #SHORTVIDEO​​​​​​​​​​​​​​ #SHORTSINDIA​​​​​​​​​​​​You've already seen the hand soap which is literally in the shape of hand. But can you imagine the foot soap?😁Try to make it at home and prank your friends!This video is made for entertainment purposes. We do not make any warranties about the completeness, safety and reliability. Any action you take upon the information on this video is strictly at your own risk, and we will not be liable for any damages or losses. It is the viewer's responsibility to use judgment, care and precautions if one plans to replicate.The following video might feature activity performed by our actors within controlled environment- please use judgment, care, and precaution if you plan to replicate.All product and company names shown in the video are trademarks™️ or registered®️ trademarks of their respective holders. Use of them does not imply any affiliation with or endorsement by them. ---------------------------------------------------------------------------------------- Our Social Media: 5-Minute Crafts YouTube: http://bit.ly/2itjCyw​​ Facebook: https://www.facebook.com/5min.crafts/​​ Instagram: https://www.instagram.com/5.min.crafts/​​ Twitter: https://twitter.com/5m_crafts​​ Subscribe to 5-Minute Crafts GIRLY: https://goo.gl/fWbJqz​​ Subscribe to 5-Minute Crafts KIDS: https://goo.gl/PEuLVt​​ The Bright Side of Youtube: https://goo.gl/rQTJZz​​ ---------------------------------------------------------------------------------------- For more videos and articles visit: http://www.brightside.me​​ For brand partnership enquiries: brands@thesoul-publishing.comMusic by Epidemic Sound: https://www.epidemicsound.com/"
"r1QFxTNHdso","Իմ եղբոր գերեզմանի հետ գործ չունեք. զոհվածի հարազատը՝ Փաշինյանին","2021-04-17T18:38:56Z","UCDv-XtfgNGHXcpwu4ab0WnA","NEWS AM","25","21.18.04","news.am|Հայաստան|Armenia|Армения|Armenian News|լուրեր Հայաստանից|Новости Армении|Yerevan|news am|news.am tv|lurer|lurer hayastanic|news from armenia|новости из армении|լուրեր","176385","1183","322","492","https://i.ytimg.com/vi/r1QFxTNHdso/default.jpg","False","False","NEWS.am-ը սոցիալական ցանցերում՝Telegram - https://bit.ly/newsamtlFacebook - http://bit.ly/2KnWOhrTwitter - http://bit.ly/2x2ixmlInstagram - http://bit.ly/2x2jefrNEWS.am Style - http://bit.ly/2Ncs5EAՏեսացանկեր՝Օրվա գլխավոր լուրերը՝ «մեկ տողով» - http://bit.ly/2ZyPpiNNEWS.am Daily digest - http://bit.ly/2IlSxsCՀարցազրույց - http://bit.ly/2WVsVvHՄամուլի տեսություն - http://bit.ly/2MRecglNEWS.am Breaking - http://bit.ly/3qESpaiՀարցրու բժշկին - http://bit.ly/2N3MYmKNEWS.am Story - http://bit.ly/3rGDSwdՕրվա թեման Ֆեյսբուքում - http://bit.ly/3l7VNt9NEWS.am: Последние известия - http://bit.ly/3bCVXG3#NEWSam #լուրեր"
"91aHeWL0n3s","Задержание украинского консула в Санкт-Петербурге — видео","2021-04-17T15:08:11Z","UCFU30dGHNhZ-hkh0R10LhLw","RT на русском","25","21.18.04","rt|новости рт|рт на русском|раша тудей|russia today|Александр Сосонюк|украина|что там у хохлов|задержание консула|консул украины|мид россии","108738","3744","449","1082","https://i.ytimg.com/vi/91aHeWL0n3s/default.jpg","False","False","ФСБ опубликовала кадры задержания украинского консула Александра Сосонюка в Санкт-Петербурге во время его встречи с гражданином России при получении закрытой информации из баз данных правоохранительных органов. Вскоре его отпустили. В МИД РФ заявили о нежелательности пребывания Сосонюка на территории страны и предписали ему покинуть её в течение трёх суток.Подписывайтесь на RT Russian:Telegram — https://t.me/rt_russianYouTube — http://www.youtube.com/subscription_center?add_user=rtrussian VK — http://vk.com/rt_russianFacebook — http://www.facebook.com/RTRussianTwitter — http://twitter.com/RT_russianOK — http://ok.ru/rtrussianInstagram — https://www.instagram.com/rtrussianTikTok — https://www.tiktok.com/@russian_rt#Украина #фсб #видеозадержания #АлександрСосонюк #RTнарусском"
"zUAuaCzC6EE","Shohjahon Jo'rayev & Rayhon - Ko'zlari zebo (Concert, Rayhon 2020)","2021-04-17T14:38:13Z","UCEmb9urJ-ad8p-mdtYfOJIA","JO'RAYEVLAR","10","21.18.04","Nevo|NevoMusic|Uzbek klip|Jo'rayev|Jo'rayevlar|Shohjahon Jo'rayev|Sherali Jo'rayev","110781","1978","66","95","https://i.ytimg.com/vi/zUAuaCzC6EE/default.jpg","False","False","Подпишись на канал: http://bit.ly/jorayevShohjahon Jo'rayev instagram:  https://www.instagram.com/shohjahon_djurayev/"
