video_id,title,publishedAt,channelId,channelTitle,categoryId,trending_date,tags,view_count,likes,dislikes,comment_count,thumbnail_link,comments_disabled,ratings_disabled,description
"DuQbOQwVaNE","Offering People $100,000 To Quit Their Job","2021-03-13T21:00:02Z","UCX6OQ3DkcsbYNE6H8uQQuVA","MrBeast","24","21.14.03","[none]","15055908","1092417","9785","64838","https://i.ytimg.com/vi/DuQbOQwVaNE/default.jpg","False","False","Download Finger On The App 2 NOW! - https://beastgames.com/New Merch - https://shopmrbeast.com/SUBSCRIBE OR I TAKE YOUR DOG╔═╦╗╔╦╗╔═╦═╦╦╦╦╗╔═╗║╚╣║║║╚╣╚╣╔╣╔╣║╚╣═╣ ╠╗║╚╝║║╠╗║╚╣║║║║║═╣╚═╩══╩═╩═╩═╩╝╚╩═╩═╝----------------------------------------------------------------follow all of these or i will kick you• Facebook - https://www.facebook.com/MrBeast6000/• Twitter - https://twitter.com/MrBeast•  Instagram - https://www.instagram.com/mrbeast--------------------------------------------------------------------"
"PucU3hge_L4","Nba YoungBoy - I Ain’t Scared","2021-03-14T02:43:18Z","UClW4jraMKz6Qj69lJf-tODA","YoungBoy Never Broke Again","10","21.14.03","[none]","1278994","178661","1065","22909","https://i.ytimg.com/vi/PucU3hge_L4/default.jpg","False","False","Love you"
"AKBF-jeOlD8","Saying Goodbye...","2021-03-12T23:33:09Z","UCkvK_5omS-42Ovgah8KRKtg","jeffreestar","26","21.14.03","jeffree star|jeffree star cosmetics|saying goodbye|jeffree star makeup|jeffree star approved","3359666","107477","27519","19709","https://i.ytimg.com/vi/AKBF-jeOlD8/default.jpg","False","False","Hey evereyone... How are ya? Today it's time to say goodbye... There has been some major changes in my life recently. Thank you for watching and being patient. Love you guys so much.WANT MORE? 🐶 Meet My NEW Pomeranian Puppy! Lucky Number 7! ▷ https://youtu.be/4oEwYP1nR6I💄 SHOP the Velour Liquid Lipstick Collection: https://bit.ly/3gdAIuQ  *SHOP: http://www.jeffreestarcosmetics.com + FOLLOW MY BRAND ON Instagram: http://instagram.com/jeffreestarcosmetics +FOLLOW ME ON IG: http://instagram.com/jeffreestar + SNAPCHAT: jeffreestar + TWITTER: @jeffreestarWATCH MORE VIDEOS...................❤️💉 WATCH ME GET BOTOX BEFORE THE LOCKDOWN ▷ https://bit.ly/2wHzUw9💜 Swatching EVERY Liquid Lipstick I’ve EVER Made ▷ https://www.youtube.com/watch?v=RfcY3J6CjgQ&t=2055s🔮 WATCH FULL FACE OF BRANDS THAT HATE ME  ► https://bit.ly/2O6GgJi"
"EyURYSTf0rM","I Survived 400 Days in HARDCORE Minecraft...","2021-03-13T13:15:01Z","UCFrVj6wBM42y3XuKCAj8n5A","SB737","20","21.14.03","minecraft|gaming|sb737|sb minecraft|sb|let's play|minecraft hardcore|hardcore|surviving 100 days|100 days|100 days hardcore|minecraft 100 days|400 days|400 days hardcore|I survived 400 days in hardcore minecraft","1269633","39721","940","5152","https://i.ytimg.com/vi/EyURYSTf0rM/default.jpg","False","False","300 DAYS HARDCORE VIDEO: https://youtu.be/4nwRKWqwbYA►Subscribe Here: http://goo.gl/0JbOQk►Leave a LIKE if you Enjoyed!►Follow me on Twitter: https://twitter.com/sb_737In this Minecraft video I survive 300 days in a Minecraft Hardcore world. Here are all the things I accomplished, and all the adventures that I had.100 Days Video Playlist: https://www.youtube.com/playlist?list=PLWJikipm2MTbf7lS_Ncd7W-Y88KOSKAofDrowned Farm I Used: https://youtu.be/rDDnKEjw-w0Thanks to  @Luke TheNotable for the idea! https://www.youtube.com/user/Creolesbackfire►Watch me stream Minecraft LIVE: http://twitch.tv/SB737►Become a Channel Member - https://www.youtube.com/channel/UCFrVj6wBM42y3XuKCAj8n5A/join►UK and EU Store - https://teespring.com/stores/sb737-eu-store►US Store - https://teespring.com/stores/sb737-us-store"
"5ejYOpVquMg","Jawbreaker Nails (I drilled my nail)","2021-03-13T16:30:16Z","UCGCVyTWogzQ4D170BLy2Arw","Simply Nailogical","24","21.14.03","nails|nail art|nail tutorial|beauty tutorial|nail art tutorial|diy nails|diy nail art|simply nailogical|cristine|jawbreaker nails|geode nails|drill|nail drill|broken nail|rock nails|geode nail art|jawbreaker nail art|nail accident|layers|100 layers|layers of nail polish|polish mountain","1002694","68541","728","3271","https://i.ytimg.com/vi/5ejYOpVquMg/default.jpg","False","False","THE NAIL DRILL WAS A BAD IDEA💀Got boring nails? Just add a Holo Taco 💿🌮 Sign up for email updates to be notified about restocks ➡️ http://holota.co/holothere1 ♡ Subscribe to never miss n̶e̶w̶ ̶n̶a̶i̶l̶ ̶a̶r̶t̶ ̶t̶u̶t̶o̶r̶i̶a̶l̶s̶! http://bit.ly/subsimply♡ Subscribe to Holo Taco (for nail videos lol): http://bit.ly/SubHoloTaco♡ Subscribe to the Podcast to hear me have adult conversations: http://bit.ly/SubSimplyPodLogicalNail drill aftermath on my second channel: https://www.youtube.com/watch?v=lxkNQZO8hOc_ _ _ _ _ _ _ _ _ _ _ _ _ _ _ _ _ _ _ _ _ _ _ _ _ _ _ _ _ _ _ _ _ _♡PRODUCTS USED IN THIS VIDEO:♡https://www.holotaco.com♥ Holo Taco Long-Lasting Base ♥ Holo Taco Frosted Metals polishes♥ Crème polishes👀♥ Rainbow Linear Holo polishes♥ Multichrome polishes♥ One-Coat Black 🖤♥ Unicorn Skin toppers♥ Flakie Holo Taco 💿🌮♥ Not Milky White♥ Glossy Tacos (top coats): http://holota.co/sosoglossy♥ Nail drill: https://amzn.to/3rJvZq1ON MY OTHER HAND: Holo Taco - Royal-Tea Blue💙 + Sonic Unicorn Skin🦄 + Glossy Taco (and then Matte Taco the next day!)Insider Geode Nails: https://www.youtube.com/watch?v=kxn4ppnFpgMJawbreaker nails (TikTok): https://vm.tiktok.com/ZMekau1Nn/Reddit post: https://www.reddit.com/r/RedditLaqueristas/comments/i3o5p5/14_layers_and_a_file_thats_all/?utm_source=share&utm_medium=ios_app&utm_name=iossmf💀My trips to Polish Mountain (2016):http://bit.ly/POLISHMOUNTAINhttp://bit.ly/ReturnToPOLISHMOUNTAIN_ _ _ _ _ _ _ _ _ _ _ _ _ _ _ _ _ _ _ _ _ _ _ _ _ _ _ _ _ _ _ _ _ _Stalk me on all the social medias!http://instagram.com/simplynailogicalhttps://www.snapchat.com/add/simplynailogicahttps://twitter.com/nailogicalhttps://www.facebook.com/simplynailogicalhttps://www.tiktok.com/@simplynailogical_itsmehttp://www.simplynailogical.com (archival materials)My other YouTube channels:https://www.youtube.com/simplypodlogicalhttps://www.youtube.com/holotacohttps://www.youtube.com/simplynotlogicalhttps://www.youtube.com/simplypodlogicalhighlights_ _ _ _ _ _ _ _ _ _ _ _ _ _ _ _ _ _ _ _ _ _ _ _ _ _ _ _ _ _ _ _ _ _I film my nail videos with this camera: http://amzn.to/1MgznhtThis 105mm macro lens: http://amzn.to/1Pi8PM3I film my face videos with this camera: http://amzn.to/2kgHIgUThis 24-70mm lens: http://amzn.to/2gXJpxQI filmed my face in this video with this camera: https://amzn.to/327OB7bThis lens: https://amzn.to/38HnBgUB cam: https://amzn.to/3cfSjjBB cam lens: https://amzn.to/2TnoULHVlog cam: https://amzn.to/2VvYni8Voiceover mic: http://amzn.to/1MefGpGAudio recorder: https://amzn.to/3dbtg1wExternal mic: https://amzn.to/32AnO3gRing light for face-cams: http://amzn.to/2cU7cNOI edit my videos with: http://bit.ly/videoeditor1I get some cool editing filters from: https://motionvfx.sjv.io/Ze3bRCheck out my personalized Amazon page with stuff I like! https://www.amazon.com/shop/simplynailogicalMusic: http://share.epidemicsound.com/SIMPLY_ _ _ _ _ _ _ _ _ _ _ _ _ _ _ _ _ _ _ _ _ _ _ _ _ _ _ _ _ _ _ _ _ _Disclaimer cause I love you guys: This video was not sponsored by any of the brands mentioned. All opinions are my own. Some links above are affiliate links."
"VZ3Xrsn62tM","Cash Or Flight...Who Can Cook The Best Steak?!","2021-03-12T23:28:40Z","UCvyTdLw8SkVmUcHYXSDEGwA","CashNasty","24","21.14.03","cash and flight cook steak|flight reacts|cash and flight|funny videos clean|cooking steak|chef o|how to cook steak|best steak|flight cooks|cooking with chef|eating|steak mukbang|cooking competition|how to|cooking videos|steak|recipe|gordon ramsay|steak challenge|cookoff|how to cook the perfect steak|steak recipe","1275815","81591","874","5894","https://i.ytimg.com/vi/VZ3Xrsn62tM/default.jpg","False","False","Had a little cooking competition with Flight 😂2nd Channel: https://goo.gl/Se1qBH 2HYPE Channel: https://www.youtube.com/channel/UCY4AlDv6wL2qhrX29iwdqAgFollow me on Twitter: www.twitter.com/cashnastygamingInstagram: @cashnastyI livestream on Twitch! www.twitch.tv/cashnastygaming"
"xP_7x2xOEvo","When you're having a bad day...","2021-03-13T14:00:13Z","UCdyMFblTjr-C2N-T5TGftQQ","Nathan Doan Comedy","23","21.14.03","Bad day|When its a bad day|Bad day be like|Bad day comedy|bad day nathan","698952","36133","388","3491","https://i.ytimg.com/vi/xP_7x2xOEvo/default.jpg","False","False","Thank you Stereo for sponsoring this video! Download Stereo and follow me here: https://stereo.com/nathandoan  #adMake sure to catch my upcoming show: https://stereo.com/u/r21qGBSiPMWdZ21 and my past show with Hanson here: https://stereo.com/u/r21yOyQEFxX6Z21Instagram @NathanDoanTwitter @ImNathanDoan"
"YnZoC-OUVVU","Minecraft UHC but you can craft Multi Armor..","2021-03-13T02:06:16Z","UCZenRGLPfB_IwmDnYlIx6Qg","Kiingtong","20","21.14.03","minecraft uhc but you can craft multi armor|minecraft but you can craft multi armor|minecraft uhc but you can craft|minecraft but you can craft|minecraft uhc|uhc|minecraft uhc but|minecraft multi armor|minecraft uhc multi armor|minecraft multi armor craft|minecraft uhc craft multi armor|kiingtong|minecraft|kiingtong uhc|graser multi armor|graser","994764","70877","1381","3864","https://i.ytimg.com/vi/YnZoC-OUVVU/default.jpg","False","False","so i played a Minecraft UHC but you can craft Multi Armor.. this is insanity.. 🤯💥 My Pokemon Channel! ​ @Kiing - Pokemon 👕 My Merch! - https://store.lunarclient.com/categor...​🎮 Play with me here! -- play.octanemc.net🎁 http://store.octanemc.net/​💎 Minecraft UHC Multi Armor credit..@Graser @EmOrSomething 📲 Connect With Me!- Twitter: https://twitter.com/Kiingtong​- Instagram: https://www.instagram.com/Kiingtong/​- Twitch: https://www.twitch.tv/kiingtong​🎧 Kaskade - Disarm You (ILLENIUM Remix)Listen here: http://bit.ly/1lgwDbj"
"aErlAkVYpZM","my label took my phone again :( .....","2021-03-14T02:12:42Z","UC_uMv3bNXwapHl8Dzf2p01Q","Lil Nas X","10","21.14.03","[none]","195285","34516","425","4409","https://i.ytimg.com/vi/aErlAkVYpZM/default.jpg","False","False","https://lilnasx.lnk.to/MONTERO"
"wvZtYgIIe2E","Game Theory: Beware Crow 64 c̸̛̊rO̵̼̮͐̄́̀͘W̴̘̪͈̆ 6̵̓͛͒4̴̈͗̃̋ c̶̾́́̀̑Ȑ̸̲̪̅͘O̶w̵̄̀̆̅̕͝ 6̴̞̓̒̈́̇4̶̩̘͗͌̉","2021-03-13T19:06:34Z","UCo_IB5145EVNcf8hw1Kku7w","The Game Theorists","20","21.14.03","crow64|crow 64|catastrophe crow|what happened to crow 64|crow 64 arg|arg|catastrophe crow 64 arg|crow 64 gameplay|adam butcher|crow 64 adam butcher|petscop|the next petscop|nintendo|nintendo 64|the game that doesn't exist|crow 64 explained|the lost nintendo game|creepypasta|scary|scary game|creepy|game theory|game theorists|matpat|game theory petscop|n64","1550511","124804","1065","12012","https://i.ytimg.com/vi/wvZtYgIIe2E/default.jpg","False","False","Get Yourself Some BRAND NEW Theory Wear! ► https://bit.ly/3beM0ysTheorists, we all know I love a good ARG. And Crow 64? Well, I had to dive in head first. Crow 64 is the ARG of the unfinished Nintendo 64 game called Catastrophe Crow. In the original video, we get the history of the game as well as our first playthrough footage. From there, it spread across the internet into a building mystery waiting to be figured out. Today, I am going to try to do just that. Check out Adam's Channel ► https://www.youtube.com/user/AdamButcherThanks to u/TheNinjaCakes for letting us use their sprite pack! ► https://bit.ly/2LIjaZTSUBSCRIBE to Catch all the Theories! ► https://goo.gl/kQWHkJ        Need Royalty Free Music for your Content? Try Epidemic Sound. Get A 30 Day Free Trial! ► http://share.epidemicsound.com/MatPat#Crow64 #CatastropheCrow #Creepypasta #Creepy #Scary #ARG #Nintendo #N64 #MatPat #Theory #GameTheory    More THEORIES: FNAF, The FINAL Timeline ►► https://bit.ly/2MlHYFeFNAF, The Monster We MISSED! ►► https://youtu.be/_ygN8HLCaJgFNAF This Theory Changes Everything ► https://bit.ly/2JUQUn6FNAF, You Were Meant To Lose ► https://youtu.be/7bn8hM9k0b0FNAF 6, No More Secrets ► https://bit.ly/2LVCq4u   Credits:Writers: Matthew Patrick and Zach StewartEditors: Pedro Freitas, Alex Sedge Sedgwick, and Tyler MascolaAssistant Editor: AlyssaBeCrazySound Editor: Yosi Berman"
"CKZvWhCqx1s","ROSÉ - 'On The Ground' M/V","2021-03-12T05:00:15Z","UCOmHUn--16B90oW2L6FRR3A","BLACKPINK","10","21.14.03","YG Entertainment|YG|와이지|K-pop|BLACKPINK|블랙핑크|블핑|제니|로제|리사|지수|Lisa|Jisoo|Jennie|Rosé|BLINK|블링크|ROSÉ On The Ground|로제 On The Ground|On The Ground|로제 R|ROSÉ R|ROSE R|ROSE On The Ground","67466987","6438003","54465","1321337","https://i.ytimg.com/vi/CKZvWhCqx1s/default.jpg","False","False","On The GroundMy life's been magic seems fantasticI used to have a hole in the wall with a mattressIt’s funny when you want itSuddenly you have itYou find out that your gold’s just plasticEvery day every nightI’ve been thinking back on you and IEvery day every nightI worked my whole lifeJust to get right just to be likeLook at me I’m never coming downI worked my whole lifeJust to get high just to realizeEverything I need is on theEverything I need is on the groundOn the groundEverything I need is on the groundNah but they don’t hear me though (Yeah what goes up it must come down)Nah but they don’t hear me though (You’re running out of time)My world’s been hectic seems electricBut I’ve been waking up with your voice in my headAnd I’m trying to send a messageAnd let you know that every single minute I’m without you I regret itEvery day every nightI’ve been thinking back on you and IEvery day every nightI worked my whole lifeJust to get right just to be likeLook at me I’m never coming downI worked my whole lifeJust to get high just to realizeEverything I need is on theEverything I need is on the groundOn the groundEverything I need is on the groundNah but they don’t hear me though (Yeah what goes up it must come down)Nah but they don’t hear me though (You’re running out of time)I’m way up in the cloudsAnd they say I’ve made it nowBut I figured it outEverything I need is on the groundJust drove by your houseSo far from you nowBut I figured it outEverything I need is on theEverything I need is on the groundOn the groundEverything I need is on the groundNah but they don’t hear me thoughOn the groundNah but they don’t hear me thoughEverything I need is on the groundAlbums Available @YG SELECT KR: https://www.ygselect.comYG SELECT EN: https://en.ygselect.comYG SELECT JP: https://jp.ygselect.comYG SELECT CN: https://cn.ygselect.comYG SELECT TH: https://ygselectth.com#ROSÉ​ #로제​ #BLACKPINK​ #블랙핑크​​ #OnTheGround​​​​​ #YG​More about BLACKPINK @http://www.blackpinkofficial.com/http://www.youtube.com/BLACKPINKOFFICIALhttp://www.facebook.com/BLACKPINKOFFICIALhttp://www.twitter.com/ygent_officialhttp://www.instagram.com/BLACKPINKOFFICIAL"
"xgKFeXmy06M","WHO’S IN MY BATHROOM? with Hailey Rhode Bieber | Guest Kendall Jenner plays Never Have I Ever","2021-03-12T17:00:27Z","UC63x3lkE4W7dlaEhXGY4Dkg","Hailey Rhode Bieber","22","21.14.03","[none]","1713031","100283","3461","5356","https://i.ytimg.com/vi/xgKFeXmy06M/default.jpg","False","False","Wild conversations. Different guests. Same bathroom. Join me on the premiere episode of Who’s in My Bathroom? with special guest and my best friend: Kendall Jenner. Things get quirky and we go deep in the most unexpected (yet least surprising) place in the house - my bathroom."
"LUEX3M9OL6M","I FOUND RARE BEANIE BABIES IN MY MOM’S GARAGE!","2021-03-12T19:49:06Z","UCR-QYzXrZF8yFarK8wZbHog","Colleen Ballinger","23","21.14.03","colleen ballinger|colleen|ballinger|psychosoprano|miranda sings|no lipstick|vlog|vlogging|singing|without lipstick|comedy|how to|tutorial|silly|funny|beanie babies|beanie|baby|beanie baby|ty|ty warner|worth|collection|collector|money|making money|getting rich","598709","29786","438","3747","https://i.ytimg.com/vi/LUEX3M9OL6M/default.jpg","False","False","I went through my entire beanie baby collection and was SHOCKED to find some rare beanie babies that could be worth thousands of dollars! Check Out My Merch! - https://fanjoy.co/collections/miranda-singsSubscribe to My Podcast - YOUTUBE CHANNEL - https://www.youtube.com/channel/UC9FEXSJpFnvxDSyM9dAWOHQAPPLE PODCAST - https://podcasts.apple.com/us/podcast/relax-with-colleen-ballinger-erik-stocklin/id1546132415SPOTIFY - https://open.spotify.com/show/4G0FH2LW1yTCRoX2Ux0ZE6Come see me on tour! - http://mirandasings.com/default.htmlFollow me on all the things! TIK TOK - https://www.tiktok.com/@colleen?source=h5_mTwitter - http://www.twitter.com/ColleenB123Instagram - http://instagram.com/colleenFacebook - https://www.facebook.com/ColleenB1234youtube - http://www.youtube.com/psychosopranosnapchat username - ColleenSubscribe to my main channel! - https://www.youtube.com/psychosopranoSubscribe to my family!Miranda - https://www.youtube.com/mirandasingsRachel - https://www.youtube.com/novaquaBallinger Family - https://www.youtube.com/ballingerfamilyKory - https://www.youtube.com/stevenspeaks08PO Box! Colleen Ballinger, Miranda Sings, or Kory DesotoPO Box 56144Sherman oaks, ca 91413"
"HkJ7K146Y20","[안방1열 직캠4K] 로제 'On The Ground' 풀캠 (ROSÉ Full Cam)│@SBS Inkigayo_2021.03.14.","2021-03-14T07:55:19Z","UCS_hnpJLQTvBkqALgapi_4g","스브스케이팝 / SBS KPOP","24","21.14.03","Inkigayo|인기가요직캠|안방1열직캠|블랙핑크|BlackPInk|블핑|로제|로지|ROSE|ROSÉ|On The Ground|온더그라운드","1411116","212925","2299","9698","https://i.ytimg.com/vi/HkJ7K146Y20/default.jpg","False","False","[안방1열 직캠4K] 로제 'On The Ground' 풀캠 (ROSÉ Full Cam)│@SBS Inkigayo_2021.03.14.#인기가요 #ROSÉ #OnTheGround------------------------------------------------------------------------------------------☞ MORE ＂SBS KPOP＂- Twitter : https://twitter.com/kpop_sbs- Facebook : https://www.facebook.com/sbskpop- Instagram : https://instagram.com/sbskpop_official"
"OHfZa1-Ga4E","Pregnant!","2021-03-13T17:00:29Z","UCsi7f6y5dH5uuye3MeCfojA","Ballinger Family","22","21.14.03","ballinger|pregnant|pregnancy|pregnancy announcement|i'm pregnant|baby #6","315210","21894","392","4538","https://i.ytimg.com/vi/OHfZa1-Ga4E/default.jpg","False","False","Pregnant! All of our videos are closed captioned and always family friendly. Subscribe to us: http://bit.ly/19AVFM6Twitter! BallingerFamily & BallingerMomInstagram: ChrisBallinger & JessicaBallingerTikTok: BallingerFamilyMerch! https://store.dftba.com/collections/ballinger-family#pregnant #pregnancyannouncement #ballinger #ballingerfamily #family #pregnancyFor Business Inquires Contact: kevin@moopsy.com"
"cT7wOSOZVoc","Minecraft Survivor VS 3 Hitmen...","2021-03-11T08:00:15Z","UCTkXRDQl0luXxVQrRQvWS6w","Dream","20","21.14.03","Dream Minecraft|dream Minecraft youtube|minecraft|dream|Minecraft hitmen|Minecraft Survivalist vs 3 hitmen|Speedrunner vs 3 hunters|Speedrunner vs 4 hunters|Speedrunner vs someone trying to stop them|Beating Minecraft but my friend tries to stop me|Minecraft but water rises every minute|minecraft but lava rises every minute|minecraft but challenge|minecraft challenge|challenge|minecraft 1.14|beating minecraft|rematch|finale|finale rematch|grand finale|grand","18128749","1309405","22207","97125","https://i.ytimg.com/vi/cT7wOSOZVoc/default.jpg","False","False","Minecraft Survivor VS 3 Hitmen... This was incredible.Click the Merch link below for a chance to play in a Manhunt video with me! Merch: https://www.dream.shopFollow my socials:➽ Twitter - @dream➽ Instagram - @dreamwastaken➽ Snapchat - @dreampublicPatreon (Plugin): https://www.patreon.com/DreamWasTakenBadBoyHalo:  @BadBoyHalo George:  @GeorgeNotFound Sapnap:  @Sapnap We decided to call this series Minecraft Hitmen. This video there are THREE hunters/hitmen instead of just one.This is a new Minecraft but, 1.16 challenge that we have decided to try. I try to survive for 100 minutes, while my friend George AND my friend Sapnap AND my friend BadBoyHalo tries to prevent me from surviving. Every 10 minutes there is a 10 minute period of invincibility. They can see me through walls, and the world is small. It's a chase, a race, and it's super intense. A lot of laughs. I love doing these challenges.If this video gets 1,500,000 likes we'll do it again!Manhunt T-Shirt Details:Each and every Manhunt t-shirt purchased will be assigned a unique number. Limit 10 Manhunt t-shirts per order.In late April after all shirts have been processed, we will randomly select one unique Manhunt t-shirt number for invitation into a 2021 Dream Manhunt video. Dream will announce the associated order number (and perhaps country and initials) via social media. The lucky customer does not need to see the announcement or know their order number, because we will make reasonable attempts to contact the customer using the contact information provided at checkout. Do not fall for scams that ask you to provide sensitive information or click, install or open anything! If contact attempts are not successful or the invitation is not accepted within 2 business days, we will repeat the same process every 2 business days approximately until an invitation is accepted. The non-transferable invitation and video participation have no retail or monetary value for the purchaser of the Manhunt t-shirt which is sold at fair value and is non-refundable. Adequate computer, internet, video and other capabilities will be arranged if necessary for the sole purpose of video participation.Employees and their families are not eligible for selection.Not Minecraft, But Water Rises or Minecraft, But Lava Rises, or any other but challenge like that. This is a speed runner / survivalist in Minecraft against a killer / assassin / hitmen#MinecraftHitmen"
"mPx-pzm8GJA","Meet Our Princess Angelique! The Aguilars","2021-03-12T20:30:14Z","UC_BSJ0WX9FnWRK_w1hwtuTw","The Aguilars","22","21.14.03","[none]","759981","43155","767","0","https://i.ytimg.com/vi/mPx-pzm8GJA/default.jpg","True","False","Shop Our Merch: https://Shoptheaguilars.com Shop Sebastian Aiden: https://sebastianaiden.com https://www.instagram.com/sebastianaidenfashion/Snapchat: SebastianaidennFamily Channels:Candy's Makeup Channel   @GlambyCandy Nikki's Channel      @Nikki V. Ethan's Channel:       @Ethan Aguilar Melody's Channel  @MVELODY **Make Sure You Like, Comment, Share & Subscribe! ** TURN ON OUR POST NOTIFICATIONS FOR A CHANCE TO GET A SHOUT OUT IN OUR NEXT VIDEO!FOLLOW US-Facebook: https://www.facebook.com/TheAguilars2017/?modal=admin_todo_tour*Candy's Instagram- https://instagram.com/Glambycandy_Candy's Snapchat- Candy_PereidaCandy's Twitter- https://twitter.com/GlambyCandy*Nestor's Instagram- https://instagram.com/nestor_aguilar323Nestor's Snapchat- Nestor_AguilarNestor's Twitter- https://twitter.com/NestorAguilar_*Sebastian's Facebook Page- https://www.facebook.com/teamsebastianaiden/Sebastian's Instagram https://www.instagram.com/sebastian_aiden_aguilar/*Nicole's Instagram- https://instagram.com/n_i_k_k_i_v/Nicole's Snapchat- Nikki_Bruhh1Nicole Twitter- https://twitter.com/N_i_k_k_i_v*Melody's Instagram-https://www.instagram.com/mvelody/Melody's Snapchat- Mvelody1*Ethan's Instagram- https://instagram.com/ethanaguilar_Watch More Of The Aguilars!Melody's 15: https://www.youtube.com/playlist?list=PLE9emnzni8_b8QywI1xcHHXqOxLCmgt7TP.O. Box 📦 P.O. Box 6525 Glendale, Az 85312For Business Inquiries, Contact:contact@tablerockmanagement.com"
