video_id,title,publishedAt,channelId,channelTitle,categoryId,trending_date,tags,view_count,likes,dislikes,comment_count,thumbnail_link,comments_disabled,ratings_disabled,description
"phIxjsUiquc","POGBA Slams MOURINHO! VARANE Deal Off? Man Utd Transfer News","2021-04-16T10:00:18Z","UCMmVPVb0BwSIOWVeDwlPocQ","The United Stand","24","21.18.04","Manchester United|Man United|Man Utd|Manchester United TV|The United Stand|United Stand|Manchester United News|MUFC|Man Utd News|United|Manchester United Latest News|Manchester United Transfer News|Transfer|Solskjaer|Ole Gunnar Solskjaer|Solskjaer news|Solskjaer press conference|Ole Gunnar Solskjaer Press Conference|Bruno|Bruno Fernandes|Man Utd vs West Ham|Manchester United vs West Ham|Manchester United West Ham|Kounde|Pau Torres|Torres","162348","4981","140","478","https://i.ytimg.com/vi/phIxjsUiquc/default.jpg","False","False","The United Stand are on Flick - join our group https://flick.group/theunitedstand. Man Utd start Paul Pogba slams Jose Mourinho and champions Solskjaer. And is Varane's transfer to United off already? Get the latest Man Utd Transfer News on The United Stand. United Stand Merch collection https://united-stand.myshopify.com/🚨VISIT OUR WEBSITE 🚨For all the latest United news and TUS content:https://www.theunitedstand.com⏲️The United Stand Content TIMELINE is the best way to find all our latest content quickly! https://www.theunitedstand.com/timeline📰 LATEST WRITTEN NEWS https://www.theunitedstand.com/articles/latest-news📸 FOLLOW OUR INSTAGRAMhttps://www.instagram.com/theunitedstandtv/✅ The United Stand MEMBERSHIP https://buff.ly/2I2Of9R📧Contact The United Stand = soccerboxtv@gmail.com📧WRITER SUBMISSIONS = unitedstandwebsite@gmail.comAddressing: Jamie or NoraSee the FULL United Stand Kit Range CLICK HERE https://buff.ly/2Krpw1zEXCLUSIVE NEW PODCAST ITUNES https://buff.ly/2ZUhv84Spotify https://buff.ly/34dwEo6Google Podcast https://buff.ly/2ZHlNDnCastBox https://buff.ly/2UuiU3RRadio Public https://buff.ly/34jWkzAThe United Stand is Manchester United's biggest independent fan channel. Made for Manchester United fans by Manchester United fans, the United Stand provides you with the latest Manchester United transfer news, highlights, goal reviews and much more. So if MUFC means the world to you, get involved and subscribe to The United Stand http://bit.ly/1CmczHm#ManchesterUnited #MUFC"
"1kxPpmhSopY","Prank Calling FaZe Clan Members","2021-04-14T18:36:55Z","UCNdpD9V0PIrH1glUJ6RG4-w","FaZe Clan","20","21.18.04","FaZe|FaZeClan|FaZe Clan|FaZe Rain|FaZe Apex|FaZe Jev|FaZe Banks|FaZe Adapt|FaZe Temperrr|FaZe Rug|FaZe Cizzorz|FaZe NICKMERCS|FaZe House|FaZe Kay|faze jarvis|Faze sway|faze mongraal|faze fortnite|fazeclan fortnite|faze h1ghsky1|Prank|Prank call|call","1183664","38755","1351","1576","https://i.ytimg.com/vi/1kxPpmhSopY/default.jpg","False","False","Today we prank called FaZe Members to see if they would believe out lies!🔥 NEW FaZe Clan Merch: http://fazeclan.com🔴 Watch us live: http://twitch.tv/team/faze👻FaZe Clan on Snapchat: https://www.snapchat.com/discover/Faze_Clan/9594979179💻 FaZe Clan on Twitter: http://twitter.com/FaZeClan📲 FaZe Clan on Instagram: http://instagram.com/fazeclan😄 FaZe Clan on Facebook: http://facebook.com/TheFaZeClan🎮 FaZe Clan Esports Update on Twitter: http://twitter.com/FaZeUpdate👾 FaZe Clan on Discord: https://discord.com/invite/faze 😂 FaZe Clan GIPHY Page  https://giphy.com/fazeclanThe Energy Drink for Gamers by GFUEL🥤 http://gfuel.com/faze🤑 Discount code: FAZEThe Headsets, Keyboards & Mice we use by STEELSERIES:💻 https://steelseries.com/esports/faze-clanThe Controllers we use by SCUF GAMING🎮 http://scuf.co/faze🤑 Discount code: FAZE"
"OnOJV0kEiA8","David Ornstein surprised by Paul Pogba's jaw-dropping comments about Jose Mourinho","2021-04-16T10:00:10Z","UCcw05gGzjLIs5dnxGkQHMvw","Sky Sports News","17","21.18.04","Paul Pogba|Pogba|Jose Mourinho|Mourinho|Ole Gunnar Solskjaer|Ole|Solskjaer|Paul Pogba Jose Mourinho|Manchester United|Man United|David Ornstein|The Athletic|Early Kick Off|Sky Sports News|Sky Sports|Sky Sports Football|News|Sport News|Breaking News|Football News|Interview|Jose|criticises|scathing","200770","2666","232","819","https://i.ytimg.com/vi/OnOJV0kEiA8/default.jpg","False","False","► Subscribe to Sky Sports News: http://bit.ly/SkySportsNewsSubDavid Ornstein, football correspondent for The Athletic, admits he was surprised by the jaw dropping comments that Paul Pogba has made about Jose Mourinho's style of man-management when he was at Manchester United. #SkySportsNews #SkySports #PaulPogba   More from Sky Sports on YouTube:► Sky Sports Retro: http://bit.ly/SkySportsRetroSub► Sky Sports: http://bit.ly/SkySportsSub► Sky Sports Football: http://bit.ly/SSFootballSub► Sky Sports Boxing: http://bit.ly/SSBoxingSub► Sky Sports F1: http://bit.ly/SubscribeSkyF1► Sky Sports Cricket: http://bit.ly/SubscribeSkyCricket► Sky Sports Golf: https://bit.ly/SubscribeSkySportsGolf"
"TOjCwHDkrpE","Bailey & Asa's PROPOSAL Video ❤️","2021-04-14T21:02:05Z","UC6QWhGQqf0YDYdRb0n6ojWw","Brooklyn and Bailey","24","21.18.04","Brooklyn|Bailey|brooklynandbailey|lifestyle|college|school|teen|mormon|lds|fun","4317200","137368","2531","9470","https://i.ytimg.com/vi/TOjCwHDkrpE/default.jpg","False","False","Watch as Asa PROPOSES to Bailey after they dated for over four years! He planned this all on his own, with some covert help from Brooklyn, family and friends. Bailey had no idea. What was your favorite part of the proposal? SUBSCRIBE and COMMENT BELOW!✅ Here is the ring Asa chose for Bailey from James Allen: 👉🏻 https://bit.ly/3gacwM5✅ Be sure to follow us on Instagram to see MORE PROPOSAL PHOTOS and Stories! 👉🏻 https://www.instagram.com/BrooklynAndBaileyI met Asa met five years ago WAY BACK in 2016 when I was only 16 and he was 15. I didn’t know it then, but I had just met my future husband! It took a year of him pursuing me, and me constantly putting him in the FRIEND ZONE, before I realized what a catch he really was! On Feb 25, 2017, Asa and I officially started dating, ending the day with my very first kiss! You can watch that video, HERE: https://youtu.be/FsI8KtveD3A (y’all prob know that story😉)In the beginning of this proposal video, there is a small outtake taken when Brooklyn and I were filming our music video for Simple Things in May, 2017. In that moment, Brooklyn and my mom had put Asa up to the task of pranking me with a fake wedding ring and proposal! Little did I know then that four years later Asa would be the one to OFFICIALLY propose to me... and I wouldn't have it ANY. OTHER. WAY! As Asa walked me out to where he planned to propose, I started bawling my eyes out when I figured out what was going on... I literally had NO clue! The date 4/3/21 will forever be a day to remember for the both of us.❤️ It might seem small to you, but it was like even the world was counting down for us! I’m so glad I got to say YES to my forever! (I’m still having a hard time remembering to call Asa my fiancé instead of boyfriend LOL!)💋's -BaileyPS~ Special thanks to Lizzy McAlpine for lending us the use of her unreleased music, to our friend Antoine for taking photos and video, and Kamri for editing this proposal video! And be sure to check back NEXT WEEK for a longer BTS vlog of EVERYTHING leading up to the proposal!__💿🎶  Music Track: No Name (unreleased title)Artist: Lizzy McAlpineWebsite: 👉🏻 https://lizzymcalpine.com/This is an unreleased rendition of Lizzy's beautiful song Andrew, that was rearranged specifically for this video. This track is as the end of Andrew. You can find all of Lizzy's music, including Andrew, on her website (link above)! You should also SUBSCRIBE to Lizzy's YouTube channel, HERE! 👉🏻 https://www.youtube.com/c/LizzyMcAlpine_Where else can YOU FIND US???   📸  Instagram | http://instagram.com/brooklynandbailey   ⏰  Tik Tok | @BrooklynAndBailey   🐥  Twitter | http://twitter.com/brookandbailey   👤  Facebook | http://facebook.com/brooklynandbailey   👻  SnapChat | http://snapchat.com/add/BrookAndBailey   🎶  Spotify | https://open.spotify.com/artist/4Y8tcJEqYuIDSNAZEqu9Nd   ☁️  SoundCloud | http://soundcloud.com/brooklynandbailey_Brooklyn & Bailey have run their own YouTube channel since March 2013, but have appeared on YouTube on their mom's CuteGirlsHairstyles channel since early 2008. So, these twins have pretty much grown up with you on YouTube! Both are currently seniors at Baylor University, studying Entrepreneurship and living life to the fullest. If you love all things twins, including lifestyle and advice videos, informative product reviews and hauls, as well as hilarious skits... then be sure to SUBSCRIBE to this channel!_FTC Disclaimer: This is not a sponsored video._💥SUPERFANS💥: You can help us translate our uploads, and get credit below each video (and be our fav people ever}! Click here to help: http://www.youtube.com/timedtext_cs_panel?tab=2&c=UC6QWhGQqf0YDYdRb0n6ojWw"
"6DqWkyfZ71E","Which Manchester United player is the Nutmeg king? 👑 | Harry Maguire | Teammates 2.0","2021-04-14T09:00:02Z","UCE97AW7eR8VVbVPBy4cCLKg","Soccer AM","17","21.18.04","Soccer AM|Football|Soccer|Premier League|Sky Sports|SoccerAM|Tubes|Tubes Soccer AM|Tubes teammates|Harry Maguire|Harry Maguire Soccer AM|Tubes Harry Maguire|Marcus Rashford|Manchester United|Edinson Cavani|Bruno Fernandes|Nemanja Matic","265026","9296","152","693","https://i.ytimg.com/vi/6DqWkyfZ71E/default.jpg","False","False","SUBSCRIBE ► http://bit.ly/SoccerAMSubTubes caught up with Manchester United captain Harry Maguire to get the low down on his Manchester United teammates. ►PODCAST: http://bit.ly/SoccerAMPodcast►FACEBOOK: http://www.facebook.com/SoccerAM►TIKTOK:  tiktok.com/@socceram►SNAPCHAT:  'SoccerAM'►INSTAGRAM: http://www.instagram.com/SoccerAM►TWITTER: https://www.twitter.com/SoccerAMMORE FROM SKY SPORTS ON YOUTUBE:►SKY SPORTS FOOTBALL: http://bit.ly/SSFootballSub►SKY SPORTS BOXING: http://bit.ly/SSBoxingSub►SKY SPORTS CRICKET: http://bit.ly/SubscribeSkyCricket►SOCCER AM: http://bit.ly/SoccerAMSub►SKY SPORTS F1: http://bit.ly/SubscribeSkyF1►SKY SPORTS: http://bit.ly/SkySportsSub►SKY SPORTS GOLF: https://bit.ly/SubscribeSkySportsGolf"
"na3i6hcUo94","All My YouTube Play Buttons","2021-04-13T20:00:03Z","UC4-79UOlP48-QNGgCko5p2g","MrBeast Shorts","22","21.18.04","[none]","9261544","524137","6641","15159","https://i.ytimg.com/vi/na3i6hcUo94/default.jpg","False","False","subscribe and help me get the diamond play button! #shorts"
"ytWPLjCimxc","I joined the FaZe Rocket League team for a day... (Season 3 Placements)","2021-04-14T17:45:00Z","UC1GFqqHIBaiCW1ivJJCFTvg","amustycow","20","21.18.04","Rocket League Musty Flick|Musty Flick Rocket League|amustycow|Rocket League Mechanics|Rocket League tutorial|Rocket League|I joined the FaZe Rocket League team for a day... (Season 3 Placements)|season 3 rocket league|rocket league season 3|season 3 placement matches|season 3 placement matches rocket league|rocket league placement matches|musty joins faze|faze musty|nrg musty|faze vs nrg|faze ayyjayy|faze gyro|faze rocket league|rocket league faze|musty 3s","1226716","47594","404","4141","https://i.ytimg.com/vi/ytWPLjCimxc/default.jpg","False","False","TW FENNEC GIVEAWAY: twitter: https://twitter.com/amustycow/status/1382102111484264460instagram: https://www.instagram.com/p/CNn5NuNDL78/In the video, I do my season 3 3v3 placement matches with the FaZe Rocket League team! I explore the ranked jungle with FaZe Gyro and FaZe Ayyjayy! Watch until the end to see how many games we end up winning and what rank we got placed at!AyyJayy socials:https://www.youtube.com/channel/UCktpnUzA1CI7rWna-Uc0tKAhttps://www.twitch.tv/ayyjayyhttps://twitter.com/AyyJayyRLGyro socials:https://www.youtube.com/channel/UCoWIX_Y51ECJFWKKsOGp6XQhttps://twitter.com/ExplosiveGyrohttps://www.twitch.tv/explosivegyroEpic Partner Creator Code: MUSTY► Subscribe: https://www.youtube.com/amustycow► Follow me on Twitch: https://www.twitch.tv/amustycow/► Buy Merch: https://amustycow.merchforall.com/▼ Follow Me:Twitter: https://twitter.com/amustycowDiscord: https://discord.gg/mustyInstagram: https://www.instagram.com/amustycow/TikTok: https://www.tiktok.com/@amustycowSnapchat: real.amustycowCar Colors and Settings: https://youtu.be/R6uvRkcy-SwProduction Music by www.epidemicsound.com#amustycow #RocketLeagueEdited by kdence. https://twitter.com/thekdence"
"Y_rYDBdXis8","FP1 red flagged after Perez and Ocon collision! | Emilia Romagna Grand Prix","2021-04-16T09:58:59Z","UC3kxJQ9RfaS5CKeYbbFMi4Q","Sky Sports F1","17","21.18.04","F1|Formula 1|Formula One|Sky F1|Sky Sports|Sky Sports F1|f1 collision|f1 highlights|f1 practice|f1 today|imola|imola grand prix|imola today|motor racing|red bull|red bull f1|red bull racing|italian grand prix","70292","905","96","143","https://i.ytimg.com/vi/Y_rYDBdXis8/default.jpg","False","False","SUBSCRIBE ► http://bit.ly/SubscribeSkyF1The first practice session at Imola was red flagged after 45 minutes following a mysterious collision between Red Bull's Sergio Perez and Alpine driver Esteban Ocon.Add the Sky Sports F1 TV channel to your Sky package by clicking here ► http://bit.ly/WatchSkyF1MORE FROM SKY SPORTS F1:►FACEBOOK: http://www.facebook.com/SkySportsF1►INSTAGRAM: http://www.instagram.com/SkySportsF1►TWITTER: https://www.twitter.com/SkySportsF1MORE FROM SKY SPORTS ON YOUTUBE:►SKY SPORTS FOOTBALL: http://bit.ly/SSFootballSub►SKY SPORTS BOXING: http://bit.ly/SSBoxingSub►SKY SPORTS CRICKET: http://bit.ly/SubscribeSkyCricket►SOCCER AM: http://bit.ly/SoccerAMSub►SKY SPORTS F1: http://bit.ly/SubscribeSkyF1►SKY SPORTS: http://bit.ly/SkySportsSub►SKY SPORTS GOLF: https://bit.ly/SubscribeSkySportsGolf"
"2CZsmTXeRBM","Oh No.... 😂","2021-04-13T19:55:26Z","UC6D1L2vxEAg_Vi0JSxMBDgA","Dan Rhodes","24","21.18.04","[none]","58415353","1608864","83184","13434","https://i.ytimg.com/vi/2CZsmTXeRBM/default.jpg","False","False","Got myself into a sticky situation there 😂"
"Zu2J8sT1akM","Slavia Prague vs Arsenal | Watch Along Live","2021-04-15T21:03:12Z","UCBTy8j2cPy6zw68godcE7MQ","AFTV","17","21.18.04","afc|aftv|arsenal|arsenal fan tv|fan cams|arsenal tv|arsenal fan cams|football|gooners|premier league|robbie lyle|troopz|dt|aftvmedia|david luiz|xhaka|martinelli|arteta|mikel arteta|aftv news|Pierre-Emerick Aubameyang|Aubameyang|Nicolas Pepe|All Gunz Blazing|transfer daily|gabriel|willian|thomas partey|aftv troopz|uel|north london|north london derby|arsenal tottenham|don robbie|football youtube|youtube football|aftv ty|arsenal videos|football fans","423433","5349","148","255","https://i.ytimg.com/vi/Zu2J8sT1akM/default.jpg","False","False","Slavia Prague vs Arsenal | Watch Along LiveThis show is brought to you by Manscaped, the world’s leader in below-the-waist grooming. Use the code ‘AFTV’ for 20% off your order and free shipping at https://www.manscaped.com! #adIf you would like to donate towards supporting Claude's funeral, memorial and family, you can do so here: https://gofund.me/2a22766a(This is the official 'GoFundMe' page set-up by his family.)☑️Try the full AFTV VIP experience (https://www.aftv.mobi/) FREE for 2 weeks, with exclusive new shows, all our YouTube content ad-free, an in-game Opta match centre, team selectors, daily polls, world-class news articles, as well as brilliant competitions including; opportunities to appear on AFTV and much more. *Just £2.99/month after the free trial period*Subscribe to the brand-new Don Robbie YouTube channel now ➡️ https://www.youtube.com/c/DonRobbie😷  AFTV have put in place all the measures suggested by our government, in order to keep our people, and our country, safer during Covid-19.  https://aftv.co.uk/home/aftv-covid-19-policy/🎥 SUBSCRIBE NOW: https://bit.ly/3dXN9Zl📸 FOLLOW US ON INSTAGRAM: https://bit.ly/3dX0kcT📲 FOLLOW US ON TWITTER: https://bit.ly/3f0Wvou👤 LIKE US ON FACEBOOK: https://bit.ly/2VJaHuK📱 FOLLOW US ON TIKTOK: https://bit.ly/2BEux3h👀 SUBSCRIBE ON SNAPCHAT: https://bit.ly/3eBAn6K🤖 JOIN US ON REDDIT: https://bit.ly/2VN1tNU📺 WATCH US ON TWITCH: https://bit.ly/3ivXYVR🖥 VISIT OUR WEBSITE: https://www.aftv.co.uk🙋 Do you have a suggestion for content that you would like to see us do, here on AFTV?➡️ Fill out this quick suggestion form and we might use your idea: https://bit.ly/3iork8JAFTV is the largest football fan network in the world! With a bias towards Arsenal Football Club, we are the place where the fan’s uncensored opinion can be heard before, during and after the whistle blows. Join in the banter and follow us for football previews, watch alongs, fan cams, podcasts and more. This is where the world watches, and the voice of the fan is heard!⚠️ DISCLAIMER: Football is a vibrant game and fans are passionate. Colourful language is sometimes used, and controversial opinions expressed. Content is often streamed live, and we are not always able to edit or censor material in advance. VIEWER DISCRETION IS ADVISED. The thoughts, views and opinions expressed are those of the contributors and do not necessarily purport to be or reflect those of AFTV.#UEL #AFTV #Arsenal #Football"
"6YgKUZnUyak","A Caves & Cliffs Announcement","2021-04-14T15:00:05Z","UC1sELGmy5jp5fQUugmuYlXQ","Minecraft","20","21.18.04","minecraft|minecraft update|caves & cliffs|cave update|minecraft cave update|mojang studios","3662227","260039","5799","42407","https://i.ytimg.com/vi/6YgKUZnUyak/default.jpg","False","False","Agnes and Henrik share some important news about the Caves & Cliffs Update. Visit https://help.minecraft.net/hc/en-us/articles/360059400852 to find out how to enable upcoming Caves & Cliffs features in your snapshot or beta.00:00 Caves & Cliffs announcement00:16 Update info00:40 Ensure Quality01:16 Technical Challenges02:05 Team Health02:43 The Split05:10 Part I Features"
"2RNkRaNfCp4","Indie World Showcase 4.14.2021 - Nintendo Switch","2021-04-14T16:27:58Z","UCGIY_O-8vW4rfX98KlMkvRg","Nintendo","20","21.18.04","nintendo|game|gameplay|fun|video game|action|adventure|rpg|play","3296159","48888","4313","5460","https://i.ytimg.com/vi/2RNkRaNfCp4/default.jpg","False","False","Check out a fresh selection of indie games coming to Nintendo Switch from some of our indie partners from around the world in the latest Indie World Showcase!Follow Indie World on Twitter: https://twitter.com/IndieWorldNAVisit Nintendo.com to find more indie games: https://nintendo.com/indie-world00:43 – Road 9602:56 – Aerial_Knight’s Never Yield05:19 – Last Stop05:58 – Hindsight06:58 – OlliOlli World08:34 – The Longing10:34 – There Is No Game: Wrong Dimension11:06 – Teenage Mutant Ninja Turtles: Shredder’s Revenge13:08 – Cris Tales13:47 – GetsuFumaDen: Undying Moon14:20 – Aztech Forgotten Gods16:13 – Skul: The Hero Slayer18:34 – art of rally18:43 – KeyWe18:52 – Labyrinth City: Pierre the Maze Detective19:02 – Weaving Tides19:11 – THE HOUSE OF THE DEAD: Remake19:19 – ENDER LILIES: Quietus of the Knights19:28 – Beasts of Maravilla Island19:37 – FEZ20:42 – OXENFREE II: Lost Signals#IndieWorld #NintendoSwitchSubscribe for more Nintendo fun! https://goo.gl/HYYsotVisit Nintendo.com for all the latest! http://www.nintendo.com/Like Nintendo on Facebook: http://www.facebook.com/NintendoFollow us on Twitter: http://twitter.com/NintendoAmericaFollow us on Instagram: http://instagram.com/NintendoFollow us on Pinterest: http://pinterest.com/Nintendo"
"YoUOyugWOzQ","GOLDBRIDGE! Manchester United 2-0 Granada Match Reaction","2021-04-15T21:36:17Z","UCMmVPVb0BwSIOWVeDwlPocQ","The United Stand","24","21.18.04","Manchester United|Man United|Man Utd|Manchester United TV|The United Stand|United Stand|Manchester United News|MUFC|Man Utd News|United|Manchester United Transfer News|Man Utd Transfer News|Transfer|Solskjaer|Solskjaer news|MU live streaming|mu live|Man Utd live stream|live|vs Manchester United|Mark Goldbridge|Goldbridge|Granada|Manchester United vs Granada|Manchester United Granada|Man Utd vs Granada","191365","6720","146","409","https://i.ytimg.com/vi/YoUOyugWOzQ/default.jpg","False","False","Manchester United 2-0 Granada. Mark Goldbridge reacts to a big result for Solskjaer's United. Get the latest Man Utd News on The United Stand. Player Ratings Vote Here https://www.theunitedstand.com/articles/match-ratings/fan-player-ratings-manchester-united-vs-granadaLIVE FAN REACTION SHOW: https://www.youtube.com/watch?v=c3Te_ngbcKk&ab_channel=TheUnitedStand🚨VISIT OUR WEBSITE 🚨For all the latest United news and TUS content:https://www.theunitedstand.com⏲️The United Stand Content TIMELINE is the best way to find all our latest content quickly! https://www.theunitedstand.com/timeline📰 LATEST WRITTEN NEWS https://www.theunitedstand.com/articles/latest-news📸 FOLLOW OUR INSTAGRAMhttps://www.instagram.com/theunitedstandtv/✅ The United Stand MEMBERSHIP https://buff.ly/2I2Of9R📧Contact The United Stand = soccerboxtv@gmail.com📧WRITER SUBMISSIONS = unitedstandwebsite@gmail.comAddressing: Jamie or NoraSee the FULL United Stand Kit Range CLICK HERE https://buff.ly/2Krpw1zEXCLUSIVE NEW PODCAST ITUNES https://buff.ly/2ZUhv84Spotify https://buff.ly/34dwEo6Google Podcast https://buff.ly/2ZHlNDnCastBox https://buff.ly/2UuiU3RRadio Public https://buff.ly/34jWkzAThe United Stand is Manchester United's biggest independent fan channel. Made for Manchester United fans by Manchester United fans, the United Stand provides you with the latest Manchester United transfer news, highlights, goal reviews and much more. So if MUFC means the world to you, get involved and subscribe to The United Stand http://bit.ly/1CmczHm#Goldbridge #ManchesterUnited #MUFC"
"fEE4RO-_jug","F9 - Official Trailer 2","2021-04-14T15:00:01Z","UCJCx8aQrdx_ueXPmxTD2odQ","The Fast Saga","1","21.18.04","Fast & Furious|Hobbs & Shaw","15918788","144122","5320","11414","https://i.ytimg.com/vi/fEE4RO-_jug/default.jpg","False","False","F9Fast is back June 25.http://www.thefastsaga.com/No matter how fast you are, no one outruns their past. F9 is the ninth chapter in the Fast & Furious Saga, which has endured for two decades and has earned more than $5 billion around the world.  Vin Diesel’s Dom Toretto is leading a quiet life off the grid with Letty and his son, little Brian, but they know that danger always lurks just over their peaceful horizon. This time, that threat will force Dom to confront the sins of his past if he’s going to save those he loves most. His crew joins together to stop a world-shattering plot led by the most skilled assassin and high-performance driver they’ve ever encountered: a man who also happens to be Dom’s forsaken brother, Jakob (John Cena, the upcoming The Suicide Squad). F9 sees the return of Justin Lin as director, who helmed the third, fourth, fifth and sixth chapters of the series when it transformed into a global blockbuster. The action hurtles around the globe—from London to Tokyo, from Central America to Edinburgh, and from a secret bunker in Azerbaijan to the teeming streets of Tbilisi. Along the way, old friends will be resurrected, old foes will return, history will be rewritten, and the true meaning of family will be tested like never before.  The film stars returning cast members Michelle Rodriguez, Tyrese Gibson, Chris “Ludacris” Bridges, Jordana Brewster, Nathalie Emmanuel and Sung Kang, with Oscar® winner Helen Mirren and Oscar® winner Charlize Theron. F9 also features Grammy-winning superstar Cardi B as new franchise character Leysa, a woman with a connection to Dom’s past, and a cameo by Reggaeton sensation Ozuna.  F9 is produced by Neal H. Moritz, Vin Diesel, Jeff Kirschenbaum, Joe Roth, Justin Lin, Clayton Townsend and Samantha Vincent.  www.thefastsaga.com"
