video_id,title,publishedAt,channelId,channelTitle,categoryId,trending_date,tags,view_count,likes,dislikes,comment_count,thumbnail_link,comments_disabled,ratings_disabled,description
"kT8RIuQkK0U","Marvel’s Avengers – Black Panther Reveal Trailer","2021-03-18T18:00:13Z","UCvC4D8onUfXzvjTOM-dBfEA","Marvel Entertainment","24","21.19.03","marvel|comics|marvel's avengers|avengers|marvel avengers|hawkeye|clint barton|marvel games|story trailer|trailer|game trailer|ps5|xbox s|xbox|playstation|video games|games|videogames|square enix|Maestro|kree|kree invasion|avengers day|kate bishop|next-gen|black panther|t'challa|tchalla|wakanda","1157343","63880","1279","2877","https://i.ytimg.com/vi/kT8RIuQkK0U/default.jpg","False","False","Bow before the king.  Black Panther and the War for Wakanda are coming to Marvel's Avengers along with Klaw, the Wakandan Jungle Biome, new enemies, and much more.► Watch Marvel on Disney+: https://bit.ly/2XyBSIW► Subscribe to Marvel on YouTube: http://bit.ly/WeO3YJFollow Marvel on Twitter: ‪https://twitter.com/marvelLike Marvel on Facebook: ‪https://www.facebook.com/marvelWatch Marvel on Twitch: https://www.twitch.tv/marvelReward your Marvel fandom by joining Marvel Insider!Earn points, then redeem for awesome rewards.Terms and conditions apply. Learn more at https://www.marvel.com/insider?Osocial=YT&CID=MarvelInsiderFor even more news, stay tuned to:Tumblr: ‪http://marvelentertainment.tumblr.com/Instagram: https://www.instagram.com/marvelPinterest: ‪http://pinterest.com/marvelofficialReddit: http://reddit.com/u/marvel-official"
"PCxyT3hHWMM","Shakti | शक्ति | Episode 1197 | Coming Up Next","2021-03-18T11:30:02Z","UC55IWqFLDH1Xp7iu1_xknRA","Colors TV","24","21.19.03","colors tv serials all|colors tv promo|colors tv new serial|colors tv naagin|colors tv khatron ke khiladi|bigg boss|hindi shows|कलर्स टीवी|comedy show|horror show|crime show|reality show|shakti|shakti colors tv|shakti colors serial|शक्ति|हरमन सिंह|soumya|rubina dilaik|vivian dsena|jigyasa singh|sudesh berry|kamya punjabi|heer singh|preeto|kinnar|शक्ति सीरियल|शक्ति सीरियल शुरू से|sony tv|sonyliv|romantic hindi show","1285989","15803","613","167","https://i.ytimg.com/vi/PCxyT3hHWMM/default.jpg","False","False","The celebration and joy bring the love birds, Virat, and Heer closer than ever before. Watch the sneak peek of the upcoming episode as they don't shy away from having a good time together.#ColorsTV #ShaktiTo subscribe this channel go to: http://www.youtube.com/subscription_center?add_user=colorstvTo download the Voot app please click on the link :IOS: https://apps.apple.com/in/app/voot/id1011777157Android: https://play.google.com/store/apps/details?id=com.tv.v18.violaFire TV: https://www.amazon.in/Viacom18-Media-Pvt-Ltd-Originals/dp/B01N2PCGG3/ref=sr_1_1?dchild=1&keywords=voot+tv&qid=1595417708&s=mobile-apps&sr=1-1Follow us on: Facebook: https://www.facebook.com/ColorsTVInstagram: https://www.instagram.com/colorstv/Set against the backdrop of culturally rich and vibrant Punjab, Shakti-Astitva Ke Ehsaas Ki portrays the power of a family to dictate the fate of its daughters, Soumya and Surbhi. Deprived of an education, companions and toys, Soumya can't understand the indifference her father and Dadi show towards her and finds solace only in her mother's arms. Meanwhile Surbhi gets everything she wants, except for the one thing she yearns for-her mother's love. What has caused these heart-breaking rifts in this otherwise perfect family? What makes parents discriminate between their own daughters? Watch the mystery unfold.The accuracy, completeness, currency and/or suitability of the above video description is not endorsed by its licensor or broadcaster or the Channel. They shall not be liable for loss and/or damage arising from the video description."
"4s1UDal7DLo","എമിലിനോടൊപ്പമുള്ള മണാലി യാത്രാ വിശേഷങ്ങൾ |Manali tour with Emil George and Family","2021-03-17T11:30:00Z","UCNMCLJlFSqiUb1EnXII3zhQ","Harees Ameerali - Royal Sky Holidays","22","21.19.03","tech travel eat|malayalam travel videos|travel vlog malayalam|india travel|india kerala travel vlog|kerala tourism|food video|bloggers in kerala|travel vlogs|harees ameerali|royalsky holidays|Manali|Emil George","166241","11268","177","449","https://i.ytimg.com/vi/4s1UDal7DLo/default.jpg","False","False","മണാലി,കുളു യാത്ര നിങ്ങൾ ആഗ്രഹിക്കുന്നുവെങ്കിൽ എല്ലാമാസവും Royalsky Holidays  നടത്തുന്ന യാത്രകളിൽ നിങ്ങൾക്കും പങ്കുചേരാം,യാത്ര ചെയ്യാനാഗ്രഹിക്കുന്നവർ എന്റെ സ്ഥാപനമായ Royalsky Holidays സുമായി ബന്ധപെടുക :+91 9846571800കൂടുതൽ യാത്ര വിശേഷങ്ങൾക്കായിഎന്റെ യൂട്യൂബ് ചാനൽ ലിങ്ക് : https://goo.gl/PpGHR8​​​​ സബ്സ്ക്രൈബ് ചെയ്യൂ .എന്റെ ഫേസ്ബുക് പേജ് ലിങ്ക് : https://goo.gl/yWTG96​​​​ ലൈക് ചെയ്യുകയും,കൂട്ടുകാർക്കു ഷെയർ ചെയ്യുകയും ചെയ്യുമല്ലോ ?----------------------------------------------------Promotion and Collaboration send us your requirements.E Mail: hareesameerali@gmail.comMOBILE:-+91 9846571800-------------------------------------------------------------കൂടുതൽ യാത്ര വിശേഷങ്ങൾക്കായിഎന്റെ യൂട്യൂബ് ചാനൽ ലിങ്ക് : https://goo.gl/PpGHR8​​​​ സബ്സ്ക്രൈബ് ചെയ്യൂ .എന്റെ ഫേസ്ബുക് പേജ് ലിങ്ക് : https://goo.gl/yWTG96​​​​ ലൈക് ചെയ്യുകയും,കൂട്ടുകാർക്കു ഷെയർ ചെയ്യുകയും ചെയ്യുമല്ലോ ?Follow Me  : INSTAGRAM: https://www.instagram.com/hareesameer...​Facebook: https://goo.gl/yWTG96​​​​E Mail : haris@royalskyholidays.comMobile:+91 9846571800(WhatsApp)www.hareesameerali.com"
"R-ZD3B_xxSY","Swaragini | स्वरागिनी | Episode 171 | Will Swara Change Her Decision? | Colors Rishtey","2021-03-18T12:00:05Z","UCyfkoMQeJOoEt3ZhY3PI6Uw","Colors Rishtey","24","21.19.03","swaragini|swaragini serial|swaragini full episodes|swaragini last episode|स्वरागिनी|swaragini episode 1|colors tv hindi serials|#swaragini|internet wala love|bepannah|shastri sisters|colors rishtey|colors tv old shows|#स्वरागिनी|स्वरागिनी सीरियल|स्वरागिनी नाटक|#hellyshah|સ્વરાગિનિ|Tejasswi Prakash|voot|voot select|colors tv show promos|bigg boss 14|barrister babu|molkki|pinjra khubsurti ka|shakti|naagin 5 full episodes|colors tv serials|Bawara dil","1207755","8687","1243","226","https://i.ytimg.com/vi/R-ZD3B_xxSY/default.jpg","False","False","Lakshya wants Sanskaar to convince Swara to change her decision. Sharmishtha helps Parvati in getting ready for 'Durga Puja'as they chat about Shobha.'Swaragini' is a story about Swara and Ragini, who belong to warring families, but later realise that they are in fact half-sisters. Out of sheer hatred, Ragini manipulates Swara's love interest, Lakshaya into marriage, while Swara ends up getting married to Lakshya's brother, Sanskar. Once he learns the truth, Sanskar swears to reunite Swara with Lakshya, but in turn falls in love with her. Will Swara choose her lover over her husband, or will the sanctity of holy matrimony triumph?#Swaragini #ColorsRishtey #Voot"
"fpy_K6v-Bto","Kundali Bhagya | Premiere Episode 908 Preview - Mar 19 2021 | Before ZEE TV | Hindi TV Serial","2021-03-17T10:59:36Z","UCXOgAl4w-FQero1ERbGHpXQ","ZEE5","24","21.19.03","zee5|web series trailer|zee5 originals|latest web series 2020|zee5 original movies|hindi web series|tamil web series|bengali web series|upcoming movie trailer|ZEE Marathi|ZEE Marathi tv serial|zee telugu|zee telugu serial|zee bangla|zee bangla serial|zee kannada|zee kannada serial|zee tamil|zee tamil serial|zee tv|zee tv serial|And tv|And tv serial|before tv|spoilers|tv show spoilers|tv serial updates","1848649","22093","751","338","https://i.ytimg.com/vi/fpy_K6v-Bto/default.jpg","False","False","Watch tomorrow’s Premiere Episodes of ZEE TV serials today. Get the best of ZEE5 Originals, popular Alt Balaji shows, 1000+ superhit movies, favourite Zindagi shows, popular kids entertainment, Live TV channels and more.Join ZEE5 now - https://www.zee5.com/myaccount/subscription?plid=0-11-1503&utm_source=yt&utm_medium=ref&utm_campaign=subscriptionWatch All ZEE5 Originals Here ► http://bit.ly/ZEE5Originals"
"WXVuaDKsXYk","ROJA Serial | Episode 787 Promo | ரோஜா | Priyanka | Sibbu Suryan | Saregama TV Shows Tamil","2021-03-17T14:30:01Z","UCtrovMbRR6h_XLMfdbhqb1A","Saregama TV Shows Tamil","24","21.19.03","saregama tvshows tamil|saregama tamil tvshows|#saregamatamiltvshows|saregamatvshows|Latest serial|sun tv serial|roja|sun tv new serial|today roja serial|roja suntv serial today|roja serial today|roja tamil tv serial|roja serial|roja serial episodes|roja episode today|today roja episode|today roja serial sun tv|roja weekend|saregama tv serial|roja promo 787|roja 787|roja promo","1423115","21321","783","752","https://i.ytimg.com/vi/WXVuaDKsXYk/default.jpg","False","False","Watch the Promo of Roja Special Episode which is scheduled on 18th March  2021.Subscribe to Saregama TVshows Tamil Channel & Don't forget to switch on your notification for all the upcoming Roja serial episodes.Crew:Cast – Priyanka, SibbuSuryan, Rajesh, Vadivukarasi, Gayathri, Shiva, Venkat, Akhila, Kavya, K. Natraj, Dr. Sharmila, Manohar, Sunitha, Sathish, Shamili, Girish, Suseendhar, Shoba Rani, Swetha, Ansari, Dubbing Janaki, SVS Kumar, Anand, Ganesh, VKR. Raghunath, Karishma.Director – V. SadhasivamSenior Vice President – B.R. VijayalakshmiCreative Head – PrinceCameraman – Parthiba KrishnaStory – SaregamaScreenplay – Guru Sampath & Rajarrshi N RoyDialogue - Guru SampathMusic - RaviragavLyricist -  Arun BharathyTitle Song Singer - M.M. ManasiEditor - K. ShankarCreative Team - K. ShanmugamFor More Latest Updates:Subscribe to : http://www.youtube.com/saregamasouthFollow us on: https://twitter.com/saregamaglobalLike us on: https://www.facebook.com/saregamaVisit our website: http://www.saregama.com#RojaSerialPromo #SaregamaTvShowsTamil"
"l5QhO9nl_xA","Living In Haunted House For 24 Hours Challenge | Horror House | Hungry Birds","2021-03-17T15:03:24Z","UCTLZ1jlmY-VogpQXng48iKQ","Hungry Birds","27","21.19.03","food challenge india|hungry birds channel|hungry birds travel|hungry birds challenge in hindi|hungry birds challenge new video|hungry birds new video|hungry birds new video 2020|hungry birds new video 2019|hungry birds new show","2456711","77141","5173","10395","https://i.ytimg.com/vi/l5QhO9nl_xA/default.jpg","False","False","Please guys show your love and support and do subscribe to our new channel .New video is live .New Video (Hungry Birds Inside) Link = https://www.youtube.com/watch?v=gwpP5zOswbQFor Latest Updates of Our Life Please FollowInstagram - https://www.instagram.com/the_hungry_birds_official/Facebook = https://www.facebook.com/hungrybirds4 Cast=Sanket,Umesh,Priti,AkshadaEdited By=Saurabh SawantDOP = Bibin P CherianBackground Music By -Epidemic Sound#HungryBirds #HorrorChallenge #ChallengeIndia"
"0-3sd48EJo4","Kumkum Bhagya | Premiere Episode 1791 Preview - Mar 19 2021 | Before ZEE TV | Hindi TV Serial","2021-03-17T10:58:17Z","UCXOgAl4w-FQero1ERbGHpXQ","ZEE5","24","21.19.03","zee5|web series trailer|zee5 originals|latest web series 2020|zee5 original movies|hindi web series|tamil web series|bengali web series|upcoming movie trailer|ZEE Marathi|ZEE Marathi tv serial|zee telugu|zee telugu serial|zee bangla|zee bangla serial|zee kannada|zee kannada serial|zee tamil|zee tamil serial|zee tv|zee tv serial|And tv|And tv serial|before tv|spoilers|tv show spoilers|tv serial updates","1578610","21566","652","363","https://i.ytimg.com/vi/0-3sd48EJo4/default.jpg","False","False","Watch tomorrow’s Premiere Episodes of ZEE TV serials today. Get the best of ZEE5 Originals, popular Alt Balaji shows, 1000+ superhit movies, favourite Zindagi shows, popular kids entertainment, Live TV channels and more.Join ZEE5 now - https://www.zee5.com/myaccount/subscription?plid=0-11-1503&utm_source=yt&utm_medium=ref&utm_campaign=subscriptionWatch All ZEE5 Originals Here ► http://bit.ly/ZEE5Originals"
"8V9sy4ujlL0","మా purvika Birthday Vlog|A day Vlog|Birthday Celebration|Vlog","2021-03-18T05:00:20Z","UCwmDl3LVAsJ3NzFIOlr5Wfg","MadhuReddy Official","22","21.19.03","birthday vlog|celebrity birthday vlog|a day in my life|birthday party|MadhuReddy official|MadhuReddy daughter|madhureddy sister|madhureddyhusband|MadhuReddy father|celebrity mother's|celebrity vlogs","302490","6640","182","3226","https://i.ytimg.com/vi/8V9sy4ujlL0/default.jpg","False","False","Dm For Collobration &Paid Collobrationmadhureddyofficial03@gmail.comDo watch my Latest Videos on Trending:-https://youtu.be/1XAZ53UDI4chttps://youtu.be/ZgNch9egjh0https://youtu.be/g7grW5QnoPUhttps://youtu.be/FrWSHpVdumwhttps://youtu.be/WA16tfwprrMCheck Out my latest New video:-My Long Frock Collection•Lot Of Memories With My Frocks•Madhureddyofficial❤️❤️https://youtu.be/Q7n7N0V2rM8________________________________________Best way to remove pimples, acne & acne scarshttps://youtu.be/s3EI_YjMPZc❤️❤️________________________________________మా వదినమ్మ ఇంట్లో పూజ(సుదర్శన హోమం)/Pooja Vlog/Madhureddyofficial❤️❤️https://youtu.be/eG12Yjmpam0_________________________________________మా వదినమ్మ ఇంటి గృహప్రవేశం|Home tour Of Vadinamma|House warming❤️❤️https://youtu.be/zg8zlBcgCdo_________________________________________మా అత్తారిల్లు|House Tour|Vlog|Family Introduce|Madhureddyofficial❤️❤️https://youtu.be/WA16tfwprrM__________________________________________నా జీవితంలో చాలా ముఖ్యమైన రోజు ఈ రోజు/The most memorable day in My life❤️https://youtu.be/IwOOe2jgUjo________________________________________నా ఈ పుట్టినరోజు అతిధులు ఎవరో తెలుసా?/In my life Best Guests for my birthday/My makeup lookhttps://youtu.be/pQGSVBGWddU❤️❤️❤️❤️❤️❤️❤️❤️❤️________________________________________MY Pattu Saree Collection/Shooting Pattu Saree/Festival Sarees/pattu lovershttps://youtu.be/e_8NObFGIFg❤️❤️❤️❤️❤️❤️❤️❤️________________________________________My Birthday Celebrations with|నా పేరు మీనాక్షి |Serial  Teamhttps://youtu.be/EEL2Ejt1y3o❤️❤️❤️❤️❤️❤️❤️________________________________________My Style Mutton Dum Briyani•Yummy Briyani•How To Make Mutton Briyani•Madhureddyofficialhttps://youtu.be/VpEwZDCt9_0❤️❤️❤️❤️❤️❤️________________________________________మా Marriage Anniversary కి నా షాపింగ్|Mostmemorable day in my life|Shopping|happineshttps://youtu.be/9OecmyhOAHw_______________________________________మా Anniversary షాపింగ్ కి మా శ్రీవారి Reaction|Na  shopping w/s My husband Reaction 😳https://youtu.be/RvZz83auWOU_____________________________________నా కుటుంబం లక్ష మంది|My Family 1Lak|Celebration Vlog|Madhureddyofficialhttps://youtu.be/ycRgKzhqupM_______________________________________నా పేరు మీనాక్షి లో గౌతమి ఎలా రెడీ అవుతుంది|How I am Geeting Ready In naa peru Meenakshi Serialhttps://youtu.be/bF6sAkeDYvE___________________________________My Earrings Collection|Beautiful Mennakari Earrings|Earring haulhttps://youtu.be/1Cxn8_3XIcc___________________________________Follow Me On Social media Instagram-https://instagram.com/madhureddy_official?igshid=fh9in5cmarnoINSTAGRAM : https://instagram.com/madhureddy_official?igshid=fh9in5cmarnothank you for watching my videolike👍share& subscribe my channel❤️❤️❤️❤️❤️❤️❤️❤️❤️❤️❤️❤️❤️For Business inquiry reach out via madhureddyofficial03@gmail.com"
"zLftw2L5Wf0","1 किलो अंगूर से ढेरों किशमिश बनाना इतना सस्ता है की फिर कभी बाजार से नहीं खरीदोगे /Homemade Kishmish","2021-03-15T05:17:27Z","UC2JcFCoSQnxqmeMxvA49Vjg","Ray Kitchen","26","21.19.03","kishmish recipe|raisins recipe|homemade raisins|how to make raisins at home|किशमिश बनाएँ अब आसानी से घर पर बिलकुल बाज़ार जैसी|kishmish recipe in hindi|मार्केट जैसी किशमिश घर पर बनाएं|किशमिश|how to make raisins at home in hindi|Home Made Kishmish Recipe|केवल Rs.50 में 1/2 kg किशमिश|1 किलो अंगूर से ढेरों किशमिश बनाना इतना सस्ता है की फिर कभी बाजार से नहीं खरीदोगे|ray kitchen|cooking|recipe|अंगूर|grapes|grapes recipe|summer recipe|summer special|summer","989686","16373","1145","790","https://i.ytimg.com/vi/zLftw2L5Wf0/default.jpg","False","False","Aaj main aapko 1 kilo angoor se lagbag 1/2 kilo kishmish ghar pe asani se kaise bana saktein hain woh bataungi , market se sasta aur A1 Quality ka banega …aur isse aap saal bhar store karke bhi rakh saktein hain …1 किलो अंगूर से ढेरों किशमिश बनाना इतना सस्ता है की फिर कभी बाजार से नहीं खरीदोगे /Homemade KishmishDoston Agar ap ko meri yeah Recipe Pasand aa ye toh…LIKE and SHARE... Karna Nahi Bhule and Latest Recipe Update ke Liye.. Subscribe Karein ..and Bell Icon Press Karein…Free!Support & Subscribe My Channel: https://goo.gl/QU4TtGYoutube Channel: http://www.youtube.com/c/RayKitchenIngredients1. Grapes 1 kg.kishmish recipe, raisins recipe, homemade raisins, how to make raisins at home, homemade raisins, किशमिश बनाएँ अब आसानी से घर पर बिलकुल बाज़ार जैसी, kishmish recipe in hindi, मार्केट जैसी किशमिश घर पर बनाएं, किशमिश, 1 किलो अंगूर से ढेरों किशमिश बनाना इतना सस्ता है की फिर कभी बाजार से नहीं खरीदोगे, how to make raisins at home in hindi, ray kitchen, cooking, recipe, cookery, foodie, grapes recipe, summer recipe, cooking videos,"
"ZrdQSAX2kyw","Zack Snyder’s Justice League | Official Trailer #2 | HBO Max","2021-03-14T19:32:17Z","UCx-KWLTKlB83hDI6UKECtJQ","HBO Max","1","21.19.03","DC Universe|zack snyder|justice league|zack snyder's justice league|snyder cut|snyder cut trailer|release the snyder cut|joker snyder cut|joker justice league|superman snyder cut|jared leto justice league|bruce wayne|wonder woman justice league|batman justice league|ezra miller justice league|justice league directors cut|man of steel|batman v superman|dawn of justice|ben affleck|henry caill|amy adams|amber heard|gal gadot|jason momoa","8526467","187951","3899","21288","https://i.ytimg.com/vi/ZrdQSAX2kyw/default.jpg","False","False","In Zack Snyder's Justice League, determined to ensure Superman’s (Henry Cavill) ultimate sacrifice was not in vain, Bruce Wayne (Ben Affleck) aligns forces with Diana Prince (Gal Gadot) with plans to recruit a team of metahumans to protect the world from an approaching threat of catastrophic proportions. The task proves more difficult than Bruce imagined, as each of the recruits must face the demons of their own pasts to transcend that which has held them back, allowing them to come together, finally forming an unprecedented league of heroes. Now united, Batman (Affleck), Wonder Woman (Gadot), Aquaman (Jason Momoa), Cyborg (Ray Fisher), and The Flash (Ezra Miller) may be too late to save the planet from Steppenwolf, DeSaad, and Darkseid and their dreadful intentions.Subscribe: http://bit.ly/HBOMaxYouTubeBe the first to know more:HBO Max: https://hbom.ax/YTLike HBO Max on Facebook: http://bit.ly/HBOMaxFacebookFollow HBO Max on Twitter: http://bit.ly/HBOMaxTwitterFollow HBO Max on Instagram: http://bit.ly/HBOMaxInstagramAbout HBO Max: HBO Max is WarnerMedia’s direct-to-consumer offering with 10,000 hours of curated premium content. HBO Max offers powerhouse programming for everyone in the home, bringing together HBO, a robust slate of new original series, key third-party licensed programs and movies, and fan favorites from WarnerMedia’s rich library including Warner Bros., New Line, DC, CNN, TNT, TBS, truTV, Turner Classic Movies, Cartoon Network, Adult Swim, Crunchyroll, Rooster Teeth, Looney Tunes and more. #HBOMax #WarnerMedia"
"n2izX_YkT4M","Shakti | शक्ति | Ep. 1197 | A Shocker For Heer!","2021-03-18T07:15:01Z","UC55IWqFLDH1Xp7iu1_xknRA","Colors TV","24","21.19.03","colors tv serials all|colors tv new serial|colors tv naagin|colors tv khatron ke khiladi|bigg boss|hindi shows|कलर्स टीवी|comedy show|horror show|crime show|reality show|choti sarrdaarni|छोटी सरदारनी|ਚੋਟੀ ਸਰਦਾਰਨੀ|sarabjit singh|avinesh rekhi|nimrit kaur ahluwalia|meher|anita raj|neelu kohli|param|choti sarrdaarni song|choti sarrdaarni title track|param cute moments|choti sarrdaarni twist|daily soap|sonyliv|star plus|best scenes","665250","6924","395","56","https://i.ytimg.com/vi/n2izX_YkT4M/default.jpg","False","False","As Heer leaves the house, she is followed by Isha. However, she gets kidnapped by Angel at knifepoint. As Heer tries to save herself from Angel, she finds out that Angel works for Isha. How will Heer deal with her?#ColorsTV #ChotiSarrdaarniTo subscribe this channel go to: http://www.youtube.com/subscription_center?add_user=colorstvTo download the Voot app please click on the link :IOS: https://apps.apple.com/in/app/voot/id1011777157Android: https://play.google.com/store/apps/details?id=com.tv.v18.violaFire TV: https://www.amazon.in/Viacom18-Media-Pvt-Ltd-Originals/dp/B01N2PCGG3/ref=sr_1_1?dchild=1&keywords=voot+tv&qid=1595417708&s=mobile-apps&sr=1-1To go to the playlist please click: https://www.youtube.com/playlist?list=PLcC6hSpO26KvMCfB5VXprxzhFVa3QHU9DFollow us on: Facebook: https://www.facebook.com/ColorsTVInstagram: https://www.instagram.com/colorstv/Meher is coerced by her mother into marrying Sarabjeet, a widower with a 5 year-old child. But, much to her mother’s dislike, Meher is pregnant with her lover, Manav’s child. Can she stand up for her love and fight her own? This is the journey of a strong-willed woman who makes her own rules and stands by them, come what may. Naag se badh kar Naagin, Sher se badh kar Sherni aur Sardar se badh kar Choti Sarrdaarni! Watch the fiercely independent sardani take on the world and protect her family in Choti Sarrdaarni.The accuracy, completeness, currency and/or suitability of the above video description is not endorsed by its licensor or broadcaster or the Channel. They shall not be liable for loss and/or damage arising from the video description."
