video_id,title,publishedAt,channelId,channelTitle,categoryId,trending_date,tags,view_count,likes,dislikes,comment_count,thumbnail_link,comments_disabled,ratings_disabled,description
"eJyuDggusOE","I Ordered Everything From The MrBeast Burger Menu","2021-05-10T19:00:11Z","UC5JYRErFekvgcd2Sb-s8-Tg","S2W","23","21.13.05","[none]","639235","55175","302","2175","https://i.ytimg.com/vi/eJyuDggusOE/default.jpg","False","False","ordering everything from the mrbeast burger menu Main Channel: https://www.youtube.com/user/BettySchwallocksMy Reddit: https://www.reddit.com/r/WillNE/My Twitch: https://www.twitch.tv/will_neTwitter: https://twitter.com/willneFacebook: https://www.facebook.com/WillNEYTInstagram: https://www.instagram.com/willne/"
"NwJiEQ-Csbc","Khabib spends $40,000,000 💰 | #shorts","2021-05-09T16:00:09Z","UCtab7TqLkMFc9MzOMvx5b-g","Frank Michael Smith","17","21.13.05","shorts|youtube shorts|khabib|khabib nurmagomedov|khabib vs mcgregor highlights|khabib vs tony ferguson|khabib vs gaethje|khabib vs poirier|khabib wrestling bear|khabib highlights|khabib mcgregor|khabib vs abel trujillo|khabib vs tony ferguson full fight|khabib vs bear|khabib vs mcgregor best moments|khabib vs holloway|khabib rich|khabib net worth|khabib money|khabib cars|khabib dagestan|khabib houses|khabib mansion|khabib nurmagomedov highlights","385480","42421","342","284","https://i.ytimg.com/vi/NwJiEQ-Csbc/default.jpg","False","False","Khabib spends $40,000,000Khabib Nurmagomedov is a man of simple pleasures. He enjoys his family, the mountains, and dominate the life out of his peers in the octagon. He most certainly does not enjoy spending cash on material possessions.Do you sub my 2nd channel? https://www.youtube.com/channel/UCLh4IlP1baVfBWRmguWyVhAI run a free contest on my IG with 💰prizes once a weekhttps://bit.ly/frankInstagram"
"ArANJLk0OnE","Covid roadmap: Boris Johnson confirms Covid rules will ease further from May 17 | ITV News","2021-05-10T21:48:14Z","UCFQgi22Ht00CpaOQLtvZx2A","ITV News","25","21.13.05","coronavirus|lockdown","294008","1179","1533","0","https://i.ytimg.com/vi/ArANJLk0OnE/default.jpg","True","False","Covid roadmap: Boris Johnson confirms Covid rules will ease further from May 17 | ITV News• Subscribe to ITV News on YouTube: http://bit.ly/2lOHmNj • Get breaking news and more stories at http://www.itv.com/newsFollow ITV News on Facebook: https://www.facebook.com/itvnews/ Follow ITV News on Twitter: https://twitter.com/itvnews Follow ITV News on Instagram: https://www.instagram.com/itvnews/"
"VBaIBBPwXMs","Carl Froch REACTS to Canelo Alvarez's win vs Billy Joe Saunders, talks Caleb Plant & MORE","2021-05-09T05:52:14Z","UCZEOvoFUl6pkx7rts8KKkhw","Boxing Social","17","21.13.05","Boxing|Interview|Boxing News|Sports|Exclusive|Boxer|Boxeo|skysports|boxnation|BOXING SOCIAL|EDDIE HEARN|ANTHONY JOSHUA|TYSON FURY|CANELO ALVAREZ|Matchroom Boxing|DAZN|Sky Sports Boxing|BT Sport Boxing|Mark Tibbs|Eddy Reynoso|Billy Joe Saunders|Callum Smith|Canelo vs Smith|Canelo vs Saunders|Jimmy Tibbs|Tom Saunders|Andy Ruiz Jr|Chris Arreola|Carl Froch","209172","1256","58","794","https://i.ytimg.com/vi/VBaIBBPwXMs/default.jpg","False","False","Boxing Social's Andi Purewal spoke to Carl Froch in Texas after pound-for-pound star Saul 'Canelo' Alvarez's clash with Billy Joe Saunders. #CaneloSaunders🔞 BETFRED | Not Suitable for Minors | Please Gamble Responsibly | https://www.begambleaware.org/NGTS.html 🔞📲 | SUBSCRIBE: https://www.youtube.com/channel/UCZEOvoFUl6pkx7rts8KKkhw?sub_confirmation=1🚨 - FOLLOW BOXING SOCIAL ON SOCIAL MEDIA... 👇🥊 - TWITTER: https://twitter.com/boxing_social🥊 - FACEBOOK: https://www.facebook.com/boxingsocial🥊 - INSTAGRAM: https://www.instagram.com/boxing.social💻 - WEBSITE: https://boxing-social.com"
"8zSY6zYILVY","SIDEMEN GUESS THE MILLIONAIRE","2021-05-09T17:01:52Z","UCDogdKl7t7NHzQ95aEwkdMw","Sidemen","24","21.13.05","sidemen|sidemen sunday|#sidemensunday","4866303","285792","2094","10289","https://i.ytimg.com/vi/8zSY6zYILVY/default.jpg","False","False","The sidemen meet some rich donnies👉🏻: Subscribe to our Reacts Channel: https://www.youtube.com/SidemenReacts 👈🏻👕: Sidemen Clothing: http://www.sidemenclothing.com👉🏻 Subscribe to our 2nd Channel: https://www.youtube.com/MoreSidemen 👈🏻📸: Sidemen Instagram: http://www.instagram.com/Sidemen🐤: Sidemen Twitter: http://www.twitter.com/Sidemen✏️: SUBMIT A #SidemenSunday IDEA HEREhttps://forms.gle/JDuGrSzM4F6mdo6D9-----------------------------------------------------------------------------------------------------------------------▶️ SIDEMEN ◀️🔵 JOSH (Zerkaa)● http://www.youtube.com/Zerkaa● http://www.youtube.com/ZerkaaPlays● http://www.instagram.com/Zerkaa● http://www.twitter.com/ZerkaaHD🔴 HARRY (W2S)● http://www.youtube.com/W2S● http://www.youtube.com/W2SPlays● http://www.instagram.com/Wroetoshaw● http://www.twitter.com/Wroetoshaw🔵 VIK (Vikkstar123)● http://www.youtube.com/Vikkstar123● http://www.youtube.com/Vikkstar123HD● http://www.youtube.com/VikkstarPlays● http://www.instagram.com/Vikkstagram● http://www.twitter.com/Vikkstar123🔴 JJ (KSI)● http://www.youtube.com/KSI● http://www.youtube.com/KSIOlajidebtHD● http://www.instagram.com/KSI● http://www.twitter.com/KSIOlajidebt🔵 TOBI (Tobjizzle)● http://www.youtube.com/TBJZL● http://www.youtube.com/Editingaming● http://www.instagram.com/Tobjizzle● http://www.twitter.com/Tobjizzle🔴 ETHAN (Behzinga)● http://www.youtube.com/Behzinga● http://www.youtube.com/Beh2inga● http://www.instagram.com/Behzingagram● http://www.twitter.com/Behzinga🔵 SIMON (Miniminter)● http://www.youtube.com/Miniminter● http://www.youtube.com/MM7Games● http://www.instagram.com/Miniminter● http://www.twitter.com/Miniminter"
"qXN8_C3vABM","Celebrating KSI's Birthday","2021-05-09T18:03:05Z","UChKVhjGmPAu7eWa2ITDd50w","Konstantin","22","21.13.05","[none]","549902","34097","350","440","https://i.ytimg.com/vi/qXN8_C3vABM/default.jpg","False","False","To find out more about the XPS range, click here👉 http://bit.ly/DELLxKONMERCH LINK: https://www.ikonfilms.co.uk/shop/ikon-black-hoodie📸INSTAGRAM: http://bit.ly/KonFilms🐤TWITTER: http://bit.ly/KonTweets🎵 Where I get my music from🎵 👉 http://share.epidemicsound.com/kon👈Kit Used In Video 👉 http://bit.ly/MyKitList"
"PEe-ZeVbTLo","Baelin's Route - An Epic NPC Man Adventure","2021-05-09T10:00:16Z","UCchBatdUMZoMfJ3rIzgV84g","Viva La Dirt League","20","21.13.05","NPC Man|PUBG Logic|pubg real life|pubg|pubg logic supercut|pubg movie|pubg parody|Viva La Dirt League|vldl|epic npc man|pubg mobile|pubg skits|viva la dirt league pubg|pubg funny|pubg live action|vldl pubg|gaming|online gaming|gamer|playtech|bored|game logic|baelin|baelins route|baelins route reaction|baelin's route|baelin's route trailer","1804090","275710","872","46282","https://i.ytimg.com/vi/PEe-ZeVbTLo/default.jpg","False","False","Baelin (Rowan Bettjeman), a simple background NPC in the video game 'Skycraft' has been walking the same route for as long as he can remember. However, his peaceful (and mindless) routine is violently shaken as a short-tempered Adventurer (Ben Van Lier) drags him off his path and into a dangerous quest to escort a mysterious NPC girl named Willow (Phoenix Cross) across the harsh world of Azerim. ORIGINAL 'BAELIN'S ROUTE' SOUNDTRACK: https://mikenewport.hearnow.com/Special thanks to Alfonso de Orleans-Borbon for getting us across the line on the Kickstarter campaign! WATCH MORE SKITS HERE: http://bit.ly/VLDLvideosSUPPORT ON PATREON - http://bit.ly/VLDLpatreonDISCORD - http://bit.ly/VLDLdiscordFACEBOOK: http://bit.ly/VLDLfacebookTWITTER: http://bit.ly/VLDLtwitterINSTAGRAM: http://bit.ly/VLDLinstagram---------------------------------- TWITCH -------------------------------http://bit.ly/VLDLtwitch----------------------------------- MERCH--------------------------------Merchandise: http://bit.ly/VLDLmerchSongs: http://bit.ly/VLDLmusic------------------- MORE VIDEOS ------------------Epic NPC Man: http://bit.ly/NPCmanBored: http://bit.ly/VLDLboredPUBG Logic: http://bit.ly/PUBGlogicFPS Logic: http://bit.ly/FPSlogicSouls Logic: http://bit.ly/SoulslogicMusic Videos: http://bit.ly/VLDLmusicvidsWildcards: http://bit.ly/VLDLwildcard"
"pe33iZFfKm8","FAKE or REAL Injury? Canelo Alvarez vs Billy Joe Saunders - Doctor Explains What REALLY Happened","2021-05-09T05:25:24Z","UCHlBaw2X5iYQGJhd5v718Zw","Brian Sutterer MD","17","21.13.05","canelo alvarez vs billy joe saunders|canelo alvarez|billy joe saunders eye injury|canelo alvarez interview|dazn|boxing|canelo alvarez fight highlights|billy joe saunders|billy joe|billy joe saunders vs canelo|billy joe saunders highlights|doctor explains|boxing news|canelo vs saunders|canelo vs saunders full fight|canelo vs saunders live|dazn boxing|wbo super title","731718","18251","758","2356","https://i.ytimg.com/vi/pe33iZFfKm8/default.jpg","False","False","Thanks to &Collar for sponsoring this video!Head to https://bit.ly/3nuYOVR and use code BRIAN10 to save 10%!Canelo Alvarez defeated Billy Joe Saunders after the fight was ended due to an eye injury suffered by Billy Joe Saunders. Many people are claiming he quit on the fight and it wasn't that bad of an injury following an uppercut from Canelo Alvarez. In this video Doctor Brian Sutterer will review the fight and explain what happened during this injury sequence. UPDATE VIDEO:https://youtu.be/cEshBdFqsg4UFC and Boxing Videos:https://youtube.com/playlist?list=PLrdpldKEF236khwdFNRilNeOZded9gZLDMY MUSIC:Epidemic Sound - Sign up with this link for a FREE 30 day trial!https://www.epidemicsound.com/referral/2m1bb5/Follow Me on Twitter!https://twitter.com/b_suttererI'm a doctor and a sports fan and this channel is dedicated to exploring the unique medical side of the world of sports, including NBA, MLB, NFL, UFC, and many more! Breaking down the biggest what ifs, historical injuries and stories, and making learning about medicine fun and relevant for all sports fans!Anatomy images: https://www.biodigital.comDISCLAIMER: Content not intended to be taken as medical advice. Opinions are my own and do not represent those of my employer. I have not personally treated or evaluated the individual(s) discussed in this video. Content used with educational and transformative intent within Fair Use GuidelinesContent owned and produced by Brian Sutterer LLC 2021"
"XdcSli5STR4","Odd1sOut Shorts Shotgun // All Dogs Go To Heaven? #shorts​","2021-05-09T16:34:30Z","UCo8bcnLyZH8tBIH9V1mLgqQ","TheOdd1sOut","23","21.13.05","[none]","2228465","155603","2041","5611","https://i.ytimg.com/vi/XdcSli5STR4/default.jpg","False","False","Happy Mothers day #shorts"
"_RwouIKOzMI","Canelo's HYPED Reaction To Beating Billy Joe Saunders, Calls Out Caleb Plant","2021-05-09T04:42:20Z","UCurvRE5fGcdUgCYWgh-BDsg","DAZN Boxing","17","21.13.05","dazn|boxing|highlights|full fight|ko|knockout|ryan garcia|top 10|canelo|anthony joshua|ggg|haney|interview|fight night|boxing highlight|canelo saunders","2774600","45097","1090","6812","https://i.ytimg.com/vi/_RwouIKOzMI/default.jpg","False","False","May 8, 2021 -- Canelo vs. Saunders from AT&T Stadium in Arlington, TexasSubscribe to our YouTube channel 👉  http://bit.ly/DAZNBoxingYouTubeDownload the DAZN app now 👉  http://bit.ly/DAZNYoutubeFollow DAZN Boxing On Social Media 👇Twitter: https://www.twitter.com/DAZNBoxingInstagram: https://www.instagram.com/DAZNBoxingFacebook: https://www.facebook.com/DAZN"
"RIlWpU5tk4E","Charli Was So Nervous To Be On The Show | Dixie D'Amelio","2021-05-09T17:00:15Z","UCLOEGprmycLLbyzBj2jozLg","Dixie D'Amelio","22","21.13.05","[none]","1212800","82155","1632","3094","https://i.ytimg.com/vi/RIlWpU5tk4E/default.jpg","False","False","Charli is BACK!!! I always have so much fun when I'm able to do videos with  @charli d'amelio! You finally get to hear from Charli D'Amelio herself about how this show started!! Thanks to the best sister for being on my show. Don't forget the show airs every Sunday at 10AM PST/1PM EST!!! Thanks for watching! CreditsExecutive Producer: Dixie D'AmelioExecutive Producer: Tommy BurnsExecutive Producer: Christian GuitonDirector: Christian GuitonDP: Seth FullerEditor: Diego ColeProduction Company: Black Street EntertainmentStudio: Hubble StudioWebsite: https://www.dixiedamelio.com​Subscribe for more official content from Dixie: https://www.youtube.com/dixiedamelio?...​Connect with me!TikTok: https://www.tiktok.com/@dixiedamelio​Instagram: https://www.instagram.com/dixiedamelio​Twitter: https://twitter.com/dixiedamelio​Website: https://www.dixiedamelio.com​Connect with Charli!TikTok: https://www.tiktok.com/@charlidamelioInstagram: https://www.instagram.com/charlidamelioYouTube: https://www.youtube.com/charlidamelioWe love our Tov chairs!https://tovfurniture.com​Shout out to Whisbe for the absolute best set-piece http://www.whisbeworldwide.com/Thanks to Room Cloud for the clouds on set!https://roomcloudshop.com/Thanks to GlowHub for the sick neon of my logohttps://glowhubco.com/Check out my merch: https://dixiedamelio.shop/​#DixieDAmelio​ #CharliDAmelio #TheEarlyLateNightShow"
"IA0hif27Tyk","US vs UK TGI Fridays | Food Wars","2021-05-09T16:00:07Z","UCwiTOchWeKjrJZw7S1H__1g","Food Insider","19","21.13.05","INSIDER|FOOD INSIDER","404998","10791","148","1018","https://i.ytimg.com/vi/IA0hif27Tyk/default.jpg","False","False","From calorie count to portion sizes, we wanted to find out all the differences between TGI Fridays in the US and the UK. This is Food Wars.Intro 00:00Portion Sizes 00:10Exclusives 3:40Nutrition 10:00Ingredients 16:24MORE FOOD WARS VIDEOS:US vs UK Nando’s | Food Warshttps://www.youtube.com/watch?v=ReyHWaYfVbYUS vs UK Chipotle | Food Warshttps://www.youtube.com/watch?v=0SSwfpO-xhM&t=6sUS vs UK Starbucks | Food Warshttps://www.youtube.com/watch?v=9fpfa1QP_8w------------------------------------------------------#TGIFridays #FoodWars #FoodInsiderInsider is great journalism about what passionate people actually want to know. That’s everything from news to food, celebrity to science, politics to sports and all the rest. It’s smart. It’s fearless. It’s fun. We push the boundaries of digital storytelling. Our mission is to inform and inspire.Subscribe to our channel and visit us at: https://www.insider.comFood Insider on Facebook: https://www.facebook.com/foodinsider/Food Insider on Instagram: https://www.instagram.com/thisisinsiderfood/Food Insider on Twitter: https://twitter.com/InsiderFoodInsider on Snapchat: https://www.snapchat.com/discover/Insider/4020934530Insider on Amazon Prime: https://www.amazon.com/v/thisisinsiderInsider on TikTok: https://www.tiktok.com/@insiderFood Insider on Dailymotion: https://www.dailymotion.com/foodinsiderUS vs UK TGI Fridays | Food Wars"
"k29kw87xpho","I made a City of Extreme Cruelty in Cities Skylines","2021-05-10T17:00:30Z","UCRC6cNamj9tYAO6h_RXd5xA","RTGame","20","21.13.05","RTGame|RT Game|Irish|funny|moments|gameplay|rt game|stream highlights|funny stream highlights|rtgame cities skylines|cities skylines|city skylines|cities skylines funny|cities skylines disaster|cities skylines country roads|cities skylines sewage|city skylines flood|cities skylines tsunami|when city planning in cities skylines|rtgame when city planning|cities skylines funny city|cities skylines bad city|cities skylines funny gameplay|cities skylines ocean","794016","51546","291","3398","https://i.ytimg.com/vi/k29kw87xpho/default.jpg","False","False","Welcome to The Bathtub. It is forever on fire, surrounded by an ocean of sewage, with no sunlight.~Watch all of my Cities Skylines videos: https://www.youtube.com/watch?v=V37Au5H0kG0&list=PLliBvQE3gg9dNVEj6v6iXaTqqrZYwFc7e~Twitch Channel: http://www.twitch.tv/rtgame~Merch Shop: https://freshmerch.fm/collections/rtgame~Twitter: https://twitter.com/RTGameCrowd~Instagram: https://www.instagram.com/rtgamecrowd~Discord: https://discord.gg/rtgame~RTGame Archive Channel: https://www.youtube.com/rtgamestreamarchive~~~~~~~~Extra Things~~~~~~~~Everything you see in my videos is edited livestream highlights taken from my Twitch channel. My schedule is Tuesday & Thursday @ 7pm, Saturday & Sunday @ 3pm - all times based in Ireland.Video edited by Ashtaric! Go support her here: https://twitter.com/xashtaricxAnd here: https://www.twitch.tv/ashtaricMusic is Paper Mario: The Origami King - The Great Sea, Red Streamer Battle, Thrills at Night, Dark Souls 3 - Various Boss music themes."
"Ne4S6glyGec","XXXTENTACION NFT Collection - The Drop","2021-05-10T15:51:56Z","UCM9r1xn6s30OnlJWb-jc3Sw","XXXTENTACION","10","21.13.05","NFT|XXXTentacion|YellowHeart|YellowHeartNFT|Blockchain|NFT DROP|Jahseh Dwayne Ricardo Onfroy|Hip Hop|Rapper|Rap|Cleopatra Bernard|Solomon Sounds|Teaser|Yelllow Heart|NFTs|@YellowHeartNFT","805945","143550","2589","18541","https://i.ytimg.com/vi/Ne4S6glyGec/default.jpg","False","False","YellowHeart presents: The XXXTENTACION NFT Collection. Live now through Saturday, May 15th 12ET on www.yh.io"
"SYFuA3xnkUE","How to Poop on a US Navy NUCLEAR SUBMARINE - Smarter Every Day 256","2021-05-09T14:00:20Z","UC6107grRI4m0o2-emgoDnAA","SmarterEveryDay","28","21.13.05","Smarter|Every|Day|Science|Physics|Destin|Sandlin|Education|Math|Smarter Every Day|experiment|nature|demonstration|slow|motion|slow motion|education|math|science|science education|what is science|Physics of|projects|experiments|science projects|Submarine|nuclear submarine|deep dive|submarine series|USS|USS Toledo|US Navy|Submariner|Life on a Submarine|bathroom|how toilet works","1164548","57927","650","3658","https://i.ytimg.com/vi/SYFuA3xnkUE/default.jpg","False","False","Go to https://buyraycon.com/smarter  for 15% off your order. Brought to you by Raycon. Click here if you're interested in subscribing: http://bit.ly/Subscribe2SED⇊  Click below for more links!  ⇊~~~~~~~~~~~~~~~~~~~~~~~~~~~~GET SMARTER SECTION~~~~~~~~~~~~~~~~~~~~~~~~~~~~Tweet Ideas to me at:http://twitter.com/smartereverydaySmarter Every Day on Facebookhttps://www.facebook.com/SmarterEveryDaySmarter Every Day on Patreonhttp://www.patreon.com/smartereverydaySmarter Every Day On Instagramhttp://www.instagram.com/smartereverydaySmarter Every Day SubReddithttp://www.reddit.com/r/smartereverydayAmbiance, audio and musicy things by: Gordon McGladdery https://www.ashellinthepit.com/http://ashellinthepit.bandcamp.com/If you feel like this video was worth your time and added value to your life, please SHARE THE VIDEO!If you REALLY liked it, feel free to pitch a few dollars Smarter Every Day by becoming a Patron.http://www.patreon.com/smartereverydayWarm Regards,Destin"
"rVXmKZCA6Gc","Jumping SUPERHERO CARS Across ENTIRE MAP In GTA 5.. (Mods)","2021-05-10T17:29:29Z","UCVAYy7_zddIx6USjXscV9Vg","Caylus","20","21.13.05","infinite lists|infinite|lists|infinite lists 2|fortnite|minecraft|gta 5|caylus|gta 5 caylus|more infinite|jelly|gta 5 mods|more infinite gta 5|jelly gta 5|Jumping SUPERHERO CARS Across ENTIRE MAP In GTA 5.. (Mods)|Jumping YOUTUBER CARS Across ENTIRE MAP In GTA 5.. (Mods)|jumping cars gta 5|jumping cars across map gta 5|caylus spiderman|spiderman gta 5|caylus stealing supercars","1824762","87838","2486","6171","https://i.ytimg.com/vi/rVXmKZCA6Gc/default.jpg","False","False","Today we jump all of the SUPERHERO CARS across the ENTIRE MAP In GTA  5!! 50,000 LIKES for MORE OF THESE VIDEOS!!👕NEW MERCH HERE👕  https://fanjoy.co/collections/infinite📷 𝐢𝐧𝐬𝐭𝐚𝐠𝐫𝐚𝐦📷 https://www.instagram.com/caylus/🐦𝐓𝐰𝐢𝐭𝐭𝐞𝐫🐦  https://twitter.com/CaylusqJoin my 𝐄𝐗𝐂𝐋𝐔𝐒𝐈𝐕𝐄 𝐒𝐄𝐂𝐑𝐄𝐓 𝐂𝐋𝐔𝐁: https://www.youtube.com/channel/UCVAYy7_zddIx6USjXscV9Vg/joinSubscribe to my 𝗼𝘁𝗵𝗲𝗿 𝗰𝗵𝗮𝗻𝗻𝗲𝗹: @Infinite"
"tKOpa4NyOBQ","ASTON VILLA vs MANCHESTER UNITED With Mark GOLDBRIDGE LIVE","2021-05-09T15:24:12Z","UCMmVPVb0BwSIOWVeDwlPocQ","The United Stand","24","21.13.05","Manchester United|Man United|Man Utd|Manchester United TV|The United Stand|United Stand|Manchester United News|MUFC|Man Utd News|United|Manchester United Transfer News|Man Utd Transfer News|Transfer|Solskjaer|Solskjaer news|MU live streaming|mu live|Man Utd live stream|live|vs Manchester United|Mark Goldbridge|Aston Villa|Aston Villa Manchester United|Aston Villa vs Man Utd|Aston Villa vs Manchester United","472797","9143","265","196","https://i.ytimg.com/vi/tKOpa4NyOBQ/default.jpg","False","False","Aston Villa vs Manchester United  watchalong with Mark Goldbridge live. Join in the match chat on our Man Utd live stream as they take on Aston Villa in the Premier League. PLAYER RATINGS https://www.theunitedstand.com/articles/match-ratings/fan-player-ratings-aston-villa-vs-manchester-united-premier-leagueLIVE GOLDBRIDGE REACTION United Stand Exclusive T Shirt collection https://united-stand.myshopify.com/🚨VISIT OUR WEBSITE 🚨For all the latest United news and TUS content:https://www.theunitedstand.com⏲️The United Stand Content TIMELINE is the best way to find all our latest content quickly! https://www.theunitedstand.com/timeline📰 LATEST WRITTEN NEWS https://www.theunitedstand.com/articles/latest-news📸 FOLLOW OUR INSTAGRAMhttps://www.instagram.com/theunitedstandtv/✅ The United Stand MEMBERSHIP https://buff.ly/2I2Of9R📧Contact The United Stand = soccerboxtv@gmail.com📧WRITER SUBMISSIONS = unitedstandwebsite@gmail.comAddressing: Jamie or NoraSee the FULL United Stand Kit Range CLICK HERE https://buff.ly/2Krpw1zEXCLUSIVE NEW PODCAST ITUNES https://buff.ly/2ZUhv84Spotify https://buff.ly/34dwEo6Google Podcast https://buff.ly/2ZHlNDnCastBox https://buff.ly/2UuiU3RRadio Public https://buff.ly/34jWkzAThe United Stand is Manchester United's biggest independent fan channel. Made for Manchester United fans by Manchester United fans, the United Stand provides you with the latest Manchester United transfer news, highlights, goal reviews and much more. So if MUFC means the world to you, get involved and subscribe to The United Stand http://bit.ly/1CmczHm#ManchesterUnited #MUFC #Goldbridge"
"dvz_nEsVLhg","Meghan Markle talks about baby girl in Vax Live speech | Today Show Australia","2021-05-10T01:31:04Z","UC5G0-uMcGFhNts84d24BZqw","TODAY","25","21.13.05","Aussie comedian|Jimmy Rees|TODAY|Today show australia|today australia|australia news|karl|karl today|karl stefanovic|ally today|karl and ally|australian morning show|australian today show|australian breakfast tv|breakfast tv australia|morning news australia|ally langdon|karl funny|today show funny|meghan markle|megan markle|meghan markel|prince harry|meghan and harry|megan and harry|royals|royal news|royals news|vaxlive|vax live","163693","962","1427","0","https://i.ytimg.com/vi/dvz_nEsVLhg/default.jpg","True","False","Meghan Markle and Prince Harry appeared at Vax Live, a concert to promote the equitable distribution of the COVID-19 vaccine. Subscribe 👉 https://bit.ly/2n4QLnx Get more TODAY at: https://bit.ly/2mRzePjn Join the TODAY team as they bring you the latest in news, current affairs, sports, politics, entertainment, fashion, health and lifestyle. Like TODAY on Facebook: http://facebook.com/IWakeUpWithTODAY Follow TODAY on Twitter: http://twitter.com/thetodayshow Follow TODAY on Instagram: https://www.instagram.com/thetodayshow #TodayShowAustralia #KarlStefanovic #AllisonLangdon"
"5UtNl3sUD0o","I Took Tommy & Tubbo Golfing...","2021-05-08T19:21:42Z","UCVhZyGllAVd-Wl6kNufV0uA","JackManifoldTV","20","21.13.05","Jack manifold|tommyinnit|minecraft|mine craft|dream|dream minecraft|funny|1000% funnier|minecraft funny|funniest minecraft video|minecraft manhunt|minecraft speedrunner vs hunter|minecraft speedrunner|minecraft speedrun|minecraft challenge|challenge|minecraft but|vlog|in real life|tubbo|golf|mini-golf|I Took Tommy & Tubbo Golfing...","2469712","283738","1300","9801","https://i.ytimg.com/vi/5UtNl3sUD0o/default.jpg","False","False","I took TommyInnit & Tubbo to Mini-Golf, in real life. It was very awesome!!Come watch Jack Manifold on the big screen (aka Twitch) - https://www.twitch.tv/JackManifoldTVEdited by:  @Wheatskins @TommyInnit @Tubbo Follow my Twitter - @JackManifoldTVFollow my Instagram - @JackManifoldTVNot Minecraft, But Water Rises or Minecraft, But Lava Rises, or any other but challenge like that. This is not even a speed run / speed runner of Minecraft against a killer / assassin or me and my good friends playing the NEW FUNNIEST MINECRAFT MOD EVER!!! POG CHAMP!!!Today I took TommyInnit (creator of the Minecraft But and also You Laugh You Lose challenge) & Tubbo (creator of wholesome) to a Mini-Golf course, in real life! It was so funny and we had lots of laughs and fun and pog. This is a vlog like other vloggers but I am the best vlogger. We had funny moments and even talked about the Dream SMP and our War VS Dream in Minecraft. It was so fun and Pog Champ"
