video_id,title,publishedAt,channelId,channelTitle,categoryId,trending_date,tags,view_count,likes,dislikes,comment_count,thumbnail_link,comments_disabled,ratings_disabled,description
"j0XKBFgTQQw","Fivio Foreign - Self Made (Official Video)","2021-04-16T15:00:19Z","UCm7gu9KfQ6oAg0Z1halgEnA","Fivio Foreign","22","21.18.04","Fivio Foreign|Self Made|NYC Drill Music|Brooklyn Drill|Drill Music|Wetty|Big Drip|New York Rap|Fivio Foreign Self Made|Fivio Foreign New Song","810531","55860","652","4487","https://i.ytimg.com/vi/j0XKBFgTQQw/default.jpg","False","False","Official video for Self Made by Fivio Foreign.He's Back!Will be available every shortly!Follow Fivio ForeignFacebook - https://www.facebook.com/FivioForeignOfficialInstagram - https://www.instagram.com/fivioforeign_8fs/TikTok - https://tiktok.com/@fivioforeignTwitter - https://twitter.com/fivioforeignhttps://fivioforeign.com/#FivioForeign #SelfMade"
"3nNarfW4Qww","AJ Tracey - Little More Love","2021-04-15T18:00:14Z","UCPOW9rO7SqJBfikRKEvbI3Q","AJ Tracey","10","21.18.04","[none]","693134","33802","285","1621","https://i.ytimg.com/vi/3nNarfW4Qww/default.jpg","False","False","FLU GAME THE ALBUM OUT NOWCDs/vinyl/merch: http://store.ajtracey.co.ukStream: http://ajtracey.ffm.to/flugameDirected by KC Locke & AJ TraceyMusic produced by YOZ BEATZ, RyFy & Mark RaggioSaxophone performance by VennaFollow AJ:http://instagram.com/ajtracey​http://twitter.com/ajtracey​http://facebook.com/ajtrcyProducer: Lewis NicholsonProduction Company: Swords & EaglesExec Producer/Directors Rep: Marisa GarnerProduction Manager: Ella Taylor-PalfreyDOP: Jordan BuckArt Director: Jenny O’SullivanEditor: Jamil Shaukat-Casting Director: Jenny O’Sullivan1st AD: Luke Goodrich2nd AD: Oliver Waters3rd AD: Dennis NorteyPA: Toby BarberPA: Darren SintesRunner: Jonathan PérezSteadicam: Sebastien Joly1st AC: Mike LinforthLoader: Tanmoye KhanCamera Trainee: Rebecca RichardsCamera Truck: Andrew CochraneGrip: Jess SaundersGrip: Bobby BrownGaffer: Josh HuntSpark: Jack SkipperSpark: Harry CohnSpark: Seanie ClarkCrane Tech: Harry ElvinSound Operator: Charlie Hurst-AJ Stylist: Aga DziedzicCast Stylist: Charlotte BurtonStyling Assistant: Cara PeeneyHMUA: Hannah SorchaHMUA Assistant: Francesca IngramHMUA Assistant: Phoebe Taylor-Art Assistant: Ed KellyArt Assistant: Daisy HarveyArt Assistant: Jamil Shaukat-Edit House: Swords & EaglesColour House: The Mill LondonColour Producer: Charlie MorrisColourist: Alex GregorySound Design: Ambit soundSound Designer: Laurie Shenoda-Security: C&S SecurityCOVID Supervisor: Ken LockeCOVID Tester: Karl Omar-Camera: PanavisionFilm Stock & Processing: KodakLighting: Drop CityCatering: Honest Foods#AJTracey #FluGame"
"ML_4URXK1xE","Young Stoner Life, Young Thug & Gunna - Solid (feat. Drake) [Official Audio]","2021-04-16T04:07:15Z","UCuwdplPbuTFZj_64d03tSBA","Young Thug","10","21.18.04","ysl records|thug|gunna|Ysl records|Young Thug|YSL|young stoner life records|young stoner life|slime language 2|solid|Solid|young thug slime language 2|slime language 2 young thug gunna drake|sl2|sl2 solid young thug gunna drake|slime language 2 solid|solid thug gunna drake|gunna thug drake solid|solid young thug gunna drake|young thug gunna drake|drake|Drake|drake young thug gunna|drake young thug gunna solid|drake solid|thug solid drake|drake solid thug","2039518","89998","863","4786","https://i.ytimg.com/vi/ML_4URXK1xE/default.jpg","False","False","Young Stoner Life Records Presents the official audio for Young Thug & Gunna's Solid featuring Drake from the album 'Slime Language 2' - Out Now!Stream 'Slime Language 2' on all platforms: https://youngstonerlife.ffm.to/slimelanguage2Check out SLATT 🐍💚:https://www.youtube.com/playlist?list=PLx95ifvZCY6r8Z0s0-1D5s0xuNyVtYs88Call Us: +1 (404) 224-97023D Design by SaiyaFollow Young Thughttp://www.twitter.com/youngthug​http://instagram.com/thuggerthugger1​http://www.facebook.com/youngthugmusicFollow Gunnahttps://only1gunna.com​https://www.instagram.com/gunna​https://twitter.com/1GunnaGunna​https://www.facebook.com/gunnaofficial​https://soundcloud.com/gunnaFollow Drakehttps://www.instagram.com/champagnepapi​ https://www.facebook.com/Drake​ https://twitter.com/drake​ https://www.drakeofficial.com​Follow Young Stoner Lifehttps://www.instagram.com/youngstonerliferecordshttps://www.facebook.com/Youngstonerliferecordshttps://twitter.com/Youngstonerlifehttps://www.tiktok.com/@youngstonerliferecordshttps://soundcloud.com/youngstonerliferecords#YoungStonerLife #Solid #SlimeLanguage2 #SL2 #YoungThug #Gunna #Drake #SLATT #OfficialAudio℗ 2021 Young Stoner Life Records exclusively distributed by 300 Entertainment"
"wgNiGj1nGYE","Version 1.5 Special Program｜Genshin Impact","2021-04-16T16:00:16Z","UCiS882YPwZt1NfaM0gR0D9Q","Genshin Impact","20","21.18.04","Amber|amber vtuber|genshi|genshi game|genshi impact|genshi video|genshin|genshin game|genshin impact|genshin impact 2020|genshin impact game|genshin impact good|genshin impact graphics|genshin impact introduction|genshin impact manga|genshin impact wiki|geshin|geshin game|Teyvat|yuanshen game|miHoYo China|miHoYo Japan|adventure story|open world game|anime style|MMORPG|anime games|mobile game|MMO PlayStation|yt:cc=on","2213814","172031","832","13886","https://i.ytimg.com/vi/wgNiGj1nGYE/default.jpg","False","False","Dear Travelers,Today Paimon brings you great news! The Special Program for Genshin Impact version 1.5 will be officially released on April 16 at 11:00 AM (UTC-5!)During the special program, you will discover all the juicy details of version 1.5. In addition to that, you can get redemption codes and other incredible gifts that we prepared especially for you. Do not miss out!Download FREE: https://genshin.mihoyo.com/en#GenshinImpact #miHoYo↓ Follow us for the latest news ↓Official Website: https://genshin.mihoyo.com/enOfficial Community: https://www.hoyolab.com/genshin/Facebook: https://www.facebook.com/GenshinImpact/Twitter: https://twitter.com/GenshinImpactInstagram: https://www.instagram.com/genshinimpact/Reddit: https://www.reddit.com/r/Genshin_Impact/"
"_KRb_qV9P4g","Smoother animation ≠ Better animation [4K 60FPS]","2021-04-16T16:00:30Z","UCj74rJ9Lgl3WTngq675wxKg","Noodle","24","21.18.04","interpolation|60fps|240fps|120fps|180fps|animation|anime|epic|hfr|boost","1002235","111325","2255","11041","https://i.ytimg.com/vi/_KRb_qV9P4g/default.jpg","False","False","get you the best deals while shoppin' online ▸ https://www.joinhoney.com/noodleHoney is FREE and finds coupons with the click of a button. Thanks Honey for sponsoring!HUGE thanks to Doggybag, Dangrips, Hyojin, and Villa for help with the animation.https://twitter.com/itsdoggybaghttps://twitter.com/dangripshttps://twitter.com/squizxyhttps://twitter.com/hi_blndThanks to Shina for the Appeal painting alsohttps://twitter.com/FujiTheAppleThis was entirely edited, and was supposed to be exported, in 48fps, not 50. Funny thing is, Premiere simply doesn't allow custom frame rates in its export window, despite supporting it as a sequence setting. I could have exported the Premiere  file into After Effects and added the sequence to the render cue, but I couldn't because AE threw me an error every time I tried. That, combined with the legitimately unbelievable amount of bugs and errors and crashes left me feeling so exhausted and numb that I ultimately decided it was worth sacrificing one 25th of a second's worth of timing here and there. If you catch any editing errors, that'd be why. Oh well!!Don't buy Adobe products.I'm on Patreon and Twitter also;https://www.patreon.com/LegitNoodlehttps://twitter.com/LegitimatNoodleChapters:00:00 - Intro1:27 - Laying the Groundwork4:32 - Ad break5:55 - Timing and Easing9:52 - Smear Frames But Worse™11:11 - Wrong Tool for the Wrong Job13:58 - OutroAnimation used (in order of appearance):Tom and JerryPixel Art (various)Cat walk (https://www.reddit.com/r/animation/comments/b0nkqs/cat_walk_cycle_done_for_college/)Cowboy BebopMulanPersona 4300FPS Bowser in cat suitSpirit (Roughs by James Baxter)Devilman CrybabyA Cat in ParisWire by WorthikidsSpiderverseDBZ FighterzParaNormanSpongebobDaffodil 3 by SmallbuOverwatchMoonlight Fox by SmallbuJoJo Part 5XCOM 2Cafouillage by Tom LawPokeAwesome Planet PanicTMNT 'Don VS Ralph'Klaus (Lineart by James Baxter)El DoradoNaruto1Samurai Jack Season 5Dead LeavesKeep Your Hands off EizoukenMeet Arnold (Cacani Demo)'Float' by PixarMusic used (in order of appearance):Les Cafes De Paris - Joe E LeeApple Kid's Theme - EarthboundLet the Game Begin! - SiIvaGunnerNoisy Notebook D - SnipperclipsStage Clear - Wii Play MotionGood Evening Bossa - RiverwornBuy Something, Will Ya!? - EarthboundStamp Mode - SnipperclipsApotos (Night) - Sonic UnleashedQuilty Court - Kirby's Extra Epic YarnJust One More Night With You - Thiago5PM - Animal Crossing New LeafTrophy Gallery - Super Smash Bros. BrawlAll the Patrons who helped fund this video:Goldencub2014PoGrimbeanieCurtis GerstnerFerdinand RemenecBest Boy KevinDayanara SergesRobert MurrayJawser78ANTHONY DUARTEMayoLouden DoneykoriioIain BrownJames  QueenMichael IncavoOctavianMr. MonocleAck mackAnxiousJoseph YoungJelisaveta MilivojevicJayCombatWombatCas HarperduskPackWaifuAndrew NietoLauren KlingeleConnor Travis-HunterLiamGary SpinradGibsoncookGiovanni LupoEmil HarmsenZyroableeSentientTurtleJamichael FolsonSupermanJ1411Dutch223Juan MeaveMarketttMark D DavisParkerMagnus Bjerke VikJoelEthanTy ShetlerNindotaWillis ScothornShaggy_OneErikTorbarikMatthew LynKyle Julian Van EppsSam CotterBig DoofyYami ShaggyNickFlowersLuke SpicerJesús FloresAAAAAAAADavid VelezMashProTatoDan ZynskiSaltTeaGeoff PorterChili CompletionistFruitSnackBanditAmeer FlippinSparkle_PlantAmielJason CummiskeyWilson BesticRobertVenohawkMarkChristina MorleyDevin StrayhornKendrick SotoShin GuardianDoggybagAdult_CoolDrew DeVaultSpidey-TronYihéng JiangAlex WilliamsTITO woodsAnthony Chrétien-ContrerasClontBolexleAllen RyersonChris BotkinAPGreg BaloneyCojo490QuiltyPleasuresChotskiesMatthew RothmannAndrew KisakAefreTheMusicalDocEndo MillsDebloboMatt, flamin hot braindead.Andrew RossCale EQuiet269RocknerradNehklesTooBadJye FrancisDinah KroneMonkey218ThrinmonJosepheousButtsmcgeeHyaDokiA TreeComrade of HomotopiaKenneth SabianBenTnflatei0nLuke ShepherdDaniel DorfmanDevon WinrickZackACarrJonathanShorpDanny DeVoid of LifeDanny Wolf-Hero The Triggered Aussie-JoystickDrummerquillDenebKusinwolfAlexander GuerreraCharles KuzmechRachel HanRamseyChristopher StollJer456Allison EasleyKing Of HatsHikiko KirkPlantbatMax LevintonKloudHeckYeckJesse BartelsRedtimecat96610Jean MachineBenedikt MüllerKeybladestrike1LawrenceTrevor harringtonReferenceMakerLuLYeahCortSorry OfficerKaltagElysium ErvininkuEuroPascal#60FPSAnimation #Interpolation #Sponsored"
"tJ50RSkypRs","LIVE FOOTBALL | Aston Villa U23  v Leeds United U23 | Premier League 2","2021-04-16T20:29:16Z","UCyQcJHDN4uYfPa1DHzKVSnw","Leeds United Official","17","21.18.04","Leeds United|LUFC|Live|U23|football","83283","1159","29","44","https://i.ytimg.com/vi/tJ50RSkypRs/default.jpg","False","False","LIVE coverage as Leeds United U23s aim to win the Premier League 2 Division 2  title as they face Aston Villa. KICK-OFF is at 7pm. #LUFC #LeedsUnited #FootballIf you thought this video was 🔥 don't forget to subscribe and hit the like 👍 button! Also if you want to get a notification every time we post hit the bell 🛎 button in the top right corner. MOT. ALAW. ⚽️Get exclusive Leeds United video content first - download the Official App: http://bit.ly/LUTVappIf you want to keep up with everything Leeds, go check out our other pages https://www.facebook.com/LeedsUnited/https://twitter.com/LUFChttps://www.instagram.com/leedsunited/?hl=enhttps://www.leedsunited.com"
"QXMyPe0hm60","Three Space Station Crew Members Return Home Aboard Soyuz Spacecraft","2021-04-17T05:46:52Z","UCLA_DiR1FfKNvjuUpBHmylQ","NASA","28","21.18.04","[none]","656592","17161","297","0","https://i.ytimg.com/vi/QXMyPe0hm60/default.jpg","True","False","Tune in live at 11:30 p.m. EDT, Fri., April 16 as three space travelers return home from the International Space Station. NASA Astronaut Kate Rubins and cosmonauts Sergey Ryzhikov and Sergey Kud-Sverchkov of the Russian space agency Roscosmos, aboard their Soyuz spacecraft, will make a parachute-assisted landing at 12:56 a.m., Sat., April 17, on the steppes of Kazakhstan, southeast of the remote town of Dzhezkazgan.During her six month mission, Kate Rubins spent hundreds of hours working on space station experiments, talking with the researchers behind the studies, and serving as an ambassador for science in downlinks with the National Science Foundation, National Institutes of Health, Centers for Disease Control, and others. She built on experiments conducted during her first mission in 2016, working on new heart research and DNA sequencing.Read more about Rubins' scientific journey: go.nasa.gov/3a8LReH"
"wW8FnNghyvI","1000 People Build 10 Countries!","2021-04-15T19:07:15Z","UCIPPMRA040LQr5QPyJEbmXA","MrBeast Gaming","20","21.18.04","[none]","12116268","605834","7256","33770","https://i.ytimg.com/vi/wW8FnNghyvI/default.jpg","False","False","Whichever team builds the best country gets $30,000! BUT only one person on the team wins all of the money, so watch this whole video to see which team wins and who gets the money!SUBSCRIBE OR YOU'LL HAVE BAD LUCKNew Merch - https://shopmrbeast.comJoin our discord server for your chance to compete in future Minecraft challenges!https://discord.gg/kCQKvZD----------------------------------------------------------------follow all of these or i will kick you• Facebook - https://www.facebook.com/MrBeast6000/• Twitter - https://twitter.com/MrBeast•  Instagram - https://www.instagram.com/mrbeast--------------------------------------------------------------------"
"sZl_sP4SrZ8","Minecraft, But Every Mob Is Lucky...","2021-04-15T23:00:25Z","UCEuN0IauvXNTn6KhP9AVJVw","xNestorio","20","21.18.04","Every Mob Is Lucky|Minecraft|Minecraft But|MC But|minecraft craft|minecraft challenge|xnestorio|nestorio|minecraft but mod|beating minecraft but|beating minecraft|minecraft survival|minecraft|mine craft|manhunt|minecraft but challenge|mc but|minecraft but|lucky blocks|lucky block|lucky mobs|minecraft but lucky blocks|lucky block mod|lucky block minecraft|minecraft lucky block|lucky block challenge|lucky|lucky blocks minecraft","1537628","58544","1434","1954","https://i.ytimg.com/vi/sZl_sP4SrZ8/default.jpg","False","False","Minecraft, But Every Mob Is Lucky...👍 40,000 Likes? (I'm still doing pushups for last vid)👉  Thumbnail Inspo:  @Wisp 👔 Buy my Cloak: https://store.lunarclient.com/category/xnestorio🎬 2nd Channel:   @Nestor  🎮Dev: https://twitter.com/LeonTG_❗ Get your own QUALITY minecraft server: https://www.bisecthosting.com/xnestorio   ↑ Use code “xNestorio” for 25% off ↑ [SPONSORED]💬My Socials! - Instagram: https://www.instagram.com/xnestorio2/​ - Twitter: https://twitter.com/xNestorio​ - Twitch: https://www.twitch.tv/xNestorio​ - Discord: discord.gg/xnestorio💻 Edited by: https://twitter.com/POSITIVEANGIE#MinecraftBut​ #MinecraftChallenge​ #Minecraft​"
"0-KgM_Nuj_w","how to create 5SOS's youngblood","2021-04-16T16:31:32Z","UCoNRSwYHJdy-yV1b82ZdHfQ","SethEverman","24","21.18.04","seth|everman|setheverman|piano|eyebrows|eye|brows|bald|5sos|5 seconds of summer|luke hemmings|michael clifford|calum hood|asthon irwin|cover|remake|parody|house hold|objects|sandwich","774128","119721","231","4999","https://i.ytimg.com/vi/0-KgM_Nuj_w/default.jpg","False","False","my friend michael clifford from 5sos messaged me about their song youngblood's 3rd anniversary and asked if i wanted to do something with them. we came up with this.Thank you so much for watching!my social media:TWITTER: http://www.twitter.com/sethevermanINSTAGRAM: http://www.instagram.com/sethevermanFACEBOOK: http://www.facebook.com/sethevermanYOUTUBE: http://www.youtube.com/setheverman"
"qrYilpW68Zs","Minecraft, But There Are Custom Enchants...","2021-04-15T02:13:33Z","UC9tXyGZiEft9J4ZiI8dHb3Q","TapL","20","21.18.04","Minecraft|Competitive Minecraft|Minecraft PvP|TapL|UHC|Ultra Hardcore|Crazy UHC|Insane Minecraft|Minecraft Minigames|Tapple|Tapple Events|Tapple Minecraft|Tapple Server|Tapple UHC|TapL UHC|TapL Challenge|Challenge|Tapple Challenge|Minecraft But|Minecraft UHC But|MinecraftBut|Minecraft Challenge|Minecraft Challenges|Minecraft Hardcore|Beating Minecraft|Minecraft OP|OP Minecraft|Blessed Minecraft|Cursed Minecraft|Minecraft Scenario|Minecraft UHC","5250210","152414","3326","8909","https://i.ytimg.com/vi/qrYilpW68Zs/default.jpg","False","False","This is Minecraft, But There Are Custom Enchants... this was awesome :DThanks for Watching! :D I appreciate all feedback and support :L!Edited By @ExtremeBlitz TWITCH STREAMS → https://twitch.tv/taplTAPL MERCH → https://tapl.storeTikTok → https://www.tiktok.com/@taplharvTwitter → https://twitter.com/TapLHarV Discord Server → https://discord.gg/TapLInstagram → https://instagram.com/taplharvSnapchat → itstapl#MinecraftBut #MinecraftChallenge #Minecraft #TapL"
"ydbdBIKdxVE","Fortnite HIT IT Emote Showcase!","2021-04-17T00:09:43Z","UCdcWUiKI9fe7TY0dxxssOkQ","ITF","20","21.18.04","itf|italkfortnite|i talk fortnite|fortnite item shop review","107519","2713","79","450","https://i.ytimg.com/vi/ydbdBIKdxVE/default.jpg","False","False","Code ITF to support me! #ad"
"7lkrFlvtBWE","FA YOUTH CUP LIVE | WEST HAM UNITED v ARSENAL","2021-04-16T20:16:58Z","UCCNOsmurvpEit9paBOzWtUg","West Ham United FC","17","21.18.04","[none]","59083","848","20","13","https://i.ytimg.com/vi/7lkrFlvtBWE/default.jpg","False","False","Watch our young Hammers in action as they take on Arsenal for a place in the quarter-finals of the FA Youth Cup!► Subscribe: http://bit.ly/1QALxTA► Follow us on Twitter: http://www.Twitter.com/westham► Like us on Facebook: http://www.facebook.com/westham► Follow us on Instagram: https://instagram.com/westham► Add us on Snapchat: westham► Visit our official website: http://www.whufc.com► Buy tickets: http://www.whufc.com/Tickets/Match-Tickets"
"6CFYIOF89hc","Chris Brown - Go Crazy (Remix) (Official Video) ft. Young Thug, Future, Lil Durk, Mulatto","2021-04-15T16:00:14Z","UCm1dsgJNnhaLkY3uAdqN4mA","ChrisBrownVEVO","10","21.18.04","Go crazy remix official video|young thug future|up young thug|future|relationship young thug|sex lies|mulatto|lil durk|big latto|queen of da souf|hendrixx|relationship|lifestyle|lifestyle young thug|drake|chris brown|look at me now|look at me now chris brown|Chris Brown YouTube|Chris Brown VEVO|Chris Brown TV|Chris Brown and Justin Bieber|Chris Brown and Ink|Indigo Chris Brown|Indigo Album|Chris Brown Don’t Check On Me","3178240","173857","3779","12049","https://i.ytimg.com/vi/6CFYIOF89hc/default.jpg","False","False","Chris Brown x Young Thug - Go Crazy (Remix) feat. Future, Lil Durk, & Mulatto out now! https://smarturl.it/xGoCrazyRemix  Watch and Listen to “Go Crazy” by Chris Brown x Young Thug - https://smarturl.it/xCBGC Check out the latest from Chris Brown:  https://smarturl.it/GxProvide  Listen to more by Chris: https://ChrisBrown.lnk.to/listenYD Subscribe to the official Chris Brown YouTube Channel: https://ChrisBrown.lnk.to/subscribeYD  Watch more videos by Chris here: https://ChrisBrown.lnk.to/listenYD/youtube Director by DAPS  Executive Produced by Andrew Listermann Production Company: RIVETING ENTFollow Chris Brown: Instagram: https://www.instagram.com/chrisbrownofficial/ Facebook: https://www.facebook.com/chrisbrown Twitter: https://twitter.com/chrisbrown  Follow Young Thug: Instagram: https://www.instagram.com/thuggerthugger1/  Facebook: https://www.facebook.com/youngthugmusic Twitter: https://twitter.com/youngthug  Follow Mulatto: Instagram: https://www.instagram.com/mulatto/ Facebook: https://www.facebook.com/mulatto Twitter: https://twitter.com/mulatto  Follow Future: Instagram: https://www.instagram.com/future/ Facebook: https://www.facebook.com/FutureOfficial    Twitter: https://twitter.com/1future  Follow Lil Durk: Instagram: https://www.instagram.com/lildurk/ Facebook: https://www.facebook.com/lildurk Twitter: https://twitter.com/lildurk   #ChrisBrown #BigLatto #HipHop #OfficialVideo #Future #LilDurkhttp://vevo.ly/8UTWwG"
"_TyM8Kvv5RI","Coming Soon... | Next Time | EastEnders","2021-04-16T14:00:10Z","UCSNvArbpIG1Kp6EGpx-QeZg","EastEnders","24","21.18.04","bbc|eastenders|eastenders bbc|coming soon|new|still to come|new eastenders|trailer|eastenders trailer|eastenders new|whitney eastenders|whitney and kush|kush eastenders|gray|gray atkins eastenders|drama|dramatic|intense|walford|albert square|danger|martin fowler|cliffhanger","75089","689","13","154","https://i.ytimg.com/vi/_TyM8Kvv5RI/default.jpg","False","False","Can Whitney and Kush escape before it's too late? Coming soon... Subscribe to EastEnders for more: http://bit.ly/EastEndersYTComing to BBC One. Catch up now on BBC iPlayer.WATCH MORE:Promos & Cliffhangers: http://bit.ly/EastEndersCliffhangersBehind The Scenes: http://bit.ly/EastendersBTSEastEnders Stars: http://bit.ly/EastEndersStarsMORE ABOUT EASTENDERS:Welcome to the Official #EastEnders Channel! Following the residents of Albert Square as their lives intertwine with drama and tears. First broadcasted in 1985, EastEnders continues to be one of the UK's most watched programmes as well as the nation's favourite soap. EastEnders has won multiple BAFTA and National Television Awards for Most Popular Serial Drama.Want to share your views with the team? Join our fan panel: https://tinyurl.com/YouTube-EE-PanelIf you or someone you know has been affected by any of the storylines on the show please visit this link for more information: https://bbc.in/2J6FisWThis is a commercial channel from BBC Studios. Service information and feedback: https://www.bbcstudios.com/contact/contact-us/"
"4Z6P_2Gyv98","Version 1.5 Beneath the Light of Jadeite Trailer | Genshin Impact","2021-04-16T12:50:29Z","UCiS882YPwZt1NfaM0gR0D9Q","Genshin Impact","20","21.18.04","Amber|amber vtuber|genshi|genshi game|genshi impact|genshi video|genshin|genshin game|genshin impact|genshin impact 2020|genshin impact game|genshin impact good|genshin impact graphics|genshin impact introduction|genshin impact manga|genshin impact wiki|geshin|geshin game|Teyvat|yuanshen game|miHoYo China|miHoYo Japan|adventure story|open world game|anime style|MMORPG|anime games|mobile game|MMO PlayStation|yt:cc=on","1837758","176222","517","17654","https://i.ytimg.com/vi/4Z6P_2Gyv98/default.jpg","False","False","Moonlight falls on the branches as a dragon's roar rises from deep beneath the roots. A drop of sun may trickle in, but a heart of stone is not easily moved.Deals are sealed with scarlet flames and ice-cold vengeance floods forth in waves. But far from the fight is a realm of serenity, where a gentle melody forever plays.Download FREE: https://genshin.mihoyo.com/en#GenshinImpact #miHoYo↓ Follow us for the latest news ↓Official Website: https://genshin.mihoyo.com/enOfficial Community: https://www.hoyolab.com/genshin/Facebook: https://www.facebook.com/GenshinImpact/Twitter: https://twitter.com/GenshinImpactInstagram: https://www.instagram.com/genshinimpact/Reddit: https://www.reddit.com/r/Genshin_Impact/"
