video_id,title,publishedAt,channelId,channelTitle,categoryId,trending_date,tags,view_count,likes,dislikes,comment_count,thumbnail_link,comments_disabled,ratings_disabled,description
"_Dqr-HILvik","fortnite ein bisschen wie früher...","2021-03-10T10:30:31Z","UCQ_hHJ0uTbzFLHrk1XHGXtw","Standart Skill","20","21.11.03","Fortnite|Fortnite Deutsch|FOrtnite Deutsch PS4|Fortnite PC|FOrtnite neues Update|FOrtnite Season 5|FOrtnite tipps|FOrtnite tricks|FOrtnite neue infos|FOrtnite standart skill|FOrtnite neue infos ps4|FOrtnite lustig|FOrtnite season|#EPICPartner","252969","22889","829","1478","https://i.ytimg.com/vi/_Dqr-HILvik/default.jpg","False","False","GAMERS ONLY Performance Drink*: https://bit.ly/GOxStandartSkill_YT(10% Rabatt mit 'standartskill')Mein Buch bestellen: https://amzn.to/2EzrMBx (Amazon) https://bit.ly/ststkthaliavv1 (Thalia)Mein Gaming-Tisch von ULTRADESK: https://bit.ly/31uZf5L *Mein Headset: https://roc.gg/TbSkill *Mein Merch: https://bit.ly/32ng7ff *Meine Maus und Tastatur: https://roc.gg/RocSkill *Mein 2. Kanal: https://bit.ly/2lNTykqInstagram: https://www.instagram.com/standartskill/Kanalmitglied werden: https://www.youtube.com/channel/UCQ_hHJ0uTbzFLHrk1XHGXtw/joinProduction Music courtesy of Epidemic Sound: http://www.epidemicsound.com* alle Links die mit einem Stern markiert sind, sind Affiliate Links /werbung"
"Wx4Vpm1KzSY","Prince Harry, Meghan reveal struggles behind royal rift in Oprah interview","2021-03-08T05:18:20Z","UCKjU3KzdbJE1EFcHVqXC3_g","CBC News: The National","25","21.11.03","harry and meghan|prince harry and meghan markle|harry and meghan oprah interview|harry and meghan interview|duke and duchess of sussex|royal family|meghan markle royal family|the queen|harry and meghan the queen|meghan markle|meghan markle interview|oprah interview|megxit|meghan harry interview reaction|Briar Stewart|Sarika Bose|The National|CBC News","5849393","43542","13699","0","https://i.ytimg.com/vi/Wx4Vpm1KzSY/default.jpg","True","False","Prince Harry and Meghan Markle's revealing interview with Oprah Winfrey outlined their motivations for breaking from the Royal Family, including Meghan’s suicidal thoughts. #HarryandMeghan#Oprah#BuckinghamPalaceWatch The National live on YouTube Sunday-Friday at 9 p.m. ETSubscribe to The National: https://www.youtube.com/user/CBCTheNational?sub_confirmation=1Connect with The National online:Facebook | https://www.facebook.com/thenationalTwitter | https://twitter.com/CBCTheNationalInstagram | https://www.instagram.com/cbcthenationalMore from CBC News | https://www.cbc.ca/newsThe National is CBC's flagship nightly news program, featuring the day's top stories with in-depth and original journalism, with hosts Adrienne Arsenault and Andrew Chang in Toronto, Ian Hanomansing in Vancouver and the CBC's chief political correspondent, Rosemary Barton in Ottawa."
"HgYVuXaihNs","my brother Van","2021-03-09T22:30:43Z","UCtinbF-Q-fVthA0qrFQTgXQ","CaseyNeistat","22","21.11.03","van neistat|neistat brothers|new york city|los angeles|filmmaking|casey van|casey brother|subscribe to van","738803","50357","699","4242","https://i.ytimg.com/vi/HgYVuXaihNs/default.jpg","False","False","DO IT!!!!  --  https://www.youtube.com/user/VanNeistatmusic by; So Wyliehttps://instagram.com/so.wylie/https://twitter.com/sowyliehttps://spoti.fi/32Hb2lz"
"EKBwafvShZU","Nach 7 Jahren Elumen in einem Monat blond | Haare frittieren Teil zwei :D","2021-03-09T17:30:06Z","UCXVgn2sRLuxSE1x5z9N5XjA","einfach inka","22","21.11.03","elumen blondieren|haare blondieren|rr@all blondieren|haare färben|einfach inka|inka lindberg","90421","1690","29","217","https://i.ytimg.com/vi/EKBwafvShZU/default.jpg","False","False","*Zur Pflege benutze ich aktuell Olaplex 0: https://amzn.to/3l06MVv*In Kombi mit Olaplex 3: https://amzn.to/3qpF5Xq*Zum Schutz der Haare schlafe ich wieder mit Seidenhaube: https://amzn.to/2OAapW7*Meine alte Haarfarbe: https://amzn.to/2PBJyUS*Meine Kamera: https://amzn.to/2OGUHsw*Jetzt mein Buch Mit dir falle ich vorbestellen! https://linktr.ee/einfachinka*= Affiliate Links▸▸ Instagram: https://www.instagram.com/einfachinka/Mein Friseur: https://www.instagram.com/bjoernstylist/Teil 1 Haare frittieren: https://youtu.be/jrMxdbuVzNceinfach inka dreht sich rund um Liebe, Dating und Sex Education. Zwischendurch gibt's dann noch einen Schwung aus meinem Leben und was mich so beschäftigt. Ich freue mich, wenn ihr mich auf meiner Reise begleitet!Wenn dir meine Videos gefallen, kannst du mich gerne mit einem kostenlosen Abo und/ oder einem Daumen hoch unterstützen. Vielen Dank für deine Treue! Deine Inka!"
"qUUloBe5vEo","Longest Dunk Wins","2021-03-08T23:00:02Z","UCRijo3ddMTht_IHyNSNXpNQ","Dude Perfect","17","21.11.03","dude perfect|dude perfect stereotypes|dude perfect water bottle flip|bottle flip|water bottle flip|dude perfect bottle flip|dude perfect basketball|dp|dude perfect world record|edition|nerf|trick shots|trick shot|family|ping pong|bowling|clean|family friendly|bubble wrap|soccer|football|spinner|spinners|fidget spinners|dude|slippery|stairs|giant|catapult|trebuchet|launch|dunk|longest|farthest|wins|battle|coby|cory|finale|michael|jordan|mj|slip|fall|funny|trending","10835563","458703","6216","15669","https://i.ytimg.com/vi/qUUloBe5vEo/default.jpg","False","False","Slippery Stairs and a GIANT catapult!?! Today's battle gets WILD! Thanks to Basketball Arena for sponsoring this video! Download for free here: https://app.adjust.com/cgsyo1z_rec0ncy *Basketball Arena is now hosting a $50k Win Streak Event that ends on March 12th!*► Thanks for subscribing! - http://bit.ly/SubDudePerfect​► Subscribe to our DP Plus Channel: http://bit.ly/DPplusSubscribe► Check out the Bloopers & Behind the Scenes: https://youtu.be/kg16owoO1DkMusic by CaiNo: Best Ever► Click HERE to listen on Spotify - https://open.spotify.com/track/4QXntpOCUp2kCwHamfOEEp?si=qVjg6_tvQZeYEwblZ82q9w► Click HERE to listen on Apple Music -  https://music.apple.com/us/album/best-ever/1499620335?i=1499620338#BattleNEXT LEVEL STUFF -------------------------------------------🎒 NEW Merch - http://bit.ly/DPStore🎮 Play our FREE iPhone game! - http://smarturl.it/DudePerfect2📱 Text us - (469) 205-7005🔔 Hit the bell next to Subscribe so you don't miss a video!👨🏻‍💻 Watch our newest vids! - http://bit.ly/NewDPVids📕 Read our Book - Go Big - http://amzn.to/OYdZ2sFollow our Instagrams so we can be best friends -------------------------------------------🏆 http://Instagram.com/DudePerfect🧔🏻 http://Instagram.com/TylerNToney👱🏻‍♂️ http://Instagram.com/Cody_Jones_🙋🏻‍♂️ http://Instagram.com/CobyCotton👨‍🦰 http://Instagram.com/GarrettHilbert⛹🏻‍♂️ http://Instagram.com/CoryCotton-------------------------------------------“Best Ever”Performed by CaiNoCourtesy of Black Toast Music, LLCWritten by Marcus Cohen and Scott Horton©2020 Black Toast Music (BMI) / Burnt Toast Music (ASCAP)-------------------------------------------Bonus points if you're still reading this! Comment: How well would you do on the slippery stairs!?Click here to learn more about Dude Perfect:http://bit.ly/AboutDudePerfectAs always...Go Big and God Bless!- Your friends at Dude PerfectBusiness or Media, please contact us at: Dude@DudePerfect.com------------5 Best Friends and a Panda.If you like Sports + Comedy, come join the Dude Perfect team!Best known for trick shots, stereotypes, battles, bottle flips, ping pong shots and all-around competitive fun, Dude Perfect prides ourselves in making the absolute best family-friendly entertainment possible! Welcome to the crew! Pound it 👊🏻 Noggin 🙇🏻‍♂️ - Dude Perfect"
"7NdojD6XIeU","Mission impossible?! 💥😰 | Berlin - Tag & Nacht #2397","2021-03-09T19:15:00Z","UC6hmAN2FLzB8-Fzzu7evKgA","Berlin - Tag & Nacht","24","21.11.03","berlin - tag & nacht|berlin tag und nacht|btn|rtl2|preview|ganze folge|tv now|Berlin|berlin tag und nacht preview|berlin tag und nacht ganze folge|berlin tag und nacht vorschau|tägliche highlights|rtlzwei|hausboot|RTL|berlin tag und nacht folge von heute|berlin tag und nacht folge von gestern|toni|connor","434442","15904","362","1012","https://i.ytimg.com/vi/7NdojD6XIeU/default.jpg","False","False","Aaron trommelt die Aktivisten zusammen und erzählt ihnen, dass der Bau trotz ihrer Aktion fortgesetzt wird. Er will unbedingt ein Zeichen setzen und weiht die Gruppe mit seinem Plan ein. Connor hingegen wird das Gefühl nicht los, dass Aaron einen Schritt zu weit gehen will. Was hat er nur vor?Die gescriptete Reality-Soap „Berlin - Tag & Nacht“ zeigt die coolste WG Berlins, mit Themen wie  Freundschaft, Liebe,  Eifersucht, Affären, Glück, Freude und Leiden. Wie im echten Leben eben!Alte wie neue WG-Bewohner, u. a. Ole, Joe, Peggy, Krätze, Schmidti, Eule, Basti Paula, Piet, Milla, Leon und viele weitere, zeigen dir ihr Leben in Berlin, der bunten Metropole Deutschlands. Sie nehmen dich mit in ihre Wohngemeinschaften, auf ihre Arbeitsplätze, in den Club Matrix, den Friseursalon „Schnitte“ sowie die Bar LA 14. Auch ein Tattoostudio und das Fitnessstudio Body Burn gehören zu den unterschiedlichen und wechselnden Handlungsorten der Serie. Die Großstadt-Soap „Berlin – Tag & Nacht“ ist nicht zuletzt deshalb so beliebt, weil sie die Bewohner der WGs im Ringen mit alltäglichen Problemen zeigt: Affäre und Eifersucht, Erfolgsdruck im Beruf sowie viele zwischenmenschliche Konflikte. Berlin - Tag & Nacht läuft Montag bis Freitag um 19:05 Uhr bei RTLZWEI. Abonniert unseren Kanal: https://www.youtube.com/channel/UC6hmAN2FLzB8-Fzzu7evKgA?sub_confirmation=1Instagram: http://www.instagram.com/berlintagundnachtZur Webseite: http://www.rtl2.de/sendung/berlin-tag-und-nachtKomplette Folgen auf TVNOW: http://www.tvnow.de/rtl2/berlin-tag-nachtZur BTN-App: https://www.rtl2.de/sendungen/berlin-tag-nacht/appFacebook: http://www.facebook.com/berlintagundnachtTwitter: http://twitter.com/rtl2#btn #berlintagundnacht #rtlzwei"
"LdI3WuiC6Pw","Astartes Goes Official! Big News On Warhammer Community Website!","2021-03-10T15:02:14Z","UCFMtdiQILuTZr22sKUeAOOA","Astartes","1","21.11.03","[none]","278158","64641","1007","9088","https://i.ytimg.com/vi/LdI3WuiC6Pw/default.jpg","False","False","EXCITING NEWS FOR THE ASTARTES PROJECTwww.warhammer-community.comI'm happy to announce today that I'll be working with Games Workshop to create officialWarhammer stories and continue the Astartes Project!It's been a dream come true to contribute to the incredible WH40k setting and nowto do so with help from the Warhammer Animations team is super exciting.A massive thank you to you all for the incredible support and encouragement you've given mefrom the very beginning. When I started I never thought this project would take me to where it hasand I don't know if I would have made it without such amazing fans.Astartes has a new home over on the Warhammer Community website so head over there to watch the videosand check regularly for more news and updates, as work on this official Warhammer Animation continues...www.warhammer-community.com"
"zSllUi5yZIM","This week on RELEASED | ROSÉ (Official Trailer)","2021-03-09T18:00:11Z","UCOmHUn--16B90oW2L6FRR3A","BLACKPINK","10","21.11.03","New Music|RELEASED YouTube Originals|YouTube Originals|New Music Videos|RELEASED|Music|ROSÉ YouTube|ROSÉ YouTube Originals|ROSÉ RELEASED|ROSÉ|ROSÉ Blackpink|Blackpink|ROSÉ On the Ground|Kpop|Blackpink the show|Pretty Savage Blackpink|How You Like that Blackpink|Blackpink lyrics|BTS|Sour Candy Blackpink|How You like that lyrics|Blackpink Kpop|Blackpink songs|ROSÉ first single|Blackpink Released|Blackpink YouTube|Blackpink Selena Gomez","4292781","762359","5027","24982","https://i.ytimg.com/vi/zSllUi5yZIM/default.jpg","False","False","Join ROSÉ this week on RELEASED as she tests how well her friends know her, see what artists are on her playlist, and performs solos with various instruments. All this leading up to the world premiere of her new music video “On The Ground”! Can't miss Music moments. RELEASED, every Thursday, only on YouTube. #RELEASEDonYT #ROSÉ  #OnTheGround"
"CkwVz1TCJAc","Du fehlst uns.. In tiefer Trauer.","2021-03-07T19:03:32Z","UCmrX69T0Yi4VM9k4VuIYaLA","Du fehlst","22","21.11.03","Du fehlst|Opa|Tim Lehmann|Gewitter im Kopf|Musik","1252461","94894","2807","13825","https://i.ytimg.com/vi/CkwVz1TCJAc/default.jpg","False","False","Danke für alles."
"FPI84G5HpJ8","When your character never speaks - Silent Hero","2021-03-10T09:00:04Z","UCchBatdUMZoMfJ3rIzgV84g","Viva La Dirt League","20","21.11.03","NPC Man|PUBG Logic|pubg real life|pubg|pubg logic supercut|pubg movie|pubg parody|Viva La Dirt League|vldl|epic npc man|pubg mobile|pubg skits|viva la dirt league pubg|pubg funny|pubg live action|vldl pubg|gaming|online gaming|gamer|playtech|bored|game logic","655340","69191","355","5995","https://i.ytimg.com/vi/FPI84G5HpJ8/default.jpg","False","False","It's amazing the things your character can achieve by not ever saying a wordWATCH MORE SKITS HERE: http://bit.ly/VLDLvideosSUPPORT ON PATREON - http://bit.ly/VLDLpatreonDISCORD - http://bit.ly/VLDLdiscordFACEBOOK: http://bit.ly/VLDLfacebookTWITTER: http://bit.ly/VLDLtwitterINSTAGRAM: http://bit.ly/VLDLinstagram---------------------------------- TWITCH -------------------------------http://bit.ly/VLDLtwitch----------------------------------- MERCH--------------------------------Merchandise: http://bit.ly/VLDLmerchSongs: http://bit.ly/VLDLmusic------------------- MORE VIDEOS ------------------Epic NPC Man: http://bit.ly/NPCmanBored: http://bit.ly/VLDLboredPUBG Logic: http://bit.ly/PUBGlogicFPS Logic: http://bit.ly/FPSlogicSouls Logic: http://bit.ly/SoulslogicMusic Videos: http://bit.ly/VLDLmusicvidsWildcards: http://bit.ly/VLDLwildcard"
"gHMYwrC7oAo","Teenage Mutant Ninja Turtles: Shredder’s Revenge - Reveal trailer","2021-03-10T14:58:41Z","UCiRyNJKUiYdKsxXkt_jMZ-A","Dotemu","20","21.11.03","TMNT|Teenage Mutant Ninja Turtles|turtles in time|konami|SNES|arcade|retro|retrogaming|pixel art|pixel|BTM|beat em up|beat em all|shredder|leonardo|michelangelo|donatello|raphael|nickelodeon|pc|steam|consoles","862660","30649","357","3846","https://i.ytimg.com/vi/gHMYwrC7oAo/default.jpg","False","False","Wishlist now on Steam: https://store.steampowered.com/app/1361510/Teenage_Mutant_Ninja_Turtles_Shredders_Revenge/Join us on Discord: https://discord.gg/GYr8YfNnckTeenage Mutant Ninja Turtles: Shredder’s Revenge reunites Leonardo, Raphael, Michelangelo, and Donatello to kick shell in a beautifully realized pixel art world invoking the turtles’ classic 1987 design.With Bebop and Rocksteady amassing gizmos to support Krang and Shredder’s latest scheme, Teenage Mutant Ninja Turtles: Shredder’s Revenge finds the turtles battling through a breathless tour of iconic TMNT locations to thwart their nemeses’ most diabolical plan yet. Armed with shell-shocking new abilities built on a foundation of classic brawling mechanics, the gang are in for an exhilarating, Foot Clan-stomping romp leading them through the sewers and bustling boroughs of New York City all the way to Dimension X.Teenage Mutant Ninja Turtles: Shredder’s Revenge will be available on PC and consoles. Trailer directed by Gary Levesque and produced by Wizz (Quadgroup)Music:  Executive producer Mutant Ninja RecordsVocals: Mike PattonMusic: Jb HanakGuitar solo: Cedric HanakProduction: Olivier Dax & Jb Hanak©2021 Viacom International Inc. All Rights Reserved. Nickelodeon, Teenage Mutant Ninja Turtles and all related titles, logos and characters are trademarks of Viacom International Inc.©2021 Dotemu, All rights reserved. Game developed by Tribute Games.#TMNT #Nickelodeon #retrogaming"
"_P14e-rw7WE","Harry und Meghan - Der Talk zum Enthüllungsinterview","2021-03-08T12:07:36Z","UC4r8bOegpKu642BZJYZX6mA","BUNTE TV","24","21.11.03","#oprahwinfrey|meghan markle oprah interview|meghan markle|meghan and harry oprah interview","363725","827","1024","842","https://i.ytimg.com/vi/_P14e-rw7WE/default.jpg","False","False","Vor diesem Termin zittert die Royal Family: Prinz Harry und Herzogin Meghan packen im großen Enthüllungs-Interview mit Oprah Winfrey über das Königshaus aus. In unserem Royal Talk erfahrt ihr alle Hintergründe! Original-Auszüge aus dem brisanten Interview findet ihr unter: https://www.bunte.de/royals/britisches-koenigshaus/ ***************************************► Jetzt kostenlos abonnieren: https://bit.ly/2xrdyzb► Mehr zu Bunte: https://www.bunte.de► Facebook: @BUNTE.de► Snapchat: @BUNTE.de► Instagram: @bunte_magazin***************************************#bunte #buntetvBUNTE.de – Das Beste aus der Welt der Stars & Royals! Bleibe immer up-to-date mit den frischesten News: Finde heraus, wie die Stars & Promis leben, lass dich von den märchenhaften Bildern der Royals verzaubern, entdecke neue Fashion- & Beauty-Trends und die besten Tipps für Gesundheit, Familie und Beziehung. Impressum: Burda Studios Publishing GmbH c/o Bunte Entertainment Verlag GmbH Arabellastraße 23, 81925 MünchenArtikel-Text"
"f3dnhz2FXoY","20 Deutschrap-Albumcover für deine ✨Inspiration✨","2021-03-09T20:18:06Z","UCD7gFHptsdB2B9qd9-1C4_A","BossXplosive","10","21.11.03","[none]","54322","8272","56","399","https://i.ytimg.com/vi/f3dnhz2FXoY/default.jpg","False","False","In diesem inspirierenden Video bekommst du 20 Albumcover, die dich für deine künstlerische Laufbahn nachhaltig prägen werden.🔶 Instagram: https://instagram.com/bossxplosive 🔵 Twitter: https://twitter.com/bossxplosiveMusik: Sims 1 Soundtrack"
"zsTxzSM0Yu0","ATEEZ Reacts to ATEEZ on the Internet (에이티즈) | Explain This | Esquire","2021-03-10T00:00:11Z","UCLPVHOw25Eu8CCKTxL5TgCA","Esquire","24","21.11.03","Esquire|ateez|ateez funny|ateez reacts|ateez reaction|ateez cute|ateez interview|esquire|explain this|에이티즈|ateez i’m the one|ateez mv|inception|answer|ateez reaction to seventeen|에이티즈 산|산|hongjoong|yunho|san|mingi|wooyoung|jongho|seonghwa|yeosang|ateez dance|ateez old|idol radio|fox|english|eng sub|engsub|ateez english|ateez eng sub|choreography|anze|argentina|duck|duck san|hello ateez|ateez vlog|atiny|jongho fruit|ateez spanish|ateez spoiler|crying","224476","43861","35","1298","https://i.ytimg.com/vi/zsTxzSM0Yu0/default.jpg","False","False","K-pop megastars Ateez (에이티즈) react to their own music videos, memes, and public appearances on the internet. Watch more of Esquire's 'Explain This' episodes HERE: https://www.youtube.com/watch?v=sFB8JVEMy0o&list=PLy47rmXHqePmwznWVMFt5WYC6vwJEysvZSUBSCRIBE to Esquire: http://bit.ly/SUBSCRIBEtoESQUIREESQUIRE SHOWS:Curated: https://www.youtube.com/watch?v=w6xBG5KJ_UA&list=PLy47rmXHqePnHgePYUN7qqfiipGQs1kDXIn or Out: https://www.youtube.com/watch?v=IMe4Qz5ZKik&list=PLy47rmXHqePlwiLPx59c8xtvvvVC3dOfdExplain This: https://www.youtube.com/watch?v=sFB8JVEMy0o&list=PLy47rmXHqePmwznWVMFt5WYC6vwJEysvZUnreleased: https://www.youtube.com/watch?v=vhlZEFMzzmA&list=PLy47rmXHqePkAJSxjhHW1oFq2-h4WLmk1Esquire on Facebook: https://www.facebook.com/EsquireEsquire on Twitter: http://twitter.com/esquireEsquire on Instagram: http://instagram.com/esquire"
"Y_LxHapTHw8","Sie ist Bodybuilderin | Shayan Garcia","2021-03-08T19:00:06Z","UCicR63tvfk9Yiwj4SjVnqBw","Shayan Garcia","23","21.11.03","shayan garcia|shayan|lachen|witzig|shirin david|sin dic|manuellsen|julien bam|dagi beee|paola|simon desue|strasseninterview|streetinterview|funny|memes|versuch nicht zu lache|deutschland|frankfurt|lustig|weinen|rapupdate|berlin|hamburg|wiesbaden","270721","17898","338","788","https://i.ytimg.com/vi/Y_LxHapTHw8/default.jpg","False","False","✘ Instagram: shayangarciahttps://www.instagram.com/shayangarcia✘ Facebook.: Shayan Garcia https://www.facebook.com/shayangarciaaKontakt: mgmt@shayan-garcia.deSchnitt: Shayan Garcia x Hemdem Media Kamera: Hemdem Media Color Grading: Hemdem MediaInstagram: hemdem.media"
"bP6ocWyWRTA","What Happened When Christian Cage and Kenny Omega Came Face to Face? | AEW Dynamite","2021-03-11T06:00:05Z","UCFN4JkGP_bVhAdBsoV9xftA","All Elite Wrestling","24","21.11.03","All Elite Wrestling|AEW|The Young Bucks|Cody Rhodes|Brandi Rhodes|Nick Jackson|Matt Jackson|Chris Jericho|Pro Wrestling|Kenny Omega|Being the Elite|Jon Moxley|Luchasaurus|Jungle Boy|Jack Perry|MOX|AEW DYNAMITE HIGHLIGHTS|#AEWDYNAMITE|AEW ON TNT|AEWonTNT|Jurassic Express|Jake Hager|Inner Circle|Join Dark Order|Rusev|Miro|AEW Dynamite|#AEW|DON CALLIS|Video Games|Music Video|Among Us|Sting|AEW Sting|WCW Sting|the icon sting|man called sting","395051","14040","337","1852","https://i.ytimg.com/vi/bP6ocWyWRTA/default.jpg","False","False","AEW Dynamite 3/10/21 LIVE!Subscribe now and never miss a new video: https://www.youtube.com/c/aew?sub_confirmation=1AEW Dynamite airs every Wednesday night 8e/7c on TNTAEW Dark: Elevation airs every Monday at 7e/6c - youtube.com/AEWAEW Dark airs every Tuesday night 7e/6c - youtube.com/AEWHow to watch Dynamite and Pay Per View events➡️  TNT - https://www.tntdrama.com/allelitewrestling➡️  Fire TV - https://www.fite.tv/channel/aew (For international fans only)➡️  B/R Live - https://www.fite.tv/channel/aew (Pay Per Views & Special Events only)Follow #AllEliteWrestling on all social media platforms➡️  https://www.Twitter.com/aew➡️  https://www.Twitter.com/AEWonTNT➡️  https://www.Facebook.com/allelitewrestling➡️  https://www.instagram.com/allelitewrestling➡️  https://www.instagram.com/AEWonTNT➡️  TikTok - AllEliteWrestling➡️  Snapchat - AllEliteWrestlingWelcome to the All Elite Wrestling YouTube channel! Here you can find the latest highlights from AEW Dynamite and the latest episodes of AEW DARK. A world-class roster of diverse male and female wrestlers give you a new wrestling experience for the first time in 20 years. Featuring Cody & Brandi Rhodes, The Young Bucks, Kenny Omega, Hangman Adam Page, Chris Jericho and Jon Moxley. Subscribe today so you don't miss the latest videos from All Elite Wrestling!This video is AEW intellectual property. It is intended for only the private use of our audience.  No part of this show may be reproduced, broadcast or exhibited in any form or by any means without the consent of AEW.  It is also prohibited for users to generate revenue from the broadcast or exhibition by the user of any AEW content (including media scrums or other editorial materials) without the consent of AEW."
"aj41hCYCN2Q","Spiel gedreht! Lewi auch vom BVB nicht zu stoppen: FC Bayern - Dortmund 4:2 | Bundesliga | DAZN","2021-03-07T23:00:00Z","UClBFnQJMlinWDCvfSXj60CA","DAZN Bundesliga","17","21.11.03","Bayern|FC Bayern München|FCB|Dortmund|Borussia Dortmund|BVB|Bayern Dortmund|Bayern vs Dortmund|Bayern - Dortmund|FC Bayern München vs Borussia Dortmund|FC Bayern München - Borussia Dortmund|Bayern Dortmund 4 2|Bayern vs Dortmund 4-2|Bayern - Dortmund 4:2|Bundesliga|Bundesliga Highlights|Bundesliga DAZN|DAZN Bundesliga|DAZN|Highlights Bundesliga|DAZN Highlights|DAZN Highlights Bundesliga|Bundesliga Highlights DAZN","1281455","43981","1321","3744","https://i.ytimg.com/vi/aj41hCYCN2Q/default.jpg","False","False","Im Top-Spiel des 24. Spieltags empfängt der FC Bayern den BVB. Die Gäste gehen durch einen frühen Doppelschlag Haalands mit 2:0 in Führung. Doch der Rekordmeister schafft es, noch vor der Pause auszugleichen. Im zweiten Durchgang gelingt den Dortmundern nur wenig nach vorne. So erhöhen die Bayern weiter den Druck und kommen kurz vor Schluss zu zwei weiteren Toren. Spieler des Abends war Robert Lewandowski, der drei Treffer erzielte, Leon Goretzka traf ebenfalls für den Tabellenführer.►Sichere dir deinen Gratismonat: http://bit.ly/DAZNerleben►Das Programm von DAZN: http://bit.ly/2uFkulD ►DAZN auch auf Facebook: https://bit.ly/2lUGipo+++ Die besten Fußball Highlights aus allen Wettbewerben auf YouTube +++►DAZN UEFA Champions League auf YouTube abonnieren: https://bit.ly/2WL75qD ►DAZN UEFA Europa League auf YouTube abonnieren: https://bit.ly/2DTc8yb ►DAZN Bundesliga auf YouTube abonnieren: https://bit.ly/2Daw8dS ►DAZN Länderspiele auf YouTube abonnieren: https://bit.ly/2XAYNSd►Goal auf YouTube abonnieren: https://bit.ly/2Bk4H0Y +++ Die besten Sport Highlights auf YouTube +++►DAZN Tennis auf YouTube abonnieren: https://bit.ly/2DblEuK ►DAZN Darts auf YouTube abonnieren: https://bit.ly/2ScVbqU   ►SPOX auf YouTube abonnieren: https://bit.ly/2MPaQqI Erlebe tausende Sportevents in HD-Qualität auf allen Geräten. Auf DAZN gibt's europäischen Top-Fußball mit UEFA Champions League, UEFA Europa League, Bundesliga, Copa America, La Liga, der Serie A und Ligue 1 sowie den besten US-Sport aus NFL, NBA, MLB und NHL. Dazu: Fight Sports, Darts, Tennis, Hockey und vieles mehr - wann und wo du willst.ERLEBE DEINEN SPORT LIVE UND AUF ABRUF. AUF ALLEN GERÄTEN.+++ Über DAZN +++DAZN ist ein Livesport-Streamingdienst, der es Fans erlaubt, Sport so zu erleben, wie sie es möchten. Egal ob live zu Hause, unterwegs, zeitversetzt oder im Rückblick, DAZN bietet über 8.000 Sportübertragungen pro Jahr und beinhaltet damit das umfangreichste Sportangebot, das es jemals bei einem einzelnen Anbieter gegeben hat.DAZN bietet einen Gratismonat, kostet danach 11,99 EUR monatlich und kann jederzeit monatlich gekündigt werden. Registriere dich direkt und sicher dir deinen Gratismonat: http://bit.ly/DAZNerlebenImpressum:http://media.dazn.com/en/impressum/"
