video_id,title,publishedAt,channelId,channelTitle,categoryId,trending_date,tags,view_count,likes,dislikes,comment_count,thumbnail_link,comments_disabled,ratings_disabled,description
"ksx62DJU2ho","UN warns of “full-scale war” as Israel-Palestinian violence intensifies - BBC News","2021-05-12T21:26:02Z","UC16niRr50-MSBwiO3YDb3RA","BBC News","25","21.13.05","bbc|bbc news|news","2852044","38942","3821","22958","https://i.ytimg.com/vi/ksx62DJU2ho/default.jpg","False","False","The United Nations is warning of the risk of full-scale war as the clashes between Israeli forces and Palestinians continue.Israel's Prime minister, Benjamin Netanyahu, warned Palestinian militants that this was just the beginning, threatening to strike with “blows they haven't dreamed of”.  The United States is sending a senior diplomat to the Middle East to urge Israelis and Palestinians to end the violence. At least 65 Palestinians including 15 children and six Israelis are reported to have been killed since the fighting began.In the past few days Palestinian militants have fired barrages of rockets  into Israel, many aimed at Tel Aviv. Israel has carried out a heavy bombardment of Gaza launching hundreds of air strikes. Tensions have been growing in Jerusalem, partly due to a long-running threat to evict Palestinians from their homes in occupied East Jerusalem in an area claimed by Jewish settlers. Sophie Raworth presents BBC News at Ten reporting by Tom Bateman in Jerusalem, Rushdi Abualouf in Gaza and Caroline Hawley.Please subscribe HERE http://bit.ly/1rbfUog#BBCNews"
"YlpN3S16ZAs","J. Cole Freestyles Over 93 Til Infinity & Mike Jones' Still Tippin - L.A. Leakers Freestyle #108","2021-05-12T18:00:13Z","UCBKIrKI8ezApiTVkEknu6xg","Power 106 Los Angeles","24","21.13.05","Hip Hop News|Music|Rap|Celebrity News|latest news|freestyle|LA Leakers|J Cole|Cole World|The off season|Dreamville|4 your eyes only|KOD|Forest Hills Drive|Born Sinner|Sideline Story|Souls of mischief|Still Tippin|93 til infinity|JID|Bas|Cozz|Earth Gang|Ari Lennox","3249378","288820","1247","22719","https://i.ytimg.com/vi/YlpN3S16ZAs/default.jpg","False","False","Almost 12 years in the making, North Carolina and the Los Angeles Leakers finally collide for Freestyle #108 featuring one of this generation's greatest hip-hop artists, @J. Cole.The Cole absence has been without a doubt felt in the culture but the perfect timing of his forthcoming 'The Off-Season' lp and the first-ever Leakers feature has further proved why Cole continues to be regarded as a GOAT and an emcee in control of his own lane. Justin Credible ad DJ Sourmilk took a trip to an exclusive North Carolina studio to tap in with the sought-out rapper and history was written.Effortlessly spitting complete top tier bars over not one, but two classic hip-hop tracks, Cole takes differing approaches over Souls Of Mischief's 93 'Til Infinity and Mike Jones' Still Tippin.#JCole #TheOffSeason Subscribe Now - http://bit.ly/17RrvxuPower 106 Website - http://bit.ly/THwnRX Listen Live - http://bit.ly/T0chlq"
"H93JD6RmxWA","I Cheated with a PROFESSIONAL Builder in a Building Competition...","2021-05-12T21:20:20Z","UCzMjRlKVO9XIqH_crIFpi6w","Skeppy","20","21.13.05","minecraft|mine craft|minecraft youtuber|pg|family friendly|skeppy|minecraft skeppy|no swearing|no cursing|minecraft trolling|minecraft troll|funny minecraft|minecraft mod|minecraft map|parkour|trolling|troll|roleplay|custom|challenge|glitch moments|skeppy face|try not to laugh|bedwars|skywars|hypixel|dream smp|professional builder|i cheated in a build battle|i cheated|badboyhalo|foolishg","1584453","98148","1706","5209","https://i.ytimg.com/vi/H93JD6RmxWA/default.jpg","False","False","Skeppy Trolls BadBoyHalo in a Building CompetitionToday BadBoyHalo and I are competing in another legendary Build Battle Challenge :D We have FIVE structures to build but what Bad doesn't know is I recruited a little bit of help this time hehe. I had to at least give him a little hope at first, so we may or may not have built a muffin with Nether Gold Ore LMAO but Foolish Gamers is a professional builder so I left it in his very capable hands. Plus I even helped at one point, it was kind of the collab of a lifetime and I even got to brush up on my French Architecture. This video was so funny and hilarious to make and I had so much fun as always so if you enjoyed this video hit it with a like and maybe I'll even teach Bad a lesson or two at building since I am so, so good at it now!Sub to @Foolish Gamers  and I guess @BadBoyHalo Follow My Twitter - @SkeppyFollow My Instagram - @SkeppyNot Minecraft, But Water Rises or Minecraft, But Lava Rises, or any other but challenge like that. This is a speed runner / survivalist in Minecraft against a killer / assassin / hitmen but it's BadBoyHalo being the silliest muffin we know"
"CLwXukmEaUw","They said do a split.. #Shorts","2021-05-12T19:57:21Z","UCWJTYHtwinZAoibFPGGnfzQ","Romina Gafur","24","21.13.05","[none]","2395715","59810","3278","383","https://i.ytimg.com/vi/CLwXukmEaUw/default.jpg","False","False",""
"NsKwMryKqRE","James May's Tesla Model S has failed!","2021-05-12T18:00:17Z","UChiwLDIBJrV5SxqdixMHmQA","DRIVETRIBE","2","21.13.05","jeremy clarkson|richard hammond|james may|cars|top gear|the grand tour","879698","51224","395","3143","https://i.ytimg.com/vi/NsKwMryKqRE/default.jpg","False","False","James May has had his Tesla Model S for a while, and until now there have been little-to-no issues with the big electric saloon car. But after taking time away from the bunker to film the next episode of The Grand Tour, a gremlin has crept into James' EV. Let him explain...We're giving away a Tesla Model 3 or £40k cash! Enter for a chance at winning: https://drivetribe.com/competitions/Dfx-Xg2aST6xFEXVqwcsxQUK 18+, purchase necessary, competition ends 23:59 BST 14/06/21.Click this link for full terms: https://bit.ly/TeslaTermsHall of the Mountain King Kevin MacLeod (incompetech.com)Licensed under Creative Commons: By Attribution 3.0 Licensehttp://creativecommons.org/licenses/by/3.0/"
"Hk4eMIswunQ","Elton John and Years & Years – It’s a Sin (BRIT Awards 2021 Performance)","2021-05-11T21:49:45Z","UCcd0tBtip8YzdTCUw3OVv_Q","Elton John","10","21.13.05","elton john|elton|john|elton john live|brit|brit awards|elton john brit|elton john brit awards|its a sin|it's a sin|elton john its a sin|its a sin elton john|elton john olly|elton john olly alexander|its a sin olly alexander|olly alexander its a sin|olly alexander live|elton john and olly|elton john and olly alexander|olly and elton john|olly alexander and elton john|years & years|years and years|its a sin years and years|its a sin years & years","943631","32027","1358","2399","https://i.ytimg.com/vi/Hk4eMIswunQ/default.jpg","False","False","Elton John and Years & Years BRIT Awards 2021 performance of the Pet Shop Boys classic single ‘It’s a Sin’.  A very special new version of the song has been released in support of Elton John AIDS Foundation.  LISTEN TO It’s a sin HERE: https://EltonJohnYearsandYears.lnk.to/ItsasinIDDONATE TO EJAF HERE: https://donate.eltonjohnaidsfoundation.org/uk/ #EltonJohnAIDSFoundation #YearsandYears #Brits2021 100% of Universal Music Operations Limited’s net proceeds (inc. all artists and producer shares) from the sale of this single shall be donated to the Elton John AIDS Foundation, a registered charity number 1017336 in England & Wales.Watch more Elton videos: https://EltonJohn.lnk.to/WatchMoreSubscribe to Elton channel: http://bit.ly/EltonYTSubscribe About Elton John: Welcome to the official Elton John channel. Subscribe today for a vast video collection of music videos, iconic live performances, exclusive interviews, behind the scenes content and playlists to explore Elton’s musical legacy in-depth. Follow Elton John on...Facebook: https://eltonjohn.lnk.to/facebookYT Twitter: https://eltonjohn.lnk.to/twitterYT Instagram: https://eltonjohn.lnk.to/instaYT Official Website: https://EltonJohn.lnk.to/WebsiteOfficial Join the Rocket Club newsletter: https://EltonJohn.lnk.to/RocketClub   Elton John and Years & Years – It’s a Sin (BRIT Awards 2021 Performance)https://www.youtube.com/user/EltonJohn"
"xVjzNyydTfM","Freeze Corleone 667 feat. Central Cee - Polémique","2021-05-13T01:53:11Z","UCaW8nWryLD0TunnyUYqp5dQ","Mangemort Squad","10","21.13.05","[none]","678618","93200","350","4116","https://i.ytimg.com/vi/xVjzNyydTfM/default.jpg","False","False","Freeze corleone feat. Central Cee - Polémique (Prod By Flem)Bientôt disponible sur toutes les plateformes Réalisation : Kunography Enregistrement : Studio 5 étoiles Mix : Studio KGBMaster: Tha Trickaz"
"mjQbTcqJnII","Omegle RATES My Magic Tricks!! - #Shorts","2021-05-13T00:11:27Z","UC3IjgjgWtpLTCrR0shGXKVg","SeanDoesMagic","24","21.13.05","Rate the magic trick|Omegle magic|Omegle magic tricks|magic trick tutorial|mind reading|money magic|money magic trick|how to read minds|reading minds|psychology|mind magic|mind reading magic|tutorial|magic tutorial|magic trick revealed|magic biggest secrets|seandoesmagic|seandoesmagic tiktok|tiktok magic|tiktok magic tutorial|tiktok how to|tiktok","615536","101927","765","707","https://i.ytimg.com/vi/mjQbTcqJnII/default.jpg","False","False","We go on Omegle and they RATE my magic tricks!MY NEW PODCAST:Spotify: https://spoti.fi/3oFj3iF​Apple: https://apple.co/3pwcWhOBusiness:seandoesmagic@collab.inc-Socials-Instagram: https://www.instagram.com/seandoesmagic/TikTok: https://www.tiktok.com/@seandoesmagicFacebook: https://www.facebook.com/seandoesmagic/Snapchat: @sean.magicThank you so much for watching friends!"
"5Dp5_XqCZe4","SHE IS HERE! Her Name Is...","2021-05-12T20:11:00Z","UCtPqR1gumPRaMLhSTlLn5nw","The Herberts","22","21.13.05","[none]","1687249","96005","974","8627","https://i.ytimg.com/vi/5Dp5_XqCZe4/default.jpg","False","False","We are so excited to share her name with the world!Subscribe to Abbie’s Channel: https://www.youtube.com/channel/UCQ0F......Subscribe to Josh’s Channel: https://www.youtube.com/user/joshherb......Follow us and be part of the Herbert Fam!—————————————————————————————————————Abbie’s Instagram: https://www.instagram.com/abbieherber......Josh’s Instagram: https://www.instagram.com/joshherbert......Abbie’s Twitter: https://twitter.com/AbbieHerbert_​​​​...Josh’s Twitter: https://twitter.com/joshherbert?lang=...Abbie’s TikTok: https://www.tiktok.com/@abbieherbert_......Josh’s TikTok: https://www.tiktok.com/@josh_herbert?......Spotify: https://open.spotify.com/artist/61ePJ......ABOUT US: Hi guys! We are Josh & Abbie Herbert! You might know us from our viral TikTok videos. We are known as that TikTok couple that is always doing the latest trends. We are so excited to have you on this journey with us. BUISNESS INQUIRIES: Abbie@talentxent.comJosh.Herbert@talentxent.comOUR MOST POPULAR VIDEOS Finding out I'm PREGNANT! https://youtu.be/BNhKSjfRzQU​​​​​​​​​...Asking My Husband **JUICY** Questions Girls Are Afraid Too Afraid To Ask: https://youtu.be/IJ-GYDZs8eY​​​​​​​​​...Asking My Wife *JUICY* Questions Guys Are Too Afraid To Ask https://youtu.be/bX5MqPGZO6s​​​​​​​​​...#TheHerberts​​​​​​​​​​​​​​​ #PregnancyUpdate​​​​​ #Pregnant​​​​"
"SBA-lqC58D8","#shorts","2021-05-08T19:42:44Z","UCGLDtG2tl0uG8P0eNstbLUA","Tool_Tips","22","21.13.05","[none]","14347637","141204","13568","1168","https://i.ytimg.com/vi/SBA-lqC58D8/default.jpg","False","False",""
"HRdyfERwQZs","Mining 1,000,000 Blocks Alone!","2021-05-12T18:18:01Z","UCIPPMRA040LQr5QPyJEbmXA","MrBeast Gaming","20","21.13.05","[none]","8730605","531886","4995","29849","https://i.ytimg.com/vi/HRdyfERwQZs/default.jpg","False","False","I hosted a challenge that lasted for days! The last person to mine one million diamonds wins $30,000!SUBSCRIBE OR YOU'LL HAVE BAD LUCKNew Merch - https://shopmrbeast.comJoin our discord server for your chance to compete in future Minecraft challenges!https://discord.gg/kCQKvZD----------------------------------------------------------------follow all of these or i will kick you• Facebook - https://www.facebook.com/MrBeast6000/• Twitter - https://twitter.com/MrBeast•  Instagram - https://www.instagram.com/mrbeast--------------------------------------------------------------------"
"n8OxyKNBsuQ","Dua Lipa - Future Nostalgia Medley (Live at the BRIT Awards 2021)","2021-05-11T21:23:58Z","UC-J-KZfRV8c13fOCkhXdLiQ","Dua Lipa","10","21.13.05","Future Nostalgia|BRITs2021|Dua Lipa","4223983","259884","3454","10215","https://i.ytimg.com/vi/n8OxyKNBsuQ/default.jpg","False","False","#DuaLipa #FutureNostalgia #BRITAwards2021Subscribe to the Dua Lipa channel for all the best and latest official music videos, behind the scenes and live performances. https://www.youtube.com/channel/UC-J-KZfRV8c13fOCkhXdLiQ?sub_confirmation=1See more official videos from Dua Lipa here:https://www.youtube.com/playlist?list=PLNrotoZZ8BaoXT_LJuwEyESQlctWNDCwDGet the album Future Nostalgia : https://dualipa.co/futurenostalgiaListen to more from the album 'Future Nostalgia' :https://www.youtube.com/playlist?list=PLNrotoZZ8BaouNABcO_A9Xkn_Nkz0PT11Follow Dua Lipa:Instagram:  https://dualipa.co/instagramFacebook: http://dualipa.co/facebookTikTok: https://www.tiktok.com/@dualipaofficialTwitter: http://dualipa.co/twitterYouTube: https://dualipa.co/youtubeAbout Dua Lipa:Born and raised in London to Kosovar-Albanian parents Dua Lipa signed to Warner Records in 2015, releasing her self titled debut in 2017 which featured the hit singles, 'Be The One', 'IDGAF', 'Hotter Than Hell' & her first UK #1 hit 'New Rules'. Critical success soon followed as Dua Lipa picked up Brit Awards for 'Best Female Solo Artist' and 'Best British Breakthrough Act' as well as Grammy Awards for 'Best New Artist' and 'Best Dance Recording' for the track 'Electricity' in collaboration with Silk City.Her second internationally acclaimed studio album 'Future Nostalgia' was released in 2020 and included the hit singles 'Don't Start Now, 'Break My Heart', 'Hallucinate' and 'Levitating', with the remix album 'Club Future Nostalgia' following shortly after featuring guest appearances from 'Blackpink', 'Missy Elliott', 'Madonna' and 'Gwen Stefani'."
"peSabCX_rB0","Money Bowling with friends! #shorts","2021-05-12T21:39:09Z","UC9SUulKzcBvThtnUopgrYyg","AnthonySenpai","20","21.13.05","[none]","4157540","145795","6151","696","https://i.ytimg.com/vi/peSabCX_rB0/default.jpg","False","False",""
"y7AJnDRuemA","Olivia Rodrigo - drivers license (Live From The BRIT Awards 2021)","2021-05-12T01:27:15Z","UCxE5jEls-T0QtlTHT8lI1lw","OliviaRodrigoVEVO","10","21.13.05","Olivia|Rodrigo Olivia Rodrigo Drivers|license Driver’s|license Drivers’|license Drivers|license|live Drivers|performance Drivers|lyrics Olivia|rodrigo|performance Olivia|live Olivia|lyrics Brit Brits The|Brit|Awards Performance Performance|video Nini High|school|musical All|Want Music Live|Music Live|performance","3358423","309322","3196","11835","https://i.ytimg.com/vi/y7AJnDRuemA/default.jpg","False","False","Olivia Rodrigo Performs 'drivers license' Live at the BRIT Awards 2021Shop SOUR: https://smarturl.it/oliviarodrigoshopPreorder SOUR: https://oliviarodrigo.lnk.to/preorderFollow Olivia:Instagram: https://www.instagram.com/oliviarodrigo/?hl=enFacebook: https://www.facebook.com/OliviaRodrigoOfficial/Twitter: https://twitter.com/Olivia_Rodrigo?ref_src=twsrc%5Egoogle%7Ctwcamp%5Eserp%7Ctwgr%5EauthorTiktok :https://www.tiktok.com/@livbedumb?lang=enLyrics:I got my driver's license last weekJust like we always talked about'Cause you were so excited for meTo finally drive up to your houseBut today I drove through the suburbsCrying 'cause you weren't aroundAnd you're probably with that blonde girlWho always made me doubtShe's so much older than meShe's everything I'm insecure aboutYeah, today I drove through the suburbs'Cause how could I ever love someone else?And I know we weren't perfect but I've never felt this way for no oneAnd I just can't imagine how you could be so okay now that I'm goneGuess you didn't mean what you wrote in that song about me'Cause you said forever, now I drive alone past your streetAnd all my friends are tiredOf hearing how much I miss you, butI kinda feel sorry for them'Cause they'll never know you the way that I do, yeahToday I drove through the suburbsAnd pictured I was driving home to youAnd I know we weren't perfectBut I've never felt this way for no one, ohAnd I just can't imagine how you could be so okay, now that I'm goneI guess you didn't mean what you wrote in that song about me'Cause you said forever, now I drive alone past your streetRed lights, stop signsI still see your face in the white cars, front yardsCan't drive past the places we used to go to'Cause I still fuckin' love you, babe (ooh, ooh, ooh, ooh)Sidewalks we crossedI still hear your voice in the traffic, we're laughingOver all the noiseGod, I'm so blue, know we're throughBut I still fuckin' love you, babe (ooh, ooh, ooh, ooh)I know we weren't perfect but I've never felt this way for no oneAnd I just can't imagine how you could be so okay, now that I'm gone'Cause you didn't mean what you wrote in that song about me'Cause you said forever, now I drive alone past your streetYeah, you said forever, now I drive alone past your streethttp://vevo.ly/jMrD19"
"wMdeticwUtc","Reacting to Brit Awards 2021 Outfits (the worst yet)","2021-05-12T16:00:25Z","UCr1QUp3n5spxDmhjn0X-iyQ","lookingforlewys","26","21.13.05","brits 2020|brit awards|brits 2021|reacting to brit awards|brit awards outfits|best and worst dressed|brits best and worst dressed|award show|dua lipa|harry styles|taylor swift|little mix|olivia rodrigo|roast|roasting|coachella outfits","77400","5142","161","161","https://i.ytimg.com/vi/wMdeticwUtc/default.jpg","False","False","ONCE AGAIN back with another best and worst dressed reacting to brit awards 2021 outfits! including dua lipa, taylor swift, harry styles, olivia rodrigo, little mix and a whole lot more xxSHOP MY MERCH! https://lookingforlewys.shop​​​​​​Business Enquiries: natalie.amos@gleamfutures.comMY NEW PODCAST!!Spotify: https://open.spotify.com/show/0ecFofM......Apple Podcasts: https://podcasts.apple.com/gb/podcast......LINKS:Main Channel: http://youtube.com/lookingforlewys​​​​​​Second Channel: http://youtube.com/lifewithlewys​​​​​​Instagram: @lookingforlewysTwitter: @lookingforlewysFacebook: http://www.facebook.com/lookingforlew​​..."
"-wMvOV4-UGk","How Many Votes Did A YouTuber Get For London Mayor?","2021-05-12T16:30:15Z","UCb31gOY6OD8ES0zP8M0GhAw","Max Fosh","23","21.13.05","Max fosh|london mayor|youtuber for mayor|niko|ndl|niko omilana|laurence fox|posh|london|boris johnson|sadiq khan","306147","32451","350","1911","https://i.ytimg.com/vi/-wMvOV4-UGk/default.jpg","False","False","thank you all for helping to take London to the Max. All in all, I'm pretty chuffed with the 27,000-ish votes that I got. You can have a look at the final breakdown here:https://www.londonelects.org.uk/im-voter/election-results/results-2021-elections/mayoral-resultsSocials: IG: https://www.instagram.com/max.fosh/Twitter: https://twitter.com/max_fosh"
"8JWqlDxEQps","Trial By Fire Trailer - Total War: WARHAMMER III","2021-05-12T16:00:04Z","UCugJq15BiB-c1NDYPHiznWQ","Total War","20","21.13.05","Total War|WARHAMMER III|WH3|Total War: WARHAMMER III|Trial By Fire|Khorne|Kislev|Trailer","692332","41920","426","3557","https://i.ytimg.com/vi/8JWqlDxEQps/default.jpg","False","False","One side forged by the anvil of ice. The other rising from the raging fires. Blood for the Blood God! Skulls for the Skull Throne! Kislev.Pre-purchase from CA (Steam & Epic): https://store.warhammer3.totalwar.comPre-purchase on Steam: https://store.steampowered.com/app/1142710Pre-purchase on Epic: https://www.epicgames.com/store/product/total-war-warhammer-3Any questions? Check out the FAQ: https://www.totalwar.com/blog/total-war-warhammer-iii-faq━━━━━━━━━━━━━━━━━#TotalWar #WARHAMMERIII #WHIII #WH3 #Khorne #Kislev #TrialByFireFollow us on social media:➤ https://discord.gg/totalwar➤ http://www.facebook.com/totalwar➤ http://www.twitter.com/totalwar➤ http://www.instagram.com/totalwarofficial➤ http://www.twitch.tv/totalwarVideo type: In-engine CinematicWhat does this mean? Full info here: ➤ http://wiki.totalwar.com/w/About_our_trailers"
"1xeHLuoup0s","WARNING: GRAPHIC CONTENT - Israel masses troops along Gaza border as conflict escalates","2021-05-13T08:21:35Z","UChqUTb7kYRX8-EiaN3XFrSQ","Reuters","25","21.13.05","reuters|business|finance|news|politics|top news|headlines|breaking news|news today|bloomberg|thomson reuters|trump|biden|reuters youtube|Joe Biden|Israel|troops|Tel Aviv|Jerusalem|Gaza border|Hamas|Palestinian President Mahmoud Abbas|Mahmoud Abbas speech","693078","8086","714","0","https://i.ytimg.com/vi/1xeHLuoup0s/default.jpg","True","False","Israel was preparing ground troops along the Gaza border and Hamas launched rocket barrages at southern Israel as the fiercest hostilities in years dragged on with no end in sight.  #AlAqsaMosque #Netanyahu #JerusalemDay #Israel #Palestinian #News #ReutersSubscribe: http://smarturl.it/reuterssubscribeReuters brings you the latest business, finance and breaking news video from around the globe.  Our reputation for accuracy and impartiality is unparalleled.Get the latest news on: http://reuters.com/Follow Reuters on Facebook: https://www.facebook.com/ReutersFollow Reuters on Twitter: https://twitter.com/ReutersFollow Reuters on Instagram: https://www.instagram.com/reuters/?hl=en"
"4w--7V1P3yE","Rag'n'Bone Man & P!nk - Anywhere Away from Here (ft. The Lewisham & Greenwich NHS Choir) BRITs 2021","2021-05-11T23:12:53Z","UCuRwdG_2dvII6VaJPppXqAw","Rag'n'Bone Man","10","21.13.05","hell yeah|life in her yet|leaf dog|lay my body down|Rag’n’Bone Man|Rag’n’Bone Man live|Rag’n’Bone Man lyrics|rag and bone man|rag n bone man|disfigured|wolves|rag n bone man all you ever wanted|rag n bone man and pink|rag n bone man anywhere away from here|anywhere away from here|anywhere away from here pink|anywhere away from here pink rag n bone man|anywhere away from here live|anywhere away from here lyrics|anywhere away from here brits","247621","7185","87","422","https://i.ytimg.com/vi/4w--7V1P3yE/default.jpg","False","False","Anywhere Away from Here (ft. The Lewisham & Greenwich NHS Choir)💙 Stream/download: https://smarturl.it/AAFHxNHS #BRITs2021------------------New Album 'Life By Misadventure': https://rnbm.lnk.to/LifeByMisadventureAY​------------------Follow Rag'n'Bone Man:http://ragnboneman.comhttp://facebook.com/ragnbonemanhttp://twitter.com/ragnbonemanhttp://instagram.com/ragnboneman------------------Lyrics:Wild and runningFearlessness is burning bright We knew nothing ‘cause out of sight is out of mind Before we ever learnt the fear of being bold Before we ever were afraid of the unknown When the lights go up I don’t think I told you I don’t think I told you That I feel out of place Pull me underground Don’t know if you notice Sometimes I close my eyes and dream of somewhere else Anywhere away from here Anywhere away from here Anywhere away from here We sold our souls and we lost control With more doubt than hope Glass half empty Discontented from growing old Through all the failed attempts at trying to belongI over think the obvious when I’m alone When the lights go up I don’t think I told youI don’t think I told you That I feel out of place Pull me underground Don’t know if you notice Sometimes I close my eyes and dream of somewhere else Anywhere away from here Anywhere away from here Anywhere away from here Oh, when I close my eyes Oh, when I close my eyes I wish I could disappear  When the lights go up I don’t think I told you Don’t know if I told you That I feel out of place Pull me underground Don’t know if you notice Sometimes I close my eyes and dream of somewhere else Anywhere away from here Anywhere away from here Anywhere away from here#RagNBoneMan #Pink #BRITs2021 #BRITs"
