video_id,title,publishedAt,channelId,channelTitle,categoryId,trending_date,tags,view_count,likes,dislikes,comment_count,thumbnail_link,comments_disabled,ratings_disabled,description
"hbO7SFJlw-E","ЧТО, ЕСЛИ ЗАПУСТИТЬ РАКЕТЫ В ТРУБЕ НАВСТРЕЧУ ДРУГ ДРУГУ?","2021-04-17T12:09:38Z","UCkUFua6WbuKcmMDrcxRpH7A","Дюшес","22","21.18.04","ракета|ракета в трубе|запустили ракету|запустили ракету в трубе|запустили ракеты навстречу друг другу|что если запустить ракеты в трубе навстречу друг другу|пролетит ли ракета через трубу|труба|что если ракеты столкнутся друг с другом|куда полетит ракета|что произойдёт с ракетой в трубе|фейерверк в трубе|получится ли|опыт|проверка|эксперимент|что если|возможно ли|дюшес|duchess","773192","116735","1460","45535","https://i.ytimg.com/vi/hbO7SFJlw-E/default.jpg","False","False","ЧТО, ЕСЛИ ЗАПУСТИТЬ РАКЕТЫ В ТРУБЕ НАВСТРЕЧУ ДРУГ ДРУГУ?Всем привет, ребята!) Сегодня мы решили провести очень необычный эксперимент!) Как вы думаете, что будет, если запустить ракету в трубе? Скорее всего, она полетит очень направленно, а что, если запустить ракеты в трубе навстречу друг другу? Что произойдёт после столкновения? Они начнут друг друга переталкивать? Или же просто потухнут? Это и многое другое, вы узнаете в этом видеоролике!)Мой ВК - https://vk.com/m.olympia2020Мой Инстаграм - https://www.instagram.com/andrey_mandzyukИнстаграм Макса - https://www.instagram.com/galchenko_m/Инстаграм Сереги - https://www.instagram.com/misharinsergei/Инстаграм Ромы - https://instagram.com/kovalenko30.07Инстаграм Жени - https://www.instagram.com/sko_ot/По вопросам РЕКЛАМЫ И СОТРУДНИЧЕСТВА - duchess@mediacube.in"
"W2pgpUhxbag","ПОВТОРЯЕМ НЕВЕРОЯТНУЮ УЛИЧНУЮ ЕДУ СО ВСЕГО МИРА / ОГРОМНАЯ РЫБА / БАНАНОВЫЕ ЧИПСЫ / ЛУКОВАЯ РОЗА","2021-04-17T07:00:07Z","UCw9L4gmA0nAsg6rlxBncByg","vanzai","22","21.18.04","ВАНЗАЙ|VANZAI|ванзай готовит|еда|vanzai|рецепты|как приготовить рыбу|сашими из рыбы|необычная еда|стрид фуд|уличная еда|ванзай рецепты|ПОВТОРЯЕМ НЕВЕРОЯТНУЮ УЛИЧНУЮ ЕДУ СО ВСЕГО МИРА|ОГРОМНАЯ РЫБА|БАНАНОВЫЕ ЧИПСЫ|ЛУКОВАЯ РОЗА|как сделать чипсы|рецепт чипсов|самые вкусные чипсы|банановые чипсы|рецепт чипсов в домашних условиях|чипсы во фритюре|фаст фуд","2202890","182538","2561","4521","https://i.ytimg.com/vi/W2pgpUhxbag/default.jpg","False","False","✅ http://e-katalog.link/u/51Zx67 - ПРОВЕРЬ ЦЕНУ НА ЛЮБОЙ ТОВАР✅ https://www.e-katalog.ru/u/q8E4cC/a - СПИСОК МОИХ ТОВАРОВ (ДЛЯ РОССИИ)✅ https://ek.ua/u/539g9j/a - СПИСОК МОЇХ ТОВАРІВ (ДЛЯ УКРАЇНИ)✅ https://www.e-katalog.ru/u/LBWKyV/a - МОЙКА КАК У МЕНЯ----------------------------------MY ENGLISH CHANNEL- https://www.youtube.com/channel/UCW0q...​---------------------------------------------Реклама/сотрудничество - sunray.advert@gmail.com______________________________________________Email: vanzai.kitchen@gmail.com - для коммуникаций по англоязычному каналу vanzai kitchen------------------------------------------------------------------------------------- VK: https://vk.com/id168352990​​​ _______________________________________________ Instagram: https://www.instagram.com/vanzai_live/​​​ _______________________________________________ ВСЕМ ПРИВЕТ .сегодня мы ПОВТОРЯТЬ НЕВЕРОЯТНУЮ УЛИЧНУЮ ЕДУ СО ВСЕГО МИРА / ОГРОМНАЯ РЫБА / БАНАНОВЫЕ ЧИПСЫ / ЛУКОВАЯ РОЗА"
"6J-VoQMh2rA","ПЕРЕДАЧА | Таш Саркисян, Дмитрий Шнякин, Васант Балан, Сослан Гатагов","2021-04-17T07:00:04Z","UCpJBtupzAkBd9BBAoJm_GcQ","Площадка","17","21.18.04","дмитрий позов|площадка|передача|футбол|спорт|talk шоу|ток шоу|поз и кос|medium quality|сослан гатагов|дмитрий шнякин|васант балан|таш саркисян|локомотив|спартак|дерби|судейство","63318","2867","127","592","https://i.ytimg.com/vi/6J-VoQMh2rA/default.jpg","False","False","Передача - футбольное talk show.Сегодня Дмитрий Позов, Таш Саркисян, Дмитрий Шнякин, Сослан Гатагов и Васант Балан спорят о скандалах вокруг Спартака и Локомотива. Съемка от 14.04.21 Наши соц. сети:https://www.instagram.com/sport_ploschadka/https://twitter.com/sportploschadkahttps://vm.tiktok.com/ZSJ2TJF6w/ https://t.me/sportploschadka https://vk.com/sportploschadka/ По вопросам рекламных и коммерческих предложений ploshadka@mediumquality.ru"
"7Od-unmAuBA","ХИТЫ 2021♫ ЛУЧШИЕ ПЕСНИ 2021, НОВИНКИ МУЗЫКИ 2021, РУССКАЯ МУЗЫКА 2021, RUSSISCHE MUSIK 2021","2021-04-16T17:41:23Z","UCzxecO6AVYz6vUKUWDfu1RQ","Best Russian Mix","10","21.18.04","русская музыка|клубная музыка|музыка русская|музика 2021|новинки музыки|классная музыка|хиты|russische musik|musik russische|русская музыка 2021|музыка 2021|русская музыка 2021 новинки|музыка 2021 русская|хиты 2021|клубная музыка 2021|новинки музыки 2021|музыка русская 2021|хиты 2021 русские|музыка 2021 русские хиты|русские хиты 2021|russische musik 2021|musik 2021 russische|музыка|Новинки Музыка 2021|танцевальная музыка","77773","515","48","31","https://i.ytimg.com/vi/7Od-unmAuBA/default.jpg","False","False","ХИТЫ 2021♫ ЛУЧШИЕ ПЕСНИ 2021, НОВИНКИ МУЗЫКИ 2021, РУССКАЯ МУЗЫКА 2021, RUSSISCHE MUSIK 2021-------------------------------------✔Приятного вам дня и прослушивания!✔Делитесь этим видео с друзьями!✔Также не забудьте нажать на колокольчик чтобы знат о всех новинках!⚠ Пожалуйста, помогите мне достигнуть 200 000 зарегистрированных ⚠ https://bit.ly/30GlNSl​Best Russian Mix is created to promote and support new Artists, (musicians/labels, composers, producers, photographers/filmmakers)Send your song or video on Best Russian Mix : letgobaby18@gmail.comIf any producer, label, artist or photographer has an issue with any of the music or video uploads please contact us and we will remove your work immediately. Thank You.We strive to find the Best and most enjoyable Music for You guys !! Peace Love and Music.➤ None of these images, music & video clips were created/owned by us.➤ This video is purely fan-made, if you (owners) want to remove this video, please CONTACT US DIRECTLY before doing anything. We will respectfully remove it.➤ If you have problems about copyright or label, please contact me via email (letgobaby18@gmail.com) or YT inbox. Thank you :)"
"abnqaeNB0Hc","Соне сделали операцию. Что дальше? / SANI vlog","2021-04-16T13:16:17Z","UCwpfuE8mL7oUy5_Nc1-9UFA","SANISHOW","15","21.18.04","помощь животным|спасение котенка|спасение животных|операция|кошке сделали операцию|кошка|кот|кошка с котом|животные|приколы с животными|приколы с котами|смешные животные|операция сони|соня заболела|sani vlog|sanishow|домашние животные","285542","31097","216","2861","https://i.ytimg.com/vi/abnqaeNB0Hc/default.jpg","False","False","Прошлый выпуск: https://youtu.be/uAfRFQk1iLcЯ этом выпуске вы узнаете, что случилось с Соней и какую операцию ей сделали. Как кошка перенесла операцию, как вела себя после операции и что будет дальше...  Включайте самое лучшее качество и обязательно смотрите до конца. Не забудьте оценить видео лайком или дизлайком, поделиться с друзьями и оставить комментарий. Это помогает видеоролику набирать обороты. Спасибо всем, кто выполняет эти пункты! ❤️● Наш канал: https://www.youtube.com/c/sanishow● Второй канал: https://www.youtube.com/channel/UCmPZL92EuH6c4OIkLaPxJWQ● Инстаграм: https://www.instagram.com/deefolt/● ВК: https://vk.com/vlogboy● Группа: https://vk.com/sanishow$ Добровольные пожертвования:● Яндекс Деньги: 410012231378432● QIWI: +375291850129● Добровольный сбор в нашей ✔️ официальной группе ВКонтакте: https://vk.com/app6471849_-31795824Будем благодарны за любую сумму!Сотрудничество ► sanishow@mail.ruВсем привет. Меня зовут Саша. Мы подбираем с улицы бездомных животных и с помощью этого канала #sanishow находим им новый дом. Эта рубрика называется Спасение животных. На нашем канале есть плейлист, в котором собраны все истории спасений. Так же рассказываем интересные истории из жизни, снимаем приколы и фейлы с нашими домашними животными, и многое другое...Нажимайте кнопочку ПОДПИСАТЬСЯ и на КОЛОКОЛЬЧИК, чтобы не пропустить следующие видео. Если вам понравился домашний влог про смешных животных, на нашем канале SANISHOW вы можете посмотреть другие видео с приколами про животных. Любите и не обижайте животных.Делайте добрые дела!____г. Бобруйск. Республика Беларусь."
"M8vBtKVoiYY","15 лайфхаков для родителей","2021-04-16T11:00:08Z","UCq1JpGFxcZTbbOAz010U-og","Трум Трум","26","21.18.04","лайфхаки для родителей|трум трум","787480","16598","1549","457","https://i.ytimg.com/vi/M8vBtKVoiYY/default.jpg","False","False","Подписывайся на канал: https://www.youtube.com/channel/UCq1JpGFxcZTbbOAz010U-og?sub_confirmation=1Моя девушка – последний дракон!: https://youtu.be/rRycl98c8eM?list=PLw_MSrc8v85dDBhA0b_b7QBBbHvI_MF-p&playnext=1Музыка:Композиция Pinball принадлежит исполнителю Tobu. Оригинальная версия: http://youtube.com/tobuofficial"
"DEKrPtQ_mjI","ДОМ на КОЛЁСАХ / Первый ремонт - Готовимся ехать в Хибины! [13 Серия]","2021-04-16T09:43:53Z","UCgQ1CeGtjCbkvslmG3zTAFA","ILYA STREKAL","2","21.18.04","Илья Стрекаловский|стрекал|ламборгини|самодельный|авто|тачки|тест|драйв|обзор","692091","43358","2180","1683","https://i.ytimg.com/vi/DEKrPtQ_mjI/default.jpg","False","False","За покупкой автобуса на Авито: https://clc.to/avito__strekalhttp://www.mtflight-shop.com/ - продажа компонентов автомобильного света - https://www.instagram.com/mtflight_official/ITS Tuning - https://www.instagram.com/itstuning/Сотрудничество - PRStrekal@gmail.com , https://strekal.ru Мой Instagram - https://instagram.com/ilya_strekal/Я ВК - http://vk.com/ilya_nevzatyagГруппа ВК  - https://vk.com/bayancover"
"pDXPT3k-dxg","ПРЕМЬЕРА 2021! Черная кошка в темной комнате. Психология преступления. 1 Серия. Детектив, Сериал","2021-04-16T18:00:27Z","UCgN_VU99ugR-LCGYXWRvGGg","СВЭЛЛ ФИЛЬМ","1","21.18.04","ПРЕМЬЕРА СЕРИАЛА 2021|Черная кошка в темной комнате|Черная кошка в темной комнате сериал|Черная кошка в темной комнате. Психология преступления|Черная кошка в темной комнате 1 серия|детектив|экранизация|сериалы 2021|сериалы 2021 новинки|детективы 2021|детективы 2021 русские новинки|детективный сериал|детектив новинка|сериал новинки 2021|русские сериалы 2021|новинки сериалы 2021 русские|детективы 2021 русские|криминальный фильм|экранизация детективов|детективы","284524","1681","150","208","https://i.ytimg.com/vi/pDXPT3k-dxg/default.jpg","False","False","ПРЕМЬЕРА 2021! Черная кошка в темной комнате. Психология преступления. 1 Серия. Детектив, СериалВсе Серии: https://www.youtube.com/playlist?list=PLTVWMyQQWNCvdVsNmmYTEotgCn92XhErjhttps://www.youtube.com/channel/UCgN_VU99ugR-LCGYXWRvGGg Подписывайся на Свэлл Фильм Официальный Канал Компании!  Минимум рекламы, максимум хороших фильмов!По одноименному роману Н. АндреевойУспешный бизнесмен Сила Мамонов круглыми сутками пропадает на работе. Домой его совсем не тянет - его жена Эльза, в которой невероятная красота сочетается с удивительной глупостью, уже давно не вызывает ничего, кроме злости и раздражения. Выносить ее на трезвую голову Сила не может, а потому все чаще прикладывается к бутылке. Мамонов боится признаться себе в том, что он был бы счастлив, если бы Эльза навсегда исчезла из его жизни. И вот в один прекрасный день он видит, что Эльзу кто-то душит… Он бросается ей на помощь и получает сокрушительный удар по голове. Придя в себя, он обнаруживает, что жена жива и здорова, и никакого душителя, по ее словам, не было…Режиссер: Илья ХотиненкоСценаристы: Анастасия Чеховская, Кирилл ХарламовАктеры: Александр Ратников, Артём Федотов, Полина Сыркина, Святослава Сагунова, Сергей Мардарь, Виктор Логинов, Любовь Зайцева, Марина Коняшкина, Евгения Бордзиловская, Александр Дмитриев и др.Производство: «Свэлл Фильм»Премьера: 16 апреля 2021 (ТВ Центр)Cерий: 2Жанр: детектив, мелодрама"
"bJ6A9eg3P6c","КАК ПОЮТ ВЖИВУЮ ТИКТОКЕРЫ VS ЗАСЛУЖЕННЫЕ АРТИСТЫ РФ","2021-04-17T06:28:44Z","UC-NxFc7S9EnLBM5r_sI2sUQ","АКАДЕМИЯ ПОРЯДОЧНЫХ ПАРНЕЙ","10","21.18.04","как поют тик токеры вживую|тик ток|миа бойка|миа бойка прятки|карнавал психушка|даня милохин|песни из тик тока|егор шип шип диор|тиктокеры дрим хаус|шип егор диор|карина кросс|карина кросс и артур бабич|артур бабич поет|тик токеры поют|как поют вживую тик токеры|юля гаврилина поет вживую|гаврилина жужу|валя карнавал|тренды тик ток|тик ток 2020|музыкалити|Лариса долина|Лариса долина и валя карнавал|апп|академия порядочных парней","130259","7277","774","1312","https://i.ytimg.com/vi/bJ6A9eg3P6c/default.jpg","False","False","Как популярные тиктокеры поют вживую и как поют заслуженные артисты - сравним в музыкальном баттле: тик токеры против профессиональных вокалистов. В наш тик ток топ сегодня попали Егор Шип, Валя Карнавал, Миа Бойка, Артур Бабич, Даня Милохин, Юля Гаврилина, Влад А4, Инстасамка,  Realmoneyken, Дина Саева, Лариса Долина, Филипп Киркоров, Хабиб и многие другие.◓ Вика - https://www.instagram.com/victoria__pich​◓Почта для сотрудничества vikawork21@gmail.com◓ВК -  https://vk.com/academyshow​◓Telegram - https://t.me/academyofguy​◓Моя партнерская сеть - https://yoola.app/r/6115825139667О чем видео: ремейки старых хитов, перепели популярную песню, каверы превзошедшие оригинал, пародии превзошедшие оригинал, хиты, музыка, популярные песни, дали хиту вторую жизнь, как тик токеры поют вживую, валя карванал и лариса долина конфликт, музыкалити, максим галкин, как поют вживую, отключилась фонограмма, как легенды поют вживую, живой вокал."
"22dNM6ZG4S0","Жёсткий наезд! ВОТ ТАК ОНИ ЗАРАБАТЫВАЮТ - 1 часть!","2021-04-17T07:21:59Z","UCF0yfUFQlNS67JpGIh_9ApA","Паша Пэл","1","21.18.04","паша пэл|бандиты|братва|нелегал","928590","167555","1239","6022","https://i.ytimg.com/vi/22dNM6ZG4S0/default.jpg","False","False","► НАЧАТЬ ИГРАТЬ СО МНОЙ ► https://goo.gl/eakUiT► ВВОДИТЕ ПРОМОКОД - PEL (7 часов - 50.000 руб)Вводите мой ник при регистрации - Pasha_Pels ___________________________________________● ОБЯЗАТЕЛЬНО ПЕРЕЙДИ по этой ССЫЛКЕ! ► https://vk.cc/bXZaeg► Инстаграм Ильи Танка - https://www.instagram.com/ilyatankshilov/► 2 часть Радмир -  https://youtu.be/3Js6Tz3X8vw● Мой инстаграм ► https://www.instagram.com/pasha_pel/● МОЯ ГРУППА ►► https://vk.com/pasha_pel● МОЙ ВК ► https://vk.com/pasha__kalinin● Прошлое видео -  https://youtu.be/AU3U7wRspsI____________________"
"JjVVtEKORHY","Ходос Авто - ТОРГ","2021-04-18T08:00:09Z","UC93GxHXgjjvVd6Z-nULOdXQ","Yardrey","2","21.18.04","ходос|ходос авто|хонсервис|хон сервис|двс|двигатель|двигатели|вольво|капитальный ремонт|капиталка|купить двс|замена двс|ремонт двс|контрактный двигатель|дизельный двигатель|внутренний двигатель|михаил ходос|капиталка двигателя|двигатель капремонт|капитальный ремонт двигатель|двигатель замена|капремонт двигателя|двигатель капиталка|двигатель ремонт цена|ремонт дизельный двигатель|ремонт гбц|двигатель диагностика|купить контрактный двигатель|контрактный","178031","12372","373","2413","https://i.ytimg.com/vi/JjVVtEKORHY/default.jpg","False","False","С чего всё началось: https://youtu.be/uUspFwwXcY4Серия ГНЕВ: https://youtu.be/9I9_TB2C4doСерия ОТРИЦАНИЕ: https://youtu.be/oudy3BSG8CAГотов результат экспертизы. Причина масложора - брак маслосъёмных колец. Михаил Ходос к его чести не стал отпираться, всё признал, взял эмоции под контроль и сделал Павлу предложения по финансовому урегулированию данной ситуации. Предложение на мой взгляд не самое плохое, надо сказать,Но теперь эмоции отказали уже у Павла. Павел решил припомнить Ходосам все 2 года мучений с автомобилем, и посчитал им ущерб, что называется, по полной программе. Правда в конце торга всё-таки разум взял своё, решили эмоции остудить и взять паузу на подумать. И это правильно, я считаю!Договорились о том, что мы напишем письменную претензию со всеми нашими требованиями, после чего ещё раз поговорим. Главное, чтобы Ходосы не потеряли нашу претензию, как в прошлый раз. 😂😂😂Подшивалов Андрей ( Ярдрей ). ____________________________  8-999-555-41-41 (телефонные звонки, смс, whatsapp, viber, telegram)Мой сайт: https://www.yardrey.ru​ Е-mail: support@yardrey.ru Группа В Контакте: https://vk.com/call_yardrey​  Фейсбук: https://facebook.com/Yardrey/​  Инстаграм: https://www.instagram.com/yardrey/​"
