video_id,title,publishedAt,channelId,channelTitle,categoryId,trending_date,tags,view_count,likes,dislikes,comment_count,thumbnail_link,comments_disabled,ratings_disabled,description
"cSvJEcKnwNE","UFC 261: Jorge Masvidal Octagon Interview","2021-04-25T05:13:23Z","UCvgfXK4nTYKudb0rFR6noLA","UFC - Ultimate Fighting Championship","17","21.28.04","ufc|261|ufc 261|jorge|masvidal|octagon|interview|post|fight|joe|rogan|mma|ultimate fighting championship","1882674","31375","776","6577","https://i.ytimg.com/vi/cSvJEcKnwNE/default.jpg","False","False","Jorge Masvidal shares his thoughts on what happened in his loss to Kamaru Usman in their main event rematch at UFC 261 in Jacksonville. Saturday night marked Masvidal's 50th professional bout.Subscribe to get all the latest UFC content: http://bit.ly/2uJRzRRExperience UFC live with UFC FIGHT PASS, the digital subscription service of the UFC. Visit https://ufcfightpass.com/To order UFC Pay-Per-Views on ESPN+, visit https://bit.ly/2vNIBE8 (U.S. only)To order UFC Pay-Per-Views, visit http://welcome.ufcfightpass.com/#PPV (Non U.S.)Connect with UFC online and on Social:🔴 Website: http://www.ufc.com🔵 Twitter: http://www.twitter.com/ufc🔵 Facebook: http://www.facebook.com/ufc🔴 Instagram: http://www.instagram.com/ufc🟡 Snapchat: UFC🟣 Twitch: https://www.twitch.tv/ufcConnect with UFC FIGHT PASS on Social:🔵 Twitter: http://www.twitter.com/ufcfightpass🔵 Facebook: http://www.facebook.com/ufcfightpass🔴 Instagram: http://www.instagram.com/ufcfightpass#UFC #UFC261"
"ly6yEJSDFko","Prince Philip's funeral: the key moments","2021-04-17T18:17:55Z","UCoMdktPbSTixAyNGwb-UYkQ","Sky News","24","21.28.04","sky|news|queen|duke|edinburgh|prince|philip|funeral|prince philip funeral|national|anthem|prince philip|service|procession|st|george|george's|chapel|windsor|castle|plan|live|coverage|arrivals|elizabeth|harry|william|charles|andrew|family|royal|royals|military|proceedings|watch","6755782","72502","4202","0","https://i.ytimg.com/vi/ly6yEJSDFko/default.jpg","True","False","The funeral of the Duke of Edinburgh has taken place at St George's Chapel in Windsor.The Queen led her family in mourning her husband of 73 years.The service was led by the Dean of Windsor, who paid tribute to Prince Philip's kindness, humour and humanity - as well as his unwavering loyalty to Her Majesty.Sky's Jason Farrell looks at how the funeral unfolded.SUBSCRIBE to our YouTube channel for more videos: http://www.youtube.com/skynews Follow us on Twitter: https://twitter.com/skynews  Like us on Facebook: https://www.facebook.com/skynews Follow us on Instagram: https://www.instagram.com/skynews For more content go to http://news.sky.com and download our apps:  Apple: https://itunes.apple.com/gb/app/sky-news/id316391924?mt=8 Android https://play.google.com/store/apps/details?id=com.bskyb.skynews.android&hl=en_GBSky News videos are now available in Spanish here/Los video de Sky News están disponibles en español aquí https://www.youtube.com/channel/UCzG5BnqHO8oNlrPDW9CYJog"
"gaV8M4nG_UY","Queen stepped in to change Prince Louis' name & title - Royal Insider","2021-04-23T16:08:59Z","UC6nNPL70MbmIV9su8V1AscA","Royal Insider","25","21.28.04","Happy birthday Prince Louis|Prince Louis of Cambridge|Prince Louis|Prince Louis grown up|Prince Louis birthday|Prince Louis 3rd birthday|Prince Louis photo|Prince Louis portrait|Queen Elizabeth|Queen Elizabeth changed Prince Louis name|Queen Elizabeth changed Prince Louis title|Prince William Kate Middleton kids|Prince William Kate Middleton children|Catherine|Kate Middleton|Prince William|Duchess of Cambridge|Prince William Kate Middleton news","3406062","25934","2978","3261","https://i.ytimg.com/vi/gaV8M4nG_UY/default.jpg","False","False","How Queen Elizabeth stepped in to change The Duke and Duchess of Cambridge's son Prince Louis' name and title.#PrinceLouis #KateMiddleton #PrinceWilliamAbout the channel:Royal Insider Channel is delighted to share news aggregated daily about royal families around the world, especially interesting stories of royal traditions, their fashion and lifestyles, and relationships among royals, updates on royal weddings, baby news, ...To get latest videos please subscribe to the channel: https://bit.ly/3jGLOsAVideos at Royal Insider can use copyrighted content based on fair use laws (https://www.youtube.com/about/copyright/#support-and-troubleshooting) and (https://en.Wikipedia.org/wiki/Fair_use)For copyright matters relating to the channel please contact us directly at : SharonDieben@outlook.com"
"Pc5Hp6BEp9E","The Absolute State of Affairs","2021-04-23T20:00:04Z","UCkin59aR57-RgqvN04jHSIg","Joana Ceddia","23","21.28.04","[none]","1770304","178658","555","16305","https://i.ytimg.com/vi/Pc5Hp6BEp9E/default.jpg","False","False","This has to be my all-time favourite recipe! I make this every day for my 16 children, 4 husbands, 3 wives, 18 ex-husbands, 24 ex-wives, my mother, father, 48 step-dads, 39 step-mums, my 17 brothers and 20 sisters, my 4 half brothers, 6 step-brothers, 3 half-sisters, 4 step-sisters, my 15 cats, 25 dogs, 3 alligators, 58 cows, 7 chickens, 8 hamsters, 14 rats, 47 best friends, 164 colleagues, my 4 bosses, all 83 clients of mine, all my ancestors, that squirrel outside, the man looking in from my window, the girl in my bathtub, and the thing in the basement. It’s really simple and easy to make so I really love giving it to as many as I can!Oh! how could I have forgotten! Silly me, here is a link to the recipe🤗: https://www.youtube.com/watch?v=OBpanKeu6cM&list=LL&index=1lots of love,Jhris Cansen"
"uxrzOQsUx74","Polo G RAPSTAR Official Lyrics & Meaning | Verified","2021-04-23T17:00:28Z","UCyFZMEnm1il5Wv3a6tPscbA","Genius","10","21.28.04","Lyric videos|einer bankz|gbwc3p|genius|genius interview|genius polo g|hip hop|lyric video|lyrics|new pop music|official lyrics|polo g|polo g einer bankz|polo g genius|polo g genius interview|polo g rapstar|polo g rapstar einer bankz|polo g rapstar genius|polo g rapstar instrumental|polo g rapstar lyrics|polo g rapstar official lyrics|pop music|rap|rap genius|rap star genius|rapstar genius|synco|verified|verified polo g","1907257","128755","722","6600","https://i.ytimg.com/vi/uxrzOQsUx74/default.jpg","False","False","Nearly a year after it was first previewed on Einer Bankz’s YouTube channel, Polo G’s “RAPSTAR” became the Chicago rapper’s first No. 1 hit on Billboard’s Hot 100. The official version of the track, which dropped this month, has already racked up 71 million Spotify streams to date. It is produced by Synco and Einer Bankz who also plays ukulele on the track. On the song, Polo G raps about his rise to fame and the struggles he’s experienced along the way.Read more on Genius: https://genius.com/a/polo-g-breaks-down-the-meaning-of-rapstarRead all the lyrics to RAPSTAR on Genius: https://genius.com/Polo-g-rapstar-lyricsWatch the official music video for RAPSTAR: https://www.youtube.com/watch?v=w2IhccXakkESubscribe to Genius: http://bit.ly/2cNV6nzGenius on Twitter: https://twitter.com/GeniusGenius on Instagram: http://instagram.com/geniusGenius on Facebook: https://facebook.com/Geniusdotcomhttp://genius.com#polog #rapstar #verified"
"j4U2820sEgs","Adin Ross Pulled Up On Me... 1v1 Basketball!","2021-04-25T17:42:49Z","UCxEUEkp5y728nY57wg8z3dw","Tristan Jass","24","21.28.04","adin ross|adin ross polo g|adin ross tecca|adin ross lil tecca|Tristan jass|t jass|adin ross t jass|adin ross Tristan jass|Tristan jass adin ross|t jass adin ross|t jass vs adin ross|Tristan jass 1v1|1v1 basketball|Tristan jass vs adin ross|trash talker basketball|adin ross 1v1|adin ross basketball|adin ross irl|adin ross twitch|adin ross girlfriend|t jass 1v1|polo g adin ross|adin ross pulled up on me|adin vs tristan|funny|adin live|twitch|lmfao","519252","35561","234","2379","https://i.ytimg.com/vi/j4U2820sEgs/default.jpg","False","False","Me & Adin Ross linked up to play some 1v1... This video is LEGENDARY!▼Connect With Tristan Jass▼https://twitter.com/tristanjass/https://www.youtube.com/tristanjasshttps://www.instagram.com/tristanj22/▼Follow T Jass Brand▼https://www.instagram.com/tjassbrand/https://twitter.com/tjassbrandhttps://www.tjassbrand.com▼Adin Ross▼https://www.instagram.com/adinross/?hl=enhttps://twitter.com/adinross?ref_src=twsrc%5Egoogle%7Ctwcamp%5Eserp%7Ctwgr%5Eauthorhttps://www.twitch.tv/adinrosshttps://www.youtube.com/channel/UCpq0Ou2ObQr-LbTB6hsl8BA"
"Wab87Jx8-7E","DMX memorial service at Barclays Center","2021-04-25T02:28:57Z","UCIjSUWHWp6KohfnR5OQTXnQ","FOX 5 New York","25","21.28.04","DMX|rap|rapper|memorial|Brooklyn Earl Simmons","297381","3679","156","505","https://i.ytimg.com/vi/Wab87Jx8-7E/default.jpg","False","False","A memorial to celebrate the life of Earl DMX Simmons was held on Saturday in Brooklyn.Subscribe to FOX 5 NY: _https://www.youtube.com/fox5ny_ (https://www.youtube.com/fox5ny)?sub_confirmation=1Watch FOX 5 NY Live: https://www.fox5ny.com/liveFOX 5 NY delivers breaking news, live events, investigations, politics, entertainment, business news and local stories from New York City and across the nation.Watch more FOX 5 NY on YouTube:Black Entrepreneurs: https://www.youtube.com/playlist?list=PLcuHpcV2MbFhCA1ErwiU_6G6XSA-HBg0rSTREET SOLDIERS with LISA EVERS: https://www.youtube.com/playlist?list=PLcuHpcV2MbFgxNyloxnZwYu5p0oWN_lSJA.I. ALL IN: https://www.youtube.com/playlist?list=PLcuHpcV2MbFgcJsok-gL3gwY8OfzVkacPFinding Faith: https://www.youtube.com/playlist?list=PLcuHpcV2MbFg7_GyPTOJfF9PiWwo9sgMdThe Big Idea: https://www.youtube.com/playlist?list=PLcuHpcV2MbFizXx6FzVo9sCaNbCYu_rVBDownload the FOX 5 NY News app: https://www.fox5ny.com/appsDownload the FOX 5 NY Weather app: https://www.fox5ny.com/appsFollow FOX 5 NY on Facebook: https://www.facebook.com/fox5ny/Follow FOX 5 NY on Twitter: https://twitter.com/fox5ny/Follow FOX 5 NY on Instagram: https://www.instagram.com/fox5ny/Subscribe to the Good Day NY Morning Brief newsletter: https://www.fox5ny.com/email"
"0T3fZiE7Feg","H.E.R. - Come Through (Visualizer) ft. Chris Brown","2021-04-23T04:00:13Z","UCQT3bmChpmnR5ThhY_ewoOQ","HERMusicVEVO","10","21.28.04","Come through|come thru|come through her|come through her chris brown|h.e.r.|her|her fight for you|judas and the black messiah|lil durk judas|lil durk music|her damage|h.e.r. damage|original soundtrack|nip and jay|what it feels like|fight for you official|fred Hampton|jay z what it feels like|g herbo judas|g herbo|g herbo all black|polo g|polo g last man standing|pooh shiesty|pooh shiesty no profanity|lil|durk","2283671","95078","1240","3816","https://i.ytimg.com/vi/0T3fZiE7Feg/default.jpg","False","False","H.E.R. - Come Through” Featuring Chris Brown // Out Now!Stream/Download // https://smarturl.it/xComeThrough Subscribe to H.E.R.'s channel for more official content // https://smarturl.it/HERytSubcribeFollow H.E.R.https://twitter.com/HERMusicx    https://www.instagram.com/hermusicofficial https://www.facebook.com/officialHERmusic http://www.her-official.com Follow Chris Brownhttps://twitter.com/chrisbrownhttps://www.instagram.com/chrisbrownofficial/ https://www.facebook.com/chrisbrown http://www.chrisbrownworld.com/ #HER #ChrisBrown #ComeThrough #RnB #OfficialVideo"
"NsQxj7nnzXs","Carin Leon - Si Lo Hice Y Que (Video Oficial)","2021-04-23T17:00:14Z","UC9pVso31eCnwbgl-VAID5Pg","TAMARINDOREKORDSZ","10","21.28.04","Carin Leon|Tamarindo|Tamarindo Records|Me la Aventé|Tú|Si Tu amor no vuelve|El Malo|Espinoza Paz|Tomas Ballardo|Chuy Lizarraga|Hijos De Barrón|El Komander|Gerardo Ortiz|Grupo Alfa|Te Vi Con el|Cobarde|Carin Leon - Cobarde","2322883","31163","631","445","https://i.ytimg.com/vi/NsQxj7nnzXs/default.jpg","False","False","Suscríbete a nuestro canal: https://bit.ly/TAMARINDOREKORDSZ Carin Leon - Si Lo Hice y Que (Video Oficial)Paginas Oficiales:Carin Leon:https://www.facebook.com/carinleonofi​cialhttps://www.instagram.com/carinleonof​icialTamarindo:https://www.facebook.com/eltamariindo/https://instagram.com/tamariindo2021 ©️ Tamarindo Rekordsz.https://www.instagram.com/tamarindorekordsz/#TamarindoRekordsz #CarinLeon #SiLoHiceYQue"
"eUhgCxXYcMw","Fivio Foreign - Unruly (Official Video)","2021-04-23T04:00:13Z","UCJOBJayWmKYTEwos_0D7fug","FivioForeignVEVO","10","21.28.04","Unruly Video|Self Made|Fivio Foreign Unruly Song|Fivio|Every Girl I Meet A Groupie|Aye Aye Aye|Viral Rap|TikTok Rap|New York Rap|Brooklyn Drill|The Woo|Tdot|Fivio Foreign Unruly|Fivio Foreign New Video|Fivio Foreign New Song|Fivio Foreign Unruly Video|Movie|BAOW|bow|Fivio Foreign|Rap|RichFish/Columbia|Unruly","1009680","46395","1066","2818","https://i.ytimg.com/vi/eUhgCxXYcMw/default.jpg","False","False","Official video for “Unruly” by Fivio ForeignListen & Download Unruly now: FivioForeign.lnk.to/Unruly Amazon Music - https://FivioForeign.lnk.to/Unruly/amazonmusicApple Music - https://FivioForeign.lnk.to/Unruly/applemusicAudiomack - https://FivioForeign.lnk.to/Unruly/audiomackDeezer - https://FivioForeign.lnk.to/Unruly/deezeriTunes - https://FivioForeign.lnk.to/Unruly/itunesSoundCloud - https://FivioForeign.lnk.to/Unruly/soundcloudSpotify - https://FivioForeign.lnk.to/spotifyYouTube Music - https://FivioForeign.lnk.to/youtubemusicDirector: John Tashiro Production Company: SHOTCLOCKEP: Harrison Corwin, Lucas PrevostProducer: Rodney ByersonColorist: Bryan Smaller @ Company 3 Editor: Matthew J. Levy Follow Fivo ForeignFacebook - https://www.facebook.com/FivioForeignOfficialInstagram - https://www.instagram.com/fivioforeign_8fsTwitter - https://twitter.com/FivioForeignTikTok - https://www.tiktok.com/@fivioforeign https://fivioforeign8fs.com #FivioForeign #Unruly"
"LyV4Zfn65xY","NOBODY CAME TO MY BIRTHDAY!!","2021-04-23T17:15:13Z","UC6xSN0oY2I9U_9xTo2RjE7g","Jeremy Hutchins","24","21.28.04","Jeremy Hutchins|Ben Azelart|Lexi Rivera|Brent Rivera|Mason Fulp|Stokes Twins|Andrew Davila|Dom Brack|Derek Days|Ear Piercing|Dares|Challenges|Amp World|Pierson Wodzynski|Logan Wodzynski|David Dobrik|Morgz|MyLifeAsEva|MrBeast|James Charles|Lexi Hensler|Loren Gray|Faze Rug|Alex Warren|Thomas Petrou|Faze Jarvis|Nobody came to my birthday|Birthday surpise|They forgot my birthday|They surprised me|its my birthday|Nobody showed up","1945508","165684","1308","8731","https://i.ytimg.com/vi/LyV4Zfn65xY/default.jpg","False","False","Thanks for all of the birthday wishes!!!NEW VIDEOS EVERY WEEKDon't forget to subscribe :)Check out my friends Lexi Rivera @Alexa RiveraBrent Rivera @Brent RiveraStokes Twins @Stokes TwinsBen Azelart @Ben AzelartPierson Wodzynski @piersonLexi Hensler @Lexi HenslerKatie Sigmond @Katie SigmondAndrew Davila @Andrew DavilaMason Fulp @Mason FulpDom Brack  @Dominic BrackSofie Dossi @Sofie DossiFollow my ig: jeremyhutchins"
"fi1gT23EtOo","Daddy Yankee - El Pony (Video Oficial)","2021-04-23T04:00:00Z","UC9TO_oo4c_LrOiKNaY6aysA","Daddy Yankee","10","21.28.04","daddy yankee en vivo|con calma|dura|shaky shaky|reggaeton 2019|reggaeton hits|lo mejor de daddy yankee|con calma remix|con calma challenge|daddy yankee en gira|concalmadegira|adictiva|dy adictiva|anuel adictiva|dy en vivo|como te llamas baby|hola me llamo katy|daddy yankee gasolina|daddy y yankee|con calma worldwide|desde que te vi supe que eras pa mi|el pony daddy yankee|el pony|daddy yankee pony","10353251","413969","19793","24121","https://i.ytimg.com/vi/fi1gT23EtOo/default.jpg","False","False","Daddy YankeeEl Pony (Video Oficial)Subtítulos ✅Suscríbete al canal: https://goo.gl/yypZyaMás vídeos de DY: Problema: https://youtu.be/7qrlCLbGigcCon Calma: https://youtu.be/DiItGE3eAyQQue Tire Pa' 'Lante: https://youtu.be/fAgvmh1jaCESigue a DY:Facebook-http://goo.gl/QYZ53a | Twitter-http://goo.gl/AzaR8o Instagram-http://goo.gl/a6F7gz | www.daddyyankee.comLetra:Ven y móntate en el Pony, en el Ponypareces una striper en el tubo haciendo moneyVen y móntate en el pony, en el ponyA to’ ese cinabun yo le voy a pasar la honeyEn la machina se monta vuelve y se desmontaSi estás bellajackie tú eres la jockeyEn la machina se monta vuelve y se desmontaSi estás bellajackie tú eres la jockeyQue tú eres under- lo quiero verTe pones susie- lo quiero verTú dices que eso rebota- lo quiero verDiablo que abuso de poder! Quiero tocar y no verSíguelo!Vámonos pa’ la danger zoneQue los que la llevan sabes quienes sonConmigo ella es otra versiónLe gusta los phillies como IversonPa’ calentarte yo tengo el donLlegaste cruda y te vas well doneSi lo estás pensando vete con Nicky que yo no creo en El PerdónConmigo no te asustes yo no jaloPero voy a acribillarte sin usar un paloEl que tienes en tu casa me dicen que salió maloEnvíame el location que yo bajo y te lo instalo.aló!No te me vayas de focoNi te me pierdas tampocoSe que te gusta el dulce y tengo los besitos de cocoCaiste poco a poco con el dueño del hipódromoOlvídate de estos caballos locoVen y móntate en el Pony en el Ponypareces una striper en el tubo haciendo moneyVen y móntate en el pony en el ponyA to’ ese cinabun yo le voy a pasar la honeyEn la machina se monta vuelve y se desmontaSi estás bellajackie tú eres la jockeyEn la machina se monta vuelve y se desmontaSi estás bellajackie tú eres la jockeyQue tú eres under- lo quiero verTe pones susie- lo quiero verTú dices que eso rebota- lo quiero verDiablo que abuso de poder! Quiero tocar y no verSíguelo!Que le meta al flow que la meta al swingYo voy con to’ sin robitusinQue mueva el montón que se marque el jeanDura como dumbbell sin ir al gymTiene un nalgaje que le roncaPero no cualquiera viene y se le montaReady pa’ la bronca me dicen el tonkaPorque tengo más espuelas que Tim DuncanSi la presionas ella te pitcheaSi la llevas con calma ella te preseaEsa movie de bichote no la capeaCúcala pa que vea te tira y te frontea uy!Tiene un nalgaje que le roncaPero no cualquiera viene y se le montaReady pa’ la bronca me dicen el tonkaPorque tengo más espuelas que Tim DuncanYa caché ese PokemónTu pelo es el jaquimónPa’ la jockey separé el sillón y, Ven y móntate en el Pony en el Ponypareces una striper en el tubo haciendo moneyVen y móntate en el pony en el ponyA to’ ese cinabun yo le voy a pasar la honeyEn la machina se monta vuelve y se desmontaSi estás bellajackie tú eres la jockeyEn la machina se monta, vuelve y se desmontaSi estás bellajackie tú eres la jockey#DaddyYankee #ElPony #NewMusic"
"bYFmfum-yqw","Team RAR Goes to PROM!!","2021-04-22T20:26:31Z","UCXOSzGyN3EPZfKE2hujeIYA","Lizzy Capri","24","21.28.04","Lizzy Capri|lizzy|Team RAR|Carter Sharer|team rar high school|team rar prom","2122132","41395","1981","3458","https://i.ytimg.com/vi/bYFmfum-yqw/default.jpg","False","False","Today Team RAR is going to prom!! This is the day you have all been waiting for! Team rar high school goes to prom - carter sharer, stove, ryan prunty, bailey, Lizzy capri and deniesse all get ready for their special night!Join this channel to get access to perks:https://www.youtube.com/channel/UCXOSzGyN3EPZfKE2hujeIYA/joinGET YOUR MERCH 👚https://lizzy.teamrar.com/ USE DISCOUNT CODE LIZZY FOR 5$ OFF!!📷INSTAGRAM → https://www.instagram.com/lizzycapri/⏰TIK TOK → https://www.tiktok.com/@lizzycapri📘FACEBOOK → LIZZY CAPRI https://goo.gl/AX1d4t💬DISCORD → https://discordapp.com/invite/lizzycord-----------------------------------------------------------------------------------------------------------VIDEO EDITOR: ONJONET WILLIAMS @OnjofficialBusiness Inquiries: lizzy.integrations@teamrar.comWARNING: This video is only for entertainment purposes. Do not attempt to recreate any of the acts in this video, as they may be dangerous if not done correctly, and could result in serious injury. If you rely on the information portrayed in this video, you assume the responsibility for the results. Have fun, but always think ahead, and remember that every project you try is at YOUR OWN RISK.This footage is property of Dream Team Studios LLC and is not allowed to be repurposed without written consent from Dream Team Studios LLC. For any requests from media contact us at lizzy.integrations@teamrar.com"
"R-jYAmRGmnc","TUG OF WAR Semi Truck Vs. Mass People!","2021-04-23T22:00:10Z","UC5f5IV0Bf79YLp_p9nfInRA","How Ridiculous","17","21.28.04","how ridiculous|rexy|44club","700928","35572","813","3723","https://i.ytimg.com/vi/R-jYAmRGmnc/default.jpg","False","False","Use code HOWRIDICULOUS12 to get up to 12 FREE MEALS across your first 4 HelloFresh boxes, including free shipping on your first box at https://bit.ly/3sWCUfVThanks to everyone who came out to the meet and greet at the tower. We are really lucky to have very minimal COVID restrictions where we live in Australia which is why we could even do this. We really feel for everyone out there who’s been in lockdowns lots more than us, hopefully this vid brightens your day.BUY NEW MERCH ➤ https://bit.ly/HRMerchStoreSUBSCRIBE ➤ http://bit.ly/SubHowRidiculousBECOME A MEMBER ➤ and get exclusive perks like bonus videos, live streams. merch discount codes + more!  http://bit.ly/HRmembershipsSOCIALSInstagram ➤ @HowRidiculousFacebook ➤ How Ridiculous / http://bit.ly/HRFaceyTwitter     ➤ @howridiculousTikTok     ➤ @howridiculousWhat's the 44 Club? https://howridiculous.org/pages/44-clubWe are passionate about seeing children released from poverty and we would love you to consider sponsoring a child with Compassion. We visited our sponsor children in the Philippines and were blown away by the difference that child sponsorship can make. To find out more about sponsoring a child right now, check out: http://cmpsn.co/howridiculousFor 44 Club fan mail or other items please send to: How Ridiculous PO Box 7045 Karawara WA 6152 AustraliaEMAIL US:All 44CLUB/fan email ➤ 44club@howridiculous.orgWe'll Pin Ya Submissions ➤ pinya@howridiculous.orgMerchandise Questions ➤ merch@howridiculous.orgLicensing/Media Inquiries ➤ licenses@howridiculous.orgBusiness Inquiries ONLY ➤ management@howridiculous.org"
"ubdeefsJr9I","50 MEME SONGS on GUITAR","2021-04-23T23:30:07Z","UCPKgIhTC3BdkAwMw6s-GEug","TheDooo","10","21.28.04","the dooo|guitar|guitar solo|50 music memes|memes compilation|music memes|meme|guitar meme|bass meme|megalovania|we are number one|guitar battle|memes 2021|memes 2020|tik tok|tik tok memes|dank memes|dank memes compilation|new memes|evolution of meme|history of meme|evolution of music|evolution of meme music (1741-2018)|old memes|musical memes through the years|music through the years|tik tok songs|cover|dababy meme|tik tok meme compilation","1237334","150216","466","8861","https://i.ytimg.com/vi/ubdeefsJr9I/default.jpg","False","False","50 of the best music memes played on guitar. Kind of a history of music memes from old to new and some cringe tiktok memes too. LIKE the video and subscribe if you enjoyed :)Twitch Channel - Twitch - https://www.twitch.tv/thedooo_-Social Media- ● Twitter - https://twitter.com/The_Dooo● Instagram - https://www.instagram.com/Dooo_Official● Discord Server - https://discord.gg/thedooo● SoundCloud - https://soundcloud.com/thedooo● Facebook - https://www.facebook.com/TheDooo-1057576707651514"
"IxXaizglscw","I Made A Water Computer And It Actually Works","2021-04-23T18:00:05Z","UCEIwxahdLz7bap-VDs9h35A","Steve Mould","28","21.28.04","[none]","1996012","77617","841","3572","https://i.ytimg.com/vi/IxXaizglscw/default.jpg","False","False","The first 200 people to sign up at https://brilliant.org/stevemould/ will get 20% off an annual subscription.Computers add numbers together using logic gates built out of transistors. But they don't have to be! They can be built out of greedy cup siphons instead! I used specially designed siphones to works as XOR and AND gates and chained them together so they add 4 digit binary numbers.Subscribe to Matt's channel so you don't miss his Dobble video:https://www.youtube.com/user/standupmathsHere's my greedy cup siphon video:https://youtu.be/Cg8KQfaT9xYImage credits:Zoom in on transistor - NISENetMoniac - Matt BrownMoniac - Paul DowneyMoniac - Tiia MontoMoniac - Marcin WicharyYou can buy my books here:https://stevemould.com/booksYou can support me on Patreon here:https://www.patreon.com/stevemouldjust like these amazing people:Matthew CockeGlenn WatsonJoseph RoccaJoël van der LooDoug PetersonRashid Al MPaul WarelisWill AckerlyHeather LiuAlnitakTwitter: http://twitter.com/mouldsInstagram: https://www.instagram.com/stevemouldscience/Facebook: https://www.facebook.com/stevemouldscience/Buy nerdy maths things: http://mathsgear.co.uk"
