video_id,title,publishedAt,channelId,channelTitle,categoryId,trending_date,tags,view_count,likes,dislikes,comment_count,thumbnail_link,comments_disabled,ratings_disabled,description
"7-lWzQd_xeQ","JUNGLE - KEEP MOVING (OFFICIAL VIDEO)","2021-03-23T18:15:13Z","UCR4a2QKvUuLvLGA6M5MM2ew","Jungle4eva","10","21.24.03","Jungle","125136","14848","64","1161","https://i.ytimg.com/vi/7-lWzQd_xeQ/default.jpg","False","False","Listen to 'Keep Moving' and pre-order 'Loving In Stereo' now: https://jungle.ffm.to/keepmoving.oydSign up to our newsletter: https://jungle.ffm.to/subscribe.oyd Shop Music & Merch: https://jungle.ffm.to/shop.oyd Tour Dates: https://jungle.ffm.to/live.oydCREDITSDirected by J Lloyd & Charlie Di Placido Choreographed by Nathaniel Williams & Cece Nama Starring:Mette Linturi  Nathaniel Williams  Thanh Jason Nguyen Zhané Samuels Shawarah Battles Miranda ChambersNaomi Weijand  Joy Duckrell  Che Jones Ken Nguyen  Jordan JFunk  Gabriel Goux  Tendai Chitate         Assistant Choreographer: Jordan Melchor  Assistant Choreographer: Yohémy Prosper Director of Photography - Jon Kassell Trinity Operator - Andy Walker 1st AD - Sam RoffeyProducer  - Jordi EstapéLine Producer - Jamie TarrUnit Production Manager - Matt Craig 1st AC - Tomas Frigstad 2nd AC - Natalie AldersonBTS Photography - Tamiym Cader  & George DayBTS Videographer Lydia KittoJungle Management - Sam DennistonColourist - Ruth Wardell Colour Producer - Holly Tidwell Production Runner - Katie CooperProduction Runner (Dailies) - Anass El Aouad Ouahbi 2nd AD - Oliver Hill Floor Runner - Ashley WhyteGaffer - Edward SmithSpark - Robbie SmithSpark - Peter Joslin Spark - Stuart Cager Stylist - Innes WooStyling Assistant - Hyokyung Park Styling Assistant - Seokyung Yoo   Production Designer - Jakob Gierse Art Buyer - Clem EveArt Standby - Joseph BaakliniSet Decorator - Bec Rodger Art Standby - Alistair OsbourneSet Decorator - Ellie Rose-Davies MUA - Chloe Rose MUA - Daniela Alves MUA - Assistant - Emma Gandolfo MUA Assistant - Madeleine Feeney Hair Stylist - Sheree JourdanHair Assistant Natalie Angel COVID Tester - Megan Markley DIT - Keeva Holder Camera Equipment - S+O Media Medic - Richard Manning - Mannings MedicsFOLLOW JUNGLE: Instagram: https://jungle.ffm.to/instagram.oydFacebook: https://jungle.ffm.to/facebook.oydTwitter: https://jungle.ffm.to/twitter.oydSpotify: https://jungle.ffm.to/spotify.oydApple Music: https://jungle.ffm.to/apple.oydTik Tok: https://jungle.ffm.to/tiktok.oyd"
"aIpkYuAHF8w","The Rise of Faceless Creators","2021-03-23T17:30:08Z","UC3iNdSV_RQU7DHTGpqEW96w","Andrei Terbea","23","21.24.03","@andreiterbea|andrei terbea|andrei terbea animation|corpse husband|corpse|corpse husband voice|corpse face reveal|dream face reveal|faceless youtubers|faceless channels|faceless creators|faceless|vtubers|vtuber community|hololive|anime|hatsune miku","448977","47245","302","4241","https://i.ytimg.com/vi/aIpkYuAHF8w/default.jpg","False","False","YouTube's top performers in the past couple of years have had a very intriguing common feature - they are faceless. Whether it's Dream, Corpse Husband, the VTuber community, and many more - it seems like keeping the mystery and protecting their privacy has been a priority. In this video we take a look at this relatively new trend that seems to be gaining popularity. ------------------------------SOURCES:Teen trust youtubers more than their own family:https://mediakix.com/blog/percent-children-becoming-a-youtuber/1956 study on parasocial relationships:http://visual-memory.co.uk/daniel/Documents/short/horton_and_wohl_1956.htmlStalker goes to youtuber’s home:https://www.bbc.com/news/uk-england-merseyside-46986529The Verge: “YouTubers are not your friends”https://www.theverge.com/2018/9/17/17832948/youtube-youtubers-influencer-creator-fans-subscribers-friends-celebrities------------------------------CREDITS:Andrei Terbea - Lead AnimatorStefan Popa - Assistant Animatorhttps://www.instagram.com/jtefe.ro/Nicoleta Toader - Producer------------------------------MUSIC:Background track:  Delusional (Instrumental) by Spring GangOutro song: Joakim Karud - Loudness & Clarityhttp://youtube.com/joakimkarud------------------------------#Faceless #CorpseHusband #VTuber"
"GxSfVHKZ-BQ","If your Android apps keep crashing / closing here is how to fix your phone","2021-03-23T02:09:15Z","UCu-NRUdNtfcjdGA5Abt3JUw","Mr. Sujano","20","21.24.03","videogames|video games|esports|retro gaming|retro|Mr. Sujano|Sujano|Tech|gaming news|game reviews|tech news|news|technology|technology news|tech review|technology review|android|android 10 fix|android 11 fix|android fix|android crash fix|android apps crashing fix|android apps crashing|android apps crashing randomly|fix android phone|fix android apps|android apps closing by themselves|android apps closing automatically|android apps closing|games|gaming","211565","13758","213","6558","https://i.ytimg.com/vi/GxSfVHKZ-BQ/default.jpg","False","False","Hey all! If you android apps are crashing on your phone, hopefully this video will help you fix it! The whole issues seems to have been caused by Android System WebView.*If you're having trouble locating it, just click on this link, open it with the Play Store and you should be good to go*https://play.google.com/store/apps/details?id=com.google.android.webview---My recommended VPNs (Mr. Sujano affiliate discounts - more than 70% off):Easy to use and inexpensive - SurfShark: https://bit.ly/2WI0AGgFast and great for power users - PIA:https://bit.ly/3pfzzq6Follow me on:Twitter: https://twitter.com/MrSujanoInstagram: https://www.instagram.com/MrSujano/Discord: https://discord.gg/nPeqU6FTwitch: https://twitch.tv/Mr_SujanoWebsite: https://mrsujano.comCheck out my recommended products on Amazon: https://amzn.to/2UXstsIDISCLAIMER: This video and description contain affiliate links, which means if you click on one of the product links, I’ll receive a small commission at no extra cost to you!This video is for entertainment purposes only.#AndoirdCrash #FixAndroid #AndroidFix #AndroidTips"
"Bzd1QygKYok","I Made This Video 2 Years Ago","2021-03-22T16:32:37Z","UCgAyQyy6x3L-tmM1GICelGA","TommyOutit","20","21.24.03","Tommyinnit|minecraft|mine craft|funny|minecraft funny|2 years|hi me in 5 years|mrbeast|dream|dream minecraft|minecraft manhunt|minecraft speedrunner vs hunter|minecraft speedrunner|minecraft speedrun|minecraft challenge|challenge|the funniest minecraft video|real life|I Made This Video 2 Years Ago","2224609","291116","2291","18370","https://i.ytimg.com/vi/Bzd1QygKYok/default.jpg","False","False","I filmed this video 2 years agoFollow my Twitter - @tommyinnitFollow my Instagram - @tommyinnittThis is my Second Channel where I post extra content & videos that I love making but wouldn't be as awesome, cool or funny on the TommyInnit channel! There is still some Dream SMP Minecraft & some of The Funniest Minecraft Videos Ever... and even some vlogs like the time I met Wilbur Soot in real life... it is awesome & I have lots of laughs! I am not crazy"
"AkqHwLedfuU","WE'RE BACK!!! | life updates + açai bowls yum | Sophia and Cinzia","2021-03-22T18:47:47Z","UC7GWUjyrgun5hE-EGI0MBKA","Sophia and Cinzia","1","21.24.03","[none]","183350","9505","130","730","https://i.ytimg.com/vi/AkqHwLedfuU/default.jpg","False","False","https://www.instagram.com/sophiatuxfordhttps://www.instagram.com/cinziabayliszulloHis Loss apparel collection out now! https://thegirlsbathroom.com/collections/his-lossWe have a podcast!https://www.instagram.com/thegirlsbathroomListen here: iTunes: https://podcasts.apple.com/gb/podcast/the-girls-bathroom/id1461748146Spotify: https://open.spotify.com/show/5RVJabFxj8BInR9wkspD87Acast: https://play.acast.com/s/thegirlsbathroomShop our apparel store here: https://thegirlsbathroom.comSign-up to our newsletter and be first to hear all the news, discounts, product and podcast updates from The Girls Bathroom: https://myshopify.us6.list-manage.com/subscribe?u=bad3e625081cf1c22f709b508&id=70a2e79464We’re going on tour!Buy tickets here: https://thegirlsbathroom.com/pages/tour-dates"
"gyCFLKf67P0","Henry Cavill Reveals How He Really Feels About The Snyder Cut","2021-03-23T22:00:07Z","UCP1iRaFlS5EYjJBryFV9JPw","Looper","24","21.24.03","looper|henry cavill|snyder cut|justice league|superman","578439","13412","318","1230","https://i.ytimg.com/vi/gyCFLKf67P0/default.jpg","False","False","Director Zack Snyder's 4-hour long cut of Justice League has finally seen the light of earth's yellow sun. When Snyder had to step away from the DC Extended Universe's all star team-up in 2016 after a tragedy in his family, Warner Bros. enlisted Avengers writer-director Joss Whedon to finish the film. Whedon's version of Justice League was not well received on release. It was panned critically and bombed at the box office. The reputation of Whedon himself has also soured among the eyes of many amid accusations that his Justice League reshoot set was, in the words of Cyborg actor Ray Fisher, gross, abusive, unprofessional, and completely unacceptable.Fans rallied for Warner Bros. to Release The Snyder Cut — a once far-fetched wish that's finally come true on HBO Max.Most of the main Justice League stars were quick to come out in favor of the Snyder Cut, including Jason Momoa , Ben Affleck, Gal Gadot , and Ray Fisher. But Henry Cavill , who first played Superman in Snyder's 2013 film, Man of Steel, had mostly stayed silent on the subject of the Snyder Cut — until now.In a March 18, 2021 Instagram post, Henry Cavill congratulated Zack Snyder on the fulfilment of his vision for the DC Extended Universe. The star wrote,Here's to you Zack. Congratulations! I know this has been an arduous journey for you, you kept fighting, though. I couldn't be happier to see your vision for Justice League realised. And what a movie it is! Cavill knows a lot about fighting to see something get made; he was originally cast in a Superman movie back in 2004 that was set to be directed by the filmmaker McG , and even got as close as having a fitting for Superman's iconic cape. But when Bryan Singer took over the project for what ultimately became Superman Returns, he cast Brandon Routh in the role. Cavill also used the HopeNeverDies hashtag, in reference to his character's slogan in promotion for the film. Superman's logo, in some versions of comics lore, isn't a big S; it's actually the Kryptonian symbol for hope. Superman explains the symbol to Lois Lane in Man of Steel, and further elaborates in the Whedon cut of Justice League that it takes its shape from a river.When asked about the Snyder Cut previously, Henry Cavill has played somewhat coy. When asked by entertainment reporter Jake Hamilton why he had remained silent while the rest of the cast joined the call for the Snyder Cut, Cavill said he declined to speak for a decidedly unserious reason. He said,I miss my mustache — which is the most important thing. And for me, it was just a harrowing reminder that I didn't have it anymore. And so I just didn't want to dig that wound any deeper. Cavill grew the 'stache for Mission: Impossible — Fallout and was legally prevented from being allowed to shave it off during the Justice League reshoots.The result, as many know, was that producers spent millions digitally removing the mustache from every frame of Superman's screen time. The final effect flew Supes right into the uncanny valley for many viewers, so you'd think Cavill would at least be happy to finally have his real face in the spotlight in Zack Snyder's Justice League.Producers at DC and Warner Bros. are currently maintaining that the Snyder Cut is not canon in the DCEU, so Clark Kent's fate hasn't really changed between now and 2017. But the critical acclaim being thrown at Zack Snyder's Justice League may change that.As columnist Owen Gleiberman wrote in his review of the film for Variety, Zack Snyder's Justice League is the movie that shows us, at last, what the DCEU could be ... Now that that's happened, to leave Snyder by the wayside seems not merely unjust; it strikes me as foolhardy. In other words, some critics think that Warner Bros. should think twice about ignoring the fanbase to which they just capitulated. Henry Cavill has expressed interest in returning to the role. As he told Men's Health in 2019,The cape is in the closet. It's still mine. #HenryCavill #SnyderCut #JusticeLeagueRead Full Article: https://www.looper.com/361768/henry-cavill-reveals-how-he-really-feels-about-the-snyder-cut/"
"H-S7UraWYFg","WE FOUND ROMELLO'S FIRST CAR!","2021-03-23T19:36:38Z","UCrWSKaQ0YVig9wMpORO3nSQ","Meet The Greers","22","21.24.03","meet the greers|tekkerz kid|family|Romello|birthday|new car|shopping|surprise|family vloggers","59937","5687","51","0","https://i.ytimg.com/vi/H-S7UraWYFg/default.jpg","True","False","SUBSCRIBE - http://bit.ly/Sub2GREERS​​​​  Dad Life https://youtube.com/channel/UCel2oB8kfgYuFKroxfNcqzwMum Life https://youtube.com/channel/UCD7IHhIWE-8EhAbuNjf0r9w📷INSTAGRAM - http://bit.ly/GreersInstagram​​​​📷Mum - https://www.instagram.com/motherof6yo​​​​...📷Dad - https://www.instagram.com/thedadoffic​​​​...📷Romello - https://www.instagram.com/its_romello...​📷Lorenzo -  https://www.instagram.com/tekkerzkid/​​​​📷Twins - https://www.instagram.com/sienna_and_​​​​...📷Thiago - https://www.instagram.com/babythiagoh​​​​...📷Marcelo - https://www.instagram.com/babymarcelo​​​​...#meetthegreers​​​​ #mtgfam​​​​ *****Follow us*****Follow us on Twitter - https://twitter.com/Meetthegreers​​​​------------------------------------------Greers Postal address Meet The GreersPO Box 18069BIRMINGHAM B42 9NQ------------------------------------------The Greer is a family of 8 from Birmingham, England. Family members include Nathan (The Dad), Tara (The Mum), Romello, Lorenzo (Tekkerz Kid), Sienna & Sariah (The Twins), Thiago and baby Marcelo We make  morning routine funny family challenge videos, house vlogsmeet the greers, tekkerz kid, family channel, family vloggers, funny, vlog, happy, family"
"00LvTCyvydU","Who Will Chris Evans Text First, Anthony Mackie or Sebastian Stan? - Stir Crazy with Josh Horowitz","2021-03-23T16:00:19Z","UCUsN5ZwHx2kILm84-jPDeXw","Comedy Central","23","21.24.03","comedy central|comedy central originals|josh horowitz|stir crazy|sebastian stan|anthony mackie|sebastian stan anthony mackie interview|the falcon and the winter soldier|marvel|mcu|sam wilson|falcon|bucky|bucky barnes|winter soldier|chris evans|captain america|would you rather|comedy|very funny|funny|funny video|funny videos|web series|comedian|comedians|coronavirus|covid 19|quarantine|quarantine games|zoom|video chat|interview","209380","20654","57","804","https://i.ytimg.com/vi/00LvTCyvydU/default.jpg","False","False","Anthony Mackie and Sebastian Stan see who can get a text back from Chris Evans first, try to identify Marvel actors by their butts, and play Would You Rather. 00:00 Anthony Mackie and Sebastian Stan join Josh for a new Stir Crazy00:38 What is Anthony and Sebastian's preferred combined nickname? 01:18 Who is the better friend of Chris Evans? The two test it out by texting him at the same time to see who he replies to first 02:00 Josh has the guys guess whose butt is whose in a picture game called Avengers Ass-emble 3:21 Chris Evans texts back 04:59 Anthony and Sebastian are asked to answer which of them are better at certain things and tests their acting abilities09:17 Josh asks Anthony and Sebastian some tough Would You Rather... questions Subscribe to Comedy Central: https://www.youtube.com/channel/UCUsN5ZwHx2kILm84-jPDeXw?sub_confirmation=1Watch more Comedy Central: https://www.youtube.com/comedycentral Follow Comedy Central: Twitter: https://twitter.com/ComedyCentral Facebook: https://www.facebook.com/ComedyCentral Instagram: https://www.instagram.com/comedycentral Watch full episodes of Comedy Central shows: http://www.cc.com/shows #Anthony Mackie #SebastianStan #StirCrazy"
"ppoNaTbjuts","OnePlus Watch - Smart Everywear","2021-03-23T19:00:15Z","UC7zygr3uEiMSkxv-6nbFUGQ","OnePlus","28","21.24.03","smartwatch|smart|watch|wearOS|apple watch|wearables|oneplus|RTos|android|oneplus 9 series|strap|sports|style|luxury|sp02|ip68|water|dust|resistant|blood oxygen saturation tracking|durable","545200","15705","368","840","https://i.ytimg.com/vi/ppoNaTbjuts/default.jpg","False","False","Working or working out, the #OnePlusWatch is Smart Everywear. Warp Charge for up to 14 days battery life. Sleep smarter with blood oxygen saturation tracking. Take calls on the go. And with an IP68 rating and dust resistance, it's as durable as it is smart.Stay synced in style - https://www.oneplus.com/oneplus-watchFollow us on social media for all the latest OnePlus news:Facebook - https://facebook.com/oneplus​​ Twitter - https://twitter.com/oneplus​​ Instagram - https://instagram.com/oneplus​​ LinkedIn - https://www.linkedin.com/company/oneplus"
"zhQAFpgRK0E","My 4th Nose Job Surgery Story! Nikita Dragun","2021-03-23T22:00:10Z","UCNBvzAJI3N92Sgl0guRxSxQ","Nikita Dragun","26","21.24.03","Rhinoplasty|nikita dragun|nikita dragun youtube|youtube nikita dragun|get ready with me|vlog|nose job|plastic surgery|rhinoplasty recovery|nose job recovery|before and after|cosmetic surgery before and after|nose shape|5 min nose job|facial surgery|reconstructive surgery|facial plastic surgery|beverly hills doctor|self actualization|personal growth|beauty|health vlog|self esteem|self love|Dragun Beauty|nikita dragun fan cam|trans|transgender|surgery","210813","19656","418","1369","https://i.ytimg.com/vi/zhQAFpgRK0E/default.jpg","False","False","hi draguns! yes... i got another nose job. this video is for educational purposes only. my nose has always been my biggest insecurity. join me as i take u along for my 4th rhinoplasty in my surgery and throughout my entire recovery. u will see everything... and i mean EVERYTHING. shoutout to my doctor for such a wonderful experience! omg if ur still reading this comment monkey balls hahaha love u. happy # TRANSformation Tuesday wow its been a long time since i've said that. XO DRAGUN Subscribe: http://bit.ly/SubNikitaDragun Shop Dragun Beauty: https://dragunbeauty.com/Watch my newest videos: https://bit.ly/3dXY4FQFollow Nikita Dragun:Instagram: https://instagram.com/nikita_dragun Twitter: https://twitter.com/NikitaDragun Facebook: https://facebook.com/IamNikitaDragun Snapchat: https://snapchat.com/add/mamadragun TikTok: https://tiktok.com/@nikitadragunWatch more Nikita Dragun:TRANSformation: https://youtube.com/playlist?list=PLvT-iqEmrxDJPOfdPCGdFeszTXFObsjfk&playnext=1 About Nikita Dragun:Welcome to the official Nikita Dragun YouTube channel! It’s your Mother Dragun here to share my life with all of you. Some things you can find me doing on this channel are personal stories about my transition, collabs with some of my best friends, makeup tutorials, story time videos, vlogs, lgbt related content, and SO much more! Don’t forget to subscribe and enable all push notifications so you never miss a moment of my life!#NikitaDragun #Rhinoplasty #CosmeticSurgery"
"cWorBYFkkfk","SML Movie: Jeffy!","2021-03-22T21:17:43Z","UCnSWkrRWNQWNhDusoWr_HXQ","SML","24","21.24.03","supermariologan|sml|movie|jeffy|jeffry|jeff|funny|jokes|logan|puppet|marvin|babysitter|show|hilarious|joke|comedy|skit|entertainment|friends|lance|rose|superluigilogan|sll|superbowserlogan|sbl","1522920","91917","2010","33866","https://i.ytimg.com/vi/cWorBYFkkfk/default.jpg","False","False","Jeffy shows up for the first time!We are remaking all of our old SML videos with our own characters.Please subscribe for more SML content!http://www.smlmerch.com"
"8MDSn9fwkw4","George And James Take GCSE Maths Exam","2021-03-23T18:20:23Z","UCPvPrcWhqR0IN2WLpCbd95A","GeorgeM","23","21.24.03","taking gcse paper|taking gcse maths paper|james marriott|memeulous|gcse maths|gcse","135908","16794","95","1914","https://i.ytimg.com/vi/8MDSn9fwkw4/default.jpg","False","False","George Memeulous and James Marriott take a GCSE maths paperJames: @James Marriott Subscribe to my main channel!: https://www.youtube.com/user/memeulousMerch: http://www.memeulous.shop/Twitter: https://twitter.com/memeulousInstagram: https://www.instagram.com/memeulousBusiness/media enquiries: george@memeulous.com"
"LsV2GWlGh-o","Hopsin - Alone With Me","2021-03-22T16:00:13Z","UCvlJkDfgfG3J38pup6lvrPg","Hopsintv","10","21.24.03","Hopsin|Alone with Me|Undercover Prodigy|Rap|hiphop|independent|#hopsin|#alonewithme|#undercoverprodigy","1194801","165550","481","16906","https://i.ytimg.com/vi/LsV2GWlGh-o/default.jpg","False","False","Hopsin's new single ALONE WITH ME available everywhere: https://ffm.to/-alonewithmeFollow Hopsin:Facebook: http://www.facebook.com/hellohopsinInstagram: @hopsinTwitter: @hopsinWebsite: http://www.undercoverprodigy.com"
"JxuHH3jTI8M","Jim is the Worst Roommate  - The Office US","2021-03-23T17:00:07Z","UCa90xqK2odw1KV5wHU9WRhg","The Office","24","21.24.03","the office|the office full episodes|rainn wilson|john krasinski|steve carell|michael scott|the office fire drill|jim and dwight pranks|dwight schrute|jim halpert|jenna fischer|the office thug life|the office funniest moments|the office bloopers season 1|the office cpr|the office parkour|Best The Office Moments|season 9|final season|philly|philadelphia|jim is a bad roommate|messy jim|jim the slob","404352","11866","87","745","https://i.ytimg.com/vi/JxuHH3jTI8M/default.jpg","False","False","Darryl discovers Jim is not the ideal roommate when the start renting together in Philly.From Season 9, Episode 14 Vandalism - Nellie and Dwight spring into action when Pam needs help finding the vandal who defaced her mural. Meanwhile, Darryl has a hard time dealing with Jim's habits.Streaming now on Peacock: https://www.peacocktv.com/stream-tv/the-office?cid=2101priolibraryofceownyt653&utm_campaign=2101priolibraryofce&utm_source=yt&utm_medium=own_yt_brandawareness_descriptionlink&utm_content=theofficeprelau&utm_term=peacockWatch The Office US on Google Play: http://bit.ly/2xYQkLD & iTunes http://apple.co/2eW0rcKSubscribe: http://bit.ly/2y5VK8NThis is the official YouTube channel for The Office US. Home to all of the official clips from the series, the funniest moments, pranks and fails. Think we should feature your favourite episode? Let us know in the comments! FB : https://www.facebook.com/theofficenbcTwitter : https://twitter.com/theofficenbcWebsite : http://www.nbc.com/the-office#TheOffice #USA #PeacockTV"
"WPgvCD7eC74","'I WAS UPSET FOR DILLIAN!' | Anthony Joshua on why he holds respect for Whyte after Povetkin loss","2021-03-23T14:00:17Z","UC_JQGBtA7P0RwkRxd7xpJcA","Sky Sports Boxing","17","21.24.03","sky sports boxing|sky sports boxing stream|boxing|sky sports|Anthony Joshua|Boxing|Sky Boxing|Tyson Fury|Fury|Matchroom Boxing|Alexander Povetkin|Povetkin Whyte|Alexander Povetkin vs Dillian Whyte|Povetkin vs Whyte rematch|rematch|IFL TV|Heavyweight|Andy Ruiz|Joshua|Joshua Pulev|Kubrat pulev","108984","2358","59","537","https://i.ytimg.com/vi/WPgvCD7eC74/default.jpg","False","False","►WATCH POVETKIN/WHYTE: https://bit.ly/WatchWhytePovetkin2►SUBSCRIBE http://bit.ly/SSBoxingSubAnthony Joshua discusses the upcoming rematch between Dillian Whyte and Alexander Povetkin. ►TWITTER: https://twitter.com/skysportsboxing►FACEBOOK: http://www.facebook.com/skysportsboxing►WEBSITE: http://www.skysports.com/boxingMORE FROM SKY SPORTS ON YOUTUBE:►SKY SPORTS FOOTBALL: http://bit.ly/SSFootballSub►SKY SPORTS CRICKET: https://bit.ly/SubscribeSkyCricket►SOCCER AM: http://bit.ly/SoccerAMSub►SKY SPORTS F1: http://bit.ly/SubscribeSkyF1►SKY SPORTS: http://bit.ly/SubscribeSkyF1"
"PKCGxv3XQWQ","The popular Hammersmith seal Freddie Mercury has been put down - BBC London","2021-03-23T18:02:22Z","UCBwejc-awS-mANgrkHQ5-6A","BBC London","25","21.24.03","BBC|London|News","63280","547","159","856","https://i.ytimg.com/vi/PKCGxv3XQWQ/default.jpg","False","False","The popular Hammersmith seal Freddie Mercury has been put down after being attacked by a dog. Freddie was known for his 'crowd-pleasing antics' in the Thames and many felt he lived up to his name. But after an incident involving a dog attack, Freddie was taken to South Essex Wildlife Hospital in Tilbury where he was treated for a bite on his flipper. X-rays revealed Freddie suffered a broken bone, dislocation as well as damage to his joints, ligaments and nerves, which resulted in the decision to put him down for welfare purposes. The British Divers Marine Life Rescue (BDMLR) is urging people to be careful around wildlife near the Thames.Subscribe here: https://bit.ly/2Gd18gBCheck out BBC London: http://bbc.co.uk/londonInstagram: https://www.instagram.com/bbclondonFacebook: https://www.facebook.com/bbclondonTwitter: https://twitter.com/bbclondonnews"
"MjKifhYNAQw","Did I Cheat In My Marriage? #TheTruth (Feat: Da'Naia Jackson)","2021-03-22T21:26:56Z","UCejZLYityfnYZ_2aGan-Thg","Derrick Jaxn","22","21.24.03","[none]","671591","0","0","0","https://i.ytimg.com/vi/MjKifhYNAQw/default.jpg","True","True","How did we come back from this? Read the story in my book, Heal Together Without Hurting Each Other get it here https://bit.ly/healtogetherbook"
