video_id,title,publishedAt,channelId,channelTitle,categoryId,trending_date,tags,view_count,likes,dislikes,comment_count,thumbnail_link,comments_disabled,ratings_disabled,description
"DNLv8yCIvFw","Among Us Logic: The Return of Novisor | Cartoon Animation","2021-03-20T18:00:02Z","UCToxKVrkEuAONR4rFIJ_DyQ","GameToons","1","21.24.03","among us|among us logic|animation|funny animation|cartoon animation|game toons|gametoons|cartoon|animated|among us animation|among us hacks|among us funny|kid friendly|family friendly|gt|no visor|novisor|no-visor|the legend of novisor","2108251","86952","1696","14784","https://i.ytimg.com/vi/DNLv8yCIvFw/default.jpg","False","False","► Enter now for your chance to win our Mr. Cheese Bundle! -https://newscapepro.com/pages/gametoons-giveaway► Subscribe to GameTunes! -https://www.youtube.com/channel/UCbbCaPmU-AvYQFMu6KCnyjw?sub_confirmation=1Novisor is back with a vengeance. Somehow he was able to escape the Skeld and made his way to Player, Mr. Cheese and the rest of the crewmates at MIRA HQ. No one is safe when this ghostly impostor is around...Don't forget to like, comment, subscribe and share to show your support for this channel!Follow us here for all sorts of cool stuff!► STORE: https://newscapepro.com/collections/gametoons-1  👕👚🕶► INSTAGRAM: https://www.instagram.com/gametoonsofficial/?hl=en 📸► FACEBOOK: https://www.facebook.com/GameToonsYT 📘► TIK TOK: https://www.tiktok.com/@gametoonsofficial?lang=en 🎵► TWITTER: https://twitter.com/GameToons 🐤"
"67bBqno5SCM","25 minutes of Rainbow Six Siege VIBING","2021-03-19T20:02:14Z","UC4l5F42_z5f3Wav_42g9pnA","Marley","20","21.24.03","Marley|Rainbow Six Siege|Marley youtube|Marley highlights|Best of Marley|Rainbow Six Siege montage|rainbow six siege funny moments|rainbow six siege update|cheater|one taps|trolling|dropshot|hacks|rainbow six siege memes|operation crimson heist|new operators|new skin|black ice|alpha pack|rainbow six siege tips and tricks|year 6|copper|champion|buff|nerf|update|elite skin|flores|siege|r6s|rainbow six siege gameplay|rainbow six siege best of|custard|dom|vibe","1439182","79606","753","20405","https://i.ytimg.com/vi/67bBqno5SCM/default.jpg","False","False","Thanks to Monster Legends for sponsoring! Don't miss out on the limited time Marley monster available until March 29th  - https://monsterlegends.onelink.me/X4Sc/MarleyRainbow Six Siege has just updated to Operation Crimson Heist, the star of Year 6! Could it be another year of waffling with the boys? Hitting cheater like champion one taps? Clutching on the Border rework with an ace? Or maybe looking for new black ice skins in alpha pack openings... All I know, is we'll be vibing with the new operator, Flores! And his drone looks OP!- FOLLOW ME - Twitter - https://twitter.com/MeatyMarley Twitch - https://www.twitch.tv/meatymarley Instagram - https://www.instagram.com/meatymarley  Merch - https://www.marleyclothing.com/- SUB TO THE OTHER WAFFLERS - Dom - https://www.youtube.com/channel/UCexHwo25wa-LYbVLEamy4BQ Custard - https://www.youtube.com/channel/UCQuyFROzssNZLxbis2puE4w Rub_n - https://www.youtube.com/user/benrutv Hixcap - https://www.youtube.com/channel/UC94FuhI_gP_T9muFUGuE8nQ AnthonyPit1 - https://www.youtube.com/channel/UCceTn1PVvHhxxbS0gvboBQQ- Check out the editor - Razencro - https://www.youtube.com/channel/UCXFT5spxGrX3zD0zwTJt-lQ- Thumbnail character artist - Japse - https://twitter.com/JAPSE_"
"DXGz9fBmf0c","HOW MANY RAPPERS CAN YOU NAME? - SIDEMEN CATEGORIES","2021-03-20T19:00:01Z","UCh5mLn90vUaB1PbRRx_AiaA","MoreSidemen","22","21.24.03","sidemen|moresidemen|miniminter|ksi|zerkaa|behzinga|tbjzl|vikkstar|wroetoshaw","2134889","131907","623","4430","https://i.ytimg.com/vi/DXGz9fBmf0c/default.jpg","False","False","Sub to Kon: https://www.youtube.com/channel/UChKVhjGmPAu7eWa2ITDd50w• Sidemen: http://www.youtube.com/Sidemen• Sidemen Clothing: http://www.sidemenclothing.com• Sidemen Twitter: https://twitter.com/SidemenSidemen:• Miniminter: http://www.youtube.com/Miniminter• Zerkaa: http://www.youtube.com/Zerkaa• Behzinga: http://www.youtube.com/Behzinga• Vikkstar123: http://www.youtube.com/Vikkstar123• TBJZL: http://www.youtube.com/TBJZL• Wroetoshaw: http://www.youtube.com/Wroetoshaw• KSI: http://www.youtube.com/KSIedited by https://twitter.com/TegsRF"
"6xT2abOB1yw","What was that...? (Derek Brunson vs Kevin Holland)","2021-03-21T08:22:07Z","UCZD2qRU8J82XGdGdUWYneNQ","TheWeasle","17","21.24.03","ufc|derek brunson|kevin holland|derek brunson vs kevin holland|derek brunson vs kevin holland highlights|derek brunson kevin holland|brunson vs holland|kevin holland vs derek brunson|kevin holland highlights|derek brunson highlights|derek brunson vs kevin holland full fight|derek brunson vs kevin holland breakdown|derek brunson interview|kevin holland interview|kevin holland knockout|derek brunson knockout","309965","5442","312","2053","https://i.ytimg.com/vi/6xT2abOB1yw/default.jpg","False","False","Kevin Holland vs Derek Brunson was a strange fight where Brunson adapted, showed his fight IQ, and wrestled his way to another victory. Holland was overzealous and looked to talk and play rather than focus on finding a way to beat the veteran. Let's break this down...___________________________________________________________________________MERCH: teespring.com/stores/theweasle-store-2Feel free to help out the channel with more content: https://www.patreon.com/theweasleFollow me:https://twitter.com/ThaWeaslehttps://www.instagram.com/weaslemma/Music:Depo On Da BeatMigos x Tyga Type Beat - Cartelhttps://www.youtube.com/watch?v=sK8IMZ7kFE"
"faz0JeBB41M","James Bond vs Nan Starring Catherine Tate | Comic Relief: Red Nose Day 2021","2021-03-19T21:38:39Z","UCdF5u0ggeSETozc8fsprjcw","Comic Relief: Red Nose Day","23","21.24.03","comic relief|red nose day|comedy|funny|sport relief|sport relief 2020|sr20|sports relief|sports relief 2020|sport|comedy sketch|james bond|daniel craig|catherine tate|funny clip|red nose day 2021|comic relief 2021|nan","349011","4563","427","386","https://i.ytimg.com/vi/faz0JeBB41M/default.jpg","False","False","James Bond joins a call to talk with M but is surprised to stumble across Nan (Catherine Tate), who is cleaning the office.Visit Us ► http://comicrelief.comDonate ► https://comicrelief.com/donateInstagram ► https://instagram.com/comicreliefTwitter ► https://twitter.com/comicreliefFacebook ► https://facebook.com/comicrelief-------------------------------------------Our mission is to drive positive change through the power of entertainment.© Comic Relief 2021. Comic Relief registered charity 326568 (England/Wales); SC039730 (Scotland)#RedNoseDay #JamesBond #CatherineTate"
"5Hr-qH3irqs","Gifting My Fans THE BATTLEPASS If They Can Float Me...","2021-03-19T21:36:09Z","UCL7AbokeoHUuy6IU6pcCUGw","Ryft","20","21.24.03","Fortnite|Creative|FortniteFastestEditor|Floating My Fans|Fortnite Season 6 Battlepass|Fortnite Battlepass","1271396","42337","846","4646","https://i.ytimg.com/vi/5Hr-qH3irqs/default.jpg","False","False","Gifting My Fans THE BATTLEPASS If They Can Float Me...Today I gifted my fans the new Fortnite Season 6 battle pass if they were able to float me. I also challenged them to other editing and floating competitions to give them another chance at getting the battlepass!This video is similar to Trying My Fans Impossible Edit Courses and Editing so fast I start floatingJoin my Discord: https://discord.gg/ryftSubscribe and hit that notification bell 🔔 to be notified whenever I upload!Creator Code: Ryft (ad)My SocialsMy Twitch: https://www.twitch.tv/notryftMy Instagram: https://www.instagram.com/NotRyft/My Twitter: https://twitter.com/NotRyftBusiness: ryft@upnorthmgmt.co"
"mThBGaXpj4U","JAMAICAN MUM RATES MY INAPPROPRIATE OUTFITS !!","2021-03-20T18:00:15Z","UCmcdVC2xKz_yVDSfahITZcQ","Teeshanece","22","21.24.03","[none]","63578","6140","45","452","https://i.ytimg.com/vi/mThBGaXpj4U/default.jpg","False","False",""
"qtDz733a9k4","4 Food Challenges in 4 Countries in 1 day (Pain)","2021-03-20T13:00:13Z","UCcjx6m03fZwtRBFn1Cf7kKQ","The Zac and Jay Show","24","21.24.03","Zac and Jay|the Zac and Jay show|Zac Alsop|Jamie Rawsthorne|Zack and jay|zac and jay food challenge|man vs food|beard vs food|4 food challenges 1 day|hardest food challenge|eating challenge|eating competition|eating challenge world record|hot wings challenge|huge ice cream challenge|biggest burger challenge|burger eating challenge|spiciest wings in the world|crazy food challenge|worst food challenges","145797","11125","98","1084","https://i.ytimg.com/vi/qtDz733a9k4/default.jpg","False","False","Get Surfshark VPN at https://Surfshark.deals/zacandjay and enter promo code ZACANDJAY for 83% off and 3 extra months for free!Link to the TV show Pants on fire: https://www.channel4.com/programmes/pants-on-fireFollow us on Instagram - https://www.instagram.com/zacandjay/ Zac - https://www.instagram.com/zacalsop/Jamie - https://www.instagram.com/jamie_rawsthorne/Follow us on Twitter:Zac:  https://twitter.com/zacalsopp/ Jamie: https://twitter.com/jamierawsthorneMUSIC:https://soundcloud.app.goo.gl/3brpVX6wc51Tiodi9"
"6FHT872hT3I","Fortnite Season 6 Except I Can Only FISH (overpowered)","2021-03-20T17:03:05Z","UC3yHtryql8S7y2jukpFsZSg","Tomato - Fortnite","20","21.24.03","fortnite|fortnite season 6|fortnite fishing only|fortnite except i can only fish|tomato fortnite|funny fortnite|fortnite fish loot only","615774","19562","403","868","https://i.ytimg.com/vi/6FHT872hT3I/default.jpg","False","False","Fortnite Season 6 Except I Can Only FISH (overpowered)Like last season, I decided to play Fortnite while only being allowed to use loot I get from fishing. There are tons of new fish and items you can get now, so let's see if I can get a win (probably not) but let's see anywayUse code tomato because its cool! (epic partner)Music from epidemicsound"
"pclIHCtplxg","Welbeck scores screamer in Brighton rout | Brighton 3-0 Newcastle | Premier League Highlights","2021-03-20T22:22:18Z","UCNAf1k0yIjyGu3k9BwAg3lg","Sky Sports Football","17","21.24.03","sky sports|premier league|Football League|football|Sky Sports live|Sky|Sports|stream|sky sports football|premier league highlights|epl highlights 1920|premier league goals|premier league highlights today|brighton|brighton 3-0 newcastle|brighton vs newcastle|brighton highlights|newcastle highlights|trossard|welbeck|welbeck goal|best premier league goals","554017","9978","162","1448","https://i.ytimg.com/vi/pclIHCtplxg/default.jpg","False","False","SUBSCRIBE ► http://bit.ly/SSFootballSubPREMIER LEAGUE HIGHLIGHTS ► http://bit.ly/SkySportsPLHighlights2021Highlights from the Premier League as Brighton put in an impressive performance to beat Newcastle 3-0 through goals from Leandro Trossard, Danny Welbeck and Neal Maupay.Watch Premier League LIVE on Sky Sports here ► http://bit.ly/WatchSkyPL►TWITTER: https://twitter.com/skysportsfootball►FACEBOOK: http://www.facebook.com/skysports►WEBSITE: http://www.skysports.com/footballMORE FROM SKY SPORTS ON YOUTUBE:►SKY SPORTS FOOTBALL: http://bit.ly/SSFootballSub►SKY SPORTS BOXING: http://bit.ly/SSBoxingSub►SKY SPORTS CRICKET: http://bit.ly/SubscribeSkyCricket►SOCCER AM: http://bit.ly/SoccerAMSub►SKY SPORTS F1: http://bit.ly/SubscribeSkyF1►SKY SPORTS: http://bit.ly/SkySportsSub►SKY SPORTS GOLF: https://bit.ly/SubscribeSkySportsGolf"
"tQ0yjYUFKAE","Justin Bieber - Peaches ft. Daniel Caesar, Giveon","2021-03-19T04:00:15Z","UCHkj014U2CQ2Nv0UZeYpE_A","JustinBieberVEVO","10","21.24.03","Justin|Bieber|Peaches|Def|Jam|Recordings|Pop","29709764","1515141","35391","75695","https://i.ytimg.com/vi/tQ0yjYUFKAE/default.jpg","False","False","Justice the album out now: https://justinbieber.lnk.to/Justice Shop Justice merch: https://JustinBieber.lnk.to/OfficialShop Listen to Holy, Lonely, Anyone, & Hold On here: https://JustinBieber.lnk.to/OutNow Follow Justin: http://facebook.com/justinbieberhttp://twitter.com/justinbieberhttp://instagram.com/justinbieberSign up for Justin’s newsletter: http://justinbiebermusic.com #Peaches #Justice #JustinBieber"
"jJuWiYrsEQE","OnePlus 9 Series - Launch Event Trailer 2","2021-03-23T11:28:03Z","UC7zygr3uEiMSkxv-6nbFUGQ","OnePlus","28","21.24.03","[none]","140109","4519","130","287","https://i.ytimg.com/vi/jJuWiYrsEQE/default.jpg","False","False","Want to take #YourBestShot​? Tune in TODAY at 10 AM EDT / 2 PM GMT / 7:30 PM IST for the unveiling the #OnePlus9Series​, the fastest and smoothest flagship of 2021.Learn more - https://onepl.us/9SeriesYT​Follow us on social media for all the latest OnePlus news: Facebook - https://facebook.com/oneplus​ Twitter - https://twitter.com/oneplus​ Instagram - https://instagram.com/oneplus​ LinkedIn - https://www.linkedin.com/company/oneplus"
"VrKW58MS12g","Glitterbomb Trap Catches Phone Scammer (who gets arrested)","2021-03-18T18:49:50Z","UCY1kMZp36IQSyNx_9h4mpCg","Mark Rober","28","21.24.03","[none]","25449005","1487119","12028","79306","https://i.ytimg.com/vi/VrKW58MS12g/default.jpg","False","False","I glitterbombed my way up the scammer chain of command.  Come join me in my Creative Engineering class!! https://Monthly.com/MarkRoberIf you suspect that you or a loved one has been the victim of fraud, you can call or visit the National Elder Fraud hotline (https://stopelderfraud.ovc.ojp.gov/)  at 833-372-8311 and report it to the FTC by visiting the agency’s website (https://reportfraud.ftc.gov/#/) or calling 877-382-4357.Go watch Jim’s video to see how he located the scammers and subscribe to his channel- https://youtu.be/Xvjjpzyiig4Go sub to Perogi with Scammer Payback too- https://youtube.com/c/ScammerPaybackNew music this time from the talented Laura Shigihara- https://open.spotify.com/track/1zOzvy6SeVJs2MEET7vyCW?si=f3fee98828fa4802"
"dHTJkKMYDCE","I Deepfaked My Videos And Nobody Realised (Ft. Tommyinnit)","2021-03-18T20:00:05Z","UCaFUrR3oSxOl5Y9y6tvLTEg","WillNE","23","21.24.03","willne|willne deepfake|I Deepfaked My Videos And Nobody Realised|willne tommyinnit|will ne","1969763","229147","1946","6071","https://i.ytimg.com/vi/dHTJkKMYDCE/default.jpg","False","False","i deepfaked my videos and nobody realised... Mr Carlin:  @Ciarán Carlin  Jimbo: @James Marriott  Young King Thomas: @TommyInnit I've nabbed this idea from @CNET, check theirs out here:https://www.youtube.com/watch?v=b-VCzLiyFxcMy Second Channel: https://www.youtube.com/user/willlenneyMy TikTok: https://vm.tiktok.com/XHeVBq/MY REDDIT: https://www.reddit.com/r/WillNE/My Twitter: https://twitter.com/willneMy Facebook: https://www.facebook.com/WillNEYTMy Instagram: https://www.instagram.com/willne"
"fjrV08X-Xg8","FC Koln vs Borussia Dortmund (2-2) | Haaland Storms Down Tunnel At FT! | Bundesliga Highlights","2021-03-20T18:30:56Z","UC4i_9WvfPRTuRWEaWyfKuFw","BT Sport","17","21.24.03","Bundesliga|Football|Soccer|Borussia Dortmund|Dortmund|Dortmund 2-2 Koln|Dortmund 2-2 Cologne|Borussia Dortmund 2-2 Koln|BTSport","547224","7855","96","1110","https://i.ytimg.com/vi/fjrV08X-Xg8/default.jpg","False","False","Erling Haaland scored both of Borussia Dortmund's goals in a 2-2 draw in Cologne but was visibly frustrated with the result at full-time.Hit 'Subscribe' above to ensure you never miss a video from the BT Sport YouTube channel.Get a BT Sport Monthly Pass now! - http://bit.ly/BTSportMonthlyPass​ Visit and subscribe to our 'BT Sport Boxing' YouTube channel ➡️ http://www.youtube.com/c/btsportboxing​Twitter: http://twitter.com/btsport​Facebook: http://www.facebook.com/btsport​Instagram:http://instagram.com/btsport​Website: http://sport.bt.com"
"GteqbsYGv1I","BHAD BHABIE - Breaking Code Silence - Turn About Ranch abuse Dr. Phil | Danielle Bregoli","2021-03-19T18:23:59Z","UC7rVvFP90pl7tAtPsVIhfww","Bhad Bhabie","10","21.24.03","danielle bregoli|Bhad Bhabie|Dr Phil|Turn about ranch|Tti|Troubled teen industry|Child abuse|Murder|Breaking code silence","3705058","241612","9831","19029","https://i.ytimg.com/vi/GteqbsYGv1I/default.jpg","False","False","#BreakingCode Silence FOR MORE INFO CHECK OUT - https://www.breakingcodesilence.nethttps://www.cbsnews.com/amp/news/murder-charge-for-teen-clay-brewer-accused-of-killing-worker-jimmy-woolsey-at-utah-troubled-youth-ranch/#apphttps://www.washingtonpost.com/news/morning-mix/wp/2016/12/08/tragedy-at-turn-about-ranch-a-teen-came-for-rehab-then-killed-a-staffer-to-escape-police-say/https://www.complex.com/music/bhad-bhabie-says-utah-treatment-center-left-her-abused-malnourishedhttps://www.buzzfeednews.com/article/scaachikoul/dr-phil-mcgraw-mental-health-danielle-bregolihttps://www.sltrib.com/news/2018/12/07/lawsuit-claims-utah-rehab/https://www.fox13now.com/news/local-news/lawsuit-against-turn-about-ranch-in-escalante-alleges-repeated-sexual-abusehttps://www.courthousenews.com/torture-alleged-at-utah-treatment-center/"
"kjsSjqTde48","3 Sud Est & Andra - Jumatatea Mea Mai Buna (Official Video)","2021-03-19T07:00:26Z","UC-j_qmx-JdJWjwVIetg1vHQ","Andra","10","21.24.03","andra|3 sud est|jumatatea mea mai buna|andra 2021|3 sud est 2021|andra vina mea|andra maruta|andra barcelona|andra camarero|andra iubirea schimba tot|sudamericana|nu doar de ziua mea|intre noi nu mai e nimic|supereroi|niciodata sa nu spui niciodata|la refren|floare de nu ma uita|inevitabil va fi bine|mi-ai luat mintile|asa e dragostea","4784197","109650","2092","6111","https://i.ytimg.com/vi/kjsSjqTde48/default.jpg","False","False","3 Sud Est & Andra - Jumatatea Mea Mai Buna (Official Video)🎵 Descarca sau asculta ”Jumatatea Mea Mai Buna”: https://li.sten.to/0uIqJB0🔔 Aboneaza-te la canal: https://goo.gl/IMGbE8🔥 Andra Online:Instagram: https://www.instagram.com/andraFacebook: https://www.facebook.com/AndraMusicTikTok: https://www.tiktok.com/@andramaruta🎤 Pentru concerte Andra: office@andramusic.rotucu@andramusic.ro Alexandru Tucu: 0774 477 662🔥 3 Sud Est Online:Instagram: https://www.instagram.com/3sudest_officialFacebook: https://www.facebook.com/3seofficialYouTube: https://www.youtube.com/c/3SUDEST🎤 Pentru concerte 3 Sud Est: office@1artistmusic.comconcerte@3se.ro Rolando Vasilescu: 0721 496 090Muzica: Laurentiu DutaVersuri: Laurentiu Duta, Viorel Sipos, Mihai BudeanuProductie muzicala & Mix & Master: Laurentiu DutaChitara: Daris MangalSaxofon: Cosmin BasasteanuVideo by NGMcreativeRegie: Bogdan PaunImagine: Paul TatcuCoregrafie: Dan ChiriacProductie: Luca’S ArtLocatie: Le Château (https://www.le-chateau.ro)(C) & (P) 2021 Andra Records, Cat Music, Media Pro Music & 1Artist Music-------------------------------------------------------------------------------------Versuri:Esti o bucata cazuta din rai,Esti o minune, doar tu poti sa-mi dai, Din lumea ta o parte,Sapte zile din sapte.Rochie alba, sangria-n pahar,Gura ta dulce ispita mi-e iar.Ochii diamante,Tu ma ghidezi in noapte.Ia-ma-n brate flamande,Lipeste ma de inima ta.Fericire-n secunde,Opreste timpul, nu mai pleca.Refren:Cand nori pe cerul vietii se aduna, hoooo,Ma las in grija ta,Jumatatea mea mai buna.Si-n noptile reci cu luna plina, heeei, Ma-mbraci cu dragostea,Jumatatea mea mai buna.Am lasat in urma noastra orasul gol.Ne-am inchis in lumea noastra in dormitor,Siluete la fereastra intr-un dans nocturn,Tu esti noaptea mea albastra,Esti tot ce am mai bun.Ia-ma-n brate flamande Lipeste ma de inima taFericire-n secundeOpreste timpul, nu mai pleca.Refren:Cand nori pe cerul vietii se aduna, hoooo,Ma las in grija ta,Jumatatea mea mai buna.Si-n noptile reci cu luna plina, heeei, Ma-mbraci cu dragostea,Jumatatea mea mai buna.Inima la tine imi zboara,Cand nu esti ard ca o tigara.Mai bine stinge-ma cu un sarut.Inima la tine imi zboara,Cand nu esti ard ca o tigara.Mai bine stinge-ma cu un sarut.Refren: Cand nori pe cerul vietii se aduna, hoooo,Ma las in grija ta,Jumatatea mea mai buna.Si-n noptile reci cu luna plina, heeei, Ma-mbraci cu dragostea,Jumatatea mea mai buna."
"BASKiB38_Gc","Virtual Pub Quiz, Live! Saturday 20th March","2021-03-20T21:43:08Z","UCLcSqjJWHJeDWD_SbdorBRw","Jay's Virtual Pub Quiz","24","21.24.03","[none]","36089","133","14","7","https://i.ytimg.com/vi/BASKiB38_Gc/default.jpg","False","False","Live stream from 7:50 and first question at 8:15 as always! Our featured charity for March is:https://www.justgiving.com/fundraising/virtualpubquizcstmOurs socials,Facebook: https://www.facebook.com/thevirtualpubquiz/ Twitter: https://twitter.com/TheVirtualPubQ1 Instagram: https://www.instagram.com/thevirtualpubquiz/ Patreon: https://www.patreon.com/thevirtualpubquizTikTok: https://www.tiktok.com/@jaysvirtualpubquizMentioned in the stream tonight:Chocolate: https://tinyurl.com/jayadventTeemill: https://jvpq.teemill.com/PrezzyBox: https://www.prezzybox.com/jaySupport from:Quiz Jockey: https://quizjockey.com/Quizmaster Biz: https://www.quizmasters.biz/The Bookhttps://www.amazon.co.uk/Jays-Virtual-Pub-Quiz-Book/dp/1913406407/Stay SafeJay"
"ueA57O7izn4","Mourinho Out Now!? @Expressions Oozing LOSES IT! | Best Of Enemies","2021-03-19T19:25:58Z","UCZDi95PJ6VmWtQAScA9Rh-w","Don Robbie","17","21.24.03","don robbie|don robbie channel|robbie lyle|man like robbie|don robbie youtube|don rob|robbie lyle aftv|aftv robbie|aftv robbie lyle|don robbie aftv|dub robbie|dub memes|robbie dub|arsenal fan tv|arsenal fan tv robbie|aftv|arsenal fans|football fans|best of enemies|robbie watch along|don robbie live|aftv live stream|aftv watchalong|robbie lyle live|premier league|don rob pod|don robbie podcast|robbie lyle podcast","196936","9640","130","955","https://i.ytimg.com/vi/ueA57O7izn4/default.jpg","False","False","Ex has to face the aftermath of losing the North London Derby & getting knocked out of the Europa League!Subscribe to Expressions: https://www.youtube.com/channel/UC-HS...​▶️ Subscribe to Don Robbie: https://bit.ly/2O2FHEM📲 Follow the Don on Instagram: https://bit.ly/2YRM9AC💬 Follow the Don on Twitter: https://bit.ly/3cHd3DD🎥 Follow the Don on TikTok: https://www.tiktok.com/@itsdonrobbie👍 Hit like for the Don on Facebook: https://bit.ly/3jn8OhG#EuropaLeague #Spurs #Football"
"Qp0Ag_epu94","Crowning RuPaul's Drag Race UK Series 2 Winner - Live Queen Reaction!","2021-03-19T20:15:03Z","UCcjoLhqu3nyOFmdqF17LeBQ","BBC Three","24","21.24.03","BBC|BBC Three|BBC3|Iplayer|Comedy|Drama|Documentary|Funny|DRUK|Ru Paul's drag race UK|series 2|winner|Lawrence Chaney|Ellie diamond|Bimini bon boulash|Tayce|live reaction|all stars|after the cameras stopped|bimini|uk hun|lip sync|snatch game|meet the queens|ruveal|reveal|live|react|reaction|fallout|rupaul's drag race uk|Charity shop sue|Charity sue|Sue|Ladeh|Shop sue|lawrence chaney reaction|lawrence chaney win","158165","5950","204","546","https://i.ytimg.com/vi/Qp0Ag_epu94/default.jpg","False","False","Watch the live reactions of  RuPaul’s Drag Race UK finalists, Ellie Diamond, Bimini Bon Boulash, Lawrence Chaney and Tayce as they find out who is the NEXT DRAG RACE UK SUPERSTAR!It’s the Grand RuVeal!  Charity Shop Sue invites the four finalists to her private screening of the finale episode. As multiple endings were recorded none of the queens know who RuPaul has chosen as his season two winner.Catch up on the full series on BBC iPlayer now: https://www.bbc.co.uk/programmes/p07kt8b4--Subscribe to BBC Three on YouTube: http://bit.ly/BBC-Three-SubscribeDid you know that we’re up to other things in other places too?Best of BBC Three: www.bbc.co.uk/bbcthreeFollow us on Social MediaTwitter: http://www.twitter.com/bbcthreeFacebook: http://www.facebook.com/bbcthreeInstagram: http://instagram.com/bbcthree"
"PHr72DM762k","Addison Rae - Obsessed (Official Music Video)","2021-03-19T04:00:16Z","UCsjVdwXJydmlSLVT2zDuwpQ","Addison Rae","22","21.24.03","Addison Rae|Obsessed|Official Music Video|Pop|Addison Rae Music|Addison Rae Obsessed|Addison Obsessed|Addison Rae Obsessed tiktok|Obsessed tiktok|Addison Rae tik tok|Addison Rae song|Addison Rae dancing|Addison Rae choreography","10695741","551603","149960","120820","https://i.ytimg.com/vi/PHr72DM762k/default.jpg","False","False","The official music video for Addison Rae – Obsessed  Stream Obsessed: https://ingroov.es/obsessed Follow Addison:Instagram: https://www.instagram.com/addisonraeeTikTok: https://www.tiktok.com/@addisonreTwitter: https://twitter.com/whoisaddisonYouTube: https://www.youtube.com/addisonrae  Directed by Diane Martel Produced by Missy GalanidaExecutive Producer: Missy Galanida and Isaac RiceDirector of Photography: Chris SoosColor & Title Design: Tim MasickEdited by: Jeremy ManevalChoreographer: Calvit HodgeAssistant Choreographer: Sara BivDirector rep: Missy Galanida/Isaac Rice Addison Rae Team: Director: Diane Martelhttps://www.instagram.com/dianemartel_/ Photographer: Marcus Cooper https://www.instagram.com/marcuscooper/ Makeup: Mary Phillipshttps://www.instagram.com/maryphillips/ Hair: Jenny Cho https://www.instagram.com/jennychohair/ Nails: Thuy Nguyen https://www.instagram.com/thuymusic/ Styling: Kyle Luu https://www.instagram.com/kyleluu/ Choreography: Calvit & Sara https://www.instagram.com/calvitjr/https://www.instagram.com/sarabivcalvitarg/ Lyrics:You turned our song down baby what for You had lit candles on the dashboard Red roses growing out of the door Wanna say something ya never said before  We were driving down sunsetYou know I like fast carsPast by where we first met Damn we made it so far Red eyes fromThe red light And that just set the mood You said you’re obsessed w me and I took a second and said me too  Im obsessed w me-e-e as much as u Said you’d die for me I’d die for me-e too If I lost you I’d still have me I can’t loseWhen you say that you’re obsessed w me, me too  I did my hair like waves on the beachThis dress so tight you can’t even speakMy heels so high you might get a nose bleedMusic’s so loud but I hear your heartbeat #Obsessed"
