video_id,title,publishedAt,channelId,channelTitle,categoryId,trending_date,tags,view_count,likes,dislikes,comment_count,thumbnail_link,comments_disabled,ratings_disabled,description
"eTSgB2YU7UM","Driver of deadly highspeed crash was on probation for former deadly crash","2021-04-26T10:43:17Z","UCDvJcb8Adv-_bOrtnRLmiDw","WFLA News Channel 8","25","21.28.04","wflatampa|wflanews|wflatampanews","269150","3667","115","2344","https://i.ytimg.com/vi/eTSgB2YU7UM/default.jpg","False","False","Driver of deadly highspeed crash was on probation for former deadly crash"
"HRiCVoyGh8c","Overworld Vs Nether ESCAPE ROOM Build Battle - Minecraft","2021-04-24T22:01:21Z","UCzMjRlKVO9XIqH_crIFpi6w","Skeppy","20","21.28.04","minecraft|mine craft|minecraft youtuber|pg|family friendly|skeppy|minecraft skeppy|no swearing|no cursing|minecraft trolling|minecraft troll|funny minecraft|minecraft mod|minecraft map|parkour|trolling|troll|roleplay|custom|challenge|glitch moments|skeppy face|try not to laugh|bedwars|skywars|hypixel|dream smp|captainpuffy|captain puffy|badboyhalo","856382","62769","581","4484","https://i.ytimg.com/vi/HRiCVoyGh8c/default.jpg","False","False","Skeppy and Captain Puffy Compete In An Escape Room Build Battle!Today I stressed out Captain Puffy LMAO in a really fun and interesting Build Battle hahah. But this time we are building AND solving our very own Escape Room's. Also we themed it! I had an Overworld theme - shut up I didn't forget guys everything is technically overworld - and Puffy's was Nether themed. Pretty easy, right? Puffy even included prizes which was honestly just the best thing ever hahaha! She totally didn't cheat by looking over the wall, by the way, I guess it's those spidey senses she was talking about it. Even Rat makes an appearance! Also like all of her questions were BadBoyHalo themed... Thanks Puffy. At least I have a voucher to make up for it. This video was so fun and funny to make so if you enjoyed please hit this video with a like :D If this gets 100k likes maybe I'll challenge another YouTuber to a fun Build Battle!! Also sub to @CaptainPuffy she is the best :DAlso! I will be uploading the BBH footage in a couple hours if you're looking for it.Follow My Twitter - @SkeppyFollow My Instagram - @SkeppyNot Minecraft, But Water Rises or Minecraft, But Lava Rises, or any other but challenge like that. This is a speed runner / survivalist in Minecraft against a killer / assassin / hitmen but it's Captain Puffy stressing out for 15 minutes LMAOSub to @Captain Puffy !!!!"
"oliX0XD0y4g","Fire Emblem Heroes - Feh Channel (Apr. 25, 2021)","2021-04-26T02:58:34Z","UCs1pApqJNPZBcPcDjEWn6MA","Nintendo Mobile","20","21.28.04","任天堂|ニンテンドー|Nintendo|Video Game (Industry)|sv_nintendo|app|iphone|android|fe|feh","119849","7070","250","0","https://i.ytimg.com/vi/oliX0XD0y4g/default.jpg","True","False","Official website: https://fire-emblem-heroes.com/#FEHeroes #FireEmblemESRB Rating: TEEN with Fantasy Violence, Suggestive Themes, Partial Nudity / In-game PurchasesRated PEGI 12 (Sexual Innuendo, Digital Purchases) USK ab 6 Jahren (Abstrakte Gewalt, Sexuelle Andeutungen, Onlinekaufe)Free-to-start; optional in-game purchases available. Persistent Internet and compatible smartphone required. Data charges may apply."
"N8VQEBQLBKI","For Lee 💛","2021-04-25T15:00:08Z","UC4laAHbk8VSgmvB47tsd2XQ","Eamon & Bec","19","21.28.04","speak up for lee|speakupforlee|Lee MacMillan|eamon bec lee|eamon and bec and lee","466230","46161","312","5749","https://i.ytimg.com/vi/N8VQEBQLBKI/default.jpg","False","False","After living an extraordinary life, and fighting a brave battle with mental illness, our hearts are shattered to share that our best friend Lee MacMillan took her life on Friday, March 26, 2021. Lee was the brightest light, a magnetic force of nature, and was loved by so so many. #SpeakUpForLeeSAMHSA Hotline for individuals and family members facing mental health and/or substance use disorders1-800-662-HELP (4357) TTY: 1-800-487-4889  If you need immediate support, please reach out to your local crisis text line:USA: Text HOME to 741741UK: Text SHOUT to 85258Canada: Text CONNECT to 686868 or 741741More resources at https://www.crisisservicescanada.ca/en/ and https://afsp.org/https://www.stopbullying.gov/resources/get-help-nowIf we can do one thing for Lee now, in the midst of this soul-crushing loss, it’s to spread the message that mental health is just as real as physical health, and that illness can strike anyone, no matter how unlikely they may seem. Lee's struggles with her mental health were also compounded in her last months of life by persistent and often vicious cyberbullying, and we want to drive home the point that cyberbullying has real life consequences -- the people on the other side of the screen have real lives, real feelings, and real struggles of their own.We are raising funds in her name to donate towards Mental Health Awareness and to combat Cyberbullying. If even one person can be spared her fate, it will be worth it.https://bit.ly/2QsKYalLife is more complex than a single social media post. Things are complicated. Don’t believe what you see online. Get out into the world and talk to your loved ones. Check in. Ask them genuinely how they’re doing. Be available to help. To listen. To offer help. Remove the stigma of asking for help. Please help us spread the awareness of this issue, for Lee and every one else who needs to hear this: share this page using #speakupforlee and share it broadly...you never know who is struggling quietly.And hold your loved ones tight. Tell them you love them. Because life can change in an instant. We will miss her with every fiber of our hearts.Thank you for contributing to her mission - her story will live on in all those she touched, let's honor her life by helping those who are not able to help themselves.(words from her family & friends)"
"bC5_QTQQskw","Funeral procession for rapper DMX","2021-04-24T18:17:26Z","UCIjSUWHWp6KohfnR5OQTXnQ","FOX 5 New York","25","21.28.04","DMX|Brooklyn|rap|entertainment","1491485","16638","749","3215","https://i.ytimg.com/vi/bC5_QTQQskw/default.jpg","False","False","The remains of rapper DMX were transported from Yonkers to the Barclays Center in Brooklyn for a memorial service on Saturday.More DMX coverage from FOX 5:  https://youtube.com/playlist?list=PLcuHpcV2MbFitz3aECxTLlOcXcONELN5TSubscribe to FOX 5 NY: _https://www.youtube.com/fox5ny_ (https://www.youtube.com/fox5ny)?sub_confirmation=1Watch FOX 5 NY Live: https://www.fox5ny.com/liveFOX 5 NY delivers breaking news, live events, investigations, politics, entertainment, business news and local stories from New York City and across the nation.Watch more FOX 5 NY on YouTube:Black Entrepreneurs: https://www.youtube.com/playlist?list=PLcuHpcV2MbFhCA1ErwiU_6G6XSA-HBg0rSTREET SOLDIERS with LISA EVERS: https://www.youtube.com/playlist?list=PLcuHpcV2MbFgxNyloxnZwYu5p0oWN_lSJA.I. ALL IN: https://www.youtube.com/playlist?list=PLcuHpcV2MbFgcJsok-gL3gwY8OfzVkacPFinding Faith: https://www.youtube.com/playlist?list=PLcuHpcV2MbFg7_GyPTOJfF9PiWwo9sgMdThe Big Idea: https://www.youtube.com/playlist?list=PLcuHpcV2MbFizXx6FzVo9sCaNbCYu_rVBDownload the FOX 5 NY News app: https://www.fox5ny.com/appsDownload the FOX 5 NY Weather app: https://www.fox5ny.com/appsFollow FOX 5 NY on Facebook: https://www.facebook.com/fox5ny/Follow FOX 5 NY on Twitter: https://twitter.com/fox5ny/Follow FOX 5 NY on Instagram: https://www.instagram.com/fox5ny/Subscribe to the Good Day NY Morning Brief newsletter: https://www.fox5ny.com/email"
"PCtBBkpVaX4","Dream - Minecraft Manhunt Extra Scenes (5 Hunters)","2021-04-23T19:39:02Z","UChU3JRloULzdFX3aCu7BiSA","DreamXD","22","21.28.04","[none]","3460495","278121","1888","38636","https://i.ytimg.com/vi/PCtBBkpVaX4/default.jpg","False","False","This is extra scenes from Dream's channel of the Minecraft Speedrunner VS 5 Hunters video. We react to what happened during the video and talk about it.Original Video: https://youtu.be/hgdSJdeGF_0This video was crazy fun and intense. Definitely one of the hardest challenges.Minecraft challenge videos are fun to do :)"
"nq6P8eN8kKs","KISSING MY BEST FRIEND'S GIRLFRIEND","2021-04-25T07:03:49Z","UC56D-IHcUvLVFTX_8NpQMXg","Brent Rivera","24","21.28.04","[none]","4219987","487283","4631","79079","https://i.ytimg.com/vi/nq6P8eN8kKs/default.jpg","False","False","like this video if you're an active subscriber :) Subscribe to my new podcast: https://www.youtube.com/channel/UCRTNrJE86bHQQYkYQ8ZX3VAWanna be next week's shoutout!? like this video and comment 'done'✩new relatable hoodies !! ✩ www.relatableapparel.comSpecial thanks to: @Sofie Dossi Subscribe to the group channel: @Amp World      Follow the squad:Ben Azelart -  @ben azelart  Lexi Hensler @Lexi Hensler​ Stokes Twins: @stokestwins  Lexi Rivera - @Alexa Rivera​  Jeremy Hutchins:  @Jeremy Hutchins​  Andrew Davila - @Andrew Davila​  Dom Brack -  @Dominic Brack​  Mason Fulp: @Mason Fulp​ Pierson: @pierson​ hang out with me on social media:SnapChat, Add me: TheBrentRiveraInstagram: @BrentRiveraTwitter: @BrentRiveraFacebook: @BrentRiveraTikTok: @BrentRiveraI have all rights to use this audio in this video according to Final Cut Pro's/YouTube's terms of use."
"TQHEJj68Jew","I Put A $100,000 Bounty On My Head","2021-04-24T20:00:00Z","UCX6OQ3DkcsbYNE6H8uQQuVA","MrBeast","24","21.28.04","[none]","28923897","1938502","15152","87498","https://i.ytimg.com/vi/TQHEJj68Jew/default.jpg","False","False","Sign up for Current w/ my Creator Code BEAST and I'll send you $1 (or maybe $1k!!): http://www.current.com/MrBeastNew Merch - https://shopmrbeast.com/SUBSCRIBE OR I TAKE YOUR DOG╔═╦╗╔╦╗╔═╦═╦╦╦╦╗╔═╗║╚╣║║║╚╣╚╣╔╣╔╣║╚╣═╣ ╠╗║╚╝║║╠╗║╚╣║║║║║═╣╚═╩══╩═╩═╩═╩╝╚╩═╩═╝----------------------------------------------------------------follow all of these or i will kick you• Facebook - https://www.facebook.com/MrBeast6000/• Twitter - https://twitter.com/MrBeast•  Instagram - https://www.instagram.com/mrbeast--------------------------------------------------------------------"
"XegHMc35Bo8","Gera MX, Christian Nodal - Botella Tras Botella (Video Oficial)","2021-04-23T05:00:12Z","UCwEJBGLB1knx2pYESEvWDWg","Gera MX","10","21.28.04","Gera MX|Gera MXM","53329643","2816200","35611","147932","https://i.ytimg.com/vi/XegHMc35Bo8/default.jpg","False","False","#GeraMX #ChristianNodal #BotellaTrasBotellaBotella Tras Botella - Gera MX, Christian Nodalhttps://virginmusic.lnk.to/BotellaTrasBotellaProducción por Jayrick y Edgar BarreraMezcla y Mastering por Luis Barrera Jr.Video por @lalo.m.b🛎  Sigue a Gera Mx en redes sociales:      - Facebook: https://www.facebook.com/GERAMX444/     - Instagram: https://www.instagram.com/geramx1/     - Spotify: https://cutt.ly/2yTo6wq🛎 Encuentra a Christian Nodal en:- Instagram: https://www.instagram.com/nodal- Facebook: https://www.facebook.com/christiannodaloficialmx- Twitter: https://twitter.com/elnodalEscucha el playlist oficial de Rich Vagos: https://smarturl.it/RichVagosSpotifyEscucha lo mejor de la calle en Hits del Barriohttps://smarturl.it/HitsDelBarrioRich Vagos Entertainment 2021"
"t2C0NGePSaY","Daniel Cormier reacts to Kamaru Usman's knockout of Jorge Masvidal at UFC 261 | SportsCenter","2021-04-25T05:50:24Z","UCO4AcsPKEkIqDmbeiZLfd1A","ESPN MMA","17","21.28.04","ufc 261|ufc|ultimate fighting championship|mma|kamaru usman|261|fight|usman|jorge masvidal|masvidal|kamaru|jorge|usman vs masvidal 2|welterweight|championship|usman masvidal|usman masvidal rematch|kamaru usman vs jorge masvidal|espn ufc|ufc interview|usman masvidal 2|gamebred|espn|usman vs masvidal|colby covington|ufc espn|espn mma kamaru usman|espn mma|mma espn|daniel cormier espn mma|espn mma daniel cormier|colby covington vs kamaru usman","1234188","15747","535","2373","https://i.ytimg.com/vi/t2C0NGePSaY/default.jpg","False","False","Daniel Cormier joins SportsCenter to break down Kamaru Usman's knockout of Jorge Masvidal in stunning fashion at UFC 261 and looks ahead to Usman's next challenge against Colby Covington.✔ For more UFC, sign up for ESPN+ http://espnplus.com/ufc/youtube✔ Get the ESPN App: http://www.espn.com/espn/apps/espn✔ Subscribe to ESPN on YouTube: http://es.pn/SUBSCRIBEtoYOUTUBE✔ Subscribe to ESPN FC on YouTube: http://bit.ly/SUBSCRIBEtoESPNFC✔ Subscribe to NBA on ESPN on YouTube: http://bit.ly/SUBSCRIBEtoNBAonESPN✔ Watch ESPN on YouTube TV: http://es.pn/YouTubeTVESPN on Social Media:► Follow on Twitter: http://www.twitter.com/espn► Like on Facebook: http://www.facebook.com/espn► Follow on Instagram: http://www.instagram.com/espnVisit ESPN on YouTube to get up-to-the-minute sports news coverage, scores, highlights and commentary for NFL, NHL, MLB, NBA, College Football, NCAA Basketball, soccer and more. More on ESPN.com: http://www.espn.com"
"gORSeDKnl3A","I Ate Disgusting Food With Noah | Dixie D'Amelio","2021-04-25T17:00:14Z","UCLOEGprmycLLbyzBj2jozLg","Dixie D'Amelio","22","21.28.04","[none]","1061979","66769","1983","2755","https://i.ytimg.com/vi/gORSeDKnl3A/default.jpg","False","False","For the third time, @Noah Beck is officially on the show. I always enjoy filming with Noah! We have a lot of fun together and it was great for him to come to check out the new set!! Write in the comments what you'd like to see us eat next time we do this segment! Thanks to Chef Aaron May for helping us get through it! Don't forget the show airs every Sunday at 10AM PST/1PM EST!!! Thanks for watching! CreditsExecutive Producer: Dixie D'AmelioExecutive Producer: Tommy BurnsExecutive Producer: Christian GuitonDirector: Christian GuitonDP: Seth FullerEditor: Diego ColeProduction Company: Black Street EntertainmentStudio: Hubble StudioWebsite: https://www.dixiedamelio.com​Subscribe for more official content from Dixie: https://www.youtube.com/dixiedamelio?...​Connect with me!TikTok: https://www.tiktok.com/@dixiedamelio​Instagram: https://www.instagram.com/dixiedamelio​Twitter: https://twitter.com/dixiedamelio​Website: https://www.dixiedamelio.com​Connect with Noah!TikTok: https://www.tiktok.com/@noahbeckInstagram: https://www.instagram.com/noahbeckYouTube: https://www.youtube.com/noahbeckThank you to Chef Aaron May for joining us for this segment!https://www.youtube.com/channel/UCd9MSZRCPOKI13ojYef5r2wWe love our Tov chairs!https://tovfurniture.com​Check out my merch: https://dixiedamelio.shop/​#DixieDAmelio​ #NoahBeck​ #TheEarlyLateNightShow"
"0fGHZf0K1p8","Moneybagg Yo - Shottas (Lala) (Official Music Video)","2021-04-23T16:00:16Z","UC7r-J2sPQVv9i3iNcte1u-A","MoneybaggYoVEVO","10","21.28.04","Moneybagg Yo|moneybag yo|shottas|shootas|moneybagg shottas|Moneybagg Yo jshottas|shottas Moneybagg Yo|shottas lyrics|shottas video|a gangsta’s pain|a gangster’s pain|a gangstas pain|moneybagg a gangstas pain|Moneybagg Yo a gangstas pain|a gangstas pain mixtape|gangstas pain|Moneybagg Yo new music|moneybagg yo music video|Moneybagg Yo 2021","3013900","84646","2557","4357","https://i.ytimg.com/vi/0fGHZf0K1p8/default.jpg","False","False","Moneybagg Yo's new album out now: https://MoneybaggYo.lnk.to/AGangstasPain​Follow Moneybagg Yo:https://www.instagram.com/moneybaggyo/https://twitter.com/moneybaggyohttps://www.facebook.com/moneybaggyoLyrics:Lala haha laugh to the bank I’m like haha dada what she sayin I heard blah blah water, rocks on me like I’m tataBye Bye, sipping lean like it’s aqua Pop up Percocet before you choppa choppa When it bust you hear brttatServing patience I’ma trappa rasta I been running with some Shottas (GO) Smoking shark lotto in a fish bowl wearing PradaGotta drink bottle from the doctore riding roung with a NLE ChoppaHard on a bitch and I said what I saidToo much blue money to go on unreadBetter get low and start using yo legs Papapa ah boy hit at yo headMad at the nigga now she up for grabs Single and thirsty, bougie and ghettoDon’t wanna let go of me like a ego Good pussy sound like you staring AlfredoLast nigga diss us can’t eat nothing but Jell-OI heard he got hit with a carbon carmello (brrt)Haters be hot but my chain below zero Money keep calling I answer like hello Lala haha laugh to the bank I’m like haha dada what she sayin I heard blah blah water, rocks on me like I’m tataBye Bye, sipping lean like it’s aqua Pop up Percocet before you choppa choppa When it bust you hear brttatServing patience I’ma trappa rasta I been running with some ShottasWhole lotta hunnids in a safe Way more twenties in the vacuum sealed Niggas be cool not straightGet no hand shake if I know you squealed Never made money playing safe Had to take them risks, kick doors, and steal My lil mean dedicated on the drill Laid there, I’m like twelve or tenSwallow gurgle all in her mouth like some tonsilsMall security kids she call em After you done just leave Auto sending yo friends the things you brought em Momma keep calling since you don’t act like you got no sense Act like you got money, funny Red and blue louis no tummy Drip you running  Lala haha laugh to the bank I’m like haha dada what she sayin I heard blah blah water, rocks on me like I’m tataBye Bye, sipping lean like it’s aqua Pop up Percocet before you choppa choppa When it bust you hear brttatServing patience I’ma trappa rasta I been running with some Shottas#MoneybaggYo​​​ #AGangstasPain​​ #ShottasMusic video by Moneybagg Yo performing Shottas (Lala). © 2021 N-Less Entertainment/Interscope Recordshttp://vevo.ly/42cG1S"
"9Szlma8RM4Q","SPONGEBOB CREWMATE Role in Among Us","2021-04-25T11:00:02Z","UCke6I9N4KfC968-yRcd5YRg","SSundee","20","21.28.04","[none]","3583046","286039","2654","8313","https://i.ytimg.com/vi/9Szlma8RM4Q/default.jpg","False","False","We add SPONGEBOB vs PLANKTON into modded Among Us!🔔 Subscribe & click the bell!  https://www.youtube.com/user/SSundee?sub_confirmation=1👍 Hit the Thumbs Up if you liked this video! 🤖 My Friends! 🤖@Nicovald @Sigils @Biffle @Henwy @LoafX @LooKuM / MRE @Ambrew Zud: https://www.youtube.com/channel/UCgYJLAsnjCZk9ocyIywgbiQMod Maker: @Sub & Fletch ❗️ Follow Me! ❗️Twitter: https://www.twitter.com/SSundeeDiscord: https://discord.gg/SSundeeInstagram: https://instagram.com/ssundeeytFacebook:  https://www.facebook.com/pages/SSundee/200010033358843👨🏻‍🍳 Awesome Video Editor ► Russellhttps://www.youtube.com/russelledits👨🏼‍🎨 Awesome Thumbnail Maker ► Flashhttps://www.youtube.com/channel/UCLy01oVLarj7RNQm52jnGKw🎨 Awesome Animator ► Davidhttps://www.youtube.com/channel/UCxSSIQevKsx2bFc_Gn4WAMg?view_as=subscriber🔥 Other Among Us Videos! 🔥No Kill Cooldown: https://youtu.be/31ff5uVzOnoMAX Difficulty: https://youtu.be/XpQCze7XsuMMedic Mod: https://youtu.be/WN_gW7yvM4k🎶 Music by Ninety9 ► LivesTobu - Such FunVideo Link: https://www.youtube.com/watch?v=d3Oc26AFDdUChannel: https://99l.tv/SubscribeDownload the album! https://99l.tv/Levelup-iThanks for watching!"
"HiUbV3vOvn4","Padres vs. Dodgers Game Highlights (4/25/21) | MLB Highlights","2021-04-26T04:45:48Z","UCoLrcjPV5PbUrUyXq5mjc_A","MLB","17","21.28.04","[none]","651667","9099","359","962","https://i.ytimg.com/vi/HiUbV3vOvn4/default.jpg","False","False","Padres vs. Dodgers full game highlights from 4/25/21Don't forget to subscribe! https://www.youtube.com/mlbFollow us elsewhere too:Twitter: https://twitter.com/MLBInstagram: https://www.instagram.com/mlb/Facebook: https://www.facebook.com/mlbTikTok: https://www.tiktok.com/share/user/6569247715560456198Visit our site for all baseball news, stats and scores! https://www.mlb.com/"
"Hl4kPcBcIHI","Moneybagg Yo - If Pain Was A Person (Official Audio)","2021-04-23T04:00:05Z","UC7r-J2sPQVv9i3iNcte1u-A","MoneybaggYoVEVO","10","21.28.04","Moneybagg Yo|moneybag yo|if pain was a person|moneybagg if pain was a person|Moneybagg Yo if pain was a person|if pain was a person Moneybagg Yo|a gangsta’s pain|a gangster’s pain|a gangstas pain|moneybagg a gangstas pain|Moneybagg Yo a gangstas pain|a gangstas pain mixtape|gangstas pain|Moneybagg Yo new music|Moneybagg Yo 2021","2685197","70784","1306","1880","https://i.ytimg.com/vi/Hl4kPcBcIHI/default.jpg","False","False","Moneybagg Yo's new album out now: https://MoneybaggYo.lnk.to/AGangstasPain​Follow Moneybagg Yo:https://www.instagram.com/moneybaggyo/https://twitter.com/moneybaggyohttps://www.facebook.com/moneybaggyoLyrics:I been tryna figure out like why a mafucca want you to be loyal to themWhen they ain’y loyal to you, ion – ion really get thatThey be tryna show love in private because They done told people people they don’t fuck with you in public and shit That shit be crazy, ion be understanding that shit Niggas be feeling away about bitches and Come on man if ain’t about no money what we doing Speak I done over played my part they forgot about me amnesia (it’s cool tho)I done hit yours, you done hit mine why you still mad we even (I ain’t on that)The blogs put up anything and the crazy part they believe em Nigga caught a charge and got locked up, only reason dude still breathing I’ll never make a hoe feel like I can’t do no better than herHeard that she got a new nigga my bag the biggest she said he on fuck how I fuckBitch lied on God and her kids, threw me off damn that fucked up my trustI know a nigga a cross you to win, where you at wit it, yeah I come from the bluff Lil bro don’t go through there spinning can’t do it myself (why) cuz my positionI’m peeping niggas in slick competition, really some bitches sit down when they pissinThey get some fame off me if I mention, but it’s a shame on me if I did it I know you obsessed with me and I get it stay in yo lane and stay out my businessOver thereYall running off with all these rumors and shit Quick and shit making assumptions Next thing you know you judging a nigga damnWhat about the truth, it’s two sides to this shitI been that nigga, I been lit, I been the shit Before I ever went public with a bitch Yall just catching on late Speaking on my personal lifeMy real life talking bout how it’s fake nigga You aint me, you ain’t in my shoes, you ain’t pay duesSpeakHe ain’t no gangsta, never did nothing gangsta That’s what they said, that’s what they thoughtI done seen so many niggas end up dead cuz they got misled (facts)Ain’t got no time for no baby mouth ass nigga tryna get spoon fedAll that he say she say, code red numb to it brain deadWithout yall I won’t be shit, hope the haters hear me loud and clear (I’m making sure)Unc told me “a scary man a dead man, you can’t live ya life in fear,” so I’m taking risks You can’t get a fair bond last time I checked how them charges disappear (hold up)Lack of communication with my bitch, got her acting all insecure I come from the struggle like you did, nigga why the fuck you tryna down me (huh)If I gotta coach a nigga on how to be real, ion need around me (at all)You can’t fix ya mouth to say I ain’t fuck with ya at least one time Well two times, nah three times couldn’t see the envy I was too blindSee they probably thought I would running out Hold time I was holding back shit a infinity clip  I’m what’s going on so I’m already knowing my name gone be in ya mouth, butWhen you have them conversations make sure you mention He getting six figures for a show, 11 whips paid for, house sitting on four acres Take care of his kids, treat all of em equallyMomma put up, she can wiggle her toes at night, peacefully Shit like that what I do it for SpeakHope for the best prepare for the worse However it come just know that I’m ready You know a lie don’t give a fuck who tell it I know they mad but they never admit itIt be ya own people They gone try to take advantage of you if you let emThey get a thrill off turning you down but never gossip but how you help emI heard it’s niggas out hear wanna touch me but I can’t tell I be where they atWatch you draw the line so stay over thereDon’t come round the gang, don’t throw up the setYou not what I rep, why do some shit you gone regret (answer that)Think smart with it, this shit chessJust cuz yall related don’t mean nothing Niggas on some ice about they checkAll that you love me shit ain’t genuine I felt the vibe when I walked in Shit slick, hurt me thinking you solid then I saw you bend Even after they true colors show kept it real on my end That wasn’t my beef at first I made it mine cuz me and bruh locked-in (for life and after)When I say we la familia we la familia, we locked in for lifeShit loyalty over love, we gone keep it real first Like you not gone see me fucking with my nigga oppIon give a fuck if I knew his opp longer than him Niggas a hate you so much they can know yo opp a rat and still hang with emDon’t that make them the same nigga shit let me know I need clarification What part of the game is that See I know what need to be doneNigga need to start pulling straight up Checking these niggas, these niggas can’t stand no pressureYou ain’t gotta feel how I’m coming where I’m coming from If pain was a person Bagg#MoneybaggYo​​​ #IfPainWasAPerson #AGangstasPain​​Music video by Moneybagg ..."
"syrGt0fpffY","Yuh-Jung Youn Accepts the Oscar for Supporting Actress","2021-04-26T02:23:10Z","UC_IpSl6O_-IRAA6fiNs05Gg","ABC","24","21.28.04","achievement|glamour|glitz|oscars2021vs|prestige|stars|winners2021","288384","6321","198","646","https://i.ytimg.com/vi/syrGt0fpffY/default.jpg","False","False","Watch Yuh-Jung Youn's Oscar 2021 acceptance speech for Actress in a Supporting Role for her portrayal of Soonja in MINARI. Watch more highlights from Oscars 2021 on Oscar.com and in the ABC app!"
