video_id,title,publishedAt,channelId,channelTitle,categoryId,trending_date,tags,view_count,likes,dislikes,comment_count,thumbnail_link,comments_disabled,ratings_disabled,description
"zj7CRohqVXY","MrBeast Exposes KSI","2021-03-22T16:00:34Z","UCbAZH3nTxzyNmehmTUhuUsA","SidemenShorts","22","21.24.03","Shorts|Sidemen","368607","23318","119","226","https://i.ytimg.com/vi/zj7CRohqVXY/default.jpg","False","False","What other clips do you want to see? Lets us know in the comments!WATCH THE ORIGINAL VIDEO HERE: (https://youtu.be/B7_YabsRU3Y)👉🏻: Subscribe to our Reacts Channel: https://www.youtube.com/SidemenReacts​ 👈🏻👕: Sidemen Clothing: http://www.sidemenclothing.com​👉🏻 Subscribe to our 2nd Channel: https://www.youtube.com/MoreSidemen​ 👈🏻📸: Sidemen Instagram: http://www.instagram.com/Sidemen​🐤: Sidemen Twitter: http://www.twitter.com/Sidemen#Shorts"
"tMcbRgRlolI","Tobi Hugs W2S Awkwardly Long","2021-03-22T18:00:06Z","UCbAZH3nTxzyNmehmTUhuUsA","SidemenShorts","22","21.24.03","Shorts|Sidemen","400092","18582","55","422","https://i.ytimg.com/vi/tMcbRgRlolI/default.jpg","False","False","What other clips do you want to see? Lets us know in the comments!WATCH THE ORIGINAL VIDEO HERE: (https://youtu.be/n3KmVsf-luY)👉🏻: Subscribe to our Reacts Channel: https://www.youtube.com/SidemenReacts​ 👈🏻👕: Sidemen Clothing: http://www.sidemenclothing.com​👉🏻 Subscribe to our 2nd Channel: https://www.youtube.com/MoreSidemen​ 👈🏻📸: Sidemen Instagram: http://www.instagram.com/Sidemen​🐤: Sidemen Twitter: http://www.twitter.com/Sidemen#Shorts"
"8u8RgUgIXVM","HIGHLIGHTS! Lawrence Okolie crushes Krzysztof Głowacki to become WBO world cruiserweight champion 👑","2021-03-21T04:06:47Z","UC_JQGBtA7P0RwkRxd7xpJcA","Sky Sports Boxing","17","21.24.03","sky sports boxing|sky sports boxing stream|boxing|sky sports|Lawrence Okolie|Okolie|Okolie Glowacki|Glowacki Okolie|Sky Boxing|Cruiserweight|Matchroom Boxing|Matchroom|IFL TV|Boxing|Lawrence Okolie highlights|highlights|boxing highlights|Anthony Joshua|AJ|Heavyweight|Dillian Whyte|post fight|Okolie post fight|Okolie Whyte|Glowacki|WBO Cruiserweight|Okolie Glowacki highlights","244604","2576","134","773","https://i.ytimg.com/vi/8u8RgUgIXVM/default.jpg","False","False","►WATCH WHYTE vs POVETKIN 2 ► http://bit.ly/WatchWhytePovetkin2►SUBSCRIBE http://bit.ly/SSBoxingSubLawrence Okolie crushed Krzysztof Glowacki with a huge right hand to start his reign as the new WBO cruiserweight champion.Okolie unloaded a devastating finishing punch to drop Glowacki heavily in the sixth round and referee Marcus McDonnell waved off the fight to confirm the coronation of Britain's newest world title holder at The SSE Arena in Wembley.►TWITTER: https://twitter.com/skysportsboxing►FACEBOOK: http://www.facebook.com/skysportsboxing►WEBSITE: http://www.skysports.com/boxingMORE FROM SKY SPORTS ON YOUTUBE:►SKY SPORTS FOOTBALL: http://bit.ly/SSFootballSub►SKY SPORTS BOXING: http://bit.ly/SSBoxingSub►SKY SPORTS CRICKET: http://bit.ly/SubscribeSkyCricket►SOCCER AM: http://bit.ly/SoccerAMSub►SKY SPORTS F1: http://bit.ly/SubscribeSkyF1►SKY SPORTS: http://bit.ly/SkySportsSub►SKY SPORTS GOLF: https://bit.ly/SubscribeSkySportsGolf"
"A_5-fED2A0Y","Full Face Of VIRAL TikTok Makeup Trends! | NikkieTutorials","2021-03-21T19:00:02Z","UCzTKskwIc_-a0cGvCXA848Q","NikkieTutorials","24","21.24.03","easy makeup|tutorials|hacks|beauty|beauty hacks|e girl makeup|how to apply makeup for beginners|tik tok makeup|tik tok hacks|tik tok beauty hacks|full face of|full face using|makeup challenge|challenge|viral|viral tik tok|nikkietutorials|nikkie tutorials|nikkitutorials|nikki tutorials|naomi jon|james charles|nikita dragun|charli damelio|crazy challenge|epic|epic fail|avani|dixie damelio|transformation|coming out|selena gomez|kim kardashian","1324971","81336","1117","3011","https://i.ytimg.com/vi/A_5-fED2A0Y/default.jpg","False","False","I teamed up with Anastasia Beverly Hills to bring you today’s video where I try your list of VIRAL TikTok makeup trends— including Spock Brows using Dipbrow Pomade. Red lipstick before foundation and a crazy full-coverage drugstore foundation powder! Enjoy and don't forget to thumbs up and subscribe!🔥 PREVIOUS VIDEO • Guess The GURU Challenge! OMG! → https://youtu.be/XvbWC79HbL0 🔥BUY MY OWN EYESHADOW PALETTE HERE 🦋 https://bit.ly/2YB6IBGMake sure you subscribe to my channel and hit the notification bell, so you don’t miss any of my new videos → http://bit.ly/SubscribeNikkieTutorials••••••••••••••••••••••••••••••••••••••••­­­•••••••••••▷ LET’S BECOME FRIENDS!!TWITTER ‣ http://www.twitter.com/NikkietutorialsINSTAGRAM ‣ https://instagram.com/nikkietutorials/TIKTOK ‣ https://vm.tiktok.com/nf6f2K/SNAPCHAT ‣ https://www.snapchat.com/add/nikkietutorials▷ OTHER VIDEOS YOU CAN CHECK OUT…….👑 THE POWER OF MAKEUP ► http://bit.ly/2scYIrE💻 Doing LADY GAGA'S Makeup! ► http://bit.ly/2M0moIy🎀 Doing My FIANCE'S Makeup! ► https://bit.ly/3bsgHxu🍑 POWER OF MAKEUP: KIM KARDASHIAN WEST ► http://bit.ly/2iz1RhT••••••••••••••••••••••••••••••••••••••••­­­•••••••••••Disclaimer ‣ This video is sponsored by Anastasia Beverly Hills. All thoughts mentioned are my own. No affiliate links are used. Honesty is key on my channel. Thank you for supporting me!Visuals & sound by Studio Beng Beng: https://www.instagram.com/studiobengbeng/ʕ•ᴥ•ʔ, I love you."
"f5pLvhrBBwQ","ARRESTING My Friend Then Surprising Him With A CAR","2021-03-20T18:01:21Z","UCdcUmdOxMrhRjKMw-BX19AA","Niko Omilana","24","21.24.03","prank|best friend prank|niko omilana|niko|surprising with a car|NDL","1202816","219557","451","9331","https://i.ytimg.com/vi/f5pLvhrBBwQ/default.jpg","False","False","I pranked my best friend then surprised him with his dream car.Follow my Instagram- http://instagram.com/niko​​Follow me on Twitter- https://twitter.com/NikoOmilana​​Business Email - Grace@totalpsyclone.com"
"z08z8IfkLh4","The Snyder Cut is Actually Not Bad","2021-03-21T19:08:31Z","UCqTYHSnBUXZamsVcOlQf-fg","The Cosmonaut Variety Hour","1","21.24.03","Justice league|review","983450","62327","2693","7359","https://i.ytimg.com/vi/z08z8IfkLh4/default.jpg","False","False","Go to http://www.audible.com/cosmonaut or text cosmonaut to 500 500 to get your free trial. Patreon: https://www.patreon.com/cosmonautvarietyhourBUY A SHIRT: https://teespring.com/stores/cosmonaut-variety-merch-storeTwitter: https://twitter.com/cosmovarietyhr"
"qDFXP5FjFZE","REAL Friend Turns FAKE Friend! *I'M KICKED OFF THE CHEER SQUAD*","2021-03-21T17:33:57Z","UCJVkkxqSzMZDcLFhULXAIIQ","Dan and Riya","23","21.24.03","danandriya|dan and riya|dan riya|types of|dan and riya vlogs|tootsie|50 types of|funny|comedy channel|best friends|best friend vs friend|fake friend vs real friend|Rich girl vs normal girl|popular best friend|my best friend found out my secret|high School life|popular girl at school doesn't like me|cheer squad life|kicked off the squad|real friendship|best friend turns fake|I dated her boyfriend|high school party|Awkward moments|best friend jokes","1053361","30448","1386","4259","https://i.ytimg.com/vi/qDFXP5FjFZE/default.jpg","False","False","The most popular girl at high school doesn't like me. My best friend is the most popular, prettiest and richest girl at school. Everyone wants to be here friend. I went out with my best friends ex boyfriend and she found out my secret. My friend is very upset at me and she has kicked me off the cheerleading squad and won't invite me to her party. I need apologize to her so we can be friends again and I can be part of her squad. Subscribe: http://bit.ly/SubscribeToDanAndRiya |Watch the latest: https://youtube.com/playlist?list=PLEAO4pwUNrMbweCYb-WN-9dH7tcUPHF49&playnext=1&index=2MERCH!:https://bvhshop.com♦ WATCH MORE:Beverly Valley High: https://youtube.com/playlist?list=PLEAO4pwUNrMbEaCVTwVcwdPMEodO3gPob&playnext=1&index=2The Skits!: https://youtube.com/playlist?list=PLEAO4pwUNrMacBYHh3XmGeYktbFFuiEBm&playnext=1&index=2Types of: https://youtube.com/playlist?list=PLEAO4pwUNrMYq2VnAFsj0cim_uYr0o7Yy&playnext=1&index=2Most Popular: https://youtube.com/playlist?list=PLEAO4pwUNrMYY6AMwIwoMi_BjBj4vm0EI&playnext=1&index=2♦ SOCIAL MEDIA o TIKTOK: @BeverlyValleyHigho DAN'S TWITTER: https://twitter.com/dankipniso RIYA'S TWITTER: https://twitter.com/itsriyamaliko DAN'S INSTAGRAM: http://instagram.com/dankipniso RIYA'S INSTAGRAM: http://instagram.com/itsriyamaliko BEVERLY VALLEY HIGH INSTAGRAM: https://instagram.com/beverlyvalleyhigh/Strawberry Spills The Tea: https://www.youtube.com/channel/UCtox8d4vtbN-97md4dsz0cgAbout Dan & Riya:Welcome to the Dan and Riya channel! Our names are Dan Kipnis and Riya Malik. We are best friends for over 15 years who decided to start making YouTube videos. We think we are the funniest people out there, so our job is to make you laugh for hours as you binge watch all our videos every single day on our YouTube channel!. Our channel is made up of comedic skits. Most of them take place in the world of Beverly Valley High where you have Dan, Riya, Tootsie, Cinnamon, Raja, Chad, Miss P, Riya's Dad and Riya's Mom. Our skits are for every age and are about everything including; relationships, boys, girls,, love, how to survive school, families, and friendship!Step into our world and become part of the DanAndRiyaFam!"
"F5nMRXAIONI","OLYMPIQUE LYONNAIS - PARIS SAINT-GERMAIN (2 - 4) - Highlights - (OL - PSG) / 2020-2021","2021-03-22T02:23:05Z","UC58LMAlfwtGRNR6Xpd4DlSA","Ligue 1 Uber Eats Official","17","21.24.03","OL PARIS SG|Lyon Paris|highlights OLYMPIQUE LYONNAIS PARIS SAINT-GERMAIN|highlights OL PARIS SG|highlights Lyon Paris|OLYMPIQUE LYONNAIS|Lyon|highlights|Goals|Goal|ligue 1|Ligue 1 Uber Eats|league 1|L1|football|foot|soccer|french league|french|France|day|match day|sp:ty=high|sp:dt=2021-03-21T21:00:00Z|sp:vl=en-GB|sp:st=soccer|sp:li=france|sp:ti:home=OL|sp:ti:away=PARIS SG","940326","13454","402","431","https://i.ytimg.com/vi/F5nMRXAIONI/default.jpg","False","False","OLYMPIQUE LYONNAIS vs PARIS SAINT-GERMAIN Highlights (2 - 4) in video. Ligue 1 Uber Eats - Season 2020/2021 - Week 30 GROUPAMA STADIUM - Sunday 21 March 2021Goals : Kylian MBAPPE (15' - PARIS SAINT-GERMAIN) / Danilo Luis Helio PEREIRA (32' - PARIS SAINT-GERMAIN) / Angel DI MARIA (47' - PARIS SAINT-GERMAIN) / Kylian MBAPPE (52' - PARIS SAINT-GERMAIN) / Islam SLIMANI (62' - OLYMPIQUE LYONNAIS) / Maxwel CORNET (81' - OLYMPIQUE LYONNAIS) OLYMPIQUE LYONNAIS Team line-up : 1 - Anthony LOPES /27 - Maxwel CORNET /25 - Maxence CAQUERET /7 - Karl TOKO EKAMBI /10 - Memphis DEPAY (c) /23 - Thiago MENDES /6 -  MARCELO /11 - Tino KADEWERE /5 - Jason DENAYER /12 - Lucas TOLENTINO COELHO DE LIMA /22 - Mattia DE SCIGLIO PARIS SAINT-GERMAIN Team line-up : 27 - Idrissa GUEYE /22 - Abdou DIALLO /3 - Presnel KIMPEMBE /6 - Marco VERRATTI /7 - Kylian MBAPPE /5 -  MARQUINHOS (c) /11 - Angel DI MARIA /1 - Keylor NAVAS /24 - Alessandro FLORENZI /18 - Bioty Moise KEAN /15 - Danilo Luis Helio PEREIRA Subscribe to the channel YoutubeSubscribe : https://www.youtube.com/subscription_center?add_user=ligue1officialFollow us on Instagram : https://instagram.com/ligue1ubereats/ Follow us on Twitter : https://twitter.com/Ligue1UberEatsFollow us on Facebook : https://fb.com/Ligue1UberEatsFollow us on Ligue1.fr : https://www.ligue1.fr"
"UQrF-VfqIP8","We're Back & Where We've Been.. | Niki and Gabi","2021-03-21T21:18:04Z","UCuVHOs0H5hvAHGr8O4yIBNQ","Niki and Gabi","26","21.24.03","niki and gabi|niki and gabi comeback|niki demar|fancy vlogs by gab|gabi demartino|smokey glow|the evolution of niki and gabi|opposite twins|Q&A|niki and gabi 2021","625023","45853","945","5525","https://i.ytimg.com/vi/UQrF-VfqIP8/default.jpg","False","False","ALL INFO DOWN BELOW IF YOU WANT TO MEET US ON ZOOM!we're back from an unexpected break... and here's where we've been and why we took a break. #NikiandGabi #NikiandGabiComeback Subscribe here ➜ http://bit.ly/2vxi9ch​Watch the Evolution of Niki and Gabi by Smokey Glow:https://www.youtube.com/watch?v=0wO-jASSkxUTO ENTER FOR A CHANCE TO JOIN OUR  ZOOM:1. comment down below your iG handle so we can contact you!2. be following us on INSTAGRAM and TIKTOK 3. comment on our instagram posts with the hashtag: NIKIANDGABICOMEBACKZOOM see you there! TO BINGE:Our Opposite Twin Challenge playlist➜ https://www.youtube.com/playlist?list​...Our Fashion // Shopping playlist➜ https://www.youtube.com/playlist?list​...**NEW VIDEOS EVERY SUNDAY and SOMETIMES WEDNESDAY**If you see this, comment niki's brunette and gabi's engaged?! only those who watch up to that point will know what this means ;)vlog channels:niki demarhttps://www.youtube.com/user/nikidemar​fancy vlogs by gab https://www.youtube.com/channel/UCLGe​...SOCIAL MEDIA Instagram➜ @NIKI / @GABITwitter➜ @nikidemar / @gabcakeTumblr➜ nikidemar / breakfastatchanel-starringgabiSnapchat➜ nikidemarrr / fancysnapsbygabWe’re Niki and Gabi! We hope you enjoyed our comeback video! We missed you guys SO much! If you don't know, We’re twin sisters who are different with opposite fashion and styles, but we come together to make videos like challenges, sister vs sister, photoshoot challenges, 24 hour challenges, DIY, swaps, shopping challenges, 24 hour challenges, diy, style, beauty, lifestyle, fashion, comedy, types of girls, music, and more!"
"6rntjQib3SA","The Truth About Cracking Your Knuckles #shorts","2021-03-22T16:18:10Z","UCC552Sd-3nyi_tk2BudLUzA","AsapSCIENCE","27","21.24.03","[none]","147695","10961","162","512","https://i.ytimg.com/vi/6rntjQib3SA/default.jpg","False","False","Here's what happens to your knuckles when you crack them #shorts"
"JV7Jzcc5o-w","Goodbye Roblox","2021-03-21T16:00:05Z","UCOaMOXfe8EWH1GJyhqhXrAA","Denis","20","21.24.03","Denis|Denis YouTube|Denis Roblox|DenisDaily|Denis Daily|Roblox|Gaming|Gameplay|No Swears|No Cursing|Kid Friendly|Family Friendly|Roblox Adventures|roblox roleplay|roblox video|Play Roblox","2125449","172305","2929","64977","https://i.ytimg.com/vi/JV7Jzcc5o-w/default.jpg","False","False","Thank you Roblox, it's been funMerch - http://denisdaily.comMY CARTOON SHOW! - https://bit.ly/3mGkxIwTwitter - http://twitter.com/DenisDailyYTInstagram - https://www.instagram.com/denisdailyyt/#Denis"
"ueq3Hrh1xtw","Gunners fight back from 3-0 down to earn draw! | West Ham 3-3 Arsenal | Premier League Highlights","2021-03-21T17:15:10Z","UCNAf1k0yIjyGu3k9BwAg3lg","Sky Sports Football","17","21.24.03","sky sports|premier league|Football League|football|Sky Sports live|Sky|Sports|stream|sky sports football|premier league highlights|premier league highlights 1920|premier league goals|arsenal highlights|west ham highlights|arsenal vs west ham highlights|arsenal 3-3 west ham|west ham 3-3 arsenal|arsenal vs west ham|lacazette|lingard|Jesse Lingard|premier league highlights today","982980","16965","276","2091","https://i.ytimg.com/vi/ueq3Hrh1xtw/default.jpg","False","False","SUBSCRIBE ► http://bit.ly/SSFootballSubPREMIER LEAGUE HIGHLIGHTS ► http://bit.ly/SkySportsPLHighlights2021Highlights from the Premier League as Arsenal fought back from three goals down to earn a point in an action-packed London derby against West Ham.Watch Premier League LIVE on Sky Sports here ► http://bit.ly/WatchSkyPL►TWITTER: https://twitter.com/skysportsfootball►FACEBOOK: http://www.facebook.com/skysports►WEBSITE: http://www.skysports.com/footballMORE FROM SKY SPORTS ON YOUTUBE:►SKY SPORTS FOOTBALL: http://bit.ly/SSFootballSub►SKY SPORTS BOXING: http://bit.ly/SSBoxingSub►SKY SPORTS CRICKET: http://bit.ly/SubscribeSkyCricket►SOCCER AM: http://bit.ly/SoccerAMSub►SKY SPORTS F1: http://bit.ly/SubscribeSkyF1►SKY SPORTS: http://bit.ly/SkySportsSub►SKY SPORTS GOLF: https://bit.ly/SubscribeSkySportsGolf"
"9pX76rbcqBM","Friday Night Funkin' - South but every turn a Different Skin Mod is used","2021-03-21T14:57:07Z","UCn6B_pl3DOEPHtTe_0rUshw","PrizMatex","20","21.24.03","Friday Night Funkin' - South but every turn a Different Skin Mod is used|South but every turn a Different Skin Mod is used|Friday Night Funkin'|HoloNight Funkin' RETURNS!|OMORI MOD|Kokichi + Nagito as Spooky kids|Spookiez|But they're humanoid|Zim|and MiniMoose over Skid and Pump|Family Night Funkin Modpack|Elegant Night Dancin' Mod|The Angry Video Game Nerd over Boyfriend|2B / Friday Night Funkin' Mod|Princess Peach as Girlfriend|Gumball and Darwin over Spooky Kids","6226309","143461","3729","7320","https://i.ytimg.com/vi/9pX76rbcqBM/default.jpg","False","False","Originally I wanted to do every boyfriend turn the skin would change but I underestimated how low in turns this song would have but even so I still have like a lot of clips leftover which I had no intention of going to waste. It's kinda of ironic when I literally stated that in my previous video but it was my fault for checking so I could only settle with this instead. Once again I still want people to know that I did use a bot to keep things well sync because I don't intend on hiding that fact since I wanted to make this video as a fun viewing experience while delivering people exposure of new skin mods out there. I have to admit compared to most I think week 2 is underrated which is the reason why I wanted to make a video of it before I forget it since I did skip it like two songs ago. Overall, this song was much easier to do since most mods came with a Girlfriend and Boyfriend skin.Mods used in this video:Main Website for these mods comes from GameBananaOMORI MOD (Update: Bug Spray)https://gamebanana.com/gamefiles/14222Kokichi + Nagito as Spooky kidshttps://gamebanana.com/skins/188532Spookiez, But they're humanoidhttps://gamebanana.com/skins/download/184827Zim, Gir, and MiniMoose over Skid and Pumphttps://gamebanana.com/skins/download/187577Family Night Funkin Modpackhttps://gamebanana.com/skins/download/184321MCYT MODPACKhttps://gamebanana.com/gamefiles/download/14119Skid And Pump Skin Playablehttps://gamebanana.com/skins/download/183972Lila over Daddy Dearesthttps://gamebanana.com/skins/188959Gumball and Darwin over Spooky Kidshttps://gamebanana.com/skins/download/190432Elegant Night Dancin' Modhttps://gamebanana.com/gamefiles/download/16246The Angry Video Game Nerd over Boyfriendhttps://gamebanana.com/skins/download/191014The Pelones Pelito replaces BFhttps://gamebanana.com/skins/download/184485Garfield With beta bfcar and also color correctionhttps://gamebanana.com/skins/186782Marina Over GF (Splatoon)https://gamebanana.com/skins/download/187733Kaede Akamatsu GFhttps://gamebanana.com/skins/download/1888792B / Friday Night Funkin' Modhttps://gamebanana.com/skins/download/184460Shuichi Saihara BFhttps://gamebanana.com/skins/download/187184Princess Peach as Girlfriendhttps://gamebanana.com/skins/download/184627Ritz over GFhttps://gamebanana.com/skins/download/190929HoloNight Funkin' RETURNS!https://gamebanana.com/gamefiles/16817►Follow Me!Twitter: https://twitter.com/PrizMatex​​​​#FridayNightFunkin​​​’"
"XfixBYasG0g","NSW floods declared a natural disaster - 7NEWS coverage - March 2021 | 7NEWS","2021-03-21T09:36:26Z","UC5T7D-Dh1eDGtsAFCuwv_Sw","7NEWS Australia","25","21.24.03","7NEWS|Australia|News|breaking news|news headlines|seven news|7 news|channel 7 news","762159","4308","242","1502","https://i.ytimg.com/vi/XfixBYasG0g/default.jpg","False","False","Sydney is facing a once-in-50-year flood emergency tonight. Evacuation orders are in place, thousands of people on alert, with sections of suburbs around the Hawkesbury and Nepean Rivers expected to go under. Adding to the crisis, Warragamba Dam is spilling enormous amounts of water with fears of flooding not seen since the 1960s. More: https://7news.link/3tH0QUwSubscribe to 7NEWS for the latest video » https://7news.link/YTSubscribeConnect with 7NEWS onlineVisit » https://7news.com.au7NEWS Podcast » http://smarturl.it/7NewsDailyFacebook » https://www.facebook.com/7NewsAustraliaTwitter » https://twitter.com/7NewsAustraliaInstagram » https://www.instagram.com/7newsaustralia/ 7NEWS combines the trusted and powerful news brands including Sunrise, The Morning Show, The Latest, and 7NEWS.com.au, delivering unique, engaging and continuous coverage on the issues that matter most to Australians. Watch 7NEWS nightly at 6pm and weekdays at 11:30am and 4pm on Channel 7 and 7plus.#BreakingNews #NSWfloods #7NEWS"
"U7xV1Jm_o2Y","SCAMMED! 😞 1st Edition Charizard (Don’t Do This!) #Shorts","2021-03-09T21:22:23Z","UCnnrLDosqnpRPQ_TH3uXnnQ","Deep Pocket Monster","24","21.24.03","pokemon card scams|1st edition base set charizard|fake charizard|fake charizard card|scammed pokemon cards|pokemon card scammed|charizard fake|pokemon scammed|charizard proxy card|charizard proxy|deep pocket monster|pat flynn|pat flynn pokemon|deep pocket monster youtube|pokemon shorts|#shorts","1195807","48371","1475","517","https://i.ytimg.com/vi/U7xV1Jm_o2Y/default.jpg","False","False","A fan of the channel was SCAMMED and wanted me to show you what happened, so it doesn’t happen to you! #ShortsThis base set 1st edition Charizard is a FAKE. Watch so you can see how not to fall for this as well.Have you ever been scammed like this? Tell me your story in the comments below.Watch this short next:▶️ Shining Fates GOD PACK? https://youtu.be/YBCFq3EG81cAnother short to watch:👓  Which Pokemon Cards Do You See? https://youtu.be/7AHZRxCy-mw👉 Join this channel to show support and get access to perks:https://www.youtube.com/channel/UCnnrLDosqnpRPQ_TH3uXnnQ/join🔴 SUBSCRIBE for more like this: https://www.youtube.com/channel/UCnnrLDosqnpRPQ_TH3uXnnQ?sub_confirmation=1Join this channel to get access to perks:https://www.youtube.com/channel/UCnnrLDosqnpRPQ_TH3uXnnQ/joinOther videos I recommend you check out:👨‍👦 Father vs. Son Pokemon Collection Showdown:  https://youtu.be/F5E9HB4YmEE📦 $999.99 PSA Pokemon Mystery Box: https://youtu.be/GVGWlM73pr8😲 The 2016 Set No One Talks About: https://youtu.be/8wXdMazi17E🍄 Mario Pikachu!: https://youtu.be/Om6GU7rUNJQ🤫 Secret STAFF cards: https://youtu.be/CpViqHHAfL0📦 $700 Mystery Box... Trash?? https://youtu.be/qyfTHmVZp8Y⛔️ Don't Make this Collector's Mistake! https://youtu.be/xTIH1YWR-kM1️⃣ The ONLY Pokemon Card Like This That Exists: https://youtu.be/ajspYIHUw3k💎 What Exactly Did TCA Gaming Send Me: https://youtu.be/ZhOIkwv-hLwConnect with me:👋 On Instagram: http://www.instagram.com/patflynn💬 On Twitter: http://www.twitter.com/patflynn💼 Check out my business and entrepreneur related YouTube channel: http://www.patflynn.com/youtube✉️ Want to send me something in the mail? Thanks! Send it here:Pat Flynn10531 4S Commons Dr STE 524San Diego, CA 92127"
"Tzo5gjtzyOM","Reacting To Jake Paul vs Tommy Fury (Who Wins?!)","2021-03-21T17:30:01Z","UC9BaJIXnYSyYalbCVfZTZ4A","VIDDAL","24","21.24.03","Boxing|KSI|Viddal Riley|Sidemen|VIDDAL|MoreSidemen|SidemenReacts|Sidemen Sundays|Among Us|Callux|Chunkz|Jake Paul|Logan Paul|Tommy Fury|Footasylum|Pro:Direct|BT Sport|Sky Sports Boxing","132733","7141","126","775","https://i.ytimg.com/vi/Tzo5gjtzyOM/default.jpg","False","False","VERY INTERESTING... Jake Paul has now gotten the attention of not only Tommy Fury but his HOF Frank Warren who is pushing for the fight...LIKE, SUBSCRIBE THEN... COMMENT your opinion on the fight. Also, new music coming soon: https://twitter.com/isitril/status/1372265192067891207?s=21Love. Become a channel member now for exclusive content inc. boxing tutorials: https://www.youtube.com/channel/UC9BaJIXnYSyYalbCVfZTZ4A/joinALL my socials below! https://linktr.ee/isitrilEdited by Cristian PazSubscribe HERE: https://www.youtube.com/user/FOURPEAZ#VIDDAL #JakePaul #TommyFury"
"kAegy4sLElY","Prince Harry - Drawn 2 Duppy | FITS","2021-03-21T09:00:08Z","UCA7KUDElNwzKpRUS9i1MzyA","Fire In The Spoof","24","21.24.03","Fire In The Spoof|FITS|Shellers|FITSFriday|FITStotheworld|#FITStotheworld|#FireInTheSpoof|Prince Harry Fire In The Spoof|Prince Harry FITS|Prince Harry Drawn 2 Duppy|Drawn 2 Duppy|Drawn 2 Duppy!|Daily Duppy|Prince Harry Daily Duppy|Black Man Born As A Ginger","86914","6831","60","734","https://i.ytimg.com/vi/kAegy4sLElY/default.jpg","False","False","Prince Harry - Drawn 2 Duppy | FITSJoin the channel to get access to perks:https://www.youtube.com/channel/UCA7KUDElNwzKpRUS9i1MzyA/join#FITS#FireInTheSpoof#FITStotheworld#Shellers—ANIMATION BY@fee_dublin_fitsCHARACTER ILLUSTRATION BY@rich_ivensLYRICS WRITTEN & PERFORMED BY@dialectofficial (Harry)BEAT PRODUCED BY@thaibeats_officialSOUND ENGINEERED BY@bobbi_londonEMAIL BEATS TOfireinthespoof@gmail.com—Follow Fire In The Spoof:▶ Youtube:https://www.youtube.com/FireInTheSpoof▶ Facebook:https://www.facebook.com/FireInTheSpoof/▶ Instagram:https://www.instagram.com/FireInTheSpoof/▶ Twitter:https://twitter.com/FireInTheSpoof▶ Spotify:https://open.spotify.com/artist/4XNHNA8zjxzrRKCkPZ6mxo▶ Apple Music:https://itunes.apple.com/gb/artist/fire-in-the-spoof/1352567895"
