video_id,title,publishedAt,channelId,channelTitle,categoryId,trending_date,tags,view_count,likes,dislikes,comment_count,thumbnail_link,comments_disabled,ratings_disabled,description
"SRz-ePm4te8","5 minutes from death : Dancing with the Devil","2021-03-23T19:41:50Z","UCZkURf9tDolFOeuw_4RD7XQ","Demi Lovato","24","21.24.03","[none]","2083268","109320","1105","4566","https://i.ytimg.com/vi/SRz-ePm4te8/default.jpg","False","False","“I knew that what I’d been looking for, I hadn’t found yet. But what I had been looking for was not in the form of a drug.”Demi and her closest confidants give a firsthand account of the aftermath of the overdose as she wakes up in the hospital after being minutes away from death.Episode 3 available March 30 @ 12p PTResources: SAMHSA Hotline for individuals and family members facing mental health and/or substance use disorders1-800-662-HELP (4357) TTY: 1-800-487-4889  National Sexual Assault Hotlinewww.rainn.org1-800-656-HOPE (4673) Or if you need immediate support, please reach out to your local crisis text line:USA: Text HOME to 741741UK: Text SHOUT to 85258Canada: Text CONNECT to 686868 or 741741 Learn how to save lives at endoverdose.net.Pre-order Demi Lovato’s new album ‘Dancing With The Devil… The Art Of Starting Over’ https://DemiLovato.lnk.to/DWTDTAOSOID"
"uZmXF50Yx7I","losing control : Dancing with the Devil","2021-03-23T19:17:17Z","UCZkURf9tDolFOeuw_4RD7XQ","Demi Lovato","24","21.24.03","[none]","3160772","164597","2606","7390","https://i.ytimg.com/vi/uZmXF50Yx7I/default.jpg","False","False","“I crossed a line I’d never crossed in addiction.” In part I of this fearless documentary series, Demi Lovato and her family and friends candidly open up for the first time about what led to her near-fatal overdose.Resources: The National Eating Disorders Association (NEDA) helpline1-800-931-2237 (they also offer click-to-chat messaging) www.nationaleatingdisorders.org SAMHSA Hotline for individuals and family members facing mental health and/or substance use disorders1-800-662-HELP (4357) TTY: 1-800-487-4889  If you need immediate support, please reach out to your local crisis text line:USA: Text HOME to 741741UK: Text SHOUT to 85258Canada: Text CONNECT to 686868 or 741741Pre-order Demi Lovato’s new album ‘Dancing With The Devil… The Art Of Starting Over’ https://DemiLovato.lnk.to/DWTDTAOSOID"
"vmVWeuoZtfM","MY TEETH TRANSFORMATION... STRIPPING IT BACK! VLOG | MOLLYMAE","2021-03-23T16:09:01Z","UC-F3kTU4V680v550AavEOsQ","MollyMae","22","21.24.03","[none]","410421","23752","164","1278","https://i.ytimg.com/vi/vmVWeuoZtfM/default.jpg","False","False","HEY GUYS...I hope you enjoyed this video, apologies for the super random ending ! the wifi issue will be the death of me lol....My next video will be out super soon, I love you all so much, thank you for your constant support even though I haven't been uploading as much recently xSHOUTOUT to RUH DENTAL who did the work for me !https://ruhdental.com/clinics/manchester/Lots of love always guys xxxMolly-Mae"
"gvRdOLl-Q_I","I’m Leaving YouTube...","2021-03-23T17:02:50Z","UCBwSufNse8VMBvQM_rCSvgQ","Morgz","24","21.24.03","morgz|morgz mum|i'm leaving|leaving|leaving youtube|real morgz|old morgz|old morgz vs. new morgz|i'm leaving youtube|why i'm leaving youtube|quitting youtube|quitting|goodbye|morgz mom|bald martin|Quitting|Morgz leaving|YouTube|Morgz quits YouTube|Morgz quitting YouTube|Old morgz|Old morgz videos|Morgz cringe|Morgz fake|Fake|Morgz fake videos|why im leaving youtube|morgz leaving|morgz quitting|morgz quit|bye youtube|new morgz|cringe|cringy","306096","31590","2402","14061","https://i.ytimg.com/vi/gvRdOLl-Q_I/default.jpg","False","False","This video is not a joke. Please watch. -------------------| FOLLOW FOR A FOLLOW BACK |------------------- ►FOLLOW ME ON TWITTER: https://twitter.com/Morgz►FOLLOW ME ON INSTAGRAM: https://www.instagram.com/morgz►ADD MY SNAPCHAT: Morgz►FOLLOW ME ON TIKTOK: https://www.tiktok.com/@morgz-------------------| OTHER |------------------- ►BUSINESS ENQUIRIES: business@morgz.coSTAY AWESOME TEAMMORGZ!! :D"
"MxfAS_1bnoU","Lingard, Shaw & Stones Return As Watkins & Johnstone Get Called Up 🦁  | Player Arrivals","2021-03-23T12:16:11Z","UCNT2e7Og56vm5_V-yJWvglA","England","17","21.24.03","england|england arrivals|england football team|england player arrivals|gareth southgate|jesse lingard|john stones|john stones england|lingard|lingard england|luke shaw|marcus rashford|mason mount|ollie watkins|raheem sterling|sam johnstone|three lions|world cup qualifiers|england world cup","407387","14883","170","1332","https://i.ytimg.com/vi/MxfAS_1bnoU/default.jpg","False","False","The Three Lions arrived at St. George's Park as they prepare for their upcoming World Cup qualifiers against San Marino, Albania and Poland. Ollie Watkins and Sam Johnstone received their first call-ups to the squad, whilst Jesse Lingard, Luke Shaw and John Stones returned to the fold. SUBSCRIBE to ensure you don’t miss a video from the England YouTube channel. Hit the bell to get notifications on our latest uploads! ► Subscribe: http://bit.ly/FATVSub► Twitter: http://www.twitter.com/england► Instagram: http://www.instagram.com/england► Facebook: http://www.facebook.com/englandteam► Twitch: https://www.twitch.tv/england► TikTok: https://www.tiktok.com/@england"
"a15czI9B91c","Starlink Mission","2021-03-24T09:37:24Z","UCtI0Hodo5o5dUb67FeUjDeA","SpaceX","28","21.24.03","SpaceX|Space|Musk|Satellite|NROl-108|Mission","370232","22160","181","843","https://i.ytimg.com/vi/a15czI9B91c/default.jpg","False","False","SpaceX is targeting Wednesday, March 24 for launch of 60 Starlink satellites from Space Launch Complex 40 (SLC-40) at Cape Canaveral Space Force Station in Florida. The instantaneous window is at 4:28 a.m. EDT, or 8:28 UTC, and a backup opportunity is available on Thursday, March 25 at 4:06 a.m. EDT, or 8:06 UTC.The Falcon 9 first stage rocket booster supporting this mission previously supported launch of the GPS-III Space Vehicle 03 and Turksat 5A missions in addition to three Starlink missions. Following stage separation, SpaceX will land Falcon 9’s first stage on the “Of Course I Still Love You” droneship, which will be located in the Atlantic Ocean. One half of Falcon 9’s fairing supported the Sentinel-6A mission and the other supported a previous Starlink mission."
"C8CHeaPgGAY","Shooting Practice, Slick Passing & Goalkeeper Training Ahead Of U21 EURO Finals | England U21","2021-03-24T10:00:04Z","UCNT2e7Og56vm5_V-yJWvglA","England","17","21.24.03","england u21 shooting practice|england u21 goalkeeper training|england u21 training shooting|england u21 finishing|england|england training|young lions|england u21 training|rhian brewster|eddie nketiah|conor gallagher|eberechi eze|curtis jones|curtis jones england u21","64963","3217","22","170","https://i.ytimg.com/vi/C8CHeaPgGAY/default.jpg","False","False","The Young Lions were hard at work ahead of the group stages of the UEFA U21 EURO Finals, where they face Switzerland U21 as their first opponent on Thursday. The team looked sharp at St. George's Park, working on their one-touch passing and finishing skills. SUBSCRIBE to ensure you don’t miss a video from the England YouTube channel. Hit the bell to get notifications on our latest uploads! ► Subscribe: http://bit.ly/FATVSub► Twitter: http://www.twitter.com/england► Instagram: http://www.instagram.com/england► Facebook: http://www.facebook.com/englandteam► Twitch: https://www.twitch.tv/england► TikTok: https://www.tiktok.com/@england"
"wo9AlOrQ3iE","Rod Wave - Tombstone (Official Video)","2021-03-24T04:00:13Z","UCenjunBhBhvKjfDAESnoppw","RodWave","10","21.24.03","rod wave|hunger games|hunger games 3|ptsd|ghetto gospel|kevin gates|lil durk|nba youngboy|NLE Choppa|Drake|Juice Wrld|Roddy Rich|YK Osiris|Yella Beezy|Jackboy|OG3Three|Money Man|Yung Dolph|Pray 4 love|Pray|Love|Pray For Love|Cuban Link|Heart On Ice|Ghetto Gospel|Heart|pray|pray for love|pray 4 love|rod wave pray for love|hip hop|rap|2020|music|rod|wave|soulfly|street|runner|streetrunner|tombstone|polog|24kgolden|justinbieber","1414234","222529","821","18328","https://i.ytimg.com/vi/wo9AlOrQ3iE/default.jpg","False","False","#rodwave #tombstone #soulflyPre-save the SoulFly Album: https://music.apple.com/us/album/soulfly/1557600260Stream Tombstone: http://smarturl.it/TombstoneRodWaveBuy Merch: https://thebottomboysurvivor.com/Follow Rod Wave:► Instagram: https://www.instagram.com/rodwave/?hl=en► Twitter: https://twitter.com/rodwave► SoundCloud: https://soundcloud.com/rodwave► YouTube: https://smarturl.it/RWYTSubCredits:Directed by @reelgoatsProduced by @blanksquareproductionsTombstone Lyrics(When the shit over it’s over I don’t know what’s after or… you know)I keep my gun in my draws ducking the sad newsMy phone say seven missed calls I know it's bad newsThis life had left me so scarred I’m knowing that's trueRemember times got so hard I got it tattooedFor sure I,Ain’t did no shows but made some breadI gotta keep the family fed lookJust talked to pops about the fedsI ain’t gon lie he had me scaredI feel em coming n***aI’ll keep on running n***aIf we go down bad, keep it a hundred n***aMy girl all in my ear screaming spend some timeI promise I’ll be here when I can get some timeRight now I gotta get what's mineI’ll be thugging til the end of timeAnd fuck these n***as cause they lameSince they love saying my nameMake sure you write the truest in the motherfucking game on my,Tombstone when they bury meBy the river they will carry meFinally I’ll be resting in peaceFinally Finally,I’ll get to fly awaySomewhere somedayfuck these n***as cause they lameSince they love saying my nameMake sure you write the truest in the game on my,Tombstone when they bury meBy the river they will carry meFinally I’ll be resting in peaceFinally Finally, yeah yeah(you know what I’m saying, I don’t really know what I’m saying, I don’t know what’s after this shitEverybody think they know but fuck it, This shit comes with a lot, it’s a lot of pressure, I’m a young n***a. Believe that man, I’m a hustler)Fuck these n***as cause they lameFinally Finally, Truest in the gameYeah yeah, yeah, yeahFinally FinallyTombstone when they bury meBy the river they will carry meFinally I’ll be resting in peaceFinally Finally, yeah"
"WjrwCSr08b4","How a massive container ship blocked Egypt's Suez Canal | ABC News","2021-03-24T08:43:16Z","UCVgO39Bk5sMo66-6o6Spn6Q","ABC News (Australia)","25","21.24.03","Australia|abc|abc news|news|canal|egypt canal|egypt|evergreen|ever given|evergreeen ship|container ship|shipping container|canal blocked|traffic jam|shipping traffic|suez|suez egypt|suez canal|ever given ship|ever given block|how did suez canal become blocked|how did ever given get stuck","52974","307","16","0","https://i.ytimg.com/vi/WjrwCSr08b4/default.jpg","True","False","One of the busiest shipping routes in the world has come to a standstill. Casey Briggs looks at how much traffic has been backed up by an unfortunate blockage in the Suez Canal.Subscribe: http://ab.co/1svxLVE  Read more here: https://www.abc.net.au/news/2021-03-24/ship-stuck-in-suez-canal-ever-given/100025314ABC News provides around the clock coverage of news events as they break in Australia and abroad, including the latest coronavirus pandemic updates. It's news when you want it, from Australia's most trusted news organisation.For more from ABC News, click here: https://ab.co/2kxYCZYWatch more ABC News content ad-free on iview: https://ab.co/2OB7Mk1Go deeper on our ABC News In-depth channel: https://ab.co/2lNeBn2Like ABC News on Facebook: http://facebook.com/abcnews.auFollow ABC News on Instagram: http://instagram.com/abcnews_auFollow ABC News on Twitter: http://twitter.com/abcnews#ABCNews #ABCNewsAustralia"
"1qLf_ecCuw4","Demi Lovato: Dancing With the Devil | Live Premiere","2021-03-23T19:00:14Z","UCZkURf9tDolFOeuw_4RD7XQ","Demi Lovato","24","21.24.03","[none]","1174626","45147","872","2235","https://i.ytimg.com/vi/1qLf_ecCuw4/default.jpg","False","False","It’s the live premiere of Demi Lovato: Dancing with the Devil, the four-part documentary, featuring Demi walking the red carpet, a conversation between Demi and director Michael D. Ratner and an exclusive acoustic performance of “Anyone”."
"Hs8rzNuz-yc","KSI's Maddest Moment","2021-03-23T20:00:03Z","UCbAZH3nTxzyNmehmTUhuUsA","SidemenShorts","22","21.24.03","Shorts|Sidemen","446431","26145","99","478","https://i.ytimg.com/vi/Hs8rzNuz-yc/default.jpg","False","False","What other clips do you want to see? Lets us know in the comments!WATCH THE ORIGINAL VIDEO HERE: (https://www.youtube.com/watch?v=ALOLO03uMN8)👉🏻: Subscribe to our Reacts Channel: https://www.youtube.com/SidemenReacts​ 👈🏻👕: Sidemen Clothing: http://www.sidemenclothing.com​👉🏻 Subscribe to our 2nd Channel: https://www.youtube.com/MoreSidemen​ 👈🏻📸: Sidemen Instagram: http://www.instagram.com/Sidemen​🐤: Sidemen Twitter: http://www.twitter.com/Sidemen#Shorts"
"MgiW0PyrBVw","We’re back","2021-03-23T21:47:23Z","UCoX-yDQICsT8zKtVDL5fXpg","chuckit or scranit","22","21.24.03","[none]","29030","6264","63","0","https://i.ytimg.com/vi/MgiW0PyrBVw/default.jpg","True","False","Cheeky review"
"LztezNYwRs4","HESITATION WITH FORFEITS FT HARRY PINERO & AJ SHABEEL","2021-03-23T20:36:56Z","UCKktpHnYOWPROE8ibLkE0Ug","Darkest Man","24","21.24.03","Darkest|Darkest man|Chunkz|Harry pinero|Harry|Beta squad|Aj|Ajshabeel","122077","23551","60","696","https://i.ytimg.com/vi/LztezNYwRs4/default.jpg","False","False","SMASH 90,000 LIKES TO SEE MORE VIDEOS WITH HARRY AND AJ!SNAPCHAT: ahmedyareeeeInstagram: darkestman"
"4gsCHLzmTvI","‘I find Gareth Bale is an idiot!’ Jan Aage Fjortoft SLAMS Bale for his disrespect | ESPN FC","2021-03-23T21:55:13Z","UCk8gzAOGprcGAFMWGzZ2zQw","ESPN UK","17","21.24.03","Gareth Bale|Gareth Bale idiot|Gareth Bale interview|Tottenham|Gareth Bale Tottenham|Gareth Bale Real Madrid|Gareth Bale exclusive|Gareth Bale Wales|Wales Euro 2020|Jan Aage Fjortoft|ESPN FC|Soccer on ESPN|ESPN Soccer|Gareth Bale golf|Jose Mourinho|Mourinho|Jose Mourinho Tottenham|Shaka Hislop|Gareth Bale injury|Gareth Bale Spurs|Spurs|Daniel Levy|Zinedine Zidane|Zidane|Craig Burley|Julien Laurens|Futbol|ESPN Deportes|ESPN|ESPN UK","162858","2884","104","809","https://i.ytimg.com/vi/4gsCHLzmTvI/default.jpg","False","False","Why does Gareth Bale continue to spark controversy when he leaves for international duty with Wales? After Bale outlines his plans to return to Real Madrid after his Tottenham loan spell, ESPN FC’s Shaka Hislop, Craig Burley, Jan Aage Fjortoft and Julien Laurens delve into his comments. Is football even important to the Welshman or is Spurs just a stepping stone? Fjortoft doesn’t mince his words for talking to Spurs as if it’s just a place to remain fit. #ESPNFC #Tottenham #Euro2020 #RealMadridSubscribe to ESPN UK: http://bit.ly/1oGUzVAFollow ESPN UK across multiple platforms:https://en-gb.facebook.com/ESPNUKhttps://twitter.com/ESPNUKhttps://www.espn.co.uk/"
"2aTCsGHB_5I","TELLING OUR FAMILIES & FRIENDS WE'RE PREGNANT","2021-03-23T17:01:02Z","UC8_ESAUsL0xXWNPHdHZDsqA","Imogenation","24","21.24.03","[none]","148109","12571","56","1120","https://i.ytimg.com/vi/2aTCsGHB_5I/default.jpg","False","False","Surprise!! I am so happy to finally show you the reactions of our families & friends when they found out we are having a baby!! So beyond grateful, we love you guys so much xxxMy reaction video: https://www.youtube.com/watch?v=wYNRQr9l110Telling My Husband I'm Pregnant: https://www.youtube.com/watch?v=zpMfaggoVZkFollow me on socials: Instagram: https://bit.ly/2AqqIgT​Twitter: https://bit.ly/2OtFMwW​Tik Tok: @imogenation13Snapchat: Imogenhudson93Depop: @imogenation_"
"FZ4SVG2meTQ","If Among Us Had 9 Impostors","2021-03-22T15:30:16Z","UCn3AViOfcFN4zIICMC5hvPg","Shiloh & Bros","22","21.24.03","among us|among us in real life|among us imposter|in real life|irl|among us reality|if everything was like among us|imposter iq|imposter among us|imposter|among us but in real life|real life|among us irl|among us parody|among us skit|funny among us|funny|funny among us moments|real life among us|imposter iq 999|imposter vs crewmate|imposter in real life|siblings|comedy|shiloh|shiloh and bros|shiloh nelson|among us song|funny among us video","6205270","128735","7821","17458","https://i.ytimg.com/vi/FZ4SVG2meTQ/default.jpg","False","False","Among us in real life but with nine impostors and one crewmate 😱  This part of our If Everything Was Like Among Us videos! Which person do you relate to the most? Thank you to the Portland Spirit for letting us film on their boat! https://www.portlandspirit.comIf you like Piper Rockelle, The Norris Nuts, Dixie D'Amelio, or the Txunamy, you'll love our channel. We do funny pranks, challenges, and skits!Shiloh's Instagram: https://www.instagram.com/shilohanelson/   Elijah's Instagram: https://www.instagram.com/iamelijahnelson/Micah's Instagram: https://www.instagram.com/heythisismicah/?hl=enJudah's Instagram: https://www.instagram.com/judahnelson/?hl=enBritney's Instagram: https://www.instagram.com/britneyleighnelson/Aislinn's Instagram https://www.instagram.com/aislinnelimcc/?hl=enSubscribe here! http://bit.ly/ShilohToJudahChannelHit the bell to be notified when we post new videos! #amongus #imposteramongus #inreallife"
"PFPfxcvRshk","Burna Boy - 23 [Official Music Video]","2021-03-23T17:00:13Z","UCEzDdNqNkT-7rSfSGSr1hWg","Burna Boy","10","21.24.03","burna boy|burner boy|burnaboy|Damini Ogulu|Atlantic Records|reggae|reggae dancehall|Nigerian|Lagos|sekkle down|pree me|heaven's gate|nigerian music|ye song|ye ye|twice as tall|burna|23|jordan|23 burna|23 video|burna grammy|twice as tall burna|burna boy 23","729513","60532","353","4801","https://i.ytimg.com/vi/PFPfxcvRshk/default.jpg","False","False","Burna Boy - 23Stream/Download 'Twice As Tall' : https://Burna.lnk.to/TwiceAsTallSubscribe for more official content from Burna Boy: https://Atlantic.lnk.to/BurnaBoySubscribeFollow Burna BoyWebsite : https://Burna.lnk.to/OfficialInstagram: https://Burna.lnk.to/InstagramTwitter: https://Burna.lnk.to/TwitterFacebook: https://Burna.lnk.to/Facebook TikTok: https://Burna.lnk.to/TikTok Triller: https://Burna.lnk.to/TrillerListen to Burna BoyYouTube: https://Burna.lnk.to/YouTubeSoundcloud: https://Burna.lnk.to/SoundCloudApple Music: https://Burna.lnk.to/AppleSpotify: https://Burna.lnk.to/SpotifyDeezer: https://Burna.lnk.to/DeezerBoomplay: https://Burna.lnk.to/BoomplayThe official YouTube channel of Atlantic Records artist Burna Boy. Subscribe for the latest music videos, performances, and more."
"OLjMNxw2fVY","Youtubers vs 12 Year Old Genius In Real Life....","2021-03-22T20:04:40Z","UC9-3c4LzdzT_HvW3Xuti9wg","Calfreezy","24","21.24.03","Soccer|Football|Calfreezy|Rebel|Rebel FC|London|England|How to|Footy|Tekkers|YouTuber|Challenge|Soccer Skills|Football Skill|Trick Shots|Soccer Fails|Football Fails|Tricks|Freestyle Football|funny|comedy|friends|vlog|vlogging|freezy","542867","36691","419","1232","https://i.ytimg.com/vi/OLjMNxw2fVY/default.jpg","False","False","Once again sorry for the audio but I loved this video so much that I wanted to put it out!Big up to Ollie for coming through, donny was an absolute legend.🔔: Subscribe & click that notification bell so you don't miss anything!📱: Follow me on my socials so you don't miss anything!:       ► Instagram - http://www.instagram.com/Calfreezy       ► Twitter - http://twitter.com/Calfreezy       ► Twitch - http://www.twitch.tv/Calfreezy       ► Tik Tok - @Calfreezy💻: Join my Discord!        ► https://discord.gg/sHmpz7D"
"bz7rq7dvX0s","Get to know me !!","2021-03-23T17:15:38Z","UCOioBz79f74LeFaf6W7N_2Q","Grace Conder","26","21.24.03","[none]","73478","7933","65","1061","https://i.ytimg.com/vi/bz7rq7dvX0s/default.jpg","False","False","hey guys make sure to hit the subscribe button xinstagram- https://www.instagram.com/graceconder/?hl=en"
"3Xjw2ynIkKs","OFB on UK Drill, No Longer Dissing Opps on Their Records (Part 1)","2021-03-23T22:15:00Z","UCg7lal8IC-xPyKfgH4rdUcA","djvlad","24","21.24.03","[none]","23697","1252","37","598","https://i.ytimg.com/vi/3Xjw2ynIkKs/default.jpg","False","False","In this clip, OFB detailed their first recording session back in 2015 before they began to think a music career was possible. Bandokay and Double Lz described some of their musical influences including Chicago drill artists like Chief Keef and founding member OFB, Headz. They also talked about bringing UK drill to a wider audience and why they've ascended beyond responding to diss tracks. Watch the full interview now, ad-free, as a VladTV Youtube Member: https://youtu.be/7jh-CVo1i3s"
"advLPnRy12Y","Tufting a Stop Asian Hate Rug","2021-03-21T19:30:31Z","UCTBGH7y-WPy4NPsPKTPXLEw","SIMJI Shorts","24","21.24.03","rug tufting|tufting rug|tufted rug|tufting a rug|tufting|carpet tufting|tufting gun|simji|custom rug|how i tuft a rug|how to tuft a rug|tufting a stop asian hate rug|stop asian hate|racism|asian racism|stop asian hate rug|diy rugs|how to make rugs at home|diy rugs at home|simjiofficial|simji rugs","648555","82554","2504","4917","https://i.ytimg.com/vi/advLPnRy12Y/default.jpg","False","False","My heart goes out to those who lost loved ones❤Instagram/TikTok - @simjiofficialMain channel - https://www.youtube.com/channel/UCshZhWW8AP9lH6b1AgGe2XQ#shortsSong Used: Music usedSummit - by Jonny EastonLink: https:; youtu.be; ZH5B_C8r9DkCheck out his channelLink: https:; www.youtube.com; jonnyeasto;"
"8Mc6zZxBTLA","Wives’ Sports Trivia FAILS 😹 | OT 25","2021-03-22T22:00:19Z","UCRijo3ddMTht_IHyNSNXpNQ","Dude Perfect","17","21.24.03","dude perfect|dude perfect stereotypes|dude perfect water bottle flip|bottle flip|water bottle flip|dude perfect bottle flip|dude perfect basketball|dp|dude perfect world record|edition|nerf|trick shots|trick shot|family|ping pong|bowling|clean|family friendly|bubble wrap|soccer|football|spinner|spinners|fidget spinners|dude|ty|wheel unfortunate|ned|braces|dentist|hack attack|get crafty|egg drop|egg|wives|chad|sports|trivia|sports trivia|garrett|coby|cody","6638997","296262","4857","32223","https://i.ytimg.com/vi/8Mc6zZxBTLA/default.jpg","False","False","Egg Drop Challenge featuring GIANT OSTRICH EGGS! Wives vs. Chad returns along with a brand new segment, HACK ATTACK!► Thanks for subscribing! - http://bit.ly/SubDudePerfect► Get your Dude Perfect Toothbrush! - https://bit.ly/DPToothbrush► Subscribe to our DP Plus Channel: http://bit.ly/DPplusSubscribeCOMMENT YOUR FAVORITE SEGMENT!-------------------------------------------Thanks for watching #Overtime25Intro: 0:00Wheel Unfortunate: 0:37Get Crafty: 06:00Wives vs. Chad: 13:49Hack Attack: 20:26NEXT LEVEL STUFF -------------------------------------------🎒 NEW Merch - http://bit.ly/DPStore🎮 Play our FREE iPhone game! - http://smarturl.it/DudePerfect2📱 Text us - (469) 205-7005🔔 Hit the bell next to Subscribe so you don't miss a video!👨🏻‍💻 Watch our newest vids! - http://bit.ly/NewDPVids📕 Read our Book - Go Big - http://amzn.to/OYdZ2sFollow our Instagrams so we can be best friends -------------------------------------------🏆 http://Instagram.com/DudePerfect🧔🏻 http://Instagram.com/TylerNToney👱🏻‍♂️ http://Instagram.com/Cody_Jones_🙋🏻‍♂️ http://Instagram.com/CobyCotton👨‍🦰 http://Instagram.com/GarrettHilbert⛹🏻‍♂️ http://Instagram.com/CoryCotton-------------------------------------------Bonus points if you're still reading this! COMMENT WHO YOU THINK WILL WIN THE EGG DROP CHALLENGE IN OT 26!Click here to learn more about Dude Perfect:http://bit.ly/AboutDudePerfectAs always...Go Big and God Bless!- Your friends at Dude PerfectBusiness or Media, please contact us at: Dude@DudePerfect.com------------5 Best Friends and a Panda.If you like Sports + Comedy, come join the Dude Perfect team!Best known for trick shots, stereotypes, battles, bottle flips, ping pong shots and all-around competitive fun, Dude Perfect prides ourselves in making the absolute best family-friendly entertainment possible! Welcome to the crew! Pound it 👊🏻 Noggin 🙇🏻‍♂️ - Dude Perfect"
"wTyNDzIuTJ4","I was buried in 3 tonnes of cheese","2021-03-22T20:11:25Z","UCOgUcv_9DaivXzsN9mcHIzQ","TGFbro","24","21.24.03","jay swingler|tgf|sidemen|crystal maze|moresidemen|how many rappers can you name|romell|police|trapped in a locker|zerkaa|christmas|jay swingler clips|saving his life|opens up|ksi|talia|uncleromell","926270","124290","1373","4656","https://i.ytimg.com/vi/wTyNDzIuTJ4/default.jpg","False","False","We spent the day buried in 3 tonnes of cheese. I hate this video𝗦𝗢𝗖𝗜𝗔𝗟𝗦 𝗕𝗘𝗟𝗢𝗪:Jay:Instagram - https://www.instagram.com/byjayswingler/?hl=enTwitter - https://twitter.com/JayFromTGFYouTube - https://www.youtube.com/channel/UCvmejiV9xeMv-yNgAPk2e_QRomell:Instagram - https://www.instagram.com/uncleromell/?hl=enTwitter - https://twitter.com/RomellHenryTgfYouTube - https://www.youtube.com/channel/UCoBWkLSzC5q8xOtOHwv6MGQLuke:Instagram - https://www.instagram.com/lukespittle/?hl=enTwitter - https://twitter.com/LukeFromTGFYouTube - https://www.youtube.com/user/lukespittle95Phelan:Instagram - https://www.instagram.com/pheluhn/?hl=enTwitter - https://twitter.com/primalafamiglia"
