video_id,title,publishedAt,channelId,channelTitle,categoryId,trending_date,tags,view_count,likes,dislikes,comment_count,thumbnail_link,comments_disabled,ratings_disabled,description
"8BlQPORtSsQ","Lil Baby Feat. Megan Thee Stallion - On Me Remix (Official Video)","2021-04-27T19:00:13Z","UCM1gEqLPsgej7ZKzu9w8v7A","LilBabyVEVO","10","21.28.04","lil baby|megan thee stallion|on me remix|on me challenge|est gee|real as it gets|on me|errbody|music|fortnite|rap|dababy|polo g|lil durk|baby|tiktok mashup|nba youngboy|king von|nle choppa|young thug|hip hop|drill|best friend|lamborghini|gunna|music video|lil baby type beat|meek mill|lyrical lemonade|kevin gates|rod wave|gucci mane","4396315","148905","6380","13374","https://i.ytimg.com/vi/8BlQPORtSsQ/default.jpg","False","False","Watch the official music video for Lil Baby Feat. Megan Thee Stallion - On Me RemixStream/Download Lil Baby Feat. Megan Thee Stallion - On Me Remix  here: https://QualityControl.lnk.to/OnMeRemixFollow Lil Baby Everywhere:Instagram: https://www.instagram.com/lilbaby_1/​​TikTok: https://www.tiktok.com/@lilbaby​​ Twitter: https://twitter.com/lilbaby4PF​Lil Baby Feat. Megan Thee Stallion - On Me Remix Lyrics:[Verse 1] Fill the bando up with bands Give the lil bro them a job You can come get rich with us You gone eat or you gone starve Keep a certified hittas and I pay him not to rob Hop out 2020 Cullinan and I’m riding in a star Know some people hate that I’m on top I bulletproof the car All the members made three bands our pack live like they cracking cards Joe know for a fact I keep it real he still ain’t take the charge Why she talkin’ crazy bout me like I don't do more than my part I can’t play with my creation give the world to my lil boy I been saving more than I been spending that’s what I be on I’m a human I’m not perfect I know sometimes I be wrong  [Hook] I’m like come and put that pussy on me  Dont be running from me If I like it I spend money on it Get whatever from me Put six figures in your business  I do real shit I drop cash at the dealership They’ll mail you a pink slip She make sure she keep her nails did and her wig fixed Went to jail and that one held me down she a real bitch Hundred rounds in this double drum  It’s a kill tent  Marco been in prison for a while but he still flexin’  [Megan Thee Stallion] This ain’t tag why you running from me  Suck it while he cummin’  When I do my little dance get the Kelly and the Birkin  If he act up I don’t give a fuck I am a rich bitch I’ll be damned if a nigga have me cryin’ in the whip Ok he sensitive when it come to me Talk shit like he running me He’ll leave out and come right back Cause he know them bitches can’t fuck with me I don’t understand how they go to sleep and then wake up in my bidness  I don’t know what chain I’m putting on my Cuban link or my tennis  I know bitches gotta be losing money how they keep watching me winning Told him boy since you keep looking at it Might as well go ahead and spend it Make a mooove  Baby you know what to dooo  [Hook] I’m like come and put that pussy on me  Dont be running from me If I like it I spend money on it Get whatever from me Put six figures in your business  I do real shit I drop cash at the dealership They’ll mail you a pink slip She make sure she keep her nails did and her wig fixed Went to jail and that one held me down she a real bitch Hundred rounds in this double drum  It’s a kill tent  Marco been in prison for a while but he still flexin’  I’m like come and put that pussy on me  Don't be running from me If I like it I spend money on it Get whatever from me #LilBaby #MeganTheeStallion #OnMeRemixMusic video by Lil Baby, Megan Thee Stallion performing On Me (Remix). Quality Control Music/Motown Records; © 2021 Quality Control Music, LLC, under exclusive license to UMG Recordings, Inc.http://vevo.ly/5B2LpQ"
"h1EmqGSeisg","Old People Got Weird Products - JonTron","2021-04-27T18:30:55Z","UCdJdEguB1F1CiYe7OEi3SBg","JonTronShow","23","21.28.04","jontron|jontronshow|old people|funny|comedy","1811088","244697","1615","25445","https://i.ytimg.com/vi/h1EmqGSeisg/default.jpg","False","False","Get Honey for FREE today ▸ http://joinhoney.com/jontronHoney finds coupons with one click. Thanks to Honey for sponsoring!--Follow JonTron Here:Instagram: http://www.Instagram.com/JonTronShow​Twitter: http://www.Twitter.com/JonTronShow​Business Inquiries:jontron(at)ellifyagency.com--Crew:Jon Jafari - Director/Editor/WriterSergio Torres - Director of Photography/Line Producer/CreativeAndrew Reynoso - Key Grip/CreativeLewis Bown - Editor/WriterMaria Alexandria - Special Effects/MakeupCharlotte Jafari - Production Assistant"
"I_il4nnmuUs","i'm deleting this video on friday","2021-04-27T20:03:41Z","UCS5Oz6CHmeoF7vSad0qqXfw","DanTDM","22","21.28.04","dantdm|dan tdm","2653797","319856","2219","47891","https://i.ytimg.com/vi/I_il4nnmuUs/default.jpg","False","False","NEW SHORTS CHANNEL : http://www.youtube.com/c/dantdmshorts?sub_confirmation=1NEW MERCH : http://buymerch.dantdm.com"
"kqWIQI-0zlk","I joined a Fashion Show as SPONGEBOB & PATRICK!","2021-04-27T20:40:03Z","UCJ8RtaYEROGEMdyUAqgO-9g","Trimix","20","21.28.04","fortnite|fortnite fashion show|fashion show|fashion show fortnite|trimix fashion show|fortnite fashion show live|fortnite show|fortnite live fashion show|fortnite skin contest|fortnite fashion shows|fortnite fashion show custom skins|custom fortnite skins|fortnite custom skins|fortnite skin|fortnite contest|fortnite fashion|fortnite emote|fortnite live|fashion show with unreleased skins|trimix","642189","33974","682","6726","https://i.ytimg.com/vi/kqWIQI-0zlk/default.jpg","False","False","► I joined a Fashion Show as SPONGEBOB & PATRICK!Today I joined a Fashion Show with Custom Fortnite Skins. I joined using Skins from different games! (Fortnite Spongebob & Patrick Skins)► Join my Discord: https://discord.gg/WWBqzgs@ninon @sneep ► Thanks for the help: https://twitter.com/YouTubeCDNR► Instagram: https://www.instagram.com/official_trimix/► Follow me here for more!• Twitter: https://twitter.com/official_trimix• Instagram: https://www.instagram.com/trimixyoutube/• Business Inquiries: business@trimix.co• Fan Messages, etc...: fan@trimix.co► If you want to see more make sure you subscribe and turn on notifications! https://goo.gl/4pwcru"
"QqsLTNkzvaY","The Most Extreme Things in the Universe - Ultimate Guide to Black Holes","2021-04-27T13:59:20Z","UCsXVk37bltHxD1rDPwtNM8Q","Kurzgesagt – In a Nutshell","27","21.28.04","[none]","2248127","198135","1068","12588","https://i.ytimg.com/vi/QqsLTNkzvaY/default.jpg","False","False","If you want to continue thinking about black holes a tad more, you can do so by getting one of the many black hole related things the Kurzgesagt team made with love: https://bit.ly/3dRJj71Sources & further reading:https://sites.google.com/view/sources-black-holes/Our Video on Neutronstars: https://youtu.be/udFxKZRyQt4Our Video on the Information Paradox: https://youtu.be/yWO-cvGETRQBlack holes are the most powerful and extreme things in the universe and they are wildly weird and complicated. What would happen if you fell inside one and what are they really?OUR CHANNELS▀▀▀▀▀▀▀▀▀▀▀▀▀▀▀▀▀▀▀▀▀▀▀▀▀▀German Channel: https://kgs.link/youtubeDE Spanish Channel: https://kgs.link/youtubeES HOW CAN YOU SUPPORT US?▀▀▀▀▀▀▀▀▀▀▀▀▀▀▀▀▀▀▀▀▀▀▀▀▀▀This is how we make our living and it would be a pleasure if you support us!Get Merch designed with ❤ https://kgs.link/shop  Join the Patreon Bird Army 🐧  https://kgs.link/patreon  DISCUSSIONS & SOCIAL MEDIA▀▀▀▀▀▀▀▀▀▀▀▀▀▀▀▀▀▀▀▀▀▀▀▀▀▀Reddit:            https://kgs.link/redditInstagram:     https://kgs.link/instagramTwitter:           https://kgs.link/twitterFacebook:      https://kgs.link/facebookDiscord:          https://kgs.link/discordNewsletter:    https://kgs.link/newsletterOUR VOICE▀▀▀▀▀▀▀▀▀▀▀▀▀▀▀▀▀▀▀▀▀▀▀▀▀▀The Kurzgesagt voice is from Steve Taylor:  https://kgs.link/youtube-voiceOUR MUSIC ♬♪▀▀▀▀▀▀▀▀▀▀▀▀▀▀▀▀▀▀▀▀▀▀▀▀▀▀700+ minutes of Kurzgesagt Soundtracks by Epic Mountain:Spotify:            https://kgs.link/music-spotifySoundcloud:   https://kgs.link/music-soundcloudBandcamp:     https://kgs.link/music-bandcampYoutube:          http://kgs.link/music-youtube2021Facebook:       https://kgs.link/music-facebookThe Soundtrack of this video:Soundcloud:   https://bit.ly/3tTZztYBandcamp:     https://bit.ly/32O2iJn🐦🐧🐤 PATREON BIRD ARMY 🐤🐧🐦▀▀▀▀▀▀▀▀▀▀▀▀▀▀▀▀▀▀▀▀▀▀▀▀▀▀Many Thanks to our wonderful Patreons from http://kgs.link/patreon who support us every month and made this video possible:Harshul Banthia, Priyadarshi Siddharth, Ethan, Chad, Mason Lagos, Zinovia, BigOlive, Edgar Galan, Lance Liu, Super Luigi Bros Animations, Nicolas Eckert, Drashya Goel, Francois, Seanskios, Alessandro Ticozzi, Cameron McPhail, Ace Sparrow, Russell Stockhammer, o+o, Alec Hogben, Mikolaj Pawlikowski, Alexandra Cheung, SubSonixx, Guillaume VIDAL, Andy Highland, Arina Maria Neculai, Jeremy Engelberg, Josh Lavine, Azreal, Jeremy Clark, Jordi Malaret, Daniel Lo, Kenna Miller, Motin, rayV, Maximo Brito, bque23, Evhen Samchuk, Riyo, Giakeimas, Sunny Bär, Alexander Utz, Gaspard Medina-Creimer, James McClelland, David Nejedlý, George-Cristian Bîrzan, James Ilesley, JP, Ariel Tubbs, Anon, Felicity, Prashanth Samuel, Doop a Derp, Brettyoke49, Oksana Sivchenko, Rene Duedam, Kacey Armbruster, Yu Shing Cheng, osama bin laden's cousin's white best friend, Miko Boulerice, Skyler Martin, Matt Harlow, Arash Amini, Christopher Thomas, João Pinheiro, Raj Patel, Maurizio, panic, Raghav Mahajan, Mate Serdult, Ethan (cathethanoob), Warren Price, Laiton, Drew Johnson, Cole Reid, Daniel Mayor, Vincent Strüh, Gamerbot43, Jonathan Elbaz, matt yang, Nikita Ivanov, Lindsay, David, IsThisRealLife, Sam Wallick, alxpck, Aina Piera Tur, Darius Soo Lum, Happy 1 Year Will Smith"
"MQVssQStc_w","Escaping Minecraft's Tallest Prison (titan's vault V2) ft. MiningBlob","2021-04-27T21:00:16Z","UC8b6neqf87RVBAkN_BLrS6A","MythrodakTV","20","21.28.04","Dream|Minecraft|Inescapable Prison|Prison|Inescapable|Mythrodak|MiningBlob|Vault|Titan's Vault|minecraft prison","605126","35666","367","4575","https://i.ytimg.com/vi/MQVssQStc_w/default.jpg","False","False","Titan's Vault is, so far, the most inescapable prison in Minecraft (in my opinion)Can I escape it? Let's find out.HUGE thanks to MiningBlob for recording the lines in the beginning and making this prison:https://www.youtube.com/channel/UC9YLc6TUWMAm5UI0N7ZjE7gAlso thanks to FadezElias for helping build the prison:https://www.youtube.com/channel/UC6NmCkxHaLgW1ZnZBRAGH8gAnd of course huge thanks to YOU! For making all my hard work worthwhile :)TIMESTAMPS0:00 - opening1:02 - intro2:48 - safety measures5:05 - phase one: setup6:08 - phase two: entry8:19 - phase three: patience9:35 - EPILEPSY WARNING9:44 - phase four: perseverance11:32 - outroMUSICLittle Nightmares 2 OST-Prison Escapes Playlist-https://youtube.com/playlist?list=PLhc9ck0E4M_1OIBkJL10l3xktLX-1whaW-Dream SMP Playlist-https://youtube.com/playlist?list=PLhc9ck0E4M_00iVVHp7D56n_LLolOqb8o-Bedwars Playlist-https://www.youtube.com/watch?v=ILhXtEzLdpg&list=PLhc9ck0E4M_2PZosdmPMSUzyPxyQ_orES-Skywars Playlist-https://www.youtube.com/watch?v=FFOk-yATLdI&list=PLhc9ck0E4M_0C10oQVMuLRXG0PHROS70G-Uploads Playlist-https://www.youtube.com/watch?v=fh2FEtvIags&list=PLhc9ck0E4M_0MisJmO9EvsGPr3R2MGFLn-My First Video-https://www.youtube.com/watch?v=fh2FEtvIags&t=25s-Other Channel-https://www.youtube.com/channel/UCN9889jhcY9MgH9-NCiJ-vA-Music-https://www.youtube.com/playlist?list=PLCjaU_SKjgE6ZM0VhyDCvnYdXvrerrb78Twitter: MythrodakUntil next time, ladies, tootloo!"
"uoP_8iX78jc","Hit Rap Songs in Voice Impressions 3! ft. Polo G, Dababy, Lil Nas X, Pooh Shiesty, + MORE","2021-04-27T22:30:15Z","UCiwIAU4SNlrcv47504JrJeQ","Azerrz","23","21.28.04","rap god|rap beats|rap songs|type beat|polo g type beat|polo g rolling loud|polo g beatbox|polo g unreleased|polo g rapstar|dababy convertible|dababy beatbox|dababy rockstar|dababy masterpiece|beatbox 2|beatbox remix|beatbox instrumental|beatbox nle choppa|lil nas x old town road|lil nas x montero reactions|montero|call me by your name|rap parody|rap freestyle|music parody|viral|tik tok viral|tik tok song|tik tok|drake","439525","67579","259","4258","https://i.ytimg.com/vi/uoP_8iX78jc/default.jpg","False","False","WHO HAD THE BEST VERSE? LIKE FOR PART 4!NEW MUSIC BY 4RIF ON THE WAY! FOLLOW ME ON INSTAGRAM FOR EXCLUSIVE CONTENT: https://instagram.com/azerrz.4rifNEW INTRO + AVATAR WAS MADE BY The Smash Toons: https://youtube.com/c/TheSmashToonsI do NOT own any footage or instrumentals in this videoThis video is a parody and no money will be made from itFootage used in order:- Predator (1987)- Arnold Schwarzenegger Bodybuilding Beginner Exercises: https://youtu.be/bTGPfJUJRh0- Terminator (1984)- Terminator 2: Judgment Day (1991)- Phineas and Ferb - Harry Potter and The Chamber of Secrets- The Grinch (2000)- Rocky (1976)- Rocky IV (1985)- The Jabbawockeez & Mickey Mouse Dance: https://youtu.be/VilIKBB2IxY- Mickey, Donald & Goofy The Three Musketeers - Down the Hatch | A Mickey Mouse Cartoon: https://youtu.be/0dcqDCoJ6F8- hip hop Mickey from Disney Dance Crew part1: https://youtu.be/uoP_8iX78jc- Various Disney+ Trailers - Avatar (2009)- The Mandalorion - Star Wars- It (2017)- It Chapter 2 (2019)- Birds of Prey (2020)- Batman Arkham Asylum- Batman the Animated Series- Batman: The Killing Joke (2016)- Joker (2019)- The Dark Knight (2008)- Su***de Squad (2016)- Batman (1989)- Dancing green iguana: https://youtu.be/Ju76SN4crkk- Obama and Biden - Running for President: https://youtu.be/-2dHI9U9ujk- Avengers: Infinity War (2018)- Black Panther (2018)- Avengers: Endgame (2019)- Black Panther Challenge x2: Walking Out and back in to Black Panther Movie Like... : https://youtu.be/IvbS79F-XFk"
"60EnsmtmBvA","Israel Adesanya Reacts To CRAZY UFC 261| Talks Marvin Vettori Rematch","2021-04-27T19:34:39Z","UC1oigGPZ4A6atKCnj17ow8Q","FREESTYLEBENDER","22","21.28.04","stylebender|israel adesanya|ufc261|reaction|live|mma|ufc|champ|middleweight|fitness|credit|e-commerce|loans|lawyer|marketing|sofware","595242","24488","221","1791","https://i.ytimg.com/vi/60EnsmtmBvA/default.jpg","False","False","Stylebender watches UFC 261 and talks about his upcoming rematch with Marvin Vettori.Like & Subscribe Edited by: Stayhydrated.mp4"
"NYWDgu5sc6A","Moneybagg Yo - GO! (with Big 30) (Official Music Video)","2021-04-26T17:00:22Z","UCrdPrDuDCbG8xayk5QkRLQA","MoneyBagg Yo","10","21.28.04","Moneybagg Yo|CMG|moneybagg fr|Moneybagg Yo fr|fr Moneybagg Yo|a gangsta’s pain|a gangster’s pain|a gangstas pain|moneybagg a gangstas pain|Moneybagg Yo a gangstas pain|a gangstas pain mixtape|gangstas pain|Moneybagg Yo new music|Moneybagg Yo 2021|Big 30|Bread Gangg|Big CEO 30|Big 30 and Bagg|Memphis|Yo Gotti|EST Gee","805774","33701","657","2012","https://i.ytimg.com/vi/NYWDgu5sc6A/default.jpg","False","False","Moneybagg Yo's new album A Gangsta's Pain out now: https://MoneybaggYo.lnk.to/AGangstasPain​Follow Moneybagg Yo:http://www.instagram.com/moneybaggyo/​​​http://www.twitter.com/moneybaggyo/​​​http://www.facebook.com/moneybaggyo/​​​Lyrics:BlrrrdThat’s why it’s switches on my glee (p***y)And we put bump stock 2-2-3 (p***y)Blrrrd Charity I gave it to them peopleYou fucking with a certified speaker Verse 1Not you posed to be gangsta but salty bout the hoe (crazy)How the fuck my artist bigger than yo CEO (blrrrd)Why the hell she know I’m toxic but still fuck with meIt’s plentiful right now I’m still pouring on a pint of VPrezi rolex emerald cut still ain’t seen a watch like this junt (nope)All white guts bitch can’t sit in here on her time of the month (period)Plain Jane shirt but it’s a stack cuz it say Saint Laurent (cost)Choppas and my dollars up shootas hungry get gobbled up (get ate)Stand-up guy won’t speak on nothing that I see or saw (shhhh)Real weed soon as I snatch it it’s already bought (it’s gone)Went to the right doctor her booty and her titties soft (she grown)Condom in my pocket anxious I still fucked her rawMy pull out game weak (mane)I pluck I tweak (f**k)Red and white supreme skiEleven whips I go Kyrie (go)Tryna steal the recipe you just a Bagg wanna beBipolar personality that’s why it’s switches on my glee BlrrrdThat’s why it’s switches on my glee (p***y)And we put bump stock 2-2-3 (p***y)Blrrrd Blrrrd BlrrrdFlip a nigga street Verse 2 – Big 30Aye !Now how the fuck you get some fame I been a oppThem folks ain’t rocking witcha they watching till you get droppedI keep clutching on this glock cuz these rocks popping out my watchAin’t nobody on yo block cuz I’m the one who scoped the dropI’m the one who knocked up on yo door hit through there with that choppaBitch we no hospital gang nigga blessed if he see a doctorIt’s 220 on the dash bitch I just left a helicopterIt’s a pint up in this car twenty bo’s and a couple roxy’sAye I’m sliding with a thottyI’m sliding with a nigga bitchJust got the drop from the lil hoeStop thinking wit ya dickPo’d a trey of wocky in a Fanta they thought it was tristHoe this 600 worth of drank this shit thicker than grits Give it to em, I gave it to emSaid you know I did it I gave it to emCharity done gave it to them peopleYou fucking with a certified sweaper#MoneybaggYo​​​ #BIG30​ #GO​ #AGangstasPain​​"
"ChZaqqoNg-0","Apex Legends – Legacy Gameplay Trailer","2021-04-26T15:00:16Z","UC0ZV6M2THA81QT9hrVWJG3A","Apex Legends","20","21.28.04","Apex Legends|Apex Legends characters|new Apex Legend|Apex Legends Valkyrie|Apex Legends Season 9|Apex Legends Arenas|Apex Legends Legacy|Battle Pass|Legacy Battle Pass|Apex Legends new season|Apex Legends game|Respawn Apex Legends|Battle Royale game|Battle Royale|Battle Royale shooter|Apex Games|squad play|multiplayer shooter|Apex Legends PS4|Apex Legends Xbox|Apex Legends PC|Apex Legends Origin|Respawn Entertainment|Electronic Arts|Titanfall 2","5718821","318952","2760","21101","https://i.ytimg.com/vi/ChZaqqoNg-0/default.jpg","False","False","Apex Legends: Legacy brings a new form of competition, Arenas. Drop into a new action-packed 3v3 game mode. Sharpen your skills in new, bespoke maps like Party Crasher and Phase Runner. It’s just your squad and their squad, so hiding isn’t an option.We’d wish you luck, but in Arenas, there isn’t any. This is a true test of skill.Valkyrie, daughter of notorious Titan Pilot Viper, is also joining the Games. Take advantage of her jetpack to own the sky and rain missiles down on your foes. Master the new high-precision Bocek Bow to skewer your opponents and drop into an Olympus that’s been mysteriously transformed. Plus grab the latest Battle Pass and prove yourself in Ranked.There’s nowhere to hide this season, Legends. Ready to find out if you’re predator or prey? Discover your true nature when Apex Legends: Legacy launches May 4!Apex Legends™ is a free-to-play battle royale game where legendary characters battle for glory, fame, and fortune on the fringes of the Frontier. Play for free now on PlayStation® 4, PlayStation 5, Xbox One, Xbox Series X|S, Nintendo Switch, and PC via Origin and Steam.Learn more about Apex Legends: Legacy: http://x.ea.com/68308 Check out our YouTube channel: http://x.ea.com/56710.Follow us on Twitter: https://twitter.com/playapex.Follow us on Instagram: https://www.instagram.com/playapex/.#ApexArenas #ApexLegacy #ApexLegends"
"66TYJJObd6E","Happier Than Ever","2021-04-26T16:00:27Z","UCiGm_E4ZwYSHV3bcW1pnSeQ","Billie Eilish","10","21.28.04","[none]","6260099","933529","11250","66745","https://i.ytimg.com/vi/66TYJJObd6E/default.jpg","False","False","Billie Eilish - “Happier Than Ever”The new album, out July 30Pre-save/add/order now: https://billieeilish.lnk.to/HappierThanEverFollow Billie Eilish:Facebook: https://BillieEilish.lnk.to/FacebookInstagram: https://BillieEilish.lnk.to/InstagramTwitter: https://BillieEilish.lnk.to/TwitterYouTube: https://www.youtube.com/BillieEilish​​Email: http://smarturl.it/BillieEilishEmail​​Store: http://smarturl.it/BillieEilishStore"
"eG9KzyVO638","WILLOW - t r a n s p a r e n t s o u l feat. Travis Barker (Performance Visual)","2021-04-27T16:59:56Z","UCgnKlNm0QJY_9LKJ4vHPspg","willowsmith","24","21.28.04","willow smith|willow|smith|smiths|willowsmith|willow smith youtube|Transparent Soul|Travis Barker|wait a minute|Time machine|Whip my hair|You left your dairy at my house|meet me at our house|female energy part 2|lately i feel everything|I can see right through just so you know|t r a n s p a r e n t s o u l","240501","34519","490","3221","https://i.ytimg.com/vi/eG9KzyVO638/default.jpg","False","False","Official performance video t r a n s p a r e n t s o u l by WILLOW ft. Travis Barker.Stream t r a n s p a r e n t s o u l ► https://Willow.lnk.to/TSoul► SUBSCRIBEhttps://www.youtube.com/user/willowsmith​► FOLLOW WILLOW:Instagram: https://www.instagram.com/willowsmith/Facebook: https://www.facebook.com/OfficialWillow/Twitter: https://twitter.com/OfficialWillow/Website: https://www.WillowSmith.com/Shazam: https://www.shazam.com/artist/5360632/willow/Subscribe to YouTube Music: https://w-llw.me/willowytm► FOLLOW Travis Barker:Instagram: https://www.instagram.com/travisbarker/Twitter: https://twitter.com/travisbarkerFacebook: https://www.facebook.com/travisbarkerofficial► LYRICS:I don’t fuckin know if it’s a lie or it’s a factAll your little fake friends will sell your secrets for some cashSmile in my face then put your cig out on my backIf you ever see me just get to runnin like the flashI knew a boy just like youHe’s a snake just like youSuch a fake just like youBut I can see the truthTransparent soulI can see right through just so you knowTransparent soulI can see right through just so you knowI don’t fuckin know it’s paradise or it’s a trapYeah, they’re treating me like royalty but is it kissin assNo one’s brave enough to take the fall rightBut it’s all your faultWhy you actin like it’s alrightI knew a girl just like youShe was vain just like youSuch a pain just like you but I can see the truthTransparent soulI can see right through just so you knowTransparent soulI can see right through just so you knowIt’s clear to me knowYou’re scared of me wowIt’s clear to me now(Transparent soul)It’s clear to me knowYou’re scared of me wowIt’s clear to me now(Transparent soul)Transparent soulI can see right through just so you knowTransparent soulI can see right through just so you know#TransparentSoul #Willow #TravisBarker"
"mpHlRC4evuk","TWICE Performs 'Cry For Me' On The Kelly Clarkson Show","2021-04-27T21:00:14Z","UCmSQ47G2NHhcjRAm9Px6R3g","The Kelly Clarkson Show","24","21.28.04","Kelly Clarkson|Entertainment|Music|Daytime|TWICE|Cry For Me|The Kelly Clarkson Show|NBC|talk show|American Idol|The Voice|singer|musician|NBC TV|Television|Funny|comedic|humor|jokes|funny video|interview|variety|talent|celebrities|video|clip|highlight|songs|TWICE on Kelly|TWICE live|I CAN’T STOP ME|CRY FOR ME|FANCY|MORE AND MORE|FEEL SPECIAL|WHAT IIS LOVE|YES OR YES|DANCE THE NIGHT AWAY|TT|LIKEY|CRY FOR ME live","1413493","238306","2437","45302","https://i.ytimg.com/vi/mpHlRC4evuk/default.jpg","False","False","K-pop girl group TWICE performs their new single Cry For Me on The Kelly Clarkson Show.#KellyClarksonShow #TWICESubscribe to The Kelly Clarkson Show: https://bit.ly/2OtOpf8 FOLLOW USInstagram: https://www.instagram.com/kellyclarksonshow/Twitter: https://twitter.com/KellyClarksonTVFacebook: https://www.facebook.com/KellyClarksonShow/ For even more fun stuff, visit https://kellyclarksonshow.com/ The Kelly Clarkson Show is the uplifting daytime destination for humor,, and connection featuring Emmy-winning talk show host, Grammy-winning artist and America’s original idol, Kelly Clarkson."
"iSvsf27wRns","If You Build A Lamborghini I'll Pay For It!","2021-04-26T18:08:34Z","UCIPPMRA040LQr5QPyJEbmXA","MrBeast Gaming","20","21.28.04","[none]","13555814","836499","7712","56643","https://i.ytimg.com/vi/iSvsf27wRns/default.jpg","False","False","Download our MrBeast Burger App and try Dream Burger now!!!iOS - https://dreamburger.mobi/app-storeAndroid - https://dreamburger.mobi/google-playSUBSCRIBE OR YOU'LL HAVE BAD LUCKNew Merch - https://shopmrbeast.comJoin our discord server for your chance to compete in future Minecraft challenges!https://discord.gg/kCQKvZD----------------------------------------------------------------follow all of these or i will kick you• Facebook - https://www.facebook.com/MrBeast6000/• Twitter - https://twitter.com/MrBeast•  Instagram - https://www.instagram.com/mrbeast--------------------------------------------------------------------"
